537390,22456,NATURAL SLATE CHALKBOARD LARGE ,1,12/6/2010 13:47,4.95,16658,United Kingdom
537390,21730,GLASS STAR FROSTED T-LIGHT HOLDER,14,12/6/2010 13:47,4.95,16658,United Kingdom
537390,85048,15CM CHRISTMAS GLASS BALL 20 LIGHTS,4,12/6/2010 13:47,7.95,16658,United Kingdom
537391,22423,REGENCY CAKESTAND 3 TIER,3,12/6/2010 13:53,12.75,16550,United Kingdom
537391,22627,MINT KITCHEN SCALES,2,12/6/2010 13:53,8.5,16550,United Kingdom
537391,22624,IVORY KITCHEN SCALES,2,12/6/2010 13:53,8.5,16550,United Kingdom
537391,22626,BLACK KITCHEN SCALES,2,12/6/2010 13:53,8.5,16550,United Kingdom
537391,22910,PAPER CHAIN KIT VINTAGE CHRISTMAS,8,12/6/2010 13:53,2.95,16550,United Kingdom
537391,22142,CHRISTMAS CRAFT WHITE FAIRY ,6,12/6/2010 13:53,1.45,16550,United Kingdom
537391,22144,CHRISTMAS CRAFT LITTLE FRIENDS,5,12/6/2010 13:53,2.1,16550,United Kingdom
537391,22667,RECIPE BOX RETROSPOT ,4,12/6/2010 13:53,2.95,16550,United Kingdom
537391,22666,RECIPE BOX PANTRY YELLOW DESIGN,4,12/6/2010 13:53,2.95,16550,United Kingdom
537391,22665,RECIPE BOX BLUE SKETCHBOOK DESIGN,4,12/6/2010 13:53,2.95,16550,United Kingdom
537391,21098,CHRISTMAS TOILET ROLL,9,12/6/2010 13:53,1.25,16550,United Kingdom
537391,22952,60 CAKE CASES VINTAGE CHRISTMAS,8,12/6/2010 13:53,0.55,16550,United Kingdom
537391,22905,CALENDAR IN SEASON DESIGN,4,12/6/2010 13:53,2.95,16550,United Kingdom
537391,22904,CALENDAR PAPER CUT DESIGN,4,12/6/2010 13:53,2.95,16550,United Kingdom
537391,22911,PAPER CHAIN KIT LONDON,4,12/6/2010 13:53,2.95,16550,United Kingdom
537391,22938,CUPCAKE LACE PAPER SET 6,8,12/6/2010 13:53,1.95,16550,United Kingdom
537391,22906,12 MESSAGE CARDS WITH ENVELOPES,10,12/6/2010 13:53,1.65,16550,United Kingdom
537391,22197,SMALL POPCORN HOLDER,25,12/6/2010 13:53,0.85,16550,United Kingdom
537391,20754,RETROSPOT RED WASHING UP GLOVES,4,12/6/2010 13:53,2.1,16550,United Kingdom
537391,20752,BLUE POLKADOT WASHING UP GLOVES,4,12/6/2010 13:53,2.1,16550,United Kingdom
537391,20751,FUNKY WASHING UP GLOVES ASSORTED,4,12/6/2010 13:53,2.1,16550,United Kingdom
537391,22956,36 FOIL HEART CAKE CASES,6,12/6/2010 13:53,2.1,16550,United Kingdom
537391,22955,36 FOIL STAR CAKE CASES ,6,12/6/2010 13:53,2.1,16550,United Kingdom
537391,22953,BIRTHDAY PARTY CORDON BARRIER TAPE,4,12/6/2010 13:53,1.25,16550,United Kingdom
537391,21558,SKULL LUNCH BOX WITH CUTLERY ,6,12/6/2010 13:53,2.55,16550,United Kingdom
537391,22352,LUNCH BOX WITH CUTLERY RETROSPOT ,6,12/6/2010 13:53,2.55,16550,United Kingdom
537391,21240,BLUE POLKADOT CUP,12,12/6/2010 13:53,0.85,16550,United Kingdom
537391,21239,PINK  POLKADOT CUP,7,12/6/2010 13:53,0.85,16550,United Kingdom
537391,21238,RED RETROSPOT CUP,6,12/6/2010 13:53,0.85,16550,United Kingdom
537391,21559,STRAWBERRY LUNCH BOX WITH CUTLERY,6,12/6/2010 13:53,2.55,16550,United Kingdom
537391,21355,TOAST ITS - I LOVE YOU ,3,12/6/2010 13:53,1.25,16550,United Kingdom
537391,21354,TOAST ITS - BEST MUM,3,12/6/2010 13:53,1.25,16550,United Kingdom
537391,21357,TOAST ITS - DINOSAUR,3,12/6/2010 13:53,1.25,16550,United Kingdom
537391,21356,TOAST ITS - FAIRY FLOWER,3,12/6/2010 13:53,1.25,16550,United Kingdom
537391,22086,PAPER CHAIN KIT 50'S CHRISTMAS ,8,12/6/2010 13:53,2.95,16550,United Kingdom
537391,22371,AIRLINE BAG VINTAGE TOKYO 78,1,12/6/2010 13:53,4.25,16550,United Kingdom
537391,22965,3 TRADITIONAl BISCUIT CUTTERS  SET,4,12/6/2010 13:53,2.1,16550,United Kingdom
537391,82578,KITCHEN METAL SIGN,3,12/6/2010 13:53,0.55,16550,United Kingdom
537391,82580,BATHROOM METAL SIGN,3,12/6/2010 13:53,0.55,16550,United Kingdom
537391,82581,TOILET METAL SIGN,3,12/6/2010 13:53,0.55,16550,United Kingdom
537391,22890,NOVELTY BISCUITS CAKE STAND 3 TIER,2,12/6/2010 13:53,9.95,16550,United Kingdom
537391,22457,NATURAL SLATE HEART CHALKBOARD ,5,12/6/2010 13:53,2.95,16550,United Kingdom
537391,22185,SLATE TILE NATURAL HANGING,5,12/6/2010 13:53,1.65,16550,United Kingdom
537391,21381,MINI WOODEN HAPPY BIRTHDAY GARLAND,4,12/6/2010 13:53,1.69,16550,United Kingdom
537391,21380,WOODEN HAPPY BIRTHDAY GARLAND,4,12/6/2010 13:53,2.95,16550,United Kingdom
537391,22966,GINGERBREAD MAN COOKIE CUTTER,8,12/6/2010 13:53,1.25,16550,United Kingdom
537391,21658,GLASS  BEURRE DISH,4,12/6/2010 13:53,3.95,16550,United Kingdom
537391,22964,3 PIECE SPACEBOY COOKIE CUTTER SET,8,12/6/2010 13:53,2.1,16550,United Kingdom
537392,M,Manual,5,12/6/2010 13:58,1.25,17068,United Kingdom
537392,21481,FAWN BLUE HOT WATER BOTTLE,4,12/6/2010 13:58,2.95,17068,United Kingdom
537392,22694,WICKER STAR ,3,12/6/2010 13:58,2.1,17068,United Kingdom
537392,85099F,JUMBO BAG STRAWBERRY,5,12/6/2010 13:58,1.95,17068,United Kingdom
537392,21931,JUMBO STORAGE BAG SUKI,5,12/6/2010 13:58,1.95,17068,United Kingdom
537392,85099B,JUMBO BAG RED RETROSPOT,6,12/6/2010 13:58,1.95,17068,United Kingdom
537392,21429,RED GINGHAM ROSE JEWELLERY BOX,5,12/6/2010 13:58,1.65,17068,United Kingdom
537392,22470,HEART OF WICKER LARGE,3,12/6/2010 13:58,2.95,17068,United Kingdom
537392,22665,RECIPE BOX BLUE SKETCHBOOK DESIGN,1,12/6/2010 13:58,2.95,17068,United Kingdom
537392,22666,RECIPE BOX PANTRY YELLOW DESIGN,1,12/6/2010 13:58,2.95,17068,United Kingdom
537392,22667,RECIPE BOX RETROSPOT ,2,12/6/2010 13:58,2.95,17068,United Kingdom
537392,22371,AIRLINE BAG VINTAGE TOKYO 78,1,12/6/2010 13:58,4.25,17068,United Kingdom
537392,22469,HEART OF WICKER SMALL,3,12/6/2010 13:58,1.65,17068,United Kingdom
537392,84030E,ENGLISH ROSE HOT WATER BOTTLE,1,12/6/2010 13:58,4.25,17068,United Kingdom
537392,22112,CHOCOLATE HOT WATER BOTTLE,1,12/6/2010 13:58,4.95,17068,United Kingdom
537392,22111,SCOTTIE DOG HOT WATER BOTTLE,1,12/6/2010 13:58,4.95,17068,United Kingdom
537392,21485,RETROSPOT HEART HOT WATER BOTTLE,1,12/6/2010 13:58,4.95,17068,United Kingdom
537392,22382,LUNCH BAG SPACEBOY DESIGN ,5,12/6/2010 13:58,1.65,17068,United Kingdom
537392,22383,LUNCH BAG SUKI  DESIGN ,5,12/6/2010 13:58,1.65,17068,United Kingdom
537392,22367,CHILDRENS APRON SPACEBOY DESIGN,2,12/6/2010 13:58,1.95,17068,United Kingdom
537392,20726,LUNCH BAG WOODLAND,5,12/6/2010 13:58,1.65,17068,United Kingdom
537392,20728,LUNCH BAG CARS BLUE,5,12/6/2010 13:58,1.65,17068,United Kingdom
537392,20727,LUNCH BAG  BLACK SKULL.,5,12/6/2010 13:58,1.65,17068,United Kingdom
537392,20725,LUNCH BAG RED RETROSPOT,5,12/6/2010 13:58,1.65,17068,United Kingdom
537393,21471,STRAWBERRY RAFFIA FOOD COVER,6,12/6/2010 13:59,3.75,13089,United Kingdom
537393,85014A,BLACK/BLUE POLKADOT UMBRELLA,6,12/6/2010 13:59,5.95,13089,United Kingdom
537393,72760B,VINTAGE CREAM 3 BASKET CAKE STAND,2,12/6/2010 13:59,9.95,13089,United Kingdom
537393,84946,ANTIQUE SILVER TEA GLASS ETCHED,36,12/6/2010 13:59,1.25,13089,United Kingdom
537393,47570B,TEA TIME TABLE CLOTH,2,12/6/2010 13:59,10.65,13089,United Kingdom
537393,21445,12 PINK ROSE PEG PLACE SETTINGS,12,12/6/2010 13:59,1.25,13089,United Kingdom
537393,21447,12 IVORY ROSE PEG PLACE SETTINGS,12,12/6/2010 13:59,1.25,13089,United Kingdom
537393,22837,HOT WATER BOTTLE BABUSHKA ,24,12/6/2010 13:59,4.65,13089,United Kingdom
537393,22909,SET OF 20 VINTAGE CHRISTMAS NAPKINS,24,12/6/2010 13:59,0.85,13089,United Kingdom
537393,84029E,RED WOOLLY HOTTIE WHITE HEART.,24,12/6/2010 13:59,3.39,13089,United Kingdom
537393,85123A,WHITE HANGING HEART T-LIGHT HOLDER,32,12/6/2010 13:59,2.55,13089,United Kingdom
537393,84879,ASSORTED COLOUR BIRD ORNAMENT,48,12/6/2010 13:59,1.69,13089,United Kingdom
537393,82483,WOOD 2 DRAWER CABINET WHITE FINISH,16,12/6/2010 13:59,4.95,13089,United Kingdom
537393,22867,HAND WARMER BIRD DESIGN,96,12/6/2010 13:59,1.85,13089,United Kingdom
537393,22865,HAND WARMER OWL DESIGN,96,12/6/2010 13:59,1.85,13089,United Kingdom
537393,22835,HOT WATER BOTTLE I AM SO POORLY,24,12/6/2010 13:59,4.25,13089,United Kingdom
537393,22834,HAND WARMER BABUSHKA DESIGN,48,12/6/2010 13:59,2.1,13089,United Kingdom
537393,22694,WICKER STAR ,24,12/6/2010 13:59,2.1,13089,United Kingdom
537393,22666,RECIPE BOX PANTRY YELLOW DESIGN,24,12/6/2010 13:59,2.55,13089,United Kingdom
537393,22654,DELUXE SEWING KIT ,12,12/6/2010 13:59,5.95,13089,United Kingdom
537393,22653,BUTTON BOX ,24,12/6/2010 13:59,1.95,13089,United Kingdom
537393,22652,TRAVEL SEWING KIT,24,12/6/2010 13:59,1.65,13089,United Kingdom
537393,22633,HAND WARMER UNION JACK,48,12/6/2010 13:59,2.1,13089,United Kingdom
537393,22630,DOLLY GIRL LUNCH BOX,24,12/6/2010 13:59,1.95,13089,United Kingdom
537393,22629,SPACEBOY LUNCH BOX ,24,12/6/2010 13:59,1.95,13089,United Kingdom
537393,22441,GROW YOUR OWN BASIL IN ENAMEL MUG,24,12/6/2010 13:59,2.1,13089,United Kingdom
537393,22178,VICTORIAN GLASS HANGING T-LIGHT,48,12/6/2010 13:59,1.25,13089,United Kingdom
537393,22169,FAMILY ALBUM WHITE PICTURE FRAME,8,12/6/2010 13:59,7.65,13089,United Kingdom
537393,22114,HOT WATER BOTTLE TEA AND SYMPATHY,24,12/6/2010 13:59,3.45,13089,United Kingdom
537393,22112,CHOCOLATE HOT WATER BOTTLE,24,12/6/2010 13:59,4.25,13089,United Kingdom
537393,21874,GIN AND TONIC MUG,24,12/6/2010 13:59,1.25,13089,United Kingdom
537393,21485,RETROSPOT HEART HOT WATER BOTTLE,48,12/6/2010 13:59,4.25,13089,United Kingdom
537393,21481,FAWN BLUE HOT WATER BOTTLE,36,12/6/2010 13:59,2.55,13089,United Kingdom
537393,21479,WHITE SKULL HOT WATER BOTTLE ,24,12/6/2010 13:59,3.39,13089,United Kingdom
537394,22558,CLOTHES PEGS RETROSPOT PACK 24 ,12,12/6/2010 14:00,1.49,13089,United Kingdom
537394,22962,JAM JAR WITH PINK LID,12,12/6/2010 14:00,0.85,13089,United Kingdom
537394,22963,JAM JAR WITH GREEN LID,12,12/6/2010 14:00,0.85,13089,United Kingdom
537394,22960,JAM MAKING SET WITH JARS,6,12/6/2010 14:00,4.25,13089,United Kingdom
537394,22961,JAM MAKING SET PRINTED,12,12/6/2010 14:00,1.45,13089,United Kingdom
537395,20983,12 PENCILS TALL TUBE RED RETROSPOT,1,12/6/2010 14:05,0.85,15356,United Kingdom
537395,21100,CHARLIE AND LOLA CHARLOTTE BAG,1,12/6/2010 14:05,1.65,15356,United Kingdom
537395,21479,WHITE SKULL HOT WATER BOTTLE ,2,12/6/2010 14:05,3.75,15356,United Kingdom
537395,84029G,KNITTED UNION FLAG HOT WATER BOTTLE,1,12/6/2010 14:05,3.75,15356,United Kingdom
537395,22114,HOT WATER BOTTLE TEA AND SYMPATHY,1,12/6/2010 14:05,3.95,15356,United Kingdom
537395,22086,PAPER CHAIN KIT 50'S CHRISTMAS ,1,12/6/2010 14:05,2.95,15356,United Kingdom
537395,22804,CANDLEHOLDER PINK HANGING HEART,1,12/6/2010 14:05,2.95,15356,United Kingdom
537395,21558,SKULL LUNCH BOX WITH CUTLERY ,1,12/6/2010 14:05,2.55,15356,United Kingdom
537395,22952,60 CAKE CASES VINTAGE CHRISTMAS,1,12/6/2010 14:05,0.55,15356,United Kingdom
537395,21733,RED HANGING HEART T-LIGHT HOLDER,2,12/6/2010 14:05,2.95,15356,United Kingdom
537395,85123A,WHITE HANGING HEART T-LIGHT HOLDER,2,12/6/2010 14:05,2.95,15356,United Kingdom
537395,84849B,FAIRY SOAP SOAP HOLDER,2,12/6/2010 14:05,1.69,15356,United Kingdom
537395,22909,SET OF 20 VINTAGE CHRISTMAS NAPKINS,2,12/6/2010 14:05,0.85,15356,United Kingdom
537395,22733,3D TRADITIONAL CHRISTMAS STICKERS,2,12/6/2010 14:05,1.25,15356,United Kingdom
537395,22952,60 CAKE CASES VINTAGE CHRISTMAS,1,12/6/2010 14:05,0.55,15356,United Kingdom
537395,20973,12 PENCIL SMALL TUBE WOODLAND,1,12/6/2010 14:05,0.65,15356,United Kingdom
537395,20979,36 PENCILS TUBE RED RETROSPOT,1,12/6/2010 14:05,1.25,15356,United Kingdom
537395,20978,36 PENCILS TUBE SKULLS,2,12/6/2010 14:05,1.25,15356,United Kingdom
537395,20981,12 PENCILS TALL TUBE WOODLAND,1,12/6/2010 14:05,0.85,15356,United Kingdom
537395,20975,12 PENCILS SMALL TUBE RED RETROSPOT,2,12/6/2010 14:05,0.65,15356,United Kingdom
537395,20974,12 PENCILS SMALL TUBE SKULL,3,12/6/2010 14:05,0.65,15356,United Kingdom
537395,20982,12 PENCILS TALL TUBE SKULLS,3,12/6/2010 14:05,0.85,15356,United Kingdom
537395,21175,GIN + TONIC DIET METAL SIGN,2,12/6/2010 14:05,2.1,15356,United Kingdom
537395,82600,NO SINGING METAL SIGN,1,12/6/2010 14:05,2.1,15356,United Kingdom
537395,82599,FANNY'S REST STOPMETAL SIGN,2,12/6/2010 14:05,2.1,15356,United Kingdom
537395,85152,HAND OVER THE CHOCOLATE   SIGN ,2,12/6/2010 14:05,2.1,15356,United Kingdom
537395,22632,HAND WARMER RED RETROSPOT,1,12/6/2010 14:05,2.1,15356,United Kingdom
537395,21169,YOU'RE CONFUSING ME METAL SIGN ,1,12/6/2010 14:05,1.69,15356,United Kingdom
537395,82552,WASHROOM METAL SIGN,1,12/6/2010 14:05,1.45,15356,United Kingdom
537395,82551,LAUNDRY 15C METAL SIGN,1,12/6/2010 14:05,1.45,15356,United Kingdom
537395,21904,HOUSE WRECKING METAL SIGN ,1,12/6/2010 14:05,2.1,15356,United Kingdom
537395,21181,PLEASE ONE PERSON METAL SIGN,1,12/6/2010 14:05,2.1,15356,United Kingdom
537395,21903,MAN FLU METAL SIGN,1,12/6/2010 14:05,2.1,15356,United Kingdom
537395,22911,PAPER CHAIN KIT LONDON,1,12/6/2010 14:05,2.95,15356,United Kingdom
537395,22085,PAPER CHAIN KIT SKULLS ,1,12/6/2010 14:05,2.95,15356,United Kingdom
537395,22659,LUNCH BOX I LOVE LONDON,1,12/6/2010 14:05,1.95,15356,United Kingdom
537395,21872,GLAMOROUS  MUG,2,12/6/2010 14:05,1.25,15356,United Kingdom
537395,21877,HOME SWEET HOME MUG,2,12/6/2010 14:05,1.25,15356,United Kingdom
537395,21870,I CAN ONLY PLEASE ONE PERSON MUG,2,12/6/2010 14:05,1.25,15356,United Kingdom
537395,21876,POTTERING MUG,1,12/6/2010 14:05,1.25,15356,United Kingdom
537395,21870,I CAN ONLY PLEASE ONE PERSON MUG,2,12/6/2010 14:05,1.25,15356,United Kingdom
537395,21874,GIN AND TONIC MUG,3,12/6/2010 14:05,1.25,15356,United Kingdom
537395,22866,HAND WARMER SCOTTY DOG DESIGN,1,12/6/2010 14:05,2.1,15356,United Kingdom
537395,22632,HAND WARMER RED RETROSPOT,1,12/6/2010 14:05,2.1,15356,United Kingdom
537395,22865,HAND WARMER OWL DESIGN,1,12/6/2010 14:05,2.1,15356,United Kingdom
537395,22867,HAND WARMER BIRD DESIGN,2,12/6/2010 14:05,2.1,15356,United Kingdom
537395,22633,HAND WARMER UNION JACK,6,12/6/2010 14:05,2.1,15356,United Kingdom
537395,22630,DOLLY GIRL LUNCH BOX,1,12/6/2010 14:05,1.95,15356,United Kingdom
537395,22659,LUNCH BOX I LOVE LONDON,1,12/6/2010 14:05,1.95,15356,United Kingdom
537395,84924A,WAKE UP COCKEREL CALENDAR SIGN ,1,12/6/2010 14:05,3.75,15356,United Kingdom
537395,22726,ALARM CLOCK BAKELIKE GREEN,1,12/6/2010 14:05,3.75,15356,United Kingdom
537395,22728,ALARM CLOCK BAKELIKE PINK,1,12/6/2010 14:05,3.75,15356,United Kingdom
537395,22730,ALARM CLOCK BAKELIKE IVORY,1,12/6/2010 14:05,3.75,15356,United Kingdom
537396,M,Manual,1,12/6/2010 14:08,35,17223,United Kingdom
537396,20772,GARDEN PATH JOURNAL,1,12/6/2010 14:08,2.55,17223,United Kingdom
537396,22560,TRADITIONAL MODELLING CLAY,3,12/6/2010 14:08,1.25,17223,United Kingdom
537396,22941,CHRISTMAS LIGHTS 10 REINDEER,1,12/6/2010 14:08,8.5,17223,United Kingdom
537396,22942,CHRISTMAS LIGHTS 10 SANTAS ,1,12/6/2010 14:08,8.5,17223,United Kingdom
537396,22415,WHITE TISSUE REAM,1,12/6/2010 14:08,7.95,17223,United Kingdom
537396,22292,HANGING CHICK  YELLOW DECORATION,3,12/6/2010 14:08,1.45,17223,United Kingdom
537396,84879,ASSORTED COLOUR BIRD ORNAMENT,2,12/6/2010 14:08,1.69,17223,United Kingdom
537396,85199S,SMALL HANGING IVORY/RED WOOD BIRD,2,12/6/2010 14:08,0.42,17223,United Kingdom
537396,85199L,LARGE HANGING IVORY & RED WOOD BIRD,7,12/6/2010 14:08,0.65,17223,United Kingdom
537396,21811,CHRISTMAS HANGING HEART WITH BELL,3,12/6/2010 14:08,1.25,17223,United Kingdom
537396,85049A,TRADITIONAL CHRISTMAS RIBBONS,1,12/6/2010 14:08,1.25,17223,United Kingdom
537396,22075,6 RIBBONS ELEGANT CHRISTMAS ,1,12/6/2010 14:08,1.65,17223,United Kingdom
537396,47586A,PINK FAIRY CAKE CUSHION COVER,2,12/6/2010 14:08,2.55,17223,United Kingdom
537396,84879,ASSORTED COLOUR BIRD ORNAMENT,8,12/6/2010 14:08,1.69,17223,United Kingdom
537396,22763,KEY CABINET MA CAMPAGNE,2,12/6/2010 14:08,9.95,17223,United Kingdom
537396,22697,GREEN REGENCY TEACUP AND SAUCER,1,12/6/2010 14:08,2.95,17223,United Kingdom
537396,22699,ROSES REGENCY TEACUP AND SAUCER ,1,12/6/2010 14:08,2.95,17223,United Kingdom
537396,22622,BOX OF VINTAGE ALPHABET BLOCKS,1,12/6/2010 14:08,9.95,17223,United Kingdom
537396,22623,BOX OF VINTAGE JIGSAW BLOCKS ,1,12/6/2010 14:08,4.95,17223,United Kingdom
537396,21166,COOK WITH WINE METAL SIGN ,1,12/6/2010 14:08,1.95,17223,United Kingdom
537396,75013B,"STRING OF 8 BUTTERFLIES,PINK",1,12/6/2010 14:08,1.65,17223,United Kingdom
537396,20829,GLITTER HANGING BUTTERFLY STRING,1,12/6/2010 14:08,2.1,17223,United Kingdom
537396,35471D,SET OF 3 BIRD LIGHT PINK FEATHER ,1,12/6/2010 14:08,1.25,17223,United Kingdom
537396,84031A,CHARLIE+LOLA RED HOT WATER BOTTLE ,1,12/6/2010 14:08,4.65,17223,United Kingdom
537396,84031B,CHARLIE LOLA BLUE HOT WATER BOTTLE ,1,12/6/2010 14:08,4.65,17223,United Kingdom
537396,84029E,RED WOOLLY HOTTIE WHITE HEART.,2,12/6/2010 14:08,3.75,17223,United Kingdom
537396,22423,REGENCY CAKESTAND 3 TIER,6,12/6/2010 14:08,12.75,17223,United Kingdom
537396,21351,CINAMMON & ORANGE WREATH,3,12/6/2010 14:08,6.75,17223,United Kingdom
537396,21352,EUCALYPTUS & PINECONE  WREATH,4,12/6/2010 14:08,6.75,17223,United Kingdom
537397,22595,CHRISTMAS GINGHAM HEART,36,12/6/2010 14:19,0.85,16817,United Kingdom
537397,22593,CHRISTMAS GINGHAM STAR,12,12/6/2010 14:19,0.85,16817,United Kingdom
537397,22855,FINE WICKER HEART ,36,12/6/2010 14:19,1.25,16817,United Kingdom
537397,22867,HAND WARMER BIRD DESIGN,12,12/6/2010 14:19,2.1,16817,United Kingdom
537397,22834,HAND WARMER BABUSHKA DESIGN,12,12/6/2010 14:19,2.1,16817,United Kingdom
537397,22086,PAPER CHAIN KIT 50'S CHRISTMAS ,12,12/6/2010 14:19,2.95,16817,United Kingdom
537397,21354,TOAST ITS - BEST MUM,12,12/6/2010 14:19,1.25,16817,United Kingdom
537397,22837,HOT WATER BOTTLE BABUSHKA ,8,12/6/2010 14:19,4.65,16817,United Kingdom
537397,22754,SMALL RED BABUSHKA NOTEBOOK ,12,12/6/2010 14:19,0.85,16817,United Kingdom
537397,22755,SMALL PURPLE BABUSHKA NOTEBOOK ,12,12/6/2010 14:19,0.85,16817,United Kingdom
C537398,22430,ENAMEL WATERING CAN CREAM,-1,12/6/2010 14:22,4.95,15426,United Kingdom
537399,22815,CARD PSYCHEDELIC APPLES,12,12/6/2010 14:31,0.42,13030,United Kingdom
537399,22718,CARD CAT AND TREE ,12,12/6/2010 14:31,0.42,13030,United Kingdom
537399,22480,RED TEA TOWEL CLASSIC DESIGN,4,12/6/2010 14:31,1.25,13030,United Kingdom
537399,22900, SET 2 TEA TOWELS I LOVE LONDON ,2,12/6/2010 14:31,2.95,13030,United Kingdom
537399,21328,BALLOONS  WRITING SET ,3,12/6/2010 14:31,1.65,13030,United Kingdom
537399,21327,SKULLS WRITING SET ,5,12/6/2010 14:31,1.65,13030,United Kingdom
537399,22141,CHRISTMAS CRAFT TREE TOP ANGEL,1,12/6/2010 14:31,2.1,13030,United Kingdom
537399,21407,BROWN CHECK CAT DOORSTOP ,1,12/6/2010 14:31,4.25,13030,United Kingdom
537399,22430,ENAMEL WATERING CAN CREAM,1,12/6/2010 14:31,4.95,13030,United Kingdom
537399,85062,PEARL CRYSTAL PUMPKIN T-LIGHT HLDR,6,12/6/2010 14:31,1.65,13030,United Kingdom
537399,22301,COFFEE MUG CAT + BIRD DESIGN,6,12/6/2010 14:31,2.55,13030,United Kingdom
537399,22295,HEART FILIGREE DOVE LARGE,12,12/6/2010 14:31,1.65,13030,United Kingdom
537399,21675,BUTTERFLIES STICKERS,6,12/6/2010 14:31,0.85,13030,United Kingdom
537399,21677,HEARTS  STICKERS,6,12/6/2010 14:31,0.85,13030,United Kingdom
537399,20986,BLUE CALCULATOR RULER,3,12/6/2010 14:31,1.25,13030,United Kingdom
537399,22561,WOODEN SCHOOL COLOURING SET,5,12/6/2010 14:31,1.65,13030,United Kingdom
537399,22494,EMERGENCY FIRST AID TIN ,1,12/6/2010 14:31,1.25,13030,United Kingdom
537399,22659,LUNCH BOX I LOVE LONDON,3,12/6/2010 14:31,1.95,13030,United Kingdom
537399,84029G,KNITTED UNION FLAG HOT WATER BOTTLE,2,12/6/2010 14:31,3.75,13030,United Kingdom
537399,47369A,PINK GREEN EMBROIDERY COSMETIC BAG,2,12/6/2010 14:31,2.95,13030,United Kingdom
537399,22654,DELUXE SEWING KIT ,2,12/6/2010 14:31,5.95,13030,United Kingdom
537399,21928,JUMBO BAG SCANDINAVIAN PAISLEY,1,12/6/2010 14:31,1.95,13030,United Kingdom
537399,21931,JUMBO STORAGE BAG SUKI,1,12/6/2010 14:31,1.95,13030,United Kingdom
537399,22635,CHILDS BREAKFAST SET DOLLY GIRL ,1,12/6/2010 14:31,9.95,13030,United Kingdom
537399,22507,MEMO BOARD RETROSPOT  DESIGN,1,12/6/2010 14:31,4.95,13030,United Kingdom
537399,22505,MEMO BOARD COTTAGE DESIGN,4,12/6/2010 14:31,4.95,13030,United Kingdom
537399,85183B,CHARLIE & LOLA WASTEPAPER BIN FLORA,1,12/6/2010 14:31,3.75,13030,United Kingdom
537399,22845,VINTAGE CREAM CAT FOOD CONTAINER,1,12/6/2010 14:31,6.35,13030,United Kingdom
537399,22605,WOODEN CROQUET GARDEN SET,3,12/6/2010 14:31,14.95,13030,United Kingdom
537399,22375,AIRLINE BAG VINTAGE JET SET BROWN,1,12/6/2010 14:31,4.25,13030,United Kingdom
537399,22372,AIRLINE BAG VINTAGE WORLD CHAMPION ,1,12/6/2010 14:31,4.25,13030,United Kingdom
537399,21621,VINTAGE UNION JACK BUNTING,1,12/6/2010 14:31,8.5,13030,United Kingdom
537399,21327,SKULLS WRITING SET ,2,12/6/2010 14:31,1.65,13030,United Kingdom
537399,21328,BALLOONS  WRITING SET ,2,12/6/2010 14:31,1.65,13030,United Kingdom
537399,22524,CHILDRENS GARDEN GLOVES BLUE,1,12/6/2010 14:31,1.25,13030,United Kingdom
537399,20986,BLUE CALCULATOR RULER,4,12/6/2010 14:31,1.25,13030,United Kingdom
537399,22374,AIRLINE BAG VINTAGE JET SET RED,1,12/6/2010 14:31,4.25,13030,United Kingdom
537399,21784,SHOE SHINE BOX ,1,12/6/2010 14:31,9.95,13030,United Kingdom
537399,22815,CARD PSYCHEDELIC APPLES,12,12/6/2010 14:31,0.42,13030,United Kingdom
537399,21258,VICTORIAN SEWING BOX LARGE,2,12/6/2010 14:31,12.75,13030,United Kingdom
537399,22718,CARD CAT AND TREE ,12,12/6/2010 14:31,0.42,13030,United Kingdom
537399,22616,PACK OF 12 LONDON TISSUES ,12,12/6/2010 14:31,0.29,13030,United Kingdom
537399,20669,RED HEART LUGGAGE TAG,2,12/6/2010 14:31,1.25,13030,United Kingdom
537399,20658,RED RETROSPOT LUGGAGE TAG,1,12/6/2010 14:31,1.25,13030,United Kingdom
537399,20658,RED RETROSPOT LUGGAGE TAG,2,12/6/2010 14:31,1.25,13030,United Kingdom
537399,21866,UNION JACK FLAG LUGGAGE TAG,3,12/6/2010 14:31,1.25,13030,United Kingdom
537399,72802C,VANILLA SCENT CANDLE JEWELLED BOX,6,12/6/2010 14:31,4.25,13030,United Kingdom
537399,22900, SET 2 TEA TOWELS I LOVE LONDON ,3,12/6/2010 14:31,2.95,13030,United Kingdom
537399,22149,FELTCRAFT 6 FLOWER FRIENDS,3,12/6/2010 14:31,2.1,13030,United Kingdom
537399,22964,3 PIECE SPACEBOY COOKIE CUTTER SET,1,12/6/2010 14:31,2.1,13030,United Kingdom
537399,84378,SET OF 3 HEART COOKIE CUTTERS,1,12/6/2010 14:31,1.25,13030,United Kingdom
537399,22965,3 TRADITIONAl BISCUIT CUTTERS  SET,1,12/6/2010 14:31,2.1,13030,United Kingdom
537399,22301,COFFEE MUG CAT + BIRD DESIGN,6,12/6/2010 14:31,2.55,13030,United Kingdom
537399,22952,60 CAKE CASES VINTAGE CHRISTMAS,3,12/6/2010 14:31,0.55,13030,United Kingdom
537399,21990,MODERN FLORAL STATIONERY SET,3,12/6/2010 14:31,2.95,13030,United Kingdom
537399,22625,RED KITCHEN SCALES,1,12/6/2010 14:31,8.5,13030,United Kingdom
537399,85099C,JUMBO  BAG BAROQUE BLACK WHITE,2,12/6/2010 14:31,1.95,13030,United Kingdom
537399,21931,JUMBO STORAGE BAG SUKI,2,12/6/2010 14:31,1.95,13030,United Kingdom
537399,21928,JUMBO BAG SCANDINAVIAN PAISLEY,2,12/6/2010 14:31,1.95,13030,United Kingdom
537399,20713,JUMBO BAG OWLS,2,12/6/2010 14:31,1.95,13030,United Kingdom
537400,22795,SWEETHEART RECIPE BOOK STAND,1,12/6/2010 14:36,6.75,17191,United Kingdom
537400,71053,WHITE METAL LANTERN,2,12/6/2010 14:36,3.75,17191,United Kingdom
537400,82494L,WOODEN FRAME ANTIQUE WHITE ,6,12/6/2010 14:36,2.95,17191,United Kingdom
537400,71477,COLOUR GLASS. STAR T-LIGHT HOLDER,4,12/6/2010 14:36,3.25,17191,United Kingdom
537400,22500,SET OF 2 TINS JARDIN DE PROVENCE,2,12/6/2010 14:36,4.95,17191,United Kingdom
537400,21181,PLEASE ONE PERSON METAL SIGN,1,12/6/2010 14:36,2.1,17191,United Kingdom
537400,46115B,GREEN POP ART MAO CUSHION COVER ,6,12/6/2010 14:36,0.19,17191,United Kingdom
537400,82583,HOT BATHS METAL SIGN,1,12/6/2010 14:36,2.1,17191,United Kingdom
537400,21814,HEART T-LIGHT HOLDER ,4,12/6/2010 14:36,1.45,17191,United Kingdom
537400,22441,GROW YOUR OWN BASIL IN ENAMEL MUG,2,12/6/2010 14:36,2.1,17191,United Kingdom
537400,22224,WHITE LOVEBIRD LANTERN,2,12/6/2010 14:36,2.95,17191,United Kingdom
537400,21733,RED HANGING HEART T-LIGHT HOLDER,1,12/6/2010 14:36,2.95,17191,United Kingdom
537400,85123A,WHITE HANGING HEART T-LIGHT HOLDER,6,12/6/2010 14:36,2.95,17191,United Kingdom
537400,22804,CANDLEHOLDER PINK HANGING HEART,3,12/6/2010 14:36,2.95,17191,United Kingdom
537400,84819,DANISH ROSE ROUND SEWING BOX,2,12/6/2010 14:36,4.25,17191,United Kingdom
537400,22086,PAPER CHAIN KIT 50'S CHRISTMAS ,2,12/6/2010 14:36,2.95,17191,United Kingdom
537400,22095,LADS ONLY TISSUE BOX,4,12/6/2010 14:36,1.25,17191,United Kingdom
537400,22095,LADS ONLY TISSUE BOX,6,12/6/2010 14:36,1.25,17191,United Kingdom
537400,22093,MOTORING TISSUE BOX,6,12/6/2010 14:36,1.25,17191,United Kingdom
537400,22098,BOUDOIR SQUARE TISSUE BOX,2,12/6/2010 14:36,1.25,17191,United Kingdom
537400,22099,CARAVAN SQUARE TISSUE BOX,4,12/6/2010 14:36,1.25,17191,United Kingdom
537400,22956,36 FOIL HEART CAKE CASES,1,12/6/2010 14:36,2.1,17191,United Kingdom
537400,22173,METAL 4 HOOK HANGER FRENCH CHATEAU,8,12/6/2010 14:36,2.95,17191,United Kingdom
537400,84975,HEART SHAPED MIRROR,3,12/6/2010 14:36,1.69,17191,United Kingdom
537400,22659,LUNCH BOX I LOVE LONDON,2,12/6/2010 14:36,1.95,17191,United Kingdom
537400,22429,ENAMEL MEASURING JUG CREAM,3,12/6/2010 14:36,4.25,17191,United Kingdom
537400,22771,CLEAR DRAWER KNOB ACRYLIC EDWARDIAN,12,12/6/2010 14:36,1.25,17191,United Kingdom
537400,22758,LARGE PURPLE BABUSHKA NOTEBOOK  ,2,12/6/2010 14:36,1.25,17191,United Kingdom
537400,22756,LARGE YELLOW BABUSHKA NOTEBOOK ,2,12/6/2010 14:36,1.25,17191,United Kingdom
537400,22757,LARGE RED BABUSHKA NOTEBOOK ,2,12/6/2010 14:36,1.25,17191,United Kingdom
537400,84406B,CREAM CUPID HEARTS COAT HANGER,8,12/6/2010 14:36,3.25,17191,United Kingdom
537400,82551,LAUNDRY 15C METAL SIGN,1,12/6/2010 14:36,1.45,17191,United Kingdom
537400,82552,WASHROOM METAL SIGN,1,12/6/2010 14:36,1.45,17191,United Kingdom
537400,21864,UNION JACK FLAG PASSPORT COVER ,4,12/6/2010 14:36,2.1,17191,United Kingdom
537400,22752,SET 7 BABUSHKA NESTING BOXES,1,12/6/2010 14:36,8.5,17191,United Kingdom
537400,84836,ZINC METAL HEART DECORATION,2,12/6/2010 14:36,1.25,17191,United Kingdom
537400,35961,FOLKART ZINC HEART CHRISTMAS DEC,2,12/6/2010 14:36,0.85,17191,United Kingdom
537400,21390,FILIGRIS HEART WITH BUTTERFLY,6,12/6/2010 14:36,1.25,17191,United Kingdom
537400,22665,RECIPE BOX BLUE SKETCHBOOK DESIGN,2,12/6/2010 14:36,2.95,17191,United Kingdom
