537400,22666,RECIPE BOX PANTRY YELLOW DESIGN,2,12/6/2010 14:36,2.95,17191,United Kingdom
537400,21034,REX CASH+CARRY JUMBO SHOPPER,4,12/6/2010 14:36,0.95,17191,United Kingdom
537400,22963,JAM JAR WITH GREEN LID,12,12/6/2010 14:36,0.85,17191,United Kingdom
537400,22423,REGENCY CAKESTAND 3 TIER,1,12/6/2010 14:36,12.75,17191,United Kingdom
537400,22449,SILK PURSE BABUSHKA PINK,1,12/6/2010 14:36,3.35,17191,United Kingdom
537400,22451,SILK PURSE BABUSHKA RED,1,12/6/2010 14:36,3.35,17191,United Kingdom
537400,22450,SILK PURSE BABUSHKA BLUE,1,12/6/2010 14:36,3.35,17191,United Kingdom
537400,79067,CORONA MEXICAN TRAY,5,12/6/2010 14:36,3.75,17191,United Kingdom
537400,22818,CARD CHRISTMAS VILLAGE,24,12/6/2010 14:36,0.42,17191,United Kingdom
537400,22816,CARD MOTORBIKE SANTA,72,12/6/2010 14:36,0.36,17191,United Kingdom
537400,22912,YELLOW COAT RACK PARIS FASHION,9,12/6/2010 14:36,4.95,17191,United Kingdom
537401,84898F,,-24,12/6/2010 14:37,0,,United Kingdom
537403,22333,RETROSPOT PARTY BAG + STICKER SET,4,12/6/2010 14:43,1.65,17191,United Kingdom
537403,22196,SMALL HEART MEASURING SPOONS,1,12/6/2010 14:43,0.85,17191,United Kingdom
537403,21864,UNION JACK FLAG PASSPORT COVER ,1,12/6/2010 14:43,2.1,17191,United Kingdom
537403,20974,12 PENCILS SMALL TUBE SKULL,2,12/6/2010 14:43,0.65,17191,United Kingdom
537403,21892,TRADITIONAL WOODEN CATCH CUP GAME ,2,12/6/2010 14:43,1.25,17191,United Kingdom
537403,22551,PLASTERS IN TIN SPACEBOY,1,12/6/2010 14:43,1.65,17191,United Kingdom
537403,20975,12 PENCILS SMALL TUBE RED RETROSPOT,2,12/6/2010 14:43,0.65,17191,United Kingdom
537403,21866,UNION JACK FLAG LUGGAGE TAG,1,12/6/2010 14:43,1.25,17191,United Kingdom
537403,22633,HAND WARMER UNION JACK,3,12/6/2010 14:43,2.1,17191,United Kingdom
537403,22557,PLASTERS IN TIN VINTAGE PAISLEY ,2,12/6/2010 14:43,1.65,17191,United Kingdom
537403,22652,TRAVEL SEWING KIT,2,12/6/2010 14:43,1.65,17191,United Kingdom
C537402,22926,IVORY GIANT GARDEN THERMOMETER,-4,12/6/2010 14:43,5.95,15502,United Kingdom
C537402,22927,GREEN GIANT GARDEN THERMOMETER,-4,12/6/2010 14:43,5.95,15502,United Kingdom
C537402,22849,BREAD BIN DINER STYLE MINT,-4,12/6/2010 14:43,14.95,15502,United Kingdom
C537402,22847,BREAD BIN DINER STYLE IVORY,-4,12/6/2010 14:43,14.95,15502,United Kingdom
C537402,47580,TEA TIME DES TEA COSY,-6,12/6/2010 14:43,2.55,15502,United Kingdom
C537402,22196,SMALL HEART MEASURING SPOONS,-12,12/6/2010 14:43,0.85,15502,United Kingdom
537404,21955,DOORMAT UNION JACK GUNS AND ROSES,1,12/6/2010 14:46,7.95,17191,United Kingdom
537404,21336,GOLD WASHBAG,1,12/6/2010 14:46,2.95,17191,United Kingdom
537404,21500,PINK POLKADOT WRAP ,25,12/6/2010 14:46,0.42,17191,United Kingdom
537404,22848,BREAD BIN DINER STYLE PINK,1,12/6/2010 14:46,16.95,17191,United Kingdom
537404,21929,JUMBO BAG PINK VINTAGE PAISLEY,2,12/6/2010 14:46,1.95,17191,United Kingdom
537404,85099C,JUMBO  BAG BAROQUE BLACK WHITE,3,12/6/2010 14:46,1.95,17191,United Kingdom
537404,21867,PINK UNION JACK  LUGGAGE TAG,1,12/6/2010 14:46,1.25,17191,United Kingdom
537404,21865,PINK UNION JACK  PASSPORT COVER ,1,12/6/2010 14:46,2.1,17191,United Kingdom
537404,22557,PLASTERS IN TIN VINTAGE PAISLEY ,1,12/6/2010 14:46,1.65,17191,United Kingdom
537404,22866,HAND WARMER SCOTTY DOG DESIGN,1,12/6/2010 14:46,2.1,17191,United Kingdom
537404,22195,LARGE HEART MEASURING SPOONS,1,12/6/2010 14:46,1.65,17191,United Kingdom
537405,79321,CHILLI LIGHTS,30,12/6/2010 14:51,4.25,17841,United Kingdom
537405,22173,METAL 4 HOOK HANGER FRENCH CHATEAU,2,12/6/2010 14:51,2.95,17841,United Kingdom
537405,82484,WOOD BLACK BOARD ANT WHITE FINISH,3,12/6/2010 14:51,6.45,17841,United Kingdom
537405,22555,PLASTERS IN TIN STRONGMAN,1,12/6/2010 14:51,1.65,17841,United Kingdom
537405,22551,PLASTERS IN TIN SPACEBOY,1,12/6/2010 14:51,1.65,17841,United Kingdom
537405,22556,PLASTERS IN TIN CIRCUS PARADE ,1,12/6/2010 14:51,1.65,17841,United Kingdom
537405,85014A,BLACK/BLUE POLKADOT UMBRELLA,1,12/6/2010 14:51,5.95,17841,United Kingdom
537405,15044C,PURPLE PAPER PARASOL,1,12/6/2010 14:51,2.95,17841,United Kingdom
537405,15044B,BLUE PAPER PARASOL ,1,12/6/2010 14:51,2.95,17841,United Kingdom
537405,20966,SANDWICH BATH SPONGE,2,12/6/2010 14:51,1.25,17841,United Kingdom
537405,21361,LOVE LARGE WOOD LETTERS ,1,12/6/2010 14:51,12.75,17841,United Kingdom
537405,79302M,"ART LIGHTS,FUNK MONKEY",1,12/6/2010 14:51,2.95,17841,United Kingdom
537405,22835,HOT WATER BOTTLE I AM SO POORLY,1,12/6/2010 14:51,4.65,17841,United Kingdom
537405,20713,JUMBO BAG OWLS,1,12/6/2010 14:51,1.95,17841,United Kingdom
537405,22385,JUMBO BAG SPACEBOY DESIGN,1,12/6/2010 14:51,1.95,17841,United Kingdom
537405,21930,JUMBO STORAGE BAG SKULLS,1,12/6/2010 14:51,1.95,17841,United Kingdom
537405,22355,CHARLOTTE BAG SUKI DESIGN,6,12/6/2010 14:51,0.85,17841,United Kingdom
537405,21935,SUKI  SHOULDER BAG,3,12/6/2010 14:51,1.65,17841,United Kingdom
537405,21931,JUMBO STORAGE BAG SUKI,2,12/6/2010 14:51,1.95,17841,United Kingdom
537405,22763,KEY CABINET MA CAMPAGNE,1,12/6/2010 14:51,9.95,17841,United Kingdom
537405,21669,BLUE STRIPE CERAMIC DRAWER KNOB,17,12/6/2010 14:51,1.25,17841,United Kingdom
537405,22755,SMALL PURPLE BABUSHKA NOTEBOOK ,1,12/6/2010 14:51,0.85,17841,United Kingdom
537405,21479,WHITE SKULL HOT WATER BOTTLE ,2,12/6/2010 14:51,3.75,17841,United Kingdom
537405,85132A,CHARLIE + LOLA BISCUITS TINS,2,12/6/2010 14:51,9.95,17841,United Kingdom
537405,35954,SMALL FOLKART STAR CHRISTMAS DEC,3,12/6/2010 14:51,0.42,17841,United Kingdom
537405,22739,RIBBON REEL CHRISTMAS SOCK BAUBLE,1,12/6/2010 14:51,1.65,17841,United Kingdom
537405,21479,WHITE SKULL HOT WATER BOTTLE ,1,12/6/2010 14:51,3.75,17841,United Kingdom
537405,22114,HOT WATER BOTTLE TEA AND SYMPATHY,1,12/6/2010 14:51,3.95,17841,United Kingdom
537405,21217,RED RETROSPOT ROUND CAKE TINS,1,12/6/2010 14:51,9.95,17841,United Kingdom
537405,21484,CHICK GREY HOT WATER BOTTLE,1,12/6/2010 14:51,3.45,17841,United Kingdom
537405,22580,ADVENT CALENDAR GINGHAM SACK,1,12/6/2010 14:51,5.95,17841,United Kingdom
537405,35004B,SET OF 3 BLACK FLYING DUCKS,1,12/6/2010 14:51,5.45,17841,United Kingdom
537405,22087,PAPER BUNTING WHITE LACE,1,12/6/2010 14:51,2.95,17841,United Kingdom
537405,22041,"RECORD FRAME 7"" SINGLE SIZE ",1,12/6/2010 14:51,2.55,17841,United Kingdom
537405,22673,FRENCH GARDEN SIGN BLUE METAL,1,12/6/2010 14:51,1.25,17841,United Kingdom
537405,85045,GREEN CHRISTMAS TREE STRING 20LIGHT,1,12/6/2010 14:51,4.95,17841,United Kingdom
