548492,22726,ALARM CLOCK BAKELIKE GREEN,2,3/31/2011 13:14,3.75,17841,United Kingdom
548492,20668,DISCO BALL CHRISTMAS DECORATION,24,3/31/2011 13:14,0.12,17841,United Kingdom
548492,79321,CHILLI LIGHTS,5,3/31/2011 13:14,5.75,17841,United Kingdom
548492,22087,PAPER BUNTING WHITE LACE,4,3/31/2011 13:14,2.95,17841,United Kingdom
548492,47590B,PINK HAPPY BIRTHDAY BUNTING,1,3/31/2011 13:14,5.45,17841,United Kingdom
548492,22957,SET 3 PAPER VINTAGE CHICK PAPER EGG,1,3/31/2011 13:14,2.95,17841,United Kingdom
548492,22659,LUNCH BOX I LOVE LONDON,1,3/31/2011 13:14,1.95,17841,United Kingdom
548492,22631,CIRCUS PARADE LUNCH BOX ,1,3/31/2011 13:14,1.95,17841,United Kingdom
548492,20728,LUNCH BAG CARS BLUE,3,3/31/2011 13:14,1.65,17841,United Kingdom
548492,47594B,SCOTTIES DESIGN WASHBAG,1,3/31/2011 13:14,1.95,17841,United Kingdom
548492,22475,SKULL DESIGN TV DINNER TRAY,1,3/31/2011 13:14,4.95,17841,United Kingdom
548492,22041,"RECORD FRAME 7"" SINGLE SIZE ",9,3/31/2011 13:14,2.55,17841,United Kingdom
548492,22355,CHARLOTTE BAG SUKI DESIGN,2,3/31/2011 13:14,0.85,17841,United Kingdom
548492,22356,CHARLOTTE BAG PINK POLKADOT,1,3/31/2011 13:14,0.85,17841,United Kingdom
548492,20719,WOODLAND CHARLOTTE BAG,1,3/31/2011 13:14,0.85,17841,United Kingdom
548492,20727,LUNCH BAG  BLACK SKULL.,1,3/31/2011 13:14,1.65,17841,United Kingdom
548492,22382,LUNCH BAG SPACEBOY DESIGN ,1,3/31/2011 13:14,1.65,17841,United Kingdom
548492,20725,LUNCH BAG RED RETROSPOT,1,3/31/2011 13:14,1.65,17841,United Kingdom
548492,21935,SUKI  SHOULDER BAG,5,3/31/2011 13:14,1.65,17841,United Kingdom
548492,20724,RED RETROSPOT CHARLOTTE BAG,2,3/31/2011 13:14,0.85,17841,United Kingdom
548492,20961,STRAWBERRY BATH SPONGE ,1,3/31/2011 13:14,1.25,17841,United Kingdom
548492,21175,GIN + TONIC DIET METAL SIGN,1,3/31/2011 13:14,2.55,17841,United Kingdom
548492,21669,BLUE STRIPE CERAMIC DRAWER KNOB,19,3/31/2011 13:14,1.25,17841,United Kingdom
548492,21670,BLUE SPOT CERAMIC DRAWER KNOB,2,3/31/2011 13:14,1.25,17841,United Kingdom
548492,20728,LUNCH BAG CARS BLUE,3,3/31/2011 13:14,1.65,17841,United Kingdom
548493,22384,LUNCH BAG PINK POLKADOT,20,3/31/2011 13:14,1.65,16839,United Kingdom
548493,84946,ANTIQUE SILVER T-LIGHT GLASS,72,3/31/2011 13:14,1.06,16839,United Kingdom
548493,22178,VICTORIAN GLASS HANGING T-LIGHT,96,3/31/2011 13:14,1.06,16839,United Kingdom
548493,21216,"SET 3 RETROSPOT TEA,COFFEE,SUGAR",24,3/31/2011 13:14,4.25,16839,United Kingdom
548493,20728,LUNCH BAG CARS BLUE,10,3/31/2011 13:14,1.65,16839,United Kingdom
548493,20749,ASSORTED COLOUR MINI CASES,2,3/31/2011 13:14,7.95,16839,United Kingdom
548493,22379,RECYCLING BAG RETROSPOT ,50,3/31/2011 13:14,1.85,16839,United Kingdom
548493,21340,CLASSIC METAL BIRDCAGE PLANT HOLDER,16,3/31/2011 13:14,9.95,16839,United Kingdom
548493,22423,REGENCY CAKESTAND 3 TIER,16,3/31/2011 13:14,10.95,16839,United Kingdom
548493,22487,WHITE WOOD GARDEN PLANT LADDER,8,3/31/2011 13:14,8.5,16839,United Kingdom
548494,22085,PAPER CHAIN KIT SKULLS ,80,3/31/2011 13:33,2.55,16698,United Kingdom
548494,22083,PAPER CHAIN KIT RETROSPOT,120,3/31/2011 13:33,2.55,16698,United Kingdom
548494,22084,PAPER CHAIN KIT EMPIRE,160,3/31/2011 13:33,2.55,16698,United Kingdom
548494,22148,EASTER CRAFT 4 CHICKS ,160,3/31/2011 13:33,1.65,16698,United Kingdom
C548495,21528,DAIRY MAID TRADITIONAL TEAPOT ,-1,3/31/2011 13:34,6.95,17075,United Kingdom
C548495,21527,RED RETROSPOT TRADITIONAL TEAPOT ,-1,3/31/2011 13:34,7.95,17075,United Kingdom
C548495,71038,WHITE HANGING BEADS CANDLE HOLDER,-1,3/31/2011 13:34,5.45,17075,United Kingdom
548496,23157,SET OF 6 NATIVITY MAGNETS ,1,3/31/2011 13:40,2.08,12678,France
548496,22941,CHRISTMAS LIGHTS 10 REINDEER,1,3/31/2011 13:40,8.5,12678,France
548496,22433,WATERING CAN GREEN DINOSAUR,1,3/31/2011 13:40,1.95,12678,France
548496,22431,WATERING CAN BLUE ELEPHANT,1,3/31/2011 13:40,1.95,12678,France
548496,22616,PACK OF 12 LONDON TISSUES ,120,3/31/2011 13:40,0.29,12678,France
548496,22555,PLASTERS IN TIN STRONGMAN,96,3/31/2011 13:40,1.45,12678,France
548496,22551,PLASTERS IN TIN SPACEBOY,96,3/31/2011 13:40,1.45,12678,France
548496,22556,PLASTERS IN TIN CIRCUS PARADE ,96,3/31/2011 13:40,1.45,12678,France
