545905,22595,GINGHAM HEART DECORATION,12,3/8/2011 8:53,0.85,15234,United Kingdom
545905,85123A,WHITE HANGING HEART T-LIGHT HOLDER,6,3/8/2011 8:53,2.95,15234,United Kingdom
545905,72232,FENG SHUI PILLAR CANDLE,48,3/8/2011 8:53,0.19,15234,United Kingdom
545905,85016,SET OF 6 VINTAGE NOTELETS KIT,6,3/8/2011 8:53,2.55,15234,United Kingdom
545905,22980,PANTRY SCRUBBING BRUSH,12,3/8/2011 8:53,1.65,15234,United Kingdom
545905,22780,LIGHT GARLAND BUTTERFILES PINK,4,3/8/2011 8:53,4.25,15234,United Kingdom
545906,22087,PAPER BUNTING WHITE LACE,6,3/8/2011 9:23,2.95,15764,United Kingdom
545906,23181,BULL DOG BOTTLE TOP WALL CLOCK,2,3/8/2011 9:23,8.25,15764,United Kingdom
545906,22192,BLUE DINER WALL CLOCK,2,3/8/2011 9:23,8.5,15764,United Kingdom
545906,22191,IVORY DINER WALL CLOCK,2,3/8/2011 9:23,8.5,15764,United Kingdom
545906,23183,MOTHER'S KITCHEN SPOON REST ,4,3/8/2011 9:23,3.75,15764,United Kingdom
545906,22726,ALARM CLOCK BAKELIKE GREEN,4,3/8/2011 9:23,3.75,15764,United Kingdom
545906,22725,ALARM CLOCK BAKELIKE CHOCOLATE,4,3/8/2011 9:23,3.75,15764,United Kingdom
545906,22729,ALARM CLOCK BAKELIKE ORANGE,4,3/8/2011 9:23,3.75,15764,United Kingdom
545906,22979,PANTRY WASHING UP BRUSH,12,3/8/2011 9:23,1.45,15764,United Kingdom
545906,22720,SET OF 3 CAKE TINS PANTRY DESIGN ,3,3/8/2011 9:23,4.95,15764,United Kingdom
545906,84378,SET OF 3 HEART COOKIE CUTTERS,12,3/8/2011 9:23,1.25,15764,United Kingdom
545906,22960,JAM MAKING SET WITH JARS,6,3/8/2011 9:23,4.25,15764,United Kingdom
545906,22966,GINGERBREAD MAN COOKIE CUTTER,12,3/8/2011 9:23,1.25,15764,United Kingdom
545906,22993,SET OF 4 PANTRY JELLY MOULDS,12,3/8/2011 9:23,1.25,15764,United Kingdom
545906,22961,JAM MAKING SET PRINTED,12,3/8/2011 9:23,1.45,15764,United Kingdom
545906,22980,PANTRY SCRUBBING BRUSH,12,3/8/2011 9:23,1.65,15764,United Kingdom
545906,22302,COFFEE MUG PEARS  DESIGN,6,3/8/2011 9:23,2.55,15764,United Kingdom
545906,22303,COFFEE MUG APPLES DESIGN,6,3/8/2011 9:23,2.55,15764,United Kingdom
545906,21175,GIN + TONIC DIET METAL SIGN,6,3/8/2011 9:23,2.55,15764,United Kingdom
545906,21166,COOK WITH WINE METAL SIGN ,12,3/8/2011 9:23,2.08,15764,United Kingdom
545906,21181,PLEASE ONE PERSON METAL SIGN,12,3/8/2011 9:23,2.1,15764,United Kingdom
545906,21844,RED RETROSPOT MUG,6,3/8/2011 9:23,2.95,15764,United Kingdom
545906,22892,SET OF SALT AND PEPPER TOADSTOOLS,12,3/8/2011 9:23,1.25,15764,United Kingdom
545906,21539,RED RETROSPOT BUTTER DISH,3,3/8/2011 9:23,4.95,15764,United Kingdom
545906,85014B,RED RETROSPOT UMBRELLA,3,3/8/2011 9:23,5.95,15764,United Kingdom
545906,84077,WORLD WAR 2 GLIDERS ASSTD DESIGNS,48,3/8/2011 9:23,0.29,15764,United Kingdom
545906,22621,TRADITIONAL KNITTING NANCY,12,3/8/2011 9:23,1.45,15764,United Kingdom
545906,21890,S/6 WOODEN SKITTLES IN COTTON BAG,6,3/8/2011 9:23,2.95,15764,United Kingdom
545906,21891,TRADITIONAL WOODEN SKIPPING ROPE,12,3/8/2011 9:23,1.25,15764,United Kingdom
545906,21918,SET 12 KIDS COLOUR  CHALK STICKS,24,3/8/2011 9:23,0.42,15764,United Kingdom
545906,22197,SMALL POPCORN HOLDER,12,3/8/2011 9:23,0.85,15764,United Kingdom
545906,21715,GIRLS VINTAGE TIN SEASIDE BUCKET,8,3/8/2011 9:23,2.55,15764,United Kingdom
545906,22383,LUNCH BAG SUKI  DESIGN ,10,3/8/2011 9:23,1.65,15764,United Kingdom
545906,22382,LUNCH BAG SPACEBOY DESIGN ,10,3/8/2011 9:23,1.65,15764,United Kingdom
