550997,20725,LUNCH BAG RED RETROSPOT,10,4/26/2011 9:04,1.65,17735,United Kingdom
550997,20728,LUNCH BAG CARS BLUE,10,4/26/2011 9:04,1.65,17735,United Kingdom
550997,20726,LUNCH BAG WOODLAND,10,4/26/2011 9:04,1.65,17735,United Kingdom
550997,20727,LUNCH BAG  BLACK SKULL.,20,4/26/2011 9:04,1.65,17735,United Kingdom
550997,22382,LUNCH BAG SPACEBOY DESIGN ,10,4/26/2011 9:04,1.65,17735,United Kingdom
550997,22383,LUNCH BAG SUKI DESIGN ,10,4/26/2011 9:04,1.65,17735,United Kingdom
550997,22662,LUNCH BAG DOLLY GIRL DESIGN,10,4/26/2011 9:04,1.65,17735,United Kingdom
550997,22327,ROUND SNACK BOXES SET OF 4 SKULLS,6,4/26/2011 9:04,2.95,17735,United Kingdom
550997,22326,ROUND SNACK BOXES SET OF4 WOODLAND ,6,4/26/2011 9:04,2.95,17735,United Kingdom
550997,22629,SPACEBOY LUNCH BOX ,12,4/26/2011 9:04,1.95,17735,United Kingdom
550997,22955,36 FOIL STAR CAKE CASES ,6,4/26/2011 9:04,2.1,17735,United Kingdom
550997,22092,BLUE PAISLEY TISSUE BOX,12,4/26/2011 9:04,1.25,17735,United Kingdom
550997,22100,SKULLS SQUARE TISSUE BOX,12,4/26/2011 9:04,1.25,17735,United Kingdom
550997,21126,SET OF 6 GIRLS CELEBRATION CANDLES,12,4/26/2011 9:04,1.25,17735,United Kingdom
550997,84796B,BLUE SAVANNAH PICNIC HAMPER FOR 2,1,4/26/2011 9:04,12.75,17735,United Kingdom
550997,22937,BAKING MOULD CHOCOLATE CUPCAKES,6,4/26/2011 9:04,2.55,17735,United Kingdom
550997,20711,JUMBO BAG TOYS ,10,4/26/2011 9:04,2.08,17735,United Kingdom
550997,22664,TOY TIDY DOLLY GIRL DESIGN,5,4/26/2011 9:04,2.1,17735,United Kingdom
550997,22379,RECYCLING BAG RETROSPOT ,5,4/26/2011 9:04,2.1,17735,United Kingdom
550997,22377,BOTTLE BAG RETROSPOT ,5,4/26/2011 9:04,2.1,17735,United Kingdom
550997,22380,TOY TIDY SPACEBOY  ,5,4/26/2011 9:04,2.1,17735,United Kingdom
550998,47566B,TEA TIME PARTY BUNTING,16,4/26/2011 9:12,4.95,12414,Austria
550998,47599A,PINK PARTY BAGS,24,4/26/2011 9:12,2.1,12414,Austria
550998,22128,PARTY CONES CANDY ASSORTED,48,4/26/2011 9:12,1.25,12414,Austria
550998,21977,PACK OF 60 PINK PAISLEY CAKE CASES,24,4/26/2011 9:12,0.55,12414,Austria
550998,POST,POSTAGE,1,4/26/2011 9:12,40,12414,Austria
550999,15058C,ICE CREAM DESIGN GARDEN PARASOL,4,4/26/2011 9:12,7.95,17670,United Kingdom
550999,21913,VINTAGE SEASIDE JIGSAW PUZZLES,4,4/26/2011 9:12,3.75,17670,United Kingdom
550999,21715,GIRLS VINTAGE TIN SEASIDE BUCKET,8,4/26/2011 9:12,2.55,17670,United Kingdom
550999,21878,PACK OF 6 SANDCASTLE FLAGS ASSORTED,24,4/26/2011 9:12,0.85,17670,United Kingdom
550999,21716,BOYS VINTAGE TIN SEASIDE BUCKET,8,4/26/2011 9:12,2.55,17670,United Kingdom
550999,21718,RED METAL BEACH SPADE ,12,4/26/2011 9:12,1.25,17670,United Kingdom
550999,21891,TRADITIONAL WOODEN SKIPPING ROPE,12,4/26/2011 9:12,1.25,17670,United Kingdom
550999,22550,HOLIDAY FUN LUDO,4,4/26/2011 9:12,3.75,17670,United Kingdom
550999,21750,LARGE SKULL WINDMILL,12,4/26/2011 9:12,2.1,17670,United Kingdom
550999,21747,SMALL SKULL WINDMILL,12,4/26/2011 9:12,1.25,17670,United Kingdom
550999,21224,SET/4 SKULL BADGES,10,4/26/2011 9:12,1.25,17670,United Kingdom
551000,22502,PICNIC BASKET WICKER SMALL,8,4/26/2011 9:15,5.95,18172,United Kingdom
551000,22432,WATERING CAN PINK BUNNY,12,4/26/2011 9:15,1.95,18172,United Kingdom
551000,22431,WATERING CAN BLUE ELEPHANT,12,4/26/2011 9:15,1.95,18172,United Kingdom
551000,22518,CHILDS GARDEN BRUSH BLUE,6,4/26/2011 9:15,2.1,18172,United Kingdom
551000,22551,PLASTERS IN TIN SPACEBOY,12,4/26/2011 9:15,1.65,18172,United Kingdom
551000,22749,FELTCRAFT PRINCESS CHARLOTTE DOLL,4,4/26/2011 9:15,3.75,18172,United Kingdom
551000,22147,FELTCRAFT BUTTERFLY HEARTS,12,4/26/2011 9:15,1.45,18172,United Kingdom
551001,85099B,JUMBO BAG RED RETROSPOT,100,4/26/2011 9:31,1.79,13408,United Kingdom
551001,21922,UNION STRIPE WITH FRINGE  HAMMOCK,12,4/26/2011 9:31,6.95,13408,United Kingdom
551001,22499,WOODEN UNION JACK BUNTING,24,4/26/2011 9:31,5.95,13408,United Kingdom
551001,21937,STRAWBERRY   PICNIC BAG,24,4/26/2011 9:31,2.95,13408,United Kingdom
551001,21936,RED RETROSPOT PICNIC BAG,24,4/26/2011 9:31,2.95,13408,United Kingdom
551001,22665,RECIPE BOX BLUE SKETCHBOOK DESIGN,6,4/26/2011 9:31,2.95,13408,United Kingdom
551002,21124,SET/10 BLUE POLKADOT PARTY CANDLES,24,4/26/2011 9:37,1.25,16834,United Kingdom
551002,21122,SET/10 PINK POLKADOT PARTY CANDLES,24,4/26/2011 9:37,1.25,16834,United Kingdom
551002,22620,4 TRADITIONAL SPINNING TOPS,12,4/26/2011 9:37,1.45,16834,United Kingdom
551002,21892,TRADITIONAL WOODEN CATCH CUP GAME ,12,4/26/2011 9:37,1.25,16834,United Kingdom
551002,21891,TRADITIONAL WOODEN SKIPPING ROPE,12,4/26/2011 9:37,1.45,16834,United Kingdom
551002,21790,VINTAGE SNAP CARDS,12,4/26/2011 9:37,0.85,16834,United Kingdom
551002,21917,SET 12 KIDS  WHITE CHALK STICKS,24,4/26/2011 9:37,0.42,16834,United Kingdom
551002,22621,TRADITIONAL KNITTING NANCY,12,4/26/2011 9:37,1.65,16834,United Kingdom
551002,22147,FELTCRAFT BUTTERFLY HEARTS,12,4/26/2011 9:37,1.45,16834,United Kingdom
551002,20972,PINK CREAM FELT CRAFT TRINKET BOX ,12,4/26/2011 9:37,1.25,16834,United Kingdom
551002,20971,PINK BLUE FELT CRAFT TRINKET BOX,12,4/26/2011 9:37,1.25,16834,United Kingdom
551002,20983,12 PENCILS TALL TUBE RED RETROSPOT,12,4/26/2011 9:37,0.85,16834,United Kingdom
551002,20981,12 PENCILS TALL TUBE WOODLAND,12,4/26/2011 9:37,0.85,16834,United Kingdom
551002,22666,RECIPE BOX PANTRY YELLOW DESIGN,6,4/26/2011 9:37,2.95,16834,United Kingdom
551002,84987,SET OF 36 TEATIME PAPER DOILIES,12,4/26/2011 9:37,1.45,16834,United Kingdom
551002,21977,PACK OF 60 PINK PAISLEY CAKE CASES,24,4/26/2011 9:37,0.55,16834,United Kingdom
551002,21975,PACK OF 60 DINOSAUR CAKE CASES,24,4/26/2011 9:37,0.55,16834,United Kingdom
551002,84991,60 TEATIME FAIRY CAKE CASES,24,4/26/2011 9:37,0.55,16834,United Kingdom
551002,21212,PACK OF 72 RETROSPOT CAKE CASES,24,4/26/2011 9:37,0.55,16834,United Kingdom
551002,22822,CREAM WALL PLANTER HEART SHAPED,4,4/26/2011 9:37,5.95,16834,United Kingdom
551002,21136,PAINTED METAL PEARS ASSORTED,16,4/26/2011 9:37,1.69,16834,United Kingdom
551002,84879,ASSORTED COLOUR BIRD ORNAMENT,16,4/26/2011 9:37,1.69,16834,United Kingdom
551002,22855,FINE WICKER HEART ,12,4/26/2011 9:37,1.25,16834,United Kingdom
551002,23152,IVORY SWEETHEART WIRE LETTER RACK ,4,4/26/2011 9:37,3.75,16834,United Kingdom
551003,20685,DOORMAT RED RETROSPOT,1,4/26/2011 9:44,7.95,16456,United Kingdom
551003,48138,DOORMAT UNION FLAG,1,4/26/2011 9:44,7.95,16456,United Kingdom
551003,48188,DOORMAT WELCOME PUPPIES,1,4/26/2011 9:44,7.95,16456,United Kingdom
551003,23199,JUMBO BAG APPLES,10,4/26/2011 9:44,2.08,16456,United Kingdom
551003,21928,JUMBO BAG SCANDINAVIAN BLUE PAISLEY,10,4/26/2011 9:44,2.08,16456,United Kingdom
551003,21930,JUMBO STORAGE BAG SKULLS,10,4/26/2011 9:44,2.08,16456,United Kingdom
551003,22411,JUMBO SHOPPER VINTAGE RED PAISLEY,10,4/26/2011 9:44,2.08,16456,United Kingdom
551003,85099C,JUMBO  BAG BAROQUE BLACK WHITE,20,4/26/2011 9:44,2.08,16456,United Kingdom
551003,85099B,JUMBO BAG RED RETROSPOT,50,4/26/2011 9:44,2.08,16456,United Kingdom
551003,21931,JUMBO STORAGE BAG SUKI,20,4/26/2011 9:44,2.08,16456,United Kingdom
551003,79406,FROSTED WHITE BASE ,24,4/26/2011 9:44,0.22,16456,United Kingdom
551003,21745,GAOLERS KEYS DECORATIVE GARDEN ,1,4/26/2011 9:44,3.75,16456,United Kingdom
551003,23147,SINGLE ANTIQUE ROSE HOOK IVORY,1,4/26/2011 9:44,1.45,16456,United Kingdom
551003,23138,SINGLE WIRE HOOK IVORY HEART,1,4/26/2011 9:44,1.45,16456,United Kingdom
551003,85231B,CINAMMON SET OF 9 T-LIGHTS,3,4/26/2011 9:44,0.85,16456,United Kingdom
551003,85231G,ORANGE SCENTED SET/9 T-LIGHTS,4,4/26/2011 9:44,0.85,16456,United Kingdom
551003,85039A,SET/4 RED MINI ROSE CANDLE IN BOWL,2,4/26/2011 9:44,1.65,16456,United Kingdom
551003,22807,SET OF 6 T-LIGHTS TOADSTOOLS,1,4/26/2011 9:44,2.95,16456,United Kingdom
551003,21845,DAIRY MAID STRIPE MUG,6,4/26/2011 9:44,0.79,16456,United Kingdom
551003,22666,RECIPE BOX PANTRY YELLOW DESIGN,1,4/26/2011 9:44,2.95,16456,United Kingdom
551003,22212,FOUR HOOK  WHITE LOVEBIRDS,1,4/26/2011 9:44,2.1,16456,United Kingdom
551003,72024U,LILAC VOTIVE CANDLE,24,4/26/2011 9:44,0.21,16456,United Kingdom
551003,85175,CACTI T-LIGHT CANDLES,16,4/26/2011 9:44,0.42,16456,United Kingdom
551004,22966,GINGERBREAD MAN COOKIE CUTTER,1,4/26/2011 9:48,2.46,,United Kingdom
551004,37340,MULTICOLOUR SPRING FLOWER MUG,2,4/26/2011 9:48,8.29,,United Kingdom
551004,47566b,TEA TIME PARTY BUNTING,4,4/26/2011 9:48,8.29,,United Kingdom
551004,72349b,SET/6 PURPLE BUTTERFLY T-LIGHTS,1,4/26/2011 9:48,4.13,,United Kingdom
551004,82482,WOODEN PICTURE FRAME WHITE FINISH,2,4/26/2011 9:48,4.96,,United Kingdom
551004,84380,SET OF 3 BUTTERFLY COOKIE CUTTERS,1,4/26/2011 9:48,3.29,,United Kingdom
551004,84509c,SET OF 4 POLKADOT PLACEMATS ,1,4/26/2011 9:48,7.46,,United Kingdom
551004,84510c,SET OF 4 POLKADOT COASTERS,1,4/26/2011 9:48,2.46,,United Kingdom
551004,84993a,75 GREEN PETIT FOUR CASES,2,4/26/2011 9:48,0.83,,United Kingdom
551004,85071C,"CHARLIE+LOLA""EXTREMELY BUSY"" SIGN",1,4/26/2011 9:48,4.96,,United Kingdom
551004,85099B,JUMBO BAG RED RETROSPOT,1,4/26/2011 9:48,4.13,,United Kingdom
551004,85099C,JUMBO  BAG BAROQUE BLACK WHITE,2,4/26/2011 9:48,4.13,,United Kingdom
551004,85114c,RED ENCHANTED FOREST PLACEMAT,10,4/26/2011 9:48,3.29,,United Kingdom
551004,DOT,DOTCOM POSTAGE,1,4/26/2011 9:48,176.71,,United Kingdom
551004,20676,RED RETROSPOT BOWL,1,4/26/2011 9:48,2.46,,United Kingdom
551004,20712,JUMBO BAG WOODLAND ANIMALS,1,4/26/2011 9:48,4.13,,United Kingdom
551004,20717,STRAWBERRY SHOPPER BAG,1,4/26/2011 9:48,2.46,,United Kingdom
551004,20828,GLITTER BUTTERFLY CLIPS,1,4/26/2011 9:48,4.96,,United Kingdom
551004,21086,SET/6 RED SPOTTY PAPER CUPS,4,4/26/2011 9:48,1.63,,United Kingdom
551004,21094,SET/6 RED SPOTTY PAPER PLATES,1,4/26/2011 9:48,2.46,,United Kingdom
551004,21162,TOXIC AREA  DOOR HANGER ,1,4/26/2011 9:48,3.29,,United Kingdom
551004,21216,"SET 3 RETROSPOT TEA,COFFEE,SUGAR",1,4/26/2011 9:48,10.79,,United Kingdom
551004,21232,STRAWBERRY CERAMIC TRINKET BOX,4,4/26/2011 9:48,3.29,,United Kingdom
551004,21253,SET OF PICTURE FRAME  STICKERS,1,4/26/2011 9:48,5.79,,United Kingdom
551004,21257,VICTORIAN SEWING BOX MEDIUM,1,4/26/2011 9:48,15.79,,United Kingdom
551004,21430,SET/3 RED GINGHAM ROSE STORAGE BOX,2,4/26/2011 9:48,7.46,,United Kingdom
551004,21557,SET OF 6 FUNKY BEAKERS,2,4/26/2011 9:48,5.63,,United Kingdom
551004,21558,SKULL LUNCH BOX WITH CUTLERY ,2,4/26/2011 9:48,4.96,,United Kingdom
551004,21672,WHITE SPOT RED CERAMIC DRAWER KNOB,8,4/26/2011 9:48,2.46,,United Kingdom
551004,21714,CITRONELLA CANDLE GARDEN POT,2,4/26/2011 9:48,2.46,,United Kingdom
551004,21731,RED TOADSTOOL LED NIGHT LIGHT,3,4/26/2011 9:48,4.13,,United Kingdom
551004,21770,OPEN CLOSED METAL SIGN,1,4/26/2011 9:48,9.96,,United Kingdom
551004,21843,RED RETROSPOT CAKE STAND,1,4/26/2011 9:48,20.79,,United Kingdom
551004,21928,JUMBO BAG SCANDINAVIAN BLUE PAISLEY,1,4/26/2011 9:48,4.13,,United Kingdom
551004,21931,JUMBO STORAGE BAG SUKI,2,4/26/2011 9:48,4.13,,United Kingdom
551004,21935,SUKI  SHOULDER BAG,1,4/26/2011 9:48,4.13,,United Kingdom
551004,21977,PACK OF 60 PINK PAISLEY CAKE CASES,5,4/26/2011 9:48,2.08,,United Kingdom
551004,22041,"RECORD FRAME 7"" SINGLE SIZE ",2,4/26/2011 9:48,4.96,,United Kingdom
551004,22069,BROWN  PIRATE TREASURE CHEST ,1,4/26/2011 9:48,4.13,,United Kingdom
551004,22084,PAPER CHAIN KIT EMPIRE,2,4/26/2011 9:48,4.96,,United Kingdom
551004,22090,PAPER BUNTING RETROSPOT,1,4/26/2011 9:48,6.63,,United Kingdom
551004,22094,RED RETROSPOT TISSUE BOX,1,4/26/2011 9:48,2.46,,United Kingdom
551004,22171,3 HOOK PHOTO SHELF ANTIQUE WHITE,1,4/26/2011 9:48,16.63,,United Kingdom
551004,22197,SMALL POPCORN HOLDER,2,4/26/2011 9:48,1.63,,United Kingdom
551004,22378,WALL TIDY RETROSPOT ,1,4/26/2011 9:48,4.96,,United Kingdom
551004,22379,RECYCLING BAG RETROSPOT ,3,4/26/2011 9:48,4.96,,United Kingdom
551004,22386,JUMBO BAG PINK POLKADOT,1,4/26/2011 9:48,4.13,,United Kingdom
551004,22411,JUMBO SHOPPER VINTAGE RED PAISLEY,3,4/26/2011 9:48,4.13,,United Kingdom
551004,22501,PICNIC BASKET WICKER LARGE,1,4/26/2011 9:48,20.79,,United Kingdom
551004,22524,CHILDRENS GARDEN GLOVES BLUE,1,4/26/2011 9:48,3.29,,United Kingdom
551004,22653,BUTTON BOX ,1,4/26/2011 9:48,4.13,,United Kingdom
551004,22677,FRENCH BLUE METAL DOOR SIGN 2,1,4/26/2011 9:48,2.46,,United Kingdom
551004,22679,FRENCH BLUE METAL DOOR SIGN 4,1,4/26/2011 9:48,2.46,,United Kingdom
551004,22682,FRENCH BLUE METAL DOOR SIGN 7,1,4/26/2011 9:48,2.46,,United Kingdom
551004,22719,GUMBALL MONOCHROME COAT RACK,2,4/26/2011 9:48,2.46,,United Kingdom
551004,22766,PHOTO FRAME CORNICE,1,4/26/2011 9:48,5.79,,United Kingdom
551004,22807,SET OF 6 T-LIGHTS TOADSTOOLS,1,4/26/2011 9:48,5.79,,United Kingdom
551005,20711,JUMBO BAG TOYS ,2,4/26/2011 9:48,4.13,,United Kingdom
551005,20712,JUMBO BAG WOODLAND ANIMALS,4,4/26/2011 9:48,4.13,,United Kingdom
551005,20717,STRAWBERRY SHOPPER BAG,1,4/26/2011 9:48,2.46,,United Kingdom
551005,20735,BLACK MINI TAPE MEASURE ,1,4/26/2011 9:48,1.63,,United Kingdom
551005,21061,PARTY INVITES FOOTBALL,1,4/26/2011 9:48,1.63,,United Kingdom
551005,21086,SET/6 RED SPOTTY PAPER CUPS,3,4/26/2011 9:48,1.63,,United Kingdom
551005,21232,STRAWBERRY CERAMIC TRINKET BOX,1,4/26/2011 9:48,3.29,,United Kingdom
551005,21257,VICTORIAN SEWING BOX MEDIUM,1,4/26/2011 9:48,15.79,,United Kingdom
551005,21328,BALLOONS  WRITING SET ,1,4/26/2011 9:48,3.29,,United Kingdom
551005,21363,HOME SMALL WOOD LETTERS,1,4/26/2011 9:48,10.79,,United Kingdom
551005,21430,SET/3 RED GINGHAM ROSE STORAGE BOX,1,4/26/2011 9:48,7.46,,United Kingdom
551005,21558,SKULL LUNCH BOX WITH CUTLERY ,1,4/26/2011 9:48,4.96,,United Kingdom
551005,21559,STRAWBERRY LUNCH BOX WITH CUTLERY,1,4/26/2011 9:48,4.96,,United Kingdom
551005,21577,SAVE THE PLANET COTTON TOTE BAG,1,4/26/2011 9:48,4.96,,United Kingdom
551005,21700,BIG DOUGHNUT FRIDGE MAGNETS,1,4/26/2011 9:48,8.29,,United Kingdom
551005,21731,RED TOADSTOOL LED NIGHT LIGHT,2,4/26/2011 9:48,4.13,,United Kingdom
551005,21770,OPEN CLOSED METAL SIGN,1,4/26/2011 9:48,9.96,,United Kingdom
551005,21892,TRADITIONAL WOODEN CATCH CUP GAME ,1,4/26/2011 9:48,2.46,,United Kingdom
551005,21931,JUMBO STORAGE BAG SUKI,3,4/26/2011 9:48,4.13,,United Kingdom
551005,22055,MINI CAKE STAND  HANGING STRAWBERY,2,4/26/2011 9:48,3.29,,United Kingdom
551005,22069,BROWN  PIRATE TREASURE CHEST ,1,4/26/2011 9:48,4.13,,United Kingdom
551005,22084,PAPER CHAIN KIT EMPIRE,1,4/26/2011 9:48,4.96,,United Kingdom
551005,22179,SET 10 LIGHTS NIGHT OWL,2,4/26/2011 9:48,13.29,,United Kingdom
551005,22195,LARGE HEART MEASURING SPOONS,2,4/26/2011 9:48,3.29,,United Kingdom
551005,22212,FOUR HOOK  WHITE LOVEBIRDS,1,4/26/2011 9:48,4.13,,United Kingdom
551005,22283,6 EGG HOUSE PAINTED WOOD,1,4/26/2011 9:48,15.79,,United Kingdom
551005,22308,TEA COSY BLUE STRIPE,12,4/26/2011 9:48,4.96,,United Kingdom
551005,22318,FIVE HEART HANGING DECORATION,1,4/26/2011 9:48,5.79,,United Kingdom
551005,22379,RECYCLING BAG RETROSPOT ,1,4/26/2011 9:48,4.96,,United Kingdom
551005,22381,TOY TIDY PINK POLKADOT,1,4/26/2011 9:48,4.96,,United Kingdom
551005,22385,JUMBO BAG SPACEBOY DESIGN,4,4/26/2011 9:48,4.13,,United Kingdom
551005,22386,JUMBO BAG PINK POLKADOT,1,4/26/2011 9:48,4.13,,United Kingdom
551005,22411,JUMBO SHOPPER VINTAGE RED PAISLEY,3,4/26/2011 9:48,4.13,,United Kingdom
551005,22456,NATURAL SLATE CHALKBOARD LARGE ,1,4/26/2011 9:48,9.96,,United Kingdom
551005,22501,PICNIC BASKET WICKER LARGE,1,4/26/2011 9:48,20.79,,United Kingdom
551005,22629,SPACEBOY LUNCH BOX ,2,4/26/2011 9:48,2.46,,United Kingdom
551005,22630,DOLLY GIRL LUNCH BOX,3,4/26/2011 9:48,2.46,,United Kingdom
551005,22637,PIGGY BANK RETROSPOT ,1,4/26/2011 9:48,5.79,,United Kingdom
551005,22663,JUMBO BAG DOLLY GIRL DESIGN,1,4/26/2011 9:48,4.13,,United Kingdom
551005,22664,TOY TIDY DOLLY GIRL DESIGN,1,4/26/2011 9:48,4.13,,United Kingdom
551005,22697,GREEN REGENCY TEACUP AND SAUCER,3,4/26/2011 9:48,5.79,,United Kingdom
551005,22776,SWEETHEART CAKESTAND 3 TIER,1,4/26/2011 9:48,19.96,,United Kingdom
551005,22844,VINTAGE CREAM DOG FOOD CONTAINER,1,4/26/2011 9:48,16.63,,United Kingdom
551005,23177,TREASURE ISLAND BOOK BOX,1,4/26/2011 9:48,4.58,,United Kingdom
551005,47591d,PINK FAIRY CAKE CHILDRENS APRON,1,4/26/2011 9:48,4.96,,United Kingdom
551005,48185,DOORMAT FAIRY CAKE,1,4/26/2011 9:48,14.13,,United Kingdom
551005,82482,WOODEN PICTURE FRAME WHITE FINISH,1,4/26/2011 9:48,4.96,,United Kingdom
551005,82483,WOOD 2 DRAWER CABINET WHITE FINISH,1,4/26/2011 9:48,12.46,,United Kingdom
551005,84509a,SET OF 4 ENGLISH ROSE PLACEMATS,1,4/26/2011 9:48,7.46,,United Kingdom
551005,84828,JUNGLE POPSICLES ICE LOLLY MOULDS,1,4/26/2011 9:48,2.46,,United Kingdom
551005,85099B,JUMBO BAG RED RETROSPOT,3,4/26/2011 9:48,4.13,,United Kingdom
551005,85099C,JUMBO  BAG BAROQUE BLACK WHITE,2,4/26/2011 9:48,4.13,,United Kingdom
551005,85132b,CHARLIE AND LOLA TABLE TINS,1,4/26/2011 9:48,8.29,,United Kingdom
551005,85176,SEWING SUSAN 21 NEEDLE SET,1,4/26/2011 9:48,1.63,,United Kingdom
551005,DOT,DOTCOM POSTAGE,1,4/26/2011 9:48,172.63,,United Kingdom
551006,20685,DOORMAT RED RETROSPOT,1,4/26/2011 9:48,16.63,,United Kingdom
551006,20711,JUMBO BAG TOYS ,2,4/26/2011 9:48,4.13,,United Kingdom
551006,20712,JUMBO BAG WOODLAND ANIMALS,3,4/26/2011 9:48,4.13,,United Kingdom
551006,21033,JUMBO BAG CHARLIE AND LOLA TOYS,5,4/26/2011 9:48,4.13,,United Kingdom
551006,21035,SET/2 RED RETROSPOT TEA TOWELS ,1,4/26/2011 9:48,6.25,,United Kingdom
551006,21232,STRAWBERRY CERAMIC TRINKET BOX,3,4/26/2011 9:48,3.29,,United Kingdom
551006,21430,SET/3 RED GINGHAM ROSE STORAGE BOX,1,4/26/2011 9:48,7.46,,United Kingdom
551006,21625,VINTAGE UNION JACK APRON,1,4/26/2011 9:48,14.13,,United Kingdom
551006,21626,VINTAGE UNION JACK PENNANT,2,4/26/2011 9:48,4.13,,United Kingdom
551006,21669,BLUE STRIPE CERAMIC DRAWER KNOB,4,4/26/2011 9:48,2.46,,United Kingdom
551006,21700,BIG DOUGHNUT FRIDGE MAGNETS,1,4/26/2011 9:48,8.29,,United Kingdom
551006,21731,RED TOADSTOOL LED NIGHT LIGHT,2,4/26/2011 9:48,4.13,,United Kingdom
551006,21843,RED RETROSPOT CAKE STAND,1,4/26/2011 9:48,20.79,,United Kingdom
551006,21874,GIN AND TONIC MUG,1,4/26/2011 9:48,3.29,,United Kingdom
551006,21928,JUMBO BAG SCANDINAVIAN BLUE PAISLEY,1,4/26/2011 9:48,4.13,,United Kingdom
551006,21931,JUMBO STORAGE BAG SUKI,2,4/26/2011 9:48,4.13,,United Kingdom
551006,22055,MINI CAKE STAND  HANGING STRAWBERY,1,4/26/2011 9:48,3.29,,United Kingdom
551006,22057,CERAMIC PLATE STRAWBERRY DESIGN,1,4/26/2011 9:48,3.29,,United Kingdom
551006,22090,PAPER BUNTING RETROSPOT,5,4/26/2011 9:48,6.63,,United Kingdom
551006,22139,RETROSPOT TEA SET CERAMIC 11 PC ,1,4/26/2011 9:48,10.79,,United Kingdom
551006,22197,SMALL POPCORN HOLDER,8,4/26/2011 9:48,1.63,,United Kingdom
551006,22297,HEART IVORY TRELLIS SMALL,1,4/26/2011 9:48,2.46,,United Kingdom
551006,22378,WALL TIDY RETROSPOT ,1,4/26/2011 9:48,4.96,,United Kingdom
551006,22381,TOY TIDY PINK POLKADOT,3,4/26/2011 9:48,4.96,,United Kingdom
551006,22383,LUNCH BAG SUKI DESIGN ,1,4/26/2011 9:48,4.96,,United Kingdom
551006,22386,JUMBO BAG PINK POLKADOT,5,4/26/2011 9:48,4.13,,United Kingdom
551006,22411,JUMBO SHOPPER VINTAGE RED PAISLEY,1,4/26/2011 9:48,4.13,,United Kingdom
551006,22424,ENAMEL BREAD BIN CREAM,1,4/26/2011 9:48,24.96,,United Kingdom
551006,22456,NATURAL SLATE CHALKBOARD LARGE ,1,4/26/2011 9:48,9.96,,United Kingdom
551006,22629,SPACEBOY LUNCH BOX ,2,4/26/2011 9:48,2.46,,United Kingdom
551006,22630,DOLLY GIRL LUNCH BOX,1,4/26/2011 9:48,2.46,,United Kingdom
551006,22659,LUNCH BOX I LOVE LONDON,1,4/26/2011 9:48,2.46,,United Kingdom
551006,22668,PINK BABY BUNTING,1,4/26/2011 9:48,5.79,,United Kingdom
551006,22719,GUMBALL MONOCHROME COAT RACK,5,4/26/2011 9:48,2.46,,United Kingdom
551006,22723,SET OF 6 HERB TINS SKETCHBOOK,1,4/26/2011 9:48,8.29,,United Kingdom
551006,47566b,TEA TIME PARTY BUNTING,1,4/26/2011 9:48,8.29,,United Kingdom
551006,48138,DOORMAT UNION FLAG,1,4/26/2011 9:48,14.13,,United Kingdom
551006,84378,SET OF 3 HEART COOKIE CUTTERS,1,4/26/2011 9:48,3.29,,United Kingdom
551006,84380,SET OF 3 BUTTERFLY COOKIE CUTTERS,2,4/26/2011 9:48,3.29,,United Kingdom
551006,85099B,JUMBO BAG RED RETROSPOT,4,4/26/2011 9:48,4.13,,United Kingdom
551006,85099C,JUMBO  BAG BAROQUE BLACK WHITE,5,4/26/2011 9:48,4.13,,United Kingdom
551006,DOT,DOTCOM POSTAGE,1,4/26/2011 9:48,138.08,,United Kingdom
551007,15056bl,EDWARDIAN PARASOL BLACK,1,4/26/2011 9:49,12.46,,United Kingdom
551007,20712,JUMBO BAG WOODLAND ANIMALS,6,4/26/2011 9:49,4.13,,United Kingdom
551007,20735,BLACK MINI TAPE MEASURE ,3,4/26/2011 9:49,1.63,,United Kingdom
551007,20975,12 PENCILS SMALL TUBE RED RETROSPOT,2,4/26/2011 9:49,1.25,,United Kingdom
551007,21430,SET/3 RED GINGHAM ROSE STORAGE BOX,1,4/26/2011 9:49,7.46,,United Kingdom
551007,21580,RABBIT  DESIGN  COTTON TOTE BAG,1,4/26/2011 9:49,4.96,,United Kingdom
551007,21714,CITRONELLA CANDLE GARDEN POT,1,4/26/2011 9:49,2.46,,United Kingdom
551007,21928,JUMBO BAG SCANDINAVIAN BLUE PAISLEY,3,4/26/2011 9:49,4.13,,United Kingdom
551007,21930,JUMBO STORAGE BAG SKULLS,1,4/26/2011 9:49,4.96,,United Kingdom
551007,21931,JUMBO STORAGE BAG SUKI,5,4/26/2011 9:49,4.13,,United Kingdom
551007,21947,SET OF 6 HEART CHOPSTICKS,1,4/26/2011 9:49,2.46,,United Kingdom
551007,22041,"RECORD FRAME 7"" SINGLE SIZE ",2,4/26/2011 9:49,4.96,,United Kingdom
551007,22059,CERAMIC STRAWBERRY DESIGN MUG,1,4/26/2011 9:49,3.29,,United Kingdom
551007,22090,PAPER BUNTING RETROSPOT,4,4/26/2011 9:49,6.63,,United Kingdom
551007,22171,3 HOOK PHOTO SHELF ANTIQUE WHITE,2,4/26/2011 9:49,16.63,,United Kingdom
551007,22360,GLASS JAR ENGLISH CONFECTIONERY,1,4/26/2011 9:49,5.79,,United Kingdom
551007,22361,GLASS JAR DAISY FRESH COTTON WOOL,1,4/26/2011 9:49,5.79,,United Kingdom
551007,22386,JUMBO BAG PINK POLKADOT,3,4/26/2011 9:49,4.13,,United Kingdom
551007,22411,JUMBO SHOPPER VINTAGE RED PAISLEY,6,4/26/2011 9:49,4.13,,United Kingdom
551007,22424,ENAMEL BREAD BIN CREAM,1,4/26/2011 9:49,24.96,,United Kingdom
551007,22474,SPACEBOY TV DINNER TRAY,1,4/26/2011 9:49,10.79,,United Kingdom
551007,22501,PICNIC BASKET WICKER LARGE,1,4/26/2011 9:49,20.79,,United Kingdom
551007,22502,PICNIC BASKET WICKER SMALL,6,4/26/2011 9:49,8.29,,United Kingdom
551007,22507,MEMO BOARD RETROSPOT  DESIGN,1,4/26/2011 9:49,10.79,,United Kingdom
551007,22515,CHILDS GARDEN SPADE PINK,1,4/26/2011 9:49,4.13,,United Kingdom
551007,22668,PINK BABY BUNTING,4,4/26/2011 9:49,5.79,,United Kingdom
551007,22776,SWEETHEART CAKESTAND 3 TIER,1,4/26/2011 9:49,19.96,,United Kingdom
551007,47566b,TEA TIME PARTY BUNTING,1,4/26/2011 9:49,8.29,,United Kingdom
551007,84380,SET OF 3 BUTTERFLY COOKIE CUTTERS,1,4/26/2011 9:49,3.29,,United Kingdom
551007,84828,JUNGLE POPSICLES ICE LOLLY MOULDS,1,4/26/2011 9:49,2.46,,United Kingdom
551007,84872a,TEATIME FUNKY FLOWER BACKPACK FOR 2,1,4/26/2011 9:49,10.79,,United Kingdom
551007,84988,SET OF 72 PINK HEART PAPER DOILIES,1,4/26/2011 9:49,3.75,,United Kingdom
551007,85099B,JUMBO BAG RED RETROSPOT,2,4/26/2011 9:49,4.13,,United Kingdom
551007,85099C,JUMBO  BAG BAROQUE BLACK WHITE,3,4/26/2011 9:49,4.13,,United Kingdom
551007,85231g,ORANGE SCENTED SET/9 T-LIGHTS,1,4/26/2011 9:49,1.63,,United Kingdom
551007,DOT,DOTCOM POSTAGE,1,4/26/2011 9:49,125.88,,United Kingdom
551008,20711,JUMBO BAG TOYS ,1,4/26/2011 9:50,4.13,,United Kingdom
551008,20712,JUMBO BAG WOODLAND ANIMALS,5,4/26/2011 9:50,4.13,,United Kingdom
551008,20718,RED RETROSPOT SHOPPER BAG,1,4/26/2011 9:50,3.29,,United Kingdom
551008,21166,COOK WITH WINE METAL SIGN ,1,4/26/2011 9:50,4.13,,United Kingdom
551008,21195,PINK  HONEYCOMB PAPER BALL ,2,4/26/2011 9:50,4.13,,United Kingdom
551008,21232,STRAWBERRY CERAMIC TRINKET BOX,2,4/26/2011 9:50,3.29,,United Kingdom
551008,21559,STRAWBERRY LUNCH BOX WITH CUTLERY,3,4/26/2011 9:50,4.96,,United Kingdom
551008,21714,CITRONELLA CANDLE GARDEN POT,1,4/26/2011 9:50,2.46,,United Kingdom
551008,21866,UNION JACK FLAG LUGGAGE TAG,1,4/26/2011 9:50,3.29,,United Kingdom
551008,21928,JUMBO BAG SCANDINAVIAN BLUE PAISLEY,4,4/26/2011 9:50,4.13,,United Kingdom
551008,21931,JUMBO STORAGE BAG SUKI,11,4/26/2011 9:50,4.13,,United Kingdom
551008,21936,RED RETROSPOT PICNIC BAG,1,4/26/2011 9:50,5.79,,United Kingdom
551008,22041,"RECORD FRAME 7"" SINGLE SIZE ",3,4/26/2011 9:50,4.96,,United Kingdom
551008,22090,PAPER BUNTING RETROSPOT,1,4/26/2011 9:50,6.63,,United Kingdom
551008,22195,LARGE HEART MEASURING SPOONS,1,4/26/2011 9:50,3.29,,United Kingdom
551008,22212,FOUR HOOK  WHITE LOVEBIRDS,1,4/26/2011 9:50,4.13,,United Kingdom
551008,22219,LOVEBIRD HANGING DECORATION WHITE ,1,4/26/2011 9:50,1.63,,United Kingdom
551008,22352,LUNCH BOX WITH CUTLERY RETROSPOT ,1,4/26/2011 9:50,4.96,,United Kingdom
551008,22357,KINGS CHOICE BISCUIT TIN,2,4/26/2011 9:50,8.29,,United Kingdom
551008,22381,TOY TIDY PINK POLKADOT,1,4/26/2011 9:50,4.96,,United Kingdom
551008,22386,JUMBO BAG PINK POLKADOT,2,4/26/2011 9:50,4.13,,United Kingdom
551008,22411,JUMBO SHOPPER VINTAGE RED PAISLEY,1,4/26/2011 9:50,4.13,,United Kingdom
551008,22424,ENAMEL BREAD BIN CREAM,2,4/26/2011 9:50,24.96,,United Kingdom
551008,22501,PICNIC BASKET WICKER LARGE,1,4/26/2011 9:50,20.79,,United Kingdom
551008,22677,FRENCH BLUE METAL DOOR SIGN 2,1,4/26/2011 9:50,2.46,,United Kingdom
551008,22681,FRENCH BLUE METAL DOOR SIGN 6,1,4/26/2011 9:50,2.46,,United Kingdom
551008,22719,GUMBALL MONOCHROME COAT RACK,1,4/26/2011 9:50,2.46,,United Kingdom
551008,22720,SET OF 3 CAKE TINS PANTRY DESIGN ,1,4/26/2011 9:50,10.79,,United Kingdom
551008,22844,VINTAGE CREAM DOG FOOD CONTAINER,1,4/26/2011 9:50,16.63,,United Kingdom
551008,23182,TOILET SIGN OCCUPIED OR VACANT,1,4/26/2011 9:50,2.5,,United Kingdom
551008,47566b,TEA TIME PARTY BUNTING,1,4/26/2011 9:50,8.29,,United Kingdom
551008,82599,FANNY'S REST STOPMETAL SIGN,1,4/26/2011 9:50,4.13,,United Kingdom
551008,82600,NO SINGING METAL SIGN,1,4/26/2011 9:50,4.13,,United Kingdom
551008,84032B,CHARLIE + LOLA RED HOT WATER BOTTLE,1,4/26/2011 9:50,5.79,,United Kingdom
551008,84519A,TOMATO CHARLIE+LOLA COASTER SET,1,4/26/2011 9:50,5.79,,United Kingdom
551008,84997a,CHILDRENS CUTLERY POLKADOT GREEN ,2,4/26/2011 9:50,8.29,,United Kingdom
