550987,21385,IVORY HANGING DECORATION  HEART,1,4/21/2011 18:10,1.63,,United Kingdom
550987,21395,BLUE POLKADOT BEAKER ,6,4/21/2011 18:10,1.63,,United Kingdom
550987,21401,BLUE PUDDING SPOON,1,4/21/2011 18:10,0.42,,United Kingdom
550987,21403,BLUE EGG  SPOON,1,4/21/2011 18:10,0.42,,United Kingdom
550987,21442,GREEN BIRDHOUSE DECORATION,1,4/21/2011 18:10,1.63,,United Kingdom
550987,21447,12 IVORY ROSE PEG PLACE SETTINGS,4,4/21/2011 18:10,2.46,,United Kingdom
550987,21454,PAINTED PINK RABBIT ,2,4/21/2011 18:10,0.83,,United Kingdom
550987,21455,PAINTED YELLOW WOODEN DAISY,2,4/21/2011 18:10,0.83,,United Kingdom
550987,21466,RED FLOWER CROCHET FOOD COVER,1,4/21/2011 18:10,7.46,,United Kingdom
550987,21504,SKULLS GREETING CARD,1,4/21/2011 18:10,0.83,,United Kingdom
550987,21539,RED RETROSPOT BUTTER DISH,1,4/21/2011 18:10,9.96,,United Kingdom
550987,21656,RIDGED GLASS POSY VASE ,1,4/21/2011 18:10,1.63,,United Kingdom
550987,21673,WHITE SPOT BLUE CERAMIC DRAWER KNOB,1,4/21/2011 18:10,3.29,,United Kingdom
550987,21704,BAG 250g SWIRLY MARBLES,1,4/21/2011 18:10,1.63,,United Kingdom
550987,21716,BOYS VINTAGE TIN SEASIDE BUCKET,2,4/21/2011 18:10,4.96,,United Kingdom
550987,21889,WOODEN BOX OF DOMINOES,1,4/21/2011 18:10,2.46,,United Kingdom
550987,21931,JUMBO STORAGE BAG SUKI,1,4/21/2011 18:10,4.13,,United Kingdom
550987,21977,PACK OF 60 PINK PAISLEY CAKE CASES,1,4/21/2011 18:10,1.25,,United Kingdom
550987,21984,PACK OF 12 PINK PAISLEY TISSUES ,1,4/21/2011 18:10,0.83,,United Kingdom
550987,21990,MODERN FLORAL STATIONERY SET,1,4/21/2011 18:10,2.46,,United Kingdom
550987,22084,PAPER CHAIN KIT EMPIRE,2,4/21/2011 18:10,5.79,,United Kingdom
550987,22088,PAPER BUNTING COLOURED LACE,1,4/21/2011 18:10,5.79,,United Kingdom
550987,22089,PAPER BUNTING VINTAGE PAISLEY,1,4/21/2011 18:10,5.79,,United Kingdom
550987,22090,PAPER BUNTING RETROSPOT,3,4/21/2011 18:10,5.79,,United Kingdom
550987,22116,METAL SIGN HIS DINNER IS SERVED,4,4/21/2011 18:10,1.63,,United Kingdom
550987,22134,MINI LADLE LOVE HEART RED ,3,4/21/2011 18:10,0.83,,United Kingdom
550987,22139,RETROSPOT TEA SET CERAMIC 11 PC ,1,4/21/2011 18:10,10.79,,United Kingdom
550987,22161,HEART DECORATION RUSTIC HANGING ,3,4/21/2011 18:10,0.79,,United Kingdom
550987,22165,"DIAMANTE HEART SHAPED WALL MIRROR, ",1,4/21/2011 18:10,10.79,,United Kingdom
550987,22179,SET 10 LIGHTS NIGHT OWL,1,4/21/2011 18:10,13.29,,United Kingdom
550987,22183,CAKE STAND VICTORIAN FILIGREE MED,1,4/21/2011 18:10,5.79,,United Kingdom
550987,22195,LARGE HEART MEASURING SPOONS,1,4/21/2011 18:10,3.29,,United Kingdom
550987,22217,T-LIGHT HOLDER HANGING LACE,5,4/21/2011 18:10,2.46,,United Kingdom
550987,22224,WHITE LOVEBIRD LANTERN,1,4/21/2011 18:10,5.79,,United Kingdom
550987,22241,GARLAND WOODEN HAPPY EASTER,6,4/21/2011 18:10,2.46,,United Kingdom
550987,22243,5 HOOK HANGER RED MAGIC TOADSTOOL,1,4/21/2011 18:10,3.29,,United Kingdom
550987,22270,HAPPY EASTER HANGING DECORATION,1,4/21/2011 18:10,7.46,,United Kingdom
550987,22286,DECORATION WOBBLY RABBIT METAL ,1,4/21/2011 18:10,3.29,,United Kingdom
550987,22287,DECORATION WOBBLY CHICKEN,1,4/21/2011 18:10,3.29,,United Kingdom
550987,22297,HEART IVORY TRELLIS SMALL,5,4/21/2011 18:10,2.46,,United Kingdom
550987,22315,200 RED + WHITE BENDY STRAWS,1,4/21/2011 18:10,2.46,,United Kingdom
550987,22326,ROUND SNACK BOXES SET OF4 WOODLAND ,1,4/21/2011 18:10,5.79,,United Kingdom
550987,22335,HEART DECORATION PAINTED ZINC ,25,4/21/2011 18:10,0.65,,United Kingdom
550987,22382,LUNCH BAG SPACEBOY DESIGN ,1,4/21/2011 18:10,4.13,,United Kingdom
550987,22383,LUNCH BAG SUKI DESIGN ,1,4/21/2011 18:10,4.13,,United Kingdom
550987,22403,MAGNETS PACK OF 4 VINTAGE LABELS ,1,4/21/2011 18:10,2.46,,United Kingdom
550987,22406,MONEY BOX KINGS CHOICE DESIGN,1,4/21/2011 18:10,2.46,,United Kingdom
550987,22411,JUMBO SHOPPER VINTAGE RED PAISLEY,1,4/21/2011 18:10,4.13,,United Kingdom
550987,22422,TOOTHPASTE TUBE PEN,1,4/21/2011 18:10,1.25,,United Kingdom
550987,22431,WATERING CAN BLUE ELEPHANT,1,4/21/2011 18:10,4.13,,United Kingdom
550987,22432,WATERING CAN PINK BUNNY,1,4/21/2011 18:10,4.13,,United Kingdom
550987,22433,WATERING CAN GREEN DINOSAUR,1,4/21/2011 18:10,4.13,,United Kingdom
550987,22435,SET OF 9 HEART SHAPED BALLOONS,1,4/21/2011 18:10,2.46,,United Kingdom
550987,22457,NATURAL SLATE HEART CHALKBOARD ,1,4/21/2011 18:10,5.79,,United Kingdom
550987,22464,HANGING METAL HEART LANTERN,6,4/21/2011 18:10,3.29,,United Kingdom
550987,22466,FAIRY TALE COTTAGE NIGHTLIGHT,1,4/21/2011 18:10,4.13,,United Kingdom
550987,22485,SET OF 2 WOODEN MARKET CRATES,1,4/21/2011 18:10,24.96,,United Kingdom
550987,22494,EMERGENCY FIRST AID TIN ,1,4/21/2011 18:10,2.46,,United Kingdom
550987,22499,WOODEN UNION JACK BUNTING,1,4/21/2011 18:10,12.46,,United Kingdom
550987,22501,PICNIC BASKET WICKER LARGE,1,4/21/2011 18:10,20.79,,United Kingdom
550987,22508,DOORSTOP RETROSPOT HEART,1,4/21/2011 18:10,7.46,,United Kingdom
550987,22557,PLASTERS IN TIN VINTAGE PAISLEY ,2,4/21/2011 18:10,3.29,,United Kingdom
550987,22558,CLOTHES PEGS RETROSPOT PACK 24 ,1,4/21/2011 18:10,3.29,,United Kingdom
550987,22562,MONSTERS STENCIL CRAFT,1,4/21/2011 18:10,2.46,,United Kingdom
550987,22563,HAPPY STENCIL CRAFT,1,4/21/2011 18:10,2.46,,United Kingdom
550987,22564,ALPHABET STENCIL CRAFT,1,4/21/2011 18:10,2.46,,United Kingdom
550987,22585,PACK OF 6 BIRDY GIFT TAGS,1,4/21/2011 18:10,2.46,,United Kingdom
550987,22602,RETROSPOT WOODEN HEART DECORATION,2,4/21/2011 18:10,1.63,,United Kingdom
550987,22616,PACK OF 12 LONDON TISSUES ,1,4/21/2011 18:10,0.83,,United Kingdom
550987,22630,DOLLY GIRL LUNCH BOX,1,4/21/2011 18:10,4.13,,United Kingdom
550987,22650,CERAMIC PIRATE CHEST MONEY BANK,1,4/21/2011 18:10,3.29,,United Kingdom
550987,22659,LUNCH BOX I LOVE LONDON,1,4/21/2011 18:10,4.13,,United Kingdom
550987,22661,CHARLOTTE BAG DOLLY GIRL DESIGN,1,4/21/2011 18:10,1.63,,United Kingdom
550987,22662,LUNCH BAG DOLLY GIRL DESIGN,2,4/21/2011 18:10,4.13,,United Kingdom
550987,22692,DOORMAT WELCOME TO OUR HOME,1,4/21/2011 18:10,15.79,,United Kingdom
550987,22693,GROW A FLYTRAP OR SUNFLOWER IN TIN,2,4/21/2011 18:10,2.5,,United Kingdom
550987,22699,ROSES REGENCY TEACUP AND SAUCER ,1,4/21/2011 18:10,5.79,,United Kingdom
550987,22714,CARD BIRTHDAY COWBOY,2,4/21/2011 18:10,0.83,,United Kingdom
550987,22715,CARD WEDDING DAY,1,4/21/2011 18:10,0.83,,United Kingdom
550987,22721,SET OF 3 CAKE TINS SKETCHBOOK,1,4/21/2011 18:10,10.79,,United Kingdom
550987,22727,ALARM CLOCK BAKELIKE RED ,1,4/21/2011 18:10,7.46,,United Kingdom
550987,22728,ALARM CLOCK BAKELIKE PINK,1,4/21/2011 18:10,7.46,,United Kingdom
550987,22771,CLEAR DRAWER KNOB ACRYLIC EDWARDIAN,1,4/21/2011 18:10,2.46,,United Kingdom
550987,22840,ROUND CAKE TIN VINTAGE RED,1,4/21/2011 18:10,15.79,,United Kingdom
550987,22844,VINTAGE CREAM DOG FOOD CONTAINER,1,4/21/2011 18:10,16.63,,United Kingdom
550987,22845,VINTAGE CREAM CAT FOOD CONTAINER,1,4/21/2011 18:10,12.46,,United Kingdom
550987,22855,FINE WICKER HEART ,6,4/21/2011 18:10,2.46,,United Kingdom
550987,22859,EASTER TIN BUNNY BOUQUET,2,4/21/2011 18:10,3.29,,United Kingdom
550987,22860,EASTER TIN CHICKS PINK DAISY,1,4/21/2011 18:10,3.29,,United Kingdom
550987,22907,PACK OF 20 NAPKINS PANTRY DESIGN,2,4/21/2011 18:10,1.63,,United Kingdom
550987,22965,3 TRADITIONAl BISCUIT CUTTERS  SET,1,4/21/2011 18:10,4.13,,United Kingdom
550987,22969,HOMEMADE JAM SCENTED CANDLES,2,4/21/2011 18:10,3.29,,United Kingdom
550987,22979,PANTRY WASHING UP BRUSH,1,4/21/2011 18:10,3.29,,United Kingdom
550987,22993,SET OF 4 PANTRY JELLY MOULDS,1,4/21/2011 18:10,2.46,,United Kingdom
550987,22996,TRAVEL CARD WALLET VINTAGE TICKET,1,4/21/2011 18:10,0.83,,United Kingdom
550987,22998,TRAVEL CARD WALLET KEEP CALM,1,4/21/2011 18:10,0.83,,United Kingdom
550987,23004,TRAVEL CARD WALLET PANTRY,2,4/21/2011 18:10,0.83,,United Kingdom
550987,23066,SMALL DECO JEWELLERY STAND,1,4/21/2011 18:10,16.63,,United Kingdom
550987,23182,TOILET SIGN OCCUPIED OR VACANT,1,4/21/2011 18:10,2.46,,United Kingdom
550987,23199,JUMBO BAG APPLES,1,4/21/2011 18:10,4.13,,United Kingdom
550987,35911A,MULTICOLOUR RABBIT EGG WARMER,4,4/21/2011 18:10,0.83,,United Kingdom
550987,37476,CONDIMENT TRAY 4 BOWLS AND 4 SPOONS,1,4/21/2011 18:10,8.29,,United Kingdom
550987,47566,PARTY BUNTING,2,4/21/2011 18:10,10.79,,United Kingdom
550987,47566B,TEA TIME PARTY BUNTING,1,4/21/2011 18:10,10.79,,United Kingdom
550987,71495A,CD WALL TIDY BLUE OFFICE,2,4/21/2011 18:10,0.83,,United Kingdom
550987,71496A,A4 WALL TIDY BLUE OFFICE,4,4/21/2011 18:10,1.46,,United Kingdom
550987,82482,WOODEN PICTURE FRAME WHITE FINISH,3,4/21/2011 18:10,4.96,,United Kingdom
550987,82484,WOOD BLACK BOARD ANT WHITE FINISH,1,4/21/2011 18:10,16.63,,United Kingdom
550987,82551,LAUNDRY 15C METAL SIGN,2,4/21/2011 18:10,2.46,,United Kingdom
550987,82583,HOT BATHS METAL SIGN,1,4/21/2011 18:10,4.13,,United Kingdom
550987,84032A,CHARLIE+LOLA PINK HOT WATER BOTTLE,1,4/21/2011 18:10,3.29,,United Kingdom
550987,84378,SET OF 3 HEART COOKIE CUTTERS,1,4/21/2011 18:10,2.46,,United Kingdom
550987,84380,SET OF 3 BUTTERFLY COOKIE CUTTERS,2,4/21/2011 18:10,2.46,,United Kingdom
550987,84429A,MEDIUM PINK BUDDHA HEAD ,1,4/21/2011 18:10,5.79,,United Kingdom
550987,84509A,SET OF 4 ENGLISH ROSE PLACEMATS,1,4/21/2011 18:10,7.46,,United Kingdom
550987,84510A,SET OF 4 ENGLISH ROSE COASTERS,1,4/21/2011 18:10,2.46,,United Kingdom
550987,84598,BOYS ALPHABET IRON ON PATCHES,14,4/21/2011 18:10,0.21,,United Kingdom
550987,84692,BOX OF 24 COCKTAIL PARASOLS,1,4/21/2011 18:10,0.83,,United Kingdom
550987,84792,ENCHANTED BIRD COATHANGER 5 HOOK,1,4/21/2011 18:10,9.13,,United Kingdom
550987,84879,ASSORTED COLOUR BIRD ORNAMENT,16,4/21/2011 18:10,1.35,,United Kingdom
550987,84880,WHITE WIRE EGG HOLDER,1,4/21/2011 18:10,15.79,,United Kingdom
550987,84978,HANGING HEART JAR T-LIGHT HOLDER,2,4/21/2011 18:10,2.46,,United Kingdom
550987,84987,SET OF 36 TEATIME PAPER DOILIES,1,4/21/2011 18:10,2.92,,United Kingdom
550987,84988,SET OF 72 PINK HEART PAPER DOILIES,1,4/21/2011 18:10,2.92,,United Kingdom
550987,84991,60 TEATIME FAIRY CAKE CASES,2,4/21/2011 18:10,1.25,,United Kingdom
550987,85017B,ENVELOPE 50 BLOSSOM IMAGES,2,4/21/2011 18:10,0.83,,United Kingdom
550987,85053,FRENCH ENAMEL CANDLEHOLDER,2,4/21/2011 18:10,4.13,,United Kingdom
550987,85062,PEARL CRYSTAL PUMPKIN T-LIGHT HLDR,4,4/21/2011 18:10,2.46,,United Kingdom
550987,85093,CANDY SPOT EGG WARMER HARE,9,4/21/2011 18:10,0.83,,United Kingdom
550987,85094,CANDY SPOT EGG WARMER RABBIT,7,4/21/2011 18:10,0.83,,United Kingdom
550987,85099B,JUMBO BAG RED RETROSPOT,1,4/21/2011 18:10,4.13,,United Kingdom
550987,85123A,WHITE HANGING HEART T-LIGHT HOLDER,16,4/21/2011 18:10,2.95,,United Kingdom
550987,85132A,CHARLIE + LOLA BISCUITS TINS,1,4/21/2011 18:10,5.79,,United Kingdom
550987,85152,HAND OVER THE CHOCOLATE   SIGN ,2,4/21/2011 18:10,4.13,,United Kingdom
550987,85199L,LARGE HANGING IVORY & RED WOOD BIRD,2,4/21/2011 18:10,1.25,,United Kingdom
550987,85199S,SMALL HANGING IVORY/RED WOOD BIRD,1,4/21/2011 18:10,0.83,,United Kingdom
550987,90214F,"LETTER ""F"" BLING KEY RING",1,4/21/2011 18:10,0.83,,United Kingdom
550987,90214O,"LETTER ""O"" BLING KEY RING",1,4/21/2011 18:10,0.83,,United Kingdom
550987,DOT,DOTCOM POSTAGE,1,4/21/2011 18:10,163.83,,United Kingdom
550987,22678,FRENCH BLUE METAL DOOR SIGN 3,2,4/21/2011 18:10,1.25,,United Kingdom
550987,22679,FRENCH BLUE METAL DOOR SIGN 4,5,4/21/2011 18:10,1.25,,United Kingdom
550987,22686,FRENCH BLUE METAL DOOR SIGN No,12,4/21/2011 18:10,1.25,,United Kingdom
550988,23205,CHARLOTTE BAG VINTAGE ALPHABET ,10,4/21/2011 18:10,0.85,14231,United Kingdom
550988,23204,CHARLOTTE BAG APPLES DESIGN,10,4/21/2011 18:10,0.85,14231,United Kingdom
550988,23201,JUMBO BAG ALPHABET,10,4/21/2011 18:10,2.08,14231,United Kingdom
550988,23208,LUNCH BAG VINTAGE LEAF DESIGN,10,4/21/2011 18:10,1.65,14231,United Kingdom
550988,23206,LUNCH BAG APPLE DESIGN,10,4/21/2011 18:10,1.65,14231,United Kingdom
550988,23207,LUNCH BAG ALPHABET DESIGN,10,4/21/2011 18:10,1.65,14231,United Kingdom
550988,22905,CALENDAR IN SEASON DESIGN,6,4/21/2011 18:10,2.95,14231,United Kingdom
550988,85099B,JUMBO BAG RED RETROSPOT,10,4/21/2011 18:10,2.08,14231,United Kingdom
550988,20712,JUMBO BAG WOODLAND ANIMALS,10,4/21/2011 18:10,2.08,14231,United Kingdom
550988,22386,JUMBO BAG PINK POLKADOT,10,4/21/2011 18:10,2.08,14231,United Kingdom
550988,21714,CITRONELLA CANDLE GARDEN POT,12,4/21/2011 18:10,1.25,14231,United Kingdom
550988,21314,SMALL GLASS HEART TRINKET POT,8,4/21/2011 18:10,2.1,14231,United Kingdom
550988,21868,POTTING SHED TEA MUG,12,4/21/2011 18:10,1.25,14231,United Kingdom
550988,22855,FINE WICKER HEART ,12,4/21/2011 18:10,1.25,14231,United Kingdom
550988,21770,OPEN CLOSED METAL SIGN,2,4/21/2011 18:10,4.95,14231,United Kingdom
550988,22413,METAL SIGN TAKE IT OR LEAVE IT ,6,4/21/2011 18:10,2.95,14231,United Kingdom
550988,23061,VINTAGE EMBOSSED HEART,12,4/21/2011 18:10,1.25,14231,United Kingdom
550988,47566,PARTY BUNTING,4,4/21/2011 18:10,4.95,14231,United Kingdom
550988,22969,HOMEMADE JAM SCENTED CANDLES,12,4/21/2011 18:10,1.45,14231,United Kingdom
550989,23201,JUMBO BAG ALPHABET,13,4/21/2011 18:22,2.08,13969,United Kingdom
550989,23204,CHARLOTTE BAG APPLES DESIGN,10,4/21/2011 18:22,0.85,13969,United Kingdom
550989,23207,LUNCH BAG ALPHABET DESIGN,10,4/21/2011 18:22,1.65,13969,United Kingdom
550989,71459,HANGING JAM JAR T-LIGHT HOLDER,3,4/21/2011 18:22,0.85,13969,United Kingdom
550989,22998,TRAVEL CARD WALLET KEEP CALM,10,4/21/2011 18:22,0.42,13969,United Kingdom
550989,22997,TRAVEL CARD WALLET UNION JACK,10,4/21/2011 18:22,0.42,13969,United Kingdom
550989,22084,PAPER CHAIN KIT EMPIRE,10,4/21/2011 18:22,2.95,13969,United Kingdom
550989,23208,LUNCH BAG VINTAGE LEAF DESIGN,1,4/21/2011 18:22,1.65,13969,United Kingdom
550989,22699,ROSES REGENCY TEACUP AND SAUCER ,1,4/21/2011 18:22,2.95,13969,United Kingdom
550989,22697,GREEN REGENCY TEACUP AND SAUCER,1,4/21/2011 18:22,2.95,13969,United Kingdom
550989,84755,COLOUR GLASS T-LIGHT HOLDER HANGING,8,4/21/2011 18:22,0.65,13969,United Kingdom
550989,22698,PINK REGENCY TEACUP AND SAUCER,1,4/21/2011 18:22,2.95,13969,United Kingdom
550989,23208,LUNCH BAG VINTAGE LEAF DESIGN,5,4/21/2011 18:22,1.65,13969,United Kingdom
550989,23206,LUNCH BAG APPLE DESIGN,10,4/21/2011 18:22,1.65,13969,United Kingdom
550989,23199,JUMBO BAG APPLES,10,4/21/2011 18:22,2.08,13969,United Kingdom
550989,85132C,CHARLIE AND LOLA FIGURES TINS,4,4/21/2011 18:22,1.95,13969,United Kingdom
550989,85132B,CHARLIE AND LOLA TABLE TINS,4,4/21/2011 18:22,1.95,13969,United Kingdom
550989,85132A,CHARLIE + LOLA BISCUITS TINS,2,4/21/2011 18:22,1.95,13969,United Kingdom
550989,85132A,CHARLIE + LOLA BISCUITS TINS,2,4/21/2011 18:22,1.95,13969,United Kingdom
550989,22090,PAPER BUNTING RETROSPOT,9,4/21/2011 18:22,2.95,13969,United Kingdom
550989,22053,EMPIRE DESIGN ROSETTE,8,4/21/2011 18:22,1.25,13969,United Kingdom
550989,23182,TOILET SIGN OCCUPIED OR VACANT,4,4/21/2011 18:22,0.83,13969,United Kingdom
550989,84970S,HANGING HEART ZINC T-LIGHT HOLDER,3,4/21/2011 18:22,0.85,13969,United Kingdom
550989,22729,ALARM CLOCK BAKELIKE ORANGE,2,4/21/2011 18:22,3.75,13969,United Kingdom
550989,82582,AREA PATROLLED METAL SIGN,7,4/21/2011 18:22,2.1,13969,United Kingdom
550989,20971,PINK BLUE FELT CRAFT TRINKET BOX,2,4/21/2011 18:22,1.25,13969,United Kingdom
550989,79144C,PAINTED LIGHTBULB RAINBOW DESIGN,2,4/21/2011 18:22,0.42,13969,United Kingdom
550989,23049,RECYCLED ACAPULCO MAT RED,1,4/21/2011 18:22,8.25,13969,United Kingdom
550989,37413,ICON MUG REVOLUTIONARY,6,4/21/2011 18:22,0.39,13969,United Kingdom
550990,22722,SET OF 6 SPICE TINS PANTRY DESIGN,48,4/21/2011 18:31,3.45,16553,United Kingdom
550990,21428,SET3 BOOK BOX GREEN GINGHAM FLOWER ,32,4/21/2011 18:31,3.75,16553,United Kingdom
550990,22356,CHARLOTTE BAG PINK POLKADOT,100,4/21/2011 18:31,0.72,16553,United Kingdom
550990,84380,SET OF 3 BUTTERFLY COOKIE CUTTERS,72,4/21/2011 18:31,1.25,16553,United Kingdom
550991,22673,FRENCH GARDEN SIGN BLUE METAL,12,4/21/2011 18:59,1.25,14060,United Kingdom
550991,23158,SET OF 5 LUCKY CAT MAGNETS ,48,4/21/2011 18:59,2.08,14060,United Kingdom
550991,22900, SET 2 TEA TOWELS I LOVE LONDON ,12,4/21/2011 18:59,3.25,14060,United Kingdom
550992,84792,ENCHANTED BIRD COATHANGER 5 HOOK,3,4/21/2011 19:05,4.65,14512,United Kingdom
550992,22178,VICTORIAN GLASS HANGING T-LIGHT,6,4/21/2011 19:05,1.25,14512,United Kingdom
550992,84457,SET/3 RABBITS FLOWER SKIPPPING ROPE,2,4/21/2011 19:05,0.85,14512,United Kingdom
550992,22944,CHRISTMAS METAL POSTCARD WITH BELLS,6,4/21/2011 19:05,1.25,14512,United Kingdom
550992,22262,FELT EGG COSY CHICKEN,2,4/21/2011 19:05,0.85,14512,United Kingdom
550992,22261,FELT EGG COSY WHITE RABBIT ,2,4/21/2011 19:05,0.85,14512,United Kingdom
550992,22269,EGG CUP NATURAL CHICKEN,4,4/21/2011 19:05,1.25,14512,United Kingdom
550992,21135,VICTORIAN  METAL POSTCARD SPRING,8,4/21/2011 19:05,1.69,14512,United Kingdom
550992,21531,RED RETROSPOT SUGAR JAM BOWL,4,4/21/2011 19:05,2.55,14512,United Kingdom
550992,22188,BLACK HEART CARD HOLDER,2,4/21/2011 19:05,3.95,14512,United Kingdom
550992,22788,BROCANTE COAT RACK,2,4/21/2011 19:05,9.95,14512,United Kingdom
550992,22782,SET 3 WICKER STORAGE BASKETS ,1,4/21/2011 19:05,24.95,14512,United Kingdom
550992,21925,UNION STRIPE CUSHION COVER ,4,4/21/2011 19:05,1.25,14512,United Kingdom
550992,46000S,POLYESTER FILLER PAD 40x40cm,4,4/21/2011 19:05,1.45,14512,United Kingdom
550993,23256,CHILDRENS CUTLERY SPACEBOY ,4,4/21/2011 19:51,4.15,15810,United Kingdom
550993,23007, SPACEBOY BABY GIFT SET,1,4/21/2011 19:51,16.95,15810,United Kingdom
550993,23010,CIRCUS PARADE BABY GIFT SET,1,4/21/2011 19:51,16.95,15810,United Kingdom
550993,23008,DOLLY GIRL BABY GIFT SET,1,4/21/2011 19:51,16.95,15810,United Kingdom
550993,23009,I LOVE LONDON BABY GIFT SET,1,4/21/2011 19:51,16.95,15810,United Kingdom
550993,23254,CHILDRENS CUTLERY DOLLY GIRL ,4,4/21/2011 19:51,4.15,15810,United Kingdom
550993,23201,JUMBO BAG ALPHABET,10,4/21/2011 19:51,2.08,15810,United Kingdom
550993,23205,CHARLOTTE BAG VINTAGE ALPHABET ,10,4/21/2011 19:51,0.85,15810,United Kingdom
550993,23206,LUNCH BAG APPLE DESIGN,10,4/21/2011 19:51,1.65,15810,United Kingdom
550993,23207,LUNCH BAG ALPHABET DESIGN,10,4/21/2011 19:51,1.65,15810,United Kingdom
550993,23208,LUNCH BAG VINTAGE LEAF DESIGN,10,4/21/2011 19:51,1.65,15810,United Kingdom
550993,21931,JUMBO STORAGE BAG SUKI,10,4/21/2011 19:51,2.08,15810,United Kingdom
550993,22386,JUMBO BAG PINK POLKADOT,10,4/21/2011 19:51,2.08,15810,United Kingdom
550993,22355,CHARLOTTE BAG SUKI DESIGN,10,4/21/2011 19:51,0.85,15810,United Kingdom
550993,22379,RECYCLING BAG RETROSPOT ,10,4/21/2011 19:51,2.1,15810,United Kingdom
550993,22381,TOY TIDY PINK POLKADOT,10,4/21/2011 19:51,2.1,15810,United Kingdom
550993,22380,TOY TIDY SPACEBOY  ,5,4/21/2011 19:51,2.1,15810,United Kingdom
550993,22664,TOY TIDY DOLLY GIRL DESIGN,5,4/21/2011 19:51,2.1,15810,United Kingdom
550993,22383,LUNCH BAG SUKI DESIGN ,10,4/21/2011 19:51,1.65,15810,United Kingdom
550993,22384,LUNCH BAG PINK POLKADOT,10,4/21/2011 19:51,1.65,15810,United Kingdom
550993,20727,LUNCH BAG  BLACK SKULL.,10,4/21/2011 19:51,1.65,15810,United Kingdom
550993,22631,CIRCUS PARADE LUNCH BOX ,12,4/21/2011 19:51,1.95,15810,United Kingdom
550993,22659,LUNCH BOX I LOVE LONDON,12,4/21/2011 19:51,1.95,15810,United Kingdom
550993,21238,RED RETROSPOT CUP,8,4/21/2011 19:51,0.85,15810,United Kingdom
550993,21239,PINK  POLKADOT CUP,8,4/21/2011 19:51,0.85,15810,United Kingdom
550993,21240,BLUE POLKADOT CUP,8,4/21/2011 19:51,0.85,15810,United Kingdom
550993,21245,GREEN POLKADOT PLATE ,8,4/21/2011 19:51,1.69,15810,United Kingdom
550993,20677,PINK POLKADOT BOWL,8,4/21/2011 19:51,1.25,15810,United Kingdom
550993,20676,RED RETROSPOT BOWL,8,4/21/2011 19:51,1.25,15810,United Kingdom
550993,84596B,SMALL DOLLY MIX DESIGN ORANGE BOWL,24,4/21/2011 19:51,0.42,15810,United Kingdom
550993,84596F,SMALL MARSHMALLOWS PINK BOWL,24,4/21/2011 19:51,0.42,15810,United Kingdom
550993,21244,BLUE POLKADOT PLATE ,8,4/21/2011 19:51,1.69,15810,United Kingdom
550994,22499,WOODEN UNION JACK BUNTING,2,4/21/2011 19:55,5.95,14562,United Kingdom
550994,22178,VICTORIAN GLASS HANGING T-LIGHT,12,4/21/2011 19:55,1.25,14562,United Kingdom
550994,82486,WOOD S/3 CABINET ANT WHITE FINISH,1,4/21/2011 19:55,8.95,14562,United Kingdom
550994,47566,PARTY BUNTING,5,4/21/2011 19:55,4.95,14562,United Kingdom
550994,21239,PINK  POLKADOT CUP,12,4/21/2011 19:55,0.85,14562,United Kingdom
550994,21238,RED RETROSPOT CUP,12,4/21/2011 19:55,0.85,14562,United Kingdom
550994,21240,BLUE POLKADOT CUP,12,4/21/2011 19:55,0.85,14562,United Kingdom
550994,22260,FELT EGG COSY BLUE RABBIT ,1,4/21/2011 19:55,0.85,14562,United Kingdom
550994,22231,JIGSAW TREE WITH BIRDHOUSE,1,4/21/2011 19:55,1.45,14562,United Kingdom
550994,22894,TABLECLOTH RED APPLES DESIGN ,2,4/21/2011 19:55,9.95,14562,United Kingdom
550994,22897,OVEN MITT APPLES DESIGN,4,4/21/2011 19:55,1.45,14562,United Kingdom
550994,82583,HOT BATHS METAL SIGN,5,4/21/2011 19:55,2.1,14562,United Kingdom
550994,20677,PINK POLKADOT BOWL,12,4/21/2011 19:55,1.25,14562,United Kingdom
550994,20676,RED RETROSPOT BOWL,12,4/21/2011 19:55,1.25,14562,United Kingdom
550994,20675,BLUE POLKADOT BOWL,12,4/21/2011 19:55,1.25,14562,United Kingdom
550994,20674,GREEN POLKADOT BOWL,12,4/21/2011 19:55,1.25,14562,United Kingdom
550994,21244,BLUE POLKADOT PLATE ,12,4/21/2011 19:55,1.69,14562,United Kingdom
550994,21242,RED RETROSPOT PLATE ,12,4/21/2011 19:55,1.69,14562,United Kingdom
550994,21245,GREEN POLKADOT PLATE ,12,4/21/2011 19:55,1.69,14562,United Kingdom
550994,21770,OPEN CLOSED METAL SIGN,4,4/21/2011 19:55,4.95,14562,United Kingdom
550994,82583,HOT BATHS METAL SIGN,6,4/21/2011 19:55,2.1,14562,United Kingdom
550994,84970L,SINGLE HEART ZINC T-LIGHT HOLDER,12,4/21/2011 19:55,0.95,14562,United Kingdom
550994,84970S,HANGING HEART ZINC T-LIGHT HOLDER,12,4/21/2011 19:55,0.85,14562,United Kingdom
550994,85066,CREAM SWEETHEART MINI CHEST,2,4/21/2011 19:55,12.75,14562,United Kingdom
550994,22671,FRENCH LAUNDRY SIGN BLUE METAL,6,4/21/2011 19:55,1.65,14562,United Kingdom
550994,22674,FRENCH TOILET SIGN BLUE METAL,3,4/21/2011 19:55,1.25,14562,United Kingdom
550994,82551,LAUNDRY 15C METAL SIGN,5,4/21/2011 19:55,1.45,14562,United Kingdom
550994,21243,PINK  POLKADOT PLATE ,12,4/21/2011 19:55,1.69,14562,United Kingdom
550994,23199,JUMBO BAG APPLES,2,4/21/2011 19:55,2.08,14562,United Kingdom
550994,22090,PAPER BUNTING RETROSPOT,3,4/21/2011 19:55,2.95,14562,United Kingdom
550994,22666,RECIPE BOX PANTRY YELLOW DESIGN,3,4/21/2011 19:55,2.95,14562,United Kingdom
550994,20726,LUNCH BAG WOODLAND,3,4/21/2011 19:55,1.65,14562,United Kingdom
550994,71459,HANGING JAM JAR T-LIGHT HOLDER,12,4/21/2011 19:55,0.85,14562,United Kingdom
550994,85066,CREAM SWEETHEART MINI CHEST,2,4/21/2011 19:55,12.75,14562,United Kingdom
550994,23145,ZINC T-LIGHT HOLDER STAR LARGE,24,4/21/2011 19:55,0.95,14562,United Kingdom
550994,23144,ZINC T-LIGHT HOLDER STARS SMALL,24,4/21/2011 19:55,0.83,14562,United Kingdom
550994,23206,LUNCH BAG APPLE DESIGN,3,4/21/2011 19:55,1.65,14562,United Kingdom
550995,85132A,CHARLIE + LOLA BISCUITS TINS,12,4/26/2011 8:33,1.95,16722,United Kingdom
550995,85132C,CHARLIE AND LOLA FIGURES TINS,12,4/26/2011 8:33,1.95,16722,United Kingdom
550995,20728,LUNCH BAG CARS BLUE,30,4/26/2011 8:33,1.65,16722,United Kingdom
550995,22383,LUNCH BAG SUKI DESIGN ,30,4/26/2011 8:33,1.65,16722,United Kingdom
550995,23206,LUNCH BAG APPLE DESIGN,30,4/26/2011 8:33,1.65,16722,United Kingdom
550995,22382,LUNCH BAG SPACEBOY DESIGN ,30,4/26/2011 8:33,1.65,16722,United Kingdom
550995,20727,LUNCH BAG  BLACK SKULL.,30,4/26/2011 8:33,1.65,16722,United Kingdom
550995,20726,LUNCH BAG WOODLAND,30,4/26/2011 8:33,1.65,16722,United Kingdom
550995,21495,SKULLS AND CROSSBONES WRAP,25,4/26/2011 8:33,0.42,16722,United Kingdom
550995,22437,SET OF 9 BLACK SKULL BALLOONS,20,4/26/2011 8:33,0.85,16722,United Kingdom
550995,22333,RETROSPOT PARTY BAG + STICKER SET,8,4/26/2011 8:33,1.65,16722,United Kingdom
550995,22331,WOODLAND PARTY BAG + STICKER SET,8,4/26/2011 8:33,1.65,16722,United Kingdom
550995,22332,SKULLS PARTY BAG + STICKER SET,8,4/26/2011 8:33,1.65,16722,United Kingdom
550995,22334,DINOSAUR PARTY BAG + STICKER SET,8,4/26/2011 8:33,1.65,16722,United Kingdom
550995,22704,WRAP RED APPLES ,25,4/26/2011 8:33,0.42,16722,United Kingdom
550995,20723,STRAWBERRY CHARLOTTE BAG,10,4/26/2011 8:33,0.85,16722,United Kingdom
550995,20724,RED RETROSPOT CHARLOTTE BAG,10,4/26/2011 8:33,0.85,16722,United Kingdom
550996,22659,LUNCH BOX I LOVE LONDON,36,4/26/2011 8:57,1.95,16681,United Kingdom
550996,22900, SET 2 TEA TOWELS I LOVE LONDON ,12,4/26/2011 8:57,3.25,16681,United Kingdom
550996,22971,QUEENS GUARD COFFEE MUG,24,4/26/2011 8:57,2.55,16681,United Kingdom
550996,22970,LONDON BUS COFFEE MUG,24,4/26/2011 8:57,2.55,16681,United Kingdom
550996,22616,PACK OF 12 LONDON TISSUES ,96,4/26/2011 8:57,0.29,16681,United Kingdom
550996,23002,TRAVEL CARD WALLET SKULLS,24,4/26/2011 8:57,0.42,16681,United Kingdom
550996,21544,SKULLS  WATER TRANSFER TATTOOS ,24,4/26/2011 8:57,0.85,16681,United Kingdom
550996,21224,SET/4 SKULL BADGES,20,4/26/2011 8:57,1.25,16681,United Kingdom
550997,23201,JUMBO BAG ALPHABET,10,4/26/2011 9:04,2.08,17735,United Kingdom
550997,23206,LUNCH BAG APPLE DESIGN,10,4/26/2011 9:04,1.65,17735,United Kingdom
550997,23208,LUNCH BAG VINTAGE LEAF DESIGN,10,4/26/2011 9:04,1.65,17735,United Kingdom
550997,23199,JUMBO BAG APPLES,10,4/26/2011 9:04,2.08,17735,United Kingdom
550997,21088,SET/6 FRUIT SALAD PAPER CUPS,24,4/26/2011 9:04,0.19,17735,United Kingdom
550997,21096,SET/6 FRUIT SALAD  PAPER PLATES,24,4/26/2011 9:04,0.39,17735,United Kingdom
550997,21090,SET/6 COLLAGE PAPER PLATES,24,4/26/2011 9:04,0.39,17735,United Kingdom
550997,21403,BLUE EGG  SPOON,24,4/26/2011 9:04,0.12,17735,United Kingdom
550997,21932,SCANDINAVIAN PAISLEY PICNIC BAG,10,4/26/2011 9:04,1.65,17735,United Kingdom
550997,21933,PINK VINTAGE PAISLEY PICNIC BAG,10,4/26/2011 9:04,1.65,17735,United Kingdom
550997,22993,SET OF 4 PANTRY JELLY MOULDS,12,4/26/2011 9:04,1.25,17735,United Kingdom
