545895,21790,VINTAGE SNAP CARDS,1,3/7/2011 17:14,1.63,,United Kingdom
545895,21820,GLITTER HEART GARLAND WITH BELLS ,1,3/7/2011 17:14,7.46,,United Kingdom
545895,21874,GIN AND TONIC MUG,1,3/7/2011 17:14,3.29,,United Kingdom
545895,21898,POTTING SHED ROSE CANDLE,2,3/7/2011 17:14,2.46,,United Kingdom
545895,21900,"KEY FOB , SHED",1,3/7/2011 17:14,1.63,,United Kingdom
545895,21905,MORE BUTTER METAL SIGN ,1,3/7/2011 17:14,1.63,,United Kingdom
545895,21928,JUMBO BAG SCANDINAVIAN BLUE PAISLEY,1,3/7/2011 17:14,4.13,,United Kingdom
545895,21931,JUMBO STORAGE BAG SUKI,1,3/7/2011 17:14,4.13,,United Kingdom
545895,21974,SET OF 36 PAISLEY FLOWER DOILIES,1,3/7/2011 17:14,2.92,,United Kingdom
545895,21977,PACK OF 60 PINK PAISLEY CAKE CASES,1,3/7/2011 17:14,1.25,,United Kingdom
545895,21990,MODERN FLORAL STATIONERY SET,1,3/7/2011 17:14,2.46,,United Kingdom
545895,21992,VINTAGE PAISLEY STATIONERY SET,1,3/7/2011 17:14,2.46,,United Kingdom
545895,21993,FLORAL FOLK STATIONERY SET,1,3/7/2011 17:14,2.46,,United Kingdom
545895,22064,PINK DOUGHNUT TRINKET POT ,11,3/7/2011 17:14,3.29,,United Kingdom
545895,22090,PAPER BUNTING RETROSPOT,2,3/7/2011 17:14,5.79,,United Kingdom
545895,22101,MIRROR MOSAIC VOTIVE HOLDER,12,3/7/2011 17:14,2.46,,United Kingdom
545895,22114,HOT WATER BOTTLE TEA AND SYMPATHY,1,3/7/2011 17:14,3.95,,United Kingdom
545895,22178,VICTORIAN GLASS HANGING T-LIGHT,2,3/7/2011 17:14,2.46,,United Kingdom
545895,22182,CAKE STAND VICTORIAN FILIGREE SMALL,1,3/7/2011 17:14,4.13,,United Kingdom
545895,22183,CAKE STAND VICTORIAN FILIGREE MED,1,3/7/2011 17:14,5.79,,United Kingdom
545895,22195,LARGE HEART MEASURING SPOONS,1,3/7/2011 17:14,3.29,,United Kingdom
545895,22196,SMALL HEART MEASURING SPOONS,1,3/7/2011 17:14,1.63,,United Kingdom
545895,22219,LOVEBIRD HANGING DECORATION WHITE ,2,3/7/2011 17:14,1.63,,United Kingdom
545895,22228,BUNNY WOODEN PAINTED WITH BIRD ,2,3/7/2011 17:14,1.63,,United Kingdom
545895,22229,BUNNY WOODEN PAINTED WITH FLOWER ,2,3/7/2011 17:14,1.63,,United Kingdom
545895,22230,JIGSAW TREE WITH WATERING CAN,1,3/7/2011 17:14,1.63,,United Kingdom
545895,22241,GARLAND WOODEN HAPPY EASTER,1,3/7/2011 17:14,2.46,,United Kingdom
545895,22243,5 HOOK HANGER RED MAGIC TOADSTOOL,1,3/7/2011 17:14,3.29,,United Kingdom
545895,22245,"HOOK, 1 HANGER ,MAGIC GARDEN",2,3/7/2011 17:14,1.63,,United Kingdom
545895,22276,WASH BAG VINTAGE ROSE PAISLEY,1,3/7/2011 17:14,5.79,,United Kingdom
545895,22277,COSMETIC BAG VINTAGE ROSE PAISLEY,1,3/7/2011 17:14,4.13,,United Kingdom
545895,22278,OVERNIGHT BAG VINTAGE ROSE PAISLEY,1,3/7/2011 17:14,10.79,,United Kingdom
545895,22281,EASTER TREE YELLOW BIRDS,1,3/7/2011 17:14,12.46,,United Kingdom
545895,22285,HANGING HEN ON NEST DECORATION,1,3/7/2011 17:14,3.29,,United Kingdom
545895,22292,HANGING CHICK  YELLOW DECORATION,1,3/7/2011 17:14,2.92,,United Kingdom
545895,22293,HANGING CHICK GREEN DECORATION,1,3/7/2011 17:14,2.92,,United Kingdom
545895,22318,FIVE HEART HANGING DECORATION,1,3/7/2011 17:14,5.79,,United Kingdom
545895,22325,MOBILE VINTAGE HEARTS ,1,3/7/2011 17:14,11.63,,United Kingdom
545895,22327,ROUND SNACK BOXES SET OF 4 SKULLS,1,3/7/2011 17:14,5.79,,United Kingdom
545895,22344,PARTY PIZZA DISH PINK POLKADOT,2,3/7/2011 17:14,1.63,,United Kingdom
545895,22356,CHARLOTTE BAG PINK POLKADOT,2,3/7/2011 17:14,1.63,,United Kingdom
545895,22361,GLASS JAR DAISY FRESH COTTON WOOL,1,3/7/2011 17:14,5.79,,United Kingdom
545895,22362,GLASS JAR PEACOCK BATH SALTS,1,3/7/2011 17:14,5.79,,United Kingdom
545895,22364,GLASS JAR DIGESTIVE BISCUITS,1,3/7/2011 17:14,5.79,,United Kingdom
545895,22365,DOORMAT RESPECTABLE HOUSE,1,3/7/2011 17:14,15.79,,United Kingdom
545895,22379,RECYCLING BAG RETROSPOT ,2,3/7/2011 17:14,4.13,,United Kingdom
545895,22419,LIPSTICK PEN RED,5,3/7/2011 17:14,0.83,,United Kingdom
545895,22421,LIPSTICK PEN FUSCHIA,4,3/7/2011 17:14,0.83,,United Kingdom
545895,22460,EMBOSSED GLASS TEALIGHT HOLDER,3,3/7/2011 17:14,2.46,,United Kingdom
545895,22469,HEART OF WICKER SMALL,1,3/7/2011 17:14,1.65,,United Kingdom
545895,22470,HEART OF WICKER LARGE,1,3/7/2011 17:14,2.95,,United Kingdom
545895,22492,MINI PAINT SET VINTAGE ,1,3/7/2011 17:14,1.63,,United Kingdom
545895,22499,WOODEN UNION JACK BUNTING,1,3/7/2011 17:14,12.46,,United Kingdom
545895,22502,PICNIC BASKET WICKER SMALL,1,3/7/2011 17:14,10.79,,United Kingdom
545895,22514,CHILDS GARDEN SPADE BLUE,1,3/7/2011 17:14,4.13,,United Kingdom
545895,22515,CHILDS GARDEN SPADE PINK,1,3/7/2011 17:14,4.13,,United Kingdom
545895,22516,CHILDS GARDEN RAKE BLUE,1,3/7/2011 17:14,4.13,,United Kingdom
545895,22517,CHILDS GARDEN RAKE PINK,1,3/7/2011 17:14,4.13,,United Kingdom
545895,22518,CHILDS GARDEN BRUSH BLUE,1,3/7/2011 17:14,4.13,,United Kingdom
545895,22519,CHILDS GARDEN BRUSH PINK,1,3/7/2011 17:14,4.13,,United Kingdom
545895,22520,CHILDS GARDEN TROWEL BLUE ,1,3/7/2011 17:14,1.63,,United Kingdom
545895,22521,CHILDS GARDEN TROWEL PINK,1,3/7/2011 17:14,1.63,,United Kingdom
545895,22522,CHILDS GARDEN FORK BLUE ,1,3/7/2011 17:14,1.63,,United Kingdom
545895,22523,CHILDS GARDEN FORK PINK,1,3/7/2011 17:14,1.63,,United Kingdom
545895,22524,CHILDRENS GARDEN GLOVES BLUE,1,3/7/2011 17:14,2.46,,United Kingdom
545895,22525,CHILDRENS GARDEN GLOVES PINK,1,3/7/2011 17:14,2.46,,United Kingdom
545895,22558,CLOTHES PEGS RETROSPOT PACK 24 ,1,3/7/2011 17:14,3.29,,United Kingdom
545895,22625,RED KITCHEN SCALES,1,3/7/2011 17:14,8.5,,United Kingdom
545895,22626,BLACK KITCHEN SCALES,1,3/7/2011 17:14,16.63,,United Kingdom
545895,22631,CIRCUS PARADE LUNCH BOX ,1,3/7/2011 17:14,4.13,,United Kingdom
545895,22663,JUMBO BAG DOLLY GIRL DESIGN,1,3/7/2011 17:14,4.13,,United Kingdom
545895,22664,TOY TIDY DOLLY GIRL DESIGN,1,3/7/2011 17:14,4.13,,United Kingdom
545895,22666,RECIPE BOX PANTRY YELLOW DESIGN,1,3/7/2011 17:14,5.79,,United Kingdom
545895,22678,FRENCH BLUE METAL DOOR SIGN 3,3,3/7/2011 17:14,2.46,,United Kingdom
545895,22681,FRENCH BLUE METAL DOOR SIGN 6,1,3/7/2011 17:14,2.46,,United Kingdom
545895,22697,GREEN REGENCY TEACUP AND SAUCER,1,3/7/2011 17:14,5.79,,United Kingdom
545895,22698,PINK REGENCY TEACUP AND SAUCER,1,3/7/2011 17:14,5.79,,United Kingdom
545895,22716,CARD CIRCUS PARADE,1,3/7/2011 17:14,0.83,,United Kingdom
545895,22722,SET OF 6 SPICE TINS PANTRY DESIGN,1,3/7/2011 17:14,8.29,,United Kingdom
545895,22728,ALARM CLOCK BAKELIKE PINK,1,3/7/2011 17:14,7.46,,United Kingdom
545895,22763,KEY CABINET MA CAMPAGNE,1,3/7/2011 17:14,19.96,,United Kingdom
545895,22781,GUMBALL MAGAZINE RACK,1,3/7/2011 17:14,14.96,,United Kingdom
545895,22786,CUSHION COVER PINK UNION JACK,1,3/7/2011 17:14,15.79,,United Kingdom
545895,22798,ANTIQUE GLASS DRESSING TABLE POT,2,3/7/2011 17:14,5.79,,United Kingdom
545895,22800,ANTIQUE TALL SWIRLGLASS TRINKET POT,3,3/7/2011 17:14,7.46,,United Kingdom
545895,22817,CARD SUKI BIRTHDAY,1,3/7/2011 17:14,0.83,,United Kingdom
545895,22822,CREAM WALL PLANTER HEART SHAPED,1,3/7/2011 17:14,12.46,,United Kingdom
545895,22856,ASSORTED EASTER DECORATIONS  BELLS,1,3/7/2011 17:14,15.79,,United Kingdom
545895,22857,ASSORTED EASTER GIFT TAGS,1,3/7/2011 17:14,10.79,,United Kingdom
545895,22859,EASTER TIN BUNNY BOUQUET,6,3/7/2011 17:14,3.29,,United Kingdom
545895,22860,EASTER TIN CHICKS PINK DAISY,1,3/7/2011 17:14,3.29,,United Kingdom
545895,22897,OVEN MITT APPLES DESIGN,1,3/7/2011 17:14,2.92,,United Kingdom
545895,22933,BAKING MOULD EASTER EGG MILK CHOC,1,3/7/2011 17:14,5.79,,United Kingdom
545895,84029G,KNITTED UNION FLAG HOT WATER BOTTLE,1,3/7/2011 17:14,7.46,,United Kingdom
545895,84031A,CHARLIE+LOLA RED HOT WATER BOTTLE ,1,3/7/2011 17:14,4.13,,United Kingdom
545895,84031B,CHARLIE LOLA BLUE HOT WATER BOTTLE ,1,3/7/2011 17:14,4.13,,United Kingdom
545895,84459B,YELLOW METAL CHICKEN HEART ,1,3/7/2011 17:14,3.29,,United Kingdom
545895,84631,FRUIT TREE AND BIRDS WALL PLAQUE,2,3/7/2011 17:14,7.46,,United Kingdom
545895,84796A,PINK HAWAIIAN PICNIC HAMPER FOR 2,1,3/7/2011 17:14,8.29,,United Kingdom
545895,84796B,BLUE SAVANNAH PICNIC HAMPER FOR 2,1,3/7/2011 17:14,8.29,,United Kingdom
545895,84849B,FAIRY SOAP SOAP HOLDER,1,3/7/2011 17:14,3.29,,United Kingdom
545895,84849D,HOT BATHS SOAP HOLDER,1,3/7/2011 17:14,3.29,,United Kingdom
545895,84879,ASSORTED COLOUR BIRD ORNAMENT,8,3/7/2011 17:14,3.12,,United Kingdom
545895,84946,ANTIQUE SILVER TEA GLASS ETCHED,4,3/7/2011 17:14,2.46,,United Kingdom
545895,84970L,SINGLE HEART ZINC T-LIGHT HOLDER,1,3/7/2011 17:14,2.08,,United Kingdom
545895,84970S,HANGING HEART ZINC T-LIGHT HOLDER,1,3/7/2011 17:14,2.08,,United Kingdom
545895,84978,HANGING HEART JAR T-LIGHT HOLDER,5,3/7/2011 17:14,2.46,,United Kingdom
545895,84992,72 SWEETHEART FAIRY CAKE CASES,3,3/7/2011 17:14,1.25,,United Kingdom
545895,85039A,SET/4 RED MINI ROSE CANDLE IN BOWL,2,3/7/2011 17:14,1.63,,United Kingdom
545895,85039C,S/4 BLACK MINI ROSE CANDLE IN BOWL,1,3/7/2011 17:14,1.63,,United Kingdom
545895,85053,FRENCH ENAMEL CANDLEHOLDER,1,3/7/2011 17:14,4.13,,United Kingdom
545895,85066,CREAM SWEETHEART MINI CHEST,1,3/7/2011 17:14,24.96,,United Kingdom
545895,85099B,JUMBO BAG RED RETROSPOT,1,3/7/2011 17:14,4.13,,United Kingdom
545895,85131A,BEADED PEARL HEART WHITE ON STICK,4,3/7/2011 17:14,0.83,,United Kingdom
545895,85131B,BEADED CRYSTAL HEART GREEN ON STICK,3,3/7/2011 17:14,0.83,,United Kingdom
545895,85131D,BEADED CRYSTAL HEART PINK ON STICK,4,3/7/2011 17:14,0.83,,United Kingdom
545895,85150,LADIES & GENTLEMEN METAL SIGN,1,3/7/2011 17:14,4.96,,United Kingdom
545895,85169C,EAU DE NIL LOVE BIRD CANDLE,1,3/7/2011 17:14,2.46,,United Kingdom
545895,85169D,PINK LOVE BIRD CANDLE,1,3/7/2011 17:14,2.46,,United Kingdom
545895,85176,SEWING SUSAN 21 NEEDLE SET,70,3/7/2011 17:14,0.85,,United Kingdom
545895,85178,VICTORIAN SEWING KIT,1,3/7/2011 17:14,2.46,,United Kingdom
545895,85199S,SMALL HANGING IVORY/RED WOOD BIRD,1,3/7/2011 17:14,0.83,,United Kingdom
545895,85215,ASSORTED CHEESE FRIDGE MAGNETS,6,3/7/2011 17:14,1.24,,United Kingdom
545895,90116,FRUIT SALAD BAG CHARM,1,3/7/2011 17:14,2.46,,United Kingdom
545895,90129A,PINK GLASS TASSLE BAG CHARM ,13,3/7/2011 17:14,1.63,,United Kingdom
545895,90201C,RED ENAMEL FLOWER RING,1,3/7/2011 17:14,2.9,,United Kingdom
545895,90201D,GREEN ENAMEL FLOWER RING,1,3/7/2011 17:14,2.9,,United Kingdom
545895,gift_0001_10,Dotcomgiftshop Gift Voucher £10.00,1,3/7/2011 17:14,8.33,,United Kingdom
545895,DOT,DOTCOM POSTAGE,1,3/7/2011 17:14,249.02,,United Kingdom
545895,85123A,WHITE HANGING HEART T-LIGHT HOLDER,9,3/7/2011 17:14,2.95,,United Kingdom
545895,22423,REGENCY CAKESTAND 3 TIER,7,3/7/2011 17:14,12.75,,United Kingdom
545895,22934,BAKING MOULD EASTER EGG WHITE CHOC,1,3/7/2011 17:14,5.79,,United Kingdom
545895,22954,HEN PARTY CORDON BARRIER TAPE,1,3/7/2011 17:14,2.46,,United Kingdom
545895,22957,SET 3 PAPER VINTAGE CHICK PAPER EGG,1,3/7/2011 17:14,5.79,,United Kingdom
545895,22960,JAM MAKING SET WITH JARS,4,3/7/2011 17:14,8.29,,United Kingdom
545895,22961,JAM MAKING SET PRINTED,2,3/7/2011 17:14,3.29,,United Kingdom
545895,22963,JAM JAR WITH GREEN LID,1,3/7/2011 17:14,1.63,,United Kingdom
545895,22967,SET 3 SONG BIRD PAPER EGGS ASSORTED,1,3/7/2011 17:14,5.79,,United Kingdom
545895,22969,HOMEMADE JAM SCENTED CANDLES,3,3/7/2011 17:14,3.29,,United Kingdom
545895,22978,PANTRY ROLLING PIN,1,3/7/2011 17:14,7.46,,United Kingdom
545895,22979,PANTRY WASHING UP BRUSH,3,3/7/2011 17:14,2.92,,United Kingdom
545895,22980,PANTRY SCRUBBING BRUSH,2,3/7/2011 17:14,3.29,,United Kingdom
545895,22982,PANTRY PASTRY BRUSH,1,3/7/2011 17:14,2.46,,United Kingdom
545895,22983,CARD BILLBOARD FONT,2,3/7/2011 17:14,0.83,,United Kingdom
545895,22988,SOLDIERS EGG CUP ,2,3/7/2011 17:14,1.25,,United Kingdom
545895,22993,SET OF 4 PANTRY JELLY MOULDS,10,3/7/2011 17:14,2.46,,United Kingdom
545895,22996,TRAVEL CARD WALLET VINTAGE TICKET,1,3/7/2011 17:14,0.83,,United Kingdom
545895,22997,TRAVEL CARD WALLET UNION JACK,1,3/7/2011 17:14,0.83,,United Kingdom
545895,23000,TRAVEL CARD WALLET TRANSPORT,1,3/7/2011 17:14,0.83,,United Kingdom
545895,23002,TRAVEL CARD WALLET SKULLS,1,3/7/2011 17:14,0.83,,United Kingdom
545895,23004,TRAVEL CARD WALLET PANTRY,1,3/7/2011 17:14,0.83,,United Kingdom
545895,23006,TRAVEL CARD WALLET FLOWER MEADOW,1,3/7/2011 17:14,0.83,,United Kingdom
545895,23053,RECYCLED ACAPULCO MAT PINK,1,3/7/2011 17:14,16.63,,United Kingdom
545895,23182,TOILET SIGN OCCUPIED OR VACANT,1,3/7/2011 17:14,2.5,,United Kingdom
545895,23184,BULL DOG BOTTLE OPENER,1,3/7/2011 17:14,9.96,,United Kingdom
545895,23193,BUFFALO BILL TREASURE BOOK BOX,1,3/7/2011 17:14,4.58,,United Kingdom
545895,35471D,SET OF 3 BIRD LIGHT PINK FEATHER ,4,3/7/2011 17:14,2.46,,United Kingdom
545895,35915B,BLUE KNITTED HEN ,7,3/7/2011 17:14,0.83,,United Kingdom
545895,35915C,PEACH KNITTED HEN ,8,3/7/2011 17:14,0.83,,United Kingdom
545895,47367B,PAIR PADDED HANGERS PINK CHECK,2,3/7/2011 17:14,3.29,,United Kingdom
545895,47566,PARTY BUNTING,4,3/7/2011 17:14,4.96,,United Kingdom
545895,48111,DOORMAT 3 SMILEY CATS,1,3/7/2011 17:14,15.79,,United Kingdom
545895,48138,DOORMAT UNION FLAG,1,3/7/2011 17:14,15.79,,United Kingdom
545895,48185,DOORMAT FAIRY CAKE,2,3/7/2011 17:14,15.79,,United Kingdom
545895,48188,DOORMAT WELCOME PUPPIES,1,3/7/2011 17:14,15.79,,United Kingdom
545895,71053,WHITE METAL LANTERN,5,3/7/2011 17:14,8.29,,United Kingdom
545895,71143,SILVER BOOK MARK WITH BEADS,1,3/7/2011 17:14,2.46,,United Kingdom
545895,72741,GRAND CHOCOLATECANDLE,3,3/7/2011 17:14,2.76,,United Kingdom
545895,72801C,4 ROSE PINK DINNER CANDLES,1,3/7/2011 17:14,2.46,,United Kingdom
545895,72802B,OCEAN SCENT CANDLE IN JEWELLED BOX,1,3/7/2011 17:14,8.29,,United Kingdom
545895,75049L,LARGE CIRCULAR MIRROR MOBILE,1,3/7/2011 17:14,2.46,,United Kingdom
545895,79066K,RETRO MOD TRAY,1,3/7/2011 17:14,1.63,,United Kingdom
545895,82494L,WOODEN FRAME ANTIQUE WHITE ,1,3/7/2011 17:14,7.46,,United Kingdom
545895,82567,"AIRLINE LOUNGE,METAL SIGN",1,3/7/2011 17:14,1.63,,United Kingdom
545895,82583,HOT BATHS METAL SIGN,1,3/7/2011 17:14,4.13,,United Kingdom
545895,82613B,"METAL SIGN,CUPCAKE SINGLE HOOK",1,3/7/2011 17:14,2.46,,United Kingdom
545895,82613C,"METAL SIGN,CUPCAKE SINGLE HOOK",1,3/7/2011 17:14,2.46,,United Kingdom
545895,84029E,RED WOOLLY HOTTIE WHITE HEART.,1,3/7/2011 17:14,7.46,,United Kingdom
545896,21495,SKULLS AND CROSSBONES WRAP,25,3/7/2011 17:19,0.42,15869,United Kingdom
545896,71477,COLOUR GLASS. STAR T-LIGHT HOLDER,1,3/7/2011 17:19,3.25,15869,United Kingdom
545896,21504,SKULLS GREETING CARD,84,3/7/2011 17:19,0.36,15869,United Kingdom
545896,21250,SET OF SKULL WALL STICKERS,4,3/7/2011 17:19,2.95,15869,United Kingdom
545896,22650,CERAMIC PIRATE CHEST MONEY BANK,4,3/7/2011 17:19,1.45,15869,United Kingdom
545897,21108,FAIRY CAKE FLANNEL ASSORTED COLOUR,1,3/7/2011 17:22,4.96,,United Kingdom
545897,21121,SET/10 RED POLKADOT PARTY CANDLES,1,3/7/2011 17:22,2.46,,United Kingdom
545897,21143,ANTIQUE GLASS HEART DECORATION ,1,3/7/2011 17:22,4.13,,United Kingdom
545897,21154,RED RETROSPOT OVEN GLOVE ,3,3/7/2011 17:22,2.46,,United Kingdom
545897,21159,MOODY BOY  DOOR HANGER ,1,3/7/2011 17:22,3.29,,United Kingdom
545897,21206,STRAWBERRY HONEYCOMB  GARLAND ,1,3/7/2011 17:22,3.29,,United Kingdom
545897,21210,SET OF 72 RETROSPOT PAPER  DOILIES,1,3/7/2011 17:22,2.92,,United Kingdom
545897,21231,SWEETHEART CERAMIC TRINKET BOX,1,3/7/2011 17:22,2.46,,United Kingdom
545897,21232,STRAWBERRY CERAMIC TRINKET BOX,1,3/7/2011 17:22,2.46,,United Kingdom
545897,21246,RED RETROSPOT BIG BOWL,1,3/7/2011 17:22,4.13,,United Kingdom
545897,21259,VICTORIAN SEWING BOX SMALL ,1,3/7/2011 17:22,12.46,,United Kingdom
545897,21361,LOVE LARGE WOOD LETTERS ,1,3/7/2011 17:22,24.96,,United Kingdom
545897,21380,WOODEN HAPPY BIRTHDAY GARLAND,1,3/7/2011 17:22,5.79,,United Kingdom
545897,21383,PACK OF 12 STICKY BUNNIES,1,3/7/2011 17:22,1.63,,United Kingdom
545897,21394,RED POLKADOT BEAKER ,4,3/7/2011 17:22,1.63,,United Kingdom
545897,21415,CLAM SHELL SMALL ,1,3/7/2011 17:22,4.13,,United Kingdom
545897,21439,BASKET OF TOADSTOOLS,1,3/7/2011 17:22,2.46,,United Kingdom
545897,21455,PAINTED YELLOW WOODEN DAISY,4,3/7/2011 17:22,0.83,,United Kingdom
545897,21459,YELLOW EASTER EGG HUNT START POST,1,3/7/2011 17:22,4.13,,United Kingdom
545897,21460,GREEN EASTER EGG HUNT START POST,1,3/7/2011 17:22,4.13,,United Kingdom
545897,21461,BLUE EASTER EGG HUNT START POST,1,3/7/2011 17:22,4.13,,United Kingdom
545897,21508,VINTAGE KID DOLLY CARD ,1,3/7/2011 17:22,0.83,,United Kingdom
545897,21531,RED RETROSPOT SUGAR JAM BOWL,1,3/7/2011 17:22,4.96,,United Kingdom
545897,21535,RED RETROSPOT SMALL MILK JUG,1,3/7/2011 17:22,4.96,,United Kingdom
545897,21624,VINTAGE UNION JACK DOORSTOP,1,3/7/2011 17:22,11.63,,United Kingdom
545897,21626,VINTAGE UNION JACK PENNANT,2,3/7/2011 17:22,1.63,,United Kingdom
545897,21658,GLASS  BEURRE DISH,1,3/7/2011 17:22,8.29,,United Kingdom
545897,21678,PAISLEY PATTERN  STICKERS,1,3/7/2011 17:22,1.63,,United Kingdom
545897,21716,BOYS VINTAGE TIN SEASIDE BUCKET,1,3/7/2011 17:22,4.96,,United Kingdom
545897,21718,RED METAL BEACH SPADE ,1,3/7/2011 17:22,2.46,,United Kingdom
545897,21719,LOVELY BONBON STICKER SHEET,1,3/7/2011 17:22,1.63,,United Kingdom
545897,21725,SWEETIES  STICKERS,1,3/7/2011 17:22,1.63,,United Kingdom
545897,21731,RED TOADSTOOL LED NIGHT LIGHT,3,3/7/2011 17:22,3.29,,United Kingdom
545897,21749,LARGE RED RETROSPOT WINDMILL,1,3/7/2011 17:22,4.13,,United Kingdom
545897,21787,RAIN PONCHO RETROSPOT,1,3/7/2011 17:22,1.63,,United Kingdom
545897,21790,VINTAGE SNAP CARDS,2,3/7/2011 17:22,1.63,,United Kingdom
545897,21791,VINTAGE HEADS AND TAILS CARD GAME ,3,3/7/2011 17:22,2.46,,United Kingdom
545897,21820,GLITTER HEART GARLAND WITH BELLS ,1,3/7/2011 17:22,7.46,,United Kingdom
545897,21846,PINK DIAMANTE PEN IN GIFT BOX,1,3/7/2011 17:22,4.13,,United Kingdom
545897,21850,BLUE  DIAMANTE PEN IN GIFT BOX,1,3/7/2011 17:22,4.13,,United Kingdom
545897,21851,LILAC DIAMANTE PEN IN GIFT BOX,1,3/7/2011 17:22,4.13,,United Kingdom
545897,21868,POTTING SHED TEA MUG,1,3/7/2011 17:22,3.29,,United Kingdom
545897,21894,POTTING SHED SEED ENVELOPES,1,3/7/2011 17:22,2.46,,United Kingdom
545897,21896,POTTING SHED TWINE,3,3/7/2011 17:22,4.13,,United Kingdom
545897,21898,POTTING SHED ROSE CANDLE,2,3/7/2011 17:22,2.46,,United Kingdom
545897,21905,MORE BUTTER METAL SIGN ,3,3/7/2011 17:22,1.63,,United Kingdom
545897,21907,I'M ON HOLIDAY METAL SIGN,1,3/7/2011 17:22,4.13,,United Kingdom
545897,21916,SET 12 RETRO WHITE CHALK STICKS,1,3/7/2011 17:22,0.83,,United Kingdom
545897,21934,SKULL SHOULDER BAG,1,3/7/2011 17:22,3.29,,United Kingdom
545897,21936,RED RETROSPOT PICNIC BAG,1,3/7/2011 17:22,5.79,,United Kingdom
545897,21981,PACK OF 12 WOODLAND TISSUES ,2,3/7/2011 17:22,0.83,,United Kingdom
545897,21982,PACK OF 12 SUKI TISSUES ,1,3/7/2011 17:22,0.83,,United Kingdom
545897,22025,RING OF ROSES BIRTHDAY CARD,1,3/7/2011 17:22,0.83,,United Kingdom
545897,22026,BANQUET BIRTHDAY  CARD  ,1,3/7/2011 17:22,0.83,,United Kingdom
545897,22027,TEA PARTY BIRTHDAY CARD,2,3/7/2011 17:22,0.83,,United Kingdom
545897,22029,SPACEBOY BIRTHDAY CARD,1,3/7/2011 17:22,0.83,,United Kingdom
545897,22066,LOVE HEART TRINKET POT,1,3/7/2011 17:22,3.29,,United Kingdom
545897,22073,RED RETROSPOT STORAGE JAR,1,3/7/2011 17:22,7.46,,United Kingdom
545897,22091,EMPIRE TISSUE BOX,1,3/7/2011 17:22,2.46,,United Kingdom
545897,22101,MIRROR MOSAIC VOTIVE HOLDER,20,3/7/2011 17:22,2.46,,United Kingdom
545897,22113,GREY HEART HOT WATER BOTTLE,1,3/7/2011 17:22,7.46,,United Kingdom
545897,22132,RED LOVE HEART SHAPE CUP,1,3/7/2011 17:22,1.63,,United Kingdom
545897,22133,PINK LOVE HEART SHAPE CUP,1,3/7/2011 17:22,1.63,,United Kingdom
545897,22135,MINI LADLE LOVE HEART PINK,1,3/7/2011 17:22,0.83,,United Kingdom
545897,22151,PLACE SETTING WHITE HEART,2,3/7/2011 17:22,1.63,,United Kingdom
545897,22158,3 HEARTS HANGING DECORATION RUSTIC,1,3/7/2011 17:22,5.79,,United Kingdom
545897,22161,HEART DECORATION RUSTIC HANGING ,2,3/7/2011 17:22,0.79,,United Kingdom
545897,22171,3 HOOK PHOTO SHELF ANTIQUE WHITE,1,3/7/2011 17:22,16.63,,United Kingdom
545897,22178,VICTORIAN GLASS HANGING T-LIGHT,9,3/7/2011 17:22,2.46,,United Kingdom
545897,22199,FRYING PAN RED RETROSPOT,1,3/7/2011 17:22,8.29,,United Kingdom
545897,22219,LOVEBIRD HANGING DECORATION WHITE ,2,3/7/2011 17:22,1.63,,United Kingdom
545897,22227,HANGING HEART MIRROR DECORATION ,9,3/7/2011 17:22,1.25,,United Kingdom
545897,22241,GARLAND WOODEN HAPPY EASTER,4,3/7/2011 17:22,2.46,,United Kingdom
545897,22279,POCKET BAG BLUE PAISLEY RED SPOT,1,3/7/2011 17:22,2.46,,United Kingdom
545897,22284,HEN HOUSE DECORATION,1,3/7/2011 17:22,3.29,,United Kingdom
545897,22295,HEART FILIGREE DOVE LARGE,2,3/7/2011 17:22,3.29,,United Kingdom
545897,22297,HEART IVORY TRELLIS SMALL,1,3/7/2011 17:22,2.46,,United Kingdom
545897,22303,COFFEE MUG APPLES DESIGN,1,3/7/2011 17:22,4.96,,United Kingdom
545897,22321,BIRD DECORATION RED RETROSPOT,1,3/7/2011 17:22,1.63,,United Kingdom
545897,22322,BIRD DECORATION GREEN POLKADOT,1,3/7/2011 17:22,1.63,,United Kingdom
545897,22329,ROUND CONTAINER SET OF 5 RETROSPOT,1,3/7/2011 17:22,3.29,,United Kingdom
545897,22335,HEART DECORATION PAINTED ZINC ,1,3/7/2011 17:22,1.25,,United Kingdom
545897,22352,LUNCH BOX WITH CUTLERY RETROSPOT ,1,3/7/2011 17:22,4.96,,United Kingdom
545897,22359,GLASS JAR KINGS CHOICE,1,3/7/2011 17:22,5.79,,United Kingdom
545897,22360,GLASS JAR ENGLISH CONFECTIONERY,3,3/7/2011 17:22,5.79,,United Kingdom
545897,22361,GLASS JAR DAISY FRESH COTTON WOOL,1,3/7/2011 17:22,5.79,,United Kingdom
545897,22362,GLASS JAR PEACOCK BATH SALTS,1,3/7/2011 17:22,5.79,,United Kingdom
545897,22379,RECYCLING BAG RETROSPOT ,2,3/7/2011 17:22,4.13,,United Kingdom
545897,22380,TOY TIDY SPACEBOY  ,1,3/7/2011 17:22,4.13,,United Kingdom
545897,22411,JUMBO SHOPPER VINTAGE RED PAISLEY,1,3/7/2011 17:22,4.13,,United Kingdom
545897,22412,METAL SIGN NEIGHBOURHOOD WITCH ,1,3/7/2011 17:22,4.13,,United Kingdom
545897,22413,METAL SIGN TAKE IT OR LEAVE IT ,1,3/7/2011 17:22,5.79,,United Kingdom
545897,22416,SET OF 36 DOILIES SPACEBOY DESIGN ,1,3/7/2011 17:22,2.92,,United Kingdom
545897,22417,PACK OF 60 SPACEBOY CAKE CASES,1,3/7/2011 17:22,1.25,,United Kingdom
545897,22422,TOOTHPASTE TUBE PEN,1,3/7/2011 17:22,1.25,,United Kingdom
545897,22432,WATERING CAN PINK BUNNY,1,3/7/2011 17:22,4.13,,United Kingdom
545897,22435,SET OF 9 HEART SHAPED BALLOONS,2,3/7/2011 17:22,2.46,,United Kingdom
545897,22464,HANGING METAL HEART LANTERN,1,3/7/2011 17:22,3.29,,United Kingdom
545897,22469,HEART OF WICKER SMALL,8,3/7/2011 17:22,1.65,,United Kingdom
545897,22470,HEART OF WICKER LARGE,8,3/7/2011 17:22,2.95,,United Kingdom
545897,22477,WATERING CAN GARDEN MARKER,2,3/7/2011 17:22,2.46,,United Kingdom
545897,22478,BIRDHOUSE GARDEN MARKER ,2,3/7/2011 17:22,2.46,,United Kingdom
545897,22479,DAISY GARDEN MARKER,2,3/7/2011 17:22,2.46,,United Kingdom
545897,22497,SET OF 2 TINS VINTAGE BATHROOM ,1,3/7/2011 17:22,8.29,,United Kingdom
545897,22498,WOODEN REGATTA BUNTING,1,3/7/2011 17:22,12.46,,United Kingdom
545897,22499,WOODEN UNION JACK BUNTING,1,3/7/2011 17:22,12.46,,United Kingdom
545897,22502,PICNIC BASKET WICKER SMALL,1,3/7/2011 17:22,10.79,,United Kingdom
545897,22529,MAGIC DRAWING SLATE GO TO THE FAIR ,1,3/7/2011 17:22,0.83,,United Kingdom
545897,22531,MAGIC DRAWING SLATE CIRCUS PARADE  ,1,3/7/2011 17:22,0.83,,United Kingdom
545897,22549,PICTURE DOMINOES,1,3/7/2011 17:22,3.29,,United Kingdom
545897,22558,CLOTHES PEGS RETROSPOT PACK 24 ,1,3/7/2011 17:22,3.29,,United Kingdom
545897,22566,FELTCRAFT HAIRBAND PINK AND PURPLE,1,3/7/2011 17:22,1.63,,United Kingdom
545897,22602,RETROSPOT WOODEN HEART DECORATION,1,3/7/2011 17:22,1.63,,United Kingdom
545897,22613,PACK OF 20 SPACEBOY NAPKINS,1,3/7/2011 17:22,1.63,,United Kingdom
545897,22614,PACK OF 12 SPACEBOY TISSUES,1,3/7/2011 17:22,0.83,,United Kingdom
545897,22616,PACK OF 12 LONDON TISSUES ,1,3/7/2011 17:22,0.83,,United Kingdom
545897,22619,SET OF 6 SOLDIER SKITTLES,1,3/7/2011 17:22,7.46,,United Kingdom
545897,22630,DOLLY GIRL LUNCH BOX,1,3/7/2011 17:22,4.13,,United Kingdom
545897,22646,CERAMIC STRAWBERRY CAKE MONEY BANK,1,3/7/2011 17:22,3.29,,United Kingdom
545897,22647,CERAMIC LOVE HEART MONEY BANK,1,3/7/2011 17:22,3.29,,United Kingdom
545897,22662,LUNCH BAG DOLLY GIRL DESIGN,1,3/7/2011 17:22,4.13,,United Kingdom
545897,22666,RECIPE BOX PANTRY YELLOW DESIGN,1,3/7/2011 17:22,5.79,,United Kingdom
545897,22677,FRENCH BLUE METAL DOOR SIGN 2,2,3/7/2011 17:22,2.46,,United Kingdom
545897,22682,FRENCH BLUE METAL DOOR SIGN 7,1,3/7/2011 17:22,2.46,,United Kingdom
545897,22684,FRENCH BLUE METAL DOOR SIGN 9,1,3/7/2011 17:22,2.46,,United Kingdom
545897,22686,FRENCH BLUE METAL DOOR SIGN No,1,3/7/2011 17:22,2.46,,United Kingdom
545897,22692,DOORMAT WELCOME TO OUR HOME,1,3/7/2011 17:22,15.79,,United Kingdom
545897,22715,CARD WEDDING DAY,1,3/7/2011 17:22,0.83,,United Kingdom
545897,22718,CARD CAT AND TREE ,1,3/7/2011 17:22,0.83,,United Kingdom
545897,22720,SET OF 3 CAKE TINS PANTRY DESIGN ,2,3/7/2011 17:22,10.79,,United Kingdom
545897,22722,SET OF 6 SPICE TINS PANTRY DESIGN,1,3/7/2011 17:22,8.29,,United Kingdom
545897,22725,ALARM CLOCK BAKELIKE CHOCOLATE,1,3/7/2011 17:22,7.46,,United Kingdom
545897,22729,ALARM CLOCK BAKELIKE ORANGE,1,3/7/2011 17:22,7.46,,United Kingdom
545897,22740,POLKADOT PEN,2,3/7/2011 17:22,1.63,,United Kingdom
545897,22777,GLASS CLOCHE LARGE,1,3/7/2011 17:22,16.63,,United Kingdom
545897,22798,ANTIQUE GLASS DRESSING TABLE POT,2,3/7/2011 17:22,5.79,,United Kingdom
545897,22800,ANTIQUE TALL SWIRLGLASS TRINKET POT,1,3/7/2011 17:22,7.46,,United Kingdom
545897,22814,CARD PARTY GAMES ,1,3/7/2011 17:22,0.83,,United Kingdom
545897,22815,CARD PSYCHEDELIC APPLES,1,3/7/2011 17:22,0.83,,United Kingdom
545897,22835,HOT WATER BOTTLE I AM SO POORLY,1,3/7/2011 17:22,9.13,,United Kingdom
545897,22845,VINTAGE CREAM CAT FOOD CONTAINER,1,3/7/2011 17:22,12.46,,United Kingdom
545897,22855,FINE WICKER HEART ,4,3/7/2011 17:22,2.46,,United Kingdom
545897,22858,EASTER TIN KEEPSAKE,1,3/7/2011 17:22,3.29,,United Kingdom
545897,22898,CHILDRENS APRON APPLES DESIGN,1,3/7/2011 17:22,4.13,,United Kingdom
545897,22937,BAKING MOULD CHOCOLATE CUPCAKES,1,3/7/2011 17:22,4.96,,United Kingdom
