537374,72817,SET OF 2 CHRISTMAS DECOUPAGE CANDLE,1,12/6/2010 12:55,1.25,17259,United Kingdom
537374,79051A,SMOKEY GREY COLOUR D.O.F. GLASS,4,12/6/2010 12:55,0.65,17259,United Kingdom
537374,72799F,IVORY PILLAR CANDLE GOLD FLOCK,2,12/6/2010 12:55,2.95,17259,United Kingdom
537374,72817,SET OF 2 CHRISTMAS DECOUPAGE CANDLE,2,12/6/2010 12:55,1.25,17259,United Kingdom
537374,85169A,IVORY LOVE BIRD CANDLE,1,12/6/2010 12:55,1.25,17259,United Kingdom
537374,72799E,IVORY PILLAR CANDLE SILVER FLOCK,3,12/6/2010 12:55,2.95,17259,United Kingdom
537374,72800E,4 IVORY DINNER CANDLES SILVER FLOCK,6,12/6/2010 12:55,2.55,17259,United Kingdom
537374,22618,COOKING SET RETROSPOT,1,12/6/2010 12:55,9.95,17259,United Kingdom
537374,21191,LARGE WHITE HONEYCOMB PAPER BELL  ,3,12/6/2010 12:55,2.1,17259,United Kingdom
537374,22749,FELTCRAFT PRINCESS CHARLOTTE DOLL,4,12/6/2010 12:55,3.75,17259,United Kingdom
537374,10133,COLOURING PENCILS BROWN TUBE,2,12/6/2010 12:55,0.85,17259,United Kingdom
537374,21107,CREAM SLICE FLANNEL PINK SPOT ,1,12/6/2010 12:55,2.95,17259,United Kingdom
537374,22988,SOLDIERS EGG CUP ,3,12/6/2010 12:55,1.25,17259,United Kingdom
537374,22974,CHILDRENS DOLLY GIRL MUG,2,12/6/2010 12:55,1.65,17259,United Kingdom
537374,22974,CHILDRENS DOLLY GIRL MUG,1,12/6/2010 12:55,1.65,17259,United Kingdom
537374,85178,VICTORIAN SEWING KIT,1,12/6/2010 12:55,1.25,17259,United Kingdom
537374,22867,HAND WARMER BIRD DESIGN,1,12/6/2010 12:55,2.1,17259,United Kingdom
537374,22210,WOOD STAMP SET BEST WISHES,2,12/6/2010 12:55,1.65,17259,United Kingdom
537374,21738,COSY SLIPPER SHOES SMALL  RED ,1,12/6/2010 12:55,2.95,17259,United Kingdom
537374,22758,LARGE PURPLE BABUSHKA NOTEBOOK  ,1,12/6/2010 12:55,1.25,17259,United Kingdom
537374,20984,12 PENCILS TALL TUBE POSY,1,12/6/2010 12:55,0.85,17259,United Kingdom
537374,20983,12 PENCILS TALL TUBE RED RETROSPOT,1,12/6/2010 12:55,0.85,17259,United Kingdom
537374,22727,ALARM CLOCK BAKELIKE RED ,1,12/6/2010 12:55,3.75,17259,United Kingdom
537374,22421,LIPSTICK PEN FUSCHIA,3,12/6/2010 12:55,0.42,17259,United Kingdom
537374,20961,STRAWBERRY BATH SPONGE ,2,12/6/2010 12:55,1.25,17259,United Kingdom
537374,20966,SANDWICH BATH SPONGE,1,12/6/2010 12:55,1.25,17259,United Kingdom
537374,22142,CHRISTMAS CRAFT WHITE FAIRY ,1,12/6/2010 12:55,1.45,17259,United Kingdom
537374,22561,WOODEN SCHOOL COLOURING SET,5,12/6/2010 12:55,1.65,17259,United Kingdom
537374,21889,WOODEN BOX OF DOMINOES,2,12/6/2010 12:55,1.25,17259,United Kingdom
537374,22549,PICTURE DOMINOES,1,12/6/2010 12:55,1.45,17259,United Kingdom
537374,22910,PAPER CHAIN KIT VINTAGE CHRISTMAS,1,12/6/2010 12:55,2.95,17259,United Kingdom
537374,20828,GLITTER BUTTERFLY CLIPS,1,12/6/2010 12:55,2.55,17259,United Kingdom
537374,20963,APPLE BATH SPONGE,1,12/6/2010 12:55,1.25,17259,United Kingdom
537374,21106,CREAM SLICE FLANNEL CHOCOLATE SPOT ,1,12/6/2010 12:55,2.95,17259,United Kingdom
537374,22866,HAND WARMER SCOTTY DOG DESIGN,1,12/6/2010 12:55,2.1,17259,United Kingdom
537374,22865,HAND WARMER OWL DESIGN,1,12/6/2010 12:55,2.1,17259,United Kingdom
537374,22633,HAND WARMER UNION JACK,2,12/6/2010 12:55,2.1,17259,United Kingdom
537374,22556,PLASTERS IN TIN CIRCUS PARADE ,1,12/6/2010 12:55,1.65,17259,United Kingdom
537374,21912,VINTAGE SNAKES & LADDERS,2,12/6/2010 12:55,3.75,17259,United Kingdom
537374,22383,LUNCH BAG SUKI  DESIGN ,1,12/6/2010 12:55,1.65,17259,United Kingdom
537374,22620,4 TRADITIONAL SPINNING TOPS,1,12/6/2010 12:55,1.25,17259,United Kingdom
537374,21892,TRADITIONAL WOODEN CATCH CUP GAME ,1,12/6/2010 12:55,1.25,17259,United Kingdom
537374,21891,TRADITIONAL WOODEN SKIPPING ROPE,1,12/6/2010 12:55,1.25,17259,United Kingdom
537374,22816,CARD MOTORBIKE SANTA,12,12/6/2010 12:55,0.42,17259,United Kingdom
537375,18097C,WHITE TALL PORCELAIN T-LIGHT HOLDER,4,12/6/2010 12:55,2.55,17019,United Kingdom
537375,22635,CHILDS BREAKFAST SET DOLLY GIRL ,1,12/6/2010 12:55,9.95,17019,United Kingdom
537375,22634,CHILDS BREAKFAST SET SPACEBOY ,2,12/6/2010 12:55,9.95,17019,United Kingdom
537375,22748,POPPY'S PLAYHOUSE KITCHEN,3,12/6/2010 12:55,2.1,17019,United Kingdom
537375,22746,POPPY'S PLAYHOUSE LIVINGROOM ,3,12/6/2010 12:55,2.1,17019,United Kingdom
537375,22745,POPPY'S PLAYHOUSE BEDROOM ,3,12/6/2010 12:55,2.1,17019,United Kingdom
537375,22747,POPPY'S PLAYHOUSE BATHROOM,2,12/6/2010 12:55,2.1,17019,United Kingdom
537375,22466,FAIRY TALE COTTAGE NIGHTLIGHT,6,12/6/2010 12:55,1.95,17019,United Kingdom
537375,21731,RED TOADSTOOL LED NIGHT LIGHT,6,12/6/2010 12:55,1.65,17019,United Kingdom
537375,22551,PLASTERS IN TIN SPACEBOY,6,12/6/2010 12:55,1.65,17019,United Kingdom
537375,22554,PLASTERS IN TIN WOODLAND ANIMALS,3,12/6/2010 12:55,1.65,17019,United Kingdom
537375,22553,PLASTERS IN TIN SKULLS,6,12/6/2010 12:55,1.65,17019,United Kingdom
537375,21452,TOADSTOOL MONEY BOX,4,12/6/2010 12:55,2.95,17019,United Kingdom
537375,22977,DOLLY GIRL CHILDRENS EGG CUP,3,12/6/2010 12:55,1.25,17019,United Kingdom
537375,22975,SPACEBOY CHILDRENS EGG CUP,3,12/6/2010 12:55,1.25,17019,United Kingdom
537375,22029,SPACEBOY BIRTHDAY CARD,12,12/6/2010 12:55,0.42,17019,United Kingdom
537375,22537,MAGIC DRAWING SLATE DINOSAUR,3,12/6/2010 12:55,0.42,17019,United Kingdom
537375,21901,"KEY FOB , BACK DOOR ",3,12/6/2010 12:55,0.65,17019,United Kingdom
537375,21900,"KEY FOB , SHED",3,12/6/2010 12:55,0.65,17019,United Kingdom
537375,21899,"KEY FOB , GARAGE DESIGN",3,12/6/2010 12:55,0.65,17019,United Kingdom
537375,20973,12 PENCIL SMALL TUBE WOODLAND,6,12/6/2010 12:55,0.65,17019,United Kingdom
537375,20974,12 PENCILS SMALL TUBE SKULL,6,12/6/2010 12:55,0.65,17019,United Kingdom
537375,20975,12 PENCILS SMALL TUBE RED RETROSPOT,6,12/6/2010 12:55,0.65,17019,United Kingdom
537375,22533,MAGIC DRAWING SLATE BAKE A CAKE ,2,12/6/2010 12:55,0.42,17019,United Kingdom
537375,21986,PACK OF 12 PINK POLKADOT TISSUES,1,12/6/2010 12:55,0.29,17019,United Kingdom
537375,21982,PACK OF 12 SUKI TISSUES ,6,12/6/2010 12:55,0.29,17019,United Kingdom
537375,21986,PACK OF 12 PINK POLKADOT TISSUES,5,12/6/2010 12:55,0.29,17019,United Kingdom
537375,22563,HAPPY STENCIL CRAFT,3,12/6/2010 12:55,1.25,17019,United Kingdom
537375,22562,MONSTERS STENCIL CRAFT,3,12/6/2010 12:55,1.25,17019,United Kingdom
537375,84991,60 TEATIME FAIRY CAKE CASES,6,12/6/2010 12:55,0.55,17019,United Kingdom
537375,21975,PACK OF 60 DINOSAUR CAKE CASES,6,12/6/2010 12:55,0.55,17019,United Kingdom
537375,21976,PACK OF 60 MUSHROOM CAKE CASES,3,12/6/2010 12:55,0.55,17019,United Kingdom
537375,21213,PACK OF 72 SKULL CAKE CASES,6,12/6/2010 12:55,0.55,17019,United Kingdom
537375,70007,HI TEC ALPINE HAND WARMER,6,12/6/2010 12:55,1.65,17019,United Kingdom
537375,22964,3 PIECE SPACEBOY COOKIE CUTTER SET,2,12/6/2010 12:55,2.1,17019,United Kingdom
537375,84997B,RED 3 PIECE RETROSPOT CUTLERY SET,2,12/6/2010 12:55,3.75,17019,United Kingdom
537375,84997D,PINK 3 PIECE POLKADOT CUTLERY SET,2,12/6/2010 12:55,3.75,17019,United Kingdom
537375,84997C,BLUE 3 PIECE POLKADOT CUTLERY SET,2,12/6/2010 12:55,3.75,17019,United Kingdom
537375,84997A,GREEN 3 PIECE POLKADOT CUTLERY SET,2,12/6/2010 12:55,3.75,17019,United Kingdom
537375,22898,CHILDRENS APRON APPLES DESIGN,2,12/6/2010 12:55,1.95,17019,United Kingdom
537375,21579,LOLITA  DESIGN  COTTON TOTE BAG,1,12/6/2010 12:55,2.25,17019,United Kingdom
537375,22086,PAPER CHAIN KIT 50'S CHRISTMAS ,2,12/6/2010 12:55,2.95,17019,United Kingdom
537375,22328,ROUND SNACK BOXES SET OF 4 FRUITS ,1,12/6/2010 12:55,2.95,17019,United Kingdom
537375,22629,SPACEBOY LUNCH BOX ,1,12/6/2010 12:55,1.95,17019,United Kingdom
537375,22633,HAND WARMER UNION JACK,20,12/6/2010 12:55,2.1,17019,United Kingdom
537375,22632,HAND WARMER RED RETROSPOT,20,12/6/2010 12:55,2.1,17019,United Kingdom
537375,22168,ORGANISER WOOD ANTIQUE WHITE ,1,12/6/2010 12:55,8.5,17019,United Kingdom
537375,21098,CHRISTMAS TOILET ROLL,20,12/6/2010 12:55,1.25,17019,United Kingdom
537375,21464,DISCO BALL ROTATOR BATTERY OPERATED,1,12/6/2010 12:55,4.25,17019,United Kingdom
C537373,22423,REGENCY CAKESTAND 3 TIER,-1,12/6/2010 12:55,12.75,14487,United Kingdom
537376,22568,FELTCRAFT CUSHION OWL,24,12/6/2010 12:59,3.39,16722,United Kingdom
537376,22586,FELTCRAFT HAIRBAND PINK AND BLUE,12,12/6/2010 12:59,0.85,16722,United Kingdom
537376,22570,FELTCRAFT CUSHION RABBIT,24,12/6/2010 12:59,3.39,16722,United Kingdom
537376,22569,FELTCRAFT CUSHION BUTTERFLY,24,12/6/2010 12:59,3.39,16722,United Kingdom
537376,22566,FELTCRAFT HAIRBAND PINK AND PURPLE,12,12/6/2010 12:59,0.85,16722,United Kingdom
537376,20969,RED FLORAL FELTCRAFT SHOULDER BAG,4,12/6/2010 12:59,3.75,16722,United Kingdom
537376,20967,GREY FLORAL FELTCRAFT SHOULDER BAG,4,12/6/2010 12:59,3.75,16722,United Kingdom
537376,20970,PINK FLORAL FELTCRAFT SHOULDER BAG,4,12/6/2010 12:59,3.75,16722,United Kingdom
537376,22149,FELTCRAFT 6 FLOWER FRIENDS,40,12/6/2010 12:59,1.85,16722,United Kingdom
537376,22144,CHRISTMAS CRAFT LITTLE FRIENDS,12,12/6/2010 12:59,2.1,16722,United Kingdom
537376,22141,CHRISTMAS CRAFT TREE TOP ANGEL,6,12/6/2010 12:59,2.1,16722,United Kingdom
537376,22142,CHRISTMAS CRAFT WHITE FAIRY ,12,12/6/2010 12:59,1.45,16722,United Kingdom
537376,21495,SKULLS AND CROSSBONES WRAP,25,12/6/2010 12:59,0.42,16722,United Kingdom
537376,16156S,WRAP PINK FAIRY CAKES ,25,12/6/2010 12:59,0.42,16722,United Kingdom
537376,22045,SPACEBOY GIFT WRAP,25,12/6/2010 12:59,0.42,16722,United Kingdom
537376,22704,WRAP RED APPLES ,25,12/6/2010 12:59,0.42,16722,United Kingdom
537377,72802A,ROSE SCENT CANDLE IN JEWELLED BOX,12,12/6/2010 13:01,4.25,15882,United Kingdom
537377,21833,CAMOUFLAGE LED TORCH,24,12/6/2010 13:01,1.69,15882,United Kingdom
537377,72807A,SET/3 ROSE CANDLE IN JEWELLED BOX,12,12/6/2010 13:01,4.25,15882,United Kingdom
537377,72349B,SET/6 PURPLE BUTTERFLY T-LIGHTS,12,12/6/2010 13:01,2.1,15882,United Kingdom
537377,M,Manual,12,12/6/2010 13:01,0.19,15882,United Kingdom
537377,17007B,S/3 POT POURI CUSHIONS BLUE COLOURS,12,12/6/2010 13:01,2.1,15882,United Kingdom
537377,22866,HAND WARMER SCOTTY DOG DESIGN,10,12/6/2010 13:01,2.1,15882,United Kingdom
537377,22865,HAND WARMER OWL DESIGN,10,12/6/2010 13:01,2.1,15882,United Kingdom
537377,22533,MAGIC DRAWING SLATE BAKE A CAKE ,1,12/6/2010 13:01,0.42,15882,United Kingdom
537377,22530,MAGIC DRAWING SLATE DOLLY GIRL ,1,12/6/2010 13:01,0.42,15882,United Kingdom
537377,22531,MAGIC DRAWING SLATE CIRCUS PARADE  ,1,12/6/2010 13:01,0.42,15882,United Kingdom
537377,22534,MAGIC DRAWING SLATE SPACEBOY ,1,12/6/2010 13:01,0.42,15882,United Kingdom
537377,22810,SET OF 6 T-LIGHTS SNOWMEN,4,12/6/2010 13:01,2.95,15882,United Kingdom
537377,22505,MEMO BOARD COTTAGE DESIGN,4,12/6/2010 13:01,4.95,15882,United Kingdom
537378,22697,GREEN REGENCY TEACUP AND SAUCER,12,12/6/2010 13:06,2.95,14911,EIRE
537378,22423,REGENCY CAKESTAND 3 TIER,12,12/6/2010 13:06,12.75,14911,EIRE
537378,21363,HOME SMALL WOOD LETTERS,3,12/6/2010 13:06,4.95,14911,EIRE
537378,22339,CHRISTMAS TREE PAINTED ZINC ,24,12/6/2010 13:06,0.65,14911,EIRE
537378,22338,STAR DECORATION PAINTED ZINC ,24,12/6/2010 13:06,0.65,14911,EIRE
537378,22336,DOVE DECORATION PAINTED ZINC ,24,12/6/2010 13:06,0.65,14911,EIRE
537378,22571,ROCKING HORSE RED CHRISTMAS ,36,12/6/2010 13:06,0.85,14911,EIRE
537378,22595,CHRISTMAS GINGHAM HEART,36,12/6/2010 13:06,0.85,14911,EIRE
537378,22594,CHRISTMAS GINGHAM TREE,36,12/6/2010 13:06,0.85,14911,EIRE
537378,22593,CHRISTMAS GINGHAM STAR,36,12/6/2010 13:06,0.85,14911,EIRE
537378,22576,SWALLOW WOODEN CHRISTMAS DECORATION,36,12/6/2010 13:06,0.85,14911,EIRE
537378,22574,HEART WOODEN CHRISTMAS DECORATION,36,12/6/2010 13:06,0.85,14911,EIRE
537378,22573,STAR WOODEN CHRISTMAS DECORATION,36,12/6/2010 13:06,0.85,14911,EIRE
537378,22082,RIBBON REEL STRIPES DESIGN ,20,12/6/2010 13:06,1.65,14911,EIRE
537378,21754,HOME BUILDING BLOCK WORD,8,12/6/2010 13:06,5.95,14911,EIRE
537378,84945,MULTI COLOUR SILVER T-LIGHT HOLDER,72,12/6/2010 13:06,0.85,14911,EIRE
537378,22119,PEACE WOODEN BLOCK LETTERS,6,12/6/2010 13:06,6.95,14911,EIRE
537378,22627,MINT KITCHEN SCALES,6,12/6/2010 13:06,8.5,14911,EIRE
537378,22699,ROSES REGENCY TEACUP AND SAUCER ,12,12/6/2010 13:06,2.95,14911,EIRE
537378,C2,CARRIAGE,1,12/6/2010 13:06,50,14911,EIRE
537380,22633,HAND WARMER UNION JACK,24,12/6/2010 13:12,2.1,15882,United Kingdom
537380,22632,HAND WARMER RED RETROSPOT,24,12/6/2010 13:12,2.1,15882,United Kingdom
C537379,22865,HAND WARMER OWL DESIGN,-10,12/6/2010 13:12,2.1,15882,United Kingdom
537381,22865,HAND WARMER OWL DESIGN,10,12/6/2010 13:13,2.1,14667,United Kingdom
537381,22632,HAND WARMER RED RETROSPOT,24,12/6/2010 13:13,2.1,14667,United Kingdom
537381,22633,HAND WARMER UNION JACK,20,12/6/2010 13:13,2.1,14667,United Kingdom
537381,22867,HAND WARMER BIRD DESIGN,24,12/6/2010 13:13,2.1,14667,United Kingdom
537381,22601,CHRISTMAS RETROSPOT ANGEL WOOD,17,12/6/2010 13:13,0.85,14667,United Kingdom
537381,22603,CHRISTMAS RETROSPOT TREE WOOD,19,12/6/2010 13:13,0.85,14667,United Kingdom
537381,22158,3 HEARTS HANGING DECORATION RUSTIC,3,12/6/2010 13:13,2.95,14667,United Kingdom
537381,22151,PLACE SETTING WHITE HEART,24,12/6/2010 13:13,0.42,14667,United Kingdom
537381,22154,ANGEL DECORATION 3 BUTTONS ,48,12/6/2010 13:13,0.42,14667,United Kingdom
537381,22838,3 TIER CAKE TIN RED AND CREAM,1,12/6/2010 13:13,14.95,14667,United Kingdom
537381,22112,CHOCOLATE HOT WATER BOTTLE,3,12/6/2010 13:13,4.95,14667,United Kingdom
537381,22111,SCOTTIE DOG HOT WATER BOTTLE,3,12/6/2010 13:13,4.95,14667,United Kingdom
537381,84029E,RED WOOLLY HOTTIE WHITE HEART.,6,12/6/2010 13:13,3.75,14667,United Kingdom
537381,22130,PARTY CONE CHRISTMAS DECORATION ,42,12/6/2010 13:13,0.85,14667,United Kingdom
537381,22576,SWALLOW WOODEN CHRISTMAS DECORATION,48,12/6/2010 13:13,0.85,14667,United Kingdom
537381,21807,WHITE CHRISTMAS STAR DECORATION,36,12/6/2010 13:13,0.42,14667,United Kingdom
537381,22162,HEART GARLAND RUSTIC PADDED,8,12/6/2010 13:13,2.95,14667,United Kingdom
537381,22700,BLACK AND WHITE DOG BOWL,6,12/6/2010 13:13,2.95,14667,United Kingdom
537381,85038,6 CHOCOLATE LOVE HEART T-LIGHTS,6,12/6/2010 13:13,2.1,14667,United Kingdom
537381,85231B,CINAMMON SET OF 9 T-LIGHTS,6,12/6/2010 13:13,0.85,14667,United Kingdom
537381,22618,COOKING SET RETROSPOT,3,12/6/2010 13:13,9.95,14667,United Kingdom
537381,47591B,SCOTTIES CHILDRENS APRON,6,12/6/2010 13:13,1.65,14667,United Kingdom
537381,22367,CHILDRENS APRON SPACEBOY DESIGN,6,12/6/2010 13:13,1.95,14667,United Kingdom
537381,20914,SET/5 RED RETROSPOT LID GLASS BOWLS,3,12/6/2010 13:13,2.95,14667,United Kingdom
537382,22727,ALARM CLOCK BAKELIKE RED ,3,12/6/2010 13:13,3.75,16710,United Kingdom
537382,22728,ALARM CLOCK BAKELIKE PINK,1,12/6/2010 13:13,3.75,16710,United Kingdom
537382,22730,ALARM CLOCK BAKELIKE IVORY,1,12/6/2010 13:13,3.75,16710,United Kingdom
537382,22729,ALARM CLOCK BAKELIKE ORANGE,2,12/6/2010 13:13,3.75,16710,United Kingdom
537382,22726,ALARM CLOCK BAKELIKE GREEN,3,12/6/2010 13:13,3.75,16710,United Kingdom
537382,84029E,RED WOOLLY HOTTIE WHITE HEART.,2,12/6/2010 13:13,3.75,16710,United Kingdom
537382,22837,HOT WATER BOTTLE BABUSHKA ,4,12/6/2010 13:13,4.65,16710,United Kingdom
537382,21485,RETROSPOT HEART HOT WATER BOTTLE,2,12/6/2010 13:13,4.95,16710,United Kingdom
537382,21481,FAWN BLUE HOT WATER BOTTLE,2,12/6/2010 13:13,2.95,16710,United Kingdom
537382,22114,HOT WATER BOTTLE TEA AND SYMPATHY,2,12/6/2010 13:13,3.95,16710,United Kingdom
537382,22111,SCOTTIE DOG HOT WATER BOTTLE,2,12/6/2010 13:13,4.95,16710,United Kingdom
537382,22113,GREY HEART HOT WATER BOTTLE,4,12/6/2010 13:13,3.75,16710,United Kingdom
537382,10124A,SPOTS ON RED BOOKCOVER TAPE,4,12/6/2010 13:13,0.42,16710,United Kingdom
537382,84347,ROTATING SILVER ANGELS T-LIGHT HLDR,6,12/6/2010 13:13,2.55,16710,United Kingdom
537382,21587,COSY HOUR GIANT TUBE MATCHES,2,12/6/2010 13:13,2.55,16710,United Kingdom
537382,84692,BOX OF 24 COCKTAIL PARASOLS,6,12/6/2010 13:13,0.42,16710,United Kingdom
537382,22075,6 RIBBONS ELEGANT CHRISTMAS ,4,12/6/2010 13:13,1.65,16710,United Kingdom
537382,20979,36 PENCILS TUBE RED RETROSPOT,2,12/6/2010 13:13,1.25,16710,United Kingdom
537382,20975,12 PENCILS SMALL TUBE RED RETROSPOT,2,12/6/2010 13:13,0.65,16710,United Kingdom
537382,22445,PENCIL CASE LIFE IS BEAUTIFUL,2,12/6/2010 13:13,2.95,16710,United Kingdom
537382,21644,ASSORTED TUTTI FRUTTI HEART BOX,2,12/6/2010 13:13,1.25,16710,United Kingdom
537382,84625A,PINK NEW BAROQUECANDLESTICK CANDLE,4,12/6/2010 13:13,2.95,16710,United Kingdom
537382,21744,SNOWFLAKE PORTABLE TABLE LIGHT ,4,12/6/2010 13:13,2.95,16710,United Kingdom
537382,22834,HAND WARMER BABUSHKA DESIGN,7,12/6/2010 13:13,2.1,16710,United Kingdom
537382,22866,HAND WARMER SCOTTY DOG DESIGN,7,12/6/2010 13:13,2.1,16710,United Kingdom
537382,22632,HAND WARMER RED RETROSPOT,4,12/6/2010 13:13,2.1,16710,United Kingdom
537382,22867,HAND WARMER BIRD DESIGN,4,12/6/2010 13:13,2.1,16710,United Kingdom
537382,22906,12 MESSAGE CARDS WITH ENVELOPES,4,12/6/2010 13:13,1.65,16710,United Kingdom
537382,22086,PAPER CHAIN KIT 50'S CHRISTMAS ,6,12/6/2010 13:13,2.95,16710,United Kingdom
537382,85231B,CINAMMON SET OF 9 T-LIGHTS,4,12/6/2010 13:13,0.85,16710,United Kingdom
537382,20668,DISCO BALL CHRISTMAS DECORATION,24,12/6/2010 13:13,0.12,16710,United Kingdom
537382,85231G,ORANGE SCENTED SET/9 T-LIGHTS,3,12/6/2010 13:13,0.85,16710,United Kingdom
537382,22842,BISCUIT TIN VINTAGE RED,1,12/6/2010 13:13,6.75,16710,United Kingdom
537382,22739,RIBBON REEL CHRISTMAS SOCK BAUBLE,3,12/6/2010 13:13,1.65,16710,United Kingdom
537382,22736,RIBBON REEL MAKING SNOWMEN ,3,12/6/2010 13:13,1.65,16710,United Kingdom
537382,22753,SMALL YELLOW BABUSHKA NOTEBOOK ,1,12/6/2010 13:13,0.85,16710,United Kingdom
537382,22754,SMALL RED BABUSHKA NOTEBOOK ,1,12/6/2010 13:13,0.85,16710,United Kingdom
537382,22754,SMALL RED BABUSHKA NOTEBOOK ,1,12/6/2010 13:13,0.85,16710,United Kingdom
537382,22755,SMALL PURPLE BABUSHKA NOTEBOOK ,2,12/6/2010 13:13,0.85,16710,United Kingdom
537382,21018,BIRD BOX CHRISTMAS TREE DECORATION,1,12/6/2010 13:13,0.85,16710,United Kingdom
537382,22843,BISCUIT TIN VINTAGE GREEN,1,12/6/2010 13:13,6.75,16710,United Kingdom
537382,21018,BIRD BOX CHRISTMAS TREE DECORATION,3,12/6/2010 13:13,0.85,16710,United Kingdom
537382,35953,FOLKART STAR CHRISTMAS DECORATIONS,1,12/6/2010 13:13,1.25,16710,United Kingdom
537382,35953,FOLKART STAR CHRISTMAS DECORATIONS,1,12/6/2010 13:13,1.25,16710,United Kingdom
537382,21817,GLITTER CHRISTMAS TREE,3,12/6/2010 13:13,0.85,16710,United Kingdom
537382,21818,GLITTER CHRISTMAS HEART ,2,12/6/2010 13:13,0.85,16710,United Kingdom
537382,21811,CHRISTMAS HANGING HEART WITH BELL,1,12/6/2010 13:13,1.25,16710,United Kingdom
537382,22336,DOVE DECORATION PAINTED ZINC ,3,12/6/2010 13:13,0.65,16710,United Kingdom
537382,21818,GLITTER CHRISTMAS HEART ,2,12/6/2010 13:13,0.85,16710,United Kingdom
537382,21819,GLITTER CHRISTMAS STAR ,2,12/6/2010 13:13,0.85,16710,United Kingdom
537382,21811,CHRISTMAS HANGING HEART WITH BELL,1,12/6/2010 13:13,1.25,16710,United Kingdom
537382,85199S,SMALL HANGING IVORY/RED WOOD BIRD,2,12/6/2010 13:13,0.42,16710,United Kingdom
537382,22572,ROCKING HORSE GREEN CHRISTMAS ,6,12/6/2010 13:13,0.85,16710,United Kingdom
537382,22335,HEART DECORATION PAINTED ZINC ,2,12/6/2010 13:13,0.65,16710,United Kingdom
537382,22295,HEART FILIGREE DOVE LARGE,1,12/6/2010 13:13,1.65,16710,United Kingdom
537382,22988,SOLDIERS EGG CUP ,12,12/6/2010 13:13,1.25,16710,United Kingdom
537382,22810,SET OF 6 T-LIGHTS SNOWMEN,6,12/6/2010 13:13,2.95,16710,United Kingdom
537382,22912,YELLOW COAT RACK PARIS FASHION,6,12/6/2010 13:13,4.95,16710,United Kingdom
C537383,21658,GLASS  BEURRE DISH,-1,12/6/2010 13:17,3.95,16550,United Kingdom
C537383,22197,SMALL POPCORN HOLDER,-1,12/6/2010 13:17,0.85,16550,United Kingdom
C537383,22371,AIRLINE BAG VINTAGE TOKYO 78,-1,12/6/2010 13:17,4.25,16550,United Kingdom
537384,22633,HAND WARMER UNION JACK,10,12/6/2010 13:21,2.1,15984,United Kingdom
537384,22632,HAND WARMER RED RETROSPOT,20,12/6/2010 13:21,2.1,15984,United Kingdom
537384,22867,HAND WARMER BIRD DESIGN,10,12/6/2010 13:21,2.1,15984,United Kingdom
537384,22865,HAND WARMER OWL DESIGN,10,12/6/2010 13:21,2.1,15984,United Kingdom
537384,22086,PAPER CHAIN KIT 50'S CHRISTMAS ,6,12/6/2010 13:21,2.95,15984,United Kingdom
537385,22423,REGENCY CAKESTAND 3 TIER,4,12/6/2010 13:22,12.75,14487,United Kingdom
537385,22966,GINGERBREAD MAN COOKIE CUTTER,1,12/6/2010 13:22,1.25,14487,United Kingdom
537385,22633,HAND WARMER UNION JACK,2,12/6/2010 13:22,2.1,14487,United Kingdom
537385,22866,HAND WARMER SCOTTY DOG DESIGN,2,12/6/2010 13:22,2.1,14487,United Kingdom
537385,22867,HAND WARMER BIRD DESIGN,2,12/6/2010 13:22,2.1,14487,United Kingdom
537385,84378,SET OF 3 HEART COOKIE CUTTERS,1,12/6/2010 13:22,1.25,14487,United Kingdom
537385,22956,36 FOIL HEART CAKE CASES,1,12/6/2010 13:22,2.1,14487,United Kingdom
537385,22296,HEART IVORY TRELLIS LARGE,8,12/6/2010 13:22,1.65,14487,United Kingdom
537385,22699,ROSES REGENCY TEACUP AND SAUCER ,6,12/6/2010 13:22,2.95,14487,United Kingdom
537385,22697,GREEN REGENCY TEACUP AND SAUCER,6,12/6/2010 13:22,2.95,14487,United Kingdom
537385,22111,SCOTTIE DOG HOT WATER BOTTLE,1,12/6/2010 13:22,4.95,14487,United Kingdom
537385,22195,LARGE HEART MEASURING SPOONS,1,12/6/2010 13:22,1.65,14487,United Kingdom
537385,22909,SET OF 20 VINTAGE CHRISTMAS NAPKINS,2,12/6/2010 13:22,0.85,14487,United Kingdom
537386,22119,PEACE WOODEN BLOCK LETTERS,3,12/6/2010 13:32,6.95,14911,EIRE
537387,22794,SWEETHEART WIRE MAGAZINE RACK,2,12/6/2010 13:34,7.95,13468,United Kingdom
537387,46000P,POLYESTER FILLER PAD 65CMx65CM,2,12/6/2010 13:34,4.25,13468,United Kingdom
537387,21638,ASSORTED TUTTI FRUTTI NOTEBOOK,12,12/6/2010 13:34,2.1,13468,United Kingdom
537387,82484,WOOD BLACK BOARD ANT WHITE FINISH,3,12/6/2010 13:34,6.45,13468,United Kingdom
537387,22114,HOT WATER BOTTLE TEA AND SYMPATHY,4,12/6/2010 13:34,3.95,13468,United Kingdom
537387,21165,BEWARE OF THE CAT METAL SIGN ,12,12/6/2010 13:34,1.69,13468,United Kingdom
537387,22465,HANGING METAL STAR LANTERN,12,12/6/2010 13:34,1.65,13468,United Kingdom
537387,71053,WHITE METAL LANTERN,4,12/6/2010 13:34,3.75,13468,United Kingdom
537387,82486,WOOD S/3 CABINET ANT WHITE FINISH,2,12/6/2010 13:34,7.95,13468,United Kingdom
537387,79321,CHILLI LIGHTS,4,12/6/2010 13:34,4.95,13468,United Kingdom
537387,22179,SET 10 LIGHTS NIGHT OWL,2,12/6/2010 13:34,6.75,13468,United Kingdom
537387,22245,"HOOK, 1 HANGER ,MAGIC GARDEN",12,12/6/2010 13:34,0.85,13468,United Kingdom
537387,22423,REGENCY CAKESTAND 3 TIER,1,12/6/2010 13:34,12.75,13468,United Kingdom
537387,84945,MULTI COLOUR SILVER T-LIGHT HOLDER,12,12/6/2010 13:34,0.85,13468,United Kingdom
537388,85123A,WHITE HANGING HEART T-LIGHT HOLDER,12,12/6/2010 13:35,2.95,17682,United Kingdom
537388,84978,HANGING HEART JAR T-LIGHT HOLDER,12,12/6/2010 13:35,1.25,17682,United Kingdom
537388,21260,FIRST AID TIN,12,12/6/2010 13:35,3.25,17682,United Kingdom
537388,22457,NATURAL SLATE HEART CHALKBOARD ,6,12/6/2010 13:35,2.95,17682,United Kingdom
537388,21790,VINTAGE SNAP CARDS,12,12/6/2010 13:35,0.85,17682,United Kingdom
537388,21888,BINGO SET,4,12/6/2010 13:35,3.75,17682,United Kingdom
537388,20725,LUNCH BAG RED RETROSPOT,20,12/6/2010 13:35,1.65,17682,United Kingdom
537388,20726,LUNCH BAG WOODLAND,10,12/6/2010 13:35,1.65,17682,United Kingdom
537388,20727,LUNCH BAG  BLACK SKULL.,20,12/6/2010 13:35,1.65,17682,United Kingdom
537388,20728,LUNCH BAG CARS BLUE,10,12/6/2010 13:35,1.65,17682,United Kingdom
537388,22382,LUNCH BAG SPACEBOY DESIGN ,10,12/6/2010 13:35,1.65,17682,United Kingdom
537388,22383,LUNCH BAG SUKI  DESIGN ,10,12/6/2010 13:35,1.65,17682,United Kingdom
537388,22384,LUNCH BAG PINK POLKADOT,20,12/6/2010 13:35,1.65,17682,United Kingdom
537388,22469,HEART OF WICKER SMALL,12,12/6/2010 13:35,1.65,17682,United Kingdom
537388,22470,HEART OF WICKER LARGE,6,12/6/2010 13:35,2.95,17682,United Kingdom
537388,22662,LUNCH BAG DOLLY GIRL DESIGN,10,12/6/2010 13:35,1.65,17682,United Kingdom
537388,82583,HOT BATHS METAL SIGN,12,12/6/2010 13:35,2.1,17682,United Kingdom
537388,22674,FRENCH TOILET SIGN BLUE METAL,12,12/6/2010 13:35,1.25,17682,United Kingdom
537389,21754,HOME BUILDING BLOCK WORD,1,12/6/2010 13:41,5.95,17757,United Kingdom
537389,22867,HAND WARMER BIRD DESIGN,3,12/6/2010 13:41,2.1,17757,United Kingdom
537389,22632,HAND WARMER RED RETROSPOT,5,12/6/2010 13:41,2.1,17757,United Kingdom
537389,22865,HAND WARMER OWL DESIGN,6,12/6/2010 13:41,2.1,17757,United Kingdom
537389,22086,PAPER CHAIN KIT 50'S CHRISTMAS ,10,12/6/2010 13:41,2.95,17757,United Kingdom
537389,21528,DAIRY MAID TRADITIONAL TEAPOT ,1,12/6/2010 13:41,6.95,17757,United Kingdom
537389,22670,FRENCH WC SIGN BLUE METAL,1,12/6/2010 13:41,1.25,17757,United Kingdom
537389,22681,FRENCH BLUE METAL DOOR SIGN 6,1,12/6/2010 13:41,1.25,17757,United Kingdom
537389,22671,FRENCH LAUNDRY SIGN BLUE METAL,2,12/6/2010 13:41,1.65,17757,United Kingdom
537389,21156,RETROSPOT CHILDRENS APRON,2,12/6/2010 13:41,1.95,17757,United Kingdom
537389,22812,PACK 3 BOXES CHRISTMAS PANNETONE,2,12/6/2010 13:41,1.95,17757,United Kingdom
537389,21746,SMALL RED RETROSPOT WINDMILL,1,12/6/2010 13:41,1.25,17757,United Kingdom
537389,21407,BROWN CHECK CAT DOORSTOP ,1,12/6/2010 13:41,4.25,17757,United Kingdom
537389,22198,LARGE POPCORN HOLDER ,3,12/6/2010 13:41,1.65,17757,United Kingdom
537389,22197,SMALL POPCORN HOLDER,10,12/6/2010 13:41,0.85,17757,United Kingdom
537389,84916,HAND TOWEL PALE BLUE W FLOWERS,1,12/6/2010 13:41,5.95,17757,United Kingdom
537389,20752,BLUE POLKADOT WASHING UP GLOVES,4,12/6/2010 13:41,2.1,17757,United Kingdom
537389,21260,FIRST AID TIN,2,12/6/2010 13:41,3.25,17757,United Kingdom
537389,22502,PICNIC BASKET WICKER SMALL,4,12/6/2010 13:41,5.95,17757,United Kingdom
537390,22816,CARD MOTORBIKE SANTA,12,12/6/2010 13:47,0.42,16658,United Kingdom
537390,40005B,BLUE ORGANDY ROUND LAMPSHADE W BEA,1,12/6/2010 13:47,0.85,16658,United Kingdom
537390,47580,TEA TIME DES TEA COSY,1,12/6/2010 13:47,2.55,16658,United Kingdom
537390,18094C,WHITE AND BLUE CERAMIC OIL BURNER,1,12/6/2010 13:47,1.25,16658,United Kingdom
537390,84946,ANTIQUE SILVER TEA GLASS ETCHED,6,12/6/2010 13:47,1.25,16658,United Kingdom
