545854,20713,JUMBO BAG OWLS,10,3/7/2011 13:51,1.95,14817,United Kingdom
545854,22379,RECYCLING BAG RETROSPOT ,5,3/7/2011 13:51,2.1,14817,United Kingdom
545854,22381,TOY TIDY PINK POLKADOT,5,3/7/2011 13:51,2.1,14817,United Kingdom
545854,22386,JUMBO BAG PINK POLKADOT,10,3/7/2011 13:51,1.95,14817,United Kingdom
545854,85099F,JUMBO BAG STRAWBERRY,10,3/7/2011 13:51,1.95,14817,United Kingdom
545854,21931,JUMBO STORAGE BAG SUKI,10,3/7/2011 13:51,1.95,14817,United Kingdom
545854,20724,RED RETROSPOT CHARLOTTE BAG,10,3/7/2011 13:51,0.85,14817,United Kingdom
545854,35916A,YELLOW FELT HANGING HEART W FLOWER,12,3/7/2011 13:51,0.85,14817,United Kingdom
545854,84741C,CITRUS GARLAND FELT FLOWERS ,6,3/7/2011 13:51,1.95,14817,United Kingdom
545854,35916C,PINK FELT HANGING HEART W FLOWER,12,3/7/2011 13:51,0.85,14817,United Kingdom
545854,22148,EASTER CRAFT 4 CHICKS ,12,3/7/2011 13:51,1.95,14817,United Kingdom
545854,21389,IVORY HANGING DECORATION  BIRD,12,3/7/2011 13:51,0.85,14817,United Kingdom
545854,22248,DECORATION  PINK CHICK MAGIC GARDEN,16,3/7/2011 13:51,0.85,14817,United Kingdom
545854,22247,BUNNY DECORATION MAGIC GARDEN,16,3/7/2011 13:51,0.85,14817,United Kingdom
545854,22285,HANGING HEN ON NEST DECORATION,12,3/7/2011 13:51,1.65,14817,United Kingdom
545854,22284,HEN HOUSE DECORATION,12,3/7/2011 13:51,1.65,14817,United Kingdom
545854,35915B,BLUE KNITTED HEN ,6,3/7/2011 13:51,1.65,14817,United Kingdom
545854,85186A,EASTER BUNNY GARLAND OF FLOWERS,24,3/7/2011 13:51,0.42,14817,United Kingdom
545854,22021,BLUE FELT EASTER EGG BASKET,6,3/7/2011 13:51,1.65,14817,United Kingdom
545854,22438,BALLOON ART MAKE YOUR OWN FLOWERS,10,3/7/2011 13:51,1.95,14817,United Kingdom
545854,21829,DINOSAUR KEYRINGS ASSORTED,36,3/7/2011 13:51,0.21,14817,United Kingdom
545854,C2,CARRIAGE,1,3/7/2011 13:51,50,14817,United Kingdom
545855,22084,PAPER CHAIN KIT EMPIRE,12,3/7/2011 13:52,2.95,15290,United Kingdom
545855,21078,SET/20 STRAWBERRY PAPER NAPKINS ,12,3/7/2011 13:52,0.85,15290,United Kingdom
545855,22077,6 RIBBONS RUSTIC CHARM,24,3/7/2011 13:52,1.65,15290,United Kingdom
545855,22908,PACK OF 20 NAPKINS RED APPLES,12,3/7/2011 13:52,0.85,15290,United Kingdom
545855,22568,FELTCRAFT CUSHION OWL,4,3/7/2011 13:52,3.75,15290,United Kingdom
545855,22262,FELT EGG COSY CHICKEN,24,3/7/2011 13:52,0.85,15290,United Kingdom
545855,85206A,CREAM FELT EASTER EGG BASKET,12,3/7/2011 13:52,1.65,15290,United Kingdom
545855,22021,BLUE FELT EASTER EGG BASKET,12,3/7/2011 13:52,1.65,15290,United Kingdom
545855,21888,BINGO SET,8,3/7/2011 13:52,3.75,15290,United Kingdom
545855,22302,COFFEE MUG PEARS  DESIGN,12,3/7/2011 13:52,2.55,15290,United Kingdom
545855,22303,COFFEE MUG APPLES DESIGN,6,3/7/2011 13:52,2.55,15290,United Kingdom
545856,22175,PINK OWL SOFT TOY,6,3/7/2011 13:54,2.95,16225,United Kingdom
545856,22149,FELTCRAFT 6 FLOWER FRIENDS,6,3/7/2011 13:54,2.1,16225,United Kingdom
545856,22138,BAKING SET 9 PIECE RETROSPOT ,6,3/7/2011 13:54,4.95,16225,United Kingdom
545856,22617,BAKING SET SPACEBOY DESIGN,6,3/7/2011 13:54,4.95,16225,United Kingdom
545857,20681,MIA,-154,3/7/2011 13:56,0,,United Kingdom
545858,22797,CHEST OF DRAWERS GINGHAM HEART ,6,3/7/2011 14:00,4,,United Kingdom
545859,22998,TRAVEL CARD WALLET KEEP CALM,24,3/7/2011 14:10,0.42,15498,United Kingdom
545859,48194,DOORMAT HEARTS,20,3/7/2011 14:10,6.75,15498,United Kingdom
545859,22457,NATURAL SLATE HEART CHALKBOARD ,6,3/7/2011 14:10,2.95,15498,United Kingdom
545859,22690,DOORMAT HOME SWEET HOME BLUE ,20,3/7/2011 14:10,6.75,15498,United Kingdom
545859,48185,DOORMAT FAIRY CAKE,20,3/7/2011 14:10,6.75,15498,United Kingdom
545859,17012D,ORIGAMI ROSE INCENSE/CANDLE SET ,6,3/7/2011 14:10,2.55,15498,United Kingdom
545859,17012B,ORIGAMI JASMINE INCENSE/CANDLE SET,6,3/7/2011 14:10,2.55,15498,United Kingdom
545859,17012C,ORIGAMI LAVENDER INCENSE/CANDL SET ,6,3/7/2011 14:10,2.55,15498,United Kingdom
545859,72225C,LAVENDER SCENT CAKE CANDLE,24,3/7/2011 14:10,0.29,15498,United Kingdom
545859,79321,CHILLI LIGHTS,8,3/7/2011 14:10,5.75,15498,United Kingdom
545859,21544,SKULLS  WATER TRANSFER TATTOOS ,12,3/7/2011 14:10,0.85,15498,United Kingdom
545859,21495,SKULLS AND CROSSBONES WRAP,25,3/7/2011 14:10,0.42,15498,United Kingdom
545859,21497,FANCY FONTS BIRTHDAY WRAP,25,3/7/2011 14:10,0.42,15498,United Kingdom
545859,22704,WRAP RED APPLES ,25,3/7/2011 14:10,0.42,15498,United Kingdom
545859,22051,BLUE SCANDINAVIAN PAISLEY WRAP,25,3/7/2011 14:10,0.42,15498,United Kingdom
545859,23004,TRAVEL CARD WALLET PANTRY,24,3/7/2011 14:10,0.42,15498,United Kingdom
545865,84519A,TOMATO CHARLIE+LOLA COASTER SET,48,3/7/2011 14:17,2.55,15769,United Kingdom
545865,85099F,JUMBO BAG STRAWBERRY,200,3/7/2011 14:17,1.65,15769,United Kingdom
545865,22385,JUMBO BAG SPACEBOY DESIGN,300,3/7/2011 14:17,1.65,15769,United Kingdom
545865,21929,JUMBO BAG PINK VINTAGE PAISLEY,200,3/7/2011 14:17,1.65,15769,United Kingdom
545865,22386,JUMBO BAG PINK POLKADOT,100,3/7/2011 14:17,1.65,15769,United Kingdom
545865,85099B,JUMBO BAG RED RETROSPOT,400,3/7/2011 14:17,1.65,15769,United Kingdom
545865,21928,JUMBO BAG SCANDINAVIAN BLUE PAISLEY,100,3/7/2011 14:17,1.65,15769,United Kingdom
545865,85099C,JUMBO  BAG BAROQUE BLACK WHITE,200,3/7/2011 14:17,1.65,15769,United Kingdom
C545866,21424,WOODLAND STORAGE BOX LARGE ,-1,3/7/2011 14:27,2.95,17841,United Kingdom
C545866,21426,WOODLAND STORAGE BOX SMALL,-2,3/7/2011 14:27,2.1,17841,United Kingdom
C545866,21427,SKULLS STORAGE BOX SMALL,-1,3/7/2011 14:27,2.1,17841,United Kingdom
C545867,21424,WOODLAND STORAGE BOX LARGE ,-1,3/7/2011 14:29,2.95,17841,United Kingdom
545868,21155,RED RETROSPOT PEG BAG,6,3/7/2011 14:33,2.55,17841,United Kingdom
545868,22380,TOY TIDY SPACEBOY  ,1,3/7/2011 14:33,2.1,17841,United Kingdom
545868,21931,JUMBO STORAGE BAG SUKI,1,3/7/2011 14:33,1.95,17841,United Kingdom
545868,21935,SUKI  SHOULDER BAG,1,3/7/2011 14:33,1.65,17841,United Kingdom
545868,22355,CHARLOTTE BAG SUKI DESIGN,4,3/7/2011 14:33,0.85,17841,United Kingdom
545868,20727,LUNCH BAG  BLACK SKULL.,2,3/7/2011 14:33,1.65,17841,United Kingdom
545868,20719,WOODLAND CHARLOTTE BAG,2,3/7/2011 14:33,0.85,17841,United Kingdom
545868,79321,CHILLI LIGHTS,1,3/7/2011 14:33,5.75,17841,United Kingdom
545868,35004C,SET OF 3 COLOURED  FLYING DUCKS,1,3/7/2011 14:33,5.45,17841,United Kingdom
545868,47590A,BLUE HAPPY BIRTHDAY BUNTING,1,3/7/2011 14:33,5.45,17841,United Kingdom
545868,22664,TOY TIDY DOLLY GIRL DESIGN,1,3/7/2011 14:33,2.1,17841,United Kingdom
545868,20707,CRAZY DAISY HEART DECORATION,2,3/7/2011 14:33,1.25,17841,United Kingdom
545868,22773,GREEN DRAWER KNOB ACRYLIC EDWARDIAN,4,3/7/2011 14:33,1.25,17841,United Kingdom
545868,72349B,SET/6 PURPLE BUTTERFLY T-LIGHTS,2,3/7/2011 14:33,2.1,17841,United Kingdom
545868,22722,SET OF 6 SPICE TINS PANTRY DESIGN,1,3/7/2011 14:33,3.95,17841,United Kingdom
545868,22993,SET OF 4 PANTRY JELLY MOULDS,2,3/7/2011 14:33,1.25,17841,United Kingdom
545868,22595,GINGHAM HEART DECORATION,6,3/7/2011 14:33,0.85,17841,United Kingdom
545868,22254,FELT TOADSTOOL LARGE,2,3/7/2011 14:33,1.25,17841,United Kingdom
545868,71053,WHITE METAL LANTERN,1,3/7/2011 14:33,3.75,17841,United Kingdom
545868,22784,LANTERN CREAM GAZEBO ,1,3/7/2011 14:33,4.95,17841,United Kingdom
545868,22673,FRENCH GARDEN SIGN BLUE METAL,2,3/7/2011 14:33,1.25,17841,United Kingdom
545868,15044C,PURPLE PAPER PARASOL,3,3/7/2011 14:33,2.95,17841,United Kingdom
545868,22804,CANDLEHOLDER PINK HANGING HEART,1,3/7/2011 14:33,2.95,17841,United Kingdom
545868,84078A,SET/4 WHITE RETRO STORAGE CUBES ,1,3/7/2011 14:33,39.95,17841,United Kingdom
545868,22470,HEART OF WICKER LARGE,3,3/7/2011 14:33,2.95,17841,United Kingdom
545869,22983,CARD BILLBOARD FONT,12,3/7/2011 14:45,0.42,17162,United Kingdom
545869,23230,WRAP ALPHABET DESIGN,25,3/7/2011 14:45,0.42,17162,United Kingdom
545869,22985,"WRAP, BILLBOARD FONTS DESIGN",25,3/7/2011 14:45,0.42,17162,United Kingdom
545869,85152,HAND OVER THE CHOCOLATE   SIGN ,12,3/7/2011 14:45,2.1,17162,United Kingdom
545869,21181,PLEASE ONE PERSON METAL SIGN,12,3/7/2011 14:45,2.1,17162,United Kingdom
545869,23182,TOILET SIGN OCCUPIED OR VACANT,24,3/7/2011 14:45,0.83,17162,United Kingdom
545869,21175,GIN + TONIC DIET METAL SIGN,6,3/7/2011 14:45,2.55,17162,United Kingdom
545869,22168,ORGANISER WOOD ANTIQUE WHITE ,2,3/7/2011 14:45,8.5,17162,United Kingdom
545869,22915,ASSORTED BOTTLE TOP  MAGNETS ,12,3/7/2011 14:45,0.42,17162,United Kingdom
545869,22723,SET OF 6 HERB TINS SKETCHBOOK,4,3/7/2011 14:45,3.95,17162,United Kingdom
545869,22720,SET OF 3 CAKE TINS PANTRY DESIGN ,3,3/7/2011 14:45,4.95,17162,United Kingdom
545869,22835,HOT WATER BOTTLE I AM SO POORLY,4,3/7/2011 14:45,4.65,17162,United Kingdom
545869,21462,"NURSERY A,B,C PAINTED LETTERS",2,3/7/2011 14:45,6.75,17162,United Kingdom
545870,85150,LADIES & GENTLEMEN METAL SIGN,6,3/7/2011 14:45,2.55,17162,United Kingdom
545871,23231,WRAP DOILEY DESIGN,25,3/7/2011 14:51,0.42,17092,United Kingdom
545871,23233,WRAP POPPIES  DESIGN,25,3/7/2011 14:51,0.42,17092,United Kingdom
545871,23230,WRAP ALPHABET DESIGN,25,3/7/2011 14:51,0.42,17092,United Kingdom
545871,22751,FELTCRAFT PRINCESS OLIVIA DOLL,3,3/7/2011 14:51,3.75,17092,United Kingdom
545871,22749,FELTCRAFT PRINCESS CHARLOTTE DOLL,3,3/7/2011 14:51,3.75,17092,United Kingdom
545871,22750,FELTCRAFT PRINCESS LOLA DOLL,3,3/7/2011 14:51,3.75,17092,United Kingdom
545871,22148,EASTER CRAFT 4 CHICKS ,12,3/7/2011 14:51,1.95,17092,United Kingdom
545871,21591,COSY HOUR CIGAR BOX MATCHES ,1,3/7/2011 14:51,1.25,17092,United Kingdom
545871,22852,DOG BOWL VINTAGE CREAM,6,3/7/2011 14:51,4.25,17092,United Kingdom
545871,22853,CAT BOWL VINTAGE CREAM,6,3/7/2011 14:51,3.25,17092,United Kingdom
545872,21468,BUTTERFLY CROCHET FOOD COVER,2,3/7/2011 14:51,3.75,15752,United Kingdom
545872,21466,RED FLOWER CROCHET FOOD COVER,2,3/7/2011 14:51,3.75,15752,United Kingdom
545872,21470,FLOWER VINE RAFFIA FOOD COVER,2,3/7/2011 14:51,3.75,15752,United Kingdom
545872,22822,CREAM WALL PLANTER HEART SHAPED,2,3/7/2011 14:51,5.95,15752,United Kingdom
545872,22988,SOLDIERS EGG CUP ,12,3/7/2011 14:51,1.25,15752,United Kingdom
545872,84596F,SMALL MARSHMALLOWS PINK BOWL,8,3/7/2011 14:51,0.42,15752,United Kingdom
545872,22386,JUMBO BAG PINK POLKADOT,2,3/7/2011 14:51,1.95,15752,United Kingdom
545872,21928,JUMBO BAG SCANDINAVIAN BLUE PAISLEY,2,3/7/2011 14:51,1.95,15752,United Kingdom
545872,20711,JUMBO BAG TOYS ,2,3/7/2011 14:51,1.95,15752,United Kingdom
545872,21033,JUMBO BAG CHARLIE AND LOLA TOYS,2,3/7/2011 14:51,2.95,15752,United Kingdom
545872,85099F,JUMBO BAG STRAWBERRY,2,3/7/2011 14:51,1.95,15752,United Kingdom
545872,85099B,JUMBO BAG RED RETROSPOT,2,3/7/2011 14:51,1.95,15752,United Kingdom
545872,20713,JUMBO BAG OWLS,2,3/7/2011 14:51,1.95,15752,United Kingdom
545872,85099C,JUMBO  BAG BAROQUE BLACK WHITE,2,3/7/2011 14:51,1.95,15752,United Kingdom
545872,21874,GIN AND TONIC MUG,6,3/7/2011 14:51,1.25,15752,United Kingdom
545872,22971,QUEENS GUARD COFFEE MUG,6,3/7/2011 14:51,2.55,15752,United Kingdom
545872,22469,HEART OF WICKER SMALL,2,3/7/2011 14:51,1.65,15752,United Kingdom
545872,84596L,BISCUITS SMALL BOWL LIGHT BLUE,2,3/7/2011 14:51,0.42,15752,United Kingdom
545872,84596E,SMALL LICORICE DES PINK BOWL,2,3/7/2011 14:51,0.42,15752,United Kingdom
545872,20766,GARDEN PATH SKETCHBOOK,2,3/7/2011 14:51,3.75,15752,United Kingdom
545872,20765,CHRYSANTHEMUM SKETCHBOOK ,2,3/7/2011 14:51,3.75,15752,United Kingdom
545872,20764,ABSTRACT CIRCLES SKETCHBOOK ,2,3/7/2011 14:51,3.75,15752,United Kingdom
545872,22158,3 HEARTS HANGING DECORATION RUSTIC,2,3/7/2011 14:51,2.95,15752,United Kingdom
545872,22662,LUNCH BAG DOLLY GIRL DESIGN,2,3/7/2011 14:51,1.65,15752,United Kingdom
545872,22384,LUNCH BAG PINK POLKADOT,2,3/7/2011 14:51,1.65,15752,United Kingdom
545872,20728,LUNCH BAG CARS BLUE,2,3/7/2011 14:51,1.65,15752,United Kingdom
545872,62096B,PURPLE/TURQ FLOWERS HANDBAG,2,3/7/2011 14:51,1.25,15752,United Kingdom
545872,20727,LUNCH BAG  BLACK SKULL.,2,3/7/2011 14:51,1.65,15752,United Kingdom
545872,21932,SCANDINAVIAN PAISLEY PICNIC BAG,2,3/7/2011 14:51,2.95,15752,United Kingdom
545872,21755,LOVE BUILDING BLOCK WORD,2,3/7/2011 14:51,5.95,15752,United Kingdom
545872,22212,FOUR HOOK  WHITE LOVEBIRDS,2,3/7/2011 14:51,2.1,15752,United Kingdom
545872,20684,STRAWBERRY DREAM CHILDS UMBRELLA,1,3/7/2011 14:51,3.25,15752,United Kingdom
545872,20686,DOLLY MIXTURE CHILDREN'S UMBRELLA,1,3/7/2011 14:51,3.25,15752,United Kingdom
545872,20682,RED RETROSPOT CHILDRENS UMBRELLA,1,3/7/2011 14:51,3.25,15752,United Kingdom
545872,22173,METAL 4 HOOK HANGER FRENCH CHATEAU,2,3/7/2011 14:51,2.95,15752,United Kingdom
545872,84792,ENCHANTED BIRD COATHANGER 5 HOOK,2,3/7/2011 14:51,4.65,15752,United Kingdom
545872,22912,YELLOW COAT RACK PARIS FASHION,1,3/7/2011 14:51,4.95,15752,United Kingdom
545872,22914,BLUE COAT RACK PARIS FASHION,1,3/7/2011 14:51,4.95,15752,United Kingdom
545872,22913,RED COAT RACK PARIS FASHION,1,3/7/2011 14:51,4.95,15752,United Kingdom
545872,84836,ZINC METAL HEART DECORATION,2,3/7/2011 14:51,1.25,15752,United Kingdom
545872,22418,10 COLOUR SPACEBOY PEN,12,3/7/2011 14:51,0.85,15752,United Kingdom
545872,22147,FELTCRAFT BUTTERFLY HEARTS,2,3/7/2011 14:51,1.45,15752,United Kingdom
545872,22263,FELT EGG COSY LADYBIRD ,4,3/7/2011 14:51,0.85,15752,United Kingdom
545872,22620,4 TRADITIONAL SPINNING TOPS,2,3/7/2011 14:51,1.25,15752,United Kingdom
545872,22557,PLASTERS IN TIN VINTAGE PAISLEY ,2,3/7/2011 14:51,1.65,15752,United Kingdom
545872,22553,PLASTERS IN TIN SKULLS,2,3/7/2011 14:51,1.65,15752,United Kingdom
545872,22261,FELT EGG COSY WHITE RABBIT ,4,3/7/2011 14:51,0.85,15752,United Kingdom
545872,22262,FELT EGG COSY CHICKEN,4,3/7/2011 14:51,0.85,15752,United Kingdom
545872,22566,FELTCRAFT HAIRBAND PINK AND PURPLE,1,3/7/2011 14:51,0.85,15752,United Kingdom
545872,22586,FELTCRAFT HAIRBAND PINK AND BLUE,2,3/7/2011 14:51,0.85,15752,United Kingdom
545872,22565,FELTCRAFT HAIRBANDS PINK AND WHITE ,1,3/7/2011 14:51,0.85,15752,United Kingdom
545872,22587,FELTCRAFT HAIRBAND RED AND BLUE,1,3/7/2011 14:51,0.85,15752,United Kingdom
545872,20657,TROPICAL LUGGAGE TAG,2,3/7/2011 14:51,1.25,15752,United Kingdom
545872,21445,12 PINK ROSE PEG PLACE SETTINGS,2,3/7/2011 14:51,1.25,15752,United Kingdom
545872,22534,MAGIC DRAWING SLATE SPACEBOY ,5,3/7/2011 14:51,0.42,15752,United Kingdom
545872,22536,MAGIC DRAWING SLATE PURDEY,5,3/7/2011 14:51,0.42,15752,United Kingdom
545872,22260,FELT EGG COSY BLUE RABBIT ,4,3/7/2011 14:51,0.85,15752,United Kingdom
545872,22535,MAGIC DRAWING SLATE BUNNIES ,5,3/7/2011 14:51,0.42,15752,United Kingdom
545872,20652,BLUE POLKADOT LUGGAGE TAG ,2,3/7/2011 14:51,1.25,15752,United Kingdom
545872,20707,CRAZY DAISY HEART DECORATION,2,3/7/2011 14:51,1.25,15752,United Kingdom
545872,21507,"ELEPHANT, BIRTHDAY CARD, ",12,3/7/2011 14:51,0.42,15752,United Kingdom
545872,21519,GIN & TONIC DIET GREETING CARD ,12,3/7/2011 14:51,0.42,15752,United Kingdom
545872,22025,RING OF ROSES BIRTHDAY CARD,12,3/7/2011 14:51,0.42,15752,United Kingdom
545872,22029,SPACEBOY BIRTHDAY CARD,12,3/7/2011 14:51,0.42,15752,United Kingdom
545872,22715,CARD WEDDING DAY,12,3/7/2011 14:51,0.42,15752,United Kingdom
545872,16238,PARTY TIME PENCIL ERASERS,5,3/7/2011 14:51,0.21,15752,United Kingdom
545872,10120,DOGGY RUBBER,8,3/7/2011 14:51,0.21,15752,United Kingdom
545872,16237,SLEEPING CAT ERASERS,6,3/7/2011 14:51,0.21,15752,United Kingdom
545872,16236,KITTY PENCIL ERASERS,6,3/7/2011 14:51,0.21,15752,United Kingdom
545872,85038,6 CHOCOLATE LOVE HEART T-LIGHTS,2,3/7/2011 14:51,2.1,15752,United Kingdom
545872,22085,PAPER CHAIN KIT SKULLS ,1,3/7/2011 14:51,2.95,15752,United Kingdom
545872,22083,PAPER CHAIN KIT RETROSPOT,1,3/7/2011 14:51,2.95,15752,United Kingdom
545872,21867,PINK UNION JACK  LUGGAGE TAG,2,3/7/2011 14:51,1.25,15752,United Kingdom
545872,21448,12 DAISY PEGS IN WOOD BOX,2,3/7/2011 14:51,1.65,15752,United Kingdom
545872,84836,ZINC METAL HEART DECORATION,2,3/7/2011 14:51,1.25,15752,United Kingdom
545872,23177,TREASURE ISLAND BOOK BOX,2,3/7/2011 14:51,2.25,15752,United Kingdom
545872,21181,PLEASE ONE PERSON METAL SIGN,1,3/7/2011 14:51,2.1,15752,United Kingdom
545872,21166,COOK WITH WINE METAL SIGN ,1,3/7/2011 14:51,2.08,15752,United Kingdom
545872,21169,YOU'RE CONFUSING ME METAL SIGN ,2,3/7/2011 14:51,1.69,15752,United Kingdom
545872,21908,CHOCOLATE THIS WAY METAL SIGN,1,3/7/2011 14:51,2.1,15752,United Kingdom
545872,82600,NO SINGING METAL SIGN,1,3/7/2011 14:51,2.1,15752,United Kingdom
545872,82582,AREA PATROLLED METAL SIGN,1,3/7/2011 14:51,2.1,15752,United Kingdom
545872,85152,HAND OVER THE CHOCOLATE   SIGN ,1,3/7/2011 14:51,2.1,15752,United Kingdom
545872,82551,LAUNDRY 15C METAL SIGN,2,3/7/2011 14:51,1.45,15752,United Kingdom
545872,82552,WASHROOM METAL SIGN,2,3/7/2011 14:51,1.45,15752,United Kingdom
545872,22245,"HOOK, 1 HANGER ,MAGIC GARDEN",3,3/7/2011 14:51,0.85,15752,United Kingdom
545872,22243,5 HOOK HANGER RED MAGIC TOADSTOOL,3,3/7/2011 14:51,1.65,15752,United Kingdom
545872,22244,3 HOOK HANGER MAGIC GARDEN,3,3/7/2011 14:51,1.95,15752,United Kingdom
545872,46000R,POLYESTER FILLER PAD 45x30cm,2,3/7/2011 14:51,1.45,15752,United Kingdom
545872,22786,CUSHION COVER PINK UNION JACK,2,3/7/2011 14:51,5.95,15752,United Kingdom
545873,23176,ABC TREASURE BOOK BOX ,8,3/7/2011 14:54,2.25,13092,United Kingdom
545873,22622,BOX OF VINTAGE ALPHABET BLOCKS,2,3/7/2011 14:54,9.95,13092,United Kingdom
545873,21056,DOCTOR'S BAG SOFT TOY,3,3/7/2011 14:54,8.95,13092,United Kingdom
545873,22623,BOX OF VINTAGE JIGSAW BLOCKS ,3,3/7/2011 14:54,4.95,13092,United Kingdom
545873,20702,PINK PADDED MOBILE,3,3/7/2011 14:54,4.25,13092,United Kingdom
545873,22320,BIRDS MOBILE VINTAGE DESIGN,3,3/7/2011 14:54,5.95,13092,United Kingdom
545874,21458,2 PICTURE BOOK EGGS EASTER BUNNY,12,3/7/2011 15:02,1.25,12841,United Kingdom
545874,21457,2 PICTURE BOOK EGGS EASTER DUCKS,12,3/7/2011 15:02,1.25,12841,United Kingdom
545874,21456,2 PICTURE BOOK EGGS EASTER CHICKS,12,3/7/2011 15:02,1.25,12841,United Kingdom
545874,84378,SET OF 3 HEART COOKIE CUTTERS,6,3/7/2011 15:02,1.25,12841,United Kingdom
545874,22993,SET OF 4 PANTRY JELLY MOULDS,3,3/7/2011 15:02,1.25,12841,United Kingdom
545874,84228,HEN HOUSE W CHICK STANDING,10,3/7/2011 15:02,0.42,12841,United Kingdom
545874,21380,WOODEN HAPPY BIRTHDAY GARLAND,4,3/7/2011 15:02,2.95,12841,United Kingdom
545874,84231,EASTER BUNNY WITH BASKET ON BACK,11,3/7/2011 15:02,0.65,12841,United Kingdom
545875,21736,Adjustment,34,3/7/2011 15:18,0,,United Kingdom
545883,85163A,WHITE BAROQUE WALL CLOCK ,1,3/7/2011 15:40,12.75,15974,United Kingdom
545883,85163B,BLACK BAROQUE WALL CLOCK ,1,3/7/2011 15:40,12.75,15974,United Kingdom
545883,85116,BLACK CANDELABRA T-LIGHT HOLDER,6,3/7/2011 15:40,2.1,15974,United Kingdom
545883,79321,CHILLI LIGHTS,4,3/7/2011 15:40,5.75,15974,United Kingdom
545883,85180A,RED HEARTS LIGHT CHAIN ,3,3/7/2011 15:40,4.65,15974,United Kingdom
545883,47351B,BLUE  VOILE LAMPSHADE,6,3/7/2011 15:40,2.95,15974,United Kingdom
545883,21613,S/12 VANILLA  BOTANICAL T-LIGHTS,6,3/7/2011 15:40,2.95,15974,United Kingdom
545883,21609,SET 12 LAVENDER  BOTANICAL T-LIGHTS,6,3/7/2011 15:40,2.95,15974,United Kingdom
545883,22077,6 RIBBONS RUSTIC CHARM,12,3/7/2011 15:40,1.65,15974,United Kingdom
C545884,M,Manual,-1,3/7/2011 15:49,537.83,,United Kingdom
C545885,22667,RECIPE BOX RETROSPOT ,-1,3/7/2011 15:52,2.95,15827,United Kingdom
C545885,22720,SET OF 3 CAKE TINS PANTRY DESIGN ,-1,3/7/2011 15:52,4.95,15827,United Kingdom
C545886,M,Manual,-1,3/7/2011 15:53,222.59,,United Kingdom
C545887,BANK CHARGES,Bank Charges,-1,3/7/2011 15:54,326.68,,United Kingdom
545888,21232,STRAWBERRY CERAMIC TRINKET BOX,72,3/7/2011 16:14,1.06,13798,United Kingdom
545888,84991,60 TEATIME FAIRY CAKE CASES,120,3/7/2011 16:14,0.42,13798,United Kingdom
545888,21181,PLEASE ONE PERSON METAL SIGN,48,3/7/2011 16:14,1.85,13798,United Kingdom
545888,82583,HOT BATHS METAL SIGN,72,3/7/2011 16:14,1.85,13798,United Kingdom
545888,48185,DOORMAT FAIRY CAKE,10,3/7/2011 16:14,6.75,13798,United Kingdom
545889,M,Manual,1,3/7/2011 16:14,45,15291,United Kingdom
545890,22327,ROUND SNACK BOXES SET OF 4 SKULLS,6,3/7/2011 16:39,2.95,16782,United Kingdom
545890,85099B,JUMBO BAG RED RETROSPOT,10,3/7/2011 16:39,1.95,16782,United Kingdom
545890,22776,SWEETHEART CAKESTAND 3 TIER,2,3/7/2011 16:39,9.95,16782,United Kingdom
545890,21754,HOME BUILDING BLOCK WORD,3,3/7/2011 16:39,5.95,16782,United Kingdom
545890,21755,LOVE BUILDING BLOCK WORD,3,3/7/2011 16:39,5.95,16782,United Kingdom
C545891,M,Manual,-1,3/7/2011 16:40,16.05,12754,Japan
C545892,M,Manual,-1,3/7/2011 16:41,17.55,12755,Japan
545894,84459B,YELLOW METAL CHICKEN HEART ,4,3/7/2011 17:04,1.49,16242,United Kingdom
545894,84459A,PINK METAL CHICKEN HEART ,4,3/7/2011 17:04,1.49,16242,United Kingdom
545894,22469,HEART OF WICKER SMALL,10,3/7/2011 17:04,1.65,16242,United Kingdom
545894,22249,DECORATION WHITE CHICK MAGIC GARDEN,6,3/7/2011 17:04,0.85,16242,United Kingdom
545894,22247,BUNNY DECORATION MAGIC GARDEN,6,3/7/2011 17:04,0.85,16242,United Kingdom
545894,22250,DECORATION  BUTTERFLY  MAGIC GARDEN,6,3/7/2011 17:04,0.85,16242,United Kingdom
545894,85214,TUB 24 PINK FLOWER PEGS,3,3/7/2011 17:04,1.65,16242,United Kingdom
545894,84988,SET OF 72 PINK HEART PAPER DOILIES,3,3/7/2011 17:04,1.45,16242,United Kingdom
545894,84987,SET OF 36 TEATIME PAPER DOILIES,3,3/7/2011 17:04,1.45,16242,United Kingdom
545894,22148,EASTER CRAFT 4 CHICKS ,6,3/7/2011 17:04,1.95,16242,United Kingdom
545894,84969,BOX OF 6 ASSORTED COLOUR TEASPOONS,1,3/7/2011 17:04,4.25,16242,United Kingdom
545894,22666,RECIPE BOX PANTRY YELLOW DESIGN,2,3/7/2011 17:04,2.95,16242,United Kingdom
545894,22720,SET OF 3 CAKE TINS PANTRY DESIGN ,2,3/7/2011 17:04,4.95,16242,United Kingdom
545894,21564,PINK  HEART SHAPE LOVE BUCKET ,2,3/7/2011 17:04,2.95,16242,United Kingdom
545894,84789,ENCHANTED BIRD PLANT CAGE,1,3/7/2011 17:04,3.75,16242,United Kingdom
545894,82552,WASHROOM METAL SIGN,4,3/7/2011 17:04,1.45,16242,United Kingdom
545894,22171,3 HOOK PHOTO SHELF ANTIQUE WHITE,1,3/7/2011 17:04,8.5,16242,United Kingdom
545894,22907,PACK OF 20 NAPKINS PANTRY DESIGN,6,3/7/2011 17:04,0.85,16242,United Kingdom
545894,22505,MEMO BOARD COTTAGE DESIGN,1,3/7/2011 17:04,4.95,16242,United Kingdom
545894,84879,ASSORTED COLOUR BIRD ORNAMENT,16,3/7/2011 17:04,1.69,16242,United Kingdom
545894,22170,PICTURE FRAME WOOD TRIPLE PORTRAIT,2,3/7/2011 17:04,6.75,16242,United Kingdom
545894,48194,DOORMAT HEARTS,3,3/7/2011 17:04,7.95,16242,United Kingdom
545894,22692,DOORMAT WELCOME TO OUR HOME,3,3/7/2011 17:04,7.95,16242,United Kingdom
545895,15036,ASSORTED COLOURS SILK FAN,2,3/7/2011 17:14,1.63,,United Kingdom
545895,17084N,FAIRY DREAMS INCENSE ,13,3/7/2011 17:14,0.42,,United Kingdom
545895,17096,ASSORTED LAQUERED INCENSE HOLDERS,13,3/7/2011 17:14,0.42,,United Kingdom
545895,20618,QUEEN OF THE SKIES PASSPORT COVER ,1,3/7/2011 17:14,1.63,,United Kingdom
545895,20677,PINK POLKADOT BOWL,2,3/7/2011 17:14,2.46,,United Kingdom
545895,20685,DOORMAT RED RETROSPOT,1,3/7/2011 17:14,15.79,,United Kingdom
545895,20707,CRAZY DAISY HEART DECORATION,2,3/7/2011 17:14,0.83,,United Kingdom
545895,20719,WOODLAND CHARLOTTE BAG,1,3/7/2011 17:14,1.63,,United Kingdom
545895,20724,RED RETROSPOT CHARLOTTE BAG,1,3/7/2011 17:14,1.63,,United Kingdom
545895,20727,LUNCH BAG  BLACK SKULL.,1,3/7/2011 17:14,4.13,,United Kingdom
545895,20728,LUNCH BAG CARS BLUE,1,3/7/2011 17:14,4.13,,United Kingdom
545895,20770,ABSTRACT CIRCLE JOURNAL ,1,3/7/2011 17:14,2.46,,United Kingdom
545895,20831,GOLD PHOTO FRAME,10,3/7/2011 17:14,4.13,,United Kingdom
545895,20961,STRAWBERRY BATH SPONGE ,3,3/7/2011 17:14,2.46,,United Kingdom
545895,20963,APPLE BATH SPONGE,3,3/7/2011 17:14,2.46,,United Kingdom
545895,20978,36 PENCILS TUBE SKULLS,2,3/7/2011 17:14,2.46,,United Kingdom
545895,20979,36 PENCILS TUBE RED RETROSPOT,1,3/7/2011 17:14,2.46,,United Kingdom
545895,21002,ROSE DU SUD DRAWSTRING BAG,1,3/7/2011 17:14,3.29,,United Kingdom
545895,21033,JUMBO BAG CHARLIE AND LOLA TOYS,1,3/7/2011 17:14,4.13,,United Kingdom
545895,21041,RED RETROSPOT OVEN GLOVE DOUBLE,1,3/7/2011 17:14,5.79,,United Kingdom
545895,21108,FAIRY CAKE FLANNEL ASSORTED COLOUR,1,3/7/2011 17:14,4.96,,United Kingdom
545895,21110,LARGE CAKE TOWEL PINK SPOTS,1,3/7/2011 17:14,13.29,,United Kingdom
545895,21122,SET/10 PINK POLKADOT PARTY CANDLES,1,3/7/2011 17:14,2.46,,United Kingdom
545895,21123,SET/10 IVORY POLKADOT PARTY CANDLES,1,3/7/2011 17:14,2.46,,United Kingdom
545895,21143,ANTIQUE GLASS HEART DECORATION ,1,3/7/2011 17:14,4.13,,United Kingdom
545895,21156,RETROSPOT CHILDRENS APRON,1,3/7/2011 17:14,4.13,,United Kingdom
545895,21195,PINK  HONEYCOMB PAPER BALL ,2,3/7/2011 17:14,4.13,,United Kingdom
545895,21212,PACK OF 72 RETROSPOT CAKE CASES,1,3/7/2011 17:14,1.25,,United Kingdom
545895,21218,RED SPOTTY BISCUIT TIN,1,3/7/2011 17:14,8.29,,United Kingdom
545895,21232,STRAWBERRY CERAMIC TRINKET BOX,12,3/7/2011 17:14,2.46,,United Kingdom
545895,21314,SMALL GLASS HEART TRINKET POT,2,3/7/2011 17:14,4.13,,United Kingdom
545895,21356,TOAST ITS - FAIRY FLOWER,1,3/7/2011 17:14,2.46,,United Kingdom
545895,21365,MIRRORED WALL ART STARS,1,3/7/2011 17:14,5.79,,United Kingdom
545895,21439,BASKET OF TOADSTOOLS,1,3/7/2011 17:14,2.46,,United Kingdom
545895,21441,BLUE BIRDHOUSE DECORATION,1,3/7/2011 17:14,1.63,,United Kingdom
545895,21454,PAINTED PINK RABBIT ,3,3/7/2011 17:14,0.83,,United Kingdom
545895,21455,PAINTED YELLOW WOODEN DAISY,1,3/7/2011 17:14,0.83,,United Kingdom
545895,21458,2 PICTURE BOOK EGGS EASTER BUNNY,1,3/7/2011 17:14,2.46,,United Kingdom
545895,21533,RETROSPOT LARGE MILK JUG,15,3/7/2011 17:14,9.96,,United Kingdom
545895,21626,VINTAGE UNION JACK PENNANT,5,3/7/2011 17:14,1.63,,United Kingdom
545895,21669,BLUE STRIPE CERAMIC DRAWER KNOB,16,3/7/2011 17:14,3.33,,United Kingdom
545895,21731,RED TOADSTOOL LED NIGHT LIGHT,1,3/7/2011 17:14,3.29,,United Kingdom
545895,21774,DECORATIVE CATS BATHROOM BOTTLE,1,3/7/2011 17:14,2.46,,United Kingdom
545895,21775,DECORATIVE FLORE BATHROOM BOTTLE,1,3/7/2011 17:14,2.46,,United Kingdom
545895,21786,POLKADOT RAIN HAT ,20,3/7/2011 17:14,0.83,,United Kingdom
