550964,85123A,WHITE HANGING HEART T-LIGHT HOLDER,32,4/21/2011 16:48,2.55,15856,United Kingdom
550964,84050,PINK HEART SHAPE EGG FRYING PAN,72,4/21/2011 16:48,1.25,15856,United Kingdom
550964,47480,HANGING PHOTO CLIP ROPE LADDER,96,4/21/2011 16:48,1.45,15856,United Kingdom
550965,84709B,PINK OVAL JEWELLED MIRROR,2,4/21/2011 16:53,5.95,16750,United Kingdom
550965,84707A,SILVER JEWELLED MIRROR TRINKET TRAY,2,4/21/2011 16:53,9.95,16750,United Kingdom
550965,20936,FORKED CACTUS CANDLE,2,4/21/2011 16:53,2.95,16750,United Kingdom
550965,20886,BOX OF 9 PEBBLE CANDLES,4,4/21/2011 16:53,1.95,16750,United Kingdom
550965,23136,IVORY WIRE SWEETHEART LETTER TRAY,1,4/21/2011 16:53,3.75,16750,United Kingdom
550965,23137,ZINC WIRE SWEETHEART LETTER TRAY,1,4/21/2011 16:53,3.75,16750,United Kingdom
550965,85174,S/4 CACTI CANDLES,2,4/21/2011 16:53,4.95,16750,United Kingdom
550965,22811,SET OF 6 T-LIGHTS CACTI ,2,4/21/2011 16:53,2.95,16750,United Kingdom
550965,22776,SWEETHEART CAKESTAND 3 TIER,1,4/21/2011 16:53,9.95,16750,United Kingdom
550965,84078A,SET/4 WHITE RETRO STORAGE CUBES ,1,4/21/2011 16:53,39.95,16750,United Kingdom
C550966,22841,ROUND CAKE TIN VINTAGE GREEN,-1,4/21/2011 16:57,7.95,17663,United Kingdom
550967,22228,BUNNY WOODEN PAINTED WITH BIRD ,12,4/21/2011 16:58,0.85,12971,United Kingdom
550967,84988,SET OF 72 PINK HEART PAPER DOILIES,12,4/21/2011 16:58,1.45,12971,United Kingdom
550967,21448,12 DAISY PEGS IN WOOD BOX,12,4/21/2011 16:58,1.65,12971,United Kingdom
550968,21626,VINTAGE UNION JACK PENNANT,12,4/21/2011 16:59,1.95,14961,United Kingdom
550968,22499,WOODEN UNION JACK BUNTING,9,4/21/2011 16:59,5.95,14961,United Kingdom
550968,21232,STRAWBERRY CERAMIC TRINKET BOX,12,4/21/2011 16:59,1.25,14961,United Kingdom
550968,21231,SWEETHEART CERAMIC TRINKET BOX,12,4/21/2011 16:59,1.25,14961,United Kingdom
550968,22055,MINI CAKE STAND  HANGING STRAWBERY,8,4/21/2011 16:59,1.65,14961,United Kingdom
550968,37446,MINI CAKE STAND WITH HANGING CAKES,8,4/21/2011 16:59,1.45,14961,United Kingdom
550968,85066,CREAM SWEETHEART MINI CHEST,2,4/21/2011 16:59,12.75,14961,United Kingdom
550968,20846,ZINC HEART LATTICE T-LIGHT HOLDER,12,4/21/2011 16:59,1.25,14961,United Kingdom
550968,22151,PLACE SETTING WHITE HEART,24,4/21/2011 16:59,0.42,14961,United Kingdom
550968,21198,WHITE HEART CONFETTI IN TUBE,12,4/21/2011 16:59,1.65,14961,United Kingdom
550968,21199,PINK  HEART CONFETTI IN TUBE,12,4/21/2011 16:59,1.65,14961,United Kingdom
550968,22595,GINGHAM HEART DECORATION,12,4/21/2011 16:59,0.85,14961,United Kingdom
550968,22855,FINE WICKER HEART ,24,4/21/2011 16:59,1.25,14961,United Kingdom
550968,84988,SET OF 72 PINK HEART PAPER DOILIES,12,4/21/2011 16:59,1.45,14961,United Kingdom
550968,22965,3 TRADITIONAl BISCUIT CUTTERS  SET,6,4/21/2011 16:59,2.1,14961,United Kingdom
550968,22960,JAM MAKING SET WITH JARS,6,4/21/2011 16:59,4.25,14961,United Kingdom
550968,22722,SET OF 6 SPICE TINS PANTRY DESIGN,4,4/21/2011 16:59,3.95,14961,United Kingdom
550968,22980,PANTRY SCRUBBING BRUSH,12,4/21/2011 16:59,1.65,14961,United Kingdom
550968,22989,SET 2 PANTRY DESIGN TEA TOWELS,6,4/21/2011 16:59,3.25,14961,United Kingdom
550968,22978,PANTRY ROLLING PIN,6,4/21/2011 16:59,3.75,14961,United Kingdom
550968,22990,COTTON APRON PANTRY DESIGN,2,4/21/2011 16:59,4.95,14961,United Kingdom
550968,22979,PANTRY WASHING UP BRUSH,12,4/21/2011 16:59,1.45,14961,United Kingdom
550968,22982,PANTRY PASTRY BRUSH,12,4/21/2011 16:59,1.25,14961,United Kingdom
550968,22993,SET OF 4 PANTRY JELLY MOULDS,12,4/21/2011 16:59,1.25,14961,United Kingdom
550968,22384,LUNCH BAG PINK POLKADOT,10,4/21/2011 16:59,1.65,14961,United Kingdom
550968,22423,REGENCY CAKESTAND 3 TIER,2,4/21/2011 16:59,12.75,14961,United Kingdom
550968,22699,ROSES REGENCY TEACUP AND SAUCER ,6,4/21/2011 16:59,2.95,14961,United Kingdom
550968,22697,GREEN REGENCY TEACUP AND SAUCER,6,4/21/2011 16:59,2.95,14961,United Kingdom
550968,20725,LUNCH BAG RED RETROSPOT,10,4/21/2011 16:59,1.65,14961,United Kingdom
550968,20724,RED RETROSPOT CHARLOTTE BAG,10,4/21/2011 16:59,0.85,14961,United Kingdom
550968,20914,SET/5 RED RETROSPOT LID GLASS BOWLS,6,4/21/2011 16:59,2.95,14961,United Kingdom
550968,21080,SET/20 RED RETROSPOT PAPER NAPKINS ,12,4/21/2011 16:59,0.85,14961,United Kingdom
550968,21216,"SET 3 RETROSPOT TEA,COFFEE,SUGAR",4,4/21/2011 16:59,4.95,14961,United Kingdom
550968,21531,RED RETROSPOT SUGAR JAM BOWL,6,4/21/2011 16:59,2.55,14961,United Kingdom
550968,21533,RETROSPOT LARGE MILK JUG,3,4/21/2011 16:59,4.95,14961,United Kingdom
550968,21535,RED RETROSPOT SMALL MILK JUG,6,4/21/2011 16:59,2.55,14961,United Kingdom
550968,21844,RED RETROSPOT MUG,6,4/21/2011 16:59,2.95,14961,United Kingdom
550968,21671,RED SPOT CERAMIC DRAWER KNOB,12,4/21/2011 16:59,1.25,14961,United Kingdom
550968,22072,RED RETROSPOT TEA CUP AND SAUCER ,8,4/21/2011 16:59,3.75,14961,United Kingdom
550968,22199,FRYING PAN RED RETROSPOT,4,4/21/2011 16:59,4.25,14961,United Kingdom
C550969,21790,VINTAGE SNAP CARDS,-12,4/21/2011 17:00,0.85,14152,United Kingdom
550970,82599,,-11,4/21/2011 17:02,0,,United Kingdom
550971,22969,HOMEMADE JAM SCENTED CANDLES,12,4/21/2011 17:03,1.45,13482,United Kingdom
550971,21231,SWEETHEART CERAMIC TRINKET BOX,12,4/21/2011 17:03,1.25,13482,United Kingdom
550971,22111,SCOTTIE DOG HOT WATER BOTTLE,3,4/21/2011 17:03,4.95,13482,United Kingdom
550971,21983,PACK OF 12 BLUE PAISLEY TISSUES ,24,4/21/2011 17:03,0.29,13482,United Kingdom
550971,20978,36 PENCILS TUBE SKULLS,16,4/21/2011 17:03,1.25,13482,United Kingdom
550971,22744,MAKE YOUR OWN MONSOON CARD KIT,6,4/21/2011 17:03,2.95,13482,United Kingdom
550971,22556,PLASTERS IN TIN CIRCUS PARADE ,12,4/21/2011 17:03,1.65,13482,United Kingdom
550971,85014B,RED RETROSPOT UMBRELLA,3,4/21/2011 17:03,5.95,13482,United Kingdom
550971,22568,FELTCRAFT CUSHION OWL,4,4/21/2011 17:03,3.75,13482,United Kingdom
550971,21833,CAMOUFLAGE LED TORCH,12,4/21/2011 17:03,1.69,13482,United Kingdom
550971,21329,DINOSAURS  WRITING SET ,12,4/21/2011 17:03,1.65,13482,United Kingdom
550972,21672,WHITE SPOT RED CERAMIC DRAWER KNOB,1,4/21/2011 17:05,1.25,14031,United Kingdom
550972,15036,ASSORTED COLOURS SILK FAN,1,4/21/2011 17:05,0.83,14031,United Kingdom
550972,20718,RED RETROSPOT SHOPPER BAG,1,4/21/2011 17:05,1.25,14031,United Kingdom
550972,22379,RECYCLING BAG RETROSPOT ,1,4/21/2011 17:05,2.1,14031,United Kingdom
550972,21154,RED RETROSPOT OVEN GLOVE ,1,4/21/2011 17:05,1.25,14031,United Kingdom
550972,21042,RED RETROSPOT APRON ,1,4/21/2011 17:05,5.95,14031,United Kingdom
550972,85136A,YELLOW SHARK HELICOPTER,1,4/21/2011 17:05,7.95,14031,United Kingdom
550972,85062,PEARL CRYSTAL PUMPKIN T-LIGHT HLDR,6,4/21/2011 17:05,1.65,14031,United Kingdom
550972,15039,SANDALWOOD FAN,1,4/21/2011 17:05,0.85,14031,United Kingdom
550972,22352,LUNCH BOX WITH CUTLERY RETROSPOT ,1,4/21/2011 17:05,2.55,14031,United Kingdom
550972,82011C,BATHROOM SCALES FOOTPRINTS IN SAND,1,4/21/2011 17:05,3.75,14031,United Kingdom
550972,21217,RED RETROSPOT ROUND CAKE TINS,1,4/21/2011 17:05,9.95,14031,United Kingdom
550972,23049,RECYCLED ACAPULCO MAT RED,1,4/21/2011 17:05,8.25,14031,United Kingdom
550972,21094,SET/6 RED SPOTTY PAPER PLATES,3,4/21/2011 17:05,0.85,14031,United Kingdom
550972,22072,RED RETROSPOT TEA CUP AND SAUCER ,4,4/21/2011 17:05,3.75,14031,United Kingdom
550972,20963,APPLE BATH SPONGE,2,4/21/2011 17:05,1.25,14031,United Kingdom
550972,21086,SET/6 RED SPOTTY PAPER CUPS,4,4/21/2011 17:05,0.65,14031,United Kingdom
550972,22199,FRYING PAN RED RETROSPOT,1,4/21/2011 17:05,4.25,14031,United Kingdom
550972,22203,MILK PAN RED RETROSPOT,1,4/21/2011 17:05,3.75,14031,United Kingdom
550972,21718,RED METAL BEACH SPADE ,1,4/21/2011 17:05,1.25,14031,United Kingdom
550972,21559,STRAWBERRY LUNCH BOX WITH CUTLERY,1,4/21/2011 17:05,2.55,14031,United Kingdom
550972,71459,HANGING JAM JAR T-LIGHT HOLDER,11,4/21/2011 17:05,0.85,14031,United Kingdom
550973,23052,RECYCLED ACAPULCO MAT TURQUOISE,3,4/21/2011 17:06,8.25,14031,United Kingdom
550973,23051,RECYCLED ACAPULCO MAT BLUE,2,4/21/2011 17:06,8.25,14031,United Kingdom
550973,23049,RECYCLED ACAPULCO MAT RED,2,4/21/2011 17:06,8.25,14031,United Kingdom
550973,21843,RED RETROSPOT CAKE STAND,1,4/21/2011 17:06,10.95,14031,United Kingdom
550973,22925,BLUE GIANT GARDEN THERMOMETER,4,4/21/2011 17:06,5.95,14031,United Kingdom
550973,22926,IVORY GIANT GARDEN THERMOMETER,4,4/21/2011 17:06,5.95,14031,United Kingdom
550973,21922,UNION STRIPE WITH FRINGE  HAMMOCK,3,4/21/2011 17:06,7.95,14031,United Kingdom
550973,15056N,EDWARDIAN PARASOL NATURAL,12,4/21/2011 17:06,5.95,14031,United Kingdom
550973,22710,WRAP I LOVE LONDON ,25,4/21/2011 17:06,0.42,14031,United Kingdom
550973,21794,CLASSIC FRENCH STYLE BASKET NATURAL,8,4/21/2011 17:06,3.95,14031,United Kingdom
550973,84879,ASSORTED COLOUR BIRD ORNAMENT,160,4/21/2011 17:06,1.45,14031,United Kingdom
550973,22660,DOORMAT I LOVE LONDON,10,4/21/2011 17:06,6.75,14031,United Kingdom
550973,22605,WOODEN CROQUET GARDEN SET,4,4/21/2011 17:06,12.75,14031,United Kingdom
550973,22607,WOODEN ROUNDERS GARDEN SET ,8,4/21/2011 17:06,8.5,14031,United Kingdom
550973,22606,WOODEN SKITTLES GARDEN SET,4,4/21/2011 17:06,12.75,14031,United Kingdom
550973,37370,RETRO COFFEE MUGS ASSORTED,144,4/21/2011 17:06,1.06,14031,United Kingdom
550974,22993,SET OF 4 PANTRY JELLY MOULDS,12,4/21/2011 17:10,1.25,13862,United Kingdom
550974,23076,ICE CREAM SUNDAE LIP GLOSS,24,4/21/2011 17:10,1.25,13862,United Kingdom
550974,23155,KNICKERBOCKERGLORY MAGNET ASSORTED ,12,4/21/2011 17:10,0.83,13862,United Kingdom
550974,84978,HANGING HEART JAR T-LIGHT HOLDER,12,4/21/2011 17:10,1.25,13862,United Kingdom
550974,22178,VICTORIAN GLASS HANGING T-LIGHT,12,4/21/2011 17:10,1.25,13862,United Kingdom
550974,21936,RED RETROSPOT PICNIC BAG,5,4/21/2011 17:10,2.95,13862,United Kingdom
550974,21937,STRAWBERRY   PICNIC BAG,5,4/21/2011 17:10,2.95,13862,United Kingdom
550974,20728,LUNCH BAG CARS BLUE,10,4/21/2011 17:10,1.65,13862,United Kingdom
550974,22384,LUNCH BAG PINK POLKADOT,10,4/21/2011 17:10,1.65,13862,United Kingdom
550974,47591D,PINK FAIRY CAKE CHILDRENS APRON,8,4/21/2011 17:10,1.95,13862,United Kingdom
550974,84755,COLOUR GLASS T-LIGHT HOLDER HANGING,16,4/21/2011 17:10,0.65,13862,United Kingdom
550975,20941,,20,4/21/2011 17:28,0,,United Kingdom
550976,84921,,6,4/21/2011 17:28,0,,United Kingdom
550977,85200,,6,4/21/2011 17:29,0,,United Kingdom
550978,22083,PAPER CHAIN KIT RETROSPOT,6,4/21/2011 17:31,2.95,13983,United Kingdom
550978,21205,MULTICOLOUR 3D BALLS GARLAND,6,4/21/2011 17:31,2.55,13983,United Kingdom
550978,22197,SMALL POPCORN HOLDER,12,4/21/2011 17:31,0.85,13983,United Kingdom
550978,21090,SET/6 COLLAGE PAPER PLATES,24,4/21/2011 17:31,0.39,13983,United Kingdom
550978,21084,SET/6 COLLAGE PAPER CUPS,24,4/21/2011 17:31,0.19,13983,United Kingdom
550978,22087,PAPER BUNTING WHITE LACE,6,4/21/2011 17:31,2.95,13983,United Kingdom
550978,22088,PAPER BUNTING COLOURED LACE,6,4/21/2011 17:31,2.95,13983,United Kingdom
550978,84212,"ASSORTED FLOWER COLOUR ""LEIS""",24,4/21/2011 17:31,0.65,13983,United Kingdom
550978,71459,HANGING JAM JAR T-LIGHT HOLDER,48,4/21/2011 17:31,0.85,13983,United Kingdom
550978,22423,REGENCY CAKESTAND 3 TIER,3,4/21/2011 17:31,12.75,13983,United Kingdom
550978,22697,GREEN REGENCY TEACUP AND SAUCER,6,4/21/2011 17:31,2.95,13983,United Kingdom
550978,22698,PINK REGENCY TEACUP AND SAUCER,6,4/21/2011 17:31,2.95,13983,United Kingdom
550978,22699,ROSES REGENCY TEACUP AND SAUCER ,6,4/21/2011 17:31,2.95,13983,United Kingdom
550978,21080,SET/20 RED RETROSPOT PAPER NAPKINS ,12,4/21/2011 17:31,0.85,13983,United Kingdom
550978,21094,SET/6 RED SPOTTY PAPER PLATES,12,4/21/2011 17:31,0.85,13983,United Kingdom
550978,21086,SET/6 RED SPOTTY PAPER CUPS,12,4/21/2011 17:31,0.65,13983,United Kingdom
550978,21985,PACK OF 12 HEARTS DESIGN TISSUES ,24,4/21/2011 17:31,0.29,13983,United Kingdom
550978,21121,SET/10 RED POLKADOT PARTY CANDLES,24,4/21/2011 17:31,1.25,13983,United Kingdom
550979,85145,,9,4/21/2011 17:31,0,,United Kingdom
550980,21445,,1,4/21/2011 17:31,0,,United Kingdom
550981,21911,,1,4/21/2011 17:32,0,,United Kingdom
550982,22632,,5,4/21/2011 17:33,0,,United Kingdom
550983,22866,,4,4/21/2011 17:34,0,,United Kingdom
550984,85008,,1,4/21/2011 17:35,0,,United Kingdom
550985,22777,,4,4/21/2011 17:40,0,,United Kingdom
550986,17003,BROCADE RING PURSE ,4,4/21/2011 18:06,0.63,,United Kingdom
550986,17084N,FAIRY DREAMS INCENSE ,1,4/21/2011 18:06,0.42,,United Kingdom
550986,18094C,WHITE AND BLUE CERAMIC OIL BURNER,1,4/21/2011 18:06,2.46,,United Kingdom
550986,20665,RED RETROSPOT PURSE ,1,4/21/2011 18:06,5.79,,United Kingdom
550986,20696,FLORAL SOFT CAR TOY,1,4/21/2011 18:06,7.46,,United Kingdom
550986,20712,JUMBO BAG WOODLAND ANIMALS,2,4/21/2011 18:06,4.13,,United Kingdom
550986,20716,PARTY FOOD SHOPPER BAG,1,4/21/2011 18:06,0.83,,United Kingdom
550986,20719,WOODLAND CHARLOTTE BAG,1,4/21/2011 18:06,1.63,,United Kingdom
550986,20725,LUNCH BAG RED RETROSPOT,50,4/21/2011 18:06,3.3,,United Kingdom
550986,20828,GLITTER BUTTERFLY CLIPS,1,4/21/2011 18:06,4.96,,United Kingdom
550986,21012,ANTIQUE ALL GLASS CANDLESTICK,1,4/21/2011 18:06,2.46,,United Kingdom
550986,21086,SET/6 RED SPOTTY PAPER CUPS,2,4/21/2011 18:06,1.63,,United Kingdom
550986,21175,GIN + TONIC DIET METAL SIGN,1,4/21/2011 18:06,4.96,,United Kingdom
550986,21181,PLEASE ONE PERSON METAL SIGN,1,4/21/2011 18:06,4.13,,United Kingdom
550986,21232,STRAWBERRY CERAMIC TRINKET BOX,1,4/21/2011 18:06,2.46,,United Kingdom
550986,21242,RED RETROSPOT PLATE ,1,4/21/2011 18:06,3.29,,United Kingdom
550986,21243,PINK  POLKADOT PLATE ,2,4/21/2011 18:06,3.29,,United Kingdom
550986,21244,BLUE POLKADOT PLATE ,2,4/21/2011 18:06,3.29,,United Kingdom
550986,21245,GREEN POLKADOT PLATE ,1,4/21/2011 18:06,3.29,,United Kingdom
550986,21380,WOODEN HAPPY BIRTHDAY GARLAND,1,4/21/2011 18:06,5.79,,United Kingdom
550986,21385,IVORY HANGING DECORATION  HEART,2,4/21/2011 18:06,1.63,,United Kingdom
550986,21389,IVORY HANGING DECORATION  BIRD,1,4/21/2011 18:06,1.63,,United Kingdom
550986,21390,FILIGRIS HEART WITH BUTTERFLY,2,4/21/2011 18:06,2.46,,United Kingdom
550986,21418,STARFISH SOAP DISH,1,4/21/2011 18:06,4.96,,United Kingdom
550986,21420,OYSTER TRINKET BOX,1,4/21/2011 18:06,6.63,,United Kingdom
550986,21447,12 IVORY ROSE PEG PLACE SETTINGS,2,4/21/2011 18:06,2.46,,United Kingdom
550986,21458,2 PICTURE BOOK EGGS EASTER BUNNY,1,4/21/2011 18:06,2.46,,United Kingdom
550986,21533,RETROSPOT LARGE MILK JUG,1,4/21/2011 18:06,9.96,,United Kingdom
550986,21534,DAIRY MAID LARGE MILK JUG,1,4/21/2011 18:06,9.96,,United Kingdom
550986,21654,RIDGED GLASS FINGER BOWL,1,4/21/2011 18:06,1.63,,United Kingdom
550986,21656,RIDGED GLASS POSY VASE ,2,4/21/2011 18:06,1.63,,United Kingdom
550986,21716,BOYS VINTAGE TIN SEASIDE BUCKET,1,4/21/2011 18:06,4.96,,United Kingdom
550986,21731,RED TOADSTOOL LED NIGHT LIGHT,3,4/21/2011 18:06,3.29,,United Kingdom
550986,21928,JUMBO BAG SCANDINAVIAN BLUE PAISLEY,1,4/21/2011 18:06,4.13,,United Kingdom
550986,21929,JUMBO BAG PINK VINTAGE PAISLEY,1,4/21/2011 18:06,4.13,,United Kingdom
550986,21931,JUMBO STORAGE BAG SUKI,1,4/21/2011 18:06,4.13,,United Kingdom
550986,21933,PINK VINTAGE PAISLEY PICNIC BAG,1,4/21/2011 18:06,2.46,,United Kingdom
550986,21991,BOHEMIAN COLLAGE STATIONERY SET,1,4/21/2011 18:06,2.46,,United Kingdom
550986,21992,VINTAGE PAISLEY STATIONERY SET,2,4/21/2011 18:06,2.46,,United Kingdom
550986,22077,6 RIBBONS RUSTIC CHARM,1,4/21/2011 18:06,3.29,,United Kingdom
550986,22083,PAPER CHAIN KIT RETROSPOT,2,4/21/2011 18:06,5.79,,United Kingdom
550986,22084,PAPER CHAIN KIT EMPIRE,1,4/21/2011 18:06,5.79,,United Kingdom
550986,22087,PAPER BUNTING WHITE LACE,11,4/21/2011 18:06,5.79,,United Kingdom
550986,22090,PAPER BUNTING RETROSPOT,9,4/21/2011 18:06,5.79,,United Kingdom
550986,22139,RETROSPOT TEA SET CERAMIC 11 PC ,1,4/21/2011 18:06,10.79,,United Kingdom
550986,22148,EASTER CRAFT 4 CHICKS ,1,4/21/2011 18:06,4.13,,United Kingdom
550986,22156,HEART DECORATION WITH PEARLS ,6,4/21/2011 18:06,1.63,,United Kingdom
550986,22161,HEART DECORATION RUSTIC HANGING ,6,4/21/2011 18:06,0.79,,United Kingdom
550986,22167, OVAL WALL MIRROR DIAMANTE ,1,4/21/2011 18:06,8.29,,United Kingdom
550986,22169,FAMILY ALBUM WHITE PICTURE FRAME,2,4/21/2011 18:06,16.63,,United Kingdom
550986,22227,HANGING HEART MIRROR DECORATION ,3,4/21/2011 18:06,1.25,,United Kingdom
550986,22233,JIGSAW RABBIT AND BIRDHOUSE,1,4/21/2011 18:06,3.29,,United Kingdom
550986,22241,GARLAND WOODEN HAPPY EASTER,1,4/21/2011 18:06,2.46,,United Kingdom
550986,22260,FELT EGG COSY BLUE RABBIT ,5,4/21/2011 18:06,1.63,,United Kingdom
550986,22262,FELT EGG COSY CHICKEN,6,4/21/2011 18:06,1.63,,United Kingdom
550986,22264,FELT FARM ANIMAL WHITE BUNNY ,3,4/21/2011 18:06,1.63,,United Kingdom
550986,22283,6 EGG HOUSE PAINTED WOOD,1,4/21/2011 18:06,15.79,,United Kingdom
550986,22297,HEART IVORY TRELLIS SMALL,2,4/21/2011 18:06,2.46,,United Kingdom
550986,22318,FIVE HEART HANGING DECORATION,1,4/21/2011 18:06,5.79,,United Kingdom
550986,22321,BIRD DECORATION RED RETROSPOT,1,4/21/2011 18:06,1.63,,United Kingdom
550986,22322,BIRD DECORATION GREEN POLKADOT,1,4/21/2011 18:06,1.63,,United Kingdom
550986,22355,CHARLOTTE BAG SUKI DESIGN,1,4/21/2011 18:06,1.63,,United Kingdom
550986,22359,GLASS JAR KINGS CHOICE,1,4/21/2011 18:06,5.79,,United Kingdom
550986,22364,GLASS JAR DIGESTIVE BISCUITS,1,4/21/2011 18:06,5.79,,United Kingdom
550986,22379,RECYCLING BAG RETROSPOT ,1,4/21/2011 18:06,4.13,,United Kingdom
550986,22409,MONEY BOX BISCUITS DESIGN,1,4/21/2011 18:06,2.46,,United Kingdom
550986,22411,JUMBO SHOPPER VINTAGE RED PAISLEY,1,4/21/2011 18:06,4.13,,United Kingdom
550986,22423,REGENCY CAKESTAND 3 TIER,2,4/21/2011 18:06,24.96,,United Kingdom
550986,22431,WATERING CAN BLUE ELEPHANT,1,4/21/2011 18:06,4.13,,United Kingdom
550986,22432,WATERING CAN PINK BUNNY,2,4/21/2011 18:06,4.13,,United Kingdom
550986,22477,WATERING CAN GARDEN MARKER,1,4/21/2011 18:06,2.46,,United Kingdom
550986,22478,BIRDHOUSE GARDEN MARKER ,1,4/21/2011 18:06,2.46,,United Kingdom
550986,22479,DAISY GARDEN MARKER,1,4/21/2011 18:06,2.46,,United Kingdom
550986,22485,SET OF 2 WOODEN MARKET CRATES,1,4/21/2011 18:06,24.96,,United Kingdom
550986,22501,PICNIC BASKET WICKER LARGE,1,4/21/2011 18:06,20.79,,United Kingdom
550986,22502,PICNIC BASKET WICKER SMALL,2,4/21/2011 18:06,10.79,,United Kingdom
550986,22602,RETROSPOT WOODEN HEART DECORATION,1,4/21/2011 18:06,1.63,,United Kingdom
550986,22639,SET OF 4 NAPKIN CHARMS HEARTS,2,4/21/2011 18:06,4.96,,United Kingdom
550986,22642,SET OF 4 NAPKIN CHARMS STARS   ,4,4/21/2011 18:06,4.96,,United Kingdom
550986,22649,STRAWBERRY FAIRY CAKE TEAPOT,1,4/21/2011 18:06,10.79,,United Kingdom
550986,22677,FRENCH BLUE METAL DOOR SIGN 2,2,4/21/2011 18:06,2.46,,United Kingdom
550986,22683,FRENCH BLUE METAL DOOR SIGN 8,2,4/21/2011 18:06,2.46,,United Kingdom
550986,22686,FRENCH BLUE METAL DOOR SIGN No,2,4/21/2011 18:06,2.46,,United Kingdom
550986,22697,GREEN REGENCY TEACUP AND SAUCER,3,4/21/2011 18:06,5.79,,United Kingdom
550986,22698,PINK REGENCY TEACUP AND SAUCER,4,4/21/2011 18:06,5.79,,United Kingdom
550986,22699,ROSES REGENCY TEACUP AND SAUCER ,5,4/21/2011 18:06,5.79,,United Kingdom
550986,22722,SET OF 6 SPICE TINS PANTRY DESIGN,1,4/21/2011 18:06,8.29,,United Kingdom
550986,22794,SWEETHEART WIRE MAGAZINE RACK,1,4/21/2011 18:06,15.79,,United Kingdom
550986,22808,SET OF 6 T-LIGHTS EASTER CHICKS,1,4/21/2011 18:06,5.79,,United Kingdom
550986,22814,CARD PARTY GAMES ,1,4/21/2011 18:06,0.83,,United Kingdom
550986,22854,CREAM SWEETHEART EGG HOLDER,1,4/21/2011 18:06,10.79,,United Kingdom
550986,22855,FINE WICKER HEART ,6,4/21/2011 18:06,2.46,,United Kingdom
550986,22928,YELLOW GIANT GARDEN THERMOMETER,1,4/21/2011 18:06,12.46,,United Kingdom
550986,22968,ROSE COTTAGE KEEPSAKE BOX ,1,4/21/2011 18:06,19.96,,United Kingdom
550986,22972,CHILDREN'S SPACEBOY MUG,1,4/21/2011 18:06,3.29,,United Kingdom
550986,22975,SPACEBOY CHILDRENS EGG CUP,1,4/21/2011 18:06,2.46,,United Kingdom
550986,22981,PANTRY APPLE CORER,1,4/21/2011 18:06,2.92,,United Kingdom
550986,23000,TRAVEL CARD WALLET TRANSPORT,1,4/21/2011 18:06,0.83,,United Kingdom
550986,23146,TRIPLE HOOK ANTIQUE IVORY ROSE,1,4/21/2011 18:06,6.63,,United Kingdom
550986,23199,JUMBO BAG APPLES,1,4/21/2011 18:06,4.13,,United Kingdom
550986,23201,JUMBO BAG ALPHABET,1,4/21/2011 18:06,4.13,,United Kingdom
550986,23204,CHARLOTTE BAG APPLES DESIGN,1,4/21/2011 18:06,1.63,,United Kingdom
550986,23205,CHARLOTTE BAG VINTAGE ALPHABET ,3,4/21/2011 18:06,1.63,,United Kingdom
550986,35923,CANDY HEART HANGING DECORATION,1,4/21/2011 18:06,2.46,,United Kingdom
550986,35961,FOLKART ZINC HEART CHRISTMAS DEC,3,4/21/2011 18:06,1.63,,United Kingdom
550986,37342,POLKADOT COFFEE CUP & SAUCER PINK,4,4/21/2011 18:06,2.46,,United Kingdom
550986,37370,RETRO COFFEE MUGS ASSORTED,1,4/21/2011 18:06,15.79,,United Kingdom
550986,46776A,WOVEN BUBBLE GUM CUSHION COVER,2,4/21/2011 18:06,4.13,,United Kingdom
550986,46776F,WOVEN ROSE GARDEN CUSHION COVER ,2,4/21/2011 18:06,4.13,,United Kingdom
550986,47021G,SET/6 BEAD COASTERS GAUZE BAG GOLD,2,4/21/2011 18:06,1.63,,United Kingdom
550986,47566,PARTY BUNTING,2,4/21/2011 18:06,10.79,,United Kingdom
550986,47566B,TEA TIME PARTY BUNTING,3,4/21/2011 18:06,10.79,,United Kingdom
550986,47593B,SCOTTIE DOGS BABY BIB,1,4/21/2011 18:06,0.83,,United Kingdom
550986,48138,DOORMAT UNION FLAG,1,4/21/2011 18:06,15.79,,United Kingdom
550986,48188,DOORMAT WELCOME PUPPIES,1,4/21/2011 18:06,15.79,,United Kingdom
550986,71459,HANGING JAM JAR T-LIGHT HOLDER,4,4/21/2011 18:06,1.66,,United Kingdom
550986,72351B,SET/6 PINK  BUTTERFLY T-LIGHTS,1,4/21/2011 18:06,4.13,,United Kingdom
550986,72760B,VINTAGE CREAM 3 BASKET CAKE STAND,1,4/21/2011 18:06,20.79,,United Kingdom
550986,72799F,IVORY PILLAR CANDLE GOLD FLOCK,2,4/21/2011 18:06,3.29,,United Kingdom
550986,82095,HEART BUTTONS JEWELLERY BOX,1,4/21/2011 18:06,4.96,,United Kingdom
550986,82482,WOODEN PICTURE FRAME WHITE FINISH,1,4/21/2011 18:06,4.96,,United Kingdom
550986,82580,BATHROOM METAL SIGN,1,4/21/2011 18:06,1.25,,United Kingdom
550986,82583,HOT BATHS METAL SIGN,2,4/21/2011 18:06,4.13,,United Kingdom
550986,84568,GIRLS ALPHABET IRON ON PATCHES ,18,4/21/2011 18:06,0.42,,United Kingdom
550986,84598,BOYS ALPHABET IRON ON PATCHES,1,4/21/2011 18:06,0.21,,United Kingdom
550986,84755,COLOUR GLASS T-LIGHT HOLDER HANGING,12,4/21/2011 18:06,1.24,,United Kingdom
550986,84796B,BLUE SAVANNAH PICNIC HAMPER FOR 2,2,4/21/2011 18:06,8.29,,United Kingdom
550986,84828,JUNGLE POPSICLES ICE LOLLY MOULDS,1,4/21/2011 18:06,2.46,,United Kingdom
550986,84879,ASSORTED COLOUR BIRD ORNAMENT,8,4/21/2011 18:06,1.35,,United Kingdom
550986,84905,PINK BUTTERFLY CUSHION COVER ,1,4/21/2011 18:06,4.96,,United Kingdom
550986,85053,FRENCH ENAMEL CANDLEHOLDER,1,4/21/2011 18:06,4.13,,United Kingdom
550986,85061W,WHITE JEWELLED HEART DECORATION,3,4/21/2011 18:06,1.63,,United Kingdom
550986,85066,CREAM SWEETHEART MINI CHEST,2,4/21/2011 18:06,24.96,,United Kingdom
550986,85093,CANDY SPOT EGG WARMER HARE,4,4/21/2011 18:06,0.83,,United Kingdom
550986,85099B,JUMBO BAG RED RETROSPOT,2,4/21/2011 18:06,4.13,,United Kingdom
550986,85099C,JUMBO  BAG BAROQUE BLACK WHITE,2,4/21/2011 18:06,4.13,,United Kingdom
550986,85123A,WHITE HANGING HEART T-LIGHT HOLDER,1,4/21/2011 18:06,5.79,,United Kingdom
550986,85129B,BEADED CRYSTAL HEART GREEN SMALL,2,4/21/2011 18:06,2.46,,United Kingdom
550986,85131A,BEADED PEARL HEART WHITE ON STICK,16,4/21/2011 18:06,0.83,,United Kingdom
550986,85131B,BEADED CRYSTAL HEART GREEN ON STICK,1,4/21/2011 18:06,0.83,,United Kingdom
550986,85131D,BEADED CRYSTAL HEART PINK ON STICK,1,4/21/2011 18:06,0.83,,United Kingdom
550986,85150,LADIES & GENTLEMEN METAL SIGN,1,4/21/2011 18:06,4.96,,United Kingdom
550986,85180A,RED HEARTS LIGHT CHAIN ,2,4/21/2011 18:06,9.13,,United Kingdom
550986,85186C,BUNNY EGG GARLAND,1,4/21/2011 18:06,0.83,,United Kingdom
550986,85205B,PINK FELT EASTER RABBIT GARLAND,1,4/21/2011 18:06,4.96,,United Kingdom
550986,90001C,ANTIQUE OPAL WHITE FLOWER EARRINGS,1,4/21/2011 18:06,4.15,,United Kingdom
550986,90060F,FIRE POLISHED GLASS NECKL GREEN,1,4/21/2011 18:06,5.82,,United Kingdom
550986,DOT,DOTCOM POSTAGE,1,4/21/2011 18:06,221.16,,United Kingdom
550986,22678,FRENCH BLUE METAL DOOR SIGN 3,1,4/21/2011 18:06,1.25,,United Kingdom
550986,22679,FRENCH BLUE METAL DOOR SIGN 4,1,4/21/2011 18:06,1.25,,United Kingdom
550986,22672,FRENCH BATHROOM SIGN BLUE METAL,5,4/21/2011 18:06,1.65,,United Kingdom
550986,22685,FRENCH BLUE METAL DOOR SIGN 0,4,4/21/2011 18:06,1.25,,United Kingdom
550986,22682,FRENCH BLUE METAL DOOR SIGN 7,9,4/21/2011 18:06,1.25,,United Kingdom
550987,15044A,PINK PAPER PARASOL ,1,4/21/2011 18:10,5.79,,United Kingdom
550987,15058C,ICE CREAM DESIGN GARDEN PARASOL,1,4/21/2011 18:10,24.96,,United Kingdom
550987,20674,GREEN POLKADOT BOWL,1,4/21/2011 18:10,2.46,,United Kingdom
550987,20675,BLUE POLKADOT BOWL,1,4/21/2011 18:10,2.46,,United Kingdom
550987,20677,PINK POLKADOT BOWL,1,4/21/2011 18:10,2.46,,United Kingdom
550987,20707,CRAZY DAISY HEART DECORATION,5,4/21/2011 18:10,0.83,,United Kingdom
550987,20725,LUNCH BAG RED RETROSPOT,2,4/21/2011 18:10,4.13,,United Kingdom
550987,20974,12 PENCILS SMALL TUBE SKULL,2,4/21/2011 18:10,1.25,,United Kingdom
550987,20975,12 PENCILS SMALL TUBE RED RETROSPOT,1,4/21/2011 18:10,1.25,,United Kingdom
550987,20981,12 PENCILS TALL TUBE WOODLAND,1,4/21/2011 18:10,1.63,,United Kingdom
550987,21041,RED RETROSPOT OVEN GLOVE DOUBLE,1,4/21/2011 18:10,5.79,,United Kingdom
550987,21096,SET/6 FRUIT SALAD  PAPER PLATES,2,4/21/2011 18:10,0.83,,United Kingdom
550987,21154,RED RETROSPOT OVEN GLOVE ,1,4/21/2011 18:10,2.46,,United Kingdom
550987,21224,SET/4 SKULL BADGES,1,4/21/2011 18:10,0.83,,United Kingdom
550987,21246,RED RETROSPOT BIG BOWL,1,4/21/2011 18:10,4.13,,United Kingdom
550987,21314,SMALL GLASS HEART TRINKET POT,1,4/21/2011 18:10,4.13,,United Kingdom
550987,21382,SET/4 SPRING FLOWER DECORATION,1,4/21/2011 18:10,5.79,,United Kingdom
550987,21383,PACK OF 12 STICKY BUNNIES,1,4/21/2011 18:10,1.63,,United Kingdom
