551008,85099B,JUMBO BAG RED RETROSPOT,2,4/26/2011 9:50,4.13,,United Kingdom
551008,85099C,JUMBO  BAG BAROQUE BLACK WHITE,8,4/26/2011 9:50,4.13,,United Kingdom
551008,DOT,DOTCOM POSTAGE,1,4/26/2011 9:50,122.5,,United Kingdom
551009,20616,CHERRY BLOSSOM PASSPORT COVER,1,4/26/2011 9:50,4.13,,United Kingdom
551009,20711,JUMBO BAG TOYS ,2,4/26/2011 9:50,4.13,,United Kingdom
551009,20712,JUMBO BAG WOODLAND ANIMALS,2,4/26/2011 9:50,4.13,,United Kingdom
551009,20765,CHRYSANTHEMUM SKETCHBOOK ,1,4/26/2011 9:50,7.46,,United Kingdom
551009,20978,36 PENCILS TUBE SKULLS,1,4/26/2011 9:50,2.46,,United Kingdom
551009,21033,JUMBO BAG CHARLIE AND LOLA TOYS,3,4/26/2011 9:50,4.13,,United Kingdom
551009,21115,ROSE CARAVAN DOORSTOP,1,4/26/2011 9:50,14.13,,United Kingdom
551009,21172,PARTY METAL SIGN ,1,4/26/2011 9:50,4.13,,United Kingdom
551009,21181,PLEASE ONE PERSON METAL SIGN,1,4/26/2011 9:50,4.13,,United Kingdom
551009,21218,RED SPOTTY BISCUIT TIN,1,4/26/2011 9:50,8.29,,United Kingdom
551009,21257,VICTORIAN SEWING BOX MEDIUM,1,4/26/2011 9:50,15.79,,United Kingdom
551009,21259,VICTORIAN SEWING BOX SMALL ,1,4/26/2011 9:50,12.46,,United Kingdom
551009,21328,BALLOONS  WRITING SET ,1,4/26/2011 9:50,3.29,,United Kingdom
551009,21408,SPOTTY PINK DUCK DOORSTOP,1,4/26/2011 9:50,8.29,,United Kingdom
551009,21428,SET3 BOOK BOX GREEN GINGHAM FLOWER ,2,4/26/2011 9:50,8.29,,United Kingdom
551009,21430,SET/3 RED GINGHAM ROSE STORAGE BOX,3,4/26/2011 9:50,7.46,,United Kingdom
551009,21559,STRAWBERRY LUNCH BOX WITH CUTLERY,2,4/26/2011 9:50,4.96,,United Kingdom
551009,21714,CITRONELLA CANDLE GARDEN POT,3,4/26/2011 9:50,2.46,,United Kingdom
551009,21731,RED TOADSTOOL LED NIGHT LIGHT,3,4/26/2011 9:50,4.13,,United Kingdom
551009,21890,S/6 WOODEN SKITTLES IN COTTON BAG,1,4/26/2011 9:50,5.79,,United Kingdom
551009,21930,JUMBO STORAGE BAG SKULLS,4,4/26/2011 9:50,4.96,,United Kingdom
551009,21931,JUMBO STORAGE BAG SUKI,5,4/26/2011 9:50,4.13,,United Kingdom
551009,21936,RED RETROSPOT PICNIC BAG,1,4/26/2011 9:50,5.79,,United Kingdom
551009,21937,STRAWBERRY   PICNIC BAG,1,4/26/2011 9:50,5.79,,United Kingdom
551009,21977,PACK OF 60 PINK PAISLEY CAKE CASES,2,4/26/2011 9:50,2.08,,United Kingdom
551009,22041,"RECORD FRAME 7"" SINGLE SIZE ",1,4/26/2011 9:50,4.96,,United Kingdom
551009,22156,HEART DECORATION WITH PEARLS ,6,4/26/2011 9:50,1.63,,United Kingdom
551009,22161,HEART DECORATION RUSTIC HANGING ,6,4/26/2011 9:50,1.63,,United Kingdom
551009,22195,LARGE HEART MEASURING SPOONS,1,4/26/2011 9:50,3.29,,United Kingdom
551009,22196,SMALL HEART MEASURING SPOONS,1,4/26/2011 9:50,1.63,,United Kingdom
551009,22297,HEART IVORY TRELLIS SMALL,6,4/26/2011 9:50,2.46,,United Kingdom
551009,22309,TEA COSY RED  STRIPE,1,4/26/2011 9:50,4.96,,United Kingdom
551009,22381,TOY TIDY PINK POLKADOT,1,4/26/2011 9:50,4.96,,United Kingdom
551009,22383,LUNCH BAG SUKI DESIGN ,1,4/26/2011 9:50,4.96,,United Kingdom
551009,22386,JUMBO BAG PINK POLKADOT,11,4/26/2011 9:50,4.13,,United Kingdom
551009,22411,JUMBO SHOPPER VINTAGE RED PAISLEY,5,4/26/2011 9:50,4.13,,United Kingdom
551009,22431,WATERING CAN BLUE ELEPHANT,1,4/26/2011 9:50,4.13,,United Kingdom
551009,22456,NATURAL SLATE CHALKBOARD LARGE ,2,4/26/2011 9:50,9.96,,United Kingdom
551009,22501,PICNIC BASKET WICKER LARGE,2,4/26/2011 9:50,20.79,,United Kingdom
551009,22502,PICNIC BASKET WICKER SMALL,4,4/26/2011 9:50,8.29,,United Kingdom
