556813,20902,VINTAGE KEEPSAKE BOX PARIS DAYS,1,6/14/2011 17:28,4.13,,United Kingdom
556813,20914,SET/5 RED RETROSPOT LID GLASS BOWLS,1,6/14/2011 17:28,5.79,,United Kingdom
556813,21026,SPACE OWL,1,6/14/2011 17:28,2.46,,United Kingdom
556813,21069,VINTAGE BILLBOARD TEA MUG,1,6/14/2011 17:28,2.46,,United Kingdom
556813,21071,VINTAGE BILLBOARD DRINK ME MUG,1,6/14/2011 17:28,2.46,,United Kingdom
556813,21155,RED RETROSPOT PEG BAG,1,6/14/2011 17:28,4.96,,United Kingdom
556813,21174,POTTERING IN THE SHED METAL SIGN,1,6/14/2011 17:28,4.13,,United Kingdom
556813,21179,NO JUNK MAIL METAL SIGN,1,6/14/2011 17:28,1.63,,United Kingdom
556813,21201,TROPICAL  HONEYCOMB PAPER GARLAND ,2,6/14/2011 17:28,4.96,,United Kingdom
556813,21206,STRAWBERRY HONEYCOMB  GARLAND ,1,6/14/2011 17:28,3.29,,United Kingdom
556813,21212,PACK OF 72 RETROSPOT CAKE CASES,1,6/14/2011 17:28,1.25,,United Kingdom
556813,21242,RED RETROSPOT PLATE ,1,6/14/2011 17:28,3.29,,United Kingdom
556813,21245,GREEN POLKADOT PLATE ,2,6/14/2011 17:28,3.29,,United Kingdom
556813,21248,DOOR HANGER  MUM + DADS ROOM,1,6/14/2011 17:28,3.29,,United Kingdom
556813,21314,SMALL GLASS HEART TRINKET POT,1,6/14/2011 17:28,4.13,,United Kingdom
556813,21476,STEEL SWEETHEART ROUND TABLE CREAM,1,6/14/2011 17:28,58.29,,United Kingdom
556813,21494,ROTATING LEAVES T-LIGHT HOLDER,1,6/14/2011 17:28,4.96,,United Kingdom
556813,21507,"ELEPHANT, BIRTHDAY CARD, ",1,6/14/2011 17:28,0.83,,United Kingdom
556813,21508,VINTAGE KID DOLLY CARD ,1,6/14/2011 17:28,0.83,,United Kingdom
556813,21524,DOORMAT SPOTTY HOME SWEET HOME,1,6/14/2011 17:28,16.63,,United Kingdom
556813,21531,RED RETROSPOT SUGAR JAM BOWL,1,6/14/2011 17:28,4.96,,United Kingdom
556813,21533,RETROSPOT LARGE MILK JUG,1,6/14/2011 17:28,9.96,,United Kingdom
556813,21539,RED RETROSPOT BUTTER DISH,1,6/14/2011 17:28,9.96,,United Kingdom
556813,21716,BOYS VINTAGE TIN SEASIDE BUCKET,1,6/14/2011 17:28,4.96,,United Kingdom
556813,21718,RED METAL BEACH SPADE ,1,6/14/2011 17:28,2.46,,United Kingdom
556813,21731,RED TOADSTOOL LED NIGHT LIGHT,1,6/14/2011 17:28,3.29,,United Kingdom
556813,21790,VINTAGE SNAP CARDS,2,6/14/2011 17:28,1.63,,United Kingdom
556813,21849,SILVER DIAMANTE PEN IN GIFT BOX,1,6/14/2011 17:28,8.29,,United Kingdom
556813,21900,"KEY FOB , SHED",1,6/14/2011 17:28,1.63,,United Kingdom
556813,21914,BLUE HARMONICA IN BOX ,1,6/14/2011 17:28,2.46,,United Kingdom
556813,21915,RED  HARMONICA IN BOX ,1,6/14/2011 17:28,2.46,,United Kingdom
556813,21922,UNION STRIPE WITH FRINGE  HAMMOCK,1,6/14/2011 17:28,16.63,,United Kingdom
556813,21928,JUMBO BAG SCANDINAVIAN BLUE PAISLEY,1,6/14/2011 17:28,4.13,,United Kingdom
556813,21929,JUMBO BAG PINK VINTAGE PAISLEY,1,6/14/2011 17:28,4.13,,United Kingdom
556813,21932,SCANDINAVIAN PAISLEY PICNIC BAG,1,6/14/2011 17:28,2.46,,United Kingdom
556813,21933,PINK VINTAGE PAISLEY PICNIC BAG,1,6/14/2011 17:28,2.46,,United Kingdom
556813,21977,PACK OF 60 PINK PAISLEY CAKE CASES,1,6/14/2011 17:28,1.25,,United Kingdom
556813,21992,VINTAGE PAISLEY STATIONERY SET,1,6/14/2011 17:28,2.46,,United Kingdom
556813,22024,RAINY LADIES BIRTHDAY CARD,2,6/14/2011 17:28,0.83,,United Kingdom
556813,22026,BANQUET BIRTHDAY  CARD  ,1,6/14/2011 17:28,0.83,,United Kingdom
556813,22027,TEA PARTY BIRTHDAY CARD,2,6/14/2011 17:28,0.83,,United Kingdom
556813,22037,ROBOT BIRTHDAY CARD,2,6/14/2011 17:28,0.83,,United Kingdom
556813,22061,LARGE CAKE STAND  HANGING STRAWBERY,1,6/14/2011 17:28,20.79,,United Kingdom
556813,22063,CERAMIC BOWL WITH STRAWBERRY DESIGN,1,6/14/2011 17:28,5.79,,United Kingdom
556813,22072,RED RETROSPOT TEA CUP AND SAUCER ,1,6/14/2011 17:28,7.46,,United Kingdom
556813,22082,RIBBON REEL STRIPES DESIGN ,2,6/14/2011 17:28,3.29,,United Kingdom
556813,22120,WELCOME  WOODEN BLOCK LETTERS,1,6/14/2011 17:28,19.96,,United Kingdom
556813,22169,FAMILY ALBUM WHITE PICTURE FRAME,1,6/14/2011 17:28,16.63,,United Kingdom
556813,22170,PICTURE FRAME WOOD TRIPLE PORTRAIT,1,6/14/2011 17:28,13.29,,United Kingdom
556813,22197,POPCORN HOLDER,1,6/14/2011 17:28,1.63,,United Kingdom
556813,22199,FRYING PAN RED RETROSPOT,1,6/14/2011 17:28,8.29,,United Kingdom
556813,22201,FRYING PAN BLUE POLKADOT,1,6/14/2011 17:28,8.29,,United Kingdom
556813,22203,MILK PAN RED RETROSPOT,1,6/14/2011 17:28,7.46,,United Kingdom
