561651,47593B,SCOTTIE DOGS BABY BIB,2,7/28/2011 15:36,0.83,,United Kingdom
561651,47599A,PINK PARTY BAGS,1,7/28/2011 15:36,4.13,,United Kingdom
561651,48138,DOORMAT UNION FLAG,1,7/28/2011 15:36,15.79,,United Kingdom
561651,72598,SET/12 TAPER CANDLES,5,7/28/2011 15:36,1.63,,United Kingdom
561651,72807A,SET/3 ROSE CANDLE IN JEWELLED BOX,1,7/28/2011 15:36,8.29,,United Kingdom
561651,82482,WOODEN PICTURE FRAME WHITE FINISH,8,7/28/2011 15:36,2.55,,United Kingdom
561651,82552,WASHROOM METAL SIGN,1,7/28/2011 15:36,2.46,,United Kingdom
561651,82613B,"METAL SIGN,CUPCAKE SINGLE HOOK",1,7/28/2011 15:36,2.46,,United Kingdom
561651,84078A,SET/4 WHITE RETRO STORAGE CUBES ,1,7/28/2011 15:36,39.95,,United Kingdom
561651,84536B,FAIRY CAKES NOTEBOOK A7 SIZE,2,7/28/2011 15:36,0.83,,United Kingdom
561651,84568,GIRLS ALPHABET IRON ON PATCHES ,12,7/28/2011 15:36,0.42,,United Kingdom
561651,84598,BOYS ALPHABET IRON ON PATCHES,4,7/28/2011 15:36,0.42,,United Kingdom
561651,84637,KITCHEN FLOWER POTS WALL PLAQUE,2,7/28/2011 15:36,4.96,,United Kingdom
561651,84796B,BLUE SAVANNAH PICNIC HAMPER FOR 2,1,7/28/2011 15:36,8.29,,United Kingdom
561651,84912A,PINK ROSE WASHBAG,1,7/28/2011 15:36,3.29,,United Kingdom
561651,84913A,SOFT PINK ROSE TOWEL ,3,7/28/2011 15:36,3.29,,United Kingdom
561651,84976,RECTANGULAR SHAPED MIRROR,1,7/28/2011 15:36,3.29,,United Kingdom
561651,84978,HANGING HEART JAR T-LIGHT HOLDER,6,7/28/2011 15:36,2.46,,United Kingdom
561651,84987,SET OF 36 TEATIME PAPER DOILIES,1,7/28/2011 15:36,2.92,,United Kingdom
561651,84991,60 TEATIME FAIRY CAKE CASES,2,7/28/2011 15:36,1.25,,United Kingdom
561651,85032A,ROMANTIC IMAGES GIFT WRAP SET,1,7/28/2011 15:36,1.63,,United Kingdom
561652,84847,,2,7/28/2011 15:50,0,,United Kingdom
561653,16219,HOUSE SHAPE PENCIL SHARPENER,48,7/28/2011 15:55,0.06,14002,United Kingdom
561653,10133,COLOURING PENCILS BROWN TUBE,20,7/28/2011 15:55,0.42,14002,United Kingdom
561653,16008,SMALL FOLDING SCISSOR(POINTED EDGE),24,7/28/2011 15:55,0.12,14002,United Kingdom
561653,16259,PIECE OF CAMO STATIONERY SET,108,7/28/2011 15:55,0.08,14002,United Kingdom
561653,20984,12 PENCILS TALL TUBE POSY,24,7/28/2011 15:55,0.29,14002,United Kingdom
561653,20992,JAZZ HEARTS PURSE NOTEBOOK,24,7/28/2011 15:55,0.39,14002,United Kingdom
561653,21084,SET/6 COLLAGE PAPER CUPS,24,7/28/2011 15:55,0.19,14002,United Kingdom
561653,21090,SET/6 COLLAGE PAPER PLATES,12,7/28/2011 15:55,0.39,14002,United Kingdom
561653,21158,MOODY GIRL DOOR HANGER ,24,7/28/2011 15:55,0.39,14002,United Kingdom
561653,21162,TOXIC AREA  DOOR HANGER ,24,7/28/2011 15:55,0.39,14002,United Kingdom
561653,21088,SET/6 FRUIT SALAD PAPER CUPS,24,7/28/2011 15:55,0.19,14002,United Kingdom
561653,21163,DO NOT TOUCH MY STUFF DOOR HANGER ,24,7/28/2011 15:55,0.39,14002,United Kingdom
561653,21179,NO JUNK MAIL METAL SIGN,24,7/28/2011 15:55,0.39,14002,United Kingdom
561653,21208,PASTEL COLOUR HONEYCOMB FAN,12,7/28/2011 15:55,0.39,14002,United Kingdom
561653,21382,SET/4 SPRING FLOWER DECORATION,12,7/28/2011 15:55,0.75,14002,United Kingdom
561653,21641,ASSORTED TUTTI FRUTTI KEYRING BALL,24,7/28/2011 15:55,0.29,14002,United Kingdom
561653,21642,ASSORTED TUTTI FRUTTI PEN,24,7/28/2011 15:55,0.29,14002,United Kingdom
561653,21650,ASSORTED TUTTI FRUTTI BRACELET,24,7/28/2011 15:55,0.19,14002,United Kingdom
561653,22091,EMPIRE TISSUE BOX,36,7/28/2011 15:55,0.39,14002,United Kingdom
561653,22094,RED RETROSPOT TISSUE BOX,36,7/28/2011 15:55,0.39,14002,United Kingdom
561653,22097,SWALLOW SQUARE TISSUE BOX,36,7/28/2011 15:55,0.39,14002,United Kingdom
561653,22099,CARAVAN SQUARE TISSUE BOX,36,7/28/2011 15:55,0.39,14002,United Kingdom
561653,22209,WOOD STAMP SET HAPPY BIRTHDAY,12,7/28/2011 15:55,0.83,14002,United Kingdom
561653,22208,WOOD STAMP SET THANK YOU,12,7/28/2011 15:55,0.83,14002,United Kingdom
561653,47503A,ASS FLORAL PRINT MULTI SCREWDRIVER,24,7/28/2011 15:55,0.42,14002,United Kingdom
561653,84596B,SMALL DOLLY MIX DESIGN ORANGE BOWL,16,7/28/2011 15:55,0.42,14002,United Kingdom
561653,84660B,BLACK STITCHED WALL CLOCK,20,7/28/2011 15:55,0.79,14002,United Kingdom
561653,84660C,PINK STITCHED WALL CLOCK,20,7/28/2011 15:55,0.79,14002,United Kingdom
561653,84859A,SILVER DISCO HANDBAG,12,7/28/2011 15:55,1.95,14002,United Kingdom
561653,84859C,PINK DISCO HANDBAG,12,7/28/2011 15:55,1.95,14002,United Kingdom
561653,21096,SET/6 FRUIT SALAD  PAPER PLATES,12,7/28/2011 15:55,0.39,14002,United Kingdom
561653,22161,HEART DECORATION RUSTIC HANGING ,24,7/28/2011 15:55,0.19,14002,United Kingdom
561653,81952V,ROUND PURPLE CLOCK WITH SUCKER,10,7/28/2011 15:55,0.19,14002,United Kingdom
561654,22423,REGENCY CAKESTAND 3 TIER,2,7/28/2011 15:58,12.75,14973,United Kingdom
561654,22805,BLUE DRAWER KNOB ACRYLIC EDWARDIAN,12,7/28/2011 15:58,1.25,14973,United Kingdom
561654,22775,PURPLE DRAWERKNOB ACRYLIC EDWARDIAN,12,7/28/2011 15:58,1.25,14973,United Kingdom
561654,22774,RED DRAWER KNOB ACRYLIC EDWARDIAN,12,7/28/2011 15:58,1.25,14973,United Kingdom
561654,22773,GREEN DRAWER KNOB ACRYLIC EDWARDIAN,12,7/28/2011 15:58,1.25,14973,United Kingdom
561654,22772,PINK DRAWER KNOB ACRYLIC EDWARDIAN,12,7/28/2011 15:58,1.25,14973,United Kingdom
561654,21135,VICTORIAN  METAL POSTCARD SPRING,24,7/28/2011 15:58,1.69,14973,United Kingdom
561654,21390,FILIGRIS HEART WITH BUTTERFLY,24,7/28/2011 15:58,1.25,14973,United Kingdom
561654,84836,ZINC METAL HEART DECORATION,12,7/28/2011 15:58,1.25,14973,United Kingdom
561654,84879,ASSORTED COLOUR BIRD ORNAMENT,8,7/28/2011 15:58,1.69,14973,United Kingdom
561654,22794,SWEETHEART WIRE MAGAZINE RACK,4,7/28/2011 15:58,7.95,14973,United Kingdom
561654,21188,3D HEARTS  HONEYCOMB PAPER GARLAND,12,7/28/2011 15:58,2.95,14973,United Kingdom
561654,22908,PACK OF 20 NAPKINS RED APPLES,12,7/28/2011 15:58,0.85,14973,United Kingdom
561654,21078,SET/20 STRAWBERRY PAPER NAPKINS ,12,7/28/2011 15:58,0.85,14973,United Kingdom
561654,22851,SET 20 NAPKINS FAIRY CAKES DESIGN ,12,7/28/2011 15:58,0.85,14973,United Kingdom
561654,23148,MINIATURE ANTIQUE ROSE HOOK IVORY,12,7/28/2011 15:58,0.83,14973,United Kingdom
561654,84818,DANISH ROSE PHOTO FRAME,24,7/28/2011 15:58,0.79,14973,United Kingdom
561654,22487,WHITE WOOD GARDEN PLANT LADDER,1,7/28/2011 15:58,9.95,14973,United Kingdom
561654,21519,GIN & TONIC DIET GREETING CARD ,12,7/28/2011 15:58,0.42,14973,United Kingdom
561654,85015,SET OF 12  VINTAGE POSTCARD SET,24,7/28/2011 15:58,0.65,14973,United Kingdom
561655,23134,LARGE ZINC HEART WALL ORGANISER,256,7/28/2011 16:00,5.88,18102,United Kingdom
561655,82484,WOOD BLACK BOARD ANT WHITE FINISH,204,7/28/2011 16:00,4.8,18102,United Kingdom
561655,82482,WOODEN PICTURE FRAME WHITE FINISH,216,7/28/2011 16:00,1.92,18102,United Kingdom
561655,22171,3 HOOK PHOTO SHELF ANTIQUE WHITE,204,7/28/2011 16:00,5.88,18102,United Kingdom
561655,22189,CREAM HEART CARD HOLDER,324,7/28/2011 16:00,2.31,18102,United Kingdom
561655,22188,BLACK HEART CARD HOLDER,324,7/28/2011 16:00,2.31,18102,United Kingdom
561655,23135,SMALL ZINC HEART WALL ORGANISER,300,7/28/2011 16:00,3.32,18102,United Kingdom
561656,23196,VINTAGE LEAF MAGNETIC NOTEPAD,12,7/28/2011 16:03,1.45,17071,United Kingdom
561656,23198,PANTRY MAGNETIC  SHOPPING LIST,12,7/28/2011 16:03,1.45,17071,United Kingdom
561656,23243,SET OF TEA COFFEE SUGAR TINS PANTRY,4,7/28/2011 16:03,4.95,17071,United Kingdom
561656,23322,LARGE WHITE HEART OF WICKER,12,7/28/2011 16:03,2.95,17071,United Kingdom
561656,23321,SMALL WHITE HEART OF WICKER,12,7/28/2011 16:03,1.65,17071,United Kingdom
561656,48194,DOORMAT HEARTS,2,7/28/2011 16:03,7.95,17071,United Kingdom
561656,22469,HEART OF WICKER SMALL,12,7/28/2011 16:03,1.65,17071,United Kingdom
561656,47566,PARTY BUNTING,4,7/28/2011 16:03,4.95,17071,United Kingdom
561656,15056N,EDWARDIAN PARASOL NATURAL,3,7/28/2011 16:03,5.95,17071,United Kingdom
561656,15056P,EDWARDIAN PARASOL PINK,3,7/28/2011 16:03,5.95,17071,United Kingdom
561656,22386,JUMBO BAG PINK POLKADOT,10,7/28/2011 16:03,2.08,17071,United Kingdom
561656,23203,JUMBO BAG DOILEY PATTERNS,10,7/28/2011 16:03,2.08,17071,United Kingdom
561656,20719,WOODLAND CHARLOTTE BAG,10,7/28/2011 16:03,0.85,17071,United Kingdom
561656,48184,DOORMAT ENGLISH ROSE ,4,7/28/2011 16:03,7.95,17071,United Kingdom
561656,22692,DOORMAT WELCOME TO OUR HOME,2,7/28/2011 16:03,7.95,17071,United Kingdom
561656,48187,DOORMAT NEW ENGLAND,2,7/28/2011 16:03,7.95,17071,United Kingdom
561656,22365,DOORMAT RESPECTABLE HOUSE,2,7/28/2011 16:03,7.95,17071,United Kingdom
561657,82483,WOOD 2 DRAWER CABINET WHITE FINISH,4,7/28/2011 16:04,6.95,17071,United Kingdom
561658,47563A,RETRO LONGBOARD IRONING BOARD COVER,1,7/28/2011 16:06,1.25,12743,Unspecified
561658,23124,18PC WOODEN CUTLERY SET DISPOSABLE,1,7/28/2011 16:06,1.25,12743,Unspecified
561658,47574A,ENGLISH ROSE SCENTED HANGING FLOWER,1,7/28/2011 16:06,0.75,12743,Unspecified
561658,35968,FOLK ART METAL HEART T-LIGHT HOLDER,5,7/28/2011 16:06,0.38,12743,Unspecified
561658,84559A,3D SHEET OF DOG STICKERS,1,7/28/2011 16:06,0.85,12743,Unspecified
561658,21586,KINGS CHOICE GIANT TUBE MATCHES,1,7/28/2011 16:06,2.55,12743,Unspecified
561658,21733,RED HANGING HEART T-LIGHT HOLDER,1,7/28/2011 16:06,2.95,12743,Unspecified
561658,23268,SET OF 2 CERAMIC CHRISTMAS REINDEER,1,7/28/2011 16:06,1.45,12743,Unspecified
561658,23210,WHITE ROCKING HORSE HAND PAINTED,1,7/28/2011 16:06,1.25,12743,Unspecified
561658,22449,SILK PURSE BABUSHKA PINK,1,7/28/2011 16:06,3.35,12743,Unspecified
561658,20886,BOX OF 9 PEBBLE CANDLES,1,7/28/2011 16:06,1.95,12743,Unspecified
561658,84879,ASSORTED COLOUR BIRD ORNAMENT,3,7/28/2011 16:06,1.69,12743,Unspecified
561658,21588,RETROSPOT GIANT TUBE MATCHES,1,7/28/2011 16:06,2.55,12743,Unspecified
561658,47599B,BLUE PARTY BAGS ,1,7/28/2011 16:06,2.1,12743,Unspecified
561658,22846,BREAD BIN DINER STYLE RED ,1,7/28/2011 16:06,16.95,12743,Unspecified
561658,23336,EGG FRYING PAN PINK ,1,7/28/2011 16:06,2.08,12743,Unspecified
561658,23338,EGG FRYING PAN RED ,1,7/28/2011 16:06,2.08,12743,Unspecified
561658,23339,EGG FRYING PAN BLUE ,1,7/28/2011 16:06,2.08,12743,Unspecified
561658,21033,JUMBO BAG CHARLIE AND LOLA TOYS,1,7/28/2011 16:06,2.08,12743,Unspecified
561658,20679,EDWARDIAN PARASOL RED,1,7/28/2011 16:06,5.95,12743,Unspecified
561658,22046,TEA PARTY  WRAPPING PAPER ,25,7/28/2011 16:06,0.42,12743,Unspecified
561658,23546,WRAP PAISLEY PARK ,25,7/28/2011 16:06,0.42,12743,Unspecified
561658,21108,FAIRY CAKE FLANNEL ASSORTED COLOUR,1,7/28/2011 16:06,2.55,12743,Unspecified
561658,21002,ROSE DU SUD DRAWSTRING BAG,2,7/28/2011 16:06,4.25,12743,Unspecified
561658,85212,MINI PAINTED GARDEN DECORATION ,12,7/28/2011 16:06,0.29,12743,Unspecified
561658,21770,OPEN CLOSED METAL SIGN,1,7/28/2011 16:06,4.95,12743,Unspecified
561658,22752,SET 7 BABUSHKA NESTING BOXES,1,7/28/2011 16:06,8.5,12743,Unspecified
561658,21108,FAIRY CAKE FLANNEL ASSORTED COLOUR,1,7/28/2011 16:06,2.55,12743,Unspecified
561658,22750,FELTCRAFT PRINCESS LOLA DOLL,1,7/28/2011 16:06,3.75,12743,Unspecified
561658,84050,PINK HEART SHAPE EGG FRYING PAN,1,7/28/2011 16:06,1.65,12743,Unspecified
561658,84813,SET OF 4 DIAMOND NAPKIN RINGS,1,7/28/2011 16:06,12.75,12743,Unspecified
561658,23079,TOADSTOOL BEDSIDE LIGHT ,1,7/28/2011 16:06,8.95,12743,Unspecified
561658,23014,GLASS APOTHECARY BOTTLE ELIXIR,1,7/28/2011 16:06,3.95,12743,Unspecified
561658,85213,MINI  ZINC GARDEN DECORATIONS ,12,7/28/2011 16:06,0.29,12743,Unspecified
561658,23068,ALUMINIUM STAMPED HEART,4,7/28/2011 16:06,2.49,12743,Unspecified
561658,22139,RETROSPOT TEA SET CERAMIC 11 PC ,2,7/28/2011 16:06,4.95,12743,Unspecified
561658,84912B,GREEN ROSE WASHBAG,1,7/28/2011 16:06,3.75,12743,Unspecified
561658,22727,ALARM CLOCK BAKELIKE RED ,1,7/28/2011 16:06,3.75,12743,Unspecified
561658,84559B,3D SHEET OF CAT STICKERS,1,7/28/2011 16:06,0.85,12743,Unspecified
561658,84549,CROCHET WHITE RABBIT KEYRING ,1,7/28/2011 16:06,1.65,12743,Unspecified
561658,22840,ROUND CAKE TIN VINTAGE RED,1,7/28/2011 16:06,7.95,12743,Unspecified
561658,22604,SET OF 4 NAPKIN CHARMS CUTLERY,2,7/28/2011 16:06,2.55,12743,Unspecified
561658,22902,TOTE BAG I LOVE LONDON,1,7/28/2011 16:06,2.1,12743,Unspecified
561658,21065,BOOM BOX SPEAKER GIRLS,1,7/28/2011 16:06,5.95,12743,Unspecified
561658,84012,MAGIC SHEEP WOOL GROWING FROM PAPER,1,7/28/2011 16:06,2.55,12743,Unspecified
561658,47559B,TEA TIME OVEN GLOVE,1,7/28/2011 16:06,1.25,12743,Unspecified
561658,82600,NO SINGING METAL SIGN,1,7/28/2011 16:06,2.1,12743,Unspecified
561658,21592,RETROSPOT CIGAR BOX MATCHES ,1,7/28/2011 16:06,1.25,12743,Unspecified
561658,21591,COSY HOUR CIGAR BOX MATCHES ,1,7/28/2011 16:06,1.25,12743,Unspecified
561658,22585,PACK OF 6 BIRDY GIFT TAGS,1,7/28/2011 16:06,1.25,12743,Unspecified
561658,23055,IVORY CHANDELIER T-LIGHT HOLDER,1,7/28/2011 16:06,6.25,12743,Unspecified
561658,23083,SET 6 PAPER TABLE LANTERN STARS ,1,7/28/2011 16:06,3.75,12743,Unspecified
561658,23082,SET 6 PAPER TABLE LANTERN HEARTS ,1,7/28/2011 16:06,3.75,12743,Unspecified
561658,16012,FOOD/DRINK SPONGE STICKERS,24,7/28/2011 16:06,0.21,12743,Unspecified
561658,22732,3D VINTAGE CHRISTMAS STICKERS ,1,7/28/2011 16:06,1.25,12743,Unspecified
561658,22733,3D TRADITIONAL CHRISTMAS STICKERS,2,7/28/2011 16:06,1.25,12743,Unspecified
561658,22320,BIRDS MOBILE VINTAGE DESIGN,1,7/28/2011 16:06,5.95,12743,Unspecified
561658,21843,RED RETROSPOT CAKE STAND,1,7/28/2011 16:06,10.95,12743,Unspecified
561658,22423,REGENCY CAKESTAND 3 TIER,1,7/28/2011 16:06,12.75,12743,Unspecified
561658,20712,JUMBO BAG WOODLAND ANIMALS,1,7/28/2011 16:06,2.08,12743,Unspecified
561658,22411,JUMBO SHOPPER VINTAGE RED PAISLEY,1,7/28/2011 16:06,2.08,12743,Unspecified
561658,85172,HYACINTH BULB T-LIGHT CANDLES,16,7/28/2011 16:06,0.42,12743,Unspecified
561658,23284,DOORMAT KEEP CALM AND COME IN,1,7/28/2011 16:06,7.95,12743,Unspecified
561658,23202,JUMBO BAG VINTAGE LEAF,1,7/28/2011 16:06,2.08,12743,Unspecified
561658,47599A,PINK PARTY BAGS,1,7/28/2011 16:06,2.1,12743,Unspecified
561658,23211,RED ROCKING HORSE HAND PAINTED,1,7/28/2011 16:06,1.25,12743,Unspecified
561658,22150,3 STRIPEY MICE FELTCRAFT,1,7/28/2011 16:06,1.95,12743,Unspecified
561658,47348A,FUSCHIA VOILE POINTY SHOE DEC,1,7/28/2011 16:06,0.39,12743,Unspecified
561658,22580,ADVENT CALENDAR GINGHAM SACK,1,7/28/2011 16:06,5.95,12743,Unspecified
561658,22834,HAND WARMER BABUSHKA DESIGN,1,7/28/2011 16:06,2.1,12743,Unspecified
561658,22325,MOBILE VINTAGE HEARTS ,1,7/28/2011 16:06,4.95,12743,Unspecified
561658,23183,MOTHER'S KITCHEN SPOON REST ,1,7/28/2011 16:06,3.75,12743,Unspecified
561658,22701,PINK DOG BOWL,1,7/28/2011 16:06,2.95,12743,Unspecified
561658,22703,PINK CAT BOWL,1,7/28/2011 16:06,2.1,12743,Unspecified
561658,23108,SET OF 10 LED DOLLY LIGHTS,1,7/28/2011 16:06,6.25,12743,Unspecified
561658,22900,SET 2 TEA TOWELS I LOVE LONDON ,1,7/28/2011 16:06,3.25,12743,Unspecified
561658,21064,BOOM BOX SPEAKER BOYS,1,7/28/2011 16:06,5.95,12743,Unspecified
561658,22450,SILK PURSE BABUSHKA BLUE,1,7/28/2011 16:06,3.35,12743,Unspecified
561658,84836,ZINC METAL HEART DECORATION,2,7/28/2011 16:06,1.25,12743,Unspecified
561658,22700,BLACK AND WHITE DOG BOWL,1,7/28/2011 16:06,2.95,12743,Unspecified
561658,22625,RED KITCHEN SCALES,1,7/28/2011 16:06,8.5,12743,Unspecified
561658,23012,GLASS APOTHECARY BOTTLE PERFUME,1,7/28/2011 16:06,3.95,12743,Unspecified
561658,79302M,"ART LIGHTS,FUNK MONKEY",1,7/28/2011 16:06,2.95,12743,Unspecified
561659,21733,RED HANGING HEART T-LIGHT HOLDER,352,7/28/2011 16:11,3.24,17450,United Kingdom
561659,22469,HEART OF WICKER SMALL,54,7/28/2011 16:11,1.93,17450,United Kingdom
561659,85123A,WHITE HANGING HEART T-LIGHT HOLDER,480,7/28/2011 16:11,3.24,17450,United Kingdom
561659,82552,WASHROOM METAL SIGN,96,7/28/2011 16:11,1.7,17450,United Kingdom
561659,22470,HEART OF WICKER LARGE,102,7/28/2011 16:11,3.21,17450,United Kingdom
561659,82551,LAUNDRY 15C METAL SIGN,96,7/28/2011 16:11,1.7,17450,United Kingdom
561660,22502,,1,7/28/2011 16:18,0,,United Kingdom
561661,22844,VINTAGE CREAM DOG FOOD CONTAINER,2,7/28/2011 16:21,8.5,12743,Unspecified
561661,84879,ASSORTED COLOUR BIRD ORNAMENT,3,7/28/2011 16:21,1.69,12743,Unspecified
561661,84821,DANISH ROSE DELUXE COASTER,1,7/28/2011 16:21,0.85,12743,Unspecified
561661,79063C,"RETRO PILL BOX KEY CHAIN,THE KING",1,7/28/2011 16:21,0.19,12743,Unspecified
561661,21931,JUMBO STORAGE BAG SUKI,1,7/28/2011 16:21,2.08,12743,Unspecified
561661,22924,FRIDGE MAGNETS LA VIE EN ROSE,6,7/28/2011 16:21,0.85,12743,Unspecified
561661,22289,HANGING METAL CHICKEN DECORATION,2,7/28/2011 16:21,1.25,12743,Unspecified
561661,22288,HANGING METAL RABBIT DECORATION,2,7/28/2011 16:21,1.25,12743,Unspecified
561661,22291,HANGING CHICK CREAM DECORATION,1,7/28/2011 16:21,1.45,12743,Unspecified
561661,84459A,PINK METAL CHICKEN HEART ,2,7/28/2011 16:21,1.49,12743,Unspecified
561661,22834,HAND WARMER BABUSHKA DESIGN,1,7/28/2011 16:21,2.1,12743,Unspecified
561661,23343,JUMBO BAG VINTAGE CHRISTMAS ,1,7/28/2011 16:21,2.08,12743,Unspecified
561661,23158,SET OF 5 LUCKY CAT MAGNETS ,1,7/28/2011 16:21,2.08,12743,Unspecified
561661,23335,EGG FRYING PAN IVORY ,1,7/28/2011 16:21,2.08,12743,Unspecified
561661,23339,EGG FRYING PAN BLUE ,1,7/28/2011 16:21,2.08,12743,Unspecified
561661,22437,SET OF 9 BLACK SKULL BALLOONS,10,7/28/2011 16:21,0.85,12743,Unspecified
561661,22288,HANGING METAL RABBIT DECORATION,5,7/28/2011 16:21,1.25,12743,Unspecified
561661,22289,HANGING METAL CHICKEN DECORATION,2,7/28/2011 16:21,1.25,12743,Unspecified
561661,23208,LUNCH BAG VINTAGE LEAF DESIGN,1,7/28/2011 16:21,1.65,12743,Unspecified
561661,21260,FIRST AID TIN,1,7/28/2011 16:21,3.25,12743,Unspecified
561661,21637,ASSORTED SANSKRIT MINI NOTEBOOK,18,7/28/2011 16:21,1.25,12743,Unspecified
561661,23108,SET OF 10 LED DOLLY LIGHTS,1,7/28/2011 16:21,6.25,12743,Unspecified
561661,85049A,TRADITIONAL CHRISTMAS RIBBONS,1,7/28/2011 16:21,1.25,12743,Unspecified
561661,20679,EDWARDIAN PARASOL RED,1,7/28/2011 16:21,5.95,12743,Unspecified
561661,23210,WHITE ROCKING HORSE HAND PAINTED,1,7/28/2011 16:21,1.25,12743,Unspecified
561661,22906,12 MESSAGE CARDS WITH ENVELOPES,1,7/28/2011 16:21,1.65,12743,Unspecified
561661,85180A,RED HEARTS LIGHT CHAIN ,2,7/28/2011 16:21,4.65,12743,Unspecified
561661,85179A,GREEN BITTY LIGHT CHAIN,1,7/28/2011 16:21,4.65,12743,Unspecified
561661,23079,TOADSTOOL BEDSIDE LIGHT ,1,7/28/2011 16:21,8.95,12743,Unspecified
561661,22396,MAGNETS PACK OF 4 RETRO PHOTO,1,7/28/2011 16:21,0.39,12743,Unspecified
561661,21591,COSY HOUR CIGAR BOX MATCHES ,1,7/28/2011 16:21,1.25,12743,Unspecified
561661,84347,ROTATING SILVER ANGELS T-LIGHT HLDR,1,7/28/2011 16:21,2.55,12743,Unspecified
561661,85175,CACTI T-LIGHT CANDLES,16,7/28/2011 16:21,0.42,12743,Unspecified
561661,35646,VINTAGE BEAD PINK EVENING BAG,1,7/28/2011 16:21,1.25,12743,Unspecified
561661,47343A,FUSCHIA FLOWER PURSE WITH BEADS,1,7/28/2011 16:21,0.83,12743,Unspecified
561661,23188,VINTAGE  2 METER FOLDING RULER,1,7/28/2011 16:21,1.65,12743,Unspecified
561661,22604,SET OF 4 NAPKIN CHARMS CUTLERY,2,7/28/2011 16:21,2.55,12743,Unspecified
561661,22556,PLASTERS IN TIN CIRCUS PARADE ,1,7/28/2011 16:21,1.65,12743,Unspecified
561661,22076,6 RIBBONS EMPIRE  ,3,7/28/2011 16:21,1.65,12743,Unspecified
561661,85179C,PINK BITTY LIGHT CHAIN,1,7/28/2011 16:21,4.65,12743,Unspecified
561661,21592,RETROSPOT CIGAR BOX MATCHES ,2,7/28/2011 16:21,1.25,12743,Unspecified
561661,22906,12 MESSAGE CARDS WITH ENVELOPES,2,7/28/2011 16:21,1.65,12743,Unspecified
561661,85180B,PINK HEARTS LIGHT CHAIN ,1,7/28/2011 16:21,4.65,12743,Unspecified
561661,22497,SET OF 2 TINS VINTAGE BATHROOM ,1,7/28/2011 16:21,4.25,12743,Unspecified
561661,21065,BOOM BOX SPEAKER GIRLS,1,7/28/2011 16:21,5.95,12743,Unspecified
561661,84012,MAGIC SHEEP WOOL GROWING FROM PAPER,1,7/28/2011 16:21,2.55,12743,Unspecified
561661,84559A,3D SHEET OF DOG STICKERS,1,7/28/2011 16:21,0.85,12743,Unspecified
561661,23083,SET 6 PAPER TABLE LANTERN STARS ,1,7/28/2011 16:21,3.75,12743,Unspecified
561661,22315,200 RED + WHITE BENDY STRAWS,1,7/28/2011 16:21,1.25,12743,Unspecified
561661,23082,SET 6 PAPER TABLE LANTERN HEARTS ,1,7/28/2011 16:21,3.75,12743,Unspecified
561661,21591,COSY HOUR CIGAR BOX MATCHES ,1,7/28/2011 16:21,1.25,12743,Unspecified
561662,84536B,FAIRY CAKES NOTEBOOK A7 SIZE,272,7/28/2011 16:28,0.32,12407,Belgium
561662,21884,CAKES AND BOWS GIFT  TAPE,12,7/28/2011 16:28,0.65,12407,Belgium
561662,48185,DOORMAT FAIRY CAKE,10,7/28/2011 16:28,6.75,12407,Belgium
561662,POST,POSTAGE,2,7/28/2011 16:28,15,12407,Belgium
561663,22501,incorrectly put back into stock,-108,7/28/2011 16:40,0,,United Kingdom
561664,23197,SKETCHBOOK MAGNETIC SHOPPING LIST,48,7/28/2011 16:53,1.25,15189,United Kingdom
561664,22427,ENAMEL FLOWER JUG CREAM,12,7/28/2011 16:53,5.45,15189,United Kingdom
561664,23158,SET OF 5 LUCKY CAT MAGNETS ,120,7/28/2011 16:53,1.85,15189,United Kingdom
561664,23163,REGENCY SUGAR TONGS,48,7/28/2011 16:53,2.08,15189,United Kingdom
561664,22139,RETROSPOT TEA SET CERAMIC 11 PC ,24,7/28/2011 16:53,4.25,15189,United Kingdom
561664,23171,REGENCY TEA PLATE GREEN ,12,7/28/2011 16:53,1.65,15189,United Kingdom
561665,22171,?,142,7/28/2011 16:55,0,,United Kingdom
561666,22502,,30,7/28/2011 16:59,0,,United Kingdom
561667,C2,CARRIAGE,1,7/28/2011 17:00,50,,EIRE
561667,22138,BAKING SET 9 PIECE RETROSPOT ,3,7/28/2011 17:00,4.95,,EIRE
561667,22560,TRADITIONAL MODELLING CLAY,24,7/28/2011 17:00,1.25,,EIRE
561667,22493,PAINT YOUR OWN CANVAS SET,12,7/28/2011 17:00,1.65,,EIRE
561667,22507,MEMO BOARD RETROSPOT  DESIGN,4,7/28/2011 17:00,4.95,,EIRE
561667,22558,CLOTHES PEGS RETROSPOT PACK 24 ,12,7/28/2011 17:00,1.65,,EIRE
561667,22907,PACK OF 20 NAPKINS PANTRY DESIGN,12,7/28/2011 17:00,0.85,,EIRE
561667,22951,60 CAKE CASES DOLLY GIRL DESIGN,24,7/28/2011 17:00,0.55,,EIRE
561667,22847,BREAD BIN DINER STYLE IVORY,2,7/28/2011 17:00,16.95,,EIRE
561667,23035,DRAWER KNOB CERAMIC IVORY,6,7/28/2011 17:00,1.45,,EIRE
561667,23026,DRAWER KNOB VINTAGE GLASS STAR,12,7/28/2011 17:00,2.08,,EIRE
561667,23025,DRAWER KNOB VINTAGE GLASS BALL,6,7/28/2011 17:00,2.08,,EIRE
561667,22728,ALARM CLOCK BAKELIKE PINK,4,7/28/2011 17:00,3.75,,EIRE
561667,21907,I'M ON HOLIDAY METAL SIGN,12,7/28/2011 17:00,2.1,,EIRE
561667,22169,FAMILY ALBUM WHITE PICTURE FRAME,2,7/28/2011 17:00,8.5,,EIRE
561667,22796,PHOTO FRAME 3 CLASSIC HANGING,2,7/28/2011 17:00,9.95,,EIRE
561667,84879,ASSORTED COLOUR BIRD ORNAMENT,16,7/28/2011 17:00,1.69,,EIRE
561667,22720,SET OF 3 CAKE TINS PANTRY DESIGN ,6,7/28/2011 17:00,4.95,,EIRE
561667,23243,SET OF TEA COFFEE SUGAR TINS PANTRY,4,7/28/2011 17:00,4.95,,EIRE
561667,22424,ENAMEL BREAD BIN CREAM,2,7/28/2011 17:00,12.75,,EIRE
561668,44091A,,-2,7/28/2011 17:03,0,,United Kingdom
561669,22423,REGENCY CAKESTAND 3 TIER,2,7/28/2011 17:09,12.75,12507,Spain
561669,23295,SET OF 12 MINI LOAF BAKING CASES,128,7/28/2011 17:09,0.72,12507,Spain
561669,23297,SET 40 HEART SHAPE PETIT FOUR CASES,144,7/28/2011 17:09,1.45,12507,Spain
561669,23294,SET OF 6 SNACK LOAF BAKING CASES,128,7/28/2011 17:09,0.72,12507,Spain
561669,23296,SET OF 6 TEA TIME BAKING CASES,128,7/28/2011 17:09,1.04,12507,Spain
561669,23293,SET OF 12 FAIRY CAKE BAKING CASES,128,7/28/2011 17:09,0.72,12507,Spain
561669,POST,POSTAGE,6,7/28/2011 17:09,28,12507,Spain
561669,22960,JAM MAKING SET WITH JARS,11,7/28/2011 17:09,0,12507,Spain
561670,84828,JUNGLE POPSICLES ICE LOLLY MOULDS,12,7/28/2011 17:15,1.25,17373,United Kingdom
561670,21034,REX CASH+CARRY JUMBO SHOPPER,1,7/28/2011 17:15,0.95,17373,United Kingdom
561670,20728,LUNCH BAG CARS BLUE,10,7/28/2011 17:15,1.65,17373,United Kingdom
561670,85049G,CHOCOLATE BOX RIBBONS ,6,7/28/2011 17:15,1.25,17373,United Kingdom
561670,22900,SET 2 TEA TOWELS I LOVE LONDON ,6,7/28/2011 17:15,3.25,17373,United Kingdom
561670,23124,18PC WOODEN CUTLERY SET DISPOSABLE,6,7/28/2011 17:15,1.25,17373,United Kingdom
561670,23309,SET OF 60 I LOVE LONDON CAKE CASES ,24,7/28/2011 17:15,0.55,17373,United Kingdom
561670,22665,RECIPE BOX BLUE SKETCHBOOK DESIGN,4,7/28/2011 17:15,2.95,17373,United Kingdom
561670,84375,SET OF 20 KIDS COOKIE CUTTERS,12,7/28/2011 17:15,2.1,17373,United Kingdom
561670,21975,PACK OF 60 DINOSAUR CAKE CASES,24,7/28/2011 17:15,0.55,17373,United Kingdom
561670,22659,LUNCH BOX I LOVE LONDON,6,7/28/2011 17:15,1.95,17373,United Kingdom
561671,22693,GROW A FLYTRAP OR SUNFLOWER IN TIN,576,7/28/2011 17:17,0.86,12830,United Kingdom
561671,22550,HOLIDAY FUN LUDO,72,7/28/2011 17:17,2.62,12830,United Kingdom
561671,21912,VINTAGE SNAKES & LADDERS,144,7/28/2011 17:17,2.62,12830,United Kingdom
561671,23229,VINTAGE DONKEY TAIL GAME ,72,7/28/2011 17:17,2.62,12830,United Kingdom
561671,22548,HEADS AND TAILS SPORTING FUN,144,7/28/2011 17:17,0.85,12830,United Kingdom
561671,21790,VINTAGE SNAP CARDS,288,7/28/2011 17:17,0.58,12830,United Kingdom
561671,22536,MAGIC DRAWING SLATE PURDEY,192,7/28/2011 17:17,0.27,12830,United Kingdom
561671,22535,MAGIC DRAWING SLATE BUNNIES ,192,7/28/2011 17:17,0.27,12830,United Kingdom
561671,22533,MAGIC DRAWING SLATE BAKE A CAKE ,192,7/28/2011 17:17,0.27,12830,United Kingdom
561671,22532,MAGIC DRAWING SLATE LEAP FROG ,192,7/28/2011 17:17,0.27,12830,United Kingdom
561672,21891,TRADITIONAL WOODEN SKIPPING ROPE,576,7/28/2011 17:18,1.02,12830,United Kingdom
561673,23134,,107,7/28/2011 17:20,0,,United Kingdom
561674,21445,,1,7/28/2011 17:20,0,,United Kingdom
561675,22907,PACK OF 20 NAPKINS PANTRY DESIGN,12,7/28/2011 17:33,0.85,17483,United Kingdom
561675,21877,HOME SWEET HOME MUG,12,7/28/2011 17:33,1.25,17483,United Kingdom
561675,22666,RECIPE BOX PANTRY YELLOW DESIGN,6,7/28/2011 17:33,2.95,17483,United Kingdom
561675,22182,CAKE STAND VICTORIAN FILIGREE SMALL,4,7/28/2011 17:33,4.95,17483,United Kingdom
561675,23109,PACK OF SIX LED TEA LIGHTS,6,7/28/2011 17:33,2.89,17483,United Kingdom
561675,47566,PARTY BUNTING,8,7/28/2011 17:33,4.95,17483,United Kingdom
561676,22795,SWEETHEART RECIPE BOOK STAND,2,7/28/2011 17:53,6.75,13468,United Kingdom
561676,22061,LARGE CAKE STAND  HANGING STRAWBERY,2,7/28/2011 17:53,9.95,13468,United Kingdom
561676,22649,STRAWBERRY FAIRY CAKE TEAPOT,8,7/28/2011 17:53,4.95,13468,United Kingdom
561676,79321,CHILLI LIGHTS,4,7/28/2011 17:53,5.75,13468,United Kingdom
