559162,85208,SET/12 FUNKY FELT FLOWER PEG IN BAG,1,7/6/2011 16:29,1.63,,United Kingdom
559162,85214,TUB 24 PINK FLOWER PEGS,2,7/6/2011 16:29,1.63,,United Kingdom
559162,90016A,SILVER/M.O.P PENDANT ORBIT NECKLACE,1,7/6/2011 16:29,8.32,,United Kingdom
559162,90019A,SILVER M.O.P ORBIT BRACELET,2,7/6/2011 16:29,5.4,,United Kingdom
559162,90070,RUBY GLASS CLUSTER BRACELET,1,7/6/2011 16:29,6.23,,United Kingdom
559162,90170,DAISY HAIR BAND,1,7/6/2011 16:29,1.65,,United Kingdom
559162,90209B,GREEN ENAMEL+GLASS HAIR COMB,2,7/6/2011 16:29,2.07,,United Kingdom
559162,DOT,DOTCOM POSTAGE,1,7/6/2011 16:29,231.61,,United Kingdom
559163,84356,POMPOM CURTAIN,2,7/6/2011 16:33,5.79,,United Kingdom
559163,84509A,SET OF 4 ENGLISH ROSE PLACEMATS,4,7/6/2011 16:33,3.29,,United Kingdom
559163,84509B,SET OF 4 FAIRY CAKE PLACEMATS,1,7/6/2011 16:33,3.29,,United Kingdom
559163,84536A,ENGLISH ROSE NOTEBOOK A7 SIZE,3,7/6/2011 16:33,0.42,,United Kingdom
559163,84569D,PACK 6 HEART/ICE-CREAM PATCHES,2,7/6/2011 16:33,0.83,,United Kingdom
559163,84584,PINK GINGHAM CAT WITH SCARF,4,7/6/2011 16:33,1.63,,United Kingdom
559163,84596B,SMALL DOLLY MIX DESIGN ORANGE BOWL,1,7/6/2011 16:33,0.83,,United Kingdom
559163,84596F,SMALL MARSHMALLOWS PINK BOWL,1,7/6/2011 16:33,0.83,,United Kingdom
559163,84596G,SMALL CHOCOLATES PINK BOWL,1,7/6/2011 16:33,0.83,,United Kingdom
559163,84596L,BISCUITS SMALL BOWL LIGHT BLUE,1,7/6/2011 16:33,0.83,,United Kingdom
559163,84637,KITCHEN FLOWER POTS WALL PLAQUE,1,7/6/2011 16:33,4.96,,United Kingdom
559163,84659A,WHITE TRAVEL ALARM CLOCK,3,7/6/2011 16:33,2.46,,United Kingdom
559163,84673A,PINK FLY SWAT,1,7/6/2011 16:33,0.79,,United Kingdom
559163,84673B,BLUE FLY SWAT,1,7/6/2011 16:33,0.79,,United Kingdom
559163,84746,PINK EASTER HENS+FLOWER,1,7/6/2011 16:33,2.46,,United Kingdom
559163,84748,FOLK FELT HANGING MULTICOL GARLAND,1,7/6/2011 16:33,2.46,,United Kingdom
559163,84796B,BLUE SAVANNAH PICNIC HAMPER FOR 2,1,7/6/2011 16:33,8.29,,United Kingdom
559163,84828,JUNGLE POPSICLES ICE LOLLY MOULDS,2,7/6/2011 16:33,1.25,,United Kingdom
559163,84832,ZINC WILLIE WINKIE  CANDLE STICK,1,7/6/2011 16:33,1.63,,United Kingdom
559163,84876B,GREEN HEART COMPACT MIRROR,1,7/6/2011 16:33,2.46,,United Kingdom
559163,84879,ASSORTED COLOUR BIRD ORNAMENT,8,7/6/2011 16:33,3.12,,United Kingdom
559163,84946,ANTIQUE SILVER T-LIGHT GLASS,22,7/6/2011 16:33,2.46,,United Kingdom
559163,84969,BOX OF 6 ASSORTED COLOUR TEASPOONS,1,7/6/2011 16:33,3.29,,United Kingdom
559163,84988,SET OF 72 PINK HEART PAPER DOILIES,1,7/6/2011 16:33,2.92,,United Kingdom
559163,84991,60 TEATIME FAIRY CAKE CASES,1,7/6/2011 16:33,1.25,,United Kingdom
559163,85017B,ENVELOPE 50 BLOSSOM IMAGES,1,7/6/2011 16:33,0.83,,United Kingdom
559163,85039A,SET/4 RED MINI ROSE CANDLE IN BOWL,6,7/6/2011 16:33,1.63,,United Kingdom
559163,85039B,S/4 IVORY MINI ROSE CANDLE IN BOWL,1,7/6/2011 16:33,1.63,,United Kingdom
559163,85086A,CANDY SPOT HEART DECORATION,1,7/6/2011 16:33,0.83,,United Kingdom
559163,85095,THREE CANVAS LUGGAGE TAGS,1,7/6/2011 16:33,0.83,,United Kingdom
559163,85099F,JUMBO BAG STRAWBERRY,1,7/6/2011 16:33,4.13,,United Kingdom
559163,85123A,WHITE HANGING HEART T-LIGHT HOLDER,2,7/6/2011 16:33,5.79,,United Kingdom
559163,85129B,BEADED CRYSTAL HEART GREEN SMALL,1,7/6/2011 16:33,2.46,,United Kingdom
559163,85130D,BEADED CRYSTAL HEART PINK LARGE,1,7/6/2011 16:33,3.29,,United Kingdom
559163,85170D,SET/6 PINK BIRD T-LIGHT CANDLES,1,7/6/2011 16:33,2.46,,United Kingdom
559163,85176,SEWING SUSAN 21 NEEDLE SET,2,7/6/2011 16:33,0.79,,United Kingdom
559163,85178,VICTORIAN SEWING KIT,4,7/6/2011 16:33,0.79,,United Kingdom
559163,85187,S/12 MINI RABBIT EASTER,1,7/6/2011 16:33,3.29,,United Kingdom
559163,85194S,HANGING SPRING FLOWER EGG SMALL,1,7/6/2011 16:33,0.63,,United Kingdom
559163,85208,SET/12 FUNKY FELT FLOWER PEG IN BAG,2,7/6/2011 16:33,1.63,,United Kingdom
559163,85214,TUB 24 PINK FLOWER PEGS,2,7/6/2011 16:33,1.63,,United Kingdom
559163,90011C,GREEN CRYSTAL DROP EARRINGS,1,7/6/2011 16:33,2.9,,United Kingdom
559163,90026C,GLASS BEAD HOOP NECKLACE GREEN,1,7/6/2011 16:33,8.32,,United Kingdom
559163,90027C,GLASS BEAD HOOP EARRINGS GREEN,1,7/6/2011 16:33,2.9,,United Kingdom
559163,90059D,DIAMANTE HAIR GRIP PACK/2 PERIDOT,1,7/6/2011 16:33,1.65,,United Kingdom
559163,90071,RUBY GLASS CLUSTER EARRINGS,1,7/6/2011 16:33,1.23,,United Kingdom
559163,90170,DAISY HAIR BAND,1,7/6/2011 16:33,1.65,,United Kingdom
559163,90209B,GREEN ENAMEL+GLASS HAIR COMB,1,7/6/2011 16:33,2.07,,United Kingdom
559163,90214D,"LETTER ""D"" BLING KEY RING",1,7/6/2011 16:33,0.83,,United Kingdom
559163,DOT,DOTCOM POSTAGE,1,7/6/2011 16:33,240.41,,United Kingdom
559163,10133,COLOURING PENCILS BROWN TUBE,3,7/6/2011 16:33,0.83,,United Kingdom
559163,11001,ASSTD DESIGN RACING CAR PEN,4,7/6/2011 16:33,0.83,,United Kingdom
559163,15036,ASSORTED COLOURS SILK FAN,2,7/6/2011 16:33,1.63,,United Kingdom
559163,15039,SANDALWOOD FAN,3,7/6/2011 16:33,1.63,,United Kingdom
559163,16237,SLEEPING CAT ERASERS,1,7/6/2011 16:33,0.42,,United Kingdom
559163,17012A,ORIGAMI VANILLA INCENSE/CANDLE SET ,6,7/6/2011 16:33,2.46,,United Kingdom
559163,17096,ASSORTED LAQUERED INCENSE HOLDERS,1,7/6/2011 16:33,0.42,,United Kingdom
559163,20665,RED RETROSPOT PURSE ,3,7/6/2011 16:33,2.46,,United Kingdom
559163,20707,CRAZY DAISY HEART DECORATION,5,7/6/2011 16:33,0.83,,United Kingdom
559163,20712,JUMBO BAG WOODLAND ANIMALS,1,7/6/2011 16:33,4.13,,United Kingdom
559163,20713,JUMBO BAG OWLS,5,7/6/2011 16:33,4.13,,United Kingdom
559163,20718,RED RETROSPOT SHOPPER BAG,2,7/6/2011 16:33,2.46,,United Kingdom
559163,20719,WOODLAND CHARLOTTE BAG,1,7/6/2011 16:33,1.63,,United Kingdom
559163,20733,GOLD MINI TAPE MEASURE ,4,7/6/2011 16:33,0.83,,United Kingdom
559163,20752,BLUE POLKADOT WASHING UP GLOVES,3,7/6/2011 16:33,2.46,,United Kingdom
559163,20768,GREEN FERN JOURNAL ,1,7/6/2011 16:33,2.46,,United Kingdom
559163,20769,DAISY JOURNAL ,1,7/6/2011 16:33,2.46,,United Kingdom
559163,20770,ABSTRACT CIRCLE JOURNAL ,2,7/6/2011 16:33,2.46,,United Kingdom
559163,20771,CHRYSANTHEMUM  JOURNAL,1,7/6/2011 16:33,2.46,,United Kingdom
559163,20856,DENIM PATCH PURSE PINK BUTTERFLY,1,7/6/2011 16:33,1.63,,United Kingdom
559163,20902,VINTAGE KEEPSAKE BOX PARIS DAYS,1,7/6/2011 16:33,4.13,,United Kingdom
559163,20936,FORKED CACTUS CANDLE,1,7/6/2011 16:33,5.79,,United Kingdom
559163,20978,36 PENCILS TUBE SKULLS,1,7/6/2011 16:33,2.46,,United Kingdom
559163,20979,36 PENCILS TUBE RED RETROSPOT,1,7/6/2011 16:33,2.46,,United Kingdom
559163,20986,BLUE CALCULATOR RULER,1,7/6/2011 16:33,0.83,,United Kingdom
559163,20996,JAZZ HEARTS ADDRESS BOOK,1,7/6/2011 16:33,0.42,,United Kingdom
559163,20997,ROSE DU SUD CUSHION COVER ,2,7/6/2011 16:33,4.13,,United Kingdom
559163,21012,ANTIQUE ALL GLASS CANDLESTICK,8,7/6/2011 16:33,2.46,,United Kingdom
559163,21033,JUMBO BAG CHARLIE AND LOLA TOYS,1,7/6/2011 16:33,2.46,,United Kingdom
559163,21058,PARTY INVITES WOODLAND,5,7/6/2011 16:33,0.83,,United Kingdom
559163,21078,SET/20 STRAWBERRY PAPER NAPKINS ,2,7/6/2011 16:33,1.63,,United Kingdom
559163,21116,OWL DOORSTOP,1,7/6/2011 16:33,8.29,,United Kingdom
559163,21135,VICTORIAN  METAL POSTCARD SPRING,16,7/6/2011 16:33,1.04,,United Kingdom
559163,21167,WHITE SAGE INCENSE,1,7/6/2011 16:33,0.42,,United Kingdom
559163,21179,NO JUNK MAIL METAL SIGN,2,7/6/2011 16:33,1.63,,United Kingdom
559163,21198,WHITE HEART CONFETTI IN TUBE,3,7/6/2011 16:33,0.83,,United Kingdom
559163,21199,PINK  HEART CONFETTI IN TUBE,3,7/6/2011 16:33,0.83,,United Kingdom
559163,21200,MULTICOLOUR HONEYCOMB PAPER GARLAND,1,7/6/2011 16:33,3.29,,United Kingdom
559163,21201,TROPICAL  HONEYCOMB PAPER GARLAND ,1,7/6/2011 16:33,4.96,,United Kingdom
559163,21204,DAISIES  HONEYCOMB GARLAND ,1,7/6/2011 16:33,1.63,,United Kingdom
559163,21206,STRAWBERRY HONEYCOMB  GARLAND ,2,7/6/2011 16:33,1.63,,United Kingdom
559163,21208,PASTEL COLOUR HONEYCOMB FAN,1,7/6/2011 16:33,3.29,,United Kingdom
559163,21209,MULTICOLOUR HONEYCOMB FAN,1,7/6/2011 16:33,3.29,,United Kingdom
559163,21232,STRAWBERRY CERAMIC TRINKET BOX,1,7/6/2011 16:33,2.46,,United Kingdom
559163,21253,SET OF PICTURE FRAME  STICKERS,1,7/6/2011 16:33,5.79,,United Kingdom
559163,21328,BALLOONS  WRITING SET ,9,7/6/2011 16:33,0.83,,United Kingdom
559163,21329,DINOSAURS  WRITING SET ,3,7/6/2011 16:33,0.83,,United Kingdom
559163,21366,MIRRORED WALL ART PHOTO FRAMES,1,7/6/2011 16:33,3.29,,United Kingdom
559163,21378,SMALL TALL CAMPHOR WOOD TOADSTOOL,1,7/6/2011 16:33,3.29,,United Kingdom
559163,21382,SET/4 SPRING FLOWER DECORATION,2,7/6/2011 16:33,1.63,,United Kingdom
559163,21383,PACK OF 12 STICKY BUNNIES,2,7/6/2011 16:33,0.83,,United Kingdom
559163,21385,IVORY HANGING DECORATION  HEART,1,7/6/2011 16:33,1.63,,United Kingdom
559163,21389,IVORY HANGING DECORATION  BIRD,2,7/6/2011 16:33,0.83,,United Kingdom
559163,21391,FRENCH LAVENDER SCENT HEART,2,7/6/2011 16:33,1.63,,United Kingdom
559163,21439,BASKET OF TOADSTOOLS,4,7/6/2011 16:33,1.25,,United Kingdom
559163,21447,12 IVORY ROSE PEG PLACE SETTINGS,1,7/6/2011 16:33,2.46,,United Kingdom
559163,21455,PAINTED YELLOW WOODEN DAISY,12,7/6/2011 16:33,0.83,,United Kingdom
559163,21466,RED FLOWER CROCHET FOOD COVER,1,7/6/2011 16:33,3.29,,United Kingdom
559163,21467,CHERRY CROCHET FOOD COVER,2,7/6/2011 16:33,3.29,,United Kingdom
559163,21469,POLKA DOT RAFFIA FOOD COVER,2,7/6/2011 16:33,3.29,,United Kingdom
559163,21470,FLOWER VINE RAFFIA FOOD COVER,1,7/6/2011 16:33,3.29,,United Kingdom
559163,21471,STRAWBERRY RAFFIA FOOD COVER,2,7/6/2011 16:33,3.29,,United Kingdom
559163,21508,VINTAGE KID DOLLY CARD ,1,7/6/2011 16:33,0.83,,United Kingdom
559163,21534,DAIRY MAID LARGE MILK JUG,1,7/6/2011 16:33,4.13,,United Kingdom
559163,21555,CERAMIC STRAWBERRY TRINKET TRAY,1,7/6/2011 16:33,2.46,,United Kingdom
559163,21576,LETS GO SHOPPING COTTON TOTE BAG,1,7/6/2011 16:33,1.63,,United Kingdom
559163,21577,SAVE THE PLANET COTTON TOTE BAG,1,7/6/2011 16:33,1.63,,United Kingdom
559163,21578,WOODLAND DESIGN  COTTON TOTE BAG,2,7/6/2011 16:33,1.63,,United Kingdom
559163,21580,RABBIT  DESIGN  COTTON TOTE BAG,1,7/6/2011 16:33,1.63,,United Kingdom
559163,21617,4 LILY  BOTANICAL DINNER CANDLES,1,7/6/2011 16:33,2.46,,United Kingdom
559163,21618,4 WILDFLOWER BOTANICAL CANDLES,1,7/6/2011 16:33,2.46,,United Kingdom
559163,21619,4 VANILLA BOTANICAL CANDLES,2,7/6/2011 16:33,2.46,,United Kingdom
559163,21620,SET OF 4 ROSE BOTANICAL CANDLES,1,7/6/2011 16:33,2.46,,United Kingdom
559163,21625,VINTAGE UNION JACK APRON,1,7/6/2011 16:33,4.13,,United Kingdom
559163,21633,SUNFLOWER DECORATIVE PARASOL,4,7/6/2011 16:33,8.29,,United Kingdom
559163,21648,ASSORTED TUTTI FRUTTI SMALL PURSE,1,7/6/2011 16:33,2.46,,United Kingdom
559163,21675,BUTTERFLIES STICKERS,1,7/6/2011 16:33,1.63,,United Kingdom
559163,21706,FOLDING UMBRELLA RED/WHITE POLKADOT,3,7/6/2011 16:33,3.29,,United Kingdom
559163,21715,GIRLS VINTAGE TIN SEASIDE BUCKET,2,7/6/2011 16:33,2.46,,United Kingdom
559163,21716,BOYS VINTAGE TIN SEASIDE BUCKET,4,7/6/2011 16:33,2.46,,United Kingdom
559163,21718,RED METAL BEACH SPADE ,1,7/6/2011 16:33,2.46,,United Kingdom
559163,21731,RED TOADSTOOL LED NIGHT LIGHT,2,7/6/2011 16:33,3.29,,United Kingdom
559163,21755,LOVE BUILDING BLOCK WORD,1,7/6/2011 16:33,12.46,,United Kingdom
559163,21756,BATH BUILDING BLOCK WORD,1,7/6/2011 16:33,11.63,,United Kingdom
559163,21790,VINTAGE SNAP CARDS,2,7/6/2011 16:33,1.63,,United Kingdom
559163,21801,CHRISTMAS TREE DECORATION WITH BELL,3,7/6/2011 16:33,0.42,,United Kingdom
559163,21802,CHRISTMAS TREE HEART DECORATION,3,7/6/2011 16:33,0.42,,United Kingdom
559163,21803,CHRISTMAS TREE STAR DECORATION,3,7/6/2011 16:33,0.42,,United Kingdom
559163,21818,GLITTER HEART DECORATION,2,7/6/2011 16:33,1.63,,United Kingdom
559163,21846,PINK DIAMANTE PEN IN GIFT BOX,1,7/6/2011 16:33,2.46,,United Kingdom
559163,21847,GREEN  DIAMANTE PEN IN GIFT BOX,1,7/6/2011 16:33,2.46,,United Kingdom
559163,21867,PINK UNION JACK  LUGGAGE TAG,1,7/6/2011 16:33,0.83,,United Kingdom
559163,21880,RED RETROSPOT TAPE,3,7/6/2011 16:33,0.42,,United Kingdom
559163,21891,TRADITIONAL WOODEN SKIPPING ROPE,1,7/6/2011 16:33,2.46,,United Kingdom
559163,21913,VINTAGE SEASIDE JIGSAW PUZZLES,1,7/6/2011 16:33,3.29,,United Kingdom
559163,21917,SET 12 KIDS  WHITE CHALK STICKS,1,7/6/2011 16:33,0.83,,United Kingdom
559163,21928,JUMBO BAG SCANDINAVIAN BLUE PAISLEY,1,7/6/2011 16:33,4.13,,United Kingdom
559163,21931,JUMBO STORAGE BAG SUKI,4,7/6/2011 16:33,4.13,,United Kingdom
559163,21933,PINK VINTAGE PAISLEY PICNIC BAG,2,7/6/2011 16:33,2.46,,United Kingdom
559163,21935,SUKI  SHOULDER BAG,1,7/6/2011 16:33,1.63,,United Kingdom
559163,21944,KITTENS DESIGN FLANNEL,11,7/6/2011 16:33,0.83,,United Kingdom
559163,21945,STRAWBERRIES  DESIGN FLANNEL ,1,7/6/2011 16:33,0.83,,United Kingdom
559163,21976,PACK OF 60 MUSHROOM CAKE CASES,1,7/6/2011 16:33,1.25,,United Kingdom
559163,21977,PACK OF 60 PINK PAISLEY CAKE CASES,2,7/6/2011 16:33,1.25,,United Kingdom
559163,21990,MODERN FLORAL STATIONERY SET,1,7/6/2011 16:33,2.46,,United Kingdom
559163,21991,BOHEMIAN COLLAGE STATIONERY SET,1,7/6/2011 16:33,2.46,,United Kingdom
559163,21992,VINTAGE PAISLEY STATIONERY SET,1,7/6/2011 16:33,2.46,,United Kingdom
559163,21993,FLORAL FOLK STATIONERY SET,1,7/6/2011 16:33,2.46,,United Kingdom
559163,22023,EMPIRE BIRTHDAY CARD,1,7/6/2011 16:33,0.83,,United Kingdom
559163,22028,PENNY FARTHING BIRTHDAY CARD,1,7/6/2011 16:33,0.83,,United Kingdom
559163,22029,SPACEBOY BIRTHDAY CARD,1,7/6/2011 16:33,0.83,,United Kingdom
559163,22031,BOTANICAL LAVENDER BIRTHDAY CARD,3,7/6/2011 16:33,0.42,,United Kingdom
559163,22032,BOTANICAL LILY GREETING CARD,4,7/6/2011 16:33,0.42,,United Kingdom
559163,22067,CHOC TRUFFLE GOLD TRINKET POT ,1,7/6/2011 16:33,3.29,,United Kingdom
559163,22068,BLACK PIRATE TREASURE CHEST,1,7/6/2011 16:33,3.29,,United Kingdom
559163,22085,PAPER CHAIN KIT SKULLS ,1,7/6/2011 16:33,2.46,,United Kingdom
559163,22109,FULL ENGLISH BREAKFAST PLATE,1,7/6/2011 16:33,7.46,,United Kingdom
559163,22149,FELTCRAFT 6 FLOWER FRIENDS,1,7/6/2011 16:33,4.13,,United Kingdom
559163,22161,HEART DECORATION RUSTIC HANGING ,1,7/6/2011 16:33,0.79,,United Kingdom
559163,22166,WALL MIRROR RECTANGLE DIAMANTE PINK,1,7/6/2011 16:33,7.46,,United Kingdom
559163,22167, OVAL WALL MIRROR DIAMANTE ,1,7/6/2011 16:33,8.29,,United Kingdom
559163,22189,CREAM HEART CARD HOLDER,1,7/6/2011 16:33,8.29,,United Kingdom
559163,22199,FRYING PAN RED RETROSPOT,1,7/6/2011 16:33,4.13,,United Kingdom
559163,22203,MILK PAN RED RETROSPOT,2,7/6/2011 16:33,3.29,,United Kingdom
559163,22204,MILK PAN BLUE POLKADOT,1,7/6/2011 16:33,3.29,,United Kingdom
559163,22208,WOOD STAMP SET THANK YOU,1,7/6/2011 16:33,0.83,,United Kingdom
559163,22211,WOOD STAMP SET FLOWERS,3,7/6/2011 16:33,0.83,,United Kingdom
559163,22227,HANGING HEART MIRROR DECORATION ,2,7/6/2011 16:33,1.25,,United Kingdom
559163,22228,BUNNY WOODEN PAINTED WITH BIRD ,1,7/6/2011 16:33,0.83,,United Kingdom
559163,22231,JIGSAW TREE WITH BIRDHOUSE,1,7/6/2011 16:33,1.25,,United Kingdom
559163,22232,JIGSAW TOADSTOOLS 3 PIECE,1,7/6/2011 16:33,1.25,,United Kingdom
559163,22244,3 HOOK HANGER MAGIC GARDEN,4,7/6/2011 16:33,4.13,,United Kingdom
559163,22246,MAGIC GARDEN FELT GARLAND ,7,7/6/2011 16:33,1.63,,United Kingdom
559163,22249,DECORATION WHITE CHICK MAGIC GARDEN,2,7/6/2011 16:33,0.83,,United Kingdom
559163,22250,DECORATION  BUTTERFLY  MAGIC GARDEN,4,7/6/2011 16:33,0.83,,United Kingdom
559163,22268,DECORATION SITTING BUNNY,3,7/6/2011 16:33,0.63,,United Kingdom
559163,22269,EGG CUP NATURAL CHICKEN,1,7/6/2011 16:33,0.83,,United Kingdom
559163,22277,COSMETIC BAG VINTAGE ROSE PAISLEY,2,7/6/2011 16:33,1.63,,United Kingdom
559163,22278,OVERNIGHT BAG VINTAGE ROSE PAISLEY,3,7/6/2011 16:33,4.13,,United Kingdom
559163,22279,POCKET BAG BLUE PAISLEY RED SPOT,2,7/6/2011 16:33,0.83,,United Kingdom
559163,22280,POCKET BAG PINK PAISELY BROWN SPOT,2,7/6/2011 16:33,0.83,,United Kingdom
559163,22286,DECORATION WOBBLY RABBIT METAL ,1,7/6/2011 16:33,1.25,,United Kingdom
559163,22291,HANGING CHICK CREAM DECORATION,1,7/6/2011 16:33,1.25,,United Kingdom
559163,22293,HANGING CHICK GREEN DECORATION,5,7/6/2011 16:33,1.25,,United Kingdom
559163,22315,200 RED + WHITE BENDY STRAWS,5,7/6/2011 16:33,1.25,,United Kingdom
559163,22316,200 BENDY SKULL STRAWS,2,7/6/2011 16:33,1.25,,United Kingdom
559163,22322,BIRD DECORATION GREEN POLKADOT,3,7/6/2011 16:33,0.83,,United Kingdom
559163,22329,ROUND CONTAINER SET OF 5 RETROSPOT,3,7/6/2011 16:33,1.63,,United Kingdom
559163,22335,HEART DECORATION PAINTED ZINC ,2,7/6/2011 16:33,1.25,,United Kingdom
559163,22336,DOVE DECORATION PAINTED ZINC ,1,7/6/2011 16:33,1.25,,United Kingdom
559163,22342,HOME GARLAND PAINTED ZINC ,1,7/6/2011 16:33,1.63,,United Kingdom
559163,22356,CHARLOTTE BAG PINK POLKADOT,1,7/6/2011 16:33,1.63,,United Kingdom
559163,22357,KINGS CHOICE BISCUIT TIN,1,7/6/2011 16:33,4.13,,United Kingdom
559163,22358,KINGS CHOICE TEA CADDY ,2,7/6/2011 16:33,2.46,,United Kingdom
559163,22371,AIRLINE BAG VINTAGE TOKYO 78,4,7/6/2011 16:33,4.13,,United Kingdom
559163,22374,AIRLINE BAG VINTAGE JET SET RED,2,7/6/2011 16:33,4.13,,United Kingdom
559163,22376,AIRLINE BAG VINTAGE JET SET WHITE,1,7/6/2011 16:33,4.13,,United Kingdom
559163,22377,BOTTLE BAG RETROSPOT ,1,7/6/2011 16:33,1.63,,United Kingdom
559163,22378,WALL TIDY RETROSPOT ,5,7/6/2011 16:33,1.63,,United Kingdom
559163,22379,RECYCLING BAG RETROSPOT ,1,7/6/2011 16:33,4.13,,United Kingdom
559163,22381,TOY TIDY PINK POLKADOT,2,7/6/2011 16:33,4.13,,United Kingdom
559163,22411,JUMBO SHOPPER VINTAGE RED PAISLEY,1,7/6/2011 16:33,4.13,,United Kingdom
559163,22420,LIPSTICK PEN BABY PINK,1,7/6/2011 16:33,0.83,,United Kingdom
559163,22469,HEART OF WICKER SMALL,2,7/6/2011 16:33,3.29,,United Kingdom
559163,22470,HEART OF WICKER LARGE,1,7/6/2011 16:33,5.79,,United Kingdom
559163,22478,BIRDHOUSE GARDEN MARKER ,8,7/6/2011 16:33,2.46,,United Kingdom
559163,22481,BLACK TEA TOWEL CLASSIC DESIGN,3,7/6/2011 16:33,0.83,,United Kingdom
559163,22487,WHITE WOOD GARDEN PLANT LADDER,1,7/6/2011 16:33,19.96,,United Kingdom
559163,22489,PACK OF 12 TRADITIONAL CRAYONS,1,7/6/2011 16:33,0.83,,United Kingdom
559163,22499,WOODEN UNION JACK BUNTING,4,7/6/2011 16:33,4.96,,United Kingdom
559163,22504,CABIN BAG VINTAGE RETROSPOT,1,7/6/2011 16:33,16.63,,United Kingdom
559163,22508,DOORSTOP RETROSPOT HEART,1,7/6/2011 16:33,7.46,,United Kingdom
559163,22595,GINGHAM HEART DECORATION,1,7/6/2011 16:33,1.63,,United Kingdom
559163,22609,PENS ASSORTED SPACEBALL,1,7/6/2011 16:33,0.42,,United Kingdom
559163,22610,PENS ASSORTED FUNNY FACE,2,7/6/2011 16:33,0.42,,United Kingdom
559163,22628,PICNIC BOXES SET OF 3 RETROSPOT ,2,7/6/2011 16:33,4.13,,United Kingdom
559163,22651,GENTLEMAN SHIRT REPAIR KIT ,1,7/6/2011 16:33,0.79,,United Kingdom
559163,22659,LUNCH BOX I LOVE LONDON,1,7/6/2011 16:33,4.13,,United Kingdom
559163,22663,JUMBO BAG DOLLY GIRL DESIGN,2,7/6/2011 16:33,2.46,,United Kingdom
559163,22712,CARD DOLLY GIRL ,1,7/6/2011 16:33,0.83,,United Kingdom
559163,22714,CARD BIRTHDAY COWBOY,1,7/6/2011 16:33,0.83,,United Kingdom
559163,22720,SET OF 3 CAKE TINS PANTRY DESIGN ,1,7/6/2011 16:33,10.79,,United Kingdom
559163,22721,SET OF 3 CAKE TINS SKETCHBOOK,1,7/6/2011 16:33,4.13,,United Kingdom
559163,22728,ALARM CLOCK BAKELIKE PINK,1,7/6/2011 16:33,7.46,,United Kingdom
559163,22756,LARGE YELLOW BABUSHKA NOTEBOOK ,1,7/6/2011 16:33,2.46,,United Kingdom
559163,22778,GLASS CLOCHE SMALL,1,7/6/2011 16:33,8.29,,United Kingdom
559163,22791,T-LIGHT GLASS FLUTED ANTIQUE,22,7/6/2011 16:33,2.46,,United Kingdom
559163,22805,BLUE DRAWER KNOB ACRYLIC EDWARDIAN,3,7/6/2011 16:33,2.46,,United Kingdom
559163,22807,SET OF 6 T-LIGHTS TOADSTOOLS,2,7/6/2011 16:33,2.46,,United Kingdom
559163,22811,SET OF 6 T-LIGHTS CACTI ,3,7/6/2011 16:33,2.46,,United Kingdom
559163,22814,CARD PARTY GAMES ,2,7/6/2011 16:33,0.42,,United Kingdom
559163,22815,CARD PSYCHEDELIC APPLES,3,7/6/2011 16:33,0.42,,United Kingdom
559163,22817,CARD SUKI BIRTHDAY,1,7/6/2011 16:33,0.42,,United Kingdom
559163,22819,"BIRTHDAY CARD, RETRO SPOT",1,7/6/2011 16:33,0.42,,United Kingdom
559163,22820,GIFT BAG BIRTHDAY,6,7/6/2011 16:33,0.42,,United Kingdom
559163,22821,GIFT BAG PSYCHEDELIC APPLES,8,7/6/2011 16:33,0.42,,United Kingdom
559163,22855,FINE WICKER HEART ,1,7/6/2011 16:33,2.46,,United Kingdom
559163,22902,TOTE BAG I LOVE LONDON,1,7/6/2011 16:33,4.13,,United Kingdom
559163,22909,SET OF 20 VINTAGE CHRISTMAS NAPKINS,1,7/6/2011 16:33,1.63,,United Kingdom
559163,22916,HERB MARKER THYME,1,7/6/2011 16:33,1.63,,United Kingdom
559163,22917,HERB MARKER ROSEMARY,1,7/6/2011 16:33,1.63,,United Kingdom
559163,22918,HERB MARKER PARSLEY,1,7/6/2011 16:33,1.63,,United Kingdom
559163,22920,HERB MARKER BASIL,1,7/6/2011 16:33,1.63,,United Kingdom
559163,22921,HERB MARKER CHIVES ,1,7/6/2011 16:33,1.63,,United Kingdom
559163,22946,WOODEN ADVENT CALENDAR CREAM,1,7/6/2011 16:33,16.63,,United Kingdom
559163,22953,BIRTHDAY PARTY CORDON BARRIER TAPE,1,7/6/2011 16:33,0.83,,United Kingdom
559163,22954,HEN PARTY CORDON BARRIER TAPE,1,7/6/2011 16:33,0.83,,United Kingdom
559163,22955,36 FOIL STAR CAKE CASES ,1,7/6/2011 16:33,2.46,,United Kingdom
559163,22956,36 FOIL HEART CAKE CASES,1,7/6/2011 16:33,2.46,,United Kingdom
559163,22961,JAM MAKING SET PRINTED,1,7/6/2011 16:33,3.29,,United Kingdom
559163,22970,LONDON BUS COFFEE MUG,1,7/6/2011 16:33,4.96,,United Kingdom
559163,23004,TRAVEL CARD WALLET PANTRY,1,7/6/2011 16:33,0.83,,United Kingdom
559163,23006,TRAVEL CARD WALLET FLOWER MEADOW,1,7/6/2011 16:33,0.83,,United Kingdom
559163,23029,DRAWER KNOB CRACKLE GLAZE GREEN,4,7/6/2011 16:33,3.29,,United Kingdom
559163,23048,SET OF 10 LANTERNS FAIRY LIGHT STAR,1,7/6/2011 16:33,8.29,,United Kingdom
559163,23061,VINTAGE EMBOSSED HEART,3,7/6/2011 16:33,2.46,,United Kingdom
559163,23068,ALUMINIUM STAMPED HEART,1,7/6/2011 16:33,4.96,,United Kingdom
559163,23084,RABBIT NIGHT LIGHT,3,7/6/2011 16:33,4.13,,United Kingdom
559163,23124,18PC WOODEN CUTLERY SET DISPOSABLE,1,7/6/2011 16:33,2.46,,United Kingdom
559163,23125,6PC WOOD PLATE SET DISPOSABLE,1,7/6/2011 16:33,2.46,,United Kingdom
559163,23141,TRIPLE WIRE HOOK PINK HEART,2,7/6/2011 16:33,4.13,,United Kingdom
559163,23148,MINIATURE ANTIQUE ROSE HOOK IVORY,4,7/6/2011 16:33,2.46,,United Kingdom
559163,23165,LARGE CERAMIC TOP STORAGE JAR,1,7/6/2011 16:33,3.29,,United Kingdom
559163,23166,MEDIUM CERAMIC TOP STORAGE JAR,1,7/6/2011 16:33,2.46,,United Kingdom
559163,23168,CLASSIC CAFE SUGAR DISPENSER,1,7/6/2011 16:33,2.46,,United Kingdom
559163,23188,VINTAGE  2 METER FOLDING RULER,1,7/6/2011 16:33,3.29,,United Kingdom
559163,23199,JUMBO BAG APPLES,2,7/6/2011 16:33,4.13,,United Kingdom
559163,23200,JUMBO BAG PEARS,4,7/6/2011 16:33,4.13,,United Kingdom
559163,23201,JUMBO BAG ALPHABET,2,7/6/2011 16:33,4.13,,United Kingdom
559163,23202,JUMBO BAG VINTAGE LEAF,2,7/6/2011 16:33,4.13,,United Kingdom
559163,23203,JUMBO BAG DOILEY PATTERNS,2,7/6/2011 16:33,4.13,,United Kingdom
559163,23204,CHARLOTTE BAG APPLES DESIGN,1,7/6/2011 16:33,1.63,,United Kingdom
559163,23205,CHARLOTTE BAG VINTAGE ALPHABET ,1,7/6/2011 16:33,1.63,,United Kingdom
559163,23212,HEART WREATH DECORATION WITH BELL,1,7/6/2011 16:33,2.5,,United Kingdom
559163,23219,LAUREL STAR ANTIQUE SILVER ,1,7/6/2011 16:33,2.5,,United Kingdom
559163,23236,DOILEY STORAGE TIN,1,7/6/2011 16:33,5.79,,United Kingdom
559163,23249,VINTAGE RED ENAMEL TRIM PLATE,1,7/6/2011 16:33,3.29,,United Kingdom
559163,23250,VINTAGE RED TRIM ENAMEL BOWL ,2,7/6/2011 16:33,2.46,,United Kingdom
559163,23265,SET OF 3 WOODEN TREE DECORATIONS,1,7/6/2011 16:33,2.46,,United Kingdom
559163,23286,BLUE VINTAGE SPOT BEAKER,2,7/6/2011 16:33,1.63,,United Kingdom
559163,23287,RED VINTAGE SPOT BEAKER,3,7/6/2011 16:33,1.63,,United Kingdom
559163,23298,SPOTTY BUNTING,1,7/6/2011 16:33,10.79,,United Kingdom
559163,23301,GARDENERS KNEELING PAD KEEP CALM ,2,7/6/2011 16:33,3.29,,United Kingdom
559163,23307,SET OF 60 PANTRY DESIGN CAKE CASES ,1,7/6/2011 16:33,1.25,,United Kingdom
559163,23309,SET OF 60 I LOVE LONDON CAKE CASES ,2,7/6/2011 16:33,1.25,,United Kingdom
559163,23343,JUMBO BAG VINTAGE CHRISTMAS ,1,7/6/2011 16:33,4.13,,United Kingdom
559163,23344,JUMBO BAG 50'S CHRISTMAS ,3,7/6/2011 16:33,4.13,,United Kingdom
559163,23348,CHILDRENS TOY COOKING UTENSIL SET,1,7/6/2011 16:33,4.13,,United Kingdom
559163,35004B,SET OF 3 BLACK FLYING DUCKS,1,7/6/2011 16:33,5.79,,United Kingdom
559163,35598D,PINK/WHITE CHRISTMAS TREE 60CM,1,7/6/2011 16:33,2.46,,United Kingdom
559163,35924,HANGING FAIRY CAKE DECORATION,1,7/6/2011 16:33,1.63,,United Kingdom
559163,35970,ZINC FOLKART SLEIGH BELLS,1,7/6/2011 16:33,4.13,,United Kingdom
559163,47369B,BLUE GREEN EMBROIDERY COSMETIC BAG,1,7/6/2011 16:33,1.63,,United Kingdom
559163,47563A,RETRO LONGBOARD IRONING BOARD COVER,1,7/6/2011 16:33,3.29,,United Kingdom
559163,47566,PARTY BUNTING,1,7/6/2011 16:33,10.79,,United Kingdom
559163,47574A,ENGLISH ROSE SCENTED HANGING FLOWER,2,7/6/2011 16:33,2.46,,United Kingdom
559163,47593B,SCOTTIE DOGS BABY BIB,1,7/6/2011 16:33,0.83,,United Kingdom
559163,48184,DOORMAT ENGLISH ROSE ,1,7/6/2011 16:33,15.79,,United Kingdom
559163,51014A,"FEATHER PEN,HOT PINK",1,7/6/2011 16:33,0.83,,United Kingdom
559163,71477,COLOUR GLASS. STAR T-LIGHT HOLDER,1,7/6/2011 16:33,6.63,,United Kingdom
559163,82001S,VINYL RECORD FRAME SILVER,2,7/6/2011 16:33,7.46,,United Kingdom
559163,82494L,WOODEN FRAME ANTIQUE WHITE ,3,7/6/2011 16:33,7.46,,United Kingdom
559163,82567,"AIRLINE LOUNGE,METAL SIGN",2,7/6/2011 16:33,1.63,,United Kingdom
559163,82580,BATHROOM METAL SIGN,1,7/6/2011 16:33,1.25,,United Kingdom
559163,82582,AREA PATROLLED METAL SIGN,1,7/6/2011 16:33,4.13,,United Kingdom
559163,84031B,CHARLIE LOLA BLUE HOT WATER BOTTLE ,1,7/6/2011 16:33,4.13,,United Kingdom
559163,84032A,CHARLIE+LOLA PINK HOT WATER BOTTLE,1,7/6/2011 16:33,3.29,,United Kingdom
559163,84032B,CHARLIE + LOLA RED HOT WATER BOTTLE,2,7/6/2011 16:33,3.29,,United Kingdom
559163,84251B,"GREETING CARD, STICKY GORDON",2,7/6/2011 16:33,0.42,,United Kingdom
559163,84251G,"GREETING CARD, OVERCROWDED POOL.",2,7/6/2011 16:33,0.42,,United Kingdom
559164,21094,SET/6 RED SPOTTY PAPER PLATES,96,7/6/2011 16:39,0.64,16422,United Kingdom
