559153,23243,SET OF TEA COFFEE SUGAR TINS PANTRY,4,7/6/2011 15:10,4.95,13804,United Kingdom
559153,22979,PANTRY WASHING UP BRUSH,12,7/6/2011 15:10,1.45,13804,United Kingdom
559153,23299,FOOD COVER WITH BEADS SET 2 ,6,7/6/2011 15:10,3.75,13804,United Kingdom
559153,23169,CLASSIC GLASS SWEET JAR,4,7/6/2011 15:10,4.15,13804,United Kingdom
559153,23165,LARGE CERAMIC TOP STORAGE JAR,12,7/6/2011 15:10,1.65,13804,United Kingdom
559153,23166,MEDIUM CERAMIC TOP STORAGE JAR,12,7/6/2011 15:10,1.25,13804,United Kingdom
559153,23167,SMALL CERAMIC TOP STORAGE JAR ,12,7/6/2011 15:10,0.83,13804,United Kingdom
559153,23229,DONKEY TAIL GAME ,6,7/6/2011 15:10,3.75,13804,United Kingdom
559153,23077,DOUGHNUT LIP GLOSS ,20,7/6/2011 15:10,1.25,13804,United Kingdom
559153,23162,REGENCY TEA STRAINER,4,7/6/2011 15:10,3.75,13804,United Kingdom
559153,23163,REGENCY SUGAR TONGS,8,7/6/2011 15:10,2.49,13804,United Kingdom
559154,22112,CHOCOLATE HOT WATER BOTTLE,3,7/6/2011 15:15,4.95,17045,United Kingdom
559154,84813,SET OF 4 DIAMOND NAPKIN RINGS,4,7/6/2011 15:15,12.75,17045,United Kingdom
559154,72741,GRAND CHOCOLATECANDLE,18,7/6/2011 15:15,1.45,17045,United Kingdom
559154,85173,SET/6 FROG PRINCE T-LIGHT CANDLES,4,7/6/2011 15:15,2.55,17045,United Kingdom
559154,20941,FROG CANDLE,5,7/6/2011 15:15,1.25,17045,United Kingdom
559155,21508,VINTAGE KID DOLLY CARD ,12,7/6/2011 15:49,0.42,13418,United Kingdom
559155,22712,CARD DOLLY GIRL ,12,7/6/2011 15:49,0.42,13418,United Kingdom
559155,22713,CARD I LOVE LONDON ,12,7/6/2011 15:49,0.42,13418,United Kingdom
559155,16156L,WRAP CAROUSEL,25,7/6/2011 15:49,0.42,13418,United Kingdom
559155,16161G,WRAP BAD HAIR DAY,25,7/6/2011 15:49,0.1,13418,United Kingdom
559155,22963,JAM JAR WITH GREEN LID,12,7/6/2011 15:49,0.85,13418,United Kingdom
559155,22961,JAM MAKING SET PRINTED,12,7/6/2011 15:49,1.45,13418,United Kingdom
559155,23309,SET OF 60 I LOVE LONDON CAKE CASES ,24,7/6/2011 15:49,0.55,13418,United Kingdom
559155,23307,SET OF 60 PANTRY DESIGN CAKE CASES ,24,7/6/2011 15:49,0.55,13418,United Kingdom
559155,21654,RIDGED GLASS FINGER BOWL,36,7/6/2011 15:49,0.39,13418,United Kingdom
559155,21990,MODERN FLORAL STATIONERY SET,12,7/6/2011 15:49,1.25,13418,United Kingdom
559155,21992,VINTAGE PAISLEY STATIONERY SET,12,7/6/2011 15:49,1.25,13418,United Kingdom
559155,22115,METAL SIGN EMPIRE TEA,12,7/6/2011 15:49,0.79,13418,United Kingdom
559155,22402,MAGNETS PACK OF 4 VINTAGE COLLAGE,12,7/6/2011 15:49,0.39,13418,United Kingdom
559155,22398,MAGNETS PACK OF 4 SWALLOWS,12,7/6/2011 15:49,0.39,13418,United Kingdom
559155,79051A,SMOKEY GREY COLOUR D.O.F. GLASS,24,7/6/2011 15:49,0.29,13418,United Kingdom
559155,84926F,PSYCHEDELIC TILE COASTER,24,7/6/2011 15:49,0.29,13418,United Kingdom
559155,84926D,LA PALMIERA TILE COASTER,24,7/6/2011 15:49,0.29,13418,United Kingdom
559155,23291,DOLLY GIRL CHILDRENS CUP,8,7/6/2011 15:49,1.25,13418,United Kingdom
559155,23289,DOLLY GIRL CHILDRENS BOWL,8,7/6/2011 15:49,1.25,13418,United Kingdom
559155,23292,SPACEBOY CHILDRENS CUP,8,7/6/2011 15:49,1.25,13418,United Kingdom
559155,23290,SPACEBOY CHILDRENS BOWL,8,7/6/2011 15:49,1.25,13418,United Kingdom
559155,21509,COWBOYS AND INDIANS BIRTHDAY CARD ,12,7/6/2011 15:49,0.42,13418,United Kingdom
559155,21507,"ELEPHANT, BIRTHDAY CARD, ",12,7/6/2011 15:49,0.42,13418,United Kingdom
559155,22027,TEA PARTY BIRTHDAY CARD,12,7/6/2011 15:49,0.42,13418,United Kingdom
559156,23239,SET OF 4 KNICK KNACK TINS POPPIES,6,7/6/2011 15:50,4.15,13418,United Kingdom
559156,23236,DOILEY STORAGE TIN,6,7/6/2011 15:50,2.89,13418,United Kingdom
559156,23241,TREASURE TIN GYMKHANA DESIGN,6,7/6/2011 15:50,2.08,13418,United Kingdom
559156,23240,SET OF 4 KNICK KNACK TINS DOILEY ,6,7/6/2011 15:50,4.15,13418,United Kingdom
559157,21936,RED RETROSPOT PICNIC BAG,5,7/6/2011 15:53,2.95,13999,United Kingdom
559157,23203,JUMBO BAG DOILEY PATTERNS,10,7/6/2011 15:53,2.08,13999,United Kingdom
559157,23209,LUNCH BAG DOILEY PATTERN ,10,7/6/2011 15:53,1.65,13999,United Kingdom
559157,23208,LUNCH BAG VINTAGE LEAF DESIGN,10,7/6/2011 15:53,1.65,13999,United Kingdom
559157,21094,SET/6 RED SPOTTY PAPER PLATES,12,7/6/2011 15:53,0.85,13999,United Kingdom
559157,23236,DOILEY STORAGE TIN,6,7/6/2011 15:53,2.89,13999,United Kingdom
559157,23298,SPOTTY BUNTING,6,7/6/2011 15:53,4.95,13999,United Kingdom
559157,47566,PARTY BUNTING,4,7/6/2011 15:53,4.95,13999,United Kingdom
559157,21621,VINTAGE UNION JACK BUNTING,2,7/6/2011 15:53,8.5,13999,United Kingdom
559157,23241,TREASURE TIN GYMKHANA DESIGN,12,7/6/2011 15:53,2.08,13999,United Kingdom
559157,23242,TREASURE TIN BUFFALO BILL ,6,7/6/2011 15:53,2.08,13999,United Kingdom
559157,23250,VINTAGE RED TRIM ENAMEL BOWL ,24,7/6/2011 15:53,1.25,13999,United Kingdom
559157,23249,VINTAGE RED ENAMEL TRIM PLATE,12,7/6/2011 15:53,1.65,13999,United Kingdom
559157,23251,VINTAGE RED ENAMEL TRIM MUG ,12,7/6/2011 15:53,1.25,13999,United Kingdom
559157,23252,VINTAGE RED ENAMEL TRIM JUG ,4,7/6/2011 15:53,3.75,13999,United Kingdom
559157,23285,PINK VINTAGE SPOT BEAKER,8,7/6/2011 15:53,0.85,13999,United Kingdom
559157,23286,BLUE VINTAGE SPOT BEAKER,8,7/6/2011 15:53,0.85,13999,United Kingdom
559157,23287,RED VINTAGE SPOT BEAKER,8,7/6/2011 15:53,0.85,13999,United Kingdom
559157,23288,GREEN VINTAGE SPOT BEAKER,8,7/6/2011 15:53,0.85,13999,United Kingdom
559158,23028,DRAWER KNOB CRACKLE GLAZE BLUE,6,7/6/2011 16:03,1.65,17428,United Kingdom
559158,23029,DRAWER KNOB CRACKLE GLAZE GREEN,6,7/6/2011 16:03,1.65,17428,United Kingdom
559158,23031,DRAWER KNOB CRACKLE GLAZE PINK,6,7/6/2011 16:03,1.65,17428,United Kingdom
559158,23034,DRAWER KNOB CERAMIC BLACK,6,7/6/2011 16:03,1.45,17428,United Kingdom
559158,23032,DRAWER KNOB CRACKLE GLAZE IVORY,6,7/6/2011 16:03,1.65,17428,United Kingdom
559158,21400,RED PUDDING SPOON,24,7/6/2011 16:03,0.12,17428,United Kingdom
559158,21401,BLUE PUDDING SPOON,24,7/6/2011 16:03,0.12,17428,United Kingdom
559158,35471D,SET OF 3 BIRD LIGHT PINK FEATHER ,24,7/6/2011 16:03,0.39,17428,United Kingdom
559158,21731,RED TOADSTOOL LED NIGHT LIGHT,24,7/6/2011 16:03,1.65,17428,United Kingdom
559158,21916,SET 12 RETRO WHITE CHALK STICKS,24,7/6/2011 16:03,0.42,17428,United Kingdom
559158,15056N,EDWARDIAN PARASOL NATURAL,6,7/6/2011 16:03,5.95,17428,United Kingdom
559158,85014B,RED RETROSPOT UMBRELLA,3,7/6/2011 16:03,5.95,17428,United Kingdom
559158,20713,JUMBO BAG OWLS,100,7/6/2011 16:03,1.79,17428,United Kingdom
559160,21317,GLASS SPHERE CANDLE STAND MEDIUM,4,7/6/2011 16:15,5.45,17293,United Kingdom
559160,22457,NATURAL SLATE HEART CHALKBOARD ,5,7/6/2011 16:15,2.95,17293,United Kingdom
559160,71053,WHITE METAL LANTERN,4,7/6/2011 16:15,3.75,17293,United Kingdom
559160,84879,ASSORTED COLOUR BIRD ORNAMENT,24,7/6/2011 16:15,1.69,17293,United Kingdom
559160,21668,RED STRIPE CERAMIC DRAWER KNOB,6,7/6/2011 16:15,1.25,17293,United Kingdom
559160,21670,BLUE SPOT CERAMIC DRAWER KNOB,6,7/6/2011 16:15,1.25,17293,United Kingdom
559160,23035,DRAWER KNOB CERAMIC IVORY,6,7/6/2011 16:15,1.45,17293,United Kingdom
559160,23026,DRAWER KNOB VINTAGE GLASS STAR,12,7/6/2011 16:15,2.08,17293,United Kingdom
559160,23032,DRAWER KNOB CRACKLE GLAZE IVORY,12,7/6/2011 16:15,1.65,17293,United Kingdom
559160,23034,DRAWER KNOB CERAMIC BLACK,6,7/6/2011 16:15,1.45,17293,United Kingdom
559160,23029,DRAWER KNOB CRACKLE GLAZE GREEN,12,7/6/2011 16:15,1.65,17293,United Kingdom
559160,21034,REX CASH+CARRY JUMBO SHOPPER,1,7/6/2011 16:15,0.95,17293,United Kingdom
559160,23028,DRAWER KNOB CRACKLE GLAZE BLUE,12,7/6/2011 16:15,1.65,17293,United Kingdom
559160,84755,COLOUR GLASS T-LIGHT HOLDER HANGING,16,7/6/2011 16:15,0.65,17293,United Kingdom
559160,21326,AGED GLASS SILVER T-LIGHT HOLDER,24,7/6/2011 16:15,0.65,17293,United Kingdom
559161,85040A,S/4 PINK FLOWER CANDLES IN BOWL,1,7/6/2011 16:15,1.65,,United Kingdom
559161,72351A,SET/6 TURQUOISE BUTTERFLY T-LIGHTS,1,7/6/2011 16:15,2.1,,United Kingdom
559161,20886,BOX OF 9 PEBBLE CANDLES,1,7/6/2011 16:15,1.95,,United Kingdom
559161,22102,MIRROR MOSAIC T-LIGHT HOLDER ,1,7/6/2011 16:15,1.65,,United Kingdom
559162,20992,JAZZ HEARTS PURSE NOTEBOOK,1,7/6/2011 16:29,0.83,,United Kingdom
559162,21033,JUMBO BAG CHARLIE AND LOLA TOYS,13,7/6/2011 16:29,2.46,,United Kingdom
559162,21058,PARTY INVITES WOODLAND,5,7/6/2011 16:29,0.83,,United Kingdom
559162,21061,PARTY INVITES FOOTBALL,1,7/6/2011 16:29,0.83,,United Kingdom
559162,21062,PARTY INVITES SPACEMAN,4,7/6/2011 16:29,0.83,,United Kingdom
559162,21063,PARTY INVITES JAZZ HEARTS,3,7/6/2011 16:29,0.83,,United Kingdom
559162,21066,VINTAGE RED MUG,1,7/6/2011 16:29,2.46,,United Kingdom
559162,21067,VINTAGE RED TEATIME MUG,1,7/6/2011 16:29,2.46,,United Kingdom
559162,21078,SET/20 STRAWBERRY PAPER NAPKINS ,4,7/6/2011 16:29,1.63,,United Kingdom
559162,21080,SET/20 RED RETROSPOT PAPER NAPKINS ,2,7/6/2011 16:29,1.63,,United Kingdom
559162,21084,SET/6 COLLAGE PAPER CUPS,9,7/6/2011 16:29,0.83,,United Kingdom
559162,21086,SET/6 RED SPOTTY PAPER CUPS,3,7/6/2011 16:29,1.63,,United Kingdom
559162,21090,SET/6 COLLAGE PAPER PLATES,10,7/6/2011 16:29,0.83,,United Kingdom
559162,21094,SET/6 RED SPOTTY PAPER PLATES,3,7/6/2011 16:29,0.83,,United Kingdom
559162,21122,SET/10 PINK POLKADOT PARTY CANDLES,1,7/6/2011 16:29,2.46,,United Kingdom
559162,21136,PAINTED METAL PEARS ASSORTED,24,7/6/2011 16:29,1.04,,United Kingdom
559162,21166,COOK WITH WINE METAL SIGN ,1,7/6/2011 16:29,4.13,,United Kingdom
559162,21172,PARTY METAL SIGN ,1,7/6/2011 16:29,4.13,,United Kingdom
559162,21179,NO JUNK MAIL METAL SIGN,1,7/6/2011 16:29,1.63,,United Kingdom
559162,21204,DAISIES  HONEYCOMB GARLAND ,5,7/6/2011 16:29,1.63,,United Kingdom
559162,21206,STRAWBERRY HONEYCOMB  GARLAND ,5,7/6/2011 16:29,1.63,,United Kingdom
559162,21209,MULTICOLOUR HONEYCOMB FAN,8,7/6/2011 16:29,3.29,,United Kingdom
559162,21224,SET/4 SKULL BADGES,1,7/6/2011 16:29,0.83,,United Kingdom
559162,21226,POCKET MIRROR WOODLAND,5,7/6/2011 16:29,0.83,,United Kingdom
559162,21232,STRAWBERRY CERAMIC TRINKET BOX,2,7/6/2011 16:29,2.46,,United Kingdom
559162,21239,PINK  POLKADOT CUP,1,7/6/2011 16:29,1.63,,United Kingdom
559162,21327,SKULLS WRITING SET ,4,7/6/2011 16:29,0.83,,United Kingdom
559162,21328,BALLOONS  WRITING SET ,5,7/6/2011 16:29,0.83,,United Kingdom
559162,21382,SET/4 SPRING FLOWER DECORATION,2,7/6/2011 16:29,1.63,,United Kingdom
559162,21383,PACK OF 12 STICKY BUNNIES,3,7/6/2011 16:29,0.83,,United Kingdom
559162,21389,IVORY HANGING DECORATION  BIRD,3,7/6/2011 16:29,0.83,,United Kingdom
559162,21391,FRENCH LAVENDER SCENT HEART,4,7/6/2011 16:29,1.63,,United Kingdom
559162,21454,PAINTED PINK RABBIT ,1,7/6/2011 16:29,0.83,,United Kingdom
559162,21466,RED FLOWER CROCHET FOOD COVER,1,7/6/2011 16:29,3.29,,United Kingdom
559162,21467,CHERRY CROCHET FOOD COVER,1,7/6/2011 16:29,3.29,,United Kingdom
559162,21468,BUTTERFLY CROCHET FOOD COVER,1,7/6/2011 16:29,3.29,,United Kingdom
559162,21469,POLKA DOT RAFFIA FOOD COVER,1,7/6/2011 16:29,3.29,,United Kingdom
559162,21470,FLOWER VINE RAFFIA FOOD COVER,1,7/6/2011 16:29,3.29,,United Kingdom
559162,21471,STRAWBERRY RAFFIA FOOD COVER,2,7/6/2011 16:29,3.29,,United Kingdom
559162,21494,ROTATING LEAVES T-LIGHT HOLDER,9,7/6/2011 16:29,1.63,,United Kingdom
559162,21523,DOORMAT FANCY FONT HOME SWEET HOME,1,7/6/2011 16:29,15.79,,United Kingdom
559162,21528,DAIRY MAID TRADITIONAL TEAPOT ,1,7/6/2011 16:29,5.79,,United Kingdom
559162,21530,DAIRY MAID TOASTRACK,1,7/6/2011 16:29,3.29,,United Kingdom
559162,21534,DAIRY MAID LARGE MILK JUG,1,7/6/2011 16:29,4.13,,United Kingdom
559162,21557,SET OF 6 FUNKY BEAKERS,1,7/6/2011 16:29,5.79,,United Kingdom
559162,21576,LETS GO SHOPPING COTTON TOTE BAG,1,7/6/2011 16:29,1.63,,United Kingdom
559162,21577,SAVE THE PLANET COTTON TOTE BAG,1,7/6/2011 16:29,1.63,,United Kingdom
559162,21578,WOODLAND DESIGN  COTTON TOTE BAG,9,7/6/2011 16:29,1.63,,United Kingdom
559162,21581,SKULLS  DESIGN  COTTON TOTE BAG,25,7/6/2011 16:29,1.63,,United Kingdom
559162,21618,4 WILDFLOWER BOTANICAL CANDLES,1,7/6/2011 16:29,2.46,,United Kingdom
559162,21629,SQUARE FLOOR CUSHION VINTAGE RED,1,7/6/2011 16:29,15.79,,United Kingdom
559162,21650,ASSORTED TUTTI FRUTTI BRACELET,1,7/6/2011 16:29,0.83,,United Kingdom
559162,21708,FOLDING UMBRELLA CREAM POLKADOT,1,7/6/2011 16:29,3.29,,United Kingdom
559162,21710,FOLDING UMBRELLA PINKWHITE POLKADOT,3,7/6/2011 16:29,3.29,,United Kingdom
559162,21711,FOLDING UMBRELLA WHITE/RED POLKADOT,2,7/6/2011 16:29,3.29,,United Kingdom
559162,21714,CITRONELLA CANDLE GARDEN POT,3,7/6/2011 16:29,2.46,,United Kingdom
559162,21716,BOYS VINTAGE TIN SEASIDE BUCKET,1,7/6/2011 16:29,2.46,,United Kingdom
559162,21723,ALPHABET HEARTS STICKER SHEET,1,7/6/2011 16:29,0.79,,United Kingdom
559162,21731,RED TOADSTOOL LED NIGHT LIGHT,2,7/6/2011 16:29,3.29,,United Kingdom
559162,21786,POLKADOT RAIN HAT ,4,7/6/2011 16:29,0.83,,United Kingdom
559162,21788,KIDS RAIN MAC BLUE,2,7/6/2011 16:29,0.79,,United Kingdom
559162,21789,KIDS RAIN MAC PINK,9,7/6/2011 16:29,0.79,,United Kingdom
559162,21846,PINK DIAMANTE PEN IN GIFT BOX,4,7/6/2011 16:29,2.46,,United Kingdom
559162,21851,LILAC DIAMANTE PEN IN GIFT BOX,2,7/6/2011 16:29,2.46,,United Kingdom
559162,21871,SAVE THE PLANET MUG,1,7/6/2011 16:29,3.29,,United Kingdom
559162,21888,BINGO SET,1,7/6/2011 16:29,7.46,,United Kingdom
559162,21905,MORE BUTTER METAL SIGN ,2,7/6/2011 16:29,1.63,,United Kingdom
559162,21929,JUMBO BAG PINK VINTAGE PAISLEY,2,7/6/2011 16:29,4.13,,United Kingdom
559162,21930,JUMBO STORAGE BAG SKULLS,2,7/6/2011 16:29,4.13,,United Kingdom
559162,21931,JUMBO STORAGE BAG SUKI,1,7/6/2011 16:29,4.13,,United Kingdom
559162,21934,SKULL SHOULDER BAG,7,7/6/2011 16:29,1.63,,United Kingdom
559162,21935,SUKI  SHOULDER BAG,18,7/6/2011 16:29,1.63,,United Kingdom
559162,21942,SKULLS DESIGN FLANNEL,1,7/6/2011 16:29,0.83,,United Kingdom
559162,21944,KITTENS DESIGN FLANNEL,1,7/6/2011 16:29,0.83,,United Kingdom
559162,21945,STRAWBERRIES  DESIGN FLANNEL ,2,7/6/2011 16:29,0.83,,United Kingdom
559162,21977,PACK OF 60 PINK PAISLEY CAKE CASES,1,7/6/2011 16:29,1.25,,United Kingdom
559162,21990,MODERN FLORAL STATIONERY SET,1,7/6/2011 16:29,2.46,,United Kingdom
559162,21992,VINTAGE PAISLEY STATIONERY SET,3,7/6/2011 16:29,2.46,,United Kingdom
559162,21993,FLORAL FOLK STATIONERY SET,2,7/6/2011 16:29,2.46,,United Kingdom
559162,22031,BOTANICAL LAVENDER BIRTHDAY CARD,4,7/6/2011 16:29,0.42,,United Kingdom
559162,22055,MINI CAKE STAND  HANGING STRAWBERY,2,7/6/2011 16:29,3.29,,United Kingdom
559162,22059,CERAMIC STRAWBERRY DESIGN MUG,1,7/6/2011 16:29,3.29,,United Kingdom
559162,22090,PAPER BUNTING RETROSPOT,2,7/6/2011 16:29,5.79,,United Kingdom
559162,22109,FULL ENGLISH BREAKFAST PLATE,2,7/6/2011 16:29,7.46,,United Kingdom
559162,22182,CAKE STAND VICTORIAN FILIGREE SMALL,3,7/6/2011 16:29,4.13,,United Kingdom
559162,22208,WOOD STAMP SET THANK YOU,2,7/6/2011 16:29,0.83,,United Kingdom
559162,22209,WOOD STAMP SET HAPPY BIRTHDAY,3,7/6/2011 16:29,0.83,,United Kingdom
559162,22211,WOOD STAMP SET FLOWERS,31,7/6/2011 16:29,0.83,,United Kingdom
559162,22228,BUNNY WOODEN PAINTED WITH BIRD ,4,7/6/2011 16:29,0.83,,United Kingdom
559162,22229,BUNNY WOODEN PAINTED WITH FLOWER ,2,7/6/2011 16:29,0.83,,United Kingdom
559162,22230,JIGSAW TREE WITH WATERING CAN,5,7/6/2011 16:29,0.83,,United Kingdom
559162,22231,JIGSAW TREE WITH BIRDHOUSE,4,7/6/2011 16:29,1.25,,United Kingdom
559162,22233,JIGSAW RABBIT AND BIRDHOUSE,3,7/6/2011 16:29,1.25,,United Kingdom
559162,22246,MAGIC GARDEN FELT GARLAND ,1,7/6/2011 16:29,1.63,,United Kingdom
559162,22247,BUNNY DECORATION MAGIC GARDEN,2,7/6/2011 16:29,0.83,,United Kingdom
559162,22248,DECORATION  PINK CHICK MAGIC GARDEN,1,7/6/2011 16:29,0.83,,United Kingdom
559162,22249,DECORATION WHITE CHICK MAGIC GARDEN,2,7/6/2011 16:29,0.83,,United Kingdom
559162,22251,BIRDHOUSE DECORATION MAGIC GARDEN,18,7/6/2011 16:29,0.83,,United Kingdom
559162,22268,DECORATION SITTING BUNNY,1,7/6/2011 16:29,0.63,,United Kingdom
559162,22278,OVERNIGHT BAG VINTAGE ROSE PAISLEY,1,7/6/2011 16:29,4.13,,United Kingdom
559162,22279,POCKET BAG BLUE PAISLEY RED SPOT,1,7/6/2011 16:29,0.83,,United Kingdom
559162,22280,POCKET BAG PINK PAISELY BROWN SPOT,6,7/6/2011 16:29,0.83,,United Kingdom
559162,22291,HANGING CHICK CREAM DECORATION,1,7/6/2011 16:29,1.25,,United Kingdom
559162,22293,HANGING CHICK GREEN DECORATION,4,7/6/2011 16:29,1.25,,United Kingdom
559162,22322,BIRD DECORATION GREEN POLKADOT,3,7/6/2011 16:29,0.83,,United Kingdom
559162,22329,ROUND CONTAINER SET OF 5 RETROSPOT,1,7/6/2011 16:29,1.63,,United Kingdom
559162,22333,RETROSPOT PARTY BAG + STICKER SET,2,7/6/2011 16:29,3.29,,United Kingdom
559162,22356,CHARLOTTE BAG PINK POLKADOT,2,7/6/2011 16:29,1.63,,United Kingdom
559162,22358,KINGS CHOICE TEA CADDY ,2,7/6/2011 16:29,2.46,,United Kingdom
559162,22372,AIRLINE BAG VINTAGE WORLD CHAMPION ,1,7/6/2011 16:29,4.13,,United Kingdom
559162,22374,AIRLINE BAG VINTAGE JET SET RED,2,7/6/2011 16:29,4.13,,United Kingdom
559162,22375,AIRLINE BAG VINTAGE JET SET BROWN,1,7/6/2011 16:29,4.13,,United Kingdom
559162,22377,BOTTLE BAG RETROSPOT ,4,7/6/2011 16:29,1.63,,United Kingdom
559162,22378,WALL TIDY RETROSPOT ,5,7/6/2011 16:29,1.63,,United Kingdom
559162,22385,JUMBO BAG SPACEBOY DESIGN,1,7/6/2011 16:29,4.13,,United Kingdom
559162,22386,JUMBO BAG PINK POLKADOT,1,7/6/2011 16:29,4.13,,United Kingdom
559162,22427,ENAMEL FLOWER JUG CREAM,1,7/6/2011 16:29,11.63,,United Kingdom
559162,22470,HEART OF WICKER LARGE,1,7/6/2011 16:29,5.79,,United Kingdom
559162,22494,EMERGENCY FIRST AID TIN ,1,7/6/2011 16:29,2.46,,United Kingdom
559162,22498,WOODEN REGATTA BUNTING,1,7/6/2011 16:29,4.96,,United Kingdom
559162,22499,WOODEN UNION JACK BUNTING,2,7/6/2011 16:29,4.96,,United Kingdom
559162,22537,MAGIC DRAWING SLATE DINOSAUR,1,7/6/2011 16:29,0.83,,United Kingdom
559162,22559,SEASIDE FLYING DISC,8,7/6/2011 16:29,0.83,,United Kingdom
559162,22616,PACK OF 12 LONDON TISSUES ,1,7/6/2011 16:29,0.83,,United Kingdom
559162,22624,IVORY KITCHEN SCALES,1,7/6/2011 16:29,16.63,,United Kingdom
559162,11001,ASSTD DESIGN RACING CAR PEN,29,7/6/2011 16:29,0.83,,United Kingdom
559162,15044C,PURPLE PAPER PARASOL,1,7/6/2011 16:29,5.79,,United Kingdom
559162,15058C,ICE CREAM DESIGN GARDEN PARASOL,1,7/6/2011 16:29,10.79,,United Kingdom
559162,18094C,WHITE AND BLUE CERAMIC OIL BURNER,3,7/6/2011 16:29,2.46,,United Kingdom
559162,20665,RED RETROSPOT PURSE ,1,7/6/2011 16:29,2.46,,United Kingdom
559162,20669,RED HEART LUGGAGE TAG,1,7/6/2011 16:29,0.83,,United Kingdom
559162,20707,CRAZY DAISY HEART DECORATION,1,7/6/2011 16:29,0.83,,United Kingdom
559162,20711,JUMBO BAG TOYS ,2,7/6/2011 16:29,4.13,,United Kingdom
559162,20712,JUMBO BAG WOODLAND ANIMALS,1,7/6/2011 16:29,4.13,,United Kingdom
559162,20713,JUMBO BAG OWLS,1,7/6/2011 16:29,4.13,,United Kingdom
559162,20717,STRAWBERRY SHOPPER BAG,1,7/6/2011 16:29,2.46,,United Kingdom
559162,20719,WOODLAND CHARLOTTE BAG,1,7/6/2011 16:29,1.63,,United Kingdom
559162,20724,RED RETROSPOT CHARLOTTE BAG,1,7/6/2011 16:29,1.63,,United Kingdom
559162,20768,GREEN FERN JOURNAL ,1,7/6/2011 16:29,2.46,,United Kingdom
559162,20974,12 PENCILS SMALL TUBE SKULL,1,7/6/2011 16:29,1.25,,United Kingdom
559162,20977,36 PENCILS TUBE WOODLAND,1,7/6/2011 16:29,2.46,,United Kingdom
559162,20979,36 PENCILS TUBE RED RETROSPOT,2,7/6/2011 16:29,2.46,,United Kingdom
559162,22628,PICNIC BOXES SET OF 3 RETROSPOT ,1,7/6/2011 16:29,4.13,,United Kingdom
559162,22646,CERAMIC STRAWBERRY CAKE MONEY BANK,1,7/6/2011 16:29,3.29,,United Kingdom
559162,22651,GENTLEMAN SHIRT REPAIR KIT ,1,7/6/2011 16:29,0.79,,United Kingdom
559162,22653,BUTTON BOX ,3,7/6/2011 16:29,1.63,,United Kingdom
559162,22663,JUMBO BAG DOLLY GIRL DESIGN,14,7/6/2011 16:29,2.46,,United Kingdom
559162,22677,FRENCH BLUE METAL DOOR SIGN 2,1,7/6/2011 16:29,2.46,,United Kingdom
559162,22679,FRENCH BLUE METAL DOOR SIGN 4,1,7/6/2011 16:29,2.46,,United Kingdom
559162,22721,SET OF 3 CAKE TINS SKETCHBOOK,2,7/6/2011 16:29,4.13,,United Kingdom
559162,22733,3D TRADITIONAL CHRISTMAS STICKERS,1,7/6/2011 16:29,2.46,,United Kingdom
559162,22785,SQUARECUSHION COVER PINK UNION JACK,1,7/6/2011 16:29,7.46,,United Kingdom
559162,22811,SET OF 6 T-LIGHTS CACTI ,1,7/6/2011 16:29,2.46,,United Kingdom
559162,22814,CARD PARTY GAMES ,7,7/6/2011 16:29,0.42,,United Kingdom
559162,22815,CARD PSYCHEDELIC APPLES,3,7/6/2011 16:29,0.42,,United Kingdom
559162,22817,CARD SUKI BIRTHDAY,5,7/6/2011 16:29,0.42,,United Kingdom
559162,22820,GIFT BAG BIRTHDAY,5,7/6/2011 16:29,0.42,,United Kingdom
559162,22821,GIFT BAG PSYCHEDELIC APPLES,4,7/6/2011 16:29,0.42,,United Kingdom
559162,22846,BREAD BIN DINER STYLE RED ,1,7/6/2011 16:29,33.29,,United Kingdom
559162,22906,12 MESSAGE CARDS WITH ENVELOPES,4,7/6/2011 16:29,3.29,,United Kingdom
559162,22907,PACK OF 20 NAPKINS PANTRY DESIGN,12,7/6/2011 16:29,1.63,,United Kingdom
559162,22951,60 CAKE CASES DOLLY GIRL DESIGN,1,7/6/2011 16:29,1.25,,United Kingdom
559162,22955,36 FOIL STAR CAKE CASES ,2,7/6/2011 16:29,2.46,,United Kingdom
559162,22956,36 FOIL HEART CAKE CASES,3,7/6/2011 16:29,2.46,,United Kingdom
559162,22961,JAM MAKING SET PRINTED,2,7/6/2011 16:29,3.29,,United Kingdom
559162,23009,I LOVE LONDON BABY GIFT SET,1,7/6/2011 16:29,24.96,,United Kingdom
559162,23084,RABBIT NIGHT LIGHT,1,7/6/2011 16:29,4.13,,United Kingdom
559162,23119,PACK OF 6 LARGE FRUIT STRAWS ,1,7/6/2011 16:29,1.25,,United Kingdom
559162,23161,REGENCY CAKE FORK,2,7/6/2011 16:29,2.46,,United Kingdom
559162,23162,REGENCY TEA STRAINER,1,7/6/2011 16:29,7.46,,United Kingdom
559162,23163,REGENCY SUGAR TONGS,1,7/6/2011 16:29,4.96,,United Kingdom
559162,23199,JUMBO BAG APPLES,3,7/6/2011 16:29,4.13,,United Kingdom
559162,23200,JUMBO BAG PEARS,2,7/6/2011 16:29,4.13,,United Kingdom
559162,23202,JUMBO BAG VINTAGE LEAF,1,7/6/2011 16:29,4.13,,United Kingdom
559162,23203,JUMBO BAG DOILEY PATTERNS,1,7/6/2011 16:29,4.13,,United Kingdom
559162,23245,SET OF 3 REGENCY CAKE TINS,2,7/6/2011 16:29,10.79,,United Kingdom
559162,23285,PINK VINTAGE SPOT BEAKER,2,7/6/2011 16:29,1.63,,United Kingdom
559162,23286,BLUE VINTAGE SPOT BEAKER,4,7/6/2011 16:29,1.63,,United Kingdom
559162,23288,GREEN VINTAGE SPOT BEAKER,2,7/6/2011 16:29,1.63,,United Kingdom
559162,23291,DOLLY GIRL CHILDRENS CUP,1,7/6/2011 16:29,2.46,,United Kingdom
559162,23292,SPACEBOY CHILDRENS CUP,1,7/6/2011 16:29,2.46,,United Kingdom
559162,23298,SPOTTY BUNTING,2,7/6/2011 16:29,10.79,,United Kingdom
559162,23306,SET OF 36 DOILIES PANTRY DESIGN,2,7/6/2011 16:29,2.92,,United Kingdom
559162,23307,SET OF 60 PANTRY DESIGN CAKE CASES ,3,7/6/2011 16:29,1.25,,United Kingdom
559162,23308,SET OF 60 VINTAGE LEAF CAKE CASES ,1,7/6/2011 16:29,1.25,,United Kingdom
559162,23309,SET OF 60 I LOVE LONDON CAKE CASES ,3,7/6/2011 16:29,1.25,,United Kingdom
559162,35598D,PINK/WHITE CHRISTMAS TREE 60CM,1,7/6/2011 16:29,2.46,,United Kingdom
559162,35648,VINTAGE BEAD PINK PURSE ,4,7/6/2011 16:29,1.63,,United Kingdom
559162,35916A,YELLOW FELT HANGING HEART W FLOWER,1,7/6/2011 16:29,0.63,,United Kingdom
559162,35916B,BLUE FELT HANGING HEART WITH FLOWER,1,7/6/2011 16:29,0.63,,United Kingdom
559162,44234,ASSORTED CIRCULAR MOBILE,2,7/6/2011 16:29,0.63,,United Kingdom
559162,47574A,ENGLISH ROSE SCENTED HANGING FLOWER,1,7/6/2011 16:29,2.46,,United Kingdom
559162,48194,DOORMAT HEARTS,1,7/6/2011 16:29,15.79,,United Kingdom
559162,71496A,A4 WALL TIDY BLUE OFFICE,1,7/6/2011 16:29,1.46,,United Kingdom
559162,82482,WOODEN PICTURE FRAME WHITE FINISH,1,7/6/2011 16:29,5.79,,United Kingdom
559162,82567,"AIRLINE LOUNGE,METAL SIGN",1,7/6/2011 16:29,1.63,,United Kingdom
559162,82580,BATHROOM METAL SIGN,3,7/6/2011 16:29,1.25,,United Kingdom
559162,82581,TOILET METAL SIGN,1,7/6/2011 16:29,1.25,,United Kingdom
559162,84032A,CHARLIE+LOLA PINK HOT WATER BOTTLE,1,7/6/2011 16:29,3.29,,United Kingdom
559162,84077,WORLD WAR 2 GLIDERS ASSTD DESIGNS,1,7/6/2011 16:29,0.63,,United Kingdom
559162,84356,POMPOM CURTAIN,1,7/6/2011 16:29,5.79,,United Kingdom
559162,84509A,SET OF 4 ENGLISH ROSE PLACEMATS,1,7/6/2011 16:29,3.29,,United Kingdom
559162,84536A,ENGLISH ROSE NOTEBOOK A7 SIZE,3,7/6/2011 16:29,0.42,,United Kingdom
559162,84536B,FAIRY CAKES NOTEBOOK A7 SIZE,4,7/6/2011 16:29,0.42,,United Kingdom
559162,84558A,3D DOG PICTURE PLAYING CARDS,2,7/6/2011 16:29,2.29,,United Kingdom
559162,84559A,3D SHEET OF DOG STICKERS,1,7/6/2011 16:29,0.79,,United Kingdom
559162,84584,PINK GINGHAM CAT WITH SCARF,2,7/6/2011 16:29,1.63,,United Kingdom
559162,84596B,SMALL DOLLY MIX DESIGN ORANGE BOWL,1,7/6/2011 16:29,0.83,,United Kingdom
559162,84596F,SMALL MARSHMALLOWS PINK BOWL,1,7/6/2011 16:29,0.83,,United Kingdom
559162,84748,FOLK FELT HANGING MULTICOL GARLAND,2,7/6/2011 16:29,2.46,,United Kingdom
559162,84813,SET OF 4 DIAMOND NAPKIN RINGS,1,7/6/2011 16:29,5.79,,United Kingdom
559162,84828,JUNGLE POPSICLES ICE LOLLY MOULDS,1,7/6/2011 16:29,1.25,,United Kingdom
559162,84877B,GREEN ROUND COMPACT MIRROR,1,7/6/2011 16:29,2.46,,United Kingdom
559162,84912B,GREEN ROSE WASHBAG,1,7/6/2011 16:29,3.29,,United Kingdom
559162,84968C,SET OF 16 VINTAGE PISTACHIO CUTLERY,1,7/6/2011 16:29,24.96,,United Kingdom
559162,84969,BOX OF 6 ASSORTED COLOUR TEASPOONS,2,7/6/2011 16:29,3.29,,United Kingdom
559162,84978,HANGING HEART JAR T-LIGHT HOLDER,2,7/6/2011 16:29,2.46,,United Kingdom
559162,84991,60 TEATIME FAIRY CAKE CASES,1,7/6/2011 16:29,1.25,,United Kingdom
559162,85017B,ENVELOPE 50 BLOSSOM IMAGES,2,7/6/2011 16:29,0.83,,United Kingdom
559162,85053,FRENCH ENAMEL CANDLEHOLDER,1,7/6/2011 16:29,4.13,,United Kingdom
559162,85086A,CANDY SPOT HEART DECORATION,1,7/6/2011 16:29,0.83,,United Kingdom
559162,85099B,JUMBO BAG RED RETROSPOT,2,7/6/2011 16:29,4.13,,United Kingdom
559162,85099F,JUMBO BAG STRAWBERRY,1,7/6/2011 16:29,4.13,,United Kingdom
559162,85116,BLACK CANDELABRA T-LIGHT HOLDER,15,7/6/2011 16:29,1.63,,United Kingdom
559162,85131A,BEADED PEARL HEART WHITE ON STICK,10,7/6/2011 16:29,0.83,,United Kingdom
559162,85152,HAND OVER THE CHOCOLATE   SIGN ,1,7/6/2011 16:29,4.13,,United Kingdom
559162,85176,SEWING SUSAN 21 NEEDLE SET,2,7/6/2011 16:29,0.79,,United Kingdom
559162,85178,VICTORIAN SEWING KIT,2,7/6/2011 16:29,0.79,,United Kingdom
559162,85186C,BUNNY EGG GARLAND,1,7/6/2011 16:29,0.83,,United Kingdom
