555016,23152,IVORY SWEETHEART WIRE LETTER RACK ,2,5/31/2011 11:09,3.75,13113,United Kingdom
555016,22355,CHARLOTTE BAG SUKI DESIGN,10,5/31/2011 11:09,0.85,13113,United Kingdom
555017,22782,SET 3 WICKER STORAGE BASKETS ,1,5/31/2011 11:14,24.95,16801,United Kingdom
555017,21794,CLASSIC FRENCH STYLE BASKET NATURAL,6,5/31/2011 11:14,3.95,16801,United Kingdom
555017,22829,SWEETHEART WIRE WALL TIDY,3,5/31/2011 11:14,9.95,16801,United Kingdom
555017,82482,WOODEN PICTURE FRAME WHITE FINISH,4,5/31/2011 11:14,2.55,16801,United Kingdom
555017,22487,WHITE WOOD GARDEN PLANT LADDER,2,5/31/2011 11:14,9.95,16801,United Kingdom
555017,22173,METAL 4 HOOK HANGER FRENCH CHATEAU,2,5/31/2011 11:14,2.95,16801,United Kingdom
555017,22485,SET OF 2 WOODEN MARKET CRATES,3,5/31/2011 11:14,12.75,16801,United Kingdom
555017,84792,ENCHANTED BIRD COATHANGER 5 HOOK,2,5/31/2011 11:14,4.65,16801,United Kingdom
555017,21340,CLASSIC METAL BIRDCAGE PLANT HOLDER,4,5/31/2011 11:14,12.75,16801,United Kingdom
555025,23118,PARISIENNE JEWELLERY DRAWER ,2,5/31/2011 11:21,7.5,17648,United Kingdom
555025,85066,CREAM SWEETHEART MINI CHEST,2,5/31/2011 11:21,12.75,17648,United Kingdom
555025,23112,PARISIENNE CURIO CABINET,2,5/31/2011 11:21,7.5,17648,United Kingdom
555025,22607,WOODEN ROUNDERS GARDEN SET ,2,5/31/2011 11:21,9.95,17648,United Kingdom
555025,82484,WOOD BLACK BOARD ANT WHITE FINISH,4,5/31/2011 11:21,7.95,17648,United Kingdom
555025,22457,NATURAL SLATE HEART CHALKBOARD ,6,5/31/2011 11:21,2.95,17648,United Kingdom
555025,23298,SPOTTY BUNTING,3,5/31/2011 11:21,4.95,17648,United Kingdom
555025,21136,PAINTED METAL PEARS ASSORTED,8,5/31/2011 11:21,1.69,17648,United Kingdom
555025,21114,LAVENDER SCENTED FABRIC HEART,10,5/31/2011 11:21,1.25,17648,United Kingdom
555025,22727,ALARM CLOCK BAKELIKE RED ,4,5/31/2011 11:21,3.75,17648,United Kingdom
555025,22193,RED DINER WALL CLOCK,2,5/31/2011 11:21,8.5,17648,United Kingdom
555025,23254,CHILDRENS CUTLERY DOLLY GIRL ,4,5/31/2011 11:21,4.15,17648,United Kingdom
555025,23256,CHILDRENS CUTLERY SPACEBOY ,4,5/31/2011 11:21,4.15,17648,United Kingdom
555025,84375,SET OF 20 KIDS COOKIE CUTTERS,12,5/31/2011 11:21,2.1,17648,United Kingdom
555025,22624,IVORY KITCHEN SCALES,2,5/31/2011 11:21,8.5,17648,United Kingdom
555025,22978,PANTRY ROLLING PIN,6,5/31/2011 11:21,3.75,17648,United Kingdom
555025,22993,SET OF 4 PANTRY JELLY MOULDS,12,5/31/2011 11:21,1.25,17648,United Kingdom
555025,22840,ROUND CAKE TIN VINTAGE RED,2,5/31/2011 11:21,7.95,17648,United Kingdom
555025,21533,RETROSPOT LARGE MILK JUG,3,5/31/2011 11:21,4.95,17648,United Kingdom
555025,21843,RED RETROSPOT CAKE STAND,2,5/31/2011 11:21,10.95,17648,United Kingdom
555025,22221,CAKE STAND LOVEBIRD 2 TIER PINK,2,5/31/2011 11:21,9.95,17648,United Kingdom
555025,22070,SMALL RED RETROSPOT MUG IN BOX ,6,5/31/2011 11:21,3.75,17648,United Kingdom
555025,22180,RETROSPOT LAMP,1,5/31/2011 11:21,9.95,17648,United Kingdom
555025,22505,MEMO BOARD COTTAGE DESIGN,4,5/31/2011 11:21,4.95,17648,United Kingdom
555025,22507,MEMO BOARD RETROSPOT  DESIGN,4,5/31/2011 11:21,4.95,17648,United Kingdom
555025,22354,RETROSPOT PADDED SEAT CUSHION,5,5/31/2011 11:21,3.75,17648,United Kingdom
555028,23053,RECYCLED ACAPULCO MAT PINK,2,5/31/2011 11:22,8.25,17648,United Kingdom
555028,23050,RECYCLED ACAPULCO MAT GREEN,2,5/31/2011 11:22,8.25,17648,United Kingdom
555028,23052,RECYCLED ACAPULCO MAT TURQUOISE,2,5/31/2011 11:22,8.25,17648,United Kingdom
C555046,22859,EASTER TIN BUNNY BOUQUET,-6,5/31/2011 11:29,1.65,12431,Australia
C555054,21843,RED RETROSPOT CAKE STAND,-1,5/31/2011 11:32,10.95,14903,United Kingdom
C555054,22784,LANTERN CREAM GAZEBO ,-1,5/31/2011 11:32,4.95,14903,United Kingdom
C555054,84947,ANTIQUE SILVER TEA GLASS ENGRAVED,-2,5/31/2011 11:32,1.25,14903,United Kingdom
555070,21669,BLUE STRIPE CERAMIC DRAWER KNOB,1,5/31/2011 11:36,1.25,15863,United Kingdom
555070,22690,DOORMAT HOME SWEET HOME BLUE ,1,5/31/2011 11:36,7.95,15863,United Kingdom
555073,22173,METAL 4 HOOK HANGER FRENCH CHATEAU,1,5/31/2011 11:39,2.95,16470,United Kingdom
555073,22537,MAGIC DRAWING SLATE DINOSAUR,1,5/31/2011 11:39,0.42,16470,United Kingdom
555073,22211,WOOD STAMP SET FLOWERS,1,5/31/2011 11:39,1.65,16470,United Kingdom
555073,23083,SET 6 PAPER TABLE LANTERN STARS ,1,5/31/2011 11:39,3.75,16470,United Kingdom
555073,18007,ESSENTIAL BALM 3.5g TIN IN ENVELOPE,20,5/31/2011 11:39,0.18,16470,United Kingdom
555073,85178,VICTORIAN SEWING KIT,5,5/31/2011 11:39,1.25,16470,United Kingdom
555073,21787,RAIN PONCHO RETROSPOT,10,5/31/2011 11:39,0.85,16470,United Kingdom
555073,22652,TRAVEL SEWING KIT,5,5/31/2011 11:39,1.65,16470,United Kingdom
555073,22557,PLASTERS IN TIN VINTAGE PAISLEY ,8,5/31/2011 11:39,1.65,16470,United Kingdom
555073,22631,CIRCUS PARADE LUNCH BOX ,1,5/31/2011 11:39,1.95,16470,United Kingdom
555073,84659A,WHITE TRAVEL ALARM CLOCK,2,5/31/2011 11:39,2.55,16470,United Kingdom
555073,22563,HAPPY STENCIL CRAFT,1,5/31/2011 11:39,1.25,16470,United Kingdom
555073,20616,CHERRY BLOSSOM PASSPORT COVER,1,5/31/2011 11:39,2.1,16470,United Kingdom
555073,20667,CHERRY BLOSSOM PURSE,1,5/31/2011 11:39,2.95,16470,United Kingdom
555073,20665,RED RETROSPOT PURSE ,2,5/31/2011 11:39,2.95,16470,United Kingdom
555073,21559,STRAWBERRY LUNCH BOX WITH CUTLERY,2,5/31/2011 11:39,2.55,16470,United Kingdom
555073,22636,CHILDS BREAKFAST SET CIRCUS PARADE,1,5/31/2011 11:39,8.5,16470,United Kingdom
555073,22278,OVERNIGHT BAG VINTAGE ROSE PAISLEY,6,5/31/2011 11:39,4.95,16470,United Kingdom
555073,22061,LARGE CAKE STAND  HANGING STRAWBERY,1,5/31/2011 11:39,9.95,16470,United Kingdom
555073,23051,RECYCLED ACAPULCO MAT BLUE,1,5/31/2011 11:39,8.25,16470,United Kingdom
C555074,23175,REGENCY MILK JUG PINK ,-1,5/31/2011 11:44,3.25,16837,United Kingdom
555075,85123A,WHITE HANGING HEART T-LIGHT HOLDER,150,5/31/2011 12:05,2.55,16013,United Kingdom
555076,21136,PAINTED METAL PEARS ASSORTED,8,5/31/2011 12:11,1.69,13900,United Kingdom
555076,84879,ASSORTED COLOUR BIRD ORNAMENT,8,5/31/2011 12:11,1.69,13900,United Kingdom
555076,21755,LOVE BUILDING BLOCK WORD,3,5/31/2011 12:11,5.95,13900,United Kingdom
555076,21746,SMALL RED RETROSPOT WINDMILL,12,5/31/2011 12:11,1.25,13900,United Kingdom
555076,23209,LUNCH BAG DOILEY PATTERN ,10,5/31/2011 12:11,1.65,13900,United Kingdom
555076,21231,SWEETHEART CERAMIC TRINKET BOX,12,5/31/2011 12:11,1.25,13900,United Kingdom
555076,22637,PIGGY BANK RETROSPOT ,6,5/31/2011 12:11,2.55,13900,United Kingdom
555076,23298,SPOTTY BUNTING,3,5/31/2011 12:11,4.95,13900,United Kingdom
555076,22839,3 TIER CAKE TIN GREEN AND CREAM,1,5/31/2011 12:11,14.95,13900,United Kingdom
555076,22924,FRIDGE MAGNETS LA VIE EN ROSE,12,5/31/2011 12:11,0.85,13900,United Kingdom
