559337,84828,JUNGLE POPSICLES ICE LOLLY MOULDS,1,7/7/2011 16:27,1.25,,United Kingdom
559337,84919,BLUE CUSHION COVER WITH FLOWER,1,7/7/2011 16:27,5.79,,United Kingdom
559337,84951A,SET OF 4 PISTACHIO LOVEBIRD COASTER,1,7/7/2011 16:27,2.46,,United Kingdom
559337,84969,BOX OF 6 ASSORTED COLOUR TEASPOONS,1,7/7/2011 16:27,3.29,,United Kingdom
559337,84991,60 TEATIME FAIRY CAKE CASES,2,7/7/2011 16:27,1.25,,United Kingdom
559337,84992,72 SWEETHEART FAIRY CAKE CASES,1,7/7/2011 16:27,1.25,,United Kingdom
559337,85017B,ENVELOPE 50 BLOSSOM IMAGES,1,7/7/2011 16:27,0.83,,United Kingdom
559337,85039A,SET/4 RED MINI ROSE CANDLE IN BOWL,1,7/7/2011 16:27,1.63,,United Kingdom
559337,85039B,S/4 IVORY MINI ROSE CANDLE IN BOWL,1,7/7/2011 16:27,1.63,,United Kingdom
559337,85114C,RED ENCHANTED FOREST PLACEMAT,1,7/7/2011 16:27,3.29,,United Kingdom
559337,85123A,WHITE HANGING HEART T-LIGHT HOLDER,2,7/7/2011 16:27,5.79,,United Kingdom
559337,85131A,BEADED PEARL HEART WHITE ON STICK,2,7/7/2011 16:27,0.83,,United Kingdom
559337,85131B,BEADED CRYSTAL HEART GREEN ON STICK,4,7/7/2011 16:27,0.83,,United Kingdom
559337,85131D,BEADED CRYSTAL HEART PINK ON STICK,4,7/7/2011 16:27,0.83,,United Kingdom
559337,85132C,CHARLIE AND LOLA FIGURES TINS,2,7/7/2011 16:27,5.79,,United Kingdom
559337,85176,SEWING SUSAN 21 NEEDLE SET,5,7/7/2011 16:27,0.79,,United Kingdom
559337,85208,SET/12 FUNKY FELT FLOWER PEG IN BAG,2,7/7/2011 16:27,1.63,,United Kingdom
559337,90175A,WHITE GLASS CHUNKY CHARM BRACELET,1,7/7/2011 16:27,9.15,,United Kingdom
559337,90206C,CRYSTAL DIAMANTE STAR BROOCH,1,7/7/2011 16:27,4.98,,United Kingdom
559337,90214D,"LETTER ""D"" BLING KEY RING",1,7/7/2011 16:27,0.83,,United Kingdom
559337,90214N,"LETTER ""N"" BLING KEY RING",1,7/7/2011 16:27,0.83,,United Kingdom
559337,DOT,DOTCOM POSTAGE,1,7/7/2011 16:27,298.31,,United Kingdom
559338,10133,COLOURING PENCILS BROWN TUBE,1,7/7/2011 16:30,0.83,,United Kingdom
559338,11001,ASSTD DESIGN RACING CAR PEN,9,7/7/2011 16:30,0.83,,United Kingdom
559338,15036,ASSORTED COLOURS SILK FAN,3,7/7/2011 16:30,1.63,,United Kingdom
559338,22173,METAL 4 HOOK HANGER FRENCH CHATEAU,1,7/7/2011 16:30,5.79,,United Kingdom
559338,22199,FRYING PAN RED RETROSPOT,2,7/7/2011 16:30,4.13,,United Kingdom
559338,22204,MILK PAN BLUE POLKADOT,1,7/7/2011 16:30,3.29,,United Kingdom
559338,22208,WOOD STAMP SET THANK YOU,3,7/7/2011 16:30,0.83,,United Kingdom
559338,22209,WOOD STAMP SET HAPPY BIRTHDAY,2,7/7/2011 16:30,0.83,,United Kingdom
559338,22210,WOOD STAMP SET BEST WISHES,3,7/7/2011 16:30,0.83,,United Kingdom
559338,22211,WOOD STAMP SET FLOWERS,2,7/7/2011 16:30,0.83,,United Kingdom
559338,22219,LOVEBIRD HANGING DECORATION WHITE ,2,7/7/2011 16:30,1.63,,United Kingdom
559338,22228,BUNNY WOODEN PAINTED WITH BIRD ,3,7/7/2011 16:30,0.83,,United Kingdom
559338,22229,BUNNY WOODEN PAINTED WITH FLOWER ,1,7/7/2011 16:30,0.83,,United Kingdom
559338,22230,JIGSAW TREE WITH WATERING CAN,1,7/7/2011 16:30,0.83,,United Kingdom
559338,22231,JIGSAW TREE WITH BIRDHOUSE,1,7/7/2011 16:30,1.25,,United Kingdom
559338,22232,JIGSAW TOADSTOOLS 3 PIECE,2,7/7/2011 16:30,1.25,,United Kingdom
559338,22244,3 HOOK HANGER MAGIC GARDEN,2,7/7/2011 16:30,4.13,,United Kingdom
559338,22246,MAGIC GARDEN FELT GARLAND ,1,7/7/2011 16:30,1.63,,United Kingdom
559338,22248,DECORATION  PINK CHICK MAGIC GARDEN,6,7/7/2011 16:30,0.83,,United Kingdom
559338,22249,DECORATION WHITE CHICK MAGIC GARDEN,2,7/7/2011 16:30,0.83,,United Kingdom
559338,22250,DECORATION  BUTTERFLY  MAGIC GARDEN,10,7/7/2011 16:30,0.83,,United Kingdom
559338,22251,BIRDHOUSE DECORATION MAGIC GARDEN,8,7/7/2011 16:30,0.83,,United Kingdom
559338,22263,FELT EGG COSY LADYBIRD ,1,7/7/2011 16:30,1.63,,United Kingdom
559338,22277,COSMETIC BAG VINTAGE ROSE PAISLEY,2,7/7/2011 16:30,1.63,,United Kingdom
559338,22278,OVERNIGHT BAG VINTAGE ROSE PAISLEY,4,7/7/2011 16:30,4.13,,United Kingdom
559338,22279,POCKET BAG BLUE PAISLEY RED SPOT,4,7/7/2011 16:30,0.83,,United Kingdom
559338,22280,POCKET BAG PINK PAISELY BROWN SPOT,2,7/7/2011 16:30,0.83,,United Kingdom
559338,22287,DECORATION WOBBLY CHICKEN,1,7/7/2011 16:30,1.25,,United Kingdom
559338,22291,HANGING CHICK CREAM DECORATION,2,7/7/2011 16:30,1.25,,United Kingdom
559338,22292,HANGING CHICK  YELLOW DECORATION,3,7/7/2011 16:30,1.25,,United Kingdom
559338,22293,HANGING CHICK GREEN DECORATION,3,7/7/2011 16:30,1.25,,United Kingdom
559338,22305,COFFEE MUG PINK PAISLEY DESIGN,1,7/7/2011 16:30,4.96,,United Kingdom
559338,22315,200 RED + WHITE BENDY STRAWS,2,7/7/2011 16:30,1.25,,United Kingdom
559338,22318,FIVE HEART HANGING DECORATION,1,7/7/2011 16:30,5.79,,United Kingdom
559338,22322,BIRD DECORATION GREEN POLKADOT,2,7/7/2011 16:30,0.83,,United Kingdom
559338,22335,HEART DECORATION PAINTED ZINC ,3,7/7/2011 16:30,1.25,,United Kingdom
559338,22337,ANGEL DECORATION PAINTED ZINC ,15,7/7/2011 16:30,1.25,,United Kingdom
559338,22342,HOME GARLAND PAINTED ZINC ,1,7/7/2011 16:30,1.63,,United Kingdom
559338,22355,CHARLOTTE BAG SUKI DESIGN,2,7/7/2011 16:30,1.63,,United Kingdom
559338,22356,CHARLOTTE BAG PINK POLKADOT,1,7/7/2011 16:30,1.63,,United Kingdom
559338,22358,KINGS CHOICE TEA CADDY ,1,7/7/2011 16:30,2.46,,United Kingdom
559338,22361,GLASS JAR DAISY FRESH COTTON WOOL,1,7/7/2011 16:30,5.79,,United Kingdom
559338,22371,AIRLINE BAG VINTAGE TOKYO 78,5,7/7/2011 16:30,4.13,,United Kingdom
559338,22372,AIRLINE BAG VINTAGE WORLD CHAMPION ,1,7/7/2011 16:30,4.13,,United Kingdom
559338,22375,AIRLINE BAG VINTAGE JET SET BROWN,1,7/7/2011 16:30,4.13,,United Kingdom
559338,22377,BOTTLE BAG RETROSPOT ,2,7/7/2011 16:30,1.63,,United Kingdom
559338,22378,WALL TIDY RETROSPOT ,10,7/7/2011 16:30,1.63,,United Kingdom
559338,22382,LUNCH BAG SPACEBOY DESIGN ,1,7/7/2011 16:30,4.13,,United Kingdom
559338,22383,LUNCH BAG SUKI DESIGN ,3,7/7/2011 16:30,4.13,,United Kingdom
559338,22384,LUNCH BAG PINK POLKADOT,1,7/7/2011 16:30,4.13,,United Kingdom
559338,22411,JUMBO SHOPPER VINTAGE RED PAISLEY,1,7/7/2011 16:30,4.13,,United Kingdom
559338,22435,SET OF 9 HEART SHAPED BALLOONS,1,7/7/2011 16:30,2.46,,United Kingdom
559338,22456,NATURAL SLATE CHALKBOARD LARGE ,1,7/7/2011 16:30,9.96,,United Kingdom
559338,22464,HANGING METAL HEART LANTERN,6,7/7/2011 16:30,3.29,,United Kingdom
559338,22469,HEART OF WICKER SMALL,2,7/7/2011 16:30,3.29,,United Kingdom
559338,22489,PACK OF 12 TRADITIONAL CRAYONS,1,7/7/2011 16:30,0.83,,United Kingdom
559338,22494,EMERGENCY FIRST AID TIN ,2,7/7/2011 16:30,2.46,,United Kingdom
559338,22498,WOODEN REGATTA BUNTING,1,7/7/2011 16:30,4.96,,United Kingdom
559338,22503,CABIN BAG VINTAGE PAISLEY,1,7/7/2011 16:30,16.63,,United Kingdom
559338,22504,CABIN BAG VINTAGE RETROSPOT,1,7/7/2011 16:30,16.63,,United Kingdom
559338,22514,CHILDS GARDEN SPADE BLUE,1,7/7/2011 16:30,4.13,,United Kingdom
559338,22516,CHILDS GARDEN RAKE BLUE,1,7/7/2011 16:30,4.13,,United Kingdom
559338,22517,CHILDS GARDEN RAKE PINK,1,7/7/2011 16:30,4.13,,United Kingdom
559338,22547,MINI JIGSAW DINOSAUR ,1,7/7/2011 16:30,0.83,,United Kingdom
559338,22559,SEASIDE FLYING DISC,1,7/7/2011 16:30,0.83,,United Kingdom
559338,22568,FELTCRAFT CUSHION OWL,1,7/7/2011 16:30,7.46,,United Kingdom
559338,22609,PENS ASSORTED SPACEBALL,7,7/7/2011 16:30,0.42,,United Kingdom
559338,22610,PENS ASSORTED FUNNY FACE,9,7/7/2011 16:30,0.42,,United Kingdom
559338,22613,PACK OF 20 SPACEBOY NAPKINS,2,7/7/2011 16:30,1.63,,United Kingdom
559338,22616,PACK OF 12 LONDON TISSUES ,1,7/7/2011 16:30,0.83,,United Kingdom
559338,22624,IVORY KITCHEN SCALES,1,7/7/2011 16:30,16.63,,United Kingdom
559338,22630,DOLLY GIRL LUNCH BOX,1,7/7/2011 16:30,4.13,,United Kingdom
559338,22637,PIGGY BANK RETROSPOT ,1,7/7/2011 16:30,4.96,,United Kingdom
559338,22651,GENTLEMAN SHIRT REPAIR KIT ,1,7/7/2011 16:30,0.79,,United Kingdom
559338,22653,BUTTON BOX ,4,7/7/2011 16:30,1.63,,United Kingdom
559338,22663,JUMBO BAG DOLLY GIRL DESIGN,5,7/7/2011 16:30,2.46,,United Kingdom
559338,22681,FRENCH BLUE METAL DOOR SIGN 6,2,7/7/2011 16:30,2.46,,United Kingdom
559338,22682,FRENCH BLUE METAL DOOR SIGN 7,1,7/7/2011 16:30,2.46,,United Kingdom
559338,22683,FRENCH BLUE METAL DOOR SIGN 8,2,7/7/2011 16:30,2.46,,United Kingdom
559338,22703,PINK CAT BOWL,2,7/7/2011 16:30,1.63,,United Kingdom
559338,22713,CARD I LOVE LONDON ,5,7/7/2011 16:30,0.83,,United Kingdom
559338,22718,CARD CAT AND TREE ,1,7/7/2011 16:30,0.83,,United Kingdom
559338,22720,SET OF 3 CAKE TINS PANTRY DESIGN ,1,7/7/2011 16:30,10.79,,United Kingdom
559338,22721,SET OF 3 CAKE TINS SKETCHBOOK,1,7/7/2011 16:30,4.13,,United Kingdom
559338,22723,SET OF 6 HERB TINS SKETCHBOOK,2,7/7/2011 16:30,3.29,,United Kingdom
559338,22726,ALARM CLOCK BAKELIKE GREEN,1,7/7/2011 16:30,7.46,,United Kingdom
559338,22728,ALARM CLOCK BAKELIKE PINK,2,7/7/2011 16:30,7.46,,United Kingdom
559338,22740,POLKADOT PEN,1,7/7/2011 16:30,1.63,,United Kingdom
559338,22743,MAKE YOUR OWN FLOWERPOWER CARD KIT,1,7/7/2011 16:30,5.79,,United Kingdom
559338,22748,POPPY'S PLAYHOUSE KITCHEN,1,7/7/2011 16:30,4.13,,United Kingdom
559338,22757,LARGE RED BABUSHKA NOTEBOOK ,1,7/7/2011 16:30,2.46,,United Kingdom
559338,22759,SET OF 3 NOTEBOOKS IN PARCEL,1,7/7/2011 16:30,3.29,,United Kingdom
559338,22763,KEY CABINET MA CAMPAGNE,1,7/7/2011 16:30,19.96,,United Kingdom
559338,22771,CLEAR DRAWER KNOB ACRYLIC EDWARDIAN,1,7/7/2011 16:30,2.46,,United Kingdom
559338,22778,GLASS CLOCHE SMALL,2,7/7/2011 16:30,8.29,,United Kingdom
559338,22785,SQUARECUSHION COVER PINK UNION JACK,1,7/7/2011 16:30,7.46,,United Kingdom
559338,22792,FLUTED ANTIQUE CANDLE HOLDER,1,7/7/2011 16:30,1.63,,United Kingdom
559338,22798,ANTIQUE GLASS DRESSING TABLE POT,2,7/7/2011 16:30,5.79,,United Kingdom
559338,22800,ANTIQUE TALL SWIRLGLASS TRINKET POT,1,7/7/2011 16:30,7.46,,United Kingdom
559338,22805,BLUE DRAWER KNOB ACRYLIC EDWARDIAN,6,7/7/2011 16:30,2.46,,United Kingdom
559338,22807,SET OF 6 T-LIGHTS TOADSTOOLS,4,7/7/2011 16:30,2.46,,United Kingdom
559338,22813,PACK 3 BOXES BIRD PANNETONE ,1,7/7/2011 16:30,4.13,,United Kingdom
559338,22814,CARD PARTY GAMES ,10,7/7/2011 16:30,0.42,,United Kingdom
559338,22815,CARD PSYCHEDELIC APPLES,8,7/7/2011 16:30,0.42,,United Kingdom
559338,22817,CARD SUKI BIRTHDAY,11,7/7/2011 16:30,0.42,,United Kingdom
559338,22819,"BIRTHDAY CARD, RETRO SPOT",16,7/7/2011 16:30,0.42,,United Kingdom
559338,22820,GIFT BAG BIRTHDAY,1,7/7/2011 16:30,0.42,,United Kingdom
559338,22821,GIFT BAG PSYCHEDELIC APPLES,7,7/7/2011 16:30,0.42,,United Kingdom
559338,22835,HOT WATER BOTTLE I AM SO POORLY,1,7/7/2011 16:30,9.13,,United Kingdom
559338,22869,NUMBER TILE COTTAGE GARDEN 1,1,7/7/2011 16:30,4.13,,United Kingdom
559338,22870,NUMBER TILE COTTAGE GARDEN 2,1,7/7/2011 16:30,4.13,,United Kingdom
559338,22907,PACK OF 20 NAPKINS PANTRY DESIGN,1,7/7/2011 16:30,1.63,,United Kingdom
559338,22909,SET OF 20 VINTAGE CHRISTMAS NAPKINS,1,7/7/2011 16:30,1.63,,United Kingdom
559338,22953,BIRTHDAY PARTY CORDON BARRIER TAPE,1,7/7/2011 16:30,0.83,,United Kingdom
559338,22962,JAM JAR WITH PINK LID,1,7/7/2011 16:30,1.63,,United Kingdom
559338,22963,JAM JAR WITH GREEN LID,1,7/7/2011 16:30,1.63,,United Kingdom
559338,22966,GINGERBREAD MAN COOKIE CUTTER,1,7/7/2011 16:30,2.46,,United Kingdom
559338,22982,PANTRY PASTRY BRUSH,1,7/7/2011 16:30,2.46,,United Kingdom
559338,23000,TRAVEL CARD WALLET TRANSPORT,1,7/7/2011 16:30,0.83,,United Kingdom
559338,23028,DRAWER KNOB CRACKLE GLAZE BLUE,4,7/7/2011 16:30,3.29,,United Kingdom
559338,23051,RECYCLED ACAPULCO MAT BLUE,1,7/7/2011 16:30,16.63,,United Kingdom
559338,23084,RABBIT NIGHT LIGHT,2,7/7/2011 16:30,4.13,,United Kingdom
559338,23096,PETIT TRAY CHIC,1,7/7/2011 16:30,3.29,,United Kingdom
559338,23112,PARISIENNE CURIO CABINET,3,7/7/2011 16:30,14.96,,United Kingdom
559338,23118,PARISIENNE JEWELLERY DRAWER ,1,7/7/2011 16:30,14.96,,United Kingdom
559338,23120,PACK OF 6 SMALL FRUIT STRAWS,6,7/7/2011 16:30,0.79,,United Kingdom
559338,23136,IVORY WIRE SWEETHEART LETTER TRAY,1,7/7/2011 16:30,7.46,,United Kingdom
559338,23140,TRIPLE WIRE HOOK IVORY HEART,1,7/7/2011 16:30,4.13,,United Kingdom
559338,23144,ZINC T-LIGHT HOLDER STARS SMALL,2,7/7/2011 16:30,1.63,,United Kingdom
559338,23145,ZINC T-LIGHT HOLDER STAR LARGE,2,7/7/2011 16:30,2.08,,United Kingdom
559338,23168,CLASSIC CAFE SUGAR DISPENSER,1,7/7/2011 16:30,2.46,,United Kingdom
559338,23170,REGENCY TEA PLATE ROSES ,2,7/7/2011 16:30,3.29,,United Kingdom
559338,23171,REGENCY TEA PLATE GREEN ,2,7/7/2011 16:30,3.29,,United Kingdom
559338,23172,REGENCY TEA PLATE PINK,2,7/7/2011 16:30,3.29,,United Kingdom
559338,23176,ABC TREASURE BOOK BOX ,2,7/7/2011 16:30,4.58,,United Kingdom
559338,23188,VINTAGE  2 METER FOLDING RULER,4,7/7/2011 16:30,3.29,,United Kingdom
559338,23190,BUNDLE OF 3 SCHOOL EXERCISE BOOKS  ,1,7/7/2011 16:30,3.29,,United Kingdom
559338,23193,BUFFALO BILL TREASURE BOOK BOX,1,7/7/2011 16:30,4.58,,United Kingdom
559338,23196,VINTAGE LEAF MAGNETIC NOTEPAD,3,7/7/2011 16:30,3.29,,United Kingdom
559338,23199,JUMBO BAG APPLES,1,7/7/2011 16:30,4.13,,United Kingdom
559338,23205,CHARLOTTE BAG VINTAGE ALPHABET ,2,7/7/2011 16:30,1.63,,United Kingdom
559338,23206,LUNCH BAG APPLE DESIGN,1,7/7/2011 16:30,4.13,,United Kingdom
559338,23207,LUNCH BAG ALPHABET DESIGN,2,7/7/2011 16:30,4.13,,United Kingdom
559338,23253,16 PIECE CUTLERY SET PANTRY DESIGN,1,7/7/2011 16:30,14.13,,United Kingdom
559338,23271,CHRISTMAS TABLE SILVER CANDLE SPIKE,3,7/7/2011 16:30,1.63,,United Kingdom
559338,23283,DOORMAT VINTAGE LEAF,1,7/7/2011 16:30,15.79,,United Kingdom
559338,23286,BLUE VINTAGE SPOT BEAKER,2,7/7/2011 16:30,1.63,,United Kingdom
559338,23287,RED VINTAGE SPOT BEAKER,2,7/7/2011 16:30,1.63,,United Kingdom
559338,23288,GREEN VINTAGE SPOT BEAKER,2,7/7/2011 16:30,1.63,,United Kingdom
559338,23290,SPACEBOY CHILDRENS BOWL,1,7/7/2011 16:30,2.46,,United Kingdom
559338,23292,SPACEBOY CHILDRENS CUP,1,7/7/2011 16:30,2.46,,United Kingdom
559338,23298,SPOTTY BUNTING,7,7/7/2011 16:30,10.79,,United Kingdom
559338,23308,SET OF 60 VINTAGE LEAF CAKE CASES ,1,7/7/2011 16:30,1.25,,United Kingdom
559338,23309,SET OF 60 I LOVE LONDON CAKE CASES ,2,7/7/2011 16:30,1.25,,United Kingdom
559338,23318,BOX OF 6 MINI VINTAGE CRACKERS,1,7/7/2011 16:30,4.96,,United Kingdom
559338,35004B,SET OF 3 BLACK FLYING DUCKS,1,7/7/2011 16:30,5.79,,United Kingdom
559338,35653,VINTAGE BEAD NOTEBOOK,13,7/7/2011 16:30,2.46,,United Kingdom
559338,35916A,YELLOW FELT HANGING HEART W FLOWER,1,7/7/2011 16:30,0.63,,United Kingdom
559338,35923,CANDY HEART HANGING DECORATION,2,7/7/2011 16:30,0.83,,United Kingdom
559338,35924,HANGING FAIRY CAKE DECORATION,1,7/7/2011 16:30,1.63,,United Kingdom
559338,37342,POLKADOT COFFEE CUP & SAUCER PINK,1,7/7/2011 16:30,2.46,,United Kingdom
559338,37479P,CUBIC MUG FLOCK PINK ON BROWN,6,7/7/2011 16:30,0.97,,United Kingdom
559338,44234,ASSORTED CIRCULAR MOBILE,2,7/7/2011 16:30,0.63,,United Kingdom
559338,46776B,WOVEN BERRIES CUSHION COVER ,1,7/7/2011 16:30,4.13,,United Kingdom
559338,46776C,WOVEN FROST CUSHION COVER,1,7/7/2011 16:30,4.13,,United Kingdom
559338,46776F,WOVEN ROSE GARDEN CUSHION COVER ,1,7/7/2011 16:30,4.13,,United Kingdom
559338,47566,PARTY BUNTING,2,7/7/2011 16:30,10.79,,United Kingdom
559338,47574A,ENGLISH ROSE SCENTED HANGING FLOWER,2,7/7/2011 16:30,2.46,,United Kingdom
559338,47578A,ENGLISH ROSE SMALL SCENTED FLOWER,1,7/7/2011 16:30,1.63,,United Kingdom
559338,47585A,PINK FAIRY CAKE CUSHION COVER,3,7/7/2011 16:30,4.13,,United Kingdom
559338,47590B,PINK HAPPY BIRTHDAY BUNTING,1,7/7/2011 16:30,10.79,,United Kingdom
559338,47593B,SCOTTIE DOGS BABY BIB,2,7/7/2011 16:30,0.83,,United Kingdom
559338,51014A,"FEATHER PEN,HOT PINK",1,7/7/2011 16:30,0.83,,United Kingdom
559338,71477,COLOUR GLASS. STAR T-LIGHT HOLDER,1,7/7/2011 16:30,6.63,,United Kingdom
559338,82567,"AIRLINE LOUNGE,METAL SIGN",2,7/7/2011 16:30,1.63,,United Kingdom
559338,84032A,CHARLIE+LOLA PINK HOT WATER BOTTLE,1,7/7/2011 16:30,3.29,,United Kingdom
559338,84077,WORLD WAR 2 GLIDERS ASSTD DESIGNS,43,7/7/2011 16:30,0.63,,United Kingdom
559338,84078A,SET/4 WHITE RETRO STORAGE CUBES ,1,7/7/2011 16:30,58.29,,United Kingdom
559338,84251B,"GREETING CARD, STICKY GORDON",1,7/7/2011 16:30,0.42,,United Kingdom
559338,84251G,"GREETING CARD, OVERCROWDED POOL.",1,7/7/2011 16:30,0.42,,United Kingdom
559338,84341B,SMALL PINK MAGIC CHRISTMAS TREE,2,7/7/2011 16:30,1.63,,United Kingdom
559338,84509A,SET OF 4 ENGLISH ROSE PLACEMATS,5,7/7/2011 16:30,3.29,,United Kingdom
559338,84509B,SET OF 4 FAIRY CAKE PLACEMATS,1,7/7/2011 16:30,3.29,,United Kingdom
559338,84509C,SET OF 4 POLKADOT PLACEMATS ,1,7/7/2011 16:30,3.29,,United Kingdom
559338,84510A,SET OF 4 ENGLISH ROSE COASTERS,1,7/7/2011 16:30,2.46,,United Kingdom
559338,84522,PINK PARTY SUNGLASSES,1,7/7/2011 16:30,1.63,,United Kingdom
559338,84536A,ENGLISH ROSE NOTEBOOK A7 SIZE,2,7/7/2011 16:30,0.42,,United Kingdom
559338,84568,GIRLS ALPHABET IRON ON PATCHES ,1,7/7/2011 16:30,0.42,,United Kingdom
559338,84569A,PACK 3 IRON ON DOG PATCHES,1,7/7/2011 16:30,0.83,,United Kingdom
559338,84569D,PACK 6 HEART/ICE-CREAM PATCHES,3,7/7/2011 16:30,0.83,,United Kingdom
559338,84584,PINK GINGHAM CAT WITH SCARF,5,7/7/2011 16:30,1.63,,United Kingdom
559338,84596B,SMALL DOLLY MIX DESIGN ORANGE BOWL,3,7/7/2011 16:30,0.83,,United Kingdom
559338,84596F,SMALL MARSHMALLOWS PINK BOWL,2,7/7/2011 16:30,0.83,,United Kingdom
559338,84596L,BISCUITS SMALL BOWL LIGHT BLUE,2,7/7/2011 16:30,0.83,,United Kingdom
559338,84598,BOYS ALPHABET IRON ON PATCHES,1,7/7/2011 16:30,0.42,,United Kingdom
559338,84637,KITCHEN FLOWER POTS WALL PLAQUE,2,7/7/2011 16:30,4.96,,United Kingdom
559338,84659A,WHITE TRAVEL ALARM CLOCK,1,7/7/2011 16:30,2.46,,United Kingdom
559338,84692,BOX OF 24 COCKTAIL PARASOLS,2,7/7/2011 16:30,0.83,,United Kingdom
559338,84796B,BLUE SAVANNAH PICNIC HAMPER FOR 2,1,7/7/2011 16:30,8.29,,United Kingdom
559338,84828,JUNGLE POPSICLES ICE LOLLY MOULDS,2,7/7/2011 16:30,1.25,,United Kingdom
559338,84876B,GREEN HEART COMPACT MIRROR,1,7/7/2011 16:30,2.46,,United Kingdom
559338,84907,PINK YELLOW PATCH CUSHION COVER,1,7/7/2011 16:30,5.79,,United Kingdom
559338,84910A,PINK PAISLEY CUSHION COVER ,2,7/7/2011 16:30,8.29,,United Kingdom
559338,84912A,PINK ROSE WASHBAG,4,7/7/2011 16:30,3.29,,United Kingdom
559338,84913A,SOFT PINK ROSE TOWEL ,1,7/7/2011 16:30,3.29,,United Kingdom
559338,84946,ANTIQUE SILVER T-LIGHT GLASS,1,7/7/2011 16:30,2.46,,United Kingdom
559338,84951A,SET OF 4 PISTACHIO LOVEBIRD COASTER,1,7/7/2011 16:30,2.46,,United Kingdom
559338,84968A,SET OF 16 VINTAGE ROSE CUTLERY,1,7/7/2011 16:30,24.96,,United Kingdom
559338,84968C,SET OF 16 VINTAGE PISTACHIO CUTLERY,1,7/7/2011 16:30,24.96,,United Kingdom
559338,84969,BOX OF 6 ASSORTED COLOUR TEASPOONS,5,7/7/2011 16:30,3.29,,United Kingdom
559338,84970L,SINGLE HEART ZINC T-LIGHT HOLDER,3,7/7/2011 16:30,2.08,,United Kingdom
559338,84970S,HANGING HEART ZINC T-LIGHT HOLDER,2,7/7/2011 16:30,2.08,,United Kingdom
559338,84978,HANGING HEART JAR T-LIGHT HOLDER,1,7/7/2011 16:30,2.46,,United Kingdom
559338,85025B,EAU DE NILE HEART SHAPE PHOTO FRAME,1,7/7/2011 16:30,3.29,,United Kingdom
559338,85025C,PINK HEART SHAPE PHOTO FRAME,1,7/7/2011 16:30,3.29,,United Kingdom
559338,85039A,SET/4 RED MINI ROSE CANDLE IN BOWL,1,7/7/2011 16:30,1.63,,United Kingdom
559338,85086A,CANDY SPOT HEART DECORATION,1,7/7/2011 16:30,0.83,,United Kingdom
559338,85087,CANDY SPOT CUSHION COVER,2,7/7/2011 16:30,3.29,,United Kingdom
559338,85099B,JUMBO BAG RED RETROSPOT,4,7/7/2011 16:30,4.13,,United Kingdom
559338,85099C,JUMBO  BAG BAROQUE BLACK WHITE,3,7/7/2011 16:30,4.13,,United Kingdom
559338,85129B,BEADED CRYSTAL HEART GREEN SMALL,1,7/7/2011 16:30,2.46,,United Kingdom
559338,85130B,BEADED CRYSTAL HEART GREEN LARGE,1,7/7/2011 16:30,3.29,,United Kingdom
559338,85131A,BEADED PEARL HEART WHITE ON STICK,3,7/7/2011 16:30,0.83,,United Kingdom
559338,85131D,BEADED CRYSTAL HEART PINK ON STICK,2,7/7/2011 16:30,0.83,,United Kingdom
559338,85132C,CHARLIE AND LOLA FIGURES TINS,1,7/7/2011 16:30,5.79,,United Kingdom
559338,85170B,SET/6 BLACK BIRD T-LIGHT CANDLES,1,7/7/2011 16:30,2.46,,United Kingdom
559338,85170C,SET/6 EAU DE NIL BIRD T-LIGHTS,1,7/7/2011 16:30,2.46,,United Kingdom
559338,85170D,SET/6 PINK BIRD T-LIGHT CANDLES,1,7/7/2011 16:30,2.46,,United Kingdom
559338,85176,SEWING SUSAN 21 NEEDLE SET,3,7/7/2011 16:30,0.79,,United Kingdom
559338,85177,BASKET OF FLOWERS SEWING KIT,2,7/7/2011 16:30,0.79,,United Kingdom
559338,85178,VICTORIAN SEWING KIT,8,7/7/2011 16:30,0.79,,United Kingdom
559338,85194S,HANGING SPRING FLOWER EGG SMALL,1,7/7/2011 16:30,0.63,,United Kingdom
559338,85227,SET OF 6 3D KIT CARDS FOR KIDS,1,7/7/2011 16:30,1.63,,United Kingdom
559338,90082A,DIAMANTE BOW BROOCH GREEN COLOUR,1,7/7/2011 16:30,6.65,,United Kingdom
559338,90122A,PINK CRYSTAL+GLASS BRACELET,1,7/7/2011 16:30,4.98,,United Kingdom
559338,90200E,GREEN SWEETHEART BRACELET,1,7/7/2011 16:30,4.15,,United Kingdom
559338,DOT,DOTCOM POSTAGE,1,7/7/2011 16:30,296.61,,United Kingdom
559338,85123A,WHITE HANGING HEART T-LIGHT HOLDER,5,7/7/2011 16:30,2.95,,United Kingdom
559338,15058A,BLUE POLKADOT GARDEN PARASOL,1,7/7/2011 16:30,10.79,,United Kingdom
559338,15058B,PINK POLKADOT GARDEN PARASOL,1,7/7/2011 16:30,10.79,,United Kingdom
559338,15058C,ICE CREAM DESIGN GARDEN PARASOL,1,7/7/2011 16:30,10.79,,United Kingdom
559338,16207B,PINK HEART RED HANDBAG,1,7/7/2011 16:30,2.46,,United Kingdom
559338,16219,HOUSE SHAPE PENCIL SHARPENER,2,7/7/2011 16:30,0.83,,United Kingdom
559338,17012F,ORIGAMI SANDLEWOOD INCENSE/CAND SET,1,7/7/2011 16:30,2.46,,United Kingdom
559338,20654,FIRST CLASS LUGGAGE TAG ,1,7/7/2011 16:30,0.83,,United Kingdom
559338,20666,ECONOMY HOLIDAY PURSE,2,7/7/2011 16:30,0.83,,United Kingdom
559338,20669,RED HEART LUGGAGE TAG,6,7/7/2011 16:30,0.83,,United Kingdom
559338,20707,CRAZY DAISY HEART DECORATION,14,7/7/2011 16:30,0.83,,United Kingdom
559338,20768,GREEN FERN JOURNAL ,1,7/7/2011 16:30,2.46,,United Kingdom
559338,20772,GARDEN PATH JOURNAL,1,7/7/2011 16:30,2.46,,United Kingdom
559338,20902,VINTAGE KEEPSAKE BOX PARIS DAYS,1,7/7/2011 16:30,4.13,,United Kingdom
559338,20963,APPLE BATH SPONGE,1,7/7/2011 16:30,2.46,,United Kingdom
559338,20971,PINK BLUE FELT CRAFT TRINKET BOX,1,7/7/2011 16:30,2.46,,United Kingdom
559338,20972,PINK CREAM FELT CRAFT TRINKET BOX ,1,7/7/2011 16:30,2.46,,United Kingdom
559338,20979,36 PENCILS TUBE RED RETROSPOT,12,7/7/2011 16:30,2.46,,United Kingdom
559338,20986,BLUE CALCULATOR RULER,1,7/7/2011 16:30,0.83,,United Kingdom
559338,20992,JAZZ HEARTS PURSE NOTEBOOK,2,7/7/2011 16:30,0.83,,United Kingdom
559338,20996,JAZZ HEARTS ADDRESS BOOK,1,7/7/2011 16:30,0.42,,United Kingdom
559338,20997,ROSE DU SUD CUSHION COVER ,1,7/7/2011 16:30,4.13,,United Kingdom
559338,21012,ANTIQUE ALL GLASS CANDLESTICK,2,7/7/2011 16:30,2.46,,United Kingdom
559338,21033,JUMBO BAG CHARLIE AND LOLA TOYS,14,7/7/2011 16:30,2.46,,United Kingdom
559338,21061,PARTY INVITES FOOTBALL,3,7/7/2011 16:30,0.83,,United Kingdom
559338,21062,PARTY INVITES SPACEMAN,1,7/7/2011 16:30,0.83,,United Kingdom
559338,21084,SET/6 COLLAGE PAPER CUPS,1,7/7/2011 16:30,0.83,,United Kingdom
559338,21090,SET/6 COLLAGE PAPER PLATES,2,7/7/2011 16:30,0.83,,United Kingdom
559338,21132,SILVER STANDING GNOME   ,1,7/7/2011 16:30,8.29,,United Kingdom
559338,21135,VICTORIAN  METAL POSTCARD SPRING,8,7/7/2011 16:30,1.04,,United Kingdom
559338,21136,PAINTED METAL PEARS ASSORTED,8,7/7/2011 16:30,1.04,,United Kingdom
559338,21172,PARTY METAL SIGN ,1,7/7/2011 16:30,4.13,,United Kingdom
559338,21175,GIN + TONIC DIET METAL SIGN,1,7/7/2011 16:30,4.96,,United Kingdom
559338,21194,PINK  HONEYCOMB PAPER FAN,2,7/7/2011 16:30,4.13,,United Kingdom
559338,21198,WHITE HEART CONFETTI IN TUBE,2,7/7/2011 16:30,0.83,,United Kingdom
559338,21199,PINK  HEART CONFETTI IN TUBE,2,7/7/2011 16:30,0.83,,United Kingdom
559338,21204,DAISIES  HONEYCOMB GARLAND ,1,7/7/2011 16:30,1.63,,United Kingdom
559338,21208,PASTEL COLOUR HONEYCOMB FAN,2,7/7/2011 16:30,3.29,,United Kingdom
559338,21209,MULTICOLOUR HONEYCOMB FAN,2,7/7/2011 16:30,3.29,,United Kingdom
559338,21238,RED RETROSPOT CUP,2,7/7/2011 16:30,1.63,,United Kingdom
559338,21239,PINK  POLKADOT CUP,2,7/7/2011 16:30,1.63,,United Kingdom
559338,21240,BLUE POLKADOT CUP,2,7/7/2011 16:30,1.63,,United Kingdom
559338,21242,RED RETROSPOT PLATE ,2,7/7/2011 16:30,3.29,,United Kingdom
559338,21243,PINK  POLKADOT PLATE ,2,7/7/2011 16:30,3.29,,United Kingdom
559338,21244,BLUE POLKADOT PLATE ,2,7/7/2011 16:30,3.29,,United Kingdom
559338,21245,GREEN POLKADOT PLATE ,2,7/7/2011 16:30,3.29,,United Kingdom
559338,21313,GLASS HEART T-LIGHT HOLDER ,1,7/7/2011 16:30,1.63,,United Kingdom
559338,21314,SMALL GLASS HEART TRINKET POT,1,7/7/2011 16:30,4.13,,United Kingdom
559338,21327,SKULLS WRITING SET ,2,7/7/2011 16:30,0.83,,United Kingdom
559338,21328,BALLOONS  WRITING SET ,4,7/7/2011 16:30,0.83,,United Kingdom
559338,21329,DINOSAURS  WRITING SET ,3,7/7/2011 16:30,0.83,,United Kingdom
559338,21381,MINI WOODEN HAPPY BIRTHDAY GARLAND,1,7/7/2011 16:30,3.29,,United Kingdom
559338,21382,SET/4 SPRING FLOWER DECORATION,5,7/7/2011 16:30,1.63,,United Kingdom
559338,21383,PACK OF 12 STICKY BUNNIES,2,7/7/2011 16:30,0.83,,United Kingdom
559338,21391,FRENCH LAVENDER SCENT HEART,1,7/7/2011 16:30,1.63,,United Kingdom
559338,21408,SPOTTY PINK DUCK DOORSTOP,1,7/7/2011 16:30,8.29,,United Kingdom
559338,21429,RED GINGHAM ROSE JEWELLERY BOX,1,7/7/2011 16:30,4.13,,United Kingdom
559338,21430,SET/3 RED GINGHAM ROSE STORAGE BOX,2,7/7/2011 16:30,7.46,,United Kingdom
559338,21446,12 RED ROSE PEG PLACE SETTINGS,2,7/7/2011 16:30,2.46,,United Kingdom
559338,21467,CHERRY CROCHET FOOD COVER,2,7/7/2011 16:30,3.29,,United Kingdom
559338,21468,BUTTERFLY CROCHET FOOD COVER,2,7/7/2011 16:30,3.29,,United Kingdom
559338,21469,POLKA DOT RAFFIA FOOD COVER,5,7/7/2011 16:30,3.29,,United Kingdom
559338,21494,ROTATING LEAVES T-LIGHT HOLDER,3,7/7/2011 16:30,1.63,,United Kingdom
559338,21506,"FANCY FONT BIRTHDAY CARD, ",2,7/7/2011 16:30,0.83,,United Kingdom
559338,21519,GIN & TONIC DIET GREETING CARD ,2,7/7/2011 16:30,0.83,,United Kingdom
559338,21531,RED RETROSPOT SUGAR JAM BOWL,1,7/7/2011 16:30,4.96,,United Kingdom
559338,21533,RETROSPOT LARGE MILK JUG,1,7/7/2011 16:30,9.96,,United Kingdom
