556812,22335,HEART DECORATION PAINTED ZINC ,1,6/14/2011 17:25,1.25,,United Kingdom
556812,22348,TEA BAG PLATE RED RETROSPOT,1,6/14/2011 17:25,1.63,,United Kingdom
556812,22355,CHARLOTTE BAG SUKI DESIGN,1,6/14/2011 17:25,1.63,,United Kingdom
556812,22365,DOORMAT RESPECTABLE HOUSE,1,6/14/2011 17:25,15.79,,United Kingdom
556812,22378,WALL TIDY RETROSPOT ,1,6/14/2011 17:25,4.13,,United Kingdom
556812,22379,RECYCLING BAG RETROSPOT ,1,6/14/2011 17:25,4.13,,United Kingdom
556812,22381,TOY TIDY PINK POLKADOT,2,6/14/2011 17:25,4.13,,United Kingdom
556812,22384,LUNCH BAG PINK POLKADOT,1,6/14/2011 17:25,4.13,,United Kingdom
556812,22386,JUMBO BAG PINK POLKADOT,1,6/14/2011 17:25,4.13,,United Kingdom
556812,22423,REGENCY CAKESTAND 3 TIER,10,6/14/2011 17:25,12.75,,United Kingdom
556812,22424,ENAMEL BREAD BIN CREAM,1,6/14/2011 17:25,24.96,,United Kingdom
556812,22435,SET OF 9 HEART SHAPED BALLOONS,2,6/14/2011 17:25,2.46,,United Kingdom
556812,22457,NATURAL SLATE HEART CHALKBOARD ,4,6/14/2011 17:25,5.79,,United Kingdom
556812,22467,GUMBALL COAT RACK,1,6/14/2011 17:25,4.96,,United Kingdom
556812,22468,BABUSHKA LIGHTS STRING OF 10,1,6/14/2011 17:25,13.29,,United Kingdom
556812,22469,HEART OF WICKER SMALL,45,6/14/2011 17:25,1.45,,United Kingdom
556812,22470,HEART OF WICKER LARGE,2,6/14/2011 17:25,5.79,,United Kingdom
556812,22480,RED TEA TOWEL CLASSIC DESIGN,1,6/14/2011 17:25,2.46,,United Kingdom
556812,22489,PACK OF 12 TRADITIONAL CRAYONS,2,6/14/2011 17:25,0.83,,United Kingdom
556812,22494,EMERGENCY FIRST AID TIN ,1,6/14/2011 17:25,2.46,,United Kingdom
556812,22498,WOODEN REGATTA BUNTING,2,6/14/2011 17:25,12.46,,United Kingdom
556812,22501,PICNIC BASKET WICKER LARGE,1,6/14/2011 17:25,20.79,,United Kingdom
556812,22502,PICNIC BASKET WICKER SMALL,1,6/14/2011 17:25,10.79,,United Kingdom
556812,22507,MEMO BOARD RETROSPOT  DESIGN,1,6/14/2011 17:25,10.79,,United Kingdom
556812,22557,PLASTERS IN TIN VINTAGE PAISLEY ,1,6/14/2011 17:25,3.29,,United Kingdom
556812,22602,RETROSPOT WOODEN HEART DECORATION,4,6/14/2011 17:25,1.63,,United Kingdom
556812,22609,PENS ASSORTED SPACEBALL,1,6/14/2011 17:25,1.63,,United Kingdom
556812,22629,SPACEBOY LUNCH BOX ,1,6/14/2011 17:25,4.13,,United Kingdom
556812,22630,DOLLY GIRL LUNCH BOX,1,6/14/2011 17:25,4.13,,United Kingdom
556812,22639,SET OF 4 NAPKIN CHARMS HEARTS,1,6/14/2011 17:25,4.96,,United Kingdom
556812,22662,LUNCH BAG DOLLY GIRL DESIGN,1,6/14/2011 17:25,4.13,,United Kingdom
556812,22666,RECIPE BOX PANTRY YELLOW DESIGN,1,6/14/2011 17:25,5.79,,United Kingdom
556812,22667,RECIPE BOX RETROSPOT ,1,6/14/2011 17:25,5.79,,United Kingdom
556812,22668,PINK BABY BUNTING,1,6/14/2011 17:25,5.79,,United Kingdom
556812,22675,FRENCH KITCHEN SIGN BLUE METAL,1,6/14/2011 17:25,2.46,,United Kingdom
556812,22697,GREEN REGENCY TEACUP AND SAUCER,8,6/14/2011 17:25,5.79,,United Kingdom
556812,10133,COLOURING PENCILS BROWN TUBE,5,6/14/2011 17:25,0.83,,United Kingdom
556812,15056N,EDWARDIAN PARASOL NATURAL,1,6/14/2011 17:25,12.46,,United Kingdom
556812,16020C,CLEAR STATIONERY BOX SET ,6,6/14/2011 17:25,0.83,,United Kingdom
556812,16207A,PINK STRAWBERRY HANDBAG ,2,6/14/2011 17:25,2.46,,United Kingdom
556812,17012C,ORIGAMI LAVENDER INCENSE/CANDL SET ,1,6/14/2011 17:25,2.46,,United Kingdom
556812,17012D,ORIGAMI ROSE INCENSE/CANDLE SET ,1,6/14/2011 17:25,2.46,,United Kingdom
556812,20661,BLUE POLKADOT PURSE ,1,6/14/2011 17:25,2.46,,United Kingdom
556812,20677,PINK POLKADOT BOWL,30,6/14/2011 17:25,2.46,,United Kingdom
556812,20700,GREEN CAT FLORAL CUSHION COVER ,1,6/14/2011 17:25,4.13,,United Kingdom
556812,20701,PINK CAT FLORAL CUSHION COVER ,2,6/14/2011 17:25,4.13,,United Kingdom
556812,20707,CRAZY DAISY HEART DECORATION,2,6/14/2011 17:25,0.83,,United Kingdom
556812,20717,STRAWBERRY SHOPPER BAG,1,6/14/2011 17:25,2.46,,United Kingdom
556812,20718,RED RETROSPOT SHOPPER BAG,2,6/14/2011 17:25,2.46,,United Kingdom
556812,20719,WOODLAND CHARLOTTE BAG,2,6/14/2011 17:25,1.63,,United Kingdom
556812,20724,RED RETROSPOT CHARLOTTE BAG,1,6/14/2011 17:25,1.63,,United Kingdom
556812,20725,LUNCH BAG RED RETROSPOT,1,6/14/2011 17:25,4.13,,United Kingdom
556812,20726,LUNCH BAG WOODLAND,1,6/14/2011 17:25,4.13,,United Kingdom
556812,20771,CHRYSANTHEMUM  JOURNAL,1,6/14/2011 17:25,4.96,,United Kingdom
556812,20898,VINTAGE NOTEBOOK TRAVELOGUE,1,6/14/2011 17:25,2.46,,United Kingdom
556812,20901,VINTAGE KEEPSAKE BOX PINK FLOWER,1,6/14/2011 17:25,4.13,,United Kingdom
556812,20902,VINTAGE KEEPSAKE BOX PARIS DAYS,3,6/14/2011 17:25,4.13,,United Kingdom
556812,20903,VINTAGE KEEPSAKE BOX TRAVELOGUE,1,6/14/2011 17:25,4.13,,United Kingdom
556812,20980,36 PENCILS TUBE POSY,18,6/14/2011 17:25,0.83,,United Kingdom
556812,21012,ANTIQUE ALL GLASS CANDLESTICK,2,6/14/2011 17:25,2.46,,United Kingdom
556812,21033,JUMBO BAG CHARLIE AND LOLA TOYS,1,6/14/2011 17:25,4.13,,United Kingdom
556812,21080,SET/20 RED RETROSPOT PAPER NAPKINS ,1,6/14/2011 17:25,1.63,,United Kingdom
556812,22698,PINK REGENCY TEACUP AND SAUCER,8,6/14/2011 17:25,5.79,,United Kingdom
556812,22699,ROSES REGENCY TEACUP AND SAUCER ,8,6/14/2011 17:25,5.79,,United Kingdom
556812,22712,CARD DOLLY GIRL ,1,6/14/2011 17:25,0.83,,United Kingdom
556812,22720,SET OF 3 CAKE TINS PANTRY DESIGN ,2,6/14/2011 17:25,10.79,,United Kingdom
556812,22727,ALARM CLOCK BAKELIKE RED ,1,6/14/2011 17:25,7.46,,United Kingdom
556812,22744,MAKE YOUR OWN MONSOON CARD KIT,1,6/14/2011 17:25,5.79,,United Kingdom
556812,22753,SMALL YELLOW BABUSHKA NOTEBOOK ,1,6/14/2011 17:25,1.63,,United Kingdom
556812,22762,CUPBOARD 3 DRAWER MA CAMPAGNE,2,6/14/2011 17:25,20.79,,United Kingdom
556812,22766,PHOTO FRAME CORNICE,2,6/14/2011 17:25,5.79,,United Kingdom
556812,22791,T-LIGHT GLASS FLUTED ANTIQUE,5,6/14/2011 17:25,2.46,,United Kingdom
556812,22792,FLUTED ANTIQUE CANDLE HOLDER,24,6/14/2011 17:25,1.63,,United Kingdom
556812,22798,ANTIQUE GLASS DRESSING TABLE POT,1,6/14/2011 17:25,5.79,,United Kingdom
556812,22800,ANTIQUE TALL SWIRLGLASS TRINKET POT,1,6/14/2011 17:25,7.46,,United Kingdom
556812,22807,SET OF 6 T-LIGHTS TOADSTOOLS,1,6/14/2011 17:25,5.79,,United Kingdom
556812,22812,PACK 3 BOXES CHRISTMAS PANNETONE,1,6/14/2011 17:25,4.13,,United Kingdom
556812,22813,PACK 3 BOXES BIRD PANNETONE ,1,6/14/2011 17:25,4.13,,United Kingdom
556812,22814,CARD PARTY GAMES ,1,6/14/2011 17:25,0.83,,United Kingdom
556812,22817,CARD SUKI BIRTHDAY,1,6/14/2011 17:25,0.83,,United Kingdom
556812,22839,3 TIER CAKE TIN GREEN AND CREAM,1,6/14/2011 17:25,29.13,,United Kingdom
556812,22851,SET 20 NAPKINS FAIRY CAKES DESIGN ,3,6/14/2011 17:25,1.63,,United Kingdom
556812,22854,CREAM SWEETHEART EGG HOLDER,1,6/14/2011 17:25,10.79,,United Kingdom
556812,22902,TOTE BAG I LOVE LONDON,1,6/14/2011 17:25,4.13,,United Kingdom
556812,22906,12 MESSAGE CARDS WITH ENVELOPES,1,6/14/2011 17:25,3.29,,United Kingdom
556812,22909,SET OF 20 VINTAGE CHRISTMAS NAPKINS,1,6/14/2011 17:25,1.63,,United Kingdom
556812,22951,60 CAKE CASES DOLLY GIRL DESIGN,2,6/14/2011 17:25,1.25,,United Kingdom
556812,22952,60 CAKE CASES VINTAGE CHRISTMAS,1,6/14/2011 17:25,1.25,,United Kingdom
556812,22960,JAM MAKING SET WITH JARS,4,6/14/2011 17:25,8.29,,United Kingdom
556812,22964,3 PIECE SPACEBOY COOKIE CUTTER SET,1,6/14/2011 17:25,4.13,,United Kingdom
556812,22968,ROSE COTTAGE KEEPSAKE BOX ,1,6/14/2011 17:25,19.96,,United Kingdom
556812,22969,HOMEMADE JAM SCENTED CANDLES,2,6/14/2011 17:25,3.29,,United Kingdom
556812,22983,CARD BILLBOARD FONT,1,6/14/2011 17:25,0.83,,United Kingdom
556812,22992,REVOLVER WOODEN RULER ,1,6/14/2011 17:25,4.13,,United Kingdom
556812,22995,TRAVEL CARD WALLET SUKI,4,6/14/2011 17:25,0.83,,United Kingdom
556812,22996,TRAVEL CARD WALLET VINTAGE TICKET,1,6/14/2011 17:25,0.83,,United Kingdom
556812,22997,TRAVEL CARD WALLET UNION JACK,2,6/14/2011 17:25,0.83,,United Kingdom
556812,23000,TRAVEL CARD WALLET TRANSPORT,2,6/14/2011 17:25,0.83,,United Kingdom
556812,23004,TRAVEL CARD WALLET PANTRY,1,6/14/2011 17:25,0.83,,United Kingdom
556812,23050,RECYCLED ACAPULCO MAT GREEN,1,6/14/2011 17:25,16.63,,United Kingdom
556812,23052,RECYCLED ACAPULCO MAT TURQUOISE,1,6/14/2011 17:25,16.63,,United Kingdom
556812,23072,MARIE ANTOINETTE TRINKET BOX SILVER,1,6/14/2011 17:25,24.96,,United Kingdom
556812,23081,GREEN METAL BOX ARMY SUPPLIES,1,6/14/2011 17:25,16.63,,United Kingdom
556812,23090,VINTAGE GLASS T-LIGHT HOLDER,5,6/14/2011 17:25,1.63,,United Kingdom
556812,23100,SILVER BELLS TABLE DECORATION,1,6/14/2011 17:25,2.46,,United Kingdom
556812,23103,JINGLE BELL HEART DECORATION,5,6/14/2011 17:25,3.29,,United Kingdom
556812,23108,SET OF 10 LED DOLLY LIGHTS,1,6/14/2011 17:25,12.46,,United Kingdom
556812,23110,PARISIENNE KEY CABINET ,1,6/14/2011 17:25,12.46,,United Kingdom
556812,23112,PARISIENNE CURIO CABINET,1,6/14/2011 17:25,14.96,,United Kingdom
556812,23135,SMALL ZINC HEART WALL ORGANISER,1,6/14/2011 17:25,12.46,,United Kingdom
556812,23144,ZINC T-LIGHT HOLDER STARS SMALL,1,6/14/2011 17:25,1.63,,United Kingdom
556812,23168,CLASSIC CAFE SUGAR DISPENSER,1,6/14/2011 17:25,2.46,,United Kingdom
556812,23169,CLASSIC GLASS COOKIE JAR,2,6/14/2011 17:25,8.29,,United Kingdom
556812,23173,REGENCY TEAPOT ROSES ,10,6/14/2011 17:25,9.95,,United Kingdom
556812,23174,REGENCY SUGAR BOWL GREEN,10,6/14/2011 17:25,8.29,,United Kingdom
556812,23181,BULL DOG BOTTLE TOP WALL CLOCK,2,6/14/2011 17:25,16.63,,United Kingdom
556812,23184,BULL DOG BOTTLE OPENER,3,6/14/2011 17:25,10.79,,United Kingdom
556812,23192,BUNDLE OF 3 ALPHABET EXERCISE BOOKS,3,6/14/2011 17:25,3.29,,United Kingdom
556812,23199,JUMBO BAG APPLES,6,6/14/2011 17:25,4.13,,United Kingdom
556812,23200,JUMBO BAG PEARS,2,6/14/2011 17:25,4.13,,United Kingdom
556812,23202,JUMBO BAG VINTAGE LEAF,1,6/14/2011 17:25,4.13,,United Kingdom
556812,23203,JUMBO BAG DOILEY PATTERNS,2,6/14/2011 17:25,4.13,,United Kingdom
556812,23204,CHARLOTTE BAG APPLES DESIGN,1,6/14/2011 17:25,1.63,,United Kingdom
556812,23206,LUNCH BAG APPLE DESIGN,1,6/14/2011 17:25,4.13,,United Kingdom
556812,23208,LUNCH BAG VINTAGE LEAF DESIGN,1,6/14/2011 17:25,4.13,,United Kingdom
556812,23209,LUNCH BAG DOILEY PATTERN ,1,6/14/2011 17:25,4.13,,United Kingdom
556812,23210,WHITE ROCKING HORSE HAND PAINTED,2,6/14/2011 17:25,2.5,,United Kingdom
556812,23226,FILIGREE HEART DAISY WHITE,2,6/14/2011 17:25,2.46,,United Kingdom
556812,23227,FILIGREE HEART BUTTERFLY WHITE ,4,6/14/2011 17:25,2.46,,United Kingdom
556812,23235,STORAGE TIN VINTAGE LEAF,1,6/14/2011 17:25,5.79,,United Kingdom
556812,23236,DOILEY STORAGE TIN,1,6/14/2011 17:25,5.79,,United Kingdom
556812,23237,SET OF 4 KNICK KNACK TINS LEAVES ,2,6/14/2011 17:25,8.29,,United Kingdom
556812,23238,SET OF 4 KNICK KNACK TINS LONDON ,2,6/14/2011 17:25,8.29,,United Kingdom
556812,23240,SET OF 4 KNICK KNACK TINS DOILEY ,6,6/14/2011 17:25,8.29,,United Kingdom
556812,23241,TREASURE TIN GYMKHANA DESIGN,3,6/14/2011 17:25,4.13,,United Kingdom
556812,23242,TREASURE TIN BUFFALO BILL ,2,6/14/2011 17:25,4.13,,United Kingdom
556812,23243,SET OF TEA COFFEE SUGAR TINS PANTRY,1,6/14/2011 17:25,10.79,,United Kingdom
556812,23245,SET OF 3 REGENCY CAKE TINS,5,6/14/2011 17:25,10.79,,United Kingdom
556812,23249,VINTAGE RED ENAMEL TRIM PLATE,4,6/14/2011 17:25,3.29,,United Kingdom
556812,23250,VINTAGE RED TRIM ENAMEL BOWL ,4,6/14/2011 17:25,2.46,,United Kingdom
556812,23251,VINTAGE RED ENAMEL TRIM MUG ,4,6/14/2011 17:25,2.46,,United Kingdom
556812,23275,SET OF 3 HANGING OWLS OLLIE BEAK,1,6/14/2011 17:25,2.46,,United Kingdom
556812,23289,DOLLY GIRL CHILDRENS BOWL,2,6/14/2011 17:25,2.46,,United Kingdom
556812,23291,DOLLY GIRL CHILDRENS CUP,2,6/14/2011 17:25,2.46,,United Kingdom
556812,23298,SPOTTY BUNTING,1,6/14/2011 17:25,10.79,,United Kingdom
556812,23300,GARDENERS KNEELING PAD CUP OF TEA ,2,6/14/2011 17:25,3.29,,United Kingdom
556812,23301,GARDENERS KNEELING PAD KEEP CALM ,2,6/14/2011 17:25,3.29,,United Kingdom
556812,23302,KNEELING MAT HOUSEWORK  DESIGN,3,6/14/2011 17:25,3.29,,United Kingdom
556812,23306,SET OF 36 DOILIES PANTRY DESIGN,3,6/14/2011 17:25,2.92,,United Kingdom
556812,23307,SET OF 60 PANTRY DESIGN CAKE CASES ,2,6/14/2011 17:25,1.25,,United Kingdom
556812,23310,BUBBLEGUM RING ASSORTED,8,6/14/2011 17:25,0.83,,United Kingdom
556812,35649,VINTAGE BEAD COSMETIC BAG ,1,6/14/2011 17:25,2.46,,United Kingdom
556812,35653,VINTAGE BEAD NOTEBOOK,9,6/14/2011 17:25,2.46,,United Kingdom
556812,35911A,MULTICOLOUR RABBIT EGG WARMER,2,6/14/2011 17:25,0.83,,United Kingdom
556812,35961,FOLKART ZINC HEART CHRISTMAS DEC,1,6/14/2011 17:25,1.63,,United Kingdom
556812,35971,ROSE FOLKART HEART DECORATIONS,1,6/14/2011 17:25,2.46,,United Kingdom
556812,37342,POLKADOT COFFEE CUP & SAUCER PINK,1,6/14/2011 17:25,2.46,,United Kingdom
556812,37446,MINI CAKE STAND WITH HANGING CAKES,1,6/14/2011 17:25,3.29,,United Kingdom
556812,37447,CERAMIC CAKE DESIGN SPOTTED PLATE,1,6/14/2011 17:25,3.29,,United Kingdom
556812,37450,CERAMIC CAKE BOWL + HANGING CAKES,2,6/14/2011 17:25,5.79,,United Kingdom
556812,37495,FAIRY CAKE BIRTHDAY CANDLE SET,1,6/14/2011 17:25,7.46,,United Kingdom
556812,47566,PARTY BUNTING,4,6/14/2011 17:25,10.79,,United Kingdom
556812,47566B,TEA TIME PARTY BUNTING,1,6/14/2011 17:25,10.79,,United Kingdom
556812,47574A,ENGLISH ROSE SCENTED HANGING FLOWER,1,6/14/2011 17:25,2.46,,United Kingdom
556812,47593B,SCOTTIE DOGS BABY BIB,1,6/14/2011 17:25,0.83,,United Kingdom
556812,48138,DOORMAT UNION FLAG,1,6/14/2011 17:25,15.79,,United Kingdom
556812,51014L,"FEATHER PEN,LIGHT PINK",1,6/14/2011 17:25,0.83,,United Kingdom
556812,71053,WHITE METAL LANTERN,2,6/14/2011 17:25,8.29,,United Kingdom
556812,71143,SILVER BOOK MARK WITH BEADS,7,6/14/2011 17:25,0.83,,United Kingdom
556812,75049L,LARGE CIRCULAR MIRROR MOBILE,1,6/14/2011 17:25,2.46,,United Kingdom
556812,79190A,RETRO PLASTIC 70'S TRAY,1,6/14/2011 17:25,0.83,,United Kingdom
556812,82551,LAUNDRY 15C METAL SIGN,1,6/14/2011 17:25,2.46,,United Kingdom
556812,82583,HOT BATHS METAL SIGN,1,6/14/2011 17:25,4.13,,United Kingdom
556812,84347,ROTATING SILVER ANGELS T-LIGHT HLDR,1,6/14/2011 17:25,4.96,,United Kingdom
556812,84380,SET OF 3 BUTTERFLY COOKIE CUTTERS,1,6/14/2011 17:25,2.46,,United Kingdom
556812,84459A,PINK METAL CHICKEN HEART ,1,6/14/2011 17:25,3.29,,United Kingdom
556812,84536A,ENGLISH ROSE NOTEBOOK A7 SIZE,6,6/14/2011 17:25,0.83,,United Kingdom
556812,84536B,FAIRY CAKES NOTEBOOK A7 SIZE,6,6/14/2011 17:25,0.83,,United Kingdom
556812,84568,GIRLS ALPHABET IRON ON PATCHES ,6,6/14/2011 17:25,0.42,,United Kingdom
556812,84637,KITCHEN FLOWER POTS WALL PLAQUE,1,6/14/2011 17:25,4.96,,United Kingdom
556812,84692,BOX OF 24 COCKTAIL PARASOLS,3,6/14/2011 17:25,0.83,,United Kingdom
556812,84755,COLOUR GLASS T-LIGHT HOLDER HANGING,4,6/14/2011 17:25,1.24,,United Kingdom
556812,84796B,BLUE SAVANNAH PICNIC HAMPER FOR 2,2,6/14/2011 17:25,8.29,,United Kingdom
556812,84912A,PINK ROSE WASHBAG,1,6/14/2011 17:25,3.29,,United Kingdom
556812,84912B,GREEN ROSE WASHBAG,1,6/14/2011 17:25,3.29,,United Kingdom
556812,84913A,SOFT PINK ROSE TOWEL ,6,6/14/2011 17:25,3.29,,United Kingdom
556812,84915,HAND TOWEL PINK FLOWER AND DAISY,1,6/14/2011 17:25,4.13,,United Kingdom
556812,84944,SET OF 6 KASHMIR FOLKART BAUBLES,42,6/14/2011 17:25,0.55,,United Kingdom
556812,84946,ANTIQUE SILVER T-LIGHT GLASS,18,6/14/2011 17:25,2.46,,United Kingdom
556812,84947,ANTIQUE SILVER TEA GLASS ENGRAVED,16,6/14/2011 17:25,2.46,,United Kingdom
556812,84969,BOX OF 6 ASSORTED COLOUR TEASPOONS,2,6/14/2011 17:25,3.29,,United Kingdom
556812,84970S,HANGING HEART ZINC T-LIGHT HOLDER,3,6/14/2011 17:25,2.08,,United Kingdom
556812,84991,60 TEATIME FAIRY CAKE CASES,3,6/14/2011 17:25,1.25,,United Kingdom
556812,85015,SET OF 12  VINTAGE POSTCARD SET,1,6/14/2011 17:25,2.46,,United Kingdom
556812,85039B,S/4 IVORY MINI ROSE CANDLE IN BOWL,2,6/14/2011 17:25,1.63,,United Kingdom
556812,85039C,S/4 BLACK MINI ROSE CANDLE IN BOWL,1,6/14/2011 17:25,1.63,,United Kingdom
556812,85048,15CM CHRISTMAS GLASS BALL 20 LIGHTS,1,6/14/2011 17:25,16.63,,United Kingdom
556812,85078,SCANDINAVIAN 3 HEARTS NAPKIN RING,8,6/14/2011 17:25,1.63,,United Kingdom
556812,85086A,CANDY SPOT HEART DECORATION,4,6/14/2011 17:25,0.83,,United Kingdom
556812,85087,CANDY SPOT CUSHION COVER,1,6/14/2011 17:25,3.29,,United Kingdom
556812,85093,CANDY SPOT EGG WARMER HARE,6,6/14/2011 17:25,0.83,,United Kingdom
556812,85099B,JUMBO BAG RED RETROSPOT,1,6/14/2011 17:25,4.13,,United Kingdom
556812,85099C,JUMBO  BAG BAROQUE BLACK WHITE,1,6/14/2011 17:25,4.13,,United Kingdom
556812,85114B,IVORY ENCHANTED FOREST PLACEMAT,2,6/14/2011 17:25,3.29,,United Kingdom
556812,85131B,BEADED CRYSTAL HEART GREEN ON STICK,1,6/14/2011 17:25,0.83,,United Kingdom
556812,85131D,BEADED CRYSTAL HEART PINK ON STICK,1,6/14/2011 17:25,0.83,,United Kingdom
556812,85132C,CHARLIE AND LOLA FIGURES TINS,1,6/14/2011 17:25,5.79,,United Kingdom
556812,85231G,ORANGE SCENTED SET/9 T-LIGHTS,1,6/14/2011 17:25,1.63,,United Kingdom
556812,90016C,SILVER/BLACK PENDANT ORBIT NECKLACE,1,6/14/2011 17:25,8.32,,United Kingdom
556812,90018C,SILVER BLACK ORBIT DROP EARRINGS,1,6/14/2011 17:25,4.15,,United Kingdom
556812,90019C,SILVER BLACK ORBIT BRACELET,1,6/14/2011 17:25,5.4,,United Kingdom
556812,90119,METALIC LEAVES BAG CHARMS,1,6/14/2011 17:25,2.46,,United Kingdom
556812,90120B,BLUE MURANO TWIST BRACELET,1,6/14/2011 17:25,4.15,,United Kingdom
556812,90134,OLD ROSE COMBO BEAD NECKLACE,1,6/14/2011 17:25,2.9,,United Kingdom
556812,90170,DAISY HAIR BAND,1,6/14/2011 17:25,1.65,,United Kingdom
556812,DOT,DOTCOM POSTAGE,1,6/14/2011 17:25,239.67,,United Kingdom
556812,23131,MISTLETOE HEART WREATH CREAM,6,6/14/2011 17:25,4.15,,United Kingdom
556812,23130,MISTLETOE HEART WREATH GREEN,10,6/14/2011 17:25,4.15,,United Kingdom
556813,22467,GUMBALL COAT RACK,2,6/14/2011 17:28,4.96,,United Kingdom
556813,22469,HEART OF WICKER SMALL,9,6/14/2011 17:28,1.63,,United Kingdom
556813,22488,NATURAL SLATE RECTANGLE CHALKBOARD,1,6/14/2011 17:28,3.29,,United Kingdom
556813,22494,EMERGENCY FIRST AID TIN ,1,6/14/2011 17:28,2.46,,United Kingdom
556813,22512,DOORSTOP RACING CAR DESIGN,1,6/14/2011 17:28,7.46,,United Kingdom
556813,22514,CHILDS GARDEN SPADE BLUE,1,6/14/2011 17:28,4.13,,United Kingdom
556813,22516,CHILDS GARDEN RAKE BLUE,1,6/14/2011 17:28,4.13,,United Kingdom
556813,22522,CHILDS GARDEN FORK BLUE ,1,6/14/2011 17:28,1.63,,United Kingdom
556813,22526,WHEELBARROW FOR CHILDREN ,1,6/14/2011 17:28,24.96,,United Kingdom
556813,22547,MINI JIGSAW DINOSAUR ,1,6/14/2011 17:28,0.83,,United Kingdom
556813,22595,GINGHAM HEART DECORATION,1,6/14/2011 17:28,1.63,,United Kingdom
556813,22602,RETROSPOT WOODEN HEART DECORATION,1,6/14/2011 17:28,1.63,,United Kingdom
556813,22610,PENS ASSORTED FUNNY FACE,1,6/14/2011 17:28,1.63,,United Kingdom
556813,22620,4 TRADITIONAL SPINNING TOPS,1,6/14/2011 17:28,2.46,,United Kingdom
556813,22629,SPACEBOY LUNCH BOX ,1,6/14/2011 17:28,4.13,,United Kingdom
556813,22637,PIGGY BANK RETROSPOT ,1,6/14/2011 17:28,4.96,,United Kingdom
556813,22661,CHARLOTTE BAG DOLLY GIRL DESIGN,2,6/14/2011 17:28,1.63,,United Kingdom
556813,22667,RECIPE BOX RETROSPOT ,1,6/14/2011 17:28,5.79,,United Kingdom
556813,22668,PINK BABY BUNTING,1,6/14/2011 17:28,5.79,,United Kingdom
556813,22693,GROW A FLYTRAP OR SUNFLOWER IN TIN,1,6/14/2011 17:28,2.5,,United Kingdom
556813,22697,GREEN REGENCY TEACUP AND SAUCER,1,6/14/2011 17:28,5.79,,United Kingdom
556813,22717,CARD DOG AND BALL ,1,6/14/2011 17:28,0.83,,United Kingdom
556813,22768,FAMILY PHOTO FRAME CORNICE,1,6/14/2011 17:28,19.96,,United Kingdom
556813,22772,PINK DRAWER KNOB ACRYLIC EDWARDIAN,1,6/14/2011 17:28,2.46,,United Kingdom
556813,22781,GUMBALL MAGAZINE RACK,1,6/14/2011 17:28,14.96,,United Kingdom
556813,22814,CARD PARTY GAMES ,2,6/14/2011 17:28,0.83,,United Kingdom
556813,22916,HERB MARKER THYME,1,6/14/2011 17:28,1.63,,United Kingdom
556813,22918,HERB MARKER PARSLEY,1,6/14/2011 17:28,1.63,,United Kingdom
556813,22919,HERB MARKER MINT,1,6/14/2011 17:28,1.63,,United Kingdom
556813,22937,BAKING MOULD CHOCOLATE CUPCAKES,1,6/14/2011 17:28,4.96,,United Kingdom
556813,22975,SPACEBOY CHILDRENS EGG CUP,1,6/14/2011 17:28,2.46,,United Kingdom
556813,23084,RABBIT NIGHT LIGHT,2,6/14/2011 17:28,4.13,,United Kingdom
556813,23087,ZINC  HEART T-LIGHT HOLDER,3,6/14/2011 17:28,2.46,,United Kingdom
556813,23090,VINTAGE GLASS T-LIGHT HOLDER,3,6/14/2011 17:28,1.63,,United Kingdom
556813,23096,PETIT TRAY CHIC,1,6/14/2011 17:28,3.29,,United Kingdom
556813,23100,SILVER BELLS TABLE DECORATION,2,6/14/2011 17:28,2.46,,United Kingdom
556813,23110,PARISIENNE KEY CABINET ,1,6/14/2011 17:28,12.46,,United Kingdom
556813,23146,TRIPLE HOOK ANTIQUE IVORY ROSE,1,6/14/2011 17:28,6.63,,United Kingdom
556813,23147,SINGLE ANTIQUE ROSE HOOK IVORY,2,6/14/2011 17:28,3.29,,United Kingdom
556813,23165,LARGE CERAMIC TOP STORAGE JAR,5,6/14/2011 17:28,3.29,,United Kingdom
556813,23170,REGENCY TEA PLATE ROSES ,2,6/14/2011 17:28,3.29,,United Kingdom
556813,23171,REGENCY TEA PLATE GREEN ,2,6/14/2011 17:28,3.29,,United Kingdom
556813,23181,BULL DOG BOTTLE TOP WALL CLOCK,1,6/14/2011 17:28,16.63,,United Kingdom
556813,23184,BULL DOG BOTTLE OPENER,1,6/14/2011 17:28,10.79,,United Kingdom
556813,23200,JUMBO BAG PEARS,2,6/14/2011 17:28,4.13,,United Kingdom
556813,23202,JUMBO BAG VINTAGE LEAF,1,6/14/2011 17:28,4.13,,United Kingdom
556813,23203,JUMBO BAG DOILEY PATTERNS,2,6/14/2011 17:28,4.13,,United Kingdom
556813,23207,LUNCH BAG ALPHABET DESIGN,1,6/14/2011 17:28,4.13,,United Kingdom
556813,23240,SET OF 4 KNICK KNACK TINS DOILEY ,1,6/14/2011 17:28,8.29,,United Kingdom
556813,23245,SET OF 3 REGENCY CAKE TINS,3,6/14/2011 17:28,10.79,,United Kingdom
556813,23249,VINTAGE RED ENAMEL TRIM PLATE,5,6/14/2011 17:28,3.29,,United Kingdom
556813,23250,VINTAGE RED TRIM ENAMEL BOWL ,5,6/14/2011 17:28,2.46,,United Kingdom
556813,23251,VINTAGE RED ENAMEL TRIM MUG ,5,6/14/2011 17:28,2.46,,United Kingdom
556813,23252,VINTAGE RED ENAMEL TRIM JUG ,1,6/14/2011 17:28,7.46,,United Kingdom
556813,23290,SPACEBOY CHILDRENS BOWL,1,6/14/2011 17:28,2.46,,United Kingdom
556813,23292,SPACE BOY CHILDRENS CUP,1,6/14/2011 17:28,2.46,,United Kingdom
556813,23299,FOOD COVER WITH BEADS SET 2 ,1,6/14/2011 17:28,7.46,,United Kingdom
556813,23300,GARDENERS KNEELING PAD CUP OF TEA ,1,6/14/2011 17:28,3.29,,United Kingdom
556813,23301,GARDENERS KNEELING PAD KEEP CALM ,1,6/14/2011 17:28,3.29,,United Kingdom
556813,23307,SET OF 60 PANTRY DESIGN CAKE CASES ,2,6/14/2011 17:28,1.25,,United Kingdom
556813,35648,VINTAGE BEAD PINK PURSE ,1,6/14/2011 17:28,1.63,,United Kingdom
556813,37447,CERAMIC CAKE DESIGN SPOTTED PLATE,1,6/14/2011 17:28,3.29,,United Kingdom
556813,37450,CERAMIC CAKE BOWL + HANGING CAKES,1,6/14/2011 17:28,5.79,,United Kingdom
556813,48194,DOORMAT HEARTS,1,6/14/2011 17:28,15.79,,United Kingdom
556813,71143,SILVER BOOK MARK WITH BEADS,6,6/14/2011 17:28,0.83,,United Kingdom
556813,71270,PHOTO CLIP LINE,1,6/14/2011 17:28,2.46,,United Kingdom
556813,72760B,VINTAGE CREAM 3 BASKET CAKE STAND,1,6/14/2011 17:28,20.79,,United Kingdom
556813,79321,CHILLI LIGHTS,1,6/14/2011 17:28,12.46,,United Kingdom
556813,82583,HOT BATHS METAL SIGN,1,6/14/2011 17:28,4.13,,United Kingdom
556813,82613C,"METAL SIGN,CUPCAKE SINGLE HOOK",1,6/14/2011 17:28,2.46,,United Kingdom
556813,84510A,SET OF 4 ENGLISH ROSE COASTERS,1,6/14/2011 17:28,2.46,,United Kingdom
556813,84580,MOUSE TOY WITH PINK T-SHIRT,1,6/14/2011 17:28,4.13,,United Kingdom
556813,84596B,SMALL DOLLY MIX DESIGN ORANGE BOWL,2,6/14/2011 17:28,0.83,,United Kingdom
556813,84596F,SMALL MARSHMALLOWS PINK BOWL,2,6/14/2011 17:28,0.83,,United Kingdom
556813,84596G,SMALL CHOCOLATES PINK BOWL,2,6/14/2011 17:28,0.83,,United Kingdom
556813,84596L,BISCUITS SMALL BOWL LIGHT BLUE,1,6/14/2011 17:28,0.83,,United Kingdom
556813,84598,BOYS ALPHABET IRON ON PATCHES,3,6/14/2011 17:28,0.42,,United Kingdom
556813,84692,BOX OF 24 COCKTAIL PARASOLS,1,6/14/2011 17:28,0.83,,United Kingdom
556813,84796B,BLUE SAVANNAH PICNIC HAMPER FOR 2,4,6/14/2011 17:28,8.29,,United Kingdom
556813,84912B,GREEN ROSE WASHBAG,1,6/14/2011 17:28,3.29,,United Kingdom
556813,84944,SET OF 6 KASHMIR FOLKART BAUBLES,6,6/14/2011 17:28,0.55,,United Kingdom
556813,85086A,CANDY SPOT HEART DECORATION,1,6/14/2011 17:28,0.83,,United Kingdom
556813,85095,THREE CANVAS LUGGAGE TAGS,1,6/14/2011 17:28,4.13,,United Kingdom
556813,85099B,JUMBO BAG RED RETROSPOT,1,6/14/2011 17:28,4.13,,United Kingdom
556813,85123A,WHITE HANGING HEART T-LIGHT HOLDER,1,6/14/2011 17:28,5.79,,United Kingdom
556813,85131D,BEADED CRYSTAL HEART PINK ON STICK,3,6/14/2011 17:28,0.83,,United Kingdom
556813,85152,HAND OVER THE CHOCOLATE   SIGN ,1,6/14/2011 17:28,4.13,,United Kingdom
556813,85177,BASKET OF FLOWERS SEWING KIT,1,6/14/2011 17:28,1.63,,United Kingdom
556813,90019A,SILVER M.O.P ORBIT BRACELET,1,6/14/2011 17:28,5.4,,United Kingdom
556813,90019B,GOLD M.O.P ORBIT BRACELET,1,6/14/2011 17:28,5.4,,United Kingdom
556813,90059A,DIAMANTE HAIR GRIP PACK/2 CRYSTAL,1,6/14/2011 17:28,1.65,,United Kingdom
556813,90083,CRYSTAL CZECH CROSS PHONE CHARM,1,6/14/2011 17:28,1.63,,United Kingdom
556813,90087,CRYSTAL SEA HORSE PHONE CHARM,1,6/14/2011 17:28,1.63,,United Kingdom
556813,90181B,AMETHYST GLASS/SHELL/PEARL NECKLACE,1,6/14/2011 17:28,9.15,,United Kingdom
556813,90214C,"LETTER ""C"" BLING KEY RING",1,6/14/2011 17:28,0.83,,United Kingdom
556813,90214J,"LETTER ""J"" BLING KEY RING",1,6/14/2011 17:28,0.83,,United Kingdom
556813,DOT,DOTCOM POSTAGE,1,6/14/2011 17:28,191.78,,United Kingdom
556813,15036,ASSORTED COLOURS SILK FAN,68,6/14/2011 17:28,1.63,,United Kingdom
556813,15039,SANDALWOOD FAN,1,6/14/2011 17:28,1.63,,United Kingdom
556813,15056N,EDWARDIAN PARASOL NATURAL,1,6/14/2011 17:28,12.46,,United Kingdom
556813,15058C,ICE CREAM DESIGN GARDEN PARASOL,1,6/14/2011 17:28,10.79,,United Kingdom
556813,16237,SLEEPING CAT ERASERS,1,6/14/2011 17:28,0.42,,United Kingdom
556813,20676,RED RETROSPOT BOWL,1,6/14/2011 17:28,2.46,,United Kingdom
556813,20712,JUMBO BAG WOODLAND ANIMALS,2,6/14/2011 17:28,4.13,,United Kingdom
556813,20713,JUMBO BAG OWLS,1,6/14/2011 17:28,4.13,,United Kingdom
556813,20828,GLITTER BUTTERFLY CLIPS,1,6/14/2011 17:28,4.96,,United Kingdom
556813,20901,VINTAGE KEEPSAKE BOX PINK FLOWER,1,6/14/2011 17:28,4.13,,United Kingdom
