556784,23164,REGENCY CAKE SLICE,8,6/14/2011 13:15,4.95,14461,United Kingdom
556784,23161,REGENCY CAKE FORK,24,6/14/2011 13:15,1.25,14461,United Kingdom
556784,21531,RED RETROSPOT SUGAR JAM BOWL,2,6/14/2011 13:15,2.55,14461,United Kingdom
556784,21535,RED RETROSPOT SMALL MILK JUG,2,6/14/2011 13:15,2.55,14461,United Kingdom
556784,84969,BOX OF 6 ASSORTED COLOUR TEASPOONS,6,6/14/2011 13:15,4.25,14461,United Kingdom
556784,22675,FRENCH KITCHEN SIGN BLUE METAL,6,6/14/2011 13:15,1.25,14461,United Kingdom
556784,21770,OPEN CLOSED METAL SIGN,4,6/14/2011 13:15,4.95,14461,United Kingdom
556784,82552,WASHROOM METAL SIGN,4,6/14/2011 13:15,1.45,14461,United Kingdom
556784,82551,LAUNDRY 15C METAL SIGN,4,6/14/2011 13:15,1.45,14461,United Kingdom
556784,22191,IVORY DINER WALL CLOCK,1,6/14/2011 13:15,8.5,14461,United Kingdom
556784,22193,RED DINER WALL CLOCK,1,6/14/2011 13:15,8.5,14461,United Kingdom
556784,22192,BLUE DINER WALL CLOCK,1,6/14/2011 13:15,8.5,14461,United Kingdom
556784,84879,ASSORTED COLOUR BIRD ORNAMENT,16,6/14/2011 13:15,1.69,14461,United Kingdom
556785,22720,SET OF 3 CAKE TINS PANTRY DESIGN ,24,6/14/2011 13:17,4.25,13408,United Kingdom
556786,23307,SET OF 60 PANTRY DESIGN CAKE CASES ,48,6/14/2011 13:18,0.55,13408,United Kingdom
556786,23012,GLASS APOTHECARY BOTTLE PERFUME,12,6/14/2011 13:18,3.45,13408,United Kingdom
556786,23014,GLASS APOTHECARY BOTTLE ELIXIR,12,6/14/2011 13:18,3.45,13408,United Kingdom
C556787,20914,SET/5 RED RETROSPOT LID GLASS BOWLS,-8,6/14/2011 13:26,2.95,16745,United Kingdom
556788,21790,VINTAGE SNAP CARDS,12,6/14/2011 13:40,0.85,15129,United Kingdom
556788,22890,NOVELTY BISCUITS CAKE STAND 3 TIER,2,6/14/2011 13:40,9.95,15129,United Kingdom
556788,22720,SET OF 3 CAKE TINS PANTRY DESIGN ,6,6/14/2011 13:40,4.95,15129,United Kingdom
556788,22067,CHOC TRUFFLE GOLD TRINKET POT ,12,6/14/2011 13:40,1.65,15129,United Kingdom
556788,22112,CHOCOLATE HOT WATER BOTTLE,48,6/14/2011 13:40,4.25,15129,United Kingdom
556788,22483,RED GINGHAM TEDDY BEAR ,12,6/14/2011 13:40,2.95,15129,United Kingdom
556788,21770,OPEN CLOSED METAL SIGN,2,6/14/2011 13:40,4.95,15129,United Kingdom
556788,23077,DOUGHNUT LIP GLOSS ,20,6/14/2011 13:40,1.25,15129,United Kingdom
556788,21749,LARGE RED RETROSPOT WINDMILL,12,6/14/2011 13:40,2.1,15129,United Kingdom
556788,23229,VINTAGE DONKEY TAIL GAME ,6,6/14/2011 13:40,3.75,15129,United Kingdom
556788,23020,GLASS  SONGBIRD STORAGE JAR,1,6/14/2011 13:40,12.5,15129,United Kingdom
556789,22720,SET OF 3 CAKE TINS PANTRY DESIGN ,3,6/14/2011 13:40,4.95,15129,United Kingdom
556790,23167,SMALL CERAMIC TOP STORAGE JAR ,12,6/14/2011 13:48,0.83,15656,United Kingdom
556790,23165,LARGE CERAMIC TOP STORAGE JAR,12,6/14/2011 13:48,1.65,15656,United Kingdom
556790,23020,GLASS  SONGBIRD STORAGE JAR,1,6/14/2011 13:48,12.5,15656,United Kingdom
556790,22855,FINE WICKER HEART ,12,6/14/2011 13:48,1.25,15656,United Kingdom
556790,21136,PAINTED METAL PEARS ASSORTED,8,6/14/2011 13:48,1.69,15656,United Kingdom
556790,84832,ZINC WILLIE WINKIE  CANDLE STICK,12,6/14/2011 13:48,0.85,15656,United Kingdom
556790,22843,BISCUIT TIN VINTAGE GREEN,2,6/14/2011 13:48,6.75,15656,United Kingdom
556790,22841,ROUND CAKE TIN VINTAGE GREEN,2,6/14/2011 13:48,7.95,15656,United Kingdom
556790,22842,BISCUIT TIN VINTAGE RED,2,6/14/2011 13:48,6.75,15656,United Kingdom
556790,23245,SET OF 3 REGENCY CAKE TINS,4,6/14/2011 13:48,4.95,15656,United Kingdom
556790,23240,SET OF 4 KNICK KNACK TINS DOILEY ,6,6/14/2011 13:48,4.15,15656,United Kingdom
556790,23236,DOILEY STORAGE TIN,6,6/14/2011 13:48,2.89,15656,United Kingdom
556790,23275,SET OF 3 HANGING OWLS OLLIE BEAK,12,6/14/2011 13:48,1.25,15656,United Kingdom
556790,22840,ROUND CAKE TIN VINTAGE RED,2,6/14/2011 13:48,7.95,15656,United Kingdom
556790,22354,RETROSPOT PADDED SEAT CUSHION,8,6/14/2011 13:48,3.75,15656,United Kingdom
556790,22776,SWEETHEART CAKESTAND 3 TIER,1,6/14/2011 13:48,9.95,15656,United Kingdom
556791,23032,DRAWER KNOB CRACKLE GLAZE IVORY,3,6/14/2011 13:51,1.65,16928,United Kingdom
556791,23028,DRAWER KNOB CRACKLE GLAZE BLUE,3,6/14/2011 13:51,1.65,16928,United Kingdom
556791,23031,DRAWER KNOB CRACKLE GLAZE PINK,3,6/14/2011 13:51,1.65,16928,United Kingdom
556791,23029,DRAWER KNOB CRACKLE GLAZE GREEN,6,6/14/2011 13:51,1.65,16928,United Kingdom
556791,23033,DRAWER KNOB CERAMIC RED,1,6/14/2011 13:51,1.45,16928,United Kingdom
556791,23034,DRAWER KNOB CERAMIC BLACK,1,6/14/2011 13:51,1.45,16928,United Kingdom
556791,23035,DRAWER KNOB CERAMIC IVORY,1,6/14/2011 13:51,1.45,16928,United Kingdom
556791,22771,CLEAR DRAWER KNOB ACRYLIC EDWARDIAN,1,6/14/2011 13:51,1.25,16928,United Kingdom
556791,22773,GREEN DRAWER KNOB ACRYLIC EDWARDIAN,5,6/14/2011 13:51,1.25,16928,United Kingdom
556791,22772,PINK DRAWER KNOB ACRYLIC EDWARDIAN,6,6/14/2011 13:51,1.25,16928,United Kingdom
556791,21669,BLUE STRIPE CERAMIC DRAWER KNOB,3,6/14/2011 13:51,1.25,16928,United Kingdom
556791,21668,RED STRIPE CERAMIC DRAWER KNOB,4,6/14/2011 13:51,1.25,16928,United Kingdom
556791,21673,WHITE SPOT BLUE CERAMIC DRAWER KNOB,7,6/14/2011 13:51,1.25,16928,United Kingdom
556791,22774,RED DRAWER KNOB ACRYLIC EDWARDIAN,8,6/14/2011 13:51,1.25,16928,United Kingdom
556791,22771,CLEAR DRAWER KNOB ACRYLIC EDWARDIAN,24,6/14/2011 13:51,1.25,16928,United Kingdom
556791,21670,BLUE SPOT CERAMIC DRAWER KNOB,6,6/14/2011 13:51,1.25,16928,United Kingdom
556791,21669,BLUE STRIPE CERAMIC DRAWER KNOB,6,6/14/2011 13:51,1.25,16928,United Kingdom
556791,22775,PURPLE DRAWERKNOB ACRYLIC EDWARDIAN,24,6/14/2011 13:51,1.25,16928,United Kingdom
556791,22772,PINK DRAWER KNOB ACRYLIC EDWARDIAN,24,6/14/2011 13:51,1.25,16928,United Kingdom
556792,84755,COLOUR GLASS T-LIGHT HOLDER HANGING,64,6/14/2011 13:52,0.65,17043,United Kingdom
556792,21499,BLUE POLKADOT WRAP,25,6/14/2011 13:52,0.42,17043,United Kingdom
556792,21500,PINK POLKADOT WRAP ,25,6/14/2011 13:52,0.42,17043,United Kingdom
556792,21506,"FANCY FONT BIRTHDAY CARD, ",12,6/14/2011 13:52,0.42,17043,United Kingdom
556792,22714,CARD BIRTHDAY COWBOY,12,6/14/2011 13:52,0.42,17043,United Kingdom
556792,22723,SET OF 6 HERB TINS SKETCHBOOK,1,6/14/2011 13:52,3.95,17043,United Kingdom
556792,21509,COWBOYS AND INDIANS BIRTHDAY CARD ,12,6/14/2011 13:52,0.42,17043,United Kingdom
556792,21891,TRADITIONAL WOODEN SKIPPING ROPE,1,6/14/2011 13:52,1.45,17043,United Kingdom
556792,62018,SOMBRERO ,3,6/14/2011 13:52,1.95,17043,United Kingdom
556792,84673B,BLUE FLY SWAT,1,6/14/2011 13:52,0.65,17043,United Kingdom
556792,21329,DINOSAURS  WRITING SET ,1,6/14/2011 13:52,1.65,17043,United Kingdom
556792,22544,MINI JIGSAW SPACEBOY,10,6/14/2011 13:52,0.42,17043,United Kingdom
556792,22543,MINI JIGSAW BAKE A CAKE ,10,6/14/2011 13:52,0.42,17043,United Kingdom
556792,21689,SILVER VANILLA  FLOWER CANDLE POT,10,6/14/2011 13:52,3.75,17043,United Kingdom
556792,22185,SLATE TILE NATURAL HANGING,8,6/14/2011 13:52,1.65,17043,United Kingdom
C556793,22697,GREEN REGENCY TEACUP AND SAUCER,-1,6/14/2011 13:54,2.95,12818,Austria
C556793,22357,KINGS CHOICE BISCUIT TIN,-5,6/14/2011 13:54,4.25,12818,Austria
556794,84755,COLOUR GLASS T-LIGHT HOLDER HANGING,144,6/14/2011 14:06,0.55,13720,United Kingdom
556794,21115,ROSE CARAVAN DOORSTOP,2,6/14/2011 14:06,6.75,13720,United Kingdom
556794,21411,GINGHAM HEART  DOORSTOP RED,3,6/14/2011 14:06,4.25,13720,United Kingdom
556794,23444,Next Day Carriage,1,6/14/2011 14:06,15,13720,United Kingdom
556795,23078,ICE CREAM PEN LIP GLOSS ,24,6/14/2011 14:29,1.25,15912,United Kingdom
556795,84536B,FAIRY CAKES NOTEBOOK A7 SIZE,23,6/14/2011 14:29,0.42,15912,United Kingdom
556795,21499,BLUE POLKADOT WRAP,25,6/14/2011 14:29,0.42,15912,United Kingdom
556795,37449,CERAMIC CAKE STAND + HANGING CAKES,1,6/14/2011 14:29,9.95,15912,United Kingdom
556795,47559B,TEA TIME OVEN GLOVE,23,6/14/2011 14:29,1.25,15912,United Kingdom
556795,37448,CERAMIC CAKE DESIGN SPOTTED MUG,23,6/14/2011 14:29,1.49,15912,United Kingdom
C556796,D,Discount,-96,6/14/2011 14:40,0.7,16013,United Kingdom
556797,23012,GLASS APOTHECARY BOTTLE PERFUME,4,6/14/2011 14:49,3.95,17101,United Kingdom
556797,23014,GLASS APOTHECARY BOTTLE ELIXIR,4,6/14/2011 14:49,3.95,17101,United Kingdom
556797,23013,GLASS APOTHECARY BOTTLE TONIC,4,6/14/2011 14:49,3.95,17101,United Kingdom
556797,23096,PETIT TRAY CHIC,12,6/14/2011 14:49,1.65,17101,United Kingdom
556797,23177,TREASURE ISLAND BOOK BOX,8,6/14/2011 14:49,2.25,17101,United Kingdom
556797,23176,ABC TREASURE BOOK BOX ,8,6/14/2011 14:49,2.25,17101,United Kingdom
556797,22197,SMALL POPCORN HOLDER,12,6/14/2011 14:49,0.85,17101,United Kingdom
556797,23201,JUMBO BAG ALPHABET,10,6/14/2011 14:49,1.95,17101,United Kingdom
556797,23207,LUNCH BAG ALPHABET DESIGN,10,6/14/2011 14:49,1.65,17101,United Kingdom
556797,22629,SPACEBOY LUNCH BOX ,12,6/14/2011 14:49,1.95,17101,United Kingdom
556797,22029,SPACEBOY BIRTHDAY CARD,12,6/14/2011 14:49,0.42,17101,United Kingdom
556797,21506,"FANCY FONT BIRTHDAY CARD, ",12,6/14/2011 14:49,0.42,17101,United Kingdom
556797,22917,HERB MARKER ROSEMARY,12,6/14/2011 14:49,0.65,17101,United Kingdom
556797,22918,HERB MARKER PARSLEY,12,6/14/2011 14:49,0.65,17101,United Kingdom
556797,22920,HERB MARKER BASIL,12,6/14/2011 14:49,0.65,17101,United Kingdom
556797,22919,HERB MARKER MINT,12,6/14/2011 14:49,0.65,17101,United Kingdom
556797,23080,RED METAL BOX TOP SECRET,2,6/14/2011 14:49,8.25,17101,United Kingdom
556803,21327,SKULLS WRITING SET ,3,6/14/2011 14:57,2.46,,United Kingdom
556803,21452,TOADSTOOL MONEY BOX,3,6/14/2011 14:57,4.96,,United Kingdom
556803,21556,CERAMIC STRAWBERRY MONEY BOX,2,6/14/2011 14:57,4.13,,United Kingdom
556803,21670,BLUE SPOT CERAMIC DRAWER KNOB,1,6/14/2011 14:57,3.29,,United Kingdom
556803,21671,RED SPOT CERAMIC DRAWER KNOB,1,6/14/2011 14:57,3.29,,United Kingdom
556803,21673,WHITE SPOT BLUE CERAMIC DRAWER KNOB,13,6/14/2011 14:57,2.46,,United Kingdom
556803,21976,PACK OF 60 MUSHROOM CAKE CASES,1,6/14/2011 14:57,2.08,,United Kingdom
556803,22068,BLACK PIRATE TREASURE CHEST,3,6/14/2011 14:57,4.13,,United Kingdom
556803,22112,CHOCOLATE HOT WATER BOTTLE,4,6/14/2011 14:57,12.46,,United Kingdom
556803,22174,PHOTO CUBE,3,6/14/2011 14:57,4.13,,United Kingdom
556803,22327,ROUND SNACK BOXES SET OF 4 SKULLS,2,6/14/2011 14:57,6.63,,United Kingdom
556803,22328,ROUND SNACK BOXES SET OF 4 FRUITS ,1,6/14/2011 14:57,4.13,,United Kingdom
556803,22355,CHARLOTTE BAG SUKI DESIGN,49,6/14/2011 14:57,2.46,,United Kingdom
556803,22356,CHARLOTTE BAG PINK POLKADOT,11,6/14/2011 14:57,2.46,,United Kingdom
556803,22367,CHILDRENS APRON SPACEBOY DESIGN,2,6/14/2011 14:57,4.96,,United Kingdom
556803,22377,BOTTLE BAG RETROSPOT ,1,6/14/2011 14:57,4.13,,United Kingdom
556803,22380,TOY TIDY SPACEBOY  ,2,6/14/2011 14:57,4.13,,United Kingdom
556803,22382,LUNCH BAG SPACEBOY DESIGN ,2,6/14/2011 14:57,4.96,,United Kingdom
556803,22383,LUNCH BAG SUKI DESIGN ,4,6/14/2011 14:57,4.96,,United Kingdom
556803,22384,LUNCH BAG PINK POLKADOT,1,6/14/2011 14:57,4.96,,United Kingdom
556803,22423,REGENCY CAKESTAND 3 TIER,4,6/14/2011 14:57,24.96,,United Kingdom
556803,22549,PICTURE DOMINOES,4,6/14/2011 14:57,2.46,,United Kingdom
556803,22553,PLASTERS IN TIN SKULLS,2,6/14/2011 14:57,3.29,,United Kingdom
556803,22557,PLASTERS IN TIN VINTAGE PAISLEY ,1,6/14/2011 14:57,3.29,,United Kingdom
556803,22631,CIRCUS PARADE LUNCH BOX ,1,6/14/2011 14:57,3.29,,United Kingdom
556803,22644,CERAMIC CHERRY CAKE MONEY BANK,1,6/14/2011 14:57,4.13,,United Kingdom
556803,22645,CERAMIC HEART FAIRY CAKE MONEY BANK,7,6/14/2011 14:57,4.13,,United Kingdom
556803,22646,CERAMIC STRAWBERRY CAKE MONEY BANK,2,6/14/2011 14:57,4.13,,United Kingdom
556803,22665,RECIPE BOX BLUE SKETCHBOOK DESIGN,3,6/14/2011 14:57,6.63,,United Kingdom
556803,22666,RECIPE BOX PANTRY YELLOW DESIGN,6,6/14/2011 14:57,6.63,,United Kingdom
556803,22727,ALARM CLOCK BAKELIKE RED ,2,6/14/2011 14:57,8.29,,United Kingdom
556803,22728,ALARM CLOCK BAKELIKE PINK,1,6/14/2011 14:57,8.29,,United Kingdom
556803,22774,RED DRAWER KNOB ACRYLIC EDWARDIAN,6,6/14/2011 14:57,2.46,,United Kingdom
556803,22805,BLUE DRAWER KNOB ACRYLIC EDWARDIAN,1,6/14/2011 14:57,2.46,,United Kingdom
556803,22835,HOT WATER BOTTLE I AM SO POORLY,3,6/14/2011 14:57,7.46,,United Kingdom
556803,22910,PAPER CHAIN KIT VINTAGE CHRISTMAS,1,6/14/2011 14:57,6.63,,United Kingdom
556803,23204,CHARLOTTE BAG APPLES DESIGN,8,6/14/2011 14:57,2.46,,United Kingdom
556803,23205,CHARLOTTE BAG VINTAGE ALPHABET ,7,6/14/2011 14:57,2.46,,United Kingdom
556803,23298,SPOTTY BUNTING,13,6/14/2011 14:57,10.79,,United Kingdom
556803,47566,PARTY BUNTING,46,6/14/2011 14:57,10.79,,United Kingdom
556803,48187,DOORMAT NEW ENGLAND,1,6/14/2011 14:57,12.46,,United Kingdom
556803,79321,CHILLI LIGHTS,5,6/14/2011 14:57,12.46,,United Kingdom
556803,82583,HOT BATHS METAL SIGN,5,6/14/2011 14:57,4.96,,United Kingdom
556803,84989a,75 GREEN FAIRY CAKE CASES,2,6/14/2011 14:57,2.08,,United Kingdom
556803,84997b,CHILDRENS CUTLERY RETROSPOT RED ,1,6/14/2011 14:57,8.29,,United Kingdom
556803,84997c,CHILDRENS CUTLERY POLKADOT BLUE,14,6/14/2011 14:57,8.29,,United Kingdom
556803,84997d,CHILDRENS CUTLERY POLKADOT PINK,7,6/14/2011 14:57,8.29,,United Kingdom
556803,85049g,CHOCOLATE BOX RIBBONS ,1,6/14/2011 14:57,2.46,,United Kingdom
556803,20675,BLUE POLKADOT BOWL,2,6/14/2011 14:57,2.46,,United Kingdom
556803,20677,PINK POLKADOT BOWL,4,6/14/2011 14:57,2.46,,United Kingdom
556803,20719,WOODLAND CHARLOTTE BAG,22,6/14/2011 14:57,2.46,,United Kingdom
556803,20723,STRAWBERRY CHARLOTTE BAG,19,6/14/2011 14:57,2.46,,United Kingdom
556803,20724,RED RETROSPOT CHARLOTTE BAG,27,6/14/2011 14:57,2.46,,United Kingdom
556803,20725,LUNCH BAG RED RETROSPOT,16,6/14/2011 14:57,4.96,,United Kingdom
556803,20726,LUNCH BAG WOODLAND,9,6/14/2011 14:57,4.96,,United Kingdom
556803,20727,LUNCH BAG  BLACK SKULL.,9,6/14/2011 14:57,4.96,,United Kingdom
556803,20728,LUNCH BAG CARS BLUE,16,6/14/2011 14:57,4.96,,United Kingdom
556803,20966,SANDWICH BATH SPONGE,1,6/14/2011 14:57,2.46,,United Kingdom
556803,21041,RED RETROSPOT OVEN GLOVE DOUBLE,4,6/14/2011 14:57,6.63,,United Kingdom
556803,21082,SET/20 FRUIT SALAD PAPER NAPKINS ,2,6/14/2011 14:57,1.63,,United Kingdom
556803,21154,RED RETROSPOT OVEN GLOVE ,2,6/14/2011 14:57,3.29,,United Kingdom
556803,21155,RED RETROSPOT PEG BAG,7,6/14/2011 14:57,4.96,,United Kingdom
556803,21212,PACK OF 72 RETROSPOT CAKE CASES,10,6/14/2011 14:57,2.08,,United Kingdom
556803,21213,PACK OF 72 SKULL CAKE CASES,12,6/14/2011 14:57,2.08,,United Kingdom
556803,21232,STRAWBERRY CERAMIC TRINKET BOX,22,6/14/2011 14:57,3.29,,United Kingdom
556803,21238,RED RETROSPOT CUP,1,6/14/2011 14:57,1.63,,United Kingdom
556803,21239,PINK  POLKADOT CUP,2,6/14/2011 14:57,1.63,,United Kingdom
556803,21240,BLUE POLKADOT CUP,2,6/14/2011 14:57,1.63,,United Kingdom
556803,21242,RED RETROSPOT PLATE ,1,6/14/2011 14:57,3.29,,United Kingdom
556803,21243,PINK  POLKADOT PLATE ,4,6/14/2011 14:57,3.29,,United Kingdom
556803,21244,BLUE POLKADOT PLATE ,1,6/14/2011 14:57,3.29,,United Kingdom
556804,23108,SET OF 10 LED DOLLY LIGHTS,12,6/14/2011 15:14,5.39,15125,United Kingdom
556804,22993,SET OF 4 PANTRY JELLY MOULDS,72,6/14/2011 15:14,1.06,15125,United Kingdom
556804,22558,CLOTHES PEGS RETROSPOT PACK 24 ,48,6/14/2011 15:14,1.45,15125,United Kingdom
556804,22457,NATURAL SLATE HEART CHALKBOARD ,18,6/14/2011 15:14,2.95,15125,United Kingdom
556804,22423,REGENCY CAKESTAND 3 TIER,2,6/14/2011 15:14,12.75,15125,United Kingdom
556804,22197,SMALL POPCORN HOLDER,100,6/14/2011 15:14,0.72,15125,United Kingdom
556804,21533,RETROSPOT LARGE MILK JUG,12,6/14/2011 15:14,4.25,15125,United Kingdom
556804,21524,DOORMAT SPOTTY HOME SWEET HOME,10,6/14/2011 15:14,6.75,15125,United Kingdom
556804,21174,POTTERING IN THE SHED METAL SIGN,24,6/14/2011 15:14,2.08,15125,United Kingdom
556804,20718,RED RETROSPOT SHOPPER BAG,20,6/14/2011 15:14,1.25,15125,United Kingdom
556805,23306,SET OF 36 DOILIES PANTRY DESIGN,24,6/14/2011 15:15,1.45,15125,United Kingdom
556805,20713,JUMBO BAG OWLS,100,6/14/2011 15:15,1.79,15125,United Kingdom
556806,23229,DONKEY TAIL GAME ,36,6/14/2011 15:16,3.39,15125,United Kingdom
C556807,POST,POSTAGE,-1,6/14/2011 15:43,14.95,,United Kingdom
C556807,M,Manual,-1,6/14/2011 15:43,91.58,,United Kingdom
556808,23050,RECYCLED ACAPULCO MAT GREEN,2,6/14/2011 15:45,8.25,17749,United Kingdom
556808,23148,MINIATURE ANTIQUE ROSE HOOK IVORY,12,6/14/2011 15:45,0.83,17749,United Kingdom
556808,23283,DOORMAT VINTAGE LEAVES DESIGN ,2,6/14/2011 15:45,7.95,17749,United Kingdom
556808,23284,DOORMAT KEEP CALM AND COME IN,2,6/14/2011 15:45,7.95,17749,United Kingdom
556808,23112,PARISIENNE CURIO CABINET,2,6/14/2011 15:45,7.5,17749,United Kingdom
556808,85066,CREAM SWEETHEART MINI CHEST,2,6/14/2011 15:45,12.75,17749,United Kingdom
556808,23047,PAPER LANTERN 5 POINT SEQUIN STAR,2,6/14/2011 15:45,5.75,17749,United Kingdom
556808,47566,PARTY BUNTING,16,6/14/2011 15:45,4.95,17749,United Kingdom
556808,21715,GIRLS VINTAGE TIN SEASIDE BUCKET,8,6/14/2011 15:45,2.55,17749,United Kingdom
556808,21716,BOYS VINTAGE TIN SEASIDE BUCKET,8,6/14/2011 15:45,2.55,17749,United Kingdom
556808,23253,16 PIECE CUTLERY SET PANTRY DESIGN,2,6/14/2011 15:45,15.95,17749,United Kingdom
556808,22423,REGENCY CAKESTAND 3 TIER,2,6/14/2011 15:45,12.75,17749,United Kingdom
556808,22427,ENAMEL FLOWER JUG CREAM,3,6/14/2011 15:45,5.95,17749,United Kingdom
556809,22537,MAGIC DRAWING SLATE DINOSAUR,1,6/14/2011 16:48,0.42,17179,United Kingdom
556809,22970,LONDON BUS COFFEE MUG,6,6/14/2011 16:48,2.55,17179,United Kingdom
556809,22971,QUEENS GUARD COFFEE MUG,6,6/14/2011 16:48,2.55,17179,United Kingdom
556809,22754,SMALL RED BABUSHKA NOTEBOOK ,2,6/14/2011 16:48,0.85,17179,United Kingdom
556809,22755,SMALL PURPLE BABUSHKA NOTEBOOK ,2,6/14/2011 16:48,0.85,17179,United Kingdom
556809,23206,LUNCH BAG APPLE DESIGN,1,6/14/2011 16:48,1.65,17179,United Kingdom
556809,22066,LOVE HEART TRINKET POT,4,6/14/2011 16:48,0.39,17179,United Kingdom
556809,23209,LUNCH BAG DOILEY PATTERN ,1,6/14/2011 16:48,1.65,17179,United Kingdom
556809,21890,S/6 WOODEN SKITTLES IN COTTON BAG,1,6/14/2011 16:48,3.25,17179,United Kingdom
556809,22619,SET OF 6 SOLDIER SKITTLES,1,6/14/2011 16:48,3.75,17179,United Kingdom
556809,84997C,CHILDRENS CUTLERY POLKADOT BLUE,7,6/14/2011 16:48,4.15,17179,United Kingdom
556809,84997D,CHILDRENS CUTLERY POLKADOT PINK,10,6/14/2011 16:48,4.15,17179,United Kingdom
556809,84997A,CHILDRENS CUTLERY POLKADOT GREEN ,5,6/14/2011 16:48,4.15,17179,United Kingdom
556809,23256,CHILDRENS CUTLERY SPACEBOY ,10,6/14/2011 16:48,4.15,17179,United Kingdom
556809,22977,DOLLY GIRL CHILDRENS EGG CUP,3,6/14/2011 16:48,1.25,17179,United Kingdom
556809,22976,CIRCUS PARADE CHILDRENS EGG CUP ,3,6/14/2011 16:48,1.25,17179,United Kingdom
556809,22975,SPACEBOY CHILDRENS EGG CUP,3,6/14/2011 16:48,1.25,17179,United Kingdom
556809,20828,GLITTER BUTTERFLY CLIPS,5,6/14/2011 16:48,2.55,17179,United Kingdom
556809,20829,GLITTER HANGING BUTTERFLY STRING,5,6/14/2011 16:48,2.1,17179,United Kingdom
556809,22972,CHILDREN'S SPACEBOY MUG,3,6/14/2011 16:48,1.65,17179,United Kingdom
556809,22974,CHILDRENS DOLLY GIRL MUG,3,6/14/2011 16:48,1.65,17179,United Kingdom
556810,11001,ASSTD DESIGN RACING CAR PEN,1,6/14/2011 16:50,1.69,,United Kingdom
556811,37340,MULTICOLOUR SPRING FLOWER MUG,48,6/14/2011 16:52,0.39,14997,United Kingdom
556811,84857C,PINK MONTE CARLO HANDBAG,24,6/14/2011 16:52,1.95,14997,United Kingdom
556811,21382,SET/4 SPRING FLOWER DECORATION,36,6/14/2011 16:52,0.75,14997,United Kingdom
556811,85212,MINI PAINTED GARDEN DECORATION ,48,6/14/2011 16:52,0.29,14997,United Kingdom
556811,20996,JAZZ HEARTS ADDRESS BOOK,24,6/14/2011 16:52,0.19,14997,United Kingdom
556811,20992,JAZZ HEARTS PURSE NOTEBOOK,24,6/14/2011 16:52,0.39,14997,United Kingdom
556811,21634,ASSORTED MINI MADRAS NOTEBOOK,24,6/14/2011 16:52,0.39,14997,United Kingdom
556811,22066,LOVE HEART TRINKET POT,48,6/14/2011 16:52,0.39,14997,United Kingdom
556811,22609,PENS ASSORTED SPACEBALL,36,6/14/2011 16:52,0.19,14997,United Kingdom
556812,21086,SET/6 RED SPOTTY PAPER CUPS,2,6/14/2011 17:25,1.63,,United Kingdom
556812,21090,SET/6 COLLAGE PAPER PLATES,1,6/14/2011 17:25,0.83,,United Kingdom
556812,21094,SET/6 RED SPOTTY PAPER PLATES,2,6/14/2011 17:25,0.83,,United Kingdom
556812,21098,CHRISTMAS TOILET ROLL,1,6/14/2011 17:25,2.46,,United Kingdom
556812,21114,LAVENDER SCENTED FABRIC HEART,1,6/14/2011 17:25,10.79,,United Kingdom
556812,21137,BLACK RECORD COVER FRAME,1,6/14/2011 17:25,7.46,,United Kingdom
556812,21165,BEWARE OF THE CAT METAL SIGN ,1,6/14/2011 17:25,4.13,,United Kingdom
556812,21166,COOK WITH WINE METAL SIGN ,1,6/14/2011 17:25,4.13,,United Kingdom
556812,21169,YOU'RE CONFUSING ME METAL SIGN ,1,6/14/2011 17:25,4.13,,United Kingdom
556812,21172,PARTY METAL SIGN ,1,6/14/2011 17:25,4.13,,United Kingdom
556812,21175,GIN + TONIC DIET METAL SIGN,2,6/14/2011 17:25,4.96,,United Kingdom
556812,21179,NO JUNK MAIL METAL SIGN,2,6/14/2011 17:25,1.63,,United Kingdom
556812,21201,TROPICAL  HONEYCOMB PAPER GARLAND ,2,6/14/2011 17:25,4.96,,United Kingdom
556812,21212,PACK OF 72 RETROSPOT CAKE CASES,2,6/14/2011 17:25,1.25,,United Kingdom
556812,21231,SWEETHEART CERAMIC TRINKET BOX,1,6/14/2011 17:25,2.46,,United Kingdom
556812,21262,WHITE GOOSE FEATHER CHRISTMAS TREE ,1,6/14/2011 17:25,7.46,,United Kingdom
556812,21289,LARGE STRIPES CHOCOLATE GIFT BAG,4,6/14/2011 17:25,1.25,,United Kingdom
556812,21314,SMALL GLASS HEART TRINKET POT,1,6/14/2011 17:25,4.13,,United Kingdom
556812,21326,AGED GLASS SILVER T-LIGHT HOLDER,5,6/14/2011 17:25,1.63,,United Kingdom
556812,21356,TOAST ITS - FAIRY FLOWER,1,6/14/2011 17:25,2.46,,United Kingdom
556812,21358,TOAST ITS - HAPPY BIRTHDAY,1,6/14/2011 17:25,2.46,,United Kingdom
556812,21383,PACK OF 12 STICKY BUNNIES,1,6/14/2011 17:25,1.63,,United Kingdom
556812,21390,FILIGRIS HEART WITH BUTTERFLY,1,6/14/2011 17:25,2.46,,United Kingdom
556812,21403,BLUE EGG  SPOON,6,6/14/2011 17:25,0.42,,United Kingdom
556812,21447,12 IVORY ROSE PEG PLACE SETTINGS,1,6/14/2011 17:25,2.46,,United Kingdom
556812,21452,TOADSTOOL MONEY BOX,2,6/14/2011 17:25,5.79,,United Kingdom
556812,21454,PAINTED PINK RABBIT ,1,6/14/2011 17:25,0.83,,United Kingdom
556812,21504,SKULLS GREETING CARD,1,6/14/2011 17:25,0.83,,United Kingdom
556812,21506,"FANCY FONT BIRTHDAY CARD, ",1,6/14/2011 17:25,0.83,,United Kingdom
556812,21523,DOORMAT FANCY FONT HOME SWEET HOME,1,6/14/2011 17:25,15.79,,United Kingdom
556812,21539,RED RETROSPOT BUTTER DISH,2,6/14/2011 17:25,9.96,,United Kingdom
556812,21672,WHITE SPOT RED CERAMIC DRAWER KNOB,7,6/14/2011 17:25,3.29,,United Kingdom
556812,21755,LOVE BUILDING BLOCK WORD,1,6/14/2011 17:25,12.46,,United Kingdom
556812,21773,DECORATIVE ROSE BATHROOM BOTTLE,6,6/14/2011 17:25,2.46,,United Kingdom
556812,21786,POLKADOT RAIN HAT ,2,6/14/2011 17:25,0.83,,United Kingdom
556812,21787,RAIN PONCHO RETROSPOT,3,6/14/2011 17:25,1.63,,United Kingdom
556812,21790,VINTAGE SNAP CARDS,6,6/14/2011 17:25,1.63,,United Kingdom
556812,21791,VINTAGE HEADS AND TAILS CARD GAME ,1,6/14/2011 17:25,2.46,,United Kingdom
556812,21864,UNION JACK FLAG PASSPORT COVER ,1,6/14/2011 17:25,4.13,,United Kingdom
556812,21877,HOME SWEET HOME MUG,3,6/14/2011 17:25,3.29,,United Kingdom
556812,21894,POTTING SHED SEED ENVELOPES,1,6/14/2011 17:25,2.46,,United Kingdom
556812,21900,"KEY FOB , SHED",1,6/14/2011 17:25,1.63,,United Kingdom
556812,21905,MORE BUTTER METAL SIGN ,1,6/14/2011 17:25,1.63,,United Kingdom
556812,21932,SCANDINAVIAN PAISLEY PICNIC BAG,4,6/14/2011 17:25,2.46,,United Kingdom
556812,21933,PINK VINTAGE PAISLEY PICNIC BAG,1,6/14/2011 17:25,2.46,,United Kingdom
556812,21934,SKULL SHOULDER BAG,2,6/14/2011 17:25,3.29,,United Kingdom
556812,21935,SUKI  SHOULDER BAG,1,6/14/2011 17:25,3.29,,United Kingdom
556812,21990,MODERN FLORAL STATIONERY SET,1,6/14/2011 17:25,2.46,,United Kingdom
556812,21991,BOHEMIAN COLLAGE STATIONERY SET,2,6/14/2011 17:25,2.46,,United Kingdom
556812,21992,VINTAGE PAISLEY STATIONERY SET,4,6/14/2011 17:25,2.46,,United Kingdom
556812,21993,FLORAL FOLK STATIONERY SET,3,6/14/2011 17:25,2.46,,United Kingdom
556812,22023,EMPIRE BIRTHDAY CARD,1,6/14/2011 17:25,0.83,,United Kingdom
556812,22064,PINK DOUGHNUT TRINKET POT ,1,6/14/2011 17:25,3.29,,United Kingdom
556812,22086,PAPER CHAIN KIT 50'S CHRISTMAS ,1,6/14/2011 17:25,5.79,,United Kingdom
556812,22109,FULL ENGLISH BREAKFAST PLATE,1,6/14/2011 17:25,7.46,,United Kingdom
556812,22116,METAL SIGN HIS DINNER IS SERVED,1,6/14/2011 17:25,1.63,,United Kingdom
556812,22129,PARTY CONES CANDY TREE DECORATION,1,6/14/2011 17:25,8.29,,United Kingdom
556812,22133,PINK LOVE HEART SHAPE CUP,1,6/14/2011 17:25,1.63,,United Kingdom
556812,22154,ANGEL DECORATION 3 BUTTONS ,4,6/14/2011 17:25,0.83,,United Kingdom
556812,22155,STAR DECORATION RUSTIC,4,6/14/2011 17:25,0.83,,United Kingdom
556812,22156,HEART DECORATION WITH PEARLS ,2,6/14/2011 17:25,1.63,,United Kingdom
556812,22163,HEART STRING MEMO HOLDER HANGING,2,6/14/2011 17:25,3.29,,United Kingdom
556812,22169,FAMILY ALBUM WHITE PICTURE FRAME,1,6/14/2011 17:25,16.63,,United Kingdom
556812,22178,VICTORIAN GLASS HANGING T-LIGHT,20,6/14/2011 17:25,2.46,,United Kingdom
556812,22182,CAKE STAND VICTORIAN FILIGREE SMALL,1,6/14/2011 17:25,4.13,,United Kingdom
556812,22185,SLATE TILE NATURAL HANGING,1,6/14/2011 17:25,3.29,,United Kingdom
556812,22196,SMALL HEART MEASURING SPOONS,1,6/14/2011 17:25,1.63,,United Kingdom
556812,22219,LOVEBIRD HANGING DECORATION WHITE ,3,6/14/2011 17:25,1.63,,United Kingdom
556812,22223,CAKE PLATE LOVEBIRD PINK,30,6/14/2011 17:25,9.96,,United Kingdom
556812,22249,DECORATION WHITE CHICK MAGIC GARDEN,1,6/14/2011 17:25,1.63,,United Kingdom
556812,22250,DECORATION  BUTTERFLY  MAGIC GARDEN,1,6/14/2011 17:25,1.63,,United Kingdom
556812,22268,DECORATION SITTING BUNNY,2,6/14/2011 17:25,0.63,,United Kingdom
556812,22269,EGG CUP NATURAL CHICKEN,5,6/14/2011 17:25,0.83,,United Kingdom
556812,22295,HEART FILIGREE DOVE LARGE,1,6/14/2011 17:25,3.29,,United Kingdom
556812,22296,HEART IVORY TRELLIS LARGE,1,6/14/2011 17:25,3.29,,United Kingdom
556812,22315,200 RED + WHITE BENDY STRAWS,2,6/14/2011 17:25,2.46,,United Kingdom
556812,22331,WOODLAND PARTY BAG + STICKER SET,1,6/14/2011 17:25,3.29,,United Kingdom
