559164,21080,SET/20 RED RETROSPOT PAPER NAPKINS ,96,7/6/2011 16:39,0.72,16422,United Kingdom
559164,20974,12 PENCILS SMALL TUBE SKULL,48,7/6/2011 16:39,0.65,16422,United Kingdom
559164,21380,WOODEN HAPPY BIRTHDAY GARLAND,6,7/6/2011 16:39,2.95,16422,United Kingdom
559164,22083,PAPER CHAIN KIT RETROSPOT,40,7/6/2011 16:39,2.55,16422,United Kingdom
559164,22090,PAPER BUNTING RETROSPOT,120,7/6/2011 16:39,2.55,16422,United Kingdom
559165,22624,IVORY KITCHEN SCALES,1,7/6/2011 16:40,8.5,12977,United Kingdom
559165,21758,VINTAGE SHELLS PRINT,1,7/6/2011 16:40,6.45,12977,United Kingdom
559165,21900,"KEY FOB , SHED",1,7/6/2011 16:40,0.65,12977,United Kingdom
559165,21902,"KEY FOB , FRONT  DOOR ",1,7/6/2011 16:40,0.65,12977,United Kingdom
559165,21901,"KEY FOB , BACK DOOR ",1,7/6/2011 16:40,0.65,12977,United Kingdom
559165,37489A,YELLOW/PINK FLOWER DESIGN BIG MUG,2,7/6/2011 16:40,0.39,12977,United Kingdom
559165,37489B,BLUE/YELLOW FLOWER DESIGN BIG MUG,3,7/6/2011 16:40,0.39,12977,United Kingdom
559165,37489D,PINK/GREEN FLOWER DESIGN BIG MUG,1,7/6/2011 16:40,0.39,12977,United Kingdom
559165,21763,VINTAGE WOODEN BAR STOOL,1,7/6/2011 16:40,20,12977,United Kingdom
559166,16219,HOUSE SHAPE PENCIL SHARPENER,24,7/6/2011 16:53,0.06,,United Kingdom
559167,23306,SET OF 36 DOILIES PANTRY DESIGN,1,7/6/2011 16:54,1.45,17997,United Kingdom
559167,16161P,WRAP ENGLISH ROSE ,50,7/6/2011 16:54,0.42,17997,United Kingdom
559167,23172,REGENCY TEA PLATE PINK,48,7/6/2011 16:54,1.45,17997,United Kingdom
559167,23170,REGENCY TEA PLATE ROSES ,48,7/6/2011 16:54,1.45,17997,United Kingdom
559167,23171,REGENCY TEA PLATE GREEN ,48,7/6/2011 16:54,1.45,17997,United Kingdom
559167,23173,REGENCY TEAPOT ROSES ,12,7/6/2011 16:54,8.15,17997,United Kingdom
559167,23174,REGENCY SUGAR BOWL GREEN,24,7/6/2011 16:54,3.75,17997,United Kingdom
559167,22063,CERAMIC BOWL WITH STRAWBERRY DESIGN,4,7/6/2011 16:54,2.95,17997,United Kingdom
559167,23175,REGENCY MILK JUG PINK ,24,7/6/2011 16:54,2.75,17997,United Kingdom
559167,23202,JUMBO BAG VINTAGE LEAF,4,7/6/2011 16:54,2.08,17997,United Kingdom
559167,85099F,JUMBO BAG STRAWBERRY,4,7/6/2011 16:54,2.08,17997,United Kingdom
559167,23200,JUMBO BAG PEARS,3,7/6/2011 16:54,2.08,17997,United Kingdom
559167,23203,JUMBO BAG DOILEY PATTERNS,2,7/6/2011 16:54,2.08,17997,United Kingdom
559167,21928,JUMBO BAG SCANDINAVIAN BLUE PAISLEY,2,7/6/2011 16:54,2.08,17997,United Kingdom
559167,21929,JUMBO BAG PINK VINTAGE PAISLEY,2,7/6/2011 16:54,2.08,17997,United Kingdom
559168,21034,REX CASH+CARRY JUMBO SHOPPER,1,7/6/2011 17:05,0.95,13263,United Kingdom
559168,23284,DOORMAT KEEP CALM AND COME IN,1,7/6/2011 17:05,7.95,13263,United Kingdom
559168,22077,6 RIBBONS RUSTIC CHARM,5,7/6/2011 17:05,1.65,13263,United Kingdom
559168,22652,TRAVEL SEWING KIT,2,7/6/2011 17:05,1.65,13263,United Kingdom
559168,22363,GLASS JAR MARMALADE ,1,7/6/2011 17:05,2.95,13263,United Kingdom
559168,22363,GLASS JAR MARMALADE ,24,7/6/2011 17:05,2.55,13263,United Kingdom
559168,21873,IF YOU CAN'T STAND THE HEAT MUG,3,7/6/2011 17:05,1.25,13263,United Kingdom
559168,21871,SAVE THE PLANET MUG,3,7/6/2011 17:05,1.25,13263,United Kingdom
559168,23300,GARDENERS KNEELING PAD CUP OF TEA ,2,7/6/2011 17:05,1.65,13263,United Kingdom
559168,23301,GARDENERS KNEELING PAD KEEP CALM ,2,7/6/2011 17:05,1.65,13263,United Kingdom
559168,22723,SET OF 6 HERB TINS SKETCHBOOK,1,7/6/2011 17:05,3.95,13263,United Kingdom
559168,21165,BEWARE OF THE CAT METAL SIGN ,3,7/6/2011 17:05,1.69,13263,United Kingdom
559168,23236,DOILEY STORAGE TIN,2,7/6/2011 17:05,2.89,13263,United Kingdom
559168,21179,NO JUNK MAIL METAL SIGN,4,7/6/2011 17:05,0.39,13263,United Kingdom
559168,20725,LUNCH BAG RED RETROSPOT,1,7/6/2011 17:05,1.65,13263,United Kingdom
559168,22384,LUNCH BAG PINK POLKADOT,2,7/6/2011 17:05,1.65,13263,United Kingdom
559168,20914,SET/5 RED RETROSPOT LID GLASS BOWLS,1,7/6/2011 17:05,2.95,13263,United Kingdom
559168,21528,DAIRY MAID TRADITIONAL TEAPOT ,1,7/6/2011 17:05,6.95,13263,United Kingdom
559168,21933,PINK VINTAGE PAISLEY PICNIC BAG,2,7/6/2011 17:05,1.65,13263,United Kingdom
559168,21932,SCANDINAVIAN PAISLEY PICNIC BAG,3,7/6/2011 17:05,1.65,13263,United Kingdom
559168,22920,HERB MARKER BASIL,2,7/6/2011 17:05,0.65,13263,United Kingdom
559168,22919,HERB MARKER MINT,2,7/6/2011 17:05,0.65,13263,United Kingdom
559168,22917,HERB MARKER ROSEMARY,2,7/6/2011 17:05,0.65,13263,United Kingdom
559168,22918,HERB MARKER PARSLEY,2,7/6/2011 17:05,0.65,13263,United Kingdom
559168,22921,HERB MARKER CHIVES ,2,7/6/2011 17:05,0.65,13263,United Kingdom
559168,22916,HERB MARKER THYME,2,7/6/2011 17:05,0.65,13263,United Kingdom
559169,21495,SKULLS AND CROSSBONES WRAP,50,7/6/2011 17:25,0.42,16722,United Kingdom
559169,16161P,WRAP ENGLISH ROSE ,25,7/6/2011 17:25,0.42,16722,United Kingdom
559169,16161U,WRAP SUKI AND FRIENDS,50,7/6/2011 17:25,0.42,16722,United Kingdom
559169,16156S,WRAP PINK FAIRY CAKES ,50,7/6/2011 17:25,0.42,16722,United Kingdom
559169,21498,RED RETROSPOT WRAP ,50,7/6/2011 17:25,0.42,16722,United Kingdom
559169,21497,FANCY FONTS BIRTHDAY WRAP,50,7/6/2011 17:25,0.42,16722,United Kingdom
559169,21499,BLUE POLKADOT WRAP,50,7/6/2011 17:25,0.42,16722,United Kingdom
559169,22045,SPACEBOY GIFT WRAP,50,7/6/2011 17:25,0.42,16722,United Kingdom
559169,22704,WRAP RED APPLES ,50,7/6/2011 17:25,0.42,16722,United Kingdom
559169,22707,WRAP MONSTER FUN ,50,7/6/2011 17:25,0.42,16722,United Kingdom
559169,22050,PINK PAISLEY ROSE GIFT WRAP,25,7/6/2011 17:25,0.42,16722,United Kingdom
559169,22706,WRAP COWBOYS  ,50,7/6/2011 17:25,0.42,16722,United Kingdom
559169,22711,WRAP CIRCUS PARADE,25,7/6/2011 17:25,0.42,16722,United Kingdom
559169,22985,WRAP BILLBOARD FONTS DESIGN,50,7/6/2011 17:25,0.42,16722,United Kingdom
559169,23230,WRAP ALPHABET DESIGN,50,7/6/2011 17:25,0.42,16722,United Kingdom
559169,85132C,CHARLIE AND LOLA FIGURES TINS,12,7/6/2011 17:25,1.95,16722,United Kingdom
559169,20996,JAZZ HEARTS ADDRESS BOOK,24,7/6/2011 17:25,0.19,16722,United Kingdom
559170,22692,DOORMAT WELCOME TO OUR HOME,1,7/6/2011 17:31,7.95,16942,United Kingdom
559170,48187,DOORMAT NEW ENGLAND,1,7/6/2011 17:31,7.95,16942,United Kingdom
559170,23209,LUNCH BAG DOILEY PATTERN ,4,7/6/2011 17:31,1.65,16942,United Kingdom
559170,23208,LUNCH BAG VINTAGE LEAF DESIGN,2,7/6/2011 17:31,1.65,16942,United Kingdom
559170,22383,LUNCH BAG SUKI DESIGN ,3,7/6/2011 17:31,1.65,16942,United Kingdom
559170,20728,LUNCH BAG CARS BLUE,2,7/6/2011 17:31,1.65,16942,United Kingdom
559170,23207,LUNCH BAG ALPHABET DESIGN,1,7/6/2011 17:31,1.65,16942,United Kingdom
559170,20723,STRAWBERRY CHARLOTTE BAG,1,7/6/2011 17:31,0.85,16942,United Kingdom
559170,20727,LUNCH BAG  BLACK SKULL.,4,7/6/2011 17:31,1.65,16942,United Kingdom
559170,22384,LUNCH BAG PINK POLKADOT,3,7/6/2011 17:31,1.65,16942,United Kingdom
559170,20725,LUNCH BAG RED RETROSPOT,3,7/6/2011 17:31,1.65,16942,United Kingdom
559170,23200,JUMBO BAG PEARS,2,7/6/2011 17:31,2.08,16942,United Kingdom
559170,23199,JUMBO BAG APPLES,2,7/6/2011 17:31,2.08,16942,United Kingdom
559170,23203,JUMBO BAG DOILEY PATTERNS,4,7/6/2011 17:31,2.08,16942,United Kingdom
559170,22411,JUMBO SHOPPER VINTAGE RED PAISLEY,5,7/6/2011 17:31,2.08,16942,United Kingdom
559170,85099B,JUMBO BAG RED RETROSPOT,3,7/6/2011 17:31,2.08,16942,United Kingdom
559170,21931,JUMBO STORAGE BAG SUKI,4,7/6/2011 17:31,2.08,16942,United Kingdom
559170,23202,JUMBO BAG VINTAGE LEAF,3,7/6/2011 17:31,2.08,16942,United Kingdom
559170,22776,SWEETHEART CAKESTAND 3 TIER,1,7/6/2011 17:31,9.95,16942,United Kingdom
559170,22470,HEART OF WICKER LARGE,3,7/6/2011 17:31,2.95,16942,United Kingdom
559170,84879,ASSORTED COLOUR BIRD ORNAMENT,24,7/6/2011 17:31,1.69,16942,United Kingdom
559170,22469,HEART OF WICKER SMALL,4,7/6/2011 17:31,1.65,16942,United Kingdom
559170,23322,LARGE WHITE HEART OF WICKER,2,7/6/2011 17:31,2.95,16942,United Kingdom
559170,23321,SMALL WHITE HEART OF WICKER,4,7/6/2011 17:31,1.65,16942,United Kingdom
559171,22355,CHARLOTTE BAG SUKI DESIGN,10,7/7/2011 8:21,0.85,17651,United Kingdom
559171,21922,UNION STRIPE WITH FRINGE  HAMMOCK,2,7/7/2011 8:21,7.95,17651,United Kingdom
559171,22171,3 HOOK PHOTO SHELF ANTIQUE WHITE,2,7/7/2011 8:21,8.5,17651,United Kingdom
559171,22469,HEART OF WICKER SMALL,12,7/7/2011 8:21,1.65,17651,United Kingdom
559171,47566,PARTY BUNTING,4,7/7/2011 8:21,4.95,17651,United Kingdom
559171,85132C,CHARLIE AND LOLA FIGURES TINS,12,7/7/2011 8:21,1.95,17651,United Kingdom
559171,20725,LUNCH BAG RED RETROSPOT,10,7/7/2011 8:21,1.65,17651,United Kingdom
559171,20726,LUNCH BAG WOODLAND,10,7/7/2011 8:21,1.65,17651,United Kingdom
559171,22427,ENAMEL FLOWER JUG CREAM,3,7/7/2011 8:21,5.95,17651,United Kingdom
559171,21975,PACK OF 60 DINOSAUR CAKE CASES,24,7/7/2011 8:21,0.55,17651,United Kingdom
559171,23209,LUNCH BAG DOILEY PATTERN ,10,7/7/2011 8:21,1.65,17651,United Kingdom
559171,23203,JUMBO BAG DOILEY PATTERNS,10,7/7/2011 8:21,2.08,17651,United Kingdom
559171,20727,LUNCH BAG  BLACK SKULL.,10,7/7/2011 8:21,1.65,17651,United Kingdom
559171,85099C,JUMBO  BAG BAROQUE BLACK WHITE,10,7/7/2011 8:21,2.08,17651,United Kingdom
559171,23200,JUMBO BAG PEARS,10,7/7/2011 8:21,2.08,17651,United Kingdom
559171,22723,SET OF 6 HERB TINS SKETCHBOOK,4,7/7/2011 8:21,3.95,17651,United Kingdom
559171,23146,TRIPLE HOOK ANTIQUE IVORY ROSE,4,7/7/2011 8:21,3.29,17651,United Kingdom
559171,23245,SET OF 3 REGENCY CAKE TINS,4,7/7/2011 8:21,4.95,17651,United Kingdom
559171,21430,SET/3 RED GINGHAM ROSE STORAGE BOX,4,7/7/2011 8:21,3.75,17651,United Kingdom
559171,22384,LUNCH BAG PINK POLKADOT,10,7/7/2011 8:21,1.65,17651,United Kingdom
559171,22383,LUNCH BAG SUKI DESIGN ,10,7/7/2011 8:21,1.65,17651,United Kingdom
559171,22356,CHARLOTTE BAG PINK POLKADOT,10,7/7/2011 8:21,0.85,17651,United Kingdom
559171,20719,WOODLAND CHARLOTTE BAG,10,7/7/2011 8:21,0.85,17651,United Kingdom
559172,22427,ENAMEL FLOWER JUG CREAM,12,7/7/2011 8:22,5.45,17651,United Kingdom
559173,22350,ILLUSTRATED CAT BOWL ,6,7/7/2011 10:03,2.55,12540,Spain
559173,22089,PAPER BUNTING VINTAGE PAISLEY,6,7/7/2011 10:03,2.95,12540,Spain
559173,22634,CHILDS BREAKFAST SET SPACEBOY ,2,7/7/2011 10:03,9.95,12540,Spain
559173,23076,ICE CREAM SUNDAE LIP GLOSS,24,7/7/2011 10:03,1.25,12540,Spain
559173,22752,SET 7 BABUSHKA NESTING BOXES,2,7/7/2011 10:03,8.5,12540,Spain
559173,22755,SMALL PURPLE BABUSHKA NOTEBOOK ,12,7/7/2011 10:03,0.85,12540,Spain
559173,22712,CARD DOLLY GIRL ,12,7/7/2011 10:03,0.42,12540,Spain
559173,22029,SPACEBOY BIRTHDAY CARD,12,7/7/2011 10:03,0.42,12540,Spain
559173,16161U,WRAP SUKI AND FRIENDS,25,7/7/2011 10:03,0.42,12540,Spain
559173,16161P,WRAP ENGLISH ROSE ,25,7/7/2011 10:03,0.42,12540,Spain
559173,23243,SET OF TEA COFFEE SUGAR TINS PANTRY,4,7/7/2011 10:03,4.95,12540,Spain
559173,22699,ROSES REGENCY TEACUP AND SAUCER ,6,7/7/2011 10:03,2.95,12540,Spain
559173,21877,HOME SWEET HOME MUG,12,7/7/2011 10:03,1.25,12540,Spain
559173,23307,SET OF 60 PANTRY DESIGN CAKE CASES ,24,7/7/2011 10:03,0.55,12540,Spain
559173,22840,ROUND CAKE TIN VINTAGE RED,2,7/7/2011 10:03,7.95,12540,Spain
559173,22842,BISCUIT TIN VINTAGE RED,2,7/7/2011 10:03,6.75,12540,Spain
559173,23197,SKETCHBOOK MAGNETIC SHOPPING LIST,12,7/7/2011 10:03,1.45,12540,Spain
559173,23184,BULL DOG BOTTLE OPENER,4,7/7/2011 10:03,4.95,12540,Spain
559173,22915,ASSORTED BOTTLE TOP  MAGNETS ,12,7/7/2011 10:03,0.42,12540,Spain
559173,21524,DOORMAT SPOTTY HOME SWEET HOME,2,7/7/2011 10:03,7.95,12540,Spain
559173,48188,DOORMAT WELCOME PUPPIES,2,7/7/2011 10:03,7.95,12540,Spain
559173,85066,CREAM SWEETHEART MINI CHEST,2,7/7/2011 10:03,12.75,12540,Spain
559173,22776,SWEETHEART CAKESTAND 3 TIER,1,7/7/2011 10:03,9.95,12540,Spain
559173,22720,SET OF 3 CAKE TINS PANTRY DESIGN ,3,7/7/2011 10:03,4.95,12540,Spain
559173,POST,POSTAGE,2,7/7/2011 10:03,28,12540,Spain
559174,20616,CHERRY BLOSSOM PASSPORT COVER,20,7/7/2011 10:04,0.75,18263,United Kingdom
559174,20984,12 PENCILS TALL TUBE POSY,24,7/7/2011 10:04,0.29,18263,United Kingdom
559174,21932,SCANDINAVIAN PAISLEY PICNIC BAG,10,7/7/2011 10:04,1.65,18263,United Kingdom
559174,21933,PINK VINTAGE PAISLEY PICNIC BAG,10,7/7/2011 10:04,1.65,18263,United Kingdom
559174,22094,RED RETROSPOT TISSUE BOX,36,7/7/2011 10:04,0.39,18263,United Kingdom
559174,22092,BLUE PAISLEY TISSUE BOX,36,7/7/2011 10:04,0.39,18263,United Kingdom
559174,22093,MOTORING TISSUE BOX,36,7/7/2011 10:04,0.39,18263,United Kingdom
559174,22099,CARAVAN SQUARE TISSUE BOX,36,7/7/2011 10:04,0.39,18263,United Kingdom
559174,22608,PENS ASSORTED FUNKY JEWELED ,36,7/7/2011 10:04,0.19,18263,United Kingdom
559174,35648,VINTAGE BEAD PINK PURSE ,24,7/7/2011 10:04,0.83,18263,United Kingdom
559174,35651,VINTAGE BEAD PINK SCARF ,12,7/7/2011 10:04,1.65,18263,United Kingdom
559174,35646,VINTAGE BEAD PINK EVENING BAG,24,7/7/2011 10:04,1.25,18263,United Kingdom
559174,37327,ASSTD MULTICOLOUR CIRCLES MUG,48,7/7/2011 10:04,0.39,18263,United Kingdom
559174,37342,POLKADOT COFFEE CUP & SAUCER PINK,24,7/7/2011 10:04,0.79,18263,United Kingdom
559174,47503A,ASS FLORAL PRINT MULTI SCREWDRIVER,24,7/7/2011 10:04,0.42,18263,United Kingdom
559174,78124,MAGAZINE RACK GEBRA ASSORTED ,24,7/7/2011 10:04,1.25,18263,United Kingdom
559174,81952V,ROUND PURPLE CLOCK WITH SUCKER,20,7/7/2011 10:04,0.19,18263,United Kingdom
559174,82616B,FRAPPUCINO SCARF KNITTING KIT,24,7/7/2011 10:04,1.25,18263,United Kingdom
559174,81952B,ROUND BLUE CLOCK WITH SUCKER,20,7/7/2011 10:04,0.19,18263,United Kingdom
559174,82616C,MIDNIGHT GLAMOUR SCARF KNITTING KIT,24,7/7/2011 10:04,1.25,18263,United Kingdom
559174,84876D,BLUE HEART COMPACT MIRROR,24,7/7/2011 10:04,1.25,18263,United Kingdom
559174,84929,ASSTD FRUIT+FLOWERS FRIDGE MAGNETS,24,7/7/2011 10:04,0.19,18263,United Kingdom
559174,85019B,BLOSSOM  IMAGES NOTEBOOK SET,24,7/7/2011 10:04,1.25,18263,United Kingdom
559174,85111,SILVER GLITTER FLOWER VOTIVE HOLDER,36,7/7/2011 10:04,0.29,18263,United Kingdom
559174,85132C,CHARLIE AND LOLA FIGURES TINS,12,7/7/2011 10:04,1.95,18263,United Kingdom
559174,85183B,CHARLIE & LOLA WASTEPAPER BIN FLORA,12,7/7/2011 10:04,1.25,18263,United Kingdom
559174,85183A,CHARLIE & LOLA WASTEPAPER BIN BLUE,12,7/7/2011 10:04,1.25,18263,United Kingdom
559174,85211,S/4 GROOVY CAT MAGNETS,24,7/7/2011 10:04,0.79,18263,United Kingdom
559174,10133,COLOURING PENCILS BROWN TUBE,20,7/7/2011 10:04,0.42,18263,United Kingdom
559174,20615,BLUE POLKADOT PASSPORT COVER,20,7/7/2011 10:04,0.75,18263,United Kingdom
C559175,22960,JAM MAKING SET WITH JARS,-11,7/7/2011 10:17,4.25,12507,Spain
559185,21189,WHITE HONEYCOMB PAPER GARLAND ,12,7/7/2011 10:20,1.65,15512,United Kingdom
559187,22960,JAM MAKING SET WITH JARS,11,7/7/2011 10:20,4.25,12507,Spain
C559189,22232,JIGSAW TOADSTOOLS 3 PIECE,-16,7/7/2011 10:25,0.59,12626,Germany
C559189,22028,PENNY FARTHING BIRTHDAY CARD,-12,7/7/2011 10:25,0.42,12626,Germany
C559193,22659,LUNCH BOX I LOVE LONDON,-1,7/7/2011 10:26,1.95,12379,Belgium
559199,23239,SET OF 4 KNICK KNACK TINS POPPIES,12,7/7/2011 10:28,4.15,15288,United Kingdom
559199,23245,SET OF 3 REGENCY CAKE TINS,12,7/7/2011 10:28,4.95,15288,United Kingdom
559199,23285,PINK VINTAGE SPOT BEAKER,16,7/7/2011 10:28,0.85,15288,United Kingdom
559199,23288,GREEN VINTAGE SPOT BEAKER,16,7/7/2011 10:28,0.85,15288,United Kingdom
559199,23286,BLUE VINTAGE SPOT BEAKER,16,7/7/2011 10:28,0.85,15288,United Kingdom
559199,23287,RED VINTAGE SPOT BEAKER,16,7/7/2011 10:28,0.85,15288,United Kingdom
559199,23240,SET OF 4 KNICK KNACK TINS DOILEY ,12,7/7/2011 10:28,4.15,15288,United Kingdom
559199,23237,SET OF 4 KNICK KNACK TINS LEAF,24,7/7/2011 10:28,4.15,15288,United Kingdom
559199,23236,DOILEY STORAGE TIN,12,7/7/2011 10:28,2.89,15288,United Kingdom
559199,23235,STORAGE TIN VINTAGE LEAF,12,7/7/2011 10:28,2.89,15288,United Kingdom
559200,23240,SET OF 4 KNICK KNACK TINS DOILEY ,3,7/7/2011 10:36,4.15,13291,United Kingdom
559200,23239,SET OF 4 KNICK KNACK TINS POPPIES,2,7/7/2011 10:36,4.15,13291,United Kingdom
559200,22795,SWEETHEART RECIPE BOOK STAND,1,7/7/2011 10:36,6.75,13291,United Kingdom
559200,22776,SWEETHEART CAKESTAND 3 TIER,1,7/7/2011 10:36,9.95,13291,United Kingdom
559200,22964,3 PIECE SPACEBOY COOKIE CUTTER SET,1,7/7/2011 10:36,2.1,13291,United Kingdom
559200,84375,SET OF 20 KIDS COOKIE CUTTERS,1,7/7/2011 10:36,2.1,13291,United Kingdom
559200,21172,PARTY METAL SIGN ,2,7/7/2011 10:36,1.45,13291,United Kingdom
559200,22350,ILLUSTRATED CAT BOWL ,1,7/7/2011 10:36,2.55,13291,United Kingdom
559200,22702,BLACK AND WHITE CAT BOWL,1,7/7/2011 10:36,2.1,13291,United Kingdom
559200,84380,SET OF 3 BUTTERFLY COOKIE CUTTERS,1,7/7/2011 10:36,1.25,13291,United Kingdom
559200,22965,3 TRADITIONAl BISCUIT CUTTERS  SET,1,7/7/2011 10:36,2.1,13291,United Kingdom
559200,84378,SET OF 3 HEART COOKIE CUTTERS,1,7/7/2011 10:36,1.25,13291,United Kingdom
559200,85202,HANGING WOOD AND FELT HEART,1,7/7/2011 10:36,0.42,13291,United Kingdom
559200,85204,HANGING WOOD AND FELT FLOWER,9,7/7/2011 10:36,0.12,13291,United Kingdom
559200,22297,HEART IVORY TRELLIS SMALL,10,7/7/2011 10:36,1.25,13291,United Kingdom
559200,22855,FINE WICKER HEART ,3,7/7/2011 10:36,1.25,13291,United Kingdom
559200,23236,DOILEY STORAGE TIN,3,7/7/2011 10:36,2.89,13291,United Kingdom
559200,20766,GARDEN PATH SKETCHBOOK,1,7/7/2011 10:36,3.75,13291,United Kingdom
559200,23322,LARGE WHITE HEART OF WICKER,2,7/7/2011 10:36,2.95,13291,United Kingdom
559200,21471,STRAWBERRY RAFFIA FOOD COVER,2,7/7/2011 10:36,3.75,13291,United Kingdom
559200,35961,FOLKART ZINC HEART CHRISTMAS DEC,5,7/7/2011 10:36,0.85,13291,United Kingdom
559200,85203,HANGING WOOD AND FELT BUTTERFLY ,6,7/7/2011 10:36,0.42,13291,United Kingdom
559200,85202,HANGING WOOD AND FELT HEART,6,7/7/2011 10:36,0.42,13291,United Kingdom
559200,21642,ASSORTED TUTTI FRUTTI PEN,24,7/7/2011 10:36,0.29,13291,United Kingdom
559200,22470,HEART OF WICKER LARGE,2,7/7/2011 10:36,2.95,13291,United Kingdom
559200,21034,REX CASH+CARRY JUMBO SHOPPER,2,7/7/2011 10:36,0.95,13291,United Kingdom
559200,22646,CERAMIC STRAWBERRY CAKE MONEY BANK,4,7/7/2011 10:36,1.45,13291,United Kingdom
559200,21232,STRAWBERRY CERAMIC TRINKET BOX,8,7/7/2011 10:36,1.25,13291,United Kingdom
559200,23301,GARDENERS KNEELING PAD KEEP CALM ,1,7/7/2011 10:36,1.65,13291,United Kingdom
559200,22294,HEART FILIGREE DOVE  SMALL,24,7/7/2011 10:36,1.25,13291,United Kingdom
559200,21390,FILIGRIS HEART WITH BUTTERFLY,24,7/7/2011 10:36,1.25,13291,United Kingdom
559200,23152,IVORY SWEETHEART WIRE LETTER RACK ,2,7/7/2011 10:36,3.75,13291,United Kingdom
559200,37446,MINI CAKE STAND WITH HANGING CAKES,2,7/7/2011 10:36,1.45,13291,United Kingdom
559200,84879,ASSORTED COLOUR BIRD ORNAMENT,16,7/7/2011 10:36,1.69,13291,United Kingdom
559200,23138,SINGLE WIRE HOOK IVORY HEART,24,7/7/2011 10:36,1.45,13291,United Kingdom
559200,20727,LUNCH BAG  BLACK SKULL.,10,7/7/2011 10:36,1.65,13291,United Kingdom
559200,20728,LUNCH BAG CARS BLUE,10,7/7/2011 10:36,1.65,13291,United Kingdom
559200,22423,REGENCY CAKESTAND 3 TIER,1,7/7/2011 10:36,12.75,13291,United Kingdom
559200,21756,BATH BUILDING BLOCK WORD,2,7/7/2011 10:36,5.95,13291,United Kingdom
559200,21754,HOME BUILDING BLOCK WORD,1,7/7/2011 10:36,5.95,13291,United Kingdom
559200,22384,LUNCH BAG PINK POLKADOT,10,7/7/2011 10:36,1.65,13291,United Kingdom
559200,22720,SET OF 3 CAKE TINS PANTRY DESIGN ,2,7/7/2011 10:36,4.95,13291,United Kingdom
559201,22624,IVORY KITCHEN SCALES,2,7/7/2011 10:39,8.5,14217,United Kingdom
559201,22627,MINT KITCHEN SCALES,2,7/7/2011 10:39,8.5,14217,United Kingdom
559201,22625,RED KITCHEN SCALES,2,7/7/2011 10:39,8.5,14217,United Kingdom
559201,22626,BLACK KITCHEN SCALES,2,7/7/2011 10:39,8.5,14217,United Kingdom
559201,21411,GINGHAM HEART  DOORSTOP RED,3,7/7/2011 10:39,4.25,14217,United Kingdom
559201,84946,ANTIQUE SILVER T-LIGHT GLASS,12,7/7/2011 10:39,1.25,14217,United Kingdom
559202,21391,FRENCH LAVENDER SCENT HEART,12,7/7/2011 10:40,0.75,13583,United Kingdom
559202,21394,RED POLKADOT BEAKER ,48,7/7/2011 10:40,0.39,13583,United Kingdom
559202,21792,CLASSIC FRENCH STYLE BASKET GREEN ,8,7/7/2011 10:40,3.95,13583,United Kingdom
559202,21993,FLORAL FOLK STATIONERY SET,12,7/7/2011 10:40,1.25,13583,United Kingdom
559202,21991,BOHEMIAN COLLAGE STATIONERY SET,12,7/7/2011 10:40,1.25,13583,United Kingdom
559202,21992,VINTAGE PAISLEY STATIONERY SET,12,7/7/2011 10:40,1.25,13583,United Kingdom
559202,21990,MODERN FLORAL STATIONERY SET,12,7/7/2011 10:40,1.25,13583,United Kingdom
559202,22161,HEART DECORATION RUSTIC HANGING ,24,7/7/2011 10:40,0.19,13583,United Kingdom
559202,23187,FRENCH STYLE STORAGE JAR BONBONS,48,7/7/2011 10:40,0.29,13583,United Kingdom
559202,37327,ASSTD MULTICOLOUR CIRCLES MUG,48,7/7/2011 10:40,0.39,13583,United Kingdom
559202,37340,MULTICOLOUR SPRING FLOWER MUG,48,7/7/2011 10:40,0.39,13583,United Kingdom
559202,37342,POLKADOT COFFEE CUP & SAUCER PINK,24,7/7/2011 10:40,0.79,13583,United Kingdom
559202,78124,MAGAZINE RACK GEBRA ASSORTED ,24,7/7/2011 10:40,1.25,13583,United Kingdom
559202,84596G,SMALL CHOCOLATES PINK BOWL,16,7/7/2011 10:40,0.42,13583,United Kingdom
559202,84596B,SMALL DOLLY MIX DESIGN ORANGE BOWL,16,7/7/2011 10:40,0.42,13583,United Kingdom
559202,84596L,BISCUITS SMALL BOWL LIGHT BLUE,16,7/7/2011 10:40,0.42,13583,United Kingdom
559202,84595E,LARGE TORTILLA DESIGN RED BOWL,12,7/7/2011 10:40,1.65,13583,United Kingdom
559202,84596F,SMALL MARSHMALLOWS PINK BOWL,16,7/7/2011 10:40,0.42,13583,United Kingdom
559202,85015,SET OF 12  VINTAGE POSTCARD SET,24,7/7/2011 10:40,0.65,13583,United Kingdom
559202,85017B,ENVELOPE 50 BLOSSOM IMAGES,12,7/7/2011 10:40,0.42,13583,United Kingdom
559202,85032C,CURIOUS IMAGES GIFT WRAP SET,12,7/7/2011 10:40,0.65,13583,United Kingdom
559202,85032A,ROMANTIC IMAGES GIFT WRAP SET,12,7/7/2011 10:40,0.65,13583,United Kingdom
559202,85032B,BLOSSOM IMAGES GIFT WRAP SET,12,7/7/2011 10:40,0.65,13583,United Kingdom
559202,22180,RETROSPOT LAMP,2,7/7/2011 10:40,9.95,13583,United Kingdom
559202,72127,COLUMBIAN CANDLE ROUND ,6,7/7/2011 10:40,1.25,13583,United Kingdom
559202,72128,COLUMBIAN CANDLE ROUND,12,7/7/2011 10:40,0.85,13583,United Kingdom
559202,72122,COFFEE SCENT PILLAR CANDLE,12,7/7/2011 10:40,0.95,13583,United Kingdom
559202,23099,FRENCH CARRIAGE LANTERN,2,7/7/2011 10:40,6.65,13583,United Kingdom
559202,71053,WHITE METAL LANTERN,4,7/7/2011 10:40,3.75,13583,United Kingdom
559202,21709,FOLDING UMBRELLA CHOCOLATE POLKADOT,4,7/7/2011 10:40,4.95,13583,United Kingdom
559202,84912A,PINK ROSE WASHBAG,4,7/7/2011 10:40,3.75,13583,United Kingdom
559202,84912B,GREEN ROSE WASHBAG,4,7/7/2011 10:40,3.75,13583,United Kingdom
559202,22348,TEA BAG PLATE RED RETROSPOT,12,7/7/2011 10:40,0.85,13583,United Kingdom
559202,23245,SET OF 3 REGENCY CAKE TINS,4,7/7/2011 10:40,4.95,13583,United Kingdom
559202,84510A,SET OF 4 ENGLISH ROSE COASTERS,10,7/7/2011 10:40,1.25,13583,United Kingdom
559202,84510C,SET OF 4 POLKADOT COASTERS,10,7/7/2011 10:40,1.25,13583,United Kingdom
559202,21078,SET/20 STRAWBERRY PAPER NAPKINS ,12,7/7/2011 10:40,0.85,13583,United Kingdom
559202,21080,SET/20 RED RETROSPOT PAPER NAPKINS ,12,7/7/2011 10:40,0.85,13583,United Kingdom
559202,21210,SET OF 72 RETROSPOT PAPER  DOILIES,12,7/7/2011 10:40,1.45,13583,United Kingdom
559202,21212,PACK OF 72 RETROSPOT CAKE CASES,24,7/7/2011 10:40,0.55,13583,United Kingdom
559202,23108,SET OF 10 LED DOLLY LIGHTS,2,7/7/2011 10:40,6.25,13583,United Kingdom
559202,23298,SPOTTY BUNTING,6,7/7/2011 10:40,4.95,13583,United Kingdom
559202,22720,SET OF 3 CAKE TINS PANTRY DESIGN ,3,7/7/2011 10:40,4.95,13583,United Kingdom
559202,22666,RECIPE BOX PANTRY YELLOW DESIGN,6,7/7/2011 10:40,2.95,13583,United Kingdom
559202,23061,VINTAGE EMBOSSED HEART,12,7/7/2011 10:40,1.25,13583,United Kingdom
559202,23146,TRIPLE HOOK ANTIQUE IVORY ROSE,4,7/7/2011 10:40,3.29,13583,United Kingdom
559202,22766,PHOTO FRAME CORNICE,8,7/7/2011 10:40,2.95,13583,United Kingdom
559202,22138,BAKING SET 9 PIECE RETROSPOT ,6,7/7/2011 10:40,4.95,13583,United Kingdom
559202,23203,JUMBO BAG DOILEY PATTERNS,10,7/7/2011 10:40,2.08,13583,United Kingdom
559202,22411,JUMBO SHOPPER VINTAGE RED PAISLEY,10,7/7/2011 10:40,2.08,13583,United Kingdom
559202,23209,LUNCH BAG DOILEY PATTERN ,10,7/7/2011 10:40,1.65,13583,United Kingdom
559202,22197,POPCORN HOLDER,12,7/7/2011 10:40,0.85,13583,United Kingdom
559202,20723,STRAWBERRY CHARLOTTE BAG,10,7/7/2011 10:40,0.85,13583,United Kingdom
559203,47566,PARTY BUNTING,200,7/7/2011 10:43,4.15,17723,United Kingdom
559204,21936,RED RETROSPOT PICNIC BAG,100,7/7/2011 11:02,2.55,13798,United Kingdom
559204,85099F,JUMBO BAG STRAWBERRY,100,7/7/2011 11:02,1.79,13798,United Kingdom
559204,21166,COOK WITH WINE METAL SIGN ,48,7/7/2011 11:02,1.85,13798,United Kingdom
559204,20728,LUNCH BAG CARS BLUE,100,7/7/2011 11:02,1.45,13798,United Kingdom
559204,85152,HAND OVER THE CHOCOLATE   SIGN ,48,7/7/2011 11:02,1.85,13798,United Kingdom
559204,84378,SET OF 3 HEART COOKIE CUTTERS,144,7/7/2011 11:02,1.06,13798,United Kingdom
559205,22178,VICTORIAN GLASS HANGING T-LIGHT,96,7/7/2011 11:10,1.06,18073,United Kingdom
559205,84946,ANTIQUE SILVER T-LIGHT GLASS,72,7/7/2011 11:10,1.06,18073,United Kingdom
559205,84970L,SINGLE HEART ZINC T-LIGHT HOLDER,12,7/7/2011 11:10,0.95,18073,United Kingdom
559205,84976,RECTANGULAR SHAPED MIRROR,72,7/7/2011 11:10,0.79,18073,United Kingdom
559206,22178,VICTORIAN GLASS HANGING T-LIGHT,96,7/7/2011 11:12,1.06,18073,United Kingdom
559206,84970L,SINGLE HEART ZINC T-LIGHT HOLDER,12,7/7/2011 11:12,0.95,18073,United Kingdom
559206,23444,Next Day Carriage,1,7/7/2011 11:12,15,18073,United Kingdom
559237,84347,ROTATING SILVER ANGELS T-LIGHT HLDR,120,7/7/2011 11:36,2.1,15267,United Kingdom
559237,23268,SET OF 2 CERAMIC CHRISTMAS REINDEER,96,7/7/2011 11:36,1.25,15267,United Kingdom
C559252,84078A,SET/4 WHITE RETRO STORAGE CUBES ,-4,7/7/2011 11:42,34.95,12980,United Kingdom
C559253,23237,SET OF 4 KNICK KNACK TINS LEAF,-1,7/7/2011 11:44,4.15,12472,Germany
C559253,23236,DOILEY STORAGE TIN,-1,7/7/2011 11:44,2.89,12472,Germany
C559253,22556,PLASTERS IN TIN CIRCUS PARADE ,-1,7/7/2011 11:44,1.65,12472,Germany
C559253,22467,GUMBALL COAT RACK,-2,7/7/2011 11:44,2.55,12472,Germany
C559253,22430,ENAMEL WATERING CAN CREAM,-1,7/7/2011 11:44,4.95,12472,Germany
