559357,21955,DOORMAT UNION JACK GUNS AND ROSES,10,7/7/2011 18:56,6.75,17107,United Kingdom
559357,20685,DOORMAT RED RETROSPOT,10,7/7/2011 18:56,6.75,17107,United Kingdom
559357,22366,DOORMAT AIRMAIL ,10,7/7/2011 18:56,6.75,17107,United Kingdom
559357,22365,DOORMAT RESPECTABLE HOUSE,10,7/7/2011 18:56,6.75,17107,United Kingdom
559357,23284,DOORMAT KEEP CALM AND COME IN,20,7/7/2011 18:56,6.75,17107,United Kingdom
559357,48188,DOORMAT WELCOME PUPPIES,10,7/7/2011 18:56,6.75,17107,United Kingdom
559357,85123A,WHITE HANGING HEART T-LIGHT HOLDER,32,7/7/2011 18:56,2.55,17107,United Kingdom
559357,22178,VICTORIAN GLASS HANGING T-LIGHT,96,7/7/2011 18:56,1.06,17107,United Kingdom
559358,85123A,WHITE HANGING HEART T-LIGHT HOLDER,6,7/7/2011 19:14,2.95,15675,United Kingdom
559358,85066,CREAM SWEETHEART MINI CHEST,2,7/7/2011 19:14,12.75,15675,United Kingdom
559358,22847,BREAD BIN DINER STYLE IVORY,1,7/7/2011 19:14,16.95,15675,United Kingdom
559358,47566,PARTY BUNTING,4,7/7/2011 19:14,4.95,15675,United Kingdom
559358,72807C,SET/3 VANILLA SCENTED CANDLE IN BOX,4,7/7/2011 19:14,4.25,15675,United Kingdom
559358,16045,POPART WOODEN PENCILS ASST,100,7/7/2011 19:14,0.04,15675,United Kingdom
559358,16259,PIECE OF CAMO STATIONERY SET,108,7/7/2011 19:14,0.08,15675,United Kingdom
559358,21287,SCENTED VELVET LOUNGE CANDLE ,72,7/7/2011 19:14,0.38,15675,United Kingdom
559358,22209,WOOD STAMP SET HAPPY BIRTHDAY,12,7/7/2011 19:14,0.83,15675,United Kingdom
559358,16054,POPART RECT PENCIL SHARPENER ASST,36,7/7/2011 19:14,0.12,15675,United Kingdom
559358,10133,COLOURING PENCILS BROWN TUBE,20,7/7/2011 19:14,0.42,15675,United Kingdom
559358,22610,PENS ASSORTED FUNNY FACE,36,7/7/2011 19:14,0.19,15675,United Kingdom
559358,23187,FRENCH STYLE STORAGE JAR BONBONS,48,7/7/2011 19:14,0.29,15675,United Kingdom
559359,23125,6PC WOOD PLATE SET DISPOSABLE,6,7/7/2011 19:18,1.25,14702,United Kingdom
559359,23124,18PC WOODEN CUTLERY SET DISPOSABLE,6,7/7/2011 19:18,1.25,14702,United Kingdom
559359,85062,PEARL CRYSTAL PUMPKIN T-LIGHT HLDR,6,7/7/2011 19:18,1.65,14702,United Kingdom
559359,21671,RED SPOT CERAMIC DRAWER KNOB,6,7/7/2011 19:18,1.25,14702,United Kingdom
559359,21669,BLUE STRIPE CERAMIC DRAWER KNOB,6,7/7/2011 19:18,1.25,14702,United Kingdom
559359,23298,SPOTTY BUNTING,5,7/7/2011 19:18,4.95,14702,United Kingdom
559359,22851,SET 20 NAPKINS FAIRY CAKES DESIGN ,1,7/7/2011 19:18,0.85,14702,United Kingdom
559359,21078,SET/20 STRAWBERRY PAPER NAPKINS ,1,7/7/2011 19:18,0.85,14702,United Kingdom
559359,21080,SET/20 RED RETROSPOT PAPER NAPKINS ,2,7/7/2011 19:18,0.85,14702,United Kingdom
559359,22907,PACK OF 20 NAPKINS PANTRY DESIGN,1,7/7/2011 19:18,0.85,14702,United Kingdom
559359,84947,ANTIQUE SILVER TEA GLASS ENGRAVED,6,7/7/2011 19:18,1.25,14702,United Kingdom
559359,84978,HANGING HEART JAR T-LIGHT HOLDER,6,7/7/2011 19:18,1.25,14702,United Kingdom
559359,84755,COLOUR GLASS T-LIGHT HOLDER HANGING,40,7/7/2011 19:18,0.65,14702,United Kingdom
559360,22720,SET OF 3 CAKE TINS PANTRY DESIGN ,3,7/7/2011 19:54,4.95,14657,United Kingdom
559360,82494L,WOODEN FRAME ANTIQUE WHITE ,1,7/7/2011 19:54,2.95,14657,United Kingdom
559360,23068,ALUMINIUM STAMPED HEART,1,7/7/2011 19:54,2.49,14657,United Kingdom
559360,20766,GARDEN PATH SKETCHBOOK,2,7/7/2011 19:54,3.75,14657,United Kingdom
559360,22489,PACK OF 12 TRADITIONAL CRAYONS,4,7/7/2011 19:54,0.42,14657,United Kingdom
559360,23255,CHILDRENS CUTLERY CIRCUS PARADE,1,7/7/2011 19:54,4.15,14657,United Kingdom
559360,23256,CHILDRENS CUTLERY SPACEBOY ,1,7/7/2011 19:54,4.15,14657,United Kingdom
559360,79191C,RETRO PLASTIC ELEPHANT TRAY,1,7/7/2011 19:54,0.85,14657,United Kingdom
559360,22629,SPACEBOY LUNCH BOX ,1,7/7/2011 19:54,1.95,14657,United Kingdom
559360,72586,SET OF 6 HALLOWEEN GHOST T-LIGHTS,6,7/7/2011 19:54,0.42,14657,United Kingdom
559360,20763,DAISY SKETCHBOOK ,2,7/7/2011 19:54,3.75,14657,United Kingdom
559360,21213,PACK OF 72 SKULL CAKE CASES,24,7/7/2011 19:54,0.55,14657,United Kingdom
559360,84378,SET OF 3 HEART COOKIE CUTTERS,6,7/7/2011 19:54,1.25,14657,United Kingdom
559360,71477,COLOUR GLASS. STAR T-LIGHT HOLDER,1,7/7/2011 19:54,3.25,14657,United Kingdom
559360,22965,3 TRADITIONAl BISCUIT CUTTERS  SET,6,7/7/2011 19:54,2.1,14657,United Kingdom
559360,84380,SET OF 3 BUTTERFLY COOKIE CUTTERS,6,7/7/2011 19:54,1.25,14657,United Kingdom
559360,22890,NOVELTY BISCUITS CAKE STAND 3 TIER,2,7/7/2011 19:54,9.95,14657,United Kingdom
559361,23284,DOORMAT KEEP CALM AND COME IN,1,7/7/2011 20:07,7.95,17312,United Kingdom
559361,21694,SMALL REGAL  SILVER CANDLEPOT ,96,7/7/2011 20:07,2.55,17312,United Kingdom
559361,21034,REX CASH+CARRY JUMBO SHOPPER,1,7/7/2011 20:07,0.95,17312,United Kingdom
559362,22208,WOOD STAMP SET THANK YOU,12,7/8/2011 8:43,0.83,12635,Germany
559362,22209,WOOD STAMP SET HAPPY BIRTHDAY,12,7/8/2011 8:43,0.83,12635,Germany
559362,22210,WOOD STAMP SET BEST WISHES,12,7/8/2011 8:43,0.83,12635,Germany
559362,21578,WOODLAND DESIGN  COTTON TOTE BAG,6,7/8/2011 8:43,2.25,12635,Germany
559362,21576,LETS GO SHOPPING COTTON TOTE BAG,6,7/8/2011 8:43,2.25,12635,Germany
559362,21577,SAVE THE PLANET COTTON TOTE BAG,6,7/8/2011 8:43,2.25,12635,Germany
559362,85049E,SCANDINAVIAN REDS RIBBONS,12,7/8/2011 8:43,1.25,12635,Germany
559362,85049C,ROMANTIC PINKS RIBBONS ,12,7/8/2011 8:43,1.25,12635,Germany
559362,85049G,CHOCOLATE BOX RIBBONS ,12,7/8/2011 8:43,1.25,12635,Germany
559362,85049H,URBAN BLACK RIBBONS ,12,7/8/2011 8:43,1.25,12635,Germany
559362,21164,HOME SWEET HOME METAL SIGN ,6,7/8/2011 8:43,2.95,12635,Germany
559362,22720,SET OF 3 CAKE TINS PANTRY DESIGN ,3,7/8/2011 8:43,4.95,12635,Germany
559362,22326,ROUND SNACK BOXES SET OF4 WOODLAND ,12,7/8/2011 8:43,2.95,12635,Germany
559362,21559,STRAWBERRY LUNCH BOX WITH CUTLERY,6,7/8/2011 8:43,2.55,12635,Germany
559362,22328,ROUND SNACK BOXES SET OF 4 FRUITS ,12,7/8/2011 8:43,2.95,12635,Germany
559362,22303,COFFEE MUG APPLES DESIGN,6,7/8/2011 8:43,2.55,12635,Germany
559362,22302,COFFEE MUG PEARS  DESIGN,6,7/8/2011 8:43,2.55,12635,Germany
559362,21877,HOME SWEET HOME MUG,12,7/8/2011 8:43,1.25,12635,Germany
559362,21871,SAVE THE PLANET MUG,12,7/8/2011 8:43,1.25,12635,Germany
559362,21068,VINTAGE BILLBOARD LOVE/HATE MUG,12,7/8/2011 8:43,1.25,12635,Germany
559362,23290,SPACEBOY CHILDRENS BOWL,8,7/8/2011 8:43,1.25,12635,Germany
559362,23292,SPACEBOY CHILDRENS CUP,8,7/8/2011 8:43,1.25,12635,Germany
559362,23289,DOLLY GIRL CHILDRENS BOWL,8,7/8/2011 8:43,1.25,12635,Germany
559362,23291,DOLLY GIRL CHILDRENS CUP,8,7/8/2011 8:43,1.25,12635,Germany
559362,22398,MAGNETS PACK OF 4 SWALLOWS,12,7/8/2011 8:43,1.25,12635,Germany
559362,21700,BIG DOUGHNUT FRIDGE MAGNETS,24,7/8/2011 8:43,0.85,12635,Germany
559362,22399,MAGNETS PACK OF 4 CHILDHOOD MEMORY,12,7/8/2011 8:43,1.25,12635,Germany
559362,22400,MAGNETS PACK OF 4 HOME SWEET HOME,12,7/8/2011 8:43,1.25,12635,Germany
559362,23158,SET OF 5 LUCKY CAT MAGNETS ,12,7/8/2011 8:43,2.08,12635,Germany
559362,23159,SET OF 5 PANCAKE DAY MAGNETS,12,7/8/2011 8:43,2.08,12635,Germany
559362,22915,ASSORTED BOTTLE TOP  MAGNETS ,12,7/8/2011 8:43,0.42,12635,Germany
559362,22922,FRIDGE MAGNETS US DINER ASSORTED,12,7/8/2011 8:43,0.85,12635,Germany
559362,20981,12 PENCILS TALL TUBE WOODLAND,12,7/8/2011 8:43,0.85,12635,Germany
559362,20977,36 PENCILS TUBE WOODLAND,16,7/8/2011 8:43,1.25,12635,Germany
559362,23190,BUNDLE OF 3 SCHOOL EXERCISE BOOKS  ,12,7/8/2011 8:43,1.65,12635,Germany
559362,23191,BUNDLE OF 3 RETRO NOTE BOOKS,12,7/8/2011 8:43,1.65,12635,Germany
559362,23240,SET OF 4 KNICK KNACK TINS DOILEY ,6,7/8/2011 8:43,4.15,12635,Germany
559362,23237,SET OF 4 KNICK KNACK TINS LEAVES ,6,7/8/2011 8:43,4.15,12635,Germany
559362,22139,RETROSPOT TEA SET CERAMIC 11 PC ,3,7/8/2011 8:43,4.95,12635,Germany
559362,POST,POSTAGE,3,7/8/2011 8:43,18,12635,Germany
559363,20713,JUMBO BAG OWLS,10,7/8/2011 8:45,2.08,16091,United Kingdom
559363,22386,JUMBO BAG PINK POLKADOT,10,7/8/2011 8:45,2.08,16091,United Kingdom
559363,23203,JUMBO BAG DOILEY PATTERNS,10,7/8/2011 8:45,2.08,16091,United Kingdom
559363,21174,POTTERING IN THE SHED METAL SIGN,12,7/8/2011 8:45,2.08,16091,United Kingdom
559363,21876,POTTERING MUG,12,7/8/2011 8:45,1.25,16091,United Kingdom
559363,23201,JUMBO BAG ALPHABET,10,7/8/2011 8:45,2.08,16091,United Kingdom
559363,47566,PARTY BUNTING,4,7/8/2011 8:45,4.95,16091,United Kingdom
559363,23298,SPOTTY BUNTING,3,7/8/2011 8:45,4.95,16091,United Kingdom
559364,21929,JUMBO BAG PINK VINTAGE PAISLEY,10,7/8/2011 8:48,2.08,17735,United Kingdom
559364,22385,JUMBO BAG SPACEBOY DESIGN,10,7/8/2011 8:48,2.08,17735,United Kingdom
559364,22663,JUMBO BAG DOLLY GIRL DESIGN,10,7/8/2011 8:48,2.08,17735,United Kingdom
559364,22386,JUMBO BAG PINK POLKADOT,10,7/8/2011 8:48,2.08,17735,United Kingdom
559364,23199,JUMBO BAG APPLES,10,7/8/2011 8:48,2.08,17735,United Kingdom
559364,23200,JUMBO BAG PEARS,10,7/8/2011 8:48,2.08,17735,United Kingdom
559364,23201,JUMBO BAG ALPHABET,10,7/8/2011 8:48,2.08,17735,United Kingdom
559364,23202,JUMBO BAG VINTAGE LEAF,10,7/8/2011 8:48,2.08,17735,United Kingdom
559364,85099F,JUMBO BAG STRAWBERRY,10,7/8/2011 8:48,2.08,17735,United Kingdom
559364,23203,JUMBO BAG DOILEY PATTERNS,10,7/8/2011 8:48,2.08,17735,United Kingdom
559364,85099B,JUMBO BAG RED RETROSPOT,10,7/8/2011 8:48,2.08,17735,United Kingdom
559364,20725,LUNCH BAG RED RETROSPOT,10,7/8/2011 8:48,1.65,17735,United Kingdom
559364,20728,LUNCH BAG CARS BLUE,10,7/8/2011 8:48,1.65,17735,United Kingdom
559364,22384,LUNCH BAG PINK POLKADOT,10,7/8/2011 8:48,1.65,17735,United Kingdom
559364,20726,LUNCH BAG WOODLAND,10,7/8/2011 8:48,1.65,17735,United Kingdom
559364,22382,LUNCH BAG SPACEBOY DESIGN ,10,7/8/2011 8:48,1.65,17735,United Kingdom
559364,22662,LUNCH BAG DOLLY GIRL DESIGN,10,7/8/2011 8:48,1.65,17735,United Kingdom
559364,20727,LUNCH BAG  BLACK SKULL.,10,7/8/2011 8:48,1.65,17735,United Kingdom
559364,22383,LUNCH BAG SUKI DESIGN ,10,7/8/2011 8:48,1.65,17735,United Kingdom
559364,23206,LUNCH BAG APPLE DESIGN,10,7/8/2011 8:48,1.65,17735,United Kingdom
559364,23207,LUNCH BAG ALPHABET DESIGN,10,7/8/2011 8:48,1.65,17735,United Kingdom
559364,23208,LUNCH BAG VINTAGE LEAF DESIGN,10,7/8/2011 8:48,1.65,17735,United Kingdom
559364,23209,LUNCH BAG DOILEY PATTERN ,10,7/8/2011 8:48,1.65,17735,United Kingdom
559364,23310,BUBBLEGUM RING ASSORTED,36,7/8/2011 8:48,0.42,17735,United Kingdom
559364,21907,I'M ON HOLIDAY METAL SIGN,12,7/8/2011 8:48,2.1,17735,United Kingdom
559364,21175,GIN + TONIC DIET METAL SIGN,12,7/8/2011 8:48,2.55,17735,United Kingdom
559364,22413,METAL SIGN TAKE IT OR LEAVE IT ,12,7/8/2011 8:48,2.95,17735,United Kingdom
559364,20711,JUMBO BAG TOYS ,10,7/8/2011 8:48,2.08,17735,United Kingdom
559364,21033,JUMBO BAG CHARLIE AND LOLA TOYS,20,7/8/2011 8:48,2.08,17735,United Kingdom
559364,21930,JUMBO STORAGE BAG SKULLS,20,7/8/2011 8:48,2.08,17735,United Kingdom
559364,20712,JUMBO BAG WOODLAND ANIMALS,10,7/8/2011 8:48,2.08,17735,United Kingdom
559364,21928,JUMBO BAG SCANDINAVIAN BLUE PAISLEY,10,7/8/2011 8:48,2.08,17735,United Kingdom
559364,21931,JUMBO STORAGE BAG SUKI,20,7/8/2011 8:48,2.08,17735,United Kingdom
559364,20713,JUMBO BAG OWLS,20,7/8/2011 8:48,2.08,17735,United Kingdom
559365,22451,,-3,7/8/2011 8:53,0,,United Kingdom
559366,23242,TREASURE TIN BUFFALO BILL ,6,7/8/2011 9:03,2.08,13102,United Kingdom
559366,23241,TREASURE TIN GYMKHANA DESIGN,6,7/8/2011 9:03,2.08,13102,United Kingdom
559366,23238,SET OF 4 KNICK KNACK TINS LONDON ,12,7/8/2011 9:03,4.15,13102,United Kingdom
559366,23289,DOLLY GIRL CHILDRENS BOWL,8,7/8/2011 9:03,1.25,13102,United Kingdom
559366,23290,SPACEBOY CHILDRENS BOWL,8,7/8/2011 9:03,1.25,13102,United Kingdom
559366,23292,SPACEBOY CHILDRENS CUP,8,7/8/2011 9:03,1.25,13102,United Kingdom
559366,23291,DOLLY GIRL CHILDRENS CUP,8,7/8/2011 9:03,1.25,13102,United Kingdom
559366,23341,PINK DINER WALL CLOCK,2,7/8/2011 9:03,8.5,13102,United Kingdom
559366,23342,MINT DINER WALL CLOCK,2,7/8/2011 9:03,8.5,13102,United Kingdom
559366,85123A,WHITE HANGING HEART T-LIGHT HOLDER,18,7/8/2011 9:03,2.95,13102,United Kingdom
559366,22197,POPCORN HOLDER,24,7/8/2011 9:03,0.85,13102,United Kingdom
559366,23049,RECYCLED ACAPULCO MAT RED,2,7/8/2011 9:03,8.25,13102,United Kingdom
559366,23052,RECYCLED ACAPULCO MAT TURQUOISE,2,7/8/2011 9:03,8.25,13102,United Kingdom
559366,22629,SPACEBOY LUNCH BOX ,24,7/8/2011 9:03,1.95,13102,United Kingdom
559366,22630,DOLLY GIRL LUNCH BOX,24,7/8/2011 9:03,1.95,13102,United Kingdom
559366,21871,SAVE THE PLANET MUG,12,7/8/2011 9:03,1.25,13102,United Kingdom
559366,22993,SET OF 4 PANTRY JELLY MOULDS,12,7/8/2011 9:03,1.25,13102,United Kingdom
559366,22558,CLOTHES PEGS RETROSPOT PACK 24 ,12,7/8/2011 9:03,1.65,13102,United Kingdom
559366,22896,PEG BAG APPLES DESIGN,6,7/8/2011 9:03,2.55,13102,United Kingdom
559367,22222,CAKE PLATE LOVEBIRD WHITE,3,7/8/2011 9:38,4.95,13013,United Kingdom
559367,22557,PLASTERS IN TIN VINTAGE PAISLEY ,12,7/8/2011 9:38,1.65,13013,United Kingdom
559367,23076,ICE CREAM SUNDAE LIP GLOSS,24,7/8/2011 9:38,1.25,13013,United Kingdom
559367,23014,GLASS APOTHECARY BOTTLE ELIXIR,4,7/8/2011 9:38,3.95,13013,United Kingdom
559367,23013,GLASS APOTHECARY BOTTLE TONIC,4,7/8/2011 9:38,3.95,13013,United Kingdom
559367,23012,GLASS APOTHECARY BOTTLE PERFUME,4,7/8/2011 9:38,3.95,13013,United Kingdom
559367,22969,HOMEMADE JAM SCENTED CANDLES,12,7/8/2011 9:38,1.45,13013,United Kingdom
559367,72741,GRAND CHOCOLATECANDLE,9,7/8/2011 9:38,1.45,13013,United Kingdom
559367,21391,FRENCH LAVENDER SCENT HEART,12,7/8/2011 9:38,0.75,13013,United Kingdom
559367,84879,ASSORTED COLOUR BIRD ORNAMENT,16,7/8/2011 9:38,1.69,13013,United Kingdom
559367,22978,PANTRY ROLLING PIN,6,7/8/2011 9:38,3.75,13013,United Kingdom
559367,22979,PANTRY WASHING UP BRUSH,12,7/8/2011 9:38,1.45,13013,United Kingdom
559367,23245,SET OF 3 REGENCY CAKE TINS,4,7/8/2011 9:38,4.95,13013,United Kingdom
559367,20752,BLUE POLKADOT WASHING UP GLOVES,6,7/8/2011 9:38,2.1,13013,United Kingdom
559367,20754,RETROSPOT RED WASHING UP GLOVES,6,7/8/2011 9:38,2.1,13013,United Kingdom
559367,22182,CAKE STAND VICTORIAN FILIGREE SMALL,4,7/8/2011 9:38,4.95,13013,United Kingdom
559367,22220,CAKE STAND LOVEBIRD 2 TIER WHITE,2,7/8/2011 9:38,9.95,13013,United Kingdom
559368,23199,JUMBO BAG APPLES,10,7/8/2011 9:38,2.08,17031,United Kingdom
559368,23200,JUMBO BAG PEARS,10,7/8/2011 9:38,2.08,17031,United Kingdom
559368,21936,RED RETROSPOT PICNIC BAG,5,7/8/2011 9:38,2.95,17031,United Kingdom
559368,20718,RED RETROSPOT SHOPPER BAG,10,7/8/2011 9:38,1.25,17031,United Kingdom
559368,21932,SCANDINAVIAN PAISLEY PICNIC BAG,10,7/8/2011 9:38,1.65,17031,United Kingdom
559368,21933,PINK VINTAGE PAISLEY PICNIC BAG,10,7/8/2011 9:38,1.65,17031,United Kingdom
559368,85099B,JUMBO BAG RED RETROSPOT,10,7/8/2011 9:38,2.08,17031,United Kingdom
559368,23202,JUMBO BAG VINTAGE LEAF,10,7/8/2011 9:38,2.08,17031,United Kingdom
559368,20725,LUNCH BAG RED RETROSPOT,10,7/8/2011 9:38,1.65,17031,United Kingdom
559368,20727,LUNCH BAG  BLACK SKULL.,10,7/8/2011 9:38,1.65,17031,United Kingdom
559368,22384,LUNCH BAG PINK POLKADOT,10,7/8/2011 9:38,1.65,17031,United Kingdom
559368,22383,LUNCH BAG SUKI DESIGN ,10,7/8/2011 9:38,1.65,17031,United Kingdom
559368,20728,LUNCH BAG CARS BLUE,10,7/8/2011 9:38,1.65,17031,United Kingdom
559369,84755,COLOUR GLASS T-LIGHT HOLDER HANGING,16,7/8/2011 10:00,0.65,14388,United Kingdom
559369,23203,JUMBO BAG DOILEY PATTERNS,20,7/8/2011 10:00,2.08,14388,United Kingdom
559369,85099B,JUMBO BAG RED RETROSPOT,20,7/8/2011 10:00,2.08,14388,United Kingdom
559369,23201,JUMBO BAG ALPHABET,20,7/8/2011 10:00,2.08,14388,United Kingdom
559369,22385,JUMBO BAG SPACEBOY DESIGN,10,7/8/2011 10:00,2.08,14388,United Kingdom
559369,22411,JUMBO SHOPPER VINTAGE RED PAISLEY,10,7/8/2011 10:00,2.08,14388,United Kingdom
559369,22382,LUNCH BAG SPACEBOY DESIGN ,10,7/8/2011 10:00,1.65,14388,United Kingdom
559369,23209,LUNCH BAG DOILEY PATTERN ,10,7/8/2011 10:00,1.65,14388,United Kingdom
559369,21931,JUMBO STORAGE BAG SUKI,10,7/8/2011 10:00,2.08,14388,United Kingdom
559369,22383,LUNCH BAG SUKI DESIGN ,10,7/8/2011 10:00,1.65,14388,United Kingdom
559369,22423,REGENCY CAKESTAND 3 TIER,1,7/8/2011 10:00,12.75,14388,United Kingdom
559369,23245,SET OF 3 REGENCY CAKE TINS,4,7/8/2011 10:00,4.95,14388,United Kingdom
559369,23121,PACK OF 6 COCKTAIL PARASOL STRAWS,24,7/8/2011 10:00,0.42,14388,United Kingdom
559369,23119,PACK OF 6 LARGE FRUIT STRAWS ,12,7/8/2011 10:00,0.62,14388,United Kingdom
559369,21065,BOOM BOX SPEAKER GIRLS,2,7/8/2011 10:00,5.95,14388,United Kingdom
559369,22328,ROUND SNACK BOXES SET OF 4 FRUITS ,6,7/8/2011 10:00,2.95,14388,United Kingdom
559370,23280,FOLDING BUTTERFLY MIRROR HOT PINK ,12,7/8/2011 10:01,0.83,17042,United Kingdom
559370,22037,ROBOT BIRTHDAY CARD,12,7/8/2011 10:01,0.42,17042,United Kingdom
559370,22815,CARD PSYCHEDELIC APPLES,12,7/8/2011 10:01,0.42,17042,United Kingdom
559370,22432,WATERING CAN PINK BUNNY,6,7/8/2011 10:01,1.95,17042,United Kingdom
559370,47566,PARTY BUNTING,4,7/8/2011 10:01,4.95,17042,United Kingdom
559370,22668,PINK BABY BUNTING,5,7/8/2011 10:01,2.95,17042,United Kingdom
559370,22468,BABUSHKA LIGHTS STRING OF 10,2,7/8/2011 10:01,6.75,17042,United Kingdom
559370,21830,ASSORTED CREEPY CRAWLIES,24,7/8/2011 10:01,0.42,17042,United Kingdom
559370,84077,WORLD WAR 2 GLIDERS ASSTD DESIGNS,48,7/8/2011 10:01,0.29,17042,United Kingdom
559370,84212,"ASSORTED FLOWER COLOUR ""LEIS""",24,7/8/2011 10:01,0.65,17042,United Kingdom
559370,22440,BALLOON WATER BOMB PACK OF 35,20,7/8/2011 10:01,0.42,17042,United Kingdom
559370,22418,10 COLOUR SPACEBOY PEN,24,7/8/2011 10:01,0.85,17042,United Kingdom
559370,23242,TREASURE TIN BUFFALO BILL ,6,7/8/2011 10:01,2.08,17042,United Kingdom
559370,22068,BLACK PIRATE TREASURE CHEST,12,7/8/2011 10:01,1.65,17042,United Kingdom
559370,22712,CARD DOLLY GIRL ,12,7/8/2011 10:01,0.42,17042,United Kingdom
559371,22470,HEART OF WICKER LARGE,12,7/8/2011 10:20,2.95,14264,United Kingdom
559371,22469,HEART OF WICKER SMALL,12,7/8/2011 10:20,1.65,14264,United Kingdom
559371,48184,DOORMAT ENGLISH ROSE ,2,7/8/2011 10:20,7.95,14264,United Kingdom
559371,48194,DOORMAT HEARTS,2,7/8/2011 10:20,7.95,14264,United Kingdom
559371,48138,DOORMAT UNION FLAG,2,7/8/2011 10:20,7.95,14264,United Kingdom
559371,22692,DOORMAT WELCOME TO OUR HOME,2,7/8/2011 10:20,7.95,14264,United Kingdom
559371,22691,DOORMAT WELCOME SUNRISE,2,7/8/2011 10:20,7.95,14264,United Kingdom
559371,23093,SMALL PARISIENNE HEART PHOTO FRAME ,8,7/8/2011 10:20,2.49,14264,United Kingdom
559371,23050,RECYCLED ACAPULCO MAT GREEN,2,7/8/2011 10:20,8.25,14264,United Kingdom
559371,23065,LARGE DECO JEWELLERY STAND,1,7/8/2011 10:20,12.5,14264,United Kingdom
559371,47566,PARTY BUNTING,4,7/8/2011 10:20,4.95,14264,United Kingdom
559371,23298,SPOTTY BUNTING,3,7/8/2011 10:20,4.95,14264,United Kingdom
559372,84879,ASSORTED COLOUR BIRD ORNAMENT,8,7/8/2011 10:23,1.69,12461,Switzerland
559372,22494,EMERGENCY FIRST AID TIN ,12,7/8/2011 10:23,1.25,12461,Switzerland
559372,21906,PHARMACIE FIRST AID TIN,2,7/8/2011 10:23,6.75,12461,Switzerland
559372,22831,WHITE BROCANTE SOAP DISH,6,7/8/2011 10:23,2.95,12461,Switzerland
559372,22128,PARTY CONES CANDY ASSORTED,12,7/8/2011 10:23,1.25,12461,Switzerland
559372,22129,PARTY CONES CANDY TREE DECORATION,12,7/8/2011 10:23,0.85,12461,Switzerland
559372,22617,BAKING SET SPACEBOY DESIGN,3,7/8/2011 10:23,4.95,12461,Switzerland
559372,22551,PLASTERS IN TIN SPACEBOY,12,7/8/2011 10:23,1.65,12461,Switzerland
559372,21650,ASSORTED TUTTI FRUTTI BRACELET,24,7/8/2011 10:23,0.19,12461,Switzerland
559372,22271,FELTCRAFT DOLL ROSIE,6,7/8/2011 10:23,2.95,12461,Switzerland
559372,22621,TRADITIONAL KNITTING NANCY,12,7/8/2011 10:23,1.65,12461,Switzerland
559372,22758,LARGE PURPLE BABUSHKA NOTEBOOK  ,12,7/8/2011 10:23,1.25,12461,Switzerland
559372,22757,LARGE RED BABUSHKA NOTEBOOK ,12,7/8/2011 10:23,1.25,12461,Switzerland
559372,22585,PACK OF 6 BIRDY GIFT TAGS,12,7/8/2011 10:23,1.25,12461,Switzerland
559372,22752,SET 7 BABUSHKA NESTING BOXES,2,7/8/2011 10:23,8.5,12461,Switzerland
559372,22450,SILK PURSE BABUSHKA BLUE,6,7/8/2011 10:23,3.35,12461,Switzerland
559372,22449,SILK PURSE BABUSHKA PINK,6,7/8/2011 10:23,3.35,12461,Switzerland
559372,22448,PIN CUSHION BABUSHKA RED,6,7/8/2011 10:23,3.35,12461,Switzerland
559372,22447,PIN CUSHION BABUSHKA BLUE,6,7/8/2011 10:23,3.35,12461,Switzerland
559372,22446,PIN CUSHION BABUSHKA PINK,6,7/8/2011 10:23,3.35,12461,Switzerland
559372,22499,WOODEN UNION JACK BUNTING,3,7/8/2011 10:23,5.95,12461,Switzerland
559372,22726,ALARM CLOCK BAKELIKE GREEN,4,7/8/2011 10:23,3.75,12461,Switzerland
559372,22725,ALARM CLOCK BAKELIKE CHOCOLATE,4,7/8/2011 10:23,3.75,12461,Switzerland
559372,22730,ALARM CLOCK BAKELIKE IVORY,4,7/8/2011 10:23,3.75,12461,Switzerland
559372,22915,ASSORTED BOTTLE TOP  MAGNETS ,12,7/8/2011 10:23,0.42,12461,Switzerland
559372,22402,MAGNETS PACK OF 4 VINTAGE COLLAGE,12,7/8/2011 10:23,0.39,12461,Switzerland
559372,22400,MAGNETS PACK OF 4 HOME SWEET HOME,12,7/8/2011 10:23,0.39,12461,Switzerland
559372,22398,MAGNETS PACK OF 4 SWALLOWS,12,7/8/2011 10:23,0.39,12461,Switzerland
559372,48187,DOORMAT NEW ENGLAND,6,7/8/2011 10:23,7.95,12461,Switzerland
559372,48184,DOORMAT ENGLISH ROSE ,6,7/8/2011 10:23,7.95,12461,Switzerland
559372,20685,DOORMAT RED RETROSPOT,6,7/8/2011 10:23,7.95,12461,Switzerland
559372,21524,DOORMAT SPOTTY HOME SWEET HOME,6,7/8/2011 10:23,7.95,12461,Switzerland
559372,22081,RIBBON REEL FLORA + FAUNA ,10,7/8/2011 10:23,1.65,12461,Switzerland
559372,21136,PAINTED METAL PEARS ASSORTED,8,7/8/2011 10:23,1.69,12461,Switzerland
559373,16156S,,-110,7/8/2011 10:36,0,,United Kingdom
559374,22050,,-100,7/8/2011 10:37,0,,United Kingdom
559375,22051,?,-300,7/8/2011 10:37,0,,United Kingdom
559376,48116,,-35,7/8/2011 10:38,0,,United Kingdom
559377,23283,,17,7/8/2011 10:39,0,,United Kingdom
559378,21781,damages?,-39,7/8/2011 10:40,0,,United Kingdom
559379,79337,,-8,7/8/2011 10:42,0,,United Kingdom
559390,21700,,-110,7/8/2011 10:46,0,,United Kingdom
559398,21169,,-70,7/8/2011 10:48,0,,United Kingdom
559401,21240,BLUE POLKADOT CUP,3,7/8/2011 10:49,0.85,15039,United Kingdom
559401,21238,RED RETROSPOT CUP,3,7/8/2011 10:49,0.85,15039,United Kingdom
559401,23122,PARTY CHARMS 50 PIECES,1,7/8/2011 10:49,0.83,15039,United Kingdom
559401,22152,PLACE SETTING WHITE STAR,12,7/8/2011 10:49,0.42,15039,United Kingdom
559401,23206,LUNCH BAG APPLE DESIGN,2,7/8/2011 10:49,1.65,15039,United Kingdom
559401,22553,PLASTERS IN TIN SKULLS,1,7/8/2011 10:49,1.65,15039,United Kingdom
559401,85099B,JUMBO BAG RED RETROSPOT,10,7/8/2011 10:49,2.08,15039,United Kingdom
559401,23200,JUMBO BAG PEARS,10,7/8/2011 10:49,2.08,15039,United Kingdom
559401,22627,MINT KITCHEN SCALES,1,7/8/2011 10:49,8.5,15039,United Kingdom
559401,21928,JUMBO BAG SCANDINAVIAN BLUE PAISLEY,10,7/8/2011 10:49,2.08,15039,United Kingdom
559401,23202,JUMBO BAG VINTAGE LEAF,10,7/8/2011 10:49,2.08,15039,United Kingdom
559401,23203,JUMBO BAG DOILEY PATTERNS,3,7/8/2011 10:49,2.08,15039,United Kingdom
559401,21673,WHITE SPOT BLUE CERAMIC DRAWER KNOB,2,7/8/2011 10:49,1.25,15039,United Kingdom
559401,22772,PINK DRAWER KNOB ACRYLIC EDWARDIAN,2,7/8/2011 10:49,1.25,15039,United Kingdom
559401,21669,BLUE STRIPE CERAMIC DRAWER KNOB,3,7/8/2011 10:49,1.25,15039,United Kingdom
559401,21670,BLUE SPOT CERAMIC DRAWER KNOB,3,7/8/2011 10:49,1.25,15039,United Kingdom
559401,22662,LUNCH BAG DOLLY GIRL DESIGN,1,7/8/2011 10:49,1.65,15039,United Kingdom
559401,47566B,TEA TIME PARTY BUNTING,2,7/8/2011 10:49,4.95,15039,United Kingdom
559401,22243,5 HOOK HANGER RED MAGIC TOADSTOOL,1,7/8/2011 10:49,1.65,15039,United Kingdom
559401,20677,PINK POLKADOT BOWL,1,7/8/2011 10:49,1.25,15039,United Kingdom
559401,20675,BLUE POLKADOT BOWL,1,7/8/2011 10:49,1.25,15039,United Kingdom
559401,21977,PACK OF 60 PINK PAISLEY CAKE CASES,1,7/8/2011 10:49,0.55,15039,United Kingdom
559401,22690,DOORMAT HOME SWEET HOME BLUE ,1,7/8/2011 10:49,7.95,15039,United Kingdom
559401,21936,RED RETROSPOT PICNIC BAG,1,7/8/2011 10:49,2.95,15039,United Kingdom
559401,21094,SET/6 RED SPOTTY PAPER PLATES,4,7/8/2011 10:49,0.85,15039,United Kingdom
559401,21080,SET/20 RED RETROSPOT PAPER NAPKINS ,4,7/8/2011 10:49,0.85,15039,United Kingdom
559401,22424,ENAMEL BREAD BIN CREAM,2,7/8/2011 10:49,12.75,15039,United Kingdom
559402,21635,,-8,7/8/2011 10:49,0,,United Kingdom
559405,22863,,-7,7/8/2011 10:50,0,,United Kingdom
559410,84341B,,-179,7/8/2011 10:51,0,,United Kingdom
559414,22855,,-4,7/8/2011 10:52,0,,United Kingdom
C559417,22617,BAKING SET SPACEBOY DESIGN,-1,7/8/2011 11:08,4.95,13115,United Kingdom
559418,21224,SET/4 SKULL BADGES,10,7/8/2011 11:36,1.25,12681,France
559418,22328,ROUND SNACK BOXES SET OF 4 FRUITS ,6,7/8/2011 11:36,2.95,12681,France
559418,20724,RED RETROSPOT CHARLOTTE BAG,10,7/8/2011 11:36,0.85,12681,France
559418,23204,CHARLOTTE BAG APPLES DESIGN,10,7/8/2011 11:36,0.85,12681,France
559418,22027,TEA PARTY BIRTHDAY CARD,12,7/8/2011 11:36,0.42,12681,France
559418,84212,"ASSORTED FLOWER COLOUR ""LEIS""",24,7/8/2011 11:36,0.65,12681,France
559418,21238,RED RETROSPOT CUP,8,7/8/2011 11:36,0.85,12681,France
559418,21239,PINK  POLKADOT CUP,8,7/8/2011 11:36,0.85,12681,France
559418,21240,BLUE POLKADOT CUP,8,7/8/2011 11:36,0.85,12681,France
559418,22302,COFFEE MUG PEARS  DESIGN,6,7/8/2011 11:36,2.55,12681,France
559418,22365,DOORMAT RESPECTABLE HOUSE,4,7/8/2011 11:36,7.95,12681,France
559418,22413,METAL SIGN TAKE IT OR LEAVE IT ,6,7/8/2011 11:36,2.95,12681,France
559418,22197,POPCORN HOLDER,12,7/8/2011 11:36,0.85,12681,France
559418,22892,SET OF SALT AND PEPPER TOADSTOOLS,12,7/8/2011 11:36,1.25,12681,France
559418,22652,TRAVEL SEWING KIT,10,7/8/2011 11:36,1.65,12681,France
559418,22348,TEA BAG PLATE RED RETROSPOT,12,7/8/2011 11:36,0.85,12681,France
559418,22898,CHILDRENS APRON APPLES DESIGN,8,7/8/2011 11:36,1.95,12681,France
559418,22716,CARD CIRCUS PARADE,12,7/8/2011 11:36,0.42,12681,France
559418,22976,CIRCUS PARADE CHILDRENS EGG CUP ,12,7/8/2011 11:36,1.25,12681,France
559418,22352,LUNCH BOX WITH CUTLERY RETROSPOT ,6,7/8/2011 11:36,2.55,12681,France
559418,23158,SET OF 5 LUCKY CAT MAGNETS ,12,7/8/2011 11:36,2.08,12681,France
