560024,22197,POPCORN HOLDER,10,7/14/2011 13:00,0.85,15005,United Kingdom
560024,82486,WOOD S/3 CABINET ANT WHITE FINISH,2,7/14/2011 13:00,8.95,15005,United Kingdom
560024,22629,SPACEBOY LUNCH BOX ,3,7/14/2011 13:00,1.95,15005,United Kingdom
560024,22659,LUNCH BOX I LOVE LONDON,4,7/14/2011 13:00,1.95,15005,United Kingdom
560024,23204,CHARLOTTE BAG APPLES DESIGN,10,7/14/2011 13:00,0.85,15005,United Kingdom
560024,20719,WOODLAND CHARLOTTE BAG,10,7/14/2011 13:00,0.85,15005,United Kingdom
560024,22355,CHARLOTTE BAG SUKI DESIGN,10,7/14/2011 13:00,0.85,15005,United Kingdom
560024,20724,RED RETROSPOT CHARLOTTE BAG,10,7/14/2011 13:00,0.85,15005,United Kingdom
560024,22356,CHARLOTTE BAG PINK POLKADOT,10,7/14/2011 13:00,0.85,15005,United Kingdom
560024,20723,STRAWBERRY CHARLOTTE BAG,10,7/14/2011 13:00,0.85,15005,United Kingdom
560024,23300,GARDENERS KNEELING PAD CUP OF TEA ,4,7/14/2011 13:00,1.65,15005,United Kingdom
560024,23301,GARDENERS KNEELING PAD KEEP CALM ,4,7/14/2011 13:00,1.65,15005,United Kingdom
560024,23302,KNEELING MAT HOUSEWORK  DESIGN,3,7/14/2011 13:00,1.65,15005,United Kingdom
560024,84508B,STRIPES DESIGN TEDDY,1,7/14/2011 13:00,2.55,15005,United Kingdom
560025,20886,BOX OF 9 PEBBLE CANDLES,1,7/14/2011 13:00,1.95,18283,United Kingdom
560025,22077,6 RIBBONS RUSTIC CHARM,1,7/14/2011 13:00,1.65,18283,United Kingdom
560025,21213,PACK OF 72 SKULL CAKE CASES,1,7/14/2011 13:00,0.55,18283,United Kingdom
560025,22951,60 CAKE CASES DOLLY GIRL DESIGN,1,7/14/2011 13:00,0.55,18283,United Kingdom
560025,22417,PACK OF 60 SPACEBOY CAKE CASES,2,7/14/2011 13:00,0.55,18283,United Kingdom
560025,21975,PACK OF 60 DINOSAUR CAKE CASES,2,7/14/2011 13:00,0.55,18283,United Kingdom
560025,21981,PACK OF 12 WOODLAND TISSUES ,2,7/14/2011 13:00,0.29,18283,United Kingdom
560025,21982,PACK OF 12 SUKI TISSUES ,1,7/14/2011 13:00,0.29,18283,United Kingdom
560025,22614,PACK OF 12 SPACEBOY TISSUES,2,7/14/2011 13:00,0.29,18283,United Kingdom
560025,21967,PACK OF 12 SKULL TISSUES,2,7/14/2011 13:00,0.29,18283,United Kingdom
560025,23296,SET OF 6 TEA TIME BAKING CASES,1,7/14/2011 13:00,1.25,18283,United Kingdom
560025,21733,RED HANGING HEART T-LIGHT HOLDER,1,7/14/2011 13:00,2.95,18283,United Kingdom
560025,22652,TRAVEL SEWING KIT,1,7/14/2011 13:00,1.65,18283,United Kingdom
560025,22554,PLASTERS IN TIN WOODLAND ANIMALS,2,7/14/2011 13:00,1.65,18283,United Kingdom
560025,22553,PLASTERS IN TIN SKULLS,2,7/14/2011 13:00,1.65,18283,United Kingdom
560025,85123A,WHITE HANGING HEART T-LIGHT HOLDER,1,7/14/2011 13:00,2.95,18283,United Kingdom
560025,23196,VINTAGE LEAF MAGNETIC NOTEPAD,1,7/14/2011 13:00,1.45,18283,United Kingdom
560025,22964,3 PIECE SPACEBOY COOKIE CUTTER SET,1,7/14/2011 13:00,2.1,18283,United Kingdom
560025,22328,ROUND SNACK BOXES SET OF 4 FRUITS ,1,7/14/2011 13:00,2.95,18283,United Kingdom
560025,22326,ROUND SNACK BOXES SET OF4 WOODLAND ,1,7/14/2011 13:00,2.95,18283,United Kingdom
560025,22327,ROUND SNACK BOXES SET OF 4 SKULLS,1,7/14/2011 13:00,2.95,18283,United Kingdom
560025,22975,SPACEBOY CHILDRENS EGG CUP,1,7/14/2011 13:00,1.25,18283,United Kingdom
560025,22972,CHILDREN'S SPACEBOY MUG,1,7/14/2011 13:00,1.65,18283,United Kingdom
560025,21874,GIN AND TONIC MUG,1,7/14/2011 13:00,1.25,18283,United Kingdom
560025,23240,SET OF 4 KNICK KNACK TINS DOILEY ,2,7/14/2011 13:00,4.15,18283,United Kingdom
560025,23237,SET OF 4 KNICK KNACK TINS LEAF,2,7/14/2011 13:00,4.15,18283,United Kingdom
560025,84755,COLOUR GLASS T-LIGHT HOLDER HANGING,8,7/14/2011 13:00,0.65,18283,United Kingdom
560025,23077,DOUGHNUT LIP GLOSS ,13,7/14/2011 13:00,1.25,18283,United Kingdom
560025,22418,10 COLOUR SPACEBOY PEN,10,7/14/2011 13:00,0.85,18283,United Kingdom
560025,20719,WOODLAND CHARLOTTE BAG,1,7/14/2011 13:00,0.85,18283,United Kingdom
560025,20724,RED RETROSPOT CHARLOTTE BAG,2,7/14/2011 13:00,0.85,18283,United Kingdom
560025,22356,CHARLOTTE BAG PINK POLKADOT,1,7/14/2011 13:00,0.85,18283,United Kingdom
560025,22661,CHARLOTTE BAG DOLLY GIRL DESIGN,2,7/14/2011 13:00,0.85,18283,United Kingdom
560025,23204,CHARLOTTE BAG APPLES DESIGN,4,7/14/2011 13:00,0.85,18283,United Kingdom
560025,22382,LUNCH BAG SPACEBOY DESIGN ,1,7/14/2011 13:00,1.65,18283,United Kingdom
560025,20726,LUNCH BAG WOODLAND,1,7/14/2011 13:00,1.65,18283,United Kingdom
560025,20727,LUNCH BAG  BLACK SKULL.,1,7/14/2011 13:00,1.65,18283,United Kingdom
560025,23208,LUNCH BAG VINTAGE LEAF DESIGN,1,7/14/2011 13:00,1.65,18283,United Kingdom
560025,22383,LUNCH BAG SUKI DESIGN ,1,7/14/2011 13:00,1.65,18283,United Kingdom
560025,23209,LUNCH BAG DOILEY PATTERN ,1,7/14/2011 13:00,1.65,18283,United Kingdom
560025,20727,LUNCH BAG  BLACK SKULL.,1,7/14/2011 13:00,1.65,18283,United Kingdom
560025,20725,LUNCH BAG RED RETROSPOT,1,7/14/2011 13:00,1.65,18283,United Kingdom
560025,22662,LUNCH BAG DOLLY GIRL DESIGN,1,7/14/2011 13:00,1.65,18283,United Kingdom
560025,23209,LUNCH BAG DOILEY PATTERN ,1,7/14/2011 13:00,1.65,18283,United Kingdom
560025,23206,LUNCH BAG APPLE DESIGN,1,7/14/2011 13:00,1.65,18283,United Kingdom
560025,22384,LUNCH BAG PINK POLKADOT,1,7/14/2011 13:00,1.65,18283,United Kingdom
560025,23202,JUMBO BAG VINTAGE LEAF,1,7/14/2011 13:00,2.08,18283,United Kingdom
560025,21931,JUMBO STORAGE BAG SUKI,1,7/14/2011 13:00,2.08,18283,United Kingdom
560025,20712,JUMBO BAG WOODLAND ANIMALS,1,7/14/2011 13:00,2.08,18283,United Kingdom
560025,85099B,JUMBO BAG RED RETROSPOT,1,7/14/2011 13:00,2.08,18283,United Kingdom
560025,22386,JUMBO BAG PINK POLKADOT,1,7/14/2011 13:00,2.08,18283,United Kingdom
560025,23200,JUMBO BAG PEARS,1,7/14/2011 13:00,2.08,18283,United Kingdom
560025,23203,JUMBO BAG DOILEY PATTERNS,2,7/14/2011 13:00,2.08,18283,United Kingdom
560025,23199,JUMBO BAG APPLES,1,7/14/2011 13:00,2.08,18283,United Kingdom
560025,21930,JUMBO STORAGE BAG SKULLS,2,7/14/2011 13:00,2.08,18283,United Kingdom
560025,22663,JUMBO BAG DOLLY GIRL DESIGN,1,7/14/2011 13:00,2.08,18283,United Kingdom
560026,21670,BLUE SPOT CERAMIC DRAWER KNOB,12,7/14/2011 13:11,1.25,16928,United Kingdom
560026,21668,RED STRIPE CERAMIC DRAWER KNOB,12,7/14/2011 13:11,1.25,16928,United Kingdom
560026,21671,RED SPOT CERAMIC DRAWER KNOB,1,7/14/2011 13:11,1.25,16928,United Kingdom
560026,22775,PURPLE DRAWERKNOB ACRYLIC EDWARDIAN,12,7/14/2011 13:11,1.25,16928,United Kingdom
560026,22772,PINK DRAWER KNOB ACRYLIC EDWARDIAN,12,7/14/2011 13:11,1.25,16928,United Kingdom
560026,21669,BLUE STRIPE CERAMIC DRAWER KNOB,2,7/14/2011 13:11,1.25,16928,United Kingdom
560026,23033,DRAWER KNOB CERAMIC RED,8,7/14/2011 13:11,1.45,16928,United Kingdom
560026,23028,DRAWER KNOB CRACKLE GLAZE BLUE,2,7/14/2011 13:11,1.65,16928,United Kingdom
560026,22805,BLUE DRAWER KNOB ACRYLIC EDWARDIAN,5,7/14/2011 13:11,1.25,16928,United Kingdom
560026,21669,BLUE STRIPE CERAMIC DRAWER KNOB,2,7/14/2011 13:11,1.25,16928,United Kingdom
560026,23032,DRAWER KNOB CRACKLE GLAZE IVORY,1,7/14/2011 13:11,1.65,16928,United Kingdom
560026,22771,CLEAR DRAWER KNOB ACRYLIC EDWARDIAN,24,7/14/2011 13:11,1.25,16928,United Kingdom
560032,21874,GIN AND TONIC MUG,2,7/14/2011 13:20,1.25,18283,United Kingdom
560033,22910,PAPER CHAIN KIT VINTAGE CHRISTMAS,6,7/14/2011 13:28,2.95,12388,Australia
560033,22338,STAR DECORATION PAINTED ZINC ,24,7/14/2011 13:28,0.65,12388,Australia
560033,22576,SWALLOW WOODEN CHRISTMAS DECORATION,12,7/14/2011 13:28,0.85,12388,Australia
560033,22600,CHRISTMAS RETROSPOT STAR WOOD,12,7/14/2011 13:28,0.85,12388,Australia
560033,22478,BIRDHOUSE GARDEN MARKER ,10,7/14/2011 13:28,1.25,12388,Australia
560033,22496,SET OF 2 ROUND TINS DUTCH CHEESE,6,7/14/2011 13:28,2.95,12388,Australia
560033,22495,SET OF 2 ROUND TINS CAMEMBERT ,6,7/14/2011 13:28,2.95,12388,Australia
560033,22310,IVORY KNITTED MUG COSY ,24,7/14/2011 13:28,1.65,12388,Australia
560033,23019,SMALL APOTHECARY MEASURING JAR ,6,7/14/2011 13:28,7.45,12388,Australia
560033,23017,APOTHECARY MEASURING JAR,6,7/14/2011 13:28,11.15,12388,Australia
560033,23024,LARGE BONNE JAM JAR  T-LIGHT HOLDER,24,7/14/2011 13:28,2.89,12388,Australia
560033,23236,DOILEY STORAGE TIN,6,7/14/2011 13:28,2.89,12388,Australia
560033,23243,SET OF TEA COFFEE SUGAR TINS PANTRY,8,7/14/2011 13:28,4.95,12388,Australia
560033,23245,SET OF 3 REGENCY CAKE TINS,8,7/14/2011 13:28,4.95,12388,Australia
560033,23252,VINTAGE RED ENAMEL TRIM JUG ,8,7/14/2011 13:28,3.75,12388,Australia
560033,23249,VINTAGE RED ENAMEL TRIM PLATE,12,7/14/2011 13:28,1.65,12388,Australia
560033,23250,VINTAGE RED TRIM ENAMEL BOWL ,12,7/14/2011 13:28,1.25,12388,Australia
560033,23318,BOX OF 6 MINI VINTAGE CRACKERS,6,7/14/2011 13:28,2.49,12388,Australia
560033,23319,BOX OF 6 MINI 50'S CRACKERS,6,7/14/2011 13:28,2.49,12388,Australia
560033,22262,FELT EGG COSY CHICKEN,24,7/14/2011 13:28,0.85,12388,Australia
560033,23298,SPOTTY BUNTING,6,7/14/2011 13:28,4.95,12388,Australia
560033,47566,PARTY BUNTING,8,7/14/2011 13:28,4.95,12388,Australia
560033,47590A,BLUE HAPPY BIRTHDAY BUNTING,3,7/14/2011 13:28,5.45,12388,Australia
560033,47590B,PINK HAPPY BIRTHDAY BUNTING,6,7/14/2011 13:28,5.45,12388,Australia
560033,71459,HANGING JAM JAR T-LIGHT HOLDER,12,7/14/2011 13:28,0.85,12388,Australia
560033,84970L,SINGLE HEART ZINC T-LIGHT HOLDER,12,7/14/2011 13:28,0.95,12388,Australia
560033,84978,HANGING HEART JAR T-LIGHT HOLDER,12,7/14/2011 13:28,1.25,12388,Australia
560033,22580,ADVENT CALENDAR GINGHAM SACK,6,7/14/2011 13:28,5.95,12388,Australia
560033,22086,PAPER CHAIN KIT 50'S CHRISTMAS ,6,7/14/2011 13:28,2.95,12388,Australia
560033,23311,VINTAGE CHRISTMAS STOCKING ,12,7/14/2011 13:28,2.55,12388,Australia
560033,23294,SET OF 6 SNACK LOAF BAKING CASES,24,7/14/2011 13:28,0.83,12388,Australia
560033,23293,SET OF 12 FAIRY CAKE BAKING CASES,24,7/14/2011 13:28,0.83,12388,Australia
560033,23295,SET OF 12 MINI LOAF BAKING CASES,24,7/14/2011 13:28,0.83,12388,Australia
560033,23297,SET 40 HEART SHAPE PETIT FOUR CASES,24,7/14/2011 13:28,1.65,12388,Australia
560033,23296,SET OF 6 TEA TIME BAKING CASES,24,7/14/2011 13:28,1.25,12388,Australia
560034,22138,BAKING SET 9 PIECE RETROSPOT ,3,7/14/2011 13:35,4.95,13933,United Kingdom
560034,23236,DOILEY STORAGE TIN,6,7/14/2011 13:35,2.89,13933,United Kingdom
560034,20749,ASSORTED COLOUR MINI CASES,4,7/14/2011 13:35,7.95,13933,United Kingdom
560034,22720,SET OF 3 CAKE TINS PANTRY DESIGN ,3,7/14/2011 13:35,4.95,13933,United Kingdom
560034,23298,SPOTTY BUNTING,3,7/14/2011 13:35,4.95,13933,United Kingdom
560034,23198,PANTRY MAGNETIC  SHOPPING LIST,12,7/14/2011 13:35,1.45,13933,United Kingdom
560034,23299,FOOD COVER WITH BEADS SET 2 ,6,7/14/2011 13:35,3.75,13933,United Kingdom
560034,22969,HOMEMADE JAM SCENTED CANDLES,12,7/14/2011 13:35,1.45,13933,United Kingdom
560034,22666,RECIPE BOX PANTRY YELLOW DESIGN,6,7/14/2011 13:35,2.95,13933,United Kingdom
560034,84987,SET OF 36 TEATIME PAPER DOILIES,12,7/14/2011 13:35,1.45,13933,United Kingdom
560034,23306,SET OF 36 DOILIES PANTRY DESIGN,12,7/14/2011 13:35,1.45,13933,United Kingdom
560034,22692,DOORMAT WELCOME TO OUR HOME,10,7/14/2011 13:35,6.75,13933,United Kingdom
560034,21231,SWEETHEART CERAMIC TRINKET BOX,12,7/14/2011 13:35,1.25,13933,United Kingdom
560034,21232,STRAWBERRY CERAMIC TRINKET BOX,12,7/14/2011 13:35,1.25,13933,United Kingdom
560035,85066,CREAM SWEETHEART MINI CHEST,3,7/14/2011 13:41,12.75,17706,United Kingdom
560035,23112,PARISIENNE CURIO CABINET,3,7/14/2011 13:41,7.5,17706,United Kingdom
560035,23137,ZINC WIRE SWEETHEART LETTER TRAY,4,7/14/2011 13:41,3.75,17706,United Kingdom
560035,23152,IVORY SWEETHEART WIRE LETTER RACK ,4,7/14/2011 13:41,3.75,17706,United Kingdom
560035,21231,SWEETHEART CERAMIC TRINKET BOX,12,7/14/2011 13:41,1.25,17706,United Kingdom
560035,23298,SPOTTY BUNTING,6,7/14/2011 13:41,4.95,17706,United Kingdom
560035,17003,BROCADE RING PURSE ,36,7/14/2011 13:41,0.29,17706,United Kingdom
560035,20685,DOORMAT RED RETROSPOT,6,7/14/2011 13:41,7.95,17706,United Kingdom
560035,15044D,RED PAPER PARASOL,6,7/14/2011 13:41,2.95,17706,United Kingdom
560035,15044C,PURPLE PAPER PARASOL,6,7/14/2011 13:41,2.95,17706,United Kingdom
560035,15044B,BLUE PAPER PARASOL ,6,7/14/2011 13:41,2.95,17706,United Kingdom
560035,15044A,PINK PAPER PARASOL ,6,7/14/2011 13:41,2.95,17706,United Kingdom
560035,21340,CLASSIC METAL BIRDCAGE PLANT HOLDER,3,7/14/2011 13:41,12.75,17706,United Kingdom
560035,15036,ASSORTED COLOURS SILK FAN,24,7/14/2011 13:41,0.83,17706,United Kingdom
560035,84836,ZINC METAL HEART DECORATION,24,7/14/2011 13:41,1.25,17706,United Kingdom
560035,16156S,WRAP PINK FAIRY CAKES ,25,7/14/2011 13:41,0.42,17706,United Kingdom
560035,84247G,"DECOUPAGE,GREETING CARD,",24,7/14/2011 13:41,0.42,17706,United Kingdom
560035,23028,DRAWER KNOB CRACKLE GLAZE BLUE,36,7/14/2011 13:41,1.65,17706,United Kingdom
560035,23029,DRAWER KNOB CRACKLE GLAZE GREEN,36,7/14/2011 13:41,1.65,17706,United Kingdom
560035,23032,DRAWER KNOB CRACKLE GLAZE IVORY,36,7/14/2011 13:41,1.65,17706,United Kingdom
560035,23026,DRAWER KNOB VINTAGE GLASS STAR,24,7/14/2011 13:41,2.08,17706,United Kingdom
560035,48111,DOORMAT 3 SMILEY CATS,6,7/14/2011 13:41,7.95,17706,United Kingdom
560035,21278,VINTAGE KITCHEN PRINT PUDDINGS,6,7/14/2011 13:41,2.55,17706,United Kingdom
560035,85059,FRENCH ENAMEL WATER BASIN,6,7/14/2011 13:41,3.75,17706,United Kingdom
560035,85099B,JUMBO BAG RED RETROSPOT,10,7/14/2011 13:41,2.08,17706,United Kingdom
560035,85053,FRENCH ENAMEL CANDLEHOLDER,6,7/14/2011 13:41,2.1,17706,United Kingdom
560035,79000,MOROCCAN TEA GLASS,24,7/14/2011 13:41,0.85,17706,United Kingdom
560035,82613A,"METAL SIGN,CUPCAKE SINGLE HOOK",25,7/14/2011 13:41,1.25,17706,United Kingdom
560035,84795B,SUNSET CHECK HAMMOCK,12,7/14/2011 13:41,7.95,17706,United Kingdom
560035,48138,DOORMAT UNION FLAG,6,7/14/2011 13:41,7.95,17706,United Kingdom
560035,48194,DOORMAT HEARTS,6,7/14/2011 13:41,7.95,17706,United Kingdom
560035,84030E,ENGLISH ROSE HOT WATER BOTTLE,6,7/14/2011 13:41,4.25,17706,United Kingdom
560035,82494L,WOODEN FRAME ANTIQUE WHITE ,6,7/14/2011 13:41,2.95,17706,United Kingdom
560035,82482,WOODEN PICTURE FRAME WHITE FINISH,6,7/14/2011 13:41,2.55,17706,United Kingdom
560035,85184C,SET 4 VALENTINE DECOUPAGE HEART BOX,18,7/14/2011 13:41,2.95,17706,United Kingdom
560035,84968A,SET OF 16 VINTAGE ROSE CUTLERY,6,7/14/2011 13:41,12.75,17706,United Kingdom
560035,37501,TEA TIME TEA SET IN GIFT BOX,6,7/14/2011 13:41,6.95,17706,United Kingdom
560035,47580,TEA TIME DES TEA COSY,6,7/14/2011 13:41,2.55,17706,United Kingdom
560035,84406B,CREAM CUPID HEARTS COAT HANGER,6,7/14/2011 13:41,4.15,17706,United Kingdom
560035,84792,ENCHANTED BIRD COATHANGER 5 HOOK,6,7/14/2011 13:41,4.65,17706,United Kingdom
560035,71477,COLOUR GLASS. STAR T-LIGHT HOLDER,6,7/14/2011 13:41,3.25,17706,United Kingdom
560035,85231G,ORANGE SCENTED SET/9 T-LIGHTS,6,7/14/2011 13:41,0.85,17706,United Kingdom
560035,40001,WHITE BAMBOO RIBS LAMPSHADE,24,7/14/2011 13:41,0.85,17706,United Kingdom
560035,71038,WHITE HANGING BEADS CANDLE HOLDER,6,7/14/2011 13:41,5.45,17706,United Kingdom
560035,85123A,WHITE HANGING HEART T-LIGHT HOLDER,6,7/14/2011 13:41,2.95,17706,United Kingdom
560035,21159,MOODY BOY  DOOR HANGER ,12,7/14/2011 13:41,1.45,17706,United Kingdom
560035,21248,DOOR HANGER  MUM + DADS ROOM,12,7/14/2011 13:41,1.45,17706,United Kingdom
560035,82600,NO SINGING METAL SIGN,12,7/14/2011 13:41,2.1,17706,United Kingdom
560035,21163,DO NOT TOUCH MY STUFF DOOR HANGER ,12,7/14/2011 13:41,1.45,17706,United Kingdom
560035,21169,YOU'RE CONFUSING ME METAL SIGN ,12,7/14/2011 13:41,1.69,17706,United Kingdom
560035,21174,POTTERING IN THE SHED METAL SIGN,12,7/14/2011 13:41,2.08,17706,United Kingdom
560035,21175,GIN + TONIC DIET METAL SIGN,12,7/14/2011 13:41,2.55,17706,United Kingdom
560035,21165,BEWARE OF THE CAT METAL SIGN ,12,7/14/2011 13:41,1.69,17706,United Kingdom
560035,85152,HAND OVER THE CHOCOLATE   SIGN ,12,7/14/2011 13:41,2.1,17706,United Kingdom
560035,21080,SET/20 RED RETROSPOT PAPER NAPKINS ,12,7/14/2011 13:41,0.85,17706,United Kingdom
560035,21217,RED RETROSPOT ROUND CAKE TINS,4,7/14/2011 13:41,9.95,17706,United Kingdom
560035,21242,RED RETROSPOT PLATE ,12,7/14/2011 13:41,1.69,17706,United Kingdom
560035,21041,RED RETROSPOT OVEN GLOVE DOUBLE,6,7/14/2011 13:41,2.95,17706,United Kingdom
560035,21284,RETROSPOT CANDLE  SMALL,12,7/14/2011 13:41,1.69,17706,United Kingdom
560035,20682,RED RETROSPOT CHILDRENS UMBRELLA,6,7/14/2011 13:41,3.25,17706,United Kingdom
560035,20754,RETROSPOT RED WASHING UP GLOVES,6,7/14/2011 13:41,2.1,17706,United Kingdom
560035,23249,VINTAGE RED ENAMEL TRIM PLATE,12,7/14/2011 13:41,1.65,17706,United Kingdom
560035,23240,SET OF 4 KNICK KNACK TINS DOILEY ,12,7/14/2011 13:41,4.15,17706,United Kingdom
560035,23252,VINTAGE RED ENAMEL TRIM JUG ,12,7/14/2011 13:41,3.75,17706,United Kingdom
560035,23251,VINTAGE RED ENAMEL TRIM MUG ,36,7/14/2011 13:41,1.25,17706,United Kingdom
560035,23142,IVORY WIRE KITCHEN ORGANISER,6,7/14/2011 13:41,10.4,17706,United Kingdom
560035,23181,BULL DOG BOTTLE TOP WALL CLOCK,4,7/14/2011 13:41,8.25,17706,United Kingdom
560035,23155,KNICKERBOCKERGLORY MAGNET ASSORTED ,24,7/14/2011 13:41,0.83,17706,United Kingdom
560035,23064,CINDERELLA CHANDELIER ,3,7/14/2011 13:41,49.95,17706,United Kingdom
560035,84946,ANTIQUE SILVER T-LIGHT GLASS,24,7/14/2011 13:41,1.25,17706,United Kingdom
560035,23039,T-LIGHT HOLDER SILVER HEART HANDLE,12,7/14/2011 13:41,1.95,17706,United Kingdom
560035,23143,ZINC WIRE KITCHEN ORGANISER,3,7/14/2011 13:41,10.4,17706,United Kingdom
560036,21163,DO NOT TOUCH MY STUFF DOOR HANGER ,24,7/14/2011 13:51,0.39,14911,EIRE
560036,22269,EGG CUP NATURAL CHICKEN,16,7/14/2011 13:51,0.39,14911,EIRE
560036,23186,FRENCH STYLE STORAGE JAR CAFE ,96,7/14/2011 13:51,0.29,14911,EIRE
560036,23187,FRENCH STYLE STORAGE JAR BONBONS,48,7/14/2011 13:51,0.29,14911,EIRE
560036,37342,POLKADOT COFFEE CUP & SAUCER PINK,24,7/14/2011 13:51,0.79,14911,EIRE
560036,85194S,HANGING SPRING FLOWER EGG SMALL,48,7/14/2011 13:51,0.19,14911,EIRE
560036,23201,JUMBO BAG ALPHABET,10,7/14/2011 13:51,2.08,14911,EIRE
560036,23202,JUMBO BAG VINTAGE LEAF,10,7/14/2011 13:51,2.08,14911,EIRE
560036,23203,JUMBO BAG DOILEY PATTERNS,10,7/14/2011 13:51,2.08,14911,EIRE
560036,23205,CHARLOTTE BAG VINTAGE ALPHABET ,10,7/14/2011 13:51,0.85,14911,EIRE
560036,22278,OVERNIGHT BAG VINTAGE ROSE PAISLEY,6,7/14/2011 13:51,4.95,14911,EIRE
560036,48188,DOORMAT WELCOME PUPPIES,2,7/14/2011 13:51,7.95,14911,EIRE
560036,48187,DOORMAT NEW ENGLAND,2,7/14/2011 13:51,7.95,14911,EIRE
560036,21523,DOORMAT FANCY FONT HOME SWEET HOME,2,7/14/2011 13:51,7.95,14911,EIRE
560036,22693,GROW A FLYTRAP OR SUNFLOWER IN TIN,24,7/14/2011 13:51,1.25,14911,EIRE
560036,21259,VICTORIAN SEWING BOX SMALL ,2,7/14/2011 13:51,5.95,14911,EIRE
560036,21172,PARTY METAL SIGN ,12,7/14/2011 13:51,1.45,14911,EIRE
560036,85123A,WHITE HANGING HEART T-LIGHT HOLDER,24,7/14/2011 13:51,2.95,14911,EIRE
560036,21469,POLKA DOT RAFFIA FOOD COVER,6,7/14/2011 13:51,3.75,14911,EIRE
560036,21467,CHERRY CROCHET FOOD COVER,6,7/14/2011 13:51,3.75,14911,EIRE
560036,22197,POPCORN HOLDER,48,7/14/2011 13:51,0.85,14911,EIRE
560036,37475,SET/4 COLOURFUL MIXING BOWLS,3,7/14/2011 13:51,9.95,14911,EIRE
560036,23171,REGENCY TEA PLATE GREEN ,12,7/14/2011 13:51,1.65,14911,EIRE
560036,23172,REGENCY TEA PLATE PINK,12,7/14/2011 13:51,1.65,14911,EIRE
560036,23170,REGENCY TEA PLATE ROSES ,12,7/14/2011 13:51,1.65,14911,EIRE
560036,22698,PINK REGENCY TEACUP AND SAUCER,6,7/14/2011 13:51,2.95,14911,EIRE
560036,22699,ROSES REGENCY TEACUP AND SAUCER ,6,7/14/2011 13:51,2.95,14911,EIRE
560036,22697,GREEN REGENCY TEACUP AND SAUCER,6,7/14/2011 13:51,2.95,14911,EIRE
560036,22425,ENAMEL COLANDER CREAM,6,7/14/2011 13:51,4.95,14911,EIRE
560036,22429,ENAMEL MEASURING JUG CREAM,8,7/14/2011 13:51,4.25,14911,EIRE
560036,22427,ENAMEL FLOWER JUG CREAM,3,7/14/2011 13:51,5.95,14911,EIRE
560036,23308,SET OF 60 VINTAGE LEAF CAKE CASES ,24,7/14/2011 13:51,0.55,14911,EIRE
560036,23307,SET OF 60 PANTRY DESIGN CAKE CASES ,24,7/14/2011 13:51,0.55,14911,EIRE
560036,84991,60 TEATIME FAIRY CAKE CASES,24,7/14/2011 13:51,0.55,14911,EIRE
560036,22424,ENAMEL BREAD BIN CREAM,1,7/14/2011 13:51,12.75,14911,EIRE
560036,22847,BREAD BIN DINER STYLE IVORY,4,7/14/2011 13:51,14.95,14911,EIRE
560036,22846,BREAD BIN DINER STYLE RED ,2,7/14/2011 13:51,16.95,14911,EIRE
560036,22720,SET OF 3 CAKE TINS PANTRY DESIGN ,3,7/14/2011 13:51,4.95,14911,EIRE
560036,22979,PANTRY WASHING UP BRUSH,12,7/14/2011 13:51,1.45,14911,EIRE
560036,22980,PANTRY SCRUBBING BRUSH,12,7/14/2011 13:51,1.65,14911,EIRE
560036,22978,PANTRY ROLLING PIN,6,7/14/2011 13:51,3.75,14911,EIRE
560036,22993,SET OF 4 PANTRY JELLY MOULDS,12,7/14/2011 13:51,1.25,14911,EIRE
560036,23165,LARGE CERAMIC TOP STORAGE JAR,12,7/14/2011 13:51,1.65,14911,EIRE
560036,23167,SMALL CERAMIC TOP STORAGE JAR ,12,7/14/2011 13:51,0.83,14911,EIRE
560036,23209,LUNCH BAG DOILEY PATTERN ,10,7/14/2011 13:51,1.65,14911,EIRE
560036,23208,LUNCH BAG VINTAGE LEAF DESIGN,10,7/14/2011 13:51,1.65,14911,EIRE
560036,22423,REGENCY CAKESTAND 3 TIER,16,7/14/2011 13:51,10.95,14911,EIRE
560037,22242,,-34,7/14/2011 14:00,0,,United Kingdom
560038,22333,RETROSPOT PARTY BAG + STICKER SET,32,7/14/2011 14:08,1.65,12709,Germany
560038,21094,SET/6 RED SPOTTY PAPER PLATES,40,7/14/2011 14:08,0.85,12709,Germany
560038,21086,SET/6 RED SPOTTY PAPER CUPS,40,7/14/2011 14:08,0.65,12709,Germany
560038,21080,SET/20 RED RETROSPOT PAPER NAPKINS ,12,7/14/2011 14:08,0.85,12709,Germany
560038,22627,MINT KITCHEN SCALES,4,7/14/2011 14:08,8.5,12709,Germany
560038,21242,RED RETROSPOT PLATE ,16,7/14/2011 14:08,1.69,12709,Germany
560038,21244,BLUE POLKADOT PLATE ,16,7/14/2011 14:08,1.69,12709,Germany
560038,21238,RED RETROSPOT CUP,24,7/14/2011 14:08,0.85,12709,Germany
560038,21239,PINK  POLKADOT CUP,24,7/14/2011 14:08,0.85,12709,Germany
560038,20685,DOORMAT RED RETROSPOT,20,7/14/2011 14:08,6.75,12709,Germany
560038,21658,GLASS  BEURRE DISH,20,7/14/2011 14:08,3.95,12709,Germany
560038,22090,PAPER BUNTING RETROSPOT,20,7/14/2011 14:08,2.95,12709,Germany
560038,22423,REGENCY CAKESTAND 3 TIER,32,7/14/2011 14:08,10.95,12709,Germany
560039,20713,wrongly marked. 23343 in box,-3100,7/14/2011 14:27,0,,United Kingdom
560040,23343,came coded as 20713,3100,7/14/2011 14:28,0,,United Kingdom
560041,22569,FELTCRAFT CUSHION BUTTERFLY,4,7/14/2011 14:46,3.75,14156,EIRE
560041,22568,FELTCRAFT CUSHION OWL,4,7/14/2011 14:46,3.75,14156,EIRE
560041,15036,ASSORTED COLOURS SILK FAN,24,7/14/2011 14:46,0.83,14156,EIRE
560041,21218,RED SPOTTY BISCUIT TIN,6,7/14/2011 14:46,3.75,14156,EIRE
560041,21216,"SET 3 RETROSPOT TEA,COFFEE,SUGAR",4,7/14/2011 14:46,4.95,14156,EIRE
560041,21539,RED RETROSPOT BUTTER DISH,3,7/14/2011 14:46,4.95,14156,EIRE
560041,21535,RED RETROSPOT SMALL MILK JUG,6,7/14/2011 14:46,2.55,14156,EIRE
560041,21531,RED RETROSPOT SUGAR JAM BOWL,6,7/14/2011 14:46,2.55,14156,EIRE
560041,22960,JAM MAKING SET WITH JARS,24,7/14/2011 14:46,3.75,14156,EIRE
560041,84997B,CHILDRENS CUTLERY RETROSPOT RED ,6,7/14/2011 14:46,4.15,14156,EIRE
560041,84997C,CHILDRENS CUTLERY POLKADOT BLUE,6,7/14/2011 14:46,4.15,14156,EIRE
560041,84997D,CHILDRENS CUTLERY POLKADOT PINK,6,7/14/2011 14:46,4.15,14156,EIRE
560041,22423,REGENCY CAKESTAND 3 TIER,4,7/14/2011 14:46,12.75,14156,EIRE
560041,84987,SET OF 36 TEATIME PAPER DOILIES,12,7/14/2011 14:46,1.45,14156,EIRE
560041,21466,RED FLOWER CROCHET FOOD COVER,6,7/14/2011 14:46,3.75,14156,EIRE
560041,21465,PINK FLOWER CROCHET FOOD COVER,6,7/14/2011 14:46,3.75,14156,EIRE
560041,22627,MINT KITCHEN SCALES,2,7/14/2011 14:46,8.5,14156,EIRE
560041,22626,BLACK KITCHEN SCALES,2,7/14/2011 14:46,8.5,14156,EIRE
560041,22625,RED KITCHEN SCALES,2,7/14/2011 14:46,8.5,14156,EIRE
560041,22624,IVORY KITCHEN SCALES,2,7/14/2011 14:46,8.5,14156,EIRE
560041,22667,RECIPE BOX RETROSPOT ,6,7/14/2011 14:46,2.95,14156,EIRE
560041,22191,IVORY DINER WALL CLOCK,2,7/14/2011 14:46,8.5,14156,EIRE
560041,22192,BLUE DINER WALL CLOCK,2,7/14/2011 14:46,8.5,14156,EIRE
560041,22193,RED DINER WALL CLOCK,2,7/14/2011 14:46,8.5,14156,EIRE
560041,22558,CLOTHES PEGS RETROSPOT PACK 24 ,12,7/14/2011 14:46,1.65,14156,EIRE
560041,22567,20 DOLLY PEGS RETROSPOT,12,7/14/2011 14:46,1.45,14156,EIRE
560041,22467,GUMBALL COAT RACK,6,7/14/2011 14:46,2.55,14156,EIRE
560041,C2,CARRIAGE,1,7/14/2011 14:46,50,14156,EIRE
560042,20727,LUNCH BAG  BLACK SKULL.,10,7/14/2011 14:46,1.65,17068,United Kingdom
560042,23206,LUNCH BAG APPLE DESIGN,10,7/14/2011 14:46,1.65,17068,United Kingdom
560042,22379,RECYCLING BAG RETROSPOT ,5,7/14/2011 14:46,2.1,17068,United Kingdom
560042,23203,JUMBO BAG DOILEY PATTERNS,10,7/14/2011 14:46,2.08,17068,United Kingdom
560042,23298,SPOTTY BUNTING,3,7/14/2011 14:46,4.95,17068,United Kingdom
560042,22377,BOTTLE BAG RETROSPOT ,5,7/14/2011 14:46,2.1,17068,United Kingdom
560042,22381,TOY TIDY PINK POLKADOT,5,7/14/2011 14:46,2.1,17068,United Kingdom
560042,20726,LUNCH BAG WOODLAND,10,7/14/2011 14:46,1.65,17068,United Kingdom
560042,22384,LUNCH BAG PINK POLKADOT,10,7/14/2011 14:46,1.65,17068,United Kingdom
560042,22662,LUNCH BAG DOLLY GIRL DESIGN,10,7/14/2011 14:46,1.65,17068,United Kingdom
560042,23202,JUMBO BAG VINTAGE LEAF,10,7/14/2011 14:46,2.08,17068,United Kingdom
C560043,21704,BAG 250g SWIRLY MARBLES,-2,7/14/2011 14:47,0.72,16656,United Kingdom
C560044,22776,SWEETHEART CAKESTAND 3 TIER,-2,7/14/2011 14:47,9.95,14258,United Kingdom
C560045,84692,BOX OF 24 COCKTAIL PARASOLS,-1,7/14/2011 14:51,0.42,16779,United Kingdom
C560045,71477,COLOUR GLASS. STAR T-LIGHT HOLDER,-1,7/14/2011 14:51,2.75,16779,United Kingdom
C560045,71053,WHITE METAL LANTERN,-2,7/14/2011 14:51,3.39,16779,United Kingdom
C560046,23092,LARGE ANTIQUE WHITE PHOTO FRAME,-1,7/14/2011 14:55,7.9,17049,United Kingdom
560047,23242,TREASURE TIN BUFFALO BILL ,1,7/14/2011 15:01,2.08,17259,United Kingdom
560047,22139,RETROSPOT TEA SET CERAMIC 11 PC ,1,7/14/2011 15:01,4.95,17259,United Kingdom
560047,22623,BOX OF VINTAGE JIGSAW BLOCKS ,1,7/14/2011 15:01,5.95,17259,United Kingdom
560047,22491,PACK OF 12 COLOURED PENCILS,1,7/14/2011 15:01,0.85,17259,United Kingdom
560047,47566,PARTY BUNTING,1,7/14/2011 15:01,4.95,17259,United Kingdom
560047,21719,LOVELY BONBON STICKER SHEET,1,7/14/2011 15:01,0.85,17259,United Kingdom
