554994,21901,"KEY FOB , BACK DOOR ",1,5/29/2011 14:18,0.65,14606,United Kingdom
554994,21216,"SET 3 RETROSPOT TEA,COFFEE,SUGAR",1,5/29/2011 14:18,4.95,14606,United Kingdom
554994,22193,RED DINER WALL CLOCK,1,5/29/2011 14:18,8.5,14606,United Kingdom
554994,51014A,"FEATHER PEN,HOT PINK",12,5/29/2011 14:18,0.85,14606,United Kingdom
554994,22507,MEMO BOARD RETROSPOT  DESIGN,1,5/29/2011 14:18,4.95,14606,United Kingdom
554994,15044A,PINK PAPER PARASOL ,1,5/29/2011 14:18,2.95,14606,United Kingdom
554994,84031A,CHARLIE+LOLA RED HOT WATER BOTTLE ,1,5/29/2011 14:18,4.65,14606,United Kingdom
554994,84032B,CHARLIE + LOLA RED HOT WATER BOTTLE,1,5/29/2011 14:18,2.95,14606,United Kingdom
554994,21746,SMALL RED RETROSPOT WINDMILL,1,5/29/2011 14:18,1.25,14606,United Kingdom
554994,22366,DOORMAT AIRMAIL ,1,5/29/2011 14:18,7.95,14606,United Kingdom
554994,20914,SET/5 RED RETROSPOT LID GLASS BOWLS,1,5/29/2011 14:18,2.95,14606,United Kingdom
554994,21533,RETROSPOT LARGE MILK JUG,1,5/29/2011 14:18,4.95,14606,United Kingdom
554994,22467,GUMBALL COAT RACK,1,5/29/2011 14:18,2.55,14606,United Kingdom
554994,22219,LOVEBIRD HANGING DECORATION WHITE ,1,5/29/2011 14:18,0.85,14606,United Kingdom
554994,22136,LOVE HEART SOCK HANGER,1,5/29/2011 14:18,1.65,14606,United Kingdom
554995,22469,HEART OF WICKER SMALL,2,5/29/2011 14:23,1.65,18109,United Kingdom
554995,21218,RED SPOTTY BISCUIT TIN,2,5/29/2011 14:23,3.75,18109,United Kingdom
554995,23118,PARISIENNE JEWELLERY DRAWER ,3,5/29/2011 14:23,7.5,18109,United Kingdom
554995,22855,FINE WICKER HEART ,2,5/29/2011 14:23,1.25,18109,United Kingdom
554995,23110,PARISIENNE KEY CABINET ,1,5/29/2011 14:23,5.75,18109,United Kingdom
554995,22961,JAM MAKING SET PRINTED,2,5/29/2011 14:23,1.45,18109,United Kingdom
554995,22151,PLACE SETTING WHITE HEART,48,5/29/2011 14:23,0.42,18109,United Kingdom
554995,21577,SAVE THE PLANET COTTON TOTE BAG,2,5/29/2011 14:23,2.25,18109,United Kingdom
554995,23112,PARISIENNE CURIO CABINET,2,5/29/2011 14:23,7.5,18109,United Kingdom
554995,23067,HANGING ENGRAVED METAL HEART,4,5/29/2011 14:23,4.15,18109,United Kingdom
554995,84836,ZINC METAL HEART DECORATION,2,5/29/2011 14:23,1.25,18109,United Kingdom
554995,21447,12 IVORY ROSE PEG PLACE SETTINGS,1,5/29/2011 14:23,1.25,18109,United Kingdom
554995,21446,12 RED ROSE PEG PLACE SETTINGS,2,5/29/2011 14:23,1.25,18109,United Kingdom
554995,85123A,WHITE HANGING HEART T-LIGHT HOLDER,3,5/29/2011 14:23,2.95,18109,United Kingdom
554995,21259,VICTORIAN SEWING BOX SMALL ,2,5/29/2011 14:23,5.95,18109,United Kingdom
554995,22487,WHITE WOOD GARDEN PLANT LADDER,4,5/29/2011 14:23,8.5,18109,United Kingdom
554996,21742,LARGE ROUND WICKER PLATTER ,1,5/29/2011 14:28,5.95,16407,United Kingdom
554996,48138,DOORMAT UNION FLAG,1,5/29/2011 14:28,7.95,16407,United Kingdom
554996,22469,HEART OF WICKER SMALL,10,5/29/2011 14:28,1.65,16407,United Kingdom
554996,22470,HEART OF WICKER LARGE,10,5/29/2011 14:28,2.95,16407,United Kingdom
554996,85123A,WHITE HANGING HEART T-LIGHT HOLDER,2,5/29/2011 14:28,2.95,16407,United Kingdom
554996,21733,RED HANGING HEART T-LIGHT HOLDER,2,5/29/2011 14:28,2.95,16407,United Kingdom
554996,82486,WOOD S/3 CABINET ANT WHITE FINISH,4,5/29/2011 14:28,8.95,16407,United Kingdom
554996,21673,WHITE SPOT BLUE CERAMIC DRAWER KNOB,6,5/29/2011 14:28,1.25,16407,United Kingdom
554996,21670,BLUE SPOT CERAMIC DRAWER KNOB,6,5/29/2011 14:28,1.25,16407,United Kingdom
554996,21669,BLUE STRIPE CERAMIC DRAWER KNOB,6,5/29/2011 14:28,1.25,16407,United Kingdom
554996,21668,RED STRIPE CERAMIC DRAWER KNOB,6,5/29/2011 14:28,1.25,16407,United Kingdom
554996,22773,GREEN DRAWER KNOB ACRYLIC EDWARDIAN,12,5/29/2011 14:28,1.25,16407,United Kingdom
554996,22772,PINK DRAWER KNOB ACRYLIC EDWARDIAN,12,5/29/2011 14:28,1.25,16407,United Kingdom
554996,22771,CLEAR DRAWER KNOB ACRYLIC EDWARDIAN,12,5/29/2011 14:28,1.25,16407,United Kingdom
554996,21754,HOME BUILDING BLOCK WORD,1,5/29/2011 14:28,5.95,16407,United Kingdom
554996,21756,BATH BUILDING BLOCK WORD,1,5/29/2011 14:28,5.95,16407,United Kingdom
554997,22336,DOVE DECORATION PAINTED ZINC ,48,5/29/2011 15:35,0.65,16746,United Kingdom
554997,23082,SET 6 PAPER TABLE LANTERN HEARTS ,6,5/29/2011 15:35,3.75,16746,United Kingdom
554997,23084,RABBIT NIGHT LIGHT,6,5/29/2011 15:35,2.08,16746,United Kingdom
554997,23203,JUMBO BAG DOILEY PATTERNS,10,5/29/2011 15:35,2.08,16746,United Kingdom
554997,23202,JUMBO BAG VINTAGE LEAF,10,5/29/2011 15:35,2.08,16746,United Kingdom
554997,23209,LUNCH BAG DOILEY PATTERN ,10,5/29/2011 15:35,1.65,16746,United Kingdom
554997,20726,LUNCH BAG WOODLAND,10,5/29/2011 15:35,1.65,16746,United Kingdom
554997,22382,LUNCH BAG SPACEBOY DESIGN ,10,5/29/2011 15:35,1.65,16746,United Kingdom
554997,23206,LUNCH BAG APPLE DESIGN,10,5/29/2011 15:35,1.65,16746,United Kingdom
554997,20712,JUMBO BAG WOODLAND ANIMALS,10,5/29/2011 15:35,2.08,16746,United Kingdom
554997,22386,JUMBO BAG PINK POLKADOT,10,5/29/2011 15:35,2.08,16746,United Kingdom
554997,85099B,JUMBO BAG RED RETROSPOT,10,5/29/2011 15:35,2.08,16746,United Kingdom
554997,23199,JUMBO BAG APPLES,10,5/29/2011 15:35,2.08,16746,United Kingdom
554997,22027,TEA PARTY BIRTHDAY CARD,12,5/29/2011 15:35,0.42,16746,United Kingdom
554997,22712,CARD DOLLY GIRL ,12,5/29/2011 15:35,0.42,16746,United Kingdom
554997,22948,METAL DECORATION NAUGHTY CHILDREN ,24,5/29/2011 15:35,0.85,16746,United Kingdom
554997,22900, SET 2 TEA TOWELS I LOVE LONDON ,6,5/29/2011 15:35,3.25,16746,United Kingdom
554997,20971,PINK BLUE FELT CRAFT TRINKET BOX,12,5/29/2011 15:35,1.25,16746,United Kingdom
554998,22423,REGENCY CAKESTAND 3 TIER,3,5/29/2011 15:35,12.75,15925,United Kingdom
554998,84347,ROTATING SILVER ANGELS T-LIGHT HLDR,12,5/29/2011 15:35,2.55,15925,United Kingdom
554998,85152,HAND OVER THE CHOCOLATE   SIGN ,12,5/29/2011 15:35,2.1,15925,United Kingdom
554998,79000,MOROCCAN TEA GLASS,12,5/29/2011 15:35,0.85,15925,United Kingdom
554998,82482,WOODEN PICTURE FRAME WHITE FINISH,6,5/29/2011 15:35,2.55,15925,United Kingdom
554998,23170,REGENCY TEA PLATE ROSES ,12,5/29/2011 15:35,1.65,15925,United Kingdom
554998,84987,SET OF 36 TEATIME PAPER DOILIES,4,5/29/2011 15:35,1.45,15925,United Kingdom
554998,84988,SET OF 72 PINK HEART PAPER DOILIES,4,5/29/2011 15:35,1.45,15925,United Kingdom
554998,21974,SET OF 36 PAISLEY FLOWER DOILIES,4,5/29/2011 15:35,1.45,15925,United Kingdom
554998,84821,DANISH ROSE DELUXE COASTER,12,5/29/2011 15:35,0.85,15925,United Kingdom
554998,23174,REGENCY SUGAR BOWL GREEN,4,5/29/2011 15:35,4.15,15925,United Kingdom
554998,22863,SOAP DISH BROCANTE,8,5/29/2011 15:35,2.95,15925,United Kingdom
554999,21922,UNION STRIPE WITH FRINGE  HAMMOCK,1,5/29/2011 15:44,7.95,15547,United Kingdom
554999,23298,SPOTTY BUNTING,1,5/29/2011 15:44,4.95,15547,United Kingdom
554999,85123A,WHITE HANGING HEART T-LIGHT HOLDER,6,5/29/2011 15:44,2.95,15547,United Kingdom
554999,84991,60 TEATIME FAIRY CAKE CASES,1,5/29/2011 15:44,0.55,15547,United Kingdom
554999,84992,72 SWEETHEART FAIRY CAKE CASES,2,5/29/2011 15:44,0.55,15547,United Kingdom
554999,20914,SET/5 RED RETROSPOT LID GLASS BOWLS,1,5/29/2011 15:44,2.95,15547,United Kingdom
554999,23118,PARISIENNE JEWELLERY DRAWER ,2,5/29/2011 15:44,7.5,15547,United Kingdom
554999,47566,PARTY BUNTING,1,5/29/2011 15:44,4.95,15547,United Kingdom
554999,37413,ICON MUG REVOLUTIONARY,30,5/29/2011 15:44,0.39,15547,United Kingdom
554999,21217,RED RETROSPOT ROUND CAKE TINS,1,5/29/2011 15:44,9.95,15547,United Kingdom
554999,21533,RETROSPOT LARGE MILK JUG,1,5/29/2011 15:44,4.95,15547,United Kingdom
554999,21539,RED RETROSPOT BUTTER DISH,1,5/29/2011 15:44,4.95,15547,United Kingdom
554999,37413,ICON MUG REVOLUTIONARY,6,5/29/2011 15:44,0.39,15547,United Kingdom
554999,23048,SET OF 10 LANTERNS FAIRY LIGHT STAR,2,5/29/2011 15:44,4.15,15547,United Kingdom
554999,21466,RED FLOWER CROCHET FOOD COVER,1,5/29/2011 15:44,3.75,15547,United Kingdom
554999,21470,FLOWER VINE RAFFIA FOOD COVER,2,5/29/2011 15:44,3.75,15547,United Kingdom
554999,20754,RETROSPOT RED WASHING UP GLOVES,2,5/29/2011 15:44,2.1,15547,United Kingdom
554999,82600,NO SINGING METAL SIGN,2,5/29/2011 15:44,2.1,15547,United Kingdom
554999,85152,HAND OVER THE CHOCOLATE   SIGN ,2,5/29/2011 15:44,2.1,15547,United Kingdom
554999,82582,AREA PATROLLED METAL SIGN,2,5/29/2011 15:44,2.1,15547,United Kingdom
554999,21165,BEWARE OF THE CAT METAL SIGN ,2,5/29/2011 15:44,1.69,15547,United Kingdom
554999,21175,GIN + TONIC DIET METAL SIGN,2,5/29/2011 15:44,2.55,15547,United Kingdom
554999,21174,POTTERING IN THE SHED METAL SIGN,1,5/29/2011 15:44,2.08,15547,United Kingdom
554999,22413,METAL SIGN TAKE IT OR LEAVE IT ,2,5/29/2011 15:44,2.95,15547,United Kingdom
554999,21908,CHOCOLATE THIS WAY METAL SIGN,2,5/29/2011 15:44,2.1,15547,United Kingdom
554999,21166,COOK WITH WINE METAL SIGN ,3,5/29/2011 15:44,2.08,15547,United Kingdom
554999,21905,MORE BUTTER METAL SIGN ,1,5/29/2011 15:44,2.1,15547,United Kingdom
554999,84949,SILVER HANGING T-LIGHT HOLDER,6,5/29/2011 15:44,1.65,15547,United Kingdom
554999,20718,RED RETROSPOT SHOPPER BAG,2,5/29/2011 15:44,1.25,15547,United Kingdom
554999,85099B,JUMBO BAG RED RETROSPOT,2,5/29/2011 15:44,2.08,15547,United Kingdom
554999,21473,SWEETHEART CREAM STEEL TABLE RECT,1,5/29/2011 15:44,19.95,15547,United Kingdom
554999,21476,STEEL SWEETHEART ROUND TABLE CREAM,2,5/29/2011 15:44,14.95,15547,United Kingdom
554999,21843,RED RETROSPOT CAKE STAND,1,5/29/2011 15:44,10.95,15547,United Kingdom
554999,22212,FOUR HOOK  WHITE LOVEBIRDS,2,5/29/2011 15:44,2.1,15547,United Kingdom
554999,82484,WOOD BLACK BOARD ANT WHITE FINISH,1,5/29/2011 15:44,7.95,15547,United Kingdom
554999,15034,PAPER POCKET TRAVELING FAN ,24,5/29/2011 15:44,0.14,15547,United Kingdom
554999,22840,ROUND CAKE TIN VINTAGE RED,1,5/29/2011 15:44,7.95,15547,United Kingdom
554999,23158,SET OF 5 LUCKY CAT MAGNETS ,2,5/29/2011 15:44,2.08,15547,United Kingdom
554999,23156,SET OF 5 MINI GROCERY MAGNETS,2,5/29/2011 15:44,2.08,15547,United Kingdom
554999,84978,HANGING HEART JAR T-LIGHT HOLDER,6,5/29/2011 15:44,1.25,15547,United Kingdom
554999,22460,EMBOSSED GLASS TEALIGHT HOLDER,4,5/29/2011 15:44,1.25,15547,United Kingdom
554999,17021,NAMASTE SWAGAT INCENSE,6,5/29/2011 15:44,0.3,15547,United Kingdom
554999,22794,SWEETHEART WIRE MAGAZINE RACK,1,5/29/2011 15:44,7.95,15547,United Kingdom
554999,85062,PEARL CRYSTAL PUMPKIN T-LIGHT HLDR,12,5/29/2011 15:44,1.65,15547,United Kingdom
554999,23145,ZINC T-LIGHT HOLDER STAR LARGE,12,5/29/2011 15:44,0.95,15547,United Kingdom
554999,84755,COLOUR GLASS T-LIGHT HOLDER HANGING,16,5/29/2011 15:44,0.65,15547,United Kingdom
554999,82486,WOOD S/3 CABINET ANT WHITE FINISH,2,5/29/2011 15:44,8.95,15547,United Kingdom
554999,79321,CHILLI LIGHTS,2,5/29/2011 15:44,5.75,15547,United Kingdom
554999,22354,RETROSPOT PADDED SEAT CUSHION,2,5/29/2011 15:44,3.75,15547,United Kingdom
554999,21259,VICTORIAN SEWING BOX SMALL ,1,5/29/2011 15:44,5.95,15547,United Kingdom
554999,44092C,PURPLE/COPPER HANGING LAMPSHADE,3,5/29/2011 15:44,0.85,15547,United Kingdom
554999,44092B,BLUE WHITE PLASTIC RINGS LAMPSHADE,1,5/29/2011 15:44,0.85,15547,United Kingdom
554999,20685,DOORMAT RED RETROSPOT,1,5/29/2011 15:44,7.95,15547,United Kingdom
554999,48111,DOORMAT 3 SMILEY CATS,1,5/29/2011 15:44,7.95,15547,United Kingdom
554999,48185,DOORMAT FAIRY CAKE,1,5/29/2011 15:44,7.95,15547,United Kingdom
554999,84358,FLOOR LAMP SHADE WOOD BASE,1,5/29/2011 15:44,9.95,15547,United Kingdom
555000,22776,SWEETHEART CAKESTAND 3 TIER,1,5/31/2011 8:03,9.95,18232,United Kingdom
555000,21906,PHARMACIE FIRST AID TIN,2,5/31/2011 8:03,6.75,18232,United Kingdom
555000,21340,CLASSIC METAL BIRDCAGE PLANT HOLDER,1,5/31/2011 8:03,12.75,18232,United Kingdom
555000,22341,LOVE GARLAND PAINTED ZINC ,12,5/31/2011 8:03,1.65,18232,United Kingdom
555000,22469,HEART OF WICKER SMALL,12,5/31/2011 8:03,1.65,18232,United Kingdom
555000,22470,HEART OF WICKER LARGE,6,5/31/2011 8:03,2.95,18232,United Kingdom
555000,22840,ROUND CAKE TIN VINTAGE RED,2,5/31/2011 8:03,7.95,18232,United Kingdom
555000,22822,CREAM WALL PLANTER HEART SHAPED,4,5/31/2011 8:03,5.95,18232,United Kingdom
555000,85040A,S/4 PINK FLOWER CANDLES IN BOWL,12,5/31/2011 8:03,1.65,18232,United Kingdom
555000,22969,HOMEMADE JAM SCENTED CANDLES,12,5/31/2011 8:03,1.45,18232,United Kingdom
555000,84949,SILVER HANGING T-LIGHT HOLDER,6,5/31/2011 8:03,1.65,18232,United Kingdom
555000,22960,JAM MAKING SET WITH JARS,6,5/31/2011 8:03,4.25,18232,United Kingdom
555000,21216,"SET 3 RETROSPOT TEA,COFFEE,SUGAR",4,5/31/2011 8:03,4.95,18232,United Kingdom
555000,22149,FELTCRAFT 6 FLOWER FRIENDS,6,5/31/2011 8:03,2.1,18232,United Kingdom
555000,21917,SET 12 KIDS  WHITE CHALK STICKS,24,5/31/2011 8:03,0.42,18232,United Kingdom
555000,22138,BAKING SET 9 PIECE RETROSPOT ,3,5/31/2011 8:03,4.95,18232,United Kingdom
555001,15056N,EDWARDIAN PARASOL NATURAL,12,5/31/2011 8:32,5.95,16566,United Kingdom
555001,84946,ANTIQUE SILVER T-LIGHT GLASS,72,5/31/2011 8:32,1.06,16566,United Kingdom
555001,84949,SILVER HANGING T-LIGHT HOLDER,18,5/31/2011 8:32,1.65,16566,United Kingdom
555001,21326,AGED GLASS SILVER T-LIGHT HOLDER,12,5/31/2011 8:32,0.65,16566,United Kingdom
555002,47566,PARTY BUNTING,8,5/31/2011 8:50,4.95,17682,United Kingdom
555002,20725,LUNCH BAG RED RETROSPOT,20,5/31/2011 8:50,1.65,17682,United Kingdom
555002,20728,LUNCH BAG CARS BLUE,20,5/31/2011 8:50,1.65,17682,United Kingdom
555002,22384,LUNCH BAG PINK POLKADOT,10,5/31/2011 8:50,1.65,17682,United Kingdom
555002,20726,LUNCH BAG WOODLAND,10,5/31/2011 8:50,1.65,17682,United Kingdom
555002,22382,LUNCH BAG SPACEBOY DESIGN ,10,5/31/2011 8:50,1.65,17682,United Kingdom
555002,22662,LUNCH BAG DOLLY GIRL DESIGN,10,5/31/2011 8:50,1.65,17682,United Kingdom
555002,20727,LUNCH BAG  BLACK SKULL.,10,5/31/2011 8:50,1.65,17682,United Kingdom
555002,22383,LUNCH BAG SUKI DESIGN ,10,5/31/2011 8:50,1.65,17682,United Kingdom
555002,23206,LUNCH BAG APPLE DESIGN,10,5/31/2011 8:50,1.65,17682,United Kingdom
555002,23207,LUNCH BAG ALPHABET DESIGN,10,5/31/2011 8:50,1.65,17682,United Kingdom
555002,23208,LUNCH BAG VINTAGE LEAF DESIGN,10,5/31/2011 8:50,1.65,17682,United Kingdom
555002,84879,ASSORTED COLOUR BIRD ORNAMENT,8,5/31/2011 8:50,1.69,17682,United Kingdom
555002,85123A,WHITE HANGING HEART T-LIGHT HOLDER,6,5/31/2011 8:50,2.95,17682,United Kingdom
555002,84978,HANGING HEART JAR T-LIGHT HOLDER,12,5/31/2011 8:50,1.25,17682,United Kingdom
555002,23112,PARISIENNE CURIO CABINET,4,5/31/2011 8:50,7.5,17682,United Kingdom
555002,23192,BUNDLE OF 3 ALPHABET EXERCISE BOOKS,12,5/31/2011 8:50,1.65,17682,United Kingdom
555003,23192,BUNDLE OF 3 ALPHABET EXERCISE BOOKS,12,5/31/2011 9:36,1.65,12787,Netherlands
555003,22445,PENCIL CASE LIFE IS BEAUTIFUL,12,5/31/2011 9:36,2.95,12787,Netherlands
555003,22077,6 RIBBONS RUSTIC CHARM,12,5/31/2011 9:36,1.65,12787,Netherlands
555003,22082,RIBBON REEL STRIPES DESIGN ,10,5/31/2011 9:36,1.65,12787,Netherlands
555003,21484,CHICK GREY HOT WATER BOTTLE,4,5/31/2011 9:36,3.45,12787,Netherlands
555003,84030E,ENGLISH ROSE HOT WATER BOTTLE,4,5/31/2011 9:36,4.25,12787,Netherlands
555003,23201,JUMBO BAG ALPHABET,10,5/31/2011 9:36,2.08,12787,Netherlands
555003,POST,POSTAGE,1,5/31/2011 9:36,15,12787,Netherlands
555004,22173,METAL 4 HOOK HANGER FRENCH CHATEAU,8,5/31/2011 9:37,2.95,13549,United Kingdom
555004,20983,12 PENCILS TALL TUBE RED RETROSPOT,12,5/31/2011 9:37,0.85,13549,United Kingdom
555004,20982,12 PENCILS TALL TUBE SKULLS,12,5/31/2011 9:37,0.85,13549,United Kingdom
555004,22423,REGENCY CAKESTAND 3 TIER,1,5/31/2011 9:37,12.75,13549,United Kingdom
555004,21039,RED RETROSPOT SHOPPING BAG,6,5/31/2011 9:37,2.55,13549,United Kingdom
555004,21115,ROSE CARAVAN DOORSTOP,2,5/31/2011 9:37,6.75,13549,United Kingdom
555004,22284,HEN HOUSE DECORATION,12,5/31/2011 9:37,1.65,13549,United Kingdom
555005,22998,TRAVEL CARD WALLET KEEP CALM,480,5/31/2011 9:38,0.36,16656,United Kingdom
555005,22725,ALARM CLOCK BAKELIKE CHOCOLATE,8,5/31/2011 9:38,3.75,16656,United Kingdom
555005,85049G,CHOCOLATE BOX RIBBONS ,144,5/31/2011 9:38,1.06,16656,United Kingdom
555005,21259,VICTORIAN SEWING BOX SMALL ,24,5/31/2011 9:38,4.95,16656,United Kingdom
555005,84691,PACK 20 DOLLY PEGS,80,5/31/2011 9:38,0.72,16656,United Kingdom
555005,21704,BAG 250g SWIRLY MARBLES,216,5/31/2011 9:38,0.72,16656,United Kingdom
555005,21790,VINTAGE SNAP CARDS,144,5/31/2011 9:38,0.72,16656,United Kingdom
555005,84508A,CAMOUFLAGE DESIGN TEDDY,144,5/31/2011 9:38,2.1,16656,United Kingdom
C555006,23301,GARDENERS KNEELING PAD KEEP CALM ,-48,5/31/2011 9:51,1.45,13694,United Kingdom
C555006,23300,GARDENERS KNEELING PAD CUP OF TEA ,-96,5/31/2011 9:51,1.45,13694,United Kingdom
555007,23301,GARDENERS KNEELING PAD KEEP CALM ,48,5/31/2011 9:52,1.45,13694,United Kingdom
555007,23300,GARDENERS KNEELING PAD CUP OF TEA ,96,5/31/2011 9:52,1.45,13694,United Kingdom
555008,47566,PARTY BUNTING,50,5/31/2011 10:24,4.15,17061,United Kingdom
555008,22423,REGENCY CAKESTAND 3 TIER,16,5/31/2011 10:24,10.95,17061,United Kingdom
555009,22178,VICTORIAN GLASS HANGING T-LIGHT,12,5/31/2011 10:32,1.25,17340,United Kingdom
555009,21326,AGED GLASS SILVER T-LIGHT HOLDER,36,5/31/2011 10:32,0.65,17340,United Kingdom
555009,84947,ANTIQUE SILVER TEA GLASS ENGRAVED,12,5/31/2011 10:32,1.25,17340,United Kingdom
555009,21169,YOU'RE CONFUSING ME METAL SIGN ,12,5/31/2011 10:32,1.69,17340,United Kingdom
555009,21175,GIN + TONIC DIET METAL SIGN,12,5/31/2011 10:32,2.55,17340,United Kingdom
555009,22728,ALARM CLOCK BAKELIKE PINK,4,5/31/2011 10:32,3.75,17340,United Kingdom
555009,21874,GIN AND TONIC MUG,12,5/31/2011 10:32,1.25,17340,United Kingdom
555009,21519,GIN & TONIC DIET GREETING CARD ,24,5/31/2011 10:32,0.42,17340,United Kingdom
555009,84949,SILVER HANGING T-LIGHT HOLDER,30,5/31/2011 10:32,1.65,17340,United Kingdom
555009,84946,ANTIQUE SILVER T-LIGHT GLASS,12,5/31/2011 10:32,1.25,17340,United Kingdom
555009,82482,WOODEN PICTURE FRAME WHITE FINISH,6,5/31/2011 10:32,2.55,17340,United Kingdom
555009,82484,WOOD BLACK BOARD ANT WHITE FINISH,12,5/31/2011 10:32,6.75,17340,United Kingdom
555009,82600,NO SINGING METAL SIGN,12,5/31/2011 10:32,2.1,17340,United Kingdom
555009,22413,METAL SIGN TAKE IT OR LEAVE IT ,12,5/31/2011 10:32,2.95,17340,United Kingdom
555009,21166,COOK WITH WINE METAL SIGN ,24,5/31/2011 10:32,2.08,17340,United Kingdom
555009,23155,KNICKERBOCKERGLORY MAGNET ASSORTED ,12,5/31/2011 10:32,0.83,17340,United Kingdom
555009,22727,ALARM CLOCK BAKELIKE RED ,4,5/31/2011 10:32,3.75,17340,United Kingdom
555009,22467,GUMBALL COAT RACK,24,5/31/2011 10:32,2.55,17340,United Kingdom
555009,22781,GUMBALL MAGAZINE RACK,6,5/31/2011 10:32,7.65,17340,United Kingdom
555009,22729,ALARM CLOCK BAKELIKE ORANGE,8,5/31/2011 10:32,3.75,17340,United Kingdom
555009,22730,ALARM CLOCK BAKELIKE IVORY,4,5/31/2011 10:32,3.75,17340,United Kingdom
555009,22725,ALARM CLOCK BAKELIKE CHOCOLATE,4,5/31/2011 10:32,3.75,17340,United Kingdom
555010,21272,SALLE DE BAIN HOOK,144,5/31/2011 10:38,1.48,17450,United Kingdom
555011,21188,3D HEARTS  HONEYCOMB PAPER GARLAND,12,5/31/2011 10:43,2.95,16168,United Kingdom
555011,21658,GLASS  BEURRE DISH,4,5/31/2011 10:43,3.95,16168,United Kingdom
555011,22928,YELLOW GIANT GARDEN THERMOMETER,2,5/31/2011 10:43,5.95,16168,United Kingdom
555011,22927,GREEN GIANT GARDEN THERMOMETER,2,5/31/2011 10:43,5.95,16168,United Kingdom
555012,21669,BLUE STRIPE CERAMIC DRAWER KNOB,12,5/31/2011 10:43,1.25,16814,United Kingdom
555012,21673,WHITE SPOT BLUE CERAMIC DRAWER KNOB,12,5/31/2011 10:43,1.25,16814,United Kingdom
555012,21670,BLUE SPOT CERAMIC DRAWER KNOB,12,5/31/2011 10:43,1.25,16814,United Kingdom
555012,21668,RED STRIPE CERAMIC DRAWER KNOB,12,5/31/2011 10:43,1.25,16814,United Kingdom
555012,21671,RED SPOT CERAMIC DRAWER KNOB,12,5/31/2011 10:43,1.25,16814,United Kingdom
555012,21672,WHITE SPOT RED CERAMIC DRAWER KNOB,12,5/31/2011 10:43,1.25,16814,United Kingdom
555012,22499,WOODEN UNION JACK BUNTING,3,5/31/2011 10:43,5.95,16814,United Kingdom
555012,22771,CLEAR DRAWER KNOB ACRYLIC EDWARDIAN,12,5/31/2011 10:43,1.25,16814,United Kingdom
555012,22771,CLEAR DRAWER KNOB ACRYLIC EDWARDIAN,12,5/31/2011 10:43,1.25,16814,United Kingdom
555012,22773,GREEN DRAWER KNOB ACRYLIC EDWARDIAN,12,5/31/2011 10:43,1.25,16814,United Kingdom
555012,22771,CLEAR DRAWER KNOB ACRYLIC EDWARDIAN,12,5/31/2011 10:43,1.25,16814,United Kingdom
555012,22775,PURPLE DRAWERKNOB ACRYLIC EDWARDIAN,12,5/31/2011 10:43,1.25,16814,United Kingdom
555012,21900,"KEY FOB , SHED",6,5/31/2011 10:43,0.65,16814,United Kingdom
555012,23066,SMALL DECO JEWELLERY STAND,1,5/31/2011 10:43,8.25,16814,United Kingdom
555012,21614,SET OF 12 ROSE BOTANICAL T-LIGHTS,3,5/31/2011 10:43,2.95,16814,United Kingdom
555012,84879,ASSORTED COLOUR BIRD ORNAMENT,32,5/31/2011 10:43,1.69,16814,United Kingdom
555012,84755,COLOUR GLASS T-LIGHT HOLDER HANGING,16,5/31/2011 10:43,0.65,16814,United Kingdom
555012,22305,COFFEE MUG PINK PAISLEY DESIGN,6,5/31/2011 10:43,2.55,16814,United Kingdom
555012,22304,COFFEE MUG BLUE PAISLEY DESIGN,6,5/31/2011 10:43,2.55,16814,United Kingdom
555012,21430,SET/3 RED GINGHAM ROSE STORAGE BOX,3,5/31/2011 10:43,3.75,16814,United Kingdom
555012,22624,IVORY KITCHEN SCALES,2,5/31/2011 10:43,8.5,16814,United Kingdom
555012,22625,RED KITCHEN SCALES,1,5/31/2011 10:43,8.5,16814,United Kingdom
555012,22178,VICTORIAN GLASS HANGING T-LIGHT,18,5/31/2011 10:43,1.25,16814,United Kingdom
555012,21586,KINGS CHOICE GIANT TUBE MATCHES,5,5/31/2011 10:43,2.55,16814,United Kingdom
555012,23301,GARDENERS KNEELING PAD KEEP CALM ,10,5/31/2011 10:43,1.65,16814,United Kingdom
555012,23300,GARDENERS KNEELING PAD CUP OF TEA ,5,5/31/2011 10:43,1.65,16814,United Kingdom
555012,23298,SPOTTY BUNTING,5,5/31/2011 10:43,4.95,16814,United Kingdom
C555013,23112,PARISIENNE CURIO CABINET,-1,5/31/2011 10:44,7.5,12601,Germany
555015,23298,SPOTTY BUNTING,3,5/31/2011 10:45,4.95,16558,United Kingdom
555015,22423,REGENCY CAKESTAND 3 TIER,1,5/31/2011 10:45,12.75,16558,United Kingdom
555015,22699,ROSES REGENCY TEACUP AND SAUCER ,6,5/31/2011 10:45,2.95,16558,United Kingdom
555015,20724,RED RETROSPOT CHARLOTTE BAG,10,5/31/2011 10:45,0.85,16558,United Kingdom
555015,22661,CHARLOTTE BAG DOLLY GIRL DESIGN,10,5/31/2011 10:45,0.85,16558,United Kingdom
555015,23204,CHARLOTTE BAG APPLES DESIGN,10,5/31/2011 10:45,0.85,16558,United Kingdom
555015,22990,COTTON APRON PANTRY DESIGN,2,5/31/2011 10:45,4.95,16558,United Kingdom
555015,20830,SILVER PHOTO FRAME,6,5/31/2011 10:45,2.1,16558,United Kingdom
555015,22507,MEMO BOARD RETROSPOT  DESIGN,4,5/31/2011 10:45,4.95,16558,United Kingdom
555015,20665,RED RETROSPOT PURSE ,6,5/31/2011 10:45,2.95,16558,United Kingdom
555015,20718,RED RETROSPOT SHOPPER BAG,10,5/31/2011 10:45,1.25,16558,United Kingdom
555015,21980,PACK OF 12 RED RETROSPOT TISSUES ,24,5/31/2011 10:45,0.29,16558,United Kingdom
555015,23108,SET OF 10 LED DOLLY LIGHTS,4,5/31/2011 10:45,6.25,16558,United Kingdom
555015,21314,SMALL GLASS HEART TRINKET POT,8,5/31/2011 10:45,2.1,16558,United Kingdom
555015,23073,GEORGIAN TRINKET BOX,2,5/31/2011 10:45,12.5,16558,United Kingdom
555015,23089,GLASS BON BON JAR,12,5/31/2011 10:45,1.65,16558,United Kingdom
555015,84951A,SET OF 4 PISTACHIO LOVEBIRD COASTER,24,5/31/2011 10:45,0.79,16558,United Kingdom
555015,79163,BLACK CHAMPAGNE GLASS,48,5/31/2011 10:45,0.39,16558,United Kingdom
555015,84596B,SMALL DOLLY MIX DESIGN ORANGE BOWL,16,5/31/2011 10:45,0.42,16558,United Kingdom
555015,84596F,SMALL MARSHMALLOWS PINK BOWL,16,5/31/2011 10:45,0.42,16558,United Kingdom
555015,85016,SET OF 6 VINTAGE NOTELETS KIT,9,5/31/2011 10:45,0.65,16558,United Kingdom
555015,21787,RAIN PONCHO RETROSPOT,24,5/31/2011 10:45,0.85,16558,United Kingdom
555015,21786,POLKADOT RAIN HAT ,24,5/31/2011 10:45,0.42,16558,United Kingdom
555015,35095B,RED VICTORIAN FABRIC OVAL BOX,24,5/31/2011 10:45,0.42,16558,United Kingdom
555015,35095A,BLUE VICTORIAN FABRIC OVAL BOX,24,5/31/2011 10:45,0.42,16558,United Kingdom
555015,15056N,EDWARDIAN PARASOL NATURAL,3,5/31/2011 10:45,5.95,16558,United Kingdom
555015,22464,HANGING METAL HEART LANTERN,12,5/31/2011 10:45,1.65,16558,United Kingdom
555015,22784,LANTERN CREAM GAZEBO ,3,5/31/2011 10:45,4.95,16558,United Kingdom
555015,22969,HOMEMADE JAM SCENTED CANDLES,12,5/31/2011 10:45,1.45,16558,United Kingdom
555015,23007, SPACEBOY BABY GIFT SET,1,5/31/2011 10:45,16.95,16558,United Kingdom
555015,23173,REGENCY TEAPOT ROSES ,2,5/31/2011 10:45,9.95,16558,United Kingdom
555015,23102,SILVER HEARTS TABLE DECORATION,12,5/31/2011 10:45,0.83,16558,United Kingdom
555015,23101,SILVER STARS TABLE DECORATION,12,5/31/2011 10:45,0.83,16558,United Kingdom
555015,23202,JUMBO BAG VINTAGE LEAF,10,5/31/2011 10:45,2.08,16558,United Kingdom
555015,23203,JUMBO BAG DOILEY PATTERNS,10,5/31/2011 10:45,2.08,16558,United Kingdom
555015,20725,LUNCH BAG RED RETROSPOT,10,5/31/2011 10:45,1.65,16558,United Kingdom
555015,23206,LUNCH BAG APPLE DESIGN,10,5/31/2011 10:45,1.65,16558,United Kingdom
555015,47566,PARTY BUNTING,4,5/31/2011 10:45,4.95,16558,United Kingdom
555015,22314,OFFICE MUG WARMER CHOC+BLUE,6,5/31/2011 10:45,2.95,16558,United Kingdom
555015,22469,HEART OF WICKER SMALL,12,5/31/2011 10:45,1.65,16558,United Kingdom
555015,16161P,WRAP ENGLISH ROSE ,25,5/31/2011 10:45,0.42,16558,United Kingdom
C555014,22055,MINI CAKE STAND  HANGING STRAWBERY,-3,5/31/2011 10:45,1.65,13113,United Kingdom
C555014,15058B,PINK POLKADOT GARDEN PARASOL,-3,5/31/2011 10:45,7.95,13113,United Kingdom
C555014,15058A,BLUE POLKADOT GARDEN PARASOL,-1,5/31/2011 10:45,6.75,13113,United Kingdom
C555014,22501,PICNIC BASKET WICKER LARGE,-52,5/31/2011 10:45,8.5,13113,United Kingdom
555016,22088,PAPER BUNTING COLOURED LACE,80,5/31/2011 11:09,2.55,13113,United Kingdom
555016,47566,PARTY BUNTING,50,5/31/2011 11:09,4.15,13113,United Kingdom
555016,22090,PAPER BUNTING RETROSPOT,40,5/31/2011 11:09,2.55,13113,United Kingdom
555016,23298,SPOTTY BUNTING,50,5/31/2011 11:09,4.15,13113,United Kingdom
555016,23082,SET 6 PAPER TABLE LANTERN HEARTS ,6,5/31/2011 11:09,3.75,13113,United Kingdom
555016,23206,LUNCH BAG APPLE DESIGN,10,5/31/2011 11:09,1.65,13113,United Kingdom
555016,22383,LUNCH BAG SUKI DESIGN ,10,5/31/2011 11:09,1.65,13113,United Kingdom
