561676,17021,NAMASTE SWAGAT INCENSE,36,7/28/2011 17:53,0.3,13468,United Kingdom
561677,16008,SMALL FOLDING SCISSOR(POINTED EDGE),12,7/28/2011 18:23,0.12,15311,United Kingdom
561677,21731,RED TOADSTOOL LED NIGHT LIGHT,2,7/28/2011 18:23,1.65,15311,United Kingdom
561677,23182,TOILET SIGN OCCUPIED OR VACANT,12,7/28/2011 18:23,0.83,15311,United Kingdom
561677,23196,VINTAGE LEAF MAGNETIC NOTEPAD,3,7/28/2011 18:23,1.45,15311,United Kingdom
561677,47310M,SMALL POP BOX FUNKY MONKEY,3,7/28/2011 18:23,1.25,15311,United Kingdom
561677,20829,GLITTER HANGING BUTTERFLY STRING,4,7/28/2011 18:23,2.1,15311,United Kingdom
561677,21137,BLACK RECORD COVER FRAME,24,7/28/2011 18:23,3.39,15311,United Kingdom
561678,21218,RED SPOTTY BISCUIT TIN,1,7/28/2011 18:33,3.75,17931,United Kingdom
561678,22625,RED KITCHEN SCALES,1,7/28/2011 18:33,8.5,17931,United Kingdom
561678,23168,CLASSIC CAFE SUGAR DISPENSER,1,7/28/2011 18:33,1.25,17931,United Kingdom
561678,21212,PACK OF 72 RETROSPOT CAKE CASES,1,7/28/2011 18:33,0.55,17931,United Kingdom
561678,21976,PACK OF 60 MUSHROOM CAKE CASES,1,7/28/2011 18:33,0.55,17931,United Kingdom
561678,21977,PACK OF 60 PINK PAISLEY CAKE CASES,1,7/28/2011 18:33,0.55,17931,United Kingdom
561678,22480,RED TEA TOWEL CLASSIC DESIGN,6,7/28/2011 18:33,1.25,17931,United Kingdom
561678,22278,OVERNIGHT BAG VINTAGE ROSE PAISLEY,1,7/28/2011 18:33,4.95,17931,United Kingdom
561678,22276,WASH BAG VINTAGE ROSE PAISLEY,1,7/28/2011 18:33,2.55,17931,United Kingdom
561678,21154,RED RETROSPOT OVEN GLOVE ,1,7/28/2011 18:33,1.25,17931,United Kingdom
561678,84673B,BLUE FLY SWAT,1,7/28/2011 18:33,0.65,17931,United Kingdom
561678,21216,"SET 3 RETROSPOT TEA,COFFEE,SUGAR",1,7/28/2011 18:33,4.95,17931,United Kingdom
561678,21936,RED RETROSPOT PICNIC BAG,1,7/28/2011 18:33,2.95,17931,United Kingdom
561678,20718,RED RETROSPOT SHOPPER BAG,1,7/28/2011 18:33,1.25,17931,United Kingdom
561678,22252,BIRDCAGE DECORATION TEALIGHT HOLDER,66,7/28/2011 18:33,1.06,17931,United Kingdom
561679,21928,JUMBO BAG SCANDINAVIAN BLUE PAISLEY,10,7/28/2011 18:56,2.08,15245,United Kingdom
561679,85099F,JUMBO BAG STRAWBERRY,10,7/28/2011 18:56,2.08,15245,United Kingdom
561679,85099B,JUMBO BAG RED RETROSPOT,10,7/28/2011 18:56,2.08,15245,United Kingdom
561679,20713,JUMBO BAG OWLS,10,7/28/2011 18:56,2.08,15245,United Kingdom
561679,22328,ROUND SNACK BOXES SET OF 4 FRUITS ,10,7/28/2011 18:56,2.95,15245,United Kingdom
561679,20725,LUNCH BAG RED RETROSPOT,10,7/28/2011 18:56,1.65,15245,United Kingdom
561679,20726,LUNCH BAG WOODLAND,10,7/28/2011 18:56,1.65,15245,United Kingdom
561679,22561,WOODEN SCHOOL COLOURING SET,12,7/28/2011 18:56,1.65,15245,United Kingdom
561679,22741,FUNKY DIVA PEN,48,7/28/2011 18:56,0.85,15245,United Kingdom
561679,22621,TRADITIONAL KNITTING NANCY,12,7/28/2011 18:56,1.65,15245,United Kingdom
561679,21830,ASSORTED CREEPY CRAWLIES,24,7/28/2011 18:56,0.42,15245,United Kingdom
561679,84077,WORLD WAR 2 GLIDERS ASSTD DESIGNS,48,7/28/2011 18:56,0.29,15245,United Kingdom
561679,21080,SET/20 RED RETROSPOT PAPER NAPKINS ,12,7/28/2011 18:56,0.85,15245,United Kingdom
561679,21917,SET 12 KIDS  WHITE CHALK STICKS,48,7/28/2011 18:56,0.42,15245,United Kingdom
561679,21916,SET 12 RETRO WHITE CHALK STICKS,48,7/28/2011 18:56,0.42,15245,United Kingdom
561679,21931,JUMBO STORAGE BAG SUKI,10,7/28/2011 18:56,2.08,15245,United Kingdom
561679,22383,LUNCH BAG SUKI DESIGN ,10,7/28/2011 18:56,1.65,15245,United Kingdom
561679,21891,TRADITIONAL WOODEN SKIPPING ROPE,12,7/28/2011 18:56,1.45,15245,United Kingdom
561679,22456,NATURAL SLATE CHALKBOARD LARGE ,18,7/28/2011 18:56,4.25,15245,United Kingdom
561679,22457,NATURAL SLATE HEART CHALKBOARD ,48,7/28/2011 18:56,2.55,15245,United Kingdom
561679,22488,NATURAL SLATE RECTANGLE CHALKBOARD,96,7/28/2011 18:56,1.45,15245,United Kingdom
561679,22326,ROUND SNACK BOXES SET OF4 WOODLAND ,10,7/28/2011 18:56,2.95,15245,United Kingdom
561679,20914,SET/5 RED RETROSPOT LID GLASS BOWLS,12,7/28/2011 18:56,2.95,15245,United Kingdom
561679,22558,CLOTHES PEGS RETROSPOT PACK 24 ,12,7/28/2011 18:56,1.65,15245,United Kingdom
561680,84968A,SET OF 16 VINTAGE ROSE CUTLERY,2,7/28/2011 19:13,12.75,18268,United Kingdom
C561681,84968A,SET OF 16 VINTAGE ROSE CUTLERY,-2,7/28/2011 19:14,12.75,15370,United Kingdom
C561682,21257,VICTORIAN SEWING BOX MEDIUM,-7,7/28/2011 19:27,6.95,13631,United Kingdom
561683,22659,LUNCH BOX I LOVE LONDON,1,7/28/2011 19:34,1.95,15518,United Kingdom
C561684,22423,REGENCY CAKESTAND 3 TIER,-1,7/28/2011 19:36,12.75,13136,United Kingdom
