554985,20963,APPLE BATH SPONGE,10,5/29/2011 12:26,1.25,12426,Germany
554985,71459,HANGING JAM JAR T-LIGHT HOLDER,12,5/29/2011 12:26,0.85,12426,Germany
554985,22551,PLASTERS IN TIN SPACEBOY,12,5/29/2011 12:26,1.65,12426,Germany
554985,22554,PLASTERS IN TIN WOODLAND ANIMALS,12,5/29/2011 12:26,1.65,12426,Germany
554985,22555,PLASTERS IN TIN STRONGMAN,12,5/29/2011 12:26,1.65,12426,Germany
554985,22414,DOORMAT NEIGHBOURHOOD WITCH ,2,5/29/2011 12:26,7.95,12426,Germany
554985,22365,DOORMAT RESPECTABLE HOUSE,2,5/29/2011 12:26,7.95,12426,Germany
554985,22366,DOORMAT AIRMAIL ,2,5/29/2011 12:26,7.95,12426,Germany
554985,21747,SMALL SKULL WINDMILL,12,5/29/2011 12:26,1.25,12426,Germany
554985,21746,SMALL RED RETROSPOT WINDMILL,12,5/29/2011 12:26,1.25,12426,Germany
554985,22960,JAM MAKING SET WITH JARS,6,5/29/2011 12:26,4.25,12426,Germany
554985,21165,BEWARE OF THE CAT METAL SIGN ,12,5/29/2011 12:26,1.69,12426,Germany
554985,21770,OPEN CLOSED METAL SIGN,2,5/29/2011 12:26,4.95,12426,Germany
554985,82600,NO SINGING METAL SIGN,12,5/29/2011 12:26,2.1,12426,Germany
554985,22326,ROUND SNACK BOXES SET OF4 WOODLAND ,12,5/29/2011 12:26,2.95,12426,Germany
554985,22328,ROUND SNACK BOXES SET OF 4 FRUITS ,6,5/29/2011 12:26,2.95,12426,Germany
554985,22329,ROUND CONTAINER SET OF 5 RETROSPOT,12,5/29/2011 12:26,1.65,12426,Germany
554985,22629,SPACEBOY LUNCH BOX ,12,5/29/2011 12:26,1.95,12426,Germany
554985,22631,CIRCUS PARADE LUNCH BOX ,12,5/29/2011 12:26,1.95,12426,Germany
554985,22975,SPACEBOY CHILDRENS EGG CUP,12,5/29/2011 12:26,1.25,12426,Germany
554985,22976,CIRCUS PARADE CHILDRENS EGG CUP ,12,5/29/2011 12:26,1.25,12426,Germany
554985,23184,BULL DOG BOTTLE OPENER,4,5/29/2011 12:26,4.95,12426,Germany
554985,22849,BREAD BIN DINER STYLE MINT,1,5/29/2011 12:26,16.95,12426,Germany
554985,22360,GLASS JAR ENGLISH CONFECTIONERY,6,5/29/2011 12:26,2.95,12426,Germany
554985,22363,GLASS JAR MARMALADE ,6,5/29/2011 12:26,2.95,12426,Germany
554985,22350,ILLUSTRATED CAT BOWL ,6,5/29/2011 12:26,2.55,12426,Germany
554985,22845,VINTAGE CREAM CAT FOOD CONTAINER,2,5/29/2011 12:26,6.35,12426,Germany
554985,16161G,WRAP BAD HAIR DAY,25,5/29/2011 12:26,0.1,12426,Germany
554985,POST,POSTAGE,4,5/29/2011 12:26,18,12426,Germany
554986,22515,CHILDS GARDEN SPADE PINK,4,5/29/2011 12:35,2.1,14451,United Kingdom
554986,22514,CHILDS GARDEN SPADE BLUE,4,5/29/2011 12:35,2.1,14451,United Kingdom
554986,20725,LUNCH BAG RED RETROSPOT,5,5/29/2011 12:35,1.65,14451,United Kingdom
554986,23204,CHARLOTTE BAG APPLES DESIGN,1,5/29/2011 12:35,0.85,14451,United Kingdom
554986,23206,LUNCH BAG APPLE DESIGN,1,5/29/2011 12:35,1.65,14451,United Kingdom
554986,20727,LUNCH BAG  BLACK SKULL.,5,5/29/2011 12:35,1.65,14451,United Kingdom
554986,22662,LUNCH BAG DOLLY GIRL DESIGN,5,5/29/2011 12:35,1.65,14451,United Kingdom
554986,22383,LUNCH BAG SUKI DESIGN ,5,5/29/2011 12:35,1.65,14451,United Kingdom
554986,23205,CHARLOTTE BAG VINTAGE ALPHABET ,1,5/29/2011 12:35,0.85,14451,United Kingdom
554986,23207,LUNCH BAG ALPHABET DESIGN,6,5/29/2011 12:35,1.65,14451,United Kingdom
554986,20728,LUNCH BAG CARS BLUE,4,5/29/2011 12:35,1.65,14451,United Kingdom
554986,23209,LUNCH BAG DOILEY PATTERN ,5,5/29/2011 12:35,1.65,14451,United Kingdom
554986,21932,SCANDINAVIAN PAISLEY PICNIC BAG,2,5/29/2011 12:35,1.65,14451,United Kingdom
554986,21933,PINK VINTAGE PAISLEY PICNIC BAG,5,5/29/2011 12:35,1.65,14451,United Kingdom
554986,23255,CHILDRENS CUTLERY CIRCUS PARADE,1,5/29/2011 12:35,4.15,14451,United Kingdom
554986,23254,CHILDRENS CUTLERY DOLLY GIRL ,1,5/29/2011 12:35,4.15,14451,United Kingdom
554986,47566,PARTY BUNTING,3,5/29/2011 12:35,4.95,14451,United Kingdom
554986,22326,ROUND SNACK BOXES SET OF4 WOODLAND ,1,5/29/2011 12:35,2.95,14451,United Kingdom
554986,22328,ROUND SNACK BOXES SET OF 4 FRUITS ,5,5/29/2011 12:35,2.95,14451,United Kingdom
554986,22327,ROUND SNACK BOXES SET OF 4 SKULLS,3,5/29/2011 12:35,2.95,14451,United Kingdom
554986,22804,CANDLEHOLDER PINK HANGING HEART,3,5/29/2011 12:35,2.95,14451,United Kingdom
554986,85123A,WHITE HANGING HEART T-LIGHT HOLDER,3,5/29/2011 12:35,2.95,14451,United Kingdom
554986,21243,PINK  POLKADOT PLATE ,2,5/29/2011 12:35,1.69,14451,United Kingdom
554986,21244,BLUE POLKADOT PLATE ,2,5/29/2011 12:35,1.69,14451,United Kingdom
554986,21430,SET/3 RED GINGHAM ROSE STORAGE BOX,3,5/29/2011 12:35,3.75,14451,United Kingdom
554986,22630,DOLLY GIRL LUNCH BOX,3,5/29/2011 12:35,1.95,14451,United Kingdom
554986,22629,SPACEBOY LUNCH BOX ,3,5/29/2011 12:35,1.95,14451,United Kingdom
554986,84563B,BLUE & WHITE BREAKFAST TRAY,2,5/29/2011 12:35,2.95,14451,United Kingdom
554986,22171,3 HOOK PHOTO SHELF ANTIQUE WHITE,2,5/29/2011 12:35,8.5,14451,United Kingdom
554986,21174,POTTERING IN THE SHED METAL SIGN,2,5/29/2011 12:35,2.08,14451,United Kingdom
554986,21166,COOK WITH WINE METAL SIGN ,2,5/29/2011 12:35,2.08,14451,United Kingdom
554986,47593B,SCOTTIE DOGS BABY BIB,3,5/29/2011 12:35,0.39,14451,United Kingdom
554986,21063,PARTY INVITES JAZZ HEARTS,3,5/29/2011 12:35,0.85,14451,United Kingdom
554986,21329,DINOSAURS  WRITING SET ,3,5/29/2011 12:35,1.65,14451,United Kingdom
554986,21328,BALLOONS  WRITING SET ,3,5/29/2011 12:35,1.65,14451,United Kingdom
554986,21327,SKULLS WRITING SET ,3,5/29/2011 12:35,1.65,14451,United Kingdom
554986,22562,MONSTERS STENCIL CRAFT,2,5/29/2011 12:35,1.25,14451,United Kingdom
554986,23298,SPOTTY BUNTING,3,5/29/2011 12:35,4.95,14451,United Kingdom
554986,85152,HAND OVER THE CHOCOLATE   SIGN ,2,5/29/2011 12:35,2.1,14451,United Kingdom
554986,82567,"AIRLINE LOUNGE,METAL SIGN",2,5/29/2011 12:35,2.1,14451,United Kingdom
554986,21175,GIN + TONIC DIET METAL SIGN,2,5/29/2011 12:35,2.55,14451,United Kingdom
554986,22628,PICNIC BOXES SET OF 3 RETROSPOT ,4,5/29/2011 12:35,4.95,14451,United Kingdom
554986,84596B,SMALL DOLLY MIX DESIGN ORANGE BOWL,24,5/29/2011 12:35,0.42,14451,United Kingdom
554986,84596F,SMALL MARSHMALLOWS PINK BOWL,24,5/29/2011 12:35,0.42,14451,United Kingdom
554986,21937,STRAWBERRY   PICNIC BAG,3,5/29/2011 12:35,2.95,14451,United Kingdom
554986,22469,HEART OF WICKER SMALL,4,5/29/2011 12:35,1.65,14451,United Kingdom
554986,22470,HEART OF WICKER LARGE,5,5/29/2011 12:35,2.95,14451,United Kingdom
554986,84519B,CARROT CHARLIE+LOLA COASTER SET,6,5/29/2011 12:35,1.25,14451,United Kingdom
554986,79030G,TUMBLER NEW ENGLAND,6,5/29/2011 12:35,0.39,14451,United Kingdom
554986,85183B,CHARLIE & LOLA WASTEPAPER BIN FLORA,4,5/29/2011 12:35,1.25,14451,United Kingdom
554986,85132B,CHARLIE AND LOLA TABLE TINS,2,5/29/2011 12:35,1.95,14451,United Kingdom
554986,85132C,CHARLIE AND LOLA FIGURES TINS,2,5/29/2011 12:35,1.95,14451,United Kingdom
554987,85066,CREAM SWEETHEART MINI CHEST,1,5/29/2011 12:48,12.75,14823,United Kingdom
554987,84970L,SINGLE HEART ZINC T-LIGHT HOLDER,2,5/29/2011 12:48,0.95,14823,United Kingdom
554987,23165,LARGE CERAMIC TOP STORAGE JAR,1,5/29/2011 12:48,1.65,14823,United Kingdom
554987,22464,HANGING METAL HEART LANTERN,1,5/29/2011 12:48,1.65,14823,United Kingdom
554987,22795,SWEETHEART RECIPE BOOK STAND,1,5/29/2011 12:48,6.75,14823,United Kingdom
554987,22457,NATURAL SLATE HEART CHALKBOARD ,1,5/29/2011 12:48,2.95,14823,United Kingdom
554987,22189,CREAM HEART CARD HOLDER,1,5/29/2011 12:48,3.95,14823,United Kingdom
554987,22188,BLACK HEART CARD HOLDER,1,5/29/2011 12:48,3.95,14823,United Kingdom
554987,82484,WOOD BLACK BOARD ANT WHITE FINISH,1,5/29/2011 12:48,7.95,14823,United Kingdom
554987,22522,CHILDS GARDEN FORK BLUE ,1,5/29/2011 12:48,0.85,14823,United Kingdom
554987,22626,BLACK KITCHEN SCALES,1,5/29/2011 12:48,8.5,14823,United Kingdom
554987,20914,SET/5 RED RETROSPOT LID GLASS BOWLS,1,5/29/2011 12:48,2.95,14823,United Kingdom
554987,22617,BAKING SET SPACEBOY DESIGN,1,5/29/2011 12:48,4.95,14823,United Kingdom
554987,22723,SET OF 6 HERB TINS SKETCHBOOK,2,5/29/2011 12:48,3.95,14823,United Kingdom
554988,84563B,BLUE & WHITE BREAKFAST TRAY,1,5/29/2011 13:32,2.95,15897,United Kingdom
554988,16235,RECYCLED PENCIL WITH RABBIT ERASER,11,5/29/2011 13:32,0.21,15897,United Kingdom
554988,22558,CLOTHES PEGS RETROSPOT PACK 24 ,1,5/29/2011 13:32,1.65,15897,United Kingdom
554988,20992,JAZZ HEARTS PURSE NOTEBOOK,1,5/29/2011 13:32,0.85,15897,United Kingdom
554988,22981,PANTRY APPLE CORER,1,5/29/2011 13:32,1.45,15897,United Kingdom
554988,15039,SANDALWOOD FAN,130,5/29/2011 13:32,0.85,15897,United Kingdom
554989,22989,SET 2 PANTRY DESIGN TEA TOWELS,3,5/29/2011 13:50,3.25,15897,United Kingdom
554989,22990,COTTON APRON PANTRY DESIGN,1,5/29/2011 13:50,4.95,15897,United Kingdom
554989,84563B,BLUE & WHITE BREAKFAST TRAY,2,5/29/2011 13:50,2.95,15897,United Kingdom
554989,16235,RECYCLED PENCIL WITH RABBIT ERASER,36,5/29/2011 13:50,0.21,15897,United Kingdom
554989,20761,BLUE PAISLEY SKETCHBOOK,1,5/29/2011 13:50,3.75,15897,United Kingdom
554989,20766,GARDEN PATH SKETCHBOOK,1,5/29/2011 13:50,3.75,15897,United Kingdom
554989,22990,COTTON APRON PANTRY DESIGN,3,5/29/2011 13:50,4.95,15897,United Kingdom
554989,20992,JAZZ HEARTS PURSE NOTEBOOK,1,5/29/2011 13:50,0.85,15897,United Kingdom
554989,22429,ENAMEL MEASURING JUG CREAM,1,5/29/2011 13:50,4.25,15897,United Kingdom
554989,84563B,BLUE & WHITE BREAKFAST TRAY,2,5/29/2011 13:50,2.95,15897,United Kingdom
554989,84875D,BLUE SQUARE COMPACT MIRROR,12,5/29/2011 13:50,1.25,15897,United Kingdom
554989,22561,WOODEN SCHOOL COLOURING SET,4,5/29/2011 13:50,1.65,15897,United Kingdom
554989,20711,JUMBO BAG TOYS ,1,5/29/2011 13:50,2.08,15897,United Kingdom
554989,21033,JUMBO BAG CHARLIE AND LOLA TOYS,1,5/29/2011 13:50,2.08,15897,United Kingdom
554989,16235,RECYCLED PENCIL WITH RABBIT ERASER,36,5/29/2011 13:50,0.21,15897,United Kingdom
554989,22563,HAPPY STENCIL CRAFT,1,5/29/2011 13:50,1.25,15897,United Kingdom
554989,22981,PANTRY APPLE CORER,2,5/29/2011 13:50,1.45,15897,United Kingdom
554989,84596B,SMALL DOLLY MIX DESIGN ORANGE BOWL,8,5/29/2011 13:50,0.42,15897,United Kingdom
554990,21668,RED STRIPE CERAMIC DRAWER KNOB,12,5/29/2011 13:57,1.25,16567,United Kingdom
554990,15060B,FAIRY CAKE DESIGN UMBRELLA,8,5/29/2011 13:57,3.75,16567,United Kingdom
554990,85116,BLACK CANDELABRA T-LIGHT HOLDER,24,5/29/2011 13:57,0.65,16567,United Kingdom
554990,79163,BLACK CHAMPAGNE GLASS,144,5/29/2011 13:57,0.39,16567,United Kingdom
554990,78124,MAGAZINE RACK GEBRA ASSORTED ,24,5/29/2011 13:57,1.25,16567,United Kingdom
554990,21932,SCANDINAVIAN PAISLEY PICNIC BAG,10,5/29/2011 13:57,1.65,16567,United Kingdom
554990,21933,PINK VINTAGE PAISLEY PICNIC BAG,10,5/29/2011 13:57,1.65,16567,United Kingdom
554990,22123,PING MICROWAVE APRON,12,5/29/2011 13:57,1.95,16567,United Kingdom
554990,79337,BLUE FLOCK GLASS CANDLEHOLDER,276,5/29/2011 13:57,0.38,16567,United Kingdom
554991,23145,ZINC T-LIGHT HOLDER STAR LARGE,1,5/29/2011 14:03,0.95,14823,United Kingdom
554991,21523,DOORMAT FANCY FONT HOME SWEET HOME,1,5/29/2011 14:03,7.95,14823,United Kingdom
554991,82580,BATHROOM METAL SIGN,1,5/29/2011 14:03,0.55,14823,United Kingdom
554991,23204,CHARLOTTE BAG APPLES DESIGN,1,5/29/2011 14:03,0.85,14823,United Kingdom
554991,22149,FELTCRAFT 6 FLOWER FRIENDS,1,5/29/2011 14:03,2.1,14823,United Kingdom
554991,85062,PEARL CRYSTAL PUMPKIN T-LIGHT HLDR,1,5/29/2011 14:03,1.65,14823,United Kingdom
554991,85123A,WHITE HANGING HEART T-LIGHT HOLDER,1,5/29/2011 14:03,2.95,14823,United Kingdom
554991,84970L,SINGLE HEART ZINC T-LIGHT HOLDER,1,5/29/2011 14:03,0.95,14823,United Kingdom
554991,22112,CHOCOLATE HOT WATER BOTTLE,1,5/29/2011 14:03,4.95,14823,United Kingdom
554991,22621,TRADITIONAL KNITTING NANCY,1,5/29/2011 14:03,1.65,14823,United Kingdom
554991,23184,BULL DOG BOTTLE OPENER,1,5/29/2011 14:03,4.95,14823,United Kingdom
554991,22507,MEMO BOARD RETROSPOT  DESIGN,1,5/29/2011 14:03,4.95,14823,United Kingdom
554991,22188,BLACK HEART CARD HOLDER,1,5/29/2011 14:03,3.95,14823,United Kingdom
554991,22470,HEART OF WICKER LARGE,1,5/29/2011 14:03,2.95,14823,United Kingdom
554991,22795,SWEETHEART RECIPE BOOK STAND,1,5/29/2011 14:03,6.75,14823,United Kingdom
554991,22776,SWEETHEART CAKESTAND 3 TIER,1,5/29/2011 14:03,9.95,14823,United Kingdom
554991,84509A,SET OF 4 ENGLISH ROSE PLACEMATS,1,5/29/2011 14:03,3.75,14823,United Kingdom
554991,22617,BAKING SET SPACEBOY DESIGN,1,5/29/2011 14:03,4.95,14823,United Kingdom
554991,22138,BAKING SET 9 PIECE RETROSPOT ,1,5/29/2011 14:03,4.95,14823,United Kingdom
554991,84510A,SET OF 4 ENGLISH ROSE COASTERS,1,5/29/2011 14:03,1.25,14823,United Kingdom
554991,21754,HOME BUILDING BLOCK WORD,1,5/29/2011 14:03,5.95,14823,United Kingdom
554991,22627,MINT KITCHEN SCALES,1,5/29/2011 14:03,8.5,14823,United Kingdom
554991,22960,JAM MAKING SET WITH JARS,1,5/29/2011 14:03,4.25,14823,United Kingdom
554991,23099,FRENCH CARRIAGE LANTERN,1,5/29/2011 14:03,6.65,14823,United Kingdom
554991,20914,SET/5 RED RETROSPOT LID GLASS BOWLS,1,5/29/2011 14:03,2.95,14823,United Kingdom
554991,21411,GINGHAM HEART  DOORSTOP RED,1,5/29/2011 14:03,4.25,14823,United Kingdom
554991,85066,CREAM SWEETHEART MINI CHEST,1,5/29/2011 14:03,12.75,14823,United Kingdom
554991,22666,RECIPE BOX PANTRY YELLOW DESIGN,1,5/29/2011 14:03,2.95,14823,United Kingdom
554991,21843,RED RETROSPOT CAKE STAND,1,5/29/2011 14:03,10.95,14823,United Kingdom
554991,22723,SET OF 6 HERB TINS SKETCHBOOK,1,5/29/2011 14:03,3.95,14823,United Kingdom
554991,22766,PHOTO FRAME CORNICE,1,5/29/2011 14:03,2.95,14823,United Kingdom
554991,22457,NATURAL SLATE HEART CHALKBOARD ,1,5/29/2011 14:03,2.95,14823,United Kingdom
554992,22045,SPACEBOY GIFT WRAP,25,5/29/2011 14:08,0.42,16686,United Kingdom
554992,22710,WRAP I LOVE LONDON ,25,5/29/2011 14:08,0.42,16686,United Kingdom
554992,22704,WRAP RED APPLES ,25,5/29/2011 14:08,0.42,16686,United Kingdom
554992,16169M,WRAP DAISY CARPET ,25,5/29/2011 14:08,0.42,16686,United Kingdom
554992,16161P,WRAP ENGLISH ROSE ,25,5/29/2011 14:08,0.42,16686,United Kingdom
554992,23230,WRAP ALPHABET DESIGN,25,5/29/2011 14:08,0.42,16686,United Kingdom
554992,22779,WOODEN OWLS LIGHT GARLAND ,1,5/29/2011 14:08,4.25,16686,United Kingdom
554992,21913,VINTAGE SEASIDE JIGSAW PUZZLES,1,5/29/2011 14:08,3.75,16686,United Kingdom
554992,22550,HOLIDAY FUN LUDO,1,5/29/2011 14:08,3.75,16686,United Kingdom
554992,21790,VINTAGE SNAP CARDS,2,5/29/2011 14:08,0.85,16686,United Kingdom
554992,22621,TRADITIONAL KNITTING NANCY,2,5/29/2011 14:08,1.65,16686,United Kingdom
554992,22331,WOODLAND PARTY BAG + STICKER SET,2,5/29/2011 14:08,1.65,16686,United Kingdom
554992,22334,DINOSAUR PARTY BAG + STICKER SET,2,5/29/2011 14:08,1.65,16686,United Kingdom
554992,21328,BALLOONS  WRITING SET ,1,5/29/2011 14:08,1.65,16686,United Kingdom
554992,85227,SET OF 6 3D KIT CARDS FOR KIDS,1,5/29/2011 14:08,0.85,16686,United Kingdom
554992,23192,BUNDLE OF 3 ALPHABET EXERCISE BOOKS,2,5/29/2011 14:08,1.65,16686,United Kingdom
554992,23190,BUNDLE OF 3 SCHOOL EXERCISE BOOKS  ,2,5/29/2011 14:08,1.65,16686,United Kingdom
554992,22273,FELTCRAFT DOLL MOLLY,2,5/29/2011 14:08,2.95,16686,United Kingdom
554992,22570,FELTCRAFT CUSHION RABBIT,2,5/29/2011 14:08,3.75,16686,United Kingdom
554992,20972,PINK CREAM FELT CRAFT TRINKET BOX ,1,5/29/2011 14:08,1.25,16686,United Kingdom
554992,21328,BALLOONS  WRITING SET ,1,5/29/2011 14:08,1.65,16686,United Kingdom
554992,22754,SMALL RED BABUSHKA NOTEBOOK ,1,5/29/2011 14:08,0.85,16686,United Kingdom
554992,22758,LARGE PURPLE BABUSHKA NOTEBOOK  ,2,5/29/2011 14:08,1.25,16686,United Kingdom
554992,22753,SMALL YELLOW BABUSHKA NOTEBOOK ,2,5/29/2011 14:08,0.85,16686,United Kingdom
554992,22150,3 STRIPEY MICE FELTCRAFT,2,5/29/2011 14:08,1.95,16686,United Kingdom
554992,22328,ROUND SNACK BOXES SET OF 4 FRUITS ,1,5/29/2011 14:08,2.95,16686,United Kingdom
554992,22742,MAKE YOUR OWN PLAYTIME CARD KIT,1,5/29/2011 14:08,2.95,16686,United Kingdom
554992,22744,MAKE YOUR OWN MONSOON CARD KIT,1,5/29/2011 14:08,2.95,16686,United Kingdom
554992,22531,MAGIC DRAWING SLATE CIRCUS PARADE  ,48,5/29/2011 14:08,0.42,16686,United Kingdom
554992,20972,PINK CREAM FELT CRAFT TRINKET BOX ,1,5/29/2011 14:08,1.25,16686,United Kingdom
554992,22779,WOODEN OWLS LIGHT GARLAND ,1,5/29/2011 14:08,4.25,16686,United Kingdom
554992,22554,PLASTERS IN TIN WOODLAND ANIMALS,1,5/29/2011 14:08,1.65,16686,United Kingdom
554992,22555,PLASTERS IN TIN STRONGMAN,1,5/29/2011 14:08,1.65,16686,United Kingdom
554992,22556,PLASTERS IN TIN CIRCUS PARADE ,1,5/29/2011 14:08,1.65,16686,United Kingdom
554992,84536A,ENGLISH ROSE NOTEBOOK A7 SIZE,2,5/29/2011 14:08,0.42,16686,United Kingdom
554992,84828,JUNGLE POPSICLES ICE LOLLY MOULDS,1,5/29/2011 14:08,1.25,16686,United Kingdom
554992,22549,PICTURE DOMINOES,2,5/29/2011 14:08,1.45,16686,United Kingdom
554992,21731,RED TOADSTOOL LED NIGHT LIGHT,2,5/29/2011 14:08,1.65,16686,United Kingdom
554992,22466,FAIRY TALE COTTAGE NIGHTLIGHT,2,5/29/2011 14:08,1.95,16686,United Kingdom
554992,23127,FELTCRAFT GIRL NICOLE KIT,3,5/29/2011 14:08,4.95,16686,United Kingdom
554992,22548,HEADS AND TAILS SPORTING FUN,1,5/29/2011 14:08,1.25,16686,United Kingdom
554992,16236,KITTY PENCIL ERASERS,26,5/29/2011 14:08,0.21,16686,United Kingdom
554992,22431,WATERING CAN BLUE ELEPHANT,1,5/29/2011 14:08,1.95,16686,United Kingdom
554992,22432,WATERING CAN PINK BUNNY,1,5/29/2011 14:08,1.95,16686,United Kingdom
554992,22147,FELTCRAFT BUTTERFLY HEARTS,2,5/29/2011 14:08,1.45,16686,United Kingdom
554992,21912,VINTAGE SNAKES & LADDERS,2,5/29/2011 14:08,3.75,16686,United Kingdom
554992,23079,TOADSTOOL BEDSIDE LIGHT ,1,5/29/2011 14:08,8.95,16686,United Kingdom
554992,22138,BAKING SET 9 PIECE RETROSPOT ,3,5/29/2011 14:08,4.95,16686,United Kingdom
554992,16012,FOOD/DRINK SPONGE STICKERS,24,5/29/2011 14:08,0.21,16686,United Kingdom
554992,22211,WOOD STAMP SET FLOWERS,4,5/29/2011 14:08,1.65,16686,United Kingdom
554992,84466,TOP SECRET PEN SET,4,5/29/2011 14:08,1.25,16686,United Kingdom
554992,22747,POPPY'S PLAYHOUSE BATHROOM,2,5/29/2011 14:08,2.1,16686,United Kingdom
554992,22745,POPPY'S PLAYHOUSE BEDROOM ,2,5/29/2011 14:08,2.1,16686,United Kingdom
554992,22746,POPPY'S PLAYHOUSE LIVINGROOM ,2,5/29/2011 14:08,2.1,16686,United Kingdom
554992,22139,RETROSPOT TEA SET CERAMIC 11 PC ,4,5/29/2011 14:08,4.95,16686,United Kingdom
554992,22326,ROUND SNACK BOXES SET OF4 WOODLAND ,1,5/29/2011 14:08,2.95,16686,United Kingdom
554992,22328,ROUND SNACK BOXES SET OF 4 FRUITS ,1,5/29/2011 14:08,2.95,16686,United Kingdom
554992,22748,POPPY'S PLAYHOUSE KITCHEN,2,5/29/2011 14:08,2.1,16686,United Kingdom
554992,21832,CHOCOLATE CALCULATOR,1,5/29/2011 14:08,1.65,16686,United Kingdom
554992,22560,TRADITIONAL MODELLING CLAY,4,5/29/2011 14:08,1.25,16686,United Kingdom
554992,22563,HAPPY STENCIL CRAFT,2,5/29/2011 14:08,1.25,16686,United Kingdom
554992,22564,ALPHABET STENCIL CRAFT,3,5/29/2011 14:08,1.25,16686,United Kingdom
554992,23191,BUNDLE OF 3 RETRO NOTE BOOKS,1,5/29/2011 14:08,1.65,16686,United Kingdom
554992,20726,LUNCH BAG WOODLAND,5,5/29/2011 14:08,1.65,16686,United Kingdom
554992,22431,WATERING CAN BLUE ELEPHANT,1,5/29/2011 14:08,1.95,16686,United Kingdom
554992,22432,WATERING CAN PINK BUNNY,1,5/29/2011 14:08,1.95,16686,United Kingdom
554992,22993,SET OF 4 PANTRY JELLY MOULDS,2,5/29/2011 14:08,1.25,16686,United Kingdom
554992,23084,RABBIT NIGHT LIGHT,1,5/29/2011 14:08,2.08,16686,United Kingdom
554992,22617,BAKING SET SPACEBOY DESIGN,2,5/29/2011 14:08,4.95,16686,United Kingdom
554992,84375,SET OF 20 KIDS COOKIE CUTTERS,1,5/29/2011 14:08,2.1,16686,United Kingdom
554992,84828,JUNGLE POPSICLES ICE LOLLY MOULDS,3,5/29/2011 14:08,1.25,16686,United Kingdom
554992,84375,SET OF 20 KIDS COOKIE CUTTERS,1,5/29/2011 14:08,2.1,16686,United Kingdom
554992,22610,PENS ASSORTED FUNNY FACE,36,5/29/2011 14:08,0.85,16686,United Kingdom
554992,23084,RABBIT NIGHT LIGHT,3,5/29/2011 14:08,2.08,16686,United Kingdom
554992,22489,PACK OF 12 TRADITIONAL CRAYONS,6,5/29/2011 14:08,0.42,16686,United Kingdom
554992,21356,TOAST ITS - FAIRY FLOWER,2,5/29/2011 14:08,1.25,16686,United Kingdom
554993,21673,WHITE SPOT BLUE CERAMIC DRAWER KNOB,2,5/29/2011 14:13,1.25,17051,United Kingdom
554993,20718,RED RETROSPOT SHOPPER BAG,5,5/29/2011 14:13,1.25,17051,United Kingdom
554993,23298,SPOTTY BUNTING,1,5/29/2011 14:13,4.95,17051,United Kingdom
554993,85123A,WHITE HANGING HEART T-LIGHT HOLDER,3,5/29/2011 14:13,2.95,17051,United Kingdom
554993,17091J,VANILLA INCENSE IN TIN,2,5/29/2011 14:13,0.38,17051,United Kingdom
554993,22457,NATURAL SLATE HEART CHALKBOARD ,3,5/29/2011 14:13,2.95,17051,United Kingdom
554993,20914,SET/5 RED RETROSPOT LID GLASS BOWLS,2,5/29/2011 14:13,2.95,17051,United Kingdom
554993,22196,SMALL HEART MEASURING SPOONS,3,5/29/2011 14:13,0.85,17051,United Kingdom
554993,22195,LARGE HEART MEASURING SPOONS,3,5/29/2011 14:13,1.65,17051,United Kingdom
554993,84378,SET OF 3 HEART COOKIE CUTTERS,3,5/29/2011 14:13,1.25,17051,United Kingdom
554993,84380,SET OF 3 BUTTERFLY COOKIE CUTTERS,3,5/29/2011 14:13,1.25,17051,United Kingdom
554993,85132B,CHARLIE AND LOLA TABLE TINS,1,5/29/2011 14:13,1.95,17051,United Kingdom
554993,85132C,CHARLIE AND LOLA FIGURES TINS,3,5/29/2011 14:13,1.95,17051,United Kingdom
554993,22487,WHITE WOOD GARDEN PLANT LADDER,1,5/29/2011 14:13,9.95,17051,United Kingdom
554993,21212,PACK OF 72 RETROSPOT CAKE CASES,12,5/29/2011 14:13,0.55,17051,United Kingdom
554993,22417,PACK OF 60 SPACEBOY CAKE CASES,12,5/29/2011 14:13,0.55,17051,United Kingdom
554993,21213,PACK OF 72 SKULL CAKE CASES,12,5/29/2011 14:13,0.55,17051,United Kingdom
554993,21975,PACK OF 60 DINOSAUR CAKE CASES,12,5/29/2011 14:13,0.55,17051,United Kingdom
554993,84991,60 TEATIME FAIRY CAKE CASES,12,5/29/2011 14:13,0.55,17051,United Kingdom
554993,22469,HEART OF WICKER SMALL,4,5/29/2011 14:13,1.65,17051,United Kingdom
554993,22470,HEART OF WICKER LARGE,3,5/29/2011 14:13,2.95,17051,United Kingdom
554993,21561,DINOSAUR LUNCH BOX WITH CUTLERY,3,5/29/2011 14:13,2.55,17051,United Kingdom
554993,21558,SKULL LUNCH BOX WITH CUTLERY ,3,5/29/2011 14:13,2.55,17051,United Kingdom
554993,21559,STRAWBERRY LUNCH BOX WITH CUTLERY,3,5/29/2011 14:13,2.55,17051,United Kingdom
554993,22352,LUNCH BOX WITH CUTLERY RETROSPOT ,3,5/29/2011 14:13,2.55,17051,United Kingdom
554993,37342,POLKADOT COFFEE CUP & SAUCER PINK,2,5/29/2011 14:13,0.79,17051,United Kingdom
554993,21232,STRAWBERRY CERAMIC TRINKET BOX,4,5/29/2011 14:13,1.25,17051,United Kingdom
554993,23300,GARDENERS KNEELING PAD CUP OF TEA ,3,5/29/2011 14:13,1.65,17051,United Kingdom
554993,20724,RED RETROSPOT CHARLOTTE BAG,5,5/29/2011 14:13,0.85,17051,United Kingdom
554993,22355,CHARLOTTE BAG SUKI DESIGN,5,5/29/2011 14:13,0.85,17051,United Kingdom
554993,22383,LUNCH BAG SUKI DESIGN ,3,5/29/2011 14:13,1.65,17051,United Kingdom
554993,21043,APRON MODERN VINTAGE COTTON,15,5/29/2011 14:13,1.95,17051,United Kingdom
554993,23206,LUNCH BAG APPLE DESIGN,1,5/29/2011 14:13,1.65,17051,United Kingdom
554993,22898,CHILDRENS APRON APPLES DESIGN,2,5/29/2011 14:13,1.95,17051,United Kingdom
554993,21156,RETROSPOT CHILDRENS APRON,2,5/29/2011 14:13,1.95,17051,United Kingdom
554993,22367,CHILDRENS APRON SPACEBOY DESIGN,2,5/29/2011 14:13,1.95,17051,United Kingdom
554993,20728,LUNCH BAG CARS BLUE,3,5/29/2011 14:13,1.65,17051,United Kingdom
554993,22382,LUNCH BAG SPACEBOY DESIGN ,2,5/29/2011 14:13,1.65,17051,United Kingdom
554993,20725,LUNCH BAG RED RETROSPOT,2,5/29/2011 14:13,1.65,17051,United Kingdom
554993,20724,RED RETROSPOT CHARLOTTE BAG,2,5/29/2011 14:13,0.85,17051,United Kingdom
554993,23204,CHARLOTTE BAG APPLES DESIGN,2,5/29/2011 14:13,0.85,17051,United Kingdom
554993,20718,RED RETROSPOT SHOPPER BAG,5,5/29/2011 14:13,1.25,17051,United Kingdom
554993,20724,RED RETROSPOT CHARLOTTE BAG,10,5/29/2011 14:13,0.85,17051,United Kingdom
554994,21246,RED RETROSPOT BIG BOWL,4,5/29/2011 14:18,4.95,14606,United Kingdom
554994,21868,POTTING SHED TEA MUG,1,5/29/2011 14:18,1.25,14606,United Kingdom
554994,20979,36 PENCILS TUBE RED RETROSPOT,1,5/29/2011 14:18,1.25,14606,United Kingdom
554994,85130D,BEADED CRYSTAL HEART PINK LARGE,2,5/29/2011 14:18,1.65,14606,United Kingdom
554994,84988,SET OF 72 PINK HEART PAPER DOILIES,3,5/29/2011 14:18,1.45,14606,United Kingdom
554994,22090,PAPER BUNTING RETROSPOT,1,5/29/2011 14:18,2.95,14606,United Kingdom
554994,21035,SET/2 RED RETROSPOT TEA TOWELS ,2,5/29/2011 14:18,3.25,14606,United Kingdom
554994,21154,RED RETROSPOT OVEN GLOVE ,1,5/29/2011 14:18,1.25,14606,United Kingdom
554994,21080,SET/20 RED RETROSPOT PAPER NAPKINS ,3,5/29/2011 14:18,0.85,14606,United Kingdom
554994,21157,RED RETROSPOT WASHBAG,1,5/29/2011 14:18,2.1,14606,United Kingdom
554994,22416,SET OF 36 DOILIES SPACEBOY DESIGN ,1,5/29/2011 14:18,1.45,14606,United Kingdom
554994,22417,PACK OF 60 SPACEBOY CAKE CASES,2,5/29/2011 14:18,0.55,14606,United Kingdom
554994,21217,RED RETROSPOT ROUND CAKE TINS,1,5/29/2011 14:18,9.95,14606,United Kingdom
554994,22344,PARTY PIZZA DISH PINK POLKADOT,1,5/29/2011 14:18,0.85,14606,United Kingdom
554994,22345,PARTY PIZZA DISH BLUE POLKADOT,1,5/29/2011 14:18,0.85,14606,United Kingdom
554994,22613,PACK OF 20 SPACEBOY NAPKINS,2,5/29/2011 14:18,0.85,14606,United Kingdom
554994,21242,RED RETROSPOT PLATE ,3,5/29/2011 14:18,1.69,14606,United Kingdom
554994,21238,RED RETROSPOT CUP,3,5/29/2011 14:18,0.85,14606,United Kingdom
554994,22348,TEA BAG PLATE RED RETROSPOT,1,5/29/2011 14:18,0.85,14606,United Kingdom
554994,21669,BLUE STRIPE CERAMIC DRAWER KNOB,2,5/29/2011 14:18,1.25,14606,United Kingdom
554994,90214A,"LETTER ""A"" BLING KEY RING",1,5/29/2011 14:18,1.25,14606,United Kingdom
554994,22996,TRAVEL CARD WALLET VINTAGE TICKET,1,5/29/2011 14:18,0.42,14606,United Kingdom
554994,22998,TRAVEL CARD WALLET KEEP CALM,1,5/29/2011 14:18,0.42,14606,United Kingdom
554994,22994,TRAVEL CARD WALLET RETROSPOT,1,5/29/2011 14:18,0.42,14606,United Kingdom
554994,21985,PACK OF 12 HEARTS DESIGN TISSUES ,1,5/29/2011 14:18,0.29,14606,United Kingdom
554994,82583,HOT BATHS METAL SIGN,1,5/29/2011 14:18,2.1,14606,United Kingdom
554994,21165,BEWARE OF THE CAT METAL SIGN ,1,5/29/2011 14:18,1.69,14606,United Kingdom
554994,21307,SET/4 BUTTERFLY MIRROR MAGNETS,1,5/29/2011 14:18,2.1,14606,United Kingdom
554994,21533,RETROSPOT LARGE MILK JUG,1,5/29/2011 14:18,4.95,14606,United Kingdom
554994,22405,MONEY BOX POCKET MONEY DESIGN,1,5/29/2011 14:18,1.25,14606,United Kingdom
