559338,21534,DAIRY MAID LARGE MILK JUG,2,7/7/2011 16:30,4.13,,United Kingdom
559338,21539,RED RETROSPOT BUTTER DISH,1,7/7/2011 16:30,9.96,,United Kingdom
559338,21576,LETS GO SHOPPING COTTON TOTE BAG,1,7/7/2011 16:30,1.63,,United Kingdom
559338,21577,SAVE THE PLANET COTTON TOTE BAG,1,7/7/2011 16:30,1.63,,United Kingdom
559338,21578,WOODLAND DESIGN  COTTON TOTE BAG,5,7/7/2011 16:30,1.63,,United Kingdom
559338,21579,LOLITA  DESIGN  COTTON TOTE BAG,1,7/7/2011 16:30,1.63,,United Kingdom
559338,21580,RABBIT  DESIGN  COTTON TOTE BAG,1,7/7/2011 16:30,1.63,,United Kingdom
559338,21581,SKULLS  DESIGN  COTTON TOTE BAG,4,7/7/2011 16:30,1.63,,United Kingdom
559338,21619,4 VANILLA BOTANICAL CANDLES,1,7/7/2011 16:30,2.46,,United Kingdom
559338,21629,SQUARE FLOOR CUSHION VINTAGE RED,1,7/7/2011 16:30,15.79,,United Kingdom
559338,21633,SUNFLOWER DECORATIVE PARASOL,1,7/7/2011 16:30,8.29,,United Kingdom
559338,21715,GIRLS VINTAGE TIN SEASIDE BUCKET,2,7/7/2011 16:30,2.46,,United Kingdom
559338,21773,DECORATIVE ROSE BATHROOM BOTTLE,1,7/7/2011 16:30,2.46,,United Kingdom
559338,21774,DECORATIVE CATS BATHROOM BOTTLE,2,7/7/2011 16:30,2.46,,United Kingdom
559338,21775,DECORATIVE FLORE BATHROOM BOTTLE,2,7/7/2011 16:30,2.46,,United Kingdom
559338,21790,VINTAGE SNAP CARDS,1,7/7/2011 16:30,1.63,,United Kingdom
559338,21791,VINTAGE HEADS AND TAILS CARD GAME ,1,7/7/2011 16:30,2.46,,United Kingdom
559338,21828,EIGHT PIECE SNAKE  SET,1,7/7/2011 16:30,2.46,,United Kingdom
559338,21829,DINOSAUR KEYRINGS ASSORTED,2,7/7/2011 16:30,0.42,,United Kingdom
559338,21846,PINK DIAMANTE PEN IN GIFT BOX,5,7/7/2011 16:30,2.46,,United Kingdom
559338,21850,BLUE  DIAMANTE PEN IN GIFT BOX,1,7/7/2011 16:30,2.46,,United Kingdom
559338,21851,LILAC DIAMANTE PEN IN GIFT BOX,2,7/7/2011 16:30,2.46,,United Kingdom
559338,21864,UNION JACK FLAG PASSPORT COVER ,1,7/7/2011 16:30,1.63,,United Kingdom
559338,21866,UNION JACK FLAG LUGGAGE TAG,4,7/7/2011 16:30,0.83,,United Kingdom
559338,21867,PINK UNION JACK  LUGGAGE TAG,3,7/7/2011 16:30,0.83,,United Kingdom
559338,21878,PACK OF 6 SANDCASTLE FLAGS ASSORTED,3,7/7/2011 16:30,1.63,,United Kingdom
559338,21908,CHOCOLATE THIS WAY METAL SIGN,1,7/7/2011 16:30,4.13,,United Kingdom
559338,21932,SCANDINAVIAN PAISLEY PICNIC BAG,1,7/7/2011 16:30,2.46,,United Kingdom
559338,21935,SUKI  SHOULDER BAG,3,7/7/2011 16:30,1.63,,United Kingdom
559338,21936,RED RETROSPOT PICNIC BAG,1,7/7/2011 16:30,5.79,,United Kingdom
559338,21942,SKULLS DESIGN FLANNEL,4,7/7/2011 16:30,0.83,,United Kingdom
559338,21944,KITTENS DESIGN FLANNEL,3,7/7/2011 16:30,0.83,,United Kingdom
559338,21976,PACK OF 60 MUSHROOM CAKE CASES,1,7/7/2011 16:30,1.25,,United Kingdom
559338,21992,VINTAGE PAISLEY STATIONERY SET,4,7/7/2011 16:30,2.46,,United Kingdom
559338,21993,FLORAL FOLK STATIONERY SET,4,7/7/2011 16:30,2.46,,United Kingdom
559338,22032,BOTANICAL LILY GREETING CARD,2,7/7/2011 16:30,0.42,,United Kingdom
559338,22035,VINTAGE CARAVAN GREETING CARD ,1,7/7/2011 16:30,0.83,,United Kingdom
559338,22037,ROBOT BIRTHDAY CARD,1,7/7/2011 16:30,0.83,,United Kingdom
559338,22116,METAL SIGN HIS DINNER IS SERVED,1,7/7/2011 16:30,1.63,,United Kingdom
559338,22163,HEART STRING MEMO HOLDER HANGING,1,7/7/2011 16:30,3.29,,United Kingdom
559339,21326,AGED GLASS SILVER T-LIGHT HOLDER,24,7/7/2011 16:49,0.65,13752,United Kingdom
559339,84946,ANTIQUE SILVER T-LIGHT GLASS,60,7/7/2011 16:49,1.25,13752,United Kingdom
559340,22413,METAL SIGN TAKE IT OR LEAVE IT ,6,7/7/2011 16:51,2.95,13699,United Kingdom
559340,22115,METAL SIGN EMPIRE TEA,12,7/7/2011 16:51,0.79,13699,United Kingdom
559340,85152,HAND OVER THE CHOCOLATE   SIGN ,12,7/7/2011 16:51,2.1,13699,United Kingdom
559340,22117,METAL SIGN HER DINNER IS SERVED ,6,7/7/2011 16:51,2.95,13699,United Kingdom
559340,21955,DOORMAT UNION JACK GUNS AND ROSES,4,7/7/2011 16:51,7.95,13699,United Kingdom
559340,21523,DOORMAT FANCY FONT HOME SWEET HOME,4,7/7/2011 16:51,7.95,13699,United Kingdom
559340,23284,DOORMAT KEEP CALM AND COME IN,4,7/7/2011 16:51,7.95,13699,United Kingdom
559340,22692,DOORMAT WELCOME TO OUR HOME,4,7/7/2011 16:51,7.95,13699,United Kingdom
559340,48185,DOORMAT FAIRY CAKE,4,7/7/2011 16:51,7.95,13699,United Kingdom
559340,48188,DOORMAT WELCOME PUPPIES,2,7/7/2011 16:51,7.95,13699,United Kingdom
559340,48111,DOORMAT 3 SMILEY CATS,2,7/7/2011 16:51,7.95,13699,United Kingdom
559340,22365,DOORMAT RESPECTABLE HOUSE,2,7/7/2011 16:51,7.95,13699,United Kingdom
559340,22414,DOORMAT NEIGHBOURHOOD WITCH ,2,7/7/2011 16:51,7.95,13699,United Kingdom
559340,22366,DOORMAT AIRMAIL ,2,7/7/2011 16:51,7.95,13699,United Kingdom
559341,23199,JUMBO BAG APPLES,20,7/7/2011 16:56,2.08,15144,United Kingdom
559341,23200,JUMBO BAG PEARS,20,7/7/2011 16:56,2.08,15144,United Kingdom
559341,23239,SET OF 4 KNICK KNACK TINS POPPIES,12,7/7/2011 16:56,4.15,15144,United Kingdom
559341,23237,SET OF 4 KNICK KNACK TINS LEAF,12,7/7/2011 16:56,4.15,15144,United Kingdom
559341,23202,JUMBO BAG VINTAGE LEAF,20,7/7/2011 16:56,2.08,15144,United Kingdom
559341,85099B,JUMBO BAG RED RETROSPOT,10,7/7/2011 16:56,2.08,15144,United Kingdom
559341,22555,PLASTERS IN TIN STRONGMAN,24,7/7/2011 16:56,1.65,15144,United Kingdom
559341,22554,PLASTERS IN TIN WOODLAND ANIMALS,24,7/7/2011 16:56,1.65,15144,United Kingdom
559341,22557,PLASTERS IN TIN VINTAGE PAISLEY ,24,7/7/2011 16:56,1.65,15144,United Kingdom
559341,22556,PLASTERS IN TIN CIRCUS PARADE ,24,7/7/2011 16:56,1.65,15144,United Kingdom
559341,22551,PLASTERS IN TIN SPACEBOY,24,7/7/2011 16:56,1.65,15144,United Kingdom
559342,84945,MULTI COLOUR SILVER T-LIGHT HOLDER,48,7/7/2011 16:59,0.85,14493,United Kingdom
559342,22585,PACK OF 6 BIRDY GIFT TAGS,12,7/7/2011 16:59,1.25,14493,United Kingdom
559342,84879,ASSORTED COLOUR BIRD ORNAMENT,16,7/7/2011 16:59,1.69,14493,United Kingdom
559342,85169A,IVORY LOVE BIRD CANDLE,12,7/7/2011 16:59,1.25,14493,United Kingdom
559342,85169B,BLACK LOVE BIRD CANDLE,12,7/7/2011 16:59,1.25,14493,United Kingdom
559342,85160B,BLACK BIRD GARDEN DESIGN MUG,6,7/7/2011 16:59,0.39,14493,United Kingdom
559342,15039,SANDALWOOD FAN,10,7/7/2011 16:59,0.85,14493,United Kingdom
559342,23065,LARGE DECO JEWELLERY STAND,3,7/7/2011 16:59,12.5,14493,United Kingdom
559342,23066,SMALL DECO JEWELLERY STAND,4,7/7/2011 16:59,8.25,14493,United Kingdom
559342,84795B,SUNSET CHECK HAMMOCK,2,7/7/2011 16:59,7.95,14493,United Kingdom
559342,21136,PAINTED METAL PEARS ASSORTED,8,7/7/2011 16:59,1.69,14493,United Kingdom
559342,16016,LARGE CHINESE STYLE SCISSOR,10,7/7/2011 16:59,0.85,14493,United Kingdom
559342,16014,SMALL CHINESE STYLE SCISSOR,20,7/7/2011 16:59,0.42,14493,United Kingdom
559342,21698,MOCK LOBSTER FRIDGE MAGNET,12,7/7/2011 16:59,0.85,14493,United Kingdom
559342,22923,FRIDGE MAGNETS LES ENFANTS ASSORTED,12,7/7/2011 16:59,0.85,14493,United Kingdom
559342,22915,ASSORTED BOTTLE TOP  MAGNETS ,12,7/7/2011 16:59,0.42,14493,United Kingdom
559342,22924,FRIDGE MAGNETS LA VIE EN ROSE,12,7/7/2011 16:59,0.85,14493,United Kingdom
559342,84929,ASSTD FRUIT+FLOWERS FRIDGE MAGNETS,24,7/7/2011 16:59,0.55,14493,United Kingdom
559342,21588,RETROSPOT GIANT TUBE MATCHES,12,7/7/2011 16:59,2.55,14493,United Kingdom
559342,79321,CHILLI LIGHTS,8,7/7/2011 16:59,5.75,14493,United Kingdom
559342,90043,COPPER AND BRASS BAG CHARM,3,7/7/2011 16:59,4.95,14493,United Kingdom
559342,90049,IVORY GOLD METAL BAG CHARM,3,7/7/2011 16:59,4.95,14493,United Kingdom
559342,90046,WHITE WITH METAL BAG CHARM,3,7/7/2011 16:59,4.95,14493,United Kingdom
559342,90048,GREEN WITH METAL BAG CHARM,3,7/7/2011 16:59,4.95,14493,United Kingdom
559342,47566,PARTY BUNTING,12,7/7/2011 16:59,4.95,14493,United Kingdom
559342,23298,SPOTTY BUNTING,6,7/7/2011 16:59,4.95,14493,United Kingdom
559342,23022,SMALL BONNE JAM JAR  T-LIGHT HOLDER,12,7/7/2011 16:59,2.08,14493,United Kingdom
559342,23023,RIDGED BONNE JAM JAR T-LIGHT HOLDER,12,7/7/2011 16:59,1.65,14493,United Kingdom
559342,23109,LED TEA LIGHTS,18,7/7/2011 16:59,2.89,14493,United Kingdom
559343,85035B,CHOCOLATE 3 WICK MORRIS BOX CANDLE,1,7/7/2011 17:01,4.25,17961,United Kingdom
C559344,22606,WOODEN SKITTLES GARDEN SET,-1,7/7/2011 17:09,15.95,17837,United Kingdom
C559345,21439,BASKET OF TOADSTOOLS,-408,7/7/2011 17:16,1.06,13984,United Kingdom
559346,84879,ASSORTED COLOUR BIRD ORNAMENT,8,7/7/2011 17:19,1.69,13486,United Kingdom
559346,22969,HOMEMADE JAM SCENTED CANDLES,12,7/7/2011 17:19,1.45,13486,United Kingdom
559346,84929,ASSTD FRUIT+FLOWERS FRIDGE MAGNETS,24,7/7/2011 17:19,0.19,13486,United Kingdom
559346,22103,MIRROR MOSAIC T-LIGHT HOLDER ROUND,6,7/7/2011 17:19,1.65,13486,United Kingdom
559346,23145,ZINC T-LIGHT HOLDER STAR LARGE,12,7/7/2011 17:19,0.95,13486,United Kingdom
559346,23144,ZINC T-LIGHT HOLDER STARS SMALL,12,7/7/2011 17:19,0.83,13486,United Kingdom
559346,84970L,SINGLE HEART ZINC T-LIGHT HOLDER,12,7/7/2011 17:19,0.95,13486,United Kingdom
559346,84970S,HANGING HEART ZINC T-LIGHT HOLDER,12,7/7/2011 17:19,0.85,13486,United Kingdom
559346,22457,NATURAL SLATE HEART CHALKBOARD ,6,7/7/2011 17:19,2.95,13486,United Kingdom
559346,22389,PAPERWEIGHT SAVE THE PLANET,6,7/7/2011 17:19,2.55,13486,United Kingdom
559346,22393,PAPERWEIGHT VINTAGE COLLAGE,6,7/7/2011 17:19,2.55,13486,United Kingdom
559346,22391,PAPERWEIGHT HOME SWEET HOME,6,7/7/2011 17:19,2.55,13486,United Kingdom
559346,23173,REGENCY TEAPOT ROSES ,2,7/7/2011 17:19,9.95,13486,United Kingdom
559346,21135,VICTORIAN  METAL POSTCARD SPRING,8,7/7/2011 17:19,1.69,13486,United Kingdom
559346,20829,GLITTER HANGING BUTTERFLY STRING,8,7/7/2011 17:19,2.1,13486,United Kingdom
C559347,M,Manual,-1,7/7/2011 17:22,2.88,18072,United Kingdom
C559347,85159A,"BLACK TEA,COFFEE,SUGAR JARS",-24,7/7/2011 17:22,1.95,18072,United Kingdom
C559347,85032C,CURIOUS IMAGES GIFT WRAP SET,-12,7/7/2011 17:22,0.65,18072,United Kingdom
C559347,85032D,YULETIDE IMAGES GIFT WRAP SET,-12,7/7/2011 17:22,0.65,18072,United Kingdom
C559347,35965,FOLKART HEART NAPKIN RINGS,-24,7/7/2011 17:22,0.79,18072,United Kingdom
C559347,22771,CLEAR DRAWER KNOB ACRYLIC EDWARDIAN,-12,7/7/2011 17:22,1.25,18072,United Kingdom
C559347,22209,WOOD STAMP SET HAPPY BIRTHDAY,-12,7/7/2011 17:22,0.83,18072,United Kingdom
C559347,22208,WOOD STAMP SET THANK YOU,-12,7/7/2011 17:22,0.83,18072,United Kingdom
C559347,22161,HEART DECORATION RUSTIC HANGING ,-24,7/7/2011 17:22,0.19,18072,United Kingdom
C559347,21673,WHITE SPOT BLUE CERAMIC DRAWER KNOB,-24,7/7/2011 17:22,1.25,18072,United Kingdom
C559347,21672,WHITE SPOT RED CERAMIC DRAWER KNOB,-12,7/7/2011 17:22,1.25,18072,United Kingdom
C559347,21671,RED SPOT CERAMIC DRAWER KNOB,-12,7/7/2011 17:22,1.25,18072,United Kingdom
C559347,21670,BLUE SPOT CERAMIC DRAWER KNOB,-12,7/7/2011 17:22,1.25,18072,United Kingdom
C559347,21373,MIRRORED WALL ART SNOWFLAKES,-12,7/7/2011 17:22,0.75,18072,United Kingdom
C559347,20840,FRENCH FLORAL CUSHION COVER ,-12,7/7/2011 17:22,0.85,18072,United Kingdom
C559347,20838,FRENCH LATTICE CUSHION COVER ,-12,7/7/2011 17:22,0.85,18072,United Kingdom
C559347,20836,FRENCH PAISLEY CUSHION COVER,-12,7/7/2011 17:22,0.83,18072,United Kingdom
C559347,M,Manual,-1,7/7/2011 17:22,9.36,18072,United Kingdom
C559348,47594A,CAROUSEL DESIGN WASHBAG,-1,7/7/2011 17:25,1.95,16550,United Kingdom
C559348,75049L,LARGE CIRCULAR MIRROR MOBILE,-2,7/7/2011 17:25,0.85,16550,United Kingdom
559349,23112,PARISIENNE CURIO CABINET,4,7/7/2011 17:33,7.5,15150,United Kingdom
559349,23028,DRAWER KNOB CRACKLE GLAZE BLUE,12,7/7/2011 17:33,1.65,15150,United Kingdom
559349,84509A,SET OF 4 ENGLISH ROSE PLACEMATS,4,7/7/2011 17:33,3.75,15150,United Kingdom
559349,20997,ROSE DU SUD CUSHION COVER ,3,7/7/2011 17:33,4.95,15150,United Kingdom
559349,20934,SET/3 POT PLANT CANDLES,2,7/7/2011 17:33,5.45,15150,United Kingdom
559349,22583,PACK OF 6 HANDBAG GIFT BOXES,6,7/7/2011 17:33,2.55,15150,United Kingdom
559349,82486,WOOD S/3 CABINET ANT WHITE FINISH,2,7/7/2011 17:33,8.95,15150,United Kingdom
559349,84821,DANISH ROSE DELUXE COASTER,12,7/7/2011 17:33,0.85,15150,United Kingdom
559349,84510A,SET OF 4 ENGLISH ROSE COASTERS,10,7/7/2011 17:33,1.25,15150,United Kingdom
559349,23032,DRAWER KNOB CRACKLE GLAZE IVORY,6,7/7/2011 17:33,1.65,15150,United Kingdom
559349,23245,SET OF 3 REGENCY CAKE TINS,4,7/7/2011 17:33,4.95,15150,United Kingdom
559349,22423,REGENCY CAKESTAND 3 TIER,1,7/7/2011 17:33,12.75,15150,United Kingdom
559349,21985,PACK OF 12 HEARTS DESIGN TISSUES ,24,7/7/2011 17:33,0.29,15150,United Kingdom
559349,21984,PACK OF 12 PINK PAISLEY TISSUES ,24,7/7/2011 17:33,0.29,15150,United Kingdom
559349,16161P,WRAP ENGLISH ROSE ,25,7/7/2011 17:33,0.42,15150,United Kingdom
559349,22048,BIRTHDAY BANQUET GIFT WRAP,25,7/7/2011 17:33,0.42,15150,United Kingdom
559349,85014A,BLACK/BLUE POLKADOT UMBRELLA,3,7/7/2011 17:33,5.95,15150,United Kingdom
559349,85014B,RED RETROSPOT UMBRELLA,3,7/7/2011 17:33,5.95,15150,United Kingdom
559349,22969,HOMEMADE JAM SCENTED CANDLES,12,7/7/2011 17:33,1.45,15150,United Kingdom
559349,48184,DOORMAT ENGLISH ROSE ,2,7/7/2011 17:33,7.95,15150,United Kingdom
559350,22726,ALARM CLOCK BAKELIKE GREEN,4,7/7/2011 17:35,3.75,16842,United Kingdom
559350,22727,ALARM CLOCK BAKELIKE RED ,4,7/7/2011 17:35,3.75,16842,United Kingdom
559350,22728,ALARM CLOCK BAKELIKE PINK,4,7/7/2011 17:35,3.75,16842,United Kingdom
559350,22729,ALARM CLOCK BAKELIKE ORANGE,4,7/7/2011 17:35,3.75,16842,United Kingdom
559350,71459,HANGING JAM JAR T-LIGHT HOLDER,24,7/7/2011 17:35,0.85,16842,United Kingdom
559350,84978,HANGING HEART JAR T-LIGHT HOLDER,12,7/7/2011 17:35,1.25,16842,United Kingdom
559350,23080,RED METAL BOX TOP SECRET,4,7/7/2011 17:35,8.25,16842,United Kingdom
559350,22986,WRAP GINGHAM ROSE ,25,7/7/2011 17:35,0.42,16842,United Kingdom
559350,22197,POPCORN HOLDER,24,7/7/2011 17:35,0.85,16842,United Kingdom
559350,22423,REGENCY CAKESTAND 3 TIER,4,7/7/2011 17:35,12.75,16842,United Kingdom
559350,21746,SMALL RED RETROSPOT WINDMILL,12,7/7/2011 17:35,1.25,16842,United Kingdom
559350,21135,VICTORIAN  METAL POSTCARD SPRING,16,7/7/2011 17:35,1.69,16842,United Kingdom
559350,84879,ASSORTED COLOUR BIRD ORNAMENT,16,7/7/2011 17:35,1.69,16842,United Kingdom
559350,22139,RETROSPOT TEA SET CERAMIC 11 PC ,6,7/7/2011 17:35,4.95,16842,United Kingdom
559350,21929,JUMBO BAG PINK VINTAGE PAISLEY,10,7/7/2011 17:35,2.08,16842,United Kingdom
559350,20726,LUNCH BAG WOODLAND,10,7/7/2011 17:35,1.65,16842,United Kingdom
C559351,23275,SET OF 3 HANGING OWLS OLLIE BEAK,-48,7/7/2011 17:42,1.25,13408,United Kingdom
559352,90205C,LARGE CRYSTAL DIAMANTE HAIRSLIDE,1,7/7/2011 17:47,1.65,17837,United Kingdom
559352,90205A,LARGE MINT DIAMANTE HAIRSLIDE,1,7/7/2011 17:47,1.65,17837,United Kingdom
559352,22804,CANDLEHOLDER PINK HANGING HEART,4,7/7/2011 17:47,2.95,17837,United Kingdom
559352,85123A,WHITE HANGING HEART T-LIGHT HOLDER,4,7/7/2011 17:47,2.95,17837,United Kingdom
559352,22138,BAKING SET 9 PIECE RETROSPOT ,3,7/7/2011 17:47,4.95,17837,United Kingdom
559352,20840,FRENCH FLORAL CUSHION COVER ,6,7/7/2011 17:47,0.85,17837,United Kingdom
559352,22635,CHILDS BREAKFAST SET DOLLY GIRL ,6,7/7/2011 17:47,9.95,17837,United Kingdom
559352,22634,CHILDS BREAKFAST SET SPACEBOY ,2,7/7/2011 17:47,9.95,17837,United Kingdom
559353,84968C,SET OF 16 VINTAGE PISTACHIO CUTLERY,5,7/7/2011 17:56,12.75,13302,United Kingdom
559354,47566,PARTY BUNTING,4,7/7/2011 18:02,4.95,16012,United Kingdom
559354,22556,PLASTERS IN TIN CIRCUS PARADE ,12,7/7/2011 18:02,1.65,16012,United Kingdom
559354,22607,WOODEN ROUNDERS GARDEN SET ,2,7/7/2011 18:02,9.95,16012,United Kingdom
559354,22149,FELTCRAFT 6 FLOWER FRIENDS,6,7/7/2011 18:02,2.1,16012,United Kingdom
559354,20977,36 PENCILS TUBE WOODLAND,16,7/7/2011 18:02,1.25,16012,United Kingdom
559354,20978,36 PENCILS TUBE SKULLS,16,7/7/2011 18:02,1.25,16012,United Kingdom
559354,22710,WRAP I LOVE LONDON ,25,7/7/2011 18:02,0.42,16012,United Kingdom
559354,23230,WRAP ALPHABET DESIGN,25,7/7/2011 18:02,0.42,16012,United Kingdom
559354,20717,STRAWBERRY SHOPPER BAG,10,7/7/2011 18:02,1.25,16012,United Kingdom
559354,22077,6 RIBBONS RUSTIC CHARM,12,7/7/2011 18:02,1.65,16012,United Kingdom
559354,23285,PINK VINTAGE SPOT BEAKER,8,7/7/2011 18:02,0.85,16012,United Kingdom
559354,23286,BLUE VINTAGE SPOT BEAKER,8,7/7/2011 18:02,0.85,16012,United Kingdom
559354,23288,GREEN VINTAGE SPOT BEAKER,8,7/7/2011 18:02,0.85,16012,United Kingdom
559354,22961,JAM MAKING SET PRINTED,12,7/7/2011 18:02,1.45,16012,United Kingdom
559354,22423,REGENCY CAKESTAND 3 TIER,1,7/7/2011 18:02,12.75,16012,United Kingdom
559354,23245,SET OF 3 REGENCY CAKE TINS,4,7/7/2011 18:02,4.95,16012,United Kingdom
559354,21868,POTTING SHED TEA MUG,12,7/7/2011 18:02,1.25,16012,United Kingdom
559354,22427,ENAMEL FLOWER JUG CREAM,3,7/7/2011 18:02,5.95,16012,United Kingdom
559354,22303,COFFEE MUG APPLES DESIGN,6,7/7/2011 18:02,2.55,16012,United Kingdom
559354,22302,COFFEE MUG PEARS  DESIGN,6,7/7/2011 18:02,2.55,16012,United Kingdom
559354,22665,RECIPE BOX BLUE SKETCHBOOK DESIGN,6,7/7/2011 18:02,2.95,16012,United Kingdom
559354,21172,PARTY METAL SIGN ,12,7/7/2011 18:02,1.45,16012,United Kingdom
559354,22784,LANTERN CREAM GAZEBO ,3,7/7/2011 18:02,4.95,16012,United Kingdom
559354,22825,DECORATIVE PLANT POT WITH FRIEZE,2,7/7/2011 18:02,7.95,16012,United Kingdom
559355,23082,SET 6 PAPER TABLE LANTERN HEARTS ,6,7/7/2011 18:14,3.75,17007,United Kingdom
559355,20984,12 PENCILS TALL TUBE POSY,24,7/7/2011 18:14,0.29,17007,United Kingdom
559355,22215,CAKE STAND WHITE TWO TIER LACE,2,7/7/2011 18:14,8.5,17007,United Kingdom
559355,22435,SET OF 9 HEART SHAPED BALLOONS,12,7/7/2011 18:14,1.25,17007,United Kingdom
559355,21199,PINK  HEART CONFETTI IN TUBE,12,7/7/2011 18:14,1.65,17007,United Kingdom
559355,23133,LARGE IVORY HEART WALL ORGANISER,2,7/7/2011 18:14,8.25,17007,United Kingdom
559355,22605,WOODEN CROQUET GARDEN SET,1,7/7/2011 18:14,14.95,17007,United Kingdom
559356,23170,REGENCY TEA PLATE ROSES ,12,7/7/2011 18:29,1.65,15416,United Kingdom
559356,23171,REGENCY TEA PLATE GREEN ,12,7/7/2011 18:29,1.65,15416,United Kingdom
559356,23172,REGENCY TEA PLATE PINK,12,7/7/2011 18:29,1.65,15416,United Kingdom
559356,23245,SET OF 3 REGENCY CAKE TINS,4,7/7/2011 18:29,4.95,15416,United Kingdom
559356,21936,RED RETROSPOT PICNIC BAG,5,7/7/2011 18:29,2.95,15416,United Kingdom
559356,22654,DELUXE SEWING KIT ,3,7/7/2011 18:29,5.95,15416,United Kingdom
559356,22077,6 RIBBONS RUSTIC CHARM,12,7/7/2011 18:29,1.65,15416,United Kingdom
559356,23209,LUNCH BAG DOILEY PATTERN ,10,7/7/2011 18:29,1.65,15416,United Kingdom
559356,20726,LUNCH BAG WOODLAND,10,7/7/2011 18:29,1.65,15416,United Kingdom
559356,22384,LUNCH BAG PINK POLKADOT,10,7/7/2011 18:29,1.65,15416,United Kingdom
559356,22411,JUMBO SHOPPER VINTAGE RED PAISLEY,10,7/7/2011 18:29,2.08,15416,United Kingdom
559356,23202,JUMBO BAG VINTAGE LEAF,10,7/7/2011 18:29,2.08,15416,United Kingdom
559356,21935,SUKI  SHOULDER BAG,10,7/7/2011 18:29,1.65,15416,United Kingdom
559356,22383,LUNCH BAG SUKI DESIGN ,10,7/7/2011 18:29,1.65,15416,United Kingdom
559356,21981,PACK OF 12 WOODLAND TISSUES ,24,7/7/2011 18:29,0.29,15416,United Kingdom
559356,21982,PACK OF 12 SUKI TISSUES ,24,7/7/2011 18:29,0.29,15416,United Kingdom
559356,21984,PACK OF 12 PINK PAISLEY TISSUES ,24,7/7/2011 18:29,0.29,15416,United Kingdom
559356,21485,RETROSPOT HEART HOT WATER BOTTLE,3,7/7/2011 18:29,4.95,15416,United Kingdom
559356,22835,HOT WATER BOTTLE I AM SO POORLY,4,7/7/2011 18:29,4.65,15416,United Kingdom
559356,22112,CHOCOLATE HOT WATER BOTTLE,3,7/7/2011 18:29,4.95,15416,United Kingdom
559356,22794,SWEETHEART WIRE MAGAZINE RACK,2,7/7/2011 18:29,7.95,15416,United Kingdom
559356,84879,ASSORTED COLOUR BIRD ORNAMENT,24,7/7/2011 18:29,1.69,15416,United Kingdom
559356,22470,HEART OF WICKER LARGE,6,7/7/2011 18:29,2.95,15416,United Kingdom
559356,23107,WHITE HEARTS WIRE PLANT POT HOLDER,8,7/7/2011 18:29,2.89,15416,United Kingdom
559356,23226,FILIGREE HEART DAISY WHITE,24,7/7/2011 18:29,1.25,15416,United Kingdom
559356,84836,ZINC METAL HEART DECORATION,12,7/7/2011 18:29,1.25,15416,United Kingdom
559356,23092,LARGE ANTIQUE WHITE PHOTO FRAME,4,7/7/2011 18:29,7.9,15416,United Kingdom
559356,22767,TRIPLE PHOTO FRAME CORNICE ,4,7/7/2011 18:29,9.95,15416,United Kingdom
559356,22768,FAMILY PHOTO FRAME CORNICE,4,7/7/2011 18:29,9.95,15416,United Kingdom
559356,22766,PHOTO FRAME CORNICE,8,7/7/2011 18:29,2.95,15416,United Kingdom
559356,22822,CREAM WALL PLANTER HEART SHAPED,2,7/7/2011 18:29,5.95,15416,United Kingdom
559356,23284,DOORMAT KEEP CALM AND COME IN,2,7/7/2011 18:29,7.95,15416,United Kingdom
559356,23088,ZINC HEART FLOWER T-LIGHT HOLDER,16,7/7/2011 18:29,1.25,15416,United Kingdom
559356,85123A,WHITE HANGING HEART T-LIGHT HOLDER,6,7/7/2011 18:29,2.95,15416,United Kingdom
559356,82600,NO SINGING METAL SIGN,12,7/7/2011 18:29,2.1,15416,United Kingdom
559356,22915,ASSORTED BOTTLE TOP  MAGNETS ,12,7/7/2011 18:29,0.42,15416,United Kingdom
559356,23181,BULL DOG BOTTLE TOP WALL CLOCK,2,7/7/2011 18:29,8.25,15416,United Kingdom
559356,23126,FELTCRAFT GIRL AMELIE KIT,4,7/7/2011 18:29,4.95,15416,United Kingdom
559356,23127,FELTCRAFT GIRL NICOLE KIT,4,7/7/2011 18:29,4.95,15416,United Kingdom
559356,22568,FELTCRAFT CUSHION OWL,4,7/7/2011 18:29,3.75,15416,United Kingdom
559356,47590A,BLUE HAPPY BIRTHDAY BUNTING,6,7/7/2011 18:29,5.45,15416,United Kingdom
559356,47590B,PINK HAPPY BIRTHDAY BUNTING,6,7/7/2011 18:29,5.45,15416,United Kingdom
559356,85014A,BLACK/BLUE POLKADOT UMBRELLA,3,7/7/2011 18:29,5.95,15416,United Kingdom
559356,85014B,RED RETROSPOT UMBRELLA,3,7/7/2011 18:29,5.95,15416,United Kingdom
559357,22470,HEART OF WICKER LARGE,40,7/7/2011 18:56,2.55,17107,United Kingdom
559357,22428,ENAMEL FIRE BUCKET CREAM,12,7/7/2011 18:56,6.35,17107,United Kingdom
559357,44236,PINK/PURPLE CIRCLE CURTAIN,8,7/7/2011 18:56,0.79,17107,United Kingdom
559357,23245,SET OF 3 REGENCY CAKE TINS,4,7/7/2011 18:56,4.95,17107,United Kingdom
559357,23337,EGG FRYING PAN MINT ,1,7/7/2011 18:56,2.08,17107,United Kingdom
559357,21174,POTTERING IN THE SHED METAL SIGN,5,7/7/2011 18:56,2.08,17107,United Kingdom
559357,21165,BEWARE OF THE CAT METAL SIGN ,2,7/7/2011 18:56,1.69,17107,United Kingdom
559357,22670,FRENCH WC SIGN BLUE METAL,2,7/7/2011 18:56,1.25,17107,United Kingdom
559357,23182,TOILET SIGN OCCUPIED OR VACANT,3,7/7/2011 18:56,0.83,17107,United Kingdom
559357,22751,FELTCRAFT PRINCESS OLIVIA DOLL,1,7/7/2011 18:56,3.75,17107,United Kingdom
559357,22749,FELTCRAFT PRINCESS CHARLOTTE DOLL,1,7/7/2011 18:56,3.75,17107,United Kingdom
559357,22750,FELTCRAFT PRINCESS LOLA DOLL,1,7/7/2011 18:56,3.75,17107,United Kingdom
559357,22273,FELTCRAFT DOLL MOLLY,2,7/7/2011 18:56,2.95,17107,United Kingdom
559357,23128,FELTCRAFT BOY JEAN-PAUL KIT,1,7/7/2011 18:56,4.95,17107,United Kingdom
559357,23127,FELTCRAFT GIRL NICOLE KIT,2,7/7/2011 18:56,4.95,17107,United Kingdom
559357,23126,FELTCRAFT GIRL AMELIE KIT,2,7/7/2011 18:56,4.95,17107,United Kingdom
559357,84970S,HANGING HEART ZINC T-LIGHT HOLDER,1,7/7/2011 18:56,0.85,17107,United Kingdom
559357,23203,JUMBO BAG DOILEY PATTERNS,10,7/7/2011 18:56,2.08,17107,United Kingdom
559357,23208,LUNCH BAG VINTAGE LEAF DESIGN,10,7/7/2011 18:56,1.65,17107,United Kingdom
559357,23300,GARDENERS KNEELING PAD CUP OF TEA ,6,7/7/2011 18:56,1.65,17107,United Kingdom
559357,23301,GARDENERS KNEELING PAD KEEP CALM ,6,7/7/2011 18:56,1.65,17107,United Kingdom
559357,23209,LUNCH BAG DOILEY PATTERN ,20,7/7/2011 18:56,1.65,17107,United Kingdom
559357,20728,LUNCH BAG CARS BLUE,10,7/7/2011 18:56,1.65,17107,United Kingdom
559357,23298,SPOTTY BUNTING,8,7/7/2011 18:56,4.95,17107,United Kingdom
559357,23240,SET OF 4 KNICK KNACK TINS DOILEY ,6,7/7/2011 18:56,4.15,17107,United Kingdom
559357,23162,REGENCY TEA STRAINER,2,7/7/2011 18:56,3.75,17107,United Kingdom
559357,22641,SET OF 4 NAPKIN CHARMS INSTRUMENT,1,7/7/2011 18:56,2.55,17107,United Kingdom
559357,22639,SET OF 4 NAPKIN CHARMS HEARTS,1,7/7/2011 18:56,2.55,17107,United Kingdom
559357,23163,REGENCY SUGAR TONGS,4,7/7/2011 18:56,2.49,17107,United Kingdom
559357,22845,VINTAGE CREAM CAT FOOD CONTAINER,1,7/7/2011 18:56,6.35,17107,United Kingdom
559357,37475,SET/4 COLOURFUL MIXING BOWLS,1,7/7/2011 18:56,9.95,17107,United Kingdom
559357,22961,JAM MAKING SET PRINTED,1,7/7/2011 18:56,1.45,17107,United Kingdom
559357,22960,JAM MAKING SET WITH JARS,2,7/7/2011 18:56,4.25,17107,United Kingdom
559357,23157,SET OF 6 NATIVITY MAGNETS ,12,7/7/2011 18:56,2.08,17107,United Kingdom
559357,23243,SET OF TEA COFFEE SUGAR TINS PANTRY,2,7/7/2011 18:56,4.95,17107,United Kingdom
559357,21876,POTTERING MUG,6,7/7/2011 18:56,1.25,17107,United Kingdom
559357,23013,GLASS APOTHECARY BOTTLE TONIC,3,7/7/2011 18:56,3.95,17107,United Kingdom
559357,22697,GREEN REGENCY TEACUP AND SAUCER,1,7/7/2011 18:56,2.95,17107,United Kingdom
559357,22698,PINK REGENCY TEACUP AND SAUCER,3,7/7/2011 18:56,2.95,17107,United Kingdom
559357,21874,GIN AND TONIC MUG,1,7/7/2011 18:56,1.25,17107,United Kingdom
559357,22844,VINTAGE CREAM DOG FOOD CONTAINER,2,7/7/2011 18:56,8.5,17107,United Kingdom
559357,23080,RED METAL BOX TOP SECRET,2,7/7/2011 18:56,8.25,17107,United Kingdom
559357,21894,POTTING SHED SEED ENVELOPES,1,7/7/2011 18:56,1.25,17107,United Kingdom
559357,85099C,JUMBO  BAG BAROQUE BLACK WHITE,10,7/7/2011 18:56,2.08,17107,United Kingdom
559357,23202,JUMBO BAG VINTAGE LEAF,10,7/7/2011 18:56,2.08,17107,United Kingdom
559357,23201,JUMBO BAG ALPHABET,10,7/7/2011 18:56,2.08,17107,United Kingdom
559357,23200,JUMBO BAG PEARS,10,7/7/2011 18:56,2.08,17107,United Kingdom
559357,23322,LARGE WHITE HEART OF WICKER,3,7/7/2011 18:56,2.95,17107,United Kingdom
559357,22692,DOORMAT WELCOME TO OUR HOME,20,7/7/2011 18:56,6.75,17107,United Kingdom
559357,48187,DOORMAT NEW ENGLAND,10,7/7/2011 18:56,6.75,17107,United Kingdom
559357,23283,DOORMAT VINTAGE LEAF,20,7/7/2011 18:56,6.75,17107,United Kingdom
559357,21523,DOORMAT FANCY FONT HOME SWEET HOME,20,7/7/2011 18:56,6.75,17107,United Kingdom
559357,22690,DOORMAT HOME SWEET HOME BLUE ,10,7/7/2011 18:56,6.75,17107,United Kingdom
559357,21524,DOORMAT SPOTTY HOME SWEET HOME,20,7/7/2011 18:56,6.75,17107,United Kingdom
559357,48116,DOORMAT MULTICOLOUR STRIPE,10,7/7/2011 18:56,6.75,17107,United Kingdom
559357,48173C,DOORMAT BLACK FLOCK ,20,7/7/2011 18:56,6.75,17107,United Kingdom
