556776,21880,RED RETROSPOT TAPE,2,6/14/2011 12:24,0.65,14730,United Kingdom
556776,22748,POPPY'S PLAYHOUSE KITCHEN,2,6/14/2011 12:24,2.1,14730,United Kingdom
556776,20754,RETROSPOT RED WASHING UP GLOVES,1,6/14/2011 12:24,2.1,14730,United Kingdom
556776,22789,T-LIGHT HOLDER SWEETHEART HANGING,2,6/14/2011 12:24,1.95,14730,United Kingdom
556776,21430,SET/3 RED GINGHAM ROSE STORAGE BOX,1,6/14/2011 12:24,3.75,14730,United Kingdom
556776,22796,PHOTO FRAME 3 CLASSIC HANGING,1,6/14/2011 12:24,9.95,14730,United Kingdom
556776,23284,DOORMAT KEEP CALM AND COME IN,1,6/14/2011 12:24,7.95,14730,United Kingdom
556776,21623,VINTAGE UNION JACK MEMOBOARD,1,6/14/2011 12:24,9.95,14730,United Kingdom
556776,22974,CHILDRENS DOLLY GIRL MUG,3,6/14/2011 12:24,1.65,14730,United Kingdom
556776,23234,BISCUIT TIN VINTAGE CHRISTMAS,1,6/14/2011 12:24,2.89,14730,United Kingdom
556776,21114,LAVENDER SCENTED FABRIC HEART,5,6/14/2011 12:24,1.25,14730,United Kingdom
556776,22720,SET OF 3 CAKE TINS PANTRY DESIGN ,2,6/14/2011 12:24,4.95,14730,United Kingdom
556776,21058,PARTY INVITES WOODLAND,2,6/14/2011 12:24,0.85,14730,United Kingdom
556776,22588,CARD HOLDER GINGHAM HEART,1,6/14/2011 12:24,2.89,14730,United Kingdom
556776,23203,JUMBO BAG DOILEY PATTERNS,1,6/14/2011 12:24,2.08,14730,United Kingdom
556776,21929,JUMBO BAG PINK VINTAGE PAISLEY,1,6/14/2011 12:24,2.08,14730,United Kingdom
556777,37495,FAIRY CAKE BIRTHDAY CANDLE SET,4,6/14/2011 12:31,3.75,14426,United Kingdom
556777,21715,GIRLS VINTAGE TIN SEASIDE BUCKET,8,6/14/2011 12:31,2.55,14426,United Kingdom
556777,21716,BOYS VINTAGE TIN SEASIDE BUCKET,8,6/14/2011 12:31,2.55,14426,United Kingdom
556777,21718,RED METAL BEACH SPADE ,12,6/14/2011 12:31,1.25,14426,United Kingdom
556777,21891,TRADITIONAL WOODEN SKIPPING ROPE,12,6/14/2011 12:31,1.45,14426,United Kingdom
556777,21889,WOODEN BOX OF DOMINOES,12,6/14/2011 12:31,1.25,14426,United Kingdom
556777,22138,BAKING SET 9 PIECE RETROSPOT ,3,6/14/2011 12:31,4.95,14426,United Kingdom
556777,22139,RETROSPOT TEA SET CERAMIC 11 PC ,3,6/14/2011 12:31,4.95,14426,United Kingdom
556777,22436,12 COLOURED PARTY BALLOONS,20,6/14/2011 12:31,0.65,14426,United Kingdom
556777,47566,PARTY BUNTING,4,6/14/2011 12:31,4.95,14426,United Kingdom
556777,22493,PAINT YOUR OWN CANVAS SET,12,6/14/2011 12:31,1.65,14426,United Kingdom
556777,82484,WOOD BLACK BOARD ANT WHITE FINISH,2,6/14/2011 12:31,7.95,14426,United Kingdom
556777,23308,SET OF 60 VINTAGE LEAF CAKE CASES ,24,6/14/2011 12:31,0.55,14426,United Kingdom
556777,23307,SET OF 60 PANTRY DESIGN CAKE CASES ,24,6/14/2011 12:31,0.55,14426,United Kingdom
556777,23309,SET OF 60 I LOVE LONDON CAKE CASES ,24,6/14/2011 12:31,0.55,14426,United Kingdom
556777,21937,STRAWBERRY   PICNIC BAG,5,6/14/2011 12:31,2.95,14426,United Kingdom
556777,21989,PACK OF 20 SKULL PAPER NAPKINS,12,6/14/2011 12:31,0.85,14426,United Kingdom
556777,21080,SET/20 RED RETROSPOT PAPER NAPKINS ,12,6/14/2011 12:31,0.85,14426,United Kingdom
556777,23299,FOOD COVER WITH BEADS SET 2 ,6,6/14/2011 12:31,3.75,14426,United Kingdom
556777,21471,STRAWBERRY RAFFIA FOOD COVER,6,6/14/2011 12:31,3.75,14426,United Kingdom
556777,21466,RED FLOWER CROCHET FOOD COVER,6,6/14/2011 12:31,3.75,14426,United Kingdom
556777,21467,CHERRY CROCHET FOOD COVER,6,6/14/2011 12:31,3.75,14426,United Kingdom
556777,21469,POLKA DOT RAFFIA FOOD COVER,6,6/14/2011 12:31,3.75,14426,United Kingdom
556777,21976,PACK OF 60 MUSHROOM CAKE CASES,24,6/14/2011 12:31,0.55,14426,United Kingdom
556777,21213,PACK OF 72 SKULL CAKE CASES,24,6/14/2011 12:31,0.55,14426,United Kingdom
556777,22847,BREAD BIN DINER STYLE IVORY,1,6/14/2011 12:31,16.95,14426,United Kingdom
556777,22624,IVORY KITCHEN SCALES,2,6/14/2011 12:31,8.5,14426,United Kingdom
556777,22720,SET OF 3 CAKE TINS PANTRY DESIGN ,3,6/14/2011 12:31,4.95,14426,United Kingdom
556777,22348,TEA BAG PLATE RED RETROSPOT,12,6/14/2011 12:31,0.85,14426,United Kingdom
556777,22981,PANTRY APPLE CORER,12,6/14/2011 12:31,1.45,14426,United Kingdom
556777,23110,PARISIENNE KEY CABINET ,2,6/14/2011 12:31,5.75,14426,United Kingdom
556777,22173,METAL 4 HOOK HANGER FRENCH CHATEAU,8,6/14/2011 12:31,2.95,14426,United Kingdom
556777,22770,MIRROR CORNICE,1,6/14/2011 12:31,14.95,14426,United Kingdom
556777,21756,BATH BUILDING BLOCK WORD,3,6/14/2011 12:31,5.95,14426,United Kingdom
556777,21754,HOME BUILDING BLOCK WORD,3,6/14/2011 12:31,5.95,14426,United Kingdom
556777,22795,SWEETHEART RECIPE BOOK STAND,2,6/14/2011 12:31,6.75,14426,United Kingdom
556777,23094,LE GRAND TRAY CHIC SET,1,6/14/2011 12:31,12.5,14426,United Kingdom
556777,22784,LANTERN CREAM GAZEBO ,3,6/14/2011 12:31,4.95,14426,United Kingdom
556777,71053,WHITE METAL LANTERN,4,6/14/2011 12:31,3.75,14426,United Kingdom
556777,22464,HANGING METAL HEART LANTERN,12,6/14/2011 12:31,1.65,14426,United Kingdom
556777,84946,ANTIQUE SILVER T-LIGHT GLASS,12,6/14/2011 12:31,1.25,14426,United Kingdom
556777,23052,RECYCLED ACAPULCO MAT TURQUOISE,2,6/14/2011 12:31,8.25,14426,United Kingdom
556777,21670,BLUE SPOT CERAMIC DRAWER KNOB,12,6/14/2011 12:31,1.25,14426,United Kingdom
556777,21673,WHITE SPOT BLUE CERAMIC DRAWER KNOB,12,6/14/2011 12:31,1.25,14426,United Kingdom
556778,21682,LARGE MEDINA STAMPED METAL BOWL ,2,6/14/2011 12:41,4.95,16712,United Kingdom
556778,23071,MARIE ANTOINETTE TRINKET BOX GOLD,1,6/14/2011 12:41,12.5,16712,United Kingdom
556778,22088,PAPER BUNTING COLOURED LACE,6,6/14/2011 12:41,2.95,16712,United Kingdom
556778,21094,SET/6 RED SPOTTY PAPER PLATES,6,6/14/2011 12:41,0.85,16712,United Kingdom
556778,21086,SET/6 RED SPOTTY PAPER CUPS,6,6/14/2011 12:41,0.65,16712,United Kingdom
556778,21080,SET/20 RED RETROSPOT PAPER NAPKINS ,4,6/14/2011 12:41,0.85,16712,United Kingdom
556778,21718,RED METAL BEACH SPADE ,6,6/14/2011 12:41,1.25,16712,United Kingdom
556778,22659,LUNCH BOX I LOVE LONDON,3,6/14/2011 12:41,1.95,16712,United Kingdom
556778,23241,TREASURE TIN GYMKHANA DESIGN,3,6/14/2011 12:41,2.08,16712,United Kingdom
556778,23169,CLASSIC GLASS COOKIE JAR,3,6/14/2011 12:41,4.15,16712,United Kingdom
556778,23242,TREASURE TIN BUFFALO BILL ,1,6/14/2011 12:41,2.08,16712,United Kingdom
556778,23338,EGG FRYING PAN RED ,3,6/14/2011 12:41,2.08,16712,United Kingdom
556778,23337,EGG FRYING PAN MINT ,3,6/14/2011 12:41,2.08,16712,United Kingdom
556778,21716,BOYS VINTAGE TIN SEASIDE BUCKET,4,6/14/2011 12:41,2.55,16712,United Kingdom
556778,23252,VINTAGE RED ENAMEL TRIM JUG ,3,6/14/2011 12:41,3.75,16712,United Kingdom
556778,23249,VINTAGE RED ENAMEL TRIM PLATE,12,6/14/2011 12:41,1.65,16712,United Kingdom
556778,23250,VINTAGE RED TRIM ENAMEL BOWL ,12,6/14/2011 12:41,1.25,16712,United Kingdom
556778,23251,VINTAGE RED ENAMEL TRIM MUG ,12,6/14/2011 12:41,1.25,16712,United Kingdom
556778,22428,ENAMEL FIRE BUCKET CREAM,2,6/14/2011 12:41,6.95,16712,United Kingdom
556778,22424,ENAMEL BREAD BIN CREAM,1,6/14/2011 12:41,12.75,16712,United Kingdom
556778,22427,ENAMEL FLOWER JUG CREAM,1,6/14/2011 12:41,5.95,16712,United Kingdom
556778,22625,RED KITCHEN SCALES,1,6/14/2011 12:41,8.5,16712,United Kingdom
556778,22624,IVORY KITCHEN SCALES,1,6/14/2011 12:41,8.5,16712,United Kingdom
556778,22627,MINT KITCHEN SCALES,1,6/14/2011 12:41,8.5,16712,United Kingdom
556778,22853,CAT BOWL VINTAGE CREAM,2,6/14/2011 12:41,3.25,16712,United Kingdom
556778,22631,CIRCUS PARADE LUNCH BOX ,2,6/14/2011 12:41,1.95,16712,United Kingdom
556778,22629,SPACEBOY LUNCH BOX ,2,6/14/2011 12:41,1.95,16712,United Kingdom
556778,22845,VINTAGE CREAM CAT FOOD CONTAINER,2,6/14/2011 12:41,6.35,16712,United Kingdom
556778,22844,VINTAGE CREAM DOG FOOD CONTAINER,2,6/14/2011 12:41,8.5,16712,United Kingdom
556778,84828,JUNGLE POPSICLES ICE LOLLY MOULDS,3,6/14/2011 12:41,1.25,16712,United Kingdom
556778,23049,RECYCLED ACAPULCO MAT RED,3,6/14/2011 12:41,8.25,16712,United Kingdom
556778,23050,RECYCLED ACAPULCO MAT GREEN,2,6/14/2011 12:41,8.25,16712,United Kingdom
556778,23051,RECYCLED ACAPULCO MAT BLUE,2,6/14/2011 12:41,8.25,16712,United Kingdom
556778,23052,RECYCLED ACAPULCO MAT TURQUOISE,3,6/14/2011 12:41,8.25,16712,United Kingdom
556778,23053,RECYCLED ACAPULCO MAT PINK,2,6/14/2011 12:41,8.25,16712,United Kingdom
556778,23054,RECYCLED ACAPULCO MAT LAVENDER,2,6/14/2011 12:41,8.25,16712,United Kingdom
556778,23201,JUMBO BAG ALPHABET,1,6/14/2011 12:41,2.08,16712,United Kingdom
556779,21189,WHITE HONEYCOMB PAPER GARLAND ,3,6/14/2011 12:45,1.65,16774,United Kingdom
556779,21204,DAISIES  HONEYCOMB GARLAND ,3,6/14/2011 12:45,1.65,16774,United Kingdom
556779,21201,TROPICAL  HONEYCOMB PAPER GARLAND ,2,6/14/2011 12:45,2.55,16774,United Kingdom
556779,21200,MULTICOLOUR HONEYCOMB PAPER GARLAND,2,6/14/2011 12:45,1.65,16774,United Kingdom
556779,21188,3D HEARTS  HONEYCOMB PAPER GARLAND,3,6/14/2011 12:45,2.95,16774,United Kingdom
556779,47566,PARTY BUNTING,3,6/14/2011 12:45,4.95,16774,United Kingdom
556779,47566B,TEA TIME PARTY BUNTING,2,6/14/2011 12:45,4.95,16774,United Kingdom
556779,21206,STRAWBERRY HONEYCOMB  GARLAND ,5,6/14/2011 12:45,1.65,16774,United Kingdom
556779,22090,PAPER BUNTING RETROSPOT,2,6/14/2011 12:45,2.95,16774,United Kingdom
556779,22088,PAPER BUNTING COLOURED LACE,2,6/14/2011 12:45,2.95,16774,United Kingdom
556779,22089,PAPER BUNTING VINTAGE PAISLEY,2,6/14/2011 12:45,2.95,16774,United Kingdom
556779,21533,RETROSPOT LARGE MILK JUG,5,6/14/2011 12:45,4.95,16774,United Kingdom
556779,71459,HANGING JAM JAR T-LIGHT HOLDER,48,6/14/2011 12:45,0.85,16774,United Kingdom
556780,21034,REX CASH+CARRY JUMBO SHOPPER,20,6/14/2011 12:46,0.95,14524,United Kingdom
556780,22189,CREAM HEART CARD HOLDER,3,6/14/2011 12:46,3.95,14524,United Kingdom
556780,22588,CARD HOLDER GINGHAM HEART,5,6/14/2011 12:46,2.89,14524,United Kingdom
556780,22607,WOODEN ROUNDERS GARDEN SET ,3,6/14/2011 12:46,9.95,14524,United Kingdom
556780,85123A,WHITE HANGING HEART T-LIGHT HOLDER,3,6/14/2011 12:46,2.95,14524,United Kingdom
556780,21733,RED HANGING HEART T-LIGHT HOLDER,1,6/14/2011 12:46,2.95,14524,United Kingdom
556780,21110,LARGE CAKE TOWEL PINK SPOTS,2,6/14/2011 12:46,6.75,14524,United Kingdom
556780,21112,SWISS ROLL TOWEL PINK  SPOTS,2,6/14/2011 12:46,2.95,14524,United Kingdom
556780,21107,CREAM SLICE FLANNEL PINK SPOT ,3,6/14/2011 12:46,2.95,14524,United Kingdom
556780,22989,SET 2 PANTRY DESIGN TEA TOWELS,4,6/14/2011 12:46,3.25,14524,United Kingdom
556780,22907,PACK OF 20 NAPKINS PANTRY DESIGN,4,6/14/2011 12:46,0.85,14524,United Kingdom
556780,37340,MULTICOLOUR SPRING FLOWER MUG,6,6/14/2011 12:46,0.39,14524,United Kingdom
556780,21470,FLOWER VINE RAFFIA FOOD COVER,3,6/14/2011 12:46,3.75,14524,United Kingdom
556780,22328,ROUND SNACK BOXES SET OF 4 FRUITS ,4,6/14/2011 12:46,2.95,14524,United Kingdom
556780,84997C,CHILDRENS CUTLERY POLKADOT BLUE,3,6/14/2011 12:46,4.15,14524,United Kingdom
556780,23256,CHILDRENS CUTLERY SPACEBOY ,3,6/14/2011 12:46,4.15,14524,United Kingdom
556780,22303,COFFEE MUG APPLES DESIGN,6,6/14/2011 12:46,2.55,14524,United Kingdom
556780,22300,COFFEE MUG DOG + BALL DESIGN,6,6/14/2011 12:46,2.55,14524,United Kingdom
556780,22301,COFFEE MUG CAT + BIRD DESIGN,6,6/14/2011 12:46,2.55,14524,United Kingdom
556780,22423,REGENCY CAKESTAND 3 TIER,1,6/14/2011 12:46,12.75,14524,United Kingdom
556780,22625,RED KITCHEN SCALES,1,6/14/2011 12:46,8.5,14524,United Kingdom
556780,21922,UNION STRIPE WITH FRINGE  HAMMOCK,1,6/14/2011 12:46,7.95,14524,United Kingdom
556780,20718,RED RETROSPOT SHOPPER BAG,3,6/14/2011 12:46,1.25,14524,United Kingdom
556780,22377,BOTTLE BAG RETROSPOT ,2,6/14/2011 12:46,2.1,14524,United Kingdom
556780,21677,HEARTS  STICKERS,6,6/14/2011 12:46,0.85,14524,United Kingdom
556780,21675,BUTTERFLIES STICKERS,6,6/14/2011 12:46,0.85,14524,United Kingdom
556781,84380,SET OF 3 BUTTERFLY COOKIE CUTTERS,12,6/14/2011 12:47,1.25,13384,United Kingdom
556781,23237,SET OF 4 KNICK KNACK TINS LEAVES ,6,6/14/2011 12:47,4.15,13384,United Kingdom
556781,23243,SET OF TEA COFFEE SUGAR TINS PANTRY,4,6/14/2011 12:47,4.95,13384,United Kingdom
556781,22961,JAM MAKING SET PRINTED,24,6/14/2011 12:47,1.45,13384,United Kingdom
556781,22993,SET OF 4 PANTRY JELLY MOULDS,12,6/14/2011 12:47,1.25,13384,United Kingdom
556781,22978,PANTRY ROLLING PIN,6,6/14/2011 12:47,3.75,13384,United Kingdom
556781,22989,SET 2 PANTRY DESIGN TEA TOWELS,12,6/14/2011 12:47,3.25,13384,United Kingdom
556781,22349,DOG BOWL CHASING BALL DESIGN,6,6/14/2011 12:47,3.75,13384,United Kingdom
556781,23308,SET OF 60 VINTAGE LEAF CAKE CASES ,24,6/14/2011 12:47,0.55,13384,United Kingdom
556781,23307,SET OF 60 PANTRY DESIGN CAKE CASES ,24,6/14/2011 12:47,0.55,13384,United Kingdom
556781,21977,PACK OF 60 PINK PAISLEY CAKE CASES,24,6/14/2011 12:47,0.55,13384,United Kingdom
556781,22843,BISCUIT TIN VINTAGE GREEN,2,6/14/2011 12:47,6.75,13384,United Kingdom
556781,22842,BISCUIT TIN VINTAGE RED,2,6/14/2011 12:47,6.75,13384,United Kingdom
556781,22841,ROUND CAKE TIN VINTAGE GREEN,2,6/14/2011 12:47,7.95,13384,United Kingdom
556781,22840,ROUND CAKE TIN VINTAGE RED,2,6/14/2011 12:47,7.95,13384,United Kingdom
556781,22839,3 TIER CAKE TIN GREEN AND CREAM,1,6/14/2011 12:47,14.95,13384,United Kingdom
556781,22838,3 TIER CAKE TIN RED AND CREAM,1,6/14/2011 12:47,14.95,13384,United Kingdom
556781,22853,CAT BOWL VINTAGE CREAM,12,6/14/2011 12:47,3.25,13384,United Kingdom
556781,22852,DOG BOWL VINTAGE CREAM,12,6/14/2011 12:47,4.25,13384,United Kingdom
556781,22849,BREAD BIN DINER STYLE MINT,1,6/14/2011 12:47,16.95,13384,United Kingdom
556781,22846,BREAD BIN DINER STYLE RED ,1,6/14/2011 12:47,16.95,13384,United Kingdom
556781,22845,VINTAGE CREAM CAT FOOD CONTAINER,4,6/14/2011 12:47,6.35,13384,United Kingdom
556781,22844,VINTAGE CREAM DOG FOOD CONTAINER,4,6/14/2011 12:47,8.5,13384,United Kingdom
556781,23250,VINTAGE RED TRIM ENAMEL BOWL ,12,6/14/2011 12:47,1.25,13384,United Kingdom
556781,23249,VINTAGE RED ENAMEL TRIM PLATE,12,6/14/2011 12:47,1.65,13384,United Kingdom
556781,23252,VINTAGE RED ENAMEL TRIM JUG ,4,6/14/2011 12:47,3.75,13384,United Kingdom
556781,23251,VINTAGE RED ENAMEL TRIM MUG ,12,6/14/2011 12:47,1.25,13384,United Kingdom
556781,22627,MINT KITCHEN SCALES,2,6/14/2011 12:47,8.5,13384,United Kingdom
556781,23206,LUNCH BAG APPLE DESIGN,20,6/14/2011 12:47,1.65,13384,United Kingdom
556781,22895,SET OF 2 TEA TOWELS APPLE AND PEARS,6,6/14/2011 12:47,3.25,13384,United Kingdom
556781,22723,SET OF 6 HERB TINS SKETCHBOOK,4,6/14/2011 12:47,3.95,13384,United Kingdom
556781,22727,ALARM CLOCK BAKELIKE RED ,4,6/14/2011 12:47,3.75,13384,United Kingdom
556781,21908,CHOCOLATE THIS WAY METAL SIGN,12,6/14/2011 12:47,2.1,13384,United Kingdom
556781,82582,AREA PATROLLED METAL SIGN,12,6/14/2011 12:47,2.1,13384,United Kingdom
556781,23188,VINTAGE  2 METER FOLDING RULER,12,6/14/2011 12:47,1.65,13384,United Kingdom
556781,84879,ASSORTED COLOUR BIRD ORNAMENT,36,6/14/2011 12:47,1.69,13384,United Kingdom
556781,22526,WHEELBARROW FOR CHILDREN ,1,6/14/2011 12:47,12.75,13384,United Kingdom
556781,21123,SET/10 IVORY POLKADOT PARTY CANDLES,24,6/14/2011 12:47,1.25,13384,United Kingdom
556781,22328,ROUND SNACK BOXES SET OF 4 FRUITS ,6,6/14/2011 12:47,2.95,13384,United Kingdom
556781,22138,BAKING SET 9 PIECE RETROSPOT ,3,6/14/2011 12:47,4.95,13384,United Kingdom
556781,22492,MINI PAINT SET VINTAGE ,36,6/14/2011 12:47,0.65,13384,United Kingdom
556781,22536,MAGIC DRAWING SLATE PURDEY,24,6/14/2011 12:47,0.42,13384,United Kingdom
556781,23192,BUNDLE OF 3 ALPHABET EXERCISE BOOKS,24,6/14/2011 12:47,1.65,13384,United Kingdom
556781,22904,CALENDAR PAPER CUT DESIGN,12,6/14/2011 12:47,2.95,13384,United Kingdom
556781,22717,CARD DOG AND BALL ,24,6/14/2011 12:47,0.42,13384,United Kingdom
556781,22704,WRAP RED APPLES ,25,6/14/2011 12:47,0.42,13384,United Kingdom
556781,22705,WRAP GREEN PEARS ,25,6/14/2011 12:47,0.42,13384,United Kingdom
556781,23232,WRAP VINTAGE PETALS  DESIGN,25,6/14/2011 12:47,0.42,13384,United Kingdom
556781,23230,WRAP ALPHABET DESIGN,25,6/14/2011 12:47,0.42,13384,United Kingdom
556781,23202,JUMBO BAG VINTAGE LEAF,20,6/14/2011 12:47,2.08,13384,United Kingdom
556781,23209,LUNCH BAG DOILEY PATTERN ,20,6/14/2011 12:47,1.65,13384,United Kingdom
556781,23240,SET OF 4 KNICK KNACK TINS DOILEY ,6,6/14/2011 12:47,4.15,13384,United Kingdom
556781,22653,BUTTON BOX ,10,6/14/2011 12:47,1.95,13384,United Kingdom
556781,22652,TRAVEL SEWING KIT,10,6/14/2011 12:47,1.65,13384,United Kingdom
556782,23202,JUMBO BAG VINTAGE LEAF,3,6/14/2011 13:04,2.08,14871,United Kingdom
556782,23203,JUMBO BAG DOILEY PATTERNS,2,6/14/2011 13:04,2.08,14871,United Kingdom
556782,23209,LUNCH BAG DOILEY PATTERN ,2,6/14/2011 13:04,1.65,14871,United Kingdom
556782,21314,SMALL GLASS HEART TRINKET POT,4,6/14/2011 13:04,2.1,14871,United Kingdom
556782,23089,GLASS BON BON JAR,6,6/14/2011 13:04,1.65,14871,United Kingdom
556782,82483,WOOD 2 DRAWER CABINET WHITE FINISH,2,6/14/2011 13:04,6.95,14871,United Kingdom
556782,21658,GLASS  BEURRE DISH,1,6/14/2011 13:04,3.95,14871,United Kingdom
556782,22723,SET OF 6 HERB TINS SKETCHBOOK,1,6/14/2011 13:04,3.95,14871,United Kingdom
556782,23300,GARDENERS KNEELING PAD CUP OF TEA ,3,6/14/2011 13:04,1.65,14871,United Kingdom
556782,23301,GARDENERS KNEELING PAD KEEP CALM ,3,6/14/2011 13:04,1.65,14871,United Kingdom
556782,22470,HEART OF WICKER LARGE,1,6/14/2011 13:04,2.95,14871,United Kingdom
556782,23322,LARGE WHITE HEART OF WICKER,1,6/14/2011 13:04,2.95,14871,United Kingdom
556782,21470,FLOWER VINE RAFFIA FOOD COVER,3,6/14/2011 13:04,3.75,14871,United Kingdom
556782,22721,SET OF 3 CAKE TINS SKETCHBOOK,2,6/14/2011 13:04,4.95,14871,United Kingdom
556782,21430,SET/3 RED GINGHAM ROSE STORAGE BOX,2,6/14/2011 13:04,3.75,14871,United Kingdom
556782,23012,GLASS APOTHECARY BOTTLE PERFUME,1,6/14/2011 13:04,3.95,14871,United Kingdom
556782,23014,GLASS APOTHECARY BOTTLE ELIXIR,1,6/14/2011 13:04,3.95,14871,United Kingdom
556783,23188,VINTAGE  2 METER FOLDING RULER,24,6/14/2011 13:15,1.65,13408,United Kingdom
556783,23169,CLASSIC GLASS COOKIE JAR,18,6/14/2011 13:15,4.15,13408,United Kingdom
556783,22699,ROSES REGENCY TEACUP AND SAUCER ,24,6/14/2011 13:15,2.55,13408,United Kingdom
556783,22771,CLEAR DRAWER KNOB ACRYLIC EDWARDIAN,24,6/14/2011 13:15,1.25,13408,United Kingdom
556783,23035,DRAWER KNOB CERAMIC IVORY,24,6/14/2011 13:15,1.45,13408,United Kingdom
556783,71053,WHITE METAL LANTERN,24,6/14/2011 13:15,3.75,13408,United Kingdom
556783,22189,CREAM HEART CARD HOLDER,12,6/14/2011 13:15,3.95,13408,United Kingdom
556783,22457,NATURAL SLATE HEART CHALKBOARD ,12,6/14/2011 13:15,2.95,13408,United Kingdom
556783,84978,HANGING HEART JAR T-LIGHT HOLDER,36,6/14/2011 13:15,1.06,13408,United Kingdom
556784,21034,REX CASH+CARRY JUMBO SHOPPER,2,6/14/2011 13:15,0.95,14461,United Kingdom
556784,22904,CALENDAR PAPER CUT DESIGN,2,6/14/2011 13:15,2.95,14461,United Kingdom
556784,21056,DOCTOR'S BAG SOFT TOY,2,6/14/2011 13:15,8.95,14461,United Kingdom
556784,22621,TRADITIONAL KNITTING NANCY,2,6/14/2011 13:15,1.65,14461,United Kingdom
556784,21791,VINTAGE HEADS AND TAILS CARD GAME ,2,6/14/2011 13:15,1.25,14461,United Kingdom
556784,84012,MAGIC SHEEP WOOL GROWING FROM PAPER,2,6/14/2011 13:15,2.55,14461,United Kingdom
556784,48129,DOORMAT TOPIARY,1,6/14/2011 13:15,7.95,14461,United Kingdom
556784,22750,FELTCRAFT PRINCESS LOLA DOLL,2,6/14/2011 13:15,3.75,14461,United Kingdom
556784,85025B,EAU DE NILE HEART SHAPE PHOTO FRAME,4,6/14/2011 13:15,1.65,14461,United Kingdom
556784,21889,WOODEN BOX OF DOMINOES,4,6/14/2011 13:15,1.25,14461,United Kingdom
556784,22196,SMALL HEART MEASURING SPOONS,1,6/14/2011 13:15,0.85,14461,United Kingdom
556784,20969,RED FLORAL FELTCRAFT SHOULDER BAG,2,6/14/2011 13:15,3.75,14461,United Kingdom
556784,21678,PAISLEY PATTERN  STICKERS,6,6/14/2011 13:15,0.85,14461,United Kingdom
556784,22637,PIGGY BANK RETROSPOT ,4,6/14/2011 13:15,2.55,14461,United Kingdom
556784,23091,ZINC HERB GARDEN CONTAINER,4,6/14/2011 13:15,6.25,14461,United Kingdom
556784,22645,CERAMIC HEART FAIRY CAKE MONEY BANK,2,6/14/2011 13:15,1.45,14461,United Kingdom
556784,21884,CAKES AND BOWS GIFT  TAPE,1,6/14/2011 13:15,0.65,14461,United Kingdom
556784,21703,BAG 125g SWIRLY MARBLES,1,6/14/2011 13:15,0.42,14461,United Kingdom
556784,20699,MOUSEY LONG LEGS SOFT TOY,2,6/14/2011 13:15,2.55,14461,United Kingdom
556784,21890,S/6 WOODEN SKITTLES IN COTTON BAG,2,6/14/2011 13:15,3.25,14461,United Kingdom
556784,22175,PINK OWL SOFT TOY,2,6/14/2011 13:15,2.95,14461,United Kingdom
556784,22176,BLUE OWL SOFT TOY,2,6/14/2011 13:15,2.95,14461,United Kingdom
556784,20707,CRAZY DAISY HEART DECORATION,2,6/14/2011 13:15,1.25,14461,United Kingdom
556784,35909B,PINK FLOWERS RABBIT EASTER,2,6/14/2011 13:15,2.95,14461,United Kingdom
556784,22150,3 STRIPEY MICE FELTCRAFT,2,6/14/2011 13:15,1.95,14461,United Kingdom
556784,22149,FELTCRAFT 6 FLOWER FRIENDS,2,6/14/2011 13:15,2.1,14461,United Kingdom
556784,84551,CROCHET DOG KEYRING,1,6/14/2011 13:15,1.65,14461,United Kingdom
556784,84548,CROCHET BEAR RED/BLUE  KEYRING,1,6/14/2011 13:15,1.65,14461,United Kingdom
556784,21891,TRADITIONAL WOODEN SKIPPING ROPE,2,6/14/2011 13:15,1.45,14461,United Kingdom
556784,23108,SET OF 10 LED DOLLY LIGHTS,3,6/14/2011 13:15,6.25,14461,United Kingdom
556784,84997A,CHILDRENS CUTLERY POLKADOT GREEN ,2,6/14/2011 13:15,4.15,14461,United Kingdom
556784,84997D,CHILDRENS CUTLERY POLKADOT PINK,2,6/14/2011 13:15,4.15,14461,United Kingdom
556784,85185B,PINK HORSE SOCK PUPPET,2,6/14/2011 13:15,2.95,14461,United Kingdom
556784,84997C,CHILDRENS CUTLERY POLKADOT BLUE,2,6/14/2011 13:15,4.15,14461,United Kingdom
556784,21648,ASSORTED TUTTI FRUTTI SMALL PURSE,4,6/14/2011 13:15,1.25,14461,United Kingdom
556784,79160,HEART SHAPE WIRELESS DOORBELL,6,6/14/2011 13:15,2.1,14461,United Kingdom
556784,22439,6 ROCKET BALLOONS ,2,6/14/2011 13:15,0.65,14461,United Kingdom
556784,21716,BOYS VINTAGE TIN SEASIDE BUCKET,2,6/14/2011 13:15,2.55,14461,United Kingdom
556784,22747,POPPY'S PLAYHOUSE BATHROOM,2,6/14/2011 13:15,2.1,14461,United Kingdom
556784,22748,POPPY'S PLAYHOUSE KITCHEN,2,6/14/2011 13:15,2.1,14461,United Kingdom
556784,22746,POPPY'S PLAYHOUSE LIVINGROOM ,2,6/14/2011 13:15,2.1,14461,United Kingdom
556784,21913,VINTAGE SEASIDE JIGSAW PUZZLES,2,6/14/2011 13:15,3.75,14461,United Kingdom
556784,21912,VINTAGE SNAKES & LADDERS,2,6/14/2011 13:15,3.75,14461,United Kingdom
556784,M,Manual,1,6/14/2011 13:15,0.39,14461,United Kingdom
556784,22348,TEA BAG PLATE RED RETROSPOT,5,6/14/2011 13:15,0.85,14461,United Kingdom
556784,23112,PARISIENNE CURIO CABINET,2,6/14/2011 13:15,7.5,14461,United Kingdom
556784,21922,UNION STRIPE WITH FRINGE  HAMMOCK,1,6/14/2011 13:15,7.95,14461,United Kingdom
556784,23093,SMALL PARISIENNE HEART PHOTO FRAME ,6,6/14/2011 13:15,2.49,14461,United Kingdom
556784,20963,APPLE BATH SPONGE,1,6/14/2011 13:15,1.25,14461,United Kingdom
556784,23321,SMALL WHITE HEART OF WICKER,4,6/14/2011 13:15,1.69,14461,United Kingdom
556784,22469,HEART OF WICKER SMALL,4,6/14/2011 13:15,1.65,14461,United Kingdom
556784,23107,WHITE HEARTS WIRE PLANT POT HOLDER,4,6/14/2011 13:15,2.89,14461,United Kingdom
556784,23111,PARISIENNE SEWING BOX,1,6/14/2011 13:15,12.5,14461,United Kingdom
556784,23110,PARISIENNE KEY CABINET ,2,6/14/2011 13:15,5.75,14461,United Kingdom
556784,21539,RED RETROSPOT BUTTER DISH,2,6/14/2011 13:15,4.95,14461,United Kingdom
556784,21533,RETROSPOT LARGE MILK JUG,1,6/14/2011 13:15,4.95,14461,United Kingdom
556784,23088,ZINC HEART FLOWER T-LIGHT HOLDER,10,6/14/2011 13:15,1.25,14461,United Kingdom
556784,23299,FOOD COVER WITH BEADS SET 2 ,4,6/14/2011 13:15,3.75,14461,United Kingdom
556784,23298,SPOTTY BUNTING,4,6/14/2011 13:15,4.95,14461,United Kingdom
556784,22362,GLASS JAR PEACOCK BATH SALTS,3,6/14/2011 13:15,2.95,14461,United Kingdom
556784,22364,GLASS JAR DIGESTIVE BISCUITS,2,6/14/2011 13:15,2.95,14461,United Kingdom
556784,22363,GLASS JAR MARMALADE ,2,6/14/2011 13:15,2.95,14461,United Kingdom
556784,22361,GLASS JAR DAISY FRESH COTTON WOOL,2,6/14/2011 13:15,2.95,14461,United Kingdom
556784,20914,SET/5 RED RETROSPOT LID GLASS BOWLS,1,6/14/2011 13:15,2.95,14461,United Kingdom
556784,21899,"KEY FOB , GARAGE DESIGN",4,6/14/2011 13:15,0.65,14461,United Kingdom
556784,21900,"KEY FOB , SHED",4,6/14/2011 13:15,0.65,14461,United Kingdom
556784,21902,"KEY FOB , FRONT  DOOR ",4,6/14/2011 13:15,0.65,14461,United Kingdom
556784,21901,"KEY FOB , BACK DOOR ",4,6/14/2011 13:15,0.65,14461,United Kingdom
556784,84968D,SET OF 16 VINTAGE RED CUTLERY,2,6/14/2011 13:15,12.75,14461,United Kingdom
556784,84968A,SET OF 16 VINTAGE ROSE CUTLERY,2,6/14/2011 13:15,12.75,14461,United Kingdom
556784,84968F,SET OF 16 VINTAGE SKY BLUE CUTLERY,2,6/14/2011 13:15,12.75,14461,United Kingdom
556784,84968C,SET OF 16 VINTAGE PISTACHIO CUTLERY,2,6/14/2011 13:15,12.75,14461,United Kingdom
556784,23175,REGENCY MILK JUG PINK ,4,6/14/2011 13:15,3.25,14461,United Kingdom
556784,84988,SET OF 72 PINK HEART PAPER DOILIES,1,6/14/2011 13:15,1.45,14461,United Kingdom
556784,21210,SET OF 72 RETROSPOT PAPER  DOILIES,1,6/14/2011 13:15,1.45,14461,United Kingdom
556784,22480,RED TEA TOWEL CLASSIC DESIGN,4,6/14/2011 13:15,1.25,14461,United Kingdom
556784,23136,IVORY WIRE SWEETHEART LETTER TRAY,2,6/14/2011 13:15,3.75,14461,United Kingdom
556784,23075,PARLOUR CERAMIC WALL HOOK,8,6/14/2011 13:15,4.15,14461,United Kingdom
556784,22727,ALARM CLOCK BAKELIKE RED ,1,6/14/2011 13:15,3.75,14461,United Kingdom
556784,22729,ALARM CLOCK BAKELIKE ORANGE,1,6/14/2011 13:15,3.75,14461,United Kingdom
556784,22728,ALARM CLOCK BAKELIKE PINK,2,6/14/2011 13:15,3.75,14461,United Kingdom
556784,21528,DAIRY MAID TRADITIONAL TEAPOT ,1,6/14/2011 13:15,6.95,14461,United Kingdom
556784,22423,REGENCY CAKESTAND 3 TIER,2,6/14/2011 13:15,12.75,14461,United Kingdom
556784,23174,REGENCY SUGAR BOWL GREEN,4,6/14/2011 13:15,4.15,14461,United Kingdom
556784,23171,REGENCY TEA PLATE GREEN ,12,6/14/2011 13:15,1.65,14461,United Kingdom
556784,37448,CERAMIC CAKE DESIGN SPOTTED MUG,2,6/14/2011 13:15,1.49,14461,United Kingdom
556784,23170,REGENCY TEA PLATE ROSES ,12,6/14/2011 13:15,1.65,14461,United Kingdom
556784,21534,DAIRY MAID LARGE MILK JUG,1,6/14/2011 13:15,4.95,14461,United Kingdom
556784,23173,REGENCY TEAPOT ROSES ,4,6/14/2011 13:15,9.95,14461,United Kingdom
