562373,22630,DOLLY GIRL LUNCH BOX,30,8/4/2011 14:33,1.95,16672,United Kingdom
562373,22634,CHILDS BREAKFAST SET SPACEBOY ,12,8/4/2011 14:33,8.5,16672,United Kingdom
562373,22635,CHILDS BREAKFAST SET DOLLY GIRL ,8,8/4/2011 14:33,8.5,16672,United Kingdom
562374,22945,CHRISTMAS METAL TAGS ASSORTED ,144,8/4/2011 14:40,0.72,14911,EIRE
562374,22910,PAPER CHAIN KIT VINTAGE CHRISTMAS,200,8/4/2011 14:40,2.55,14911,EIRE
562374,22909,SET OF 20 VINTAGE CHRISTMAS NAPKINS,192,8/4/2011 14:40,0.72,14911,EIRE
562374,22907,PACK OF 20 NAPKINS PANTRY DESIGN,12,8/4/2011 14:40,0.85,14911,EIRE
562374,22699,ROSES REGENCY TEACUP AND SAUCER ,48,8/4/2011 14:40,2.55,14911,EIRE
562374,22698,PINK REGENCY TEACUP AND SAUCER,48,8/4/2011 14:40,2.55,14911,EIRE
562374,22697,GREEN REGENCY TEACUP AND SAUCER,48,8/4/2011 14:40,2.55,14911,EIRE
562374,22423,REGENCY CAKESTAND 3 TIER,32,8/4/2011 14:40,10.95,14911,EIRE
562374,22193,RED DINER WALL CLOCK,12,8/4/2011 14:40,7.65,14911,EIRE
562374,22192,BLUE DINER WALL CLOCK,12,8/4/2011 14:40,7.65,14911,EIRE
562374,22086,PAPER CHAIN KIT 50'S CHRISTMAS ,120,8/4/2011 14:40,2.55,14911,EIRE
562374,21977,PACK OF 60 PINK PAISLEY CAKE CASES,24,8/4/2011 14:40,0.55,14911,EIRE
562374,23318,BOX OF 6 MINI VINTAGE CRACKERS,96,8/4/2011 14:40,2.08,14911,EIRE
562374,23315,IVORY REFECTORY CLOCK,12,8/4/2011 14:40,8.15,14911,EIRE
562374,23314,VINTAGE CHRISTMAS TABLECLOTH,4,8/4/2011 14:40,12.5,14911,EIRE
562374,23307,SET OF 60 PANTRY DESIGN CAKE CASES ,24,8/4/2011 14:40,0.55,14911,EIRE
562374,23175,REGENCY MILK JUG PINK ,48,8/4/2011 14:40,2.75,14911,EIRE
562374,23174,REGENCY SUGAR BOWL GREEN,48,8/4/2011 14:40,3.75,14911,EIRE
562374,23173,REGENCY TEAPOT ROSES ,24,8/4/2011 14:40,8.15,14911,EIRE
562374,23172,REGENCY TEA PLATE PINK,48,8/4/2011 14:40,1.45,14911,EIRE
562374,23171,REGENCY TEA PLATE GREEN ,48,8/4/2011 14:40,1.45,14911,EIRE
562374,23170,REGENCY TEA PLATE ROSES ,48,8/4/2011 14:40,1.45,14911,EIRE
562374,23169,CLASSIC GLASS COOKIE JAR,6,8/4/2011 14:40,4.15,14911,EIRE
562374,23166,MEDIUM CERAMIC TOP STORAGE JAR,12,8/4/2011 14:40,1.25,14911,EIRE
562374,23163,REGENCY SUGAR TONGS,48,8/4/2011 14:40,2.08,14911,EIRE
562374,23157,SET OF 6 NATIVITY MAGNETS ,240,8/4/2011 14:40,1.85,14911,EIRE
562374,22980,PANTRY SCRUBBING BRUSH,48,8/4/2011 14:40,1.45,14911,EIRE
562374,22979,PANTRY WASHING UP BRUSH,72,8/4/2011 14:40,1.25,14911,EIRE
562374,22978,PANTRY ROLLING PIN,24,8/4/2011 14:40,3.39,14911,EIRE
562374,22952,60 CAKE CASES VINTAGE CHRISTMAS,240,8/4/2011 14:40,0.42,14911,EIRE
562374,22950,36 DOILIES VINTAGE CHRISTMAS,288,8/4/2011 14:40,1.25,14911,EIRE
C562375,23318,BOX OF 6 MINI VINTAGE CRACKERS,-96,8/4/2011 14:46,2.08,14911,EIRE
C562375,23315,IVORY REFECTORY CLOCK,-12,8/4/2011 14:46,8.15,14911,EIRE
C562375,23314,VINTAGE CHRISTMAS TABLECLOTH,-4,8/4/2011 14:46,12.5,14911,EIRE
C562375,23307,SET OF 60 PANTRY DESIGN CAKE CASES ,-24,8/4/2011 14:46,0.55,14911,EIRE
C562375,23175,REGENCY MILK JUG PINK ,-48,8/4/2011 14:46,2.75,14911,EIRE
C562375,23174,REGENCY SUGAR BOWL GREEN,-48,8/4/2011 14:46,3.75,14911,EIRE
C562375,23173,REGENCY TEAPOT ROSES ,-24,8/4/2011 14:46,8.15,14911,EIRE
C562375,23172,REGENCY TEA PLATE PINK,-48,8/4/2011 14:46,1.45,14911,EIRE
C562375,23171,REGENCY TEA PLATE GREEN ,-48,8/4/2011 14:46,1.45,14911,EIRE
C562375,23170,REGENCY TEA PLATE ROSES ,-48,8/4/2011 14:46,1.45,14911,EIRE
C562375,23169,CLASSIC GLASS COOKIE JAR,-6,8/4/2011 14:46,4.15,14911,EIRE
C562375,23166,MEDIUM CERAMIC TOP STORAGE JAR,-12,8/4/2011 14:46,1.25,14911,EIRE
C562375,23163,REGENCY SUGAR TONGS,-48,8/4/2011 14:46,2.08,14911,EIRE
C562375,23157,SET OF 6 NATIVITY MAGNETS ,-240,8/4/2011 14:46,1.85,14911,EIRE
C562375,22980,PANTRY SCRUBBING BRUSH,-48,8/4/2011 14:46,1.45,14911,EIRE
C562375,22979,PANTRY WASHING UP BRUSH,-72,8/4/2011 14:46,1.25,14911,EIRE
C562375,22978,PANTRY ROLLING PIN,-24,8/4/2011 14:46,3.39,14911,EIRE
C562375,22952,60 CAKE CASES VINTAGE CHRISTMAS,-240,8/4/2011 14:46,0.42,14911,EIRE
C562375,22950,36 DOILIES VINTAGE CHRISTMAS,-288,8/4/2011 14:46,1.25,14911,EIRE
C562375,22945,CHRISTMAS METAL TAGS ASSORTED ,-144,8/4/2011 14:46,0.72,14911,EIRE
C562375,22910,PAPER CHAIN KIT VINTAGE CHRISTMAS,-200,8/4/2011 14:46,2.55,14911,EIRE
C562375,22909,SET OF 20 VINTAGE CHRISTMAS NAPKINS,-192,8/4/2011 14:46,0.72,14911,EIRE
C562375,22907,PACK OF 20 NAPKINS PANTRY DESIGN,-12,8/4/2011 14:46,0.85,14911,EIRE
C562375,22699,ROSES REGENCY TEACUP AND SAUCER ,-48,8/4/2011 14:46,2.55,14911,EIRE
C562375,22698,PINK REGENCY TEACUP AND SAUCER,-48,8/4/2011 14:46,2.55,14911,EIRE
C562375,22697,GREEN REGENCY TEACUP AND SAUCER,-48,8/4/2011 14:46,2.55,14911,EIRE
C562375,22423,REGENCY CAKESTAND 3 TIER,-32,8/4/2011 14:46,10.95,14911,EIRE
C562375,22193,RED DINER WALL CLOCK,-12,8/4/2011 14:46,7.65,14911,EIRE
C562375,22192,BLUE DINER WALL CLOCK,-12,8/4/2011 14:46,7.65,14911,EIRE
C562375,22086,PAPER CHAIN KIT 50'S CHRISTMAS ,-120,8/4/2011 14:46,2.55,14911,EIRE
C562375,21977,PACK OF 60 PINK PAISLEY CAKE CASES,-24,8/4/2011 14:46,0.55,14911,EIRE
562376,10133,COLOURING PENCILS BROWN TUBE,40,8/4/2011 15:04,0.42,15254,United Kingdom
562376,22381,TOY TIDY PINK POLKADOT,5,8/4/2011 15:04,2.1,15254,United Kingdom
562376,85032D,YULETIDE IMAGES GIFT WRAP SET,12,8/4/2011 15:04,0.65,15254,United Kingdom
562376,22969,HOMEMADE JAM SCENTED CANDLES,12,8/4/2011 15:04,1.45,15254,United Kingdom
562376,84946,ANTIQUE SILVER T-LIGHT GLASS,12,8/4/2011 15:04,1.25,15254,United Kingdom
562376,23109,PACK OF SIX LED TEA LIGHTS,6,8/4/2011 15:04,2.89,15254,United Kingdom
562376,22548,HEADS AND TAILS SPORTING FUN,12,8/4/2011 15:04,1.25,15254,United Kingdom
562376,23546,WRAP PAISLEY PARK ,25,8/4/2011 15:04,0.42,15254,United Kingdom
562376,23549,WRAP BIRD GARDEN ,25,8/4/2011 15:04,0.42,15254,United Kingdom
562376,23234,BISCUIT TIN VINTAGE CHRISTMAS,6,8/4/2011 15:04,2.89,15254,United Kingdom
562376,23313,VINTAGE CHRISTMAS BUNTING,5,8/4/2011 15:04,4.95,15254,United Kingdom
562376,23319,BOX OF 6 MINI 50'S CRACKERS,6,8/4/2011 15:04,2.49,15254,United Kingdom
562376,23344,JUMBO BAG 50'S CHRISTMAS ,10,8/4/2011 15:04,2.08,15254,United Kingdom
562376,22113,GREY HEART HOT WATER BOTTLE,4,8/4/2011 15:04,3.75,15254,United Kingdom
562376,23310,BUBBLEGUM RING ASSORTED,72,8/4/2011 15:04,0.42,15254,United Kingdom
562376,85099C,JUMBO  BAG BAROQUE BLACK WHITE,10,8/4/2011 15:04,2.08,15254,United Kingdom
562376,23203,JUMBO BAG DOILEY PATTERNS,10,8/4/2011 15:04,2.08,15254,United Kingdom
562376,21485,RETROSPOT HEART HOT WATER BOTTLE,3,8/4/2011 15:04,4.95,15254,United Kingdom
562377,23299,FOOD COVER WITH BEADS SET 2 ,2,8/4/2011 15:04,3.75,14535,United Kingdom
562377,22993,SET OF 4 PANTRY JELLY MOULDS,2,8/4/2011 15:04,1.25,14535,United Kingdom
562377,21559,STRAWBERRY LUNCH BOX WITH CUTLERY,1,8/4/2011 15:04,2.55,14535,United Kingdom
562377,21922,UNION STRIPE WITH FRINGE  HAMMOCK,7,8/4/2011 15:04,7.95,14535,United Kingdom
562377,23245,SET OF 3 REGENCY CAKE TINS,1,8/4/2011 15:04,4.95,14535,United Kingdom
562377,23229,VINTAGE DONKEY TAIL GAME ,3,8/4/2011 15:04,3.75,14535,United Kingdom
562377,23307,SET OF 60 PANTRY DESIGN CAKE CASES ,3,8/4/2011 15:04,0.55,14535,United Kingdom
562377,23308,SET OF 60 VINTAGE LEAF CAKE CASES ,3,8/4/2011 15:04,0.55,14535,United Kingdom
562377,23191,BUNDLE OF 3 RETRO NOTE BOOKS,3,8/4/2011 15:04,1.65,14535,United Kingdom
562377,23192,BUNDLE OF 3 ALPHABET EXERCISE BOOKS,3,8/4/2011 15:04,1.65,14535,United Kingdom
562377,22907,PACK OF 20 NAPKINS PANTRY DESIGN,2,8/4/2011 15:04,0.85,14535,United Kingdom
562377,23298,SPOTTY BUNTING,4,8/4/2011 15:04,4.95,14535,United Kingdom
562377,23321,SMALL WHITE HEART OF WICKER,6,8/4/2011 15:04,1.65,14535,United Kingdom
562377,23188,VINTAGE  2 METER FOLDING RULER,4,8/4/2011 15:04,1.65,14535,United Kingdom
562377,23322,LARGE WHITE HEART OF WICKER,6,8/4/2011 15:04,2.95,14535,United Kingdom
562377,23288,GREEN VINTAGE SPOT BEAKER,2,8/4/2011 15:04,0.85,14535,United Kingdom
562377,23285,PINK VINTAGE SPOT BEAKER,2,8/4/2011 15:04,0.85,14535,United Kingdom
562377,23287,RED VINTAGE SPOT BEAKER,2,8/4/2011 15:04,0.85,14535,United Kingdom
562377,23286,BLUE VINTAGE SPOT BEAKER,2,8/4/2011 15:04,0.85,14535,United Kingdom
562377,22990,COTTON APRON PANTRY DESIGN,3,8/4/2011 15:04,4.95,14535,United Kingdom
562377,21745,GAOLERS KEYS DECORATIVE GARDEN ,3,8/4/2011 15:04,3.75,14535,United Kingdom
562377,22697,GREEN REGENCY TEACUP AND SAUCER,2,8/4/2011 15:04,2.95,14535,United Kingdom
562377,22699,ROSES REGENCY TEACUP AND SAUCER ,2,8/4/2011 15:04,2.95,14535,United Kingdom
562377,22426,ENAMEL WASH BOWL CREAM,2,8/4/2011 15:04,3.75,14535,United Kingdom
562377,20752,BLUE POLKADOT WASHING UP GLOVES,2,8/4/2011 15:04,2.1,14535,United Kingdom
562377,20996,JAZZ HEARTS ADDRESS BOOK,6,8/4/2011 15:04,0.19,14535,United Kingdom
562377,22210,WOOD STAMP SET BEST WISHES,3,8/4/2011 15:04,0.83,14535,United Kingdom
562377,22211,WOOD STAMP SET FLOWERS,3,8/4/2011 15:04,0.83,14535,United Kingdom
562377,84997A,CHILDRENS CUTLERY POLKADOT GREEN ,1,8/4/2011 15:04,4.15,14535,United Kingdom
562377,23256,CHILDRENS CUTLERY SPACEBOY ,2,8/4/2011 15:04,4.15,14535,United Kingdom
562377,84997B,CHILDRENS CUTLERY RETROSPOT RED ,1,8/4/2011 15:04,4.15,14535,United Kingdom
562377,84997D,CHILDRENS CUTLERY POLKADOT PINK,2,8/4/2011 15:04,4.15,14535,United Kingdom
562377,20754,RETROSPOT RED WASHING UP GLOVES,2,8/4/2011 15:04,2.1,14535,United Kingdom
562377,22627,MINT KITCHEN SCALES,1,8/4/2011 15:04,8.5,14535,United Kingdom
562377,22624,IVORY KITCHEN SCALES,1,8/4/2011 15:04,8.5,14535,United Kingdom
562377,22963,JAM JAR WITH GREEN LID,6,8/4/2011 15:04,0.85,14535,United Kingdom
562377,16045,POPART WOODEN PENCILS ASST,100,8/4/2011 15:04,0.04,14535,United Kingdom
562377,22720,SET OF 3 CAKE TINS PANTRY DESIGN ,2,8/4/2011 15:04,4.95,14535,United Kingdom
562377,22961,JAM MAKING SET PRINTED,2,8/4/2011 15:04,1.45,14535,United Kingdom
562377,22561,WOODEN SCHOOL COLOURING SET,4,8/4/2011 15:04,1.65,14535,United Kingdom
562377,22564,ALPHABET STENCIL CRAFT,4,8/4/2011 15:04,1.25,14535,United Kingdom
562377,85059,FRENCH ENAMEL WATER BASIN,1,8/4/2011 15:04,3.75,14535,United Kingdom
562377,23178,JAM CLOCK MAGNET,2,8/4/2011 15:04,2.89,14535,United Kingdom
562377,23175,REGENCY MILK JUG PINK ,1,8/4/2011 15:04,3.25,14535,United Kingdom
562377,23152,IVORY SWEETHEART WIRE LETTER RACK ,2,8/4/2011 15:04,3.75,14535,United Kingdom
562377,22457,NATURAL SLATE HEART CHALKBOARD ,12,8/4/2011 15:04,2.95,14535,United Kingdom
562377,22488,NATURAL SLATE RECTANGLE CHALKBOARD,4,8/4/2011 15:04,1.65,14535,United Kingdom
562377,22794,SWEETHEART WIRE MAGAZINE RACK,1,8/4/2011 15:04,7.95,14535,United Kingdom
562377,22411,JUMBO SHOPPER VINTAGE RED PAISLEY,2,8/4/2011 15:04,2.08,14535,United Kingdom
562377,23203,JUMBO BAG DOILEY PATTERNS,2,8/4/2011 15:04,2.08,14535,United Kingdom
562377,23199,JUMBO BAG APPLES,2,8/4/2011 15:04,2.08,14535,United Kingdom
562377,47590A,BLUE HAPPY BIRTHDAY BUNTING,1,8/4/2011 15:04,5.45,14535,United Kingdom
562377,47590B,PINK HAPPY BIRTHDAY BUNTING,1,8/4/2011 15:04,5.45,14535,United Kingdom
562377,47566,PARTY BUNTING,2,8/4/2011 15:04,4.95,14535,United Kingdom
562377,22456,NATURAL SLATE CHALKBOARD LARGE ,2,8/4/2011 15:04,4.95,14535,United Kingdom
562377,82484,WOOD BLACK BOARD ANT WHITE FINISH,1,8/4/2011 15:04,7.95,14535,United Kingdom
562377,21561,DINOSAUR LUNCH BOX WITH CUTLERY,1,8/4/2011 15:04,2.55,14535,United Kingdom
562377,22630,DOLLY GIRL LUNCH BOX,1,8/4/2011 15:04,1.95,14535,United Kingdom
562377,22629,SPACEBOY LUNCH BOX ,1,8/4/2011 15:04,1.95,14535,United Kingdom
562377,20992,JAZZ HEARTS PURSE NOTEBOOK,6,8/4/2011 15:04,0.39,14535,United Kingdom
562377,21755,LOVE BUILDING BLOCK WORD,1,8/4/2011 15:04,5.95,14535,United Kingdom
562377,85123A,WHITE HANGING HEART T-LIGHT HOLDER,12,8/4/2011 15:04,2.95,14535,United Kingdom
562377,47504H,ENGLISH ROSE SPIRIT LEVEL ,1,8/4/2011 15:04,0.79,14535,United Kingdom
562377,47503A,ASS FLORAL PRINT MULTI SCREWDRIVER,3,8/4/2011 15:04,0.42,14535,United Kingdom
562377,21621,VINTAGE UNION JACK BUNTING,6,8/4/2011 15:04,8.5,14535,United Kingdom
562377,82494L,WOODEN FRAME ANTIQUE WHITE ,6,8/4/2011 15:04,2.95,14535,United Kingdom
562377,85066,CREAM SWEETHEART MINI CHEST,1,8/4/2011 15:04,12.75,14535,United Kingdom
562377,82482,WOODEN PICTURE FRAME WHITE FINISH,6,8/4/2011 15:04,2.55,14535,United Kingdom
562377,84978,HANGING HEART JAR T-LIGHT HOLDER,6,8/4/2011 15:04,1.25,14535,United Kingdom
562377,23138,SINGLE WIRE HOOK IVORY HEART,12,8/4/2011 15:04,1.45,14535,United Kingdom
562377,72122,COFFEE SCENT PILLAR CANDLE,4,8/4/2011 15:04,0.95,14535,United Kingdom
562377,23026,DRAWER KNOB VINTAGE GLASS STAR,6,8/4/2011 15:04,2.08,14535,United Kingdom
562377,21668,RED STRIPE CERAMIC DRAWER KNOB,6,8/4/2011 15:04,1.25,14535,United Kingdom
562377,23032,DRAWER KNOB CRACKLE GLAZE IVORY,6,8/4/2011 15:04,1.65,14535,United Kingdom
562377,23033,DRAWER KNOB CERAMIC RED,6,8/4/2011 15:04,1.45,14535,United Kingdom
562377,21669,BLUE STRIPE CERAMIC DRAWER KNOB,6,8/4/2011 15:04,1.25,14535,United Kingdom
562377,23028,DRAWER KNOB CRACKLE GLAZE BLUE,6,8/4/2011 15:04,1.65,14535,United Kingdom
562377,23031,DRAWER KNOB CRACKLE GLAZE PINK,6,8/4/2011 15:04,1.65,14535,United Kingdom
562377,23029,DRAWER KNOB CRACKLE GLAZE GREEN,6,8/4/2011 15:04,1.65,14535,United Kingdom
562377,22383,LUNCH BAG SUKI DESIGN ,2,8/4/2011 15:04,1.65,14535,United Kingdom
562377,23546,WRAP PAISLEY PARK ,25,8/4/2011 15:04,0.42,14535,United Kingdom
562377,23548,WRAP MAGIC FOREST ,25,8/4/2011 15:04,0.42,14535,United Kingdom
562377,22704,WRAP RED APPLES ,25,8/4/2011 15:04,0.42,14535,United Kingdom
562377,23209,LUNCH BAG DOILEY PATTERN ,1,8/4/2011 15:04,1.65,14535,United Kingdom
562377,23208,LUNCH BAG VINTAGE LEAF DESIGN,2,8/4/2011 15:04,1.65,14535,United Kingdom
562377,23206,LUNCH BAG APPLE DESIGN,2,8/4/2011 15:04,1.65,14535,United Kingdom
562377,22382,LUNCH BAG SPACEBOY DESIGN ,2,8/4/2011 15:04,1.65,14535,United Kingdom
562377,23207,LUNCH BAG ALPHABET DESIGN,3,8/4/2011 15:04,1.65,14535,United Kingdom
562377,23306,SET OF 36 DOILIES PANTRY DESIGN,2,8/4/2011 15:04,1.45,14535,United Kingdom
562377,23077,DOUGHNUT LIP GLOSS ,20,8/4/2011 15:04,1.25,14535,United Kingdom
562377,22469,HEART OF WICKER SMALL,2,8/4/2011 15:04,1.65,14535,United Kingdom
562377,22470,HEART OF WICKER LARGE,2,8/4/2011 15:04,2.95,14535,United Kingdom
562377,21034,REX CASH+CARRY JUMBO SHOPPER,1,8/4/2011 15:04,0.95,14535,United Kingdom
562377,22328,ROUND SNACK BOXES SET OF 4 FRUITS ,3,8/4/2011 15:04,2.95,14535,United Kingdom
562377,23167,SMALL CERAMIC TOP STORAGE JAR ,8,8/4/2011 15:04,0.83,14535,United Kingdom
562377,23166,MEDIUM CERAMIC TOP STORAGE JAR,12,8/4/2011 15:04,1.25,14535,United Kingdom
562377,23165,LARGE CERAMIC TOP STORAGE JAR,6,8/4/2011 15:04,1.65,14535,United Kingdom
562378,21034,REX CASH+CARRY JUMBO SHOPPER,5,8/4/2011 15:07,0.95,15046,United Kingdom
562378,85049F,BABY BOOM RIBBONS ,6,8/4/2011 15:07,1.25,15046,United Kingdom
562378,85049G,CHOCOLATE BOX RIBBONS ,6,8/4/2011 15:07,1.25,15046,United Kingdom
562378,22077,6 RIBBONS RUSTIC CHARM,6,8/4/2011 15:07,1.65,15046,United Kingdom
562378,23140,TRIPLE WIRE HOOK IVORY HEART,3,8/4/2011 15:07,4.15,15046,United Kingdom
562378,85049C,ROMANTIC PINKS RIBBONS ,6,8/4/2011 15:07,1.25,15046,United Kingdom
562378,85049E,SCANDINAVIAN REDS RIBBONS,12,8/4/2011 15:07,1.25,15046,United Kingdom
562378,85049A,TRADITIONAL CHRISTMAS RIBBONS,6,8/4/2011 15:07,1.25,15046,United Kingdom
562378,23150,IVORY SWEETHEART SOAP DISH,1,8/4/2011 15:07,2.49,15046,United Kingdom
562378,21326,AGED GLASS SILVER T-LIGHT HOLDER,12,8/4/2011 15:07,0.65,15046,United Kingdom
562378,23322,LARGE WHITE HEART OF WICKER,4,8/4/2011 15:07,2.95,15046,United Kingdom
562378,21809,CHRISTMAS HANGING TREE WITH BELL,48,8/4/2011 15:07,1.25,15046,United Kingdom
562378,23226,FILIGREE HEART DAISY WHITE,48,8/4/2011 15:07,1.25,15046,United Kingdom
562378,85061W,WHITE JEWELLED HEART DECORATION,24,8/4/2011 15:07,0.85,15046,United Kingdom
562378,23138,SINGLE WIRE HOOK IVORY HEART,12,8/4/2011 15:07,1.45,15046,United Kingdom
562378,23131,MISTLETOE HEART WREATH CREAM,48,8/4/2011 15:07,3.75,15046,United Kingdom
562378,22806,SET OF 6 T-LIGHTS WEDDING CAKE ,1,8/4/2011 15:07,2.95,15046,United Kingdom
562378,21824,PAINTED METAL STAR WITH HOLLY BELLS,24,8/4/2011 15:07,1.45,15046,United Kingdom
562378,82482,WOODEN PICTURE FRAME WHITE FINISH,2,8/4/2011 15:07,2.55,15046,United Kingdom
562378,21080,SET/20 RED RETROSPOT PAPER NAPKINS ,2,8/4/2011 15:07,0.85,15046,United Kingdom
562378,22907,PACK OF 20 NAPKINS PANTRY DESIGN,2,8/4/2011 15:07,0.85,15046,United Kingdom
562378,22908,PACK OF 20 NAPKINS RED APPLES,2,8/4/2011 15:07,0.85,15046,United Kingdom
562378,21811,HANGING HEART WITH BELL,48,8/4/2011 15:07,1.25,15046,United Kingdom
562378,22153,ANGEL DECORATION STARS ON DRESS,96,8/4/2011 15:07,0.42,15046,United Kingdom
562378,21823,PAINTED METAL HEART WITH HOLLY BELL,48,8/4/2011 15:07,1.45,15046,United Kingdom
562378,35970,ZINC FOLKART SLEIGH BELLS,6,8/4/2011 15:07,1.69,15046,United Kingdom
562378,21807,WHITE CHRISTMAS STAR DECORATION,36,8/4/2011 15:07,0.42,15046,United Kingdom
562378,22824,3 TIER SWEETHEART GARDEN SHELF,1,8/4/2011 15:07,35.95,15046,United Kingdom
562378,84879,ASSORTED COLOUR BIRD ORNAMENT,160,8/4/2011 15:07,1.45,15046,United Kingdom
562379,85123A,WHITE HANGING HEART T-LIGHT HOLDER,12,8/4/2011 15:17,2.95,15134,United Kingdom
562379,21745,GAOLERS KEYS DECORATIVE GARDEN ,4,8/4/2011 15:17,3.75,15134,United Kingdom
562379,23176,ABC TREASURE BOOK BOX ,8,8/4/2011 15:17,2.25,15134,United Kingdom
562379,21704,BAG 250g SWIRLY MARBLES,12,8/4/2011 15:17,0.85,15134,United Kingdom
562379,22619,SET OF 6 SOLDIER SKITTLES,4,8/4/2011 15:17,3.75,15134,United Kingdom
562379,22139,RETROSPOT TEA SET CERAMIC 11 PC ,3,8/4/2011 15:17,4.95,15134,United Kingdom
562379,22492,MINI PAINT SET VINTAGE ,36,8/4/2011 15:17,0.65,15134,United Kingdom
562379,22493,PAINT YOUR OWN CANVAS SET,12,8/4/2011 15:17,1.65,15134,United Kingdom
562379,22669,RED BABY BUNTING ,5,8/4/2011 15:17,2.95,15134,United Kingdom
562379,84976,RECTANGULAR SHAPED MIRROR,12,8/4/2011 15:17,0.79,15134,United Kingdom
562379,23322,LARGE WHITE HEART OF WICKER,6,8/4/2011 15:17,2.95,15134,United Kingdom
562379,35961,FOLKART ZINC HEART CHRISTMAS DEC,12,8/4/2011 15:17,0.85,15134,United Kingdom
562380,23349,ROLL WRAP VINTAGE CHRISTMAS,12,8/4/2011 15:23,1.25,14778,United Kingdom
562380,23353,6 GIFT TAGS VINTAGE CHRISTMAS ,12,8/4/2011 15:23,0.83,14778,United Kingdom
562380,23350,ROLL WRAP VINTAGE SPOT ,12,8/4/2011 15:23,1.25,14778,United Kingdom
562380,23374,RED SPOT PAPER GIFT BAG,10,8/4/2011 15:23,0.82,14778,United Kingdom
562380,23438,GIFT BAG LARGE SPOT ,12,8/4/2011 15:23,1.25,14778,United Kingdom
562380,23083,SET 6 PAPER TABLE LANTERN STARS ,12,8/4/2011 15:23,3.75,14778,United Kingdom
562380,23048,SET OF 10 LANTERNS FAIRY LIGHT STAR,4,8/4/2011 15:23,4.15,14778,United Kingdom
562380,23436,GIFT BAG LARGE VINTAGE CHRISTMAS,12,8/4/2011 15:23,1.25,14778,United Kingdom
562380,23078,ICE CREAM PEN LIP GLOSS ,24,8/4/2011 15:23,1.25,14778,United Kingdom
562380,23077,DOUGHNUT LIP GLOSS ,20,8/4/2011 15:23,1.25,14778,United Kingdom
562380,22720,SET OF 3 CAKE TINS PANTRY DESIGN ,3,8/4/2011 15:23,4.95,14778,United Kingdom
562380,22768,FAMILY PHOTO FRAME CORNICE,2,8/4/2011 15:23,9.95,14778,United Kingdom
562380,22767,TRIPLE PHOTO FRAME CORNICE ,2,8/4/2011 15:23,9.95,14778,United Kingdom
562380,23014,GLASS APOTHECARY BOTTLE ELIXIR,4,8/4/2011 15:23,3.95,14778,United Kingdom
562380,23012,GLASS APOTHECARY BOTTLE PERFUME,4,8/4/2011 15:23,3.95,14778,United Kingdom
562380,23133,LARGE IVORY HEART WALL ORGANISER,8,8/4/2011 15:23,7.05,14778,United Kingdom
562380,23132,SMALL IVORY HEART WALL ORGANISER,12,8/4/2011 15:23,4.95,14778,United Kingdom
562381,21039,RED RETROSPOT SHOPPING BAG,12,8/4/2011 15:33,2.55,16873,United Kingdom
562381,20718,RED RETROSPOT SHOPPER BAG,20,8/4/2011 15:33,1.25,16873,United Kingdom
562381,85099B,JUMBO BAG RED RETROSPOT,10,8/4/2011 15:33,2.08,16873,United Kingdom
562381,20724,RED RETROSPOT CHARLOTTE BAG,20,8/4/2011 15:33,0.85,16873,United Kingdom
562381,20961,STRAWBERRY BATH SPONGE ,10,8/4/2011 15:33,1.25,16873,United Kingdom
562381,20963,APPLE BATH SPONGE,10,8/4/2011 15:33,1.25,16873,United Kingdom
562381,20685,DOORMAT RED RETROSPOT,4,8/4/2011 15:33,7.95,16873,United Kingdom
562381,21523,DOORMAT FANCY FONT HOME SWEET HOME,2,8/4/2011 15:33,7.95,16873,United Kingdom
562381,22692,DOORMAT WELCOME TO OUR HOME,2,8/4/2011 15:33,7.95,16873,United Kingdom
562381,82482,WOODEN PICTURE FRAME WHITE FINISH,6,8/4/2011 15:33,2.55,16873,United Kingdom
562381,23075,PARLOUR CERAMIC WALL HOOK,8,8/4/2011 15:33,4.15,16873,United Kingdom
562381,20725,LUNCH BAG RED RETROSPOT,10,8/4/2011 15:33,1.65,16873,United Kingdom
562381,22199,FRYING PAN RED RETROSPOT,4,8/4/2011 15:33,4.25,16873,United Kingdom
562381,21154,RED RETROSPOT OVEN GLOVE ,10,8/4/2011 15:33,1.25,16873,United Kingdom
562381,21155,RED RETROSPOT PEG BAG,12,8/4/2011 15:33,2.55,16873,United Kingdom
562381,21212,PACK OF 72 RETROSPOT CAKE CASES,24,8/4/2011 15:33,0.55,16873,United Kingdom
562381,22625,RED KITCHEN SCALES,2,8/4/2011 15:33,8.5,16873,United Kingdom
562381,20754,RETROSPOT RED WASHING UP GLOVES,6,8/4/2011 15:33,2.1,16873,United Kingdom
562381,22348,TEA BAG PLATE RED RETROSPOT,24,8/4/2011 15:33,0.85,16873,United Kingdom
562381,21918,SET 12 KIDS COLOUR  CHALK STICKS,48,8/4/2011 15:33,0.42,16873,United Kingdom
562381,22637,PIGGY BANK RETROSPOT ,8,8/4/2011 15:33,2.55,16873,United Kingdom
562381,22560,TRADITIONAL MODELLING CLAY,48,8/4/2011 15:33,1.06,16873,United Kingdom
562381,21788,KIDS RAIN MAC BLUE,24,8/4/2011 15:33,0.85,16873,United Kingdom
562381,21789,KIDS RAIN MAC PINK,24,8/4/2011 15:33,0.85,16873,United Kingdom
562381,22892,SET OF SALT AND PEPPER TOADSTOOLS,24,8/4/2011 15:33,1.25,16873,United Kingdom
562381,22489,PACK OF 12 TRADITIONAL CRAYONS,24,8/4/2011 15:33,0.42,16873,United Kingdom
562381,22491,PACK OF 12 COLOURED PENCILS,24,8/4/2011 15:33,0.85,16873,United Kingdom
562381,22561,WOODEN SCHOOL COLOURING SET,24,8/4/2011 15:33,1.65,16873,United Kingdom
562381,21844,RED RETROSPOT MUG,12,8/4/2011 15:33,2.95,16873,United Kingdom
562382,22927,?,-40,8/4/2011 15:36,0,,United Kingdom
562383,22523,?,-90,8/4/2011 15:37,0,,United Kingdom
562384,23175,,-44,8/4/2011 15:41,0,,United Kingdom
562385,47559B,,-84,8/4/2011 15:42,0,,United Kingdom
562386,84596L,,-21,8/4/2011 15:43,0,,United Kingdom
562387,22429,ENAMEL MEASURING JUG CREAM,4,8/4/2011 15:51,4.25,13402,United Kingdom
562387,23321,SMALL WHITE HEART OF WICKER,12,8/4/2011 15:51,1.65,13402,United Kingdom
562387,22952,60 CAKE CASES VINTAGE CHRISTMAS,24,8/4/2011 15:51,0.55,13402,United Kingdom
562387,21506,"FANCY FONT BIRTHDAY CARD, ",12,8/4/2011 15:51,0.42,13402,United Kingdom
562387,21519,GIN & TONIC DIET GREETING CARD ,12,8/4/2011 15:51,0.42,13402,United Kingdom
562387,21504,SKULLS GREETING CARD,12,8/4/2011 15:51,0.42,13402,United Kingdom
562387,22815,CARD PSYCHEDELIC APPLES,12,8/4/2011 15:51,0.42,13402,United Kingdom
562387,84251B,"GREETING CARD, STICKY GORDON",12,8/4/2011 15:51,0.19,13402,United Kingdom
562387,84249A,"GREETING CARD,SQUARE, DOUGHNUTS",12,8/4/2011 15:51,0.42,13402,United Kingdom
562387,22077,6 RIBBONS RUSTIC CHARM,12,8/4/2011 15:51,1.65,13402,United Kingdom
562387,22075,6 RIBBONS ELEGANT CHRISTMAS ,12,8/4/2011 15:51,1.65,13402,United Kingdom
562387,22851,SET 20 NAPKINS FAIRY CAKES DESIGN ,12,8/4/2011 15:51,0.85,13402,United Kingdom
562387,22469,HEART OF WICKER SMALL,12,8/4/2011 15:51,1.65,13402,United Kingdom
562387,21985,PACK OF 12 HEARTS DESIGN TISSUES ,24,8/4/2011 15:51,0.29,13402,United Kingdom
562387,21982,PACK OF 12 SUKI TISSUES ,24,8/4/2011 15:51,0.29,13402,United Kingdom
562387,20914,SET/5 RED RETROSPOT LID GLASS BOWLS,12,8/4/2011 15:51,2.95,13402,United Kingdom
562387,22328,ROUND SNACK BOXES SET OF 4 FRUITS ,18,8/4/2011 15:51,2.95,13402,United Kingdom
562387,22988,SOLDIERS EGG CUP ,12,8/4/2011 15:51,1.25,13402,United Kingdom
562387,22261,FELT EGG COSY WHITE RABBIT ,12,8/4/2011 15:51,0.85,13402,United Kingdom
562387,22260,FELT EGG COSY BLUE RABBIT ,12,8/4/2011 15:51,0.85,13402,United Kingdom
562387,22263,FELT EGG COSY LADYBIRD ,12,8/4/2011 15:51,0.85,13402,United Kingdom
562387,22427,ENAMEL FLOWER JUG CREAM,3,8/4/2011 15:51,5.95,13402,United Kingdom
562388,48138,DOORMAT UNION FLAG,1,8/4/2011 15:52,7.95,18099,United Kingdom
562388,22998,TRAVEL CARD WALLET KEEP CALM,24,8/4/2011 15:52,0.42,18099,United Kingdom
562388,23154,SET OF 4 JAM JAR MAGNETS,12,8/4/2011 15:52,2.08,18099,United Kingdom
562388,23156,SET OF 5 MINI GROCERY MAGNETS,12,8/4/2011 15:52,2.08,18099,United Kingdom
562388,23309,SET OF 60 I LOVE LONDON CAKE CASES ,4,8/4/2011 15:52,0.55,18099,United Kingdom
562388,21976,PACK OF 60 MUSHROOM CAKE CASES,4,8/4/2011 15:52,0.55,18099,United Kingdom
562388,21212,PACK OF 72 RETROSPOT CAKE CASES,6,8/4/2011 15:52,0.55,18099,United Kingdom
562388,22616,PACK OF 12 LONDON TISSUES ,12,8/4/2011 15:52,0.29,18099,United Kingdom
562388,21981,PACK OF 12 WOODLAND TISSUES ,12,8/4/2011 15:52,0.29,18099,United Kingdom
562388,22615,PACK OF 12 CIRCUS PARADE TISSUES ,12,8/4/2011 15:52,0.29,18099,United Kingdom
562388,22554,PLASTERS IN TIN WOODLAND ANIMALS,12,8/4/2011 15:52,1.65,18099,United Kingdom
562388,22556,PLASTERS IN TIN CIRCUS PARADE ,12,8/4/2011 15:52,1.65,18099,United Kingdom
562388,84596B,SMALL DOLLY MIX DESIGN ORANGE BOWL,8,8/4/2011 15:52,0.42,18099,United Kingdom
562388,84596F,SMALL MARSHMALLOWS PINK BOWL,8,8/4/2011 15:52,0.42,18099,United Kingdom
562388,22720,SET OF 3 CAKE TINS PANTRY DESIGN ,1,8/4/2011 15:52,4.95,18099,United Kingdom
562388,22109,FULL ENGLISH BREAKFAST PLATE,1,8/4/2011 15:52,3.75,18099,United Kingdom
562388,21065,BOOM BOX SPEAKER GIRLS,2,8/4/2011 15:52,5.95,18099,United Kingdom
562388,21064,BOOM BOX SPEAKER BOYS,2,8/4/2011 15:52,5.95,18099,United Kingdom
562388,22197,POPCORN HOLDER,4,8/4/2011 15:52,0.85,18099,United Kingdom
562389,21746,SMALL RED RETROSPOT WINDMILL,24,8/4/2011 15:55,1.25,16531,United Kingdom
562389,23081,GREEN METAL BOX ARMY SUPPLIES,2,8/4/2011 15:55,8.25,16531,United Kingdom
562389,23080,RED METAL BOX TOP SECRET,2,8/4/2011 15:55,8.25,16531,United Kingdom
