565737,22952,60 CAKE CASES VINTAGE CHRISTMAS,24,9/6/2011 12:27,0.55,16400,United Kingdom
565737,22734,SET OF 6 RIBBONS VINTAGE CHRISTMAS,12,9/6/2011 12:27,2.89,16400,United Kingdom
565737,23322,LARGE WHITE HEART OF WICKER,1,9/6/2011 12:27,2.95,16400,United Kingdom
565737,23340,VINTAGE CHRISTMAS CAKE FRILL,6,9/6/2011 12:27,1.65,16400,United Kingdom
565737,22567,20 DOLLY PEGS RETROSPOT,1,9/6/2011 12:27,1.45,16400,United Kingdom
565737,22940,FELTCRAFT CHRISTMAS FAIRY,3,9/6/2011 12:27,4.25,16400,United Kingdom
565737,23157,SET OF 6 NATIVITY MAGNETS ,12,9/6/2011 12:27,2.08,16400,United Kingdom
565737,23356,LOVE HOT WATER BOTTLE,1,9/6/2011 12:27,5.95,16400,United Kingdom
565737,22112,CHOCOLATE HOT WATER BOTTLE,1,9/6/2011 12:27,4.95,16400,United Kingdom
565737,22111,SCOTTIE DOG HOT WATER BOTTLE,2,9/6/2011 12:27,4.95,16400,United Kingdom
565737,22950,36 DOILIES VINTAGE CHRISTMAS,5,9/6/2011 12:27,1.45,16400,United Kingdom
565737,22909,SET OF 20 VINTAGE CHRISTMAS NAPKINS,8,9/6/2011 12:27,0.85,16400,United Kingdom
565737,22269,EGG CUP NATURAL CHICKEN,16,9/6/2011 12:27,0.39,16400,United Kingdom
565737,21584,RETROSPOT SMALL TUBE MATCHES,1,9/6/2011 12:27,1.65,16400,United Kingdom
565737,23323,WHITE WICKER STAR ,10,9/6/2011 12:27,2.1,16400,United Kingdom
565737,22645,CERAMIC HEART FAIRY CAKE MONEY BANK,8,9/6/2011 12:27,1.45,16400,United Kingdom
565737,22946,WOODEN ADVENT CALENDAR CREAM,1,9/6/2011 12:27,16.95,16400,United Kingdom
565737,22138,BAKING SET 9 PIECE RETROSPOT ,3,9/6/2011 12:27,4.95,16400,United Kingdom
565738,20725,LUNCH BAG RED RETROSPOT,10,9/6/2011 12:30,1.65,14667,United Kingdom
565738,20728,LUNCH BAG CARS BLUE,10,9/6/2011 12:30,1.65,14667,United Kingdom
565738,22384,LUNCH BAG PINK POLKADOT,10,9/6/2011 12:30,1.65,14667,United Kingdom
565738,20713,JUMBO BAG OWLS,30,9/6/2011 12:30,2.08,14667,United Kingdom
565738,22377,BOTTLE BAG RETROSPOT ,20,9/6/2011 12:30,2.1,14667,United Kingdom
565738,21928,JUMBO BAG SCANDINAVIAN BLUE PAISLEY,10,9/6/2011 12:30,2.08,14667,United Kingdom
565738,85099B,JUMBO BAG RED RETROSPOT,50,9/6/2011 12:30,2.08,14667,United Kingdom
565738,22663,JUMBO BAG DOLLY GIRL DESIGN,20,9/6/2011 12:30,2.08,14667,United Kingdom
565738,85099F,JUMBO BAG STRAWBERRY,10,9/6/2011 12:30,2.08,14667,United Kingdom
565738,23202,JUMBO BAG VINTAGE LEAF,15,9/6/2011 12:30,2.08,14667,United Kingdom
565738,22385,JUMBO BAG SPACEBOY DESIGN,20,9/6/2011 12:30,2.08,14667,United Kingdom
565738,85049E,SCANDINAVIAN REDS RIBBONS,6,9/6/2011 12:30,1.25,14667,United Kingdom
565738,23207,LUNCH BAG ALPHABET DESIGN,10,9/6/2011 12:30,1.65,14667,United Kingdom
565738,22077,6 RIBBONS RUSTIC CHARM,6,9/6/2011 12:30,1.95,14667,United Kingdom
565738,85049F,BABY BOOM RIBBONS ,6,9/6/2011 12:30,1.25,14667,United Kingdom
565738,23201,JUMBO BAG ALPHABET,30,9/6/2011 12:30,2.08,14667,United Kingdom
565738,22349,DOG BOWL CHASING BALL DESIGN,6,9/6/2011 12:30,3.75,14667,United Kingdom
565738,22350,ILLUSTRATED CAT BOWL ,6,9/6/2011 12:30,2.55,14667,United Kingdom
565738,21735,TWO DOOR CURIO CABINET,2,9/6/2011 12:30,12.75,14667,United Kingdom
565740,23316,RED REFECTORY CLOCK ,12,9/6/2011 12:31,8.15,15189,United Kingdom
565740,23317,BLUE REFECTORY CLOCK ,12,9/6/2011 12:31,8.15,15189,United Kingdom
565740,84946,ANTIQUE SILVER T-LIGHT GLASS,72,9/6/2011 12:31,1.06,15189,United Kingdom
565740,22178,VICTORIAN GLASS HANGING T-LIGHT,96,9/6/2011 12:31,1.65,15189,United Kingdom
565741,71459,HANGING JAM JAR T-LIGHT HOLDERS,96,9/6/2011 12:32,0.72,15189,United Kingdom
565741,47566,PARTY BUNTING,50,9/6/2011 12:32,4.15,15189,United Kingdom
565741,85053,FRENCH ENAMEL CANDLEHOLDER,6,9/6/2011 12:32,2.1,15189,United Kingdom
565741,22427,ENAMEL FLOWER JUG CREAM,12,9/6/2011 12:32,5.45,15189,United Kingdom
565747,23356,LOVE HOT WATER BOTTLE,3,9/6/2011 12:38,5.95,14239,United Kingdom
565747,23355,HOT WATER BOTTLE KEEP CALM,16,9/6/2011 12:38,4.95,14239,United Kingdom
565747,22114,HOT WATER BOTTLE TEA AND SYMPATHY,12,9/6/2011 12:38,4.25,14239,United Kingdom
565747,84029G,KNITTED UNION FLAG HOT WATER BOTTLE,8,9/6/2011 12:38,4.25,14239,United Kingdom
565747,22633,HAND WARMER UNION JACK,12,9/6/2011 12:38,2.1,14239,United Kingdom
565747,22867,HAND WARMER BIRD DESIGN,12,9/6/2011 12:38,2.1,14239,United Kingdom
565747,85099F,JUMBO BAG STRAWBERRY,10,9/6/2011 12:38,2.08,14239,United Kingdom
565747,23203,JUMBO BAG VINTAGE DOILY ,10,9/6/2011 12:38,2.08,14239,United Kingdom
565747,23202,JUMBO BAG VINTAGE LEAF,10,9/6/2011 12:38,2.08,14239,United Kingdom
565747,22411,JUMBO SHOPPER VINTAGE RED PAISLEY,10,9/6/2011 12:38,2.08,14239,United Kingdom
565748,22191,IVORY DINER WALL CLOCK,4,9/6/2011 12:38,8.5,14156,EIRE
565748,22193,RED DINER WALL CLOCK,4,9/6/2011 12:38,8.5,14156,EIRE
565748,23340,VINTAGE CHRISTMAS CAKE FRILL,12,9/6/2011 12:38,1.65,14156,EIRE
565748,22739,RIBBON REEL CHRISTMAS SOCK BAUBLE,10,9/6/2011 12:38,1.65,14156,EIRE
565748,22737,RIBBON REEL CHRISTMAS PRESENT ,10,9/6/2011 12:38,1.65,14156,EIRE
565748,85048,15CM CHRISTMAS GLASS BALL 20 LIGHTS,24,9/6/2011 12:38,6.95,14156,EIRE
565748,35970,ZINC FOLKART SLEIGH BELLS,48,9/6/2011 12:38,1.69,14156,EIRE
565748,23351,ROLL WRAP 50'S CHRISTMAS,24,9/6/2011 12:38,1.25,14156,EIRE
565748,23350,ROLL WRAP VINTAGE SPOT ,24,9/6/2011 12:38,1.25,14156,EIRE
565748,23322,LARGE WHITE HEART OF WICKER,12,9/6/2011 12:38,2.95,14156,EIRE
