567323,23355,HOT WATER BOTTLE KEEP CALM,4,9/19/2011 14:23,4.95,17557,United Kingdom
567324,22698,PINK REGENCY TEACUP AND SAUCER,48,9/19/2011 14:27,2.55,12879,United Kingdom
567324,22699,ROSES REGENCY TEACUP AND SAUCER ,72,9/19/2011 14:27,2.55,12879,United Kingdom
567324,22697,GREEN REGENCY TEACUP AND SAUCER,24,9/19/2011 14:27,2.55,12879,United Kingdom
567325,85099C,JUMBO  BAG BAROQUE BLACK WHITE,100,9/19/2011 14:28,1.79,13228,United Kingdom
567325,85099B,JUMBO BAG RED RETROSPOT,100,9/19/2011 14:28,1.79,13228,United Kingdom
567326,23395,BELLE JARDINIERE CUSHION COVER,4,9/19/2011 14:38,3.75,14290,United Kingdom
567326,23396,LE JARDIN BOTANIQUE CUSHION COVER,4,9/19/2011 14:38,3.75,14290,United Kingdom
567326,23394,POSTE FRANCE CUSHION COVER,4,9/19/2011 14:38,3.75,14290,United Kingdom
567326,23245,SET OF 3 REGENCY CAKE TINS,4,9/19/2011 14:38,4.95,14290,United Kingdom
567326,23073,GEORGIAN TRINKET BOX,2,9/19/2011 14:38,12.5,14290,United Kingdom
567326,22497,SET OF 2 TINS VINTAGE BATHROOM ,4,9/19/2011 14:38,4.25,14290,United Kingdom
567326,84945,MULTI COLOUR SILVER T-LIGHT HOLDER,12,9/19/2011 14:38,0.85,14290,United Kingdom
567326,84952B,BLACK LOVE BIRD T-LIGHT HOLDER,6,9/19/2011 14:38,3.75,14290,United Kingdom
567326,84609,TALL ROCOCO CANDLE HOLDER,4,9/19/2011 14:38,8.5,14290,United Kingdom
567326,22427,ENAMEL FLOWER JUG CREAM,3,9/19/2011 14:38,5.95,14290,United Kingdom
567326,23252,VINTAGE RED ENAMEL TRIM JUG ,4,9/19/2011 14:38,3.75,14290,United Kingdom
567326,22800,ANTIQUE TALL SWIRLGLASS TRINKET POT,4,9/19/2011 14:38,3.75,14290,United Kingdom
567326,23181,BULL DOG BOTTLE TOP WALL CLOCK,2,9/19/2011 14:38,8.25,14290,United Kingdom
567326,82484,WOOD BLACK BOARD ANT WHITE FINISH,2,9/19/2011 14:38,7.95,14290,United Kingdom
567326,21407,BROWN CHECK CAT DOORSTOP ,3,9/19/2011 14:38,4.25,14290,United Kingdom
567326,21135,VICTORIAN  METAL POSTCARD SPRING,8,9/19/2011 14:38,1.69,14290,United Kingdom
567326,84879,ASSORTED COLOUR BIRD ORNAMENT,8,9/19/2011 14:38,1.69,14290,United Kingdom
567327,23397,FOOT STOOL HOME SWEET HOME ,2,9/19/2011 14:43,9.95,13102,United Kingdom
567327,23411, TRELLIS COAT RACK,6,9/19/2011 14:43,4.95,13102,United Kingdom
567327,23427,STOOL HOME SWEET HOME ,1,9/19/2011 14:43,12.5,13102,United Kingdom
567327,22197,POPCORN HOLDER,48,9/19/2011 14:43,0.85,13102,United Kingdom
567327,22192,BLUE DINER WALL CLOCK,2,9/19/2011 14:43,8.5,13102,United Kingdom
567327,23341,PINK DINER WALL CLOCK,2,9/19/2011 14:43,8.5,13102,United Kingdom
567327,23342,MINT DINER WALL CLOCK,2,9/19/2011 14:43,8.5,13102,United Kingdom
567327,22629,SPACEBOY LUNCH BOX ,12,9/19/2011 14:43,1.95,13102,United Kingdom
567327,21708,FOLDING UMBRELLA CREAM POLKADOT,4,9/19/2011 14:43,4.95,13102,United Kingdom
567327,21706,FOLDING UMBRELLA RED/WHITE POLKADOT,4,9/19/2011 14:43,4.95,13102,United Kingdom
567327,21709,FOLDING UMBRELLA CHOCOLATE POLKADOT,4,9/19/2011 14:43,4.95,13102,United Kingdom
567327,21871,SAVE THE PLANET MUG,12,9/19/2011 14:43,1.65,13102,United Kingdom
567327,23188,VINTAGE  2 METER FOLDING RULER,12,9/19/2011 14:43,1.65,13102,United Kingdom
567327,22561,WOODEN SCHOOL COLOURING SET,12,9/19/2011 14:43,1.65,13102,United Kingdom
567327,23241,TREASURE TIN GYMKHANA DESIGN,6,9/19/2011 14:43,2.08,13102,United Kingdom
567327,23242,TREASURE TIN BUFFALO BILL ,6,9/19/2011 14:43,2.08,13102,United Kingdom
567327,22996,TRAVEL CARD WALLET VINTAGE TICKET,24,9/19/2011 14:43,0.42,13102,United Kingdom
567328,47591D,PINK FAIRY CAKE CHILDRENS APRON,8,9/19/2011 14:43,1.95,14356,United Kingdom
567328,23318,BOX OF 6 MINI VINTAGE CRACKERS,6,9/19/2011 14:43,2.49,14356,United Kingdom
567328,23311,VINTAGE CHRISTMAS STOCKING ,6,9/19/2011 14:43,2.55,14356,United Kingdom
567328,23147,SINGLE ANTIQUE ROSE HOOK IVORY,12,9/19/2011 14:43,1.45,14356,United Kingdom
567328,23157,SET OF 6 NATIVITY MAGNETS ,12,9/19/2011 14:43,2.08,14356,United Kingdom
567328,23131,MISTLETOE HEART WREATH CREAM,4,9/19/2011 14:43,4.15,14356,United Kingdom
567328,23072,MARIE ANTOINETTE TRINKET BOX SILVER,2,9/19/2011 14:43,12.5,14356,United Kingdom
567328,23067,HANGING ENGRAVED METAL HEART,2,9/19/2011 14:43,4.15,14356,United Kingdom
567328,23055,IVORY CHANDELIER T-LIGHT HOLDER,3,9/19/2011 14:43,6.25,14356,United Kingdom
567328,23047,PAPER LANTERN 5 POINT SEQUIN STAR,2,9/19/2011 14:43,5.75,14356,United Kingdom
567328,22992,REVOLVER WOODEN RULER ,12,9/19/2011 14:43,1.95,14356,United Kingdom
567328,22809,SET OF 6 T-LIGHTS SANTA,6,9/19/2011 14:43,2.95,14356,United Kingdom
567328,22734,SET OF 6 RIBBONS VINTAGE CHRISTMAS,6,9/19/2011 14:43,2.89,14356,United Kingdom
567328,22654,DELUXE SEWING KIT ,3,9/19/2011 14:43,5.95,14356,United Kingdom
567328,22138,BAKING SET 9 PIECE RETROSPOT ,3,9/19/2011 14:43,4.95,14356,United Kingdom
567328,21974,SET OF 36 PAISLEY FLOWER DOILIES,12,9/19/2011 14:43,1.45,14356,United Kingdom
567328,21136,PAINTED METAL PEARS ASSORTED,8,9/19/2011 14:43,1.69,14356,United Kingdom
567328,85048,15CM CHRISTMAS GLASS BALL 20 LIGHTS,2,9/19/2011 14:43,7.95,14356,United Kingdom
567328,84879,ASSORTED COLOUR BIRD ORNAMENT,8,9/19/2011 14:43,1.69,14356,United Kingdom
567328,84375,SET OF 20 KIDS COOKIE CUTTERS,12,9/19/2011 14:43,2.1,14356,United Kingdom
567329,22112,CHOCOLATE HOT WATER BOTTLE,6,9/19/2011 14:43,4.95,13416,United Kingdom
567329,22114,HOT WATER BOTTLE TEA AND SYMPATHY,4,9/19/2011 14:43,4.25,13416,United Kingdom
567329,22835,HOT WATER BOTTLE I AM SO POORLY,4,9/19/2011 14:43,4.95,13416,United Kingdom
567329,23355,HOT WATER BOTTLE KEEP CALM,4,9/19/2011 14:43,4.95,13416,United Kingdom
567329,84030E,ENGLISH ROSE HOT WATER BOTTLE,4,9/19/2011 14:43,4.25,13416,United Kingdom
567329,23356,LOVE HOT WATER BOTTLE,6,9/19/2011 14:43,5.95,13416,United Kingdom
567329,84029G,KNITTED UNION FLAG HOT WATER BOTTLE,4,9/19/2011 14:43,4.25,13416,United Kingdom
567329,84029E,RED WOOLLY HOTTIE WHITE HEART.,4,9/19/2011 14:43,4.25,13416,United Kingdom
567329,22191,IVORY DINER WALL CLOCK,4,9/19/2011 14:43,8.5,13416,United Kingdom
567329,22192,BLUE DINER WALL CLOCK,4,9/19/2011 14:43,8.5,13416,United Kingdom
567329,22193,RED DINER WALL CLOCK,4,9/19/2011 14:43,8.5,13416,United Kingdom
C567330,23111,PARISIENNE SEWING BOX,-2,9/19/2011 14:46,12.5,13552,United Kingdom
C567330,84030E,ENGLISH ROSE HOT WATER BOTTLE,-1,9/19/2011 14:46,4.25,13552,United Kingdom
C567331,23403,LETTER HOLDER HOME SWEET HOME,-1,9/19/2011 14:50,3.75,16609,United Kingdom
C567331,23110,PARISIENNE KEY CABINET ,-1,9/19/2011 14:50,5.75,16609,United Kingdom
C567331,22138,BAKING SET 9 PIECE RETROSPOT ,-6,9/19/2011 14:50,4.95,16609,United Kingdom
C567332,22423,REGENCY CAKESTAND 3 TIER,-2,9/19/2011 14:52,12.75,13767,United Kingdom
C567332,22726,ALARM CLOCK BAKELIKE GREEN,-1,9/19/2011 14:52,3.75,13767,United Kingdom
C567332,21314,SMALL GLASS HEART TRINKET POT,-3,9/19/2011 14:52,1.85,13767,United Kingdom
567333,21931,JUMBO STORAGE BAG SUKI,10,9/19/2011 14:55,2.08,14282,United Kingdom
567333,20713,JUMBO BAG OWLS,20,9/19/2011 14:55,2.08,14282,United Kingdom
567333,22386,JUMBO BAG PINK POLKADOT,10,9/19/2011 14:55,2.08,14282,United Kingdom
567333,23199,JUMBO BAG APPLES,10,9/19/2011 14:55,2.08,14282,United Kingdom
567333,85099C,JUMBO  BAG BAROQUE BLACK WHITE,20,9/19/2011 14:55,2.08,14282,United Kingdom
567333,85099B,JUMBO BAG RED RETROSPOT,10,9/19/2011 14:55,2.08,14282,United Kingdom
567333,23203,JUMBO BAG VINTAGE DOILY ,10,9/19/2011 14:55,2.08,14282,United Kingdom
567333,22356,CHARLOTTE BAG PINK POLKADOT,10,9/19/2011 14:55,0.85,14282,United Kingdom
567333,20724,RED RETROSPOT CHARLOTTE BAG,10,9/19/2011 14:55,0.85,14282,United Kingdom
567333,23206,LUNCH BAG APPLE DESIGN,10,9/19/2011 14:55,1.65,14282,United Kingdom
567333,20751,FUNKY WASHING UP GLOVES ASSORTED,12,9/19/2011 14:55,2.1,14282,United Kingdom
567333,20718,RED RETROSPOT SHOPPER BAG,10,9/19/2011 14:55,1.25,14282,United Kingdom
567333,23209,LUNCH BAG VINTAGE DOILY ,10,9/19/2011 14:55,1.65,14282,United Kingdom
567333,21159,MOODY BOY  DOOR HANGER ,24,9/19/2011 14:55,0.39,14282,United Kingdom
567333,21158,MOODY GIRL DOOR HANGER ,24,9/19/2011 14:55,0.39,14282,United Kingdom
567333,16218,CARTOON  PENCIL SHARPENERS,80,9/19/2011 14:55,0.06,14282,United Kingdom
567333,16219,HOUSE SHAPE PENCIL SHARPENER,48,9/19/2011 14:55,0.06,14282,United Kingdom
567334,85048,15CM CHRISTMAS GLASS BALL 20 LIGHTS,24,9/19/2011 14:55,6.95,14911,EIRE
567334,23085,ANTIQUE SILVER BAUBLE LAMP  ,4,9/19/2011 14:55,10.4,14911,EIRE
567334,22460,EMBOSSED GLASS TEALIGHT HOLDER,12,9/19/2011 14:55,1.25,14911,EIRE
567334,23101,SILVER STARS TABLE DECORATION,12,9/19/2011 14:55,0.83,14911,EIRE
567334,23067,HANGING ENGRAVED METAL HEART,6,9/19/2011 14:55,4.15,14911,EIRE
567334,23068,ALUMINIUM STAMPED HEART,8,9/19/2011 14:55,2.49,14911,EIRE
567334,82483,WOOD 2 DRAWER CABINET WHITE FINISH,2,9/19/2011 14:55,6.95,14911,EIRE
567334,23333,IVORY WICKER HEART MEDIUM,12,9/19/2011 14:55,1.25,14911,EIRE
567334,22654,DELUXE SEWING KIT ,6,9/19/2011 14:55,5.95,14911,EIRE
567334,23427,STOOL HOME SWEET HOME ,2,9/19/2011 14:55,12.5,14911,EIRE
567334,23397,FOOT STOOL HOME SWEET HOME ,2,9/19/2011 14:55,9.95,14911,EIRE
567334,23111,PARISIENNE SEWING BOX,2,9/19/2011 14:55,12.5,14911,EIRE
567334,23298,SPOTTY BUNTING,3,9/19/2011 14:55,4.95,14911,EIRE
567334,22666,RECIPE BOX PANTRY YELLOW DESIGN,6,9/19/2011 14:55,2.95,14911,EIRE
567334,22960,JAM MAKING SET WITH JARS,6,9/19/2011 14:55,4.25,14911,EIRE
567334,22561,WOODEN SCHOOL COLOURING SET,12,9/19/2011 14:55,1.65,14911,EIRE
567334,47590B,PINK HAPPY BIRTHDAY BUNTING,3,9/19/2011 14:55,5.45,14911,EIRE
567334,47590A,BLUE HAPPY BIRTHDAY BUNTING,3,9/19/2011 14:55,5.45,14911,EIRE
567334,47566,PARTY BUNTING,3,9/19/2011 14:55,4.95,14911,EIRE
567334,23201,JUMBO BAG ALPHABET,10,9/19/2011 14:55,2.08,14911,EIRE
567334,22867,HAND WARMER BIRD DESIGN,12,9/19/2011 14:55,2.1,14911,EIRE
567334,22112,CHOCOLATE HOT WATER BOTTLE,6,9/19/2011 14:55,4.95,14911,EIRE
567334,84030E,ENGLISH ROSE HOT WATER BOTTLE,4,9/19/2011 14:55,4.25,14911,EIRE
567334,82494L,WOODEN FRAME ANTIQUE WHITE ,6,9/19/2011 14:55,2.95,14911,EIRE
567335,35965,,6,9/19/2011 14:55,0,,United Kingdom
567336,21731,RED TOADSTOOL LED NIGHT LIGHT,12,9/19/2011 14:56,1.65,12621,Germany
567336,23247,BISCUIT TIN 50'S CHRISTMAS,6,9/19/2011 14:56,2.89,12621,Germany
567336,22698,PINK REGENCY TEACUP AND SAUCER,6,9/19/2011 14:56,2.95,12621,Germany
567336,22697,GREEN REGENCY TEACUP AND SAUCER,6,9/19/2011 14:56,2.95,12621,Germany
567336,23374,RED SPOT PAPER GIFT BAG,20,9/19/2011 14:56,0.82,12621,Germany
567336,23438, RED SPOT GIFT BAG LARGE,24,9/19/2011 14:56,1.25,12621,Germany
567336,22580,ADVENT CALENDAR GINGHAM SACK,48,9/19/2011 14:56,4.95,12621,Germany
567336,23319,BOX OF 6 MINI 50'S CRACKERS,96,9/19/2011 14:56,2.08,12621,Germany
567336,22734,SET OF 6 RIBBONS VINTAGE CHRISTMAS,12,9/19/2011 14:56,2.89,12621,Germany
567336,POST,POSTAGE,4,9/19/2011 14:56,18,12621,Germany
567337,35965,,5,9/19/2011 14:56,0,,United Kingdom
567338,22969,HOMEMADE JAM SCENTED CANDLES,12,9/19/2011 15:00,1.45,14146,United Kingdom
567338,22654,DELUXE SEWING KIT ,3,9/19/2011 15:00,5.95,14146,United Kingdom
567338,22568,FELTCRAFT CUSHION OWL,4,9/19/2011 15:00,3.75,14146,United Kingdom
567338,22569,FELTCRAFT CUSHION BUTTERFLY,4,9/19/2011 15:00,3.75,14146,United Kingdom
567338,22570,FELTCRAFT CUSHION RABBIT,4,9/19/2011 15:00,3.75,14146,United Kingdom
567338,17107D,FLOWER FAIRY 5 SUMMER DRAW LINERS,6,9/19/2011 15:00,2.55,14146,United Kingdom
567338,22219,LOVEBIRD HANGING DECORATION WHITE ,12,9/19/2011 15:00,0.85,14146,United Kingdom
567338,22297,HEART IVORY TRELLIS SMALL,24,9/19/2011 15:00,1.25,14146,United Kingdom
567338,22693,GROW A FLYTRAP OR SUNFLOWER IN TIN,24,9/19/2011 15:00,1.25,14146,United Kingdom
567338,22432,WATERING CAN PINK BUNNY,6,9/19/2011 15:00,1.95,14146,United Kingdom
567338,22431,WATERING CAN BLUE ELEPHANT,6,9/19/2011 15:00,1.95,14146,United Kingdom
567338,22433,WATERING CAN GREEN DINOSAUR,6,9/19/2011 15:00,1.95,14146,United Kingdom
567338,84945,MULTI COLOUR SILVER T-LIGHT HOLDER,12,9/19/2011 15:00,0.85,14146,United Kingdom
567338,20749,ASSORTED COLOUR MINI CASES,2,9/19/2011 15:00,7.95,14146,United Kingdom
567338,21497,FANCY FONTS BIRTHDAY WRAP,25,9/19/2011 15:00,0.42,14146,United Kingdom
567338,21498,RED RETROSPOT WRAP ,25,9/19/2011 15:00,0.42,14146,United Kingdom
567338,21499,BLUE POLKADOT WRAP,25,9/19/2011 15:00,0.42,14146,United Kingdom
567338,22046,TEA PARTY  WRAPPING PAPER ,25,9/19/2011 15:00,0.42,14146,United Kingdom
567338,22045,SPACEBOY GIFT WRAP,25,9/19/2011 15:00,0.42,14146,United Kingdom
567338,23230,WRAP ALPHABET DESIGN,25,9/19/2011 15:00,0.42,14146,United Kingdom
567338,23233,WRAP POPPIES  DESIGN,25,9/19/2011 15:00,0.42,14146,United Kingdom
567338,16156S,WRAP PINK FAIRY CAKES ,25,9/19/2011 15:00,0.42,14146,United Kingdom
567339,23377,PACK OF 12 DOLLY GIRL TISSUES,24,9/19/2011 15:01,0.39,14146,United Kingdom
567339,23289,DOLLY GIRL CHILDRENS BOWL,8,9/19/2011 15:01,1.25,14146,United Kingdom
567339,23291,DOLLY GIRL CHILDRENS CUP,8,9/19/2011 15:01,1.25,14146,United Kingdom
567339,22951,60 CAKE CASES DOLLY GIRL DESIGN,24,9/19/2011 15:01,0.55,14146,United Kingdom
567339,22630,DOLLY GIRL LUNCH BOX,12,9/19/2011 15:01,1.95,14146,United Kingdom
567339,22899,CHILDREN'S APRON DOLLY GIRL ,6,9/19/2011 15:01,2.1,14146,United Kingdom
567339,23108,SET OF 10 LED DOLLY LIGHTS,2,9/19/2011 15:01,6.25,14146,United Kingdom
567339,22629,SPACEBOY LUNCH BOX ,12,9/19/2011 15:01,1.95,14146,United Kingdom
567339,23292,SPACEBOY CHILDRENS CUP,8,9/19/2011 15:01,1.25,14146,United Kingdom
567339,23290,SPACEBOY CHILDRENS BOWL,8,9/19/2011 15:01,1.25,14146,United Kingdom
567339,22417,PACK OF 60 SPACEBOY CAKE CASES,24,9/19/2011 15:01,0.55,14146,United Kingdom
567339,22614,PACK OF 12 SPACEBOY TISSUES,24,9/19/2011 15:01,0.39,14146,United Kingdom
567339,22551,PLASTERS IN TIN SPACEBOY,12,9/19/2011 15:01,1.65,14146,United Kingdom
567339,22418,10 COLOUR SPACEBOY PEN,24,9/19/2011 15:01,0.85,14146,United Kingdom
567339,22367,CHILDRENS APRON SPACEBOY DESIGN,8,9/19/2011 15:01,1.95,14146,United Kingdom
567339,23188,VINTAGE  2 METER FOLDING RULER,12,9/19/2011 15:01,1.65,14146,United Kingdom
567339,22561,WOODEN SCHOOL COLOURING SET,12,9/19/2011 15:01,1.65,14146,United Kingdom
567339,21889,WOODEN BOX OF DOMINOES,12,9/19/2011 15:01,1.25,14146,United Kingdom
567339,22560,TRADITIONAL MODELLING CLAY,24,9/19/2011 15:01,1.25,14146,United Kingdom
567339,21915,RED  HARMONICA IN BOX ,12,9/19/2011 15:01,1.25,14146,United Kingdom
567339,21914,BLUE HARMONICA IN BOX ,12,9/19/2011 15:01,1.25,14146,United Kingdom
567339,23242,TREASURE TIN BUFFALO BILL ,6,9/19/2011 15:01,2.08,14146,United Kingdom
567339,22555,PLASTERS IN TIN STRONGMAN,12,9/19/2011 15:01,1.65,14146,United Kingdom
567339,22556,PLASTERS IN TIN CIRCUS PARADE ,12,9/19/2011 15:01,1.65,14146,United Kingdom
567339,23169,CLASSIC GLASS COOKIE JAR,6,9/19/2011 15:01,4.15,14146,United Kingdom
567339,22993,SET OF 4 PANTRY JELLY MOULDS,12,9/19/2011 15:01,1.25,14146,United Kingdom
567339,23307,SET OF 60 PANTRY DESIGN CAKE CASES ,24,9/19/2011 15:01,0.55,14146,United Kingdom
567339,22969,HOMEMADE JAM SCENTED CANDLES,12,9/19/2011 15:01,1.45,14146,United Kingdom
567339,84375,SET OF 20 KIDS COOKIE CUTTERS,12,9/19/2011 15:01,2.1,14146,United Kingdom
567339,23296,SET OF 6 TEA TIME BAKING CASES,8,9/19/2011 15:01,1.25,14146,United Kingdom
567339,23295,SET OF 12 MINI LOAF BAKING CASES,8,9/19/2011 15:01,0.83,14146,United Kingdom
567339,23294,SET OF 6 SNACK LOAF BAKING CASES,8,9/19/2011 15:01,0.83,14146,United Kingdom
567339,23293,SET OF 12 FAIRY CAKE BAKING CASES,8,9/19/2011 15:01,0.83,14146,United Kingdom
567339,23240,SET OF 4 KNICK KNACK TINS DOILY ,6,9/19/2011 15:01,4.15,14146,United Kingdom
567339,84946,ANTIQUE SILVER T-LIGHT GLASS,12,9/19/2011 15:01,1.25,14146,United Kingdom
567339,23215,JINGLE BELL HEART ANTIQUE SILVER,12,9/19/2011 15:01,2.08,14146,United Kingdom
567339,23375,50'S CHRISTMAS PAPER GIFT BAG,10,9/19/2011 15:01,0.82,14146,United Kingdom
567339,23437, 50'S CHRISTMAS GIFT BAG LARGE,12,9/19/2011 15:01,1.25,14146,United Kingdom
567339,22086,PAPER CHAIN KIT 50'S CHRISTMAS ,6,9/19/2011 15:01,2.95,14146,United Kingdom
567339,23319,BOX OF 6 MINI 50'S CRACKERS,6,9/19/2011 15:01,2.49,14146,United Kingdom
567339,22910,PAPER CHAIN KIT VINTAGE CHRISTMAS,6,9/19/2011 15:01,2.95,14146,United Kingdom
567339,23436,VINTAGE CHRISTMAS GIFT BAG LARGE ,12,9/19/2011 15:01,1.25,14146,United Kingdom
567339,23373,VINTAGE CHRISTMAS PAPER GIFT BAG,10,9/19/2011 15:01,0.82,14146,United Kingdom
567339,23318,BOX OF 6 MINI VINTAGE CRACKERS,6,9/19/2011 15:01,2.49,14146,United Kingdom
567339,22941,CHRISTMAS LIGHTS 10 REINDEER,2,9/19/2011 15:01,8.5,14146,United Kingdom
567339,23550,WRAP ALPHABET POSTER  ,25,9/19/2011 15:01,0.42,14146,United Kingdom
567339,22045,SPACEBOY GIFT WRAP,25,9/19/2011 15:01,0.42,14146,United Kingdom
567339,22708,WRAP DOLLY GIRL,25,9/19/2011 15:01,0.42,14146,United Kingdom
567339,23230,WRAP ALPHABET DESIGN,25,9/19/2011 15:01,0.42,14146,United Kingdom
567339,23547,WRAP FLOWER SHOP  ,25,9/19/2011 15:01,0.42,14146,United Kingdom
567340,23080,RED METAL BOX TOP SECRET,2,9/19/2011 15:02,8.25,12540,Spain
567340,23081,GREEN METAL BOX ARMY SUPPLIES,2,9/19/2011 15:02,8.25,12540,Spain
567340,23242,TREASURE TIN BUFFALO BILL ,12,9/19/2011 15:02,2.08,12540,Spain
567340,23241,TREASURE TIN GYMKHANA DESIGN,12,9/19/2011 15:02,2.08,12540,Spain
567340,84077,WORLD WAR 2 GLIDERS ASSTD DESIGNS,48,9/19/2011 15:02,0.29,12540,Spain
567340,22556,PLASTERS IN TIN CIRCUS PARADE ,24,9/19/2011 15:02,1.65,12540,Spain
567340,22553,PLASTERS IN TIN SKULLS,24,9/19/2011 15:02,1.65,12540,Spain
567340,23079,TOADSTOOL BEDSIDE LIGHT ,2,9/19/2011 15:02,8.95,12540,Spain
567340,22329,ROUND CONTAINER SET OF 5 RETROSPOT,12,9/19/2011 15:02,1.65,12540,Spain
567340,21212,PACK OF 72 RETROSPOT CAKE CASES,24,9/19/2011 15:02,0.55,12540,Spain
567340,21213,PACK OF 72 SKULL CAKE CASES,24,9/19/2011 15:02,0.55,12540,Spain
567340,23307,SET OF 60 PANTRY DESIGN CAKE CASES ,24,9/19/2011 15:02,0.55,12540,Spain
567340,23306,SET OF 36 DOILIES PANTRY DESIGN,12,9/19/2011 15:02,1.45,12540,Spain
567340,21210,SET OF 72 RETROSPOT PAPER  DOILIES,12,9/19/2011 15:02,1.45,12540,Spain
567340,21671,RED SPOT CERAMIC DRAWER KNOB,12,9/19/2011 15:02,1.45,12540,Spain
567340,21668,RED STRIPE CERAMIC DRAWER KNOB,12,9/19/2011 15:02,1.45,12540,Spain
567340,21669,BLUE STRIPE CERAMIC DRAWER KNOB,12,9/19/2011 15:02,1.45,12540,Spain
567340,21672,WHITE SPOT RED CERAMIC DRAWER KNOB,12,9/19/2011 15:02,1.45,12540,Spain
567340,21673,WHITE SPOT BLUE CERAMIC DRAWER KNOB,12,9/19/2011 15:02,1.45,12540,Spain
567340,21670,BLUE SPOT CERAMIC DRAWER KNOB,12,9/19/2011 15:02,1.45,12540,Spain
567340,22077,6 RIBBONS RUSTIC CHARM,12,9/19/2011 15:02,1.95,12540,Spain
567340,22984,CARD GINGHAM ROSE ,12,9/19/2011 15:02,0.42,12540,Spain
567340,21770,OPEN CLOSED METAL SIGN,8,9/19/2011 15:02,4.95,12540,Spain
567340,21172,PARTY METAL SIGN ,12,9/19/2011 15:02,1.45,12540,Spain
567340,22176,BLUE OWL SOFT TOY,12,9/19/2011 15:02,2.95,12540,Spain
567340,23393,HOME SWEET HOME CUSHION COVER ,8,9/19/2011 15:02,3.75,12540,Spain
567340,23432,PRETTY HANGING QUILTED HEARTS,36,9/19/2011 15:02,0.83,12540,Spain
567340,23433,HANGING QUILTED PATCHWORK APPLES,24,9/19/2011 15:02,0.83,12540,Spain
567340,23445,ICE CREAM BUBBLES,20,9/19/2011 15:02,0.83,12540,Spain
567340,84828,JUNGLE POPSICLES ICE LOLLY MOULDS,12,9/19/2011 15:02,1.25,12540,Spain
567340,21164,HOME SWEET HOME METAL SIGN ,6,9/19/2011 15:02,2.95,12540,Spain
567340,21754,HOME BUILDING BLOCK WORD,9,9/19/2011 15:02,6.25,12540,Spain
567340,22585,PACK OF 6 BIRDY GIFT TAGS,24,9/19/2011 15:02,1.25,12540,Spain
567340,23240,SET OF 4 KNICK KNACK TINS DOILY ,12,9/19/2011 15:02,4.15,12540,Spain
567340,84879,ASSORTED COLOUR BIRD ORNAMENT,48,9/19/2011 15:02,1.69,12540,Spain
567340,POST,POSTAGE,4,9/19/2011 15:02,28,12540,Spain
567341,22961,JAM MAKING SET PRINTED,12,9/19/2011 15:04,1.45,14961,United Kingdom
567341,23167,SMALL CERAMIC TOP STORAGE JAR ,12,9/19/2011 15:04,0.83,14961,United Kingdom
567341,23166,MEDIUM CERAMIC TOP STORAGE JAR,12,9/19/2011 15:04,1.25,14961,United Kingdom
567341,23165,LARGE CERAMIC TOP STORAGE JAR,12,9/19/2011 15:04,1.65,14961,United Kingdom
567341,22962,JAM JAR WITH PINK LID,12,9/19/2011 15:04,0.85,14961,United Kingdom
567341,22963,JAM JAR WITH GREEN LID,12,9/19/2011 15:04,0.85,14961,United Kingdom
567341,23307,SET OF 60 PANTRY DESIGN CAKE CASES ,24,9/19/2011 15:04,0.55,14961,United Kingdom
567341,22356,CHARLOTTE BAG PINK POLKADOT,10,9/19/2011 15:04,0.85,14961,United Kingdom
567341,22384,LUNCH BAG PINK POLKADOT,10,9/19/2011 15:04,1.65,14961,United Kingdom
567341,20724,RED RETROSPOT CHARLOTTE BAG,10,9/19/2011 15:04,0.85,14961,United Kingdom
567341,85099B,JUMBO BAG RED RETROSPOT,10,9/19/2011 15:04,2.08,14961,United Kingdom
567341,23201,JUMBO BAG ALPHABET,10,9/19/2011 15:04,2.08,14961,United Kingdom
567341,23207,LUNCH BAG ALPHABET DESIGN,10,9/19/2011 15:04,1.65,14961,United Kingdom
567341,23205,CHARLOTTE BAG VINTAGE ALPHABET ,10,9/19/2011 15:04,0.85,14961,United Kingdom
567341,23200,JUMBO BAG PEARS,10,9/19/2011 15:04,2.08,14961,United Kingdom
567341,23199,JUMBO BAG APPLES,10,9/19/2011 15:04,2.08,14961,United Kingdom
567341,23204,CHARLOTTE BAG APPLES DESIGN,10,9/19/2011 15:04,0.85,14961,United Kingdom
567341,20723,STRAWBERRY CHARLOTTE BAG,10,9/19/2011 15:04,0.85,14961,United Kingdom
567341,22355,CHARLOTTE BAG SUKI DESIGN,10,9/19/2011 15:04,0.85,14961,United Kingdom
567341,21930,JUMBO STORAGE BAG SKULLS,10,9/19/2011 15:04,2.08,14961,United Kingdom
567341,23344,JUMBO BAG 50'S CHRISTMAS ,10,9/19/2011 15:04,2.08,14961,United Kingdom
567341,23343,JUMBO BAG VINTAGE CHRISTMAS ,10,9/19/2011 15:04,2.08,14961,United Kingdom
567341,22197,POPCORN HOLDER,100,9/19/2011 15:04,0.72,14961,United Kingdom
567341,23328,SET 6 SCHOOL MILK BOTTLES IN CRATE,4,9/19/2011 15:04,3.75,14961,United Kingdom
567341,22697,GREEN REGENCY TEACUP AND SAUCER,12,9/19/2011 15:04,2.95,14961,United Kingdom
567341,22698,PINK REGENCY TEACUP AND SAUCER,12,9/19/2011 15:04,2.95,14961,United Kingdom
567341,23164,REGENCY CAKE SLICE,4,9/19/2011 15:04,4.95,14961,United Kingdom
567341,23173,REGENCY TEAPOT ROSES ,2,9/19/2011 15:04,9.95,14961,United Kingdom
567341,23245,SET OF 3 REGENCY CAKE TINS,4,9/19/2011 15:04,4.95,14961,United Kingdom
567341,23295,SET OF 12 MINI LOAF BAKING CASES,16,9/19/2011 15:04,0.83,14961,United Kingdom
567341,23296,SET OF 6 TEA TIME BAKING CASES,16,9/19/2011 15:04,1.25,14961,United Kingdom
567341,23293,SET OF 12 FAIRY CAKE BAKING CASES,16,9/19/2011 15:04,0.83,14961,United Kingdom
567341,23294,SET OF 6 SNACK LOAF BAKING CASES,16,9/19/2011 15:04,0.83,14961,United Kingdom
567341,23203,JUMBO BAG VINTAGE DOILY ,10,9/19/2011 15:04,2.08,14961,United Kingdom
567341,23209,LUNCH BAG VINTAGE DOILY ,10,9/19/2011 15:04,1.65,14961,United Kingdom
567341,23202,JUMBO BAG VINTAGE LEAF,10,9/19/2011 15:04,2.08,14961,United Kingdom
567341,23208,LUNCH BAG VINTAGE LEAF DESIGN,10,9/19/2011 15:04,1.65,14961,United Kingdom
567341,22795,SWEETHEART RECIPE BOOK STAND,16,9/19/2011 15:04,5.95,14961,United Kingdom
567341,23096,PETIT TRAY CHIC,12,9/19/2011 15:04,1.65,14961,United Kingdom
567341,23355,HOT WATER BOTTLE KEEP CALM,24,9/19/2011 15:04,4.15,14961,United Kingdom
567341,23309,SET OF 60 I LOVE LONDON CAKE CASES ,24,9/19/2011 15:04,0.55,14961,United Kingdom
567341,22911,PAPER CHAIN KIT LONDON,6,9/19/2011 15:04,2.95,14961,United Kingdom
567341,23298,SPOTTY BUNTING,12,9/19/2011 15:04,4.95,14961,United Kingdom
567342,POST,POSTAGE,1,9/19/2011 15:04,10,16235,United Kingdom
567343,47590B,PINK HAPPY BIRTHDAY BUNTING,3,9/19/2011 15:21,5.45,17628,United Kingdom
567343,47566,PARTY BUNTING,4,9/19/2011 15:21,4.95,17628,United Kingdom
567343,21212,PACK OF 72 RETROSPOT CAKE CASES,24,9/19/2011 15:21,0.55,17628,United Kingdom
567343,21975,PACK OF 60 DINOSAUR CAKE CASES,24,9/19/2011 15:21,0.55,17628,United Kingdom
567343,21213,PACK OF 72 SKULL CAKE CASES,24,9/19/2011 15:21,0.55,17628,United Kingdom
567344,22418,10 COLOUR SPACEBOY PEN,24,9/19/2011 15:49,0.85,13704,United Kingdom
567344,21090,SET/6 COLLAGE PAPER PLATES,24,9/19/2011 15:49,0.39,13704,United Kingdom
567344,21084,SET/6 COLLAGE PAPER CUPS,24,9/19/2011 15:49,0.19,13704,United Kingdom
567344,21262,WHITE GOOSE FEATHER CHRISTMAS TREE ,6,9/19/2011 15:49,2.95,13704,United Kingdom
567344,21261,GREEN GOOSE FEATHER CHRISTMAS TREE ,6,9/19/2011 15:49,2.95,13704,United Kingdom
567344,22398,MAGNETS PACK OF 4 SWALLOWS,12,9/19/2011 15:49,0.39,13704,United Kingdom
567344,47503A,ASS FLORAL PRINT MULTI SCREWDRIVER,24,9/19/2011 15:49,0.42,13704,United Kingdom
567344,85032C,CURIOUS IMAGES GIFT WRAP SET,12,9/19/2011 15:49,0.65,13704,United Kingdom
567346,22865,HAND WARMER OWL DESIGN,96,9/19/2011 15:53,1.85,13767,United Kingdom
567346,22867,HAND WARMER BIRD DESIGN,96,9/19/2011 15:53,1.85,13767,United Kingdom
567346,22866,HAND WARMER SCOTTY DOG DESIGN,96,9/19/2011 15:53,1.85,13767,United Kingdom
567346,22114,HOT WATER BOTTLE TEA AND SYMPATHY,24,9/19/2011 15:53,3.75,13767,United Kingdom
567346,22111,SCOTTIE DOG HOT WATER BOTTLE,24,9/19/2011 15:53,4.25,13767,United Kingdom
567346,23342,MINT DINER WALL CLOCK,4,9/19/2011 15:53,8.5,13767,United Kingdom
567346,22192,BLUE DINER WALL CLOCK,4,9/19/2011 15:53,8.5,13767,United Kingdom
567346,22193,RED DINER WALL CLOCK,4,9/19/2011 15:53,8.5,13767,United Kingdom
567346,23439,HAND WARMER RED LOVE HEART,96,9/19/2011 15:53,1.85,13767,United Kingdom
C567345,23174,REGENCY SUGAR BOWL GREEN,-1,9/19/2011 15:53,4.15,14911,EIRE
C567347,22666,RECIPE BOX PANTRY YELLOW DESIGN,-4,9/19/2011 15:54,2.95,15465,United Kingdom
C567347,22423,REGENCY CAKESTAND 3 TIER,-7,9/19/2011 15:54,10.95,15465,United Kingdom
C567348,85123A,WHITE HANGING HEART T-LIGHT HOLDER,-1,9/19/2011 15:57,2.95,15755,United Kingdom
C567348,23410,CURIO CABINET LINEN AND LACE ,-1,9/19/2011 15:57,8.15,15755,United Kingdom
C567348,23380,PACK OF 12 VINTAGE DOILY TISSUES,-12,9/19/2011 15:57,0.39,15755,United Kingdom
C567348,22094,RED RETROSPOT TISSUE BOX,-6,9/19/2011 15:57,0.39,15755,United Kingdom
C567349,23110,PARISIENNE KEY CABINET ,-1,9/19/2011 16:01,5.75,13375,United Kingdom
