565682,22995,TRAVEL CARD WALLET SUKI,1,9/6/2011 10:42,0.42,14796,United Kingdom
565682,22998,TRAVEL CARD WALLET KEEP CALM,1,9/6/2011 10:42,0.42,14796,United Kingdom
565682,22553,PLASTERS IN TIN SKULLS,1,9/6/2011 10:42,1.65,14796,United Kingdom
565682,21479,WHITE SKULL HOT WATER BOTTLE ,1,9/6/2011 10:42,4.25,14796,United Kingdom
565682,21581,SKULLS  DESIGN  COTTON TOTE BAG,1,9/6/2011 10:42,2.25,14796,United Kingdom
565682,15056P,EDWARDIAN PARASOL PINK,1,9/6/2011 10:42,5.95,14796,United Kingdom
565682,20679,EDWARDIAN PARASOL RED,1,9/6/2011 10:42,5.95,14796,United Kingdom
565682,15056N,EDWARDIAN PARASOL NATURAL,1,9/6/2011 10:42,5.95,14796,United Kingdom
565682,15056BL,EDWARDIAN PARASOL BLACK,4,9/6/2011 10:42,5.95,14796,United Kingdom
C565681,23445,ICE CREAM BUBBLES,-20,9/6/2011 10:42,0.83,15521,United Kingdom
C565681,23256,CHILDRENS CUTLERY SPACEBOY ,-4,9/6/2011 10:42,4.15,15521,United Kingdom
C565681,23254,CHILDRENS CUTLERY DOLLY GIRL ,-4,9/6/2011 10:42,4.15,15521,United Kingdom
C565681,23203,JUMBO BAG VINTAGE DOILY ,-10,9/6/2011 10:42,2.08,15521,United Kingdom
C565681,23201,JUMBO BAG ALPHABET,-10,9/6/2011 10:42,2.08,15521,United Kingdom
C565681,22622,BOX OF VINTAGE ALPHABET BLOCKS,-2,9/6/2011 10:42,11.95,15521,United Kingdom
C565681,22333,RETROSPOT PARTY BAG + STICKER SET,-8,9/6/2011 10:42,1.65,15521,United Kingdom
C565681,22332,SKULLS PARTY BAG + STICKER SET,-8,9/6/2011 10:42,1.65,15521,United Kingdom
C565681,21915,RED  HARMONICA IN BOX ,-12,9/6/2011 10:42,1.25,15521,United Kingdom
C565681,21731,RED TOADSTOOL LED NIGHT LIGHT,-12,9/6/2011 10:42,1.65,15521,United Kingdom
C565681,20749,ASSORTED COLOUR MINI CASES,-2,9/6/2011 10:42,7.95,15521,United Kingdom
C565683,21891,TRADITIONAL WOODEN SKIPPING ROPE,-12,9/6/2011 10:42,1.45,15521,United Kingdom
565684,20972,PINK CREAM FELT CRAFT TRINKET BOX ,24,9/6/2011 10:46,1.25,16455,United Kingdom
565684,20971,PINK BLUE FELT CRAFT TRINKET BOX,24,9/6/2011 10:46,1.25,16455,United Kingdom
565684,23032,DRAWER KNOB CRACKLE GLAZE IVORY,6,9/6/2011 10:46,1.65,16455,United Kingdom
565684,23031,DRAWER KNOB CRACKLE GLAZE PINK,6,9/6/2011 10:46,1.65,16455,United Kingdom
565684,23029,DRAWER KNOB CRACKLE GLAZE GREEN,6,9/6/2011 10:46,1.65,16455,United Kingdom
565684,23028,DRAWER KNOB CRACKLE GLAZE BLUE,6,9/6/2011 10:46,1.65,16455,United Kingdom
565684,22805,BLUE DRAWER KNOB ACRYLIC EDWARDIAN,12,9/6/2011 10:46,1.25,16455,United Kingdom
565684,22775,PURPLE DRAWERKNOB ACRYLIC EDWARDIAN,12,9/6/2011 10:46,1.25,16455,United Kingdom
565684,22774,RED DRAWER KNOB ACRYLIC EDWARDIAN,12,9/6/2011 10:46,1.25,16455,United Kingdom
565684,22773,GREEN DRAWER KNOB ACRYLIC EDWARDIAN,12,9/6/2011 10:46,1.25,16455,United Kingdom
565684,22772,PINK DRAWER KNOB ACRYLIC EDWARDIAN,12,9/6/2011 10:46,1.25,16455,United Kingdom
565684,22771,CLEAR DRAWER KNOB ACRYLIC EDWARDIAN,12,9/6/2011 10:46,1.25,16455,United Kingdom
565685,21181,PLEASE ONE PERSON METAL SIGN,96,9/6/2011 10:53,1.85,15671,United Kingdom
565685,85150,LADIES & GENTLEMEN METAL SIGN,96,9/6/2011 10:53,2.1,15671,United Kingdom
565685,85152,HAND OVER THE CHOCOLATE   SIGN ,48,9/6/2011 10:53,1.85,15671,United Kingdom
565685,21166,COOK WITH WINE METAL SIGN ,48,9/6/2011 10:53,1.85,15671,United Kingdom
565685,22595,GINGHAM HEART DECORATION,24,9/6/2011 10:53,0.85,15671,United Kingdom
565685,22594,CHRISTMAS GINGHAM TREE,24,9/6/2011 10:53,0.85,15671,United Kingdom
565685,22593,CHRISTMAS GINGHAM STAR,24,9/6/2011 10:53,0.85,15671,United Kingdom
565685,22130,PARTY CONE CHRISTMAS DECORATION ,24,9/6/2011 10:53,0.85,15671,United Kingdom
565723,85152,HAND OVER THE CHOCOLATE   SIGN ,14,9/6/2011 11:29,2.1,14408,United Kingdom
565723,21166,COOK WITH WINE METAL SIGN ,48,9/6/2011 11:29,1.85,14408,United Kingdom
565723,82582,AREA PATROLLED METAL SIGN,24,9/6/2011 11:29,2.1,14408,United Kingdom
565723,21181,PLEASE ONE PERSON METAL SIGN,72,9/6/2011 11:29,1.85,14408,United Kingdom
565724,22423,REGENCY CAKESTAND 3 TIER,2,9/6/2011 11:53,12.75,16168,United Kingdom
565724,22699,ROSES REGENCY TEACUP AND SAUCER ,6,9/6/2011 11:53,2.95,16168,United Kingdom
565724,22697,GREEN REGENCY TEACUP AND SAUCER,6,9/6/2011 11:53,2.95,16168,United Kingdom
565724,22698,PINK REGENCY TEACUP AND SAUCER,6,9/6/2011 11:53,2.95,16168,United Kingdom
565724,23047,PAPER LANTERN 5 POINT SEQUIN STAR,2,9/6/2011 11:53,5.75,16168,United Kingdom
565724,23046,PAPER LANTERN 9 POINT DELUXE STAR,2,9/6/2011 11:53,6.65,16168,United Kingdom
565724,75049L,LARGE CIRCULAR MIRROR MOBILE,96,9/6/2011 11:53,0.85,16168,United Kingdom
565725,22998,TRAVEL CARD WALLET KEEP CALM,24,9/6/2011 11:55,0.42,13949,United Kingdom
565725,84625A,PINK NEW BAROQUECANDLESTICK CANDLE,24,9/6/2011 11:55,0.85,13949,United Kingdom
565725,47503A,ASS FLORAL PRINT MULTI SCREWDRIVER,24,9/6/2011 11:55,0.42,13949,United Kingdom
565725,22244,3 HOOK HANGER MAGIC GARDEN,12,9/6/2011 11:55,1.95,13949,United Kingdom
565725,22196,SMALL HEART MEASURING SPOONS,12,9/6/2011 11:55,0.85,13949,United Kingdom
565725,22195,LARGE HEART MEASURING SPOONS,12,9/6/2011 11:55,1.65,13949,United Kingdom
565725,21563,RED HEART SHAPE LOVE BUCKET ,6,9/6/2011 11:55,2.95,13949,United Kingdom
565725,21564,PINK  HEART SHAPE LOVE BUCKET ,6,9/6/2011 11:55,2.95,13949,United Kingdom
565725,22399,MAGNETS PACK OF 4 CHILDHOOD MEMORY,12,9/6/2011 11:55,1.25,13949,United Kingdom
565725,22396,MAGNETS PACK OF 4 RETRO PHOTO,12,9/6/2011 11:55,0.39,13949,United Kingdom
565725,22398,MAGNETS PACK OF 4 SWALLOWS,12,9/6/2011 11:55,0.39,13949,United Kingdom
565725,23155,KNICKERBOCKERGLORY MAGNET ASSORTED ,12,9/6/2011 11:55,0.83,13949,United Kingdom
565725,23154,SET OF 4 JAM JAR MAGNETS,12,9/6/2011 11:55,2.08,13949,United Kingdom
565725,22922,FRIDGE MAGNETS US DINER ASSORTED,12,9/6/2011 11:55,0.85,13949,United Kingdom
565725,23159,SET OF 5 PANCAKE DAY MAGNETS,12,9/6/2011 11:55,2.08,13949,United Kingdom
565725,16219,HOUSE SHAPE PENCIL SHARPENER,48,9/6/2011 11:55,0.06,13949,United Kingdom
565725,21179,NO JUNK MAIL METAL SIGN,24,9/6/2011 11:55,0.39,13949,United Kingdom
565725,21367,MIRRORED WALL ART GENTS,12,9/6/2011 11:55,0.75,13949,United Kingdom
565725,21368,MIRRORED WALL ART LADIES,12,9/6/2011 11:55,0.75,13949,United Kingdom
565725,85116,BLACK CANDELABRA T-LIGHT HOLDER,18,9/6/2011 11:55,0.65,13949,United Kingdom
565725,85212,MINI PAINTED GARDEN DECORATION ,24,9/6/2011 11:55,0.29,13949,United Kingdom
565725,22139,RETROSPOT TEA SET CERAMIC 11 PC ,3,9/6/2011 11:55,4.95,13949,United Kingdom
565725,22138,BAKING SET 9 PIECE RETROSPOT ,9,9/6/2011 11:55,4.95,13949,United Kingdom
565725,22617,BAKING SET SPACEBOY DESIGN,6,9/6/2011 11:55,4.95,13949,United Kingdom
565725,22593,CHRISTMAS GINGHAM STAR,12,9/6/2011 11:55,0.85,13949,United Kingdom
565725,23268,SET OF 2 CERAMIC CHRISTMAS REINDEER,12,9/6/2011 11:55,1.45,13949,United Kingdom
565725,22131,FOOD CONTAINER SET 3 LOVE HEART ,6,9/6/2011 11:55,1.95,13949,United Kingdom
565725,22750,FELTCRAFT PRINCESS LOLA DOLL,4,9/6/2011 11:55,3.75,13949,United Kingdom
565725,21136,PAINTED METAL PEARS ASSORTED,8,9/6/2011 11:55,1.69,13949,United Kingdom
565725,84879,ASSORTED COLOUR BIRD ORNAMENT,8,9/6/2011 11:55,1.69,13949,United Kingdom
565725,23433,HANGING QUILTED PATCHWORK APPLES,12,9/6/2011 11:55,0.83,13949,United Kingdom
565725,23400,SHELF WITH 4 HOOKS HOME SWEET HOME,2,9/6/2011 11:55,6.25,13949,United Kingdom
565725,23206,LUNCH BAG APPLE DESIGN,10,9/6/2011 11:55,1.65,13949,United Kingdom
565725,85015,SET OF 12  VINTAGE POSTCARD SET,24,9/6/2011 11:55,0.65,13949,United Kingdom
565725,23280,FOLDING BUTTERFLY MIRROR HOT PINK ,12,9/6/2011 11:55,0.83,13949,United Kingdom
565725,23000,TRAVEL CARD WALLET TRANSPORT,24,9/6/2011 11:55,0.42,13949,United Kingdom
565725,22996,TRAVEL CARD WALLET VINTAGE TICKET,24,9/6/2011 11:55,0.42,13949,United Kingdom
565725,23004,TRAVEL CARD WALLET PANTRY,24,9/6/2011 11:55,0.42,13949,United Kingdom
565726,22792,FLUTED ANTIQUE CANDLE HOLDER,12,9/6/2011 11:58,0.85,14360,United Kingdom
565726,22792,FLUTED ANTIQUE CANDLE HOLDER,12,9/6/2011 11:58,0.85,14360,United Kingdom
565726,84347,ROTATING SILVER ANGELS T-LIGHT HLDR,12,9/6/2011 11:58,2.55,14360,United Kingdom
565726,23217,LAUREL HEART ANTIQUE SILVER,12,9/6/2011 11:58,1.25,14360,United Kingdom
565726,23225,CHERUB HEART DECORATION SILVER ,12,9/6/2011 11:58,0.83,14360,United Kingdom
565726,22791,T-LIGHT GLASS FLUTED ANTIQUE,12,9/6/2011 11:58,1.25,14360,United Kingdom
565726,23221,REINDEER HEART DECORATION SILVER,12,9/6/2011 11:58,0.83,14360,United Kingdom
565726,22735,RIBBON REEL SOCKS AND MITTENS,10,9/6/2011 11:58,1.65,14360,United Kingdom
565726,22739,RIBBON REEL CHRISTMAS SOCK BAUBLE,10,9/6/2011 11:58,1.65,14360,United Kingdom
565726,22737,RIBBON REEL CHRISTMAS PRESENT ,10,9/6/2011 11:58,1.65,14360,United Kingdom
565726,22736,RIBBON REEL MAKING SNOWMEN ,10,9/6/2011 11:58,1.65,14360,United Kingdom
565726,22734,SET OF 6 RIBBONS VINTAGE CHRISTMAS,12,9/6/2011 11:58,2.89,14360,United Kingdom
565726,23353,6 GIFT TAGS VINTAGE CHRISTMAS ,12,9/6/2011 11:58,0.83,14360,United Kingdom
565726,22950,36 DOILIES VINTAGE CHRISTMAS,12,9/6/2011 11:58,1.45,14360,United Kingdom
565726,22952,60 CAKE CASES VINTAGE CHRISTMAS,24,9/6/2011 11:58,0.55,14360,United Kingdom
565726,23349,ROLL WRAP VINTAGE CHRISTMAS,12,9/6/2011 11:58,1.25,14360,United Kingdom
565726,23340,VINTAGE CHRISTMAS CAKE FRILL,12,9/6/2011 11:58,1.65,14360,United Kingdom
565726,23373,VINTAGE CHRISTMAS PAPER GIFT BAG,10,9/6/2011 11:58,0.82,14360,United Kingdom
565726,23436,GIFT BAG LARGE VINTAGE CHRISTMAS,12,9/6/2011 11:58,1.25,14360,United Kingdom
565726,22909,SET OF 20 VINTAGE CHRISTMAS NAPKINS,12,9/6/2011 11:58,0.85,14360,United Kingdom
565726,23234,BISCUIT TIN VINTAGE CHRISTMAS,6,9/6/2011 11:58,2.89,14360,United Kingdom
565726,22623,BOX OF VINTAGE JIGSAW BLOCKS ,3,9/6/2011 11:58,5.95,14360,United Kingdom
565726,23188,VINTAGE  2 METER FOLDING RULER,12,9/6/2011 11:58,1.65,14360,United Kingdom
565726,22561,WOODEN SCHOOL COLOURING SET,12,9/6/2011 11:58,1.65,14360,United Kingdom
565726,22622,BOX OF VINTAGE ALPHABET BLOCKS,2,9/6/2011 11:58,11.95,14360,United Kingdom
565726,23241,TREASURE TIN GYMKHANA DESIGN,6,9/6/2011 11:58,2.08,14360,United Kingdom
565726,23242,TREASURE TIN BUFFALO BILL ,6,9/6/2011 11:58,2.08,14360,United Kingdom
565726,23208,LUNCH BAG VINTAGE LEAF DESIGN,10,9/6/2011 11:58,1.65,14360,United Kingdom
565726,23207,LUNCH BAG ALPHABET DESIGN,10,9/6/2011 11:58,1.65,14360,United Kingdom
565726,22355,CHARLOTTE BAG SUKI DESIGN,10,9/6/2011 11:58,0.85,14360,United Kingdom
565726,23202,JUMBO BAG VINTAGE LEAF,10,9/6/2011 11:58,2.08,14360,United Kingdom
565726,22411,JUMBO SHOPPER VINTAGE RED PAISLEY,10,9/6/2011 11:58,2.08,14360,United Kingdom
565726,23287,RED VINTAGE SPOT BEAKER,8,9/6/2011 11:58,0.85,14360,United Kingdom
565726,23286,BLUE VINTAGE SPOT BEAKER,8,9/6/2011 11:58,0.85,14360,United Kingdom
565726,23288,GREEN VINTAGE SPOT BEAKER,8,9/6/2011 11:58,0.85,14360,United Kingdom
565726,23285,PINK VINTAGE SPOT BEAKER,8,9/6/2011 11:58,0.85,14360,United Kingdom
565726,22969,HOMEMADE JAM SCENTED CANDLES,12,9/6/2011 11:58,1.45,14360,United Kingdom
565726,22654,DELUXE SEWING KIT ,3,9/6/2011 11:58,5.95,14360,United Kingdom
565726,85178,VICTORIAN SEWING KIT,12,9/6/2011 11:58,1.25,14360,United Kingdom
565726,22651,GENTLEMAN SHIRT REPAIR KIT ,12,9/6/2011 11:58,0.85,14360,United Kingdom
565726,84879,ASSORTED COLOUR BIRD ORNAMENT,8,9/6/2011 11:58,1.69,14360,United Kingdom
565726,22423,REGENCY CAKESTAND 3 TIER,3,9/6/2011 11:58,12.75,14360,United Kingdom
565726,22698,PINK REGENCY TEACUP AND SAUCER,6,9/6/2011 11:58,2.95,14360,United Kingdom
565726,22699,ROSES REGENCY TEACUP AND SAUCER ,6,9/6/2011 11:58,2.95,14360,United Kingdom
565726,22697,GREEN REGENCY TEACUP AND SAUCER,6,9/6/2011 11:58,2.95,14360,United Kingdom
565726,23173,REGENCY TEAPOT ROSES ,2,9/6/2011 11:58,9.95,14360,United Kingdom
565726,23174,REGENCY SUGAR BOWL GREEN,4,9/6/2011 11:58,4.15,14360,United Kingdom
565726,23170,REGENCY TEA PLATE ROSES ,12,9/6/2011 11:58,1.65,14360,United Kingdom
565726,23171,REGENCY TEA PLATE GREEN ,12,9/6/2011 11:58,1.65,14360,United Kingdom
565726,23172,REGENCY TEA PLATE PINK,12,9/6/2011 11:58,1.65,14360,United Kingdom
565726,23162,REGENCY TEA STRAINER,4,9/6/2011 11:58,3.75,14360,United Kingdom
565726,23245,SET OF 3 REGENCY CAKE TINS,4,9/6/2011 11:58,4.95,14360,United Kingdom
565726,23356,LOVE HOT WATER BOTTLE,3,9/6/2011 11:58,5.95,14360,United Kingdom
565726,22112,CHOCOLATE HOT WATER BOTTLE,3,9/6/2011 11:58,4.95,14360,United Kingdom
565726,22835,HOT WATER BOTTLE I AM SO POORLY,4,9/6/2011 11:58,4.65,14360,United Kingdom
565726,22113,GREY HEART HOT WATER BOTTLE,4,9/6/2011 11:58,3.75,14360,United Kingdom
565726,82600,NO SINGING METAL SIGN,12,9/6/2011 11:58,2.1,14360,United Kingdom
565726,21181,PLEASE ONE PERSON METAL SIGN,12,9/6/2011 11:58,2.1,14360,United Kingdom
565726,21175,GIN + TONIC DIET METAL SIGN,12,9/6/2011 11:58,2.55,14360,United Kingdom
565726,21169,YOU'RE CONFUSING ME METAL SIGN ,12,9/6/2011 11:58,1.69,14360,United Kingdom
565726,22818,CARD CHRISTMAS VILLAGE,12,9/6/2011 11:58,0.42,14360,United Kingdom
565726,22959,WRAP CHRISTMAS VILLAGE,25,9/6/2011 11:58,0.42,14360,United Kingdom
565726,23232,WRAP VINTAGE LEAF DESIGN,25,9/6/2011 11:58,0.42,14360,United Kingdom
565726,22047,EMPIRE GIFT WRAP,25,9/6/2011 11:58,0.42,14360,United Kingdom
565726,21497,FANCY FONTS BIRTHDAY WRAP,25,9/6/2011 11:58,0.42,14360,United Kingdom
565726,22983,CARD BILLBOARD FONT,12,9/6/2011 11:58,0.42,14360,United Kingdom
565726,22030,SWALLOWS GREETING CARD,12,9/6/2011 11:58,0.42,14360,United Kingdom
565726,22712,CARD DOLLY GIRL ,12,9/6/2011 11:58,0.42,14360,United Kingdom
565726,22029,SPACEBOY BIRTHDAY CARD,12,9/6/2011 11:58,0.42,14360,United Kingdom
565726,22026,BANQUET BIRTHDAY  CARD  ,12,9/6/2011 11:58,0.42,14360,United Kingdom
565726,22715,CARD WEDDING DAY,12,9/6/2011 11:58,0.42,14360,United Kingdom
565726,23313,VINTAGE CHRISTMAS BUNTING,10,9/6/2011 11:58,4.95,14360,United Kingdom
565727,22382,LUNCH BAG SPACEBOY DESIGN ,10,9/6/2011 11:58,1.65,13158,United Kingdom
565727,20727,LUNCH BAG  BLACK SKULL.,10,9/6/2011 11:58,1.65,13158,United Kingdom
565727,22384,LUNCH BAG PINK POLKADOT,10,9/6/2011 11:58,1.65,13158,United Kingdom
565727,22727,ALARM CLOCK BAKELIKE RED ,4,9/6/2011 11:58,3.75,13158,United Kingdom
565727,22467,GUMBALL COAT RACK,6,9/6/2011 11:58,2.55,13158,United Kingdom
565727,15036,ASSORTED COLOURS SILK FAN,12,9/6/2011 11:58,0.83,13158,United Kingdom
565727,15034,PAPER POCKET TRAVELING FAN ,24,9/6/2011 11:58,0.14,13158,United Kingdom
565727,22326,ROUND SNACK BOXES SET OF4 WOODLAND ,6,9/6/2011 11:58,2.95,13158,United Kingdom
565727,22327,ROUND SNACK BOXES SET OF 4 SKULLS,6,9/6/2011 11:58,2.95,13158,United Kingdom
565727,22328,ROUND SNACK BOXES SET OF 4 FRUITS ,12,9/6/2011 11:58,2.95,13158,United Kingdom
565727,23313,VINTAGE CHRISTMAS BUNTING,5,9/6/2011 11:58,4.95,13158,United Kingdom
565727,23433,HANGING QUILTED PATCHWORK APPLES,12,9/6/2011 11:58,0.83,13158,United Kingdom
565727,22909,SET OF 20 VINTAGE CHRISTMAS NAPKINS,12,9/6/2011 11:58,0.85,13158,United Kingdom
565727,22197,POPCORN HOLDER,12,9/6/2011 11:58,0.85,13158,United Kingdom
565727,23208,LUNCH BAG VINTAGE LEAF DESIGN,10,9/6/2011 11:58,1.65,13158,United Kingdom
565727,20961,STRAWBERRY BATH SPONGE ,10,9/6/2011 11:58,1.25,13158,United Kingdom
565727,20963,APPLE BATH SPONGE,10,9/6/2011 11:58,1.25,13158,United Kingdom
565727,21918,SET 12 KIDS COLOUR  CHALK STICKS,24,9/6/2011 11:58,0.42,13158,United Kingdom
565727,84920,PINK FLOWER FABRIC PONY,4,9/6/2011 11:58,3.75,13158,United Kingdom
565727,23348,CHILDRENS TOY COOKING UTENSIL SET,6,9/6/2011 11:58,2.08,13158,United Kingdom
565727,21703,BAG 125g SWIRLY MARBLES,12,9/6/2011 11:58,0.42,13158,United Kingdom
565727,22418,10 COLOUR SPACEBOY PEN,24,9/6/2011 11:58,0.85,13158,United Kingdom
565727,51014L,"FEATHER PEN,LIGHT PINK",24,9/6/2011 11:58,0.39,13158,United Kingdom
565728,22952,60 CAKE CASES VINTAGE CHRISTMAS,24,9/6/2011 12:00,0.55,17716,United Kingdom
565728,23100,SILVER BELLS TABLE DECORATION,12,9/6/2011 12:00,1.25,17716,United Kingdom
565728,22086,PAPER CHAIN KIT 50'S CHRISTMAS ,24,9/6/2011 12:00,2.95,17716,United Kingdom
565728,22910,PAPER CHAIN KIT VINTAGE CHRISTMAS,24,9/6/2011 12:00,2.95,17716,United Kingdom
565728,22694,WICKER STAR ,6,9/6/2011 12:00,2.1,17716,United Kingdom
565728,22766,PHOTO FRAME CORNICE,8,9/6/2011 12:00,2.95,17716,United Kingdom
565728,22469,HEART OF WICKER SMALL,12,9/6/2011 12:00,1.65,17716,United Kingdom
565728,85123A,WHITE HANGING HEART T-LIGHT HOLDER,32,9/6/2011 12:00,2.55,17716,United Kingdom
565728,21670,BLUE SPOT CERAMIC DRAWER KNOB,12,9/6/2011 12:00,1.45,17716,United Kingdom
565728,21213,PACK OF 72 SKULL CAKE CASES,24,9/6/2011 12:00,0.55,17716,United Kingdom
565728,22085,PAPER CHAIN KIT SKULLS ,6,9/6/2011 12:00,2.95,17716,United Kingdom
565728,22437,SET OF 9 BLACK SKULL BALLOONS,20,9/6/2011 12:00,0.85,17716,United Kingdom
565728,22083,PAPER CHAIN KIT RETROSPOT,40,9/6/2011 12:00,2.55,17716,United Kingdom
565728,22774,RED DRAWER KNOB ACRYLIC EDWARDIAN,24,9/6/2011 12:00,1.25,17716,United Kingdom
565728,22773,GREEN DRAWER KNOB ACRYLIC EDWARDIAN,12,9/6/2011 12:00,1.25,17716,United Kingdom
565728,22772,PINK DRAWER KNOB ACRYLIC EDWARDIAN,12,9/6/2011 12:00,1.25,17716,United Kingdom
565728,22771,CLEAR DRAWER KNOB ACRYLIC EDWARDIAN,12,9/6/2011 12:00,1.25,17716,United Kingdom
565729,21181,PLEASE ONE PERSON METAL SIGN,12,9/6/2011 12:01,2.1,17716,United Kingdom
565730,82551,LAUNDRY 15C METAL SIGN,6,9/6/2011 12:02,1.45,14715,United Kingdom
565730,82552,WASHROOM METAL SIGN,6,9/6/2011 12:02,1.45,14715,United Kingdom
565730,23426,METAL SIGN DROP YOUR PANTS,2,9/6/2011 12:02,2.89,14715,United Kingdom
565730,22413,METAL SIGN TAKE IT OR LEAVE IT ,2,9/6/2011 12:02,2.95,14715,United Kingdom
565730,21908,CHOCOLATE THIS WAY METAL SIGN,2,9/6/2011 12:02,2.1,14715,United Kingdom
565730,22412,METAL SIGN NEIGHBOURHOOD WITCH ,1,9/6/2011 12:02,2.1,14715,United Kingdom
565730,82600,NO SINGING METAL SIGN,2,9/6/2011 12:02,2.1,14715,United Kingdom
565730,82583,HOT BATHS METAL SIGN,2,9/6/2011 12:02,2.1,14715,United Kingdom
565730,23203,JUMBO BAG VINTAGE DOILY ,4,9/6/2011 12:02,2.08,14715,United Kingdom
565730,21985,PACK OF 12 HEARTS DESIGN TISSUES ,12,9/6/2011 12:02,0.39,14715,United Kingdom
565730,23298,SPOTTY BUNTING,2,9/6/2011 12:02,4.95,14715,United Kingdom
565730,23332,IVORY WICKER HEART LARGE,10,9/6/2011 12:02,1.65,14715,United Kingdom
565730,23329,DECORATIVE WICKER HEART LARGE,8,9/6/2011 12:02,1.65,14715,United Kingdom
565730,21644,ASSORTED TUTTI FRUTTI HEART BOX,6,9/6/2011 12:02,1.25,14715,United Kingdom
565730,21917,SET 12 KIDS  WHITE CHALK STICKS,6,9/6/2011 12:02,0.42,14715,United Kingdom
565730,75049L,LARGE CIRCULAR MIRROR MOBILE,54,9/6/2011 12:02,1.25,14715,United Kingdom
565730,23412,HEART MIRROR ANTIQUE WHITE,4,9/6/2011 12:02,7.5,14715,United Kingdom
565730,82484,WOOD BLACK BOARD ANT WHITE FINISH,2,9/6/2011 12:02,7.95,14715,United Kingdom
565730,22971,QUEENS GUARD COFFEE MUG,6,9/6/2011 12:02,2.55,14715,United Kingdom
565730,22766,PHOTO FRAME CORNICE,4,9/6/2011 12:02,2.95,14715,United Kingdom
565730,71053,WHITE METAL LANTERN,6,9/6/2011 12:02,3.75,14715,United Kingdom
565730,22756,LARGE YELLOW BABUSHKA NOTEBOOK ,2,9/6/2011 12:02,1.25,14715,United Kingdom
565730,22758,LARGE PURPLE BABUSHKA NOTEBOOK  ,2,9/6/2011 12:02,1.25,14715,United Kingdom
565730,21683,MEDIUM MEDINA STAMPED METAL BOWL ,4,9/6/2011 12:02,2.95,14715,United Kingdom
565730,21463,MIRRORED DISCO BALL ,2,9/6/2011 12:02,5.95,14715,United Kingdom
565730,84356,POMPOM CURTAIN,6,9/6/2011 12:02,6.95,14715,United Kingdom
565730,21872,GLAMOROUS  MUG,6,9/6/2011 12:02,1.25,14715,United Kingdom
565731,23075,DOUBLE CERAMIC PARLOUR HOOK,4,9/6/2011 12:02,4.15,17716,United Kingdom
565731,23153,ZINC SWEETHEART WIRE LETTER RACK,4,9/6/2011 12:02,3.75,17716,United Kingdom
565731,23152,IVORY SWEETHEART WIRE LETTER RACK ,4,9/6/2011 12:02,3.75,17716,United Kingdom
565731,23250,ENAMEL BOWL PANTRY,12,9/6/2011 12:02,1.25,17716,United Kingdom
565731,23249,ENAMEL DINNER PLATE PANTRY,12,9/6/2011 12:02,1.65,17716,United Kingdom
565731,23252,ENAMEL JUG PANTRY,4,9/6/2011 12:02,3.75,17716,United Kingdom
565731,23288,GREEN VINTAGE SPOT BEAKER,8,9/6/2011 12:02,0.85,17716,United Kingdom
565731,23287,RED VINTAGE SPOT BEAKER,8,9/6/2011 12:02,0.85,17716,United Kingdom
565731,22988,SOLDIERS EGG CUP ,12,9/6/2011 12:02,1.25,17716,United Kingdom
565732,20725,LUNCH BAG RED RETROSPOT,10,9/6/2011 12:10,1.65,17068,United Kingdom
565732,22384,LUNCH BAG PINK POLKADOT,10,9/6/2011 12:10,1.65,17068,United Kingdom
565732,22386,JUMBO BAG PINK POLKADOT,10,9/6/2011 12:10,2.08,17068,United Kingdom
565732,20728,LUNCH BAG CARS BLUE,10,9/6/2011 12:10,1.65,17068,United Kingdom
565732,20727,LUNCH BAG  BLACK SKULL.,10,9/6/2011 12:10,1.65,17068,United Kingdom
565732,23199,JUMBO BAG APPLES,10,9/6/2011 12:10,2.08,17068,United Kingdom
565732,23202,JUMBO BAG VINTAGE LEAF,10,9/6/2011 12:10,2.08,17068,United Kingdom
565732,23203,JUMBO BAG VINTAGE DOILY ,10,9/6/2011 12:10,2.08,17068,United Kingdom
565732,85099B,JUMBO BAG RED RETROSPOT,10,9/6/2011 12:10,2.08,17068,United Kingdom
565732,23201,JUMBO BAG ALPHABET,10,9/6/2011 12:10,2.08,17068,United Kingdom
565732,22381,TOY TIDY PINK POLKADOT,10,9/6/2011 12:10,2.1,17068,United Kingdom
565732,22379,RECYCLING BAG RETROSPOT ,10,9/6/2011 12:10,2.1,17068,United Kingdom
565732,20717,STRAWBERRY SHOPPER BAG,10,9/6/2011 12:10,1.25,17068,United Kingdom
565732,20718,RED RETROSPOT SHOPPER BAG,10,9/6/2011 12:10,1.25,17068,United Kingdom
565733,22847,BREAD BIN DINER STYLE IVORY,2,9/6/2011 12:11,16.95,16359,United Kingdom
565733,23328,SET 6 SCHOOL MILK BOTTLES IN CRATE,4,9/6/2011 12:11,3.75,16359,United Kingdom
565733,84836,ZINC METAL HEART DECORATION,72,9/6/2011 12:11,1.25,16359,United Kingdom
565733,22424,ENAMEL BREAD BIN CREAM,2,9/6/2011 12:11,12.75,16359,United Kingdom
565734,23396,LA JARDIN BOTANIQUE CUSHION COVER,3,9/6/2011 12:15,3.75,17191,United Kingdom
565734,23394,POSTE FRANCE CUSHION COVER,3,9/6/2011 12:15,3.75,17191,United Kingdom
565734,23028,DRAWER KNOB CRACKLE GLAZE BLUE,12,9/6/2011 12:15,1.65,17191,United Kingdom
565734,82552,WASHROOM METAL SIGN,1,9/6/2011 12:15,1.45,17191,United Kingdom
565734,21034,REX CASH+CARRY JUMBO SHOPPER,5,9/6/2011 12:15,0.95,17191,United Kingdom
565734,22773,GREEN DRAWER KNOB ACRYLIC EDWARDIAN,48,9/6/2011 12:15,1.25,17191,United Kingdom
565734,22771,CLEAR DRAWER KNOB ACRYLIC EDWARDIAN,24,9/6/2011 12:15,1.25,17191,United Kingdom
565734,22500,SET OF 2 TINS JARDIN DE PROVENCE,2,9/6/2011 12:15,4.95,17191,United Kingdom
565734,22496,SET OF 2 ROUND TINS DUTCH CHEESE,1,9/6/2011 12:15,2.95,17191,United Kingdom
565734,21174,POTTERING IN THE SHED METAL SIGN,1,9/6/2011 12:15,2.08,17191,United Kingdom
565734,21903,MAN FLU METAL SIGN,1,9/6/2011 12:15,2.1,17191,United Kingdom
565734,23414,ZINC BOX SIGN HOME,3,9/6/2011 12:15,9.95,17191,United Kingdom
565734,22557,PLASTERS IN TIN VINTAGE PAISLEY ,1,9/6/2011 12:15,1.65,17191,United Kingdom
565734,22659,LUNCH BOX I LOVE LONDON,2,9/6/2011 12:15,1.95,17191,United Kingdom
565734,22993,SET OF 4 PANTRY JELLY MOULDS,8,9/6/2011 12:15,1.25,17191,United Kingdom
565734,22429,ENAMEL MEASURING JUG CREAM,2,9/6/2011 12:15,4.25,17191,United Kingdom
565734,79066K,RETRO MOD TRAY,2,9/6/2011 12:15,0.85,17191,United Kingdom
565734,35095B,RED VICTORIAN FABRIC OVAL BOX,3,9/6/2011 12:15,0.42,17191,United Kingdom
565734,35095A,BLUE VICTORIAN FABRIC OVAL BOX,3,9/6/2011 12:15,0.42,17191,United Kingdom
565734,23191,BUNDLE OF 3 RETRO NOTE BOOKS,1,9/6/2011 12:15,1.65,17191,United Kingdom
565734,82552,WASHROOM METAL SIGN,1,9/6/2011 12:15,1.45,17191,United Kingdom
565734,21896,POTTING SHED TWINE,1,9/6/2011 12:15,2.1,17191,United Kingdom
565734,23425,STORAGE TIN HOME SWEET HOME,3,9/6/2011 12:15,2.49,17191,United Kingdom
565734,22219,LOVEBIRD HANGING DECORATION WHITE ,9,9/6/2011 12:15,0.85,17191,United Kingdom
565734,23399,HOME SWEET HOME HANGING HEART,6,9/6/2011 12:15,0.85,17191,United Kingdom
565734,23241,TREASURE TIN GYMKHANA DESIGN,6,9/6/2011 12:15,2.08,17191,United Kingdom
565734,23151,ZINC SWEETHEART SOAP DISH,2,9/6/2011 12:15,2.49,17191,United Kingdom
565734,23150,IVORY SWEETHEART SOAP DISH,2,9/6/2011 12:15,2.49,17191,United Kingdom
565734,22095,LADS ONLY TISSUE BOX,6,9/6/2011 12:15,0.39,17191,United Kingdom
565734,84406B,CREAM CUPID HEARTS COAT HANGER,8,9/6/2011 12:15,4.15,17191,United Kingdom
565734,22093,MOTORING TISSUE BOX,14,9/6/2011 12:15,0.39,17191,United Kingdom
565734,23243,SET OF TEA COFFEE SUGAR TINS PANTRY,2,9/6/2011 12:15,4.95,17191,United Kingdom
565734,22098,BOUDOIR SQUARE TISSUE BOX,18,9/6/2011 12:15,0.39,17191,United Kingdom
565734,22795,SWEETHEART RECIPE BOOK STAND,2,9/6/2011 12:15,6.75,17191,United Kingdom
565734,22912,YELLOW COAT RACK PARIS FASHION,3,9/6/2011 12:15,4.95,17191,United Kingdom
565734,22173,METAL 4 HOOK HANGER FRENCH CHATEAU,8,9/6/2011 12:15,3.29,17191,United Kingdom
565734,23146,TRIPLE HOOK ANTIQUE IVORY ROSE,4,9/6/2011 12:15,3.29,17191,United Kingdom
565735,BANK CHARGES,Bank Charges,1,9/6/2011 12:25,15,16904,United Kingdom
565736,22151,PLACE SETTING WHITE HEART,432,9/6/2011 12:27,0.36,13784,United Kingdom
565737,23275,SET OF 3 HANGING OWLS OLLIE BEAK,12,9/6/2011 12:27,1.25,16400,United Kingdom
565737,22567,20 DOLLY PEGS RETROSPOT,2,9/6/2011 12:27,1.45,16400,United Kingdom
565737,23333,IVORY WICKER HEART MEDIUM,24,9/6/2011 12:27,1.25,16400,United Kingdom
565737,22142,CHRISTMAS CRAFT WHITE FAIRY ,4,9/6/2011 12:27,1.45,16400,United Kingdom
565737,22144,CHRISTMAS CRAFT LITTLE FRIENDS,1,9/6/2011 12:27,2.1,16400,United Kingdom
565737,22141,CHRISTMAS CRAFT TREE TOP ANGEL,1,9/6/2011 12:27,2.1,16400,United Kingdom
565737,22633,HAND WARMER UNION JACK,1,9/6/2011 12:27,2.1,16400,United Kingdom
565737,22866,HAND WARMER SCOTTY DOG DESIGN,5,9/6/2011 12:27,2.1,16400,United Kingdom
565737,22865,HAND WARMER OWL DESIGN,3,9/6/2011 12:27,2.1,16400,United Kingdom
565737,22632,HAND WARMER RED RETROSPOT,2,9/6/2011 12:27,2.1,16400,United Kingdom
565737,22794,SWEETHEART WIRE MAGAZINE RACK,2,9/6/2011 12:27,7.95,16400,United Kingdom
