565649,22845,VINTAGE CREAM CAT FOOD CONTAINER,2,9/5/2011 16:27,6.35,16712,United Kingdom
565649,22853,CAT BOWL VINTAGE CREAM,2,9/5/2011 16:27,3.25,16712,United Kingdom
565649,22627,MINT KITCHEN SCALES,1,9/5/2011 16:27,8.5,16712,United Kingdom
565649,23299,FOOD COVER WITH BEADS SET 2 ,4,9/5/2011 16:27,3.75,16712,United Kingdom
565649,22852,DOG BOWL VINTAGE CREAM,2,9/5/2011 16:27,4.25,16712,United Kingdom
565649,23123,COCKTAIL SWORDS 50 PIECES,3,9/5/2011 16:27,0.83,16712,United Kingdom
565649,22631,CIRCUS PARADE LUNCH BOX ,2,9/5/2011 16:27,1.95,16712,United Kingdom
565649,22630,DOLLY GIRL LUNCH BOX,2,9/5/2011 16:27,1.95,16712,United Kingdom
565649,22842,BISCUIT TIN VINTAGE RED,2,9/5/2011 16:27,6.75,16712,United Kingdom
565649,22847,BREAD BIN DINER STYLE IVORY,1,9/5/2011 16:27,16.95,16712,United Kingdom
565649,23252,VINTAGE RED ENAMEL TRIM JUG ,3,9/5/2011 16:27,3.75,16712,United Kingdom
565649,23251,VINTAGE RED ENAMEL TRIM MUG ,6,9/5/2011 16:27,1.25,16712,United Kingdom
565649,23249,VINTAGE RED ENAMEL TRIM PLATE,3,9/5/2011 16:27,1.65,16712,United Kingdom
565649,23250,VINTAGE RED TRIM ENAMEL BOWL ,3,9/5/2011 16:27,1.25,16712,United Kingdom
565649,22838,3 TIER CAKE TIN RED AND CREAM,1,9/5/2011 16:27,14.95,16712,United Kingdom
565649,22624,IVORY KITCHEN SCALES,1,9/5/2011 16:27,8.5,16712,United Kingdom
565649,23080,RED METAL BOX TOP SECRET,1,9/5/2011 16:27,8.25,16712,United Kingdom
565649,22895,SET OF 2 TEA TOWELS APPLE AND PEARS,6,9/5/2011 16:27,3.25,16712,United Kingdom
565649,23091,ZINC HERB GARDEN CONTAINER,6,9/5/2011 16:27,6.25,16712,United Kingdom
565649,22261,FELT EGG COSY WHITE RABBIT ,3,9/5/2011 16:27,0.85,16712,United Kingdom
565649,22260,FELT EGG COSY BLUE RABBIT ,3,9/5/2011 16:27,0.85,16712,United Kingdom
565649,22262,FELT EGG COSY CHICKEN,3,9/5/2011 16:27,0.85,16712,United Kingdom
565649,22263,FELT EGG COSY LADYBIRD ,3,9/5/2011 16:27,0.85,16712,United Kingdom
565649,23335,EGG FRYING PAN IVORY ,3,9/5/2011 16:27,2.08,16712,United Kingdom
565649,22840,ROUND CAKE TIN VINTAGE RED,2,9/5/2011 16:27,7.95,16712,United Kingdom
565649,22411,JUMBO SHOPPER VINTAGE RED PAISLEY,2,9/5/2011 16:27,2.08,16712,United Kingdom
565664,23232,WRAP VINTAGE LEAF DESIGN,25,9/5/2011 17:36,0.42,13211,United Kingdom
565664,23231,WRAP  VINTAGE DOILY ,25,9/5/2011 17:36,0.42,13211,United Kingdom
565664,23549,WRAP BIRD GARDEN ,25,9/5/2011 17:36,0.42,13211,United Kingdom
565664,21498,RED RETROSPOT WRAP ,25,9/5/2011 17:36,0.42,13211,United Kingdom
565664,21495,SKULLS AND CROSSBONES WRAP,25,9/5/2011 17:36,0.42,13211,United Kingdom
565664,21499,BLUE POLKADOT WRAP,25,9/5/2011 17:36,0.42,13211,United Kingdom
565664,22548,HEADS AND TAILS SPORTING FUN,1,9/5/2011 17:36,1.25,13211,United Kingdom
565664,22333,RETROSPOT PARTY BAG + STICKER SET,5,9/5/2011 17:36,1.65,13211,United Kingdom
565664,22332,SKULLS PARTY BAG + STICKER SET,5,9/5/2011 17:36,1.65,13211,United Kingdom
565664,22334,DINOSAUR PARTY BAG + STICKER SET,5,9/5/2011 17:36,1.65,13211,United Kingdom
565664,47590B,PINK HAPPY BIRTHDAY BUNTING,4,9/5/2011 17:36,5.45,13211,United Kingdom
565664,47590A,BLUE HAPPY BIRTHDAY BUNTING,4,9/5/2011 17:36,5.45,13211,United Kingdom
565664,23298,SPOTTY BUNTING,8,9/5/2011 17:36,4.95,13211,United Kingdom
565664,21207,SKULL AND CROSSBONES  GARLAND ,6,9/5/2011 17:36,1.65,13211,United Kingdom
565664,47566,PARTY BUNTING,3,9/5/2011 17:36,4.95,13211,United Kingdom
565664,22436,12 COLOURED PARTY BALLOONS,9,9/5/2011 17:36,0.65,13211,United Kingdom
565664,22436,12 COLOURED PARTY BALLOONS,10,9/5/2011 17:36,0.65,13211,United Kingdom
565664,20718,RED RETROSPOT SHOPPER BAG,4,9/5/2011 17:36,1.25,13211,United Kingdom
565664,21060,PARTY INVITES BALLOON GIRL,6,9/5/2011 17:36,0.85,13211,United Kingdom
565664,21059,PARTY INVITES DINOSAURS,6,9/5/2011 17:36,0.85,13211,United Kingdom
565664,21058,PARTY INVITES WOODLAND,6,9/5/2011 17:36,0.85,13211,United Kingdom
565664,84380,SET OF 3 BUTTERFLY COOKIE CUTTERS,4,9/5/2011 17:36,1.45,13211,United Kingdom
565664,21987,PACK OF 6 SKULL PAPER CUPS,8,9/5/2011 17:36,0.65,13211,United Kingdom
565664,21086,SET/6 RED SPOTTY PAPER CUPS,8,9/5/2011 17:36,0.65,13211,United Kingdom
565664,21975,PACK OF 60 DINOSAUR CAKE CASES,8,9/5/2011 17:36,0.55,13211,United Kingdom
565664,21212,PACK OF 72 RETROSPOT CAKE CASES,8,9/5/2011 17:36,0.55,13211,United Kingdom
565664,21213,PACK OF 72 SKULL CAKE CASES,8,9/5/2011 17:36,0.55,13211,United Kingdom
565664,23125,6PC WOOD PLATE SET DISPOSABLE,6,9/5/2011 17:36,1.25,13211,United Kingdom
565664,23121,PACK OF 6 COCKTAIL PARASOL STRAWS,8,9/5/2011 17:36,0.42,13211,United Kingdom
565664,23293,SET OF 12 FAIRY CAKE BAKING CASES,10,9/5/2011 17:36,0.83,13211,United Kingdom
565664,21080,SET/20 RED RETROSPOT PAPER NAPKINS ,8,9/5/2011 17:36,0.85,13211,United Kingdom
565664,21094,SET/6 RED SPOTTY PAPER PLATES,8,9/5/2011 17:36,0.85,13211,United Kingdom
565664,21988,PACK OF 6 SKULL PAPER PLATES,8,9/5/2011 17:36,0.85,13211,United Kingdom
565664,21989,PACK OF 20 SKULL PAPER NAPKINS,8,9/5/2011 17:36,0.85,13211,United Kingdom
565664,21883,STARS GIFT TAPE ,12,9/5/2011 17:36,0.65,13211,United Kingdom
565664,21880,RED RETROSPOT TAPE,12,9/5/2011 17:36,0.65,13211,United Kingdom
565664,23296,SET OF 6 TEA TIME BAKING CASES,8,9/5/2011 17:36,1.25,13211,United Kingdom
565664,84692,BOX OF 24 COCKTAIL PARASOLS,25,9/5/2011 17:36,0.42,13211,United Kingdom
565664,23294,SET OF 6 SNACK LOAF BAKING CASES,8,9/5/2011 17:36,0.83,13211,United Kingdom
565664,23295,SET OF 12 MINI LOAF BAKING CASES,8,9/5/2011 17:36,0.83,13211,United Kingdom
565664,22083,PAPER CHAIN KIT RETROSPOT,40,9/5/2011 17:36,2.55,13211,United Kingdom
565664,22086,PAPER CHAIN KIT 50'S CHRISTMAS ,80,9/5/2011 17:36,2.55,13211,United Kingdom
565664,22083,PAPER CHAIN KIT RETROSPOT,40,9/5/2011 17:36,2.55,13211,United Kingdom
565664,23297,SET 40 HEART SHAPE PETIT FOUR CASES,8,9/5/2011 17:36,1.65,13211,United Kingdom
565665,21165,BEWARE OF THE CAT METAL SIGN ,22,9/5/2011 17:44,1.69,15856,United Kingdom
565665,21165,BEWARE OF THE CAT METAL SIGN ,48,9/5/2011 17:44,1.45,15856,United Kingdom
565665,22659,LUNCH BOX I LOVE LONDON,4,9/5/2011 17:44,1.95,15856,United Kingdom
565665,21169,YOU'RE CONFUSING ME METAL SIGN ,6,9/5/2011 17:44,1.69,15856,United Kingdom
565665,85150,LADIES & GENTLEMEN METAL SIGN,12,9/5/2011 17:44,2.55,15856,United Kingdom
565665,21166,COOK WITH WINE METAL SIGN ,12,9/5/2011 17:44,2.08,15856,United Kingdom
565665,23426,METAL SIGN DROP YOUR PANTS,12,9/5/2011 17:44,2.89,15856,United Kingdom
565665,82552,WASHROOM METAL SIGN,24,9/5/2011 17:44,1.45,15856,United Kingdom
565665,82551,LAUNDRY 15C METAL SIGN,24,9/5/2011 17:44,1.45,15856,United Kingdom
565665,82600,NO SINGING METAL SIGN,24,9/5/2011 17:44,2.1,15856,United Kingdom
565665,82583,HOT BATHS METAL SIGN,12,9/5/2011 17:44,2.1,15856,United Kingdom
565665,22892,SET OF SALT AND PEPPER TOADSTOOLS,6,9/5/2011 17:44,1.25,15856,United Kingdom
565665,37448,CERAMIC CAKE DESIGN SPOTTED MUG,5,9/5/2011 17:44,1.49,15856,United Kingdom
565665,22647,CERAMIC LOVE HEART MONEY BANK,6,9/5/2011 17:44,1.45,15856,United Kingdom
565665,22645,CERAMIC HEART FAIRY CAKE MONEY BANK,12,9/5/2011 17:44,1.45,15856,United Kingdom
565665,21175,GIN + TONIC DIET METAL SIGN,7,9/5/2011 17:44,2.55,15856,United Kingdom
565665,85071C,"CHARLIE+LOLA""EXTREMELY BUSY"" SIGN",7,9/5/2011 17:44,0.39,15856,United Kingdom
565665,22646,CERAMIC STRAWBERRY CAKE MONEY BANK,4,9/5/2011 17:44,1.45,15856,United Kingdom
565665,21232,STRAWBERRY CERAMIC TRINKET BOX,4,9/5/2011 17:44,1.25,15856,United Kingdom
565665,21231,SWEETHEART CERAMIC TRINKET BOX,12,9/5/2011 17:44,1.25,15856,United Kingdom
565665,22988,SOLDIERS EGG CUP ,12,9/5/2011 17:44,1.25,15856,United Kingdom
565665,22059,CERAMIC STRAWBERRY DESIGN MUG,3,9/5/2011 17:44,1.49,15856,United Kingdom
565665,23194,GYMKHANA TREASURE BOOK BOX,2,9/5/2011 17:44,2.25,15856,United Kingdom
565665,23193,BUFFALO BILL TREASURE BOOK BOX,2,9/5/2011 17:44,2.25,15856,United Kingdom
565665,23176,ABC TREASURE BOOK BOX ,1,9/5/2011 17:44,2.25,15856,United Kingdom
565665,37500,TEA TIME TEAPOT IN GIFT BOX,2,9/5/2011 17:44,4.95,15856,United Kingdom
C565666,22188,BLACK HEART CARD HOLDER,-1,9/5/2011 17:46,3.95,15856,United Kingdom
C565666,22187,GREEN CHRISTMAS TREE CARD HOLDER,-2,9/5/2011 17:46,4.25,15856,United Kingdom
565667,23037,CANDLE HOLDER SILVER MADELINE,12,9/6/2011 8:34,1.65,17449,United Kingdom
565667,22173,METAL 4 HOOK HANGER FRENCH CHATEAU,8,9/6/2011 8:34,3.29,17449,United Kingdom
565667,22795,SWEETHEART RECIPE BOOK STAND,2,9/6/2011 8:34,6.75,17449,United Kingdom
565667,84978,HANGING HEART JAR T-LIGHT HOLDER,12,9/6/2011 8:34,1.25,17449,United Kingdom
565667,22269,EGG CUP NATURAL CHICKEN,16,9/6/2011 8:34,0.39,17449,United Kingdom
565667,22294,HEART FILIGREE DOVE  SMALL,24,9/6/2011 8:34,1.25,17449,United Kingdom
565667,22297,HEART IVORY TRELLIS SMALL,24,9/6/2011 8:34,1.25,17449,United Kingdom
565667,22171,3 HOOK PHOTO SHELF ANTIQUE WHITE,2,9/6/2011 8:34,8.5,17449,United Kingdom
565667,22169,FAMILY ALBUM WHITE PICTURE FRAME,2,9/6/2011 8:34,8.5,17449,United Kingdom
565668,21755,LOVE BUILDING BLOCK WORD,3,9/6/2011 9:15,6.25,15291,United Kingdom
565668,21670,BLUE SPOT CERAMIC DRAWER KNOB,96,9/6/2011 9:15,1.25,15291,United Kingdom
565668,21669,BLUE STRIPE CERAMIC DRAWER KNOB,96,9/6/2011 9:15,1.25,15291,United Kingdom
565668,21668,RED STRIPE CERAMIC DRAWER KNOB,96,9/6/2011 9:15,1.25,15291,United Kingdom
565669,22639,SET OF 4 NAPKIN CHARMS HEARTS,32,9/6/2011 9:18,2.1,17560,United Kingdom
565669,84755,COLOUR GLASS T-LIGHT HOLDER HANGING,64,9/6/2011 9:18,0.65,17560,United Kingdom
565669,40016,CHINESE DRAGON PAPER LANTERNS,96,9/6/2011 9:18,0.42,17560,United Kingdom
565670,22175,PINK OWL SOFT TOY,6,9/6/2011 9:23,2.95,14944,United Kingdom
565670,22176,BLUE OWL SOFT TOY,6,9/6/2011 9:23,2.95,14944,United Kingdom
565670,84931A,PINK SCOTTIE DOG W FLOWER PATTERN,6,9/6/2011 9:23,2.55,14944,United Kingdom
565670,84931B,BLUE SCOTTIE DOG W FLOWER PATTERN,6,9/6/2011 9:23,2.55,14944,United Kingdom
565670,23168,CLASSIC CAFE SUGAR DISPENSER,12,9/6/2011 9:23,1.25,14944,United Kingdom
565670,23270,SET OF 2 CERAMIC PAINTED HEARTS ,48,9/6/2011 9:23,1.45,14944,United Kingdom
565670,22728,ALARM CLOCK BAKELIKE PINK,8,9/6/2011 9:23,3.75,14944,United Kingdom
565670,22727,ALARM CLOCK BAKELIKE RED ,8,9/6/2011 9:23,3.75,14944,United Kingdom
565670,22726,ALARM CLOCK BAKELIKE GREEN,4,9/6/2011 9:23,3.75,14944,United Kingdom
565670,23341,PINK DINER WALL CLOCK,4,9/6/2011 9:23,8.5,14944,United Kingdom
565670,23342,MINT DINER WALL CLOCK,4,9/6/2011 9:23,8.5,14944,United Kingdom
565670,22670,FRENCH WC SIGN BLUE METAL,12,9/6/2011 9:23,1.25,14944,United Kingdom
565670,22671,FRENCH LAUNDRY SIGN BLUE METAL,12,9/6/2011 9:23,1.65,14944,United Kingdom
565670,85123A,WHITE HANGING HEART T-LIGHT HOLDER,12,9/6/2011 9:23,2.95,14944,United Kingdom
565670,21498,RED RETROSPOT WRAP ,50,9/6/2011 9:23,0.42,14944,United Kingdom
565670,22193,RED DINER WALL CLOCK,4,9/6/2011 9:23,8.5,14944,United Kingdom
565670,22469,HEART OF WICKER SMALL,12,9/6/2011 9:23,1.65,14944,United Kingdom
565670,22637,PIGGY BANK RETROSPOT ,4,9/6/2011 9:23,2.55,14944,United Kingdom
565670,22457,NATURAL SLATE HEART CHALKBOARD ,24,9/6/2011 9:23,2.95,14944,United Kingdom
565670,22846,BREAD BIN DINER STYLE RED ,2,9/6/2011 9:23,16.95,14944,United Kingdom
565670,21210,SET OF 72 RETROSPOT PAPER  DOILIES,12,9/6/2011 9:23,1.45,14944,United Kingdom
565670,23144,ZINC T-LIGHT HOLDER STARS SMALL,12,9/6/2011 9:23,0.83,14944,United Kingdom
565670,22156,HEART DECORATION WITH PEARLS ,24,9/6/2011 9:23,0.85,14944,United Kingdom
565670,23321,SMALL WHITE HEART OF WICKER,12,9/6/2011 9:23,1.65,14944,United Kingdom
565670,23322,LARGE WHITE HEART OF WICKER,12,9/6/2011 9:23,2.95,14944,United Kingdom
C565671,22890,NOVELTY BISCUITS CAKE STAND 3 TIER,-1,9/6/2011 9:30,9.95,14796,United Kingdom
C565671,22059,CERAMIC STRAWBERRY DESIGN MUG,-1,9/6/2011 9:30,1.49,14796,United Kingdom
565672,85049E,SCANDINAVIAN REDS RIBBONS,12,9/6/2011 9:34,1.25,17700,United Kingdom
565672,85049G,CHOCOLATE BOX RIBBONS ,12,9/6/2011 9:34,1.25,17700,United Kingdom
565672,85049C,ROMANTIC PINKS RIBBONS ,12,9/6/2011 9:34,1.25,17700,United Kingdom
565672,22744,MAKE YOUR OWN MONSOON CARD KIT,6,9/6/2011 9:34,2.95,17700,United Kingdom
565672,21116,OWL DOORSTOP,3,9/6/2011 9:34,4.95,17700,United Kingdom
565672,23298,SPOTTY BUNTING,6,9/6/2011 9:34,4.95,17700,United Kingdom
565672,22469,HEART OF WICKER SMALL,12,9/6/2011 9:34,1.65,17700,United Kingdom
565672,84879,ASSORTED COLOUR BIRD ORNAMENT,8,9/6/2011 9:34,1.69,17700,United Kingdom
565672,23321,SMALL WHITE HEART OF WICKER,12,9/6/2011 9:34,1.65,17700,United Kingdom
565672,23431,NATURAL HANGING QUILTED HEARTS ,12,9/6/2011 9:34,0.83,17700,United Kingdom
565672,85061W,WHITE JEWELLED HEART DECORATION,24,9/6/2011 9:34,0.85,17700,United Kingdom
565672,20982,12 PENCILS TALL TUBE SKULLS,12,9/6/2011 9:34,0.85,17700,United Kingdom
565672,20983,12 PENCILS TALL TUBE RED RETROSPOT,12,9/6/2011 9:34,0.85,17700,United Kingdom
565672,20984,12 PENCILS TALL TUBE POSY,24,9/6/2011 9:34,0.29,17700,United Kingdom
565672,21703,BAG 125g SWIRLY MARBLES,12,9/6/2011 9:34,0.42,17700,United Kingdom
565672,23263,SET OF 3 WOODEN HEART DECORATIONS,12,9/6/2011 9:34,1.25,17700,United Kingdom
565672,23270,SET OF 2 CERAMIC PAINTED HEARTS ,12,9/6/2011 9:34,1.45,17700,United Kingdom
565672,23381,PACK OF 12 VINTAGE LEAF TISSUES ,24,9/6/2011 9:34,0.39,17700,United Kingdom
565672,47566,PARTY BUNTING,4,9/6/2011 9:34,4.95,17700,United Kingdom
565672,85123A,WHITE HANGING HEART T-LIGHT HOLDER,32,9/6/2011 9:34,2.55,17700,United Kingdom
565672,84912B,GREEN ROSE WASHBAG,4,9/6/2011 9:34,3.75,17700,United Kingdom
565672,84922,PINK BUTTERFLY WASHBAG,3,9/6/2011 9:34,4.25,17700,United Kingdom
565672,22804,CANDLEHOLDER PINK HANGING HEART,6,9/6/2011 9:34,2.95,17700,United Kingdom
565672,23057,BEADED CHANDELIER T-LIGHT HOLDER,4,9/6/2011 9:34,4.95,17700,United Kingdom
565672,23056,FLOWERS CHANDELIER T-LIGHT HOLDER,3,9/6/2011 9:34,6.25,17700,United Kingdom
565672,23055,IVORY CHANDELIER T-LIGHT HOLDER,3,9/6/2011 9:34,6.25,17700,United Kingdom
565672,22173,METAL 4 HOOK HANGER FRENCH CHATEAU,8,9/6/2011 9:34,3.29,17700,United Kingdom
565672,22078,RIBBON REEL LACE DESIGN ,10,9/6/2011 9:34,2.1,17700,United Kingdom
565672,22080,RIBBON REEL POLKADOTS ,10,9/6/2011 9:34,1.65,17700,United Kingdom
565672,22077,6 RIBBONS RUSTIC CHARM,12,9/6/2011 9:34,1.95,17700,United Kingdom
565673,23323,WHITE WICKER STAR ,12,9/6/2011 9:45,2.1,14441,United Kingdom
565673,23355,HOT WATER BOTTLE KEEP CALM,12,9/6/2011 9:45,4.95,14441,United Kingdom
565673,47566,PARTY BUNTING,8,9/6/2011 9:45,4.95,14441,United Kingdom
565673,22413,METAL SIGN TAKE IT OR LEAVE IT ,6,9/6/2011 9:45,2.95,14441,United Kingdom
565673,21174,POTTERING IN THE SHED METAL SIGN,12,9/6/2011 9:45,2.08,14441,United Kingdom
565673,22119,PEACE WOODEN BLOCK LETTERS,3,9/6/2011 9:45,6.95,14441,United Kingdom
565673,23322,LARGE WHITE HEART OF WICKER,6,9/6/2011 9:45,2.95,14441,United Kingdom
565673,84029G,KNITTED UNION FLAG HOT WATER BOTTLE,12,9/6/2011 9:45,4.25,14441,United Kingdom
565673,23332,IVORY WICKER HEART LARGE,24,9/6/2011 9:45,1.65,14441,United Kingdom
565673,22112,CHOCOLATE HOT WATER BOTTLE,9,9/6/2011 9:45,4.95,14441,United Kingdom
565674,23393,HOME SWEET HOME CUSHION COVER ,4,9/6/2011 9:49,3.75,15271,United Kingdom
565674,23395,BELLE JARDINIERE CUSHION COVER,4,9/6/2011 9:49,3.75,15271,United Kingdom
565674,23234,BISCUIT TIN VINTAGE CHRISTMAS,6,9/6/2011 9:49,2.89,15271,United Kingdom
565674,23270,SET OF 2 CERAMIC PAINTED HEARTS ,12,9/6/2011 9:49,1.45,15271,United Kingdom
565674,23427,STOOL HOME SWEET HOME ,2,9/6/2011 9:49,12.5,15271,United Kingdom
565674,23407,SET OF 2 TRAYS HOME SWEET HOME,2,9/6/2011 9:49,9.95,15271,United Kingdom
565674,23425,STORAGE TIN HOME SWEET HOME,6,9/6/2011 9:49,2.49,15271,United Kingdom
565674,23399,HOME SWEET HOME HANGING HEART,12,9/6/2011 9:49,0.85,15271,United Kingdom
565674,23403,LETTER HOLDER HOME SWEET HOME,4,9/6/2011 9:49,3.75,15271,United Kingdom
565674,23405,HOME SWEET HOME 2 DRAWER CABINET,4,9/6/2011 9:49,4.95,15271,United Kingdom
565674,23406,HOME SWEET HOME KEY HOLDER,2,9/6/2011 9:49,6.25,15271,United Kingdom
565674,22865,HAND WARMER OWL DESIGN,12,9/6/2011 9:49,2.1,15271,United Kingdom
565674,22114,HOT WATER BOTTLE TEA AND SYMPATHY,4,9/6/2011 9:49,4.25,15271,United Kingdom
565675,21754,HOME BUILDING BLOCK WORD,3,9/6/2011 9:51,5.95,15513,United Kingdom
565675,21114,LAVENDER SCENTED FABRIC HEART,40,9/6/2011 9:51,1.25,15513,United Kingdom
565675,22725,ALARM CLOCK BAKELIKE CHOCOLATE,4,9/6/2011 9:51,3.75,15513,United Kingdom
565675,22727,ALARM CLOCK BAKELIKE RED ,8,9/6/2011 9:51,3.75,15513,United Kingdom
565675,22699,ROSES REGENCY TEACUP AND SAUCER ,6,9/6/2011 9:51,2.95,15513,United Kingdom
565675,22697,GREEN REGENCY TEACUP AND SAUCER,6,9/6/2011 9:51,2.95,15513,United Kingdom
565675,22624,IVORY KITCHEN SCALES,12,9/6/2011 9:51,7.65,15513,United Kingdom
565675,22605,WOODEN CROQUET GARDEN SET,8,9/6/2011 9:51,12.75,15513,United Kingdom
565675,22441,GROW YOUR OWN BASIL IN ENAMEL MUG,16,9/6/2011 9:51,2.1,15513,United Kingdom
565675,23208,LUNCH BAG VINTAGE LEAF DESIGN,20,9/6/2011 9:51,1.65,15513,United Kingdom
565675,82483,WOOD 2 DRAWER CABINET WHITE FINISH,16,9/6/2011 9:51,5.95,15513,United Kingdom
565675,22766,PHOTO FRAME CORNICE,48,9/6/2011 9:51,2.55,15513,United Kingdom
565675,22767,TRIPLE PHOTO FRAME CORNICE ,16,9/6/2011 9:51,8.5,15513,United Kingdom
565675,23209,LUNCH BAG VINTAGE DOILY ,20,9/6/2011 9:51,1.65,15513,United Kingdom
565675,22698,PINK REGENCY TEACUP AND SAUCER,6,9/6/2011 9:51,2.95,15513,United Kingdom
565675,22726,ALARM CLOCK BAKELIKE GREEN,8,9/6/2011 9:51,3.75,15513,United Kingdom
565675,23245,SET OF 3 REGENCY CAKE TINS,16,9/6/2011 9:51,4.15,15513,United Kingdom
565675,21497,FANCY FONTS BIRTHDAY WRAP,25,9/6/2011 9:51,0.42,15513,United Kingdom
565675,23232,WRAP VINTAGE LEAF DESIGN,25,9/6/2011 9:51,0.42,15513,United Kingdom
565675,71477,COLOUR GLASS. STAR T-LIGHT HOLDER,24,9/6/2011 9:51,2.75,15513,United Kingdom
565675,23075,PARLOUR CERAMIC WALL HOOK,8,9/6/2011 9:51,4.15,15513,United Kingdom
565675,23046,PAPER LANTERN 9 POINT DELUXE STAR,20,9/6/2011 9:51,6.65,15513,United Kingdom
565675,23070,EDWARDIAN HEART PHOTO FRAME,4,9/6/2011 9:51,4.15,15513,United Kingdom
565675,22792,FLUTED ANTIQUE CANDLE HOLDER,12,9/6/2011 9:51,0.85,15513,United Kingdom
565675,23066,SMALL DECO JEWELLERY STAND,24,9/6/2011 9:51,7.45,15513,United Kingdom
565675,23065,LARGE DECO JEWELLERY STAND,24,9/6/2011 9:51,11.15,15513,United Kingdom
565675,21916,SET 12 RETRO WHITE CHALK STICKS,48,9/6/2011 9:51,0.42,15513,United Kingdom
565675,22456,NATURAL SLATE CHALKBOARD LARGE ,18,9/6/2011 9:51,4.25,15513,United Kingdom
565675,82484,WOOD BLACK BOARD ANT WHITE FINISH,12,9/6/2011 9:51,6.75,15513,United Kingdom
565675,22191,IVORY DINER WALL CLOCK,2,9/6/2011 9:51,8.5,15513,United Kingdom
565675,22721,SET OF 3 CAKE TINS SKETCHBOOK,6,9/6/2011 9:51,4.95,15513,United Kingdom
565675,22665,RECIPE BOX BLUE SKETCHBOOK DESIGN,6,9/6/2011 9:51,2.95,15513,United Kingdom
565675,22666,RECIPE BOX PANTRY YELLOW DESIGN,6,9/6/2011 9:51,2.95,15513,United Kingdom
565675,21407,BROWN CHECK CAT DOORSTOP ,16,9/6/2011 9:51,3.75,15513,United Kingdom
565675,23168,CLASSIC CAFE SUGAR DISPENSER,12,9/6/2011 9:51,1.25,15513,United Kingdom
565675,85123A,WHITE HANGING HEART T-LIGHT HOLDER,32,9/6/2011 9:51,2.55,15513,United Kingdom
565675,23173,REGENCY TEAPOT ROSES ,12,9/6/2011 9:51,8.15,15513,United Kingdom
565675,23109,PACK OF SIX LED TEA LIGHTS,12,9/6/2011 9:51,2.89,15513,United Kingdom
565676,23350,ROLL WRAP VINTAGE SPOT ,72,9/6/2011 9:53,1.04,15513,United Kingdom
565676,23393,HOME SWEET HOME CUSHION COVER ,4,9/6/2011 9:53,3.75,15513,United Kingdom
565676,23395,BELLE JARDINIERE CUSHION COVER,4,9/6/2011 9:53,3.75,15513,United Kingdom
565676,23412,HEART MIRROR ANTIQUE WHITE,2,9/6/2011 9:53,7.5,15513,United Kingdom
565676,23356,LOVE HOT WATER BOTTLE,24,9/6/2011 9:53,4.95,15513,United Kingdom
565677,21731,RED TOADSTOOL LED NIGHT LIGHT,12,9/6/2011 10:04,1.65,15521,United Kingdom
565677,22332,SKULLS PARTY BAG + STICKER SET,8,9/6/2011 10:04,1.65,15521,United Kingdom
565677,22333,RETROSPOT PARTY BAG + STICKER SET,8,9/6/2011 10:04,1.65,15521,United Kingdom
565677,23201,JUMBO BAG ALPHABET,10,9/6/2011 10:04,2.08,15521,United Kingdom
565677,23203,JUMBO BAG VINTAGE DOILY ,10,9/6/2011 10:04,2.08,15521,United Kingdom
565677,20749,ASSORTED COLOUR MINI CASES,2,9/6/2011 10:04,7.95,15521,United Kingdom
565677,23445,ICE CREAM BUBBLES,20,9/6/2011 10:04,0.83,15521,United Kingdom
565677,21915,RED  HARMONICA IN BOX ,12,9/6/2011 10:04,1.25,15521,United Kingdom
565677,22622,BOX OF VINTAGE ALPHABET BLOCKS,2,9/6/2011 10:04,11.95,15521,United Kingdom
565677,23254,CHILDRENS CUTLERY DOLLY GIRL ,4,9/6/2011 10:04,4.15,15521,United Kingdom
565677,23256,CHILDRENS CUTLERY SPACEBOY ,4,9/6/2011 10:04,4.15,15521,United Kingdom
565678,21891,TRADITIONAL WOODEN SKIPPING ROPE,12,9/6/2011 10:04,1.45,15521,United Kingdom
565679,21621,VINTAGE UNION JACK BUNTING,10,9/6/2011 10:12,8.5,15199,United Kingdom
565679,47590A,BLUE HAPPY BIRTHDAY BUNTING,9,9/6/2011 10:12,5.45,15199,United Kingdom
565679,47590B,PINK HAPPY BIRTHDAY BUNTING,9,9/6/2011 10:12,5.45,15199,United Kingdom
565679,22668,PINK BABY BUNTING,50,9/6/2011 10:12,2.55,15199,United Kingdom
565680,21213,PACK OF 72 SKULL CAKE CASES,240,9/6/2011 10:27,0.42,14560,United Kingdom
565682,21175,GIN + TONIC DIET METAL SIGN,24,9/6/2011 10:42,2.55,14796,United Kingdom
565682,21166,COOK WITH WINE METAL SIGN ,24,9/6/2011 10:42,2.08,14796,United Kingdom
565682,21165,BEWARE OF THE CAT METAL SIGN ,24,9/6/2011 10:42,1.69,14796,United Kingdom
565682,85152,HAND OVER THE CHOCOLATE   SIGN ,12,9/6/2011 10:42,2.1,14796,United Kingdom
565682,21908,CHOCOLATE THIS WAY METAL SIGN,12,9/6/2011 10:42,2.1,14796,United Kingdom
565682,21903,MAN FLU METAL SIGN,12,9/6/2011 10:42,2.1,14796,United Kingdom
565682,82567,"AIRLINE LOUNGE,METAL SIGN",6,9/6/2011 10:42,2.1,14796,United Kingdom
565682,21166,COOK WITH WINE METAL SIGN ,10,9/6/2011 10:42,2.08,14796,United Kingdom
565682,21181,PLEASE ONE PERSON METAL SIGN,2,9/6/2011 10:42,2.1,14796,United Kingdom
565682,85152,HAND OVER THE CHOCOLATE   SIGN ,9,9/6/2011 10:42,2.1,14796,United Kingdom
565682,21907,I'M ON HOLIDAY METAL SIGN,24,9/6/2011 10:42,2.1,14796,United Kingdom
565682,82600,NO SINGING METAL SIGN,24,9/6/2011 10:42,2.1,14796,United Kingdom
565682,82582,AREA PATROLLED METAL SIGN,36,9/6/2011 10:42,2.1,14796,United Kingdom
565682,82583,HOT BATHS METAL SIGN,48,9/6/2011 10:42,2.1,14796,United Kingdom
565682,37449,CERAMIC CAKE STAND + HANGING CAKES,1,9/6/2011 10:42,9.95,14796,United Kingdom
565682,23307,SET OF 60 PANTRY DESIGN CAKE CASES ,4,9/6/2011 10:42,0.55,14796,United Kingdom
565682,21977,PACK OF 60 PINK PAISLEY CAKE CASES,4,9/6/2011 10:42,0.55,14796,United Kingdom
565682,23309,SET OF 60 I LOVE LONDON CAKE CASES ,4,9/6/2011 10:42,0.55,14796,United Kingdom
565682,21213,PACK OF 72 SKULL CAKE CASES,4,9/6/2011 10:42,0.55,14796,United Kingdom
565682,21774,DECORATIVE CATS BATHROOM BOTTLE,1,9/6/2011 10:42,1.25,14796,United Kingdom
565682,21700,BIG DOUGHNUT FRIDGE MAGNETS,6,9/6/2011 10:42,0.85,14796,United Kingdom
565682,35965,FOLKART HEART NAPKIN RINGS,6,9/6/2011 10:42,0.79,14796,United Kingdom
565682,22064,PINK DOUGHNUT TRINKET POT ,2,9/6/2011 10:42,1.65,14796,United Kingdom
565682,23236,STORAGE TIN VINTAGE DOILY ,1,9/6/2011 10:42,2.89,14796,United Kingdom
565682,23239,SET OF 4 KNICK KNACK TINS POPPIES,1,9/6/2011 10:42,4.15,14796,United Kingdom
565682,37500,TEA TIME TEAPOT IN GIFT BOX,2,9/6/2011 10:42,4.95,14796,United Kingdom
565682,23240,SET OF 4 KNICK KNACK TINS DOILY ,1,9/6/2011 10:42,4.15,14796,United Kingdom
565682,22900,SET 2 TEA TOWELS I LOVE LONDON ,3,9/6/2011 10:42,3.25,14796,United Kingdom
565682,37450,CERAMIC CAKE BOWL + HANGING CAKES,2,9/6/2011 10:42,2.95,14796,United Kingdom
565682,47559B,TEA TIME OVEN GLOVE,6,9/6/2011 10:42,1.25,14796,United Kingdom
565682,22629,SPACEBOY LUNCH BOX ,2,9/6/2011 10:42,1.95,14796,United Kingdom
565682,22630,DOLLY GIRL LUNCH BOX,2,9/6/2011 10:42,1.95,14796,United Kingdom
565682,22659,LUNCH BOX I LOVE LONDON,1,9/6/2011 10:42,1.95,14796,United Kingdom
565682,21231,SWEETHEART CERAMIC TRINKET BOX,8,9/6/2011 10:42,1.25,14796,United Kingdom
565682,21232,STRAWBERRY CERAMIC TRINKET BOX,4,9/6/2011 10:42,1.25,14796,United Kingdom
565682,23077,DOUGHNUT LIP GLOSS ,20,9/6/2011 10:42,1.25,14796,United Kingdom
565682,85123A,WHITE HANGING HEART T-LIGHT HOLDER,2,9/6/2011 10:42,2.95,14796,United Kingdom
565682,21733,RED HANGING HEART T-LIGHT HOLDER,2,9/6/2011 10:42,2.95,14796,United Kingdom
565682,22398,MAGNETS PACK OF 4 SWALLOWS,12,9/6/2011 10:42,0.39,14796,United Kingdom
565682,85111,SILVER GLITTER FLOWER VOTIVE HOLDER,12,9/6/2011 10:42,0.29,14796,United Kingdom
565682,22968,ROSE COTTAGE KEEPSAKE BOX ,1,9/6/2011 10:42,9.95,14796,United Kingdom
565682,84596G,SMALL CHOCOLATES PINK BOWL,8,9/6/2011 10:42,0.42,14796,United Kingdom
565682,21340,CLASSIC METAL BIRDCAGE PLANT HOLDER,1,9/6/2011 10:42,12.75,14796,United Kingdom
565682,35646,VINTAGE BEAD PINK EVENING BAG,5,9/6/2011 10:42,1.25,14796,United Kingdom
565682,35651,VINTAGE BEAD PINK SCARF ,7,9/6/2011 10:42,1.65,14796,United Kingdom
565682,23236,STORAGE TIN VINTAGE DOILY ,1,9/6/2011 10:42,2.89,14796,United Kingdom
565682,22123,PING MICROWAVE APRON,4,9/6/2011 10:42,1.95,14796,United Kingdom
565682,47593B,SCOTTIE DOGS BABY BIB,6,9/6/2011 10:42,0.39,14796,United Kingdom
565682,23280,FOLDING BUTTERFLY MIRROR HOT PINK ,1,9/6/2011 10:42,0.83,14796,United Kingdom
565682,23281,FOLDING BUTTERFLY MIRROR RED  ,1,9/6/2011 10:42,0.83,14796,United Kingdom
565682,23282,FOLDING BUTTERFLY MIRROR IVORY ,1,9/6/2011 10:42,0.83,14796,United Kingdom
565682,84596B,SMALL DOLLY MIX DESIGN ORANGE BOWL,16,9/6/2011 10:42,0.42,14796,United Kingdom
565682,84596F,SMALL MARSHMALLOWS PINK BOWL,16,9/6/2011 10:42,0.42,14796,United Kingdom
565682,22396,MAGNETS PACK OF 4 RETRO PHOTO,6,9/6/2011 10:42,0.39,14796,United Kingdom
565682,23392,SPACEBOY ROCKET LOLLY MAKERS,1,9/6/2011 10:42,2.08,14796,United Kingdom
