567239,22725,ALARM CLOCK BAKELIKE CHOCOLATE,12,9/19/2011 11:33,3.75,14735,United Kingdom
567239,22727,ALARM CLOCK BAKELIKE RED ,4,9/19/2011 11:33,3.75,14735,United Kingdom
567239,22728,ALARM CLOCK BAKELIKE PINK,4,9/19/2011 11:33,3.75,14735,United Kingdom
567239,22730,ALARM CLOCK BAKELIKE IVORY,12,9/19/2011 11:33,3.75,14735,United Kingdom
567252,23333,IVORY WICKER HEART MEDIUM,24,9/19/2011 11:37,1.25,13695,United Kingdom
567252,23215,JINGLE BELL HEART ANTIQUE SILVER,12,9/19/2011 11:37,2.08,13695,United Kingdom
567252,22178,VICTORIAN GLASS HANGING T-LIGHT,96,9/19/2011 11:37,1.65,13695,United Kingdom
567252,84978,HANGING HEART JAR T-LIGHT HOLDER,12,9/19/2011 11:37,1.25,13695,United Kingdom
567252,84945,MULTI COLOUR SILVER T-LIGHT HOLDER,12,9/19/2011 11:37,0.85,13695,United Kingdom
567252,84947,ANTIQUE SILVER TEA GLASS ENGRAVED,72,9/19/2011 11:37,1.06,13695,United Kingdom
567252,23444,Next Day Carriage,1,9/19/2011 11:37,15,13695,United Kingdom
567280,21509,COWBOYS AND INDIANS BIRTHDAY CARD ,72,9/19/2011 11:46,0.36,14646,Netherlands
567280,21731,RED TOADSTOOL LED NIGHT LIGHT,288,9/19/2011 11:46,1.45,14646,Netherlands
567280,22029,SPACEBOY BIRTHDAY CARD,144,9/19/2011 11:46,0.36,14646,Netherlands
567280,23082,SET 6 PAPER TABLE LANTERN HEARTS ,96,9/19/2011 11:46,3.29,14646,Netherlands
567280,23083,SET 6 PAPER TABLE LANTERN STARS ,96,9/19/2011 11:46,3.29,14646,Netherlands
567280,23100,SILVER BELLS TABLE DECORATION,72,9/19/2011 11:46,1.04,14646,Netherlands
567280,23101,SILVER STARS TABLE DECORATION,72,9/19/2011 11:46,0.72,14646,Netherlands
567280,23102,SILVER HEARTS TABLE DECORATION,72,9/19/2011 11:46,0.72,14646,Netherlands
567280,23126,FELTCRAFT GIRL AMELIE KIT,40,9/19/2011 11:46,4.15,14646,Netherlands
567280,23144,ZINC T-LIGHT HOLDER STARS SMALL,144,9/19/2011 11:46,0.72,14646,Netherlands
567280,23163,REGENCY SUGAR TONGS,48,9/19/2011 11:46,2.08,14646,Netherlands
567280,23164,REGENCY CAKE SLICE,36,9/19/2011 11:46,4.15,14646,Netherlands
567280,23189,SET OF 12 FORK CANDLES,48,9/19/2011 11:46,2.49,14646,Netherlands
567280,23209,LUNCH BAG VINTAGE DOILY ,100,9/19/2011 11:46,1.45,14646,Netherlands
567280,23289,DOLLY GIRL CHILDRENS BOWL,144,9/19/2011 11:46,1.05,14646,Netherlands
567280,23290,SPACEBOY CHILDRENS BOWL,144,9/19/2011 11:46,1.05,14646,Netherlands
567280,84991,60 TEATIME FAIRY CAKE CASES,120,9/19/2011 11:46,0.42,14646,Netherlands
567280,84992,72 SWEETHEART FAIRY CAKE CASES,120,9/19/2011 11:46,0.42,14646,Netherlands
567280,84997D,CHILDRENS CUTLERY POLKADOT PINK,72,9/19/2011 11:46,3.75,14646,Netherlands
567280,85099B,JUMBO BAG RED RETROSPOT,100,9/19/2011 11:46,1.79,14646,Netherlands
567280,21390,FILIGRIS HEART WITH BUTTERFLY,288,9/19/2011 11:46,1.06,14646,Netherlands
567280,22294,HEART FILIGREE DOVE  SMALL,288,9/19/2011 11:46,1.06,14646,Netherlands
567280,22964,3 PIECE SPACEBOY COOKIE CUTTER SET,144,9/19/2011 11:46,1.85,14646,Netherlands
567280,21559,STRAWBERRY LUNCH BOX WITH CUTLERY,60,9/19/2011 11:46,2.1,14646,Netherlands
567280,22244,3 HOOK HANGER MAGIC GARDEN,92,9/19/2011 11:46,1.95,14646,Netherlands
567280,22423,REGENCY CAKESTAND 3 TIER,16,9/19/2011 11:46,10.95,14646,Netherlands
567280,22662,LUNCH BAG DOLLY GIRL DESIGN,100,9/19/2011 11:46,1.45,14646,Netherlands
567280,20724,RED RETROSPOT CHARLOTTE BAG,100,9/19/2011 11:46,0.72,14646,Netherlands
567280,22697,GREEN REGENCY TEACUP AND SAUCER,24,9/19/2011 11:46,2.55,14646,Netherlands
567280,22848,BREAD BIN DINER STYLE PINK,4,9/19/2011 11:46,14.95,14646,Netherlands
567280,22847,BREAD BIN DINER STYLE IVORY,8,9/19/2011 11:46,14.95,14646,Netherlands
567280,22557,PLASTERS IN TIN VINTAGE PAISLEY ,96,9/19/2011 11:46,1.45,14646,Netherlands
567280,22629,SPACEBOY LUNCH BOX ,192,9/19/2011 11:46,1.65,14646,Netherlands
567280,22630,DOLLY GIRL LUNCH BOX,192,9/19/2011 11:46,1.65,14646,Netherlands
567280,23293,SET OF 12 FAIRY CAKE BAKING CASES,128,9/19/2011 11:46,0.72,14646,Netherlands
567280,22131,FOOD CONTAINER SET 3 LOVE HEART ,72,9/19/2011 11:46,1.65,14646,Netherlands
567280,22149,FELTCRAFT 6 FLOWER FRIENDS,40,9/19/2011 11:46,1.85,14646,Netherlands
567280,22326,ROUND SNACK BOXES SET OF4 WOODLAND ,96,9/19/2011 11:46,2.55,14646,Netherlands
567280,22328,ROUND SNACK BOXES SET OF 4 FRUITS ,48,9/19/2011 11:46,2.55,14646,Netherlands
567280,22382,LUNCH BAG SPACEBOY DESIGN ,100,9/19/2011 11:46,1.45,14646,Netherlands
567280,22383,LUNCH BAG SUKI DESIGN ,100,9/19/2011 11:46,1.45,14646,Netherlands
567280,22385,JUMBO BAG SPACEBOY DESIGN,100,9/19/2011 11:46,1.79,14646,Netherlands
567280,22386,JUMBO BAG PINK POLKADOT,100,9/19/2011 11:46,1.79,14646,Netherlands
567280,22411,JUMBO SHOPPER VINTAGE RED PAISLEY,100,9/19/2011 11:46,1.79,14646,Netherlands
567280,22418,10 COLOUR SPACEBOY PEN,144,9/19/2011 11:46,0.72,14646,Netherlands
567280,22467,GUMBALL COAT RACK,108,9/19/2011 11:46,2.1,14646,Netherlands
567280,22505,MEMO BOARD COTTAGE DESIGN,48,9/19/2011 11:46,4.25,14646,Netherlands
567280,22551,PLASTERS IN TIN SPACEBOY,96,9/19/2011 11:46,1.45,14646,Netherlands
567280,22553,PLASTERS IN TIN SKULLS,96,9/19/2011 11:46,1.45,14646,Netherlands
567280,22554,PLASTERS IN TIN WOODLAND ANIMALS,96,9/19/2011 11:46,1.45,14646,Netherlands
567280,22556,PLASTERS IN TIN CIRCUS PARADE ,96,9/19/2011 11:46,1.45,14646,Netherlands
567280,22699,ROSES REGENCY TEACUP AND SAUCER ,24,9/19/2011 11:46,2.55,14646,Netherlands
567280,22712,CARD DOLLY GIRL ,144,9/19/2011 11:46,0.36,14646,Netherlands
567280,22908,PACK OF 20 NAPKINS RED APPLES,96,9/19/2011 11:46,0.72,14646,Netherlands
567280,22352,LUNCH BOX WITH CUTLERY RETROSPOT ,120,9/19/2011 11:46,2.1,14646,Netherlands
567280,22142,CHRISTMAS CRAFT WHITE FAIRY ,40,9/19/2011 11:46,1.25,14646,Netherlands
567280,20712,JUMBO BAG WOODLAND ANIMALS,100,9/19/2011 11:46,1.79,14646,Netherlands
567280,20713,JUMBO BAG OWLS,100,9/19/2011 11:46,1.79,14646,Netherlands
567280,20719,WOODLAND CHARLOTTE BAG,200,9/19/2011 11:46,0.72,14646,Netherlands
567280,20725,LUNCH BAG RED RETROSPOT,200,9/19/2011 11:46,1.45,14646,Netherlands
567280,20726,LUNCH BAG WOODLAND,200,9/19/2011 11:46,1.45,14646,Netherlands
567280,20727,LUNCH BAG  BLACK SKULL.,100,9/19/2011 11:46,1.45,14646,Netherlands
567280,20728,LUNCH BAG CARS BLUE,100,9/19/2011 11:46,1.45,14646,Netherlands
567280,20979,36 PENCILS TUBE RED RETROSPOT,128,9/19/2011 11:46,1.06,14646,Netherlands
567280,21213,PACK OF 72 SKULL CAKE CASES,120,9/19/2011 11:46,0.42,14646,Netherlands
567280,21558,SKULL LUNCH BOX WITH CUTLERY ,60,9/19/2011 11:46,2.1,14646,Netherlands
567287,23298,SPOTTY BUNTING,3,9/19/2011 11:49,4.95,18232,United Kingdom
567287,22668,PINK BABY BUNTING,5,9/19/2011 11:49,2.95,18232,United Kingdom
567287,22138,BAKING SET 9 PIECE RETROSPOT ,3,9/19/2011 11:49,4.95,18232,United Kingdom
567287,22470,HEART OF WICKER LARGE,12,9/19/2011 11:49,2.95,18232,United Kingdom
567287,23108,SET OF 10 LED DOLLY LIGHTS,2,9/19/2011 11:49,6.25,18232,United Kingdom
567288,48187,DOORMAT NEW ENGLAND,1,9/19/2011 11:49,8.25,16906,United Kingdom
567288,20762,GREEN FERN SKETCHBOOK ,1,9/19/2011 11:49,3.75,16906,United Kingdom
567288,47599A,PINK PARTY BAGS,1,9/19/2011 11:49,2.1,16906,United Kingdom
567288,23198,PANTRY MAGNETIC  SHOPPING LIST,1,9/19/2011 11:49,1.45,16906,United Kingdom
567288,22750,FELTCRAFT PRINCESS LOLA DOLL,1,9/19/2011 11:49,3.75,16906,United Kingdom
567288,22024,RAINY LADIES BIRTHDAY CARD,12,9/19/2011 11:49,0.42,16906,United Kingdom
567288,20986,BLUE CALCULATOR RULER,1,9/19/2011 11:49,1.25,16906,United Kingdom
567288,23338,EGG FRYING PAN RED ,1,9/19/2011 11:49,2.08,16906,United Kingdom
567288,85035A,GARDENIA 3 WICK MORRIS BOXED CANDLE,2,9/19/2011 11:49,4.25,16906,United Kingdom
567288,22278,OVERNIGHT BAG VINTAGE ROSE PAISLEY,2,9/19/2011 11:49,4.95,16906,United Kingdom
567288,22989,SET 2 PANTRY DESIGN TEA TOWELS,2,9/19/2011 11:49,3.25,16906,United Kingdom
567288,21034,REX CASH+CARRY JUMBO SHOPPER,1,9/19/2011 11:49,0.95,16906,United Kingdom
567288,20728,LUNCH BAG CARS BLUE,1,9/19/2011 11:49,1.65,16906,United Kingdom
567288,22979,PANTRY WASHING UP BRUSH,2,9/19/2011 11:49,1.45,16906,United Kingdom
567288,20751,FUNKY WASHING UP GLOVES ASSORTED,1,9/19/2011 11:49,2.1,16906,United Kingdom
567288,20751,FUNKY WASHING UP GLOVES ASSORTED,1,9/19/2011 11:49,2.1,16906,United Kingdom
567288,22093,MOTORING TISSUE BOX,1,9/19/2011 11:49,0.39,16906,United Kingdom
567288,22096,PINK PAISLEY SQUARE TISSUE BOX ,1,9/19/2011 11:49,0.39,16906,United Kingdom
567288,22098,BOUDOIR SQUARE TISSUE BOX,4,9/19/2011 11:49,0.39,16906,United Kingdom
567288,85099B,JUMBO BAG RED RETROSPOT,1,9/19/2011 11:49,2.08,16906,United Kingdom
567288,21154,RED RETROSPOT OVEN GLOVE ,2,9/19/2011 11:49,1.25,16906,United Kingdom
567288,20914,SET/5 RED RETROSPOT LID GLASS BOWLS,3,9/19/2011 11:49,2.95,16906,United Kingdom
567288,22624,IVORY KITCHEN SCALES,1,9/19/2011 11:49,8.5,16906,United Kingdom
567288,22107,PIZZA PLATE IN BOX,1,9/19/2011 11:49,3.75,16906,United Kingdom
567288,22624,IVORY KITCHEN SCALES,1,9/19/2011 11:49,8.5,16906,United Kingdom
567288,21528,DAIRY MAID TRADITIONAL TEAPOT ,1,9/19/2011 11:49,6.95,16906,United Kingdom
567288,22096,PINK PAISLEY SQUARE TISSUE BOX ,1,9/19/2011 11:49,0.39,16906,United Kingdom
567288,22197,POPCORN HOLDER,6,9/19/2011 11:49,0.85,16906,United Kingdom
567288,22092,BLUE PAISLEY TISSUE BOX,1,9/19/2011 11:49,0.39,16906,United Kingdom
567288,22674,FRENCH TOILET SIGN BLUE METAL,1,9/19/2011 11:49,1.25,16906,United Kingdom
567288,22278,OVERNIGHT BAG VINTAGE ROSE PAISLEY,4,9/19/2011 11:49,4.95,16906,United Kingdom
567288,47559B,TEA TIME OVEN GLOVE,1,9/19/2011 11:49,1.25,16906,United Kingdom
567288,23190,BUNDLE OF 3 SCHOOL EXERCISE BOOKS  ,1,9/19/2011 11:49,1.65,16906,United Kingdom
567288,85099F,JUMBO BAG STRAWBERRY,2,9/19/2011 11:49,2.08,16906,United Kingdom
567288,21929,JUMBO BAG PINK VINTAGE PAISLEY,1,9/19/2011 11:49,2.08,16906,United Kingdom
567288,22024,RAINY LADIES BIRTHDAY CARD,12,9/19/2011 11:49,0.42,16906,United Kingdom
567288,23397,FOOT STOOL HOME SWEET HOME ,1,9/19/2011 11:49,9.95,16906,United Kingdom
567288,85059,FRENCH ENAMEL WATER BASIN,1,9/19/2011 11:49,3.75,16906,United Kingdom
567288,23339,EGG FRYING PAN BLUE ,1,9/19/2011 11:49,2.08,16906,United Kingdom
567288,21902,"KEY FOB , FRONT  DOOR ",1,9/19/2011 11:49,0.65,16906,United Kingdom
567288,22491,PACK OF 12 COLOURED PENCILS,2,9/19/2011 11:49,0.85,16906,United Kingdom
567288,22993,SET OF 4 PANTRY JELLY MOULDS,1,9/19/2011 11:49,1.25,16906,United Kingdom
567288,22429,ENAMEL MEASURING JUG CREAM,1,9/19/2011 11:49,4.25,16906,United Kingdom
567288,22989,SET 2 PANTRY DESIGN TEA TOWELS,1,9/19/2011 11:49,3.25,16906,United Kingdom
567288,22993,SET OF 4 PANTRY JELLY MOULDS,1,9/19/2011 11:49,1.25,16906,United Kingdom
567288,20752,BLUE POLKADOT WASHING UP GLOVES,1,9/19/2011 11:49,2.1,16906,United Kingdom
567288,21034,REX CASH+CARRY JUMBO SHOPPER,1,9/19/2011 11:49,0.95,16906,United Kingdom
567288,23286,BLUE VINTAGE SPOT BEAKER,2,9/19/2011 11:49,0.85,16906,United Kingdom
567288,23288,GREEN VINTAGE SPOT BEAKER,2,9/19/2011 11:49,0.85,16906,United Kingdom
567288,23287,RED VINTAGE SPOT BEAKER,2,9/19/2011 11:49,0.85,16906,United Kingdom
567288,23285,PINK VINTAGE SPOT BEAKER,2,9/19/2011 11:49,0.85,16906,United Kingdom
C567289,POST,POSTAGE,-1,9/19/2011 11:50,4.41,17612,United Kingdom
C567289,21137,BLACK RECORD COVER FRAME,-4,9/19/2011 11:50,3.75,17612,United Kingdom
567290,23245,SET OF 3 REGENCY CAKE TINS,48,9/19/2011 11:54,4.15,14646,Netherlands
567290,85183B,CHARLIE & LOLA WASTEPAPER BIN FLORA,48,9/19/2011 11:54,1.25,14646,Netherlands
567290,22751,FELTCRAFT PRINCESS OLIVIA DOLL,48,9/19/2011 11:54,3.39,14646,Netherlands
567290,22082,RIBBON REEL STRIPES DESIGN ,120,9/19/2011 11:54,1.45,14646,Netherlands
567290,22631,CIRCUS PARADE LUNCH BOX ,64,9/19/2011 11:54,1.65,14646,Netherlands
567290,22899,CHILDREN'S APRON DOLLY GIRL ,100,9/19/2011 11:54,1.85,14646,Netherlands
567290,22367,CHILDRENS APRON SPACEBOY DESIGN,100,9/19/2011 11:54,1.65,14646,Netherlands
567290,23345, DOLLY GIRL BEAKER,400,9/19/2011 11:54,1.08,14646,Netherlands
567290,23346,SPACEBOY BEAKER,400,9/19/2011 11:54,1.08,14646,Netherlands
567290,23292,SPACEBOY CHILDRENS CUP,96,9/19/2011 11:54,1.05,14646,Netherlands
567290,23291,DOLLY GIRL CHILDRENS CUP,96,9/19/2011 11:54,1.05,14646,Netherlands
567290,23240,SET OF 4 KNICK KNACK TINS DOILY ,96,9/19/2011 11:54,3.75,14646,Netherlands
567290,23293,SET OF 12 FAIRY CAKE BAKING CASES,256,9/19/2011 11:54,0.72,14646,Netherlands
567290,22929,SCHOOL DESK AND CHAIR ,4,9/19/2011 11:54,57.95,14646,Netherlands
567290,22826,LOVE SEAT ANTIQUE WHITE METAL,1,9/19/2011 11:54,85,14646,Netherlands
567290,22544,MINI JIGSAW SPACEBOY,240,9/19/2011 11:54,0.36,14646,Netherlands
567290,21481,FAWN BLUE HOT WATER BOTTLE,72,9/19/2011 11:54,3.39,14646,Netherlands
567290,23170,REGENCY TEA PLATE ROSES ,48,9/19/2011 11:54,1.45,14646,Netherlands
567290,22539,MINI JIGSAW DOLLY GIRL,240,9/19/2011 11:54,0.36,14646,Netherlands
567290,23171,REGENCY TEA PLATE GREEN ,48,9/19/2011 11:54,1.45,14646,Netherlands
567290,22210,WOOD STAMP SET BEST WISHES,96,9/19/2011 11:54,0.83,14646,Netherlands
567290,23172,REGENCY TEA PLATE PINK,48,9/19/2011 11:54,1.45,14646,Netherlands
567290,23424,GINGHAM RECIPE BOOK BOX,24,9/19/2011 11:54,4.15,14646,Netherlands
567290,23328,SET 6 SCHOOL MILK BOTTLES IN CRATE,48,9/19/2011 11:54,3.39,14646,Netherlands
567290,23419,HOME SWEET HOME BOTTLE ,48,9/19/2011 11:54,1.79,14646,Netherlands
567290,21212,PACK OF 72 RETROSPOT CAKE CASES,240,9/19/2011 11:54,0.42,14646,Netherlands
567290,21975,PACK OF 60 DINOSAUR CAKE CASES,120,9/19/2011 11:54,0.42,14646,Netherlands
567290,23295,SET OF 12 MINI LOAF BAKING CASES,128,9/19/2011 11:54,0.72,14646,Netherlands
567290,23162,REGENCY TEA STRAINER,48,9/19/2011 11:54,3.29,14646,Netherlands
567290,22667,RECIPE BOX RETROSPOT ,24,9/19/2011 11:54,2.55,14646,Netherlands
567290,21261,GREEN GOOSE FEATHER CHRISTMAS TREE ,24,9/19/2011 11:54,2.95,14646,Netherlands
567290,72586,SET OF 6 HALLOWEEN GHOST T-LIGHTS,72,9/19/2011 11:54,0.42,14646,Netherlands
567290,21672,WHITE SPOT RED CERAMIC DRAWER KNOB,96,9/19/2011 11:54,1.25,14646,Netherlands
567290,23080,RED METAL BOX TOP SECRET,16,9/19/2011 11:54,7.5,14646,Netherlands
567290,23081,GREEN METAL BOX ARMY SUPPLIES,16,9/19/2011 11:54,7.5,14646,Netherlands
567290,22329,ROUND CONTAINER SET OF 5 RETROSPOT,48,9/19/2011 11:54,1.45,14646,Netherlands
567290,22749,FELTCRAFT PRINCESS CHARLOTTE DOLL,48,9/19/2011 11:54,3.39,14646,Netherlands
567290,22750,FELTCRAFT PRINCESS LOLA DOLL,48,9/19/2011 11:54,3.39,14646,Netherlands
567291,22215,CAKE STAND WHITE TWO TIER LACE,4,9/19/2011 11:55,8.5,12527,Germany
567291,22222,CAKE PLATE LOVEBIRD WHITE,3,9/19/2011 11:55,4.95,12527,Germany
567291,23319,BOX OF 6 MINI 50'S CRACKERS,6,9/19/2011 11:55,2.49,12527,Germany
567292,37500,TEA TIME TEAPOT IN GIFT BOX,1,9/19/2011 11:59,4.95,14606,United Kingdom
567292,21901,"KEY FOB , BACK DOOR ",1,9/19/2011 11:59,0.65,14606,United Kingdom
567292,21755,LOVE BUILDING BLOCK WORD,1,9/19/2011 11:59,6.25,14606,United Kingdom
567292,21928,JUMBO BAG SCANDINAVIAN BLUE PAISLEY,1,9/19/2011 11:59,2.08,14606,United Kingdom
567292,21640,ASSORTED TUTTI FRUTTI  FOB NOTEBOOK,1,9/19/2011 11:59,0.85,14606,United Kingdom
567292,22563,HAPPY STENCIL CRAFT,1,9/19/2011 11:59,1.25,14606,United Kingdom
567292,85114C,RED ENCHANTED FOREST PLACEMAT,1,9/19/2011 11:59,1.65,14606,United Kingdom
567292,20718,RED RETROSPOT SHOPPER BAG,1,9/19/2011 11:59,1.25,14606,United Kingdom
567292,22896,PEG BAG APPLES DESIGN,2,9/19/2011 11:59,2.55,14606,United Kingdom
567292,22571,ROCKING HORSE RED CHRISTMAS ,1,9/19/2011 11:59,0.85,14606,United Kingdom
567292,21705,BAG 500g SWIRLY MARBLES,1,9/19/2011 11:59,1.65,14606,United Kingdom
567292,21462,"NURSERY A,B,C PAINTED LETTERS",1,9/19/2011 11:59,6.75,14606,United Kingdom
567292,21463,MIRRORED DISCO BALL ,1,9/19/2011 11:59,5.95,14606,United Kingdom
567292,21464,DISCO BALL ROTATOR BATTERY OPERATED,1,9/19/2011 11:59,4.25,14606,United Kingdom
567292,21666,RIDGED GLASS T-LIGHT HOLDER,3,9/19/2011 11:59,0.65,14606,United Kingdom
567292,22431,WATERING CAN BLUE ELEPHANT,1,9/19/2011 11:59,1.95,14606,United Kingdom
567293,21535,RED RETROSPOT SMALL MILK JUG,6,9/19/2011 12:01,2.55,12640,France
567293,21531,RED RETROSPOT SUGAR JAM BOWL,6,9/19/2011 12:01,2.55,12640,France
567293,22072,RED RETROSPOT TEA CUP AND SAUCER ,4,9/19/2011 12:01,3.75,12640,France
567293,22348,TEA BAG PLATE RED RETROSPOT,12,9/19/2011 12:01,0.85,12640,France
567293,23174,REGENCY SUGAR BOWL GREEN,4,9/19/2011 12:01,4.15,12640,France
567293,23175,REGENCY MILK JUG PINK ,4,9/19/2011 12:01,3.25,12640,France
567293,22847,BREAD BIN DINER STYLE IVORY,2,9/19/2011 12:01,16.95,12640,France
567293,22645,CERAMIC HEART FAIRY CAKE MONEY BANK,12,9/19/2011 12:01,1.45,12640,France
567293,21703,BAG 125g SWIRLY MARBLES,12,9/19/2011 12:01,0.42,12640,France
567293,21889,WOODEN BOX OF DOMINOES,12,9/19/2011 12:01,1.25,12640,France
567293,21890,S/6 WOODEN SKITTLES IN COTTON BAG,6,9/19/2011 12:01,3.25,12640,France
567293,21891,TRADITIONAL WOODEN SKIPPING ROPE,12,9/19/2011 12:01,1.45,12640,France
567293,22619,SET OF 6 SOLDIER SKITTLES,4,9/19/2011 12:01,3.75,12640,France
567293,23101,SILVER STARS TABLE DECORATION,12,9/19/2011 12:01,0.83,12640,France
567293,22961,JAM MAKING SET PRINTED,12,9/19/2011 12:01,1.45,12640,France
567293,22727,ALARM CLOCK BAKELIKE RED ,4,9/19/2011 12:01,3.75,12640,France
567293,22730,ALARM CLOCK BAKELIKE IVORY,4,9/19/2011 12:01,3.75,12640,France
567293,22726,ALARM CLOCK BAKELIKE GREEN,4,9/19/2011 12:01,3.75,12640,France
567293,22192,BLUE DINER WALL CLOCK,2,9/19/2011 12:01,8.5,12640,France
567293,22191,IVORY DINER WALL CLOCK,2,9/19/2011 12:01,8.5,12640,France
567293,22193,RED DINER WALL CLOCK,2,9/19/2011 12:01,8.5,12640,France
567293,22467,GUMBALL COAT RACK,6,9/19/2011 12:01,2.55,12640,France
567293,22423,REGENCY CAKESTAND 3 TIER,3,9/19/2011 12:01,12.75,12640,France
567293,22697,GREEN REGENCY TEACUP AND SAUCER,6,9/19/2011 12:01,2.95,12640,France
567293,23160,REGENCY TEA SPOON,12,9/19/2011 12:01,1.25,12640,France
567293,22698,PINK REGENCY TEACUP AND SAUCER,6,9/19/2011 12:01,2.95,12640,France
567293,23161,REGENCY CAKE FORK,12,9/19/2011 12:01,1.25,12640,France
567293,23164,REGENCY CAKE SLICE,4,9/19/2011 12:01,4.95,12640,France
567293,22699,ROSES REGENCY TEACUP AND SAUCER ,6,9/19/2011 12:01,2.95,12640,France
567293,22624,IVORY KITCHEN SCALES,2,9/19/2011 12:01,8.5,12640,France
567293,23319,BOX OF 6 MINI 50'S CRACKERS,6,9/19/2011 12:01,2.49,12640,France
567293,22785,SQUARECUSHION COVER PINK UNION JACK,2,9/19/2011 12:01,6.75,12640,France
567293,21622,VINTAGE UNION JACK CUSHION COVER,4,9/19/2011 12:01,4.95,12640,France
567293,48138,DOORMAT UNION FLAG,2,9/19/2011 12:01,8.25,12640,France
567293,22207,FRYING PAN UNION FLAG,4,9/19/2011 12:01,4.25,12640,France
567293,22377,BOTTLE BAG RETROSPOT ,5,9/19/2011 12:01,2.1,12640,France
567293,22379,RECYCLING BAG RETROSPOT ,5,9/19/2011 12:01,2.1,12640,France
567293,23343,JUMBO BAG VINTAGE CHRISTMAS ,10,9/19/2011 12:01,2.08,12640,France
567293,20749,ASSORTED COLOUR MINI CASES,2,9/19/2011 12:01,7.95,12640,France
567293,21485,RETROSPOT HEART HOT WATER BOTTLE,3,9/19/2011 12:01,4.95,12640,France
567293,22111,SCOTTIE DOG HOT WATER BOTTLE,3,9/19/2011 12:01,4.95,12640,France
567293,POST,POSTAGE,5,9/19/2011 12:01,18,12640,France
567294,23245,SET OF 3 REGENCY CAKE TINS,4,9/19/2011 12:06,4.95,13774,United Kingdom
567294,22720,SET OF 3 CAKE TINS PANTRY DESIGN ,3,9/19/2011 12:06,4.95,13774,United Kingdom
567294,22840,ROUND CAKE TIN VINTAGE RED,2,9/19/2011 12:06,7.95,13774,United Kingdom
567294,22839,3 TIER CAKE TIN GREEN AND CREAM,1,9/19/2011 12:06,14.95,13774,United Kingdom
567294,23240,SET OF 4 KNICK KNACK TINS DOILY ,6,9/19/2011 12:06,4.15,13774,United Kingdom
567294,21977,PACK OF 60 PINK PAISLEY CAKE CASES,24,9/19/2011 12:06,0.55,13774,United Kingdom
567294,21974,SET OF 36 PAISLEY FLOWER DOILIES,12,9/19/2011 12:06,1.45,13774,United Kingdom
567294,22082,RIBBON REEL STRIPES DESIGN ,10,9/19/2011 12:06,1.65,13774,United Kingdom
567294,23394,POSTE FRANCE CUSHION COVER,4,9/19/2011 12:06,3.75,13774,United Kingdom
567294,23393,HOME SWEET HOME CUSHION COVER ,4,9/19/2011 12:06,3.75,13774,United Kingdom
567294,23396,LA JARDIN BOTANIQUE CUSHION COVER,4,9/19/2011 12:06,3.75,13774,United Kingdom
567294,23312,VINTAGE CHRISTMAS GIFT SACK,4,9/19/2011 12:06,4.15,13774,United Kingdom
567294,22950,36 DOILIES VINTAGE CHRISTMAS,12,9/19/2011 12:06,1.45,13774,United Kingdom
567294,22910,PAPER CHAIN KIT VINTAGE CHRISTMAS,6,9/19/2011 12:06,2.95,13774,United Kingdom
567294,22945,CHRISTMAS METAL TAGS ASSORTED ,12,9/19/2011 12:06,0.85,13774,United Kingdom
567294,22739,RIBBON REEL CHRISTMAS SOCK BAUBLE,10,9/19/2011 12:06,1.65,13774,United Kingdom
567294,22737,RIBBON REEL CHRISTMAS PRESENT ,10,9/19/2011 12:06,1.65,13774,United Kingdom
567294,22952,60 CAKE CASES VINTAGE CHRISTMAS,24,9/19/2011 12:06,0.55,13774,United Kingdom
567294,22909,SET OF 20 VINTAGE CHRISTMAS NAPKINS,12,9/19/2011 12:06,0.85,13774,United Kingdom
567294,23129,HEART SHAPED HOLLY WREATH,4,9/19/2011 12:06,4.15,13774,United Kingdom
567294,22961,JAM MAKING SET PRINTED,12,9/19/2011 12:06,1.45,13774,United Kingdom
567294,23399,HOME SWEET HOME HANGING HEART,12,9/19/2011 12:06,0.85,13774,United Kingdom
567295,22441,GROW YOUR OWN BASIL IN ENAMEL MUG,8,9/19/2011 12:16,2.1,17490,United Kingdom
567295,22922,FRIDGE MAGNETS US DINER ASSORTED,12,9/19/2011 12:16,0.85,17490,United Kingdom
567295,21470,FLOWER VINE RAFFIA FOOD COVER,6,9/19/2011 12:16,3.75,17490,United Kingdom
567295,22499,WOODEN UNION JACK BUNTING,6,9/19/2011 12:16,5.95,17490,United Kingdom
567295,21926,RED/CREAM STRIPE CUSHION COVER ,40,9/19/2011 12:16,1.06,17490,United Kingdom
567295,21927,BLUE/CREAM STRIPE CUSHION COVER ,40,9/19/2011 12:16,1.06,17490,United Kingdom
567295,21875,KINGS CHOICE MUG,12,9/19/2011 12:16,1.25,17490,United Kingdom
567295,22358,KINGS CHOICE TEA CADDY ,6,9/19/2011 12:16,2.95,17490,United Kingdom
567295,22076,6 RIBBONS EMPIRE  ,12,9/19/2011 12:16,1.65,17490,United Kingdom
567295,22077,6 RIBBONS RUSTIC CHARM,12,9/19/2011 12:16,1.95,17490,United Kingdom
567295,22371,AIRLINE BAG VINTAGE TOKYO 78,12,9/19/2011 12:16,3.95,17490,United Kingdom
567295,21832,CHOCOLATE CALCULATOR,12,9/19/2011 12:16,1.65,17490,United Kingdom
567296,15056BL,EDWARDIAN PARASOL BLACK,6,9/19/2011 12:19,5.95,12682,France
567296,23427,STOOL HOME SWEET HOME ,2,9/19/2011 12:19,12.5,12682,France
567296,23433,HANGING QUILTED PATCHWORK APPLES,12,9/19/2011 12:19,0.83,12682,France
567296,23397,FOOT STOOL HOME SWEET HOME ,2,9/19/2011 12:19,9.95,12682,France
567296,23411, TRELLIS COAT RACK,6,9/19/2011 12:19,4.95,12682,France
567296,23445,ICE CREAM BUBBLES,20,9/19/2011 12:19,0.83,12682,France
567296,20725,LUNCH BAG RED RETROSPOT,20,9/19/2011 12:19,1.65,12682,France
567296,20726,LUNCH BAG WOODLAND,10,9/19/2011 12:19,1.65,12682,France
567296,23296,SET OF 6 TEA TIME BAKING CASES,8,9/19/2011 12:19,1.25,12682,France
567296,20750,RED RETROSPOT MINI CASES,4,9/19/2011 12:19,7.95,12682,France
567296,21210,SET OF 72 RETROSPOT PAPER  DOILIES,12,9/19/2011 12:19,1.45,12682,France
567296,20749,ASSORTED COLOUR MINI CASES,2,9/19/2011 12:19,7.95,12682,France
567296,15056N,EDWARDIAN PARASOL NATURAL,3,9/19/2011 12:19,5.95,12682,France
567296,22998,TRAVEL CARD WALLET KEEP CALM,24,9/19/2011 12:19,0.42,12682,France
567296,23004,TRAVEL CARD WALLET PANTRY,24,9/19/2011 12:19,0.42,12682,France
567296,22027,TEA PARTY BIRTHDAY CARD,12,9/19/2011 12:19,0.42,12682,France
567296,23209,LUNCH BAG VINTAGE DOILY ,10,9/19/2011 12:19,1.65,12682,France
567296,POST,POSTAGE,1,9/19/2011 12:19,18,12682,France
567297,21136,PAINTED METAL PEARS ASSORTED,8,9/19/2011 12:27,1.69,15594,United Kingdom
567297,16238,PARTY TIME PENCIL ERASERS,28,9/19/2011 12:27,0.21,15594,United Kingdom
567297,20982,12 PENCILS TALL TUBE SKULLS,12,9/19/2011 12:27,0.85,15594,United Kingdom
567297,20983,12 PENCILS TALL TUBE RED RETROSPOT,12,9/19/2011 12:27,0.85,15594,United Kingdom
567297,23355,HOT WATER BOTTLE KEEP CALM,4,9/19/2011 12:27,4.95,15594,United Kingdom
567297,23358,HOT STUFF HOT WATER BOTTLE,6,9/19/2011 12:27,3.75,15594,United Kingdom
567297,23400,SHELF WITH 4 HOOKS HOME SWEET HOME,2,9/19/2011 12:27,6.25,15594,United Kingdom
567297,23407,SET OF 2 TRAYS HOME SWEET HOME,2,9/19/2011 12:27,9.95,15594,United Kingdom
567297,23445,ICE CREAM BUBBLES,20,9/19/2011 12:27,0.83,15594,United Kingdom
567297,21710,FOLDING UMBRELLA PINKWHITE POLKADOT,4,9/19/2011 12:27,4.95,15594,United Kingdom
567297,21706,FOLDING UMBRELLA RED/WHITE POLKADOT,4,9/19/2011 12:27,4.95,15594,United Kingdom
567297,22112,CHOCOLATE HOT WATER BOTTLE,3,9/19/2011 12:27,4.95,15594,United Kingdom
567297,22114,HOT WATER BOTTLE TEA AND SYMPATHY,4,9/19/2011 12:27,4.25,15594,United Kingdom
567297,84029G,KNITTED UNION FLAG HOT WATER BOTTLE,4,9/19/2011 12:27,4.25,15594,United Kingdom
567297,22111,SCOTTIE DOG HOT WATER BOTTLE,3,9/19/2011 12:27,4.95,15594,United Kingdom
567297,84946,ANTIQUE SILVER T-LIGHT GLASS,12,9/19/2011 12:27,1.25,15594,United Kingdom
567297,23353,6 GIFT TAGS VINTAGE CHRISTMAS ,12,9/19/2011 12:27,0.83,15594,United Kingdom
567297,16169E,WRAP 50'S  CHRISTMAS,25,9/19/2011 12:27,0.42,15594,United Kingdom
567297,21498,RED RETROSPOT WRAP ,25,9/19/2011 12:27,0.42,15594,United Kingdom
567297,23232,WRAP VINTAGE LEAF DESIGN,25,9/19/2011 12:27,0.42,15594,United Kingdom
567297,23351,ROLL WRAP 50'S CHRISTMAS,12,9/19/2011 12:27,1.25,15594,United Kingdom
567297,23349,ROLL WRAP VINTAGE CHRISTMAS,12,9/19/2011 12:27,1.25,15594,United Kingdom
567297,23352,ROLL WRAP 50'S RED CHRISTMAS ,12,9/19/2011 12:27,1.25,15594,United Kingdom
567297,22737,RIBBON REEL CHRISTMAS PRESENT ,10,9/19/2011 12:27,1.65,15594,United Kingdom
567297,23434,3 RAFFIA RIBBONS 50'S CHRISTMAS ,10,9/19/2011 12:27,2.08,15594,United Kingdom
567297,23129,HEART SHAPED HOLLY WREATH,4,9/19/2011 12:27,4.15,15594,United Kingdom
567297,22960,JAM MAKING SET WITH JARS,6,9/19/2011 12:27,4.25,15594,United Kingdom
567297,21257,VICTORIAN SEWING BOX MEDIUM,2,9/19/2011 12:27,7.95,15594,United Kingdom
567297,22652,TRAVEL SEWING KIT,10,9/19/2011 12:27,1.65,15594,United Kingdom
