565617,20839,FRENCH PAISLEY CUSHION COVER ,1,9/5/2011 15:30,3.29,,United Kingdom
565617,20977,36 PENCILS TUBE WOODLAND,1,9/5/2011 15:30,2.46,,United Kingdom
565617,20978,36 PENCILS TUBE SKULLS,1,9/5/2011 15:30,2.46,,United Kingdom
565617,21028,NINJA RABBIT BLACK,1,9/5/2011 15:30,2.46,,United Kingdom
565617,21068,VINTAGE BILLBOARD LOVE/HATE MUG,2,9/5/2011 15:30,2.46,,United Kingdom
565617,21071,VINTAGE BILLBOARD DRINK ME MUG,1,9/5/2011 15:30,2.46,,United Kingdom
565617,21078,SET/20 STRAWBERRY PAPER NAPKINS ,2,9/5/2011 15:30,1.63,,United Kingdom
565617,21084,SET/6 COLLAGE PAPER CUPS,2,9/5/2011 15:30,0.83,,United Kingdom
565617,21090,SET/6 COLLAGE PAPER PLATES,2,9/5/2011 15:30,0.83,,United Kingdom
565617,21123,SET/10 IVORY POLKADOT PARTY CANDLES,4,9/5/2011 15:30,0.83,,United Kingdom
565617,21288,STRIPEY CHOCOLATE NESTING BOXES,1,9/5/2011 15:30,3.29,,United Kingdom
565617,21356,TOAST ITS - FAIRY FLOWER,2,9/5/2011 15:30,0.83,,United Kingdom
565617,21358,TOAST ITS - HAPPY BIRTHDAY,1,9/5/2011 15:30,0.83,,United Kingdom
565617,21403,BLUE EGG  SPOON,60,9/5/2011 15:30,0.42,,United Kingdom
565617,21485,RETROSPOT HEART HOT WATER BOTTLE,1,9/5/2011 15:30,10.79,,United Kingdom
565617,21650,ASSORTED TUTTI FRUTTI BRACELET,2,9/5/2011 15:30,0.83,,United Kingdom
565617,21670,BLUE SPOT CERAMIC DRAWER KNOB,2,9/5/2011 15:30,3.29,,United Kingdom
565617,21683,MEDIUM MEDINA STAMPED METAL BOWL ,1,9/5/2011 15:30,5.79,,United Kingdom
565617,21684,SMALL MEDINA STAMPED METAL BOWL ,2,9/5/2011 15:30,2.46,,United Kingdom
565617,21731,RED TOADSTOOL LED NIGHT LIGHT,1,9/5/2011 15:30,3.29,,United Kingdom
565617,21739,COSY SLIPPER SHOES SMALL GREEN,1,9/5/2011 15:30,2.46,,United Kingdom
565617,21745,GAOLERS KEYS DECORATIVE GARDEN ,1,9/5/2011 15:30,8.29,,United Kingdom
565617,21880,RED RETROSPOT TAPE,4,9/5/2011 15:30,0.42,,United Kingdom
565617,21902,"KEY FOB , FRONT  DOOR ",1,9/5/2011 15:30,1.63,,United Kingdom
565617,21916,SET 12 RETRO WHITE CHALK STICKS,1,9/5/2011 15:30,0.83,,United Kingdom
565617,21929,JUMBO BAG PINK VINTAGE PAISLEY,1,9/5/2011 15:30,4.13,,United Kingdom
565617,21930,JUMBO STORAGE BAG SKULLS,3,9/5/2011 15:30,4.13,,United Kingdom
565617,21931,JUMBO STORAGE BAG SUKI,3,9/5/2011 15:30,4.13,,United Kingdom
565617,21934,SKULL SHOULDER BAG,2,9/5/2011 15:30,1.63,,United Kingdom
565617,21935,SUKI  SHOULDER BAG,6,9/5/2011 15:30,1.63,,United Kingdom
565617,21936,RED RETROSPOT PICNIC BAG,21,9/5/2011 15:30,5.79,,United Kingdom
565617,21990,MODERN FLORAL STATIONERY SET,1,9/5/2011 15:30,2.46,,United Kingdom
565617,21992,VINTAGE PAISLEY STATIONERY SET,1,9/5/2011 15:30,2.46,,United Kingdom
565617,22035,VINTAGE CARAVAN GREETING CARD ,1,9/5/2011 15:30,0.83,,United Kingdom
565617,22076,6 RIBBONS EMPIRE  ,1,9/5/2011 15:30,1.25,,United Kingdom
565617,22099,CARAVAN SQUARE TISSUE BOX,1,9/5/2011 15:30,2.46,,United Kingdom
565617,22129,PARTY CONES CANDY DECORATION,4,9/5/2011 15:30,2.46,,United Kingdom
565617,22139,RETROSPOT TEA SET CERAMIC 11 PC ,1,9/5/2011 15:30,10.79,,United Kingdom
565617,22173,METAL 4 HOOK HANGER FRENCH CHATEAU,1,9/5/2011 15:30,5.79,,United Kingdom
565617,22174,PHOTO CUBE,1,9/5/2011 15:30,3.29,,United Kingdom
565617,22178,VICTORIAN GLASS HANGING T-LIGHT,11,9/5/2011 15:30,2.46,,United Kingdom
565617,22197,POPCORN HOLDER,3,9/5/2011 15:30,1.63,,United Kingdom
565617,22222,CAKE PLATE LOVEBIRD WHITE,1,9/5/2011 15:30,9.96,,United Kingdom
565617,22244,3 HOOK HANGER MAGIC GARDEN,2,9/5/2011 15:30,4.13,,United Kingdom
565617,22273,FELTCRAFT DOLL MOLLY,1,9/5/2011 15:30,5.79,,United Kingdom
565617,22297,HEART IVORY TRELLIS SMALL,1,9/5/2011 15:30,2.46,,United Kingdom
565617,22335,HEART DECORATION PAINTED ZINC ,1,9/5/2011 15:30,1.25,,United Kingdom
565617,22356,CHARLOTTE BAG PINK POLKADOT,2,9/5/2011 15:30,1.63,,United Kingdom
565617,22374,AIRLINE BAG VINTAGE JET SET RED,1,9/5/2011 15:30,8.29,,United Kingdom
565617,22379,RECYCLING BAG RETROSPOT ,1,9/5/2011 15:30,4.13,,United Kingdom
565617,22380,TOY TIDY SPACEBOY  ,1,9/5/2011 15:30,4.13,,United Kingdom
565617,22384,LUNCH BAG PINK POLKADOT,2,9/5/2011 15:30,4.13,,United Kingdom
565617,22411,JUMBO SHOPPER VINTAGE RED PAISLEY,3,9/5/2011 15:30,4.13,,United Kingdom
565617,22429,ENAMEL MEASURING JUG CREAM,1,9/5/2011 15:30,8.29,,United Kingdom
565617,22446,PIN CUSHION BABUSHKA PINK,2,9/5/2011 15:30,2.46,,United Kingdom
565617,22449,SILK PURSE BABUSHKA PINK,1,9/5/2011 15:30,2.46,,United Kingdom
565617,22452,MEASURING TAPE BABUSHKA PINK,5,9/5/2011 15:30,1.63,,United Kingdom
565617,22457,NATURAL SLATE HEART CHALKBOARD ,1,9/5/2011 15:30,5.79,,United Kingdom
565617,22470,HEART OF WICKER LARGE,2,9/5/2011 15:30,5.79,,United Kingdom
565617,22494,EMERGENCY FIRST AID TIN ,1,9/5/2011 15:30,2.46,,United Kingdom
565617,22556,PLASTERS IN TIN CIRCUS PARADE ,1,9/5/2011 15:30,3.29,,United Kingdom
565617,22558,CLOTHES PEGS RETROSPOT PACK 24 ,1,9/5/2011 15:30,3.29,,United Kingdom
565617,22584,PACK OF 6 PANNETONE GIFT BOXES,8,9/5/2011 15:30,4.96,,United Kingdom
565617,22607,WOODEN ROUNDERS GARDEN SET ,2,9/5/2011 15:30,8.29,,United Kingdom
565617,22609,PENS ASSORTED SPACEBALL,2,9/5/2011 15:30,1.63,,United Kingdom
565617,22610,PENS ASSORTED FUNNY FACE,1,9/5/2011 15:30,1.63,,United Kingdom
565617,22616,PACK OF 12 LONDON TISSUES ,2,9/5/2011 15:30,0.83,,United Kingdom
565617,22621,TRADITIONAL KNITTING NANCY,2,9/5/2011 15:30,3.29,,United Kingdom
565617,22646,CERAMIC STRAWBERRY CAKE MONEY BANK,1,9/5/2011 15:30,3.29,,United Kingdom
565617,22650,CERAMIC PIRATE CHEST MONEY BANK,1,9/5/2011 15:30,3.29,,United Kingdom
565617,22653,BUTTON BOX ,8,9/5/2011 15:30,1.63,,United Kingdom
565617,22661,CHARLOTTE BAG DOLLY GIRL DESIGN,1,9/5/2011 15:30,1.63,,United Kingdom
565617,22701,PINK DOG BOWL,1,9/5/2011 15:30,2.46,,United Kingdom
565617,22703,PINK CAT BOWL,3,9/5/2011 15:30,1.63,,United Kingdom
565617,22712,CARD DOLLY GIRL ,1,9/5/2011 15:30,0.83,,United Kingdom
565617,22714,CARD BIRTHDAY COWBOY,1,9/5/2011 15:30,0.83,,United Kingdom
565617,22720,SET OF 3 CAKE TINS PANTRY DESIGN ,1,9/5/2011 15:30,10.79,,United Kingdom
565617,22723,SET OF 6 HERB TINS SKETCHBOOK,1,9/5/2011 15:30,8.29,,United Kingdom
565617,22726,ALARM CLOCK BAKELIKE GREEN,1,9/5/2011 15:30,7.46,,United Kingdom
565617,22734,SET OF 6 RIBBONS VINTAGE CHRISTMAS,1,9/5/2011 15:30,5.79,,United Kingdom
565617,22758,LARGE PURPLE BABUSHKA NOTEBOOK  ,1,9/5/2011 15:30,2.46,,United Kingdom
565617,22775,PURPLE DRAWERKNOB ACRYLIC EDWARDIAN,6,9/5/2011 15:30,2.46,,United Kingdom
565617,22781,GUMBALL MAGAZINE RACK,2,9/5/2011 15:30,14.96,,United Kingdom
565617,22815,CARD PSYCHEDELIC APPLES,1,9/5/2011 15:30,0.42,,United Kingdom
565617,22819,"BIRTHDAY CARD, RETRO SPOT",4,9/5/2011 15:30,0.42,,United Kingdom
565617,22891,TEA FOR ONE POLKADOT,1,9/5/2011 15:30,8.29,,United Kingdom
565617,22896,PEG BAG APPLES DESIGN,1,9/5/2011 15:30,4.96,,United Kingdom
565617,22969,HOMEMADE JAM SCENTED CANDLES,2,9/5/2011 15:30,3.29,,United Kingdom
565617,22994,TRAVEL CARD WALLET RETROSPOT,2,9/5/2011 15:30,0.83,,United Kingdom
565617,22998,TRAVEL CARD WALLET KEEP CALM,1,9/5/2011 15:30,0.83,,United Kingdom
565617,23004,TRAVEL CARD WALLET PANTRY,1,9/5/2011 15:30,0.83,,United Kingdom
565617,23009,I LOVE LONDON BABY GIFT SET,1,9/5/2011 15:30,24.96,,United Kingdom
565617,23061,VINTAGE EMBOSSED HEART,1,9/5/2011 15:30,2.46,,United Kingdom
565617,23078,ICE CREAM PEN LIP GLOSS ,7,9/5/2011 15:30,2.46,,United Kingdom
565617,23084,RABBIT NIGHT LIGHT,2,9/5/2011 15:30,4.13,,United Kingdom
565617,23119,PACK OF 6 LARGE FRUIT STRAWS ,12,9/5/2011 15:30,1.25,,United Kingdom
565617,23122,PARTY CHARMS 50 PIECES,3,9/5/2011 15:30,1.63,,United Kingdom
565617,23123,COCKTAIL SWORDS 50 PIECES,2,9/5/2011 15:30,1.63,,United Kingdom
565617,23162,REGENCY TEA STRAINER,1,9/5/2011 15:30,7.46,,United Kingdom
565617,23163,REGENCY SUGAR TONGS,1,9/5/2011 15:30,4.96,,United Kingdom
565617,23165,LARGE CERAMIC TOP STORAGE JAR,3,9/5/2011 15:30,3.29,,United Kingdom
565617,23166,MEDIUM CERAMIC TOP STORAGE JAR,3,9/5/2011 15:30,2.46,,United Kingdom
565617,23182,TOILET SIGN OCCUPIED OR VACANT,1,9/5/2011 15:30,2.46,,United Kingdom
565617,23199,JUMBO BAG APPLES,1,9/5/2011 15:30,4.13,,United Kingdom
565617,23200,JUMBO BAG PEARS,2,9/5/2011 15:30,4.13,,United Kingdom
565617,23201,JUMBO BAG ALPHABET,2,9/5/2011 15:30,4.13,,United Kingdom
565617,23203,JUMBO BAG VINTAGE DOILY ,5,9/5/2011 15:30,4.13,,United Kingdom
565617,23206,LUNCH BAG APPLE DESIGN,2,9/5/2011 15:30,2.46,,United Kingdom
565617,23206,LUNCH BAG APPLE DESIGN,1,9/5/2011 15:30,4.13,,United Kingdom
565617,23214,JINGLE BELL HEART ANTIQUE GOLD,1,9/5/2011 15:30,4.13,,United Kingdom
565617,23215,JINGLE BELL HEART ANTIQUE SILVER,1,9/5/2011 15:30,4.13,,United Kingdom
565617,23227,FILIGREE HEART BUTTERFLY WHITE ,1,9/5/2011 15:30,2.46,,United Kingdom
565617,23236,STORAGE TIN VINTAGE DOILY ,1,9/5/2011 15:30,5.79,,United Kingdom
565617,23239,SET OF 4 KNICK KNACK TINS POPPIES,1,9/5/2011 15:30,8.29,,United Kingdom
565617,23241,TREASURE TIN GYMKHANA DESIGN,1,9/5/2011 15:30,4.13,,United Kingdom
565617,23245,SET OF 3 REGENCY CAKE TINS,1,9/5/2011 15:30,10.79,,United Kingdom
565617,23294,SET OF 6 SNACK LOAF BAKING CASES,1,9/5/2011 15:30,2.46,,United Kingdom
565617,23301,GARDENERS KNEELING PAD KEEP CALM ,1,9/5/2011 15:30,3.29,,United Kingdom
565617,23309,SET OF 60 I LOVE LONDON CAKE CASES ,5,9/5/2011 15:30,1.25,,United Kingdom
565617,23328,SET 6 SCHOOL MILK BOTTLES IN CRATE,5,9/5/2011 15:30,7.46,,United Kingdom
565617,23332,IVORY WICKER HEART LARGE,1,9/5/2011 15:30,3.29,,United Kingdom
565617,23344,JUMBO BAG 50'S CHRISTMAS ,1,9/5/2011 15:30,4.13,,United Kingdom
565617,23355,HOT WATER BOTTLE KEEP CALM,1,9/5/2011 15:30,10.79,,United Kingdom
565617,23439,HAND WARMER RED LOVE HEART,1,9/5/2011 15:30,4.13,,United Kingdom
565617,35961,FOLKART ZINC HEART CHRISTMAS DEC,1,9/5/2011 15:30,1.63,,United Kingdom
565617,46776C,WOVEN FROST CUSHION COVER,1,9/5/2011 15:30,4.13,,United Kingdom
565617,46776F,WOVEN ROSE GARDEN CUSHION COVER ,9,9/5/2011 15:30,4.13,,United Kingdom
565617,47566,PARTY BUNTING,1,9/5/2011 15:30,10.79,,United Kingdom
565617,47578A,ENGLISH ROSE SMALL SCENTED FLOWER,1,9/5/2011 15:30,1.63,,United Kingdom
565617,51014C,"FEATHER PEN,COAL BLACK",1,9/5/2011 15:30,0.83,,United Kingdom
565617,71053,WHITE METAL LANTERN,1,9/5/2011 15:30,8.29,,United Kingdom
565617,72807C,SET/3 VANILLA SCENTED CANDLE IN BOX,1,9/5/2011 15:30,8.29,,United Kingdom
565617,72817,SET OF 2 CHRISTMAS DECOUPAGE CANDLE,1,9/5/2011 15:30,1.63,,United Kingdom
565617,79144B,PAINTED LIGHTBULB STAR+ MOON,3,9/5/2011 15:30,0.83,,United Kingdom
565617,79144C,PAINTED LIGHTBULB RAINBOW DESIGN,1,9/5/2011 15:30,0.83,,United Kingdom
565617,79190B,RETRO PLASTIC POLKA TRAY,2,9/5/2011 15:30,0.83,,United Kingdom
565617,82580,BATHROOM METAL SIGN,1,9/5/2011 15:30,1.25,,United Kingdom
565617,82581,TOILET METAL SIGN,1,9/5/2011 15:30,1.25,,United Kingdom
565617,84031B,CHARLIE LOLA BLUE HOT WATER BOTTLE ,2,9/5/2011 15:30,4.13,,United Kingdom
565617,84032A,CHARLIE+LOLA PINK HOT WATER BOTTLE,1,9/5/2011 15:30,3.29,,United Kingdom
565617,84510A,SET OF 4 ENGLISH ROSE COASTERS,1,9/5/2011 15:30,2.46,,United Kingdom
565617,84536B,FAIRY CAKES NOTEBOOK A7 SIZE,1,9/5/2011 15:30,0.83,,United Kingdom
565617,84568,GIRLS ALPHABET IRON ON PATCHES ,3,9/5/2011 15:30,0.42,,United Kingdom
565617,84598,BOYS ALPHABET IRON ON PATCHES,3,9/5/2011 15:30,0.42,,United Kingdom
565617,84692,BOX OF 24 COCKTAIL PARASOLS,1,9/5/2011 15:30,0.83,,United Kingdom
565617,84836,ZINC METAL HEART DECORATION,1,9/5/2011 15:30,2.46,,United Kingdom
565617,84970L,SINGLE HEART ZINC T-LIGHT HOLDER,1,9/5/2011 15:30,2.08,,United Kingdom
565617,85032C,CURIOUS IMAGES GIFT WRAP SET,2,9/5/2011 15:30,1.63,,United Kingdom
565617,85048,15CM CHRISTMAS GLASS BALL 20 LIGHTS,1,9/5/2011 15:30,16.63,,United Kingdom
565617,85049H,URBAN BLACK RIBBONS ,4,9/5/2011 15:30,0.83,,United Kingdom
565617,85059,FRENCH ENAMEL WATER BASIN,1,9/5/2011 15:30,7.46,,United Kingdom
565617,85078,SCANDINAVIAN 3 HEARTS NAPKIN RING,6,9/5/2011 15:30,1.63,,United Kingdom
565617,85087,CANDY SPOT CUSHION COVER,1,9/5/2011 15:30,3.29,,United Kingdom
565617,85099F,JUMBO BAG STRAWBERRY,1,9/5/2011 15:30,4.13,,United Kingdom
565617,85123A,WHITE HANGING HEART T-LIGHT HOLDER,1,9/5/2011 15:30,5.79,,United Kingdom
565617,85168B,BLACK BAROQUE CARRIAGE CLOCK,1,9/5/2011 15:30,8.29,,United Kingdom
565617,85194S,HANGING SPRING FLOWER EGG SMALL,1,9/5/2011 15:30,1.63,,United Kingdom
565617,90010A,MIDNIGHT BLUE GLASS/SILVER BRACELET,1,9/5/2011 15:30,9.57,,United Kingdom
565617,90147,CHUNKY SILVER NECKLACE PASTEL FLOWE,1,9/5/2011 15:30,10.4,,United Kingdom
565617,90195A,PURPLE GEMSTONE BRACELET,1,9/5/2011 15:30,9.15,,United Kingdom
565617,90201A,PURPLE ENAMEL FLOWER RING,1,9/5/2011 15:30,2.9,,United Kingdom
565617,90214A,"LETTER ""A"" BLING KEY RING",3,9/5/2011 15:30,0.83,,United Kingdom
565617,90214F,"LETTER ""F"" BLING KEY RING",1,9/5/2011 15:30,0.83,,United Kingdom
565617,90214J,"LETTER ""J"" BLING KEY RING",1,9/5/2011 15:30,0.83,,United Kingdom
565617,90214R,"LETTER ""R"" BLING KEY RING",1,9/5/2011 15:30,0.83,,United Kingdom
565617,DOT,DOTCOM POSTAGE,1,9/5/2011 15:30,138,,United Kingdom
565617,23335,EGG FRYING PAN IVORY ,1,9/5/2011 15:30,2.08,,United Kingdom
565617,22470,HEART OF WICKER LARGE,3,9/5/2011 15:30,2.95,,United Kingdom
565617,23321,SMALL WHITE HEART OF WICKER,3,9/5/2011 15:30,1.65,,United Kingdom
565617,22469,HEART OF WICKER SMALL,3,9/5/2011 15:30,1.65,,United Kingdom
565617,21975,PACK OF 60 DINOSAUR CAKE CASES,9,9/5/2011 15:30,0.55,,United Kingdom
565617,21976,PACK OF 60 MUSHROOM CAKE CASES,8,9/5/2011 15:30,0.55,,United Kingdom
565617,22993,SET OF 4 PANTRY JELLY MOULDS,5,9/5/2011 15:30,1.25,,United Kingdom
565617,84879,ASSORTED COLOUR BIRD ORNAMENT,8,9/5/2011 15:30,1.69,,United Kingdom
565617,22481,BLACK TEA TOWEL CLASSIC DESIGN,4,9/5/2011 15:30,1.25,,United Kingdom
565617,21216,"SET 3 RETROSPOT TEA,COFFEE,SUGAR",1,9/5/2011 15:30,4.95,,United Kingdom
565617,21217,RED RETROSPOT ROUND CAKE TINS,1,9/5/2011 15:30,9.95,,United Kingdom
565617,22207,FRYING PAN UNION FLAG,2,9/5/2011 15:30,4.25,,United Kingdom
565617,22965,3 TRADITIONAl BISCUIT CUTTERS  SET,3,9/5/2011 15:30,2.1,,United Kingdom
565618,84926D,LA PALMIERA TILE COASTER,24,9/5/2011 15:40,0.29,15974,United Kingdom
565618,21179,NO JUNK MAIL METAL SIGN,24,9/5/2011 15:40,0.39,15974,United Kingdom
565618,21090,SET/6 COLLAGE PAPER PLATES,12,9/5/2011 15:40,0.39,15974,United Kingdom
565618,20832,RED FLOCK LOVE HEART PHOTO FRAME,24,9/5/2011 15:40,0.39,15974,United Kingdom
565618,10080,GROOVY CACTUS INFLATABLE,12,9/5/2011 15:40,0.39,15974,United Kingdom
565618,21745,GAOLERS KEYS DECORATIVE GARDEN ,4,9/5/2011 15:40,3.75,15974,United Kingdom
565618,23076,ICE CREAM SUNDAE LIP GLOSS,24,9/5/2011 15:40,1.25,15974,United Kingdom
565618,21642,ASSORTED TUTTI FRUTTI PEN,24,9/5/2011 15:40,0.29,15974,United Kingdom
565618,21744,SNOWFLAKE PORTABLE TABLE LIGHT ,6,9/5/2011 15:40,2.95,15974,United Kingdom
565618,84510A,SET OF 4 ENGLISH ROSE COASTERS,10,9/5/2011 15:40,1.25,15974,United Kingdom
565618,23173,REGENCY TEAPOT ROSES ,2,9/5/2011 15:40,9.95,15974,United Kingdom
565618,20831,GOLD PHOTO FRAME,6,9/5/2011 15:40,2.1,15974,United Kingdom
565618,21279,VINTAGE KITCHEN PRINT FRUITS,6,9/5/2011 15:40,2.55,15974,United Kingdom
565618,22469,HEART OF WICKER SMALL,12,9/5/2011 15:40,1.65,15974,United Kingdom
565618,22670,FRENCH WC SIGN BLUE METAL,12,9/5/2011 15:40,1.25,15974,United Kingdom
565618,82581,TOILET METAL SIGN,12,9/5/2011 15:40,0.55,15974,United Kingdom
565618,21164,HOME SWEET HOME METAL SIGN ,6,9/5/2011 15:40,2.95,15974,United Kingdom
565618,22412,METAL SIGN NEIGHBOURHOOD WITCH ,12,9/5/2011 15:40,2.1,15974,United Kingdom
565618,82600,NO SINGING METAL SIGN,12,9/5/2011 15:40,2.1,15974,United Kingdom
565618,23322,LARGE WHITE HEART OF WICKER,6,9/5/2011 15:40,2.95,15974,United Kingdom
565618,23332,IVORY WICKER HEART LARGE,12,9/5/2011 15:40,1.65,15974,United Kingdom
565618,71053,WHITE METAL LANTERN,4,9/5/2011 15:40,3.75,15974,United Kingdom
565618,21650,ASSORTED TUTTI FRUTTI BRACELET,24,9/5/2011 15:40,0.19,15974,United Kingdom
565618,51014C,"FEATHER PEN,COAL BLACK",24,9/5/2011 15:40,0.39,15974,United Kingdom
565618,85212,MINI PAINTED GARDEN DECORATION ,24,9/5/2011 15:40,0.29,15974,United Kingdom
565631,85099C,JUMBO  BAG BAROQUE BLACK WHITE,100,9/5/2011 15:49,1.79,14680,United Kingdom
565631,22386,JUMBO BAG PINK POLKADOT,100,9/5/2011 15:49,1.79,14680,United Kingdom
565631,20712,JUMBO BAG WOODLAND ANIMALS,100,9/5/2011 15:49,1.79,14680,United Kingdom
565631,21930,JUMBO STORAGE BAG SKULLS,100,9/5/2011 15:49,1.79,14680,United Kingdom
565631,22667,RECIPE BOX RETROSPOT ,24,9/5/2011 15:49,2.55,14680,United Kingdom
565631,84997D,CHILDRENS CUTLERY POLKADOT PINK,72,9/5/2011 15:49,3.75,14680,United Kingdom
565631,21430,SET/3 RED GINGHAM ROSE STORAGE BOX,24,9/5/2011 15:49,3.39,14680,United Kingdom
565631,20724,RED RETROSPOT CHARLOTTE BAG,10,9/5/2011 15:49,0.85,14680,United Kingdom
565631,22628,PICNIC BOXES SET OF 3 RETROSPOT ,8,9/5/2011 15:49,4.95,14680,United Kingdom
565631,20727,LUNCH BAG  BLACK SKULL.,30,9/5/2011 15:49,1.65,14680,United Kingdom
565643,23212,HEART WREATH DECORATION WITH BELL,24,9/5/2011 15:56,1.25,13468,United Kingdom
565643,23213,STAR WREATH DECORATION WITH BELL,24,9/5/2011 15:56,1.25,13468,United Kingdom
565643,23374,RED SPOT PAPER GIFT BAG,10,9/5/2011 15:56,0.82,13468,United Kingdom
565643,22595,GINGHAM HEART DECORATION,48,9/5/2011 15:56,0.85,13468,United Kingdom
565643,85123A,WHITE HANGING HEART T-LIGHT HOLDER,64,9/5/2011 15:56,2.55,13468,United Kingdom
565643,20724,RED RETROSPOT CHARLOTTE BAG,10,9/5/2011 15:56,0.85,13468,United Kingdom
565643,21155,RED RETROSPOT PEG BAG,24,9/5/2011 15:56,2.55,13468,United Kingdom
565643,23298,SPOTTY BUNTING,3,9/5/2011 15:56,4.95,13468,United Kingdom
565644,21175,GIN + TONIC DIET METAL SIGN,12,9/5/2011 15:56,2.55,15491,United Kingdom
565644,85152,HAND OVER THE CHOCOLATE   SIGN ,24,9/5/2011 15:56,2.1,15491,United Kingdom
565644,21165,BEWARE OF THE CAT METAL SIGN ,24,9/5/2011 15:56,1.69,15491,United Kingdom
565644,21166,COOK WITH WINE METAL SIGN ,48,9/5/2011 15:56,1.85,15491,United Kingdom
565644,21181,PLEASE ONE PERSON METAL SIGN,48,9/5/2011 15:56,1.85,15491,United Kingdom
565648,23129,HEART SHAPED HOLLY WREATH,1,9/5/2011 16:22,4.15,18196,United Kingdom
565648,21172,PARTY METAL SIGN ,1,9/5/2011 16:22,1.45,18196,United Kingdom
565648,23426,METAL SIGN DROP YOUR PANTS,1,9/5/2011 16:22,2.89,18196,United Kingdom
565648,22217,T-LIGHT HOLDER HANGING LACE,1,9/5/2011 16:22,1.25,18196,United Kingdom
565648,23194,GYMKHANA TREASURE BOOK BOX,1,9/5/2011 16:22,2.25,18196,United Kingdom
565648,23048,SET OF 10 LANTERNS FAIRY LIGHT STAR,1,9/5/2011 16:22,4.15,18196,United Kingdom
565648,85130D,BEADED CRYSTAL HEART PINK LARGE,2,9/5/2011 16:22,0.79,18196,United Kingdom
565648,85130C,BEADED CRYSTAL HEART BLUE  LARGE,2,9/5/2011 16:22,0.79,18196,United Kingdom
565648,21892,TRADITIONAL WOODEN CATCH CUP GAME ,3,9/5/2011 16:22,1.25,18196,United Kingdom
565648,23100,SILVER BELLS TABLE DECORATION,2,9/5/2011 16:22,1.25,18196,United Kingdom
565648,23213,STAR WREATH DECORATION WITH BELL,1,9/5/2011 16:22,1.25,18196,United Kingdom
565648,23210,WHITE ROCKING HORSE HAND PAINTED,1,9/5/2011 16:22,1.25,18196,United Kingdom
565648,23239,SET OF 4 KNICK KNACK TINS POPPIES,1,9/5/2011 16:22,4.15,18196,United Kingdom
565648,15039,SANDALWOOD FAN,1,9/5/2011 16:22,0.85,18196,United Kingdom
565648,22403,MAGNETS PACK OF 4 VINTAGE LABELS ,1,9/5/2011 16:22,0.39,18196,United Kingdom
565648,22042,CHRISTMAS CARD SINGING ANGEL,12,9/5/2011 16:22,0.42,18196,United Kingdom
565648,22818,CARD CHRISTMAS VILLAGE,12,9/5/2011 16:22,0.42,18196,United Kingdom
565648,84247E,PACK/12 XMAS FUN CARD,1,9/5/2011 16:22,2.95,18196,United Kingdom
565648,22044,CHRISTMAS CARD STACK OF PRESENTS,12,9/5/2011 16:22,0.42,18196,United Kingdom
565648,23307,SET OF 60 PANTRY DESIGN CAKE CASES ,1,9/5/2011 16:22,0.55,18196,United Kingdom
565648,84991,60 TEATIME FAIRY CAKE CASES,1,9/5/2011 16:22,0.55,18196,United Kingdom
565648,20956,PORCELAIN T-LIGHT HOLDERS ASSORTED,8,9/5/2011 16:22,1.25,18196,United Kingdom
565648,23263,SET OF 3 WOODEN HEART DECORATIONS,1,9/5/2011 16:22,1.25,18196,United Kingdom
565648,84877D,BLUE ROUND COMPACT MIRROR,1,9/5/2011 16:22,1.25,18196,United Kingdom
565648,84875D,BLUE SQUARE COMPACT MIRROR,1,9/5/2011 16:22,1.25,18196,United Kingdom
565648,22402,MAGNETS PACK OF 4 VINTAGE COLLAGE,1,9/5/2011 16:22,0.39,18196,United Kingdom
565648,22399,MAGNETS PACK OF 4 CHILDHOOD MEMORY,1,9/5/2011 16:22,1.25,18196,United Kingdom
565648,23131,MISTLETOE HEART WREATH CREAM,5,9/5/2011 16:22,4.15,18196,United Kingdom
565648,82482,WOODEN PICTURE FRAME WHITE FINISH,1,9/5/2011 16:22,2.95,18196,United Kingdom
565648,23210,WHITE ROCKING HORSE HAND PAINTED,1,9/5/2011 16:22,1.25,18196,United Kingdom
565648,23090,VINTAGE GLASS T-LIGHT HOLDER,4,9/5/2011 16:22,0.83,18196,United Kingdom
565648,23065,LARGE DECO JEWELLERY STAND,1,9/5/2011 16:22,12.5,18196,United Kingdom
565648,15034,PAPER POCKET TRAVELING FAN ,12,9/5/2011 16:22,0.14,18196,United Kingdom
565648,22729,ALARM CLOCK BAKELIKE ORANGE,1,9/5/2011 16:22,3.75,18196,United Kingdom
565648,22727,ALARM CLOCK BAKELIKE RED ,2,9/5/2011 16:22,3.75,18196,United Kingdom
565648,23066,SMALL DECO JEWELLERY STAND,2,9/5/2011 16:22,8.25,18196,United Kingdom
565648,18097C,WHITE TALL PORCELAIN T-LIGHT HOLDER,2,9/5/2011 16:22,2.55,18196,United Kingdom
565648,84970S,HANGING HEART ZINC T-LIGHT HOLDER,2,9/5/2011 16:22,0.85,18196,United Kingdom
565648,22460,EMBOSSED GLASS TEALIGHT HOLDER,2,9/5/2011 16:22,1.25,18196,United Kingdom
565648,22217,T-LIGHT HOLDER HANGING LACE,1,9/5/2011 16:22,1.25,18196,United Kingdom
565648,23326,HANGING MINI COLOURED BOTTLES,24,9/5/2011 16:22,0.63,18196,United Kingdom
565648,21394,RED POLKADOT BEAKER ,6,9/5/2011 16:22,0.39,18196,United Kingdom
565648,21912,VINTAGE SNAKES & LADDERS,1,9/5/2011 16:22,3.75,18196,United Kingdom
565648,85130B,BEADED CRYSTAL HEART GREEN LARGE,3,9/5/2011 16:22,0.79,18196,United Kingdom
565648,85124B,BLUE JUICY FRUIT PHOTO FRAME,1,9/5/2011 16:22,2.55,18196,United Kingdom
565648,85124C,GREEN JUICY FRUIT PHOTO FRAME,1,9/5/2011 16:22,2.55,18196,United Kingdom
565648,23437, 50'S CHRISTMAS GIFT BAG LARGE,3,9/5/2011 16:22,1.25,18196,United Kingdom
565648,23436,VINTAGE CHRISTMAS GIFT BAG LARGE ,3,9/5/2011 16:22,1.25,18196,United Kingdom
565648,23375,50'S CHRISTMAS PAPER GIFT BAG,5,9/5/2011 16:22,0.82,18196,United Kingdom
565648,23373,VINTAGE CHRISTMAS PAPER GIFT BAG,5,9/5/2011 16:22,0.82,18196,United Kingdom
565648,23374,RED SPOT PAPER GIFT BAG,10,9/5/2011 16:22,0.82,18196,United Kingdom
565648,22753,SMALL YELLOW BABUSHKA NOTEBOOK ,1,9/5/2011 16:22,0.85,18196,United Kingdom
565648,22754,SMALL RED BABUSHKA NOTEBOOK ,1,9/5/2011 16:22,0.85,18196,United Kingdom
565648,22755,SMALL PURPLE BABUSHKA NOTEBOOK ,1,9/5/2011 16:22,0.85,18196,United Kingdom
565648,23177,TREASURE ISLAND BOOK BOX,2,9/5/2011 16:22,2.25,18196,United Kingdom
565648,23193,BUFFALO BILL TREASURE BOOK BOX,1,9/5/2011 16:22,2.25,18196,United Kingdom
565648,22585,PACK OF 6 BIRDY GIFT TAGS,2,9/5/2011 16:22,1.25,18196,United Kingdom
565648,23353,6 GIFT TAGS VINTAGE CHRISTMAS ,2,9/5/2011 16:22,0.83,18196,United Kingdom
565648,23354,6 GIFT TAGS 50'S CHRISTMAS ,2,9/5/2011 16:22,0.83,18196,United Kingdom
565648,22584,PACK OF 6 PANNETONE GIFT BOXES,2,9/5/2011 16:22,2.55,18196,United Kingdom
565648,22583,PACK OF 6 HANDBAG GIFT BOXES,2,9/5/2011 16:22,2.55,18196,United Kingdom
565648,22812,PACK 3 BOXES CHRISTMAS PANNETONE,3,9/5/2011 16:22,1.95,18196,United Kingdom
565648,22813,PACK 3 BOXES BIRD PANNETONE ,3,9/5/2011 16:22,1.95,18196,United Kingdom
565649,22993,SET OF 4 PANTRY JELLY MOULDS,3,9/5/2011 16:27,1.25,16712,United Kingdom
565649,22980,PANTRY SCRUBBING BRUSH,6,9/5/2011 16:27,1.65,16712,United Kingdom
565649,22979,PANTRY WASHING UP BRUSH,6,9/5/2011 16:27,1.45,16712,United Kingdom
565649,22900,SET 2 TEA TOWELS I LOVE LONDON ,3,9/5/2011 16:27,3.25,16712,United Kingdom
565649,84356,POMPOM CURTAIN,2,9/5/2011 16:27,6.95,16712,United Kingdom
565649,21682,LARGE MEDINA STAMPED METAL BOWL ,4,9/5/2011 16:27,4.95,16712,United Kingdom
565649,21683,MEDIUM MEDINA STAMPED METAL BOWL ,6,9/5/2011 16:27,2.95,16712,United Kingdom
565649,23156,SET OF 5 MINI GROCERY MAGNETS,1,9/5/2011 16:27,2.08,16712,United Kingdom
565649,22659,LUNCH BOX I LOVE LONDON,2,9/5/2011 16:27,1.95,16712,United Kingdom
565649,22384,LUNCH BAG PINK POLKADOT,3,9/5/2011 16:27,1.65,16712,United Kingdom
565649,23207,LUNCH BAG ALPHABET DESIGN,3,9/5/2011 16:27,1.65,16712,United Kingdom
565649,20726,LUNCH BAG WOODLAND,3,9/5/2011 16:27,1.65,16712,United Kingdom
565649,23208,LUNCH BAG VINTAGE LEAF DESIGN,3,9/5/2011 16:27,1.65,16712,United Kingdom
565649,23206,LUNCH BAG APPLE DESIGN,3,9/5/2011 16:27,1.65,16712,United Kingdom
565649,22383,LUNCH BAG SUKI DESIGN ,3,9/5/2011 16:27,1.65,16712,United Kingdom
565649,22382,LUNCH BAG SPACEBOY DESIGN ,3,9/5/2011 16:27,1.65,16712,United Kingdom
565649,22662,LUNCH BAG DOLLY GIRL DESIGN,3,9/5/2011 16:27,1.65,16712,United Kingdom
565649,20727,LUNCH BAG  BLACK SKULL.,4,9/5/2011 16:27,1.65,16712,United Kingdom
565649,21794,CLASSIC FRENCH STYLE BASKET NATURAL,3,9/5/2011 16:27,3.95,16712,United Kingdom
565649,23242,TREASURE TIN BUFFALO BILL ,6,9/5/2011 16:27,2.08,16712,United Kingdom
565649,22430,ENAMEL WATERING CAN CREAM,3,9/5/2011 16:27,4.95,16712,United Kingdom
565649,21470,FLOWER VINE RAFFIA FOOD COVER,1,9/5/2011 16:27,3.75,16712,United Kingdom
565649,21469,POLKA DOT RAFFIA FOOD COVER,1,9/5/2011 16:27,3.75,16712,United Kingdom
565649,21467,CHERRY CROCHET FOOD COVER,1,9/5/2011 16:27,3.75,16712,United Kingdom
565649,21466,RED FLOWER CROCHET FOOD COVER,2,9/5/2011 16:27,3.75,16712,United Kingdom
565649,22844,VINTAGE CREAM DOG FOOD CONTAINER,2,9/5/2011 16:27,8.5,16712,United Kingdom
565649,22631,CIRCUS PARADE LUNCH BOX ,2,9/5/2011 16:27,1.95,16712,United Kingdom
565649,22425,ENAMEL COLANDER CREAM,3,9/5/2011 16:27,4.95,16712,United Kingdom
565649,85054,FRENCH ENAMEL POT W LID,3,9/5/2011 16:27,2.95,16712,United Kingdom
