565289,23174,REGENCY SUGAR BOWL GREEN,4,9/2/2011 11:43,4.15,14911,EIRE
565289,23245,SET OF 3 REGENCY CAKE TINS,4,9/2/2011 11:43,4.95,14911,EIRE
565289,85014B,RED RETROSPOT UMBRELLA,3,9/2/2011 11:43,5.95,14911,EIRE
565289,23110,PARISIENNE KEY CABINET ,10,9/2/2011 11:43,5.75,14911,EIRE
565289,23112,PARISIENNE CURIO CABINET,2,9/2/2011 11:43,7.5,14911,EIRE
565289,82484,WOOD BLACK BOARD ANT WHITE FINISH,12,9/2/2011 11:43,6.75,14911,EIRE
565289,22796,PHOTO FRAME 3 CLASSIC HANGING,4,9/2/2011 11:43,9.95,14911,EIRE
565289,21670,BLUE SPOT CERAMIC DRAWER KNOB,12,9/2/2011 11:43,1.25,14911,EIRE
565289,22668,PINK BABY BUNTING,5,9/2/2011 11:43,2.95,14911,EIRE
565289,21380,WOODEN HAPPY BIRTHDAY GARLAND,6,9/2/2011 11:43,2.95,14911,EIRE
565289,47566B,TEA TIME PARTY BUNTING,4,9/2/2011 11:43,4.95,14911,EIRE
565289,21755,LOVE BUILDING BLOCK WORD,3,9/2/2011 11:43,5.95,14911,EIRE
565289,23147,SINGLE ANTIQUE ROSE HOOK IVORY,12,9/2/2011 11:43,1.45,14911,EIRE
565289,23335,EGG FRYING PAN IVORY ,6,9/2/2011 11:43,2.08,14911,EIRE
565289,84050,PINK HEART SHAPE EGG FRYING PAN,6,9/2/2011 11:43,1.65,14911,EIRE
565289,23243,SET OF TEA COFFEE SUGAR TINS PANTRY,4,9/2/2011 11:43,4.95,14911,EIRE
565289,22978,PANTRY ROLLING PIN,6,9/2/2011 11:43,3.75,14911,EIRE
565289,22456,NATURAL SLATE CHALKBOARD LARGE ,9,9/2/2011 11:43,4.95,14911,EIRE
565289,23033,DRAWER KNOB CERAMIC RED,12,9/2/2011 11:43,1.45,14911,EIRE
565289,22120,WELCOME  WOODEN BLOCK LETTERS,6,9/2/2011 11:43,9.95,14911,EIRE
565289,21755,LOVE BUILDING BLOCK WORD,3,9/2/2011 11:43,5.95,14911,EIRE
C565290,22307,GOLD MUG BONE CHINA TREE OF LIFE,-24,9/2/2011 11:46,1.25,16092,United Kingdom
565291,82484,WOOD BLACK BOARD ANT WHITE FINISH,300,9/2/2011 11:53,4.8,18102,United Kingdom
565291,82482,WOODEN PICTURE FRAME WHITE FINISH,324,9/2/2011 11:53,1.92,18102,United Kingdom
565291,23135,SMALL ZINC HEART WALL ORGANISER,408,9/2/2011 11:53,3.32,18102,United Kingdom
565291,22189,CREAM HEART CARD HOLDER,324,9/2/2011 11:53,2.31,18102,United Kingdom
565291,22188,BLACK HEART CARD HOLDER,324,9/2/2011 11:53,2.31,18102,United Kingdom
565292,22112,CHOCOLATE HOT WATER BOTTLE,12,9/2/2011 11:54,4.95,16102,United Kingdom
565292,22114,HOT WATER BOTTLE TEA AND SYMPATHY,12,9/2/2011 11:54,4.25,16102,United Kingdom
565292,22835,HOT WATER BOTTLE I AM SO POORLY,12,9/2/2011 11:54,4.65,16102,United Kingdom
565292,84029G,KNITTED UNION FLAG HOT WATER BOTTLE,12,9/2/2011 11:54,3.75,16102,United Kingdom
565292,23355,HOT WATER BOTTLE KEEP CALM,12,9/2/2011 11:54,4.95,16102,United Kingdom
565292,72351A,SET/6 TURQUOISE BUTTERFLY T-LIGHTS,12,9/2/2011 11:54,2.1,16102,United Kingdom
565292,72351B,SET/6 PINK  BUTTERFLY T-LIGHTS,12,9/2/2011 11:54,2.1,16102,United Kingdom
565292,72349B,SET/6 PURPLE BUTTERFLY T-LIGHTS,12,9/2/2011 11:54,2.1,16102,United Kingdom
565292,21977,PACK OF 60 PINK PAISLEY CAKE CASES,24,9/2/2011 11:54,0.55,16102,United Kingdom
565292,23307,SET OF 60 PANTRY DESIGN CAKE CASES ,24,9/2/2011 11:54,0.55,16102,United Kingdom
565292,22196,SMALL HEART MEASURING SPOONS,24,9/2/2011 11:54,0.85,16102,United Kingdom
565292,22195,LARGE HEART MEASURING SPOONS,12,9/2/2011 11:54,1.65,16102,United Kingdom
565292,21974,SET OF 36 PAISLEY FLOWER DOILIES,24,9/2/2011 11:54,1.45,16102,United Kingdom
565292,23306,SET OF 36 DOILIES PANTRY DESIGN,24,9/2/2011 11:54,1.45,16102,United Kingdom
565292,22950,36 DOILIES VINTAGE CHRISTMAS,12,9/2/2011 11:54,1.45,16102,United Kingdom
565292,22952,60 CAKE CASES VINTAGE CHRISTMAS,24,9/2/2011 11:54,0.55,16102,United Kingdom
565292,23267,SET OF 4 SANTA PLACE SETTINGS,24,9/2/2011 11:54,1.25,16102,United Kingdom
565292,22997,TRAVEL CARD WALLET UNION JACK,24,9/2/2011 11:54,0.42,16102,United Kingdom
565293,23177,TREASURE ISLAND BOOK BOX,144,9/2/2011 11:59,1.95,17857,United Kingdom
565293,23176,ABC TREASURE BOOK BOX ,144,9/2/2011 11:59,1.95,17857,United Kingdom
C565294,20981,12 PENCILS TALL TUBE WOODLAND,-12,9/2/2011 12:00,0.85,12423,Belgium
565295,22646,CERAMIC STRAWBERRY CAKE MONEY BANK,12,9/2/2011 12:01,1.45,12794,Portugal
565295,23078,ICE CREAM PEN LIP GLOSS ,24,9/2/2011 12:01,1.25,12794,Portugal
565295,47585A,PINK FAIRY CAKE CUSHION COVER,4,9/2/2011 12:01,3.75,12794,Portugal
565295,23154,SET OF 4 JAM JAR MAGNETS,12,9/2/2011 12:01,2.08,12794,Portugal
565295,47567B,TEA TIME KITCHEN APRON,3,9/2/2011 12:01,5.95,12794,Portugal
565295,47591D,PINK FAIRY CAKE CHILDRENS APRON,8,9/2/2011 12:01,1.95,12794,Portugal
565295,47559B,TEA TIME OVEN GLOVE,10,9/2/2011 12:01,1.25,12794,Portugal
565295,22567,20 DOLLY PEGS RETROSPOT,12,9/2/2011 12:01,1.45,12794,Portugal
565295,84991,60 TEATIME FAIRY CAKE CASES,24,9/2/2011 12:01,0.55,12794,Portugal
565295,22851,SET 20 NAPKINS FAIRY CAKES DESIGN ,12,9/2/2011 12:01,0.85,12794,Portugal
565295,84509G,SET OF 4 FAIRY CAKE PLACEMATS ,4,9/2/2011 12:01,3.75,12794,Portugal
565295,47580,TEA TIME DES TEA COSY,6,9/2/2011 12:01,2.55,12794,Portugal
565295,16156S,WRAP PINK FAIRY CAKES ,25,9/2/2011 12:01,0.42,12794,Portugal
565295,21288,STRIPEY CHOCOLATE NESTING BOXES,6,9/2/2011 12:01,2.95,12794,Portugal
565295,21292,SMALL STRIPES CHOCOLATE GIFT BAG ,16,9/2/2011 12:01,0.85,12794,Portugal
565295,72741,GRAND CHOCOLATECANDLE,9,9/2/2011 12:01,1.45,12794,Portugal
565295,47599A,PINK PARTY BAGS,6,9/2/2011 12:01,2.1,12794,Portugal
565295,84535B,FAIRY CAKES NOTEBOOK A6 SIZE,16,9/2/2011 12:01,0.65,12794,Portugal
565295,84987,SET OF 36 TEATIME PAPER DOILIES,12,9/2/2011 12:01,1.45,12794,Portugal
565295,23189,SET OF 12 FORK CANDLES,6,9/2/2011 12:01,2.89,12794,Portugal
565296,84929,code mix up? 84930,-967,9/2/2011 12:04,0,,United Kingdom
565297,84877D,?,-203,9/2/2011 12:06,0,,United Kingdom
565302,21682,?display?,-156,9/2/2011 12:16,0,,United Kingdom
565303,22904,CALENDAR PAPER CUT DESIGN,1,9/2/2011 12:17,2.95,,Unspecified
565303,21329,DINOSAURS  WRITING SET ,1,9/2/2011 12:17,1.65,,Unspecified
565303,21992,VINTAGE PAISLEY STATIONERY SET,1,9/2/2011 12:17,1.25,,Unspecified
565303,20772,GARDEN PATH JOURNAL,1,9/2/2011 12:17,2.55,,Unspecified
565303,23196,VINTAGE LEAF MAGNETIC NOTEPAD,1,9/2/2011 12:17,1.45,,Unspecified
565303,22543,MINI JIGSAW BAKE A CAKE ,2,9/2/2011 12:17,0.42,,Unspecified
565303,22539,MINI JIGSAW DOLLY GIRL,2,9/2/2011 12:17,0.42,,Unspecified
565303,22544,MINI JIGSAW SPACEBOY,3,9/2/2011 12:17,0.42,,Unspecified
565303,22541,MINI JIGSAW LEAP FROG,1,9/2/2011 12:17,0.42,,Unspecified
565303,22540,MINI JIGSAW CIRCUS PARADE ,1,9/2/2011 12:17,0.42,,Unspecified
565303,22537,MAGIC DRAWING SLATE DINOSAUR,2,9/2/2011 12:17,0.42,,Unspecified
565303,22533,MAGIC DRAWING SLATE BAKE A CAKE ,2,9/2/2011 12:17,0.42,,Unspecified
565303,22535,MAGIC DRAWING SLATE BUNNIES ,4,9/2/2011 12:17,0.42,,Unspecified
565303,22536,MAGIC DRAWING SLATE PURDEY,2,9/2/2011 12:17,0.42,,Unspecified
565303,22532,MAGIC DRAWING SLATE LEAP FROG ,2,9/2/2011 12:17,0.42,,Unspecified
565303,22531,MAGIC DRAWING SLATE CIRCUS PARADE  ,2,9/2/2011 12:17,0.42,,Unspecified
565303,22534,MAGIC DRAWING SLATE SPACEBOY ,2,9/2/2011 12:17,0.42,,Unspecified
565303,22530,MAGIC DRAWING SLATE DOLLY GIRL ,2,9/2/2011 12:17,0.42,,Unspecified
565303,22529,MAGIC DRAWING SLATE GO TO THE FAIR ,2,9/2/2011 12:17,0.42,,Unspecified
565303,22540,MINI JIGSAW CIRCUS PARADE ,3,9/2/2011 12:17,0.42,,Unspecified
565303,22746,POPPY'S PLAYHOUSE LIVINGROOM ,1,9/2/2011 12:17,2.1,,Unspecified
565303,22748,POPPY'S PLAYHOUSE KITCHEN,1,9/2/2011 12:17,2.1,,Unspecified
565303,22747,POPPY'S PLAYHOUSE BATHROOM,1,9/2/2011 12:17,2.1,,Unspecified
565303,22745,POPPY'S PLAYHOUSE BEDROOM ,1,9/2/2011 12:17,2.1,,Unspecified
565303,85227,SET OF 6 3D KIT CARDS FOR KIDS,1,9/2/2011 12:17,0.85,,Unspecified
565303,84077,WORLD WAR 2 GLIDERS ASSTD DESIGNS,48,9/2/2011 12:17,0.29,,Unspecified
565303,23309,SET OF 60 I LOVE LONDON CAKE CASES ,2,9/2/2011 12:17,0.55,,Unspecified
565303,22437,SET OF 9 BLACK SKULL BALLOONS,10,9/2/2011 12:17,0.85,,Unspecified
565303,84378,SET OF 3 HEART COOKIE CUTTERS,2,9/2/2011 12:17,1.45,,Unspecified
565303,23307,SET OF 60 PANTRY DESIGN CAKE CASES ,2,9/2/2011 12:17,0.55,,Unspecified
565303,21977,PACK OF 60 PINK PAISLEY CAKE CASES,2,9/2/2011 12:17,0.55,,Unspecified
565303,21976,PACK OF 60 MUSHROOM CAKE CASES,2,9/2/2011 12:17,0.55,,Unspecified
565303,21975,PACK OF 60 DINOSAUR CAKE CASES,2,9/2/2011 12:17,0.55,,Unspecified
565303,84991,60 TEATIME FAIRY CAKE CASES,2,9/2/2011 12:17,0.55,,Unspecified
565303,11001,ASSTD DESIGN RACING CAR PEN,16,9/2/2011 12:17,1.69,,Unspecified
565303,22951,60 CAKE CASES DOLLY GIRL DESIGN,2,9/2/2011 12:17,0.55,,Unspecified
565303,84375,SET OF 20 KIDS COOKIE CUTTERS,2,9/2/2011 12:17,2.1,,Unspecified
565303,21559,STRAWBERRY LUNCH BOX WITH CUTLERY,2,9/2/2011 12:17,2.55,,Unspecified
565303,21558,SKULL LUNCH BOX WITH CUTLERY ,1,9/2/2011 12:17,2.55,,Unspecified
565303,22499,WOODEN UNION JACK BUNTING,1,9/2/2011 12:17,5.95,,Unspecified
565303,22964,3 PIECE SPACEBOY COOKIE CUTTER SET,2,9/2/2011 12:17,2.1,,Unspecified
565303,22911,PAPER CHAIN KIT LONDON,1,9/2/2011 12:17,2.95,,Unspecified
565303,22549,PICTURE DOMINOES,2,9/2/2011 12:17,1.45,,Unspecified
565303,23076,ICE CREAM SUNDAE LIP GLOSS,24,9/2/2011 12:17,1.25,,Unspecified
565303,21912,VINTAGE SNAKES & LADDERS,2,9/2/2011 12:17,3.75,,Unspecified
565303,21888,BINGO SET,2,9/2/2011 12:17,3.75,,Unspecified
565303,23310,BUBBLEGUM RING ASSORTED,36,9/2/2011 12:17,0.42,,Unspecified
565303,84997C,CHILDRENS CUTLERY POLKADOT BLUE,2,9/2/2011 12:17,4.15,,Unspecified
565303,23254,CHILDRENS CUTLERY DOLLY GIRL ,2,9/2/2011 12:17,4.15,,Unspecified
565303,23255,CHILDRENS CUTLERY CIRCUS PARADE,4,9/2/2011 12:17,4.15,,Unspecified
565303,22083,PAPER CHAIN KIT RETROSPOT,2,9/2/2011 12:17,2.95,,Unspecified
565303,85019B,BLOSSOM  IMAGES NOTEBOOK SET,2,9/2/2011 12:17,1.25,,Unspecified
565303,21558,SKULL LUNCH BOX WITH CUTLERY ,1,9/2/2011 12:17,2.55,,Unspecified
565303,22911,PAPER CHAIN KIT LONDON,3,9/2/2011 12:17,2.95,,Unspecified
565303,85227,SET OF 6 3D KIT CARDS FOR KIDS,5,9/2/2011 12:17,0.85,,Unspecified
565303,22196,SMALL HEART MEASURING SPOONS,1,9/2/2011 12:17,0.85,,Unspecified
565303,20983,12 PENCILS TALL TUBE RED RETROSPOT,4,9/2/2011 12:17,0.85,,Unspecified
565303,20977,36 PENCILS TUBE WOODLAND,4,9/2/2011 12:17,1.25,,Unspecified
565303,20982,12 PENCILS TALL TUBE SKULLS,5,9/2/2011 12:17,0.85,,Unspecified
565303,23084,RABBIT NIGHT LIGHT,1,9/2/2011 12:17,2.08,,Unspecified
565303,22549,PICTURE DOMINOES,1,9/2/2011 12:17,1.45,,Unspecified
565303,85227,SET OF 6 3D KIT CARDS FOR KIDS,4,9/2/2011 12:17,0.85,,Unspecified
565303,22138,BAKING SET 9 PIECE RETROSPOT ,2,9/2/2011 12:17,4.95,,Unspecified
565303,21889,WOODEN BOX OF DOMINOES,5,9/2/2011 12:17,1.25,,Unspecified
565303,22550,HOLIDAY FUN LUDO,2,9/2/2011 12:17,3.75,,Unspecified
565303,23127,FELTCRAFT GIRL NICOLE KIT,1,9/2/2011 12:17,4.95,,Unspecified
565304,16259,,-3167,9/2/2011 12:18,0,,United Kingdom
C565305,40001,WHITE BAMBOO RIBS LAMPSHADE,-9,9/2/2011 12:18,0.64,15311,United Kingdom
C565305,75049L,LARGE CIRCULAR MIRROR MOBILE,-2,9/2/2011 12:18,0.85,15311,United Kingdom
565306,21830,sold as 1,-252,9/2/2011 12:20,0,,United Kingdom
565307,21830,?,-443,9/2/2011 12:20,0,,United Kingdom
565308,21829,sold as 1,-432,9/2/2011 12:22,0,,United Kingdom
565309,22178,VICTORIAN GLASS HANGING T-LIGHT,96,9/2/2011 12:25,1.65,15311,United Kingdom
565309,22352,LUNCH BOX WITH CUTLERY RETROSPOT ,60,9/2/2011 12:25,2.1,15311,United Kingdom
565309,21470,FLOWER VINE RAFFIA FOOD COVER,2,9/2/2011 12:25,3.75,15311,United Kingdom
565309,21669,BLUE STRIPE CERAMIC DRAWER KNOB,4,9/2/2011 12:25,1.45,15311,United Kingdom
565309,22773,GREEN DRAWER KNOB ACRYLIC EDWARDIAN,2,9/2/2011 12:25,1.25,15311,United Kingdom
565310,21829,?missing,-1897,9/2/2011 12:26,0,,United Kingdom
565311,21137,BLACK RECORD COVER FRAME,72,9/2/2011 12:33,3.39,16210,United Kingdom
565311,22041,"RECORD FRAME 7"" SINGLE SIZE ",48,9/2/2011 12:33,2.1,16210,United Kingdom
565312,84660C,PINK STITCHED WALL CLOCK,22,9/2/2011 12:37,0.79,14527,United Kingdom
565312,22847,BREAD BIN DINER STYLE IVORY,1,9/2/2011 12:37,16.95,14527,United Kingdom
565312,22795,SWEETHEART RECIPE BOOK STAND,1,9/2/2011 12:37,6.75,14527,United Kingdom
565312,21922,UNION STRIPE WITH FRINGE  HAMMOCK,1,9/2/2011 12:37,7.95,14527,United Kingdom
565312,71053,WHITE METAL LANTERN,1,9/2/2011 12:37,3.75,14527,United Kingdom
565312,21088,SET/6 FRUIT SALAD PAPER CUPS,6,9/2/2011 12:37,0.19,14527,United Kingdom
565312,21096,SET/6 FRUIT SALAD  PAPER PLATES,4,9/2/2011 12:37,0.39,14527,United Kingdom
565312,22907,PACK OF 20 NAPKINS PANTRY DESIGN,4,9/2/2011 12:37,0.85,14527,United Kingdom
565312,47591D,PINK FAIRY CAKE CHILDRENS APRON,1,9/2/2011 12:37,1.95,14527,United Kingdom
565312,22898,CHILDRENS APRON APPLES DESIGN,1,9/2/2011 12:37,1.95,14527,United Kingdom
565312,22895,SET OF 2 TEA TOWELS APPLE AND PEARS,4,9/2/2011 12:37,3.25,14527,United Kingdom
565312,23251,VINTAGE RED ENAMEL TRIM MUG ,2,9/2/2011 12:37,1.25,14527,United Kingdom
565312,21927,BLUE/CREAM STRIPE CUSHION COVER ,6,9/2/2011 12:37,1.25,14527,United Kingdom
565312,21115,ROSE CARAVAN DOORSTOP,1,9/2/2011 12:37,6.75,14527,United Kingdom
565312,23355,HOT WATER BOTTLE KEEP CALM,2,9/2/2011 12:37,4.95,14527,United Kingdom
565312,84880,WHITE WIRE EGG HOLDER,1,9/2/2011 12:37,7.5,14527,United Kingdom
565312,21906,PHARMACIE FIRST AID TIN,2,9/2/2011 12:37,6.75,14527,United Kingdom
565312,21930,JUMBO STORAGE BAG SKULLS,4,9/2/2011 12:37,2.08,14527,United Kingdom
565312,23202,JUMBO BAG VINTAGE LEAF,4,9/2/2011 12:37,2.08,14527,United Kingdom
565312,22912,YELLOW COAT RACK PARIS FASHION,1,9/2/2011 12:37,4.95,14527,United Kingdom
C565313,D,Discount,-1,9/2/2011 12:41,14.5,14527,United Kingdom
565314,84660C,,-21,9/2/2011 12:43,0,,United Kingdom
565315,22424,ENAMEL BREAD BIN CREAM,1,9/2/2011 12:51,12.75,14019,United Kingdom
565315,22993,SET OF 4 PANTRY JELLY MOULDS,72,9/2/2011 12:51,1.06,14019,United Kingdom
565315,22489,PACK OF 12 TRADITIONAL CRAYONS,24,9/2/2011 12:51,0.42,14019,United Kingdom
565315,22561,WOODEN SCHOOL COLOURING SET,12,9/2/2011 12:51,1.65,14019,United Kingdom
565315,22083,PAPER CHAIN KIT RETROSPOT,6,9/2/2011 12:51,2.95,14019,United Kingdom
565315,23188,VINTAGE  2 METER FOLDING RULER,12,9/2/2011 12:51,1.65,14019,United Kingdom
565315,23325,RUSTIC STRAWBERRY JAM POT SMALL,12,9/2/2011 12:51,1.65,14019,United Kingdom
565315,22979,PANTRY WASHING UP BRUSH,12,9/2/2011 12:51,1.45,14019,United Kingdom
565315,23250,VINTAGE RED TRIM ENAMEL BOWL ,12,9/2/2011 12:51,1.25,14019,United Kingdom
565315,22429,ENAMEL MEASURING JUG CREAM,4,9/2/2011 12:51,4.25,14019,United Kingdom
565315,23251,VINTAGE RED ENAMEL TRIM MUG ,96,9/2/2011 12:51,1.04,14019,United Kingdom
565315,22178,VICTORIAN GLASS HANGING T-LIGHT,24,9/2/2011 12:51,1.25,14019,United Kingdom
565315,22185,SLATE TILE NATURAL HANGING,12,9/2/2011 12:51,1.65,14019,United Kingdom
565315,22456,NATURAL SLATE CHALKBOARD LARGE ,3,9/2/2011 12:51,4.95,14019,United Kingdom
565315,23033,DRAWER KNOB CERAMIC RED,6,9/2/2011 12:51,1.45,14019,United Kingdom
565315,23034,DRAWER KNOB CERAMIC BLACK,6,9/2/2011 12:51,1.45,14019,United Kingdom
565315,23035,DRAWER KNOB CERAMIC IVORY,6,9/2/2011 12:51,1.45,14019,United Kingdom
565316,23321,SMALL WHITE HEART OF WICKER,12,9/2/2011 12:52,1.65,15628,United Kingdom
565316,23323,WHITE WICKER STAR ,12,9/2/2011 12:52,2.1,15628,United Kingdom
565316,22570,FELTCRAFT CUSHION RABBIT,8,9/2/2011 12:52,3.75,15628,United Kingdom
565316,23322,LARGE WHITE HEART OF WICKER,6,9/2/2011 12:52,2.95,15628,United Kingdom
565316,21213,PACK OF 72 SKULL CAKE CASES,24,9/2/2011 12:52,0.55,15628,United Kingdom
565316,22138,BAKING SET 9 PIECE RETROSPOT ,3,9/2/2011 12:52,4.95,15628,United Kingdom
565316,21790,VINTAGE SNAP CARDS,12,9/2/2011 12:52,0.85,15628,United Kingdom
565316,23227,FILIGREE HEART BUTTERFLY WHITE ,24,9/2/2011 12:52,1.25,15628,United Kingdom
565316,22961,JAM MAKING SET PRINTED,12,9/2/2011 12:52,1.45,15628,United Kingdom
565316,22144,CHRISTMAS CRAFT LITTLE FRIENDS,6,9/2/2011 12:52,2.1,15628,United Kingdom
565316,85123A,WHITE HANGING HEART T-LIGHT HOLDER,12,9/2/2011 12:52,2.95,15628,United Kingdom
565316,21733,RED HANGING HEART T-LIGHT HOLDER,6,9/2/2011 12:52,2.95,15628,United Kingdom
565316,22949,36 DOILIES DOLLY GIRL,12,9/2/2011 12:52,1.45,15628,United Kingdom
565316,22951,60 CAKE CASES DOLLY GIRL DESIGN,24,9/2/2011 12:52,0.55,15628,United Kingdom
565316,22077,6 RIBBONS RUSTIC CHARM,12,9/2/2011 12:52,1.65,15628,United Kingdom
565316,22147,FELTCRAFT BUTTERFLY HEARTS,12,9/2/2011 12:52,1.45,15628,United Kingdom
565317,23298,SPOTTY BUNTING,12,9/2/2011 13:00,4.95,12921,United Kingdom
565317,85099B,JUMBO BAG RED RETROSPOT,30,9/2/2011 13:00,2.08,12921,United Kingdom
565317,22386,JUMBO BAG PINK POLKADOT,10,9/2/2011 13:00,2.08,12921,United Kingdom
565317,21931,JUMBO STORAGE BAG SUKI,10,9/2/2011 13:00,2.08,12921,United Kingdom
565317,23201,JUMBO BAG ALPHABET,30,9/2/2011 13:00,2.08,12921,United Kingdom
565317,23203,JUMBO BAG VINTAGE DOILY ,40,9/2/2011 13:00,2.08,12921,United Kingdom
565317,22457,NATURAL SLATE HEART CHALKBOARD ,6,9/2/2011 13:00,2.95,12921,United Kingdom
565317,23202,JUMBO BAG VINTAGE LEAF,10,9/2/2011 13:00,2.08,12921,United Kingdom
565317,23199,JUMBO BAG APPLES,20,9/2/2011 13:00,2.08,12921,United Kingdom
565317,23240,SET OF 4 KNICK KNACK TINS DOILY ,12,9/2/2011 13:00,4.15,12921,United Kingdom
565317,23080,RED METAL BOX TOP SECRET,8,9/2/2011 13:00,8.25,12921,United Kingdom
565317,23081,GREEN METAL BOX ARMY SUPPLIES,4,9/2/2011 13:00,8.25,12921,United Kingdom
565317,23326,HANGING MINI COLOURED BOTTLES,48,9/2/2011 13:00,0.63,12921,United Kingdom
565317,23327,HANGING CLEAR MINI BOTTLE,48,9/2/2011 13:00,0.63,12921,United Kingdom
565318,20674,GREEN POLKADOT BOWL,16,9/2/2011 13:01,1.25,12921,United Kingdom
565318,22382,LUNCH BAG SPACEBOY DESIGN ,20,9/2/2011 13:01,1.65,12921,United Kingdom
565318,20725,LUNCH BAG RED RETROSPOT,30,9/2/2011 13:01,1.65,12921,United Kingdom
565318,20726,LUNCH BAG WOODLAND,10,9/2/2011 13:01,1.65,12921,United Kingdom
565318,20727,LUNCH BAG  BLACK SKULL.,30,9/2/2011 13:01,1.65,12921,United Kingdom
565318,23209,LUNCH BAG VINTAGE DOILY ,30,9/2/2011 13:01,1.65,12921,United Kingdom
565318,23206,LUNCH BAG APPLE DESIGN,30,9/2/2011 13:01,1.65,12921,United Kingdom
565318,22629,SPACEBOY LUNCH BOX ,12,9/2/2011 13:01,1.95,12921,United Kingdom
565318,21155,RED RETROSPOT PEG BAG,6,9/2/2011 13:01,2.55,12921,United Kingdom
565318,21122,SET/10 PINK POLKADOT PARTY CANDLES,24,9/2/2011 13:01,1.25,12921,United Kingdom
565318,84997D,CHILDRENS CUTLERY POLKADOT PINK,8,9/2/2011 13:01,4.15,12921,United Kingdom
565318,23256,CHILDRENS CUTLERY SPACEBOY ,8,9/2/2011 13:01,4.15,12921,United Kingdom
565318,21080,SET/20 RED RETROSPOT PAPER NAPKINS ,12,9/2/2011 13:01,0.85,12921,United Kingdom
565318,21086,SET/6 RED SPOTTY PAPER CUPS,12,9/2/2011 13:01,0.65,12921,United Kingdom
565318,21989,PACK OF 20 SKULL PAPER NAPKINS,12,9/2/2011 13:01,0.85,12921,United Kingdom
565318,47590B,PINK HAPPY BIRTHDAY BUNTING,6,9/2/2011 13:01,5.45,12921,United Kingdom
565318,47590A,BLUE HAPPY BIRTHDAY BUNTING,6,9/2/2011 13:01,5.45,12921,United Kingdom
565318,23285,PINK VINTAGE SPOT BEAKER,8,9/2/2011 13:01,0.85,12921,United Kingdom
565318,23286,BLUE VINTAGE SPOT BEAKER,8,9/2/2011 13:01,0.85,12921,United Kingdom
565318,23287,RED VINTAGE SPOT BEAKER,8,9/2/2011 13:01,0.85,12921,United Kingdom
565318,23288,GREEN VINTAGE SPOT BEAKER,8,9/2/2011 13:01,0.85,12921,United Kingdom
565318,23234,BISCUIT TIN VINTAGE CHRISTMAS,6,9/2/2011 13:01,2.89,12921,United Kingdom
565318,23340,VINTAGE CHRISTMAS CAKE FRILL,12,9/2/2011 13:01,1.65,12921,United Kingdom
565319,23348,,225,9/2/2011 13:07,0,,United Kingdom
565320,23204,CHARLOTTE BAG APPLES DESIGN,32,9/2/2011 13:10,0.85,16745,United Kingdom
565320,20723,STRAWBERRY CHARLOTTE BAG,100,9/2/2011 13:10,0.72,16745,United Kingdom
565320,22355,CHARLOTTE BAG SUKI DESIGN,100,9/2/2011 13:10,0.72,16745,United Kingdom
565320,22908,PACK OF 20 NAPKINS RED APPLES,1,9/2/2011 13:10,0.85,16745,United Kingdom
565320,22384,LUNCH BAG PINK POLKADOT,10,9/2/2011 13:10,1.65,16745,United Kingdom
565320,23205,CHARLOTTE BAG VINTAGE ALPHABET ,10,9/2/2011 13:10,0.85,16745,United Kingdom
565320,20727,LUNCH BAG  BLACK SKULL.,10,9/2/2011 13:10,1.65,16745,United Kingdom
565320,23297,SET 40 HEART SHAPE PETIT FOUR CASES,4,9/2/2011 13:10,1.65,16745,United Kingdom
565320,22243,5 HOOK HANGER RED MAGIC TOADSTOOL,12,9/2/2011 13:10,1.65,16745,United Kingdom
565320,22066,LOVE HEART TRINKET POT,8,9/2/2011 13:10,0.39,16745,United Kingdom
565320,21977,PACK OF 60 PINK PAISLEY CAKE CASES,120,9/2/2011 13:10,0.42,16745,United Kingdom
565320,21212,PACK OF 72 RETROSPOT CAKE CASES,120,9/2/2011 13:10,0.42,16745,United Kingdom
565320,22349,DOG BOWL CHASING BALL DESIGN,6,9/2/2011 13:10,3.75,16745,United Kingdom
565320,21974,SET OF 36 PAISLEY FLOWER DOILIES,3,9/2/2011 13:10,1.45,16745,United Kingdom
565320,23306,SET OF 36 DOILIES PANTRY DESIGN,3,9/2/2011 13:10,1.45,16745,United Kingdom
565320,21972,SET OF 36 DINOSAUR PAPER DOILIES,3,9/2/2011 13:10,1.45,16745,United Kingdom
565320,21211,SET OF 72 SKULL PAPER  DOILIES,3,9/2/2011 13:10,1.45,16745,United Kingdom
565320,21218,RED SPOTTY BISCUIT TIN,24,9/2/2011 13:10,3.25,16745,United Kingdom
565321,22423,REGENCY CAKESTAND 3 TIER,6,9/2/2011 13:14,12.75,12437,France
565321,21121,SET/10 RED POLKADOT PARTY CANDLES,24,9/2/2011 13:14,1.25,12437,France
565321,21080,SET/20 RED RETROSPOT PAPER NAPKINS ,24,9/2/2011 13:14,0.85,12437,France
565321,21208,PASTEL COLOUR HONEYCOMB FAN,12,9/2/2011 13:14,0.39,12437,France
565321,21843,RED RETROSPOT CAKE STAND,6,9/2/2011 13:14,10.95,12437,France
565321,21987,PACK OF 6 SKULL PAPER CUPS,12,9/2/2011 13:14,0.65,12437,France
565321,21558,SKULL LUNCH BOX WITH CUTLERY ,6,9/2/2011 13:14,2.55,12437,France
565321,22333,RETROSPOT PARTY BAG + STICKER SET,8,9/2/2011 13:14,1.65,12437,France
565321,POST,POSTAGE,2,9/2/2011 13:14,18,12437,France
565322,21058,PARTY INVITES WOODLAND,12,9/2/2011 13:15,0.85,12437,France
565322,22331,WOODLAND PARTY BAG + STICKER SET,16,9/2/2011 13:15,1.65,12437,France
565322,20676,RED RETROSPOT BOWL,8,9/2/2011 13:15,1.25,12437,France
565322,20675,BLUE POLKADOT BOWL,8,9/2/2011 13:15,1.25,12437,France
565322,22356,CHARLOTTE BAG PINK POLKADOT,10,9/2/2011 13:15,0.85,12437,France
C565323,21658,GLASS  BEURRE DISH,-1,9/2/2011 13:16,3.95,14606,United Kingdom
C565323,47566,PARTY BUNTING,-1,9/2/2011 13:16,4.95,14606,United Kingdom
C565323,21481,FAWN BLUE HOT WATER BOTTLE,-1,9/2/2011 13:16,3.75,14606,United Kingdom
565324,22193,RED DINER WALL CLOCK,1,9/2/2011 13:18,8.5,13232,United Kingdom
565324,23341,PINK DINER WALL CLOCK,1,9/2/2011 13:18,8.5,13232,United Kingdom
565324,21210,SET OF 72 RETROSPOT PAPER  DOILIES,2,9/2/2011 13:18,1.45,13232,United Kingdom
565324,84988,SET OF 72 PINK HEART PAPER DOILIES,1,9/2/2011 13:18,1.45,13232,United Kingdom
565324,22950,36 DOILIES VINTAGE CHRISTMAS,2,9/2/2011 13:18,1.45,13232,United Kingdom
565324,22732,3D VINTAGE CHRISTMAS STICKERS ,2,9/2/2011 13:18,1.25,13232,United Kingdom
565324,23234,BISCUIT TIN VINTAGE CHRISTMAS,2,9/2/2011 13:18,2.89,13232,United Kingdom
565324,22086,PAPER CHAIN KIT 50'S CHRISTMAS ,1,9/2/2011 13:18,2.95,13232,United Kingdom
565324,22910,PAPER CHAIN KIT VINTAGE CHRISTMAS,1,9/2/2011 13:18,2.95,13232,United Kingdom
565324,22961,JAM MAKING SET PRINTED,2,9/2/2011 13:18,1.45,13232,United Kingdom
565324,22845,VINTAGE CREAM CAT FOOD CONTAINER,1,9/2/2011 13:18,6.35,13232,United Kingdom
565324,22689,DOORMAT MERRY CHRISTMAS RED ,1,9/2/2011 13:18,8.25,13232,United Kingdom
565324,23353,6 GIFT TAGS VINTAGE CHRISTMAS ,4,9/2/2011 13:18,0.83,13232,United Kingdom
565324,22131,FOOD CONTAINER SET 3 LOVE HEART ,3,9/2/2011 13:18,1.95,13232,United Kingdom
565324,23350,ROLL WRAP VINTAGE SPOT ,2,9/2/2011 13:18,1.25,13232,United Kingdom
565324,23349,ROLL WRAP VINTAGE CHRISTMAS,2,9/2/2011 13:18,1.25,13232,United Kingdom
565324,22844,VINTAGE CREAM DOG FOOD CONTAINER,1,9/2/2011 13:18,8.5,13232,United Kingdom
565324,22910,PAPER CHAIN KIT VINTAGE CHRISTMAS,1,9/2/2011 13:18,2.95,13232,United Kingdom
565324,22086,PAPER CHAIN KIT 50'S CHRISTMAS ,1,9/2/2011 13:18,2.95,13232,United Kingdom
565324,22845,VINTAGE CREAM CAT FOOD CONTAINER,1,9/2/2011 13:18,6.35,13232,United Kingdom
565324,22852,DOG BOWL VINTAGE CREAM,2,9/2/2011 13:18,4.25,13232,United Kingdom
565324,22853,CAT BOWL VINTAGE CREAM,1,9/2/2011 13:18,3.25,13232,United Kingdom
565324,22816,CARD MOTORBIKE SANTA,24,9/2/2011 13:18,0.42,13232,United Kingdom
565324,22818,CARD CHRISTMAS VILLAGE,24,9/2/2011 13:18,0.42,13232,United Kingdom
565324,23338,EGG FRYING PAN RED ,1,9/2/2011 13:18,2.08,13232,United Kingdom
565324,22952,60 CAKE CASES VINTAGE CHRISTMAS,4,9/2/2011 13:18,0.55,13232,United Kingdom
565324,22909,SET OF 20 VINTAGE CHRISTMAS NAPKINS,4,9/2/2011 13:18,0.85,13232,United Kingdom
565324,85032D,YULETIDE IMAGES GIFT WRAP SET,2,9/2/2011 13:18,0.65,13232,United Kingdom
565324,23343,JUMBO BAG VINTAGE CHRISTMAS ,2,9/2/2011 13:18,2.08,13232,United Kingdom
565324,23198,PANTRY MAGNETIC  SHOPPING LIST,1,9/2/2011 13:18,1.45,13232,United Kingdom
565324,21216,"SET 3 RETROSPOT TEA,COFFEE,SUGAR",2,9/2/2011 13:18,4.95,13232,United Kingdom
565324,22727,ALARM CLOCK BAKELIKE RED ,1,9/2/2011 13:18,3.75,13232,United Kingdom
565324,22726,ALARM CLOCK BAKELIKE GREEN,1,9/2/2011 13:18,3.75,13232,United Kingdom
565324,22728,ALARM CLOCK BAKELIKE PINK,1,9/2/2011 13:18,3.75,13232,United Kingdom
565324,22730,ALARM CLOCK BAKELIKE IVORY,1,9/2/2011 13:18,3.75,13232,United Kingdom
565324,20725,LUNCH BAG RED RETROSPOT,1,9/2/2011 13:18,1.65,13232,United Kingdom
565324,85014A,BLACK/BLUE POLKADOT UMBRELLA,1,9/2/2011 13:18,5.95,13232,United Kingdom
565325,21429,RED GINGHAM ROSE JEWELLERY BOX,16,9/2/2011 13:22,1.95,16086,United Kingdom
565325,21929,JUMBO BAG PINK VINTAGE PAISLEY,10,9/2/2011 13:22,2.08,16086,United Kingdom
565325,23201,JUMBO BAG ALPHABET,10,9/2/2011 13:22,2.08,16086,United Kingdom
565325,85099B,JUMBO BAG RED RETROSPOT,30,9/2/2011 13:22,2.08,16086,United Kingdom
565325,21930,JUMBO STORAGE BAG SKULLS,10,9/2/2011 13:22,2.08,16086,United Kingdom
565325,23355,HOT WATER BOTTLE KEEP CALM,24,9/2/2011 13:22,4.15,16086,United Kingdom
565325,20972,PINK CREAM FELT CRAFT TRINKET BOX ,24,9/2/2011 13:22,1.25,16086,United Kingdom
