565325,11001,ASSTD DESIGN RACING CAR PEN,16,9/2/2011 13:22,1.69,16086,United Kingdom
565326,15056N,EDWARDIAN PARASOL NATURAL,1,9/2/2011 13:41,5.95,16706,United Kingdom
565326,15056BL,EDWARDIAN PARASOL BLACK,2,9/2/2011 13:41,5.95,16706,United Kingdom
565326,15056N,EDWARDIAN PARASOL NATURAL,2,9/2/2011 13:41,5.95,16706,United Kingdom
565326,20679,EDWARDIAN PARASOL RED,2,9/2/2011 13:41,5.95,16706,United Kingdom
565326,22487,WHITE WOOD GARDEN PLANT LADDER,1,9/2/2011 13:41,9.95,16706,United Kingdom
565326,23169,CLASSIC GLASS COOKIE JAR,1,9/2/2011 13:41,4.15,16706,United Kingdom
565326,84559A,3D SHEET OF DOG STICKERS,3,9/2/2011 13:41,0.85,16706,United Kingdom
565326,84559B,3D SHEET OF CAT STICKERS,3,9/2/2011 13:41,0.85,16706,United Kingdom
565326,35968,FOLK ART METAL HEART T-LIGHT HOLDER,2,9/2/2011 13:41,0.38,16706,United Kingdom
565326,84375,SET OF 20 KIDS COOKIE CUTTERS,1,9/2/2011 13:41,2.1,16706,United Kingdom
565326,21787,RAIN PONCHO RETROSPOT,4,9/2/2011 13:41,0.85,16706,United Kingdom
565326,20992,JAZZ HEARTS PURSE NOTEBOOK,2,9/2/2011 13:41,0.39,16706,United Kingdom
565326,20996,JAZZ HEARTS ADDRESS BOOK,2,9/2/2011 13:41,0.19,16706,United Kingdom
565326,21788,KIDS RAIN MAC BLUE,3,9/2/2011 13:41,0.85,16706,United Kingdom
565326,21789,KIDS RAIN MAC PINK,3,9/2/2011 13:41,0.85,16706,United Kingdom
565326,22965,3 TRADITIONAl BISCUIT CUTTERS  SET,1,9/2/2011 13:41,2.1,16706,United Kingdom
565326,84378,SET OF 3 HEART COOKIE CUTTERS,1,9/2/2011 13:41,1.45,16706,United Kingdom
565326,84380,SET OF 3 BUTTERFLY COOKIE CUTTERS,1,9/2/2011 13:41,1.45,16706,United Kingdom
565326,21636,MADRAS NOTEBOOK MEDIUM,2,9/2/2011 13:41,0.75,16706,United Kingdom
565326,47559B,TEA TIME OVEN GLOVE,1,9/2/2011 13:41,1.25,16706,United Kingdom
565326,47593B,SCOTTIE DOGS BABY BIB,2,9/2/2011 13:41,0.39,16706,United Kingdom
565326,22966,GINGERBREAD MAN COOKIE CUTTER,1,9/2/2011 13:41,1.25,16706,United Kingdom
565326,23201,JUMBO BAG ALPHABET,1,9/2/2011 13:41,2.08,16706,United Kingdom
565326,22663,JUMBO BAG DOLLY GIRL DESIGN,2,9/2/2011 13:41,2.08,16706,United Kingdom
565326,22385,JUMBO BAG SPACEBOY DESIGN,1,9/2/2011 13:41,2.08,16706,United Kingdom
565326,21872,GLAMOROUS  MUG,1,9/2/2011 13:41,1.25,16706,United Kingdom
565326,21070,VINTAGE BILLBOARD MUG ,1,9/2/2011 13:41,1.25,16706,United Kingdom
565326,21071,VINTAGE BILLBOARD DRINK ME MUG,1,9/2/2011 13:41,1.25,16706,United Kingdom
565326,84596F,SMALL MARSHMALLOWS PINK BOWL,1,9/2/2011 13:41,0.42,16706,United Kingdom
565326,84596B,SMALL DOLLY MIX DESIGN ORANGE BOWL,1,9/2/2011 13:41,0.42,16706,United Kingdom
565326,84596G,SMALL CHOCOLATES PINK BOWL,1,9/2/2011 13:41,0.42,16706,United Kingdom
565326,84596L,BISCUITS SMALL BOWL LIGHT BLUE,2,9/2/2011 13:41,0.42,16706,United Kingdom
565326,22423,REGENCY CAKESTAND 3 TIER,1,9/2/2011 13:41,12.75,16706,United Kingdom
565326,22776,SWEETHEART 3 TIER CAKE STAND ,1,9/2/2011 13:41,9.95,16706,United Kingdom
565327,85034B,3 WHITE CHOC MORRIS BOXED CANDLES,4,9/2/2011 13:48,4.25,12832,United Kingdom
565327,85173,SET/6 FROG PRINCE T-LIGHT CANDLES,6,9/2/2011 13:48,2.55,12832,United Kingdom
565327,85169A,IVORY LOVE BIRD CANDLE,12,9/2/2011 13:48,1.25,12832,United Kingdom
565327,85169B,BLACK LOVE BIRD CANDLE,12,9/2/2011 13:48,1.25,12832,United Kingdom
565327,21755,LOVE BUILDING BLOCK WORD,3,9/2/2011 13:48,5.95,12832,United Kingdom
565327,22508,DOORSTOP RETROSPOT HEART,4,9/2/2011 13:48,3.75,12832,United Kingdom
565327,21231,SWEETHEART CERAMIC TRINKET BOX,12,9/2/2011 13:48,1.25,12832,United Kingdom
565327,23081,GREEN METAL BOX ARMY SUPPLIES,2,9/2/2011 13:48,8.25,12832,United Kingdom
565327,21915,RED  HARMONICA IN BOX ,12,9/2/2011 13:48,1.25,12832,United Kingdom
565327,21790,VINTAGE SNAP CARDS,12,9/2/2011 13:48,0.85,12832,United Kingdom
565327,21889,WOODEN BOX OF DOMINOES,12,9/2/2011 13:48,1.25,12832,United Kingdom
565327,21704,BAG 250g SWIRLY MARBLES,12,9/2/2011 13:48,0.85,12832,United Kingdom
565327,72807C,SET/3 VANILLA SCENTED CANDLE IN BOX,4,9/2/2011 13:48,4.25,12832,United Kingdom
565327,22197,POPCORN HOLDER,12,9/2/2011 13:48,0.85,12832,United Kingdom
565327,22786,CUSHION COVER PINK UNION JACK,2,9/2/2011 13:48,5.95,12832,United Kingdom
565327,23355,HOT WATER BOTTLE KEEP CALM,4,9/2/2011 13:48,4.95,12832,United Kingdom
565327,22114,HOT WATER BOTTLE TEA AND SYMPATHY,4,9/2/2011 13:48,4.25,12832,United Kingdom
565327,22784,LANTERN CREAM GAZEBO ,3,9/2/2011 13:48,4.95,12832,United Kingdom
565328,22193,RED DINER WALL CLOCK,4,9/2/2011 13:50,8.5,14004,United Kingdom
565328,22191,IVORY DINER WALL CLOCK,4,9/2/2011 13:50,8.5,14004,United Kingdom
565328,22192,BLUE DINER WALL CLOCK,4,9/2/2011 13:50,8.5,14004,United Kingdom
565328,22727,ALARM CLOCK BAKELIKE RED ,8,9/2/2011 13:50,3.75,14004,United Kingdom
565328,22730,ALARM CLOCK BAKELIKE IVORY,8,9/2/2011 13:50,3.75,14004,United Kingdom
565328,22728,ALARM CLOCK BAKELIKE PINK,8,9/2/2011 13:50,3.75,14004,United Kingdom
565328,23341,PINK DINER WALL CLOCK,4,9/2/2011 13:50,8.5,14004,United Kingdom
565328,23328,SET 6 SCHOOL MILK BOTTLES IN CRATE,4,9/2/2011 13:50,3.75,14004,United Kingdom
565329,21041,RED RETROSPOT OVEN GLOVE DOUBLE,1,9/2/2011 13:54,2.95,14606,United Kingdom
565329,22795,SWEETHEART RECIPE BOOK STAND,1,9/2/2011 13:54,6.75,14606,United Kingdom
565329,22196,SMALL HEART MEASURING SPOONS,2,9/2/2011 13:54,0.85,14606,United Kingdom
565329,21539,RED RETROSPOT BUTTER DISH,1,9/2/2011 13:54,4.95,14606,United Kingdom
565329,15056N,EDWARDIAN PARASOL NATURAL,1,9/2/2011 13:54,5.95,14606,United Kingdom
565329,20749,ASSORTED COLOUR MINI CASES,2,9/2/2011 13:54,7.95,14606,United Kingdom
565329,21900,"KEY FOB , SHED",1,9/2/2011 13:54,0.65,14606,United Kingdom
565329,21899,GARAGE KEY FOB,1,9/2/2011 13:54,0.65,14606,United Kingdom
565329,21900,"KEY FOB , SHED",2,9/2/2011 13:54,0.65,14606,United Kingdom
565329,21902,"KEY FOB , FRONT  DOOR ",1,9/2/2011 13:54,0.65,14606,United Kingdom
565329,21901,"KEY FOB , BACK DOOR ",4,9/2/2011 13:54,0.65,14606,United Kingdom
565329,82580,BATHROOM METAL SIGN,4,9/2/2011 13:54,0.55,14606,United Kingdom
565329,21828,EIGHT PIECE SNAKE  SET,1,9/2/2011 13:54,1.25,14606,United Kingdom
565329,22163,HEART STRING MEMO HOLDER HANGING,1,9/2/2011 13:54,2.95,14606,United Kingdom
565329,22505,MEMO BOARD COTTAGE DESIGN,1,9/2/2011 13:54,4.95,14606,United Kingdom
565329,21973,SET OF 36 MUSHROOM PAPER DOILIES,1,9/2/2011 13:54,1.45,14606,United Kingdom
565329,21035,SET/2 RED RETROSPOT TEA TOWELS ,1,9/2/2011 13:54,3.25,14606,United Kingdom
565329,85078,SCANDINAVIAN 3 HEARTS NAPKIN RING,1,9/2/2011 13:54,0.19,14606,United Kingdom
565329,22273,FELTCRAFT DOLL MOLLY,1,9/2/2011 13:54,2.95,14606,United Kingdom
565329,21094,SET/6 RED SPOTTY PAPER PLATES,1,9/2/2011 13:54,0.85,14606,United Kingdom
565329,21666,RIDGED GLASS T-LIGHT HOLDER,2,9/2/2011 13:54,0.65,14606,United Kingdom
565329,20728,LUNCH BAG CARS BLUE,1,9/2/2011 13:54,1.65,14606,United Kingdom
565329,21446,12 RED ROSE PEG PLACE SETTINGS,1,9/2/2011 13:54,1.25,14606,United Kingdom
565329,21215,IVORY PAPER CUP CAKE CASES ,1,9/2/2011 13:54,0.55,14606,United Kingdom
565329,21580,RABBIT  DESIGN  COTTON TOTE BAG,1,9/2/2011 13:54,2.25,14606,United Kingdom
565329,20718,RED RETROSPOT SHOPPER BAG,1,9/2/2011 13:54,1.25,14606,United Kingdom
565329,85169C,EAU DE NIL LOVE BIRD CANDLE,1,9/2/2011 13:54,1.25,14606,United Kingdom
565329,84884A,ANT WHITE WIRE HEART SPIRAL,2,9/2/2011 13:54,3.95,14606,United Kingdom
565329,20777,CHRYSANTHEMUM NOTEBOOK,1,9/2/2011 13:54,1.65,14606,United Kingdom
565329,22996,TRAVEL CARD WALLET VINTAGE TICKET,1,9/2/2011 13:54,0.42,14606,United Kingdom
565329,22994,TRAVEL CARD WALLET RETROSPOT,2,9/2/2011 13:54,0.42,14606,United Kingdom
565329,22998,TRAVEL CARD WALLET KEEP CALM,2,9/2/2011 13:54,0.42,14606,United Kingdom
565329,22997,TRAVEL CARD WALLET UNION JACK,1,9/2/2011 13:54,0.42,14606,United Kingdom
565329,21849,SILVER DIAMANTE PEN IN GIFT BOX,1,9/2/2011 13:54,4.95,14606,United Kingdom
565329,22219,LOVEBIRD HANGING DECORATION WHITE ,1,9/2/2011 13:54,0.85,14606,United Kingdom
565329,22909,SET OF 20 VINTAGE CHRISTMAS NAPKINS,5,9/2/2011 13:54,0.85,14606,United Kingdom
565329,15056N,EDWARDIAN PARASOL NATURAL,1,9/2/2011 13:54,5.95,14606,United Kingdom
565329,22132,RED LOVE HEART SHAPE CUP,1,9/2/2011 13:54,0.85,14606,United Kingdom
565329,22322,BIRD DECORATION GREEN POLKADOT,3,9/2/2011 13:54,0.85,14606,United Kingdom
565329,23080,RED METAL BOX TOP SECRET,1,9/2/2011 13:54,8.25,14606,United Kingdom
565330,23188,VINTAGE  2 METER FOLDING RULER,20,9/2/2011 13:55,1.65,16989,United Kingdom
565331,85059,FRENCH ENAMEL WATER BASIN,1,9/2/2011 13:59,3.75,16674,United Kingdom
565331,23335,EGG FRYING PAN IVORY ,1,9/2/2011 13:59,2.08,16674,United Kingdom
565331,22553,PLASTERS IN TIN SKULLS,1,9/2/2011 13:59,1.65,16674,United Kingdom
565331,85015,SET OF 12  VINTAGE POSTCARD SET,1,9/2/2011 13:59,0.65,16674,United Kingdom
565331,21224,SET/4 SKULL BADGES,1,9/2/2011 13:59,1.25,16674,United Kingdom
565331,22970,LONDON BUS COFFEE MUG,1,9/2/2011 13:59,2.55,16674,United Kingdom
565331,22409,MONEY BOX BISCUITS DESIGN,1,9/2/2011 13:59,1.25,16674,United Kingdom
565331,20978,36 PENCILS TUBE SKULLS,1,9/2/2011 13:59,1.25,16674,United Kingdom
565331,21967,PACK OF 12 SKULL TISSUES,1,9/2/2011 13:59,0.39,16674,United Kingdom
565331,21213,PACK OF 72 SKULL CAKE CASES,1,9/2/2011 13:59,0.55,16674,United Kingdom
565331,22429,ENAMEL MEASURING JUG CREAM,1,9/2/2011 13:59,4.25,16674,United Kingdom
565331,21984,PACK OF 12 PINK PAISLEY TISSUES ,1,9/2/2011 13:59,0.39,16674,United Kingdom
565331,23192,BUNDLE OF 3 ALPHABET EXERCISE BOOKS,1,9/2/2011 13:59,1.65,16674,United Kingdom
565331,22441,GROW YOUR OWN BASIL IN ENAMEL MUG,1,9/2/2011 13:59,2.1,16674,United Kingdom
565331,22699,ROSES REGENCY TEACUP AND SAUCER ,1,9/2/2011 13:59,2.95,16674,United Kingdom
565331,21098,CHRISTMAS TOILET ROLL,2,9/2/2011 13:59,1.25,16674,United Kingdom
565331,23350,ROLL WRAP VINTAGE SPOT ,2,9/2/2011 13:59,1.25,16674,United Kingdom
565331,23343,JUMBO BAG VINTAGE CHRISTMAS ,2,9/2/2011 13:59,2.08,16674,United Kingdom
565331,20712,JUMBO BAG WOODLAND ANIMALS,1,9/2/2011 13:59,2.08,16674,United Kingdom
565331,21034,REX CASH+CARRY JUMBO SHOPPER,1,9/2/2011 13:59,0.95,16674,United Kingdom
565331,15056BL,EDWARDIAN PARASOL BLACK,1,9/2/2011 13:59,5.95,16674,United Kingdom
565331,21327,SKULLS WRITING SET ,1,9/2/2011 13:59,1.65,16674,United Kingdom
565331,21425,SKULLS STORAGE BOX LARGE,1,9/2/2011 13:59,2.95,16674,United Kingdom
565331,23048,SET OF 10 LANTERNS FAIRY LIGHT STAR,1,9/2/2011 13:59,4.15,16674,United Kingdom
565331,84947,ANTIQUE SILVER TEA GLASS ENGRAVED,6,9/2/2011 13:59,1.25,16674,United Kingdom
565331,22791,T-LIGHT GLASS FLUTED ANTIQUE,12,9/2/2011 13:59,1.25,16674,United Kingdom
565331,23082,SET 6 PAPER TABLE LANTERN HEARTS ,3,9/2/2011 13:59,3.75,16674,United Kingdom
565331,22072,RED RETROSPOT TEA CUP AND SAUCER ,1,9/2/2011 13:59,3.75,16674,United Kingdom
565331,22178,VICTORIAN GLASS HANGING T-LIGHT,6,9/2/2011 13:59,1.95,16674,United Kingdom
565331,22699,ROSES REGENCY TEACUP AND SAUCER ,1,9/2/2011 13:59,2.95,16674,United Kingdom
565331,23048,SET OF 10 LANTERNS FAIRY LIGHT STAR,1,9/2/2011 13:59,4.15,16674,United Kingdom
565331,23328,SET 6 SCHOOL MILK BOTTLES IN CRATE,2,9/2/2011 13:59,3.75,16674,United Kingdom
565331,21972,SET OF 36 DINOSAUR PAPER DOILIES,1,9/2/2011 13:59,1.45,16674,United Kingdom
565331,21059,PARTY INVITES DINOSAURS,2,9/2/2011 13:59,0.85,16674,United Kingdom
565331,22334,DINOSAUR PARTY BAG + STICKER SET,1,9/2/2011 13:59,1.65,16674,United Kingdom
565332,47566,PARTY BUNTING,8,9/2/2011 14:09,4.95,13695,United Kingdom
565332,23332,IVORY WICKER HEART LARGE,24,9/2/2011 14:09,1.65,13695,United Kingdom
565332,23322,LARGE WHITE HEART OF WICKER,12,9/2/2011 14:09,2.95,13695,United Kingdom
565332,22960,JAM MAKING SET WITH JARS,6,9/2/2011 14:09,4.25,13695,United Kingdom
565332,22961,JAM MAKING SET PRINTED,12,9/2/2011 14:09,1.45,13695,United Kingdom
565332,84970L,SINGLE HEART ZINC T-LIGHT HOLDER,24,9/2/2011 14:09,0.95,13695,United Kingdom
565332,84970S,HANGING HEART ZINC T-LIGHT HOLDER,24,9/2/2011 14:09,0.85,13695,United Kingdom
565332,84947,ANTIQUE SILVER TEA GLASS ENGRAVED,72,9/2/2011 14:09,1.06,13695,United Kingdom
565332,84946,ANTIQUE SILVER T-LIGHT GLASS,24,9/2/2011 14:09,1.25,13695,United Kingdom
565332,21136,PAINTED METAL PEARS ASSORTED,16,9/2/2011 14:09,1.69,13695,United Kingdom
565332,23323,WHITE WICKER STAR ,6,9/2/2011 14:09,2.1,13695,United Kingdom
565332,84879,ASSORTED COLOUR BIRD ORNAMENT,8,9/2/2011 14:09,1.69,13695,United Kingdom
565332,23145,ZINC T-LIGHT HOLDER STAR LARGE,12,9/2/2011 14:09,0.95,13695,United Kingdom
565332,23144,ZINC T-LIGHT HOLDER STARS SMALL,12,9/2/2011 14:09,0.83,13695,United Kingdom
565333,84997D,CHILDRENS CUTLERY POLKADOT PINK,8,9/2/2011 14:23,4.15,12375,Finland
565333,84997C,CHILDRENS CUTLERY POLKADOT BLUE,4,9/2/2011 14:23,4.15,12375,Finland
565333,20719,WOODLAND CHARLOTTE BAG,10,9/2/2011 14:23,0.85,12375,Finland
565333,22356,CHARLOTTE BAG PINK POLKADOT,10,9/2/2011 14:23,0.85,12375,Finland
565333,23200,JUMBO BAG PEARS,10,9/2/2011 14:23,2.08,12375,Finland
565333,23203,JUMBO BAG VINTAGE DOILY ,10,9/2/2011 14:23,2.08,12375,Finland
565333,20713,JUMBO BAG OWLS,10,9/2/2011 14:23,2.08,12375,Finland
565333,20749,ASSORTED COLOUR MINI CASES,4,9/2/2011 14:23,7.95,12375,Finland
565333,22355,CHARLOTTE BAG SUKI DESIGN,10,9/2/2011 14:23,0.85,12375,Finland
565333,21929,JUMBO BAG PINK VINTAGE PAISLEY,10,9/2/2011 14:23,2.08,12375,Finland
565333,POST,POSTAGE,1,9/2/2011 14:23,40,12375,Finland
565338,23295,SET OF 12 MINI LOAF BAKING CASES,24,9/2/2011 14:39,0.83,14948,United Kingdom
565338,21212,PACK OF 72 RETROSPOT CAKE CASES,24,9/2/2011 14:39,0.55,14948,United Kingdom
565338,23340,VINTAGE CHRISTMAS CAKE FRILL,12,9/2/2011 14:39,1.65,14948,United Kingdom
565338,21884,CAKES AND BOWS GIFT  TAPE,12,9/2/2011 14:39,0.65,14948,United Kingdom
565338,21125,SET 6 FOOTBALL CELEBRATION CANDLES,12,9/2/2011 14:39,1.25,14948,United Kingdom
565338,23293,SET OF 12 FAIRY CAKE BAKING CASES,8,9/2/2011 14:39,0.83,14948,United Kingdom
565346,20893,HANGING BAUBLE T-LIGHT HOLDER SMALL,3,9/2/2011 14:41,2.55,,United Kingdom
565346,20894,HANGING BAUBLE T-LIGHT HOLDER LARGE,3,9/2/2011 14:41,2.95,,United Kingdom
565350,22668,PINK BABY BUNTING,3,9/2/2011 14:42,2.95,14178,United Kingdom
565350,37342,POLKADOT COFFEE CUP & SAUCER PINK,1,9/2/2011 14:42,0.79,14178,United Kingdom
565350,15056P,EDWARDIAN PARASOL PINK,1,9/2/2011 14:42,5.95,14178,United Kingdom
565350,22548,HEADS AND TAILS SPORTING FUN,3,9/2/2011 14:42,1.25,14178,United Kingdom
565350,21403,BLUE EGG  SPOON,24,9/2/2011 14:42,0.12,14178,United Kingdom
565350,21790,VINTAGE SNAP CARDS,3,9/2/2011 14:42,0.85,14178,United Kingdom
565350,22623,BOX OF VINTAGE JIGSAW BLOCKS ,3,9/2/2011 14:42,5.95,14178,United Kingdom
565350,22037,ROBOT BIRTHDAY CARD,12,9/2/2011 14:42,0.42,14178,United Kingdom
565350,22630,DOLLY GIRL LUNCH BOX,3,9/2/2011 14:42,1.95,14178,United Kingdom
565350,22629,SPACEBOY LUNCH BOX ,3,9/2/2011 14:42,1.95,14178,United Kingdom
565350,23346,SPACEBOY BEAKER,6,9/2/2011 14:42,1.25,14178,United Kingdom
565350,22620,4 TRADITIONAL SPINNING TOPS,3,9/2/2011 14:42,1.45,14178,United Kingdom
565350,22621,TRADITIONAL KNITTING NANCY,3,9/2/2011 14:42,1.65,14178,United Kingdom
565350,21892,TRADITIONAL WOODEN CATCH CUP GAME ,3,9/2/2011 14:42,1.25,14178,United Kingdom
565350,85208,SET/12 FUNKY FELT FLOWER PEG IN BAG,1,9/2/2011 14:42,2.1,14178,United Kingdom
565350,22617,BAKING SET SPACEBOY DESIGN,12,9/2/2011 14:42,4.95,14178,United Kingdom
565350,21394,RED POLKADOT BEAKER ,24,9/2/2011 14:42,0.39,14178,United Kingdom
565350,22139,RETROSPOT TEA SET CERAMIC 11 PC ,6,9/2/2011 14:42,4.95,14178,United Kingdom
565366,21928,JUMBO BAG SCANDINAVIAN BLUE PAISLEY,10,9/2/2011 14:56,2.08,17091,United Kingdom
565366,21931,JUMBO STORAGE BAG SUKI,10,9/2/2011 14:56,2.08,17091,United Kingdom
565366,21930,JUMBO STORAGE BAG SKULLS,10,9/2/2011 14:56,2.08,17091,United Kingdom
565366,22386,JUMBO BAG PINK POLKADOT,10,9/2/2011 14:56,2.08,17091,United Kingdom
565366,23199,JUMBO BAG APPLES,10,9/2/2011 14:56,2.08,17091,United Kingdom
565366,23200,JUMBO BAG PEARS,10,9/2/2011 14:56,2.08,17091,United Kingdom
565366,22385,JUMBO BAG SPACEBOY DESIGN,10,9/2/2011 14:56,2.08,17091,United Kingdom
565366,22663,JUMBO BAG DOLLY GIRL DESIGN,10,9/2/2011 14:56,2.08,17091,United Kingdom
565366,23201,JUMBO BAG ALPHABET,10,9/2/2011 14:56,2.08,17091,United Kingdom
565366,23202,JUMBO BAG VINTAGE LEAF,10,9/2/2011 14:56,2.08,17091,United Kingdom
565366,23203,JUMBO BAG VINTAGE DOILY ,10,9/2/2011 14:56,2.08,17091,United Kingdom
565366,85099B,JUMBO BAG RED RETROSPOT,10,9/2/2011 14:56,2.08,17091,United Kingdom
565366,22662,LUNCH BAG DOLLY GIRL DESIGN,10,9/2/2011 14:56,1.65,17091,United Kingdom
565366,22384,LUNCH BAG PINK POLKADOT,10,9/2/2011 14:56,1.65,17091,United Kingdom
565366,84997A,CHILDRENS CUTLERY POLKADOT GREEN ,4,9/2/2011 14:56,4.15,17091,United Kingdom
565366,84997C,CHILDRENS CUTLERY POLKADOT BLUE,4,9/2/2011 14:56,4.15,17091,United Kingdom
565366,84997D,CHILDRENS CUTLERY POLKADOT PINK,4,9/2/2011 14:56,4.15,17091,United Kingdom
565366,23206,LUNCH BAG APPLE DESIGN,10,9/2/2011 14:56,1.65,17091,United Kingdom
565366,20725,LUNCH BAG RED RETROSPOT,10,9/2/2011 14:56,1.65,17091,United Kingdom
565366,22507,MEMO BOARD RETROSPOT  DESIGN,4,9/2/2011 14:56,4.95,17091,United Kingdom
565366,22632,HAND WARMER RED RETROSPOT,12,9/2/2011 14:56,2.1,17091,United Kingdom
565366,23254,CHILDRENS CUTLERY DOLLY GIRL ,4,9/2/2011 14:56,4.15,17091,United Kingdom
565366,22835,HOT WATER BOTTLE I AM SO POORLY,4,9/2/2011 14:56,4.65,17091,United Kingdom
565366,84029E,RED WOOLLY HOTTIE WHITE HEART.,4,9/2/2011 14:56,3.95,17091,United Kingdom
565366,23357,HOT WATER BOTTLE SEX BOMB,4,9/2/2011 14:56,4.95,17091,United Kingdom
565366,21479,WHITE SKULL HOT WATER BOTTLE ,4,9/2/2011 14:56,3.75,17091,United Kingdom
565366,20727,LUNCH BAG  BLACK SKULL.,10,9/2/2011 14:56,1.65,17091,United Kingdom
565366,22382,LUNCH BAG SPACEBOY DESIGN ,10,9/2/2011 14:56,1.65,17091,United Kingdom
565366,23208,LUNCH BAG VINTAGE LEAF DESIGN,10,9/2/2011 14:56,1.65,17091,United Kingdom
565366,21485,RETROSPOT HEART HOT WATER BOTTLE,3,9/2/2011 14:56,4.95,17091,United Kingdom
565366,23356,LOVE HOT WATER BOTTLE,3,9/2/2011 14:56,5.95,17091,United Kingdom
565366,23355,HOT WATER BOTTLE KEEP CALM,4,9/2/2011 14:56,4.95,17091,United Kingdom
565366,23358,HOT STUFF HOT WATER BOTTLE,6,9/2/2011 14:56,3.75,17091,United Kingdom
565366,22112,CHOCOLATE HOT WATER BOTTLE,3,9/2/2011 14:56,4.95,17091,United Kingdom
565366,22111,SCOTTIE DOG HOT WATER BOTTLE,3,9/2/2011 14:56,4.95,17091,United Kingdom
565366,22802,FAUX FUR CHOCOLATE THROW,1,9/2/2011 14:56,19.95,17091,United Kingdom
565366,47566,PARTY BUNTING,4,9/2/2011 14:56,4.95,17091,United Kingdom
565367,23119,PACK OF 6 LARGE FRUIT STRAWS ,12,9/2/2011 14:56,0.62,17091,United Kingdom
565368,21784,,1,9/2/2011 14:59,0,,United Kingdom
565369,37342,,1,9/2/2011 15:02,0,,United Kingdom
565370,82494L,crushed ctn,-33,9/2/2011 15:04,0,,United Kingdom
565371,82483,crushed,-13,9/2/2011 15:04,0,,United Kingdom
565372,84029E,RED WOOLLY HOTTIE WHITE HEART.,48,9/2/2011 15:05,3.39,17090,United Kingdom
565376,21682,,144,9/2/2011 15:10,0,,United Kingdom
565377,M,Manual,1,9/2/2011 15:12,852.8,18087,United Kingdom
565378,21485,RETROSPOT HEART HOT WATER BOTTLE,1,9/2/2011 15:16,7.46,,United Kingdom
565378,21670,BLUE SPOT CERAMIC DRAWER KNOB,8,9/2/2011 15:16,3.29,,United Kingdom
565378,21671,RED SPOT CERAMIC DRAWER KNOB,1,9/2/2011 15:16,3.29,,United Kingdom
565378,21714,CITRONELLA CANDLE GARDEN POT,12,9/2/2011 15:16,3.29,,United Kingdom
565378,22041,"RECORD FRAME 7"" SINGLE SIZE ",11,9/2/2011 15:16,5.79,,United Kingdom
565378,22079,RIBBON REEL HEARTS DESIGN ,1,9/2/2011 15:16,2.46,,United Kingdom
565378,22111,SCOTTIE DOG HOT WATER BOTTLE,1,9/2/2011 15:16,12.46,,United Kingdom
565378,22112,CHOCOLATE HOT WATER BOTTLE,8,9/2/2011 15:16,12.46,,United Kingdom
565378,22114,HOT WATER BOTTLE TEA AND SYMPATHY,7,9/2/2011 15:16,9.13,,United Kingdom
565378,22174,PHOTO CUBE,2,9/2/2011 15:16,4.13,,United Kingdom
565378,22197,POPCORN HOLDER,37,9/2/2011 15:16,1.63,,United Kingdom
565378,22327,ROUND SNACK BOXES SET OF 4 SKULLS,4,9/2/2011 15:16,6.63,,United Kingdom
565378,22355,CHARLOTTE BAG SUKI DESIGN,60,9/2/2011 15:16,2.46,,United Kingdom
565378,22356,CHARLOTTE BAG PINK POLKADOT,14,9/2/2011 15:16,2.46,,United Kingdom
565378,22382,LUNCH BAG SPACEBOY DESIGN ,10,9/2/2011 15:16,4.96,,United Kingdom
565378,22383,LUNCH BAG SUKI DESIGN ,11,9/2/2011 15:16,4.96,,United Kingdom
565378,22423,REGENCY CAKESTAND 3 TIER,5,9/2/2011 15:16,24.96,,United Kingdom
565378,22426,ENAMEL WASH BOWL CREAM,1,9/2/2011 15:16,8.29,,United Kingdom
565378,22645,CERAMIC HEART FAIRY CAKE MONEY BANK,8,9/2/2011 15:16,4.13,,United Kingdom
565378,22665,RECIPE BOX BLUE SKETCHBOOK DESIGN,1,9/2/2011 15:16,6.63,,United Kingdom
565378,22666,RECIPE BOX PANTRY YELLOW DESIGN,10,9/2/2011 15:16,6.63,,United Kingdom
565378,22726,ALARM CLOCK BAKELIKE GREEN,2,9/2/2011 15:16,8.29,,United Kingdom
565378,22727,ALARM CLOCK BAKELIKE RED ,3,9/2/2011 15:16,8.29,,United Kingdom
565378,22729,ALARM CLOCK BAKELIKE ORANGE,1,9/2/2011 15:16,8.29,,United Kingdom
565378,22730,ALARM CLOCK BAKELIKE IVORY,1,9/2/2011 15:16,8.29,,United Kingdom
565378,22732,3D VINTAGE CHRISTMAS STICKERS ,2,9/2/2011 15:16,1.63,,United Kingdom
565378,22733,3D TRADITIONAL CHRISTMAS STICKERS,1,9/2/2011 15:16,1.63,,United Kingdom
565378,22737,RIBBON REEL CHRISTMAS PRESENT ,1,9/2/2011 15:16,7.5,,United Kingdom
565378,22739,RIBBON REEL CHRISTMAS SOCK BAUBLE,2,9/2/2011 15:16,4.13,,United Kingdom
565378,22745,POPPY'S PLAYHOUSE BEDROOM ,1,9/2/2011 15:16,3.29,,United Kingdom
565378,22746,POPPY'S PLAYHOUSE LIVINGROOM ,1,9/2/2011 15:16,3.29,,United Kingdom
565378,22747,POPPY'S PLAYHOUSE BATHROOM,1,9/2/2011 15:16,3.29,,United Kingdom
565378,22775,PURPLE DRAWERKNOB ACRYLIC EDWARDIAN,7,9/2/2011 15:16,2.46,,United Kingdom
565378,22835,HOT WATER BOTTLE I AM SO POORLY,2,9/2/2011 15:16,7.46,,United Kingdom
565378,22896,PEG BAG APPLES DESIGN,1,9/2/2011 15:16,5.79,,United Kingdom
565378,22910,PAPER CHAIN KIT VINTAGE CHRISTMAS,1,9/2/2011 15:16,6.63,,United Kingdom
565378,23168,CLASSIC CAFE SUGAR DISPENSER,14,9/2/2011 15:16,3.29,,United Kingdom
565378,23204,CHARLOTTE BAG APPLES DESIGN,11,9/2/2011 15:16,2.46,,United Kingdom
565378,23205,CHARLOTTE BAG VINTAGE ALPHABET ,11,9/2/2011 15:16,2.46,,United Kingdom
565378,23206,LUNCH BAG APPLE DESIGN,18,9/2/2011 15:16,4.96,,United Kingdom
565378,23206,LUNCH BAG APPLE DESIGN,1,9/2/2011 15:16,5.63,,United Kingdom
565378,23207,LUNCH BAG ALPHABET DESIGN,2,9/2/2011 15:16,4.96,,United Kingdom
565378,23208,LUNCH BAG VINTAGE LEAF DESIGN,1,9/2/2011 15:16,4.96,,United Kingdom
565378,23208,LUNCH BAG VINTAGE LEAF DESIGN,1,9/2/2011 15:16,5.63,,United Kingdom
565378,23298,SPOTTY BUNTING,15,9/2/2011 15:16,10.79,,United Kingdom
565378,35970,ZINC FOLKART SLEIGH BELLS,1,9/2/2011 15:16,8.33,,United Kingdom
565378,47566,PARTY BUNTING,28,9/2/2011 15:16,10.79,,United Kingdom
565378,79321,CHILLI LIGHTS,1,9/2/2011 15:16,12.46,,United Kingdom
565378,82583,HOT BATHS METAL SIGN,10,9/2/2011 15:16,4.96,,United Kingdom
565378,84029E,RED WOOLLY HOTTIE WHITE HEART.,5,9/2/2011 15:16,7.46,,United Kingdom
565378,84031A,CHARLIE+LOLA RED HOT WATER BOTTLE ,2,9/2/2011 15:16,4.96,,United Kingdom
565378,84692,BOX OF 24 COCKTAIL PARASOLS,8,9/2/2011 15:16,1.63,,United Kingdom
565378,84997b,CHILDRENS CUTLERY RETROSPOT RED ,6,9/2/2011 15:16,8.29,,United Kingdom
565378,84997c,CHILDRENS CUTLERY POLKADOT BLUE,4,9/2/2011 15:16,8.29,,United Kingdom
565378,84997d,CHILDRENS CUTLERY POLKADOT PINK,5,9/2/2011 15:16,8.29,,United Kingdom
565378,20675,BLUE POLKADOT BOWL,3,9/2/2011 15:16,2.46,,United Kingdom
565378,20677,PINK POLKADOT BOWL,3,9/2/2011 15:16,2.46,,United Kingdom
565378,20719,WOODLAND CHARLOTTE BAG,28,9/2/2011 15:16,2.46,,United Kingdom
565378,20723,STRAWBERRY CHARLOTTE BAG,38,9/2/2011 15:16,2.46,,United Kingdom
565378,20724,RED RETROSPOT CHARLOTTE BAG,12,9/2/2011 15:16,2.46,,United Kingdom
565378,20726,LUNCH BAG WOODLAND,11,9/2/2011 15:16,4.96,,United Kingdom
565378,20726,LUNCH BAG WOODLAND,1,9/2/2011 15:16,8.33,,United Kingdom
565378,20727,LUNCH BAG  BLACK SKULL.,17,9/2/2011 15:16,4.96,,United Kingdom
565378,20727,LUNCH BAG  BLACK SKULL.,1,9/2/2011 15:16,8.33,,United Kingdom
565378,20728,LUNCH BAG CARS BLUE,14,9/2/2011 15:16,4.96,,United Kingdom
565378,21041,RED RETROSPOT OVEN GLOVE DOUBLE,1,9/2/2011 15:16,6.63,,United Kingdom
565378,21154,RED RETROSPOT OVEN GLOVE ,1,9/2/2011 15:16,3.29,,United Kingdom
565378,21155,RED RETROSPOT PEG BAG,7,9/2/2011 15:16,4.96,,United Kingdom
565378,21212,PACK OF 72 RETROSPOT CAKE CASES,11,9/2/2011 15:16,2.08,,United Kingdom
565378,21213,PACK OF 72 SKULL CAKE CASES,6,9/2/2011 15:16,2.08,,United Kingdom
565378,21232,STRAWBERRY CERAMIC TRINKET BOX,8,9/2/2011 15:16,3.29,,United Kingdom
565378,21238,RED RETROSPOT CUP,2,9/2/2011 15:16,1.63,,United Kingdom
565378,21239,PINK  POLKADOT CUP,2,9/2/2011 15:16,1.63,,United Kingdom
565378,21240,BLUE POLKADOT CUP,3,9/2/2011 15:16,1.63,,United Kingdom
565378,21243,PINK  POLKADOT PLATE ,1,9/2/2011 15:16,3.29,,United Kingdom
565378,21244,BLUE POLKADOT PLATE ,4,9/2/2011 15:16,3.29,,United Kingdom
565378,21479,WHITE SKULL HOT WATER BOTTLE ,3,9/2/2011 15:16,8.29,,United Kingdom
565378,21484,CHICK GREY HOT WATER BOTTLE,1,9/2/2011 15:16,8.29,,United Kingdom
C565379,85099B,JUMBO BAG RED RETROSPOT,-1,9/2/2011 15:17,2.08,14415,United Kingdom
C565379,23184,BULL DOG BOTTLE OPENER,-1,9/2/2011 15:17,4.95,14415,United Kingdom
565380,22423,REGENCY CAKESTAND 3 TIER,16,9/2/2011 15:20,10.95,14463,United Kingdom
565380,84947,ANTIQUE SILVER TEA GLASS ENGRAVED,36,9/2/2011 15:20,1.25,14463,United Kingdom
565381,22800,ANTIQUE TALL SWIRLGLASS TRINKET POT,4,9/2/2011 15:23,3.75,16173,United Kingdom
565381,22801,ANTIQUE GLASS PEDESTAL BOWL,4,9/2/2011 15:23,3.75,16173,United Kingdom
565381,21314,SMALL GLASS HEART TRINKET POT,8,9/2/2011 15:23,2.1,16173,United Kingdom
565381,22798,ANTIQUE GLASS DRESSING TABLE POT,8,9/2/2011 15:23,2.95,16173,United Kingdom
