565381,23065,LARGE DECO JEWELLERY STAND,1,9/2/2011 15:23,12.5,16173,United Kingdom
565381,23066,SMALL DECO JEWELLERY STAND,2,9/2/2011 15:23,8.25,16173,United Kingdom
565381,21108,FAIRY CAKE FLANNEL ASSORTED COLOUR,9,9/2/2011 15:23,2.55,16173,United Kingdom
565381,21107,CREAM SLICE FLANNEL PINK SPOT ,6,9/2/2011 15:23,2.95,16173,United Kingdom
565381,21326,AGED GLASS SILVER T-LIGHT HOLDER,12,9/2/2011 15:23,0.65,16173,United Kingdom
565381,85053,FRENCH ENAMEL CANDLEHOLDER,6,9/2/2011 15:23,2.1,16173,United Kingdom
565381,82486,3 DRAWER ANTIQUE WHITE WOOD CABINET,2,9/2/2011 15:23,8.95,16173,United Kingdom
565381,82483,WOOD 2 DRAWER CABINET WHITE FINISH,2,9/2/2011 15:23,6.95,16173,United Kingdom
565381,23091,ZINC HERB GARDEN CONTAINER,3,9/2/2011 15:23,6.25,16173,United Kingdom
565381,22487,WHITE WOOD GARDEN PLANT LADDER,1,9/2/2011 15:23,9.95,16173,United Kingdom
565381,22430,ENAMEL WATERING CAN CREAM,4,9/2/2011 15:23,4.95,16173,United Kingdom
565381,82484,WOOD BLACK BOARD ANT WHITE FINISH,2,9/2/2011 15:23,7.95,16173,United Kingdom
565381,22457,NATURAL SLATE HEART CHALKBOARD ,6,9/2/2011 15:23,2.95,16173,United Kingdom
565381,82482,WOODEN PICTURE FRAME WHITE FINISH,6,9/2/2011 15:23,2.55,16173,United Kingdom
565381,22796,PHOTO FRAME 3 CLASSIC HANGING,2,9/2/2011 15:23,9.95,16173,United Kingdom
565381,22768,FAMILY PHOTO FRAME CORNICE,2,9/2/2011 15:23,9.95,16173,United Kingdom
565381,22767,TRIPLE PHOTO FRAME CORNICE ,2,9/2/2011 15:23,9.95,16173,United Kingdom
565381,21381,MINI WOODEN HAPPY BIRTHDAY GARLAND,12,9/2/2011 15:23,1.69,16173,United Kingdom
565381,22770,MIRROR CORNICE,1,9/2/2011 15:23,14.95,16173,United Kingdom
565381,22469,HEART OF WICKER SMALL,12,9/2/2011 15:23,1.65,16173,United Kingdom
565381,23077,DOUGHNUT LIP GLOSS ,20,9/2/2011 15:23,1.25,16173,United Kingdom
565383,20718,RED RETROSPOT SHOPPER BAG,1,9/2/2011 15:45,2.46,14096,United Kingdom
565383,20733,GOLD MINI TAPE MEASURE ,2,9/2/2011 15:45,0.83,14096,United Kingdom
565383,21914,BLUE HARMONICA IN BOX ,1,9/2/2011 15:45,2.46,14096,United Kingdom
565383,22086,PAPER CHAIN KIT 50'S CHRISTMAS ,1,9/2/2011 15:45,5.79,14096,United Kingdom
565383,22188,BLACK HEART CARD HOLDER,1,9/2/2011 15:45,8.29,14096,United Kingdom
565383,22354,RETROSPOT PADDED SEAT CUSHION,1,9/2/2011 15:45,7.46,14096,United Kingdom
565383,22356,CHARLOTTE BAG PINK POLKADOT,2,9/2/2011 15:45,1.63,14096,United Kingdom
565383,22446,PIN CUSHION BABUSHKA PINK,2,9/2/2011 15:45,2.46,14096,United Kingdom
565383,22457,NATURAL SLATE HEART CHALKBOARD ,1,9/2/2011 15:45,5.79,14096,United Kingdom
565383,22492,MINI PAINT SET VINTAGE ,1,9/2/2011 15:45,1.63,14096,United Kingdom
565383,22812,PACK 3 BOXES CHRISTMAS PANNETONE,1,9/2/2011 15:45,4.13,14096,United Kingdom
565383,22896,PEG BAG APPLES DESIGN,1,9/2/2011 15:45,4.96,14096,United Kingdom
565383,22897,OVEN MITT APPLES DESIGN,1,9/2/2011 15:45,3.29,14096,United Kingdom
565383,22939,ADULT APRON APPLE DELIGHT,1,9/2/2011 15:45,10.79,14096,United Kingdom
565383,22961,JAM MAKING SET PRINTED,1,9/2/2011 15:45,3.29,14096,United Kingdom
