572294,23380,PACK OF 12 VINTAGE DOILY TISSUES,12,10/23/2011 13:10,0.39,13471,United Kingdom
572294,23377,PACK OF 12 DOLLY GIRL TISSUES,12,10/23/2011 13:10,0.39,13471,United Kingdom
572294,21980,PACK OF 12 RED RETROSPOT TISSUES ,12,10/23/2011 13:10,0.39,13471,United Kingdom
572294,22625,RED KITCHEN SCALES,2,10/23/2011 13:10,8.5,13471,United Kingdom
572294,21716,BOYS VINTAGE TIN SEASIDE BUCKET,8,10/23/2011 13:10,2.55,13471,United Kingdom
572294,21715,GIRLS VINTAGE TIN SEASIDE BUCKET,8,10/23/2011 13:10,2.55,13471,United Kingdom
572294,22978,PANTRY ROLLING PIN,2,10/23/2011 13:10,3.75,13471,United Kingdom
572294,22907,PACK OF 20 NAPKINS PANTRY DESIGN,5,10/23/2011 13:10,0.85,13471,United Kingdom
572294,20718,RED RETROSPOT SHOPPER BAG,20,10/23/2011 13:10,1.25,13471,United Kingdom
572294,21411,GINGHAM HEART  DOORSTOP RED,2,10/23/2011 13:10,4.25,13471,United Kingdom
572294,20725,LUNCH BAG RED RETROSPOT,10,10/23/2011 13:10,1.65,13471,United Kingdom
572294,21429,RED GINGHAM ROSE JEWELLERY BOX,4,10/23/2011 13:10,1.95,13471,United Kingdom
572294,22522,CHILDS GARDEN FORK BLUE ,5,10/23/2011 13:10,0.85,13471,United Kingdom
572294,22523,CHILDS GARDEN FORK PINK,5,10/23/2011 13:10,0.85,13471,United Kingdom
572294,22514,CHILDS GARDEN SPADE BLUE,4,10/23/2011 13:10,2.1,13471,United Kingdom
572294,22515,CHILDS GARDEN SPADE PINK,4,10/23/2011 13:10,2.1,13471,United Kingdom
572294,21558,SKULL LUNCH BOX WITH CUTLERY ,2,10/23/2011 13:10,2.55,13471,United Kingdom
572294,22567,20 DOLLY PEGS RETROSPOT,1,10/23/2011 13:10,1.45,13471,United Kingdom
572294,21154,RED RETROSPOT OVEN GLOVE ,2,10/23/2011 13:10,1.25,13471,United Kingdom
572294,23198,PANTRY MAGNETIC  SHOPPING LIST,4,10/23/2011 13:10,1.45,13471,United Kingdom
572294,21986,PACK OF 12 PINK POLKADOT TISSUES,12,10/23/2011 13:10,0.39,13471,United Kingdom
572294,21718,RED METAL BEACH SPADE ,16,10/23/2011 13:10,1.25,13471,United Kingdom
572294,23184,BULL DOG BOTTLE OPENER,3,10/23/2011 13:10,4.95,13471,United Kingdom
572294,21559,STRAWBERRY LUNCH BOX WITH CUTLERY,2,10/23/2011 13:10,2.55,13471,United Kingdom
572294,20754,RETROSPOT RED WASHING UP GLOVES,6,10/23/2011 13:10,2.1,13471,United Kingdom
572294,23300,GARDENERS KNEELING PAD CUP OF TEA ,5,10/23/2011 13:10,1.65,13471,United Kingdom
572294,23301,GARDENERS KNEELING PAD KEEP CALM ,5,10/23/2011 13:10,1.65,13471,United Kingdom
572294,23366,SET 12 COLOURING PENCILS DOILY,48,10/23/2011 13:10,0.65,13471,United Kingdom
572294,22193,RED DINER WALL CLOCK,2,10/23/2011 13:10,8.5,13471,United Kingdom
572294,21974,SET OF 36 PAISLEY FLOWER DOILIES,6,10/23/2011 13:10,1.45,13471,United Kingdom
572294,21211,SET OF 72 SKULL PAPER  DOILIES,4,10/23/2011 13:10,1.45,13471,United Kingdom
572294,84987,SET OF 36 TEATIME PAPER DOILIES,6,10/23/2011 13:10,1.45,13471,United Kingdom
572294,23306,SET OF 36 DOILIES PANTRY DESIGN,6,10/23/2011 13:10,1.45,13471,United Kingdom
572294,84988,SET OF 72 PINK HEART PAPER DOILIES,5,10/23/2011 13:10,1.45,13471,United Kingdom
572294,21155,RED RETROSPOT PEG BAG,10,10/23/2011 13:10,2.55,13471,United Kingdom
572294,21625,VINTAGE UNION JACK APRON,5,10/23/2011 13:10,6.95,13471,United Kingdom
572294,22899,CHILDREN'S APRON DOLLY GIRL ,8,10/23/2011 13:10,2.1,13471,United Kingdom
572294,21154,RED RETROSPOT OVEN GLOVE ,3,10/23/2011 13:10,1.25,13471,United Kingdom
572294,47591D,PINK FAIRY CAKE CHILDRENS APRON,6,10/23/2011 13:10,1.95,13471,United Kingdom
572294,21156,RETROSPOT CHILDRENS APRON,7,10/23/2011 13:10,1.95,13471,United Kingdom
572294,22367,CHILDRENS APRON SPACEBOY DESIGN,5,10/23/2011 13:10,1.95,13471,United Kingdom
572294,22666,RECIPE BOX PANTRY YELLOW DESIGN,4,10/23/2011 13:10,2.95,13471,United Kingdom
572294,23293,SET OF 12 FAIRY CAKE BAKING CASES,8,10/23/2011 13:10,0.83,13471,United Kingdom
572294,23296,SET OF 6 TEA TIME BAKING CASES,4,10/23/2011 13:10,1.25,13471,United Kingdom
572294,23295,SET OF 12 MINI LOAF BAKING CASES,8,10/23/2011 13:10,0.83,13471,United Kingdom
572294,23502,PLAYING CARDS VINTAGE DOILY ,3,10/23/2011 13:10,1.25,13471,United Kingdom
572294,21889,WOODEN BOX OF DOMINOES,7,10/23/2011 13:10,1.25,13471,United Kingdom
572294,22990,COTTON APRON PANTRY DESIGN,2,10/23/2011 13:10,4.95,13471,United Kingdom
572294,22692,DOORMAT WELCOME TO OUR HOME,2,10/23/2011 13:10,8.25,13471,United Kingdom
572294,20685,DOORMAT RED RETROSPOT,2,10/23/2011 13:10,8.25,13471,United Kingdom
572294,22333,RETROSPOT PARTY BAG + STICKER SET,16,10/23/2011 13:10,1.65,13471,United Kingdom
572294,85099B,JUMBO BAG RED RETROSPOT,4,10/23/2011 13:10,2.08,13471,United Kingdom
572294,22663,JUMBO BAG DOLLY GIRL DESIGN,3,10/23/2011 13:10,2.08,13471,United Kingdom
572294,22381,TOY TIDY PINK POLKADOT,3,10/23/2011 13:10,2.1,13471,United Kingdom
572294,23203,JUMBO BAG VINTAGE DOILY ,7,10/23/2011 13:10,2.08,13471,United Kingdom
572294,22960,JAM MAKING SET WITH JARS,4,10/23/2011 13:10,4.25,13471,United Kingdom
572294,22993,SET OF 4 PANTRY JELLY MOULDS,7,10/23/2011 13:10,1.25,13471,United Kingdom
572294,23493,VINTAGE DOILY TRAVEL SEWING KIT,5,10/23/2011 13:10,1.95,13471,United Kingdom
572294,21789,KIDS RAIN MAC PINK,6,10/23/2011 13:10,0.85,13471,United Kingdom
572294,21883,STARS GIFT TAPE ,12,10/23/2011 13:10,0.65,13471,United Kingdom
572294,21880,RED RETROSPOT TAPE,12,10/23/2011 13:10,0.65,13471,United Kingdom
572294,21918,SET 12 KIDS COLOUR  CHALK STICKS,5,10/23/2011 13:10,0.42,13471,United Kingdom
572294,21788,KIDS RAIN MAC BLUE,6,10/23/2011 13:10,0.85,13471,United Kingdom
572294,22662,LUNCH BAG DOLLY GIRL DESIGN,4,10/23/2011 13:10,1.65,13471,United Kingdom
572294,22551,PLASTERS IN TIN SPACEBOY,4,10/23/2011 13:10,1.65,13471,United Kingdom
572295,22599,CHRISTMAS MUSICAL ZINC STAR,6,10/23/2011 13:49,0.29,16686,United Kingdom
572295,22598,CHRISTMAS MUSICAL ZINC TREE,6,10/23/2011 13:49,0.29,16686,United Kingdom
572295,23047,PAPER LANTERN 5 POINT SEQUIN STAR,1,10/23/2011 13:49,5.75,16686,United Kingdom
572295,23041,PAPER LANTERN 9 POINT SNOW STAR,1,10/23/2011 13:49,4.15,16686,United Kingdom
572295,84836,ZINC METAL HEART DECORATION,3,10/23/2011 13:49,1.25,16686,United Kingdom
572295,23102,SILVER HEARTS TABLE DECORATION,1,10/23/2011 13:49,0.83,16686,United Kingdom
572295,23101,SILVER STARS TABLE DECORATION,2,10/23/2011 13:49,0.83,16686,United Kingdom
572295,23480,MINI LIGHTS WOODLAND MUSHROOMS,1,10/23/2011 13:49,3.75,16686,United Kingdom
572295,23224,CHERUB HEART DECORATION GOLD,5,10/23/2011 13:49,0.83,16686,United Kingdom
572295,21802,CHRISTMAS TREE HEART DECORATION,5,10/23/2011 13:49,0.42,16686,United Kingdom
572295,21803,CHRISTMAS TREE STAR DECORATION,4,10/23/2011 13:49,0.42,16686,United Kingdom
572295,21804,WHITE CHRISTMAS GARLAND STARS TREES,2,10/23/2011 13:49,3.75,16686,United Kingdom
572295,22641,SET OF 4 NAPKIN CHARMS INSTRUMENT,3,10/23/2011 13:49,2.55,16686,United Kingdom
572295,23275,SET OF 3 HANGING OWLS OLLIE BEAK,2,10/23/2011 13:49,1.25,16686,United Kingdom
572295,23264,SET OF 3 WOODEN SLEIGH DECORATIONS,2,10/23/2011 13:49,1.25,16686,United Kingdom
572295,22604,SET OF 4 NAPKIN CHARMS CUTLERY,3,10/23/2011 13:49,2.55,16686,United Kingdom
572295,22574,HEART WOODEN CHRISTMAS DECORATION,6,10/23/2011 13:49,0.85,16686,United Kingdom
572295,22572,ROCKING HORSE GREEN CHRISTMAS ,6,10/23/2011 13:49,0.85,16686,United Kingdom
572295,22573,STAR WOODEN CHRISTMAS DECORATION,6,10/23/2011 13:49,0.85,16686,United Kingdom
572295,22576,SWALLOW WOODEN CHRISTMAS DECORATION,6,10/23/2011 13:49,0.85,16686,United Kingdom
572295,79191B,RETRO PLASTIC POLKA TRAY,2,10/23/2011 13:49,0.85,16686,United Kingdom
572295,79191C,RETRO PLASTIC ELEPHANT TRAY,4,10/23/2011 13:49,0.85,16686,United Kingdom
572295,22955,36 FOIL STAR CAKE CASES ,1,10/23/2011 13:49,2.1,16686,United Kingdom
572295,23392,SPACEBOY ROCKET LOLLY MAKERS,1,10/23/2011 13:49,2.08,16686,United Kingdom
572295,84828,JUNGLE POPSICLES ICE LOLLY MOULDS,2,10/23/2011 13:49,1.25,16686,United Kingdom
572295,23559,WOODLAND BUNNIES LOLLY MAKERS,2,10/23/2011 13:49,2.08,16686,United Kingdom
572295,23197,SKETCHBOOK MAGNETIC SHOPPING LIST,2,10/23/2011 13:49,1.45,16686,United Kingdom
572295,23196,VINTAGE LEAF MAGNETIC NOTEPAD,2,10/23/2011 13:49,1.45,16686,United Kingdom
572295,22560,TRADITIONAL MODELLING CLAY,4,10/23/2011 13:49,1.25,16686,United Kingdom
572295,22467,GUMBALL COAT RACK,2,10/23/2011 13:49,2.55,16686,United Kingdom
572295,23130,MISTLETOE HEART WREATH GREEN,1,10/23/2011 13:49,4.15,16686,United Kingdom
572295,23129,HEART SHAPED HOLLY WREATH,1,10/23/2011 13:49,4.15,16686,United Kingdom
572295,84380,SET OF 3 BUTTERFLY COOKIE CUTTERS,2,10/23/2011 13:49,1.45,16686,United Kingdom
572295,22966,GINGERBREAD MAN COOKIE CUTTER,3,10/23/2011 13:49,1.25,16686,United Kingdom
572295,84378,SET OF 3 HEART COOKIE CUTTERS,2,10/23/2011 13:49,1.45,16686,United Kingdom
572295,22326,ROUND SNACK BOXES SET OF4 WOODLAND ,1,10/23/2011 13:49,2.95,16686,United Kingdom
572295,22328,ROUND SNACK BOXES SET OF 4 FRUITS ,2,10/23/2011 13:49,2.95,16686,United Kingdom
572295,22729,ALARM CLOCK BAKELIKE ORANGE,2,10/23/2011 13:49,3.75,16686,United Kingdom
572295,22730,ALARM CLOCK BAKELIKE IVORY,2,10/23/2011 13:49,3.75,16686,United Kingdom
572295,23509,MINI PLAYING CARDS FUN FAIR ,2,10/23/2011 13:49,0.42,16686,United Kingdom
572295,85034A,3 GARDENIA MORRIS BOXED CANDLES,1,10/23/2011 13:49,1.25,16686,United Kingdom
572295,84952B,BLACK LOVE BIRD T-LIGHT HOLDER,3,10/23/2011 13:49,3.75,16686,United Kingdom
572295,22628,PICNIC BOXES SET OF 3 RETROSPOT ,1,10/23/2011 13:49,4.95,16686,United Kingdom
572295,22468,BABUSHKA LIGHTS STRING OF 10,1,10/23/2011 13:49,6.75,16686,United Kingdom
572295,23256,CHILDRENS CUTLERY SPACEBOY ,1,10/23/2011 13:49,4.15,16686,United Kingdom
572295,84510E,SET OF 4 GREEN CAROUSEL COASTERS,2,10/23/2011 13:49,1.25,16686,United Kingdom
572295,84510C,SET OF 4 POLKADOT COASTERS,2,10/23/2011 13:49,1.25,16686,United Kingdom
572295,84510A,SET OF 4 ENGLISH ROSE COASTERS,2,10/23/2011 13:49,1.25,16686,United Kingdom
572295,22211,WOOD STAMP SET FLOWERS,2,10/23/2011 13:49,0.83,16686,United Kingdom
572295,85034A,3 GARDENIA MORRIS BOXED CANDLES,1,10/23/2011 13:49,1.25,16686,United Kingdom
572295,22759,SET OF 3 NOTEBOOKS IN PARCEL,2,10/23/2011 13:49,1.65,16686,United Kingdom
572295,23392,SPACEBOY ROCKET LOLLY MAKERS,1,10/23/2011 13:49,2.08,16686,United Kingdom
572295,22991,GIRAFFE WOODEN RULER,2,10/23/2011 13:49,1.95,16686,United Kingdom
572295,23254,CHILDRENS CUTLERY DOLLY GIRL ,2,10/23/2011 13:49,4.15,16686,United Kingdom
572295,23255,CHILDRENS CUTLERY CIRCUS PARADE,1,10/23/2011 13:49,4.15,16686,United Kingdom
572295,23256,CHILDRENS CUTLERY SPACEBOY ,1,10/23/2011 13:49,4.15,16686,United Kingdom
572295,21991,BOHEMIAN COLLAGE STATIONERY SET,2,10/23/2011 13:49,1.25,16686,United Kingdom
572295,21992,VINTAGE PAISLEY STATIONERY SET,1,10/23/2011 13:49,1.25,16686,United Kingdom
572295,22558,CLOTHES PEGS RETROSPOT PACK 24 ,2,10/23/2011 13:49,1.65,16686,United Kingdom
572295,21640,ASSORTED TUTTI FRUTTI  FOB NOTEBOOK,12,10/23/2011 13:49,0.85,16686,United Kingdom
572295,20903,VINTAGE KEEPSAKE BOX TRAVELOGUE,1,10/23/2011 13:49,6.35,16686,United Kingdom
572295,72803A,ROSE SCENT CANDLE JEWELLED DRAWER,2,10/23/2011 13:49,4.25,16686,United Kingdom
572295,20794,BLUE  TILE HOOK,3,10/23/2011 13:49,2.55,16686,United Kingdom
572295,21293,MIRRORED DOVE WALL DECORATION,4,10/23/2011 13:49,2.1,16686,United Kingdom
572295,85169B,BLACK LOVE BIRD CANDLE,4,10/23/2011 13:49,1.25,16686,United Kingdom
572295,21640,ASSORTED TUTTI FRUTTI  FOB NOTEBOOK,12,10/23/2011 13:49,0.85,16686,United Kingdom
572295,85169A,IVORY LOVE BIRD CANDLE,4,10/23/2011 13:49,1.25,16686,United Kingdom
572295,10120,DOGGY RUBBER,5,10/23/2011 13:49,0.21,16686,United Kingdom
572295,23403,LETTER HOLDER HOME SWEET HOME,2,10/23/2011 13:49,3.75,16686,United Kingdom
572295,23486,ANTIQUE HEART SHELF UNIT,1,10/23/2011 13:49,16.65,16686,United Kingdom
572295,85124B,BLUE JUICY FRUIT PHOTO FRAME,2,10/23/2011 13:49,2.55,16686,United Kingdom
572295,21636,MADRAS NOTEBOOK MEDIUM,4,10/23/2011 13:49,0.75,16686,United Kingdom
572295,23505,PLAYING CARDS I LOVE LONDON ,1,10/23/2011 13:49,1.25,16686,United Kingdom
572295,23509,MINI PLAYING CARDS FUN FAIR ,3,10/23/2011 13:49,0.42,16686,United Kingdom
572295,21328,BALLOONS  WRITING SET ,3,10/23/2011 13:49,1.65,16686,United Kingdom
572295,21061,PARTY INVITES FOOTBALL,3,10/23/2011 13:49,0.85,16686,United Kingdom
572295,21062,PARTY INVITES SPACEMAN,2,10/23/2011 13:49,0.85,16686,United Kingdom
572295,22564,ALPHABET STENCIL CRAFT,1,10/23/2011 13:49,1.25,16686,United Kingdom
572295,22562,MONSTERS STENCIL CRAFT,1,10/23/2011 13:49,1.25,16686,United Kingdom
572295,22489,PACK OF 12 TRADITIONAL CRAYONS,6,10/23/2011 13:49,0.42,16686,United Kingdom
572295,22563,HAPPY STENCIL CRAFT,3,10/23/2011 13:49,1.25,16686,United Kingdom
572295,20898,VINTAGE NOTEBOOK TRAVELOGUE,5,10/23/2011 13:49,2.95,16686,United Kingdom
572295,22753,SMALL YELLOW BABUSHKA NOTEBOOK ,1,10/23/2011 13:49,0.85,16686,United Kingdom
572295,22754,SMALL RED BABUSHKA NOTEBOOK ,1,10/23/2011 13:49,0.85,16686,United Kingdom
572295,22755,SMALL PURPLE BABUSHKA NOTEBOOK ,1,10/23/2011 13:49,0.85,16686,United Kingdom
572295,22756,LARGE YELLOW BABUSHKA NOTEBOOK ,1,10/23/2011 13:49,1.25,16686,United Kingdom
572295,22757,LARGE RED BABUSHKA NOTEBOOK ,1,10/23/2011 13:49,1.25,16686,United Kingdom
572295,21058,PARTY INVITES WOODLAND,2,10/23/2011 13:49,0.85,16686,United Kingdom
572295,21060,PARTY INVITES BALLOON GIRL,3,10/23/2011 13:49,0.85,16686,United Kingdom
572295,22784,LANTERN CREAM GAZEBO ,2,10/23/2011 13:49,4.95,16686,United Kingdom
572295,21375,LARGE CAMPHOR WOOD FIELD MUSHROOM ,1,10/23/2011 13:49,5.45,16686,United Kingdom
572295,21376,LARGE  TALL CAMPHOR WOOD TOADSTOOL ,1,10/23/2011 13:49,5.45,16686,United Kingdom
572295,21377,SMALL CAMPHOR WOOD FIELD  MUSHROOM,2,10/23/2011 13:49,1.65,16686,United Kingdom
572295,21378,SMALL TALL CAMPHOR WOOD TOADSTOOL,1,10/23/2011 13:49,1.65,16686,United Kingdom
572295,21379,CAMPHOR WOOD PORTOBELLO MUSHROOM,2,10/23/2011 13:49,1.25,16686,United Kingdom
572295,82486,3 DRAWER ANTIQUE WHITE WOOD CABINET,1,10/23/2011 13:49,8.95,16686,United Kingdom
572295,23356,LOVE HOT WATER BOTTLE,1,10/23/2011 13:49,5.95,16686,United Kingdom
572295,22111,SCOTTIE DOG HOT WATER BOTTLE,2,10/23/2011 13:49,4.95,16686,United Kingdom
572295,21484,CHICK GREY HOT WATER BOTTLE,1,10/23/2011 13:49,4.25,16686,United Kingdom
572295,22779,WOODEN OWLS LIGHT GARLAND ,1,10/23/2011 13:49,4.25,16686,United Kingdom
572295,84030E,ENGLISH ROSE HOT WATER BOTTLE,1,10/23/2011 13:49,4.25,16686,United Kingdom
572295,21484,CHICK GREY HOT WATER BOTTLE,1,10/23/2011 13:49,4.25,16686,United Kingdom
572295,21481,FAWN BLUE HOT WATER BOTTLE,2,10/23/2011 13:49,3.75,16686,United Kingdom
572295,84029G,KNITTED UNION FLAG HOT WATER BOTTLE,1,10/23/2011 13:49,4.25,16686,United Kingdom
572295,21479,WHITE SKULL HOT WATER BOTTLE ,2,10/23/2011 13:49,4.25,16686,United Kingdom
572295,23229,VINTAGE DONKEY TAIL GAME ,2,10/23/2011 13:49,3.75,16686,United Kingdom
572295,23445,ICE CREAM BUBBLES,20,10/23/2011 13:49,0.83,16686,United Kingdom
572295,21754,HOME BUILDING BLOCK WORD,2,10/23/2011 13:49,6.25,16686,United Kingdom
572295,22466,FAIRY TALE COTTAGE NIGHT LIGHT,2,10/23/2011 13:49,1.95,16686,United Kingdom
572295,23176,ABC TREASURE BOOK BOX ,2,10/23/2011 13:49,2.25,16686,United Kingdom
572295,22550,HOLIDAY FUN LUDO,2,10/23/2011 13:49,3.75,16686,United Kingdom
572295,21506,"FANCY FONT BIRTHDAY CARD, ",12,10/23/2011 13:49,0.42,16686,United Kingdom
572295,21504,SKULLS GREETING CARD,12,10/23/2011 13:49,0.42,16686,United Kingdom
572295,85227,SET OF 6 3D KIT CARDS FOR KIDS,3,10/23/2011 13:49,0.85,16686,United Kingdom
572295,79321,CHILLI LIGHTS,1,10/23/2011 13:49,5.75,16686,United Kingdom
572295,23388,WOODLAND MINI BACKPACK,1,10/23/2011 13:49,4.15,16686,United Kingdom
572295,23389,SPACEBOY MINI BACKPACK,3,10/23/2011 13:49,4.15,16686,United Kingdom
572295,23390,DOLLY GIRL MINI BACKPACK,2,10/23/2011 13:49,4.15,16686,United Kingdom
572295,22176,BLUE OWL SOFT TOY,1,10/23/2011 13:49,2.95,16686,United Kingdom
572295,22175,PINK OWL SOFT TOY,1,10/23/2011 13:49,2.95,16686,United Kingdom
572295,23193,BUFFALO BILL TREASURE BOOK BOX,1,10/23/2011 13:49,2.25,16686,United Kingdom
572295,23505,PLAYING CARDS I LOVE LONDON ,1,10/23/2011 13:49,1.25,16686,United Kingdom
572295,21790,VINTAGE SNAP CARDS,2,10/23/2011 13:49,0.85,16686,United Kingdom
572295,21731,RED TOADSTOOL LED NIGHT LIGHT,2,10/23/2011 13:49,1.65,16686,United Kingdom
572295,23506,MINI PLAYING CARDS SPACEBOY ,5,10/23/2011 13:49,0.42,16686,United Kingdom
572295,23048,SET OF 10 LANTERNS FAIRY LIGHT STAR,2,10/23/2011 13:49,4.15,16686,United Kingdom
572295,23499,SET 12 VINTAGE DOILY CHALK ,2,10/23/2011 13:49,0.42,16686,United Kingdom
572295,22531,MAGIC DRAWING SLATE CIRCUS PARADE  ,10,10/23/2011 13:49,0.42,16686,United Kingdom
572295,21889,WOODEN BOX OF DOMINOES,2,10/23/2011 13:49,1.25,16686,United Kingdom
572296,23503,PLAYING CARDS KEEP CALM & CARRY ON,1,10/23/2011 14:28,1.25,13598,United Kingdom
572296,23239,SET OF 4 KNICK KNACK TINS POPPIES,2,10/23/2011 14:28,4.15,13598,United Kingdom
572296,23237,SET OF 4 KNICK KNACK TINS LEAF,2,10/23/2011 14:28,4.15,13598,United Kingdom
572296,84947,ANTIQUE SILVER TEA GLASS ENGRAVED,6,10/23/2011 14:28,1.25,13598,United Kingdom
572296,85066,CREAM SWEETHEART MINI CHEST,2,10/23/2011 14:28,12.75,13598,United Kingdom
572296,21390,FILIGRIS HEART WITH BUTTERFLY,6,10/23/2011 14:28,1.25,13598,United Kingdom
572296,22411,JUMBO SHOPPER VINTAGE RED PAISLEY,1,10/23/2011 14:28,2.08,13598,United Kingdom
572296,22744,MAKE YOUR OWN MONSOON CARD KIT,1,10/23/2011 14:28,2.95,13598,United Kingdom
572296,85066,CREAM SWEETHEART MINI CHEST,1,10/23/2011 14:28,12.75,13598,United Kingdom
572296,23016,GLASS TWIST BON BON JAR,1,10/23/2011 14:28,7.85,13598,United Kingdom
572296,23238,SET OF 4 KNICK KNACK TINS LONDON ,1,10/23/2011 14:28,4.15,13598,United Kingdom
572296,23239,SET OF 4 KNICK KNACK TINS POPPIES,1,10/23/2011 14:28,4.15,13598,United Kingdom
572296,23493,VINTAGE DOILY TRAVEL SEWING KIT,2,10/23/2011 14:28,1.95,13598,United Kingdom
572296,23300,GARDENERS KNEELING PAD CUP OF TEA ,1,10/23/2011 14:28,1.65,13598,United Kingdom
572296,21908,CHOCOLATE THIS WAY METAL SIGN,1,10/23/2011 14:28,2.1,13598,United Kingdom
572296,22188,BLACK HEART CARD HOLDER,1,10/23/2011 14:28,3.95,13598,United Kingdom
572296,23348,CHILDRENS TOY COOKING UTENSIL SET,1,10/23/2011 14:28,2.08,13598,United Kingdom
572296,22139,RETROSPOT TEA SET CERAMIC 11 PC ,1,10/23/2011 14:28,4.95,13598,United Kingdom
572296,84832,ZINC WILLIE WINKIE  CANDLE STICK,1,10/23/2011 14:28,0.85,13598,United Kingdom
572296,23355,HOT WATER BOTTLE KEEP CALM,1,10/23/2011 14:28,4.95,13598,United Kingdom
572296,23389,SPACEBOY MINI BACKPACK,1,10/23/2011 14:28,4.15,13598,United Kingdom
572296,22867,HAND WARMER BIRD DESIGN,1,10/23/2011 14:28,2.1,13598,United Kingdom
572296,22632,HAND WARMER RED RETROSPOT,1,10/23/2011 14:28,2.1,13598,United Kingdom
572296,22633,HAND WARMER UNION JACK,3,10/23/2011 14:28,2.1,13598,United Kingdom
572296,23300,GARDENERS KNEELING PAD CUP OF TEA ,1,10/23/2011 14:28,1.65,13598,United Kingdom
572296,23301,GARDENERS KNEELING PAD KEEP CALM ,1,10/23/2011 14:28,1.65,13598,United Kingdom
572296,23302,KNEELING MAT HOUSEWORK  DESIGN,1,10/23/2011 14:28,1.65,13598,United Kingdom
572296,22188,BLACK HEART CARD HOLDER,1,10/23/2011 14:28,3.95,13598,United Kingdom
572296,23103,JINGLE BELL HEART DECORATION,1,10/23/2011 14:28,1.65,13598,United Kingdom
572296,22670,FRENCH WC SIGN BLUE METAL,1,10/23/2011 14:28,1.25,13598,United Kingdom
572296,23152,IVORY SWEETHEART WIRE LETTER RACK ,1,10/23/2011 14:28,3.75,13598,United Kingdom
572296,23238,SET OF 4 KNICK KNACK TINS LONDON ,1,10/23/2011 14:28,4.15,13598,United Kingdom
572296,23239,SET OF 4 KNICK KNACK TINS POPPIES,2,10/23/2011 14:28,4.15,13598,United Kingdom
572296,85099C,JUMBO  BAG BAROQUE BLACK WHITE,2,10/23/2011 14:28,2.08,13598,United Kingdom
572296,21755,LOVE BUILDING BLOCK WORD,1,10/23/2011 14:28,6.25,13598,United Kingdom
572296,85099B,JUMBO BAG RED RETROSPOT,1,10/23/2011 14:28,2.08,13598,United Kingdom
572296,21928,JUMBO BAG SCANDINAVIAN BLUE PAISLEY,1,10/23/2011 14:28,2.08,13598,United Kingdom
572296,22411,JUMBO SHOPPER VINTAGE RED PAISLEY,1,10/23/2011 14:28,2.08,13598,United Kingdom
572296,21931,JUMBO STORAGE BAG SUKI,1,10/23/2011 14:28,2.08,13598,United Kingdom
572296,23203,JUMBO BAG VINTAGE DOILY ,1,10/23/2011 14:28,2.08,13598,United Kingdom
572297,82494L,WOODEN FRAME ANTIQUE WHITE ,6,10/23/2011 14:30,2.95,15953,United Kingdom
572297,82482,WOODEN PICTURE FRAME WHITE FINISH,6,10/23/2011 14:30,2.95,15953,United Kingdom
572297,23456,MEDIUM PARLOUR PICTURE FRAME ,2,10/23/2011 14:30,4.15,15953,United Kingdom
572297,23455,SMALL PARLOUR PICTURE FRAME,4,10/23/2011 14:30,2.89,15953,United Kingdom
572297,23460,SWEETHEART WALL TIDY ,1,10/23/2011 14:30,9.95,15953,United Kingdom
572297,23136,IVORY WIRE SWEETHEART LETTER TRAY,2,10/23/2011 14:30,3.75,15953,United Kingdom
572297,85123A,WHITE HANGING HEART T-LIGHT HOLDER,32,10/23/2011 14:30,2.55,15953,United Kingdom
572297,23152,IVORY SWEETHEART WIRE LETTER RACK ,2,10/23/2011 14:30,3.75,15953,United Kingdom
572298,23556,LANDMARK FRAME COVENT GARDEN ,3,10/23/2011 14:33,12.5,14071,United Kingdom
572298,23554,LANDMARK FRAME OXFORD STREET,3,10/23/2011 14:33,12.5,14071,United Kingdom
572298,23555,LANDMARK FRAME NOTTING HILL ,1,10/23/2011 14:33,12.5,14071,United Kingdom
572298,23558,LANDMARK FRAME LONDON BRIDGE ,1,10/23/2011 14:33,12.5,14071,United Kingdom
572298,23557,LANDMARK FRAME BAKER STREET ,1,10/23/2011 14:33,12.5,14071,United Kingdom
572298,23553,LANDMARK FRAME CAMDEN TOWN ,1,10/23/2011 14:33,12.5,14071,United Kingdom
572298,23539,WALL ART LOVES' SECRET ,1,10/23/2011 14:33,5.95,14071,United Kingdom
572298,23534,WALL ART STOP FOR TEA ,1,10/23/2011 14:33,5.95,14071,United Kingdom
572298,23535,WALL ART BICYCLE SAFETY,2,10/23/2011 14:33,5.95,14071,United Kingdom
572298,48173C,DOORMAT BLACK FLOCK ,1,10/23/2011 14:33,8.25,14071,United Kingdom
572298,21770,OPEN CLOSED METAL SIGN,1,10/23/2011 14:33,4.95,14071,United Kingdom
572298,23526,WALL ART DOG LICENCE ,1,10/23/2011 14:33,5.95,14071,United Kingdom
C572299,85066,CREAM SWEETHEART MINI CHEST,-1,10/23/2011 14:35,12.75,13598,United Kingdom
572300,45013,FOLDING SHOE TIDY,1,10/23/2011 14:40,2.95,18005,United Kingdom
572300,22481,BLACK TEA TOWEL CLASSIC DESIGN,2,10/23/2011 14:40,1.25,18005,United Kingdom
572300,23203,JUMBO BAG VINTAGE DOILY ,1,10/23/2011 14:40,2.08,18005,United Kingdom
572300,20712,JUMBO BAG WOODLAND ANIMALS,1,10/23/2011 14:40,2.08,18005,United Kingdom
572300,23131,MISTLETOE HEART WREATH CREAM,1,10/23/2011 14:40,4.15,18005,United Kingdom
572300,23344,JUMBO BAG 50'S CHRISTMAS ,2,10/23/2011 14:40,2.08,18005,United Kingdom
572300,23301,GARDENERS KNEELING PAD KEEP CALM ,1,10/23/2011 14:40,1.65,18005,United Kingdom
572300,23321,SMALL WHITE HEART OF WICKER,1,10/23/2011 14:40,1.65,18005,United Kingdom
572300,22799,SWEETHEART WIRE FRUIT BOWL,1,10/23/2011 14:40,8.5,18005,United Kingdom
572300,21289,LARGE STRIPES CHOCOLATE GIFT BAG,16,10/23/2011 14:40,1.25,18005,United Kingdom
572300,23252,VINTAGE RED ENAMEL TRIM JUG ,1,10/23/2011 14:40,3.75,18005,United Kingdom
572300,22758,LARGE PURPLE BABUSHKA NOTEBOOK  ,1,10/23/2011 14:40,1.25,18005,United Kingdom
572300,22754,SMALL RED BABUSHKA NOTEBOOK ,5,10/23/2011 14:40,0.85,18005,United Kingdom
572300,22965,3 TRADITIONAl BISCUIT CUTTERS  SET,1,10/23/2011 14:40,2.1,18005,United Kingdom
572300,23007, SPACEBOY BABY GIFT SET,1,10/23/2011 14:40,16.95,18005,United Kingdom
572300,72802C,VANILLA SCENT CANDLE JEWELLED BOX,4,10/23/2011 14:40,4.25,18005,United Kingdom
572300,23252,VINTAGE RED ENAMEL TRIM JUG ,1,10/23/2011 14:40,3.75,18005,United Kingdom
572300,22907,PACK OF 20 NAPKINS PANTRY DESIGN,2,10/23/2011 14:40,0.85,18005,United Kingdom
572300,15056BL,EDWARDIAN PARASOL BLACK,1,10/23/2011 14:40,5.95,18005,United Kingdom
572300,22423,REGENCY CAKESTAND 3 TIER,2,10/23/2011 14:40,12.75,18005,United Kingdom
572300,22766,PHOTO FRAME CORNICE,1,10/23/2011 14:40,2.95,18005,United Kingdom
572300,23131,MISTLETOE HEART WREATH CREAM,1,10/23/2011 14:40,4.15,18005,United Kingdom
572300,21034,REX CASH+CARRY JUMBO SHOPPER,1,10/23/2011 14:40,0.95,18005,United Kingdom
572301,20992,JAZZ HEARTS PURSE NOTEBOOK,1,10/23/2011 14:41,0.39,16794,United Kingdom
572301,23411, TRELLIS COAT RACK,1,10/23/2011 14:41,4.95,16794,United Kingdom
572301,21900,"KEY FOB , SHED",1,10/23/2011 14:41,0.65,16794,United Kingdom
572301,21899,GARAGE KEY FOB,2,10/23/2011 14:41,0.65,16794,United Kingdom
572301,21900,"KEY FOB , SHED",1,10/23/2011 14:41,0.65,16794,United Kingdom
572301,22773,GREEN DRAWER KNOB ACRYLIC EDWARDIAN,2,10/23/2011 14:41,1.25,16794,United Kingdom
572301,23182,TOILET SIGN OCCUPIED OR VACANT,1,10/23/2011 14:41,0.83,16794,United Kingdom
572301,23415,HOME SWEET HOME HOOK,1,10/23/2011 14:41,1.65,16794,United Kingdom
572301,23417,BATHROOM HOOK,1,10/23/2011 14:41,1.65,16794,United Kingdom
572301,23196,VINTAGE LEAF MAGNETIC NOTEPAD,3,10/23/2011 14:41,1.45,16794,United Kingdom
572301,23198,PANTRY MAGNETIC  SHOPPING LIST,3,10/23/2011 14:41,1.45,16794,United Kingdom
572301,22993,SET OF 4 PANTRY JELLY MOULDS,1,10/23/2011 14:41,1.25,16794,United Kingdom
572301,22469,HEART OF WICKER SMALL,1,10/23/2011 14:41,1.65,16794,United Kingdom
572301,20894,HANGING BAUBLE T-LIGHT HOLDER LARGE,1,10/23/2011 14:41,2.95,16794,United Kingdom
572301,20893,HANGING BAUBLE T-LIGHT HOLDER SMALL,1,10/23/2011 14:41,2.55,16794,United Kingdom
572301,82552,WASHROOM METAL SIGN,2,10/23/2011 14:41,1.45,16794,United Kingdom
572301,22371,AIRLINE BAG VINTAGE TOKYO 78,1,10/23/2011 14:41,4.25,16794,United Kingdom
572301,23200,JUMBO BAG PEARS,2,10/23/2011 14:41,2.08,16794,United Kingdom
572301,23199,JUMBO BAG APPLES,1,10/23/2011 14:41,2.08,16794,United Kingdom
572301,20718,RED RETROSPOT SHOPPER BAG,2,10/23/2011 14:41,1.25,16794,United Kingdom
572301,22384,LUNCH BAG PINK POLKADOT,3,10/23/2011 14:41,1.65,16794,United Kingdom
572301,20727,LUNCH BAG  BLACK SKULL.,2,10/23/2011 14:41,1.65,16794,United Kingdom
572301,20725,LUNCH BAG RED RETROSPOT,4,10/23/2011 14:41,1.65,16794,United Kingdom
