577358,22139,RETROSPOT TEA SET CERAMIC 11 PC ,1,11/18/2011 15:59,10.79,,United Kingdom
577358,22141,CHRISTMAS CRAFT TREE TOP ANGEL,1,11/18/2011 15:59,4.13,,United Kingdom
577358,22142,CHRISTMAS CRAFT WHITE FAIRY ,1,11/18/2011 15:59,3.29,,United Kingdom
577358,22144,CHRISTMAS CRAFT LITTLE FRIENDS,1,11/18/2011 15:59,4.13,,United Kingdom
577358,22153,ANGEL DECORATION STARS ON DRESS,1,11/18/2011 15:59,0.83,,United Kingdom
577358,22154,ANGEL DECORATION 3 BUTTONS ,1,11/18/2011 15:59,0.83,,United Kingdom
577358,22162,HEART GARLAND RUSTIC PADDED,1,11/18/2011 15:59,3.29,,United Kingdom
577358,22163,HEART STRING MEMO HOLDER HANGING,14,11/18/2011 15:59,1.63,,United Kingdom
577358,22167, OVAL WALL MIRROR DIAMANTE ,1,11/18/2011 15:59,8.29,,United Kingdom
577358,22169,FAMILY ALBUM WHITE PICTURE FRAME,1,11/18/2011 15:59,16.63,,United Kingdom
577358,22175,PINK OWL SOFT TOY,1,11/18/2011 15:59,5.79,,United Kingdom
577358,22178,VICTORIAN GLASS HANGING T-LIGHT,2,11/18/2011 15:59,2.46,,United Kingdom
577358,22193,RED DINER WALL CLOCK,1,11/18/2011 15:59,16.63,,United Kingdom
577358,22195,LARGE HEART MEASURING SPOONS,1,11/18/2011 15:59,3.29,,United Kingdom
577358,22196,SMALL HEART MEASURING SPOONS,2,11/18/2011 15:59,1.63,,United Kingdom
577358,22197,POPCORN HOLDER,4,11/18/2011 15:59,1.63,,United Kingdom
577358,22219,LOVEBIRD HANGING DECORATION WHITE ,1,11/18/2011 15:59,1.63,,United Kingdom
577358,22222,CAKE PLATE LOVEBIRD WHITE,1,11/18/2011 15:59,9.96,,United Kingdom
577358,22227,HANGING HEART MIRROR DECORATION ,2,11/18/2011 15:59,1.25,,United Kingdom
577358,22271,FELTCRAFT DOLL ROSIE,2,11/18/2011 15:59,5.79,,United Kingdom
577358,22273,FELTCRAFT DOLL MOLLY,1,11/18/2011 15:59,5.79,,United Kingdom
577358,22284,HEN HOUSE DECORATION,1,11/18/2011 15:59,3.29,,United Kingdom
577358,22297,HEART IVORY TRELLIS SMALL,1,11/18/2011 15:59,2.46,,United Kingdom
577358,22300,COFFEE MUG DOG + BALL DESIGN,1,11/18/2011 15:59,4.96,,United Kingdom
577358,22301,COFFEE MUG CAT + BIRD DESIGN,1,11/18/2011 15:59,4.96,,United Kingdom
577358,22304,COFFEE MUG BLUE PAISLEY DESIGN,1,11/18/2011 15:59,4.96,,United Kingdom
577358,22306,SILVER MUG BONE CHINA TREE OF LIFE,1,11/18/2011 15:59,8.29,,United Kingdom
577358,22328,ROUND SNACK BOXES SET OF 4 FRUITS ,1,11/18/2011 15:59,5.79,,United Kingdom
577358,22332,SKULLS PARTY BAG + STICKER SET,2,11/18/2011 15:59,3.29,,United Kingdom
577358,22337,ANGEL DECORATION PAINTED ZINC ,4,11/18/2011 15:59,0.63,,United Kingdom
577358,22338,STAR DECORATION PAINTED ZINC ,6,11/18/2011 15:59,0.63,,United Kingdom
577358,22340,NOEL GARLAND PAINTED ZINC ,9,11/18/2011 15:59,0.83,,United Kingdom
577358,22348,TEA BAG PLATE RED RETROSPOT,3,11/18/2011 15:59,1.63,,United Kingdom
577358,22355,CHARLOTTE BAG SUKI DESIGN,10,11/18/2011 15:59,1.63,,United Kingdom
577358,22356,CHARLOTTE BAG PINK POLKADOT,6,11/18/2011 15:59,1.63,,United Kingdom
577358,22359,GLASS JAR KINGS CHOICE,1,11/18/2011 15:59,5.79,,United Kingdom
577358,22361,GLASS JAR DAISY FRESH COTTON WOOL,2,11/18/2011 15:59,5.79,,United Kingdom
577358,22378,WALL TIDY RETROSPOT ,1,11/18/2011 15:59,4.13,,United Kingdom
577358,22379,RECYCLING BAG RETROSPOT ,2,11/18/2011 15:59,4.13,,United Kingdom
577358,22381,TOY TIDY PINK POLKADOT,1,11/18/2011 15:59,4.13,,United Kingdom
577358,22411,JUMBO SHOPPER VINTAGE RED PAISLEY,1,11/18/2011 15:59,4.13,,United Kingdom
577358,22418,10 COLOUR SPACEBOY PEN,3,11/18/2011 15:59,1.63,,United Kingdom
577358,22419,LIPSTICK PEN RED,8,11/18/2011 15:59,0.83,,United Kingdom
577358,22422,TOOTHPASTE TUBE PEN,2,11/18/2011 15:59,1.25,,United Kingdom
577358,22426,ENAMEL WASH BOWL CREAM,1,11/18/2011 15:59,7.46,,United Kingdom
577358,22431,WATERING CAN BLUE ELEPHANT,1,11/18/2011 15:59,4.13,,United Kingdom
577358,22437,SET OF 9 BLACK SKULL BALLOONS,1,11/18/2011 15:59,1.63,,United Kingdom
577358,22439,6 ROCKET BALLOONS ,1,11/18/2011 15:59,1.25,,United Kingdom
577358,22446,PIN CUSHION BABUSHKA PINK,1,11/18/2011 15:59,2.46,,United Kingdom
577358,22457,NATURAL SLATE HEART CHALKBOARD ,1,11/18/2011 15:59,5.79,,United Kingdom
577358,22464,HANGING METAL HEART LANTERN,6,11/18/2011 15:59,3.29,,United Kingdom
577358,22466,FAIRY TALE COTTAGE NIGHT LIGHT,1,11/18/2011 15:59,4.13,,United Kingdom
577358,22478,BIRDHOUSE GARDEN MARKER ,1,11/18/2011 15:59,2.46,,United Kingdom
577358,22479,DAISY GARDEN MARKER,1,11/18/2011 15:59,2.46,,United Kingdom
577358,22483,RED GINGHAM TEDDY BEAR ,1,11/18/2011 15:59,5.79,,United Kingdom
577358,22486,PLASMATRONIC LAMP,1,11/18/2011 15:59,8.29,,United Kingdom
577358,22489,PACK OF 12 TRADITIONAL CRAYONS,18,11/18/2011 15:59,0.83,,United Kingdom
577358,22492,MINI PAINT SET VINTAGE ,4,11/18/2011 15:59,1.63,,United Kingdom
577358,22494,EMERGENCY FIRST AID TIN ,2,11/18/2011 15:59,2.46,,United Kingdom
577358,22514,CHILDS GARDEN SPADE BLUE,1,11/18/2011 15:59,4.13,,United Kingdom
577358,22516,CHILDS GARDEN RAKE BLUE,1,11/18/2011 15:59,4.13,,United Kingdom
577358,22538,MINI JIGSAW GO TO THE FAIR,1,11/18/2011 15:59,0.83,,United Kingdom
577358,22539,MINI JIGSAW DOLLY GIRL,4,11/18/2011 15:59,0.83,,United Kingdom
577358,22549,PICTURE DOMINOES,3,11/18/2011 15:59,3.29,,United Kingdom
577358,22551,PLASTERS IN TIN SPACEBOY,1,11/18/2011 15:59,3.29,,United Kingdom
577358,22553,PLASTERS IN TIN SKULLS,1,11/18/2011 15:59,3.29,,United Kingdom
577358,22555,PLASTERS IN TIN STRONGMAN,1,11/18/2011 15:59,3.29,,United Kingdom
577358,22558,CLOTHES PEGS RETROSPOT PACK 24 ,1,11/18/2011 15:59,3.29,,United Kingdom
577358,22559,SEASIDE FLYING DISC,1,11/18/2011 15:59,2.46,,United Kingdom
577358,22560,TRADITIONAL MODELLING CLAY,2,11/18/2011 15:59,2.46,,United Kingdom
577358,22561,WOODEN SCHOOL COLOURING SET,1,11/18/2011 15:59,3.29,,United Kingdom
577358,22562,MONSTERS STENCIL CRAFT,1,11/18/2011 15:59,2.46,,United Kingdom
577358,22563,HAPPY STENCIL CRAFT,1,11/18/2011 15:59,2.46,,United Kingdom
577358,22564,ALPHABET STENCIL CRAFT,2,11/18/2011 15:59,2.46,,United Kingdom
577358,22568,FELTCRAFT CUSHION OWL,3,11/18/2011 15:59,7.46,,United Kingdom
577358,22574,HEART WOODEN CHRISTMAS DECORATION,2,11/18/2011 15:59,1.63,,United Kingdom
577358,22577,WOODEN HEART CHRISTMAS SCANDINAVIAN,3,11/18/2011 15:59,0.83,,United Kingdom
577358,22578,WOODEN STAR CHRISTMAS SCANDINAVIAN,6,11/18/2011 15:59,0.83,,United Kingdom
577358,22579,WOODEN TREE CHRISTMAS SCANDINAVIAN,6,11/18/2011 15:59,0.83,,United Kingdom
577358,22580,ADVENT CALENDAR GINGHAM SACK,12,11/18/2011 15:59,4.13,,United Kingdom
577358,22581,WOOD STOCKING CHRISTMAS SCANDISPOT,4,11/18/2011 15:59,0.83,,United Kingdom
577358,22585,PACK OF 6 BIRDY GIFT TAGS,2,11/18/2011 15:59,2.46,,United Kingdom
577358,22586,FELTCRAFT HAIRBAND PINK AND BLUE,1,11/18/2011 15:59,1.63,,United Kingdom
577358,22587,FELTCRAFT HAIRBAND RED AND BLUE,2,11/18/2011 15:59,1.63,,United Kingdom
577358,22588,CARD HOLDER GINGHAM HEART,1,11/18/2011 15:59,5.79,,United Kingdom
577358,22591,CARDHOLDER GINGHAM CHRISTMAS TREE,1,11/18/2011 15:59,6.63,,United Kingdom
577358,22592,CARDHOLDER HOLLY WREATH METAL,2,11/18/2011 15:59,7.46,,United Kingdom
577358,22593,CHRISTMAS GINGHAM STAR,4,11/18/2011 15:59,1.63,,United Kingdom
577358,22594,CHRISTMAS GINGHAM TREE,3,11/18/2011 15:59,1.63,,United Kingdom
577358,22596,CHRISTMAS STAR WISH LIST CHALKBOARD,2,11/18/2011 15:59,2.46,,United Kingdom
577358,22597,MUSICAL ZINC HEART DECORATION ,4,11/18/2011 15:59,0.83,,United Kingdom
577358,22598,CHRISTMAS MUSICAL ZINC TREE,4,11/18/2011 15:59,0.83,,United Kingdom
577358,22599,CHRISTMAS MUSICAL ZINC STAR,2,11/18/2011 15:59,0.83,,United Kingdom
577358,22604,SET OF 4 NAPKIN CHARMS CUTLERY,30,11/18/2011 15:59,4.96,,United Kingdom
577358,22614,PACK OF 12 SPACEBOY TISSUES,1,11/18/2011 15:59,0.83,,United Kingdom
577358,22617,BAKING SET SPACEBOY DESIGN,1,11/18/2011 15:59,10.79,,United Kingdom
577358,22619,SET OF 6 SOLDIER SKITTLES,3,11/18/2011 15:59,7.46,,United Kingdom
577358,22620,4 TRADITIONAL SPINNING TOPS,4,11/18/2011 15:59,2.46,,United Kingdom
577358,22621,TRADITIONAL KNITTING NANCY,8,11/18/2011 15:59,3.29,,United Kingdom
577358,22627,MINT KITCHEN SCALES,1,11/18/2011 15:59,16.63,,United Kingdom
577358,22629,SPACEBOY LUNCH BOX ,2,11/18/2011 15:59,4.13,,United Kingdom
577358,22630,DOLLY GIRL LUNCH BOX,4,11/18/2011 15:59,4.13,,United Kingdom
577358,22631,CIRCUS PARADE LUNCH BOX ,1,11/18/2011 15:59,4.13,,United Kingdom
577358,22642,SET OF 4 NAPKIN CHARMS STARS   ,2,11/18/2011 15:59,4.96,,United Kingdom
577358,22653,BUTTON BOX ,11,11/18/2011 15:59,1.63,,United Kingdom
577358,22654,DELUXE SEWING KIT ,7,11/18/2011 15:59,5.79,,United Kingdom
577358,22659,LUNCH BOX I LOVE LONDON,3,11/18/2011 15:59,4.13,,United Kingdom
577358,22666,RECIPE BOX PANTRY YELLOW DESIGN,3,11/18/2011 15:59,5.79,,United Kingdom
577358,22683,FRENCH BLUE METAL DOOR SIGN 8,1,11/18/2011 15:59,2.46,,United Kingdom
577358,22687,DOORMAT CHRISTMAS VILLAGE,1,11/18/2011 15:59,16.63,,United Kingdom
577358,22689,DOORMAT MERRY CHRISTMAS RED ,1,11/18/2011 15:59,16.63,,United Kingdom
577358,22693,GROW A FLYTRAP OR SUNFLOWER IN TIN,4,11/18/2011 15:59,2.5,,United Kingdom
577358,22694,WICKER STAR ,1,11/18/2011 15:59,4.13,,United Kingdom
577358,22697,GREEN REGENCY TEACUP AND SAUCER,2,11/18/2011 15:59,5.79,,United Kingdom
577358,22699,ROSES REGENCY TEACUP AND SAUCER ,1,11/18/2011 15:59,5.79,,United Kingdom
577358,22701,PINK DOG BOWL,2,11/18/2011 15:59,2.46,,United Kingdom
577358,22714,CARD BIRTHDAY COWBOY,2,11/18/2011 15:59,0.83,,United Kingdom
577358,22716,CARD CIRCUS PARADE,1,11/18/2011 15:59,0.83,,United Kingdom
577358,22720,SET OF 3 CAKE TINS PANTRY DESIGN ,1,11/18/2011 15:59,10.79,,United Kingdom
577358,22722,SET OF 6 SPICE TINS PANTRY DESIGN,7,11/18/2011 15:59,4.13,,United Kingdom
577358,22726,ALARM CLOCK BAKELIKE GREEN,2,11/18/2011 15:59,7.46,,United Kingdom
577358,22727,ALARM CLOCK BAKELIKE RED ,2,11/18/2011 15:59,7.46,,United Kingdom
577358,22728,ALARM CLOCK BAKELIKE PINK,2,11/18/2011 15:59,7.46,,United Kingdom
577358,22733,3D TRADITIONAL CHRISTMAS STICKERS,1,11/18/2011 15:59,2.46,,United Kingdom
577358,22734,SET OF 6 RIBBONS VINTAGE CHRISTMAS,1,11/18/2011 15:59,5.79,,United Kingdom
577358,22737,RIBBON REEL CHRISTMAS PRESENT ,1,11/18/2011 15:59,3.29,,United Kingdom
577358,22738,RIBBON REEL SNOWY VILLAGE,1,11/18/2011 15:59,3.29,,United Kingdom
577358,22739,RIBBON REEL CHRISTMAS SOCK BAUBLE,1,11/18/2011 15:59,3.29,,United Kingdom
577358,22741,FUNKY DIVA PEN,3,11/18/2011 15:59,1.63,,United Kingdom
577358,22745,POPPY'S PLAYHOUSE BEDROOM ,1,11/18/2011 15:59,4.13,,United Kingdom
577358,22746,POPPY'S PLAYHOUSE LIVINGROOM ,1,11/18/2011 15:59,4.13,,United Kingdom
577358,22753,SMALL YELLOW BABUSHKA NOTEBOOK ,4,11/18/2011 15:59,1.63,,United Kingdom
577358,22754,SMALL RED BABUSHKA NOTEBOOK ,2,11/18/2011 15:59,1.63,,United Kingdom
577358,22755,SMALL PURPLE BABUSHKA NOTEBOOK ,1,11/18/2011 15:59,1.63,,United Kingdom
577358,22759,SET OF 3 NOTEBOOKS IN PARCEL,1,11/18/2011 15:59,3.29,,United Kingdom
577358,22771,CLEAR DRAWER KNOB ACRYLIC EDWARDIAN,2,11/18/2011 15:59,2.46,,United Kingdom
577358,22791,T-LIGHT GLASS FLUTED ANTIQUE,3,11/18/2011 15:59,2.46,,United Kingdom
577358,22801,ANTIQUE GLASS PEDESTAL BOWL,1,11/18/2011 15:59,7.46,,United Kingdom
577358,22809,SET OF 6 T-LIGHTS SANTA,1,11/18/2011 15:59,5.79,,United Kingdom
577358,22810,SET OF 6 T-LIGHTS SNOWMEN,1,11/18/2011 15:59,5.79,,United Kingdom
577358,22814,CARD PARTY GAMES ,2,11/18/2011 15:59,0.42,,United Kingdom
577358,22815,CARD PSYCHEDELIC APPLES,3,11/18/2011 15:59,0.42,,United Kingdom
577358,22816,CARD MOTORBIKE SANTA,3,11/18/2011 15:59,0.42,,United Kingdom
577358,22817,CARD SUKI BIRTHDAY,1,11/18/2011 15:59,0.42,,United Kingdom
577358,22818,CARD CHRISTMAS VILLAGE,2,11/18/2011 15:59,0.42,,United Kingdom
577358,22821,GIFT BAG PSYCHEDELIC APPLES,1,11/18/2011 15:59,0.83,,United Kingdom
577358,22838,3 TIER CAKE TIN RED AND CREAM,1,11/18/2011 15:59,29.13,,United Kingdom
577358,22839,3 TIER CAKE TIN GREEN AND CREAM,1,11/18/2011 15:59,29.13,,United Kingdom
577358,22845,VINTAGE CREAM CAT FOOD CONTAINER,1,11/18/2011 15:59,12.46,,United Kingdom
577358,22851,SET 20 NAPKINS FAIRY CAKES DESIGN ,1,11/18/2011 15:59,1.63,,United Kingdom
577358,22865,HAND WARMER OWL DESIGN,3,11/18/2011 15:59,4.13,,United Kingdom
577358,22866,HAND WARMER SCOTTY DOG DESIGN,1,11/18/2011 15:59,4.13,,United Kingdom
577358,22867,HAND WARMER BIRD DESIGN,1,11/18/2011 15:59,4.13,,United Kingdom
577358,22893,MINI CAKE STAND T-LIGHT HOLDER,3,11/18/2011 15:59,0.83,,United Kingdom
577358,22896,PEG BAG APPLES DESIGN,1,11/18/2011 15:59,4.96,,United Kingdom
577358,22906,12 MESSAGE CARDS WITH ENVELOPES,1,11/18/2011 15:59,3.29,,United Kingdom
577358,22909,SET OF 20 VINTAGE CHRISTMAS NAPKINS,2,11/18/2011 15:59,1.63,,United Kingdom
577358,22910,PAPER CHAIN KIT VINTAGE CHRISTMAS,2,11/18/2011 15:59,5.79,,United Kingdom
577358,22917,HERB MARKER ROSEMARY,1,11/18/2011 15:59,1.63,,United Kingdom
577358,22920,HERB MARKER BASIL,1,11/18/2011 15:59,1.63,,United Kingdom
577358,22928,YELLOW GIANT GARDEN THERMOMETER,1,11/18/2011 15:59,12.46,,United Kingdom
577358,22931,BAKING MOULD HEART WHITE CHOCOLATE,1,11/18/2011 15:59,4.96,,United Kingdom
577358,22941,CHRISTMAS LIGHTS 10 REINDEER,1,11/18/2011 15:59,16.63,,United Kingdom
577358,22948,METAL DECORATION NAUGHTY CHILDREN ,4,11/18/2011 15:59,1.66,,United Kingdom
577358,22951,60 CAKE CASES DOLLY GIRL DESIGN,1,11/18/2011 15:59,1.25,,United Kingdom
577358,22952,60 CAKE CASES VINTAGE CHRISTMAS,3,11/18/2011 15:59,1.25,,United Kingdom
577358,22955,36 FOIL STAR CAKE CASES ,1,11/18/2011 15:59,4.13,,United Kingdom
577358,22960,JAM MAKING SET WITH JARS,1,11/18/2011 15:59,8.29,,United Kingdom
577358,22961,JAM MAKING SET PRINTED,2,11/18/2011 15:59,3.29,,United Kingdom
577358,22978,PANTRY ROLLING PIN,1,11/18/2011 15:59,7.46,,United Kingdom
577358,22979,PANTRY WASHING UP BRUSH,1,11/18/2011 15:59,3.29,,United Kingdom
577358,22980,PANTRY SCRUBBING BRUSH,1,11/18/2011 15:59,3.29,,United Kingdom
577358,22982,PANTRY PASTRY BRUSH,1,11/18/2011 15:59,2.46,,United Kingdom
577358,22983,CARD BILLBOARD FONT,1,11/18/2011 15:59,0.83,,United Kingdom
577358,22991,GIRAFFE WOODEN RULER,1,11/18/2011 15:59,4.13,,United Kingdom
577358,22992,REVOLVER WOODEN RULER ,1,11/18/2011 15:59,4.13,,United Kingdom
577358,22993,SET OF 4 PANTRY JELLY MOULDS,2,11/18/2011 15:59,2.46,,United Kingdom
577358,22994,TRAVEL CARD WALLET RETROSPOT,1,11/18/2011 15:59,0.83,,United Kingdom
577358,22995,TRAVEL CARD WALLET SUKI,2,11/18/2011 15:59,0.83,,United Kingdom
577358,22996,TRAVEL CARD WALLET VINTAGE TICKET,2,11/18/2011 15:59,0.83,,United Kingdom
577358,22998,TRAVEL CARD WALLET KEEP CALM,3,11/18/2011 15:59,0.83,,United Kingdom
577358,23000,TRAVEL CARD WALLET TRANSPORT,1,11/18/2011 15:59,0.83,,United Kingdom
577358,23005,TRAVEL CARD WALLET I LOVE LONDON,2,11/18/2011 15:59,0.83,,United Kingdom
577358,23008,DOLLY GIRL BABY GIFT SET,1,11/18/2011 15:59,10.79,,United Kingdom
577358,23009,I LOVE LONDON BABY GIFT SET,1,11/18/2011 15:59,10.79,,United Kingdom
577358,23010,CIRCUS PARADE BABY GIFT SET,1,11/18/2011 15:59,10.79,,United Kingdom
577358,23012,GLASS APOTHECARY BOTTLE PERFUME,1,11/18/2011 15:59,8.29,,United Kingdom
577358,23014,GLASS APOTHECARY BOTTLE ELIXIR,1,11/18/2011 15:59,8.29,,United Kingdom
577358,23038,T-LIGHT HOLDER SILVER SAUCER,2,11/18/2011 15:59,1.63,,United Kingdom
577358,23039,T-LIGHT HOLDER SILVER HEART HANDLE,1,11/18/2011 15:59,4.13,,United Kingdom
577358,23074,EMBOSSED HEART TRINKET BOX,1,11/18/2011 15:59,4.13,,United Kingdom
577358,23076,ICE CREAM SUNDAE LIP GLOSS,1,11/18/2011 15:59,2.46,,United Kingdom
577358,23078,ICE CREAM PEN LIP GLOSS ,2,11/18/2011 15:59,2.46,,United Kingdom
577358,23080,RED METAL BOX TOP SECRET,1,11/18/2011 15:59,16.63,,United Kingdom
577358,23081,GREEN METAL BOX ARMY SUPPLIES,3,11/18/2011 15:59,16.63,,United Kingdom
577358,23083,SET 6 PAPER TABLE LANTERN STARS ,3,11/18/2011 15:59,7.46,,United Kingdom
577358,23084,RABBIT NIGHT LIGHT,279,11/18/2011 15:59,4.13,,United Kingdom
577358,23089,GLASS BON BON JAR,1,11/18/2011 15:59,3.29,,United Kingdom
577358,23100,SILVER BELLS TABLE DECORATION,3,11/18/2011 15:59,2.46,,United Kingdom
577358,23109,PACK OF SIX LED TEA LIGHTS,1,11/18/2011 15:59,5.79,,United Kingdom
577358,23112,PARISIENNE CURIO CABINET,1,11/18/2011 15:59,14.96,,United Kingdom
577358,23119,PACK OF 6 LARGE FRUIT STRAWS ,1,11/18/2011 15:59,1.25,,United Kingdom
577358,23120,PACK OF 6 SMALL FRUIT STRAWS,1,11/18/2011 15:59,0.79,,United Kingdom
577358,23122,PARTY CHARMS 50 PIECES,2,11/18/2011 15:59,1.63,,United Kingdom
577358,23126,FELTCRAFT GIRL AMELIE KIT,1,11/18/2011 15:59,10.79,,United Kingdom
577358,23132,SMALL IVORY HEART WALL ORGANISER,1,11/18/2011 15:59,12.46,,United Kingdom
577358,23143,ZINC WIRE KITCHEN ORGANISER,1,11/18/2011 15:59,20.79,,United Kingdom
577358,23165,LARGE CERAMIC TOP STORAGE JAR,10,11/18/2011 15:59,3.29,,United Kingdom
577358,23166,MEDIUM CERAMIC TOP STORAGE JAR,2,11/18/2011 15:59,2.46,,United Kingdom
577358,23167,SMALL CERAMIC TOP STORAGE JAR ,1,11/18/2011 15:59,1.63,,United Kingdom
577358,23169,CLASSIC GLASS COOKIE JAR,1,11/18/2011 15:59,8.29,,United Kingdom
577358,23170,REGENCY TEA PLATE ROSES ,3,11/18/2011 15:59,3.29,,United Kingdom
577358,23171,REGENCY TEA PLATE GREEN ,5,11/18/2011 15:59,3.29,,United Kingdom
577358,23172,REGENCY TEA PLATE PINK,2,11/18/2011 15:59,3.29,,United Kingdom
577358,23175,REGENCY MILK JUG PINK ,2,11/18/2011 15:59,7.46,,United Kingdom
577358,23177,TREASURE ISLAND BOOK BOX,1,11/18/2011 15:59,4.58,,United Kingdom
577358,23178,JAM CLOCK MAGNET,1,11/18/2011 15:59,5.79,,United Kingdom
577358,23182,TOILET SIGN OCCUPIED OR VACANT,2,11/18/2011 15:59,2.46,,United Kingdom
577358,23189,SET OF 12 FORK CANDLES,2,11/18/2011 15:59,5.79,,United Kingdom
577358,23192,BUNDLE OF 3 ALPHABET EXERCISE BOOKS,1,11/18/2011 15:59,3.29,,United Kingdom
577358,23198,PANTRY MAGNETIC  SHOPPING LIST,1,11/18/2011 15:59,3.29,,United Kingdom
577358,23200,JUMBO BAG PEARS,2,11/18/2011 15:59,4.13,,United Kingdom
577358,23203,JUMBO BAG VINTAGE DOILY ,2,11/18/2011 15:59,4.13,,United Kingdom
577358,23204,CHARLOTTE BAG APPLES DESIGN,2,11/18/2011 15:59,1.63,,United Kingdom
577358,23205,CHARLOTTE BAG VINTAGE ALPHABET ,2,11/18/2011 15:59,1.63,,United Kingdom
577358,23206,LUNCH BAG APPLE DESIGN,3,11/18/2011 15:59,4.13,,United Kingdom
577358,23207,LUNCH BAG ALPHABET DESIGN,2,11/18/2011 15:59,4.13,,United Kingdom
577358,23208,LUNCH BAG VINTAGE LEAF DESIGN,1,11/18/2011 15:59,4.13,,United Kingdom
577358,23209,LUNCH BAG VINTAGE DOILY ,3,11/18/2011 15:59,4.13,,United Kingdom
577358,23210,WHITE ROCKING HORSE HAND PAINTED,3,11/18/2011 15:59,2.46,,United Kingdom
577358,23211,RED ROCKING HORSE HAND PAINTED,5,11/18/2011 15:59,2.46,,United Kingdom
577358,23217,LAUREL HEART ANTIQUE SILVER,1,11/18/2011 15:59,2.46,,United Kingdom
577358,23221,REINDEER HEART DECORATION SILVER,2,11/18/2011 15:59,1.63,,United Kingdom
577358,23226,FILIGREE HEART DAISY WHITE,3,11/18/2011 15:59,2.46,,United Kingdom
577358,23228,FILIGREE HEART BIRD WHITE ,2,11/18/2011 15:59,2.46,,United Kingdom
577358,23229,VINTAGE DONKEY TAIL GAME ,2,11/18/2011 15:59,7.46,,United Kingdom
577358,23240,SET OF 4 KNICK KNACK TINS DOILY ,2,11/18/2011 15:59,8.29,,United Kingdom
577358,23241,TREASURE TIN GYMKHANA DESIGN,3,11/18/2011 15:59,4.13,,United Kingdom
577358,23242,TREASURE TIN BUFFALO BILL ,2,11/18/2011 15:59,4.13,,United Kingdom
577358,23245,SET OF 3 REGENCY CAKE TINS,3,11/18/2011 15:59,10.79,,United Kingdom
577358,23256,CHILDRENS CUTLERY SPACEBOY ,1,11/18/2011 15:59,8.29,,United Kingdom
577358,23263,SET OF 3 WOODEN HEART DECORATIONS,3,11/18/2011 15:59,2.46,,United Kingdom
577358,23265,SET OF 3 WOODEN TREE DECORATIONS,1,11/18/2011 15:59,2.46,,United Kingdom
577358,23266,SET OF 3 WOODEN STOCKING DECORATION,1,11/18/2011 15:59,2.46,,United Kingdom
577358,23271,CHRISTMAS TABLE SILVER CANDLE SPIKE,4,11/18/2011 15:59,1.63,,United Kingdom
577358,23281,FOLDING BUTTERFLY MIRROR RED  ,1,11/18/2011 15:59,2.46,,United Kingdom
577358,23284,DOORMAT KEEP CALM AND COME IN,1,11/18/2011 15:59,15.79,,United Kingdom
577358,23289,DOLLY GIRL CHILDRENS BOWL,1,11/18/2011 15:59,2.46,,United Kingdom
577358,23290,SPACEBOY CHILDRENS BOWL,1,11/18/2011 15:59,2.46,,United Kingdom
577358,23291,DOLLY GIRL CHILDRENS CUP,2,11/18/2011 15:59,2.46,,United Kingdom
577358,23293,SET OF 12 FAIRY CAKE BAKING CASES,1,11/18/2011 15:59,2.46,,United Kingdom
577358,23294,SET OF 6 SNACK LOAF BAKING CASES,1,11/18/2011 15:59,2.46,,United Kingdom
577358,23295,SET OF 12 MINI LOAF BAKING CASES,2,11/18/2011 15:59,2.46,,United Kingdom
577358,23300,GARDENERS KNEELING PAD CUP OF TEA ,1,11/18/2011 15:59,3.29,,United Kingdom
577358,23301,GARDENERS KNEELING PAD KEEP CALM ,7,11/18/2011 15:59,3.29,,United Kingdom
577358,23302,KNEELING MAT HOUSEWORK  DESIGN,1,11/18/2011 15:59,3.29,,United Kingdom
577358,23307,SET OF 60 PANTRY DESIGN CAKE CASES ,7,11/18/2011 15:59,1.25,,United Kingdom
577358,23310,BUBBLEGUM RING ASSORTED,4,11/18/2011 15:59,0.83,,United Kingdom
577358,23311,VINTAGE CHRISTMAS STOCKING ,2,11/18/2011 15:59,4.96,,United Kingdom
577358,23318,BOX OF 6 MINI VINTAGE CRACKERS,6,11/18/2011 15:59,4.96,,United Kingdom
577358,23320,GIANT 50'S CHRISTMAS CRACKER,1,11/18/2011 15:59,5.79,,United Kingdom
577358,23322,LARGE WHITE HEART OF WICKER,1,11/18/2011 15:59,5.79,,United Kingdom
577358,23328,SET 6 SCHOOL MILK BOTTLES IN CRATE,19,11/18/2011 15:59,7.46,,United Kingdom
577358,23334,IVORY WICKER HEART SMALL,4,11/18/2011 15:59,1.25,,United Kingdom
577358,23343,JUMBO BAG VINTAGE CHRISTMAS ,6,11/18/2011 15:59,4.13,,United Kingdom
577358,23344,JUMBO BAG 50'S CHRISTMAS ,8,11/18/2011 15:59,4.13,,United Kingdom
577358,23346,SPACEBOY BEAKER,1,11/18/2011 15:59,2.46,,United Kingdom
577358,23347,I LOVE LONDON BEAKER,1,11/18/2011 15:59,2.46,,United Kingdom
577358,23348,CHILDRENS TOY COOKING UTENSIL SET,2,11/18/2011 15:59,4.13,,United Kingdom
577358,23349,ROLL WRAP VINTAGE CHRISTMAS,6,11/18/2011 15:59,2.46,,United Kingdom
577358,23350,ROLL WRAP VINTAGE SPOT ,1,11/18/2011 15:59,2.46,,United Kingdom
577358,23351,ROLL WRAP 50'S CHRISTMAS,1,11/18/2011 15:59,2.46,,United Kingdom
577358,23353,6 GIFT TAGS VINTAGE CHRISTMAS ,7,11/18/2011 15:59,1.63,,United Kingdom
577358,23365,SET 12 COLOUR PENCILS LOVE LONDON,3,11/18/2011 15:59,1.25,,United Kingdom
577358,23366,SET 12 COLOURING PENCILS DOILY,3,11/18/2011 15:59,1.25,,United Kingdom
577358,23367,SET 12 COLOUR PENCILS SPACEBOY ,4,11/18/2011 15:59,1.25,,United Kingdom
577358,23369,SET 36 COLOUR PENCILS LOVE LONDON,8,11/18/2011 15:59,2.46,,United Kingdom
577358,23370,SET 36 COLOURING PENCILS DOILY,1,11/18/2011 15:59,2.46,,United Kingdom
577358,23371,SET 36 COLOUR PENCILS SPACEBOY ,2,11/18/2011 15:59,2.46,,United Kingdom
577358,23372,SET 36 COLOUR PENCILS DOLLY GIRL,2,11/18/2011 15:59,2.46,,United Kingdom
577358,23374,RED SPOT PAPER GIFT BAG,1,11/18/2011 15:59,1.63,,United Kingdom
577358,23376,PACK OF 12 VINTAGE CHRISTMAS TISSUE,2,11/18/2011 15:59,0.83,,United Kingdom
577358,23377,PACK OF 12 DOLLY GIRL TISSUES,1,11/18/2011 15:59,0.83,,United Kingdom
577358,23378,PACK OF 12 50'S CHRISTMAS TISSUES,1,11/18/2011 15:59,0.83,,United Kingdom
577358,23379,PACK OF 12 RED APPLE TISSUES,1,11/18/2011 15:59,0.83,,United Kingdom
577358,23380,PACK OF 12 VINTAGE DOILY TISSUES,1,11/18/2011 15:59,0.83,,United Kingdom
577358,23388,WOODLAND MINI BACKPACK,1,11/18/2011 15:59,8.29,,United Kingdom
577358,23389,SPACEBOY MINI BACKPACK,1,11/18/2011 15:59,8.29,,United Kingdom
577358,23390,DOLLY GIRL MINI BACKPACK,1,11/18/2011 15:59,8.29,,United Kingdom
577358,23396,LE JARDIN BOTANIQUE CUSHION COVER,2,11/18/2011 15:59,10.79,,United Kingdom
577358,23397,FOOT STOOL HOME SWEET HOME ,1,11/18/2011 15:59,19.96,,United Kingdom
577358,23398,HANGING HEART BONHEUR,1,11/18/2011 15:59,2.08,,United Kingdom
577358,23399,HOME SWEET HOME HANGING HEART,1,11/18/2011 15:59,2.08,,United Kingdom
577358,23407,SET OF 2 TRAYS HOME SWEET HOME,1,11/18/2011 15:59,16.63,,United Kingdom
577358,23413,DECORATIVE VINTAGE COFFEE  BOX,1,11/18/2011 15:59,10.79,,United Kingdom
577358,23419,HOME SWEET HOME BOTTLE ,1,11/18/2011 15:59,4.13,,United Kingdom
577358,23424,GINGHAM RECIPE BOOK BOX,1,11/18/2011 15:59,10.79,,United Kingdom
577358,23425,STORAGE TIN HOME SWEET HOME,1,11/18/2011 15:59,4.96,,United Kingdom
577358,23426,METAL SIGN DROP YOUR PANTS,1,11/18/2011 15:59,5.79,,United Kingdom
577358,23434,3 RAFFIA RIBBONS 50'S CHRISTMAS ,14,11/18/2011 15:59,0.83,,United Kingdom
577358,23435,3 RAFFIA RIBBONS VINTAGE CHRISTMAS,8,11/18/2011 15:59,0.83,,United Kingdom
577358,23436,VINTAGE CHRISTMAS GIFT BAG LARGE ,3,11/18/2011 15:59,2.46,,United Kingdom
577358,23437, 50'S CHRISTMAS GIFT BAG LARGE,2,11/18/2011 15:59,2.46,,United Kingdom
577358,23438, RED SPOT GIFT BAG LARGE,3,11/18/2011 15:59,2.46,,United Kingdom
577358,23473,WOODLAND SMALL RED FELT HEART,1,11/18/2011 15:59,1.63,,United Kingdom
577358,23474,WOODLAND SMALL BLUE FELT HEART,1,11/18/2011 15:59,1.63,,United Kingdom
577358,23477,WOODLAND LARGE BLUE FELT HEART,3,11/18/2011 15:59,2.46,,United Kingdom
577358,23478,WOODLAND LARGE PINK FELT HEART,5,11/18/2011 15:59,2.46,,United Kingdom
577358,23484,HEART TRELLIS TRIPLE T-LIGHT HOLDER,1,11/18/2011 15:59,5.79,,United Kingdom
577358,23493,VINTAGE DOILY TRAVEL SEWING KIT,6,11/18/2011 15:59,3.29,,United Kingdom
577358,23497,CLASSIC CHROME BICYCLE BELL ,4,11/18/2011 15:59,3.29,,United Kingdom
577358,23499,SET 12 VINTAGE DOILY CHALK ,3,11/18/2011 15:59,0.83,,United Kingdom
577358,23500,KEY RING BASEBALL BOOT ASSORTED ,2,11/18/2011 15:59,2.46,,United Kingdom
577358,23506,MINI PLAYING CARDS SPACEBOY ,1,11/18/2011 15:59,0.83,,United Kingdom
577358,23508,MINI PLAYING CARDS DOLLY GIRL ,1,11/18/2011 15:59,0.83,,United Kingdom
577358,23526,WALL ART DOG LICENCE ,1,11/18/2011 15:59,12.46,,United Kingdom
577358,23534,WALL ART STOP FOR TEA ,2,11/18/2011 15:59,12.46,,United Kingdom
577358,23535,WALL ART BICYCLE SAFETY,5,11/18/2011 15:59,12.46,,United Kingdom
577358,23553,LANDMARK FRAME CAMDEN TOWN ,1,11/18/2011 15:59,24.96,,United Kingdom
577358,23554,LANDMARK FRAME OXFORD STREET,1,11/18/2011 15:59,24.96,,United Kingdom
577358,23558,LANDMARK FRAME LONDON BRIDGE ,1,11/18/2011 15:59,24.96,,United Kingdom
