575367,22940,FELTCRAFT CHRISTMAS FAIRY,12,11/9/2011 15:05,4.25,15114,United Kingdom
575367,22141,CHRISTMAS CRAFT TREE TOP ANGEL,6,11/9/2011 15:05,2.1,15114,United Kingdom
575367,22144,CHRISTMAS CRAFT LITTLE FRIENDS,6,11/9/2011 15:05,2.1,15114,United Kingdom
575367,22577,WOODEN HEART CHRISTMAS SCANDINAVIAN,48,11/9/2011 15:05,0.29,15114,United Kingdom
575367,22578,WOODEN STAR CHRISTMAS SCANDINAVIAN,48,11/9/2011 15:05,0.29,15114,United Kingdom
575367,22579,WOODEN TREE CHRISTMAS SCANDINAVIAN,24,11/9/2011 15:05,0.29,15114,United Kingdom
575367,22573,STAR WOODEN CHRISTMAS DECORATION,12,11/9/2011 15:05,0.85,15114,United Kingdom
575367,22574,HEART WOODEN CHRISTMAS DECORATION,12,11/9/2011 15:05,0.85,15114,United Kingdom
575367,22576,SWALLOW WOODEN CHRISTMAS DECORATION,12,11/9/2011 15:05,0.85,15114,United Kingdom
575367,22601,CHRISTMAS RETROSPOT ANGEL WOOD,12,11/9/2011 15:05,0.85,15114,United Kingdom
575367,22600,CHRISTMAS RETROSPOT STAR WOOD,12,11/9/2011 15:05,0.85,15114,United Kingdom
575367,22603,CHRISTMAS RETROSPOT TREE WOOD,12,11/9/2011 15:05,0.85,15114,United Kingdom
575367,22602,RETROSPOT WOODEN HEART DECORATION,12,11/9/2011 15:05,0.85,15114,United Kingdom
575367,22595,GINGHAM HEART DECORATION,12,11/9/2011 15:05,0.85,15114,United Kingdom
575367,22593,CHRISTMAS GINGHAM STAR,12,11/9/2011 15:05,0.85,15114,United Kingdom
575367,22594,CHRISTMAS GINGHAM TREE,12,11/9/2011 15:05,0.85,15114,United Kingdom
575367,22581,WOOD STOCKING CHRISTMAS SCANDISPOT,12,11/9/2011 15:05,0.85,15114,United Kingdom
575367,23264,SET OF 3 WOODEN SLEIGH DECORATIONS,12,11/9/2011 15:05,1.25,15114,United Kingdom
575367,23266,SET OF 3 WOODEN STOCKING DECORATION,12,11/9/2011 15:05,1.25,15114,United Kingdom
575367,85199S,SMALL HANGING IVORY/RED WOOD BIRD,24,11/9/2011 15:05,0.42,15114,United Kingdom
575367,23265,SET OF 3 WOODEN TREE DECORATIONS,12,11/9/2011 15:05,1.25,15114,United Kingdom
575367,35967,FOLK ART METAL STAR T-LIGHT HOLDER,12,11/9/2011 15:05,0.38,15114,United Kingdom
575367,23434,3 RAFFIA RIBBONS 50'S CHRISTMAS ,10,11/9/2011 15:05,0.79,15114,United Kingdom
575367,23435,3 RAFFIA RIBBONS VINTAGE CHRISTMAS,10,11/9/2011 15:05,0.79,15114,United Kingdom
575367,22738,RIBBON REEL SNOWY VILLAGE,10,11/9/2011 15:05,1.65,15114,United Kingdom
575367,22734,SET OF 6 RIBBONS VINTAGE CHRISTMAS,6,11/9/2011 15:05,2.89,15114,United Kingdom
575367,22737,RIBBON REEL CHRISTMAS PRESENT ,10,11/9/2011 15:05,1.65,15114,United Kingdom
575367,22736,RIBBON REEL MAKING SNOWMEN ,10,11/9/2011 15:05,1.65,15114,United Kingdom
575367,22306,SILVER MUG BONE CHINA TREE OF LIFE,24,11/9/2011 15:05,1.06,15114,United Kingdom
575367,22307,GOLD MUG BONE CHINA TREE OF LIFE,24,11/9/2011 15:05,1.06,15114,United Kingdom
575367,22065,CHRISTMAS PUDDING TRINKET POT ,48,11/9/2011 15:05,0.39,15114,United Kingdom
575367,22952,60 CAKE CASES VINTAGE CHRISTMAS,24,11/9/2011 15:05,0.55,15114,United Kingdom
575367,22909,SET OF 20 VINTAGE CHRISTMAS NAPKINS,12,11/9/2011 15:05,0.85,15114,United Kingdom
575367,23382,BOX OF 6 CHRISTMAS CAKE DECORATIONS,4,11/9/2011 15:05,3.75,15114,United Kingdom
575368,90065B,BLACK VINT ART DEC CRYSTAL BRACELET,1,11/9/2011 15:07,6.75,14482,United Kingdom
575368,90184C,BLACK CHUNKY BEAD BRACELET W STRAP,1,11/9/2011 15:07,8.95,14482,United Kingdom
575368,51008,AFGHAN SLIPPER SOCK PAIR,1,11/9/2011 15:07,3.45,14482,United Kingdom
575368,22866,HAND WARMER SCOTTY DOG DESIGN,1,11/9/2011 15:07,2.1,14482,United Kingdom
575368,90159,COTE D'AZURE NECKLACE,1,11/9/2011 15:07,4.95,14482,United Kingdom
575368,90158,ST TROPEZ NECKLACE,2,11/9/2011 15:07,4.95,14482,United Kingdom
575368,21922,UNION STRIPE WITH FRINGE  HAMMOCK,1,11/9/2011 15:07,7.95,14482,United Kingdom
575368,22047,EMPIRE GIFT WRAP,25,11/9/2011 15:07,0.42,14482,United Kingdom
575368,22785,SQUARECUSHION COVER PINK UNION JACK,1,11/9/2011 15:07,6.75,14482,United Kingdom
575368,23336,EGG FRYING PAN PINK ,1,11/9/2011 15:07,2.08,14482,United Kingdom
575368,23129,HEART SHAPED HOLLY WREATH,1,11/9/2011 15:07,4.15,14482,United Kingdom
575368,23302,KNEELING MAT HOUSEWORK  DESIGN,1,11/9/2011 15:07,1.65,14482,United Kingdom
575368,21818,GLITTER HEART DECORATION,4,11/9/2011 15:07,0.39,14482,United Kingdom
575368,23219,LAUREL STAR ANTIQUE SILVER ,2,11/9/2011 15:07,1.25,14482,United Kingdom
575368,90195A,PURPLE GEMSTONE BRACELET,1,11/9/2011 15:07,2.95,14482,United Kingdom
575368,90196B,BLACK GEMSTONE NECKLACE 45CM,1,11/9/2011 15:07,12.75,14482,United Kingdom
575368,90195B,BLACK GEMSTONE BRACELET,1,11/9/2011 15:07,2.95,14482,United Kingdom
575368,90160B,RED BOUDICCA LARGE BRACELET,1,11/9/2011 15:07,6.95,14482,United Kingdom
575368,90196A,PURPLE GEMSTONE NECKLACE 45CM,1,11/9/2011 15:07,12.75,14482,United Kingdom
575368,23219,LAUREL STAR ANTIQUE SILVER ,1,11/9/2011 15:07,1.25,14482,United Kingdom
575368,21817,GLITTER CHRISTMAS TREE,1,11/9/2011 15:07,0.39,14482,United Kingdom
575368,21817,GLITTER CHRISTMAS TREE,1,11/9/2011 15:07,0.39,14482,United Kingdom
575368,21822,GLITTER CHRISTMAS TREE WITH BELLS,1,11/9/2011 15:07,0.79,14482,United Kingdom
575368,35953,FOLKART STAR CHRISTMAS DECORATIONS,4,11/9/2011 15:07,0.39,14482,United Kingdom
575368,21922,UNION STRIPE WITH FRINGE  HAMMOCK,1,11/9/2011 15:07,7.95,14482,United Kingdom
575368,22095,LADS ONLY TISSUE BOX,1,11/9/2011 15:07,0.39,14482,United Kingdom
575368,23319,BOX OF 6 MINI 50'S CRACKERS,4,11/9/2011 15:07,2.49,14482,United Kingdom
575368,22952,60 CAKE CASES VINTAGE CHRISTMAS,1,11/9/2011 15:07,0.55,14482,United Kingdom
575368,22866,HAND WARMER SCOTTY DOG DESIGN,1,11/9/2011 15:07,2.1,14482,United Kingdom
575368,23275,SET OF 3 HANGING OWLS OLLIE BEAK,1,11/9/2011 15:07,1.25,14482,United Kingdom
575368,82582,AREA PATROLLED METAL SIGN,1,11/9/2011 15:07,2.1,14482,United Kingdom
575368,21034,REX CASH+CARRY JUMBO SHOPPER,1,11/9/2011 15:07,0.95,14482,United Kingdom
575368,84692,BOX OF 24 COCKTAIL PARASOLS,1,11/9/2011 15:07,0.42,14482,United Kingdom
575368,21731,RED TOADSTOOL LED NIGHT LIGHT,1,11/9/2011 15:07,1.65,14482,United Kingdom
575368,48188,DOORMAT WELCOME PUPPIES,1,11/9/2011 15:07,8.25,14482,United Kingdom
575368,23394,POSTE FRANCE CUSHION COVER,1,11/9/2011 15:07,3.75,14482,United Kingdom
575368,23395,BELLE JARDINIERE CUSHION COVER,2,11/9/2011 15:07,3.75,14482,United Kingdom
575368,23396,LE JARDIN BOTANIQUE CUSHION COVER,1,11/9/2011 15:07,3.75,14482,United Kingdom
575368,23084,RABBIT NIGHT LIGHT,1,11/9/2011 15:07,2.08,14482,United Kingdom
575368,23583,LUNCH BAG PAISLEY PARK  ,1,11/9/2011 15:07,1.65,14482,United Kingdom
575368,22568,FELTCRAFT CUSHION OWL,2,11/9/2011 15:07,3.75,14482,United Kingdom
575368,22970,LONDON BUS COFFEE MUG,6,11/9/2011 15:07,2.55,14482,United Kingdom
575368,22941,CHRISTMAS LIGHTS 10 REINDEER,1,11/9/2011 15:07,8.5,14482,United Kingdom
575368,23083,SET 6 PAPER TABLE LANTERN STARS ,1,11/9/2011 15:07,3.75,14482,United Kingdom
575368,22809,SET OF 6 T-LIGHTS SANTA,1,11/9/2011 15:07,2.95,14482,United Kingdom
575368,23203,JUMBO BAG VINTAGE DOILY ,4,11/9/2011 15:07,2.08,14482,United Kingdom
575368,23320,GIANT 50'S CHRISTMAS CRACKER,2,11/9/2011 15:07,2.89,14482,United Kingdom
575368,23319,BOX OF 6 MINI 50'S CRACKERS,4,11/9/2011 15:07,2.49,14482,United Kingdom
575368,23396,LE JARDIN BOTANIQUE CUSHION COVER,1,11/9/2011 15:07,3.75,14482,United Kingdom
575368,22158,3 HEARTS HANGING DECORATION RUSTIC,1,11/9/2011 15:07,2.95,14482,United Kingdom
575368,21809,CHRISTMAS HANGING TREE WITH BELL,1,11/9/2011 15:07,0.39,14482,United Kingdom
575368,21810,CHRISTMAS HANGING STAR WITH BELL,2,11/9/2011 15:07,0.39,14482,United Kingdom
575368,23210,WHITE ROCKING HORSE HAND PAINTED,1,11/9/2011 15:07,1.25,14482,United Kingdom
575368,23211,RED ROCKING HORSE HAND PAINTED,1,11/9/2011 15:07,1.25,14482,United Kingdom
575368,23213,STAR WREATH DECORATION WITH BELL,1,11/9/2011 15:07,1.25,14482,United Kingdom
575368,23212,HEART WREATH DECORATION WITH BELL,1,11/9/2011 15:07,1.25,14482,United Kingdom
575368,21809,CHRISTMAS HANGING TREE WITH BELL,1,11/9/2011 15:07,0.39,14482,United Kingdom
575368,21811,HANGING HEART WITH BELL,2,11/9/2011 15:07,0.39,14482,United Kingdom
575368,90204,PAIR OF ENAMEL BUTTERFLY HAIRCLIP,1,11/9/2011 15:07,3.35,14482,United Kingdom
575369,22086,PAPER CHAIN KIT 50'S CHRISTMAS ,40,11/9/2011 15:09,2.55,16655,United Kingdom
575369,23382,BOX OF 6 CHRISTMAS CAKE DECORATIONS,4,11/9/2011 15:09,3.75,16655,United Kingdom
575369,23475,WOODLAND SMALL PINK FELT HEART,12,11/9/2011 15:09,0.83,16655,United Kingdom
575369,23473,WOODLAND SMALL RED FELT HEART,12,11/9/2011 15:09,0.83,16655,United Kingdom
575369,23478,WOODLAND LARGE PINK FELT HEART,12,11/9/2011 15:09,1.25,16655,United Kingdom
575369,21458,2 PICTURE BOOK EGGS EASTER BUNNY,12,11/9/2011 15:09,1.25,16655,United Kingdom
575369,21457,2 PICTURE BOOK EGGS EASTER DUCKS,12,11/9/2011 15:09,1.25,16655,United Kingdom
575369,84457,SET/3 RABBITS FLOWER SKIPPPING ROPE,12,11/9/2011 15:09,0.85,16655,United Kingdom
575369,85202,HANGING WOOD AND FELT HEART,24,11/9/2011 15:09,0.42,16655,United Kingdom
575369,23264,SET OF 3 WOODEN SLEIGH DECORATIONS,12,11/9/2011 15:09,1.25,16655,United Kingdom
575369,23265,SET OF 3 WOODEN TREE DECORATIONS,12,11/9/2011 15:09,1.25,16655,United Kingdom
575369,22577,WOODEN HEART CHRISTMAS SCANDINAVIAN,24,11/9/2011 15:09,0.29,16655,United Kingdom
575369,22578,WOODEN STAR CHRISTMAS SCANDINAVIAN,24,11/9/2011 15:09,0.29,16655,United Kingdom
575369,22579,WOODEN TREE CHRISTMAS SCANDINAVIAN,24,11/9/2011 15:09,0.29,16655,United Kingdom
575369,21790,VINTAGE SNAP CARDS,12,11/9/2011 15:09,0.85,16655,United Kingdom
575369,23439,HAND WARMER RED LOVE HEART,24,11/9/2011 15:09,2.1,16655,United Kingdom
575369,22865,HAND WARMER OWL DESIGN,12,11/9/2011 15:09,2.1,16655,United Kingdom
575369,22866,HAND WARMER SCOTTY DOG DESIGN,12,11/9/2011 15:09,2.1,16655,United Kingdom
575369,22834,HAND WARMER BABUSHKA DESIGN,12,11/9/2011 15:09,2.1,16655,United Kingdom
575369,22111,SCOTTIE DOG HOT WATER BOTTLE,12,11/9/2011 15:09,4.95,16655,United Kingdom
575369,22113,GREY HEART HOT WATER BOTTLE,36,11/9/2011 15:09,3.75,16655,United Kingdom
575369,21481,FAWN BLUE HOT WATER BOTTLE,8,11/9/2011 15:09,3.75,16655,United Kingdom
575370,22086,PAPER CHAIN KIT 50'S CHRISTMAS ,6,11/9/2011 15:11,2.95,13522,United Kingdom
575370,22585,PACK OF 6 BIRDY GIFT TAGS,12,11/9/2011 15:11,1.25,13522,United Kingdom
575370,22077,6 RIBBONS RUSTIC CHARM,12,11/9/2011 15:11,1.95,13522,United Kingdom
575370,23356,LOVE HOT WATER BOTTLE,6,11/9/2011 15:11,5.95,13522,United Kingdom
575370,22113,GREY HEART HOT WATER BOTTLE,8,11/9/2011 15:11,4.25,13522,United Kingdom
575371,22731,3D CHRISTMAS STAMPS STICKERS ,36,11/9/2011 15:11,1.25,14132,United Kingdom
575371,22992,REVOLVER WOODEN RULER ,12,11/9/2011 15:11,1.95,14132,United Kingdom
575371,22560,TRADITIONAL MODELLING CLAY,24,11/9/2011 15:11,1.25,14132,United Kingdom
575371,22620,4 TRADITIONAL SPINNING TOPS,12,11/9/2011 15:11,1.45,14132,United Kingdom
575371,22144,CHRISTMAS CRAFT LITTLE FRIENDS,40,11/9/2011 15:11,1.85,14132,United Kingdom
575371,84077,WORLD WAR 2 GLIDERS ASSTD DESIGNS,48,11/9/2011 15:11,0.29,14132,United Kingdom
575371,23310,BUBBLEGUM RING ASSORTED,36,11/9/2011 15:11,0.42,14132,United Kingdom
575371,22492,MINI PAINT SET VINTAGE ,72,11/9/2011 15:11,0.65,14132,United Kingdom
575371,22493,PAINT YOUR OWN CANVAS SET,12,11/9/2011 15:11,1.65,14132,United Kingdom
575371,22531,MAGIC DRAWING SLATE CIRCUS PARADE  ,24,11/9/2011 15:11,0.42,14132,United Kingdom
575371,22546,MINI JIGSAW PURDEY,24,11/9/2011 15:11,0.42,14132,United Kingdom
575383,21135,VICTORIAN  METAL POSTCARD SPRING,8,11/9/2011 15:17,1.69,15986,United Kingdom
575383,21136,PAINTED METAL PEARS ASSORTED,8,11/9/2011 15:17,1.69,15986,United Kingdom
575383,84879,ASSORTED COLOUR BIRD ORNAMENT,8,11/9/2011 15:17,1.69,15986,United Kingdom
575383,22295,HEART FILIGREE DOVE LARGE,12,11/9/2011 15:17,1.65,15986,United Kingdom
575383,23398,HANGING HEART BONHEUR,12,11/9/2011 15:17,0.85,15986,United Kingdom
575383,23399,HOME SWEET HOME HANGING HEART,12,11/9/2011 15:17,0.85,15986,United Kingdom
575383,84836,ZINC METAL HEART DECORATION,12,11/9/2011 15:17,1.25,15986,United Kingdom
575383,21819,GLITTER CHRISTMAS STAR ,36,11/9/2011 15:17,0.39,15986,United Kingdom
575383,21818,GLITTER HEART DECORATION,36,11/9/2011 15:17,0.39,15986,United Kingdom
575383,21817,GLITTER CHRISTMAS TREE,16,11/9/2011 15:17,0.39,15986,United Kingdom
575383,22577,WOODEN HEART CHRISTMAS SCANDINAVIAN,48,11/9/2011 15:17,0.29,15986,United Kingdom
575383,22578,WOODEN STAR CHRISTMAS SCANDINAVIAN,24,11/9/2011 15:17,0.29,15986,United Kingdom
575383,22579,WOODEN TREE CHRISTMAS SCANDINAVIAN,24,11/9/2011 15:17,0.29,15986,United Kingdom
575383,22602,RETROSPOT WOODEN HEART DECORATION,12,11/9/2011 15:17,0.85,15986,United Kingdom
575384,23318,BOX OF 6 MINI VINTAGE CRACKERS,6,11/9/2011 15:17,2.49,17690,United Kingdom
575384,23319,BOX OF 6 MINI 50'S CRACKERS,6,11/9/2011 15:17,2.49,17690,United Kingdom
575384,22738,RIBBON REEL SNOWY VILLAGE,10,11/9/2011 15:17,1.65,17690,United Kingdom
575384,22736,RIBBON REEL MAKING SNOWMEN ,10,11/9/2011 15:17,1.65,17690,United Kingdom
575384,22086,PAPER CHAIN KIT 50'S CHRISTMAS ,12,11/9/2011 15:17,2.95,17690,United Kingdom
575384,22910,PAPER CHAIN KIT VINTAGE CHRISTMAS,12,11/9/2011 15:17,2.95,17690,United Kingdom
575384,22941,CHRISTMAS LIGHTS 10 REINDEER,4,11/9/2011 15:17,8.5,17690,United Kingdom
575384,23494,VINTAGE DOILY DELUXE SEWING KIT ,6,11/9/2011 15:17,5.95,17690,United Kingdom
575384,23493,VINTAGE DOILY TRAVEL SEWING KIT,10,11/9/2011 15:17,1.95,17690,United Kingdom
575384,21481,FAWN BLUE HOT WATER BOTTLE,8,11/9/2011 15:17,3.75,17690,United Kingdom
575384,21479,WHITE SKULL HOT WATER BOTTLE ,4,11/9/2011 15:17,4.25,17690,United Kingdom
575384,23355,HOT WATER BOTTLE KEEP CALM,8,11/9/2011 15:17,4.95,17690,United Kingdom
575384,21485,RETROSPOT HEART HOT WATER BOTTLE,3,11/9/2011 15:17,4.95,17690,United Kingdom
575384,84029E,RED WOOLLY HOTTIE WHITE HEART.,4,11/9/2011 15:17,4.25,17690,United Kingdom
575384,22865,HAND WARMER OWL DESIGN,12,11/9/2011 15:17,2.1,17690,United Kingdom
575384,23439,HAND WARMER RED LOVE HEART,12,11/9/2011 15:17,2.1,17690,United Kingdom
575384,22834,HAND WARMER BABUSHKA DESIGN,12,11/9/2011 15:17,2.1,17690,United Kingdom
575384,22867,HAND WARMER BIRD DESIGN,12,11/9/2011 15:17,2.1,17690,United Kingdom
575384,23200,JUMBO BAG PEARS,10,11/9/2011 15:17,2.08,17690,United Kingdom
575384,22385,JUMBO BAG SPACEBOY DESIGN,10,11/9/2011 15:17,2.08,17690,United Kingdom
575384,22411,JUMBO SHOPPER VINTAGE RED PAISLEY,10,11/9/2011 15:17,2.08,17690,United Kingdom
C575385,23099,FRENCH CARRIAGE LANTERN,-1,11/9/2011 15:19,6.65,15916,United Kingdom
C575385,22784,LANTERN CREAM GAZEBO ,-1,11/9/2011 15:19,4.95,15916,United Kingdom
C575385,22119,PEACE WOODEN BLOCK LETTERS,-1,11/9/2011 15:19,6.95,15916,United Kingdom
575386,20977,,-16,11/9/2011 15:22,0,,United Kingdom
575387,20978,36 PENCILS TUBE SKULLS,16,11/9/2011 15:23,1.25,13992,United Kingdom
575387,22621,TRADITIONAL KNITTING NANCY,12,11/9/2011 15:23,1.65,13992,United Kingdom
575387,20979,36 PENCILS TUBE RED RETROSPOT,16,11/9/2011 15:23,1.25,13992,United Kingdom
575387,20719,WOODLAND CHARLOTTE BAG,10,11/9/2011 15:23,0.85,13992,United Kingdom
575387,20724,RED RETROSPOT CHARLOTTE BAG,10,11/9/2011 15:23,0.85,13992,United Kingdom
575388,84946,ANTIQUE SILVER T-LIGHT GLASS,144,11/9/2011 15:30,1.06,12971,United Kingdom
575388,22086,PAPER CHAIN KIT 50'S CHRISTMAS ,12,11/9/2011 15:30,2.95,12971,United Kingdom
575389,21464,DISCO BALL ROTATOR BATTERY OPERATED,2,11/9/2011 15:31,4.25,12971,United Kingdom
575389,22580,ADVENT CALENDAR GINGHAM SACK,3,11/9/2011 15:31,5.95,12971,United Kingdom
575389,22152,PLACE SETTING WHITE STAR,24,11/9/2011 15:31,0.42,12971,United Kingdom
575389,22594,CHRISTMAS GINGHAM TREE,12,11/9/2011 15:31,0.85,12971,United Kingdom
575389,22593,CHRISTMAS GINGHAM STAR,12,11/9/2011 15:31,0.85,12971,United Kingdom
575389,22572,ROCKING HORSE GREEN CHRISTMAS ,24,11/9/2011 15:31,0.85,12971,United Kingdom
575389,22571,ROCKING HORSE RED CHRISTMAS ,24,11/9/2011 15:31,0.85,12971,United Kingdom
575390,22574,HEART WOODEN CHRISTMAS DECORATION,12,11/9/2011 15:31,0.85,12971,United Kingdom
575390,22576,SWALLOW WOODEN CHRISTMAS DECORATION,12,11/9/2011 15:31,0.85,12971,United Kingdom
575390,23267,SET OF 4 SANTA PLACE SETTINGS,12,11/9/2011 15:31,1.25,12971,United Kingdom
575390,23222,CHRISTMAS TREE HANGING GOLD,12,11/9/2011 15:31,0.83,12971,United Kingdom
575390,23220,REINDEER HEART DECORATION GOLD,12,11/9/2011 15:31,0.83,12971,United Kingdom
575391,72817,SET OF 2 CHRISTMAS DECOUPAGE CANDLE,24,11/9/2011 15:36,0.79,14354,United Kingdom
575391,85032A,ROMANTIC IMAGES GIFT WRAP SET,12,11/9/2011 15:36,0.65,14354,United Kingdom
575391,22601,CHRISTMAS RETROSPOT ANGEL WOOD,12,11/9/2011 15:36,0.85,14354,United Kingdom
575391,85199S,SMALL HANGING IVORY/RED WOOD BIRD,24,11/9/2011 15:36,0.42,14354,United Kingdom
575391,22077,6 RIBBONS RUSTIC CHARM,12,11/9/2011 15:36,1.95,14354,United Kingdom
575391,22734,SET OF 6 RIBBONS VINTAGE CHRISTMAS,6,11/9/2011 15:36,2.89,14354,United Kingdom
575392,21642,ASSORTED TUTTI FRUTTI PEN,24,11/9/2011 15:42,0.29,14234,United Kingdom
575392,23366,SET 12 COLOURING PENCILS DOILY,16,11/9/2011 15:42,0.65,14234,United Kingdom
575392,23367,SET 12 COLOUR PENCILS SPACEBOY ,16,11/9/2011 15:42,0.65,14234,United Kingdom
575392,23368,SET 12 COLOUR PENCILS DOLLY GIRL ,16,11/9/2011 15:42,0.65,14234,United Kingdom
575392,21208,PASTEL COLOUR HONEYCOMB FAN,12,11/9/2011 15:42,0.39,14234,United Kingdom
575392,21209,MULTICOLOUR HONEYCOMB FAN,12,11/9/2011 15:42,0.39,14234,United Kingdom
575392,35471D,SET OF 3 BIRD LIGHT PINK FEATHER ,24,11/9/2011 15:42,0.39,14234,United Kingdom
575392,22571,ROCKING HORSE RED CHRISTMAS ,12,11/9/2011 15:42,0.85,14234,United Kingdom
575392,22572,ROCKING HORSE GREEN CHRISTMAS ,12,11/9/2011 15:42,0.85,14234,United Kingdom
575392,22940,FELTCRAFT CHRISTMAS FAIRY,4,11/9/2011 15:42,4.25,14234,United Kingdom
575392,22142,CHRISTMAS CRAFT WHITE FAIRY ,12,11/9/2011 15:42,1.45,14234,United Kingdom
575392,22959,WRAP CHRISTMAS VILLAGE,25,11/9/2011 15:42,0.42,14234,United Kingdom
575392,22150,3 STRIPEY MICE FELTCRAFT,6,11/9/2011 15:42,1.95,14234,United Kingdom
575392,21137,BLACK RECORD COVER FRAME,12,11/9/2011 15:42,3.75,14234,United Kingdom
575392,22041,"RECORD FRAME 7"" SINGLE SIZE ",12,11/9/2011 15:42,2.55,14234,United Kingdom
575410,85099B,JUMBO BAG RED RETROSPOT,20,11/9/2011 15:50,2.08,17705,United Kingdom
575410,20718,RED RETROSPOT SHOPPER BAG,10,11/9/2011 15:50,1.25,17705,United Kingdom
575410,22279,POCKET BAG BLUE PAISLEY RED SPOT,12,11/9/2011 15:50,1.25,17705,United Kingdom
575410,22193,RED DINER WALL CLOCK,2,11/9/2011 15:50,8.5,17705,United Kingdom
575410,23341,PINK DINER WALL CLOCK,2,11/9/2011 15:50,8.5,17705,United Kingdom
575410,22728,ALARM CLOCK BAKELIKE PINK,12,11/9/2011 15:50,3.75,17705,United Kingdom
575410,22726,ALARM CLOCK BAKELIKE GREEN,12,11/9/2011 15:50,3.75,17705,United Kingdom
575410,22727,ALARM CLOCK BAKELIKE RED ,12,11/9/2011 15:50,3.75,17705,United Kingdom
575410,22909,SET OF 20 VINTAGE CHRISTMAS NAPKINS,12,11/9/2011 15:50,0.85,17705,United Kingdom
575410,85150,LADIES & GENTLEMEN METAL SIGN,6,11/9/2011 15:50,2.55,17705,United Kingdom
575410,23076,ICE CREAM SUNDAE LIP GLOSS,24,11/9/2011 15:50,1.25,17705,United Kingdom
575410,22114,HOT WATER BOTTLE TEA AND SYMPATHY,4,11/9/2011 15:50,4.25,17705,United Kingdom
575410,23355,HOT WATER BOTTLE KEEP CALM,4,11/9/2011 15:50,4.95,17705,United Kingdom
575410,23344,JUMBO BAG 50'S CHRISTMAS ,10,11/9/2011 15:50,2.08,17705,United Kingdom
575410,23343,JUMBO BAG VINTAGE CHRISTMAS ,10,11/9/2011 15:50,2.08,17705,United Kingdom
575410,22411,JUMBO SHOPPER VINTAGE RED PAISLEY,10,11/9/2011 15:50,2.08,17705,United Kingdom
575410,21928,JUMBO BAG SCANDINAVIAN BLUE PAISLEY,10,11/9/2011 15:50,2.08,17705,United Kingdom
575415,23313,VINTAGE CHRISTMAS BUNTING,50,11/9/2011 15:51,4.15,16168,United Kingdom
575418,85099C,JUMBO  BAG BAROQUE BLACK WHITE,10,11/9/2011 15:52,2.08,16986,United Kingdom
575418,22386,JUMBO BAG PINK POLKADOT,30,11/9/2011 15:52,2.08,16986,United Kingdom
575433,85099B,JUMBO BAG RED RETROSPOT,10,11/9/2011 15:54,2.08,16953,United Kingdom
575475,22595,GINGHAM HEART DECORATION,12,11/9/2011 16:03,0.85,17702,United Kingdom
575475,23348,CHILDRENS TOY COOKING UTENSIL SET,6,11/9/2011 16:03,2.08,17702,United Kingdom
575475,22139,RETROSPOT TEA SET CERAMIC 11 PC ,6,11/9/2011 16:03,4.95,17702,United Kingdom
575475,20713,JUMBO BAG OWLS,10,11/9/2011 16:03,2.08,17702,United Kingdom
575475,23200,JUMBO BAG PEARS,10,11/9/2011 16:03,2.08,17702,United Kingdom
575475,85099B,JUMBO BAG RED RETROSPOT,100,11/9/2011 16:03,1.79,17702,United Kingdom
575475,22578,WOODEN STAR CHRISTMAS SCANDINAVIAN,24,11/9/2011 16:03,0.29,17702,United Kingdom
575475,22579,WOODEN TREE CHRISTMAS SCANDINAVIAN,24,11/9/2011 16:03,0.29,17702,United Kingdom
575475,20727,LUNCH BAG  BLACK SKULL.,10,11/9/2011 16:03,1.65,17702,United Kingdom
575475,23206,LUNCH BAG APPLE DESIGN,10,11/9/2011 16:03,1.65,17702,United Kingdom
575475,23583,LUNCH BAG PAISLEY PARK  ,10,11/9/2011 16:03,1.65,17702,United Kingdom
575475,20725,LUNCH BAG RED RETROSPOT,10,11/9/2011 16:03,1.65,17702,United Kingdom
575475,23208,LUNCH BAG VINTAGE LEAF DESIGN,10,11/9/2011 16:03,1.65,17702,United Kingdom
575475,23209,LUNCH BAG VINTAGE DOILY ,10,11/9/2011 16:03,1.65,17702,United Kingdom
575475,23681,LUNCH BAG RED VINTAGE DOILY,10,11/9/2011 16:03,1.65,17702,United Kingdom
575475,23199,JUMBO BAG APPLES,10,11/9/2011 16:03,2.08,17702,United Kingdom
575475,23582,VINTAGE DOILY JUMBO BAG RED ,10,11/9/2011 16:03,2.08,17702,United Kingdom
575475,23581,JUMBO BAG PAISLEY PARK,10,11/9/2011 16:03,2.08,17702,United Kingdom
575475,85099F,JUMBO BAG STRAWBERRY,10,11/9/2011 16:03,2.08,17702,United Kingdom
575476,35954,SMALL FOLKART STAR CHRISTMAS DEC,120,11/9/2011 16:10,0.19,15046,United Kingdom
575476,21390,FILIGRIS HEART WITH BUTTERFLY,24,11/9/2011 16:10,1.25,15046,United Kingdom
575476,23210,WHITE ROCKING HORSE HAND PAINTED,48,11/9/2011 16:10,1.25,15046,United Kingdom
575476,22297,HEART IVORY TRELLIS SMALL,24,11/9/2011 16:10,1.25,15046,United Kingdom
575476,23227,FILIGREE HEART BUTTERFLY WHITE ,96,11/9/2011 16:10,1.25,15046,United Kingdom
575476,21822,GLITTER CHRISTMAS TREE WITH BELLS,12,11/9/2011 16:10,0.79,15046,United Kingdom
575476,23228,FILIGREE HEART BIRD WHITE ,96,11/9/2011 16:10,1.25,15046,United Kingdom
575476,21034,REX CASH+CARRY JUMBO SHOPPER,1,11/9/2011 16:10,0.95,15046,United Kingdom
575476,23210,WHITE ROCKING HORSE HAND PAINTED,48,11/9/2011 16:10,1.25,15046,United Kingdom
575477,20971,PINK BLUE FELT CRAFT TRINKET BOX,1,11/9/2011 16:14,2.46,,United Kingdom
575477,20972,PINK CREAM FELT CRAFT TRINKET BOX ,1,11/9/2011 16:14,2.46,,United Kingdom
575477,20973,12 PENCIL SMALL TUBE WOODLAND,5,11/9/2011 16:14,1.25,,United Kingdom
575477,20979,36 PENCILS TUBE RED RETROSPOT,3,11/9/2011 16:14,2.46,,United Kingdom
575477,20982,12 PENCILS TALL TUBE SKULLS,1,11/9/2011 16:14,1.63,,United Kingdom
575477,20983,12 PENCILS TALL TUBE RED RETROSPOT,1,11/9/2011 16:14,1.63,,United Kingdom
575477,20985,HEART CALCULATOR,4,11/9/2011 16:14,2.46,,United Kingdom
575477,20986,BLUE CALCULATOR RULER,1,11/9/2011 16:14,2.46,,United Kingdom
575477,21014,SWISS CHALET TREE DECORATION ,8,11/9/2011 16:14,0.83,,United Kingdom
575477,21015,DARK BIRD HOUSE TREE DECORATION,9,11/9/2011 16:14,0.83,,United Kingdom
575477,21039,RED RETROSPOT SHOPPING BAG,1,11/9/2011 16:14,5.79,,United Kingdom
575477,21064,BOOM BOX SPEAKER BOYS,2,11/9/2011 16:14,4.13,,United Kingdom
575477,21065,BOOM BOX SPEAKER GIRLS,1,11/9/2011 16:14,4.13,,United Kingdom
575477,21068,VINTAGE BILLBOARD LOVE/HATE MUG,2,11/9/2011 16:14,2.46,,United Kingdom
575477,21080,SET/20 RED RETROSPOT PAPER NAPKINS ,1,11/9/2011 16:14,1.63,,United Kingdom
575477,21116,OWL DOORSTOP,1,11/9/2011 16:14,8.29,,United Kingdom
575477,21126,SET OF 6 GIRLS CELEBRATION CANDLES,1,11/9/2011 16:14,1.25,,United Kingdom
575477,21137,BLACK RECORD COVER FRAME,2,11/9/2011 16:14,7.46,,United Kingdom
575477,21165,BEWARE OF THE CAT METAL SIGN ,1,11/9/2011 16:14,4.13,,United Kingdom
575477,21166,COOK WITH WINE METAL SIGN ,1,11/9/2011 16:14,4.13,,United Kingdom
575477,21167,WHITE SAGE INCENSE,1,11/9/2011 16:14,0.42,,United Kingdom
575477,21174,POTTERING IN THE SHED METAL SIGN,1,11/9/2011 16:14,4.13,,United Kingdom
575477,21175,GIN + TONIC DIET METAL SIGN,1,11/9/2011 16:14,4.96,,United Kingdom
575477,21181,PLEASE ONE PERSON METAL SIGN,3,11/9/2011 16:14,4.13,,United Kingdom
575477,21212,PACK OF 72 RETROSPOT CAKE CASES,4,11/9/2011 16:14,1.25,,United Kingdom
575477,21213,PACK OF 72 SKULL CAKE CASES,1,11/9/2011 16:14,1.25,,United Kingdom
575477,21217,RED RETROSPOT ROUND CAKE TINS,1,11/9/2011 16:14,20.79,,United Kingdom
575477,21224,SET/4 SKULL BADGES,3,11/9/2011 16:14,0.83,,United Kingdom
575477,21231,SWEETHEART CERAMIC TRINKET BOX,1,11/9/2011 16:14,2.46,,United Kingdom
575477,21260,FIRST AID TIN,1,11/9/2011 16:14,6.63,,United Kingdom
575477,21314,SMALL GLASS HEART TRINKET POT,2,11/9/2011 16:14,4.13,,United Kingdom
575477,21328,BALLOONS  WRITING SET ,2,11/9/2011 16:14,3.29,,United Kingdom
575477,21356,TOAST ITS - FAIRY FLOWER,7,11/9/2011 16:14,0.83,,United Kingdom
575477,21383,PACK OF 12 STICKY BUNNIES,2,11/9/2011 16:14,1.25,,United Kingdom
575477,21385,IVORY HANGING DECORATION  HEART,1,11/9/2011 16:14,1.63,,United Kingdom
575477,21429,RED GINGHAM ROSE JEWELLERY BOX,2,11/9/2011 16:14,4.13,,United Kingdom
575477,21471,STRAWBERRY RAFFIA FOOD COVER,1,11/9/2011 16:14,3.29,,United Kingdom
575477,21494,ROTATING LEAVES T-LIGHT HOLDER,1,11/9/2011 16:14,2.46,,United Kingdom
575477,21506,"FANCY FONT BIRTHDAY CARD, ",2,11/9/2011 16:14,0.83,,United Kingdom
575477,21530,DAIRY MAID TOASTRACK,1,11/9/2011 16:14,3.29,,United Kingdom
575477,21544,SKULLS  WATER TRANSFER TATTOOS ,7,11/9/2011 16:14,1.63,,United Kingdom
575477,21555,CERAMIC STRAWBERRY TRINKET TRAY,1,11/9/2011 16:14,2.46,,United Kingdom
575477,21577,SAVE THE PLANET COTTON TOTE BAG,1,11/9/2011 16:14,4.96,,United Kingdom
575477,21616,4 PEAR BOTANICAL DINNER CANDLES,1,11/9/2011 16:14,3.29,,United Kingdom
