573405,23486,ANTIQUE HEART SHELF UNIT,1,10/30/2011 15:55,16.65,13822,United Kingdom
573405,82494L,WOODEN FRAME ANTIQUE WHITE ,3,10/30/2011 15:55,2.95,13822,United Kingdom
573405,23569,TRADTIONAL ALPHABET STAMP SET,1,10/30/2011 15:55,4.95,13822,United Kingdom
573405,23571,TRADITIONAL NAUGHTS & CROSSES,3,10/30/2011 15:55,1.65,13822,United Kingdom
573405,23570,TRADITIONAL PICK UP STICKS GAME ,3,10/30/2011 15:55,1.25,13822,United Kingdom
573405,22464,HANGING METAL HEART LANTERN,3,10/30/2011 15:55,1.65,13822,United Kingdom
573405,85123A,WHITE HANGING HEART T-LIGHT HOLDER,3,10/30/2011 15:55,2.95,13822,United Kingdom
573405,85036B,CHOCOLATE 1 WICK MORRIS BOX CANDLE,3,10/30/2011 15:55,1.25,13822,United Kingdom
573405,85036C,ROSE 1 WICK MORRIS BOXED CANDLE,3,10/30/2011 15:55,1.25,13822,United Kingdom
573405,22791,T-LIGHT GLASS FLUTED ANTIQUE,12,10/30/2011 15:55,1.25,13822,United Kingdom
573405,23090,VINTAGE GLASS T-LIGHT HOLDER,12,10/30/2011 15:55,0.83,13822,United Kingdom
573405,84950,ASSORTED COLOUR T-LIGHT HOLDER,12,10/30/2011 15:55,0.65,13822,United Kingdom
573405,20893,HANGING BAUBLE T-LIGHT HOLDER SMALL,12,10/30/2011 15:55,2.55,13822,United Kingdom
573405,23407,SET OF 2 TRAYS HOME SWEET HOME,1,10/30/2011 15:55,9.95,13822,United Kingdom
573405,82482,WOODEN PICTURE FRAME WHITE FINISH,3,10/30/2011 15:55,2.95,13822,United Kingdom
573405,22789,T-LIGHT HOLDER SWEETHEART HANGING,2,10/30/2011 15:55,1.95,13822,United Kingdom
573405,84970L,SINGLE HEART ZINC T-LIGHT HOLDER,3,10/30/2011 15:55,1.25,13822,United Kingdom
573405,23145,ZINC T-LIGHT HOLDER STAR LARGE,2,10/30/2011 15:55,0.95,13822,United Kingdom
573405,84970S,HANGING HEART ZINC T-LIGHT HOLDER,3,10/30/2011 15:55,0.85,13822,United Kingdom
573405,84766,SILVER ROCOCO CANDLE STICK,2,10/30/2011 15:55,5.95,13822,United Kingdom
573405,84978,HANGING HEART JAR T-LIGHT HOLDER,6,10/30/2011 15:55,1.25,13822,United Kingdom
573405,85111,SILVER GLITTER FLOWER VOTIVE HOLDER,6,10/30/2011 15:55,0.29,13822,United Kingdom
573405,84946,ANTIQUE SILVER T-LIGHT GLASS,6,10/30/2011 15:55,1.25,13822,United Kingdom
573405,21326,AGED GLASS SILVER T-LIGHT HOLDER,3,10/30/2011 15:55,0.65,13822,United Kingdom
573405,21132,SILVER STANDING GNOME   ,1,10/30/2011 15:55,4.25,13822,United Kingdom
573405,21167,WHITE SAGE INCENSE,25,10/30/2011 15:55,0.21,13822,United Kingdom
573405,21935,SUKI  SHOULDER BAG,3,10/30/2011 15:55,1.65,13822,United Kingdom
573405,22355,CHARLOTTE BAG SUKI DESIGN,3,10/30/2011 15:55,0.85,13822,United Kingdom
573405,23209,LUNCH BAG VINTAGE DOILY ,3,10/30/2011 15:55,1.65,13822,United Kingdom
573405,23583,LUNCH BAG PAISLEY PARK  ,6,10/30/2011 15:55,1.65,13822,United Kingdom
573405,22189,CREAM HEART CARD HOLDER,3,10/30/2011 15:55,3.95,13822,United Kingdom
573405,85131A,BEADED PEARL HEART WHITE ON STICK,3,10/30/2011 15:55,1.25,13822,United Kingdom
573405,21034,REX CASH+CARRY JUMBO SHOPPER,3,10/30/2011 15:55,0.95,13822,United Kingdom
573406,20712,JUMBO BAG WOODLAND ANIMALS,10,10/30/2011 15:57,2.08,14112,United Kingdom
573406,21931,JUMBO STORAGE BAG SUKI,10,10/30/2011 15:57,2.08,14112,United Kingdom
573406,21930,JUMBO STORAGE BAG SKULLS,10,10/30/2011 15:57,2.08,14112,United Kingdom
573406,85099B,JUMBO BAG RED RETROSPOT,10,10/30/2011 15:57,2.08,14112,United Kingdom
573406,22411,JUMBO SHOPPER VINTAGE RED PAISLEY,10,10/30/2011 15:57,2.08,14112,United Kingdom
573406,85099C,JUMBO  BAG BAROQUE BLACK WHITE,10,10/30/2011 15:57,2.08,14112,United Kingdom
573406,23582,VINTAGE DOILY JUMBO BAG RED ,10,10/30/2011 15:57,2.08,14112,United Kingdom
573406,23203,JUMBO BAG VINTAGE DOILY ,10,10/30/2011 15:57,2.08,14112,United Kingdom
573406,23200,JUMBO BAG PEARS,10,10/30/2011 15:57,2.08,14112,United Kingdom
573406,23199,JUMBO BAG APPLES,10,10/30/2011 15:57,2.08,14112,United Kingdom
573406,22355,CHARLOTTE BAG SUKI DESIGN,10,10/30/2011 15:57,0.85,14112,United Kingdom
573406,20719,WOODLAND CHARLOTTE BAG,10,10/30/2011 15:57,0.85,14112,United Kingdom
573406,20724,RED RETROSPOT CHARLOTTE BAG,10,10/30/2011 15:57,0.85,14112,United Kingdom
573406,23204,CHARLOTTE BAG APPLES DESIGN,10,10/30/2011 15:57,0.85,14112,United Kingdom
573406,22752,SET 7 BABUSHKA NESTING BOXES,2,10/30/2011 15:57,8.5,14112,United Kingdom
573406,20726,LUNCH BAG WOODLAND,10,10/30/2011 15:57,1.65,14112,United Kingdom
573406,20725,LUNCH BAG RED RETROSPOT,10,10/30/2011 15:57,1.65,14112,United Kingdom
573406,23209,LUNCH BAG VINTAGE DOILY ,10,10/30/2011 15:57,1.65,14112,United Kingdom
573406,23206,LUNCH BAG APPLE DESIGN,10,10/30/2011 15:57,1.65,14112,United Kingdom
573406,22383,LUNCH BAG SUKI DESIGN ,10,10/30/2011 15:57,1.65,14112,United Kingdom
573406,20728,LUNCH BAG CARS BLUE,10,10/30/2011 15:57,1.65,14112,United Kingdom
573406,20727,LUNCH BAG  BLACK SKULL.,10,10/30/2011 15:57,1.65,14112,United Kingdom
573406,23358,HOT STUFF HOT WATER BOTTLE,6,10/30/2011 15:57,3.75,14112,United Kingdom
573406,21484,CHICK GREY HOT WATER BOTTLE,4,10/30/2011 15:57,4.25,14112,United Kingdom
573406,21481,FAWN BLUE HOT WATER BOTTLE,4,10/30/2011 15:57,3.75,14112,United Kingdom
573406,21485,RETROSPOT HEART HOT WATER BOTTLE,3,10/30/2011 15:57,4.95,14112,United Kingdom
573406,84029E,RED WOOLLY HOTTIE WHITE HEART.,4,10/30/2011 15:57,4.25,14112,United Kingdom
573406,21479,WHITE SKULL HOT WATER BOTTLE ,4,10/30/2011 15:57,4.25,14112,United Kingdom
573406,23310,BUBBLEGUM RING ASSORTED,36,10/30/2011 15:57,0.42,14112,United Kingdom
573406,22866,HAND WARMER SCOTTY DOG DESIGN,12,10/30/2011 15:57,2.1,14112,United Kingdom
573406,22632,HAND WARMER RED RETROSPOT,12,10/30/2011 15:57,2.1,14112,United Kingdom
573406,22865,HAND WARMER OWL DESIGN,12,10/30/2011 15:57,2.1,14112,United Kingdom
573406,23436,VINTAGE CHRISTMAS GIFT BAG LARGE ,12,10/30/2011 15:57,1.25,14112,United Kingdom
573406,23344,JUMBO BAG 50'S CHRISTMAS ,10,10/30/2011 15:57,2.08,14112,United Kingdom
573406,22086,PAPER CHAIN KIT 50'S CHRISTMAS ,6,10/30/2011 15:57,2.95,14112,United Kingdom
573406,23319,BOX OF 6 MINI 50'S CRACKERS,6,10/30/2011 15:57,2.49,14112,United Kingdom
573406,23320,GIANT 50'S CHRISTMAS CRACKER,12,10/30/2011 15:57,2.89,14112,United Kingdom
573406,22952,60 CAKE CASES VINTAGE CHRISTMAS,24,10/30/2011 15:57,0.55,14112,United Kingdom
573406,22910,PAPER CHAIN KIT VINTAGE CHRISTMAS,6,10/30/2011 15:57,2.95,14112,United Kingdom
573406,23343,JUMBO BAG VINTAGE CHRISTMAS ,10,10/30/2011 15:57,2.08,14112,United Kingdom
573406,23318,BOX OF 6 MINI VINTAGE CRACKERS,6,10/30/2011 15:57,2.49,14112,United Kingdom
573406,23312,VINTAGE CHRISTMAS GIFT SACK,4,10/30/2011 15:57,4.15,14112,United Kingdom
573406,23311,VINTAGE CHRISTMAS STOCKING ,6,10/30/2011 15:57,2.55,14112,United Kingdom
573407,20983,12 PENCILS TALL TUBE RED RETROSPOT,12,10/30/2011 15:58,0.85,18067,United Kingdom
573407,23371,SET 36 COLOUR PENCILS SPACEBOY ,6,10/30/2011 15:58,1.25,18067,United Kingdom
573407,23419,HOME SWEET HOME BOTTLE ,1,10/30/2011 15:58,2.08,18067,United Kingdom
573407,23321,SMALL WHITE HEART OF WICKER,4,10/30/2011 15:58,1.65,18067,United Kingdom
573407,22367,CHILDRENS APRON SPACEBOY DESIGN,1,10/30/2011 15:58,1.95,18067,United Kingdom
573407,21625,VINTAGE UNION JACK APRON,1,10/30/2011 15:58,6.95,18067,United Kingdom
573407,16254,TRANSPARENT ACRYLIC TAPE DISPENSER,1,10/30/2011 15:58,0.85,18067,United Kingdom
573407,22082,RIBBON REEL STRIPES DESIGN ,5,10/30/2011 15:58,1.65,18067,United Kingdom
573407,22734,SET OF 6 RIBBONS VINTAGE CHRISTMAS,1,10/30/2011 15:58,2.89,18067,United Kingdom
573407,22077,6 RIBBONS RUSTIC CHARM,1,10/30/2011 15:58,1.95,18067,United Kingdom
573407,85049A,TRADITIONAL CHRISTMAS RIBBONS,1,10/30/2011 15:58,1.25,18067,United Kingdom
573407,85049E,SCANDINAVIAN REDS RIBBONS,2,10/30/2011 15:58,1.25,18067,United Kingdom
573407,22628,PICNIC BOXES SET OF 3 RETROSPOT ,1,10/30/2011 15:58,4.95,18067,United Kingdom
573407,22079,RIBBON REEL HEARTS DESIGN ,5,10/30/2011 15:58,1.65,18067,United Kingdom
573407,22383,LUNCH BAG SUKI DESIGN ,1,10/30/2011 15:58,1.65,18067,United Kingdom
573407,23583,LUNCH BAG PAISLEY PARK  ,1,10/30/2011 15:58,1.65,18067,United Kingdom
573407,23394,POSTE FRANCE CUSHION COVER,2,10/30/2011 15:58,3.75,18067,United Kingdom
573407,21936,RED RETROSPOT PICNIC BAG,1,10/30/2011 15:58,2.95,18067,United Kingdom
573407,20724,RED RETROSPOT CHARLOTTE BAG,10,10/30/2011 15:58,0.85,18067,United Kingdom
573407,22113,GREY HEART HOT WATER BOTTLE,6,10/30/2011 15:58,4.25,18067,United Kingdom
573407,23425,STORAGE TIN HOME SWEET HOME,6,10/30/2011 15:58,2.49,18067,United Kingdom
573407,23403,LETTER HOLDER HOME SWEET HOME,4,10/30/2011 15:58,3.75,18067,United Kingdom
573407,23482,PEARLISED IVORY HEART LARGE ,12,10/30/2011 15:58,1.65,18067,United Kingdom
