573373,47591D,PINK FAIRY CAKE CHILDRENS APRON,2,10/30/2011 13:37,1.95,14684,United Kingdom
573373,23103,JINGLE BELL HEART DECORATION,1,10/30/2011 13:37,1.65,14684,United Kingdom
573373,22652,TRAVEL SEWING KIT,1,10/30/2011 13:37,1.65,14684,United Kingdom
573373,23365,SET 12 COLOUR PENCILS LOVE LONDON,3,10/30/2011 13:37,0.65,14684,United Kingdom
573373,23103,JINGLE BELL HEART DECORATION,1,10/30/2011 13:37,1.65,14684,United Kingdom
573373,20973,12 PENCIL SMALL TUBE WOODLAND,2,10/30/2011 13:37,0.65,14684,United Kingdom
573373,23366,SET 12 COLOURING PENCILS DOILY,2,10/30/2011 13:37,0.65,14684,United Kingdom
573373,20983,12 PENCILS TALL TUBE RED RETROSPOT,2,10/30/2011 13:37,0.85,14684,United Kingdom
573373,22753,SMALL YELLOW BABUSHKA NOTEBOOK ,3,10/30/2011 13:37,0.85,14684,United Kingdom
573373,23491,VINTAGE JINGLE BELLS HEART,1,10/30/2011 13:37,8.25,14684,United Kingdom
573373,22755,SMALL PURPLE BABUSHKA NOTEBOOK ,4,10/30/2011 13:37,0.85,14684,United Kingdom
573373,22754,SMALL RED BABUSHKA NOTEBOOK ,3,10/30/2011 13:37,0.85,14684,United Kingdom
573373,22564,ALPHABET STENCIL CRAFT,2,10/30/2011 13:37,1.25,14684,United Kingdom
573373,22563,HAPPY STENCIL CRAFT,2,10/30/2011 13:37,1.25,14684,United Kingdom
573373,22562,MONSTERS STENCIL CRAFT,1,10/30/2011 13:37,1.25,14684,United Kingdom
573373,16259,PIECE OF CAMO STATIONERY SET,4,10/30/2011 13:37,0.08,14684,United Kingdom
573373,22562,MONSTERS STENCIL CRAFT,1,10/30/2011 13:37,1.25,14684,United Kingdom
573373,21329,DINOSAURS  WRITING SET ,1,10/30/2011 13:37,1.65,14684,United Kingdom
573373,21327,SKULLS WRITING SET ,1,10/30/2011 13:37,1.65,14684,United Kingdom
573373,23295,SET OF 12 MINI LOAF BAKING CASES,1,10/30/2011 13:37,0.83,14684,United Kingdom
573373,22457,NATURAL SLATE HEART CHALKBOARD ,1,10/30/2011 13:37,2.95,14684,United Kingdom
573373,23507,MINI PLAYING CARDS BUFFALO BILL ,1,10/30/2011 13:37,0.42,14684,United Kingdom
573373,21212,PACK OF 72 RETROSPOT CAKE CASES,1,10/30/2011 13:37,0.55,14684,United Kingdom
573373,20668,DISCO BALL CHRISTMAS DECORATION,24,10/30/2011 13:37,0.12,14684,United Kingdom
573373,21975,PACK OF 60 DINOSAUR CAKE CASES,2,10/30/2011 13:37,0.55,14684,United Kingdom
573373,84991,60 TEATIME FAIRY CAKE CASES,1,10/30/2011 13:37,0.55,14684,United Kingdom
573373,23198,PANTRY MAGNETIC  SHOPPING LIST,2,10/30/2011 13:37,1.45,14684,United Kingdom
573373,22991,GIRAFFE WOODEN RULER,1,10/30/2011 13:37,1.95,14684,United Kingdom
573373,21213,PACK OF 72 SKULL CAKE CASES,3,10/30/2011 13:37,0.55,14684,United Kingdom
573373,70007,HI TEC ALPINE HAND WARMER,4,10/30/2011 13:37,1.65,14684,United Kingdom
573373,23308,SET OF 60 VINTAGE LEAF CAKE CASES ,2,10/30/2011 13:37,0.55,14684,United Kingdom
573373,22417,PACK OF 60 SPACEBOY CAKE CASES,1,10/30/2011 13:37,0.55,14684,United Kingdom
573373,23307,SET OF 60 PANTRY DESIGN CAKE CASES ,2,10/30/2011 13:37,0.55,14684,United Kingdom
573373,22750,FELTCRAFT PRINCESS LOLA DOLL,1,10/30/2011 13:37,3.75,14684,United Kingdom
573373,22273,FELTCRAFT DOLL MOLLY,1,10/30/2011 13:37,2.95,14684,United Kingdom
573373,22271,FELTCRAFT DOLL ROSIE,1,10/30/2011 13:37,2.95,14684,United Kingdom
573373,23583,LUNCH BAG PAISLEY PARK  ,1,10/30/2011 13:37,1.65,14684,United Kingdom
573373,22118,JOY WOODEN BLOCK LETTERS,1,10/30/2011 13:37,4.95,14684,United Kingdom
573373,85123A,WHITE HANGING HEART T-LIGHT HOLDER,3,10/30/2011 13:37,2.95,14684,United Kingdom
573373,16235,RECYCLED PENCIL WITH RABBIT ERASER,10,10/30/2011 13:37,0.21,14684,United Kingdom
573373,22619,SET OF 6 SOLDIER SKITTLES,1,10/30/2011 13:37,3.75,14684,United Kingdom
573373,22621,TRADITIONAL KNITTING NANCY,3,10/30/2011 13:37,1.65,14684,United Kingdom
573373,21891,TRADITIONAL WOODEN SKIPPING ROPE,2,10/30/2011 13:37,1.45,14684,United Kingdom
573373,21892,TRADITIONAL WOODEN CATCH CUP GAME ,2,10/30/2011 13:37,1.25,14684,United Kingdom
573373,85227,SET OF 6 3D KIT CARDS FOR KIDS,6,10/30/2011 13:37,0.85,14684,United Kingdom
573373,22810,SET OF 6 T-LIGHTS SNOWMEN,1,10/30/2011 13:37,2.95,14684,United Kingdom
573373,72131,COLUMBIAN CANDLE RECTANGLE,1,10/30/2011 13:37,1.95,14684,United Kingdom
573373,72128,COLUMBIAN CANDLE ROUND,2,10/30/2011 13:37,0.85,14684,United Kingdom
573373,72133,COLUMBIAN CANDLE RECTANGLE,2,10/30/2011 13:37,1.25,14684,United Kingdom
573373,72130,COLUMBIAN CANDLE ROUND,2,10/30/2011 13:37,0.65,14684,United Kingdom
573373,72134,COLUMBIAN  CUBE CANDLE ,2,10/30/2011 13:37,0.85,14684,United Kingdom
573373,23583,LUNCH BAG PAISLEY PARK  ,1,10/30/2011 13:37,1.65,14684,United Kingdom
573373,20727,LUNCH BAG  BLACK SKULL.,1,10/30/2011 13:37,1.65,14684,United Kingdom
573373,22382,LUNCH BAG SPACEBOY DESIGN ,1,10/30/2011 13:37,1.65,14684,United Kingdom
573373,20726,LUNCH BAG WOODLAND,1,10/30/2011 13:37,1.65,14684,United Kingdom
573373,22383,LUNCH BAG SUKI DESIGN ,1,10/30/2011 13:37,1.65,14684,United Kingdom
573373,22113,GREY HEART HOT WATER BOTTLE,1,10/30/2011 13:37,4.25,14684,United Kingdom
573373,21479,WHITE SKULL HOT WATER BOTTLE ,1,10/30/2011 13:37,4.25,14684,United Kingdom
573373,21481,FAWN BLUE HOT WATER BOTTLE,1,10/30/2011 13:37,3.75,14684,United Kingdom
573373,23207,LUNCH BAG ALPHABET DESIGN,2,10/30/2011 13:37,1.65,14684,United Kingdom
573373,84519B,CARROT CHARLIE+LOLA COASTER SET,1,10/30/2011 13:37,1.25,14684,United Kingdom
573373,23505,PLAYING CARDS I LOVE LONDON ,2,10/30/2011 13:37,1.25,14684,United Kingdom
573373,84032B,CHARLIE + LOLA RED HOT WATER BOTTLE,1,10/30/2011 13:37,2.95,14684,United Kingdom
573373,23509,MINI PLAYING CARDS FUN FAIR ,1,10/30/2011 13:37,0.42,14684,United Kingdom
573373,23508,MINI PLAYING CARDS DOLLY GIRL ,1,10/30/2011 13:37,0.42,14684,United Kingdom
573373,23506,MINI PLAYING CARDS SPACEBOY ,2,10/30/2011 13:37,0.42,14684,United Kingdom
573373,84375,SET OF 20 KIDS COOKIE CUTTERS,2,10/30/2011 13:37,2.1,14684,United Kingdom
573373,84012,MAGIC SHEEP WOOL GROWING FROM PAPER,3,10/30/2011 13:37,0.85,14684,United Kingdom
573373,23439,HAND WARMER RED LOVE HEART,1,10/30/2011 13:37,2.1,14684,United Kingdom
573373,22865,HAND WARMER OWL DESIGN,2,10/30/2011 13:37,2.1,14684,United Kingdom
573373,22633,HAND WARMER UNION JACK,4,10/30/2011 13:37,2.1,14684,United Kingdom
573373,22867,HAND WARMER BIRD DESIGN,2,10/30/2011 13:37,2.1,14684,United Kingdom
573373,22834,HAND WARMER BABUSHKA DESIGN,3,10/30/2011 13:37,2.1,14684,United Kingdom
573374,22158,3 HEARTS HANGING DECORATION RUSTIC,16,10/30/2011 13:39,2.95,14755,United Kingdom
573374,85123A,WHITE HANGING HEART T-LIGHT HOLDER,12,10/30/2011 13:39,2.95,14755,United Kingdom
573374,22113,GREY HEART HOT WATER BOTTLE,8,10/30/2011 13:39,4.25,14755,United Kingdom
573374,21485,RETROSPOT HEART HOT WATER BOTTLE,9,10/30/2011 13:39,4.95,14755,United Kingdom
573374,22114,HOT WATER BOTTLE TEA AND SYMPATHY,12,10/30/2011 13:39,4.25,14755,United Kingdom
573374,23355,HOT WATER BOTTLE KEEP CALM,8,10/30/2011 13:39,4.95,14755,United Kingdom
573374,84879,ASSORTED COLOUR BIRD ORNAMENT,24,10/30/2011 13:39,1.69,14755,United Kingdom
573374,22771,CLEAR DRAWER KNOB ACRYLIC EDWARDIAN,12,10/30/2011 13:39,1.25,14755,United Kingdom
573374,22558,CLOTHES PEGS RETROSPOT PACK 24 ,24,10/30/2011 13:39,1.65,14755,United Kingdom
573374,21843,RED RETROSPOT CAKE STAND,2,10/30/2011 13:39,10.95,14755,United Kingdom
573374,22507,MEMO BOARD RETROSPOT  DESIGN,4,10/30/2011 13:39,4.95,14755,United Kingdom
573374,21672,WHITE SPOT RED CERAMIC DRAWER KNOB,12,10/30/2011 13:39,1.45,14755,United Kingdom
573374,21673,WHITE SPOT BLUE CERAMIC DRAWER KNOB,12,10/30/2011 13:39,1.45,14755,United Kingdom
573374,23031,DRAWER KNOB CRACKLE GLAZE PINK,6,10/30/2011 13:39,1.65,14755,United Kingdom
573374,23032,DRAWER KNOB CRACKLE GLAZE IVORY,6,10/30/2011 13:39,1.65,14755,United Kingdom
573375,23206,LUNCH BAG APPLE DESIGN,10,10/30/2011 13:42,1.65,15521,United Kingdom
573375,21238,RED RETROSPOT CUP,8,10/30/2011 13:42,0.85,15521,United Kingdom
573375,23209,LUNCH BAG VINTAGE DOILY ,10,10/30/2011 13:42,1.65,15521,United Kingdom
573375,20712,JUMBO BAG WOODLAND ANIMALS,10,10/30/2011 13:42,2.08,15521,United Kingdom
573375,23201,JUMBO BAG ALPHABET,10,10/30/2011 13:42,2.08,15521,United Kingdom
573375,23207,LUNCH BAG ALPHABET DESIGN,10,10/30/2011 13:42,1.65,15521,United Kingdom
573375,23255,CHILDRENS CUTLERY CIRCUS PARADE,4,10/30/2011 13:42,4.15,15521,United Kingdom
573375,23256,CHILDRENS CUTLERY SPACEBOY ,8,10/30/2011 13:42,4.15,15521,United Kingdom
573375,22382,LUNCH BAG SPACEBOY DESIGN ,10,10/30/2011 13:42,1.65,15521,United Kingdom
573375,23254,CHILDRENS CUTLERY DOLLY GIRL ,4,10/30/2011 13:42,4.15,15521,United Kingdom
573375,21915,RED  HARMONICA IN BOX ,24,10/30/2011 13:42,1.25,15521,United Kingdom
573375,21889,WOODEN BOX OF DOMINOES,12,10/30/2011 13:42,1.25,15521,United Kingdom
573375,22491,PACK OF 12 COLOURED PENCILS,12,10/30/2011 13:42,0.85,15521,United Kingdom
573375,22489,PACK OF 12 TRADITIONAL CRAYONS,24,10/30/2011 13:42,0.42,15521,United Kingdom
573375,22560,TRADITIONAL MODELLING CLAY,24,10/30/2011 13:42,1.25,15521,United Kingdom
573375,22622,BOX OF VINTAGE ALPHABET BLOCKS,2,10/30/2011 13:42,11.95,15521,United Kingdom
573375,22466,FAIRY TALE COTTAGE NIGHT LIGHT,12,10/30/2011 13:42,1.95,15521,United Kingdom
573375,21731,RED TOADSTOOL LED NIGHT LIGHT,24,10/30/2011 13:42,1.65,15521,United Kingdom
573375,23084,RABBIT NIGHT LIGHT,96,10/30/2011 13:42,1.79,15521,United Kingdom
573375,23569,TRADTIONAL ALPHABET STAMP SET,16,10/30/2011 13:42,4.95,15521,United Kingdom
573375,23571,TRADITIONAL NAUGHTS & CROSSES,12,10/30/2011 13:42,1.65,15521,United Kingdom
573375,22333,RETROSPOT PARTY BAG + STICKER SET,8,10/30/2011 13:42,1.65,15521,United Kingdom
573375,22331,WOODLAND PARTY BAG + STICKER SET,8,10/30/2011 13:42,1.65,15521,United Kingdom
573375,22332,SKULLS PARTY BAG + STICKER SET,8,10/30/2011 13:42,1.65,15521,United Kingdom
573376,82482,WOODEN PICTURE FRAME WHITE FINISH,2,10/30/2011 13:50,2.95,13617,United Kingdom
573376,23109,PACK OF SIX LED TEA LIGHTS,1,10/30/2011 13:50,2.89,13617,United Kingdom
573376,23090,VINTAGE GLASS T-LIGHT HOLDER,2,10/30/2011 13:50,0.83,13617,United Kingdom
573376,21696,SMALL SILVER TRELLIS CANDLEPOT,2,10/30/2011 13:50,2.95,13617,United Kingdom
573376,21693,SMALL HAMMERED SILVER CANDLEPOT ,7,10/30/2011 13:50,2.95,13617,United Kingdom
573376,21689,SILVER VANILLA  FLOWER CANDLE POT,6,10/30/2011 13:50,3.75,13617,United Kingdom
573376,23103,JINGLE BELL HEART DECORATION,5,10/30/2011 13:50,1.65,13617,United Kingdom
573376,72800E,4 IVORY DINNER CANDLES SILVER FLOCK,2,10/30/2011 13:50,2.55,13617,United Kingdom
573376,72799E,IVORY PILLAR CANDLE SILVER FLOCK,1,10/30/2011 13:50,2.95,13617,United Kingdom
573376,21819,GLITTER CHRISTMAS STAR ,28,10/30/2011 13:50,0.39,13617,United Kingdom
573376,85107,CUT GLASS T-LIGHT HOLDER OCTAGON,4,10/30/2011 13:50,2.55,13617,United Kingdom
573376,23489,VINTAGE BELLS GARLAND,4,10/30/2011 13:50,2.89,13617,United Kingdom
573376,23100,SILVER BELLS TABLE DECORATION,10,10/30/2011 13:50,1.25,13617,United Kingdom
573376,84947,ANTIQUE SILVER TEA GLASS ENGRAVED,10,10/30/2011 13:50,1.25,13617,United Kingdom
573376,22801,ANTIQUE GLASS PEDESTAL BOWL,4,10/30/2011 13:50,3.75,13617,United Kingdom
573376,22791,T-LIGHT GLASS FLUTED ANTIQUE,24,10/30/2011 13:50,1.25,13617,United Kingdom
573377,22144,CHRISTMAS CRAFT LITTLE FRIENDS,5,10/30/2011 13:51,2.1,14653,United Kingdom
573377,22142,CHRISTMAS CRAFT WHITE FAIRY ,5,10/30/2011 13:51,1.45,14653,United Kingdom
573377,23138,SINGLE WIRE HOOK IVORY HEART,3,10/30/2011 13:51,1.45,14653,United Kingdom
573377,23139,SINGLE WIRE HOOK PINK HEART,3,10/30/2011 13:51,1.45,14653,United Kingdom
573377,23012,GLASS APOTHECARY BOTTLE PERFUME,1,10/30/2011 13:51,3.95,14653,United Kingdom
573377,23013,GLASS APOTHECARY BOTTLE TONIC,1,10/30/2011 13:51,3.95,14653,United Kingdom
573377,21744,SNOWFLAKE PORTABLE TABLE LIGHT ,3,10/30/2011 13:51,2.95,14653,United Kingdom
573377,23082,SET 6 PAPER TABLE LANTERN HEARTS ,3,10/30/2011 13:51,3.75,14653,United Kingdom
573377,22093,MOTORING TISSUE BOX,2,10/30/2011 13:51,0.39,14653,United Kingdom
573377,22099,CARAVAN SQUARE TISSUE BOX,1,10/30/2011 13:51,0.39,14653,United Kingdom
573377,22795,SWEETHEART RECIPE BOOK STAND,1,10/30/2011 13:51,6.75,14653,United Kingdom
573377,23152,IVORY SWEETHEART WIRE LETTER RACK ,2,10/30/2011 13:51,3.75,14653,United Kingdom
573377,22136,LOVE HEART SOCK HANGER,3,10/30/2011 13:51,1.65,14653,United Kingdom
573377,22195,LARGE HEART MEASURING SPOONS,2,10/30/2011 13:51,1.65,14653,United Kingdom
573377,22196,SMALL HEART MEASURING SPOONS,4,10/30/2011 13:51,0.85,14653,United Kingdom
573377,23399,HOME SWEET HOME HANGING HEART,4,10/30/2011 13:51,0.85,14653,United Kingdom
573377,23337,EGG FRYING PAN MINT ,2,10/30/2011 13:51,2.08,14653,United Kingdom
573377,23338,EGG FRYING PAN RED ,2,10/30/2011 13:51,2.08,14653,United Kingdom
573377,23336,EGG FRYING PAN PINK ,2,10/30/2011 13:51,2.08,14653,United Kingdom
573377,23335,EGG FRYING PAN IVORY ,2,10/30/2011 13:51,2.08,14653,United Kingdom
573377,23339,EGG FRYING PAN BLUE ,3,10/30/2011 13:51,2.08,14653,United Kingdom
573377,21877,HOME SWEET HOME MUG,6,10/30/2011 13:51,1.65,14653,United Kingdom
573377,22429,ENAMEL MEASURING JUG CREAM,2,10/30/2011 13:51,4.25,14653,United Kingdom
573377,84050,PINK HEART SHAPE EGG FRYING PAN,2,10/30/2011 13:51,1.65,14653,United Kingdom
573377,23569,TRADTIONAL ALPHABET STAMP SET,1,10/30/2011 13:51,4.95,14653,United Kingdom
573377,23183,MOTHER'S KITCHEN SPOON REST ,2,10/30/2011 13:51,3.75,14653,United Kingdom
573377,23184,BULL DOG BOTTLE OPENER,2,10/30/2011 13:51,4.95,14653,United Kingdom
573377,85048,15CM CHRISTMAS GLASS BALL 20 LIGHTS,8,10/30/2011 13:51,7.95,14653,United Kingdom
573377,22848,BREAD BIN DINER STYLE PINK,1,10/30/2011 13:51,10,14653,United Kingdom
573377,22312,OFFICE MUG WARMER POLKADOT,1,10/30/2011 13:51,2.95,14653,United Kingdom
573377,22313,OFFICE MUG WARMER PINK,1,10/30/2011 13:51,2.95,14653,United Kingdom
573377,22314,OFFICE MUG WARMER CHOC+BLUE,1,10/30/2011 13:51,2.95,14653,United Kingdom
573377,23166,MEDIUM CERAMIC TOP STORAGE JAR,8,10/30/2011 13:51,1.25,14653,United Kingdom
573377,22966,GINGERBREAD MAN COOKIE CUTTER,2,10/30/2011 13:51,1.25,14653,United Kingdom
573377,84378,SET OF 3 HEART COOKIE CUTTERS,2,10/30/2011 13:51,1.45,14653,United Kingdom
573377,23169,CLASSIC GLASS COOKIE JAR,2,10/30/2011 13:51,4.15,14653,United Kingdom
573377,20751,FUNKY WASHING UP GLOVES ASSORTED,2,10/30/2011 13:51,2.1,14653,United Kingdom
573377,20751,FUNKY WASHING UP GLOVES ASSORTED,2,10/30/2011 13:51,2.1,14653,United Kingdom
573377,20751,FUNKY WASHING UP GLOVES ASSORTED,2,10/30/2011 13:51,2.1,14653,United Kingdom
573377,70007,HI TEC ALPINE HAND WARMER,1,10/30/2011 13:51,1.65,14653,United Kingdom
573377,70006,LOVE HEART POCKET WARMER,1,10/30/2011 13:51,1.65,14653,United Kingdom
573377,21205,MULTICOLOUR 3D BALLS GARLAND,1,10/30/2011 13:51,2.55,14653,United Kingdom
573377,23182,TOILET SIGN OCCUPIED OR VACANT,2,10/30/2011 13:51,0.83,14653,United Kingdom
573377,23182,TOILET SIGN OCCUPIED OR VACANT,3,10/30/2011 13:51,0.83,14653,United Kingdom
573377,22670,FRENCH WC SIGN BLUE METAL,1,10/30/2011 13:51,1.25,14653,United Kingdom
573377,21985,PACK OF 12 HEARTS DESIGN TISSUES ,12,10/30/2011 13:51,0.39,14653,United Kingdom
573377,23198,PANTRY MAGNETIC  SHOPPING LIST,3,10/30/2011 13:51,1.45,14653,United Kingdom
573377,22666,RECIPE BOX PANTRY YELLOW DESIGN,1,10/30/2011 13:51,2.95,14653,United Kingdom
573377,21745,GAOLERS KEYS DECORATIVE GARDEN ,1,10/30/2011 13:51,3.75,14653,United Kingdom
573377,82582,AREA PATROLLED METAL SIGN,1,10/30/2011 13:51,2.1,14653,United Kingdom
573377,22725,ALARM CLOCK BAKELIKE CHOCOLATE,1,10/30/2011 13:51,3.75,14653,United Kingdom
573377,22726,ALARM CLOCK BAKELIKE GREEN,1,10/30/2011 13:51,3.75,14653,United Kingdom
573377,22730,ALARM CLOCK BAKELIKE IVORY,1,10/30/2011 13:51,3.75,14653,United Kingdom
573377,23571,TRADITIONAL NAUGHTS & CROSSES,6,10/30/2011 13:51,1.65,14653,United Kingdom
573377,23570,TRADITIONAL PICK UP STICKS GAME ,6,10/30/2011 13:51,1.25,14653,United Kingdom
573377,23165,LARGE CERAMIC TOP STORAGE JAR,12,10/30/2011 13:51,1.65,14653,United Kingdom
573377,22961,JAM MAKING SET PRINTED,2,10/30/2011 13:51,1.45,14653,United Kingdom
573377,23558,LANDMARK FRAME LONDON BRIDGE ,1,10/30/2011 13:51,12.5,14653,United Kingdom
573377,23557,LANDMARK FRAME BAKER STREET ,1,10/30/2011 13:51,12.5,14653,United Kingdom
573377,23556,LANDMARK FRAME COVENT GARDEN ,1,10/30/2011 13:51,12.5,14653,United Kingdom
573377,23553,LANDMARK FRAME CAMDEN TOWN ,2,10/30/2011 13:51,12.5,14653,United Kingdom
573378,82484,WOOD BLACK BOARD ANT WHITE FINISH,2,10/30/2011 13:53,7.95,14217,United Kingdom
573378,23479,WIRE EGG BASKET ,2,10/30/2011 13:53,7.85,14217,United Kingdom
573378,23411, TRELLIS COAT RACK,6,10/30/2011 13:53,4.95,14217,United Kingdom
573378,84879,ASSORTED COLOUR BIRD ORNAMENT,8,10/30/2011 13:53,1.69,14217,United Kingdom
573378,22457,NATURAL SLATE HEART CHALKBOARD ,6,10/30/2011 13:53,2.95,14217,United Kingdom
573379,23301,GARDENERS KNEELING PAD KEEP CALM ,12,10/30/2011 14:03,1.65,15680,United Kingdom
573379,23300,GARDENERS KNEELING PAD CUP OF TEA ,12,10/30/2011 14:03,1.65,15680,United Kingdom
573379,21810,CHRISTMAS HANGING STAR WITH BELL,48,10/30/2011 14:03,0.39,15680,United Kingdom
573379,21811,HANGING HEART WITH BELL,48,10/30/2011 14:03,0.39,15680,United Kingdom
573379,21498,RED RETROSPOT WRAP ,25,10/30/2011 14:03,0.42,15680,United Kingdom
573379,21499,BLUE POLKADOT WRAP,25,10/30/2011 14:03,0.42,15680,United Kingdom
573379,23530,WALL ART ONLY ONE PERSON ,6,10/30/2011 14:03,4.95,15680,United Kingdom
573379,23470,CARD HOLDER LOVE BIRD LARGE ,2,10/30/2011 14:03,6.25,15680,United Kingdom
573379,23541,WALL ART CLASSIC PUDDINGS ,2,10/30/2011 14:03,8.25,15680,United Kingdom
573379,22079,RIBBON REEL HEARTS DESIGN ,10,10/30/2011 14:03,1.65,15680,United Kingdom
573379,22804,PINK HANGING HEART T-LIGHT HOLDER,6,10/30/2011 14:03,2.95,15680,United Kingdom
573379,23490,T-LIGHT HOLDER HANGING LOVE BIRD,6,10/30/2011 14:03,3.75,15680,United Kingdom
573379,22734,SET OF 6 RIBBONS VINTAGE CHRISTMAS,6,10/30/2011 14:03,2.89,15680,United Kingdom
573379,22813,PACK 3 BOXES BIRD PANNETONE ,12,10/30/2011 14:03,1.95,15680,United Kingdom
573379,84347,ROTATING SILVER ANGELS T-LIGHT HLDR,6,10/30/2011 14:03,2.55,15680,United Kingdom
573379,23100,SILVER BELLS TABLE DECORATION,24,10/30/2011 14:03,1.25,15680,United Kingdom
573379,21136,PAINTED METAL PEARS ASSORTED,8,10/30/2011 14:03,1.69,15680,United Kingdom
573379,22151,PLACE SETTING WHITE HEART,24,10/30/2011 14:03,0.42,15680,United Kingdom
573379,22595,GINGHAM HEART DECORATION,12,10/30/2011 14:03,0.85,15680,United Kingdom
573379,23129,HEART SHAPED HOLLY WREATH,4,10/30/2011 14:03,4.15,15680,United Kingdom
573379,23130,MISTLETOE HEART WREATH GREEN,4,10/30/2011 14:03,4.15,15680,United Kingdom
573379,23212,HEART WREATH DECORATION WITH BELL,12,10/30/2011 14:03,1.25,15680,United Kingdom
573379,23215,JINGLE BELL HEART ANTIQUE SILVER,12,10/30/2011 14:03,2.08,15680,United Kingdom
573379,23214,JINGLE BELL HEART ANTIQUE GOLD,12,10/30/2011 14:03,2.08,15680,United Kingdom
573379,23221,REINDEER HEART DECORATION SILVER,12,10/30/2011 14:03,0.83,15680,United Kingdom
573379,23225,CHERUB HEART DECORATION SILVER ,12,10/30/2011 14:03,0.83,15680,United Kingdom
573379,23344,JUMBO BAG 50'S CHRISTMAS ,10,10/30/2011 14:03,2.08,15680,United Kingdom
573379,22398,MAGNETS PACK OF 4 SWALLOWS,12,10/30/2011 14:03,0.39,15680,United Kingdom
573379,22219,LOVEBIRD HANGING DECORATION WHITE ,12,10/30/2011 14:03,0.85,15680,United Kingdom
573379,84879,ASSORTED COLOUR BIRD ORNAMENT,8,10/30/2011 14:03,1.69,15680,United Kingdom
573379,22212,FOUR HOOK  WHITE LOVEBIRDS,6,10/30/2011 14:03,2.1,15680,United Kingdom
573379,22111,SCOTTIE DOG HOT WATER BOTTLE,3,10/30/2011 14:03,4.95,15680,United Kingdom
573379,22112,CHOCOLATE HOT WATER BOTTLE,3,10/30/2011 14:03,4.95,15680,United Kingdom
573380,22654,DELUXE SEWING KIT ,2,10/30/2011 14:04,5.95,14572,United Kingdom
573380,23313,VINTAGE CHRISTMAS BUNTING,3,10/30/2011 14:04,4.95,14572,United Kingdom
573380,22114,HOT WATER BOTTLE TEA AND SYMPATHY,2,10/30/2011 14:04,4.25,14572,United Kingdom
573380,22835,HOT WATER BOTTLE I AM SO POORLY,2,10/30/2011 14:04,4.95,14572,United Kingdom
573380,22113,GREY HEART HOT WATER BOTTLE,2,10/30/2011 14:04,4.25,14572,United Kingdom
573380,23355,HOT WATER BOTTLE KEEP CALM,3,10/30/2011 14:04,4.95,14572,United Kingdom
573380,22118,JOY WOODEN BLOCK LETTERS,1,10/30/2011 14:04,4.95,14572,United Kingdom
573380,23275,SET OF 3 HANGING OWLS OLLIE BEAK,2,10/30/2011 14:04,1.25,14572,United Kingdom
573380,23265,SET OF 3 WOODEN TREE DECORATIONS,3,10/30/2011 14:04,1.25,14572,United Kingdom
573380,23263,SET OF 3 WOODEN HEART DECORATIONS,3,10/30/2011 14:04,1.25,14572,United Kingdom
573380,23266,SET OF 3 WOODEN STOCKING DECORATION,4,10/30/2011 14:04,1.25,14572,United Kingdom
573380,21135,VICTORIAN  METAL POSTCARD SPRING,16,10/30/2011 14:04,1.69,14572,United Kingdom
573380,23275,SET OF 3 HANGING OWLS OLLIE BEAK,1,10/30/2011 14:04,1.25,14572,United Kingdom
573380,85150,LADIES & GENTLEMEN METAL SIGN,24,10/30/2011 14:04,2.55,14572,United Kingdom
573380,84944,SET OF 6 KASHMIR FOLKART BAUBLES,1,10/30/2011 14:04,1.65,14572,United Kingdom
573380,22822,CREAM WALL PLANTER HEART SHAPED,1,10/30/2011 14:04,5.95,14572,United Kingdom
573380,23462,ROCOCO WALL MIRROR WHITE,2,10/30/2011 14:04,19.95,14572,United Kingdom
573380,23245,SET OF 3 REGENCY CAKE TINS,8,10/30/2011 14:04,4.95,14572,United Kingdom
573380,22988,SOLDIERS EGG CUP ,12,10/30/2011 14:04,1.25,14572,United Kingdom
573380,23109,PACK OF SIX LED TEA LIGHTS,2,10/30/2011 14:04,2.89,14572,United Kingdom
573380,21591,COSY HOUR CIGAR BOX MATCHES ,6,10/30/2011 14:04,1.25,14572,United Kingdom
573380,23157,SET OF 6 NATIVITY MAGNETS ,12,10/30/2011 14:04,2.08,14572,United Kingdom
573380,20754,RETROSPOT RED WASHING UP GLOVES,4,10/30/2011 14:04,2.1,14572,United Kingdom
573380,21559,STRAWBERRY LUNCH BOX WITH CUTLERY,6,10/30/2011 14:04,2.55,14572,United Kingdom
573380,23238,SET OF 4 KNICK KNACK TINS LONDON ,6,10/30/2011 14:04,4.15,14572,United Kingdom
573380,22834,HAND WARMER BABUSHKA DESIGN,24,10/30/2011 14:04,2.1,14572,United Kingdom
573380,23534,WALL ART STOP FOR TEA ,2,10/30/2011 14:04,5.95,14572,United Kingdom
573380,23329,DECORATIVE WICKER HEART LARGE,2,10/30/2011 14:04,1.65,14572,United Kingdom
573380,23330,DECORATIVE WICKER HEART MEDIUM,2,10/30/2011 14:04,1.25,14572,United Kingdom
573380,21351,CINAMMON & ORANGE WREATH,1,10/30/2011 14:04,6.75,14572,United Kingdom
573380,21741,COSY SLIPPER SHOES LARGE GREEN,5,10/30/2011 14:04,2.95,14572,United Kingdom
573380,84375,SET OF 20 KIDS COOKIE CUTTERS,1,10/30/2011 14:04,2.1,14572,United Kingdom
573380,23127,FELTCRAFT GIRL NICOLE KIT,1,10/30/2011 14:04,4.95,14572,United Kingdom
573380,23126,FELTCRAFT GIRL AMELIE KIT,1,10/30/2011 14:04,4.95,14572,United Kingdom
573380,23128,FELTCRAFT BOY JEAN-PAUL KIT,1,10/30/2011 14:04,4.95,14572,United Kingdom
573380,22086,PAPER CHAIN KIT 50'S CHRISTMAS ,6,10/30/2011 14:04,2.95,14572,United Kingdom
573380,21591,COSY HOUR CIGAR BOX MATCHES ,2,10/30/2011 14:04,1.25,14572,United Kingdom
573380,22734,SET OF 6 RIBBONS VINTAGE CHRISTMAS,1,10/30/2011 14:04,2.89,14572,United Kingdom
573380,22131,FOOD CONTAINER SET 3 LOVE HEART ,2,10/30/2011 14:04,1.95,14572,United Kingdom
573380,22197,POPCORN HOLDER,2,10/30/2011 14:04,0.85,14572,United Kingdom
573380,84375,SET OF 20 KIDS COOKIE CUTTERS,1,10/30/2011 14:04,2.1,14572,United Kingdom
573380,84347,ROTATING SILVER ANGELS T-LIGHT HLDR,3,10/30/2011 14:04,2.55,14572,United Kingdom
573380,23082,SET 6 PAPER TABLE LANTERN HEARTS ,1,10/30/2011 14:04,3.75,14572,United Kingdom
573380,23234,BISCUIT TIN VINTAGE CHRISTMAS,2,10/30/2011 14:04,2.89,14572,United Kingdom
573380,23382,BOX OF 6 CHRISTMAS CAKE DECORATIONS,4,10/30/2011 14:04,3.75,14572,United Kingdom
573380,23083,SET 6 PAPER TABLE LANTERN STARS ,6,10/30/2011 14:04,3.75,14572,United Kingdom
573380,37450,CERAMIC CAKE BOWL + HANGING CAKES,2,10/30/2011 14:04,2.95,14572,United Kingdom
573380,23247,BISCUIT TIN 50'S CHRISTMAS,3,10/30/2011 14:04,2.89,14572,United Kingdom
573380,23084,RABBIT NIGHT LIGHT,4,10/30/2011 14:04,2.08,14572,United Kingdom
573380,22734,SET OF 6 RIBBONS VINTAGE CHRISTMAS,4,10/30/2011 14:04,2.89,14572,United Kingdom
573380,22585,PACK OF 6 BIRDY GIFT TAGS,9,10/30/2011 14:04,1.25,14572,United Kingdom
573380,22966,GINGERBREAD MAN COOKIE CUTTER,3,10/30/2011 14:04,1.25,14572,United Kingdom
573381,23282,FOLDING BUTTERFLY MIRROR IVORY ,4,10/30/2011 14:05,0.83,17590,United Kingdom
573381,23280,FOLDING BUTTERFLY MIRROR HOT PINK ,4,10/30/2011 14:05,0.83,17590,United Kingdom
573381,20992,JAZZ HEARTS PURSE NOTEBOOK,4,10/30/2011 14:05,0.39,17590,United Kingdom
573381,22161,HEART DECORATION RUSTIC HANGING ,4,10/30/2011 14:05,0.19,17590,United Kingdom
573381,22155,STAR DECORATION RUSTIC,5,10/30/2011 14:05,0.42,17590,United Kingdom
573381,22154,ANGEL DECORATION 3 BUTTONS ,5,10/30/2011 14:05,0.42,17590,United Kingdom
573381,23264,SET OF 3 WOODEN SLEIGH DECORATIONS,2,10/30/2011 14:05,1.25,17590,United Kingdom
573381,23480,MINI LIGHTS WOODLAND MUSHROOMS,2,10/30/2011 14:05,3.75,17590,United Kingdom
573381,23263,SET OF 3 WOODEN HEART DECORATIONS,2,10/30/2011 14:05,1.25,17590,United Kingdom
573381,23227,FILIGREE HEART BUTTERFLY WHITE ,4,10/30/2011 14:05,1.25,17590,United Kingdom
573381,23266,SET OF 3 WOODEN STOCKING DECORATION,2,10/30/2011 14:05,1.25,17590,United Kingdom
573381,23375,50'S CHRISTMAS PAPER GIFT BAG,1,10/30/2011 14:05,0.82,17590,United Kingdom
573381,22977,DOLLY GIRL CHILDRENS EGG CUP,3,10/30/2011 14:05,1.25,17590,United Kingdom
573381,22975,SPACEBOY CHILDRENS EGG CUP,3,10/30/2011 14:05,1.25,17590,United Kingdom
573381,84659A,WHITE TRAVEL ALARM CLOCK,1,10/30/2011 14:05,2.55,17590,United Kingdom
573381,71038,WHITE HANGING BEADS CANDLE HOLDER,1,10/30/2011 14:05,5.45,17590,United Kingdom
573381,23319,BOX OF 6 MINI 50'S CRACKERS,4,10/30/2011 14:05,2.49,17590,United Kingdom
573381,23320,GIANT 50'S CHRISTMAS CRACKER,4,10/30/2011 14:05,2.89,17590,United Kingdom
573381,23321,SMALL WHITE HEART OF WICKER,4,10/30/2011 14:05,1.65,17590,United Kingdom
