577393,23174,REGENCY SUGAR BOWL GREEN,2,11/18/2011 17:06,4.15,14031,United Kingdom
577393,23175,REGENCY MILK JUG PINK ,8,11/18/2011 17:06,3.25,14031,United Kingdom
577393,23347,I LOVE LONDON BEAKER,40,11/18/2011 17:06,1.25,14031,United Kingdom
577393,23338,EGG FRYING PAN RED ,15,11/18/2011 17:06,2.08,14031,United Kingdom
C577394,84946,ANTIQUE SILVER T-LIGHT GLASS,-4,11/18/2011 17:09,1.25,14902,United Kingdom
C577394,23493,VINTAGE DOILY TRAVEL SEWING KIT,-1,11/18/2011 17:09,1.95,14902,United Kingdom
C577394,23184,BULL DOG BOTTLE OPENER,-2,11/18/2011 17:09,4.95,14902,United Kingdom
C577394,22219,LOVEBIRD HANGING DECORATION WHITE ,-2,11/18/2011 17:09,0.85,14902,United Kingdom
C577395,37447,CERAMIC CAKE DESIGN SPOTTED PLATE,-4,11/18/2011 17:10,1.49,12779,Poland
C577395,23423,PANTRY 3 HOOK ROLLING PIN HANGER,-2,11/18/2011 17:10,3.75,12779,Poland
C577395,22666,RECIPE BOX PANTRY YELLOW DESIGN,-2,11/18/2011 17:10,2.95,12779,Poland
577396,22086,PAPER CHAIN KIT 50'S CHRISTMAS ,40,11/18/2011 17:11,2.55,17621,United Kingdom
577396,22910,PAPER CHAIN KIT VINTAGE CHRISTMAS,40,11/18/2011 17:11,2.55,17621,United Kingdom
577396,22809,SET OF 6 T-LIGHTS SANTA,36,11/18/2011 17:11,2.55,17621,United Kingdom
577396,22189,CREAM HEART CARD HOLDER,8,11/18/2011 17:11,3.95,17621,United Kingdom
577396,23284,DOORMAT KEEP CALM AND COME IN,4,11/18/2011 17:11,8.25,17621,United Kingdom
577396,23182,TOILET SIGN OCCUPIED OR VACANT,24,11/18/2011 17:11,0.83,17621,United Kingdom
577396,22938,CUPCAKE LACE PAPER SET 6,12,11/18/2011 17:11,1.95,17621,United Kingdom
577396,23245,SET OF 3 REGENCY CAKE TINS,4,11/18/2011 17:11,4.95,17621,United Kingdom
577396,23300,GARDENERS KNEELING PAD CUP OF TEA ,12,11/18/2011 17:11,1.65,17621,United Kingdom
577396,23301,GARDENERS KNEELING PAD KEEP CALM ,12,11/18/2011 17:11,1.65,17621,United Kingdom
577396,20971,PINK BLUE FELT CRAFT TRINKET BOX,12,11/18/2011 17:11,1.25,17621,United Kingdom
C577397,22220,CAKE STAND LOVEBIRD 2 TIER WHITE,-1,11/18/2011 17:12,9.95,12504,Germany
C577397,22776,SWEETHEART 3 TIER CAKE STAND ,-1,11/18/2011 17:12,9.95,12504,Germany
C577397,22236,CAKE STAND 3 TIER MAGIC GARDEN,-1,11/18/2011 17:12,12.75,12504,Germany
C577398,84978,HANGING HEART JAR T-LIGHT HOLDER,-7,11/18/2011 17:15,1.25,16839,United Kingdom
C577398,21340,CLASSIC METAL BIRDCAGE PLANT HOLDER,-1,11/18/2011 17:15,12.75,16839,United Kingdom
C577399,22138,BAKING SET 9 PIECE RETROSPOT ,-1,11/18/2011 17:15,4.95,13895,United Kingdom
577400,22411,JUMBO SHOPPER VINTAGE RED PAISLEY,10,11/18/2011 17:20,2.08,16201,United Kingdom
577400,22383,LUNCH BAG SUKI DESIGN ,10,11/18/2011 17:20,1.65,16201,United Kingdom
577400,22386,JUMBO BAG PINK POLKADOT,10,11/18/2011 17:20,2.08,16201,United Kingdom
577400,23203,JUMBO BAG VINTAGE DOILY ,10,11/18/2011 17:20,2.08,16201,United Kingdom
577400,23209,LUNCH BAG VINTAGE DOILY ,20,11/18/2011 17:20,1.65,16201,United Kingdom
577400,23343,JUMBO BAG VINTAGE CHRISTMAS ,10,11/18/2011 17:20,2.08,16201,United Kingdom
577400,23581,JUMBO BAG PAISLEY PARK,10,11/18/2011 17:20,2.08,16201,United Kingdom
577400,23681,LUNCH BAG RED VINTAGE DOILY,10,11/18/2011 17:20,1.65,16201,United Kingdom
577400,23582,VINTAGE DOILY JUMBO BAG RED ,10,11/18/2011 17:20,2.08,16201,United Kingdom
577400,23583,LUNCH BAG PAISLEY PARK  ,10,11/18/2011 17:20,1.65,16201,United Kingdom
577400,85099B,JUMBO BAG RED RETROSPOT,10,11/18/2011 17:20,2.08,16201,United Kingdom
577400,23170,REGENCY TEA PLATE ROSES ,12,11/18/2011 17:20,1.65,16201,United Kingdom
577400,22469,HEART OF WICKER SMALL,12,11/18/2011 17:20,1.65,16201,United Kingdom
577400,23171,REGENCY TEA PLATE GREEN ,12,11/18/2011 17:20,1.65,16201,United Kingdom
577400,84817,DANISH ROSE DECORATIVE PLATE,12,11/18/2011 17:20,2.1,16201,United Kingdom
577400,22699,ROSES REGENCY TEACUP AND SAUCER ,6,11/18/2011 17:20,2.95,16201,United Kingdom
577400,22697,GREEN REGENCY TEACUP AND SAUCER,6,11/18/2011 17:20,2.95,16201,United Kingdom
577400,22867,HAND WARMER BIRD DESIGN,12,11/18/2011 17:20,2.1,16201,United Kingdom
577400,84879,ASSORTED COLOUR BIRD ORNAMENT,16,11/18/2011 17:20,1.69,16201,United Kingdom
577400,23204,CHARLOTTE BAG APPLES DESIGN,10,11/18/2011 17:20,0.85,16201,United Kingdom
577400,20723,STRAWBERRY CHARLOTTE BAG,10,11/18/2011 17:20,0.85,16201,United Kingdom
577400,20724,RED RETROSPOT CHARLOTTE BAG,10,11/18/2011 17:20,0.85,16201,United Kingdom
577400,20727,LUNCH BAG  BLACK SKULL.,10,11/18/2011 17:20,1.65,16201,United Kingdom
577400,20725,LUNCH BAG RED RETROSPOT,10,11/18/2011 17:20,1.65,16201,United Kingdom
577400,20728,LUNCH BAG CARS BLUE,10,11/18/2011 17:20,1.65,16201,United Kingdom
577400,21928,JUMBO BAG SCANDINAVIAN BLUE PAISLEY,10,11/18/2011 17:20,2.08,16201,United Kingdom
577400,21929,JUMBO BAG PINK VINTAGE PAISLEY,10,11/18/2011 17:20,2.08,16201,United Kingdom
577400,21931,JUMBO STORAGE BAG SUKI,10,11/18/2011 17:20,2.08,16201,United Kingdom
