575477,21640,ASSORTED TUTTI FRUTTI  FOB NOTEBOOK,5,11/9/2011 16:14,1.63,,United Kingdom
575477,21648,ASSORTED TUTTI FRUTTI SMALL PURSE,2,11/9/2011 16:14,2.46,,United Kingdom
575477,21675,BUTTERFLIES STICKERS,1,11/9/2011 16:14,1.63,,United Kingdom
575477,21698,MOCK LOBSTER FRIDGE MAGNET,1,11/9/2011 16:14,1.63,,United Kingdom
575477,21703,BAG 125g SWIRLY MARBLES,2,11/9/2011 16:14,0.83,,United Kingdom
575477,21705,BAG 500g SWIRLY MARBLES,1,11/9/2011 16:14,3.29,,United Kingdom
575477,21715,GIRLS VINTAGE TIN SEASIDE BUCKET,1,11/9/2011 16:14,4.96,,United Kingdom
575477,21716,BOYS VINTAGE TIN SEASIDE BUCKET,1,11/9/2011 16:14,4.96,,United Kingdom
575477,21718,RED METAL BEACH SPADE ,2,11/9/2011 16:14,2.46,,United Kingdom
575477,21731,RED TOADSTOOL LED NIGHT LIGHT,2,11/9/2011 16:14,3.29,,United Kingdom
575477,21739,COSY SLIPPER SHOES SMALL GREEN,2,11/9/2011 16:14,2.46,,United Kingdom
575477,21744,SNOWFLAKE PORTABLE TABLE LIGHT ,3,11/9/2011 16:14,2.46,,United Kingdom
575477,21754,HOME BUILDING BLOCK WORD,1,11/9/2011 16:14,11.63,,United Kingdom
575477,21788,KIDS RAIN MAC BLUE,2,11/9/2011 16:14,1.63,,United Kingdom
575477,21790,VINTAGE SNAP CARDS,3,11/9/2011 16:14,1.63,,United Kingdom
575477,21791,VINTAGE HEADS AND TAILS CARD GAME ,1,11/9/2011 16:14,2.46,,United Kingdom
575477,21803,CHRISTMAS TREE STAR DECORATION,17,11/9/2011 16:14,0.42,,United Kingdom
575477,21808,"CHRISTMAS GARLAND STARS,TREES",3,11/9/2011 16:14,3.29,,United Kingdom
575477,21810,CHRISTMAS HANGING STAR WITH BELL,7,11/9/2011 16:14,0.83,,United Kingdom
575477,21811,HANGING HEART WITH BELL,3,11/9/2011 16:14,0.83,,United Kingdom
575477,21812,GARLAND WITH HEARTS AND BELLS,3,11/9/2011 16:14,3.29,,United Kingdom
575477,21813,GARLAND WITH STARS AND BELLS,8,11/9/2011 16:14,3.29,,United Kingdom
575477,21822,GLITTER CHRISTMAS TREE WITH BELLS,2,11/9/2011 16:14,1.63,,United Kingdom
575477,21824,PAINTED METAL STAR WITH HOLLY BELLS,2,11/9/2011 16:14,0.83,,United Kingdom
575477,21832,CHOCOLATE CALCULATOR,1,11/9/2011 16:14,3.29,,United Kingdom
575477,21833,CAMOUFLAGE LED TORCH,2,11/9/2011 16:14,3.29,,United Kingdom
575477,21846,PINK DIAMANTE PEN IN GIFT BOX,1,11/9/2011 16:14,8.29,,United Kingdom
575477,21850,BLUE  DIAMANTE PEN IN GIFT BOX,1,11/9/2011 16:14,8.29,,United Kingdom
575477,21867,PINK UNION JACK  LUGGAGE TAG,1,11/9/2011 16:14,2.46,,United Kingdom
575477,21878,PACK OF 6 SANDCASTLE FLAGS ASSORTED,2,11/9/2011 16:14,1.63,,United Kingdom
575477,21880,RED RETROSPOT TAPE,2,11/9/2011 16:14,0.42,,United Kingdom
575477,21881,CUTE CATS TAPE,1,11/9/2011 16:14,1.63,,United Kingdom
575477,21888,BINGO SET,3,11/9/2011 16:14,7.46,,United Kingdom
575477,21889,WOODEN BOX OF DOMINOES,2,11/9/2011 16:14,2.46,,United Kingdom
575477,21890,S/6 WOODEN SKITTLES IN COTTON BAG,1,11/9/2011 16:14,5.79,,United Kingdom
575477,21894,POTTING SHED SEED ENVELOPES,1,11/9/2011 16:14,2.46,,United Kingdom
575477,21900,"KEY FOB , SHED",1,11/9/2011 16:14,1.63,,United Kingdom
575477,21915,RED  HARMONICA IN BOX ,1,11/9/2011 16:14,2.46,,United Kingdom
575477,21928,JUMBO BAG SCANDINAVIAN BLUE PAISLEY,1,11/9/2011 16:14,4.13,,United Kingdom
575477,21929,JUMBO BAG PINK VINTAGE PAISLEY,1,11/9/2011 16:14,4.13,,United Kingdom
575477,21930,JUMBO STORAGE BAG SKULLS,1,11/9/2011 16:14,4.13,,United Kingdom
575477,21931,JUMBO STORAGE BAG SUKI,1,11/9/2011 16:14,4.13,,United Kingdom
575477,21933,PINK VINTAGE PAISLEY PICNIC BAG,1,11/9/2011 16:14,2.46,,United Kingdom
575477,21934,SKULL SHOULDER BAG,3,11/9/2011 16:14,1.63,,United Kingdom
575477,21935,SUKI  SHOULDER BAG,14,11/9/2011 16:14,1.63,,United Kingdom
575477,21942,SKULLS DESIGN FLANNEL,1,11/9/2011 16:14,1.63,,United Kingdom
575477,21943,CAKES AND RABBITS DESIGN FLANNEL ,1,11/9/2011 16:14,1.63,,United Kingdom
575477,21944,KITTENS DESIGN FLANNEL,1,11/9/2011 16:14,1.63,,United Kingdom
575477,21945,STRAWBERRIES  DESIGN FLANNEL ,2,11/9/2011 16:14,1.63,,United Kingdom
575477,21967,PACK OF 12 SKULL TISSUES,2,11/9/2011 16:14,0.83,,United Kingdom
575477,21976,PACK OF 60 MUSHROOM CAKE CASES,1,11/9/2011 16:14,1.25,,United Kingdom
575477,21977,PACK OF 60 PINK PAISLEY CAKE CASES,1,11/9/2011 16:14,1.25,,United Kingdom
575477,21990,MODERN FLORAL STATIONERY SET,2,11/9/2011 16:14,2.46,,United Kingdom
575477,21992,VINTAGE PAISLEY STATIONERY SET,2,11/9/2011 16:14,2.46,,United Kingdom
575477,21993,FLORAL FOLK STATIONERY SET,1,11/9/2011 16:14,2.46,,United Kingdom
575477,22023,EMPIRE BIRTHDAY CARD,1,11/9/2011 16:14,0.83,,United Kingdom
575477,22024,RAINY LADIES BIRTHDAY CARD,1,11/9/2011 16:14,0.83,,United Kingdom
575477,22029,SPACEBOY BIRTHDAY CARD,1,11/9/2011 16:14,0.83,,United Kingdom
575477,22065,CHRISTMAS PUDDING TRINKET POT ,5,11/9/2011 16:14,1.63,,United Kingdom
575477,22068,BLACK PIRATE TREASURE CHEST,1,11/9/2011 16:14,3.29,,United Kingdom
575477,22069,BROWN  PIRATE TREASURE CHEST ,1,11/9/2011 16:14,3.29,,United Kingdom
575477,22074,6 RIBBONS SHIMMERING PINKS ,2,11/9/2011 16:14,1.25,,United Kingdom
575477,22075,6 RIBBONS ELEGANT CHRISTMAS ,1,11/9/2011 16:14,1.63,,United Kingdom
575477,22076,6 RIBBONS EMPIRE  ,1,11/9/2011 16:14,1.25,,United Kingdom
575477,22083,PAPER CHAIN KIT RETROSPOT,1,11/9/2011 16:14,5.79,,United Kingdom
575477,22086,PAPER CHAIN KIT 50'S CHRISTMAS ,6,11/9/2011 16:14,5.79,,United Kingdom
575477,22097,SWALLOW SQUARE TISSUE BOX,1,11/9/2011 16:14,2.46,,United Kingdom
575477,22099,CARAVAN SQUARE TISSUE BOX,1,11/9/2011 16:14,2.46,,United Kingdom
575477,22106,MIRROR MOSAIC HURRICANE LAMP ,3,11/9/2011 16:14,4.96,,United Kingdom
575477,22107,PIZZA PLATE IN BOX,1,11/9/2011 16:14,3.29,,United Kingdom
575477,22109,FULL ENGLISH BREAKFAST PLATE,1,11/9/2011 16:14,7.46,,United Kingdom
575477,22114,HOT WATER BOTTLE TEA AND SYMPATHY,7,11/9/2011 16:14,8.29,,United Kingdom
575477,22132,RED LOVE HEART SHAPE CUP,3,11/9/2011 16:14,1.63,,United Kingdom
575477,22133,PINK LOVE HEART SHAPE CUP,2,11/9/2011 16:14,1.63,,United Kingdom
575477,22139,RETROSPOT TEA SET CERAMIC 11 PC ,1,11/9/2011 16:14,10.79,,United Kingdom
575477,22142,CHRISTMAS CRAFT WHITE FAIRY ,2,11/9/2011 16:14,3.29,,United Kingdom
575477,22150,3 STRIPEY MICE FELTCRAFT,1,11/9/2011 16:14,4.13,,United Kingdom
575477,22161,HEART DECORATION RUSTIC HANGING ,7,11/9/2011 16:14,0.79,,United Kingdom
575477,22163,HEART STRING MEMO HOLDER HANGING,3,11/9/2011 16:14,1.63,,United Kingdom
575477,22169,FAMILY ALBUM WHITE PICTURE FRAME,1,11/9/2011 16:14,16.63,,United Kingdom
575477,22173,METAL 4 HOOK HANGER FRENCH CHATEAU,2,11/9/2011 16:14,5.79,,United Kingdom
575477,22174,PHOTO CUBE,4,11/9/2011 16:14,3.29,,United Kingdom
575477,22178,VICTORIAN GLASS HANGING T-LIGHT,4,11/9/2011 16:14,2.46,,United Kingdom
575477,22185,SLATE TILE NATURAL HANGING,1,11/9/2011 16:14,3.29,,United Kingdom
