572244,23566,EGG CUP MILKMAID HEIDI,12,10/21/2011 15:54,1.25,14233,United Kingdom
572244,23493,VINTAGE DOILY TRAVEL SEWING KIT,20,10/21/2011 15:54,1.95,14233,United Kingdom
572244,23311,VINTAGE CHRISTMAS STOCKING ,18,10/21/2011 15:54,2.55,14233,United Kingdom
572244,23245,SET OF 3 REGENCY CAKE TINS,16,10/21/2011 15:54,4.15,14233,United Kingdom
572244,22603,CHRISTMAS RETROSPOT TREE WOOD,24,10/21/2011 15:54,0.85,14233,United Kingdom
572244,22600,CHRISTMAS RETROSPOT STAR WOOD,24,10/21/2011 15:54,0.85,14233,United Kingdom
572244,22581,WOOD STOCKING CHRISTMAS SCANDISPOT,24,10/21/2011 15:54,0.85,14233,United Kingdom
572244,22577,WOODEN HEART CHRISTMAS SCANDINAVIAN,24,10/21/2011 15:54,0.29,14233,United Kingdom
572244,22297,HEART IVORY TRELLIS SMALL,24,10/21/2011 15:54,1.25,14233,United Kingdom
572244,23264,SET OF 3 WOODEN SLEIGH DECORATIONS,12,10/21/2011 15:54,1.25,14233,United Kingdom
572272,21745,GAOLERS KEYS DECORATIVE GARDEN ,3,10/21/2011 16:18,3.75,13171,United Kingdom
572272,22082,RIBBON REEL STRIPES DESIGN ,2,10/21/2011 16:18,1.65,13171,United Kingdom
572272,22577,WOODEN HEART CHRISTMAS SCANDINAVIAN,10,10/21/2011 16:18,0.29,13171,United Kingdom
572272,22578,WOODEN STAR CHRISTMAS SCANDINAVIAN,10,10/21/2011 16:18,0.29,13171,United Kingdom
572272,22579,WOODEN TREE CHRISTMAS SCANDINAVIAN,11,10/21/2011 16:18,0.29,13171,United Kingdom
572272,23485,BOTANICAL GARDENS WALL CLOCK ,2,10/21/2011 16:18,25,13171,United Kingdom
572272,23330,DECORATIVE WICKER HEART MEDIUM,4,10/21/2011 16:18,1.25,13171,United Kingdom
572272,23263,SET OF 3 WOODEN HEART DECORATIONS,4,10/21/2011 16:18,1.25,13171,United Kingdom
572272,23266,SET OF 3 WOODEN STOCKING DECORATION,3,10/21/2011 16:18,1.25,13171,United Kingdom
572272,23265,SET OF 3 WOODEN TREE DECORATIONS,3,10/21/2011 16:18,1.25,13171,United Kingdom
572272,22469,HEART OF WICKER SMALL,4,10/21/2011 16:18,1.65,13171,United Kingdom
572272,82486,3 DRAWER ANTIQUE WHITE WOOD CABINET,2,10/21/2011 16:18,8.95,13171,United Kingdom
572272,22624,IVORY KITCHEN SCALES,2,10/21/2011 16:18,8.5,13171,United Kingdom
572274,23160,REGENCY TEA SPOON,12,10/21/2011 16:48,1.25,14031,United Kingdom
572274,23164,REGENCY CAKE SLICE,4,10/21/2011 16:48,4.95,14031,United Kingdom
572274,23162,REGENCY TEA STRAINER,8,10/21/2011 16:48,3.75,14031,United Kingdom
572274,23245,SET OF 3 REGENCY CAKE TINS,2,10/21/2011 16:48,4.95,14031,United Kingdom
572274,82494L,WOODEN FRAME ANTIQUE WHITE ,2,10/21/2011 16:48,2.95,14031,United Kingdom
572274,23338,EGG FRYING PAN RED ,8,10/21/2011 16:48,2.08,14031,United Kingdom
572274,23031,DRAWER KNOB CRACKLE GLAZE PINK,6,10/21/2011 16:48,1.65,14031,United Kingdom
572274,23029,DRAWER KNOB CRACKLE GLAZE GREEN,6,10/21/2011 16:48,1.65,14031,United Kingdom
572274,23032,DRAWER KNOB CRACKLE GLAZE IVORY,6,10/21/2011 16:48,1.65,14031,United Kingdom
572274,23014,GLASS APOTHECARY BOTTLE ELIXIR,12,10/21/2011 16:48,3.45,14031,United Kingdom
572274,23012,GLASS APOTHECARY BOTTLE PERFUME,12,10/21/2011 16:48,3.45,14031,United Kingdom
572274,22423,REGENCY CAKESTAND 3 TIER,16,10/21/2011 16:48,10.95,14031,United Kingdom
572274,22437,SET OF 9 BLACK SKULL BALLOONS,4,10/21/2011 16:48,0.85,14031,United Kingdom
572274,22434,BALLOON PUMP WITH 10 BALLOONS,1,10/21/2011 16:48,1.95,14031,United Kingdom
572274,23418,LAVENDER TOILETTE BOTTLE,12,10/21/2011 16:48,2.08,14031,United Kingdom
572274,22698,PINK REGENCY TEACUP AND SAUCER,4,10/21/2011 16:48,2.95,14031,United Kingdom
572274,22697,GREEN REGENCY TEACUP AND SAUCER,5,10/21/2011 16:48,2.95,14031,United Kingdom
572274,22699,ROSES REGENCY TEACUP AND SAUCER ,3,10/21/2011 16:48,2.95,14031,United Kingdom
572274,23542,WALL ART 70'S ALPHABET ,2,10/21/2011 16:48,8.25,14031,United Kingdom
572274,23535,WALL ART BICYCLE SAFETY,6,10/21/2011 16:48,5.95,14031,United Kingdom
572274,23537,WALL ART I LOVE LONDON ,3,10/21/2011 16:48,4.95,14031,United Kingdom
572274,20679,EDWARDIAN PARASOL RED,12,10/21/2011 16:48,5.95,14031,United Kingdom
572274,15056N,EDWARDIAN PARASOL NATURAL,12,10/21/2011 16:48,5.95,14031,United Kingdom
C572275,22423,REGENCY CAKESTAND 3 TIER,-1,10/23/2011 9:42,12.75,12572,Germany
C572275,71279,PINK GLASS CANDLEHOLDER,-1,10/23/2011 9:42,2.95,12572,Germany
C572276,23237,SET OF 4 KNICK KNACK TINS LEAF,-2,10/23/2011 10:24,4.15,16768,United Kingdom
572277,21340,CLASSIC METAL BIRDCAGE PLANT HOLDER,1,10/23/2011 10:38,12.75,16768,United Kingdom
572277,20914,SET/5 RED RETROSPOT LID GLASS BOWLS,1,10/23/2011 10:38,2.95,16768,United Kingdom
572277,23300,GARDENERS KNEELING PAD CUP OF TEA ,2,10/23/2011 10:38,1.65,16768,United Kingdom
572277,22633,HAND WARMER UNION JACK,2,10/23/2011 10:38,2.1,16768,United Kingdom
572277,22867,HAND WARMER BIRD DESIGN,2,10/23/2011 10:38,2.1,16768,United Kingdom
572277,22834,HAND WARMER BABUSHKA DESIGN,4,10/23/2011 10:38,2.1,16768,United Kingdom
572277,22866,HAND WARMER SCOTTY DOG DESIGN,4,10/23/2011 10:38,2.1,16768,United Kingdom
572277,22693,GROW A FLYTRAP OR SUNFLOWER IN TIN,48,10/23/2011 10:38,1.25,16768,United Kingdom
572277,85066,CREAM SWEETHEART MINI CHEST,2,10/23/2011 10:38,12.75,16768,United Kingdom
572277,23078,ICE CREAM PEN LIP GLOSS ,40,10/23/2011 10:38,1.25,16768,United Kingdom
572277,22121,NOEL WOODEN BLOCK LETTERS ,2,10/23/2011 10:38,5.95,16768,United Kingdom
572278,22692,DOORMAT WELCOME TO OUR HOME,2,10/23/2011 10:46,8.25,16326,United Kingdom
572278,48187,DOORMAT NEW ENGLAND,2,10/23/2011 10:46,8.25,16326,United Kingdom
572278,23284,DOORMAT KEEP CALM AND COME IN,3,10/23/2011 10:46,8.25,16326,United Kingdom
572278,23283,DOORMAT VINTAGE LEAF,3,10/23/2011 10:46,8.25,16326,United Kingdom
572278,48116,DOORMAT MULTICOLOUR STRIPE,1,10/23/2011 10:46,8.25,16326,United Kingdom
572278,21524,DOORMAT SPOTTY HOME SWEET HOME,2,10/23/2011 10:46,8.25,16326,United Kingdom
572278,48173C,DOORMAT BLACK FLOCK ,2,10/23/2011 10:46,8.25,16326,United Kingdom
572278,21523,DOORMAT FANCY FONT HOME SWEET HOME,1,10/23/2011 10:46,8.25,16326,United Kingdom
572278,48129,DOORMAT TOPIARY,2,10/23/2011 10:46,8.25,16326,United Kingdom
572278,48184,DOORMAT ENGLISH ROSE ,2,10/23/2011 10:46,8.25,16326,United Kingdom
572278,48111,DOORMAT 3 SMILEY CATS,1,10/23/2011 10:46,8.25,16326,United Kingdom
572278,22866,HAND WARMER SCOTTY DOG DESIGN,2,10/23/2011 10:46,2.1,16326,United Kingdom
572278,22867,HAND WARMER BIRD DESIGN,3,10/23/2011 10:46,2.1,16326,United Kingdom
572278,23439,HAND WARMER RED LOVE HEART,5,10/23/2011 10:46,2.1,16326,United Kingdom
572278,84347,ROTATING SILVER ANGELS T-LIGHT HLDR,1,10/23/2011 10:46,2.55,16326,United Kingdom
572278,21494,ROTATING LEAVES T-LIGHT HOLDER,2,10/23/2011 10:46,1.25,16326,United Kingdom
572278,21352,EUCALYPTUS & PINECONE  WREATH,4,10/23/2011 10:46,2.95,16326,United Kingdom
572279,22380,TOY TIDY SPACEBOY  ,3,10/23/2011 10:56,2.1,16066,United Kingdom
572279,22469,HEART OF WICKER SMALL,6,10/23/2011 10:56,1.65,16066,United Kingdom
572279,22694,WICKER STAR ,5,10/23/2011 10:56,2.1,16066,United Kingdom
572279,23301,GARDENERS KNEELING PAD KEEP CALM ,5,10/23/2011 10:56,1.65,16066,United Kingdom
572279,22660,DOORMAT I LOVE LONDON,1,10/23/2011 10:56,8.25,16066,United Kingdom
572279,23284,DOORMAT KEEP CALM AND COME IN,5,10/23/2011 10:56,8.25,16066,United Kingdom
572279,22556,PLASTERS IN TIN CIRCUS PARADE ,1,10/23/2011 10:56,1.65,16066,United Kingdom
572279,17012C,ORIGAMI LAVENDER INCENSE/CANDL SET ,2,10/23/2011 10:56,0.85,16066,United Kingdom
572279,22557,PLASTERS IN TIN VINTAGE PAISLEY ,2,10/23/2011 10:56,1.65,16066,United Kingdom
572279,21787,RAIN PONCHO RETROSPOT,2,10/23/2011 10:56,0.85,16066,United Kingdom
572279,22138,BAKING SET 9 PIECE RETROSPOT ,4,10/23/2011 10:56,4.95,16066,United Kingdom
572279,22271,FELTCRAFT DOLL ROSIE,1,10/23/2011 10:56,2.95,16066,United Kingdom
572279,22749,FELTCRAFT PRINCESS CHARLOTTE DOLL,1,10/23/2011 10:56,3.75,16066,United Kingdom
572279,20969,RED FLORAL FELTCRAFT SHOULDER BAG,2,10/23/2011 10:56,3.75,16066,United Kingdom
572279,23355,HOT WATER BOTTLE KEEP CALM,4,10/23/2011 10:56,4.95,16066,United Kingdom
572279,22114,HOT WATER BOTTLE TEA AND SYMPATHY,5,10/23/2011 10:56,4.25,16066,United Kingdom
572279,22359,GLASS JAR KINGS CHOICE,1,10/23/2011 10:56,2.95,16066,United Kingdom
572279,22362,GLASS JAR PEACOCK BATH SALTS,1,10/23/2011 10:56,2.95,16066,United Kingdom
572279,22361,GLASS JAR DAISY FRESH COTTON WOOL,1,10/23/2011 10:56,2.95,16066,United Kingdom
572280,84536A,ENGLISH ROSE NOTEBOOK A7 SIZE,6,10/23/2011 11:05,0.42,16007,United Kingdom
572280,20996,JAZZ HEARTS ADDRESS BOOK,5,10/23/2011 11:05,0.19,16007,United Kingdom
572280,20992,JAZZ HEARTS PURSE NOTEBOOK,4,10/23/2011 11:05,0.39,16007,United Kingdom
572280,21212,PACK OF 72 RETROSPOT CAKE CASES,2,10/23/2011 11:05,0.55,16007,United Kingdom
572280,21975,PACK OF 60 DINOSAUR CAKE CASES,2,10/23/2011 11:05,0.55,16007,United Kingdom
572280,23308,SET OF 60 VINTAGE LEAF CAKE CASES ,2,10/23/2011 11:05,0.55,16007,United Kingdom
572280,22951,60 CAKE CASES DOLLY GIRL DESIGN,2,10/23/2011 11:05,0.55,16007,United Kingdom
572280,21213,PACK OF 72 SKULL CAKE CASES,2,10/23/2011 11:05,0.55,16007,United Kingdom
572280,23307,SET OF 60 PANTRY DESIGN CAKE CASES ,2,10/23/2011 11:05,0.55,16007,United Kingdom
572280,84992,72 SWEETHEART FAIRY CAKE CASES,2,10/23/2011 11:05,0.55,16007,United Kingdom
572280,21976,PACK OF 60 MUSHROOM CAKE CASES,2,10/23/2011 11:05,0.55,16007,United Kingdom
572280,21989,PACK OF 20 SKULL PAPER NAPKINS,1,10/23/2011 11:05,0.85,16007,United Kingdom
572280,22795,SWEETHEART RECIPE BOOK STAND,2,10/23/2011 11:05,6.75,16007,United Kingdom
572280,21790,VINTAGE SNAP CARDS,4,10/23/2011 11:05,0.85,16007,United Kingdom
572280,23368,SET 12 COLOUR PENCILS DOLLY GIRL ,6,10/23/2011 11:05,0.65,16007,United Kingdom
572280,23366,SET 12 COLOURING PENCILS DOILY,6,10/23/2011 11:05,0.65,16007,United Kingdom
572280,23367,SET 12 COLOUR PENCILS SPACEBOY ,2,10/23/2011 11:05,0.65,16007,United Kingdom
572280,20974,12 PENCILS SMALL TUBE SKULL,1,10/23/2011 11:05,0.65,16007,United Kingdom
572280,21262,WHITE GOOSE FEATHER CHRISTMAS TREE ,2,10/23/2011 11:05,2.95,16007,United Kingdom
572280,20975,12 PENCILS SMALL TUBE RED RETROSPOT,6,10/23/2011 11:05,0.65,16007,United Kingdom
572280,20973,12 PENCIL SMALL TUBE WOODLAND,2,10/23/2011 11:05,0.65,16007,United Kingdom
572280,20974,12 PENCILS SMALL TUBE SKULL,2,10/23/2011 11:05,0.65,16007,United Kingdom
572280,23507,MINI PLAYING CARDS BUFFALO BILL ,2,10/23/2011 11:05,0.42,16007,United Kingdom
572280,23509,MINI PLAYING CARDS FUN FAIR ,2,10/23/2011 11:05,0.42,16007,United Kingdom
572280,23508,MINI PLAYING CARDS DOLLY GIRL ,2,10/23/2011 11:05,0.42,16007,United Kingdom
572280,23510,MINI PLAYING CARDS GYMKHANA,2,10/23/2011 11:05,0.42,16007,United Kingdom
572280,20973,12 PENCIL SMALL TUBE WOODLAND,4,10/23/2011 11:05,0.65,16007,United Kingdom
572280,22944,CHRISTMAS METAL POSTCARD WITH BELLS,24,10/23/2011 11:05,0.39,16007,United Kingdom
572280,23354,6 GIFT TAGS 50'S CHRISTMAS ,1,10/23/2011 11:05,0.83,16007,United Kingdom
572280,23335,EGG FRYING PAN IVORY ,1,10/23/2011 11:05,2.08,16007,United Kingdom
572280,23337,EGG FRYING PAN MINT ,1,10/23/2011 11:05,2.08,16007,United Kingdom
572280,23339,EGG FRYING PAN BLUE ,1,10/23/2011 11:05,2.08,16007,United Kingdom
572280,23148,MINIATURE ANTIQUE ROSE HOOK IVORY,12,10/23/2011 11:05,0.83,16007,United Kingdom
572280,20974,12 PENCILS SMALL TUBE SKULL,1,10/23/2011 11:05,0.65,16007,United Kingdom
572280,21902,"KEY FOB , FRONT  DOOR ",8,10/23/2011 11:05,0.65,16007,United Kingdom
572280,23102,SILVER HEARTS TABLE DECORATION,9,10/23/2011 11:05,0.83,16007,United Kingdom
572280,22730,ALARM CLOCK BAKELIKE IVORY,1,10/23/2011 11:05,3.75,16007,United Kingdom
572280,22729,ALARM CLOCK BAKELIKE ORANGE,1,10/23/2011 11:05,3.75,16007,United Kingdom
572280,22728,ALARM CLOCK BAKELIKE PINK,1,10/23/2011 11:05,3.75,16007,United Kingdom
572280,22726,ALARM CLOCK BAKELIKE GREEN,1,10/23/2011 11:05,3.75,16007,United Kingdom
572280,22621,TRADITIONAL KNITTING NANCY,4,10/23/2011 11:05,1.65,16007,United Kingdom
572280,21892,TRADITIONAL WOODEN CATCH CUP GAME ,2,10/23/2011 11:05,1.25,16007,United Kingdom
572280,23470,CARD HOLDER LOVE BIRD LARGE ,3,10/23/2011 11:05,6.25,16007,United Kingdom
572280,22356,CHARLOTTE BAG PINK POLKADOT,2,10/23/2011 11:05,0.85,16007,United Kingdom
572280,23204,CHARLOTTE BAG APPLES DESIGN,2,10/23/2011 11:05,0.85,16007,United Kingdom
572280,22355,CHARLOTTE BAG SUKI DESIGN,2,10/23/2011 11:05,0.85,16007,United Kingdom
572280,20724,RED RETROSPOT CHARLOTTE BAG,2,10/23/2011 11:05,0.85,16007,United Kingdom
572280,20719,WOODLAND CHARLOTTE BAG,2,10/23/2011 11:05,0.85,16007,United Kingdom
572280,20723,STRAWBERRY CHARLOTTE BAG,2,10/23/2011 11:05,0.85,16007,United Kingdom
572280,23205,CHARLOTTE BAG VINTAGE ALPHABET ,2,10/23/2011 11:05,0.85,16007,United Kingdom
572280,22661,CHARLOTTE BAG DOLLY GIRL DESIGN,2,10/23/2011 11:05,0.85,16007,United Kingdom
572280,21992,VINTAGE PAISLEY STATIONERY SET,3,10/23/2011 11:05,1.25,16007,United Kingdom
572280,23354,6 GIFT TAGS 50'S CHRISTMAS ,5,10/23/2011 11:05,0.83,16007,United Kingdom
572280,84535B,FAIRY CAKES NOTEBOOK A6 SIZE,4,10/23/2011 11:05,0.65,16007,United Kingdom
572280,22646,CERAMIC STRAWBERRY CAKE MONEY BANK,4,10/23/2011 11:05,1.45,16007,United Kingdom
572280,23191,BUNDLE OF 3 RETRO NOTE BOOKS,4,10/23/2011 11:05,1.65,16007,United Kingdom
572280,22549,PICTURE DOMINOES,3,10/23/2011 11:05,1.45,16007,United Kingdom
572280,21993,FLORAL FOLK STATIONERY SET,3,10/23/2011 11:05,1.25,16007,United Kingdom
572280,23300,GARDENERS KNEELING PAD CUP OF TEA ,6,10/23/2011 11:05,1.65,16007,United Kingdom
572280,23301,GARDENERS KNEELING PAD KEEP CALM ,6,10/23/2011 11:05,1.65,16007,United Kingdom
572280,21791,VINTAGE HEADS AND TAILS CARD GAME ,4,10/23/2011 11:05,1.25,16007,United Kingdom
572280,22197,POPCORN HOLDER,6,10/23/2011 11:05,0.85,16007,United Kingdom
572281,22655,VINTAGE RED KITCHEN CABINET,1,10/23/2011 11:10,50,17211,United Kingdom
572281,23232,WRAP VINTAGE LEAF DESIGN,25,10/23/2011 11:10,0.42,17211,United Kingdom
572281,84507C,BLUE CIRCLES DESIGN MONKEY DOLL,5,10/23/2011 11:10,2.55,17211,United Kingdom
572281,22940,FELTCRAFT CHRISTMAS FAIRY,4,10/23/2011 11:10,4.25,17211,United Kingdom
572281,23321,SMALL WHITE HEART OF WICKER,6,10/23/2011 11:10,1.65,17211,United Kingdom
572281,23323,WHITE WICKER STAR ,3,10/23/2011 11:10,2.1,17211,United Kingdom
572281,85123A,WHITE HANGING HEART T-LIGHT HOLDER,6,10/23/2011 11:10,2.95,17211,United Kingdom
572281,22435,SET OF 9 HEART SHAPED BALLOONS,10,10/23/2011 11:10,1.25,17211,United Kingdom
572281,23101,SILVER STARS TABLE DECORATION,6,10/23/2011 11:10,0.83,17211,United Kingdom
572281,22600,CHRISTMAS RETROSPOT STAR WOOD,12,10/23/2011 11:10,0.85,17211,United Kingdom
572281,22980,PANTRY SCRUBBING BRUSH,1,10/23/2011 11:10,1.65,17211,United Kingdom
572281,22154,ANGEL DECORATION 3 BUTTONS ,20,10/23/2011 11:10,0.42,17211,United Kingdom
572281,22737,RIBBON REEL CHRISTMAS PRESENT ,5,10/23/2011 11:10,1.65,17211,United Kingdom
572281,22735,RIBBON REEL SOCKS AND MITTENS,5,10/23/2011 11:10,1.65,17211,United Kingdom
572281,22739,RIBBON REEL CHRISTMAS SOCK BAUBLE,5,10/23/2011 11:10,1.65,17211,United Kingdom
572281,22086,PAPER CHAIN KIT 50'S CHRISTMAS ,10,10/23/2011 11:10,2.95,17211,United Kingdom
572281,22963,JAM JAR WITH GREEN LID,6,10/23/2011 11:10,0.85,17211,United Kingdom
572281,23490,T-LIGHT HOLDER HANGING LOVE BIRD,6,10/23/2011 11:10,3.75,17211,United Kingdom
572281,84949,SILVER HANGING T-LIGHT HOLDER,6,10/23/2011 11:10,1.65,17211,United Kingdom
572281,23355,HOT WATER BOTTLE KEEP CALM,3,10/23/2011 11:10,4.95,17211,United Kingdom
572281,23357,HOT WATER BOTTLE SEX BOMB,3,10/23/2011 11:10,4.95,17211,United Kingdom
572281,23356,LOVE HOT WATER BOTTLE,3,10/23/2011 11:10,5.95,17211,United Kingdom
572281,22835,HOT WATER BOTTLE I AM SO POORLY,3,10/23/2011 11:10,4.95,17211,United Kingdom
572281,23344,JUMBO BAG 50'S CHRISTMAS ,10,10/23/2011 11:10,2.08,17211,United Kingdom
572281,48194,DOORMAT HEARTS,2,10/23/2011 11:10,8.25,17211,United Kingdom
572281,23284,DOORMAT KEEP CALM AND COME IN,2,10/23/2011 11:10,8.25,17211,United Kingdom
572281,48187,DOORMAT NEW ENGLAND,2,10/23/2011 11:10,8.25,17211,United Kingdom
572281,21955,DOORMAT UNION JACK GUNS AND ROSES,2,10/23/2011 11:10,8.25,17211,United Kingdom
572281,23283,DOORMAT VINTAGE LEAF,2,10/23/2011 11:10,8.25,17211,United Kingdom
572282,23501,KEY RING BASEBALL BOOT UNION JACK,10,10/23/2011 11:39,1.25,17634,United Kingdom
572282,84596B,SMALL DOLLY MIX DESIGN ORANGE BOWL,2,10/23/2011 11:39,0.42,17634,United Kingdom
572282,84596F,SMALL MARSHMALLOWS PINK BOWL,2,10/23/2011 11:39,0.42,17634,United Kingdom
572282,84380,SET OF 3 BUTTERFLY COOKIE CUTTERS,6,10/23/2011 11:39,1.45,17634,United Kingdom
572282,22993,SET OF 4 PANTRY JELLY MOULDS,2,10/23/2011 11:39,1.25,17634,United Kingdom
572282,22064,PINK DOUGHNUT TRINKET POT ,2,10/23/2011 11:39,1.65,17634,United Kingdom
572282,23469,CARD HOLDER LOVE BIRD SMALL,2,10/23/2011 11:39,4.15,17634,United Kingdom
572282,23470,CARD HOLDER LOVE BIRD LARGE ,1,10/23/2011 11:39,6.25,17634,United Kingdom
572282,47559B,TEA TIME OVEN GLOVE,4,10/23/2011 11:39,1.25,17634,United Kingdom
572282,22197,POPCORN HOLDER,6,10/23/2011 11:39,0.85,17634,United Kingdom
572282,22067,CHOC TRUFFLE GOLD TRINKET POT ,2,10/23/2011 11:39,1.65,17634,United Kingdom
572282,21232,STRAWBERRY CERAMIC TRINKET BOX,2,10/23/2011 11:39,1.25,17634,United Kingdom
572282,21242,RED RETROSPOT PLATE ,2,10/23/2011 11:39,1.69,17634,United Kingdom
572282,20676,RED RETROSPOT BOWL,2,10/23/2011 11:39,1.25,17634,United Kingdom
572282,22960,JAM MAKING SET WITH JARS,2,10/23/2011 11:39,4.25,17634,United Kingdom
572282,23404,HOME SWEET HOME BLACKBOARD,2,10/23/2011 11:39,4.95,17634,United Kingdom
572282,23300,GARDENERS KNEELING PAD CUP OF TEA ,2,10/23/2011 11:39,1.65,17634,United Kingdom
572282,21367,MIRRORED WALL ART GENTS,3,10/23/2011 11:39,0.75,17634,United Kingdom
572282,21368,MIRRORED WALL ART LADIES,2,10/23/2011 11:39,0.75,17634,United Kingdom
572282,22966,GINGERBREAD MAN COOKIE CUTTER,5,10/23/2011 11:39,1.25,17634,United Kingdom
572282,22371,AIRLINE BAG VINTAGE TOKYO 78,1,10/23/2011 11:39,4.25,17634,United Kingdom
572282,22961,JAM MAKING SET PRINTED,6,10/23/2011 11:39,1.45,17634,United Kingdom
572282,20914,SET/5 RED RETROSPOT LID GLASS BOWLS,2,10/23/2011 11:39,2.95,17634,United Kingdom
572282,22720,SET OF 3 CAKE TINS PANTRY DESIGN ,1,10/23/2011 11:39,4.95,17634,United Kingdom
572282,22324,BLUE POLKADOT KIDS BAG,2,10/23/2011 11:39,1.95,17634,United Kingdom
572282,20719,WOODLAND CHARLOTTE BAG,2,10/23/2011 11:39,0.85,17634,United Kingdom
572282,20724,RED RETROSPOT CHARLOTTE BAG,2,10/23/2011 11:39,0.85,17634,United Kingdom
572282,23205,CHARLOTTE BAG VINTAGE ALPHABET ,2,10/23/2011 11:39,0.85,17634,United Kingdom
572282,22355,CHARLOTTE BAG SUKI DESIGN,2,10/23/2011 11:39,0.85,17634,United Kingdom
572282,22356,CHARLOTTE BAG PINK POLKADOT,2,10/23/2011 11:39,0.85,17634,United Kingdom
572282,22838,3 TIER CAKE TIN RED AND CREAM,1,10/23/2011 11:39,14.95,17634,United Kingdom
572283,22119,PEACE WOODEN BLOCK LETTERS,2,10/23/2011 11:42,6.95,15000,United Kingdom
572283,23542,WALL ART 70'S ALPHABET ,1,10/23/2011 11:42,8.25,15000,United Kingdom
572283,23541,WALL ART CLASSIC PUDDINGS ,1,10/23/2011 11:42,8.25,15000,United Kingdom
572283,21755,LOVE BUILDING BLOCK WORD,2,10/23/2011 11:42,6.25,15000,United Kingdom
572283,22121,NOEL WOODEN BLOCK LETTERS ,2,10/23/2011 11:42,5.95,15000,United Kingdom
572283,21754,HOME BUILDING BLOCK WORD,2,10/23/2011 11:42,6.25,15000,United Kingdom
572283,22118,JOY WOODEN BLOCK LETTERS,2,10/23/2011 11:42,4.95,15000,United Kingdom
572283,21380,WOODEN HAPPY BIRTHDAY GARLAND,2,10/23/2011 11:42,2.95,15000,United Kingdom
572283,21808,"CHRISTMAS GARLAND STARS,TREES",3,10/23/2011 11:42,3.75,15000,United Kingdom
572283,22617,BAKING SET SPACEBOY DESIGN,2,10/23/2011 11:42,4.95,15000,United Kingdom
572283,22271,FELTCRAFT DOLL ROSIE,1,10/23/2011 11:42,2.95,15000,United Kingdom
572283,22569,FELTCRAFT CUSHION BUTTERFLY,2,10/23/2011 11:42,3.75,15000,United Kingdom
572283,22568,FELTCRAFT CUSHION OWL,2,10/23/2011 11:42,3.75,15000,United Kingdom
572283,47590B,PINK HAPPY BIRTHDAY BUNTING,2,10/23/2011 11:42,5.45,15000,United Kingdom
572283,47590A,BLUE HAPPY BIRTHDAY BUNTING,2,10/23/2011 11:42,5.45,15000,United Kingdom
572283,21002,ROSE DU SUD DRAWSTRING BAG,2,10/23/2011 11:42,4.25,15000,United Kingdom
572283,21481,FAWN BLUE HOT WATER BOTTLE,2,10/23/2011 11:42,3.75,15000,United Kingdom
572283,23298,SPOTTY BUNTING,2,10/23/2011 11:42,4.95,15000,United Kingdom
572283,21577,SAVE THE PLANET COTTON TOTE BAG,2,10/23/2011 11:42,2.25,15000,United Kingdom
572283,21580,RABBIT  DESIGN  COTTON TOTE BAG,2,10/23/2011 11:42,2.25,15000,United Kingdom
572283,21484,CHICK GREY HOT WATER BOTTLE,2,10/23/2011 11:42,4.25,15000,United Kingdom
572283,22110,BIRD HOUSE HOT WATER BOTTLE,2,10/23/2011 11:42,2.55,15000,United Kingdom
572283,84030E,ENGLISH ROSE HOT WATER BOTTLE,2,10/23/2011 11:42,4.25,15000,United Kingdom
572283,23390,DOLLY GIRL MINI BACKPACK,2,10/23/2011 11:42,4.15,15000,United Kingdom
572283,23388,WOODLAND MINI BACKPACK,2,10/23/2011 11:42,4.15,15000,United Kingdom
572283,23389,SPACEBOY MINI BACKPACK,2,10/23/2011 11:42,4.15,15000,United Kingdom
572283,22430,ENAMEL WATERING CAN CREAM,1,10/23/2011 11:42,4.95,15000,United Kingdom
572283,23395,BELLE JARDINIERE CUSHION COVER,3,10/23/2011 11:42,3.75,15000,United Kingdom
572283,23394,POSTE FRANCE CUSHION COVER,3,10/23/2011 11:42,3.75,15000,United Kingdom
572283,23396,LE JARDIN BOTANIQUE CUSHION COVER,3,10/23/2011 11:42,3.75,15000,United Kingdom
572283,23393,HOME SWEET HOME CUSHION COVER ,3,10/23/2011 11:42,3.75,15000,United Kingdom
572283,23419,HOME SWEET HOME BOTTLE ,2,10/23/2011 11:42,2.08,15000,United Kingdom
572283,23418,LAVENDER TOILETTE BOTTLE,2,10/23/2011 11:42,2.08,15000,United Kingdom
572283,21261,GREEN GOOSE FEATHER CHRISTMAS TREE ,1,10/23/2011 11:42,2.95,15000,United Kingdom
572283,22867,HAND WARMER BIRD DESIGN,2,10/23/2011 11:42,2.1,15000,United Kingdom
572283,22866,HAND WARMER SCOTTY DOG DESIGN,2,10/23/2011 11:42,2.1,15000,United Kingdom
572283,22865,HAND WARMER OWL DESIGN,2,10/23/2011 11:42,2.1,15000,United Kingdom
572283,22945,CHRISTMAS METAL TAGS ASSORTED ,36,10/23/2011 11:42,0.85,15000,United Kingdom
572283,22578,WOODEN STAR CHRISTMAS SCANDINAVIAN,4,10/23/2011 11:42,0.29,15000,United Kingdom
572283,22078,RIBBON REEL LACE DESIGN ,2,10/23/2011 11:42,2.1,15000,United Kingdom
572283,22082,RIBBON REEL STRIPES DESIGN ,2,10/23/2011 11:42,1.65,15000,United Kingdom
572283,22579,WOODEN TREE CHRISTMAS SCANDINAVIAN,4,10/23/2011 11:42,0.29,15000,United Kingdom
572283,22577,WOODEN HEART CHRISTMAS SCANDINAVIAN,4,10/23/2011 11:42,0.29,15000,United Kingdom
572283,22077,6 RIBBONS RUSTIC CHARM,2,10/23/2011 11:42,1.95,15000,United Kingdom
572283,85049A,TRADITIONAL CHRISTMAS RIBBONS,3,10/23/2011 11:42,1.25,15000,United Kingdom
572283,22583,PACK OF 6 HANDBAG GIFT BOXES,3,10/23/2011 11:42,2.55,15000,United Kingdom
572283,22582,PACK OF 6 SWEETIE GIFT BOXES,3,10/23/2011 11:42,2.55,15000,United Kingdom
572283,22585,PACK OF 6 BIRDY GIFT TAGS,3,10/23/2011 11:42,1.25,15000,United Kingdom
572283,22584,PACK OF 6 PANNETONE GIFT BOXES,3,10/23/2011 11:42,2.55,15000,United Kingdom
572283,85049G,CHOCOLATE BOX RIBBONS ,2,10/23/2011 11:42,1.25,15000,United Kingdom
572283,21824,PAINTED METAL STAR WITH HOLLY BELLS,3,10/23/2011 11:42,0.39,15000,United Kingdom
572283,21823,PAINTED METAL HEART WITH HOLLY BELL,3,10/23/2011 11:42,0.39,15000,United Kingdom
572283,22643,SET OF 4 NAPKIN CHARMS LEAVES   ,2,10/23/2011 11:42,2.55,15000,United Kingdom
572283,22604,SET OF 4 NAPKIN CHARMS CUTLERY,2,10/23/2011 11:42,2.55,15000,United Kingdom
572283,22138,BAKING SET 9 PIECE RETROSPOT ,2,10/23/2011 11:42,4.95,15000,United Kingdom
572283,35970,ZINC FOLKART SLEIGH BELLS,4,10/23/2011 11:42,1.69,15000,United Kingdom
572283,23265,SET OF 3 WOODEN TREE DECORATIONS,2,10/23/2011 11:42,1.25,15000,United Kingdom
572283,23266,SET OF 3 WOODEN STOCKING DECORATION,2,10/23/2011 11:42,1.25,15000,United Kingdom
572283,23264,SET OF 3 WOODEN SLEIGH DECORATIONS,2,10/23/2011 11:42,1.25,15000,United Kingdom
572283,23263,SET OF 3 WOODEN HEART DECORATIONS,2,10/23/2011 11:42,1.25,15000,United Kingdom
572283,23433,HANGING QUILTED PATCHWORK APPLES,6,10/23/2011 11:42,0.83,15000,United Kingdom
572283,84879,ASSORTED COLOUR BIRD ORNAMENT,4,10/23/2011 11:42,1.69,15000,United Kingdom
572283,23398,HANGING HEART BONHEUR,2,10/23/2011 11:42,0.85,15000,United Kingdom
572283,21156,RETROSPOT CHILDRENS APRON,2,10/23/2011 11:42,1.95,15000,United Kingdom
572283,47591D,PINK FAIRY CAKE CHILDRENS APRON,2,10/23/2011 11:42,1.95,15000,United Kingdom
572283,21114,LAVENDER SCENTED FABRIC HEART,10,10/23/2011 11:42,1.25,15000,United Kingdom
572283,22367,CHILDRENS APRON SPACEBOY DESIGN,2,10/23/2011 11:42,1.95,15000,United Kingdom
572283,22899,CHILDREN'S APRON DOLLY GIRL ,2,10/23/2011 11:42,2.1,15000,United Kingdom
572283,22731,3D CHRISTMAS STAMPS STICKERS ,2,10/23/2011 11:42,1.25,15000,United Kingdom
572283,22732,3D VINTAGE CHRISTMAS STICKERS ,2,10/23/2011 11:42,1.25,15000,United Kingdom
572283,22733,3D TRADITIONAL CHRISTMAS STICKERS,2,10/23/2011 11:42,1.25,15000,United Kingdom
572283,22734,SET OF 6 RIBBONS VINTAGE CHRISTMAS,2,10/23/2011 11:42,2.89,15000,United Kingdom
572283,23398,HANGING HEART BONHEUR,1,10/23/2011 11:42,0.85,15000,United Kingdom
572283,23399,HOME SWEET HOME HANGING HEART,3,10/23/2011 11:42,0.85,15000,United Kingdom
572283,22090,PAPER BUNTING RETROSPOT,2,10/23/2011 11:42,2.95,15000,United Kingdom
572283,22089,PAPER BUNTING VINTAGE PAISLEY,2,10/23/2011 11:42,2.95,15000,United Kingdom
572283,21034,REX CASH+CARRY JUMBO SHOPPER,3,10/23/2011 11:42,0.95,15000,United Kingdom
572284,22483,RED GINGHAM TEDDY BEAR ,1,10/23/2011 12:08,2.95,16744,United Kingdom
572284,21770,OPEN CLOSED METAL SIGN,1,10/23/2011 12:08,4.95,16744,United Kingdom
572284,22110,BIRD HOUSE HOT WATER BOTTLE,2,10/23/2011 12:08,2.55,16744,United Kingdom
572284,21452,TOADSTOOL MONEY BOX,3,10/23/2011 12:08,2.95,16744,United Kingdom
572284,22173,METAL 4 HOOK HANGER FRENCH CHATEAU,1,10/23/2011 12:08,3.29,16744,United Kingdom
