577358,23559,WOODLAND BUNNIES LOLLY MAKERS,2,11/18/2011 15:59,4.13,,United Kingdom
577358,23567,EGG CUP HENRIETTA HEN PINK,1,11/18/2011 15:59,2.46,,United Kingdom
577358,23568,EGG CUP HENRIETTA HEN CREAM ,4,11/18/2011 15:59,2.46,,United Kingdom
577358,23570,TRADITIONAL PICK UP STICKS GAME ,3,11/18/2011 15:59,2.46,,United Kingdom
577358,23571,TRADITIONAL NAUGHTS & CROSSES,3,11/18/2011 15:59,3.29,,United Kingdom
577358,23581,JUMBO BAG PAISLEY PARK,1,11/18/2011 15:59,4.13,,United Kingdom
577358,23583,LUNCH BAG PAISLEY PARK  ,2,11/18/2011 15:59,4.13,,United Kingdom
577358,23620,SET 10 CARDS PERFECT POST 17090,2,11/18/2011 15:59,2.49,,United Kingdom
577358,23626,SET 10 CARDS DINKY TREE 17076,1,11/18/2011 15:59,2.49,,United Kingdom
577358,23660,HENRIETTA HEN MUG ,1,11/18/2011 15:59,4.13,,United Kingdom
577358,23681,LUNCH BAG RED VINTAGE DOILY,1,11/18/2011 15:59,4.13,,United Kingdom
577358,23694,PAISLEY PARK CARD,1,11/18/2011 15:59,0.83,,United Kingdom
577358,35095A,BLUE VICTORIAN FABRIC OVAL BOX,3,11/18/2011 15:59,0.83,,United Kingdom
577358,35095B,RED VICTORIAN FABRIC OVAL BOX,3,11/18/2011 15:59,0.83,,United Kingdom
577358,35646,VINTAGE BEAD PINK EVENING BAG,2,11/18/2011 15:59,2.46,,United Kingdom
577358,35953,FOLKART STAR CHRISTMAS DECORATIONS,8,11/18/2011 15:59,0.61,,United Kingdom
577358,35961,FOLKART ZINC HEART CHRISTMAS DEC,4,11/18/2011 15:59,1.63,,United Kingdom
577358,35967,FOLK ART METAL STAR T-LIGHT HOLDER,2,11/18/2011 15:59,0.83,,United Kingdom
577358,35970,ZINC FOLKART SLEIGH BELLS,3,11/18/2011 15:59,4.13,,United Kingdom
577358,37448,CERAMIC CAKE DESIGN SPOTTED MUG,2,11/18/2011 15:59,3.29,,United Kingdom
577358,37500,TEA TIME TEAPOT IN GIFT BOX,1,11/18/2011 15:59,8.29,,United Kingdom
577358,46776A,WOVEN BUBBLE GUM CUSHION COVER,3,11/18/2011 15:59,4.13,,United Kingdom
577358,46776B,WOVEN BERRIES CUSHION COVER ,1,11/18/2011 15:59,4.13,,United Kingdom
577358,46776C,WOVEN FROST CUSHION COVER,2,11/18/2011 15:59,4.13,,United Kingdom
577358,46776E,WOVEN CANDY CUSHION COVER ,1,11/18/2011 15:59,4.13,,United Kingdom
577358,47310M,SMALL POP BOX FUNKY MONKEY,2,11/18/2011 15:59,1.63,,United Kingdom
577358,47563A,RETRO LONGBOARD IRONING BOARD COVER,1,11/18/2011 15:59,3.29,,United Kingdom
577358,48184,DOORMAT ENGLISH ROSE ,1,11/18/2011 15:59,15.79,,United Kingdom
577358,51014A,"FEATHER PEN,HOT PINK",4,11/18/2011 15:59,0.83,,United Kingdom
577358,51014C,"FEATHER PEN,COAL BLACK",5,11/18/2011 15:59,0.83,,United Kingdom
577358,51014L,"FEATHER PEN,LIGHT PINK",2,11/18/2011 15:59,0.83,,United Kingdom
577358,70007,HI TEC ALPINE HAND WARMER,1,11/18/2011 15:59,3.29,,United Kingdom
577358,71053,WHITE MOROCCAN METAL LANTERN,1,11/18/2011 15:59,8.29,,United Kingdom
577358,71459,HANGING JAM JAR T-LIGHT HOLDERS,4,11/18/2011 15:59,1.66,,United Kingdom
577358,71477,COLOURED GLASS STAR T-LIGHT HOLDER,1,11/18/2011 15:59,6.63,,United Kingdom
577358,72351A,SET/6 TURQUOISE BUTTERFLY T-LIGHTS,1,11/18/2011 15:59,4.13,,United Kingdom
577358,79302M,"ART LIGHTS,FUNK MONKEY",1,11/18/2011 15:59,5.79,,United Kingdom
577358,79321,CHILLI LIGHTS,1,11/18/2011 15:59,12.46,,United Kingdom
577358,82001S,SILVER RECORD COVER FRAME,1,11/18/2011 15:59,7.46,,United Kingdom
577358,82552,WASHROOM METAL SIGN,1,11/18/2011 15:59,2.46,,United Kingdom
577358,82567,"AIRLINE LOUNGE,METAL SIGN",2,11/18/2011 15:59,1.63,,United Kingdom
577358,82578,KITCHEN METAL SIGN,4,11/18/2011 15:59,1.25,,United Kingdom
577358,82580,BATHROOM METAL SIGN,2,11/18/2011 15:59,1.25,,United Kingdom
577358,82616B,FRAPPUCINO SCARF KNITTING KIT,1,11/18/2011 15:59,2.46,,United Kingdom
577358,82616C,MIDNIGHT GLAMOUR SCARF KNITTING KIT,1,11/18/2011 15:59,2.46,,United Kingdom
577358,84029G,KNITTED UNION FLAG HOT WATER BOTTLE,1,11/18/2011 15:59,8.29,,United Kingdom
577358,84030E,ENGLISH ROSE HOT WATER BOTTLE,1,11/18/2011 15:59,8.29,,United Kingdom
577358,84032B,CHARLIE + LOLA RED HOT WATER BOTTLE,3,11/18/2011 15:59,3.29,,United Kingdom
577358,84077,WORLD WAR 2 GLIDERS ASSTD DESIGNS,4,11/18/2011 15:59,0.63,,United Kingdom
577358,84247E,PACK OF 12 CHRISTMAS FUN CARDS,1,11/18/2011 15:59,2.46,,United Kingdom
577358,84375,SET OF 20 KIDS COOKIE CUTTERS,2,11/18/2011 15:59,4.13,,United Kingdom
577358,84380,SET OF 3 BUTTERFLY COOKIE CUTTERS,2,11/18/2011 15:59,2.46,,United Kingdom
577358,84536A,ENGLISH ROSE NOTEBOOK A7 SIZE,1,11/18/2011 15:59,0.83,,United Kingdom
577358,84559A,3D SHEET OF DOG STICKERS,1,11/18/2011 15:59,1.63,,United Kingdom
577358,84580,MOUSE TOY WITH PINK T-SHIRT,1,11/18/2011 15:59,4.13,,United Kingdom
577358,84581,DOG TOY WITH PINK CROCHET SKIRT,1,11/18/2011 15:59,4.13,,United Kingdom
577358,84596B,SMALL DOLLY MIX DESIGN ORANGE BOWL,1,11/18/2011 15:59,0.83,,United Kingdom
577358,84596F,SMALL MARSHMALLOWS PINK BOWL,2,11/18/2011 15:59,0.83,,United Kingdom
577358,84596G,SMALL CHOCOLATES PINK BOWL,1,11/18/2011 15:59,0.83,,United Kingdom
577358,84598,BOYS ALPHABET IRON ON PATCHES,6,11/18/2011 15:59,0.42,,United Kingdom
577358,84692,BOX OF 24 COCKTAIL PARASOLS,5,11/18/2011 15:59,0.83,,United Kingdom
577358,84755,COLOUR GLASS T-LIGHT HOLDER HANGING,16,11/18/2011 15:59,1.24,,United Kingdom
577358,84912B,GREEN ROSE WASHBAG,1,11/18/2011 15:59,3.29,,United Kingdom
577358,84946,ANTIQUE SILVER T-LIGHT GLASS,7,11/18/2011 15:59,2.46,,United Kingdom
577358,84951B,SET OF 4 BLACK LOVEBIRD COASTERS,1,11/18/2011 15:59,2.46,,United Kingdom
577358,84978,HANGING HEART JAR T-LIGHT HOLDER,1,11/18/2011 15:59,2.46,,United Kingdom
577358,84988,SET OF 72 PINK HEART PAPER DOILIES,1,11/18/2011 15:59,2.92,,United Kingdom
577358,84991,60 TEATIME FAIRY CAKE CASES,2,11/18/2011 15:59,1.25,,United Kingdom
577358,84992,72 SWEETHEART FAIRY CAKE CASES,3,11/18/2011 15:59,1.25,,United Kingdom
577358,84993A,75 GREEN PETIT FOUR CASES,5,11/18/2011 15:59,0.83,,United Kingdom
577358,84997D,CHILDRENS CUTLERY POLKADOT PINK,1,11/18/2011 15:59,8.29,,United Kingdom
577358,85032A,ROMANTIC IMAGES GIFT WRAP SET,1,11/18/2011 15:59,1.63,,United Kingdom
577358,85032C,CURIOUS IMAGES GIFT WRAP SET,1,11/18/2011 15:59,1.63,,United Kingdom
577358,85039C,S/4 BLACK MINI ROSE CANDLE IN BOWL,1,11/18/2011 15:59,1.63,,United Kingdom
577358,85049A,TRADITIONAL CHRISTMAS RIBBONS,3,11/18/2011 15:59,2.46,,United Kingdom
577358,85049C,ROMANTIC PINKS RIBBONS ,1,11/18/2011 15:59,2.46,,United Kingdom
577358,85049E,SCANDINAVIAN REDS RIBBONS,2,11/18/2011 15:59,2.46,,United Kingdom
577358,85049G,CHOCOLATE BOX RIBBONS ,2,11/18/2011 15:59,2.46,,United Kingdom
577358,85049H,URBAN BLACK RIBBONS ,7,11/18/2011 15:59,0.83,,United Kingdom
577358,85053,FRENCH ENAMEL CANDLEHOLDER,1,11/18/2011 15:59,4.13,,United Kingdom
577358,85062,PEARL CRYSTAL PUMPKIN T-LIGHT HLDR,2,11/18/2011 15:59,2.46,,United Kingdom
577358,85123A,WHITE HANGING HEART T-LIGHT HOLDER,1,11/18/2011 15:59,5.79,,United Kingdom
577358,85129D,BEADED CRYSTAL HEART PINK SMALL,1,11/18/2011 15:59,2.46,,United Kingdom
577358,85131B,BEADED CRYSTAL HEART GREEN ON STICK,1,11/18/2011 15:59,0.83,,United Kingdom
577358,85131D,BEADED CRYSTAL HEART PINK ON STICK,1,11/18/2011 15:59,0.83,,United Kingdom
577358,85168B,BLACK BAROQUE CARRIAGE CLOCK,1,11/18/2011 15:59,8.29,,United Kingdom
577358,85169B,BLACK LOVE BIRD CANDLE,2,11/18/2011 15:59,2.46,,United Kingdom
577358,85173,SET/6 FROG PRINCE T-LIGHT CANDLES,1,11/18/2011 15:59,4.96,,United Kingdom
577358,85179A,GREEN BITTY LIGHT CHAIN,1,11/18/2011 15:59,2.46,,United Kingdom
577358,85179C,PINK BITTY LIGHT CHAIN,1,11/18/2011 15:59,2.46,,United Kingdom
577358,85199S,SMALL HANGING IVORY/RED WOOD BIRD,6,11/18/2011 15:59,0.83,,United Kingdom
577358,85227,SET OF 6 3D KIT CARDS FOR KIDS,1,11/18/2011 15:59,1.63,,United Kingdom
577358,90018B,GOLD M.O.P ORBIT DROP EARRINGS,1,11/18/2011 15:59,4.15,,United Kingdom
577358,90019B,GOLD M.O.P ORBIT BRACELET,1,11/18/2011 15:59,5.4,,United Kingdom
577358,90059A,DIAMANTE HAIR GRIP PACK/2 CRYSTAL,1,11/18/2011 15:59,1.65,,United Kingdom
577358,90114,SUMMER DAISIES BAG CHARM,1,11/18/2011 15:59,2.46,,United Kingdom
577358,90175D,TIGRIS EYE CHUNKY CHARM BRACELET,1,11/18/2011 15:59,9.15,,United Kingdom
577358,90182B,AMETHYST 3 BEAD DROP EARRINGS,1,11/18/2011 15:59,2.9,,United Kingdom
577358,90201A,PURPLE ENAMEL FLOWER RING,1,11/18/2011 15:59,2.9,,United Kingdom
577358,90214H,"LETTER ""H"" BLING KEY RING",1,11/18/2011 15:59,0.83,,United Kingdom
577358,DOT,DOTCOM POSTAGE,1,11/18/2011 15:59,579.21,,United Kingdom
577358,22804,PINK HANGING HEART T-LIGHT HOLDER,2,11/18/2011 15:59,2.95,,United Kingdom
577358,16235,RECYCLED PENCIL WITH RABBIT ERASER,2,11/18/2011 15:59,0.42,,United Kingdom
577358,16236,KITTY PENCIL ERASERS,1,11/18/2011 15:59,0.42,,United Kingdom
577358,16254,TRANSPARENT ACRYLIC TAPE DISPENSER,1,11/18/2011 15:59,1.63,,United Kingdom
577358,20685,DOORMAT RED RETROSPOT,2,11/18/2011 15:59,15.79,,United Kingdom
577358,20719,WOODLAND CHARLOTTE BAG,8,11/18/2011 15:59,1.63,,United Kingdom
577358,20723,STRAWBERRY CHARLOTTE BAG,1,11/18/2011 15:59,1.63,,United Kingdom
577358,20724,RED RETROSPOT CHARLOTTE BAG,5,11/18/2011 15:59,1.63,,United Kingdom
577358,20725,LUNCH BAG RED RETROSPOT,2,11/18/2011 15:59,4.13,,United Kingdom
577358,20726,LUNCH BAG WOODLAND,1,11/18/2011 15:59,4.13,,United Kingdom
577358,20733,GOLD MINI TAPE MEASURE ,2,11/18/2011 15:59,0.83,,United Kingdom
577358,20755,BLUE PAISLEY POCKET BOOK,1,11/18/2011 15:59,1.63,,United Kingdom
577358,20764,ABSTRACT CIRCLES SKETCHBOOK ,1,11/18/2011 15:59,7.46,,United Kingdom
577358,20775,DAISY NOTEBOOK ,2,11/18/2011 15:59,1.63,,United Kingdom
577358,20777,CHRYSANTHEMUM NOTEBOOK,3,11/18/2011 15:59,1.63,,United Kingdom
577358,20839,FRENCH PAISLEY CUSHION COVER ,2,11/18/2011 15:59,3.29,,United Kingdom
577358,20931,BLUE POT PLANT CANDLE ,1,11/18/2011 15:59,7.46,,United Kingdom
577358,20956,PORCELAIN T-LIGHT HOLDERS ASSORTED,1,11/18/2011 15:59,2.46,,United Kingdom
577358,20971,PINK BLUE FELT CRAFT TRINKET BOX,1,11/18/2011 15:59,2.46,,United Kingdom
577358,20972,PINK CREAM FELT CRAFT TRINKET BOX ,1,11/18/2011 15:59,2.46,,United Kingdom
577358,20973,12 PENCIL SMALL TUBE WOODLAND,5,11/18/2011 15:59,1.25,,United Kingdom
577358,20978,36 PENCILS TUBE SKULLS,1,11/18/2011 15:59,2.46,,United Kingdom
577358,20979,36 PENCILS TUBE RED RETROSPOT,2,11/18/2011 15:59,2.46,,United Kingdom
577358,20982,12 PENCILS TALL TUBE SKULLS,5,11/18/2011 15:59,1.63,,United Kingdom
577358,20983,12 PENCILS TALL TUBE RED RETROSPOT,1,11/18/2011 15:59,1.63,,United Kingdom
577358,20986,BLUE CALCULATOR RULER,4,11/18/2011 15:59,2.46,,United Kingdom
577358,21012,ANTIQUE ALL GLASS CANDLESTICK,4,11/18/2011 15:59,2.46,,United Kingdom
577358,21028,NINJA RABBIT BLACK,1,11/18/2011 15:59,2.46,,United Kingdom
577358,21035,SET/2 RED RETROSPOT TEA TOWELS ,1,11/18/2011 15:59,6.63,,United Kingdom
577358,21064,BOOM BOX SPEAKER BOYS,1,11/18/2011 15:59,4.13,,United Kingdom
577358,21090,SET/6 COLLAGE PAPER PLATES,3,11/18/2011 15:59,0.83,,United Kingdom
577358,21098,CHRISTMAS TOILET ROLL,2,11/18/2011 15:59,2.46,,United Kingdom
577358,21116,OWL DOORSTOP,1,11/18/2011 15:59,8.29,,United Kingdom
577358,21128,GOLD FISHING GNOME,1,11/18/2011 15:59,12.46,,United Kingdom
577358,21131,GOLD STANDING GNOME,1,11/18/2011 15:59,8.29,,United Kingdom
577358,21137,BLACK RECORD COVER FRAME,1,11/18/2011 15:59,7.46,,United Kingdom
577358,21162,TOXIC AREA  DOOR HANGER ,1,11/18/2011 15:59,3.29,,United Kingdom
577358,21165,BEWARE OF THE CAT METAL SIGN ,1,11/18/2011 15:59,4.13,,United Kingdom
577358,21181,PLEASE ONE PERSON METAL SIGN,1,11/18/2011 15:59,4.13,,United Kingdom
577358,21210,SET OF 72 RETROSPOT PAPER  DOILIES,1,11/18/2011 15:59,2.92,,United Kingdom
577358,21212,PACK OF 72 RETROSPOT CAKE CASES,2,11/18/2011 15:59,1.25,,United Kingdom
577358,21213,PACK OF 72 SKULL CAKE CASES,4,11/18/2011 15:59,1.25,,United Kingdom
577358,21215,IVORY PAPER CUP CAKE CASES ,1,11/18/2011 15:59,1.25,,United Kingdom
577358,21224,SET/4 SKULL BADGES,5,11/18/2011 15:59,0.83,,United Kingdom
577358,21231,SWEETHEART CERAMIC TRINKET BOX,2,11/18/2011 15:59,2.46,,United Kingdom
577358,21239,PINK  POLKADOT CUP,1,11/18/2011 15:59,1.63,,United Kingdom
577358,21240,BLUE POLKADOT CUP,1,11/18/2011 15:59,1.63,,United Kingdom
577358,21288,STRIPEY CHOCOLATE NESTING BOXES,2,11/18/2011 15:59,3.29,,United Kingdom
577358,21314,SMALL GLASS HEART TRINKET POT,1,11/18/2011 15:59,4.13,,United Kingdom
577358,21328,BALLOONS  WRITING SET ,1,11/18/2011 15:59,3.29,,United Kingdom
577358,21356,TOAST ITS - FAIRY FLOWER,9,11/18/2011 15:59,0.83,,United Kingdom
577358,21358,TOAST ITS - HAPPY BIRTHDAY,2,11/18/2011 15:59,0.83,,United Kingdom
577358,21365,MIRRORED WALL ART STARS,1,11/18/2011 15:59,5.79,,United Kingdom
577358,21385,IVORY HANGING DECORATION  HEART,1,11/18/2011 15:59,1.63,,United Kingdom
577358,21441,BLUE BIRDHOUSE DECORATION,1,11/18/2011 15:59,1.63,,United Kingdom
577358,21442,GREEN BIRDHOUSE DECORATION,1,11/18/2011 15:59,1.63,,United Kingdom
577358,21494,ROTATING LEAVES T-LIGHT HOLDER,5,11/18/2011 15:59,2.46,,United Kingdom
577358,21506,"FANCY FONT BIRTHDAY CARD, ",1,11/18/2011 15:59,0.83,,United Kingdom
577358,21509,COWBOYS AND INDIANS BIRTHDAY CARD ,1,11/18/2011 15:59,0.83,,United Kingdom
577358,21558,SKULL LUNCH BOX WITH CUTLERY ,1,11/18/2011 15:59,4.96,,United Kingdom
577358,21577,SAVE THE PLANET COTTON TOTE BAG,1,11/18/2011 15:59,4.96,,United Kingdom
577358,21581,SKULLS  DESIGN  COTTON TOTE BAG,1,11/18/2011 15:59,4.96,,United Kingdom
577358,21617,4 LILY  BOTANICAL DINNER CANDLES,3,11/18/2011 15:59,3.29,,United Kingdom
577358,21619,4 VANILLA BOTANICAL CANDLES,2,11/18/2011 15:59,3.29,,United Kingdom
577358,21620,SET OF 4 ROSE BOTANICAL CANDLES,1,11/18/2011 15:59,3.29,,United Kingdom
577358,21630,FLOOR CUSHION ELEPHANT CARNIVAL,1,11/18/2011 15:59,18.29,,United Kingdom
577358,21640,ASSORTED TUTTI FRUTTI  FOB NOTEBOOK,1,11/18/2011 15:59,1.63,,United Kingdom
577358,21648,ASSORTED TUTTI FRUTTI SMALL PURSE,2,11/18/2011 15:59,2.46,,United Kingdom
577358,21650,ASSORTED TUTTI FRUTTI BRACELET,2,11/18/2011 15:59,0.83,,United Kingdom
577358,21680,WOODLAND  STICKERS,1,11/18/2011 15:59,1.63,,United Kingdom
577358,21703,BAG 125g SWIRLY MARBLES,2,11/18/2011 15:59,0.83,,United Kingdom
577358,21704,BAG 250g SWIRLY MARBLES,1,11/18/2011 15:59,1.63,,United Kingdom
577358,21731,RED TOADSTOOL LED NIGHT LIGHT,5,11/18/2011 15:59,3.29,,United Kingdom
577358,21733,RED HANGING HEART T-LIGHT HOLDER,1,11/18/2011 15:59,5.79,,United Kingdom
577358,21739,COSY SLIPPER SHOES SMALL GREEN,1,11/18/2011 15:59,2.46,,United Kingdom
577358,21744,SNOWFLAKE PORTABLE TABLE LIGHT ,5,11/18/2011 15:59,2.46,,United Kingdom
577358,21790,VINTAGE SNAP CARDS,3,11/18/2011 15:59,1.63,,United Kingdom
577358,21791,VINTAGE HEADS AND TAILS CARD GAME ,3,11/18/2011 15:59,2.46,,United Kingdom
577358,21803,CHRISTMAS TREE STAR DECORATION,20,11/18/2011 15:59,0.42,,United Kingdom
577358,21809,CHRISTMAS HANGING TREE WITH BELL,2,11/18/2011 15:59,0.83,,United Kingdom
577359,85150,LADIES & GENTLEMEN METAL SIGN,6,11/18/2011 16:07,2.55,14903,United Kingdom
577359,21907,I'M ON HOLIDAY METAL SIGN,2,11/18/2011 16:07,2.1,14903,United Kingdom
577359,21905,MORE BUTTER METAL SIGN ,2,11/18/2011 16:07,0.79,14903,United Kingdom
577359,21908,CHOCOLATE THIS WAY METAL SIGN,6,11/18/2011 16:07,2.1,14903,United Kingdom
577359,22672,FRENCH BATHROOM SIGN BLUE METAL,2,11/18/2011 16:07,1.65,14903,United Kingdom
577359,82582,AREA PATROLLED METAL SIGN,2,11/18/2011 16:07,2.1,14903,United Kingdom
577359,21174,POTTERING IN THE SHED METAL SIGN,1,11/18/2011 16:07,2.08,14903,United Kingdom
577359,82583,HOT BATHS METAL SIGN,1,11/18/2011 16:07,2.1,14903,United Kingdom
577359,21175,GIN + TONIC DIET METAL SIGN,5,11/18/2011 16:07,2.55,14903,United Kingdom
577359,23426,METAL SIGN DROP YOUR PANTS,2,11/18/2011 16:07,2.89,14903,United Kingdom
577359,22115,METAL SIGN EMPIRE TEA,2,11/18/2011 16:07,0.79,14903,United Kingdom
577359,82583,HOT BATHS METAL SIGN,1,11/18/2011 16:07,2.1,14903,United Kingdom
577359,22488,NATURAL SLATE RECTANGLE CHALKBOARD,8,11/18/2011 16:07,1.65,14903,United Kingdom
577359,22456,NATURAL SLATE CHALKBOARD LARGE ,1,11/18/2011 16:07,4.95,14903,United Kingdom
577359,20992,JAZZ HEARTS PURSE NOTEBOOK,6,11/18/2011 16:07,0.39,14903,United Kingdom
577359,22674,FRENCH TOILET SIGN BLUE METAL,5,11/18/2011 16:07,1.25,14903,United Kingdom
577359,82581,TOILET METAL SIGN,6,11/18/2011 16:07,0.55,14903,United Kingdom
577359,22670,FRENCH WC SIGN BLUE METAL,6,11/18/2011 16:07,1.25,14903,United Kingdom
577359,84596B,SMALL DOLLY MIX DESIGN ORANGE BOWL,8,11/18/2011 16:07,0.42,14903,United Kingdom
577359,20996,JAZZ HEARTS ADDRESS BOOK,8,11/18/2011 16:07,0.19,14903,United Kingdom
577359,22727,ALARM CLOCK BAKELIKE RED ,2,11/18/2011 16:07,3.75,14903,United Kingdom
577359,22728,ALARM CLOCK BAKELIKE PINK,2,11/18/2011 16:07,3.75,14903,United Kingdom
577359,22726,ALARM CLOCK BAKELIKE GREEN,2,11/18/2011 16:07,3.75,14903,United Kingdom
577359,22457,NATURAL SLATE HEART CHALKBOARD ,2,11/18/2011 16:07,2.95,14903,United Kingdom
577359,82494L,WOODEN FRAME ANTIQUE WHITE ,2,11/18/2011 16:07,2.95,14903,United Kingdom
577359,23404,HOME SWEET HOME BLACKBOARD,1,11/18/2011 16:07,4.95,14903,United Kingdom
577359,23029,DRAWER KNOB CRACKLE GLAZE GREEN,12,11/18/2011 16:07,1.65,14903,United Kingdom
577359,22771,CLEAR DRAWER KNOB ACRYLIC EDWARDIAN,12,11/18/2011 16:07,1.25,14903,United Kingdom
577359,23035,DRAWER KNOB CERAMIC IVORY,12,11/18/2011 16:07,1.45,14903,United Kingdom
577359,22505,MEMO BOARD COTTAGE DESIGN,2,11/18/2011 16:07,4.95,14903,United Kingdom
577359,22171,3 HOOK PHOTO SHELF ANTIQUE WHITE,1,11/18/2011 16:07,8.5,14903,United Kingdom
577359,22188,BLACK HEART CARD HOLDER,1,11/18/2011 16:07,3.95,14903,United Kingdom
577359,22189,CREAM HEART CARD HOLDER,3,11/18/2011 16:07,3.95,14903,United Kingdom
577359,22695,WICKER WREATH SMALL,3,11/18/2011 16:07,1.45,14903,United Kingdom
577359,23486,ANTIQUE HEART SHELF UNIT,1,11/18/2011 16:07,16.65,14903,United Kingdom
577359,23485,BOTANICAL GARDENS WALL CLOCK ,1,11/18/2011 16:07,25,14903,United Kingdom
577359,23321,SMALL WHITE HEART OF WICKER,2,11/18/2011 16:07,1.65,14903,United Kingdom
577359,22141,CHRISTMAS CRAFT TREE TOP ANGEL,2,11/18/2011 16:07,2.1,14903,United Kingdom
577359,22469,HEART OF WICKER SMALL,4,11/18/2011 16:07,1.65,14903,United Kingdom
577359,22144,CHRISTMAS CRAFT LITTLE FRIENDS,2,11/18/2011 16:07,2.1,14903,United Kingdom
577359,22142,CHRISTMAS CRAFT WHITE FAIRY ,2,11/18/2011 16:07,1.45,14903,United Kingdom
577359,22438,BALLOON ART MAKE YOUR OWN FLOWERS,2,11/18/2011 16:07,1.95,14903,United Kingdom
577359,21889,WOODEN BOX OF DOMINOES,2,11/18/2011 16:07,1.25,14903,United Kingdom
577359,23499,SET 12 VINTAGE DOILY CHALK ,1,11/18/2011 16:07,0.42,14903,United Kingdom
577359,21916,SET 12 RETRO WHITE CHALK STICKS,2,11/18/2011 16:07,0.42,14903,United Kingdom
577359,21918,SET 12 KIDS COLOUR  CHALK STICKS,3,11/18/2011 16:07,0.42,14903,United Kingdom
577359,21790,VINTAGE SNAP CARDS,3,11/18/2011 16:07,0.85,14903,United Kingdom
577359,22865,HAND WARMER OWL DESIGN,2,11/18/2011 16:07,2.1,14903,United Kingdom
577359,23439,HAND WARMER RED LOVE HEART,2,11/18/2011 16:07,2.1,14903,United Kingdom
577359,22866,HAND WARMER SCOTTY DOG DESIGN,4,11/18/2011 16:07,2.1,14903,United Kingdom
577359,21791,VINTAGE HEADS AND TAILS CARD GAME ,4,11/18/2011 16:07,1.25,14903,United Kingdom
577359,22549,PICTURE DOMINOES,2,11/18/2011 16:07,1.45,14903,United Kingdom
577359,22563,HAPPY STENCIL CRAFT,2,11/18/2011 16:07,1.25,14903,United Kingdom
577359,22564,ALPHABET STENCIL CRAFT,2,11/18/2011 16:07,1.25,14903,United Kingdom
577359,22086,PAPER CHAIN KIT 50'S CHRISTMAS ,2,11/18/2011 16:07,2.95,14903,United Kingdom
577359,22910,PAPER CHAIN KIT VINTAGE CHRISTMAS,2,11/18/2011 16:07,2.95,14903,United Kingdom
577359,20970,PINK FLORAL FELTCRAFT SHOULDER BAG,2,11/18/2011 16:07,3.75,14903,United Kingdom
577359,20969,RED FLORAL FELTCRAFT SHOULDER BAG,2,11/18/2011 16:07,3.75,14903,United Kingdom
577359,20972,PINK CREAM FELT CRAFT TRINKET BOX ,2,11/18/2011 16:07,1.25,14903,United Kingdom
577359,22150,3 STRIPEY MICE FELTCRAFT,4,11/18/2011 16:07,1.95,14903,United Kingdom
577359,85185B,PINK HORSE SOCK PUPPET KIT,6,11/18/2011 16:07,2.95,14903,United Kingdom
C577360,21137,BLACK RECORD COVER FRAME,-4,11/18/2011 16:12,3.75,13012,United Kingdom
577361,23137,ZINC WIRE SWEETHEART LETTER TRAY,4,11/18/2011 16:13,3.75,13012,United Kingdom
C577362,23110,PARISIENNE KEY CABINET ,-2,11/18/2011 16:14,5.75,14073,United Kingdom
C577363,23235,STORAGE TIN VINTAGE LEAF,-3,11/18/2011 16:17,2.89,12697,Sweden
C577364,23118,PARISIENNE JEWELLERY DRAWER ,-2,11/18/2011 16:18,7.5,14140,United Kingdom
577365,23344,JUMBO BAG 50'S CHRISTMAS ,20,11/18/2011 16:19,2.08,17063,United Kingdom
577365,23254,CHILDRENS CUTLERY DOLLY GIRL ,8,11/18/2011 16:19,4.15,17063,United Kingdom
577365,23256,CHILDRENS CUTLERY SPACEBOY ,8,11/18/2011 16:19,4.15,17063,United Kingdom
577365,85099B,JUMBO BAG RED RETROSPOT,10,11/18/2011 16:19,2.08,17063,United Kingdom
577365,23382,BOX OF 6 CHRISTMAS CAKE DECORATIONS,4,11/18/2011 16:19,3.75,17063,United Kingdom
577365,22720,SET OF 3 CAKE TINS PANTRY DESIGN ,3,11/18/2011 16:19,4.95,17063,United Kingdom
577365,23330,DECORATIVE WICKER HEART MEDIUM,36,11/18/2011 16:19,1.25,17063,United Kingdom
577365,23331,DECORATIVE WICKER HEART SMALL,48,11/18/2011 16:19,0.63,17063,United Kingdom
577365,23329,DECORATIVE WICKER HEART LARGE,12,11/18/2011 16:19,1.65,17063,United Kingdom
577365,23499,SET 12 VINTAGE DOILY CHALK ,24,11/18/2011 16:19,0.42,17063,United Kingdom
577365,23289,DOLLY GIRL CHILDRENS BOWL,8,11/18/2011 16:19,1.25,17063,United Kingdom
577365,23290,SPACEBOY CHILDRENS BOWL,8,11/18/2011 16:19,1.25,17063,United Kingdom
577365,23291,DOLLY GIRL CHILDRENS CUP,8,11/18/2011 16:19,1.25,17063,United Kingdom
577365,23292,SPACEBOY CHILDRENS CUP,8,11/18/2011 16:19,1.25,17063,United Kingdom
577365,23085,ANTIQUE SILVER BAUBLE LAMP  ,4,11/18/2011 16:19,10.4,17063,United Kingdom
577365,23582,VINTAGE DOILY JUMBO BAG RED ,10,11/18/2011 16:19,2.08,17063,United Kingdom
C577369,22271,FELTCRAFT DOLL ROSIE,-2,11/18/2011 16:20,2.95,14132,United Kingdom
C577375,23118,PARISIENNE JEWELLERY DRAWER ,-2,11/18/2011 16:21,7.5,14441,United Kingdom
C577375,23111,PARISIENNE SEWING BOX,-1,11/18/2011 16:21,12.5,14441,United Kingdom
C577381,22362,GLASS JAR PEACOCK BATH SALTS,-1,11/18/2011 16:24,2.95,15297,United Kingdom
C577381,23012,GLASS APOTHECARY BOTTLE PERFUME,-1,11/18/2011 16:24,3.95,15297,United Kingdom
577382,21094,SET/6 RED SPOTTY PAPER PLATES,8,11/18/2011 16:48,0.85,17961,United Kingdom
577382,21086,SET/6 RED SPOTTY PAPER CUPS,6,11/18/2011 16:48,0.65,17961,United Kingdom
577382,21080,SET/20 RED RETROSPOT PAPER NAPKINS ,2,11/18/2011 16:48,0.85,17961,United Kingdom
C577383,21068,VINTAGE BILLBOARD LOVE/HATE MUG,-1,11/18/2011 16:48,1.25,13091,United Kingdom
C577383,21871,SAVE THE PLANET MUG,-2,11/18/2011 16:48,1.65,13091,United Kingdom
C577383,22064,PINK DOUGHNUT TRINKET POT ,-13,11/18/2011 16:48,1.65,13091,United Kingdom
C577384,21313,GLASS HEART T-LIGHT HOLDER ,-10,11/18/2011 16:50,0.64,14156,EIRE
C577385,23661,MILK MAIDS MUG ,-1,11/18/2011 16:53,1.65,14189,United Kingdom
C577385,23660,HENRIETTA HEN MUG ,-1,11/18/2011 16:53,1.65,14189,United Kingdom
C577386,23401,RUSTIC MIRROR WITH LACE HEART,-1,11/18/2011 16:54,6.25,18276,United Kingdom
577387,22374,AIRLINE BAG VINTAGE JET SET RED,1,11/18/2011 16:55,4.25,17961,United Kingdom
C577388,22699,ROSES REGENCY TEACUP AND SAUCER ,-6,11/18/2011 16:58,2.95,14911,EIRE
C577388,22698,PINK REGENCY TEACUP AND SAUCER,-1,11/18/2011 16:58,2.95,14911,EIRE
C577388,22697,GREEN REGENCY TEACUP AND SAUCER,-5,11/18/2011 16:58,2.95,14911,EIRE
C577388,22182,CAKE STAND VICTORIAN FILIGREE SMALL,-1,11/18/2011 16:58,4.95,14911,EIRE
C577388,22507,MEMO BOARD RETROSPOT  DESIGN,-3,11/18/2011 16:58,4.95,14911,EIRE
C577388,22941,CHRISTMAS LIGHTS 10 REINDEER,-1,11/18/2011 16:58,8.5,14911,EIRE
C577388,22423,REGENCY CAKESTAND 3 TIER,-1,11/18/2011 16:58,12.75,14911,EIRE
C577388,23454,THREE MINI HANGING FRAMES,-2,11/18/2011 16:58,4.15,14911,EIRE
C577388,21429,RED GINGHAM ROSE JEWELLERY BOX,-2,11/18/2011 16:58,1.95,14911,EIRE
C577388,23118,PARISIENNE JEWELLERY DRAWER ,-1,11/18/2011 16:58,7.5,14911,EIRE
C577389,23108,SET OF 10 LED DOLLY LIGHTS,-2,11/18/2011 16:59,6.25,13381,United Kingdom
C577390,23401,RUSTIC MIRROR WITH LACE HEART,-1,11/18/2011 17:01,6.25,18276,United Kingdom
C577391,22197,POPCORN HOLDER,-13,11/18/2011 17:03,0.72,13078,United Kingdom
C577391,22109,FULL ENGLISH BREAKFAST PLATE,-2,11/18/2011 17:03,3.39,13078,United Kingdom
C577392,23169,CLASSIC GLASS COOKIE JAR,-6,11/18/2011 17:05,4.15,16560,United Kingdom
577393,23012,GLASS APOTHECARY BOTTLE PERFUME,12,11/18/2011 17:06,3.45,14031,United Kingdom
577393,84029G,KNITTED UNION FLAG HOT WATER BOTTLE,48,11/18/2011 17:06,3.75,14031,United Kingdom
577393,22365,DOORMAT RESPECTABLE HOUSE,20,11/18/2011 17:06,7.08,14031,United Kingdom
577393,23355,HOT WATER BOTTLE KEEP CALM,48,11/18/2011 17:06,4.15,14031,United Kingdom
577393,23535,WALL ART BICYCLE SAFETY,18,11/18/2011 17:06,5.35,14031,United Kingdom
577393,23537,WALL ART I LOVE LONDON ,18,11/18/2011 17:06,4.15,14031,United Kingdom
577393,48138,DOORMAT UNION FLAG,30,11/18/2011 17:06,7.08,14031,United Kingdom
577393,21484,CHICK GREY HOT WATER BOTTLE,36,11/18/2011 17:06,3.75,14031,United Kingdom
577393,84879,ASSORTED COLOUR BIRD ORNAMENT,160,11/18/2011 17:06,1.45,14031,United Kingdom
577393,22423,REGENCY CAKESTAND 3 TIER,16,11/18/2011 17:06,10.95,14031,United Kingdom
577393,22988,SOLDIERS EGG CUP ,144,11/18/2011 17:06,1.06,14031,United Kingdom
577393,23020,GLASS  SONGBIRD STORAGE JAR,8,11/18/2011 17:06,11.15,14031,United Kingdom
577393,23014,GLASS APOTHECARY BOTTLE ELIXIR,12,11/18/2011 17:06,3.45,14031,United Kingdom
577393,23013,GLASS APOTHECARY BOTTLE TONIC,12,11/18/2011 17:06,3.45,14031,United Kingdom
577393,23503,PLAYING CARDS KEEP CALM & CARRY ON,25,11/18/2011 17:06,1.25,14031,United Kingdom
577393,22998,TRAVEL CARD WALLET KEEP CALM,96,11/18/2011 17:06,0.42,14031,United Kingdom
577393,23162,REGENCY TEA STRAINER,16,11/18/2011 17:06,3.75,14031,United Kingdom
577393,22065,CHRISTMAS PUDDING TRINKET POT ,22,11/18/2011 17:06,0.39,14031,United Kingdom
