572284,21389,IVORY HANGING DECORATION  BIRD,6,10/23/2011 12:08,0.85,16744,United Kingdom
572284,22991,GIRAFFE WOODEN RULER,4,10/23/2011 12:08,1.95,16744,United Kingdom
572284,21114,LAVENDER SCENTED FABRIC HEART,5,10/23/2011 12:08,1.25,16744,United Kingdom
572284,85017B,ENVELOPE 50 BLOSSOM IMAGES,1,10/23/2011 12:08,0.42,16744,United Kingdom
572284,23138,SINGLE WIRE HOOK IVORY HEART,3,10/23/2011 12:08,1.45,16744,United Kingdom
572284,21891,TRADITIONAL WOODEN SKIPPING ROPE,3,10/23/2011 12:08,1.45,16744,United Kingdom
572284,22619,SET OF 6 SOLDIER SKITTLES,3,10/23/2011 12:08,3.75,16744,United Kingdom
572284,23528,WALL ART SPACEBOY,1,10/23/2011 12:08,3.75,16744,United Kingdom
572284,23529,WALL ART DOLLY GIRL ,1,10/23/2011 12:08,3.75,16744,United Kingdom
572284,22138,BAKING SET 9 PIECE RETROSPOT ,2,10/23/2011 12:08,4.95,16744,United Kingdom
572284,21704,BAG 250g SWIRLY MARBLES,3,10/23/2011 12:08,0.85,16744,United Kingdom
572284,22534,MAGIC DRAWING SLATE SPACEBOY ,6,10/23/2011 12:08,0.42,16744,United Kingdom
572284,22530,MAGIC DRAWING SLATE DOLLY GIRL ,6,10/23/2011 12:08,0.42,16744,United Kingdom
572284,23368,SET 12 COLOUR PENCILS DOLLY GIRL ,10,10/23/2011 12:08,0.65,16744,United Kingdom
572284,23367,SET 12 COLOUR PENCILS SPACEBOY ,10,10/23/2011 12:08,0.65,16744,United Kingdom
572284,23377,PACK OF 12 DOLLY GIRL TISSUES,12,10/23/2011 12:08,0.39,16744,United Kingdom
572284,22090,PAPER BUNTING RETROSPOT,1,10/23/2011 12:08,2.95,16744,United Kingdom
572284,21680,WOODLAND  STICKERS,6,10/23/2011 12:08,0.85,16744,United Kingdom
572284,20981,12 PENCILS TALL TUBE WOODLAND,3,10/23/2011 12:08,0.85,16744,United Kingdom
572284,23289,DOLLY GIRL CHILDRENS BOWL,4,10/23/2011 12:08,1.25,16744,United Kingdom
572284,21578,WOODLAND DESIGN  COTTON TOTE BAG,2,10/23/2011 12:08,2.25,16744,United Kingdom
572284,23292,SPACEBOY CHILDRENS CUP,4,10/23/2011 12:08,1.25,16744,United Kingdom
572284,23290,SPACEBOY CHILDRENS BOWL,4,10/23/2011 12:08,1.25,16744,United Kingdom
572284,22712,CARD DOLLY GIRL ,12,10/23/2011 12:08,0.42,16744,United Kingdom
572284,22029,SPACEBOY BIRTHDAY CARD,12,10/23/2011 12:08,0.42,16744,United Kingdom
572284,21918,SET 12 KIDS COLOUR  CHALK STICKS,4,10/23/2011 12:08,0.42,16744,United Kingdom
572284,23390,DOLLY GIRL MINI BACKPACK,2,10/23/2011 12:08,4.15,16744,United Kingdom
572284,22326,ROUND SNACK BOXES SET OF4 WOODLAND ,2,10/23/2011 12:08,2.95,16744,United Kingdom
572284,23389,SPACEBOY MINI BACKPACK,2,10/23/2011 12:08,4.15,16744,United Kingdom
572284,22899,CHILDREN'S APRON DOLLY GIRL ,4,10/23/2011 12:08,2.1,16744,United Kingdom
572284,23291,DOLLY GIRL CHILDRENS CUP,4,10/23/2011 12:08,1.25,16744,United Kingdom
572284,22617,BAKING SET SPACEBOY DESIGN,2,10/23/2011 12:08,4.95,16744,United Kingdom
572284,22273,FELTCRAFT DOLL MOLLY,1,10/23/2011 12:08,2.95,16744,United Kingdom
572284,22274,FELTCRAFT DOLL EMILY,1,10/23/2011 12:08,2.95,16744,United Kingdom
572284,23486,ANTIQUE HEART SHELF UNIT,1,10/23/2011 12:08,16.65,16744,United Kingdom
572284,51014L,"FEATHER PEN,LIGHT PINK",12,10/23/2011 12:08,0.39,16744,United Kingdom
572284,51014A,"FEATHER PEN,HOT PINK",12,10/23/2011 12:08,0.39,16744,United Kingdom
572284,22560,TRADITIONAL MODELLING CLAY,4,10/23/2011 12:08,1.25,16744,United Kingdom
572284,21790,VINTAGE SNAP CARDS,4,10/23/2011 12:08,0.85,16744,United Kingdom
572284,21791,VINTAGE HEADS AND TAILS CARD GAME ,4,10/23/2011 12:08,1.25,16744,United Kingdom
572284,22662,LUNCH BAG DOLLY GIRL DESIGN,6,10/23/2011 12:08,1.65,16744,United Kingdom
572284,22382,LUNCH BAG SPACEBOY DESIGN ,6,10/23/2011 12:08,1.65,16744,United Kingdom
572284,21578,WOODLAND DESIGN  COTTON TOTE BAG,2,10/23/2011 12:08,2.25,16744,United Kingdom
572284,22630,DOLLY GIRL LUNCH BOX,4,10/23/2011 12:08,1.95,16744,United Kingdom
572284,22629,SPACEBOY LUNCH BOX ,4,10/23/2011 12:08,1.95,16744,United Kingdom
572285,22692,DOORMAT WELCOME TO OUR HOME,1,10/23/2011 12:16,8.25,14698,United Kingdom
572285,82484,WOOD BLACK BOARD ANT WHITE FINISH,1,10/23/2011 12:16,7.95,14698,United Kingdom
572285,23541,WALL ART CLASSIC PUDDINGS ,1,10/23/2011 12:16,8.25,14698,United Kingdom
572285,23534,WALL ART STOP FOR TEA ,2,10/23/2011 12:16,5.95,14698,United Kingdom
572285,23093,SMALL PARISIENNE HEART PHOTO FRAME ,2,10/23/2011 12:16,2.49,14698,United Kingdom
572285,23328,SET 6 SCHOOL MILK BOTTLES IN CRATE,1,10/23/2011 12:16,3.75,14698,United Kingdom
572285,84832,ZINC WILLIE WINKIE  CANDLE STICK,8,10/23/2011 12:16,0.85,14698,United Kingdom
572285,23431,NATURAL HANGING QUILTED HEARTS ,12,10/23/2011 12:16,0.83,14698,United Kingdom
572285,21391,FRENCH LAVENDER SCENT HEART,3,10/23/2011 12:16,0.75,14698,United Kingdom
572285,21391,FRENCH LAVENDER SCENT HEART,3,10/23/2011 12:16,0.75,14698,United Kingdom
572285,23354,6 GIFT TAGS 50'S CHRISTMAS ,6,10/23/2011 12:16,0.83,14698,United Kingdom
572285,35970,ZINC FOLKART SLEIGH BELLS,1,10/23/2011 12:16,1.69,14698,United Kingdom
572285,79051A,SMOKEY GREY COLOUR GLASS,16,10/23/2011 12:16,0.29,14698,United Kingdom
572285,23107,WHITE HEARTS WIRE PLANT POT HOLDER,4,10/23/2011 12:16,2.89,14698,United Kingdom
572285,35970,ZINC FOLKART SLEIGH BELLS,3,10/23/2011 12:16,1.69,14698,United Kingdom
572285,22575,METAL MERRY CHRISTMAS WREATH,2,10/23/2011 12:16,1.95,14698,United Kingdom
572285,23328,SET 6 SCHOOL MILK BOTTLES IN CRATE,1,10/23/2011 12:16,3.75,14698,United Kingdom
572285,23352,ROLL WRAP 50'S RED CHRISTMAS ,4,10/23/2011 12:16,1.25,14698,United Kingdom
572285,23351,ROLL WRAP 50'S CHRISTMAS,4,10/23/2011 12:16,1.25,14698,United Kingdom
572285,23360,SET 8 CANDLES VINTAGE DOILY,4,10/23/2011 12:16,1.95,14698,United Kingdom
572286,22500,SET OF 2 TINS JARDIN DE PROVENCE,4,10/23/2011 12:18,4.95,16434,United Kingdom
572286,23378,PACK OF 12 50'S CHRISTMAS TISSUES,12,10/23/2011 12:18,0.39,16434,United Kingdom
572286,23264,SET OF 3 WOODEN SLEIGH DECORATIONS,12,10/23/2011 12:18,1.25,16434,United Kingdom
572286,22219,LOVEBIRD HANGING DECORATION WHITE ,12,10/23/2011 12:18,0.85,16434,United Kingdom
572286,23570,TRADITIONAL PICK UP STICKS GAME ,1,10/23/2011 12:18,1.25,16434,United Kingdom
572286,22557,PLASTERS IN TIN VINTAGE PAISLEY ,1,10/23/2011 12:18,1.65,16434,United Kingdom
572286,22555,PLASTERS IN TIN STRONGMAN,1,10/23/2011 12:18,1.65,16434,United Kingdom
572286,23534,WALL ART STOP FOR TEA ,1,10/23/2011 12:18,5.95,16434,United Kingdom
572286,22739,RIBBON REEL CHRISTMAS SOCK BAUBLE,5,10/23/2011 12:18,1.65,16434,United Kingdom
572286,23503,PLAYING CARDS KEEP CALM & CARRY ON,6,10/23/2011 12:18,1.25,16434,United Kingdom
572286,22774,RED DRAWER KNOB ACRYLIC EDWARDIAN,12,10/23/2011 12:18,1.25,16434,United Kingdom
572286,23266,SET OF 3 WOODEN STOCKING DECORATION,12,10/23/2011 12:18,1.25,16434,United Kingdom
572286,23265,SET OF 3 WOODEN TREE DECORATIONS,12,10/23/2011 12:18,1.25,16434,United Kingdom
572286,21823,PAINTED METAL HEART WITH HOLLY BELL,24,10/23/2011 12:18,0.39,16434,United Kingdom
572286,22800,ANTIQUE TALL SWIRLGLASS TRINKET POT,4,10/23/2011 12:18,3.75,16434,United Kingdom
572286,22798,ANTIQUE GLASS DRESSING TABLE POT,4,10/23/2011 12:18,2.95,16434,United Kingdom
572286,84947,ANTIQUE SILVER TEA GLASS ENGRAVED,6,10/23/2011 12:18,1.25,16434,United Kingdom
572286,23234,BISCUIT TIN VINTAGE CHRISTMAS,6,10/23/2011 12:18,2.89,16434,United Kingdom
572286,23100,SILVER BELLS TABLE DECORATION,12,10/23/2011 12:18,1.25,16434,United Kingdom
572287,48185,DOORMAT FAIRY CAKE,1,10/23/2011 12:26,8.25,15584,United Kingdom
572287,23320,GIANT 50'S CHRISTMAS CRACKER,3,10/23/2011 12:26,2.89,15584,United Kingdom
572287,37446,MINI CAKE STAND WITH HANGING CAKES,4,10/23/2011 12:26,1.45,15584,United Kingdom
572287,23319,BOX OF 6 MINI 50'S CRACKERS,2,10/23/2011 12:26,2.49,15584,United Kingdom
572287,23318,BOX OF 6 MINI VINTAGE CRACKERS,1,10/23/2011 12:26,2.49,15584,United Kingdom
572287,20973,12 PENCIL SMALL TUBE WOODLAND,2,10/23/2011 12:26,0.65,15584,United Kingdom
572287,23156,SET OF 5 MINI GROCERY MAGNETS,1,10/23/2011 12:26,2.08,15584,United Kingdom
572287,23159,SET OF 5 PANCAKE DAY MAGNETS,2,10/23/2011 12:26,2.08,15584,United Kingdom
572287,37340,MULTICOLOUR SPRING FLOWER MUG,6,10/23/2011 12:26,0.39,15584,United Kingdom
572287,22158,3 HEARTS HANGING DECORATION RUSTIC,2,10/23/2011 12:26,2.95,15584,United Kingdom
572287,23311,VINTAGE CHRISTMAS STOCKING ,3,10/23/2011 12:26,2.55,15584,United Kingdom
572287,23313,VINTAGE CHRISTMAS BUNTING,3,10/23/2011 12:26,4.95,15584,United Kingdom
572287,20724,RED RETROSPOT CHARLOTTE BAG,2,10/23/2011 12:26,0.85,15584,United Kingdom
572287,84879,ASSORTED COLOUR BIRD ORNAMENT,8,10/23/2011 12:26,1.69,15584,United Kingdom
572287,22086,PAPER CHAIN KIT 50'S CHRISTMAS ,2,10/23/2011 12:26,2.95,15584,United Kingdom
572287,22911,PAPER CHAIN KIT LONDON,2,10/23/2011 12:26,2.95,15584,United Kingdom
572287,85049E,SCANDINAVIAN REDS RIBBONS,2,10/23/2011 12:26,1.25,15584,United Kingdom
572287,22909,SET OF 20 VINTAGE CHRISTMAS NAPKINS,3,10/23/2011 12:26,0.85,15584,United Kingdom
572287,23170,REGENCY TEA PLATE ROSES ,12,10/23/2011 12:26,1.65,15584,United Kingdom
572287,23048,SET OF 10 LANTERNS FAIRY LIGHT STAR,2,10/23/2011 12:26,4.15,15584,United Kingdom
572287,23013,GLASS APOTHECARY BOTTLE TONIC,1,10/23/2011 12:26,3.95,15584,United Kingdom
572287,23012,GLASS APOTHECARY BOTTLE PERFUME,1,10/23/2011 12:26,3.95,15584,United Kingdom
572287,22810,SET OF 6 T-LIGHTS SNOWMEN,6,10/23/2011 12:26,2.95,15584,United Kingdom
572287,22799,SWEETHEART WIRE FRUIT BOWL,1,10/23/2011 12:26,8.5,15584,United Kingdom
572287,22776,SWEETHEART 3 TIER CAKE STAND ,1,10/23/2011 12:26,9.95,15584,United Kingdom
572287,23161,REGENCY CAKE FORK,12,10/23/2011 12:26,1.25,15584,United Kingdom
572287,23249,VINTAGE RED ENAMEL TRIM PLATE,3,10/23/2011 12:26,1.65,15584,United Kingdom
572287,23487,SWEET HEART CAKE CARRIER,1,10/23/2011 12:26,9.95,15584,United Kingdom
572287,23250,VINTAGE RED TRIM ENAMEL BOWL ,4,10/23/2011 12:26,1.25,15584,United Kingdom
572287,21328,BALLOONS  WRITING SET ,2,10/23/2011 12:26,1.65,15584,United Kingdom
572287,72818,CHRISTMAS DECOUPAGE CANDLE,12,10/23/2011 12:26,0.39,15584,United Kingdom
572287,22809,SET OF 6 T-LIGHTS SANTA,6,10/23/2011 12:26,2.95,15584,United Kingdom
572287,22186,RED STAR CARD HOLDER,1,10/23/2011 12:26,1.95,15584,United Kingdom
572287,23252,VINTAGE RED ENAMEL TRIM JUG ,1,10/23/2011 12:26,3.75,15584,United Kingdom
572287,23133,LARGE IVORY HEART WALL ORGANISER,2,10/23/2011 12:26,8.25,15584,United Kingdom
572287,84006,MAGIC TREE -PAPER FLOWERS,3,10/23/2011 12:26,0.85,15584,United Kingdom
572287,23486,ANTIQUE HEART SHELF UNIT,1,10/23/2011 12:26,16.65,15584,United Kingdom
572287,21034,REX CASH+CARRY JUMBO SHOPPER,1,10/23/2011 12:26,0.95,15584,United Kingdom
572287,22424,ENAMEL BREAD BIN CREAM,1,10/23/2011 12:26,12.75,15584,United Kingdom
572288,22960,JAM MAKING SET WITH JARS,1,10/23/2011 12:28,4.25,17377,United Kingdom
572288,22963,JAM JAR WITH GREEN LID,2,10/23/2011 12:28,0.85,17377,United Kingdom
572288,22962,JAM JAR WITH PINK LID,2,10/23/2011 12:28,0.85,17377,United Kingdom
572288,22766,PHOTO FRAME CORNICE,1,10/23/2011 12:28,2.95,17377,United Kingdom
572288,22111,SCOTTIE DOG HOT WATER BOTTLE,2,10/23/2011 12:28,4.95,17377,United Kingdom
572288,23355,HOT WATER BOTTLE KEEP CALM,2,10/23/2011 12:28,4.95,17377,United Kingdom
572288,21485,RETROSPOT HEART HOT WATER BOTTLE,2,10/23/2011 12:28,4.95,17377,United Kingdom
572288,23354,6 GIFT TAGS 50'S CHRISTMAS ,2,10/23/2011 12:28,0.83,17377,United Kingdom
572288,22979,PANTRY WASHING UP BRUSH,1,10/23/2011 12:28,1.45,17377,United Kingdom
572288,22980,PANTRY SCRUBBING BRUSH,1,10/23/2011 12:28,1.65,17377,United Kingdom
572288,85099B,JUMBO BAG RED RETROSPOT,2,10/23/2011 12:28,2.08,17377,United Kingdom
572288,23298,SPOTTY BUNTING,4,10/23/2011 12:28,4.95,17377,United Kingdom
572288,23356,LOVE HOT WATER BOTTLE,3,10/23/2011 12:28,5.95,17377,United Kingdom
572288,23355,HOT WATER BOTTLE KEEP CALM,5,10/23/2011 12:28,4.95,17377,United Kingdom
572288,21621,VINTAGE UNION JACK BUNTING,5,10/23/2011 12:28,8.5,17377,United Kingdom
572288,47566B,TEA TIME PARTY BUNTING,5,10/23/2011 12:28,4.95,17377,United Kingdom
572288,22023,EMPIRE BIRTHDAY CARD,12,10/23/2011 12:28,0.42,17377,United Kingdom
572288,22712,CARD DOLLY GIRL ,12,10/23/2011 12:28,0.42,17377,United Kingdom
572288,22024,RAINY LADIES BIRTHDAY CARD,12,10/23/2011 12:28,0.42,17377,United Kingdom
572288,22028,PENNY FARTHING BIRTHDAY CARD,12,10/23/2011 12:28,0.42,17377,United Kingdom
572288,22983,CARD BILLBOARD FONT,12,10/23/2011 12:28,0.42,17377,United Kingdom
572289,23320,GIANT 50'S CHRISTMAS CRACKER,2,10/23/2011 12:37,2.89,13782,United Kingdom
572289,23469,CARD HOLDER LOVE BIRD SMALL,2,10/23/2011 12:37,4.15,13782,United Kingdom
572289,21773,DECORATIVE ROSE BATHROOM BOTTLE,1,10/23/2011 12:37,1.25,13782,United Kingdom
572289,21775,DECORATIVE FLORE BATHROOM BOTTLE,1,10/23/2011 12:37,1.25,13782,United Kingdom
572289,85123A,WHITE HANGING HEART T-LIGHT HOLDER,2,10/23/2011 12:37,2.95,13782,United Kingdom
572289,21733,RED HANGING HEART T-LIGHT HOLDER,2,10/23/2011 12:37,2.95,13782,United Kingdom
572289,21175,GIN + TONIC DIET METAL SIGN,2,10/23/2011 12:37,2.55,13782,United Kingdom
572289,21774,DECORATIVE CATS BATHROOM BOTTLE,1,10/23/2011 12:37,1.25,13782,United Kingdom
572289,21351,CINAMMON & ORANGE WREATH,1,10/23/2011 12:37,6.75,13782,United Kingdom
572289,23274,STAR T-LIGHT HOLDER WILLIE WINKIE,2,10/23/2011 12:37,1.65,13782,United Kingdom
572289,23272,TREE T-LIGHT HOLDER WILLIE WINKIE,2,10/23/2011 12:37,1.65,13782,United Kingdom
572289,23273,HEART T-LIGHT HOLDER WILLIE WINKIE,2,10/23/2011 12:37,1.65,13782,United Kingdom
572289,85184C,SET 4 VALENTINE DECOUPAGE HEART BOX,2,10/23/2011 12:37,2.95,13782,United Kingdom
572289,23418,LAVENDER TOILETTE BOTTLE,2,10/23/2011 12:37,2.08,13782,United Kingdom
572289,23089,GLASS BON BON JAR,2,10/23/2011 12:37,1.95,13782,United Kingdom
572289,21288,STRIPEY CHOCOLATE NESTING BOXES,2,10/23/2011 12:37,2.95,13782,United Kingdom
572289,22766,PHOTO FRAME CORNICE,2,10/23/2011 12:37,2.95,13782,United Kingdom
572289,84970S,HANGING HEART ZINC T-LIGHT HOLDER,12,10/23/2011 12:37,0.85,13782,United Kingdom
572289,22798,ANTIQUE GLASS DRESSING TABLE POT,2,10/23/2011 12:37,2.95,13782,United Kingdom
572289,23090,VINTAGE GLASS T-LIGHT HOLDER,12,10/23/2011 12:37,0.83,13782,United Kingdom
572289,23169,CLASSIC GLASS COOKIE JAR,2,10/23/2011 12:37,4.15,13782,United Kingdom
572290,22491,PACK OF 12 COLOURED PENCILS,12,10/23/2011 12:46,0.85,14800,United Kingdom
572290,22983,CARD BILLBOARD FONT,12,10/23/2011 12:46,0.42,14800,United Kingdom
572290,22029,SPACEBOY BIRTHDAY CARD,12,10/23/2011 12:46,0.42,14800,United Kingdom
572290,22712,CARD DOLLY GIRL ,12,10/23/2011 12:46,0.42,14800,United Kingdom
572290,23280,FOLDING BUTTERFLY MIRROR HOT PINK ,1,10/23/2011 12:46,0.83,14800,United Kingdom
572290,22865,HAND WARMER OWL DESIGN,3,10/23/2011 12:46,2.1,14800,United Kingdom
572290,23439,HAND WARMER RED LOVE HEART,3,10/23/2011 12:46,2.1,14800,United Kingdom
572290,22866,HAND WARMER SCOTTY DOG DESIGN,2,10/23/2011 12:46,2.1,14800,United Kingdom
572290,22633,HAND WARMER UNION JACK,4,10/23/2011 12:46,2.1,14800,United Kingdom
572290,23501,KEY RING BASEBALL BOOT UNION JACK,20,10/23/2011 12:46,1.25,14800,United Kingdom
572290,23500,KEY RING BASEBALL BOOT ASSORTED ,40,10/23/2011 12:46,1.25,14800,United Kingdom
572290,23390,DOLLY GIRL MINI BACKPACK,2,10/23/2011 12:46,4.15,14800,United Kingdom
572290,23389,SPACEBOY MINI BACKPACK,2,10/23/2011 12:46,4.15,14800,United Kingdom
572290,82616C,MIDNIGHT GLAMOUR SCARF KNITTING KIT,1,10/23/2011 12:46,1.25,14800,United Kingdom
572290,21875,KINGS CHOICE MUG,1,10/23/2011 12:46,1.25,14800,United Kingdom
572290,21871,SAVE THE PLANET MUG,1,10/23/2011 12:46,1.65,14800,United Kingdom
572290,22659,LUNCH BOX I LOVE LONDON,6,10/23/2011 12:46,1.95,14800,United Kingdom
572290,47599A,PINK PARTY BAGS,3,10/23/2011 12:46,2.1,14800,United Kingdom
572290,47599B,BLUE PARTY BAGS ,2,10/23/2011 12:46,2.1,14800,United Kingdom
572290,22530,MAGIC DRAWING SLATE DOLLY GIRL ,15,10/23/2011 12:46,0.42,14800,United Kingdom
572290,22534,MAGIC DRAWING SLATE SPACEBOY ,12,10/23/2011 12:46,0.42,14800,United Kingdom
572290,23506,MINI PLAYING CARDS SPACEBOY ,12,10/23/2011 12:46,0.42,14800,United Kingdom
572290,23508,MINI PLAYING CARDS DOLLY GIRL ,15,10/23/2011 12:46,0.42,14800,United Kingdom
572290,22998,TRAVEL CARD WALLET KEEP CALM,24,10/23/2011 12:46,0.42,14800,United Kingdom
572290,23284,DOORMAT KEEP CALM AND COME IN,1,10/23/2011 12:46,8.25,14800,United Kingdom
572290,85124C,GREEN JUICY FRUIT PHOTO FRAME,1,10/23/2011 12:46,2.55,14800,United Kingdom
572290,23558,LANDMARK FRAME LONDON BRIDGE ,2,10/23/2011 12:46,12.5,14800,United Kingdom
572290,23557,LANDMARK FRAME BAKER STREET ,2,10/23/2011 12:46,12.5,14800,United Kingdom
572290,23554,LANDMARK FRAME OXFORD STREET,2,10/23/2011 12:46,12.5,14800,United Kingdom
572290,23555,LANDMARK FRAME NOTTING HILL ,2,10/23/2011 12:46,12.5,14800,United Kingdom
572290,23556,LANDMARK FRAME COVENT GARDEN ,2,10/23/2011 12:46,12.5,14800,United Kingdom
572290,20970,PINK FLORAL FELTCRAFT SHOULDER BAG,6,10/23/2011 12:46,3.75,14800,United Kingdom
572290,22985,WRAP BILLBOARD FONTS DESIGN,25,10/23/2011 12:46,0.42,14800,United Kingdom
572290,22708,WRAP DOLLY GIRL,25,10/23/2011 12:46,0.42,14800,United Kingdom
572290,22045,SPACEBOY GIFT WRAP,25,10/23/2011 12:46,0.42,14800,United Kingdom
572291,22598,CHRISTMAS MUSICAL ZINC TREE,3,10/23/2011 12:46,0.29,16931,United Kingdom
572291,23199,JUMBO BAG APPLES,2,10/23/2011 12:46,2.08,16931,United Kingdom
572291,85123A,WHITE HANGING HEART T-LIGHT HOLDER,6,10/23/2011 12:46,2.95,16931,United Kingdom
572291,85038,6 CHOCOLATE LOVE HEART T-LIGHTS,6,10/23/2011 12:46,2.1,16931,United Kingdom
572291,47518F,ICON PLACEMAT POP ART ELVIS,1,10/23/2011 12:46,0.12,16931,United Kingdom
572291,22625,RED KITCHEN SCALES,1,10/23/2011 12:46,8.5,16931,United Kingdom
572291,22627,MINT KITCHEN SCALES,1,10/23/2011 12:46,8.5,16931,United Kingdom
572291,22624,IVORY KITCHEN SCALES,2,10/23/2011 12:46,8.5,16931,United Kingdom
572291,23354,6 GIFT TAGS 50'S CHRISTMAS ,6,10/23/2011 12:46,0.83,16931,United Kingdom
572291,21823,PAINTED METAL HEART WITH HOLLY BELL,6,10/23/2011 12:46,0.39,16931,United Kingdom
572291,21824,PAINTED METAL STAR WITH HOLLY BELLS,6,10/23/2011 12:46,0.39,16931,United Kingdom
572291,22577,WOODEN HEART CHRISTMAS SCANDINAVIAN,3,10/23/2011 12:46,0.29,16931,United Kingdom
572291,22581,WOOD STOCKING CHRISTMAS SCANDISPOT,3,10/23/2011 12:46,0.85,16931,United Kingdom
572291,22335,HEART DECORATION PAINTED ZINC ,6,10/23/2011 12:46,0.65,16931,United Kingdom
572291,22339,CHRISTMAS TREE PAINTED ZINC ,6,10/23/2011 12:46,0.19,16931,United Kingdom
572291,22338,STAR DECORATION PAINTED ZINC ,6,10/23/2011 12:46,0.19,16931,United Kingdom
572291,23342,MINT DINER WALL CLOCK,1,10/23/2011 12:46,8.5,16931,United Kingdom
572291,22193,RED DINER WALL CLOCK,1,10/23/2011 12:46,8.5,16931,United Kingdom
572291,22191,IVORY DINER WALL CLOCK,1,10/23/2011 12:46,8.5,16931,United Kingdom
572291,22599,CHRISTMAS MUSICAL ZINC STAR,6,10/23/2011 12:46,0.29,16931,United Kingdom
572291,22598,CHRISTMAS MUSICAL ZINC TREE,3,10/23/2011 12:46,0.29,16931,United Kingdom
572291,23088,ZINC HEART FLOWER T-LIGHT HOLDER,6,10/23/2011 12:46,1.25,16931,United Kingdom
572291,23272,TREE T-LIGHT HOLDER WILLIE WINKIE,3,10/23/2011 12:46,1.65,16931,United Kingdom
572291,23273,HEART T-LIGHT HOLDER WILLIE WINKIE,3,10/23/2011 12:46,1.65,16931,United Kingdom
572291,23274,STAR T-LIGHT HOLDER WILLIE WINKIE,3,10/23/2011 12:46,1.65,16931,United Kingdom
572291,23265,SET OF 3 WOODEN TREE DECORATIONS,1,10/23/2011 12:46,1.25,16931,United Kingdom
572291,23263,SET OF 3 WOODEN HEART DECORATIONS,1,10/23/2011 12:46,1.25,16931,United Kingdom
572291,23266,SET OF 3 WOODEN STOCKING DECORATION,1,10/23/2011 12:46,1.25,16931,United Kingdom
572291,23264,SET OF 3 WOODEN SLEIGH DECORATIONS,1,10/23/2011 12:46,1.25,16931,United Kingdom
572291,23501,KEY RING BASEBALL BOOT UNION JACK,6,10/23/2011 12:46,1.25,16931,United Kingdom
572291,23469,CARD HOLDER LOVE BIRD SMALL,1,10/23/2011 12:46,4.15,16931,United Kingdom
572291,23148,MINIATURE ANTIQUE ROSE HOOK IVORY,6,10/23/2011 12:46,0.83,16931,United Kingdom
572291,22728,ALARM CLOCK BAKELIKE PINK,3,10/23/2011 12:46,3.75,16931,United Kingdom
572291,22730,ALARM CLOCK BAKELIKE IVORY,3,10/23/2011 12:46,3.75,16931,United Kingdom
572291,84347,ROTATING SILVER ANGELS T-LIGHT HLDR,6,10/23/2011 12:46,2.55,16931,United Kingdom
572291,23147,SINGLE ANTIQUE ROSE HOOK IVORY,3,10/23/2011 12:46,1.45,16931,United Kingdom
572291,20754,RETROSPOT RED WASHING UP GLOVES,3,10/23/2011 12:46,2.1,16931,United Kingdom
572291,22560,TRADITIONAL MODELLING CLAY,6,10/23/2011 12:46,1.25,16931,United Kingdom
572291,23437, 50'S CHRISTMAS GIFT BAG LARGE,6,10/23/2011 12:46,1.25,16931,United Kingdom
572291,23375,50'S CHRISTMAS PAPER GIFT BAG,6,10/23/2011 12:46,0.82,16931,United Kingdom
572291,23131,MISTLETOE HEART WREATH CREAM,1,10/23/2011 12:46,4.15,16931,United Kingdom
572291,22812,PACK 3 BOXES CHRISTMAS PANNETONE,3,10/23/2011 12:46,1.95,16931,United Kingdom
572291,37413,ICON MUG REVOLUTIONARY,4,10/23/2011 12:46,0.39,16931,United Kingdom
572291,23320,GIANT 50'S CHRISTMAS CRACKER,1,10/23/2011 12:46,2.89,16931,United Kingdom
572291,22086,PAPER CHAIN KIT 50'S CHRISTMAS ,1,10/23/2011 12:46,2.95,16931,United Kingdom
572291,23319,BOX OF 6 MINI 50'S CRACKERS,3,10/23/2011 12:46,2.49,16931,United Kingdom
572291,23351,ROLL WRAP 50'S CHRISTMAS,12,10/23/2011 12:46,1.25,16931,United Kingdom
572291,23555,LANDMARK FRAME NOTTING HILL ,1,10/23/2011 12:46,12.5,16931,United Kingdom
572291,23553,LANDMARK FRAME CAMDEN TOWN ,1,10/23/2011 12:46,12.5,16931,United Kingdom
572291,23344,JUMBO BAG 50'S CHRISTMAS ,3,10/23/2011 12:46,2.08,16931,United Kingdom
572292,22469,HEART OF WICKER SMALL,6,10/23/2011 12:56,1.65,16017,United Kingdom
572292,22470,HEART OF WICKER LARGE,3,10/23/2011 12:56,2.95,16017,United Kingdom
572292,85049E,SCANDINAVIAN REDS RIBBONS,2,10/23/2011 12:56,1.25,16017,United Kingdom
572292,85049A,TRADITIONAL CHRISTMAS RIBBONS,6,10/23/2011 12:56,1.25,16017,United Kingdom
572292,85049E,SCANDINAVIAN REDS RIBBONS,5,10/23/2011 12:56,1.25,16017,United Kingdom
572292,22866,HAND WARMER SCOTTY DOG DESIGN,1,10/23/2011 12:56,2.1,16017,United Kingdom
572292,22633,HAND WARMER UNION JACK,1,10/23/2011 12:56,2.1,16017,United Kingdom
572292,23515,EMBROIDERED RIBBON REEL DAISY ,3,10/23/2011 12:56,2.08,16017,United Kingdom
572292,23513,EMBROIDERED RIBBON REEL SUSIE ,3,10/23/2011 12:56,2.08,16017,United Kingdom
572292,23518,EMBROIDERED RIBBON REEL RACHEL ,3,10/23/2011 12:56,2.89,16017,United Kingdom
572292,23579,SNACK TRAY I LOVE LONDON,3,10/23/2011 12:56,1.95,16017,United Kingdom
572292,23226,FILIGREE HEART DAISY WHITE,1,10/23/2011 12:56,1.25,16017,United Kingdom
572292,23226,FILIGREE HEART DAISY WHITE,6,10/23/2011 12:56,1.25,16017,United Kingdom
572292,22079,RIBBON REEL HEARTS DESIGN ,5,10/23/2011 12:56,1.65,16017,United Kingdom
572292,22479,DAISY GARDEN MARKER,10,10/23/2011 12:56,1.25,16017,United Kingdom
572292,84974,S/2 ZINC HEART DESIGN PLANTERS,2,10/23/2011 12:56,9.95,16017,United Kingdom
572292,23462,ROCOCO WALL MIRROR WHITE,1,10/23/2011 12:56,19.95,16017,United Kingdom
572292,22866,HAND WARMER SCOTTY DOG DESIGN,2,10/23/2011 12:56,2.1,16017,United Kingdom
572292,22633,HAND WARMER UNION JACK,2,10/23/2011 12:56,2.1,16017,United Kingdom
572292,22632,HAND WARMER RED RETROSPOT,3,10/23/2011 12:56,2.1,16017,United Kingdom
572292,23106,ZINC HEARTS PLANT POT HOLDER,2,10/23/2011 12:56,2.89,16017,United Kingdom
572292,23107,WHITE HEARTS WIRE PLANT POT HOLDER,2,10/23/2011 12:56,2.89,16017,United Kingdom
572292,23439,HAND WARMER RED LOVE HEART,4,10/23/2011 12:56,2.1,16017,United Kingdom
572292,23439,HAND WARMER RED LOVE HEART,2,10/23/2011 12:56,2.1,16017,United Kingdom
572292,22866,HAND WARMER SCOTTY DOG DESIGN,3,10/23/2011 12:56,2.1,16017,United Kingdom
572292,85049H,URBAN BLACK RIBBONS ,3,10/23/2011 12:56,1.25,16017,United Kingdom
572292,85049G,CHOCOLATE BOX RIBBONS ,3,10/23/2011 12:56,1.25,16017,United Kingdom
572292,85049C,ROMANTIC PINKS RIBBONS ,3,10/23/2011 12:56,1.25,16017,United Kingdom
572292,22074,6 RIBBONS SHIMMERING PINKS ,3,10/23/2011 12:56,1.65,16017,United Kingdom
572292,21135,VICTORIAN  METAL POSTCARD SPRING,3,10/23/2011 12:56,1.69,16017,United Kingdom
572292,23302,KNEELING MAT HOUSEWORK  DESIGN,3,10/23/2011 12:56,1.65,16017,United Kingdom
572292,23301,GARDENERS KNEELING PAD KEEP CALM ,3,10/23/2011 12:56,1.65,16017,United Kingdom
572293,M,Manual,1,10/23/2011 13:02,50,12748,United Kingdom
572294,22557,PLASTERS IN TIN VINTAGE PAISLEY ,5,10/23/2011 13:10,1.65,13471,United Kingdom
572294,23078,ICE CREAM PEN LIP GLOSS ,20,10/23/2011 13:10,1.25,13471,United Kingdom
572294,23077,DOUGHNUT LIP GLOSS ,20,10/23/2011 13:10,1.25,13471,United Kingdom
572294,85014B,RED RETROSPOT UMBRELLA,4,10/23/2011 13:10,5.95,13471,United Kingdom
572294,20682,RED RETROSPOT CHILDRENS UMBRELLA,5,10/23/2011 13:10,3.25,13471,United Kingdom
572294,22384,LUNCH BAG PINK POLKADOT,10,10/23/2011 13:10,1.65,13471,United Kingdom
572294,20727,LUNCH BAG  BLACK SKULL.,10,10/23/2011 13:10,1.65,13471,United Kingdom
572294,22111,SCOTTIE DOG HOT WATER BOTTLE,3,10/23/2011 13:10,4.95,13471,United Kingdom
572294,22835,HOT WATER BOTTLE I AM SO POORLY,3,10/23/2011 13:10,4.95,13471,United Kingdom
572294,22114,HOT WATER BOTTLE TEA AND SYMPATHY,2,10/23/2011 13:10,4.25,13471,United Kingdom
572294,84030E,ENGLISH ROSE HOT WATER BOTTLE,2,10/23/2011 13:10,4.25,13471,United Kingdom
572294,21485,RETROSPOT HEART HOT WATER BOTTLE,2,10/23/2011 13:10,4.95,13471,United Kingdom
572294,22112,CHOCOLATE HOT WATER BOTTLE,2,10/23/2011 13:10,4.95,13471,United Kingdom
572294,23209,LUNCH BAG VINTAGE DOILY ,5,10/23/2011 13:10,1.65,13471,United Kingdom
572294,22377,BOTTLE BAG RETROSPOT ,10,10/23/2011 13:10,2.1,13471,United Kingdom
572294,22951,60 CAKE CASES DOLLY GIRL DESIGN,24,10/23/2011 13:10,0.55,13471,United Kingdom
572294,21212,PACK OF 72 RETROSPOT CAKE CASES,24,10/23/2011 13:10,0.55,13471,United Kingdom
572294,22567,20 DOLLY PEGS RETROSPOT,4,10/23/2011 13:10,1.45,13471,United Kingdom
