536836,22197,SMALL POPCORN HOLDER,2,12/2/2010 18:08,0.85,18168,United Kingdom
536836,22633,HAND WARMER UNION JACK,4,12/2/2010 18:08,2.1,18168,United Kingdom
536836,22180,RETROSPOT LAMP,1,12/2/2010 18:08,9.95,18168,United Kingdom
536836,21218,RED SPOTTY BISCUIT TIN,2,12/2/2010 18:08,3.75,18168,United Kingdom
536836,21155,RED RETROSPOT PEG BAG,1,12/2/2010 18:08,2.1,18168,United Kingdom
536836,21039,RED RETROSPOT SHOPPING BAG,1,12/2/2010 18:08,2.55,18168,United Kingdom
536836,21157,RED RETROSPOT WASHBAG,1,12/2/2010 18:08,2.1,18168,United Kingdom
536836,21041,RED RETROSPOT OVEN GLOVE DOUBLE,1,12/2/2010 18:08,2.95,18168,United Kingdom
536836,21154,RED RETROSPOT OVEN GLOVE ,1,12/2/2010 18:08,1.25,18168,United Kingdom
536836,21154,RED RETROSPOT OVEN GLOVE ,2,12/2/2010 18:08,1.25,18168,United Kingdom
536836,21035,SET/2 RED RETROSPOT TEA TOWELS ,1,12/2/2010 18:08,2.95,18168,United Kingdom
536836,47570B,TEA TIME TABLE CLOTH,1,12/2/2010 18:08,10.65,18168,United Kingdom
536836,47567B,TEA TIME KITCHEN APRON,2,12/2/2010 18:08,5.95,18168,United Kingdom
536836,47559B,TEA TIME OVEN GLOVE,6,12/2/2010 18:08,1.25,18168,United Kingdom
536836,22193,RED DINER WALL CLOCK,1,12/2/2010 18:08,8.5,18168,United Kingdom
536836,22649,STRAWBERRY FAIRY CAKE TEAPOT,1,12/2/2010 18:08,4.95,18168,United Kingdom
536836,16156S,WRAP PINK FAIRY CAKES ,25,12/2/2010 18:08,0.42,18168,United Kingdom
536836,16161P,WRAP ENGLISH ROSE ,25,12/2/2010 18:08,0.42,18168,United Kingdom
536837,82486,WOOD S/3 CABINET ANT WHITE FINISH,2,12/2/2010 18:15,7.95,14395,United Kingdom
536837,82483,WOOD 2 DRAWER CABINET WHITE FINISH,4,12/2/2010 18:15,5.95,14395,United Kingdom
536837,82482,WOODEN PICTURE FRAME WHITE FINISH,6,12/2/2010 18:15,2.55,14395,United Kingdom
536837,21754,HOME BUILDING BLOCK WORD,3,12/2/2010 18:15,5.95,14395,United Kingdom
536837,21755,LOVE BUILDING BLOCK WORD,3,12/2/2010 18:15,5.95,14395,United Kingdom
536837,82494L,WOODEN FRAME ANTIQUE WHITE ,4,12/2/2010 18:15,2.95,14395,United Kingdom
536837,22171,3 HOOK PHOTO SHELF ANTIQUE WHITE,2,12/2/2010 18:15,8.5,14395,United Kingdom
536837,16161M,WRAP  PINK FLOCK,25,12/2/2010 18:15,0.42,14395,United Kingdom
536837,22112,CHOCOLATE HOT WATER BOTTLE,7,12/2/2010 18:15,4.95,14395,United Kingdom
536837,21980,PACK OF 12 RED RETROSPOT TISSUES ,12,12/2/2010 18:15,0.29,14395,United Kingdom
536837,21486,PINK HEART DOTS HOT WATER BOTTLE,3,12/2/2010 18:15,3.75,14395,United Kingdom
536837,20972,PINK CREAM FELT CRAFT TRINKET BOX ,6,12/2/2010 18:15,1.25,14395,United Kingdom
536837,22114,HOT WATER BOTTLE TEA AND SYMPATHY,4,12/2/2010 18:15,3.95,14395,United Kingdom
536837,22144,CHRISTMAS CRAFT LITTLE FRIENDS,2,12/2/2010 18:15,2.1,14395,United Kingdom
536837,22865,HAND WARMER OWL DESIGN,1,12/2/2010 18:15,2.1,14395,United Kingdom
536837,22633,HAND WARMER UNION JACK,4,12/2/2010 18:15,2.1,14395,United Kingdom
536837,22470,HEART OF WICKER LARGE,3,12/2/2010 18:15,2.95,14395,United Kingdom
536837,22632,HAND WARMER RED RETROSPOT,4,12/2/2010 18:15,2.1,14395,United Kingdom
536837,85049A,TRADITIONAL CHRISTMAS RIBBONS,6,12/2/2010 18:15,1.25,14395,United Kingdom
536837,20984,12 PENCILS TALL TUBE POSY,5,12/2/2010 18:15,0.85,14395,United Kingdom
536837,85214,TUB 24 PINK FLOWER PEGS,1,12/2/2010 18:15,1.65,14395,United Kingdom
536837,22804,CANDLEHOLDER PINK HANGING HEART,2,12/2/2010 18:15,2.95,14395,United Kingdom
536837,20981,12 PENCILS TALL TUBE WOODLAND,5,12/2/2010 18:15,0.85,14395,United Kingdom
536837,22173,METAL 4 HOOK HANGER FRENCH CHATEAU,8,12/2/2010 18:15,2.95,14395,United Kingdom
536837,85123A,WHITE HANGING HEART T-LIGHT HOLDER,2,12/2/2010 18:15,2.95,14395,United Kingdom
536837,21499,BLUE POLKADOT WRAP,25,12/2/2010 18:15,0.42,14395,United Kingdom
536837,21500,PINK POLKADOT WRAP ,25,12/2/2010 18:15,0.42,14395,United Kingdom
536838,15036,ASSORTED COLOURS SILK FAN,24,12/2/2010 18:23,0.75,14865,United Kingdom
536838,72232,FENG SHUI PILLAR CANDLE,48,12/2/2010 18:23,0.19,14865,United Kingdom
536838,40016,CHINESE DRAGON PAPER LANTERNS,24,12/2/2010 18:23,0.42,14865,United Kingdom
536839,84077,WORLD WAR 2 GLIDERS ASSTD DESIGNS,288,12/2/2010 18:25,0.21,15093,United Kingdom
536839,20685,DOORMAT RED RETROSPOT,5,12/2/2010 18:25,7.95,15093,United Kingdom
536839,21524,DOORMAT SPOTTY HOME SWEET HOME,10,12/2/2010 18:25,6.75,15093,United Kingdom
536839,21916,SET 12 RETRO WHITE CHALK STICKS,24,12/2/2010 18:25,0.42,15093,United Kingdom
536839,21508,VINTAGE KID DOLLY CARD ,12,12/2/2010 18:25,0.42,15093,United Kingdom
536839,22027,TEA PARTY BIRTHDAY CARD,12,12/2/2010 18:25,0.42,15093,United Kingdom
536839,22030,SWALLOWS GREETING CARD,36,12/2/2010 18:25,0.42,15093,United Kingdom
536839,22029,SPACEBOY BIRTHDAY CARD,36,12/2/2010 18:25,0.42,15093,United Kingdom
536839,21519,GIN & TONIC DIET GREETING CARD ,36,12/2/2010 18:25,0.42,15093,United Kingdom
536839,21506,"FANCY FONT BIRTHDAY CARD, ",24,12/2/2010 18:25,0.42,15093,United Kingdom
536839,22023,EMPIRE BIRTHDAY CARD,24,12/2/2010 18:25,0.42,15093,United Kingdom
536839,21507,"ELEPHANT, BIRTHDAY CARD, ",36,12/2/2010 18:25,0.42,15093,United Kingdom
536839,84247G,"DECOUPAGE,GREETING CARD,",48,12/2/2010 18:25,0.42,15093,United Kingdom
536839,21509,COWBOYS AND INDIANS BIRTHDAY CARD ,48,12/2/2010 18:25,0.42,15093,United Kingdom
536839,84879,ASSORTED COLOUR BIRD ORNAMENT,96,12/2/2010 18:25,1.69,15093,United Kingdom
536839,22585,PACK OF 6 BIRDY GIFT TAGS,144,12/2/2010 18:25,1.06,15093,United Kingdom
536840,22961,JAM MAKING SET PRINTED,12,12/2/2010 18:27,1.45,12738,Germany
536840,22962,JAM JAR WITH PINK LID,12,12/2/2010 18:27,0.85,12738,Germany
536840,22963,JAM JAR WITH GREEN LID,12,12/2/2010 18:27,0.85,12738,Germany
536840,22776,SWEETHEART CAKESTAND 3 TIER,1,12/2/2010 18:27,9.95,12738,Germany
536840,22952,60 CAKE CASES VINTAGE CHRISTMAS,24,12/2/2010 18:27,0.55,12738,Germany
536840,22077,6 RIBBONS RUSTIC CHARM,12,12/2/2010 18:27,1.65,12738,Germany
536840,22215,CAKE STAND WHITE TWO TIER LACE,2,12/2/2010 18:27,8.5,12738,Germany
536840,21977,PACK OF 60 PINK PAISLEY CAKE CASES,24,12/2/2010 18:27,0.55,12738,Germany
536840,84991,60 TEATIME FAIRY CAKE CASES,24,12/2/2010 18:27,0.55,12738,Germany
536840,21212,PACK OF 72 RETROSPOT CAKE CASES,24,12/2/2010 18:27,0.55,12738,Germany
536840,POST,POSTAGE,1,12/2/2010 18:27,18,12738,Germany
536841,22766,PHOTO FRAME CORNICE,8,12/2/2010 18:27,2.95,16150,United Kingdom
536841,22768,FAMILY PHOTO FRAME CORNICE,4,12/2/2010 18:27,9.95,16150,United Kingdom
536841,21260,FIRST AID TIN,6,12/2/2010 18:27,3.25,16150,United Kingdom
536841,22169,FAMILY ALBUM WHITE PICTURE FRAME,2,12/2/2010 18:27,8.5,16150,United Kingdom
536841,84879,ASSORTED COLOUR BIRD ORNAMENT,8,12/2/2010 18:27,1.69,16150,United Kingdom
536841,22171,3 HOOK PHOTO SHELF ANTIQUE WHITE,2,12/2/2010 18:27,8.5,16150,United Kingdom
536841,22170,PICTURE FRAME WOOD TRIPLE PORTRAIT,4,12/2/2010 18:27,6.75,16150,United Kingdom
536841,22470,HEART OF WICKER LARGE,6,12/2/2010 18:27,2.95,16150,United Kingdom
536841,22469,HEART OF WICKER SMALL,12,12/2/2010 18:27,1.65,16150,United Kingdom
536841,22969,HOMEMADE JAM SCENTED CANDLES,12,12/2/2010 18:27,1.45,16150,United Kingdom
536841,22771,CLEAR DRAWER KNOB ACRYLIC EDWARDIAN,12,12/2/2010 18:27,1.25,16150,United Kingdom
536841,22772,PINK DRAWER KNOB ACRYLIC EDWARDIAN,12,12/2/2010 18:27,1.25,16150,United Kingdom
536841,22775,PURPLE DRAWERKNOB ACRYLIC EDWARDIAN,12,12/2/2010 18:27,1.25,16150,United Kingdom
536841,21428,SET3 BOOK BOX GREEN GINGHAM FLOWER ,4,12/2/2010 18:27,4.25,16150,United Kingdom
536841,21429,RED GINGHAM ROSE JEWELLERY BOX,8,12/2/2010 18:27,1.65,16150,United Kingdom
536841,21430,SET/3 RED GINGHAM ROSE STORAGE BOX,4,12/2/2010 18:27,3.75,16150,United Kingdom
536841,22077,6 RIBBONS RUSTIC CHARM,12,12/2/2010 18:27,1.65,16150,United Kingdom
536841,22356,CHARLOTTE BAG PINK POLKADOT,10,12/2/2010 18:27,0.85,16150,United Kingdom
536841,20724,RED RETROSPOT CHARLOTTE BAG,10,12/2/2010 18:27,0.85,16150,United Kingdom
536841,22759,SET OF 3 NOTEBOOKS IN PARCEL,12,12/2/2010 18:27,1.65,16150,United Kingdom
536841,21143,ANTIQUE GLASS HEART DECORATION ,12,12/2/2010 18:27,1.95,16150,United Kingdom
536841,85064,CREAM SWEETHEART LETTER RACK,2,12/2/2010 18:27,5.45,16150,United Kingdom
536842,20726,LUNCH BAG WOODLAND,10,12/2/2010 18:45,1.65,17552,United Kingdom
536842,20977,36 PENCILS TUBE WOODLAND,16,12/2/2010 18:45,1.25,17552,United Kingdom
536842,22623,BOX OF VINTAGE JIGSAW BLOCKS ,6,12/2/2010 18:45,4.95,17552,United Kingdom
536842,22617,BAKING SET SPACEBOY DESIGN,6,12/2/2010 18:45,4.95,17552,United Kingdom
536842,22502,PICNIC BASKET WICKER SMALL,4,12/2/2010 18:45,5.95,17552,United Kingdom
536842,47590B,PINK HAPPY BIRTHDAY BUNTING,6,12/2/2010 18:45,5.45,17552,United Kingdom
536842,47590A,BLUE HAPPY BIRTHDAY BUNTING,6,12/2/2010 18:45,5.45,17552,United Kingdom
536842,21981,PACK OF 12 WOODLAND TISSUES ,48,12/2/2010 18:45,0.29,17552,United Kingdom
536842,22584,PACK OF 6 PANNETONE GIFT BOXES,6,12/2/2010 18:45,2.55,17552,United Kingdom
536842,21033,JUMBO BAG CHARLIE AND LOLA TOYS,10,12/2/2010 18:45,2.95,17552,United Kingdom
536842,22551,PLASTERS IN TIN SPACEBOY,12,12/2/2010 18:45,1.65,17552,United Kingdom
536843,22966,GINGERBREAD MAN COOKIE CUTTER,12,12/2/2010 18:46,1.25,17552,United Kingdom
536843,22890,NOVELTY BISCUITS CAKE STAND 3 TIER,2,12/2/2010 18:46,9.95,17552,United Kingdom
536844,22502,PICNIC BASKET WICKER SMALL,32,12/2/2010 18:49,4.95,14236,United Kingdom
536844,21430,SET/3 RED GINGHAM ROSE STORAGE BOX,4,12/2/2010 18:49,3.75,14236,United Kingdom
536844,22841,ROUND CAKE TIN VINTAGE GREEN,2,12/2/2010 18:49,7.95,14236,United Kingdom
536845,84997B,RED 3 PIECE RETROSPOT CUTLERY SET,1,12/2/2010 19:18,3.75,17961,United Kingdom
536845,22384,LUNCH BAG PINK POLKADOT,1,12/2/2010 19:18,1.65,17961,United Kingdom
536845,21530,DAIRY MAID TOASTRACK,1,12/2/2010 19:18,2.95,17961,United Kingdom
536845,21528,DAIRY MAID TRADITIONAL TEAPOT ,1,12/2/2010 19:18,6.95,17961,United Kingdom
536845,22635,CHILDS BREAKFAST SET DOLLY GIRL ,1,12/2/2010 19:18,9.95,17961,United Kingdom
536845,21326,AGED GLASS SILVER T-LIGHT HOLDER,6,12/2/2010 19:18,0.65,17961,United Kingdom
536845,84832,ZINC WILLIE WINKIE  CANDLE STICK,4,12/2/2010 19:18,0.85,17961,United Kingdom
536845,21891,TRADITIONAL WOODEN SKIPPING ROPE,1,12/2/2010 19:18,1.25,17961,United Kingdom
536845,72807C,SET/3 VANILLA SCENTED CANDLE IN BOX,1,12/2/2010 19:18,4.25,17961,United Kingdom
536845,21333,CLASSIC WHITE FRAME,1,12/2/2010 19:18,2.95,17961,United Kingdom
536845,21820,GLITTER HEART GARLAND WITH BELLS ,1,12/2/2010 19:18,3.75,17961,United Kingdom
536845,21821,GLITTER STAR GARLAND WITH BELLS ,1,12/2/2010 19:18,3.75,17961,United Kingdom
536845,22162,HEART GARLAND RUSTIC PADDED,1,12/2/2010 19:18,2.95,17961,United Kingdom
536845,20727,LUNCH BAG  BLACK SKULL.,1,12/2/2010 19:18,1.65,17961,United Kingdom
536845,22619,SET OF 6 SOLDIER SKITTLES,2,12/2/2010 19:18,3.75,17961,United Kingdom
536845,21479,WHITE SKULL HOT WATER BOTTLE ,1,12/2/2010 19:18,3.75,17961,United Kingdom
536845,84029G,KNITTED UNION FLAG HOT WATER BOTTLE,1,12/2/2010 19:18,3.75,17961,United Kingdom
536845,21706,FOLDING UMBRELLA RED/WHITE POLKADOT,1,12/2/2010 19:18,4.95,17961,United Kingdom
536845,21114,LAVENDER SCENTED FABRIC HEART,1,12/2/2010 19:18,1.25,17961,United Kingdom
536845,20725,LUNCH BAG RED RETROSPOT,1,12/2/2010 19:18,1.65,17961,United Kingdom
536845,22327,ROUND SNACK BOXES SET OF 4 SKULLS,1,12/2/2010 19:18,2.95,17961,United Kingdom
536845,20978,36 PENCILS TUBE SKULLS,3,12/2/2010 19:18,1.25,17961,United Kingdom
536845,20979,36 PENCILS TUBE RED RETROSPOT,4,12/2/2010 19:18,1.25,17961,United Kingdom
536845,22636,CHILDS BREAKFAST SET CIRCUS PARADE,1,12/2/2010 19:18,8.5,17961,United Kingdom
536845,85014A,BLACK/BLUE POLKADOT UMBRELLA,1,12/2/2010 19:18,5.95,17961,United Kingdom
536845,20615,BLUE POLKADOT PASSPORT COVER,1,12/2/2010 19:18,2.1,17961,United Kingdom
536845,22634,CHILDS BREAKFAST SET SPACEBOY ,1,12/2/2010 19:18,9.95,17961,United Kingdom
536845,22271,FELTCRAFT DOLL ROSIE,2,12/2/2010 19:18,2.95,17961,United Kingdom
536845,21479,WHITE SKULL HOT WATER BOTTLE ,2,12/2/2010 19:18,3.75,17961,United Kingdom
536846,22469,HEART OF WICKER SMALL,2,12/2/2010 19:59,1.65,14573,United Kingdom
536846,21754,HOME BUILDING BLOCK WORD,2,12/2/2010 19:59,5.95,14573,United Kingdom
536846,22666,RECIPE BOX PANTRY YELLOW DESIGN,1,12/2/2010 19:59,2.95,14573,United Kingdom
536846,22665,RECIPE BOX BLUE SKETCHBOOK DESIGN,1,12/2/2010 19:59,2.95,14573,United Kingdom
536846,22667,RECIPE BOX RETROSPOT ,1,12/2/2010 19:59,2.95,14573,United Kingdom
536846,22752,SET 7 BABUSHKA NESTING BOXES,2,12/2/2010 19:59,8.5,14573,United Kingdom
536846,22776,SWEETHEART CAKESTAND 3 TIER,1,12/2/2010 19:59,9.95,14573,United Kingdom
536846,20914,SET/5 RED RETROSPOT LID GLASS BOWLS,3,12/2/2010 19:59,2.95,14573,United Kingdom
536846,22427,ENAMEL FLOWER JUG CREAM,1,12/2/2010 19:59,5.95,14573,United Kingdom
536846,22794,SWEETHEART WIRE MAGAZINE RACK,2,12/2/2010 19:59,7.95,14573,United Kingdom
536846,22426,ENAMEL WASH BOWL CREAM,1,12/2/2010 19:59,3.75,14573,United Kingdom
536846,22424,ENAMEL BREAD BIN CREAM,1,12/2/2010 19:59,12.75,14573,United Kingdom
536846,22367,CHILDRENS APRON SPACEBOY DESIGN,2,12/2/2010 19:59,1.95,14573,United Kingdom
536846,21156,RETROSPOT CHILDRENS APRON,2,12/2/2010 19:59,1.95,14573,United Kingdom
536846,22625,RED KITCHEN SCALES,1,12/2/2010 19:59,8.5,14573,United Kingdom
536846,22624,IVORY KITCHEN SCALES,1,12/2/2010 19:59,8.5,14573,United Kingdom
536846,22423,REGENCY CAKESTAND 3 TIER,1,12/2/2010 19:59,12.75,14573,United Kingdom
536846,21034,REX CASH+CARRY JUMBO SHOPPER,2,12/2/2010 19:59,0.95,14573,United Kingdom
536846,20728,LUNCH BAG CARS BLUE,2,12/2/2010 19:59,1.65,14573,United Kingdom
536846,22382,LUNCH BAG SPACEBOY DESIGN ,2,12/2/2010 19:59,1.65,14573,United Kingdom
536846,22418,10 COLOUR SPACEBOY PEN,12,12/2/2010 19:59,0.85,14573,United Kingdom
536846,22470,HEART OF WICKER LARGE,1,12/2/2010 19:59,2.95,14573,United Kingdom
536846,22646,CERAMIC STRAWBERRY CAKE MONEY BANK,1,12/2/2010 19:59,1.45,14573,United Kingdom
536846,71477,COLOUR GLASS. STAR T-LIGHT HOLDER,1,12/2/2010 19:59,3.25,14573,United Kingdom
536846,21912,VINTAGE SNAKES & LADDERS,1,12/2/2010 19:59,3.75,14573,United Kingdom
536846,22142,CHRISTMAS CRAFT WHITE FAIRY ,1,12/2/2010 19:59,1.45,14573,United Kingdom
536846,21673,WHITE SPOT BLUE CERAMIC DRAWER KNOB,2,12/2/2010 19:59,1.25,14573,United Kingdom
536846,21669,BLUE STRIPE CERAMIC DRAWER KNOB,4,12/2/2010 19:59,1.25,14573,United Kingdom
536846,21668,RED STRIPE CERAMIC DRAWER KNOB,2,12/2/2010 19:59,1.25,14573,United Kingdom
536846,21670,BLUE SPOT CERAMIC DRAWER KNOB,4,12/2/2010 19:59,1.25,14573,United Kingdom
536846,21668,RED STRIPE CERAMIC DRAWER KNOB,2,12/2/2010 19:59,1.25,14573,United Kingdom
536846,21671,RED SPOT CERAMIC DRAWER KNOB,4,12/2/2010 19:59,1.25,14573,United Kingdom
536846,21673,WHITE SPOT BLUE CERAMIC DRAWER KNOB,2,12/2/2010 19:59,1.25,14573,United Kingdom
536846,47021G,SET/6 BEAD COASTERS GAUZE BAG GOLD,2,12/2/2010 19:59,1.25,14573,United Kingdom
536846,22834,HAND WARMER BABUSHKA DESIGN,6,12/2/2010 19:59,2.1,14573,United Kingdom
536846,22113,GREY HEART HOT WATER BOTTLE,1,12/2/2010 19:59,3.75,14573,United Kingdom
536846,22443,GROW YOUR OWN HERBS SET OF 3,1,12/2/2010 19:59,7.95,14573,United Kingdom
536846,22442,GROW YOUR OWN FLOWERS SET OF 3,1,12/2/2010 19:59,7.95,14573,United Kingdom
536846,21034,REX CASH+CARRY JUMBO SHOPPER,1,12/2/2010 19:59,0.95,14573,United Kingdom
536846,82494L,WOODEN FRAME ANTIQUE WHITE ,2,12/2/2010 19:59,2.95,14573,United Kingdom
536846,15060B,FAIRY CAKE DESIGN UMBRELLA,1,12/2/2010 19:59,3.75,14573,United Kingdom
536846,22149,FELTCRAFT 6 FLOWER FRIENDS,1,12/2/2010 19:59,2.1,14573,United Kingdom
536846,22797,CHEST OF DRAWERS GINGHAM HEART ,1,12/2/2010 19:59,16.95,14573,United Kingdom
536846,20681,PINK POLKADOT CHILDRENS UMBRELLA,2,12/2/2010 19:59,3.25,14573,United Kingdom
536846,22607,WOODEN ROUNDERS GARDEN SET ,1,12/2/2010 19:59,9.95,14573,United Kingdom
536846,22605,WOODEN CROQUET GARDEN SET,1,12/2/2010 19:59,14.95,14573,United Kingdom
536846,22505,MEMO BOARD COTTAGE DESIGN,1,12/2/2010 19:59,4.95,14573,United Kingdom
536846,22501,PICNIC BASKET WICKER LARGE,1,12/2/2010 19:59,9.95,14573,United Kingdom
536846,20983,12 PENCILS TALL TUBE RED RETROSPOT,1,12/2/2010 19:59,0.85,14573,United Kingdom
536846,20982,12 PENCILS TALL TUBE SKULLS,1,12/2/2010 19:59,0.85,14573,United Kingdom
536846,20974,12 PENCILS SMALL TUBE SKULL,1,12/2/2010 19:59,0.65,14573,United Kingdom
536846,22271,FELTCRAFT DOLL ROSIE,1,12/2/2010 19:59,2.95,14573,United Kingdom
536846,20971,PINK BLUE FELT CRAFT TRINKET BOX,1,12/2/2010 19:59,1.25,14573,United Kingdom
536846,20972,PINK CREAM FELT CRAFT TRINKET BOX ,1,12/2/2010 19:59,1.25,14573,United Kingdom
536846,22940,FELTCRAFT CHRISTMAS FAIRY,1,12/2/2010 19:59,4.25,14573,United Kingdom
536846,22750,FELTCRAFT PRINCESS LOLA DOLL,1,12/2/2010 19:59,3.75,14573,United Kingdom
536846,22749,FELTCRAFT PRINCESS CHARLOTTE DOLL,1,12/2/2010 19:59,3.75,14573,United Kingdom
536846,22272,FELTCRAFT DOLL MARIA,1,12/2/2010 19:59,2.95,14573,United Kingdom
536846,22751,FELTCRAFT PRINCESS OLIVIA DOLL,1,12/2/2010 19:59,3.75,14573,United Kingdom
536846,22274,FELTCRAFT DOLL EMILY,1,12/2/2010 19:59,2.95,14573,United Kingdom
536846,22837,HOT WATER BOTTLE BABUSHKA ,3,12/2/2010 19:59,4.65,14573,United Kingdom
536846,20982,12 PENCILS TALL TUBE SKULLS,1,12/2/2010 19:59,0.85,14573,United Kingdom
536846,21891,TRADITIONAL WOODEN SKIPPING ROPE,2,12/2/2010 19:59,1.25,14573,United Kingdom
536846,22113,GREY HEART HOT WATER BOTTLE,1,12/2/2010 19:59,3.75,14573,United Kingdom
536846,22179,SET 10 LIGHTS NIGHT OWL,1,12/2/2010 19:59,6.75,14573,United Kingdom
536846,22468,BABUSHKA LIGHTS STRING OF 10,1,12/2/2010 19:59,6.75,14573,United Kingdom
536846,21892,TRADITIONAL WOODEN CATCH CUP GAME ,3,12/2/2010 19:59,1.25,14573,United Kingdom
536846,22141,CHRISTMAS CRAFT TREE TOP ANGEL,1,12/2/2010 19:59,2.1,14573,United Kingdom
536846,22180,RETROSPOT LAMP,1,12/2/2010 19:59,9.95,14573,United Kingdom
536846,20983,12 PENCILS TALL TUBE RED RETROSPOT,1,12/2/2010 19:59,0.85,14573,United Kingdom
536846,20975,12 PENCILS SMALL TUBE RED RETROSPOT,6,12/2/2010 19:59,0.65,14573,United Kingdom
536846,20983,12 PENCILS TALL TUBE RED RETROSPOT,4,12/2/2010 19:59,0.85,14573,United Kingdom
536846,20974,12 PENCILS SMALL TUBE SKULL,1,12/2/2010 19:59,0.65,14573,United Kingdom
536846,22502,PICNIC BASKET WICKER SMALL,1,12/2/2010 19:59,5.95,14573,United Kingdom
536846,22766,PHOTO FRAME CORNICE,2,12/2/2010 19:59,2.95,14573,United Kingdom
536846,22617,BAKING SET SPACEBOY DESIGN,2,12/2/2010 19:59,4.95,14573,United Kingdom
536847,22155,STAR DECORATION RUSTIC,48,12/3/2010 9:31,0.42,17135,United Kingdom
536847,21807,WHITE CHRISTMAS STAR DECORATION,36,12/3/2010 9:31,0.42,17135,United Kingdom
536847,22161,HEART DECORATION RUSTIC HANGING ,24,12/3/2010 9:31,0.65,17135,United Kingdom
536847,22065,CHRISTMAS PUDDING TRINKET POT ,24,12/3/2010 9:31,1.45,17135,United Kingdom
536847,20956,PORCELAIN T-LIGHT HOLDERS ASSORTED,12,12/3/2010 9:31,1.25,17135,United Kingdom
536847,84347,ROTATING SILVER ANGELS T-LIGHT HLDR,6,12/3/2010 9:31,2.55,17135,United Kingdom
536847,21231,SWEETHEART CERAMIC TRINKET BOX,24,12/3/2010 9:31,1.25,17135,United Kingdom
536847,21232,STRAWBERRY CERAMIC TRINKET BOX,24,12/3/2010 9:31,1.25,17135,United Kingdom
536847,22067,CHOC TRUFFLE GOLD TRINKET POT ,24,12/3/2010 9:31,1.65,17135,United Kingdom
536848,22910,PAPER CHAIN KIT VINTAGE CHRISTMAS,80,12/3/2010 9:39,2.55,13408,United Kingdom
536848,21930,JUMBO STORAGE BAG SKULLS,100,12/3/2010 9:39,1.65,13408,United Kingdom
536848,21928,JUMBO BAG SCANDINAVIAN PAISLEY,100,12/3/2010 9:39,1.65,13408,United Kingdom
536849,22730,ALARM CLOCK BAKELIKE IVORY,19,12/3/2010 9:45,3.75,17396,United Kingdom
536849,22727,ALARM CLOCK BAKELIKE RED ,48,12/3/2010 9:45,3.75,17396,United Kingdom
536849,22728,ALARM CLOCK BAKELIKE PINK,39,12/3/2010 9:45,3.75,17396,United Kingdom
C536850,22942,CHRISTMAS LIGHTS 10 SANTAS ,-48,12/3/2010 9:47,7.65,14213,United Kingdom
C536850,22689,DOORMAT MERRY CHRISTMAS RED ,-50,12/3/2010 9:47,6.75,14213,United Kingdom
C536850,22591,CARDHOLDER GINGHAM CHRISTMAS TREE,-50,12/3/2010 9:47,2.55,14213,United Kingdom
C536850,22580,ADVENT CALENDAR GINGHAM SACK,-48,12/3/2010 9:47,4.95,14213,United Kingdom
C536850,22186,RED STAR CARD HOLDER,-48,12/3/2010 9:47,2.55,14213,United Kingdom
536851,20682,RED RETROSPOT CHILDRENS UMBRELLA,24,12/3/2010 9:49,3.25,12967,United Kingdom
536851,22111,SCOTTIE DOG HOT WATER BOTTLE,36,12/3/2010 9:49,4.95,12967,United Kingdom
536851,21485,RETROSPOT HEART HOT WATER BOTTLE,6,12/3/2010 9:49,4.95,12967,United Kingdom
536851,22128,PARTY CONES CANDY ASSORTED,60,12/3/2010 9:49,1.25,12967,United Kingdom
536851,20749,ASSORTED COLOUR MINI CASES,12,12/3/2010 9:49,7.95,12967,United Kingdom
536851,22276,WASH BAG VINTAGE ROSE PAISLEY,36,12/3/2010 9:49,2.55,12967,United Kingdom
536851,22503,CABIN BAG VINTAGE PAISLEY,6,12/3/2010 9:49,29.95,12967,United Kingdom
536851,21430,SET/3 RED GINGHAM ROSE STORAGE BOX,48,12/3/2010 9:49,4.25,12967,United Kingdom
536851,21429,RED GINGHAM ROSE JEWELLERY BOX,56,12/3/2010 9:49,1.65,12967,United Kingdom
536851,21428,SET3 BOOK BOX GREEN GINGHAM FLOWER ,8,12/3/2010 9:49,4.25,12967,United Kingdom
536851,22333,RETROSPOT PARTY BAG + STICKER SET,32,12/3/2010 9:49,1.65,12967,United Kingdom
536851,22180,RETROSPOT LAMP,6,12/3/2010 9:49,9.95,12967,United Kingdom
536851,22504,CABIN BAG VINTAGE RETROSPOT,6,12/3/2010 9:49,29.95,12967,United Kingdom
536851,21094,SET/6 RED SPOTTY PAPER PLATES,12,12/3/2010 9:49,0.85,12967,United Kingdom
536851,21086,SET/6 RED SPOTTY PAPER CUPS,12,12/3/2010 9:49,0.65,12967,United Kingdom
536852,22549,PICTURE DOMINOES,12,12/3/2010 9:51,1.45,12686,France
536852,22544,MINI JIGSAW SPACEBOY,24,12/3/2010 9:51,0.42,12686,France
536852,22539,MINI JIGSAW DOLLY GIRL,24,12/3/2010 9:51,0.42,12686,France
536852,22661,CHARLOTTE BAG DOLLY GIRL DESIGN,10,12/3/2010 9:51,0.85,12686,France
536852,21791,VINTAGE HEADS AND TAILS CARD GAME ,12,12/3/2010 9:51,1.25,12686,France
536852,21786,POLKADOT RAIN HAT ,24,12/3/2010 9:51,0.42,12686,France
536852,POST,POSTAGE,1,12/3/2010 9:51,18,12686,France
C536853,84678,CLASSICAL ROSE SMALL VASE,-1,12/3/2010 10:07,2.55,14679,United Kingdom
C536854,22158,3 HEARTS HANGING DECORATION RUSTIC,-1,12/3/2010 10:09,2.95,15240,United Kingdom
C536854,22944,CHRISTMAS METAL POSTCARD WITH BELLS,-1,12/3/2010 10:09,1.25,15240,United Kingdom
C536854,21871,SAVE THE PLANET MUG,-1,12/3/2010 10:09,1.25,15240,United Kingdom
C536855,21527,RED RETROSPOT TRADITIONAL TEAPOT ,-4,12/3/2010 10:11,7.95,18225,United Kingdom
536856,22632,HAND WARMER RED POLKA DOT,12,12/3/2010 10:26,2.1,13370,United Kingdom
536856,22941,CHRISTMAS LIGHTS 10 REINDEER,2,12/3/2010 10:26,8.5,13370,United Kingdom
536856,22943,CHRISTMAS LIGHTS 10 VINTAGE BAUBLES,6,12/3/2010 10:26,4.95,13370,United Kingdom
536856,21591,COSY HOUR CIGAR BOX MATCHES ,24,12/3/2010 10:26,1.25,13370,United Kingdom
536856,22169,FAMILY ALBUM WHITE PICTURE FRAME,2,12/3/2010 10:26,8.5,13370,United Kingdom
536856,22759,SET OF 3 NOTEBOOKS IN PARCEL,12,12/3/2010 10:26,1.65,13370,United Kingdom
536856,22960,JAM MAKING SET WITH JARS,6,12/3/2010 10:26,4.25,13370,United Kingdom
536856,22622,BOX OF VINTAGE ALPHABET BLOCKS,4,12/3/2010 10:26,9.95,13370,United Kingdom
536856,22423,REGENCY CAKESTAND 3 TIER,2,12/3/2010 10:26,12.75,13370,United Kingdom
536856,22623,BOX OF VINTAGE JIGSAW BLOCKS ,6,12/3/2010 10:26,4.95,13370,United Kingdom
536856,22748,POPPY'S PLAYHOUSE KITCHEN,6,12/3/2010 10:26,2.1,13370,United Kingdom
536856,22746,POPPY'S PLAYHOUSE LIVINGROOM ,6,12/3/2010 10:26,2.1,13370,United Kingdom
536856,22745,POPPY'S PLAYHOUSE BEDROOM ,6,12/3/2010 10:26,2.1,13370,United Kingdom
536856,22747,POPPY'S PLAYHOUSE BATHROOM,6,12/3/2010 10:26,2.1,13370,United Kingdom
536856,84077,WORLD WAR 2 GLIDERS ASSTD DESIGNS,48,12/3/2010 10:26,0.29,13370,United Kingdom
536856,21790,VINTAGE SNAP CARDS,12,12/3/2010 10:26,0.85,13370,United Kingdom
536856,21791,VINTAGE HEADS AND TAILS CARD GAME ,12,12/3/2010 10:26,1.25,13370,United Kingdom
536856,22549,PICTURE DOMINOES,12,12/3/2010 10:26,1.45,13370,United Kingdom
536856,22620,4 TRADITIONAL SPINNING TOPS,12,12/3/2010 10:26,1.25,13370,United Kingdom
536856,22621,TRADITIONAL KNITTING NANCY,12,12/3/2010 10:26,1.45,13370,United Kingdom
536856,22636,CHILDS BREAKFAST SET CIRCUS PARADE,2,12/3/2010 10:26,8.5,13370,United Kingdom
536856,22635,CHILDS BREAKFAST SET DOLLY GIRL ,2,12/3/2010 10:26,9.95,13370,United Kingdom
536856,22940,FELTCRAFT CHRISTMAS FAIRY,8,12/3/2010 10:26,4.25,13370,United Kingdom
536856,21990,MODERN FLORAL STATIONERY SET,6,12/3/2010 10:26,2.95,13370,United Kingdom
536856,21993,FLORAL FOLK STATIONERY SET,6,12/3/2010 10:26,2.95,13370,United Kingdom
536856,84945,MULTI COLOUR SILVER T-LIGHT HOLDER,12,12/3/2010 10:26,0.85,13370,United Kingdom
536856,22845,VINTAGE CREAM CAT FOOD CONTAINER,2,12/3/2010 10:26,6.35,13370,United Kingdom
536856,21755,LOVE BUILDING BLOCK WORD,3,12/3/2010 10:26,5.95,13370,United Kingdom
536856,22699,ROSES REGENCY TEACUP AND SAUCER ,6,12/3/2010 10:26,2.95,13370,United Kingdom
536856,22697,GREEN REGENCY TEACUP AND SAUCER,6,12/3/2010 10:26,2.95,13370,United Kingdom
536856,22798,ANTIQUE GLASS DRESSING TABLE POT,8,12/3/2010 10:26,2.95,13370,United Kingdom
536856,21889,WOODEN BOX OF DOMINOES,12,12/3/2010 10:26,1.25,13370,United Kingdom
536856,22800,ANTIQUE TALL SWIRLGLASS TRINKET POT,4,12/3/2010 10:26,3.75,13370,United Kingdom
536856,79000,MOROCCAN TEA GLASS,12,12/3/2010 10:26,0.85,13370,United Kingdom
536856,22834,HAND WARMER BABUSHKA DESIGN,12,12/3/2010 10:26,2.1,13370,United Kingdom
536856,22865,HAND WARMER OWL DESIGN,12,12/3/2010 10:26,2.1,13370,United Kingdom
536856,22468,BABUSHKA LIGHTS STRING OF 10,4,12/3/2010 10:26,6.75,13370,United Kingdom
536856,21890,S/6 WOODEN SKITTLES IN COTTON BAG,6,12/3/2010 10:26,2.95,13370,United Kingdom
536856,21892,TRADITIONAL WOODEN CATCH CUP GAME ,12,12/3/2010 10:26,1.25,13370,United Kingdom
536857,22900, SET 2 TEA TOWELS I LOVE LONDON ,5,12/3/2010 10:33,2.95,16883,United Kingdom
