580893,22642,SET OF 4 NAPKIN CHARMS STARS   ,6,12/6/2011 12:38,0.79,17290,United Kingdom
580893,22930,BAKING MOULD HEART MILK CHOCOLATE,1,12/6/2011 12:38,2.55,17290,United Kingdom
580893,21355,TOAST ITS - I LOVE YOU ,1,12/6/2011 12:38,1.25,17290,United Kingdom
580893,20992,JAZZ HEARTS PURSE NOTEBOOK,1,12/6/2011 12:38,0.39,17290,United Kingdom
580893,23392,SPACEBOY ROCKET LOLLY MAKERS,1,12/6/2011 12:38,2.08,17290,United Kingdom
580893,23016,GLASS TWIST BON BON JAR,2,12/6/2011 12:38,7.85,17290,United Kingdom
580893,82551,LAUNDRY 15C METAL SIGN,1,12/6/2011 12:38,1.45,17290,United Kingdom
580893,21162,TOXIC AREA  DOOR HANGER ,1,12/6/2011 12:38,0.39,17290,United Kingdom
580893,21158,MOODY GIRL DOOR HANGER ,1,12/6/2011 12:38,0.39,17290,United Kingdom
580893,85071C,"CHARLIE+LOLA""EXTREMELY BUSY"" SIGN",1,12/6/2011 12:38,0.39,17290,United Kingdom
580893,22481,BLACK TEA TOWEL CLASSIC DESIGN,2,12/6/2011 12:38,0.39,17290,United Kingdom
580893,21713,CITRONELLA CANDLE FLOWERPOT,2,12/6/2011 12:38,2.1,17290,United Kingdom
580893,22500,SET OF 2 TINS JARDIN DE PROVENCE,1,12/6/2011 12:38,1.25,17290,United Kingdom
580893,85034C,3 ROSE MORRIS BOXED CANDLES,1,12/6/2011 12:38,1.25,17290,United Kingdom
580893,22509,SEWING BOX RETROSPOT DESIGN ,1,12/6/2011 12:38,3.95,17290,United Kingdom
580893,85014A,BLACK/BLUE POLKADOT UMBRELLA,1,12/6/2011 12:38,5.95,17290,United Kingdom
580893,21524,DOORMAT SPOTTY HOME SWEET HOME,1,12/6/2011 12:38,8.25,17290,United Kingdom
580894,22485,SET OF 2 WOODEN MARKET CRATES,12,12/6/2011 12:41,10.95,13408,United Kingdom
580894,22741,FUNKY DIVA PEN,96,12/6/2011 12:41,0.85,13408,United Kingdom
580894,22086,PAPER CHAIN KIT 50'S CHRISTMAS ,40,12/6/2011 12:41,2.55,13408,United Kingdom
580894,22910,PAPER CHAIN KIT VINTAGE CHRISTMAS,40,12/6/2011 12:41,2.55,13408,United Kingdom
580901,22464,HANGING METAL HEART LANTERN,12,12/6/2011 12:45,0.79,16528,United Kingdom
580901,22646,CERAMIC STRAWBERRY CAKE MONEY BANK,36,12/6/2011 12:45,0.39,16528,United Kingdom
580901,23425,STORAGE TIN HOME SWEET HOME,12,12/6/2011 12:45,0.79,16528,United Kingdom
580901,72799C,PINK PILLAR CANDLE SILVER FLOCK,12,12/6/2011 12:45,0.79,16528,United Kingdom
580901,22487,WHITE WOOD GARDEN PLANT LADDER,1,12/6/2011 12:45,9.95,16528,United Kingdom
580901,21314,SMALL GLASS HEART TRINKET POT,8,12/6/2011 12:45,2.1,16528,United Kingdom
580901,22465,HANGING METAL STAR LANTERN,12,12/6/2011 12:45,0.79,16528,United Kingdom
580901,21693,SMALL HAMMERED SILVER CANDLEPOT ,6,12/6/2011 12:45,2.95,16528,United Kingdom
580901,21689,SILVER VANILLA  FLOWER CANDLE POT,4,12/6/2011 12:45,3.75,16528,United Kingdom
580901,21326,AGED GLASS SILVER T-LIGHT HOLDER,12,12/6/2011 12:45,0.65,16528,United Kingdom
580901,22791,T-LIGHT GLASS FLUTED ANTIQUE,12,12/6/2011 12:45,1.25,16528,United Kingdom
580901,23273,HEART T-LIGHT HOLDER WILLIE WINKIE,12,12/6/2011 12:45,1.65,16528,United Kingdom
580901,23274,STAR T-LIGHT HOLDER WILLIE WINKIE,12,12/6/2011 12:45,1.65,16528,United Kingdom
580901,84945,MULTI COLOUR SILVER T-LIGHT HOLDER,12,12/6/2011 12:45,0.85,16528,United Kingdom
580901,85066,CREAM SWEETHEART MINI CHEST,2,12/6/2011 12:45,12.75,16528,United Kingdom
580901,23407,SET OF 2 TRAYS HOME SWEET HOME,2,12/6/2011 12:45,9.95,16528,United Kingdom
580901,23136,IVORY WIRE SWEETHEART LETTER TRAY,4,12/6/2011 12:45,3.75,16528,United Kingdom
580902,82582,AREA PATROLLED METAL SIGN,72,12/6/2011 12:50,1.85,13881,United Kingdom
580902,21181,PLEASE ONE PERSON METAL SIGN,48,12/6/2011 12:50,1.85,13881,United Kingdom
580902,22086,PAPER CHAIN KIT 50'S CHRISTMAS ,80,12/6/2011 12:50,2.55,13881,United Kingdom
580902,22144,CHRISTMAS CRAFT LITTLE FRIENDS,40,12/6/2011 12:50,1.85,13881,United Kingdom
580902,22909,SET OF 20 VINTAGE CHRISTMAS NAPKINS,96,12/6/2011 12:50,0.72,13881,United Kingdom
580903,21850,BLUE  DIAMANTE PEN IN GIFT BOX,1,12/6/2011 12:56,4.95,14606,United Kingdom
580903,22668,PINK BABY BUNTING,1,12/6/2011 12:56,2.95,14606,United Kingdom
580903,21843,RED RETROSPOT CAKE STAND,1,12/6/2011 12:56,10.95,14606,United Kingdom
580903,22423,REGENCY CAKESTAND 3 TIER,1,12/6/2011 12:56,12.75,14606,United Kingdom
580903,21619,4 VANILLA BOTANICAL CANDLES,2,12/6/2011 12:56,1.25,14606,United Kingdom
580903,22400,MAGNETS PACK OF 4 HOME SWEET HOME,1,12/6/2011 12:56,0.39,14606,United Kingdom
580903,85231B,CINAMMON SET OF 9 T-LIGHTS,2,12/6/2011 12:56,0.85,14606,United Kingdom
580903,21917,SET 12 KIDS  WHITE CHALK STICKS,1,12/6/2011 12:56,0.42,14606,United Kingdom
580903,21918,SET 12 KIDS COLOUR  CHALK STICKS,1,12/6/2011 12:56,0.42,14606,United Kingdom
580903,22161,HEART DECORATION RUSTIC HANGING ,4,12/6/2011 12:56,0.19,14606,United Kingdom
580903,22190,LOCAL CAFE MUG,1,12/6/2011 12:56,0.39,14606,United Kingdom
580903,22448,PIN CUSHION BABUSHKA RED,1,12/6/2011 12:56,1.25,14606,United Kingdom
580903,85114C,RED ENCHANTED FOREST PLACEMAT,1,12/6/2011 12:56,1.65,14606,United Kingdom
580903,21039,RED RETROSPOT SHOPPING BAG,1,12/6/2011 12:56,2.55,14606,United Kingdom
580903,23418,LAVENDER TOILETTE BOTTLE,1,12/6/2011 12:56,2.08,14606,United Kingdom
580903,21238,RED RETROSPOT CUP,1,12/6/2011 12:56,0.85,14606,United Kingdom
580903,22199,FRYING PAN RED RETROSPOT,1,12/6/2011 12:56,1.25,14606,United Kingdom
580903,21850,BLUE  DIAMANTE PEN IN GIFT BOX,1,12/6/2011 12:56,4.95,14606,United Kingdom
580903,21042,RED RETROSPOT APRON ,2,12/6/2011 12:56,5.95,14606,United Kingdom
580903,21080,SET/20 RED RETROSPOT PAPER NAPKINS ,3,12/6/2011 12:56,0.85,14606,United Kingdom
580903,23301,GARDENERS KNEELING PAD KEEP CALM ,4,12/6/2011 12:56,1.65,14606,United Kingdom
580903,23300,GARDENERS KNEELING PAD CUP OF TEA ,1,12/6/2011 12:56,1.65,14606,United Kingdom
580903,22414,DOORMAT NEIGHBOURHOOD WITCH ,1,12/6/2011 12:56,3.95,14606,United Kingdom
580903,21638,ASSORTED TUTTI FRUTTI NOTEBOOK,2,12/6/2011 12:56,2.1,14606,United Kingdom
580903,20782,CAMOUFLAGE EAR MUFF HEADPHONES,1,12/6/2011 12:56,1.95,14606,United Kingdom
580903,21494,ROTATING LEAVES T-LIGHT HOLDER,1,12/6/2011 12:56,1.25,14606,United Kingdom
580903,22996,TRAVEL CARD WALLET VINTAGE TICKET,1,12/6/2011 12:56,0.42,14606,United Kingdom
580903,21680,WOODLAND  STICKERS,6,12/6/2011 12:56,0.85,14606,United Kingdom
580903,21918,SET 12 KIDS COLOUR  CHALK STICKS,1,12/6/2011 12:56,0.42,14606,United Kingdom
580903,21916,SET 12 RETRO WHITE CHALK STICKS,5,12/6/2011 12:56,0.42,14606,United Kingdom
580903,22553,PLASTERS IN TIN SKULLS,1,12/6/2011 12:56,1.65,14606,United Kingdom
580903,22650,CERAMIC PIRATE CHEST MONEY BANK,1,12/6/2011 12:56,1.45,14606,United Kingdom
580903,21874,GIN AND TONIC MUG,1,12/6/2011 12:56,1.65,14606,United Kingdom
580903,22069,BROWN  PIRATE TREASURE CHEST ,1,12/6/2011 12:56,0.39,14606,United Kingdom
580903,22068,BLACK PIRATE TREASURE CHEST,1,12/6/2011 12:56,0.39,14606,United Kingdom
580903,20676,RED RETROSPOT BOWL,1,12/6/2011 12:56,1.25,14606,United Kingdom
580903,84596F,SMALL MARSHMALLOWS PINK BOWL,1,12/6/2011 12:56,0.42,14606,United Kingdom
580903,21944,KITTENS DESIGN FLANNEL,1,12/6/2011 12:56,0.39,14606,United Kingdom
580903,21945,STRAWBERRIES  DESIGN FLANNEL ,1,12/6/2011 12:56,0.39,14606,United Kingdom
580903,22082,RIBBON REEL STRIPES DESIGN ,1,12/6/2011 12:56,1.65,14606,United Kingdom
580903,22571,ROCKING HORSE RED CHRISTMAS ,5,12/6/2011 12:56,0.85,14606,United Kingdom
580903,22363,GLASS JAR MARMALADE ,1,12/6/2011 12:56,2.95,14606,United Kingdom
580903,84997D,CHILDRENS CUTLERY POLKADOT PINK,2,12/6/2011 12:56,4.15,14606,United Kingdom
580903,22362,GLASS JAR PEACOCK BATH SALTS,1,12/6/2011 12:56,2.95,14606,United Kingdom
580903,22359,GLASS JAR KINGS CHOICE,1,12/6/2011 12:56,2.95,14606,United Kingdom
580903,22795,SWEETHEART RECIPE BOOK STAND,2,12/6/2011 12:56,6.75,14606,United Kingdom
580903,82616C,MIDNIGHT GLAMOUR SCARF KNITTING KIT,4,12/6/2011 12:56,1.25,14606,United Kingdom
580903,21534,DAIRY MAID LARGE MILK JUG,1,12/6/2011 12:56,4.95,14606,United Kingdom
580903,22409,MONEY BOX BISCUITS DESIGN,1,12/6/2011 12:56,1.25,14606,United Kingdom
580903,22220,CAKE STAND LOVEBIRD 2 TIER WHITE,1,12/6/2011 12:56,2.95,14606,United Kingdom
580903,22329,ROUND CONTAINER SET OF 5 RETROSPOT,1,12/6/2011 12:56,1.65,14606,United Kingdom
580903,22624,IVORY KITCHEN SCALES,1,12/6/2011 12:56,8.5,14606,United Kingdom
580903,22624,IVORY KITCHEN SCALES,1,12/6/2011 12:56,8.5,14606,United Kingdom
580903,21890,S/6 WOODEN SKITTLES IN COTTON BAG,1,12/6/2011 12:56,3.25,14606,United Kingdom
580903,20979,36 PENCILS TUBE RED RETROSPOT,1,12/6/2011 12:56,1.25,14606,United Kingdom
580903,85152,HAND OVER THE CHOCOLATE   SIGN ,1,12/6/2011 12:56,2.1,14606,United Kingdom
580903,22996,TRAVEL CARD WALLET VINTAGE TICKET,2,12/6/2011 12:56,0.42,14606,United Kingdom
580903,21985,PACK OF 12 HEARTS DESIGN TISSUES ,4,12/6/2011 12:56,0.39,14606,United Kingdom
580903,20771,CHRYSANTHEMUM  JOURNAL,2,12/6/2011 12:56,2.55,14606,United Kingdom
580903,20762,GREEN FERN SKETCHBOOK ,1,12/6/2011 12:56,3.75,14606,United Kingdom
580903,20931,BLUE POT PLANT CANDLE ,1,12/6/2011 12:56,1.25,14606,United Kingdom
580903,22314,OFFICE MUG WARMER CHOC+BLUE,1,12/6/2011 12:56,1.25,14606,United Kingdom
580903,22331,WOODLAND PARTY BAG + STICKER SET,2,12/6/2011 12:56,1.65,14606,United Kingdom
580903,23169,CLASSIC GLASS COOKIE JAR,3,12/6/2011 12:56,4.15,14606,United Kingdom
580903,21929,JUMBO BAG PINK VINTAGE PAISLEY,1,12/6/2011 12:56,2.08,14606,United Kingdom
580903,21264,WHITE GOOSE FEATHER TREE 60CM ,1,12/6/2011 12:56,1.95,14606,United Kingdom
580903,20717,STRAWBERRY SHOPPER BAG,1,12/6/2011 12:56,1.25,14606,United Kingdom
580903,23080,RED METAL BOX TOP SECRET,2,12/6/2011 12:56,8.25,14606,United Kingdom
580904,22414,DOORMAT NEIGHBOURHOOD WITCH ,1,12/6/2011 12:59,3.95,15311,United Kingdom
580904,21524,DOORMAT SPOTTY HOME SWEET HOME,1,12/6/2011 12:59,8.25,15311,United Kingdom
580904,48116,DOORMAT MULTICOLOUR STRIPE,1,12/6/2011 12:59,8.25,15311,United Kingdom
580904,23169,CLASSIC GLASS COOKIE JAR,1,12/6/2011 12:59,4.15,15311,United Kingdom
580904,23315,IVORY REFECTORY CLOCK,3,12/6/2011 12:59,9.95,15311,United Kingdom
580904,23316,RED REFECTORY CLOCK ,2,12/6/2011 12:59,9.95,15311,United Kingdom
580904,23317,BLUE REFECTORY CLOCK ,1,12/6/2011 12:59,9.95,15311,United Kingdom
580904,21790,VINTAGE SNAP CARDS,1,12/6/2011 12:59,0.85,15311,United Kingdom
580904,22678,FRENCH BLUE METAL DOOR SIGN 3,1,12/6/2011 12:59,1.25,15311,United Kingdom
580904,22262,FELT EGG COSY CHICKEN,4,12/6/2011 12:59,0.85,15311,United Kingdom
580904,21892,TRADITIONAL WOODEN CATCH CUP GAME ,2,12/6/2011 12:59,1.25,15311,United Kingdom
580904,22227,HANGING HEART MIRROR DECORATION ,17,12/6/2011 12:59,0.65,15311,United Kingdom
580904,21718,RED METAL BEACH SPADE ,1,12/6/2011 12:59,1.25,15311,United Kingdom
580904,21716,BOYS VINTAGE TIN SEASIDE BUCKET,1,12/6/2011 12:59,2.55,15311,United Kingdom
580904,23184,BULL DOG BOTTLE OPENER,2,12/6/2011 12:59,4.95,15311,United Kingdom
580904,23196,VINTAGE LEAF MAGNETIC NOTEPAD,2,12/6/2011 12:59,1.45,15311,United Kingdom
580904,21931,JUMBO STORAGE BAG SUKI,1,12/6/2011 12:59,2.08,15311,United Kingdom
580904,85099B,JUMBO BAG RED RETROSPOT,1,12/6/2011 12:59,2.08,15311,United Kingdom
580904,84347,ROTATING SILVER ANGELS T-LIGHT HLDR,12,12/6/2011 12:59,2.55,15311,United Kingdom
580904,22410,MONEY BOX HOUSEKEEPING DESIGN,6,12/6/2011 12:59,0.39,15311,United Kingdom
580904,84945,MULTI COLOUR SILVER T-LIGHT HOLDER,12,12/6/2011 12:59,0.85,15311,United Kingdom
580904,23147,SINGLE ANTIQUE ROSE HOOK IVORY,6,12/6/2011 12:59,1.45,15311,United Kingdom
580904,23148,MINIATURE ANTIQUE ROSE HOOK IVORY,12,12/6/2011 12:59,0.83,15311,United Kingdom
580904,22406,MONEY BOX KINGS CHOICE DESIGN,6,12/6/2011 12:59,0.39,15311,United Kingdom
580904,47310M,SMALL POP BOX FUNKY MONKEY,2,12/6/2011 12:59,1.25,15311,United Kingdom
580904,79302M,"ART LIGHTS,FUNK MONKEY",2,12/6/2011 12:59,2.95,15311,United Kingdom
580904,22905,CALENDAR IN SEASON DESIGN,7,12/6/2011 12:59,1.25,15311,United Kingdom
580904,46118,FUNKY MONKEY CUSHION COVER,4,12/6/2011 12:59,0.85,15311,United Kingdom
580904,84978,HANGING HEART JAR T-LIGHT HOLDER,36,12/6/2011 12:59,1.06,15311,United Kingdom
580904,22752,SET 7 BABUSHKA NESTING BOXES,24,12/6/2011 12:59,3.95,15311,United Kingdom
580904,21258,VICTORIAN SEWING BOX LARGE,8,12/6/2011 12:59,10.95,15311,United Kingdom
580905,17091J,VANILLA INCENSE IN TIN,36,12/6/2011 13:02,0.38,16313,United Kingdom
580905,22492,MINI PAINT SET VINTAGE ,36,12/6/2011 13:02,0.65,16313,United Kingdom
580905,22178,VICTORIAN GLASS HANGING T-LIGHT,6,12/6/2011 13:02,1.95,16313,United Kingdom
580905,23490,T-LIGHT HOLDER HANGING LOVE BIRD,6,12/6/2011 13:02,3.75,16313,United Kingdom
580905,22961,JAM MAKING SET PRINTED,12,12/6/2011 13:02,1.45,16313,United Kingdom
580905,22654,DELUXE SEWING KIT ,3,12/6/2011 13:02,5.95,16313,United Kingdom
580906,35970,ZINC FOLKART SLEIGH BELLS,24,12/6/2011 13:10,1.69,13104,United Kingdom
580906,23196,VINTAGE LEAF MAGNETIC NOTEPAD,12,12/6/2011 13:10,1.45,13104,United Kingdom
580906,21137,BLACK RECORD COVER FRAME,48,12/6/2011 13:10,3.39,13104,United Kingdom
580906,23569,TRADTIONAL ALPHABET STAMP SET,24,12/6/2011 13:10,4.95,13104,United Kingdom
580907,22487,WHITE WOOD GARDEN PLANT LADDER,1,12/6/2011 13:13,9.95,13507,United Kingdom
580907,22844,VINTAGE CREAM DOG FOOD CONTAINER,2,12/6/2011 13:13,8.5,13507,United Kingdom
580907,82484,WOOD BLACK BOARD ANT WHITE FINISH,2,12/6/2011 13:13,7.95,13507,United Kingdom
580907,85123A,WHITE HANGING HEART T-LIGHT HOLDER,6,12/6/2011 13:13,2.95,13507,United Kingdom
580907,84946,ANTIQUE SILVER T-LIGHT GLASS,24,12/6/2011 13:13,1.25,13507,United Kingdom
580907,22470,HEART OF WICKER LARGE,6,12/6/2011 13:13,2.95,13507,United Kingdom
580907,22588,CARD HOLDER GINGHAM HEART,6,12/6/2011 13:13,2.89,13507,United Kingdom
580907,22178,VICTORIAN GLASS HANGING T-LIGHT,12,12/6/2011 13:13,1.95,13507,United Kingdom
580907,22367,CHILDRENS APRON SPACEBOY DESIGN,8,12/6/2011 13:13,1.95,13507,United Kingdom
580907,23300,GARDENERS KNEELING PAD CUP OF TEA ,12,12/6/2011 13:13,1.65,13507,United Kingdom
580907,21914,BLUE HARMONICA IN BOX ,12,12/6/2011 13:13,1.25,13507,United Kingdom
580907,23127,FELTCRAFT GIRL NICOLE KIT,4,12/6/2011 13:13,4.95,13507,United Kingdom
580907,21442,GREEN BIRDHOUSE DECORATION,24,12/6/2011 13:13,0.19,13507,United Kingdom
580907,22185,SLATE TILE NATURAL HANGING,12,12/6/2011 13:13,0.79,13507,United Kingdom
580907,22217,T-LIGHT HOLDER HANGING LACE,12,12/6/2011 13:13,0.39,13507,United Kingdom
580907,22220,CAKE STAND LOVEBIRD 2 TIER WHITE,6,12/6/2011 13:13,2.95,13507,United Kingdom
580907,22464,HANGING METAL HEART LANTERN,12,12/6/2011 13:13,0.79,13507,United Kingdom
580907,23320,GIANT 50'S CHRISTMAS CRACKER,12,12/6/2011 13:13,1.25,13507,United Kingdom
580907,22990,COTTON APRON PANTRY DESIGN,12,12/6/2011 13:13,1.95,13507,United Kingdom
580907,22758,LARGE PURPLE BABUSHKA NOTEBOOK  ,12,12/6/2011 13:13,0.39,13507,United Kingdom
580907,22757,LARGE RED BABUSHKA NOTEBOOK ,12,12/6/2011 13:13,0.39,13507,United Kingdom
580907,22755,SMALL PURPLE BABUSHKA NOTEBOOK ,24,12/6/2011 13:13,0.21,13507,United Kingdom
580907,22754,SMALL RED BABUSHKA NOTEBOOK ,24,12/6/2011 13:13,0.21,13507,United Kingdom
580907,22646,CERAMIC STRAWBERRY CAKE MONEY BANK,36,12/6/2011 13:13,0.39,13507,United Kingdom
580907,22596,CHRISTMAS STAR WISH LIST CHALKBOARD,12,12/6/2011 13:13,0.39,13507,United Kingdom
580907,22496,SET OF 2 ROUND TINS DUTCH CHEESE,12,12/6/2011 13:13,0.79,13507,United Kingdom
580907,22495,SET OF 2 ROUND TINS CAMEMBERT ,12,12/6/2011 13:13,0.79,13507,United Kingdom
580907,22845,VINTAGE CREAM CAT FOOD CONTAINER,2,12/6/2011 13:13,6.35,13507,United Kingdom
580907,23148,MINIATURE ANTIQUE ROSE HOOK IVORY,12,12/6/2011 13:13,0.83,13507,United Kingdom
580907,23061,VINTAGE EMBOSSED HEART,12,12/6/2011 13:13,1.25,13507,United Kingdom
580907,21733,RED HANGING HEART T-LIGHT HOLDER,6,12/6/2011 13:13,2.95,13507,United Kingdom
580907,84950,ASSORTED COLOUR T-LIGHT HOLDER,12,12/6/2011 13:13,0.65,13507,United Kingdom
580907,21428,SET3 BOOK BOX GREEN GINGHAM FLOWER ,4,12/6/2011 13:13,4.25,13507,United Kingdom
580907,47591D,PINK FAIRY CAKE CHILDRENS APRON,8,12/6/2011 13:13,1.95,13507,United Kingdom
580908,84375,SET OF 20 KIDS COOKIE CUTTERS,1,12/6/2011 13:20,2.1,16495,United Kingdom
580908,84992,72 SWEETHEART FAIRY CAKE CASES,1,12/6/2011 13:20,0.55,16495,United Kingdom
580908,23301,GARDENERS KNEELING PAD KEEP CALM ,3,12/6/2011 13:20,1.65,16495,United Kingdom
580908,21122,SET/10 PINK POLKADOT PARTY CANDLES,2,12/6/2011 13:20,1.25,16495,United Kingdom
580908,21124,SET/10 BLUE POLKADOT PARTY CANDLES,2,12/6/2011 13:20,1.25,16495,United Kingdom
580908,21121,SET/10 RED POLKADOT PARTY CANDLES,1,12/6/2011 13:20,1.25,16495,United Kingdom
580908,22558,CLOTHES PEGS RETROSPOT PACK 24 ,9,12/6/2011 13:20,1.65,16495,United Kingdom
580908,21213,PACK OF 72 SKULL CAKE CASES,1,12/6/2011 13:20,0.55,16495,United Kingdom
580908,22952,60 CAKE CASES VINTAGE CHRISTMAS,1,12/6/2011 13:20,0.55,16495,United Kingdom
580908,21584,RETROSPOT SMALL TUBE MATCHES,2,12/6/2011 13:20,1.65,16495,United Kingdom
580908,23309,SET OF 60 I LOVE LONDON CAKE CASES ,2,12/6/2011 13:20,0.55,16495,United Kingdom
580908,22952,60 CAKE CASES VINTAGE CHRISTMAS,1,12/6/2011 13:20,0.55,16495,United Kingdom
580908,22439,6 ROCKET BALLOONS ,10,12/6/2011 13:20,0.65,16495,United Kingdom
580908,21983,PACK OF 12 BLUE PAISLEY TISSUES ,12,12/6/2011 13:20,0.39,16495,United Kingdom
580908,22139,RETROSPOT TEA SET CERAMIC 11 PC ,1,12/6/2011 13:20,4.95,16495,United Kingdom
580908,22605,WOODEN CROQUET GARDEN SET,1,12/6/2011 13:20,14.95,16495,United Kingdom
580908,23335,EGG FRYING PAN IVORY ,1,12/6/2011 13:20,2.08,16495,United Kingdom
580908,22141,CHRISTMAS CRAFT TREE TOP ANGEL,1,12/6/2011 13:20,2.1,16495,United Kingdom
580908,21584,RETROSPOT SMALL TUBE MATCHES,1,12/6/2011 13:20,1.65,16495,United Kingdom
580908,22139,RETROSPOT TEA SET CERAMIC 11 PC ,1,12/6/2011 13:20,4.95,16495,United Kingdom
580908,23127,FELTCRAFT GIRL NICOLE KIT,1,12/6/2011 13:20,4.95,16495,United Kingdom
580908,22367,CHILDRENS APRON SPACEBOY DESIGN,1,12/6/2011 13:20,1.95,16495,United Kingdom
580908,22617,BAKING SET SPACEBOY DESIGN,2,12/6/2011 13:20,4.95,16495,United Kingdom
580908,22367,CHILDRENS APRON SPACEBOY DESIGN,1,12/6/2011 13:20,1.95,16495,United Kingdom
580908,22635,CHILDS BREAKFAST SET DOLLY GIRL ,1,12/6/2011 13:20,9.95,16495,United Kingdom
580908,22634,CHILDS BREAKFAST SET SPACEBOY ,1,12/6/2011 13:20,9.95,16495,United Kingdom
580908,84658,WHITE STITCHED CUSHION COVER,2,12/6/2011 13:20,6.95,16495,United Kingdom
580908,22517,CHILDS GARDEN RAKE PINK,1,12/6/2011 13:20,2.1,16495,United Kingdom
580908,22515,CHILDS GARDEN SPADE PINK,1,12/6/2011 13:20,2.1,16495,United Kingdom
580908,20677,PINK POLKADOT BOWL,12,12/6/2011 13:20,1.25,16495,United Kingdom
580908,22438,BALLOON ART MAKE YOUR OWN FLOWERS,1,12/6/2011 13:20,0.39,16495,United Kingdom
580908,21714,CITRONELLA CANDLE GARDEN POT,6,12/6/2011 13:20,1.25,16495,United Kingdom
580908,23310,BUBBLEGUM RING ASSORTED,1,12/6/2011 13:20,0.42,16495,United Kingdom
580908,23388,WOODLAND MINI BACKPACK,1,12/6/2011 13:20,4.15,16495,United Kingdom
580908,22488,NATURAL SLATE RECTANGLE CHALKBOARD,3,12/6/2011 13:20,1.65,16495,United Kingdom
580908,20659,ECONOMY LUGGAGE TAG,1,12/6/2011 13:20,1.25,16495,United Kingdom
580908,21621,VINTAGE UNION JACK BUNTING,1,12/6/2011 13:20,8.5,16495,United Kingdom
580908,22086,PAPER CHAIN KIT 50'S CHRISTMAS ,3,12/6/2011 13:20,2.95,16495,United Kingdom
580908,84949,SILVER HANGING T-LIGHT HOLDER,6,12/6/2011 13:20,1.65,16495,United Kingdom
580908,22139,RETROSPOT TEA SET CERAMIC 11 PC ,1,12/6/2011 13:20,4.95,16495,United Kingdom
580908,22302,COFFEE MUG PEARS  DESIGN,12,12/6/2011 13:20,2.55,16495,United Kingdom
580908,84086B,YELLOW/BLUE RETRO RADIO,1,12/6/2011 13:20,2.95,16495,United Kingdom
580908,23500,KEY RING BASEBALL BOOT ASSORTED ,20,12/6/2011 13:20,1.25,16495,United Kingdom
580908,21462,"NURSERY A,B,C PAINTED LETTERS",1,12/6/2011 13:20,1.95,16495,United Kingdom
580908,22150,3 STRIPEY MICE FELTCRAFT,1,12/6/2011 13:20,1.95,16495,United Kingdom
580908,22367,CHILDRENS APRON SPACEBOY DESIGN,1,12/6/2011 13:20,1.95,16495,United Kingdom
580908,22617,BAKING SET SPACEBOY DESIGN,1,12/6/2011 13:20,4.95,16495,United Kingdom
580908,22635,CHILDS BREAKFAST SET DOLLY GIRL ,1,12/6/2011 13:20,9.95,16495,United Kingdom
580908,22634,CHILDS BREAKFAST SET SPACEBOY ,3,12/6/2011 13:20,9.95,16495,United Kingdom
580908,23127,FELTCRAFT GIRL NICOLE KIT,1,12/6/2011 13:20,4.95,16495,United Kingdom
580908,22150,3 STRIPEY MICE FELTCRAFT,1,12/6/2011 13:20,1.95,16495,United Kingdom
580908,22606,WOODEN SKITTLES GARDEN SET,1,12/6/2011 13:20,15.95,16495,United Kingdom
580908,22139,RETROSPOT TEA SET CERAMIC 11 PC ,1,12/6/2011 13:20,4.95,16495,United Kingdom
580908,22992,REVOLVER WOODEN RULER ,3,12/6/2011 13:20,1.95,16495,United Kingdom
580908,22991,GIRAFFE WOODEN RULER,1,12/6/2011 13:20,1.95,16495,United Kingdom
580908,21065,BOOM BOX SPEAKER GIRLS,2,12/6/2011 13:20,1.25,16495,United Kingdom
580908,23301,GARDENERS KNEELING PAD KEEP CALM ,4,12/6/2011 13:20,1.65,16495,United Kingdom
580908,23318,BOX OF 6 MINI VINTAGE CRACKERS,2,12/6/2011 13:20,2.49,16495,United Kingdom
580908,22158,3 HEARTS HANGING DECORATION RUSTIC,1,12/6/2011 13:20,2.95,16495,United Kingdom
580908,23103,JINGLE BELL HEART DECORATION,1,12/6/2011 13:20,1.65,16495,United Kingdom
580908,22606,WOODEN SKITTLES GARDEN SET,2,12/6/2011 13:20,15.95,16495,United Kingdom
580908,21584,RETROSPOT SMALL TUBE MATCHES,4,12/6/2011 13:20,1.65,16495,United Kingdom
580908,23126,FELTCRAFT GIRL AMELIE KIT,1,12/6/2011 13:20,4.95,16495,United Kingdom
580908,85135C,RED DRAGONFLY HELICOPTER,4,12/6/2011 13:20,7.95,16495,United Kingdom
580909,23343,JUMBO BAG VINTAGE CHRISTMAS ,20,12/6/2011 13:27,2.08,18225,United Kingdom
580909,22910,PAPER CHAIN KIT VINTAGE CHRISTMAS,6,12/6/2011 13:27,2.95,18225,United Kingdom
580909,21872,GLAMOROUS  MUG,12,12/6/2011 13:27,1.25,18225,United Kingdom
580909,21876,POTTERING MUG,12,12/6/2011 13:27,1.65,18225,United Kingdom
580909,23344,JUMBO BAG 50'S CHRISTMAS ,10,12/6/2011 13:27,2.08,18225,United Kingdom
580909,22663,JUMBO BAG DOLLY GIRL DESIGN,10,12/6/2011 13:27,2.08,18225,United Kingdom
580909,22385,JUMBO BAG SPACEBOY DESIGN,10,12/6/2011 13:27,2.08,18225,United Kingdom
580909,23582,VINTAGE DOILY JUMBO BAG RED ,10,12/6/2011 13:27,2.08,18225,United Kingdom
580909,23581,JUMBO BAG PAISLEY PARK,10,12/6/2011 13:27,2.08,18225,United Kingdom
580909,23200,JUMBO BAG PEARS,10,12/6/2011 13:27,2.08,18225,United Kingdom
580909,21929,JUMBO BAG PINK VINTAGE PAISLEY,10,12/6/2011 13:27,2.08,18225,United Kingdom
580909,21928,JUMBO BAG SCANDINAVIAN BLUE PAISLEY,10,12/6/2011 13:27,2.08,18225,United Kingdom
580909,22083,PAPER CHAIN KIT RETROSPOT,6,12/6/2011 13:27,2.95,18225,United Kingdom
580909,23498,CLASSIC BICYCLE CLIPS ,12,12/6/2011 13:27,1.45,18225,United Kingdom
580909,23562,SET OF 6 RIBBONS PERFECTLY PRETTY  ,6,12/6/2011 13:27,2.89,18225,United Kingdom
580909,23560,SET OF 6 RIBBONS COUNTRY STYLE,6,12/6/2011 13:27,2.89,18225,United Kingdom
580910,21411,GINGHAM HEART  DOORSTOP RED,96,12/6/2011 13:29,1.95,13225,United Kingdom
580910,22165,"DIAMANTE HEART SHAPED WALL MIRROR, ",144,12/6/2011 13:29,3.95,13225,United Kingdom
580910,22166,WALL MIRROR RECTANGLE DIAMANTE PINK,96,12/6/2011 13:29,2.95,13225,United Kingdom
580910,22464,HANGING METAL HEART LANTERN,192,12/6/2011 13:29,0.79,13225,United Kingdom
580910,22646,CERAMIC STRAWBERRY CAKE MONEY BANK,144,12/6/2011 13:29,0.39,13225,United Kingdom
580910,22644,CERAMIC CHERRY CAKE MONEY BANK,144,12/6/2011 13:29,0.39,13225,United Kingdom
580910,22785,SQUARECUSHION COVER PINK UNION JACK,48,12/6/2011 13:29,1.25,13225,United Kingdom
580911,22386,JUMBO BAG PINK POLKADOT,10,12/6/2011 13:30,2.08,14503,United Kingdom
580911,22411,JUMBO SHOPPER VINTAGE RED PAISLEY,10,12/6/2011 13:30,2.08,14503,United Kingdom
580911,23344,JUMBO BAG 50'S CHRISTMAS ,10,12/6/2011 13:30,2.08,14503,United Kingdom
580911,23203,JUMBO BAG VINTAGE DOILY ,10,12/6/2011 13:30,2.08,14503,United Kingdom
580911,85099C,JUMBO  BAG BAROQUE BLACK WHITE,10,12/6/2011 13:30,2.08,14503,United Kingdom
580911,23497,CLASSIC CHROME BICYCLE BELL ,12,12/6/2011 13:30,1.45,14503,United Kingdom
580911,22792,FLUTED ANTIQUE CANDLE HOLDER,12,12/6/2011 13:30,0.85,14503,United Kingdom
580911,23090,VINTAGE GLASS T-LIGHT HOLDER,12,12/6/2011 13:30,0.83,14503,United Kingdom
580911,22577,WOODEN HEART CHRISTMAS SCANDINAVIAN,12,12/6/2011 13:30,0.29,14503,United Kingdom
580911,22578,WOODEN STAR CHRISTMAS SCANDINAVIAN,12,12/6/2011 13:30,0.29,14503,United Kingdom
580911,22576,SWALLOW WOODEN CHRISTMAS DECORATION,12,12/6/2011 13:30,0.85,14503,United Kingdom
580911,22603,CHRISTMAS RETROSPOT TREE WOOD,12,12/6/2011 13:30,0.85,14503,United Kingdom
580911,85199S,SMALL HANGING IVORY/RED WOOD BIRD,24,12/6/2011 13:30,0.42,14503,United Kingdom
580911,23286,BLUE VINTAGE SPOT BEAKER,8,12/6/2011 13:30,0.85,14503,United Kingdom
580911,22139,RETROSPOT TEA SET CERAMIC 11 PC ,6,12/6/2011 13:30,4.95,14503,United Kingdom
580911,21914,BLUE HARMONICA IN BOX ,12,12/6/2011 13:30,1.25,14503,United Kingdom
580911,23493,VINTAGE DOILY TRAVEL SEWING KIT,10,12/6/2011 13:30,1.95,14503,United Kingdom
580911,22553,PLASTERS IN TIN SKULLS,12,12/6/2011 13:30,1.65,14503,United Kingdom
580911,21485,RETROSPOT HEART HOT WATER BOTTLE,3,12/6/2011 13:30,4.95,14503,United Kingdom
580911,22910,PAPER CHAIN KIT VINTAGE CHRISTMAS,6,12/6/2011 13:30,2.95,14503,United Kingdom
580911,22086,PAPER CHAIN KIT 50'S CHRISTMAS ,12,12/6/2011 13:30,2.95,14503,United Kingdom
C580912,22041,"RECORD FRAME 7"" SINGLE SIZE ",-24,12/6/2011 13:37,2.55,12989,United Kingdom
C580913,22536,MAGIC DRAWING SLATE PURDEY,-120,12/6/2011 13:41,0.36,17857,United Kingdom
580914,71477,COLOURED GLASS STAR T-LIGHT HOLDER,6,12/6/2011 13:42,3.95,14871,United Kingdom
580914,22910,PAPER CHAIN KIT VINTAGE CHRISTMAS,2,12/6/2011 13:42,2.95,14871,United Kingdom
580914,23499,SET 12 VINTAGE DOILY CHALK ,3,12/6/2011 13:42,0.42,14871,United Kingdom
580914,23503,PLAYING CARDS KEEP CALM & CARRY ON,2,12/6/2011 13:42,1.25,14871,United Kingdom
580914,23504,PLAYING CARDS JUBILEE UNION JACK,2,12/6/2011 13:42,1.25,14871,United Kingdom
