579297,23300,GARDENERS KNEELING PAD CUP OF TEA ,2,11/29/2011 11:23,3.29,,United Kingdom
579297,23311,VINTAGE CHRISTMAS STOCKING ,3,11/29/2011 11:23,4.96,,United Kingdom
579297,23328,SET 6 SCHOOL MILK BOTTLES IN CRATE,12,11/29/2011 11:23,7.46,,United Kingdom
579297,23331,DECORATIVE WICKER HEART SMALL,10,11/29/2011 11:23,1.25,,United Kingdom
579297,23332,IVORY WICKER HEART LARGE,1,11/29/2011 11:23,3.29,,United Kingdom
579297,23343,JUMBO BAG VINTAGE CHRISTMAS ,1,11/29/2011 11:23,4.13,,United Kingdom
579297,23344,JUMBO BAG 50'S CHRISTMAS ,1,11/29/2011 11:23,4.13,,United Kingdom
579297,23345, DOLLY GIRL BEAKER,1,11/29/2011 11:23,2.46,,United Kingdom
579297,23349,ROLL WRAP VINTAGE CHRISTMAS,14,11/29/2011 11:23,2.46,,United Kingdom
579297,23351,ROLL WRAP 50'S CHRISTMAS,13,11/29/2011 11:23,2.46,,United Kingdom
579297,23352,ROLL WRAP 50'S RED CHRISTMAS ,10,11/29/2011 11:23,2.46,,United Kingdom
579297,23353,6 GIFT TAGS VINTAGE CHRISTMAS ,2,11/29/2011 11:23,1.63,,United Kingdom
579297,23354,6 GIFT TAGS 50'S CHRISTMAS ,5,11/29/2011 11:23,1.63,,United Kingdom
579297,23367,SET 12 COLOUR PENCILS SPACEBOY ,2,11/29/2011 11:23,1.25,,United Kingdom
579297,23382,BOX OF 6 CHRISTMAS CAKE DECORATIONS,8,11/29/2011 11:23,7.46,,United Kingdom
579297,23389,SPACEBOY MINI BACKPACK,1,11/29/2011 11:23,8.29,,United Kingdom
579297,23397,FOOT STOOL HOME SWEET HOME ,2,11/29/2011 11:23,19.96,,United Kingdom
579297,23403,LETTER HOLDER HOME SWEET HOME,1,11/29/2011 11:23,7.46,,United Kingdom
579297,23404,HOME SWEET HOME BLACKBOARD,1,11/29/2011 11:23,10.79,,United Kingdom
579297,23480,MINI LIGHTS WOODLAND MUSHROOMS,5,11/29/2011 11:23,7.46,,United Kingdom
579297,23489,VINTAGE BELLS GARLAND,1,11/29/2011 11:23,5.79,,United Kingdom
579297,23493,VINTAGE DOILY TRAVEL SEWING KIT,2,11/29/2011 11:23,3.29,,United Kingdom
579297,23504,PLAYING CARDS JUBILEE UNION JACK,1,11/29/2011 11:23,2.46,,United Kingdom
579297,23526,WALL ART DOG LICENCE ,1,11/29/2011 11:23,12.46,,United Kingdom
579297,23534,WALL ART STOP FOR TEA ,1,11/29/2011 11:23,12.46,,United Kingdom
579297,23535,WALL ART BICYCLE SAFETY,2,11/29/2011 11:23,12.46,,United Kingdom
579297,23541,WALL ART CLASSIC PUDDINGS ,2,11/29/2011 11:23,12.46,,United Kingdom
579297,23567,EGG CUP HENRIETTA HEN PINK,1,11/29/2011 11:23,2.46,,United Kingdom
579297,37340,MULTICOLOUR SPRING FLOWER MUG,6,11/29/2011 11:23,1.38,,United Kingdom
579297,48138,DOORMAT UNION FLAG,2,11/29/2011 11:23,14.13,,United Kingdom
579297,71053,WHITE MOROCCAN METAL LANTERN,3,11/29/2011 11:23,8.29,,United Kingdom
579297,72801c,4 ROSE PINK DINNER CANDLES,1,11/29/2011 11:23,2.46,,United Kingdom
579297,75049L,LARGE CIRCULAR MIRROR MOBILE,2,11/29/2011 11:23,2.46,,United Kingdom
579297,82001s,SILVER RECORD COVER FRAME,2,11/29/2011 11:23,7.46,,United Kingdom
579297,82482,WOODEN PICTURE FRAME WHITE FINISH,1,11/29/2011 11:23,4.96,,United Kingdom
579297,82494l,WOODEN FRAME ANTIQUE WHITE ,7,11/29/2011 11:23,8.29,,United Kingdom
579297,82551,LAUNDRY 15C METAL SIGN,2,11/29/2011 11:23,2.46,,United Kingdom
579297,82580,BATHROOM METAL SIGN,1,11/29/2011 11:23,1.25,,United Kingdom
579297,82581,TOILET METAL SIGN,1,11/29/2011 11:23,1.25,,United Kingdom
579297,82600,N0 SINGING METAL SIGN,2,11/29/2011 11:23,4.13,,United Kingdom
579297,84032A,CHARLIE+LOLA PINK HOT WATER BOTTLE,3,11/29/2011 11:23,5.79,,United Kingdom
579297,84032B,CHARLIE + LOLA RED HOT WATER BOTTLE,6,11/29/2011 11:23,3.29,,United Kingdom
579297,84969,BOX OF 6 ASSORTED COLOUR TEASPOONS,1,11/29/2011 11:23,8.29,,United Kingdom
579297,84970l,SINGLE HEART ZINC T-LIGHT HOLDER,2,11/29/2011 11:23,2.08,,United Kingdom
579297,85014a,BLACK/BLUE POLKADOT UMBRELLA,1,11/29/2011 11:23,12.46,,United Kingdom
579297,85014b,RED RETROSPOT UMBRELLA,1,11/29/2011 11:23,12.46,,United Kingdom
579297,85048,15CM CHRISTMAS GLASS BALL 20 LIGHTS,1,11/29/2011 11:23,16.63,,United Kingdom
579297,85049a,TRADITIONAL CHRISTMAS RIBBONS,3,11/29/2011 11:23,3.29,,United Kingdom
579297,85071C,"CHARLIE+LOLA""EXTREMELY BUSY"" SIGN",1,11/29/2011 11:23,1.63,,United Kingdom
579297,85099B,JUMBO BAG RED RETROSPOT,16,11/29/2011 11:23,4.13,,United Kingdom
579297,85099C,JUMBO  BAG BAROQUE BLACK WHITE,5,11/29/2011 11:23,4.13,,United Kingdom
579297,85123a,WHITE HANGING HEART T-LIGHT HOLDER,1,11/29/2011 11:23,6.63,,United Kingdom
579297,85173,SET/6 FROG PRINCE T-LIGHT CANDLES,1,11/29/2011 11:23,4.96,,United Kingdom
579297,85179a,GREEN BITTY LIGHT CHAIN,1,11/29/2011 11:23,2.46,,United Kingdom
579297,DOT,DOTCOM POSTAGE,1,11/29/2011 11:23,1563,,United Kingdom
579300,21034,REX CASH+CARRY JUMBO SHOPPER,3,11/29/2011 11:30,0.95,14667,United Kingdom
579300,85099B,JUMBO BAG RED RETROSPOT,20,11/29/2011 11:30,2.08,14667,United Kingdom
579300,23344,JUMBO BAG 50'S CHRISTMAS ,32,11/29/2011 11:30,2.08,14667,United Kingdom
579300,21351,CINAMMON & ORANGE WREATH,4,11/29/2011 11:30,6.75,14667,United Kingdom
579300,22571,ROCKING HORSE RED CHRISTMAS ,18,11/29/2011 11:30,0.85,14667,United Kingdom
579300,22578,WOODEN STAR CHRISTMAS SCANDINAVIAN,20,11/29/2011 11:30,0.29,14667,United Kingdom
579300,22577,WOODEN HEART CHRISTMAS SCANDINAVIAN,21,11/29/2011 11:30,0.29,14667,United Kingdom
579300,23333,IVORY WICKER HEART MEDIUM,24,11/29/2011 11:30,1.25,14667,United Kingdom
579300,23334,IVORY WICKER HEART SMALL,46,11/29/2011 11:30,0.63,14667,United Kingdom
579300,22576,SWALLOW WOODEN CHRISTMAS DECORATION,48,11/29/2011 11:30,0.85,14667,United Kingdom
579300,23219,LAUREL STAR ANTIQUE SILVER ,36,11/29/2011 11:30,1.25,14667,United Kingdom
579300,23275,SET OF 3 HANGING OWLS OLLIE BEAK,12,11/29/2011 11:30,1.25,14667,United Kingdom
579300,23215,JINGLE BELL HEART ANTIQUE SILVER,24,11/29/2011 11:30,2.08,14667,United Kingdom
579301,22061,LARGE CAKE STAND  HANGING STRAWBERY,1,11/29/2011 11:32,9.95,18118,United Kingdom
579301,23322,LARGE WHITE HEART OF WICKER,2,11/29/2011 11:32,2.95,18118,United Kingdom
579301,22197,POPCORN HOLDER,15,11/29/2011 11:32,0.85,18118,United Kingdom
579301,21899,GARAGE KEY FOB,1,11/29/2011 11:32,0.65,18118,United Kingdom
579301,23270,SET OF 2 CERAMIC PAINTED HEARTS ,1,11/29/2011 11:32,1.45,18118,United Kingdom
579301,23269,SET OF 2 CERAMIC CHRISTMAS TREES,1,11/29/2011 11:32,1.45,18118,United Kingdom
579301,23263,SET OF 3 WOODEN HEART DECORATIONS,1,11/29/2011 11:32,1.25,18118,United Kingdom
579301,22577,WOODEN HEART CHRISTMAS SCANDINAVIAN,3,11/29/2011 11:32,0.29,18118,United Kingdom
579301,22581,WOOD STOCKING CHRISTMAS SCANDISPOT,1,11/29/2011 11:32,0.29,18118,United Kingdom
579301,22595,GINGHAM HEART DECORATION,3,11/29/2011 11:32,0.85,18118,United Kingdom
579301,22578,WOODEN STAR CHRISTMAS SCANDINAVIAN,3,11/29/2011 11:32,0.29,18118,United Kingdom
579301,21385,IVORY HANGING DECORATION  HEART,6,11/29/2011 11:32,0.85,18118,United Kingdom
579301,22457,NATURAL SLATE HEART CHALKBOARD ,1,11/29/2011 11:32,2.95,18118,United Kingdom
579301,23367,SET 12 COLOUR PENCILS SPACEBOY ,1,11/29/2011 11:32,0.65,18118,United Kingdom
579301,23368,SET 12 COLOUR PENCILS DOLLY GIRL ,1,11/29/2011 11:32,0.65,18118,United Kingdom
579301,20978,36 PENCILS TUBE SKULLS,2,11/29/2011 11:32,1.25,18118,United Kingdom
579301,20975,12 PENCILS SMALL TUBE RED RETROSPOT,5,11/29/2011 11:32,0.65,18118,United Kingdom
579301,23320,GIANT 50'S CHRISTMAS CRACKER,1,11/29/2011 11:32,2.89,18118,United Kingdom
579301,23321,SMALL WHITE HEART OF WICKER,1,11/29/2011 11:32,1.65,18118,United Kingdom
579301,23319,BOX OF 6 MINI 50'S CRACKERS,1,11/29/2011 11:32,2.49,18118,United Kingdom
579301,23581,JUMBO BAG PAISLEY PARK,1,11/29/2011 11:32,2.08,18118,United Kingdom
579301,85099B,JUMBO BAG RED RETROSPOT,3,11/29/2011 11:32,2.08,18118,United Kingdom
579301,23343,JUMBO BAG VINTAGE CHRISTMAS ,2,11/29/2011 11:32,2.08,18118,United Kingdom
579301,23344,JUMBO BAG 50'S CHRISTMAS ,1,11/29/2011 11:32,2.08,18118,United Kingdom
579301,22112,CHOCOLATE HOT WATER BOTTLE,1,11/29/2011 11:32,4.95,18118,United Kingdom
579301,23355,HOT WATER BOTTLE KEEP CALM,1,11/29/2011 11:32,4.95,18118,United Kingdom
579301,22189,CREAM HEART CARD HOLDER,2,11/29/2011 11:32,3.95,18118,United Kingdom
579301,22424,ENAMEL BREAD BIN CREAM,1,11/29/2011 11:32,12.75,18118,United Kingdom
579301,22429,ENAMEL MEASURING JUG CREAM,1,11/29/2011 11:32,4.25,18118,United Kingdom
579301,85049H,URBAN BLACK RIBBONS ,1,11/29/2011 11:32,1.25,18118,United Kingdom
579301,85049G,CHOCOLATE BOX RIBBONS ,1,11/29/2011 11:32,1.25,18118,United Kingdom
579301,85049C,ROMANTIC PINKS RIBBONS ,1,11/29/2011 11:32,1.25,18118,United Kingdom
579301,22077,6 RIBBONS RUSTIC CHARM,1,11/29/2011 11:32,1.95,18118,United Kingdom
579301,22367,CHILDRENS APRON SPACEBOY DESIGN,1,11/29/2011 11:32,1.95,18118,United Kingdom
579301,21035,SET/2 RED RETROSPOT TEA TOWELS ,1,11/29/2011 11:32,3.25,18118,United Kingdom
579301,21154,RED RETROSPOT OVEN GLOVE ,1,11/29/2011 11:32,1.25,18118,United Kingdom
579301,85152,HAND OVER THE CHOCOLATE   SIGN ,1,11/29/2011 11:32,2.1,18118,United Kingdom
579301,21166,COOK WITH WINE METAL SIGN ,1,11/29/2011 11:32,2.08,18118,United Kingdom
579301,22720,SET OF 3 CAKE TINS PANTRY DESIGN ,1,11/29/2011 11:32,4.95,18118,United Kingdom
579301,22596,CHRISTMAS STAR WISH LIST CHALKBOARD,3,11/29/2011 11:32,1.25,18118,United Kingdom
579301,22666,RECIPE BOX PANTRY YELLOW DESIGN,1,11/29/2011 11:32,2.95,18118,United Kingdom
579301,21327,SKULLS WRITING SET ,5,11/29/2011 11:32,1.65,18118,United Kingdom
579301,21329,DINOSAURS  WRITING SET ,4,11/29/2011 11:32,1.65,18118,United Kingdom
579301,20992,JAZZ HEARTS PURSE NOTEBOOK,2,11/29/2011 11:32,0.39,18118,United Kingdom
579301,23068,ALUMINIUM STAMPED HEART,1,11/29/2011 11:32,2.49,18118,United Kingdom
579301,21243,PINK POLKADOT PLATE ,1,11/29/2011 11:32,1.69,18118,United Kingdom
579301,21239,PINK  POLKADOT CUP,1,11/29/2011 11:32,0.85,18118,United Kingdom
579301,22352,LUNCH BOX WITH CUTLERY RETROSPOT ,1,11/29/2011 11:32,2.55,18118,United Kingdom
579301,20677,PINK POLKADOT BOWL,1,11/29/2011 11:32,1.25,18118,United Kingdom
579301,84997D,CHILDRENS CUTLERY POLKADOT PINK,1,11/29/2011 11:32,4.15,18118,United Kingdom
579301,21559,STRAWBERRY LUNCH BOX WITH CUTLERY,1,11/29/2011 11:32,2.55,18118,United Kingdom
579301,84519B,CARROT CHARLIE+LOLA COASTER SET,2,11/29/2011 11:32,1.25,18118,United Kingdom
579301,84519A,TOMATO CHARLIE+LOLA COASTER SET,1,11/29/2011 11:32,1.25,18118,United Kingdom
579301,23301,GARDENERS KNEELING PAD KEEP CALM ,3,11/29/2011 11:32,1.65,18118,United Kingdom
579301,22065,CHRISTMAS PUDDING TRINKET POT ,2,11/29/2011 11:32,0.39,18118,United Kingdom
579301,20914,SET/5 RED RETROSPOT LID GLASS BOWLS,1,11/29/2011 11:32,2.95,18118,United Kingdom
579301,20969,RED FLORAL FELTCRAFT SHOULDER BAG,1,11/29/2011 11:32,3.75,18118,United Kingdom
579301,85123A,WHITE HANGING HEART T-LIGHT HOLDER,3,11/29/2011 11:32,2.95,18118,United Kingdom
579301,21158,MOODY GIRL DOOR HANGER ,2,11/29/2011 11:32,0.39,18118,United Kingdom
579301,21159,MOODY BOY  DOOR HANGER ,2,11/29/2011 11:32,0.39,18118,United Kingdom
579301,21162,TOXIC AREA  DOOR HANGER ,2,11/29/2011 11:32,0.39,18118,United Kingdom
579301,22940,FELTCRAFT CHRISTMAS FAIRY,1,11/29/2011 11:32,4.25,18118,United Kingdom
579301,85071C,"CHARLIE+LOLA""EXTREMELY BUSY"" SIGN",3,11/29/2011 11:32,0.39,18118,United Kingdom
579301,85071B,RED CHARLIE+LOLA PERSONAL DOORSIGN,2,11/29/2011 11:32,0.39,18118,United Kingdom
579301,85071D,CHARLIE+LOLA MY ROOM DOOR SIGN,2,11/29/2011 11:32,0.39,18118,United Kingdom
579301,85071A,BLUE CHARLIE+LOLA PERSONAL DOORSIGN,2,11/29/2011 11:32,0.39,18118,United Kingdom
579301,23564,EGG CUP MILKMAID INGRID,1,11/29/2011 11:32,1.25,18118,United Kingdom
579301,21231,SWEETHEART CERAMIC TRINKET BOX,1,11/29/2011 11:32,1.25,18118,United Kingdom
579301,22650,CERAMIC PIRATE CHEST MONEY BANK,2,11/29/2011 11:32,1.45,18118,United Kingdom
579301,22645,CERAMIC HEART FAIRY CAKE MONEY BANK,2,11/29/2011 11:32,1.45,18118,United Kingdom
579301,21430,SET/3 RED GINGHAM ROSE STORAGE BOX,2,11/29/2011 11:32,3.75,18118,United Kingdom
579301,21429,RED GINGHAM ROSE JEWELLERY BOX,2,11/29/2011 11:32,1.95,18118,United Kingdom
579301,22383,LUNCH BAG SUKI DESIGN ,2,11/29/2011 11:32,1.65,18118,United Kingdom
579301,23583,LUNCH BAG PAISLEY PARK  ,1,11/29/2011 11:32,1.65,18118,United Kingdom
579301,22086,PAPER CHAIN KIT 50'S CHRISTMAS ,4,11/29/2011 11:32,2.95,18118,United Kingdom
579301,22910,PAPER CHAIN KIT VINTAGE CHRISTMAS,2,11/29/2011 11:32,2.95,18118,United Kingdom
579301,22749,FELTCRAFT PRINCESS CHARLOTTE DOLL,1,11/29/2011 11:32,3.75,18118,United Kingdom
579301,22750,FELTCRAFT PRINCESS LOLA DOLL,1,11/29/2011 11:32,3.75,18118,United Kingdom
579301,20972,PINK CREAM FELT CRAFT TRINKET BOX ,3,11/29/2011 11:32,1.25,18118,United Kingdom
579301,22141,CHRISTMAS CRAFT TREE TOP ANGEL,2,11/29/2011 11:32,2.1,18118,United Kingdom
579301,22138,BAKING SET 9 PIECE RETROSPOT ,1,11/29/2011 11:32,4.95,18118,United Kingdom
579301,22617,BAKING SET SPACEBOY DESIGN,1,11/29/2011 11:32,4.95,18118,United Kingdom
579301,22440,BALLOON WATER BOMB PACK OF 35,3,11/29/2011 11:32,0.42,18118,United Kingdom
579301,22620,4 TRADITIONAL SPINNING TOPS,2,11/29/2011 11:32,1.45,18118,United Kingdom
579301,22621,TRADITIONAL KNITTING NANCY,3,11/29/2011 11:32,1.65,18118,United Kingdom
579301,22633,HAND WARMER UNION JACK,1,11/29/2011 11:32,2.1,18118,United Kingdom
579301,22865,HAND WARMER OWL DESIGN,2,11/29/2011 11:32,2.1,18118,United Kingdom
579301,22144,CHRISTMAS CRAFT LITTLE FRIENDS,3,11/29/2011 11:32,2.1,18118,United Kingdom
579307,48185,DOORMAT FAIRY CAKE,2,11/29/2011 11:34,8.25,17655,United Kingdom
579307,48111,DOORMAT 3 SMILEY CATS,2,11/29/2011 11:34,8.25,17655,United Kingdom
579307,22835,HOT WATER BOTTLE I AM SO POORLY,8,11/29/2011 11:34,4.95,17655,United Kingdom
579307,22112,CHOCOLATE HOT WATER BOTTLE,24,11/29/2011 11:34,4.25,17655,United Kingdom
579307,22114,HOT WATER BOTTLE TEA AND SYMPATHY,8,11/29/2011 11:34,4.25,17655,United Kingdom
579307,84879,ASSORTED COLOUR BIRD ORNAMENT,16,11/29/2011 11:34,1.69,17655,United Kingdom
579307,23357,HOT WATER BOTTLE SEX BOMB,4,11/29/2011 11:34,4.95,17655,United Kingdom
579307,23355,HOT WATER BOTTLE KEEP CALM,4,11/29/2011 11:34,4.95,17655,United Kingdom
579307,22733,3D TRADITIONAL CHRISTMAS STICKERS,18,11/29/2011 11:34,1.25,17655,United Kingdom
579307,84347,ROTATING SILVER ANGELS T-LIGHT HLDR,6,11/29/2011 11:34,2.55,17655,United Kingdom
579307,21181,PLEASE ONE PERSON METAL SIGN,48,11/29/2011 11:34,1.85,17655,United Kingdom
579307,22639,SET OF 4 NAPKIN CHARMS HEARTS,6,11/29/2011 11:34,2.55,17655,United Kingdom
579307,22604,SET OF 4 NAPKIN CHARMS CUTLERY,6,11/29/2011 11:34,2.55,17655,United Kingdom
579307,22642,SET OF 4 NAPKIN CHARMS STARS   ,6,11/29/2011 11:34,2.55,17655,United Kingdom
579328,22577,WOODEN HEART CHRISTMAS SCANDINAVIAN,24,11/29/2011 11:40,0.29,17711,United Kingdom
579328,23660,HENRIETTA HEN MUG ,12,11/29/2011 11:40,1.65,17711,United Kingdom
579328,20996,JAZZ HEARTS ADDRESS BOOK,24,11/29/2011 11:40,0.19,17711,United Kingdom
579328,23076,ICE CREAM SUNDAE LIP GLOSS,24,11/29/2011 11:40,1.25,17711,United Kingdom
579328,22138,BAKING SET 9 PIECE RETROSPOT ,3,11/29/2011 11:40,4.95,17711,United Kingdom
579328,20772,GARDEN PATH JOURNAL,6,11/29/2011 11:40,2.55,17711,United Kingdom
579328,20777,CHRYSANTHEMUM NOTEBOOK,6,11/29/2011 11:40,1.65,17711,United Kingdom
579328,22961,JAM MAKING SET PRINTED,12,11/29/2011 11:40,1.45,17711,United Kingdom
579328,22693,GROW A FLYTRAP OR SUNFLOWER IN TIN,24,11/29/2011 11:40,1.25,17711,United Kingdom
579328,71477,COLOUR GLASS. STAR T-LIGHT HOLDER,4,11/29/2011 11:40,3.95,17711,United Kingdom
579332,21175,GIN AND TONIC DIET METAL SIGN,24,11/29/2011 11:41,2.55,14408,United Kingdom
579332,23503,PLAYING CARDS KEEP CALM & CARRY ON,12,11/29/2011 11:41,1.25,14408,United Kingdom
579332,82582,AREA PATROLLED METAL SIGN,24,11/29/2011 11:41,2.1,14408,United Kingdom
579332,85152,HAND OVER THE CHOCOLATE   SIGN ,24,11/29/2011 11:41,2.1,14408,United Kingdom
579332,21166,COOK WITH WINE METAL SIGN ,24,11/29/2011 11:41,2.08,14408,United Kingdom
579332,22178,VICTORIAN GLASS HANGING T-LIGHT,6,11/29/2011 11:41,1.95,14408,United Kingdom
579332,84949,SILVER HANGING T-LIGHT HOLDER,24,11/29/2011 11:41,1.65,14408,United Kingdom
579332,84946,ANTIQUE SILVER T-LIGHT GLASS,24,11/29/2011 11:41,1.25,14408,United Kingdom
579339,22193,RED DINER WALL CLOCK,12,11/29/2011 11:45,7.65,14866,United Kingdom
579339,22993,SET OF 4 PANTRY JELLY MOULDS,36,11/29/2011 11:45,1.25,14866,United Kingdom
579339,23318,BOX OF 6 MINI VINTAGE CRACKERS,48,11/29/2011 11:45,2.08,14866,United Kingdom
579339,23168,CLASSIC CAFE SUGAR DISPENSER,36,11/29/2011 11:45,1.04,14866,United Kingdom
579339,22722,SET OF 6 SPICE TINS PANTRY DESIGN,16,11/29/2011 11:45,3.95,14866,United Kingdom
579345,22534,MAGIC DRAWING SLATE SPACEBOY ,24,11/29/2011 11:46,0.42,12727,France
579345,22530,MAGIC DRAWING SLATE DOLLY GIRL ,24,11/29/2011 11:46,0.42,12727,France
579345,22139,RETROSPOT TEA SET CERAMIC 11 PC ,6,11/29/2011 11:46,4.95,12727,France
579345,22617,BAKING SET SPACEBOY DESIGN,3,11/29/2011 11:46,4.95,12727,France
579345,22138,BAKING SET 9 PIECE RETROSPOT ,3,11/29/2011 11:46,4.95,12727,France
579345,23080,RED METAL BOX TOP SECRET,4,11/29/2011 11:46,8.25,12727,France
579345,23081,GREEN METAL BOX ARMY SUPPLIES,12,11/29/2011 11:46,8.25,12727,France
579345,23445,ICE CREAM BUBBLES,20,11/29/2011 11:46,0.83,12727,France
579345,23559,WOODLAND BUNNIES LOLLY MAKERS,6,11/29/2011 11:46,2.08,12727,France
579345,23084,RABBIT NIGHT LIGHT,24,11/29/2011 11:46,1.79,12727,France
579345,22466,FAIRY TALE COTTAGE NIGHT LIGHT,12,11/29/2011 11:46,1.95,12727,France
579345,22553,PLASTERS IN TIN SKULLS,12,11/29/2011 11:46,1.65,12727,France
579345,22557,PLASTERS IN TIN VINTAGE PAISLEY ,12,11/29/2011 11:46,1.65,12727,France
579345,22492,MINI PAINT SET VINTAGE ,36,11/29/2011 11:46,0.65,12727,France
579345,21559,STRAWBERRY LUNCH BOX WITH CUTLERY,6,11/29/2011 11:46,2.55,12727,France
579345,22659,LUNCH BOX I LOVE LONDON,12,11/29/2011 11:46,1.95,12727,France
579345,POST,POSTAGE,4,11/29/2011 11:46,18,12727,France
579345,20749,ASSORTED COLOUR MINI CASES,6,11/29/2011 11:46,7.95,12727,France
579345,16218,CARTOON  PENCIL SHARPENERS,80,11/29/2011 11:46,0.06,12727,France
579345,22730,ALARM CLOCK BAKELIKE IVORY,8,11/29/2011 11:46,3.75,12727,France
579345,22728,ALARM CLOCK BAKELIKE PINK,8,11/29/2011 11:46,3.75,12727,France
579345,22727,ALARM CLOCK BAKELIKE RED ,8,11/29/2011 11:46,3.75,12727,France
579345,22556,PLASTERS IN TIN CIRCUS PARADE ,12,11/29/2011 11:46,1.65,12727,France
C579347,23225,CHERUB HEART DECORATION SILVER ,-36,11/29/2011 11:47,0.83,17658,United Kingdom
C579347,22163,HEART STRING MEMO HOLDER HANGING,-24,11/29/2011 11:47,0.79,17658,United Kingdom
C579347,22584,PACK OF 6 PANETTONE GIFT BOXES,-14,11/29/2011 11:47,2.55,17658,United Kingdom
C579347,22585,PACK OF 6 BIRDY GIFT TAGS,-20,11/29/2011 11:47,1.25,17658,United Kingdom
579350,85123A,WHITE HANGING HEART T-LIGHT HOLDER,32,11/29/2011 11:48,2.55,15218,United Kingdom
579350,21868,POTTING SHED TEA MUG,18,11/29/2011 11:48,1.65,15218,United Kingdom
579350,21181,PLEASE ONE PERSON METAL SIGN,24,11/29/2011 11:48,2.1,15218,United Kingdom
579350,85172,HYACINTH BULB T-LIGHT CANDLES,32,11/29/2011 11:48,0.42,15218,United Kingdom
579350,22191,IVORY DINER WALL CLOCK,4,11/29/2011 11:48,8.5,15218,United Kingdom
579350,22192,BLUE DINER WALL CLOCK,1,11/29/2011 11:48,8.5,15218,United Kingdom
579350,22193,RED DINER WALL CLOCK,4,11/29/2011 11:48,8.5,15218,United Kingdom
579350,21129,SILVER FISHING GNOME ,8,11/29/2011 11:48,5.95,15218,United Kingdom
579350,17091J,VANILLA INCENSE IN TIN,18,11/29/2011 11:48,0.38,15218,United Kingdom
579350,23300,GARDENERS KNEELING PAD CUP OF TEA ,24,11/29/2011 11:48,1.65,15218,United Kingdom
579350,22379,RECYCLING BAG RETROSPOT ,20,11/29/2011 11:48,2.1,15218,United Kingdom
579350,21930,JUMBO STORAGE BAG SKULLS,10,11/29/2011 11:48,2.08,15218,United Kingdom
579350,23344,JUMBO BAG 50'S CHRISTMAS ,10,11/29/2011 11:48,2.08,15218,United Kingdom
579350,23581,JUMBO BAG PAISLEY PARK,40,11/29/2011 11:48,2.08,15218,United Kingdom
579350,23582,VINTAGE DOILY JUMBO BAG RED ,30,11/29/2011 11:48,2.08,15218,United Kingdom
579350,23301,GARDENERS KNEELING PAD KEEP CALM ,48,11/29/2011 11:48,1.45,15218,United Kingdom
579350,75049L,LARGE CIRCULAR MIRROR MOBILE,192,11/29/2011 11:48,0.85,15218,United Kingdom
579352,20961,STRAWBERRY BATH SPONGE ,1,11/29/2011 11:48,1.25,,United Kingdom
579352,72351A,SET/6 TURQUOISE BUTTERFLY T-LIGHTS,1,11/29/2011 11:48,2.1,,United Kingdom
579352,72122,COFFEE SCENT PILLAR CANDLE,3,11/29/2011 11:48,0.95,,United Kingdom
579352,85135A,YELLOW DRAGONFLY HELICOPTER,1,11/29/2011 11:48,7.95,,United Kingdom
579352,22059,CERAMIC STRAWBERRY DESIGN MUG,1,11/29/2011 11:48,1.49,,United Kingdom
579352,21108,FAIRY CAKE FLANNEL ASSORTED COLOUR,9,11/29/2011 11:48,0.79,,United Kingdom
579352,85136C,RED SHARK HELICOPTER,1,11/29/2011 11:48,7.95,,United Kingdom
579352,72741,GRAND CHOCOLATECANDLE,9,11/29/2011 11:48,1.45,,United Kingdom
579352,20970,PINK FLORAL FELTCRAFT SHOULDER BAG,1,11/29/2011 11:48,3.75,,United Kingdom
579352,23320,GIANT 50'S CHRISTMAS CRACKER,1,11/29/2011 11:48,2.89,,United Kingdom
579352,20969,RED FLORAL FELTCRAFT SHOULDER BAG,1,11/29/2011 11:48,3.75,,United Kingdom
579358,22979,PANTRY WASHING UP BRUSH,24,11/29/2011 11:50,1.45,16992,United Kingdom
579358,23396,LE JARDIN BOTANIQUE CUSHION COVER,4,11/29/2011 11:50,3.75,16992,United Kingdom
579358,23395,BELLE JARDINIERE CUSHION COVER,4,11/29/2011 11:50,3.75,16992,United Kingdom
579358,23399,HOME SWEET HOME HANGING HEART,12,11/29/2011 11:50,0.85,16992,United Kingdom
579358,85123A,WHITE HANGING HEART T-LIGHT HOLDER,6,11/29/2011 11:50,2.95,16992,United Kingdom
579358,84946,ANTIQUE SILVER T-LIGHT GLASS,12,11/29/2011 11:50,1.25,16992,United Kingdom
579358,84609,TALL ROCOCO CANDLE HOLDER,4,11/29/2011 11:50,8.5,16992,United Kingdom
579358,21012,ANTIQUE ALL GLASS CANDLESTICK,6,11/29/2011 11:50,2.1,16992,United Kingdom
579358,22485,SET OF 2 WOODEN MARKET CRATES,2,11/29/2011 11:50,12.75,16992,United Kingdom
579358,22835,HOT WATER BOTTLE I AM SO POORLY,4,11/29/2011 11:50,4.95,16992,United Kingdom
579358,22112,CHOCOLATE HOT WATER BOTTLE,3,11/29/2011 11:50,4.95,16992,United Kingdom
579361,85136A,YELLOW SHARK HELICOPTER,1,11/29/2011 11:51,7.95,,United Kingdom
579361,21874,GIN AND TONIC MUG,1,11/29/2011 11:51,1.65,,United Kingdom
579361,22493,PAINT YOUR OWN CANVAS SET,2,11/29/2011 11:51,1.65,,United Kingdom
579361,21055,TOOL BOX SOFT TOY ,1,11/29/2011 11:51,8.95,,United Kingdom
579364,23077,DOUGHNUT LIP GLOSS ,20,11/29/2011 11:52,1.25,14173,United Kingdom
579364,21034,REX CASH+CARRY JUMBO SHOPPER,1,11/29/2011 11:52,0.95,14173,United Kingdom
579364,23083,SET 6 PAPER TABLE LANTERN STARS ,36,11/29/2011 11:52,3.75,14173,United Kingdom
579364,23439,HAND WARMER RED LOVE HEART,6,11/29/2011 11:52,2.1,14173,United Kingdom
579364,22633,HAND WARMER UNION JACK,10,11/29/2011 11:52,2.1,14173,United Kingdom
579365,23084,RABBIT NIGHT LIGHT,6,11/29/2011 11:54,2.08,14173,United Kingdom
C579366,POST,POSTAGE,-1,11/29/2011 11:56,9.72,14205,United Kingdom
579387,23299,FOOD COVER WITH BEADS SET 2 ,2,11/29/2011 12:06,3.75,14452,United Kingdom
579387,23281,FOLDING BUTTERFLY MIRROR RED  ,1,11/29/2011 12:06,0.83,14452,United Kingdom
579387,90094,NECKLACE+BRACELET SET FRUIT SALAD ,1,11/29/2011 12:06,2.55,14452,United Kingdom
579387,90099,NECKLACE+BRACELET SET BLUE HIBISCUS,2,11/29/2011 12:06,2.55,14452,United Kingdom
579387,23562,SET OF 6 RIBBONS PERFECTLY PRETTY  ,1,11/29/2011 12:06,2.89,14452,United Kingdom
579387,23560,SET OF 6 RIBBONS COUNTRY STYLE,2,11/29/2011 12:06,2.89,14452,United Kingdom
579387,23293,SET OF 12 FAIRY CAKE BAKING CASES,2,11/29/2011 12:06,0.83,14452,United Kingdom
579387,21592,RETROSPOT CIGAR BOX MATCHES ,2,11/29/2011 12:06,1.25,14452,United Kingdom
579387,22094,RED RETROSPOT TISSUE BOX,4,11/29/2011 12:06,0.39,14452,United Kingdom
579387,23695,DOILY THANK YOU CARD,12,11/29/2011 12:06,0.42,14452,United Kingdom
579387,22098,BOUDOIR SQUARE TISSUE BOX,2,11/29/2011 12:06,0.39,14452,United Kingdom
579387,22690,DOORMAT HOME SWEET HOME BLUE ,1,11/29/2011 12:06,8.25,14452,United Kingdom
579387,23318,BOX OF 6 MINI VINTAGE CRACKERS,4,11/29/2011 12:06,2.49,14452,United Kingdom
579387,21592,RETROSPOT CIGAR BOX MATCHES ,2,11/29/2011 12:06,1.25,14452,United Kingdom
579387,22841,ROUND CAKE TIN VINTAGE GREEN,1,11/29/2011 12:06,7.95,14452,United Kingdom
579387,21108,FAIRY CAKE FLANNEL ASSORTED COLOUR,9,11/29/2011 12:06,0.79,14452,United Kingdom
579387,23578,SNACK TRAY RED GINGHAM,2,11/29/2011 12:06,1.95,14452,United Kingdom
579387,23562,SET OF 6 RIBBONS PERFECTLY PRETTY  ,1,11/29/2011 12:06,2.89,14452,United Kingdom
579387,23281,FOLDING BUTTERFLY MIRROR RED  ,2,11/29/2011 12:06,0.83,14452,United Kingdom
579387,23336,EGG FRYING PAN PINK ,1,11/29/2011 12:06,2.08,14452,United Kingdom
579387,23335,EGG FRYING PAN IVORY ,1,11/29/2011 12:06,2.08,14452,United Kingdom
579387,22361,GLASS JAR DAISY FRESH COTTON WOOL,1,11/29/2011 12:06,2.95,14452,United Kingdom
579387,22359,GLASS JAR KINGS CHOICE,1,11/29/2011 12:06,2.95,14452,United Kingdom
579387,84997C,CHILDRENS CUTLERY POLKADOT BLUE,1,11/29/2011 12:06,4.15,14452,United Kingdom
579387,84997B,CHILDRENS CUTLERY RETROSPOT RED ,1,11/29/2011 12:06,4.15,14452,United Kingdom
579387,84997D,CHILDRENS CUTLERY POLKADOT PINK,2,11/29/2011 12:06,4.15,14452,United Kingdom
579387,23328,SET 6 SCHOOL MILK BOTTLES IN CRATE,1,11/29/2011 12:06,3.75,14452,United Kingdom
579387,22840,ROUND CAKE TIN VINTAGE RED,1,11/29/2011 12:06,7.95,14452,United Kingdom
579387,23301,GARDENERS KNEELING PAD KEEP CALM ,1,11/29/2011 12:06,1.65,14452,United Kingdom
579387,23300,GARDENERS KNEELING PAD CUP OF TEA ,2,11/29/2011 12:06,1.65,14452,United Kingdom
579387,21677,HEARTS  STICKERS,6,11/29/2011 12:06,0.85,14452,United Kingdom
579387,23019,SMALL APOTHECARY MEASURING JAR ,1,11/29/2011 12:06,8.25,14452,United Kingdom
579391,22910,PAPER CHAIN KIT VINTAGE CHRISTMAS,40,11/29/2011 12:07,2.55,14251,United Kingdom
579391,22732,3D VINTAGE CHRISTMAS STICKERS ,18,11/29/2011 12:07,1.25,14251,United Kingdom
579391,22731,3D CHRISTMAS STAMPS STICKERS ,18,11/29/2011 12:07,1.25,14251,United Kingdom
