579146,22910,PAPER CHAIN KIT VINTAGE CHRISTMAS,5,11/28/2011 13:14,2.95,16347,United Kingdom
579146,22086,PAPER CHAIN KIT 50'S CHRISTMAS ,5,11/28/2011 13:14,2.95,16347,United Kingdom
579146,23489,VINTAGE BELLS GARLAND,1,11/28/2011 13:14,2.89,16347,United Kingdom
579146,22470,HEART OF WICKER LARGE,3,11/28/2011 13:14,2.95,16347,United Kingdom
579146,21930,JUMBO STORAGE BAG SKULLS,3,11/28/2011 13:14,2.08,16347,United Kingdom
579146,23202,JUMBO BAG VINTAGE LEAF,3,11/28/2011 13:14,2.08,16347,United Kingdom
579146,84029E,RED WOOLLY HOTTIE WHITE HEART.,3,11/28/2011 13:14,4.25,16347,United Kingdom
579146,21485,RETROSPOT HEART HOT WATER BOTTLE,2,11/28/2011 13:14,4.95,16347,United Kingdom
579146,22111,SCOTTIE DOG HOT WATER BOTTLE,14,11/28/2011 13:14,4.95,16347,United Kingdom
579146,84946,ANTIQUE SILVER T-LIGHT GLASS,6,11/28/2011 13:14,1.25,16347,United Kingdom
579146,23271,CHRISTMAS TABLE SILVER CANDLE SPIKE,32,11/28/2011 13:14,0.83,16347,United Kingdom
579146,23356,LOVE HOT WATER BOTTLE,1,11/28/2011 13:14,5.95,16347,United Kingdom
579146,21479,WHITE SKULL HOT WATER BOTTLE ,3,11/28/2011 13:14,4.25,16347,United Kingdom
579146,23356,LOVE HOT WATER BOTTLE,3,11/28/2011 13:14,5.95,16347,United Kingdom
579146,48138,DOORMAT UNION FLAG,1,11/28/2011 13:14,8.25,16347,United Kingdom
579146,48184,DOORMAT ENGLISH ROSE ,1,11/28/2011 13:14,8.25,16347,United Kingdom
579146,22734,SET OF 6 RIBBONS VINTAGE CHRISTMAS,5,11/28/2011 13:14,2.89,16347,United Kingdom
579146,22909,SET OF 20 VINTAGE CHRISTMAS NAPKINS,10,11/28/2011 13:14,0.85,16347,United Kingdom
579147,23323,WHITE WICKER STAR ,2,11/28/2011 13:20,2.1,13263,United Kingdom
579147,23321,SMALL WHITE HEART OF WICKER,2,11/28/2011 13:20,1.65,13263,United Kingdom
579147,23212,HEART WREATH DECORATION WITH BELL,6,11/28/2011 13:20,1.25,13263,United Kingdom
579147,23213,STAR WREATH DECORATION WITH BELL,6,11/28/2011 13:20,1.25,13263,United Kingdom
579147,21819,GLITTER CHRISTMAS STAR ,10,11/28/2011 13:20,0.39,13263,United Kingdom
579147,21818,GLITTER HEART DECORATION,10,11/28/2011 13:20,0.39,13263,United Kingdom
579147,21810,CHRISTMAS HANGING STAR WITH BELL,9,11/28/2011 13:20,0.39,13263,United Kingdom
579147,22578,WOODEN STAR CHRISTMAS SCANDINAVIAN,15,11/28/2011 13:20,0.29,13263,United Kingdom
579147,22577,WOODEN HEART CHRISTMAS SCANDINAVIAN,15,11/28/2011 13:20,0.29,13263,United Kingdom
579147,23211,RED ROCKING HORSE HAND PAINTED,5,11/28/2011 13:20,1.25,13263,United Kingdom
579147,23210,WHITE ROCKING HORSE HAND PAINTED,5,11/28/2011 13:20,1.25,13263,United Kingdom
579147,23266,SET OF 3 WOODEN STOCKING DECORATION,1,11/28/2011 13:20,1.25,13263,United Kingdom
579147,22573,STAR WOODEN CHRISTMAS DECORATION,10,11/28/2011 13:20,0.85,13263,United Kingdom
579147,22574,HEART WOODEN CHRISTMAS DECORATION,10,11/28/2011 13:20,0.85,13263,United Kingdom
579147,22576,SWALLOW WOODEN CHRISTMAS DECORATION,10,11/28/2011 13:20,0.85,13263,United Kingdom
579147,23222,CHRISTMAS TREE HANGING GOLD,5,11/28/2011 13:20,0.83,13263,United Kingdom
579147,23220,REINDEER HEART DECORATION GOLD,3,11/28/2011 13:20,0.83,13263,United Kingdom
579147,23224,CHERUB HEART DECORATION GOLD,3,11/28/2011 13:20,0.83,13263,United Kingdom
579147,23275,SET OF 3 HANGING OWLS OLLIE BEAK,4,11/28/2011 13:20,1.25,13263,United Kingdom
579147,23269,SET OF 2 CERAMIC CHRISTMAS TREES,2,11/28/2011 13:20,1.45,13263,United Kingdom
579147,23270,SET OF 2 CERAMIC PAINTED HEARTS ,2,11/28/2011 13:20,1.45,13263,United Kingdom
579147,23263,SET OF 3 WOODEN HEART DECORATIONS,3,11/28/2011 13:20,1.25,13263,United Kingdom
579147,23265,SET OF 3 WOODEN TREE DECORATIONS,2,11/28/2011 13:20,1.25,13263,United Kingdom
579147,23266,SET OF 3 WOODEN STOCKING DECORATION,4,11/28/2011 13:20,1.25,13263,United Kingdom
579147,21485,RETROSPOT HEART HOT WATER BOTTLE,1,11/28/2011 13:20,4.95,13263,United Kingdom
579147,22113,GREY HEART HOT WATER BOTTLE,1,11/28/2011 13:20,4.25,13263,United Kingdom
579147,85123A,WHITE HANGING HEART T-LIGHT HOLDER,1,11/28/2011 13:20,2.95,13263,United Kingdom
579147,23493,VINTAGE DOILY TRAVEL SEWING KIT,2,11/28/2011 13:20,1.95,13263,United Kingdom
579147,22077,6 RIBBONS RUSTIC CHARM,4,11/28/2011 13:20,1.95,13263,United Kingdom
579147,22065,CHRISTMAS PUDDING TRINKET POT ,2,11/28/2011 13:20,0.39,13263,United Kingdom
579147,23454,THREE MINI HANGING FRAMES,1,11/28/2011 13:20,4.15,13263,United Kingdom
579147,23453,OVAL  MINI PORTRAIT FRAME,1,11/28/2011 13:20,1.95,13263,United Kingdom
579147,23451,SQUARE MINI PORTRAIT FRAME,1,11/28/2011 13:20,1.95,13263,United Kingdom
579147,23452,HEART MINI PORTRAIT FRAME,1,11/28/2011 13:20,1.95,13263,United Kingdom
579147,21181,PLEASE ONE PERSON METAL SIGN,2,11/28/2011 13:20,2.1,13263,United Kingdom
579147,21166,COOK WITH WINE METAL SIGN ,2,11/28/2011 13:20,2.08,13263,United Kingdom
579147,23426,METAL SIGN DROP YOUR PANTS,2,11/28/2011 13:20,2.89,13263,United Kingdom
579147,23247,BISCUIT TIN 50'S CHRISTMAS,1,11/28/2011 13:20,2.89,13263,United Kingdom
579147,82494L,WOODEN FRAME ANTIQUE WHITE ,1,11/28/2011 13:20,2.95,13263,United Kingdom
579147,82482,WOODEN PICTURE FRAME WHITE FINISH,1,11/28/2011 13:20,2.95,13263,United Kingdom
579147,21877,HOME SWEET HOME MUG,2,11/28/2011 13:20,1.65,13263,United Kingdom
579147,21871,SAVE THE PLANET MUG,2,11/28/2011 13:20,1.65,13263,United Kingdom
579147,21873,IF YOU CAN'T STAND THE HEAT MUG,2,11/28/2011 13:20,1.25,13263,United Kingdom
579147,23152,IVORY SWEETHEART WIRE LETTER RACK ,2,11/28/2011 13:20,3.75,13263,United Kingdom
579148,22749,FELTCRAFT PRINCESS CHARLOTTE DOLL,6,11/28/2011 13:20,3.75,17523,United Kingdom
579148,22750,FELTCRAFT PRINCESS LOLA DOLL,3,11/28/2011 13:20,3.75,17523,United Kingdom
579148,22751,FELTCRAFT PRINCESS OLIVIA DOLL,3,11/28/2011 13:20,3.75,17523,United Kingdom
579148,22274,FELTCRAFT DOLL EMILY,3,11/28/2011 13:20,2.95,17523,United Kingdom
579148,22130,PARTY CONE CHRISTMAS DECORATION ,24,11/28/2011 13:20,0.85,17523,United Kingdom
579148,22273,FELTCRAFT DOLL MOLLY,3,11/28/2011 13:20,2.95,17523,United Kingdom
579148,22940,FELTCRAFT CHRISTMAS FAIRY,6,11/28/2011 13:20,4.25,17523,United Kingdom
579148,22509,SEWING BOX RETROSPOT DESIGN ,1,11/28/2011 13:20,16.95,17523,United Kingdom
579149,20712,JUMBO BAG WOODLAND ANIMALS,10,11/28/2011 13:21,2.08,13844,United Kingdom
579149,21485,RETROSPOT HEART HOT WATER BOTTLE,6,11/28/2011 13:21,4.95,13844,United Kingdom
579149,20685,DOORMAT RED RETROSPOT,2,11/28/2011 13:21,8.25,13844,United Kingdom
579149,23344,JUMBO BAG 50'S CHRISTMAS ,10,11/28/2011 13:21,2.08,13844,United Kingdom
579149,22596,CHRISTMAS STAR WISH LIST CHALKBOARD,12,11/28/2011 13:21,1.25,13844,United Kingdom
579149,21326,AGED GLASS SILVER T-LIGHT HOLDER,24,11/28/2011 13:21,0.65,13844,United Kingdom
579149,22086,PAPER CHAIN KIT 50'S CHRISTMAS ,12,11/28/2011 13:21,2.95,13844,United Kingdom
579149,23234,BISCUIT TIN VINTAGE CHRISTMAS,6,11/28/2011 13:21,2.89,13844,United Kingdom
579149,22734,SET OF 6 RIBBONS VINTAGE CHRISTMAS,6,11/28/2011 13:21,2.89,13844,United Kingdom
579149,22549,PICTURE DOMINOES,12,11/28/2011 13:21,1.45,13844,United Kingdom
579149,21790,VINTAGE SNAP CARDS,12,11/28/2011 13:21,0.85,13844,United Kingdom
579149,22619,SET OF 6 SOLDIER SKITTLES,4,11/28/2011 13:21,3.75,13844,United Kingdom
579149,22961,JAM MAKING SET PRINTED,12,11/28/2011 13:21,1.45,13844,United Kingdom
579149,23480,MINI LIGHTS WOODLAND MUSHROOMS,4,11/28/2011 13:21,3.75,13844,United Kingdom
579149,23521,WALL ART CAT AND BIRD ,6,11/28/2011 13:21,2.89,13844,United Kingdom
579149,23203,JUMBO BAG VINTAGE DOILY ,10,11/28/2011 13:21,2.08,13844,United Kingdom
579149,22469,HEART OF WICKER SMALL,12,11/28/2011 13:21,1.65,13844,United Kingdom
579149,20982,12 PENCILS TALL TUBE SKULLS,12,11/28/2011 13:21,0.85,13844,United Kingdom
579149,23192,BUNDLE OF 3 ALPHABET EXERCISE BOOKS,12,11/28/2011 13:21,1.65,13844,United Kingdom
579149,22792,FLUTED ANTIQUE CANDLE HOLDER,12,11/28/2011 13:21,0.85,13844,United Kingdom
579150,22086,PAPER CHAIN KIT 50'S CHRISTMAS ,40,11/28/2011 13:25,2.55,13408,United Kingdom
579150,23083,SET 6 PAPER TABLE LANTERN STARS ,48,11/28/2011 13:25,3.29,13408,United Kingdom
579150,23225,CHERUB HEART DECORATION SILVER ,144,11/28/2011 13:25,0.72,13408,United Kingdom
579150,84378,SET OF 3 HEART COOKIE CUTTERS,24,11/28/2011 13:25,1.45,13408,United Kingdom
579150,23013,GLASS APOTHECARY BOTTLE TONIC,12,11/28/2011 13:25,3.45,13408,United Kingdom
579150,21181,PLEASE ONE PERSON METAL SIGN,24,11/28/2011 13:25,2.1,13408,United Kingdom
579150,23240,SET OF 4 KNICK KNACK TINS DOILY ,12,11/28/2011 13:25,4.15,13408,United Kingdom
579150,21914,BLUE HARMONICA IN BOX ,24,11/28/2011 13:25,1.25,13408,United Kingdom
579150,22666,RECIPE BOX PANTRY YELLOW DESIGN,6,11/28/2011 13:25,2.95,13408,United Kingdom
579150,22667,RECIPE BOX RETROSPOT ,6,11/28/2011 13:25,2.95,13408,United Kingdom
579151,23552,BICYCLE PUNCTURE REPAIR KIT ,24,11/28/2011 13:25,2.08,13408,United Kingdom
579151,23498,CLASSIC BICYCLE CLIPS ,72,11/28/2011 13:25,1.25,13408,United Kingdom
579152,21212,PACK OF 72 RETROSPOT CAKE CASES,24,11/28/2011 13:26,0.55,12479,Germany
579152,21210,SET OF 72 RETROSPOT PAPER  DOILIES,12,11/28/2011 13:26,1.45,12479,Germany
579152,21080,SET/20 RED RETROSPOT PAPER NAPKINS ,12,11/28/2011 13:26,0.85,12479,Germany
579152,21086,SET/6 RED SPOTTY PAPER CUPS,12,11/28/2011 13:26,0.65,12479,Germany
579152,21989,PACK OF 20 SKULL PAPER NAPKINS,12,11/28/2011 13:26,0.85,12479,Germany
579152,21987,PACK OF 6 SKULL PAPER CUPS,12,11/28/2011 13:26,0.65,12479,Germany
579152,21558,SKULL LUNCH BOX WITH CUTLERY ,12,11/28/2011 13:26,2.55,12479,Germany
579152,21211,SET OF 72 SKULL PAPER  DOILIES,12,11/28/2011 13:26,1.45,12479,Germany
579152,21213,PACK OF 72 SKULL CAKE CASES,24,11/28/2011 13:26,0.55,12479,Germany
579152,21882,SKULLS TAPE,12,11/28/2011 13:26,0.65,12479,Germany
579152,22437,SET OF 9 BLACK SKULL BALLOONS,20,11/28/2011 13:26,0.85,12479,Germany
579152,84992,72 SWEETHEART FAIRY CAKE CASES,24,11/28/2011 13:26,0.55,12479,Germany
579152,22993,SET OF 4 PANTRY JELLY MOULDS,12,11/28/2011 13:26,1.25,12479,Germany
579152,22628,PICNIC BOXES SET OF 3 RETROSPOT ,4,11/28/2011 13:26,4.95,12479,Germany
579152,21216,"SET 3 RETROSPOT TEA,COFFEE,SUGAR",4,11/28/2011 13:26,4.95,12479,Germany
579152,23243,SET OF TEA COFFEE SUGAR TINS PANTRY,4,11/28/2011 13:26,4.95,12479,Germany
579152,21217,RED RETROSPOT ROUND CAKE TINS,3,11/28/2011 13:26,9.95,12479,Germany
579152,22720,SET OF 3 CAKE TINS PANTRY DESIGN ,3,11/28/2011 13:26,4.95,12479,Germany
579152,21088,SET/6 FRUIT SALAD PAPER CUPS,24,11/28/2011 13:26,0.19,12479,Germany
579152,21988,PACK OF 6 SKULL PAPER PLATES,12,11/28/2011 13:26,0.85,12479,Germany
579152,21094,SET/6 RED SPOTTY PAPER PLATES,12,11/28/2011 13:26,0.85,12479,Germany
579152,22215,CAKE STAND WHITE TWO TIER LACE,2,11/28/2011 13:26,8.5,12479,Germany
579152,22734,SET OF 6 RIBBONS VINTAGE CHRISTMAS,6,11/28/2011 13:26,2.89,12479,Germany
579152,22077,6 RIBBONS RUSTIC CHARM,12,11/28/2011 13:26,1.95,12479,Germany
579152,85049E,SCANDINAVIAN REDS RIBBONS,12,11/28/2011 13:26,1.25,12479,Germany
579152,85049C,ROMANTIC PINKS RIBBONS ,12,11/28/2011 13:26,1.25,12479,Germany
579152,20978,36 PENCILS TUBE SKULLS,16,11/28/2011 13:26,1.25,12479,Germany
579152,20979,36 PENCILS TUBE RED RETROSPOT,16,11/28/2011 13:26,1.25,12479,Germany
579152,20973,12 PENCIL SMALL TUBE WOODLAND,24,11/28/2011 13:26,0.65,12479,Germany
579152,23370,SET 36 COLOURING PENCILS DOILY,16,11/28/2011 13:26,1.25,12479,Germany
579152,POST,POSTAGE,3,11/28/2011 13:26,18,12479,Germany
579153,22555,PLASTERS IN TIN STRONGMAN,12,11/28/2011 13:26,1.65,12660,France
579153,22556,PLASTERS IN TIN CIRCUS PARADE ,12,11/28/2011 13:26,1.65,12660,France
579153,22554,PLASTERS IN TIN WOODLAND ANIMALS,12,11/28/2011 13:26,1.65,12660,France
579153,22175,PINK OWL SOFT TOY,6,11/28/2011 13:26,2.95,12660,France
579153,84931B,BLUE SCOTTIE DOG W FLOWER PATTERN,6,11/28/2011 13:26,2.55,12660,France
579153,22320,BIRDS MOBILE VINTAGE DESIGN,3,11/28/2011 13:26,5.95,12660,France
579153,22492,MINI PAINT SET VINTAGE ,36,11/28/2011 13:26,0.65,12660,France
579153,22744,MAKE YOUR OWN MONSOON CARD KIT,6,11/28/2011 13:26,2.95,12660,France
579153,22453,MEASURING TAPE BABUSHKA BLUE,6,11/28/2011 13:26,2.95,12660,France
579153,22654,DELUXE SEWING KIT ,3,11/28/2011 13:26,5.95,12660,France
579153,22966,GINGERBREAD MAN COOKIE CUTTER,12,11/28/2011 13:26,1.25,12660,France
579153,84375,SET OF 20 KIDS COOKIE CUTTERS,12,11/28/2011 13:26,2.1,12660,France
579153,POST,POSTAGE,1,11/28/2011 13:26,18,12660,France
579154,22809,SET OF 6 T-LIGHTS SANTA,1,11/28/2011 13:27,2.95,17218,United Kingdom
579154,22959,WRAP CHRISTMAS VILLAGE,25,11/28/2011 13:27,0.42,17218,United Kingdom
579154,84950,ASSORTED COLOUR T-LIGHT HOLDER,12,11/28/2011 13:27,0.65,17218,United Kingdom
579154,22423,REGENCY CAKESTAND 3 TIER,1,11/28/2011 13:27,12.75,17218,United Kingdom
579154,22728,ALARM CLOCK BAKELIKE PINK,2,11/28/2011 13:27,3.75,17218,United Kingdom
579154,22725,ALARM CLOCK BAKELIKE CHOCOLATE,1,11/28/2011 13:27,3.75,17218,United Kingdom
579154,22727,ALARM CLOCK BAKELIKE RED ,2,11/28/2011 13:27,3.75,17218,United Kingdom
579154,22726,ALARM CLOCK BAKELIKE GREEN,3,11/28/2011 13:27,3.75,17218,United Kingdom
579154,23084,RABBIT NIGHT LIGHT,12,11/28/2011 13:27,2.08,17218,United Kingdom
579154,22186,RED STAR CARD HOLDER,2,11/28/2011 13:27,1.95,17218,United Kingdom
579154,23320,GIANT 50'S CHRISTMAS CRACKER,2,11/28/2011 13:27,2.89,17218,United Kingdom
579154,22952,60 CAKE CASES VINTAGE CHRISTMAS,1,11/28/2011 13:27,0.55,17218,United Kingdom
579154,22491,PACK OF 12 COLOURED PENCILS,3,11/28/2011 13:27,0.85,17218,United Kingdom
579154,35970,ZINC FOLKART SLEIGH BELLS,12,11/28/2011 13:27,1.69,17218,United Kingdom
579154,23282,FOLDING BUTTERFLY MIRROR IVORY ,2,11/28/2011 13:27,0.83,17218,United Kingdom
579154,23281,FOLDING BUTTERFLY MIRROR RED  ,2,11/28/2011 13:27,0.83,17218,United Kingdom
579154,23280,FOLDING BUTTERFLY MIRROR HOT PINK ,2,11/28/2011 13:27,0.83,17218,United Kingdom
579154,22489,PACK OF 12 TRADITIONAL CRAYONS,3,11/28/2011 13:27,0.42,17218,United Kingdom
579154,22952,60 CAKE CASES VINTAGE CHRISTMAS,4,11/28/2011 13:27,0.55,17218,United Kingdom
579154,22810,SET OF 6 T-LIGHTS SNOWMEN,2,11/28/2011 13:27,2.95,17218,United Kingdom
579154,22752,SET 7 BABUSHKA NESTING BOXES,3,11/28/2011 13:27,8.5,17218,United Kingdom
579154,84030E,ENGLISH ROSE HOT WATER BOTTLE,1,11/28/2011 13:27,4.25,17218,United Kingdom
579154,23356,LOVE HOT WATER BOTTLE,1,11/28/2011 13:27,5.95,17218,United Kingdom
579154,22111,SCOTTIE DOG HOT WATER BOTTLE,1,11/28/2011 13:27,4.95,17218,United Kingdom
579154,21481,FAWN BLUE HOT WATER BOTTLE,2,11/28/2011 13:27,3.75,17218,United Kingdom
579154,22941,CHRISTMAS LIGHTS 10 REINDEER,1,11/28/2011 13:27,8.5,17218,United Kingdom
579154,23571,TRADITIONAL NAUGHTS & CROSSES,3,11/28/2011 13:27,1.65,17218,United Kingdom
579154,22834,HAND WARMER BABUSHKA DESIGN,2,11/28/2011 13:27,2.1,17218,United Kingdom
579154,22866,HAND WARMER SCOTTY DOG DESIGN,2,11/28/2011 13:27,2.1,17218,United Kingdom
579154,22632,HAND WARMER RED RETROSPOT,2,11/28/2011 13:27,2.1,17218,United Kingdom
579154,22867,HAND WARMER BIRD DESIGN,2,11/28/2011 13:27,2.1,17218,United Kingdom
579154,22865,HAND WARMER OWL DESIGN,2,11/28/2011 13:27,2.1,17218,United Kingdom
579155,72800D,4 BLUE DINNER CANDLES SILVER FLOCK,1,11/28/2011 13:37,2.55,18101,United Kingdom
579155,21850,BLUE  DIAMANTE PEN IN GIFT BOX,1,11/28/2011 13:37,4.95,18101,United Kingdom
579155,72369A,PINK CLEAR GLASS CANDLE PLATE,4,11/28/2011 13:37,1.25,18101,United Kingdom
579155,20659,ECONOMY LUGGAGE TAG,1,11/28/2011 13:37,1.25,18101,United Kingdom
579155,21866,UNION JACK FLAG LUGGAGE TAG,1,11/28/2011 13:37,1.25,18101,United Kingdom
579155,20655,QUEEN OF SKIES LUGGAGE TAG,1,11/28/2011 13:37,1.25,18101,United Kingdom
579155,20617,FIRST CLASS PASSPORT COVER ,2,11/28/2011 13:37,2.1,18101,United Kingdom
579155,23322,LARGE WHITE HEART OF WICKER,2,11/28/2011 13:37,2.95,18101,United Kingdom
579155,85061W,WHITE JEWELLED HEART DECORATION,5,11/28/2011 13:37,0.85,18101,United Kingdom
579155,20659,ECONOMY LUGGAGE TAG,1,11/28/2011 13:37,1.25,18101,United Kingdom
579155,23332,IVORY WICKER HEART LARGE,6,11/28/2011 13:37,1.65,18101,United Kingdom
579155,22070,SMALL RED RETROSPOT MUG IN BOX ,1,11/28/2011 13:37,3.75,18101,United Kingdom
579155,22071,SMALL WHITE RETROSPOT MUG IN BOX ,1,11/28/2011 13:37,3.75,18101,United Kingdom
579155,85106,CUT GLASS HEXAGON T-LIGHT HOLDER,2,11/28/2011 13:37,2.55,18101,United Kingdom
579155,21849,SILVER DIAMANTE PEN IN GIFT BOX,2,11/28/2011 13:37,4.95,18101,United Kingdom
579155,85061W,WHITE JEWELLED HEART DECORATION,2,11/28/2011 13:37,0.85,18101,United Kingdom
579155,22151,PLACE SETTING WHITE HEART,6,11/28/2011 13:37,0.42,18101,United Kingdom
579155,85107,CUT GLASS T-LIGHT HOLDER OCTAGON,3,11/28/2011 13:37,2.55,18101,United Kingdom
579155,85061W,WHITE JEWELLED HEART DECORATION,1,11/28/2011 13:37,0.85,18101,United Kingdom
579155,23481,PEARLISED IVORY HEART SMALL ,2,11/28/2011 13:37,1.25,18101,United Kingdom
579155,20618,QUEEN OF THE SKIES PASSPORT COVER ,1,11/28/2011 13:37,2.1,18101,United Kingdom
579155,20956,PORCELAIN T-LIGHT HOLDERS ASSORTED,4,11/28/2011 13:37,1.25,18101,United Kingdom
579155,23300,GARDENERS KNEELING PAD CUP OF TEA ,1,11/28/2011 13:37,1.65,18101,United Kingdom
579155,23301,GARDENERS KNEELING PAD KEEP CALM ,1,11/28/2011 13:37,1.65,18101,United Kingdom
579155,72800C,4 PINK DINNER CANDLE SILVER FLOCK,1,11/28/2011 13:37,2.55,18101,United Kingdom
579155,23481,PEARLISED IVORY HEART SMALL ,4,11/28/2011 13:37,1.25,18101,United Kingdom
579155,22158,3 HEARTS HANGING DECORATION RUSTIC,4,11/28/2011 13:37,2.95,18101,United Kingdom
579155,23323,WHITE WICKER STAR ,2,11/28/2011 13:37,2.1,18101,United Kingdom
579156,23146,TRIPLE HOOK ANTIQUE IVORY ROSE,4,11/28/2011 13:47,3.29,17419,United Kingdom
579156,84406B,CREAM CUPID HEARTS COAT HANGER,4,11/28/2011 13:47,4.15,17419,United Kingdom
579156,84792,ENCHANTED BIRD COATHANGER 5 HOOK,4,11/28/2011 13:47,4.65,17419,United Kingdom
579156,22138,BAKING SET 9 PIECE RETROSPOT ,12,11/28/2011 13:47,4.95,17419,United Kingdom
579156,23293,SET OF 12 FAIRY CAKE BAKING CASES,8,11/28/2011 13:47,0.83,17419,United Kingdom
579156,22632,HAND WARMER RED RETROSPOT,12,11/28/2011 13:47,2.1,17419,United Kingdom
579156,23490,T-LIGHT HOLDER HANGING LOVE BIRD,12,11/28/2011 13:47,3.75,17419,United Kingdom
579156,22456,NATURAL SLATE CHALKBOARD LARGE ,3,11/28/2011 13:47,4.95,17419,United Kingdom
579156,23109,PACK OF SIX LED TEA LIGHTS,6,11/28/2011 13:47,2.89,17419,United Kingdom
579156,22193,RED DINER WALL CLOCK,4,11/28/2011 13:47,8.5,17419,United Kingdom
579156,22617,BAKING SET SPACEBOY DESIGN,3,11/28/2011 13:47,4.95,17419,United Kingdom
579156,23359,SET OF 12 T-LIGHTS VINTAGE DOILY,12,11/28/2011 13:47,1.95,17419,United Kingdom
579156,85048,15CM CHRISTMAS GLASS BALL 20 LIGHTS,2,11/28/2011 13:47,7.95,17419,United Kingdom
579157,23493,VINTAGE DOILY TRAVEL SEWING KIT,10,11/28/2011 13:51,1.95,15540,United Kingdom
579157,23434,3 RAFFIA RIBBONS 50'S CHRISTMAS ,10,11/28/2011 13:51,0.79,15540,United Kingdom
579157,84875B,GREEN SQUARE COMPACT MIRROR,10,11/28/2011 13:51,1.25,15540,United Kingdom
579157,90030A,SPOTTED WHITE NATURAL SEED NECKLACE,6,11/28/2011 13:51,1,15540,United Kingdom
579157,90030B,RED KUKUI COCONUT SEED NECKLACE,6,11/28/2011 13:51,1,15540,United Kingdom
579157,23076,ICE CREAM SUNDAE LIP GLOSS,24,11/28/2011 13:51,1.25,15540,United Kingdom
579157,22138,BAKING SET 9 PIECE RETROSPOT ,3,11/28/2011 13:51,4.95,15540,United Kingdom
579157,21116,OWL DOORSTOP,3,11/28/2011 13:51,4.95,15540,United Kingdom
579157,21934,SKULL SHOULDER BAG,10,11/28/2011 13:51,1.65,15540,United Kingdom
579157,21494,ROTATING LEAVES T-LIGHT HOLDER,12,11/28/2011 13:51,1.25,15540,United Kingdom
579157,21935,SUKI  SHOULDER BAG,10,11/28/2011 13:51,1.65,15540,United Kingdom
579157,22110,BIRD HOUSE HOT WATER BOTTLE,6,11/28/2011 13:51,2.55,15540,United Kingdom
579157,22821,GIFT BAG PSYCHEDELIC APPLES,12,11/28/2011 13:51,0.65,15540,United Kingdom
579157,79144B,PAINTED LIGHTBULB STAR+ MOON,6,11/28/2011 13:51,0.42,15540,United Kingdom
579157,22944,CHRISTMAS METAL POSTCARD WITH BELLS,72,11/28/2011 13:51,0.39,15540,United Kingdom
579158,23503,PLAYING CARDS KEEP CALM & CARRY ON,12,11/28/2011 13:53,1.25,17188,United Kingdom
579158,23355,HOT WATER BOTTLE KEEP CALM,8,11/28/2011 13:53,4.95,17188,United Kingdom
579158,22971,QUEENS GUARD COFFEE MUG,6,11/28/2011 13:53,2.55,17188,United Kingdom
579158,22970,LONDON BUS COFFEE MUG,6,11/28/2011 13:53,2.55,17188,United Kingdom
579158,23090,VINTAGE GLASS T-LIGHT HOLDER,12,11/28/2011 13:53,0.83,17188,United Kingdom
579158,84946,ANTIQUE SILVER T-LIGHT GLASS,12,11/28/2011 13:53,1.25,17188,United Kingdom
579158,85048,15CM CHRISTMAS GLASS BALL 20 LIGHTS,12,11/28/2011 13:53,6.95,17188,United Kingdom
579158,22435,SET OF 9 HEART SHAPED BALLOONS,12,11/28/2011 13:53,1.25,17188,United Kingdom
579158,22632,HAND WARMER RED RETROSPOT,12,11/28/2011 13:53,2.1,17188,United Kingdom
579158,22865,HAND WARMER OWL DESIGN,12,11/28/2011 13:53,2.1,17188,United Kingdom
579158,22866,HAND WARMER SCOTTY DOG DESIGN,12,11/28/2011 13:53,2.1,17188,United Kingdom
579158,22585,PACK OF 6 BIRDY GIFT TAGS,12,11/28/2011 13:53,1.25,17188,United Kingdom
579158,23353,6 GIFT TAGS VINTAGE CHRISTMAS ,12,11/28/2011 13:53,0.83,17188,United Kingdom
579159,23349,ROLL WRAP VINTAGE CHRISTMAS,12,11/28/2011 13:53,1.25,13196,United Kingdom
579159,23352,ROLL WRAP 50'S RED CHRISTMAS ,12,11/28/2011 13:53,1.25,13196,United Kingdom
579159,23350,ROLL WRAP VINTAGE SPOT ,24,11/28/2011 13:53,1.25,13196,United Kingdom
579159,23351,ROLL WRAP 50'S CHRISTMAS,12,11/28/2011 13:53,1.25,13196,United Kingdom
579159,21506,"FANCY FONT BIRTHDAY CARD, ",12,11/28/2011 13:53,0.42,13196,United Kingdom
579159,23494,VINTAGE DOILY DELUXE SEWING KIT ,3,11/28/2011 13:53,5.95,13196,United Kingdom
579159,22139,RETROSPOT TEA SET CERAMIC 11 PC ,6,11/28/2011 13:53,4.95,13196,United Kingdom
579159,22551,PLASTERS IN TIN SPACEBOY,12,11/28/2011 13:53,1.65,13196,United Kingdom
579159,23695,DOILY THANK YOU CARD,12,11/28/2011 13:53,0.42,13196,United Kingdom
579160,23506,MINI PLAYING CARDS SPACEBOY ,20,11/28/2011 13:54,0.42,13196,United Kingdom
579160,23570,TRADITIONAL PICK UP STICKS GAME ,12,11/28/2011 13:54,1.25,13196,United Kingdom
579160,23504,PLAYING CARDS JUBILEE UNION JACK,12,11/28/2011 13:54,1.25,13196,United Kingdom
579160,23370,SET 36 COLOURING PENCILS DOILY,16,11/28/2011 13:54,1.25,13196,United Kingdom
579161,21928,JUMBO BAG SCANDINAVIAN BLUE PAISLEY,1,11/28/2011 13:56,2.08,17379,United Kingdom
579161,23581,JUMBO BAG PAISLEY PARK,1,11/28/2011 13:56,2.08,17379,United Kingdom
579161,20712,JUMBO BAG WOODLAND ANIMALS,1,11/28/2011 13:56,2.08,17379,United Kingdom
579161,23344,JUMBO BAG 50'S CHRISTMAS ,1,11/28/2011 13:56,2.08,17379,United Kingdom
579161,47590B,PINK HAPPY BIRTHDAY BUNTING,1,11/28/2011 13:56,5.45,17379,United Kingdom
579161,22333,RETROSPOT PARTY BAG + STICKER SET,3,11/28/2011 13:56,1.65,17379,United Kingdom
579161,22110,BIRD HOUSE HOT WATER BOTTLE,2,11/28/2011 13:56,2.55,17379,United Kingdom
579161,23206,LUNCH BAG APPLE DESIGN,1,11/28/2011 13:56,1.65,17379,United Kingdom
579161,22662,LUNCH BAG DOLLY GIRL DESIGN,1,11/28/2011 13:56,1.65,17379,United Kingdom
579161,23583,LUNCH BAG PAISLEY PARK  ,1,11/28/2011 13:56,1.65,17379,United Kingdom
579161,22356,CHARLOTTE BAG PINK POLKADOT,1,11/28/2011 13:56,0.85,17379,United Kingdom
579161,84596F,SMALL MARSHMALLOWS PINK BOWL,2,11/28/2011 13:56,0.42,17379,United Kingdom
579161,22131,FOOD CONTAINER SET 3 LOVE HEART ,2,11/28/2011 13:56,1.95,17379,United Kingdom
579161,21380,WOODEN HAPPY BIRTHDAY GARLAND,1,11/28/2011 13:56,2.95,17379,United Kingdom
579161,21034,REX CASH+CARRY JUMBO SHOPPER,5,11/28/2011 13:56,0.95,17379,United Kingdom
579161,47590B,PINK HAPPY BIRTHDAY BUNTING,1,11/28/2011 13:56,5.45,17379,United Kingdom
579161,21731,RED TOADSTOOL LED NIGHT LIGHT,1,11/28/2011 13:56,1.65,17379,United Kingdom
579161,22079,RIBBON REEL HEARTS DESIGN ,5,11/28/2011 13:56,1.65,17379,United Kingdom
579161,22908,PACK OF 20 NAPKINS RED APPLES,2,11/28/2011 13:56,0.85,17379,United Kingdom
579161,22909,SET OF 20 VINTAGE CHRISTMAS NAPKINS,2,11/28/2011 13:56,0.85,17379,United Kingdom
579161,20724,RED RETROSPOT CHARLOTTE BAG,1,11/28/2011 13:56,0.85,17379,United Kingdom
579161,20719,WOODLAND CHARLOTTE BAG,1,11/28/2011 13:56,0.85,17379,United Kingdom
579161,23583,LUNCH BAG PAISLEY PARK  ,2,11/28/2011 13:56,1.65,17379,United Kingdom
579161,22356,CHARLOTTE BAG PINK POLKADOT,1,11/28/2011 13:56,0.85,17379,United Kingdom
579161,20723,STRAWBERRY CHARLOTTE BAG,2,11/28/2011 13:56,0.85,17379,United Kingdom
579161,23343,JUMBO BAG VINTAGE CHRISTMAS ,2,11/28/2011 13:56,2.08,17379,United Kingdom
579161,22338,STAR DECORATION PAINTED ZINC ,25,11/28/2011 13:56,0.19,17379,United Kingdom
579161,85194S,HANGING SPRING FLOWER EGG SMALL,5,11/28/2011 13:56,0.19,17379,United Kingdom
579161,22161,HEART DECORATION RUSTIC HANGING ,5,11/28/2011 13:56,0.19,17379,United Kingdom
579161,15034,PAPER POCKET TRAVELING FAN ,12,11/28/2011 13:56,0.14,17379,United Kingdom
579161,16216,LETTER SHAPE PENCIL SHARPENER,80,11/28/2011 13:56,0.06,17379,United Kingdom
579161,22865,HAND WARMER OWL DESIGN,5,11/28/2011 13:56,2.1,17379,United Kingdom
579161,23439,HAND WARMER RED LOVE HEART,10,11/28/2011 13:56,2.1,17379,United Kingdom
579161,22633,HAND WARMER UNION JACK,5,11/28/2011 13:56,2.1,17379,United Kingdom
579161,22867,HAND WARMER BIRD DESIGN,5,11/28/2011 13:56,2.1,17379,United Kingdom
579161,22834,HAND WARMER BABUSHKA DESIGN,5,11/28/2011 13:56,2.1,17379,United Kingdom
579161,22866,HAND WARMER SCOTTY DOG DESIGN,10,11/28/2011 13:56,2.1,17379,United Kingdom
579161,23005,TRAVEL CARD WALLET I LOVE LONDON,1,11/28/2011 13:56,0.42,17379,United Kingdom
579161,84510A,SET OF 4 ENGLISH ROSE COASTERS,1,11/28/2011 13:56,1.25,17379,United Kingdom
579161,21264,WHITE GOOSE FEATHER TREE 60CM ,2,11/28/2011 13:56,1.95,17379,United Kingdom
579161,84536A,ENGLISH ROSE NOTEBOOK A7 SIZE,8,11/28/2011 13:56,0.42,17379,United Kingdom
579161,84510A,SET OF 4 ENGLISH ROSE COASTERS,1,11/28/2011 13:56,1.25,17379,United Kingdom
