580956,22807,SET OF 6 T-LIGHTS TOADSTOOLS,2,12/6/2011 14:23,1.25,17841,United Kingdom
580956,22508,DOORSTOP RETROSPOT HEART,1,12/6/2011 14:23,3.75,17841,United Kingdom
580956,21982,PACK OF 12 SUKI TISSUES ,1,12/6/2011 14:23,0.39,17841,United Kingdom
580956,21967,PACK OF 12 SKULL TISSUES,1,12/6/2011 14:23,0.39,17841,United Kingdom
580956,21986,PACK OF 12 PINK POLKADOT TISSUES,1,12/6/2011 14:23,0.39,17841,United Kingdom
580956,21985,PACK OF 12 HEARTS DESIGN TISSUES ,2,12/6/2011 14:23,0.39,17841,United Kingdom
580956,23241,TREASURE TIN GYMKHANA DESIGN,2,12/6/2011 14:23,2.08,17841,United Kingdom
580956,23242,TREASURE TIN BUFFALO BILL ,1,12/6/2011 14:23,2.08,17841,United Kingdom
580956,84692,BOX OF 24 COCKTAIL PARASOLS,3,12/6/2011 14:23,0.42,17841,United Kingdom
580956,22673,FRENCH GARDEN SIGN BLUE METAL,1,12/6/2011 14:23,1.25,17841,United Kingdom
580956,22132,RED LOVE HEART SHAPE CUP,1,12/6/2011 14:23,0.85,17841,United Kingdom
C580957,POST,POSTAGE,-1,12/6/2011 14:23,4.5,12839,United Kingdom
580958,22597,MUSICAL ZINC HEART DECORATION ,1,12/6/2011 14:30,0.29,17266,United Kingdom
580958,22335,HEART DECORATION PAINTED ZINC ,7,12/6/2011 14:30,0.65,17266,United Kingdom
580958,23334,IVORY WICKER HEART SMALL,1,12/6/2011 14:30,0.63,17266,United Kingdom
580958,23333,IVORY WICKER HEART MEDIUM,1,12/6/2011 14:30,1.25,17266,United Kingdom
580958,23332,IVORY WICKER HEART LARGE,1,12/6/2011 14:30,1.65,17266,United Kingdom
580958,23334,IVORY WICKER HEART SMALL,4,12/6/2011 14:30,0.63,17266,United Kingdom
580958,23500,KEY RING BASEBALL BOOT ASSORTED ,1,12/6/2011 14:30,1.25,17266,United Kingdom
580958,22597,MUSICAL ZINC HEART DECORATION ,2,12/6/2011 14:30,0.29,17266,United Kingdom
580958,21818,GLITTER HEART DECORATION,20,12/6/2011 14:30,0.39,17266,United Kingdom
580958,22597,MUSICAL ZINC HEART DECORATION ,7,12/6/2011 14:30,0.29,17266,United Kingdom
580958,23334,IVORY WICKER HEART SMALL,2,12/6/2011 14:30,0.63,17266,United Kingdom
580958,23332,IVORY WICKER HEART LARGE,2,12/6/2011 14:30,1.65,17266,United Kingdom
580958,23333,IVORY WICKER HEART MEDIUM,2,12/6/2011 14:30,1.25,17266,United Kingdom
580958,23333,IVORY WICKER HEART MEDIUM,4,12/6/2011 14:30,1.25,17266,United Kingdom
580958,22910,PAPER CHAIN KIT VINTAGE CHRISTMAS,1,12/6/2011 14:30,2.95,17266,United Kingdom
580958,23333,IVORY WICKER HEART MEDIUM,1,12/6/2011 14:30,1.25,17266,United Kingdom
580958,23332,IVORY WICKER HEART LARGE,6,12/6/2011 14:30,1.65,17266,United Kingdom
580958,23323,WHITE WICKER STAR ,1,12/6/2011 14:30,2.1,17266,United Kingdom
580958,23500,KEY RING BASEBALL BOOT ASSORTED ,5,12/6/2011 14:30,1.25,17266,United Kingdom
580958,23074,EMBOSSED HEART TRINKET BOX,3,12/6/2011 14:30,2.08,17266,United Kingdom
580958,23084,RABBIT NIGHT LIGHT,1,12/6/2011 14:30,2.08,17266,United Kingdom
580958,23061,VINTAGE EMBOSSED HEART,6,12/6/2011 14:30,1.25,17266,United Kingdom
580958,23571,TRADITIONAL NAUGHTS & CROSSES,1,12/6/2011 14:30,1.65,17266,United Kingdom
580958,23570,TRADITIONAL PICK UP STICKS GAME ,1,12/6/2011 14:30,1.25,17266,United Kingdom
580958,23569,TRADTIONAL ALPHABET STAMP SET,1,12/6/2011 14:30,4.95,17266,United Kingdom
580958,21561,DINOSAUR LUNCH BOX WITH CUTLERY,1,12/6/2011 14:30,2.55,17266,United Kingdom
580958,21704,BAG 250g SWIRLY MARBLES,1,12/6/2011 14:30,0.85,17266,United Kingdom
580958,22335,HEART DECORATION PAINTED ZINC ,1,12/6/2011 14:30,0.65,17266,United Kingdom
580958,23084,RABBIT NIGHT LIGHT,1,12/6/2011 14:30,2.08,17266,United Kingdom
580958,21588,RETROSPOT GIANT TUBE MATCHES,1,12/6/2011 14:30,2.55,17266,United Kingdom
580958,20781,GOLD EAR MUFF HEADPHONES,1,12/6/2011 14:30,1.95,17266,United Kingdom
580958,23194,GYMKHANA TREASURE BOOK BOX,1,12/6/2011 14:30,2.25,17266,United Kingdom
580958,22992,REVOLVER WOODEN RULER ,2,12/6/2011 14:30,1.95,17266,United Kingdom
580958,22620,4 TRADITIONAL SPINNING TOPS,1,12/6/2011 14:30,1.45,17266,United Kingdom
580958,20781,GOLD EAR MUFF HEADPHONES,1,12/6/2011 14:30,1.95,17266,United Kingdom
580958,21533,RETROSPOT LARGE MILK JUG,1,12/6/2011 14:30,4.95,17266,United Kingdom
580958,23084,RABBIT NIGHT LIGHT,1,12/6/2011 14:30,2.08,17266,United Kingdom
580958,20781,GOLD EAR MUFF HEADPHONES,1,12/6/2011 14:30,1.95,17266,United Kingdom
580958,22070,SMALL RED RETROSPOT MUG IN BOX ,1,12/6/2011 14:30,3.75,17266,United Kingdom
580958,21844,RED RETROSPOT MUG,2,12/6/2011 14:30,2.95,17266,United Kingdom
580958,23345, DOLLY GIRL BEAKER,2,12/6/2011 14:30,1.25,17266,United Kingdom
580958,22197,POPCORN HOLDER,2,12/6/2011 14:30,0.85,17266,United Kingdom
580958,46000S,POLYESTER FILLER PAD 40x40cm,1,12/6/2011 14:30,1.45,17266,United Kingdom
580958,23241,TREASURE TIN GYMKHANA DESIGN,1,12/6/2011 14:30,2.08,17266,United Kingdom
580958,22071,SMALL WHITE RETROSPOT MUG IN BOX ,1,12/6/2011 14:30,3.75,17266,United Kingdom
580958,22667,RECIPE BOX RETROSPOT ,1,12/6/2011 14:30,2.95,17266,United Kingdom
580958,23461,SWEETHEART BIRD HOUSE,1,12/6/2011 14:30,4.15,17266,United Kingdom
580958,22634,CHILDS BREAKFAST SET SPACEBOY ,1,12/6/2011 14:30,9.95,17266,United Kingdom
580958,23245,SET OF 3 REGENCY CAKE TINS,1,12/6/2011 14:30,4.95,17266,United Kingdom
580958,22766,PHOTO FRAME CORNICE,2,12/6/2011 14:30,2.95,17266,United Kingdom
580958,23403,LETTER HOLDER HOME SWEET HOME,1,12/6/2011 14:30,3.75,17266,United Kingdom
580958,23194,GYMKHANA TREASURE BOOK BOX,1,12/6/2011 14:30,2.25,17266,United Kingdom
580958,23345, DOLLY GIRL BEAKER,2,12/6/2011 14:30,1.25,17266,United Kingdom
580958,23346,SPACEBOY BEAKER,4,12/6/2011 14:30,1.25,17266,United Kingdom
580958,23393,HOME SWEET HOME CUSHION COVER ,1,12/6/2011 14:30,3.75,17266,United Kingdom
580959,23188,VINTAGE  2 METRE FOLDING RULER,12,12/6/2011 14:31,1.65,14673,United Kingdom
580959,23084,RABBIT NIGHT LIGHT,6,12/6/2011 14:31,2.08,14673,United Kingdom
580959,84077,WORLD WAR 2 GLIDERS ASSTD DESIGNS,48,12/6/2011 14:31,0.29,14673,United Kingdom
580959,21891,TRADITIONAL WOODEN SKIPPING ROPE,12,12/6/2011 14:31,1.45,14673,United Kingdom
580959,22419,LIPSTICK PEN RED,12,12/6/2011 14:31,0.42,14673,United Kingdom
580959,21914,BLUE HARMONICA IN BOX ,12,12/6/2011 14:31,1.25,14673,United Kingdom
580959,22633,HAND WARMER UNION JACK,12,12/6/2011 14:31,2.1,14673,United Kingdom
580959,23355,HOT WATER BOTTLE KEEP CALM,4,12/6/2011 14:31,4.95,14673,United Kingdom
580959,22111,SCOTTIE DOG HOT WATER BOTTLE,3,12/6/2011 14:31,4.95,14673,United Kingdom
580959,22835,HOT WATER BOTTLE I AM SO POORLY,8,12/6/2011 14:31,4.95,14673,United Kingdom
580959,22114,HOT WATER BOTTLE TEA AND SYMPATHY,4,12/6/2011 14:31,4.25,14673,United Kingdom
580959,22178,VICTORIAN GLASS HANGING T-LIGHT,36,12/6/2011 14:31,1.95,14673,United Kingdom
580959,84946,ANTIQUE SILVER T-LIGHT GLASS,12,12/6/2011 14:31,1.25,14673,United Kingdom
580959,35970,ZINC FOLKART SLEIGH BELLS,12,12/6/2011 14:31,1.69,14673,United Kingdom
580959,84347,ROTATING SILVER ANGELS T-LIGHT HLDR,24,12/6/2011 14:31,2.55,14673,United Kingdom
580960,85199S,SMALL HANGING IVORY/RED WOOD BIRD,8,12/6/2011 14:35,0.42,16016,United Kingdom
580960,22639,SET OF 4 NAPKIN CHARMS HEARTS,2,12/6/2011 14:35,0.79,16016,United Kingdom
580960,22643,SET OF 4 NAPKIN CHARMS LEAVES   ,2,12/6/2011 14:35,0.79,16016,United Kingdom
580960,23355,HOT WATER BOTTLE KEEP CALM,1,12/6/2011 14:35,4.95,16016,United Kingdom
580960,22586,FELTCRAFT HAIRBAND PINK AND BLUE,4,12/6/2011 14:35,0.85,16016,United Kingdom
580960,22566,FELTCRAFT HAIRBAND PINK AND PURPLE,2,12/6/2011 14:35,0.85,16016,United Kingdom
580960,21485,RETROSPOT HEART HOT WATER BOTTLE,1,12/6/2011 14:35,4.95,16016,United Kingdom
580960,22111,SCOTTIE DOG HOT WATER BOTTLE,1,12/6/2011 14:35,4.95,16016,United Kingdom
580960,35095A,BLUE VICTORIAN FABRIC OVAL BOX,3,12/6/2011 14:35,0.42,16016,United Kingdom
580960,35095B,RED VICTORIAN FABRIC OVAL BOX,3,12/6/2011 14:35,0.42,16016,United Kingdom
580960,23583,LUNCH BAG PAISLEY PARK  ,2,12/6/2011 14:35,1.65,16016,United Kingdom
580960,20726,LUNCH BAG WOODLAND,2,12/6/2011 14:35,1.65,16016,United Kingdom
580960,23200,JUMBO BAG PEARS,2,12/6/2011 14:35,2.08,16016,United Kingdom
580960,23581,JUMBO BAG PAISLEY PARK,2,12/6/2011 14:35,2.08,16016,United Kingdom
580960,85099C,JUMBO  BAG BAROQUE BLACK WHITE,1,12/6/2011 14:35,2.08,16016,United Kingdom
580960,23202,JUMBO BAG VINTAGE LEAF,1,12/6/2011 14:35,2.08,16016,United Kingdom
580960,21730,GLASS STAR FROSTED T-LIGHT HOLDER,2,12/6/2011 14:35,4.95,16016,United Kingdom
580960,20728,LUNCH BAG CARS BLUE,2,12/6/2011 14:35,1.65,16016,United Kingdom
580960,23208,LUNCH BAG VINTAGE LEAF DESIGN,2,12/6/2011 14:35,1.65,16016,United Kingdom
580960,22500,SET OF 2 TINS JARDIN DE PROVENCE,3,12/6/2011 14:35,1.25,16016,United Kingdom
580960,21428,SET3 BOOK BOX GREEN GINGHAM FLOWER ,2,12/6/2011 14:35,4.25,16016,United Kingdom
580960,22568,FELTCRAFT CUSHION OWL,2,12/6/2011 14:35,3.75,16016,United Kingdom
580960,71477,COLOURED GLASS STAR T-LIGHT HOLDER,2,12/6/2011 14:35,3.95,16016,United Kingdom
580960,22326,ROUND SNACK BOXES SET OF4 WOODLAND ,4,12/6/2011 14:35,2.95,16016,United Kingdom
580960,20767,BLUE PAISLEY JOURNAL ,1,12/6/2011 14:35,2.55,16016,United Kingdom
580960,20769,DAISY JOURNAL ,1,12/6/2011 14:35,2.55,16016,United Kingdom
580960,20772,GARDEN PATH JOURNAL,1,12/6/2011 14:35,2.55,16016,United Kingdom
580960,20764,ABSTRACT CIRCLES SKETCHBOOK ,1,12/6/2011 14:35,3.75,16016,United Kingdom
580960,21991,BOHEMIAN COLLAGE STATIONERY SET,2,12/6/2011 14:35,1.25,16016,United Kingdom
580960,21993,FLORAL FOLK STATIONERY SET,2,12/6/2011 14:35,1.25,16016,United Kingdom
580960,21990,MODERN FLORAL STATIONERY SET,2,12/6/2011 14:35,1.25,16016,United Kingdom
580960,84879,ASSORTED COLOUR BIRD ORNAMENT,8,12/6/2011 14:35,1.69,16016,United Kingdom
580960,23201,JUMBO BAG ALPHABET,2,12/6/2011 14:35,2.08,16016,United Kingdom
580961,23083,SET 6 PAPER TABLE LANTERN STARS ,4,12/6/2011 14:40,3.75,14572,United Kingdom
580961,23313,VINTAGE CHRISTMAS BUNTING,2,12/6/2011 14:40,4.95,14572,United Kingdom
580961,23430,BLUE RETRO KITCHEN WALL CLOCK,1,12/6/2011 14:40,8.15,14572,United Kingdom
580961,22423,REGENCY CAKESTAND 3 TIER,8,12/6/2011 14:40,12.75,14572,United Kingdom
580962,85099B,JUMBO BAG RED RETROSPOT,10,12/6/2011 14:40,2.08,17119,United Kingdom
580962,84029G,KNITTED UNION FLAG HOT WATER BOTTLE,4,12/6/2011 14:40,4.25,17119,United Kingdom
580962,21742,LARGE ROUND WICKER PLATTER ,2,12/6/2011 14:40,5.95,17119,United Kingdom
580962,23432,PRETTY HANGING QUILTED HEARTS,12,12/6/2011 14:40,0.83,17119,United Kingdom
580963,22865,HAND WARMER OWL DESIGN,12,12/6/2011 14:49,2.1,14868,United Kingdom
580963,22867,HAND WARMER BIRD DESIGN,12,12/6/2011 14:49,2.1,14868,United Kingdom
580963,22556,PLASTERS IN TIN CIRCUS PARADE ,12,12/6/2011 14:49,1.65,14868,United Kingdom
580963,22554,PLASTERS IN TIN WOODLAND ANIMALS,12,12/6/2011 14:49,1.65,14868,United Kingdom
580963,22557,PLASTERS IN TIN VINTAGE PAISLEY ,12,12/6/2011 14:49,1.65,14868,United Kingdom
580963,23493,VINTAGE DOILY TRAVEL SEWING KIT,10,12/6/2011 14:49,1.95,14868,United Kingdom
580963,23480,MINI LIGHTS WOODLAND MUSHROOMS,4,12/6/2011 14:49,3.75,14868,United Kingdom
580963,21731,RED TOADSTOOL LED NIGHT LIGHT,12,12/6/2011 14:49,1.65,14868,United Kingdom
580963,23084,RABBIT NIGHT LIGHT,18,12/6/2011 14:49,2.08,14868,United Kingdom
580963,22112,CHOCOLATE HOT WATER BOTTLE,9,12/6/2011 14:49,4.95,14868,United Kingdom
580963,22835,HOT WATER BOTTLE I AM SO POORLY,8,12/6/2011 14:49,4.95,14868,United Kingdom
580963,23355,HOT WATER BOTTLE KEEP CALM,12,12/6/2011 14:49,4.95,14868,United Kingdom
580963,23083,SET 6 PAPER TABLE LANTERN STARS ,12,12/6/2011 14:49,3.75,14868,United Kingdom
580964,23332,IVORY WICKER HEART LARGE,20,12/6/2011 14:50,1.65,15822,United Kingdom
580964,21742,LARGE ROUND WICKER PLATTER ,4,12/6/2011 14:50,5.95,15822,United Kingdom
580964,23321,SMALL WHITE HEART OF WICKER,12,12/6/2011 14:50,1.65,15822,United Kingdom
580964,23323,WHITE WICKER STAR ,6,12/6/2011 14:50,2.1,15822,United Kingdom
580964,23322,LARGE WHITE HEART OF WICKER,4,12/6/2011 14:50,2.95,15822,United Kingdom
580964,85048,15CM CHRISTMAS GLASS BALL 20 LIGHTS,8,12/6/2011 14:50,7.95,15822,United Kingdom
580964,23273,HEART T-LIGHT HOLDER WILLIE WINKIE,9,12/6/2011 14:50,1.65,15822,United Kingdom
580964,22791,T-LIGHT GLASS FLUTED ANTIQUE,24,12/6/2011 14:50,1.25,15822,United Kingdom
580964,21385,IVORY HANGING DECORATION  HEART,24,12/6/2011 14:50,0.85,15822,United Kingdom
580964,84947,ANTIQUE SILVER TEA GLASS ENGRAVED,12,12/6/2011 14:50,1.25,15822,United Kingdom
580964,22178,VICTORIAN GLASS HANGING T-LIGHT,12,12/6/2011 14:50,1.95,15822,United Kingdom
580964,84946,ANTIQUE SILVER T-LIGHT GLASS,12,12/6/2011 14:50,1.25,15822,United Kingdom
580964,84949,SILVER HANGING T-LIGHT HOLDER,12,12/6/2011 14:50,1.65,15822,United Kingdom
580964,23090,VINTAGE GLASS T-LIGHT HOLDER,24,12/6/2011 14:50,0.83,15822,United Kingdom
580964,23114,VINTAGE LEAF CHOPPING BOARD  ,2,12/6/2011 14:50,4.95,15822,United Kingdom
580964,23283,DOORMAT VINTAGE LEAF,10,12/6/2011 14:50,7.08,15822,United Kingdom
580964,23202,JUMBO BAG VINTAGE LEAF,20,12/6/2011 14:50,2.08,15822,United Kingdom
580965,23576,SNACK TRAY RED VINTAGE DOILY,8,12/6/2011 14:52,1.95,12417,Belgium
580965,23562,SET OF 6 RIBBONS PERFECTLY PRETTY  ,6,12/6/2011 14:52,2.89,12417,Belgium
580965,22423,REGENCY CAKESTAND 3 TIER,4,12/6/2011 14:52,12.75,12417,Belgium
580965,23007, SPACEBOY BABY GIFT SET,1,12/6/2011 14:52,16.95,12417,Belgium
580965,23241,TREASURE TIN GYMKHANA DESIGN,6,12/6/2011 14:52,2.08,12417,Belgium
580965,21135,VICTORIAN  METAL POSTCARD SPRING,8,12/6/2011 14:52,1.69,12417,Belgium
580965,22944,CHRISTMAS METAL POSTCARD WITH BELLS,12,12/6/2011 14:52,1.25,12417,Belgium
580965,22959,WRAP CHRISTMAS VILLAGE,25,12/6/2011 14:52,0.42,12417,Belgium
580965,16161P,WRAP ENGLISH ROSE ,25,12/6/2011 14:52,0.42,12417,Belgium
580965,22666,RECIPE BOX PANTRY YELLOW DESIGN,6,12/6/2011 14:52,2.95,12417,Belgium
580965,23243,SET OF TEA COFFEE SUGAR TINS PANTRY,4,12/6/2011 14:52,4.95,12417,Belgium
580965,21499,BLUE POLKADOT WRAP,25,12/6/2011 14:52,0.42,12417,Belgium
580965,23173,REGENCY TEAPOT ROSES ,2,12/6/2011 14:52,9.95,12417,Belgium
580965,23175,REGENCY MILK JUG PINK ,4,12/6/2011 14:52,3.25,12417,Belgium
580965,23174,REGENCY SUGAR BOWL GREEN,4,12/6/2011 14:52,4.15,12417,Belgium
580965,23170,REGENCY TEA PLATE ROSES ,12,12/6/2011 14:52,1.65,12417,Belgium
580965,21218,RED SPOTTY BISCUIT TIN,6,12/6/2011 14:52,3.75,12417,Belgium
580965,22624,IVORY KITCHEN SCALES,2,12/6/2011 14:52,8.5,12417,Belgium
580965,22915,ASSORTED BOTTLE TOP  MAGNETS ,12,12/6/2011 14:52,0.42,12417,Belgium
580965,POST,POSTAGE,3,12/6/2011 14:52,15,12417,Belgium
C580966,23212,HEART WREATH DECORATION WITH BELL,-12,12/6/2011 14:52,1.25,16554,United Kingdom
C580966,22130,PARTY CONE CHRISTMAS DECORATION ,-1,12/6/2011 14:52,0.85,16554,United Kingdom
C580966,23108,SET OF 10 LED DOLLY LIGHTS,-2,12/6/2011 14:52,6.25,16554,United Kingdom
C580966,23103,JINGLE BELL HEART DECORATION,-24,12/6/2011 14:52,1.65,16554,United Kingdom
C580966,23083,SET 6 PAPER TABLE LANTERN STARS ,-3,12/6/2011 14:52,3.75,16554,United Kingdom
C580966,22602,RETROSPOT WOODEN HEART DECORATION,-4,12/6/2011 14:52,0.85,16554,United Kingdom
C580966,22600,CHRISTMAS RETROSPOT STAR WOOD,-4,12/6/2011 14:52,0.85,16554,United Kingdom
C580966,22577,WOODEN HEART CHRISTMAS SCANDINAVIAN,-5,12/6/2011 14:52,0.29,16554,United Kingdom
C580966,22469,HEART OF WICKER SMALL,-4,12/6/2011 14:52,1.65,16554,United Kingdom
C580966,21314,SMALL GLASS HEART TRINKET POT,-4,12/6/2011 14:52,2.1,16554,United Kingdom
580967,84836,ZINC METAL HEART DECORATION,12,12/6/2011 14:56,1.25,14216,United Kingdom
580967,84347,ROTATING SILVER ANGELS T-LIGHT HLDR,10,12/6/2011 14:56,2.55,14216,United Kingdom
580967,21390,FILIGRIS HEART WITH BUTTERFLY,24,12/6/2011 14:56,1.25,14216,United Kingdom
580967,22294,HEART FILIGREE DOVE  SMALL,24,12/6/2011 14:56,1.25,14216,United Kingdom
580967,21340,CLASSIC METAL BIRDCAGE PLANT HOLDER,1,12/6/2011 14:56,12.75,14216,United Kingdom
580967,23485,BOTANICAL GARDENS WALL CLOCK ,1,12/6/2011 14:56,25,14216,United Kingdom
C580968,23583,LUNCH BAG PAISLEY PARK  ,-10,12/6/2011 14:57,1.65,15622,United Kingdom
C580968,23582,VINTAGE DOILY JUMBO BAG RED ,-20,12/6/2011 14:57,2.08,15622,United Kingdom
C580968,23581,JUMBO BAG PAISLEY PARK,-20,12/6/2011 14:57,2.08,15622,United Kingdom
C580968,23542,WALL ART 70'S ALPHABET ,-2,12/6/2011 14:57,8.25,15622,United Kingdom
C580968,23536,WALL ART VILLAGE SHOW ,-4,12/6/2011 14:57,5.95,15622,United Kingdom
C580968,23534,WALL ART STOP FOR TEA ,-4,12/6/2011 14:57,5.95,15622,United Kingdom
C580968,23534,WALL ART STOP FOR TEA ,-3,12/6/2011 14:57,5.95,15622,United Kingdom
C580968,23527,WALL ART ANIMALS AND NATURE ,-6,12/6/2011 14:57,3.75,15622,United Kingdom
C580968,23526,WALL ART DOG LICENCE ,-4,12/6/2011 14:57,5.95,15622,United Kingdom
C580968,23525,WALL ART BUFFALO BILL ,-6,12/6/2011 14:57,3.75,15622,United Kingdom
C580968,23524,WALL ART HORSE & PONY ,-6,12/6/2011 14:57,3.75,15622,United Kingdom
C580968,23523,WALL ART TREASURE AHOY ,-6,12/6/2011 14:57,3.75,15622,United Kingdom
C580968,23485,BOTANICAL GARDENS WALL CLOCK ,-1,12/6/2011 14:57,25,15622,United Kingdom
C580968,23382,BOX OF 6 CHRISTMAS CAKE DECORATIONS,-12,12/6/2011 14:57,3.75,15622,United Kingdom
C580968,23284,DOORMAT KEEP CALM AND COME IN,-2,12/6/2011 14:57,8.25,15622,United Kingdom
580969,22138,BAKING SET 9 PIECE RETROSPOT ,6,12/6/2011 14:59,4.95,16076,United Kingdom
580969,23301,GARDENERS KNEELING PAD KEEP CALM ,24,12/6/2011 14:59,1.65,16076,United Kingdom
580969,21790,VINTAGE SNAP CARDS,12,12/6/2011 14:59,0.85,16076,United Kingdom
580969,22139,RETROSPOT TEA SET CERAMIC 11 PC ,6,12/6/2011 14:59,4.95,16076,United Kingdom
580969,21914,BLUE HARMONICA IN BOX ,12,12/6/2011 14:59,1.25,16076,United Kingdom
580969,23208,LUNCH BAG VINTAGE LEAF DESIGN,10,12/6/2011 14:59,1.65,16076,United Kingdom
580969,21169,YOU'RE CONFUSING ME METAL SIGN ,12,12/6/2011 14:59,1.69,16076,United Kingdom
C580970,22946,WOODEN ADVENT CALENDAR CREAM,-6,12/6/2011 15:01,12.75,15814,United Kingdom
C580971,90058B,CRYSTAL STUD EARRINGS ASSORTED COL ,-36,12/6/2011 15:04,0.38,14298,United Kingdom
C580971,90058A,CRYSTAL STUD EARRINGS CLEAR DISPLAY,-36,12/6/2011 15:04,0.38,14298,United Kingdom
C580971,22313,OFFICE MUG WARMER PINK,-250,12/6/2011 15:04,2.55,14298,United Kingdom
580972,20972,PINK CREAM FELT CRAFT TRINKET BOX ,12,12/6/2011 15:10,1.25,15194,United Kingdom
580972,22749,FELTCRAFT PRINCESS CHARLOTTE DOLL,8,12/6/2011 15:10,3.75,15194,United Kingdom
580972,22169,FAMILY ALBUM WHITE PICTURE FRAME,8,12/6/2011 15:10,7.65,15194,United Kingdom
580972,23455,SMALL PARLOUR PICTURE FRAME,6,12/6/2011 15:10,2.89,15194,United Kingdom
580972,47480,HANGING PHOTO CLIP ROPE LADDER,96,12/6/2011 15:10,1.45,15194,United Kingdom
580972,23331,DECORATIVE WICKER HEART SMALL,48,12/6/2011 15:10,0.63,15194,United Kingdom
580972,21930,JUMBO STORAGE BAG SKULLS,10,12/6/2011 15:10,2.08,15194,United Kingdom
580972,21292,SMALL STRIPES CHOCOLATE GIFT BAG ,96,12/6/2011 15:10,0.19,15194,United Kingdom
580972,21564,PINK  HEART SHAPE LOVE BUCKET ,24,12/6/2011 15:10,0.79,15194,United Kingdom
580972,21705,BAG 500g SWIRLY MARBLES,24,12/6/2011 15:10,0.39,15194,United Kingdom
580972,22185,SLATE TILE NATURAL HANGING,12,12/6/2011 15:10,0.79,15194,United Kingdom
580972,22215,CAKE STAND WHITE TWO TIER LACE,12,12/6/2011 15:10,2.95,15194,United Kingdom
580972,22216,T-LIGHT HOLDER WHITE LACE,48,12/6/2011 15:10,0.29,15194,United Kingdom
580972,22217,T-LIGHT HOLDER HANGING LACE,36,12/6/2011 15:10,0.39,15194,United Kingdom
580972,22319,HAIRCLIPS FORTIES FABRIC ASSORTED,36,12/6/2011 15:10,0.19,15194,United Kingdom
580972,22486,PLASMATRONIC LAMP,6,12/6/2011 15:10,3.95,15194,United Kingdom
580972,22473,TV DINNER TRAY VINTAGE PAISLEY,8,12/6/2011 15:10,1.95,15194,United Kingdom
580972,22596,CHRISTMAS STAR WISH LIST CHALKBOARD,48,12/6/2011 15:10,0.39,15194,United Kingdom
580972,84813,SET OF 4 DIAMOND NAPKIN RINGS,16,12/6/2011 15:10,2.95,15194,United Kingdom
580972,22153,ANGEL DECORATION STARS ON DRESS,48,12/6/2011 15:10,0.42,15194,United Kingdom
580972,22156,HEART DECORATION WITH PEARLS ,48,12/6/2011 15:10,0.85,15194,United Kingdom
580972,85061W,WHITE JEWELLED HEART DECORATION,24,12/6/2011 15:10,0.85,15194,United Kingdom
580972,23217,LAUREL HEART ANTIQUE SILVER,12,12/6/2011 15:10,1.25,15194,United Kingdom
580972,23219,LAUREL STAR ANTIQUE SILVER ,12,12/6/2011 15:10,1.25,15194,United Kingdom
580972,23482,PEARLISED IVORY HEART LARGE ,12,12/6/2011 15:10,1.65,15194,United Kingdom
580972,23334,IVORY WICKER HEART SMALL,48,12/6/2011 15:10,0.63,15194,United Kingdom
580973,21098,CHRISTMAS TOILET ROLL,12,12/6/2011 15:12,1.25,12820,United Kingdom
580973,22602,RETROSPOT WOODEN HEART DECORATION,12,12/6/2011 15:12,0.85,12820,United Kingdom
580973,22600,CHRISTMAS RETROSPOT STAR WOOD,12,12/6/2011 15:12,0.85,12820,United Kingdom
580973,23323,WHITE WICKER STAR ,18,12/6/2011 15:12,2.1,12820,United Kingdom
580973,23313,VINTAGE CHRISTMAS BUNTING,5,12/6/2011 15:12,4.95,12820,United Kingdom
580973,22086,PAPER CHAIN KIT 50'S CHRISTMAS ,6,12/6/2011 15:12,2.95,12820,United Kingdom
580973,84836,ZINC METAL HEART DECORATION,12,12/6/2011 15:12,1.25,12820,United Kingdom
580973,84946,ANTIQUE SILVER T-LIGHT GLASS,12,12/6/2011 15:12,1.25,12820,United Kingdom
580973,21479,WHITE SKULL HOT WATER BOTTLE ,4,12/6/2011 15:12,4.25,12820,United Kingdom
580973,22186,RED STAR CARD HOLDER,6,12/6/2011 15:12,2.95,12820,United Kingdom
580973,22592,CARDHOLDER HOLLY WREATH METAL,4,12/6/2011 15:12,3.75,12820,United Kingdom
580973,22791,T-LIGHT GLASS FLUTED ANTIQUE,12,12/6/2011 15:12,1.25,12820,United Kingdom
580974,79321,CHILLI LIGHTS,4,12/6/2011 15:17,5.75,14293,United Kingdom
580974,21509,COWBOYS AND INDIANS BIRTHDAY CARD ,12,12/6/2011 15:17,0.42,14293,United Kingdom
580974,21507,ELEPHANT BIRTHDAY CARD ,12,12/6/2011 15:17,0.42,14293,United Kingdom
580974,21508,VINTAGE KID DOLLY CARD ,12,12/6/2011 15:17,0.42,14293,United Kingdom
580974,22029,SPACEBOY BIRTHDAY CARD,12,12/6/2011 15:17,0.42,14293,United Kingdom
580974,22714,CARD BIRTHDAY COWBOY,12,12/6/2011 15:17,0.42,14293,United Kingdom
580974,22814,CARD PARTY GAMES ,12,12/6/2011 15:17,0.42,14293,United Kingdom
580974,21495,SKULLS AND CROSSBONES WRAP,25,12/6/2011 15:17,0.42,14293,United Kingdom
580974,22045,SPACEBOY GIFT WRAP,25,12/6/2011 15:17,0.42,14293,United Kingdom
580974,23232,WRAP VINTAGE LEAF DESIGN,25,12/6/2011 15:17,0.42,14293,United Kingdom
580974,21934,SKULL SHOULDER BAG,10,12/6/2011 15:17,1.65,14293,United Kingdom
580974,22632,HAND WARMER RED RETROSPOT,12,12/6/2011 15:17,2.1,14293,United Kingdom
580974,22866,HAND WARMER SCOTTY DOG DESIGN,12,12/6/2011 15:17,2.1,14293,United Kingdom
580974,22865,HAND WARMER OWL DESIGN,12,12/6/2011 15:17,2.1,14293,United Kingdom
580974,22867,HAND WARMER BIRD DESIGN,12,12/6/2011 15:17,2.1,14293,United Kingdom
580974,22111,SCOTTIE DOG HOT WATER BOTTLE,3,12/6/2011 15:17,4.95,14293,United Kingdom
580974,84032A,CHARLIE+LOLA PINK HOT WATER BOTTLE,12,12/6/2011 15:17,2.95,14293,United Kingdom
580974,84032B,CHARLIE + LOLA RED HOT WATER BOTTLE,6,12/6/2011 15:17,2.95,14293,United Kingdom
580974,21479,WHITE SKULL HOT WATER BOTTLE ,4,12/6/2011 15:17,4.25,14293,United Kingdom
580974,22534,MAGIC DRAWING SLATE SPACEBOY ,24,12/6/2011 15:17,0.42,14293,United Kingdom
580974,22530,MAGIC DRAWING SLATE DOLLY GIRL ,24,12/6/2011 15:17,0.42,14293,United Kingdom
580975,22041,"RECORD FRAME 7"" SINGLE SIZE ",24,12/6/2011 15:28,2.55,12989,United Kingdom
580976,POST,POSTAGE,1,12/6/2011 15:29,5.29,,United Kingdom
580977,21137,BLACK RECORD COVER FRAME,12,12/6/2011 15:32,3.75,16569,United Kingdom
580977,16169E,WRAP 50'S  CHRISTMAS,25,12/6/2011 15:32,0.42,16569,United Kingdom
580977,23545,WRAP RED VINTAGE DOILY,25,12/6/2011 15:32,0.42,16569,United Kingdom
580977,23231,WRAP  VINTAGE DOILY ,25,12/6/2011 15:32,0.42,16569,United Kingdom
580977,85048,15CM CHRISTMAS GLASS BALL 20 LIGHTS,6,12/6/2011 15:32,7.95,16569,United Kingdom
580978,22109,FULL ENGLISH BREAKFAST PLATE,16,12/6/2011 15:36,3.39,13078,United Kingdom
580978,22107,PIZZA PLATE IN BOX,8,12/6/2011 15:36,1.25,13078,United Kingdom
580978,22682,FRENCH BLUE METAL DOOR SIGN 7,10,12/6/2011 15:36,1.25,13078,United Kingdom
580978,84879,ASSORTED COLOUR BIRD ORNAMENT,160,12/6/2011 15:36,1.45,13078,United Kingdom
580978,22725,ALARM CLOCK BAKELIKE CHOCOLATE,4,12/6/2011 15:36,3.75,13078,United Kingdom
580978,22728,ALARM CLOCK BAKELIKE PINK,50,12/6/2011 15:36,3.39,13078,United Kingdom
580978,22730,ALARM CLOCK BAKELIKE IVORY,8,12/6/2011 15:36,3.75,13078,United Kingdom
580978,22197,POPCORN HOLDER,200,12/6/2011 15:36,0.72,13078,United Kingdom
580978,23084,RABBIT NIGHT LIGHT,96,12/6/2011 15:36,1.79,13078,United Kingdom
580979,23238,SET OF 4 KNICK KNACK TINS LONDON ,6,12/6/2011 15:40,4.15,12362,Belgium
580979,23237,SET OF 4 KNICK KNACK TINS LEAF,6,12/6/2011 15:40,4.15,12362,Belgium
580979,22328,ROUND SNACK BOXES SET OF 4 FRUITS ,6,12/6/2011 15:40,2.95,12362,Belgium
580979,23244,ROUND STORAGE TIN VINTAGE LEAF,6,12/6/2011 15:40,1.95,12362,Belgium
580979,23254,CHILDRENS CUTLERY DOLLY GIRL ,4,12/6/2011 15:40,4.15,12362,Belgium
580979,23256,CHILDRENS CUTLERY SPACEBOY ,4,12/6/2011 15:40,4.15,12362,Belgium
580979,23255,CHILDRENS CUTLERY CIRCUS PARADE,4,12/6/2011 15:40,4.15,12362,Belgium
580979,84997D,CHILDRENS CUTLERY POLKADOT PINK,4,12/6/2011 15:40,4.15,12362,Belgium
580979,23290,SPACEBOY CHILDRENS BOWL,8,12/6/2011 15:40,1.25,12362,Belgium
580979,23292,SPACEBOY CHILDRENS CUP,8,12/6/2011 15:40,1.25,12362,Belgium
580979,20749,ASSORTED COLOUR MINI CASES,2,12/6/2011 15:40,7.95,12362,Belgium
580979,20750,RED RETROSPOT MINI CASES,2,12/6/2011 15:40,7.95,12362,Belgium
580979,23389,SPACEBOY MINI BACKPACK,4,12/6/2011 15:40,4.15,12362,Belgium
580979,23390,DOLLY GIRL MINI BACKPACK,4,12/6/2011 15:40,4.15,12362,Belgium
580979,23391, I LOVE LONDON MINI BACKPACK,4,12/6/2011 15:40,4.15,12362,Belgium
580979,23204,CHARLOTTE BAG APPLES DESIGN,10,12/6/2011 15:40,0.85,12362,Belgium
580979,21931,JUMBO STORAGE BAG SUKI,10,12/6/2011 15:40,2.08,12362,Belgium
580979,23199,JUMBO BAG APPLES,10,12/6/2011 15:40,2.08,12362,Belgium
580979,23202,JUMBO BAG VINTAGE LEAF,10,12/6/2011 15:40,2.08,12362,Belgium
