580979,85099B,JUMBO BAG RED RETROSPOT,10,12/6/2011 15:40,2.08,12362,Belgium
580979,23203,JUMBO BAG VINTAGE DOILY ,10,12/6/2011 15:40,2.08,12362,Belgium
580979,22816,CARD MOTORBIKE SANTA,12,12/6/2011 15:40,0.42,12362,Belgium
580979,22908,PACK OF 20 NAPKINS RED APPLES,12,12/6/2011 15:40,0.85,12362,Belgium
580979,23369,SET 36 COLOUR PENCILS LOVE LONDON,16,12/6/2011 15:40,1.25,12362,Belgium
580979,21704,BAG 250g SWIRLY MARBLES,12,12/6/2011 15:40,0.85,12362,Belgium
580979,22549,PICTURE DOMINOES,12,12/6/2011 15:40,1.45,12362,Belgium
580979,23569,TRADTIONAL ALPHABET STAMP SET,4,12/6/2011 15:40,4.95,12362,Belgium
580979,23598,PAPER BUNTING VINTAGE PARTY,6,12/6/2011 15:40,2.95,12362,Belgium
580979,23264,SET OF 3 WOODEN SLEIGH DECORATIONS,12,12/6/2011 15:40,1.25,12362,Belgium
580979,POST,POSTAGE,3,12/6/2011 15:40,18,12362,Belgium
580980,22577,WOODEN HEART CHRISTMAS SCANDINAVIAN,12,12/6/2011 15:43,0.29,17730,United Kingdom
580980,22112,CHOCOLATE HOT WATER BOTTLE,48,12/6/2011 15:43,4.25,17730,United Kingdom
580980,22114,HOT WATER BOTTLE TEA AND SYMPATHY,12,12/6/2011 15:43,4.25,17730,United Kingdom
580980,23355,HOT WATER BOTTLE KEEP CALM,24,12/6/2011 15:43,4.15,17730,United Kingdom
580980,85230B,CINNAMON SCENTED VOTIVE CANDLE,24,12/6/2011 15:43,0.29,17730,United Kingdom
580980,22984,CARD GINGHAM ROSE ,12,12/6/2011 15:43,0.42,17730,United Kingdom
580980,23695,DOILY THANK YOU CARD,12,12/6/2011 15:43,0.42,17730,United Kingdom
580980,22712,CARD DOLLY GIRL ,12,12/6/2011 15:43,0.42,17730,United Kingdom
580980,23694,PAISLEY PARK CARD,12,12/6/2011 15:43,0.42,17730,United Kingdom
580980,22986,WRAP GINGHAM ROSE ,50,12/6/2011 15:43,0.42,17730,United Kingdom
580980,23231,WRAP  VINTAGE DOILY ,25,12/6/2011 15:43,0.42,17730,United Kingdom
580980,23547,WRAP FLOWER SHOP  ,25,12/6/2011 15:43,0.42,17730,United Kingdom
580980,16161P,WRAP ENGLISH ROSE ,25,12/6/2011 15:43,0.42,17730,United Kingdom
580980,22144,CHRISTMAS CRAFT LITTLE FRIENDS,12,12/6/2011 15:43,2.1,17730,United Kingdom
580980,22142,CHRISTMAS CRAFT WHITE FAIRY ,12,12/6/2011 15:43,1.45,17730,United Kingdom
580980,23264,SET OF 3 WOODEN SLEIGH DECORATIONS,12,12/6/2011 15:43,1.25,17730,United Kingdom
580980,22865,HAND WARMER OWL DESIGN,24,12/6/2011 15:43,2.1,17730,United Kingdom
580980,23504,PLAYING CARDS JUBILEE UNION JACK,12,12/6/2011 15:43,1.25,17730,United Kingdom
580980,20768,GREEN FERN JOURNAL ,6,12/6/2011 15:43,2.55,17730,United Kingdom
580980,20769,DAISY JOURNAL ,6,12/6/2011 15:43,2.55,17730,United Kingdom
580980,84212,"ASSORTED FLOWER COLOUR ""LEIS""",48,12/6/2011 15:43,0.65,17730,United Kingdom
580980,21872,GLAMOROUS  MUG,12,12/6/2011 15:43,1.25,17730,United Kingdom
580980,21875,KINGS CHOICE MUG,12,12/6/2011 15:43,1.25,17730,United Kingdom
580980,22348,TEA BAG PLATE RED RETROSPOT,12,12/6/2011 15:43,0.85,17730,United Kingdom
580981,21115,ROSE CARAVAN DOORSTOP,8,12/6/2011 16:02,1.95,16201,United Kingdom
580981,23110,PARISIENNE KEY CABINET ,2,12/6/2011 16:02,5.75,16201,United Kingdom
580981,22596,CHRISTMAS STAR WISH LIST CHALKBOARD,12,12/6/2011 16:02,0.39,16201,United Kingdom
580981,22469,HEART OF WICKER SMALL,12,12/6/2011 16:02,1.65,16201,United Kingdom
580981,22695,WICKER WREATH SMALL,12,12/6/2011 16:02,0.59,16201,United Kingdom
580981,84879,ASSORTED COLOUR BIRD ORNAMENT,32,12/6/2011 16:02,1.69,16201,United Kingdom
580981,22867,HAND WARMER BIRD DESIGN,12,12/6/2011 16:02,2.1,16201,United Kingdom
580981,21930,JUMBO STORAGE BAG SKULLS,10,12/6/2011 16:02,2.08,16201,United Kingdom
580981,21928,JUMBO BAG SCANDINAVIAN BLUE PAISLEY,10,12/6/2011 16:02,2.08,16201,United Kingdom
580981,21931,JUMBO STORAGE BAG SUKI,10,12/6/2011 16:02,2.08,16201,United Kingdom
580981,23581,JUMBO BAG PAISLEY PARK,10,12/6/2011 16:02,2.08,16201,United Kingdom
580981,85099C,JUMBO  BAG BAROQUE BLACK WHITE,10,12/6/2011 16:02,2.08,16201,United Kingdom
580981,23343,JUMBO BAG VINTAGE CHRISTMAS ,10,12/6/2011 16:02,2.08,16201,United Kingdom
580981,23344,JUMBO BAG 50'S CHRISTMAS ,10,12/6/2011 16:02,2.08,16201,United Kingdom
580981,20713,JUMBO BAG OWLS,10,12/6/2011 16:02,2.08,16201,United Kingdom
580981,22386,JUMBO BAG PINK POLKADOT,10,12/6/2011 16:02,2.08,16201,United Kingdom
580981,23203,JUMBO BAG VINTAGE DOILY ,10,12/6/2011 16:02,2.08,16201,United Kingdom
580981,20719,WOODLAND CHARLOTTE BAG,10,12/6/2011 16:02,0.85,16201,United Kingdom
580981,22355,CHARLOTTE BAG SUKI DESIGN,10,12/6/2011 16:02,0.85,16201,United Kingdom
580981,23204,CHARLOTTE BAG APPLES DESIGN,10,12/6/2011 16:02,0.85,16201,United Kingdom
580981,22356,CHARLOTTE BAG PINK POLKADOT,10,12/6/2011 16:02,0.85,16201,United Kingdom
580981,22383,LUNCH BAG SUKI DESIGN ,10,12/6/2011 16:02,1.65,16201,United Kingdom
580981,20726,LUNCH BAG WOODLAND,10,12/6/2011 16:02,1.65,16201,United Kingdom
580981,23583,LUNCH BAG PAISLEY PARK  ,20,12/6/2011 16:02,1.65,16201,United Kingdom
580981,20725,LUNCH BAG RED RETROSPOT,10,12/6/2011 16:02,1.65,16201,United Kingdom
580981,22384,LUNCH BAG PINK POLKADOT,10,12/6/2011 16:02,1.65,16201,United Kingdom
580981,22581,WOOD STOCKING CHRISTMAS SCANDISPOT,12,12/6/2011 16:02,0.29,16201,United Kingdom
580981,22578,WOODEN STAR CHRISTMAS SCANDINAVIAN,12,12/6/2011 16:02,0.29,16201,United Kingdom
580981,23263,SET OF 3 WOODEN HEART DECORATIONS,12,12/6/2011 16:02,1.25,16201,United Kingdom
580981,20724,RED RETROSPOT CHARLOTTE BAG,10,12/6/2011 16:02,0.85,16201,United Kingdom
580982,20618,QUEEN OF THE SKIES PASSPORT COVER ,1,12/6/2011 16:21,2.1,17861,United Kingdom
580982,23250,VINTAGE RED TRIM ENAMEL BOWL ,12,12/6/2011 16:21,1.25,17861,United Kingdom
580982,21534,DAIRY MAID LARGE MILK JUG,1,12/6/2011 16:21,4.95,17861,United Kingdom
580982,22536,MAGIC DRAWING SLATE PURDEY,1,12/6/2011 16:21,0.42,17861,United Kingdom
580982,21358,TOAST ITS - HAPPY BIRTHDAY,1,12/6/2011 16:21,1.25,17861,United Kingdom
580982,22536,MAGIC DRAWING SLATE PURDEY,1,12/6/2011 16:21,0.42,17861,United Kingdom
580982,22601,CHRISTMAS RETROSPOT ANGEL WOOD,6,12/6/2011 16:21,0.85,17861,United Kingdom
580982,22600,CHRISTMAS RETROSPOT STAR WOOD,10,12/6/2011 16:21,0.85,17861,United Kingdom
580982,22536,MAGIC DRAWING SLATE PURDEY,1,12/6/2011 16:21,0.42,17861,United Kingdom
580982,20668,DISCO BALL CHRISTMAS DECORATION,72,12/6/2011 16:21,0.12,17861,United Kingdom
580982,22090,PAPER BUNTING RETROSPOT,6,12/6/2011 16:21,2.95,17861,United Kingdom
580982,22093,MOTORING TISSUE BOX,1,12/6/2011 16:21,0.39,17861,United Kingdom
580982,22558,CLOTHES PEGS RETROSPOT PACK 24 ,6,12/6/2011 16:21,1.65,17861,United Kingdom
580982,23392,SPACEBOY ROCKET LOLLY MAKERS,1,12/6/2011 16:21,2.08,17861,United Kingdom
580982,22471,TV DINNER TRAY AIR HOSTESS ,1,12/6/2011 16:21,1.95,17861,United Kingdom
580982,22475,SKULL DESIGN TV DINNER TRAY,1,12/6/2011 16:21,1.95,17861,United Kingdom
580982,23080,RED METAL BOX TOP SECRET,2,12/6/2011 16:21,8.25,17861,United Kingdom
580982,23009,I LOVE LONDON BABY GIFT SET,1,12/6/2011 16:21,16.95,17861,United Kingdom
580982,23007, SPACEBOY BABY GIFT SET,1,12/6/2011 16:21,16.95,17861,United Kingdom
580982,17003,BROCADE RING PURSE ,6,12/6/2011 16:21,0.39,17861,United Kingdom
