579391,22086,PAPER CHAIN KIT 50'S CHRISTMAS ,40,11/29/2011 12:07,2.55,14251,United Kingdom
579391,22544,MINI JIGSAW SPACEBOY,24,11/29/2011 12:07,0.42,14251,United Kingdom
579391,22539,MINI JIGSAW DOLLY GIRL,24,11/29/2011 12:07,0.42,14251,United Kingdom
579391,22537,MAGIC DRAWING SLATE DINOSAUR,24,11/29/2011 12:07,0.42,14251,United Kingdom
579391,22534,MAGIC DRAWING SLATE SPACEBOY ,24,11/29/2011 12:07,0.42,14251,United Kingdom
579391,22531,MAGIC DRAWING SLATE CIRCUS PARADE  ,24,11/29/2011 12:07,0.42,14251,United Kingdom
579391,22530,MAGIC DRAWING SLATE DOLLY GIRL ,24,11/29/2011 12:07,0.42,14251,United Kingdom
579391,72741,GRAND CHOCOLATECANDLE,72,11/29/2011 12:07,1.25,14251,United Kingdom
579391,22809,SET OF 6 T-LIGHTS SANTA,24,11/29/2011 12:07,2.95,14251,United Kingdom
579391,21790,VINTAGE SNAP CARDS,24,11/29/2011 12:07,0.85,14251,United Kingdom
579393,23473,WOODLAND SMALL RED FELT HEART,24,11/29/2011 12:07,0.83,12627,Germany
579393,23474,WOODLAND SMALL BLUE FELT HEART,24,11/29/2011 12:07,0.83,12627,Germany
579393,23475,WOODLAND SMALL PINK FELT HEART,12,11/29/2011 12:07,0.83,12627,Germany
579393,23480,MINI LIGHTS WOODLAND MUSHROOMS,8,11/29/2011 12:07,3.75,12627,Germany
579393,23497,CLASSIC CHROME BICYCLE BELL ,12,11/29/2011 12:07,1.45,12627,Germany
579393,23498,CLASSIC BICYCLE CLIPS ,12,11/29/2011 12:07,1.45,12627,Germany
579393,23552,BICYCLE PUNCTURE REPAIR KIT ,6,11/29/2011 12:07,2.08,12627,Germany
579393,23583,LUNCH BAG PAISLEY PARK  ,10,11/29/2011 12:07,1.65,12627,Germany
579393,23582,VINTAGE DOILY JUMBO BAG RED ,10,11/29/2011 12:07,2.08,12627,Germany
579393,23581,JUMBO BAG PAISLEY PARK,10,11/29/2011 12:07,2.08,12627,Germany
579393,23204,CHARLOTTE BAG APPLES DESIGN,10,11/29/2011 12:07,0.85,12627,Germany
579393,20712,JUMBO BAG WOODLAND ANIMALS,10,11/29/2011 12:07,2.08,12627,Germany
579393,22326,ROUND SNACK BOXES SET OF4 WOODLAND ,18,11/29/2011 12:07,2.95,12627,Germany
579393,22554,PLASTERS IN TIN WOODLAND ANIMALS,12,11/29/2011 12:07,1.65,12627,Germany
579393,21068,VINTAGE BILLBOARD LOVE/HATE MUG,12,11/29/2011 12:07,1.25,12627,Germany
579393,21673,WHITE SPOT BLUE CERAMIC DRAWER KNOB,12,11/29/2011 12:07,1.45,12627,Germany
579393,21670,BLUE SPOT CERAMIC DRAWER KNOB,12,11/29/2011 12:07,1.45,12627,Germany
579393,85169A,IVORY LOVE BIRD CANDLE,12,11/29/2011 12:07,1.25,12627,Germany
579393,85169D,PINK LOVE BIRD CANDLE,12,11/29/2011 12:07,1.25,12627,Germany
579393,20685,DOORMAT RED RETROSPOT,2,11/29/2011 12:07,8.25,12627,Germany
579393,21524,DOORMAT SPOTTY HOME SWEET HOME,2,11/29/2011 12:07,8.25,12627,Germany
579393,22690,DOORMAT HOME SWEET HOME BLUE ,2,11/29/2011 12:07,8.25,12627,Germany
579393,22691,DOORMAT WELCOME SUNRISE,2,11/29/2011 12:07,8.25,12627,Germany
579393,22962,JAM JAR WITH PINK LID,12,11/29/2011 12:07,0.85,12627,Germany
579393,21672,WHITE SPOT RED CERAMIC DRAWER KNOB,12,11/29/2011 12:07,1.45,12627,Germany
579393,21671,RED SPOT CERAMIC DRAWER KNOB,12,11/29/2011 12:07,1.45,12627,Germany
579393,21668,RED STRIPE CERAMIC DRAWER KNOB,12,11/29/2011 12:07,1.45,12627,Germany
579393,21669,BLUE STRIPE CERAMIC DRAWER KNOB,12,11/29/2011 12:07,1.45,12627,Germany
579393,POST,POSTAGE,3,11/29/2011 12:07,18,12627,Germany
579399,21668,RED STRIPE CERAMIC DRAWER KNOB,4,11/29/2011 12:09,1.45,13137,United Kingdom
579399,21672,WHITE SPOT RED CERAMIC DRAWER KNOB,4,11/29/2011 12:09,1.45,13137,United Kingdom
579399,23033,DRAWER KNOB CERAMIC RED,2,11/29/2011 12:09,1.45,13137,United Kingdom
579399,22774,RED DRAWER KNOB ACRYLIC EDWARDIAN,2,11/29/2011 12:09,1.25,13137,United Kingdom
579399,21669,BLUE STRIPE CERAMIC DRAWER KNOB,4,11/29/2011 12:09,1.45,13137,United Kingdom
579399,22771,CLEAR DRAWER KNOB ACRYLIC EDWARDIAN,2,11/29/2011 12:09,1.25,13137,United Kingdom
579399,21671,RED SPOT CERAMIC DRAWER KNOB,4,11/29/2011 12:09,1.45,13137,United Kingdom
579399,21670,BLUE SPOT CERAMIC DRAWER KNOB,4,11/29/2011 12:09,1.45,13137,United Kingdom
579399,23035,DRAWER KNOB CERAMIC IVORY,2,11/29/2011 12:09,1.45,13137,United Kingdom
579399,23344,JUMBO BAG 50'S CHRISTMAS ,5,11/29/2011 12:09,2.08,13137,United Kingdom
579399,22966,GINGERBREAD MAN COOKIE CUTTER,2,11/29/2011 12:09,1.25,13137,United Kingdom
579399,23571,TRADITIONAL NAUGHTS & CROSSES,3,11/29/2011 12:09,1.65,13137,United Kingdom
579399,21213,PACK OF 72 SKULL CAKE CASES,2,11/29/2011 12:09,0.55,13137,United Kingdom
579399,21975,PACK OF 60 DINOSAUR CAKE CASES,2,11/29/2011 12:09,0.55,13137,United Kingdom
579399,23307,SET OF 60 PANTRY DESIGN CAKE CASES ,2,11/29/2011 12:09,0.55,13137,United Kingdom
579399,23308,SET OF 60 VINTAGE LEAF CAKE CASES ,2,11/29/2011 12:09,0.55,13137,United Kingdom
579399,22951,60 CAKE CASES DOLLY GIRL DESIGN,2,11/29/2011 12:09,0.55,13137,United Kingdom
579399,21212,PACK OF 72 RETROSPOT CAKE CASES,3,11/29/2011 12:09,0.55,13137,United Kingdom
579399,22952,60 CAKE CASES VINTAGE CHRISTMAS,8,11/29/2011 12:09,0.55,13137,United Kingdom
579399,22086,PAPER CHAIN KIT 50'S CHRISTMAS ,2,11/29/2011 12:09,2.95,13137,United Kingdom
579399,22910,PAPER CHAIN KIT VINTAGE CHRISTMAS,2,11/29/2011 12:09,2.95,13137,United Kingdom
579399,21989,PACK OF 20 SKULL PAPER NAPKINS,1,11/29/2011 12:09,0.85,13137,United Kingdom
579399,21080,SET/20 RED RETROSPOT PAPER NAPKINS ,3,11/29/2011 12:09,0.85,13137,United Kingdom
579399,22909,SET OF 20 VINTAGE CHRISTMAS NAPKINS,6,11/29/2011 12:09,0.85,13137,United Kingdom
579399,23367,SET 12 COLOUR PENCILS SPACEBOY ,3,11/29/2011 12:09,0.65,13137,United Kingdom
579399,23368,SET 12 COLOUR PENCILS DOLLY GIRL ,3,11/29/2011 12:09,0.65,13137,United Kingdom
579399,23365,SET 12 COLOUR PENCILS LOVE LONDON,3,11/29/2011 12:09,0.65,13137,United Kingdom
579399,23366,SET 12 COLOURING PENCILS DOILY,3,11/29/2011 12:09,0.65,13137,United Kingdom
579399,20975,12 PENCILS SMALL TUBE RED RETROSPOT,3,11/29/2011 12:09,0.65,13137,United Kingdom
579399,20973,12 PENCIL SMALL TUBE WOODLAND,3,11/29/2011 12:09,0.65,13137,United Kingdom
579399,22489,PACK OF 12 TRADITIONAL CRAYONS,5,11/29/2011 12:09,0.42,13137,United Kingdom
579399,22563,HAPPY STENCIL CRAFT,2,11/29/2011 12:09,1.25,13137,United Kingdom
579399,22079,RIBBON REEL HEARTS DESIGN ,2,11/29/2011 12:09,1.65,13137,United Kingdom
579399,84987,SET OF 36 TEATIME PAPER DOILIES,1,11/29/2011 12:09,1.45,13137,United Kingdom
579399,22949,SET OF 36 DOLLY GIRL PAPER DOILIES,1,11/29/2011 12:09,1.45,13137,United Kingdom
579399,21210,SET OF 72 RETROSPOT PAPER  DOILIES,1,11/29/2011 12:09,1.45,13137,United Kingdom
579399,23205,CHARLOTTE BAG VINTAGE ALPHABET ,1,11/29/2011 12:09,0.85,13137,United Kingdom
579399,23559,WOODLAND BUNNIES LOLLY MAKERS,1,11/29/2011 12:09,2.08,13137,United Kingdom
579399,21991,BOHEMIAN COLLAGE STATIONERY SET,1,11/29/2011 12:09,1.25,13137,United Kingdom
579399,22208,WOOD STAMP SET THANK YOU,1,11/29/2011 12:09,0.83,13137,United Kingdom
579399,22211,WOOD STAMP SET FLOWERS,1,11/29/2011 12:09,0.83,13137,United Kingdom
579399,21986,PACK OF 12 PINK POLKADOT TISSUES,3,11/29/2011 12:09,0.39,13137,United Kingdom
579399,85071A,BLUE CHARLIE+LOLA PERSONAL DOORSIGN,1,11/29/2011 12:09,0.39,13137,United Kingdom
579399,23503,PLAYING CARDS KEEP CALM & CARRY ON,1,11/29/2011 12:09,1.25,13137,United Kingdom
579399,22200,FRYING PAN PINK POLKADOT,1,11/29/2011 12:09,4.25,13137,United Kingdom
579399,79066K,RETRO MOD TRAY,1,11/29/2011 12:09,0.85,13137,United Kingdom
579399,22079,RIBBON REEL HEARTS DESIGN ,1,11/29/2011 12:09,1.65,13137,United Kingdom
579399,23330,DECORATIVE WICKER HEART MEDIUM,4,11/29/2011 12:09,1.25,13137,United Kingdom
579399,23333,IVORY WICKER HEART MEDIUM,5,11/29/2011 12:09,1.25,13137,United Kingdom
579399,21070,VINTAGE BILLBOARD MUG ,1,11/29/2011 12:09,1.25,13137,United Kingdom
579399,21986,PACK OF 12 PINK POLKADOT TISSUES,1,11/29/2011 12:09,0.39,13137,United Kingdom
579399,47518F,ICON PLACEMAT POP ART ELVIS,2,11/29/2011 12:09,0.12,13137,United Kingdom
579399,21367,MIRRORED WALL ART GENTS,1,11/29/2011 12:09,0.75,13137,United Kingdom
579399,47591D,PINK FAIRY CAKE CHILDRENS APRON,1,11/29/2011 12:09,1.95,13137,United Kingdom
579399,20772,GARDEN PATH JOURNAL,1,11/29/2011 12:09,2.55,13137,United Kingdom
579399,20769,DAISY JOURNAL ,1,11/29/2011 12:09,2.55,13137,United Kingdom
579399,22384,LUNCH BAG PINK POLKADOT,1,11/29/2011 12:09,1.65,13137,United Kingdom
579399,22109,FULL ENGLISH BREAKFAST PLATE,1,11/29/2011 12:09,3.75,13137,United Kingdom
579399,23429,RED RETRO KITCHEN WALL CLOCK,2,11/29/2011 12:09,8.15,13137,United Kingdom
579399,21535,RED RETROSPOT SMALL MILK JUG,1,11/29/2011 12:09,2.55,13137,United Kingdom
579399,21218,RED SPOTTY BISCUIT TIN,1,11/29/2011 12:09,3.75,13137,United Kingdom
579399,22097,SWALLOW SQUARE TISSUE BOX,1,11/29/2011 12:09,0.39,13137,United Kingdom
579399,23428,IVORY RETRO KITCHEN WALL CLOCK,2,11/29/2011 12:09,8.15,13137,United Kingdom
579399,23301,GARDENERS KNEELING PAD KEEP CALM ,1,11/29/2011 12:09,1.65,13137,United Kingdom
579399,23280,FOLDING BUTTERFLY MIRROR HOT PINK ,9,11/29/2011 12:09,0.83,13137,United Kingdom
579399,23282,FOLDING BUTTERFLY MIRROR IVORY ,2,11/29/2011 12:09,0.83,13137,United Kingdom
579399,85212,MINI PAINTED GARDEN DECORATION ,12,11/29/2011 12:09,0.29,13137,United Kingdom
579399,84192,ASSORTED COLOUR METAL CAT ,3,11/29/2011 12:09,1.25,13137,United Kingdom
579399,23245,SET OF 3 REGENCY CAKE TINS,3,11/29/2011 12:09,4.95,13137,United Kingdom
579399,20914,SET/5 RED RETROSPOT LID GLASS BOWLS,5,11/29/2011 12:09,2.95,13137,United Kingdom
579399,23322,LARGE WHITE HEART OF WICKER,4,11/29/2011 12:09,2.95,13137,United Kingdom
579399,23332,IVORY WICKER HEART LARGE,6,11/29/2011 12:09,1.65,13137,United Kingdom
579399,22470,HEART OF WICKER LARGE,2,11/29/2011 12:09,2.95,13137,United Kingdom
579399,21770,OPEN CLOSED METAL SIGN,1,11/29/2011 12:09,4.95,13137,United Kingdom
579399,23241,TREASURE TIN GYMKHANA DESIGN,6,11/29/2011 12:09,2.08,13137,United Kingdom
579399,22730,ALARM CLOCK BAKELIKE IVORY,2,11/29/2011 12:09,3.75,13137,United Kingdom
579399,22726,ALARM CLOCK BAKELIKE GREEN,3,11/29/2011 12:09,3.75,13137,United Kingdom
579399,23525,WALL ART BUFFALO BILL ,1,11/29/2011 12:09,3.75,13137,United Kingdom
579399,23524,WALL ART HORSE & PONY ,1,11/29/2011 12:09,3.75,13137,United Kingdom
579399,21136,PAINTED METAL PEARS ASSORTED,6,11/29/2011 12:09,1.69,13137,United Kingdom
579399,84879,ASSORTED COLOUR BIRD ORNAMENT,7,11/29/2011 12:09,1.69,13137,United Kingdom
579399,22549,PICTURE DOMINOES,1,11/29/2011 12:09,1.45,13137,United Kingdom
579399,21791,VINTAGE HEADS AND TAILS CARD GAME ,1,11/29/2011 12:09,1.25,13137,United Kingdom
579399,22865,HAND WARMER OWL DESIGN,3,11/29/2011 12:09,2.1,13137,United Kingdom
579399,22867,HAND WARMER BIRD DESIGN,3,11/29/2011 12:09,2.1,13137,United Kingdom
579399,22632,HAND WARMER RED RETROSPOT,3,11/29/2011 12:09,2.1,13137,United Kingdom
579399,23439,HAND WARMER RED LOVE HEART,3,11/29/2011 12:09,2.1,13137,United Kingdom
579399,23681,LUNCH BAG RED VINTAGE DOILY,2,11/29/2011 12:09,1.65,13137,United Kingdom
579399,23209,LUNCH BAG VINTAGE DOILY ,2,11/29/2011 12:09,1.65,13137,United Kingdom
579399,20727,LUNCH BAG  BLACK SKULL.,3,11/29/2011 12:09,1.65,13137,United Kingdom
579399,23355,HOT WATER BOTTLE KEEP CALM,3,11/29/2011 12:09,4.95,13137,United Kingdom
579399,84029G,KNITTED UNION FLAG HOT WATER BOTTLE,1,11/29/2011 12:09,4.25,13137,United Kingdom
579399,84031B,CHARLIE LOLA BLUE HOT WATER BOTTLE ,1,11/29/2011 12:09,4.65,13137,United Kingdom
579399,84031A,CHARLIE+LOLA RED HOT WATER BOTTLE ,1,11/29/2011 12:09,4.65,13137,United Kingdom
579399,21479,WHITE SKULL HOT WATER BOTTLE ,2,11/29/2011 12:09,4.25,13137,United Kingdom
579399,84032B,CHARLIE + LOLA RED HOT WATER BOTTLE,2,11/29/2011 12:09,2.95,13137,United Kingdom
579399,84032A,CHARLIE+LOLA PINK HOT WATER BOTTLE,2,11/29/2011 12:09,2.95,13137,United Kingdom
579399,85014B,RED RETROSPOT UMBRELLA,2,11/29/2011 12:09,5.95,13137,United Kingdom
579399,85014A,BLACK/BLUE POLKADOT UMBRELLA,1,11/29/2011 12:09,5.95,13137,United Kingdom
579399,21892,TRADITIONAL WOODEN CATCH CUP GAME ,2,11/29/2011 12:09,1.25,13137,United Kingdom
579399,21891,TRADITIONAL WOODEN SKIPPING ROPE,2,11/29/2011 12:09,1.45,13137,United Kingdom
579399,22621,TRADITIONAL KNITTING NANCY,3,11/29/2011 12:09,1.65,13137,United Kingdom
579399,21408,SPOTTY PINK DUCK DOORSTOP,1,11/29/2011 12:09,4.25,13137,United Kingdom
579399,22439,6 ROCKET BALLOONS ,1,11/29/2011 12:09,0.65,13137,United Kingdom
579399,22372,AIRLINE BAG VINTAGE WORLD CHAMPION ,1,11/29/2011 12:09,4.25,13137,United Kingdom
579400,23163,REGENCY SUGAR TONGS,8,11/29/2011 12:10,2.49,17306,United Kingdom
579400,23505,PLAYING CARDS I LOVE LONDON ,100,11/29/2011 12:10,1.04,17306,United Kingdom
579400,23309,SET OF 60 I LOVE LONDON CAKE CASES ,240,11/29/2011 12:10,0.42,17306,United Kingdom
579400,22971,QUEENS GUARD COFFEE MUG,36,11/29/2011 12:10,2.1,17306,United Kingdom
579400,22988,SOLDIERS EGG CUP ,144,11/29/2011 12:10,1.06,17306,United Kingdom
579400,22659,LUNCH BOX I LOVE LONDON,64,11/29/2011 12:10,1.65,17306,United Kingdom
579400,22616,PACK OF 12 LONDON TISSUES ,432,11/29/2011 12:10,0.32,17306,United Kingdom
579401,22189,CREAM HEART CARD HOLDER,4,11/29/2011 12:12,3.95,14550,United Kingdom
579401,23319,BOX OF 6 MINI 50'S CRACKERS,4,11/29/2011 12:12,2.49,14550,United Kingdom
579401,23109,PACK OF SIX LED TEA LIGHTS,24,11/29/2011 12:12,2.89,14550,United Kingdom
579401,23082,SET 6 PAPER TABLE LANTERN HEARTS ,24,11/29/2011 12:12,3.75,14550,United Kingdom
579401,23083,SET 6 PAPER TABLE LANTERN STARS ,12,11/29/2011 12:12,3.75,14550,United Kingdom
579401,22079,RIBBON REEL HEARTS DESIGN ,5,11/29/2011 12:12,1.65,14550,United Kingdom
579401,23498,CLASSIC BICYCLE CLIPS ,1,11/29/2011 12:12,1.45,14550,United Kingdom
579401,23497,CLASSIC CHROME BICYCLE BELL ,1,11/29/2011 12:12,1.45,14550,United Kingdom
579401,23552,BICYCLE PUNCTURE REPAIR KIT ,1,11/29/2011 12:12,2.08,14550,United Kingdom
579401,23499,SET 12 VINTAGE DOILY CHALK ,7,11/29/2011 12:12,0.42,14550,United Kingdom
579401,23189,SET OF 12 FORK CANDLES,4,11/29/2011 12:12,2.89,14550,United Kingdom
579401,22079,RIBBON REEL HEARTS DESIGN ,5,11/29/2011 12:12,1.65,14550,United Kingdom
579401,23500,KEY RING BASEBALL BOOT ASSORTED ,20,11/29/2011 12:12,1.25,14550,United Kingdom
579401,21985,PACK OF 12 HEARTS DESIGN TISSUES ,12,11/29/2011 12:12,0.39,14550,United Kingdom
579401,23461,SWEETHEART BIRD HOUSE,1,11/29/2011 12:12,4.15,14550,United Kingdom
579401,23378,PACK OF 12 50'S CHRISTMAS TISSUES,12,11/29/2011 12:12,0.39,14550,United Kingdom
579401,23084,RABBIT NIGHT LIGHT,30,11/29/2011 12:12,1.79,14550,United Kingdom
579401,82482,WOODEN PICTURE FRAME WHITE FINISH,6,11/29/2011 12:12,2.95,14550,United Kingdom
579401,23552,BICYCLE PUNCTURE REPAIR KIT ,4,11/29/2011 12:12,2.08,14550,United Kingdom
579401,82494L,WOODEN FRAME ANTIQUE WHITE ,6,11/29/2011 12:12,2.95,14550,United Kingdom
579401,23498,CLASSIC BICYCLE CLIPS ,2,11/29/2011 12:12,1.45,14550,United Kingdom
579401,22768,FAMILY PHOTO FRAME CORNICE,2,11/29/2011 12:12,9.95,14550,United Kingdom
579402,23157,SET OF 6 NATIVITY MAGNETS ,115,11/29/2011 12:14,1.85,17306,United Kingdom
579402,22619,SET OF 6 SOLDIER SKITTLES,16,11/29/2011 12:14,3.75,17306,United Kingdom
579402,22970,LONDON BUS COFFEE MUG,36,11/29/2011 12:14,2.1,17306,United Kingdom
579403,23080,RED METAL BOX TOP SECRET,10,11/29/2011 12:15,8.25,14503,United Kingdom
579403,23582,VINTAGE DOILY JUMBO BAG RED ,20,11/29/2011 12:15,2.08,14503,United Kingdom
579403,23581,JUMBO BAG PAISLEY PARK,30,11/29/2011 12:15,2.08,14503,United Kingdom
579403,85099B,JUMBO BAG RED RETROSPOT,20,11/29/2011 12:15,2.08,14503,United Kingdom
579403,22411,JUMBO SHOPPER VINTAGE RED PAISLEY,20,11/29/2011 12:15,2.08,14503,United Kingdom
579403,85099C,JUMBO  BAG BAROQUE BLACK WHITE,10,11/29/2011 12:15,2.08,14503,United Kingdom
579403,22386,JUMBO BAG PINK POLKADOT,10,11/29/2011 12:15,2.08,14503,United Kingdom
579403,23343,JUMBO BAG VINTAGE CHRISTMAS ,40,11/29/2011 12:15,2.08,14503,United Kingdom
579403,23344,JUMBO BAG 50'S CHRISTMAS ,20,11/29/2011 12:15,2.08,14503,United Kingdom
579404,22274,FELTCRAFT DOLL EMILY,6,11/29/2011 12:21,2.95,14126,United Kingdom
579404,22150,3 STRIPEY MICE FELTCRAFT,6,11/29/2011 12:21,1.95,14126,United Kingdom
579404,22273,FELTCRAFT DOLL MOLLY,6,11/29/2011 12:21,2.95,14126,United Kingdom
579404,22779,WOODEN OWLS LIGHT GARLAND ,4,11/29/2011 12:21,4.25,14126,United Kingdom
579404,22621,TRADITIONAL KNITTING NANCY,12,11/29/2011 12:21,1.65,14126,United Kingdom
579404,22457,NATURAL SLATE HEART CHALKBOARD ,12,11/29/2011 12:21,2.95,14126,United Kingdom
579404,85123A,WHITE HANGING HEART T-LIGHT HOLDER,12,11/29/2011 12:21,2.95,14126,United Kingdom
579404,20961,STRAWBERRY BATH SPONGE ,50,11/29/2011 12:21,1.25,14126,United Kingdom
579404,22605,WOODEN CROQUET GARDEN SET,1,11/29/2011 12:21,14.95,14126,United Kingdom
579404,22433,WATERING CAN GREEN DINOSAUR,6,11/29/2011 12:21,1.95,14126,United Kingdom
579404,21479,WHITE SKULL HOT WATER BOTTLE ,4,11/29/2011 12:21,4.25,14126,United Kingdom
579404,23444,Next Day Carriage,1,11/29/2011 12:21,15,14126,United Kingdom
579405,20963,APPLE BATH SPONGE,50,11/29/2011 12:22,1.25,14126,United Kingdom
579405,22560,TRADITIONAL MODELLING CLAY,288,11/29/2011 12:22,1.06,14126,United Kingdom
579406,37449,CERAMIC CAKE STAND + HANGING CAKES,2,11/29/2011 12:27,9.95,13014,United Kingdom
579406,22061,LARGE CAKE STAND  HANGING STRAWBERY,2,11/29/2011 12:27,9.95,13014,United Kingdom
579406,21258,VICTORIAN SEWING BOX LARGE,8,11/29/2011 12:27,10.95,13014,United Kingdom
579406,21257,VICTORIAN SEWING BOX MEDIUM,10,11/29/2011 12:27,7.95,13014,United Kingdom
579406,21259,VICTORIAN SEWING BOX SMALL ,8,11/29/2011 12:27,5.95,13014,United Kingdom
579406,21232,STRAWBERRY CERAMIC TRINKET POT,12,11/29/2011 12:27,1.25,13014,United Kingdom
579406,22667,RECIPE BOX RETROSPOT ,12,11/29/2011 12:27,2.95,13014,United Kingdom
579407,21790,VINTAGE SNAP CARDS,12,11/29/2011 12:32,0.85,13657,United Kingdom
579407,21791,VINTAGE HEADS AND TAILS CARD GAME ,12,11/29/2011 12:32,1.25,13657,United Kingdom
579407,22468,BABUSHKA LIGHTS STRING OF 10,10,11/29/2011 12:32,6.75,13657,United Kingdom
579407,22940,FELTCRAFT CHRISTMAS FAIRY,12,11/29/2011 12:32,4.25,13657,United Kingdom
579407,22144,CHRISTMAS CRAFT LITTLE FRIENDS,12,11/29/2011 12:32,2.1,13657,United Kingdom
579407,84347,ROTATING SILVER ANGELS T-LIGHT HLDR,18,11/29/2011 12:32,2.55,13657,United Kingdom
579407,23444,Next Day Carriage,1,11/29/2011 12:32,15,13657,United Kingdom
579408,21642,ASSORTED TUTTI FRUTTI PEN,1,11/29/2011 12:34,0.29,14701,United Kingdom
579408,23284,DOORMAT KEEP CALM AND COME IN,1,11/29/2011 12:34,8.25,14701,United Kingdom
579408,23489,VINTAGE BELLS GARLAND,16,11/29/2011 12:34,2.89,14701,United Kingdom
579408,23216,LAUREL HEART ANTIQUE GOLD,5,11/29/2011 12:34,1.25,14701,United Kingdom
579408,23220,REINDEER HEART DECORATION GOLD,3,11/29/2011 12:34,0.83,14701,United Kingdom
579408,23217,LAUREL HEART ANTIQUE SILVER,9,11/29/2011 12:34,1.25,14701,United Kingdom
579408,23225,CHERUB HEART DECORATION SILVER ,4,11/29/2011 12:34,0.83,14701,United Kingdom
579408,23221,REINDEER HEART DECORATION SILVER,4,11/29/2011 12:34,0.83,14701,United Kingdom
579408,23265,SET OF 3 WOODEN TREE DECORATIONS,3,11/29/2011 12:34,1.25,14701,United Kingdom
579408,23266,SET OF 3 WOODEN STOCKING DECORATION,3,11/29/2011 12:34,1.25,14701,United Kingdom
579408,23264,SET OF 3 WOODEN SLEIGH DECORATIONS,4,11/29/2011 12:34,1.25,14701,United Kingdom
579408,23263,SET OF 3 WOODEN HEART DECORATIONS,4,11/29/2011 12:34,1.25,14701,United Kingdom
579408,84875B,GREEN SQUARE COMPACT MIRROR,1,11/29/2011 12:34,1.25,14701,United Kingdom
579408,84876B,GREEN HEART COMPACT MIRROR,2,11/29/2011 12:34,1.25,14701,United Kingdom
579408,22945,CHRISTMAS METAL TAGS ASSORTED ,7,11/29/2011 12:34,0.85,14701,United Kingdom
579408,23501,KEY RING BASEBALL BOOT UNION JACK,2,11/29/2011 12:34,1.25,14701,United Kingdom
579408,23500,KEY RING BASEBALL BOOT ASSORTED ,6,11/29/2011 12:34,1.25,14701,United Kingdom
579408,23116,VEGETABLE GARDEN CHOPPING BOARD,1,11/29/2011 12:34,4.95,14701,United Kingdom
579408,23115,RED APPLES CHOPPING BOARD   ,1,11/29/2011 12:34,4.95,14701,United Kingdom
579408,23114,VINTAGE LEAF CHOPPING BOARD  ,2,11/29/2011 12:34,4.95,14701,United Kingdom
579408,23117,POPPY FIELDS CHOPPING BOARD,2,11/29/2011 12:34,4.95,14701,United Kingdom
579408,22961,JAM MAKING SET PRINTED,2,11/29/2011 12:34,1.45,14701,United Kingdom
579408,23426,METAL SIGN DROP YOUR PANTS,2,11/29/2011 12:34,2.89,14701,United Kingdom
579408,21172,PARTY METAL SIGN ,1,11/29/2011 12:34,1.45,14701,United Kingdom
579408,21166,COOK WITH WINE METAL SIGN ,1,11/29/2011 12:34,2.08,14701,United Kingdom
579408,21903,MAN FLU METAL SIGN,1,11/29/2011 12:34,2.1,14701,United Kingdom
579408,21832,CHOCOLATE CALCULATOR,1,11/29/2011 12:34,1.65,14701,United Kingdom
579408,22997,TRAVEL CARD WALLET UNION JACK,2,11/29/2011 12:34,0.42,14701,United Kingdom
579408,23000,TRAVEL CARD WALLET TRANSPORT,4,11/29/2011 12:34,0.42,14701,United Kingdom
579408,23005,TRAVEL CARD WALLET I LOVE LONDON,3,11/29/2011 12:34,0.42,14701,United Kingdom
579408,23002,TRAVEL CARD WALLET SKULLS,5,11/29/2011 12:34,0.42,14701,United Kingdom
579408,22998,TRAVEL CARD WALLET KEEP CALM,4,11/29/2011 12:34,0.42,14701,United Kingdom
579408,20986,BLUE CALCULATOR RULER,1,11/29/2011 12:34,1.25,14701,United Kingdom
579408,23269,SET OF 2 CERAMIC CHRISTMAS TREES,6,11/29/2011 12:34,1.45,14701,United Kingdom
579408,23270,SET OF 2 CERAMIC PAINTED HEARTS ,6,11/29/2011 12:34,1.45,14701,United Kingdom
579408,23497,CLASSIC CHROME BICYCLE BELL ,1,11/29/2011 12:34,1.45,14701,United Kingdom
579408,23498,CLASSIC BICYCLE CLIPS ,1,11/29/2011 12:34,1.45,14701,United Kingdom
579408,23552,BICYCLE PUNCTURE REPAIR KIT ,1,11/29/2011 12:34,2.08,14701,United Kingdom
579408,22564,ALPHABET STENCIL CRAFT,2,11/29/2011 12:34,1.25,14701,United Kingdom
579408,22992,REVOLVER WOODEN RULER ,1,11/29/2011 12:34,1.95,14701,United Kingdom
579408,22991,GIRAFFE WOODEN RULER,1,11/29/2011 12:34,1.95,14701,United Kingdom
579408,22953,BIRTHDAY PARTY CORDON BARRIER TAPE,1,11/29/2011 12:34,1.25,14701,United Kingdom
579408,23439,HAND WARMER RED LOVE HEART,1,11/29/2011 12:34,2.1,14701,United Kingdom
579408,22865,HAND WARMER OWL DESIGN,1,11/29/2011 12:34,2.1,14701,United Kingdom
579408,22633,HAND WARMER UNION JACK,2,11/29/2011 12:34,2.1,14701,United Kingdom
579408,22095,LADS ONLY TISSUE BOX,2,11/29/2011 12:34,0.39,14701,United Kingdom
579408,23189,SET OF 12 FORK CANDLES,5,11/29/2011 12:34,2.89,14701,United Kingdom
579408,21592,RETROSPOT CIGAR BOX MATCHES ,5,11/29/2011 12:34,1.25,14701,United Kingdom
579408,23491,VINTAGE JINGLE BELLS HEART,6,11/29/2011 12:34,8.25,14701,United Kingdom
579408,23492,VINTAGE JINGLE BELLS WREATH,1,11/29/2011 12:34,8.25,14701,United Kingdom
579408,22349,DOG BOWL CHASING BALL DESIGN,4,11/29/2011 12:34,3.75,14701,United Kingdom
579408,23215,JINGLE BELL HEART ANTIQUE SILVER,10,11/29/2011 12:34,2.08,14701,United Kingdom
579408,23660,HENRIETTA HEN MUG ,6,11/29/2011 12:34,1.65,14701,United Kingdom
579408,22791,T-LIGHT GLASS FLUTED ANTIQUE,12,11/29/2011 12:34,1.25,14701,United Kingdom
579408,23355,HOT WATER BOTTLE KEEP CALM,2,11/29/2011 12:34,4.95,14701,United Kingdom
579408,23356,LOVE HOT WATER BOTTLE,2,11/29/2011 12:34,5.95,14701,United Kingdom
579408,22909,SET OF 20 VINTAGE CHRISTMAS NAPKINS,2,11/29/2011 12:34,0.85,14701,United Kingdom
579408,23085,ANTIQUE SILVER BAUBLE LAMP  ,6,11/29/2011 12:34,10.4,14701,United Kingdom
579408,22086,PAPER CHAIN KIT 50'S CHRISTMAS ,2,11/29/2011 12:34,2.95,14701,United Kingdom
579408,22585,PACK OF 6 BIRDY GIFT TAGS,1,11/29/2011 12:34,1.25,14701,United Kingdom
579408,22733,3D TRADITIONAL CHRISTMAS STICKERS,2,11/29/2011 12:34,1.25,14701,United Kingdom
579408,22734,SET OF 6 RIBBONS VINTAGE CHRISTMAS,2,11/29/2011 12:34,2.89,14701,United Kingdom
579408,22952,60 CAKE CASES VINTAGE CHRISTMAS,2,11/29/2011 12:34,0.55,14701,United Kingdom
579408,23319,BOX OF 6 MINI 50'S CRACKERS,2,11/29/2011 12:34,2.49,14701,United Kingdom
579408,23320,GIANT 50'S CHRISTMAS CRACKER,4,11/29/2011 12:34,2.89,14701,United Kingdom
579408,23196,VINTAGE LEAF MAGNETIC NOTEPAD,1,11/29/2011 12:34,1.45,14701,United Kingdom
579408,22909,SET OF 20 VINTAGE CHRISTMAS NAPKINS,3,11/29/2011 12:34,0.85,14701,United Kingdom
579408,23353,6 GIFT TAGS VINTAGE CHRISTMAS ,2,11/29/2011 12:34,0.83,14701,United Kingdom
579408,23354,6 GIFT TAGS 50'S CHRISTMAS ,2,11/29/2011 12:34,0.83,14701,United Kingdom
579408,23553,LANDMARK FRAME CAMDEN TOWN ,1,11/29/2011 12:34,12.5,14701,United Kingdom
579408,23557,LANDMARK FRAME BAKER STREET ,1,11/29/2011 12:34,12.5,14701,United Kingdom
579408,23558,LANDMARK FRAME LONDON BRIDGE ,1,11/29/2011 12:34,12.5,14701,United Kingdom
579408,23247,BISCUIT TIN 50'S CHRISTMAS,4,11/29/2011 12:34,2.89,14701,United Kingdom
579408,21638,ASSORTED TUTTI FRUTTI NOTEBOOK,1,11/29/2011 12:34,2.1,14701,United Kingdom
579408,23083,SET 6 PAPER TABLE LANTERN STARS ,1,11/29/2011 12:34,3.75,14701,United Kingdom
579408,22398,MAGNETS PACK OF 4 SWALLOWS,1,11/29/2011 12:34,0.39,14701,United Kingdom
579408,47563A,RETRO LONGBOARD IRONING BOARD COVER,1,11/29/2011 12:34,1.25,14701,United Kingdom
579408,23190,BUNDLE OF 3 SCHOOL EXERCISE BOOKS  ,1,11/29/2011 12:34,1.65,14701,United Kingdom
579408,23123,COCKTAIL SWORDS 50 PIECES,1,11/29/2011 12:34,0.83,14701,United Kingdom
579408,23571,TRADITIONAL NAUGHTS & CROSSES,1,11/29/2011 12:34,1.65,14701,United Kingdom
579408,23569,TRADTIONAL ALPHABET STAMP SET,1,11/29/2011 12:34,4.95,14701,United Kingdom
579408,23570,TRADITIONAL PICK UP STICKS GAME ,1,11/29/2011 12:34,1.25,14701,United Kingdom
579408,23082,SET 6 PAPER TABLE LANTERN HEARTS ,1,11/29/2011 12:34,3.75,14701,United Kingdom
579408,22095,LADS ONLY TISSUE BOX,1,11/29/2011 12:34,0.39,14701,United Kingdom
579408,23552,BICYCLE PUNCTURE REPAIR KIT ,1,11/29/2011 12:34,2.08,14701,United Kingdom
579408,23493,VINTAGE DOILY TRAVEL SEWING KIT,1,11/29/2011 12:34,1.95,14701,United Kingdom
579408,23241,TREASURE TIN GYMKHANA DESIGN,1,11/29/2011 12:34,2.08,14701,United Kingdom
579408,23196,VINTAGE LEAF MAGNETIC NOTEPAD,1,11/29/2011 12:34,1.45,14701,United Kingdom
579408,23340,VINTAGE CHRISTMAS CAKE FRILL,1,11/29/2011 12:34,1.65,14701,United Kingdom
