536876,22745,POPPY'S PLAYHOUSE BEDROOM ,2,12/3/2010 11:36,4.21,,United Kingdom
536876,22746,POPPY'S PLAYHOUSE LIVINGROOM ,2,12/3/2010 11:36,4.21,,United Kingdom
536876,22748,POPPY'S PLAYHOUSE KITCHEN,1,12/3/2010 11:36,4.21,,United Kingdom
536876,22752,SET 7 BABUSHKA NESTING BOXES,2,12/3/2010 11:36,16.98,,United Kingdom
536876,22753,SMALL YELLOW BABUSHKA NOTEBOOK ,2,12/3/2010 11:36,1.66,,United Kingdom
536876,22754,SMALL RED BABUSHKA NOTEBOOK ,3,12/3/2010 11:36,1.66,,United Kingdom
536876,22755,SMALL PURPLE BABUSHKA NOTEBOOK ,1,12/3/2010 11:36,1.66,,United Kingdom
536876,22757,LARGE RED BABUSHKA NOTEBOOK ,2,12/3/2010 11:36,2.51,,United Kingdom
536876,22759,SET OF 3 NOTEBOOKS IN PARCEL,7,12/3/2010 11:36,3.36,,United Kingdom
536876,22760,"TRAY, BREAKFAST IN BED",2,12/3/2010 11:36,25.49,,United Kingdom
536876,22762,CUPBOARD 3 DRAWER MA CAMPAGNE,1,12/3/2010 11:36,29.79,,United Kingdom
536876,22768,FAMILY PHOTO FRAME CORNICE,1,12/3/2010 11:36,20.38,,United Kingdom
536876,22777,GLASS CLOCHE LARGE,2,12/3/2010 11:36,16.98,,United Kingdom
536876,22785,SQUARECUSHION COVER PINK UNION FLAG,1,12/3/2010 11:36,16.98,,United Kingdom
536876,22791,T-LIGHT GLASS FLUTED ANTIQUE,6,12/3/2010 11:36,2.51,,United Kingdom
536876,22795,SWEETHEART RECIPE BOOK STAND,1,12/3/2010 11:36,13.57,,United Kingdom
536876,22796,PHOTO FRAME 3 CLASSIC HANGING,1,12/3/2010 11:36,21.23,,United Kingdom
536876,22798,ANTIQUE GLASS DRESSING TABLE POT,1,12/3/2010 11:36,5.91,,United Kingdom
536876,22801,ANTIQUE GLASS PEDESTAL BOWL,1,12/3/2010 11:36,7.62,,United Kingdom
536876,22809,SET OF 6 T-LIGHTS SANTA,1,12/3/2010 11:36,5.91,,United Kingdom
536876,22810,SET OF 6 T-LIGHTS SNOWMEN,1,12/3/2010 11:36,5.91,,United Kingdom
536876,22811,SET OF 6 T-LIGHTS CACTI ,1,12/3/2010 11:36,5.91,,United Kingdom
536876,22812,PACK 3 BOXES CHRISTMAS PANNETONE,4,12/3/2010 11:36,4.21,,United Kingdom
536876,22813,PACK 3 BOXES BIRD PANNETONE ,1,12/3/2010 11:36,4.21,,United Kingdom
536876,22816,CARD MOTORBIKE SANTA,2,12/3/2010 11:36,0.85,,United Kingdom
536876,22818,CARD CHRISTMAS VILLAGE,1,12/3/2010 11:36,0.85,,United Kingdom
536876,22834,HAND WARMER BABUSHKA DESIGN,2,12/3/2010 11:36,4.21,,United Kingdom
536876,22835,HOT WATER BOTTLE I AM SO POORLY,9,12/3/2010 11:36,9.32,,United Kingdom
536876,22837,HOT WATER BOTTLE BABUSHKA ,1,12/3/2010 11:36,9.32,,United Kingdom
536876,22845,VINTAGE CREAM CAT FOOD CONTAINER,1,12/3/2010 11:36,12.72,,United Kingdom
536876,22851,SET 20 NAPKINS FAIRY CAKES DESIGN ,3,12/3/2010 11:36,1.66,,United Kingdom
536876,22862,LOVE HEART NAPKIN BOX ,1,12/3/2010 11:36,8.47,,United Kingdom
536876,22865,HAND WARMER OWL DESIGN,6,12/3/2010 11:36,4.21,,United Kingdom
536876,22866,HAND WARMER SCOTTY DOG DESIGN,5,12/3/2010 11:36,4.21,,United Kingdom
536876,22867,HAND WARMER BIRD DESIGN,9,12/3/2010 11:36,4.21,,United Kingdom
536876,22882,NUMBER TILE VINTAGE FONT 3,1,12/3/2010 11:36,4.21,,United Kingdom
536876,22884,NUMBER TILE VINTAGE FONT 5,1,12/3/2010 11:36,4.21,,United Kingdom
536876,22897,OVEN MITT APPLES DESIGN,1,12/3/2010 11:36,2.98,,United Kingdom
536876,22899,CHILDREN'S APRON DOLLY GIRL ,3,12/3/2010 11:36,4.21,,United Kingdom
536876,22900, SET 2 TEA TOWELS I LOVE LONDON ,3,12/3/2010 11:36,5.91,,United Kingdom
536876,22902,TOTE BAG I LOVE LONDON,1,12/3/2010 11:36,4.21,,United Kingdom
536876,22904,CALENDAR PAPER CUT DESIGN,4,12/3/2010 11:36,5.91,,United Kingdom
536876,22906,12 MESSAGE CARDS WITH ENVELOPES,4,12/3/2010 11:36,3.36,,United Kingdom
536876,22908,PACK OF 20 NAPKINS RED APPLES,1,12/3/2010 11:36,1.66,,United Kingdom
536876,22909,SET OF 20 VINTAGE CHRISTMAS NAPKINS,2,12/3/2010 11:36,1.66,,United Kingdom
536876,22910,PAPER CHAIN KIT VINTAGE CHRISTMAS,9,12/3/2010 11:36,5.91,,United Kingdom
536876,22915,ASSORTED BOTTLE TOP  MAGNETS ,1,12/3/2010 11:36,5.06,,United Kingdom
536876,22926,IVORY GIANT GARDEN THERMOMETER,1,12/3/2010 11:36,11.87,,United Kingdom
536876,22927,GREEN GIANT GARDEN THERMOMETER,1,12/3/2010 11:36,11.87,,United Kingdom
536876,22943,CHRISTMAS LIGHTS 10 VINTAGE BAUBLES,3,12/3/2010 11:36,11.02,,United Kingdom
536876,22947,WOODEN ADVENT CALENDAR RED,1,12/3/2010 11:36,34,,United Kingdom
