579116,23350,ROLL WRAP VINTAGE SPOT ,1,11/28/2011 11:54,1.25,17346,United Kingdom
579116,23552,BICYCLE PUNCTURE REPAIR KIT ,3,11/28/2011 11:54,2.08,17346,United Kingdom
579116,22551,PLASTERS IN TIN SPACEBOY,3,11/28/2011 11:54,1.65,17346,United Kingdom
579116,23368,SET 12 COLOUR PENCILS DOLLY GIRL ,2,11/28/2011 11:54,0.65,17346,United Kingdom
579116,23084,RABBIT NIGHT LIGHT,22,11/28/2011 11:54,2.08,17346,United Kingdom
579116,23367,SET 12 COLOUR PENCILS SPACEBOY ,4,11/28/2011 11:54,0.65,17346,United Kingdom
579116,23371,SET 36 COLOUR PENCILS SPACEBOY ,2,11/28/2011 11:54,1.25,17346,United Kingdom
579116,23372,SET 36 COLOUR PENCILS DOLLY GIRL,2,11/28/2011 11:54,1.25,17346,United Kingdom
579116,23333,IVORY WICKER HEART MEDIUM,6,11/28/2011 11:54,1.25,17346,United Kingdom
579116,21588,RETROSPOT GIANT TUBE MATCHES,2,11/28/2011 11:54,2.55,17346,United Kingdom
579116,20724,RED RETROSPOT CHARLOTTE BAG,3,11/28/2011 11:54,0.85,17346,United Kingdom
579116,22629,SPACEBOY LUNCH BOX ,1,11/28/2011 11:54,1.95,17346,United Kingdom
579116,22630,DOLLY GIRL LUNCH BOX,1,11/28/2011 11:54,1.95,17346,United Kingdom
579116,21464,DISCO BALL ROTATOR BATTERY OPERATED,1,11/28/2011 11:54,4.25,17346,United Kingdom
579116,22197,POPCORN HOLDER,24,11/28/2011 11:54,0.85,17346,United Kingdom
579116,23498,CLASSIC BICYCLE CLIPS ,3,11/28/2011 11:54,1.45,17346,United Kingdom
579116,23497,CLASSIC CHROME BICYCLE BELL ,3,11/28/2011 11:54,1.45,17346,United Kingdom
579116,23229,VINTAGE DONKEY TAIL GAME ,2,11/28/2011 11:54,3.75,17346,United Kingdom
579116,23506,MINI PLAYING CARDS SPACEBOY ,4,11/28/2011 11:54,0.42,17346,United Kingdom
579116,23510,MINI PLAYING CARDS GYMKHANA,2,11/28/2011 11:54,0.42,17346,United Kingdom
579116,23508,MINI PLAYING CARDS DOLLY GIRL ,4,11/28/2011 11:54,0.42,17346,United Kingdom
579116,23507,MINI PLAYING CARDS BUFFALO BILL ,2,11/28/2011 11:54,0.42,17346,United Kingdom
579121,23311,VINTAGE CHRISTMAS STOCKING ,12,11/28/2011 12:01,2.55,17299,United Kingdom
579121,23084,RABBIT NIGHT LIGHT,12,11/28/2011 12:01,2.08,17299,United Kingdom
579121,21500,PINK POLKADOT WRAP ,25,11/28/2011 12:01,0.42,17299,United Kingdom
579121,23077,DOUGHNUT LIP GLOSS ,20,11/28/2011 12:01,1.25,17299,United Kingdom
579122,22594,CHRISTMAS GINGHAM TREE,144,11/28/2011 12:05,0.72,12971,United Kingdom
579122,15036,ASSORTED COLOURS SILK FAN,60,11/28/2011 12:05,0.83,12971,United Kingdom
579122,22577,WOODEN HEART CHRISTMAS SCANDINAVIAN,96,11/28/2011 12:05,0.29,12971,United Kingdom
579122,21464,DISCO BALL ROTATOR BATTERY OPERATED,2,11/28/2011 12:05,4.25,12971,United Kingdom
579122,21463,MIRRORED DISCO BALL ,16,11/28/2011 12:05,4.95,12971,United Kingdom
579122,22593,CHRISTMAS GINGHAM STAR,48,11/28/2011 12:05,0.85,12971,United Kingdom
579123,22573,STAR WOODEN CHRISTMAS DECORATION,60,11/28/2011 12:08,0.85,14217,United Kingdom
579123,22574,HEART WOODEN CHRISTMAS DECORATION,60,11/28/2011 12:08,0.85,14217,United Kingdom
579123,82494L,WOODEN FRAME ANTIQUE WHITE ,6,11/28/2011 12:08,2.95,14217,United Kingdom
579123,23460,SWEETHEART WALL TIDY ,2,11/28/2011 12:08,9.95,14217,United Kingdom
579124,22753,SMALL YELLOW BABUSHKA NOTEBOOK ,1,11/28/2011 12:14,0.85,15721,United Kingdom
579124,22757,LARGE RED BABUSHKA NOTEBOOK ,1,11/28/2011 12:14,1.25,15721,United Kingdom
579124,84596F,SMALL MARSHMALLOWS PINK BOWL,8,11/28/2011 12:14,0.42,15721,United Kingdom
579124,21239,PINK  POLKADOT CUP,8,11/28/2011 12:14,0.85,15721,United Kingdom
579124,21993,FLORAL FOLK STATIONERY SET,2,11/28/2011 12:14,1.25,15721,United Kingdom
579124,21990,MODERN FLORAL STATIONERY SET,3,11/28/2011 12:14,1.25,15721,United Kingdom
579124,22666,RECIPE BOX PANTRY YELLOW DESIGN,1,11/28/2011 12:14,2.95,15721,United Kingdom
579124,22083,PAPER CHAIN KIT RETROSPOT,1,11/28/2011 12:14,2.95,15721,United Kingdom
579124,16045,POPART WOODEN PENCILS ASST,100,11/28/2011 12:14,0.04,15721,United Kingdom
579124,22867,HAND WARMER BIRD DESIGN,2,11/28/2011 12:14,2.1,15721,United Kingdom
579124,22621,TRADITIONAL KNITTING NANCY,2,11/28/2011 12:14,1.65,15721,United Kingdom
579124,21114,LAVENDER SCENTED FABRIC HEART,5,11/28/2011 12:14,1.25,15721,United Kingdom
579124,79191C,RETRO PLASTIC ELEPHANT TRAY,2,11/28/2011 12:14,0.85,15721,United Kingdom
579124,22908,PACK OF 20 NAPKINS RED APPLES,1,11/28/2011 12:14,0.85,15721,United Kingdom
579124,23370,SET 36 COLOURING PENCILS DOILY,1,11/28/2011 12:14,1.25,15721,United Kingdom
579124,22131,FOOD CONTAINER SET 3 LOVE HEART ,1,11/28/2011 12:14,1.95,15721,United Kingdom
579124,20978,36 PENCILS TUBE SKULLS,1,11/28/2011 12:14,1.25,15721,United Kingdom
579124,23372,SET 36 COLOUR PENCILS DOLLY GIRL,1,11/28/2011 12:14,1.25,15721,United Kingdom
579124,23369,SET 36 COLOUR PENCILS LOVE LONDON,1,11/28/2011 12:14,1.25,15721,United Kingdom
579124,23249,VINTAGE RED ENAMEL TRIM PLATE,12,11/28/2011 12:14,1.65,15721,United Kingdom
579124,84920,PINK FLOWER FABRIC PONY,1,11/28/2011 12:14,3.75,15721,United Kingdom
579124,22207,FRYING PAN UNION FLAG,1,11/28/2011 12:14,4.25,15721,United Kingdom
579124,47503A,ASS FLORAL PRINT MULTI SCREWDRIVER,2,11/28/2011 12:14,0.42,15721,United Kingdom
579124,21914,BLUE HARMONICA IN BOX ,1,11/28/2011 12:14,1.25,15721,United Kingdom
579124,22633,HAND WARMER UNION JACK,2,11/28/2011 12:14,2.1,15721,United Kingdom
579124,22909,SET OF 20 VINTAGE CHRISTMAS NAPKINS,1,11/28/2011 12:14,0.85,15721,United Kingdom
579124,21892,TRADITIONAL WOODEN CATCH CUP GAME ,1,11/28/2011 12:14,1.25,15721,United Kingdom
579124,21411,GINGHAM HEART  DOORSTOP RED,1,11/28/2011 12:14,4.25,15721,United Kingdom
579124,23442,12 HANGING EGGS HAND PAINTED,1,11/28/2011 12:14,2.08,15721,United Kingdom
579124,22175,PINK OWL SOFT TOY,1,11/28/2011 12:14,2.95,15721,United Kingdom
579124,84029E,RED WOOLLY HOTTIE WHITE HEART.,1,11/28/2011 12:14,4.25,15721,United Kingdom
579124,21479,WHITE SKULL HOT WATER BOTTLE ,1,11/28/2011 12:14,4.25,15721,United Kingdom
579124,84030E,ENGLISH ROSE HOT WATER BOTTLE,1,11/28/2011 12:14,4.25,15721,United Kingdom
579124,23206,LUNCH BAG APPLE DESIGN,1,11/28/2011 12:14,1.65,15721,United Kingdom
579124,22139,RETROSPOT TEA SET CERAMIC 11 PC ,1,11/28/2011 12:14,4.95,15721,United Kingdom
579124,22096,PINK PAISLEY SQUARE TISSUE BOX ,2,11/28/2011 12:14,0.39,15721,United Kingdom
579124,21621,VINTAGE UNION JACK BUNTING,1,11/28/2011 12:14,8.5,15721,United Kingdom
579124,20829,GLITTER HANGING BUTTERFLY STRING,2,11/28/2011 12:14,2.1,15721,United Kingdom
579124,20828,GLITTER BUTTERFLY CLIPS,2,11/28/2011 12:14,2.55,15721,United Kingdom
579124,23379,PACK OF 12 RED APPLE TISSUES,12,11/28/2011 12:14,0.39,15721,United Kingdom
579124,21967,PACK OF 12 SKULL TISSUES,12,11/28/2011 12:14,0.39,15721,United Kingdom
579124,23196,VINTAGE LEAF MAGNETIC NOTEPAD,1,11/28/2011 12:14,1.45,15721,United Kingdom
579124,22992,REVOLVER WOODEN RULER ,1,11/28/2011 12:14,1.95,15721,United Kingdom
579124,21947,SET OF 6 HEART CHOPSTICKS,1,11/28/2011 12:14,1.25,15721,United Kingdom
579124,21620,SET OF 4 ROSE BOTANICAL CANDLES,12,11/28/2011 12:14,1.25,15721,United Kingdom
579124,21429,RED GINGHAM ROSE JEWELLERY BOX,2,11/28/2011 12:14,1.95,15721,United Kingdom
579124,21930,JUMBO STORAGE BAG SKULLS,4,11/28/2011 12:14,2.08,15721,United Kingdom
579124,23200,JUMBO BAG PEARS,1,11/28/2011 12:14,2.08,15721,United Kingdom
579124,23199,JUMBO BAG APPLES,1,11/28/2011 12:14,2.08,15721,United Kingdom
579124,23202,JUMBO BAG VINTAGE LEAF,10,11/28/2011 12:14,2.08,15721,United Kingdom
579124,23203,JUMBO BAG VINTAGE DOILY ,10,11/28/2011 12:14,2.08,15721,United Kingdom
579124,22075,6 RIBBONS ELEGANT CHRISTMAS ,3,11/28/2011 12:14,1.65,15721,United Kingdom
579124,47471,RAINBOW PEGS PHOTO CLIP STRING,4,11/28/2011 12:14,0.65,15721,United Kingdom
579124,47469,ASSORTED SHAPES PHOTO CLIP SILVER ,1,11/28/2011 12:14,0.65,15721,United Kingdom
579124,23301,GARDENERS KNEELING PAD KEEP CALM ,4,11/28/2011 12:14,1.65,15721,United Kingdom
579124,22086,PAPER CHAIN KIT 50'S CHRISTMAS ,1,11/28/2011 12:14,2.95,15721,United Kingdom
579124,23197,SKETCHBOOK MAGNETIC SHOPPING LIST,1,11/28/2011 12:14,1.45,15721,United Kingdom
579124,21181,PLEASE ONE PERSON METAL SIGN,4,11/28/2011 12:14,2.1,15721,United Kingdom
579124,23249,VINTAGE RED ENAMEL TRIM PLATE,12,11/28/2011 12:14,1.65,15721,United Kingdom
579124,23442,12 HANGING EGGS HAND PAINTED,1,11/28/2011 12:14,2.08,15721,United Kingdom
579124,47469,ASSORTED SHAPES PHOTO CLIP SILVER ,1,11/28/2011 12:14,0.65,15721,United Kingdom
579124,47469,ASSORTED SHAPES PHOTO CLIP SILVER ,2,11/28/2011 12:14,0.65,15721,United Kingdom
579124,47469,ASSORTED SHAPES PHOTO CLIP SILVER ,2,11/28/2011 12:14,0.65,15721,United Kingdom
579124,23552,BICYCLE PUNCTURE REPAIR KIT ,1,11/28/2011 12:14,2.08,15721,United Kingdom
579124,22151,PLACE SETTING WHITE HEART,2,11/28/2011 12:14,0.42,15721,United Kingdom
579124,84748,FOLK FELT HANGING MULTICOL GARLAND,1,11/28/2011 12:14,3.75,15721,United Kingdom
579124,22164,STRING OF STARS CARD HOLDER,24,11/28/2011 12:14,2.95,15721,United Kingdom
579124,22197,POPCORN HOLDER,4,11/28/2011 12:14,0.85,15721,United Kingdom
579124,23535,WALL ART BICYCLE SAFETY,1,11/28/2011 12:14,5.95,15721,United Kingdom
579124,23530,WALL ART ONLY ONE PERSON ,2,11/28/2011 12:14,4.95,15721,United Kingdom
579124,84748,FOLK FELT HANGING MULTICOL GARLAND,1,11/28/2011 12:14,3.75,15721,United Kingdom
579124,22819,"BIRTHDAY CARD, RETRO SPOT",12,11/28/2011 12:14,0.42,15721,United Kingdom
579124,21306,SET/4 DAISY MIRROR MAGNETS,3,11/28/2011 12:14,0.29,15721,United Kingdom
579124,22163,HEART STRING MEMO HOLDER HANGING,24,11/28/2011 12:14,0.79,15721,United Kingdom
579124,22983,CARD BILLBOARD FONT,12,11/28/2011 12:14,0.42,15721,United Kingdom
579124,22633,HAND WARMER UNION JACK,2,11/28/2011 12:14,2.1,15721,United Kingdom
579124,22992,REVOLVER WOODEN RULER ,2,11/28/2011 12:14,1.95,15721,United Kingdom
579124,22906,12 MESSAGE CARDS WITH ENVELOPES,2,11/28/2011 12:14,1.65,15721,United Kingdom
579124,23439,HAND WARMER RED LOVE HEART,2,11/28/2011 12:14,2.1,15721,United Kingdom
579124,22632,HAND WARMER RED RETROSPOT,2,11/28/2011 12:14,2.1,15721,United Kingdom
579124,22865,HAND WARMER OWL DESIGN,2,11/28/2011 12:14,2.1,15721,United Kingdom
579124,21429,RED GINGHAM ROSE JEWELLERY BOX,2,11/28/2011 12:14,1.95,15721,United Kingdom
579124,20914,SET/5 RED RETROSPOT LID GLASS BOWLS,1,11/28/2011 12:14,2.95,15721,United Kingdom
579124,21791,VINTAGE HEADS AND TAILS CARD GAME ,1,11/28/2011 12:14,1.25,15721,United Kingdom
579124,23355,HOT WATER BOTTLE KEEP CALM,2,11/28/2011 12:14,4.95,15721,United Kingdom
579124,23356,LOVE HOT WATER BOTTLE,2,11/28/2011 12:14,5.95,15721,United Kingdom
579124,21479,WHITE SKULL HOT WATER BOTTLE ,2,11/28/2011 12:14,4.25,15721,United Kingdom
579124,23200,JUMBO BAG PEARS,3,11/28/2011 12:14,2.08,15721,United Kingdom
579124,21928,JUMBO BAG SCANDINAVIAN BLUE PAISLEY,10,11/28/2011 12:14,2.08,15721,United Kingdom
579124,23201,JUMBO BAG ALPHABET,4,11/28/2011 12:14,2.08,15721,United Kingdom
579124,21929,JUMBO BAG PINK VINTAGE PAISLEY,2,11/28/2011 12:14,2.08,15721,United Kingdom
579125,21615,4 LAVENDER BOTANICAL DINNER CANDLES,12,11/28/2011 12:19,1.25,14215,United Kingdom
579125,23470,CARD HOLDER LOVE BIRD LARGE ,2,11/28/2011 12:19,6.25,14215,United Kingdom
579125,23469,CARD HOLDER LOVE BIRD SMALL,6,11/28/2011 12:19,4.15,14215,United Kingdom
579125,23489,VINTAGE BELLS GARLAND,6,11/28/2011 12:19,2.89,14215,United Kingdom
579125,22577,WOODEN HEART CHRISTMAS SCANDINAVIAN,24,11/28/2011 12:19,0.29,14215,United Kingdom
579125,22578,WOODEN STAR CHRISTMAS SCANDINAVIAN,24,11/28/2011 12:19,0.29,14215,United Kingdom
579125,22338,STAR DECORATION PAINTED ZINC ,96,11/28/2011 12:19,0.19,14215,United Kingdom
579125,22340,NOEL GARLAND PAINTED ZINC ,24,11/28/2011 12:19,0.39,14215,United Kingdom
579125,23435,3 RAFFIA RIBBONS VINTAGE CHRISTMAS,10,11/28/2011 12:19,0.79,14215,United Kingdom
579125,23434,3 RAFFIA RIBBONS 50'S CHRISTMAS ,10,11/28/2011 12:19,0.79,14215,United Kingdom
579125,35953,FOLKART STAR CHRISTMAS DECORATIONS,48,11/28/2011 12:19,0.39,14215,United Kingdom
579125,35964,FOLKART CLIP ON STARS,36,11/28/2011 12:19,0.39,14215,United Kingdom
579125,23263,SET OF 3 WOODEN HEART DECORATIONS,12,11/28/2011 12:19,1.25,14215,United Kingdom
579125,85199S,SMALL HANGING IVORY/RED WOOD BIRD,24,11/28/2011 12:19,0.42,14215,United Kingdom
579125,22208,WOOD STAMP SET THANK YOU,12,11/28/2011 12:19,0.83,14215,United Kingdom
579125,22342,HOME GARLAND PAINTED ZINC ,24,11/28/2011 12:19,0.75,14215,United Kingdom
579125,35471D,SET OF 3 BIRD LIGHT PINK FEATHER ,24,11/28/2011 12:19,0.39,14215,United Kingdom
579125,22580,ADVENT CALENDAR GINGHAM SACK,3,11/28/2011 12:19,5.95,14215,United Kingdom
579125,22734,SET OF 6 RIBBONS VINTAGE CHRISTMAS,6,11/28/2011 12:19,2.89,14215,United Kingdom
579125,22075,6 RIBBONS ELEGANT CHRISTMAS ,12,11/28/2011 12:19,1.65,14215,United Kingdom
579125,85049A,TRADITIONAL CHRISTMAS RIBBONS,12,11/28/2011 12:19,1.25,14215,United Kingdom
579125,22866,HAND WARMER SCOTTY DOG DESIGN,12,11/28/2011 12:19,2.1,14215,United Kingdom
579125,22867,HAND WARMER BIRD DESIGN,12,11/28/2011 12:19,2.1,14215,United Kingdom
579125,22633,HAND WARMER UNION JACK,12,11/28/2011 12:19,2.1,14215,United Kingdom
579125,21588,RETROSPOT GIANT TUBE MATCHES,12,11/28/2011 12:19,2.55,14215,United Kingdom
579125,21619,4 VANILLA BOTANICAL CANDLES,12,11/28/2011 12:19,1.25,14215,United Kingdom
579125,21616,4 PEAR BOTANICAL DINNER CANDLES,12,11/28/2011 12:19,1.25,14215,United Kingdom
579125,21672,WHITE SPOT RED CERAMIC DRAWER KNOB,12,11/28/2011 12:19,1.45,14215,United Kingdom
579126,21231,SWEETHEART CERAMIC TRINKET BOX,72,11/28/2011 12:19,1.06,13798,United Kingdom
579126,21181,PLEASE ONE PERSON METAL SIGN,48,11/28/2011 12:19,1.85,13798,United Kingdom
579126,47559B,TEA TIME OVEN GLOVE,95,11/28/2011 12:19,1.06,13798,United Kingdom
579126,47591D,PINK FAIRY CAKE CHILDRENS APRON,50,11/28/2011 12:19,1.65,13798,United Kingdom
C579127,22326,ROUND SNACK BOXES SET OF4 WOODLAND ,-1,11/28/2011 12:22,2.95,12674,France
579128,22600,CHRISTMAS RETROSPOT STAR WOOD,12,11/28/2011 12:30,0.85,14397,United Kingdom
579128,22694,WICKER STAR ,6,11/28/2011 12:30,2.1,14397,United Kingdom
579128,22178,VICTORIAN GLASS HANGING T-LIGHT,48,11/28/2011 12:30,1.95,14397,United Kingdom
579128,20846,ZINC HEART LATTICE T-LIGHT HOLDER,24,11/28/2011 12:30,1.25,14397,United Kingdom
579128,84946,ANTIQUE SILVER T-LIGHT GLASS,12,11/28/2011 12:30,1.25,14397,United Kingdom
579129,22800,ANTIQUE TALL SWIRLGLASS TRINKET POT,2,11/28/2011 12:31,3.75,17852,United Kingdom
579129,22831,WHITE BROCANTE SOAP DISH,2,11/28/2011 12:31,2.95,17852,United Kingdom
579129,22619,SET OF 6 SOLDIER SKITTLES,2,11/28/2011 12:31,3.75,17852,United Kingdom
579129,84380,SET OF 3 BUTTERFLY COOKIE CUTTERS,3,11/28/2011 12:31,1.45,17852,United Kingdom
579129,22798,ANTIQUE GLASS DRESSING TABLE POT,2,11/28/2011 12:31,2.95,17852,United Kingdom
579129,21888,BINGO SET,1,11/28/2011 12:31,3.75,17852,United Kingdom
579129,23229,VINTAGE DONKEY TAIL GAME ,2,11/28/2011 12:31,3.75,17852,United Kingdom
579129,22150,3 STRIPEY MICE FELTCRAFT,1,11/28/2011 12:31,1.95,17852,United Kingdom
579130,21201,TROPICAL  HONEYCOMB PAPER GARLAND ,24,11/28/2011 12:32,2.55,14735,United Kingdom
579130,23382,BOX OF 6 CHRISTMAS CAKE DECORATIONS,8,11/28/2011 12:32,3.75,14735,United Kingdom
579130,23189,SET OF 12 FORK CANDLES,18,11/28/2011 12:32,2.89,14735,United Kingdom
579130,21868,POTTING SHED TEA MUG,12,11/28/2011 12:32,1.65,14735,United Kingdom
579131,23077,DOUGHNUT LIP GLOSS ,20,11/28/2011 12:33,1.25,12839,United Kingdom
579131,22059,CERAMIC STRAWBERRY DESIGN MUG,12,11/28/2011 12:33,1.49,12839,United Kingdom
579131,37448,CERAMIC CAKE DESIGN SPOTTED MUG,12,11/28/2011 12:33,1.49,12839,United Kingdom
579131,22064,PINK DOUGHNUT TRINKET POT ,12,11/28/2011 12:33,1.65,12839,United Kingdom
579131,21231,SWEETHEART CERAMIC TRINKET BOX,12,11/28/2011 12:33,1.25,12839,United Kingdom
579131,21172,PARTY METAL SIGN ,12,11/28/2011 12:33,1.45,12839,United Kingdom
579131,21164,HOME SWEET HOME METAL SIGN ,6,11/28/2011 12:33,2.95,12839,United Kingdom
579131,20685,DOORMAT RED RETROSPOT,2,11/28/2011 12:33,8.25,12839,United Kingdom
579131,22366,DOORMAT AIRMAIL ,2,11/28/2011 12:33,8.25,12839,United Kingdom
579131,82001S,SILVER RECORD COVER FRAME,4,11/28/2011 12:33,3.75,12839,United Kingdom
579131,21481,FAWN BLUE HOT WATER BOTTLE,8,11/28/2011 12:33,3.75,12839,United Kingdom
579131,23399,HOME SWEET HOME HANGING HEART,12,11/28/2011 12:33,0.85,12839,United Kingdom
579131,20724,RED RETROSPOT CHARLOTTE BAG,40,11/28/2011 12:33,0.85,12839,United Kingdom
579131,22661,CHARLOTTE BAG DOLLY GIRL DESIGN,20,11/28/2011 12:33,0.85,12839,United Kingdom
579131,20719,WOODLAND CHARLOTTE BAG,30,11/28/2011 12:33,0.85,12839,United Kingdom
579131,22355,CHARLOTTE BAG SUKI DESIGN,30,11/28/2011 12:33,0.85,12839,United Kingdom
579131,23204,CHARLOTTE BAG APPLES DESIGN,20,11/28/2011 12:33,0.85,12839,United Kingdom
579131,20723,STRAWBERRY CHARLOTTE BAG,30,11/28/2011 12:33,0.85,12839,United Kingdom
579131,22356,CHARLOTTE BAG PINK POLKADOT,20,11/28/2011 12:33,0.85,12839,United Kingdom
579131,23582,VINTAGE DOILY JUMBO BAG RED ,10,11/28/2011 12:33,2.08,12839,United Kingdom
579131,85099B,JUMBO BAG RED RETROSPOT,10,11/28/2011 12:33,2.08,12839,United Kingdom
579131,21931,JUMBO STORAGE BAG SUKI,10,11/28/2011 12:33,2.08,12839,United Kingdom
579131,23203,JUMBO BAG VINTAGE DOILY ,10,11/28/2011 12:33,2.08,12839,United Kingdom
579131,85099F,JUMBO BAG STRAWBERRY,10,11/28/2011 12:33,2.08,12839,United Kingdom
579131,23344,JUMBO BAG 50'S CHRISTMAS ,10,11/28/2011 12:33,2.08,12839,United Kingdom
579131,23343,JUMBO BAG VINTAGE CHRISTMAS ,10,11/28/2011 12:33,2.08,12839,United Kingdom
579131,22197,POPCORN HOLDER,48,11/28/2011 12:33,0.85,12839,United Kingdom
579132,22186,RED STAR CARD HOLDER,4,11/28/2011 12:35,1.95,15022,United Kingdom
579132,85048,15CM CHRISTMAS GLASS BALL 20 LIGHTS,3,11/28/2011 12:35,7.95,15022,United Kingdom
579132,22187,GREEN CHRISTMAS TREE CARD HOLDER,4,11/28/2011 12:35,1.95,15022,United Kingdom
579132,20668,DISCO BALL CHRISTMAS DECORATION,24,11/28/2011 12:35,0.12,15022,United Kingdom
579132,22666,RECIPE BOX PANTRY YELLOW DESIGN,1,11/28/2011 12:35,2.95,15022,United Kingdom
579132,23310,BUBBLEGUM RING ASSORTED,36,11/28/2011 12:35,0.42,15022,United Kingdom
579132,84029G,KNITTED UNION FLAG HOT WATER BOTTLE,1,11/28/2011 12:35,4.25,15022,United Kingdom
579132,23214,JINGLE BELL HEART ANTIQUE GOLD,1,11/28/2011 12:35,2.08,15022,United Kingdom
579132,22092,BLUE PAISLEY TISSUE BOX,2,11/28/2011 12:35,0.39,15022,United Kingdom
579132,23323,WHITE WICKER STAR ,3,11/28/2011 12:35,2.1,15022,United Kingdom
579132,22694,WICKER STAR ,1,11/28/2011 12:35,2.1,15022,United Kingdom
579132,22601,CHRISTMAS RETROSPOT ANGEL WOOD,4,11/28/2011 12:35,0.85,15022,United Kingdom
579132,22600,CHRISTMAS RETROSPOT STAR WOOD,4,11/28/2011 12:35,0.85,15022,United Kingdom
579132,22603,CHRISTMAS RETROSPOT TREE WOOD,3,11/28/2011 12:35,0.85,15022,United Kingdom
579132,23215,JINGLE BELL HEART ANTIQUE SILVER,3,11/28/2011 12:35,2.08,15022,United Kingdom
579132,21828,EIGHT PIECE SNAKE  SET,3,11/28/2011 12:35,1.25,15022,United Kingdom
579132,22866,HAND WARMER SCOTTY DOG DESIGN,1,11/28/2011 12:35,2.1,15022,United Kingdom
579132,22633,HAND WARMER UNION JACK,1,11/28/2011 12:35,2.1,15022,United Kingdom
579132,22571,ROCKING HORSE RED CHRISTMAS ,1,11/28/2011 12:35,0.85,15022,United Kingdom
579132,22581,WOOD STOCKING CHRISTMAS SCANDISPOT,4,11/28/2011 12:35,0.29,15022,United Kingdom
579132,22577,WOODEN HEART CHRISTMAS SCANDINAVIAN,6,11/28/2011 12:35,0.29,15022,United Kingdom
579132,22571,ROCKING HORSE RED CHRISTMAS ,1,11/28/2011 12:35,0.85,15022,United Kingdom
579132,47421,ASSORTED COLOUR LIZARD SUCTION HOOK,1,11/28/2011 12:35,0.42,15022,United Kingdom
579132,47422,ASSORTED MONKEY SUCTION CUP HOOK,3,11/28/2011 12:35,0.42,15022,United Kingdom
579132,47421,ASSORTED COLOUR LIZARD SUCTION HOOK,2,11/28/2011 12:35,0.42,15022,United Kingdom
579132,22553,PLASTERS IN TIN SKULLS,1,11/28/2011 12:35,1.65,15022,United Kingdom
579132,22555,PLASTERS IN TIN STRONGMAN,2,11/28/2011 12:35,1.65,15022,United Kingdom
579132,22558,CLOTHES PEGS RETROSPOT PACK 24 ,2,11/28/2011 12:35,1.65,15022,United Kingdom
579132,21329,DINOSAURS  WRITING SET ,2,11/28/2011 12:35,1.65,15022,United Kingdom
579132,23247,BISCUIT TIN 50'S CHRISTMAS,1,11/28/2011 12:35,2.89,15022,United Kingdom
579132,20961,STRAWBERRY BATH SPONGE ,10,11/28/2011 12:35,1.25,15022,United Kingdom
579132,21615,4 LAVENDER BOTANICAL DINNER CANDLES,4,11/28/2011 12:35,1.25,15022,United Kingdom
579132,21619,4 VANILLA BOTANICAL CANDLES,4,11/28/2011 12:35,1.25,15022,United Kingdom
579132,21620,SET OF 4 ROSE BOTANICAL CANDLES,4,11/28/2011 12:35,1.25,15022,United Kingdom
579132,21820,GLITTER HEART GARLAND WITH BELLS ,6,11/28/2011 12:35,3.75,15022,United Kingdom
579132,35964,FOLKART CLIP ON STARS,12,11/28/2011 12:35,0.39,15022,United Kingdom
579132,22065,CHRISTMAS PUDDING TRINKET POT ,2,11/28/2011 12:35,0.39,15022,United Kingdom
579132,21822,GLITTER CHRISTMAS TREE WITH BELLS,6,11/28/2011 12:35,0.79,15022,United Kingdom
579132,23234,BISCUIT TIN VINTAGE CHRISTMAS,1,11/28/2011 12:35,2.89,15022,United Kingdom
579132,22167, OVAL WALL MIRROR DIAMANTE ,1,11/28/2011 12:35,9.95,15022,United Kingdom
579132,23214,JINGLE BELL HEART ANTIQUE GOLD,2,11/28/2011 12:35,2.08,15022,United Kingdom
579132,21828,EIGHT PIECE SNAKE  SET,1,11/28/2011 12:35,1.25,15022,United Kingdom
579132,22866,HAND WARMER SCOTTY DOG DESIGN,1,11/28/2011 12:35,2.1,15022,United Kingdom
579132,22694,WICKER STAR ,1,11/28/2011 12:35,2.1,15022,United Kingdom
579132,22554,PLASTERS IN TIN WOODLAND ANIMALS,2,11/28/2011 12:35,1.65,15022,United Kingdom
579132,22553,PLASTERS IN TIN SKULLS,1,11/28/2011 12:35,1.65,15022,United Kingdom
579132,20982,12 PENCILS TALL TUBE SKULLS,3,11/28/2011 12:35,0.85,15022,United Kingdom
579132,22633,HAND WARMER UNION JACK,1,11/28/2011 12:35,2.1,15022,United Kingdom
579132,22865,HAND WARMER OWL DESIGN,1,11/28/2011 12:35,2.1,15022,United Kingdom
579132,22632,HAND WARMER RED RETROSPOT,1,11/28/2011 12:35,2.1,15022,United Kingdom
579132,23439,HAND WARMER RED LOVE HEART,2,11/28/2011 12:35,2.1,15022,United Kingdom
579132,21034,REX CASH+CARRY JUMBO SHOPPER,2,11/28/2011 12:35,0.95,15022,United Kingdom
579133,22805,BLUE DRAWER KNOB ACRYLIC EDWARDIAN,2,11/28/2011 12:36,1.25,17852,United Kingdom
579133,22773,GREEN DRAWER KNOB ACRYLIC EDWARDIAN,2,11/28/2011 12:36,1.25,17852,United Kingdom
579133,22775,PURPLE DRAWERKNOB ACRYLIC EDWARDIAN,2,11/28/2011 12:36,1.25,17852,United Kingdom
579133,22774,RED DRAWER KNOB ACRYLIC EDWARDIAN,2,11/28/2011 12:36,1.25,17852,United Kingdom
579133,23029,DRAWER KNOB CRACKLE GLAZE GREEN,4,11/28/2011 12:36,1.65,17852,United Kingdom
579133,21892,TRADITIONAL WOODEN CATCH CUP GAME ,1,11/28/2011 12:36,1.25,17852,United Kingdom
579133,21790,VINTAGE SNAP CARDS,2,11/28/2011 12:36,0.85,17852,United Kingdom
579133,22831,WHITE BROCANTE SOAP DISH,2,11/28/2011 12:36,2.95,17852,United Kingdom
579133,22150,3 STRIPEY MICE FELTCRAFT,1,11/28/2011 12:36,1.95,17852,United Kingdom
579133,84947,ANTIQUE SILVER TEA GLASS ENGRAVED,6,11/28/2011 12:36,1.25,17852,United Kingdom
579133,23169,CLASSIC GLASS COOKIE JAR,2,11/28/2011 12:36,4.15,17852,United Kingdom
579133,23569,TRADTIONAL ALPHABET STAMP SET,1,11/28/2011 12:36,4.95,17852,United Kingdom
579133,23570,TRADITIONAL PICK UP STICKS GAME ,3,11/28/2011 12:36,1.25,17852,United Kingdom
579133,23392,SPACEBOY ROCKET LOLLY MAKERS,3,11/28/2011 12:36,2.08,17852,United Kingdom
579133,23490,T-LIGHT HOLDER HANGING LOVE BIRD,2,11/28/2011 12:36,3.75,17852,United Kingdom
579133,84380,SET OF 3 BUTTERFLY COOKIE CUTTERS,3,11/28/2011 12:36,1.45,17852,United Kingdom
579134,23583,LUNCH BAG PAISLEY PARK  ,10,11/28/2011 12:38,1.65,13115,United Kingdom
579134,23681,LUNCH BAG RED VINTAGE DOILY,10,11/28/2011 12:38,1.65,13115,United Kingdom
579134,22274,FELTCRAFT DOLL EMILY,12,11/28/2011 12:38,2.95,13115,United Kingdom
579134,22273,FELTCRAFT DOLL MOLLY,12,11/28/2011 12:38,2.95,13115,United Kingdom
579134,22749,FELTCRAFT PRINCESS CHARLOTTE DOLL,8,11/28/2011 12:38,3.75,13115,United Kingdom
579134,22750,FELTCRAFT PRINCESS LOLA DOLL,8,11/28/2011 12:38,3.75,13115,United Kingdom
579134,21059,PARTY INVITES DINOSAURS,12,11/28/2011 12:38,0.85,13115,United Kingdom
579134,21061,PARTY INVITES FOOTBALL,12,11/28/2011 12:38,0.85,13115,United Kingdom
579134,21063,PARTY INVITES JAZZ HEARTS,12,11/28/2011 12:38,0.85,13115,United Kingdom
579134,21058,PARTY INVITES WOODLAND,12,11/28/2011 12:38,0.85,13115,United Kingdom
579134,22384,LUNCH BAG PINK POLKADOT,20,11/28/2011 12:38,1.65,13115,United Kingdom
579134,23208,LUNCH BAG VINTAGE LEAF DESIGN,10,11/28/2011 12:38,1.65,13115,United Kingdom
579134,23209,LUNCH BAG VINTAGE DOILY ,10,11/28/2011 12:38,1.65,13115,United Kingdom
579134,20728,LUNCH BAG CARS BLUE,20,11/28/2011 12:38,1.65,13115,United Kingdom
579134,23207,LUNCH BAG ALPHABET DESIGN,20,11/28/2011 12:38,1.65,13115,United Kingdom
579134,23206,LUNCH BAG APPLE DESIGN,20,11/28/2011 12:38,1.65,13115,United Kingdom
579134,20727,LUNCH BAG  BLACK SKULL.,20,11/28/2011 12:38,1.65,13115,United Kingdom
579134,22383,LUNCH BAG SUKI DESIGN ,20,11/28/2011 12:38,1.65,13115,United Kingdom
579134,20725,LUNCH BAG RED RETROSPOT,20,11/28/2011 12:38,1.65,13115,United Kingdom
579134,15036,ASSORTED COLOURS SILK FAN,12,11/28/2011 12:38,0.83,13115,United Kingdom
579134,21495,SKULLS AND CROSSBONES WRAP,25,11/28/2011 12:38,0.42,13115,United Kingdom
579134,16161U,WRAP SUKI AND FRIENDS,25,11/28/2011 12:38,0.42,13115,United Kingdom
579135,23492,VINTAGE JINGLE BELLS WREATH,1,11/28/2011 12:44,8.25,18096,United Kingdom
579135,22597,MUSICAL ZINC HEART DECORATION ,10,11/28/2011 12:44,0.29,18096,United Kingdom
579135,23270,SET OF 2 CERAMIC PAINTED HEARTS ,4,11/28/2011 12:44,1.45,18096,United Kingdom
579135,23333,IVORY WICKER HEART MEDIUM,10,11/28/2011 12:44,1.25,18096,United Kingdom
579135,84596B,SMALL DOLLY MIX DESIGN ORANGE BOWL,3,11/28/2011 12:44,0.42,18096,United Kingdom
579135,84596F,SMALL MARSHMALLOWS PINK BOWL,8,11/28/2011 12:44,0.42,18096,United Kingdom
579135,23263,SET OF 3 WOODEN HEART DECORATIONS,4,11/28/2011 12:44,1.25,18096,United Kingdom
