579161,22197,POPCORN HOLDER,5,11/28/2011 13:56,0.85,17379,United Kingdom
579161,23493,VINTAGE DOILY TRAVEL SEWING KIT,5,11/28/2011 13:56,1.95,17379,United Kingdom
579161,75011,BLUE DAISY MOBILE,1,11/28/2011 13:56,0.79,17379,United Kingdom
579161,23309,SET OF 60 I LOVE LONDON CAKE CASES ,1,11/28/2011 13:56,0.55,17379,United Kingdom
579161,21212,PACK OF 72 RETROSPOT CAKE CASES,2,11/28/2011 13:56,0.55,17379,United Kingdom
579161,22608,PENS ASSORTED FUNKY JEWELED ,36,11/28/2011 13:56,0.19,17379,United Kingdom
579161,21154,RED RETROSPOT OVEN GLOVE ,3,11/28/2011 13:56,1.25,17379,United Kingdom
579161,21210,SET OF 72 RETROSPOT PAPER  DOILIES,2,11/28/2011 13:56,1.45,17379,United Kingdom
579161,23310,BUBBLEGUM RING ASSORTED,36,11/28/2011 13:56,0.42,17379,United Kingdom
579161,20832,RED FLOCK LOVE HEART PHOTO FRAME,4,11/28/2011 13:56,0.39,17379,United Kingdom
579161,22998,TRAVEL CARD WALLET KEEP CALM,5,11/28/2011 13:56,0.42,17379,United Kingdom
579161,22999,TRAVEL CARD WALLET VINTAGE LEAF,5,11/28/2011 13:56,0.42,17379,United Kingdom
579161,23005,TRAVEL CARD WALLET I LOVE LONDON,4,11/28/2011 13:56,0.42,17379,United Kingdom
579161,22995,TRAVEL CARD WALLET SUKI,5,11/28/2011 13:56,0.42,17379,United Kingdom
579161,84988,SET OF 72 PINK HEART PAPER DOILIES,1,11/28/2011 13:56,1.45,17379,United Kingdom
579161,16045,POPART WOODEN PENCILS ASST,100,11/28/2011 13:56,0.04,17379,United Kingdom
579161,23309,SET OF 60 I LOVE LONDON CAKE CASES ,1,11/28/2011 13:56,0.55,17379,United Kingdom
579161,85184C,SET 4 VALENTINE DECOUPAGE HEART BOX,1,11/28/2011 13:56,2.95,17379,United Kingdom
579161,22598,CHRISTMAS MUSICAL ZINC TREE,10,11/28/2011 13:56,0.29,17379,United Kingdom
579161,23103,JINGLE BELL HEART DECORATION,3,11/28/2011 13:56,1.65,17379,United Kingdom
579161,21810,CHRISTMAS HANGING STAR WITH BELL,3,11/28/2011 13:56,0.39,17379,United Kingdom
579161,22577,WOODEN HEART CHRISTMAS SCANDINAVIAN,5,11/28/2011 13:56,0.29,17379,United Kingdom
579161,22151,PLACE SETTING WHITE HEART,10,11/28/2011 13:56,0.42,17379,United Kingdom
579161,84378,SET OF 3 HEART COOKIE CUTTERS,2,11/28/2011 13:56,1.45,17379,United Kingdom
579161,84380,SET OF 3 BUTTERFLY COOKIE CUTTERS,2,11/28/2011 13:56,1.45,17379,United Kingdom
579161,22909,SET OF 20 VINTAGE CHRISTMAS NAPKINS,3,11/28/2011 13:56,0.85,17379,United Kingdom
579161,85184C,SET 4 VALENTINE DECOUPAGE HEART BOX,4,11/28/2011 13:56,2.95,17379,United Kingdom
579161,21429,RED GINGHAM ROSE JEWELLERY BOX,2,11/28/2011 13:56,1.95,17379,United Kingdom
579161,21430,SET/3 RED GINGHAM ROSE STORAGE BOX,2,11/28/2011 13:56,3.75,17379,United Kingdom
579161,21231,SWEETHEART CERAMIC TRINKET BOX,16,11/28/2011 13:56,1.25,17379,United Kingdom
579161,22306,SILVER MUG BONE CHINA TREE OF LIFE,6,11/28/2011 13:56,1.06,17379,United Kingdom
579161,20996,JAZZ HEARTS ADDRESS BOOK,24,11/28/2011 13:56,0.19,17379,United Kingdom
579161,22066,LOVE HEART TRINKET POT,20,11/28/2011 13:56,0.39,17379,United Kingdom
579161,35967,FOLK ART METAL STAR T-LIGHT HOLDER,12,11/28/2011 13:56,0.38,17379,United Kingdom
579161,84596F,SMALL MARSHMALLOWS PINK BOWL,40,11/28/2011 13:56,0.42,17379,United Kingdom
579161,22608,PENS ASSORTED FUNKY JEWELED ,36,11/28/2011 13:56,0.19,17379,United Kingdom
579161,22110,BIRD HOUSE HOT WATER BOTTLE,3,11/28/2011 13:56,2.55,17379,United Kingdom
579161,22187,GREEN CHRISTMAS TREE CARD HOLDER,3,11/28/2011 13:56,1.95,17379,United Kingdom
579161,23313,VINTAGE CHRISTMAS BUNTING,1,11/28/2011 13:56,4.95,17379,United Kingdom
579161,23323,WHITE WICKER STAR ,11,11/28/2011 13:56,2.1,17379,United Kingdom
579161,23206,LUNCH BAG APPLE DESIGN,4,11/28/2011 13:56,1.65,17379,United Kingdom
579162,22371,AIRLINE BAG VINTAGE TOKYO 78,10,11/28/2011 13:58,4.25,16393,United Kingdom
579162,23390,DOLLY GIRL MINI BACKPACK,2,11/28/2011 13:58,4.15,16393,United Kingdom
579162,23391, I LOVE LONDON MINI BACKPACK,2,11/28/2011 13:58,4.15,16393,United Kingdom
579162,22367,CHILDRENS APRON SPACEBOY DESIGN,10,11/28/2011 13:58,1.95,16393,United Kingdom
579162,21156,RETROSPOT CHILDRENS APRON,5,11/28/2011 13:58,1.95,16393,United Kingdom
579162,22899,CHILDREN'S APRON DOLLY GIRL ,6,11/28/2011 13:58,2.1,16393,United Kingdom
579162,22898,CHILDRENS APRON APPLES DESIGN,6,11/28/2011 13:58,1.95,16393,United Kingdom
579162,22662,LUNCH BAG DOLLY GIRL DESIGN,2,11/28/2011 13:58,1.65,16393,United Kingdom
579162,22383,LUNCH BAG SUKI DESIGN ,2,11/28/2011 13:58,1.65,16393,United Kingdom
579162,20725,LUNCH BAG RED RETROSPOT,3,11/28/2011 13:58,1.65,16393,United Kingdom
579162,22629,SPACEBOY LUNCH BOX ,10,11/28/2011 13:58,1.95,16393,United Kingdom
579162,22659,LUNCH BOX I LOVE LONDON,4,11/28/2011 13:58,1.95,16393,United Kingdom
579162,22631,CIRCUS PARADE LUNCH BOX ,4,11/28/2011 13:58,1.95,16393,United Kingdom
579162,22993,SET OF 4 PANTRY JELLY MOULDS,12,11/28/2011 13:58,1.25,16393,United Kingdom
579162,22988,SOLDIERS EGG CUP ,4,11/28/2011 13:58,1.25,16393,United Kingdom
579162,22975,SPACEBOY CHILDRENS EGG CUP,4,11/28/2011 13:58,1.25,16393,United Kingdom
579162,23238,SET OF 4 KNICK KNACK TINS LONDON ,6,11/28/2011 13:58,4.15,16393,United Kingdom
579162,23344,JUMBO BAG 50'S CHRISTMAS ,4,11/28/2011 13:58,2.08,16393,United Kingdom
579162,85099B,JUMBO BAG RED RETROSPOT,4,11/28/2011 13:58,2.08,16393,United Kingdom
579162,21931,JUMBO STORAGE BAG SUKI,4,11/28/2011 13:58,2.08,16393,United Kingdom
579162,23157,SET OF 6 NATIVITY MAGNETS ,2,11/28/2011 13:58,2.08,16393,United Kingdom
579162,23083,SET 6 PAPER TABLE LANTERN STARS ,1,11/28/2011 13:58,3.75,16393,United Kingdom
579162,22732,3D VINTAGE CHRISTMAS STICKERS ,2,11/28/2011 13:58,1.25,16393,United Kingdom
579162,85227,SET OF 6 3D KIT CARDS FOR KIDS,1,11/28/2011 13:58,0.85,16393,United Kingdom
579162,22834,HAND WARMER BABUSHKA DESIGN,5,11/28/2011 13:58,2.1,16393,United Kingdom
579162,22633,HAND WARMER UNION JACK,4,11/28/2011 13:58,2.1,16393,United Kingdom
579162,22867,HAND WARMER BIRD DESIGN,6,11/28/2011 13:58,2.1,16393,United Kingdom
579162,22632,HAND WARMER RED RETROSPOT,5,11/28/2011 13:58,2.1,16393,United Kingdom
579162,22865,HAND WARMER OWL DESIGN,1,11/28/2011 13:58,2.1,16393,United Kingdom
579162,22866,HAND WARMER SCOTTY DOG DESIGN,5,11/28/2011 13:58,2.1,16393,United Kingdom
579163,22866,HAND WARMER SCOTTY DOG DESIGN,96,11/28/2011 13:59,1.85,15838,United Kingdom
579163,22865,HAND WARMER OWL DESIGN,96,11/28/2011 13:59,1.79,15838,United Kingdom
579163,22633,HAND WARMER UNION JACK,96,11/28/2011 13:59,1.79,15838,United Kingdom
579163,22759,SET OF 3 NOTEBOOKS IN PARCEL,144,11/28/2011 13:59,1.45,15838,United Kingdom
579164,22866,HAND WARMER SCOTTY DOG DESIGN,96,11/28/2011 14:00,1.85,15838,United Kingdom
579164,22865,HAND WARMER OWL DESIGN,36,11/28/2011 14:00,1.79,15838,United Kingdom
579165,84580,MOUSE TOY WITH PINK T-SHIRT,4,11/28/2011 14:01,3.75,13389,United Kingdom
579165,23571,TRADITIONAL NAUGHTS & CROSSES,12,11/28/2011 14:01,1.65,13389,United Kingdom
579165,22619,SET OF 6 SOLDIER SKITTLES,4,11/28/2011 14:01,3.75,13389,United Kingdom
579165,22607,WOODEN ROUNDERS GARDEN SET ,2,11/28/2011 14:01,9.95,13389,United Kingdom
579165,85014A,BLACK/BLUE POLKADOT UMBRELLA,3,11/28/2011 14:01,5.95,13389,United Kingdom
579165,35095A,BLUE VICTORIAN FABRIC OVAL BOX,24,11/28/2011 14:01,0.42,13389,United Kingdom
579165,35095B,RED VICTORIAN FABRIC OVAL BOX,24,11/28/2011 14:01,0.42,13389,United Kingdom
579165,22111,SCOTTIE DOG HOT WATER BOTTLE,6,11/28/2011 14:01,4.95,13389,United Kingdom
579165,21012,ANTIQUE ALL GLASS CANDLESTICK,6,11/28/2011 14:01,2.1,13389,United Kingdom
579165,23322,LARGE WHITE HEART OF WICKER,6,11/28/2011 14:01,2.95,13389,United Kingdom
579165,23197,SKETCHBOOK MAGNETIC SHOPPING LIST,12,11/28/2011 14:01,1.45,13389,United Kingdom
579165,21452,TOADSTOOL MONEY BOX,6,11/28/2011 14:01,2.95,13389,United Kingdom
579165,23444,Next Day Carriage,1,11/28/2011 14:01,15,13389,United Kingdom
579166,23084,RABBIT NIGHT LIGHT,6,11/28/2011 14:02,2.08,14290,United Kingdom
579166,23534,WALL ART STOP FOR TEA ,6,11/28/2011 14:02,5.95,14290,United Kingdom
579166,22800,ANTIQUE TALL SWIRLGLASS TRINKET POT,4,11/28/2011 14:02,3.75,14290,United Kingdom
579166,23156,SET OF 5 MINI GROCERY MAGNETS,12,11/28/2011 14:02,2.08,14290,United Kingdom
579166,23158,SET OF 5 LUCKY CAT MAGNETS ,12,11/28/2011 14:02,2.08,14290,United Kingdom
579166,22086,PAPER CHAIN KIT 50'S CHRISTMAS ,6,11/28/2011 14:02,2.95,14290,United Kingdom
