581376,22750,FELTCRAFT PRINCESS LOLA DOLL,1,12/8/2011 12:43,3.75,14719,United Kingdom
581376,22751,FELTCRAFT PRINCESS OLIVIA DOLL,1,12/8/2011 12:43,3.75,14719,United Kingdom
581376,22556,PLASTERS IN TIN CIRCUS PARADE ,6,12/8/2011 12:43,1.65,14719,United Kingdom
581376,22555,PLASTERS IN TIN STRONGMAN,6,12/8/2011 12:43,1.65,14719,United Kingdom
581376,22557,PLASTERS IN TIN VINTAGE PAISLEY ,6,12/8/2011 12:43,1.65,14719,United Kingdom
581376,22554,PLASTERS IN TIN WOODLAND ANIMALS,6,12/8/2011 12:43,1.65,14719,United Kingdom
581376,22557,PLASTERS IN TIN VINTAGE PAISLEY ,4,12/8/2011 12:43,1.65,14719,United Kingdom
581376,22551,PLASTERS IN TIN SPACEBOY,6,12/8/2011 12:43,1.65,14719,United Kingdom
581376,22555,PLASTERS IN TIN STRONGMAN,4,12/8/2011 12:43,1.65,14719,United Kingdom
581376,23076,ICE CREAM SUNDAE LIP GLOSS,24,12/8/2011 12:43,1.25,14719,United Kingdom
581376,22969,HOMEMADE JAM SCENTED CANDLES,12,12/8/2011 12:43,1.45,14719,United Kingdom
581376,22767,TRIPLE PHOTO FRAME CORNICE ,1,12/8/2011 12:43,9.95,14719,United Kingdom
581376,23301,GARDENERS KNEELING PAD KEEP CALM ,1,12/8/2011 12:43,1.65,14719,United Kingdom
581377,21108,FAIRY CAKE FLANNEL ASSORTED COLOUR,18,12/8/2011 12:44,0.79,14138,United Kingdom
581377,23076,ICE CREAM SUNDAE LIP GLOSS,24,12/8/2011 12:44,1.25,14138,United Kingdom
581377,22809,SET OF 6 T-LIGHTS SANTA,12,12/8/2011 12:44,2.95,14138,United Kingdom
581377,22112,CHOCOLATE HOT WATER BOTTLE,3,12/8/2011 12:44,4.95,14138,United Kingdom
581377,22114,HOT WATER BOTTLE TEA AND SYMPATHY,4,12/8/2011 12:44,4.25,14138,United Kingdom
581377,22111,SCOTTIE DOG HOT WATER BOTTLE,6,12/8/2011 12:44,4.95,14138,United Kingdom
581377,21481,FAWN BLUE HOT WATER BOTTLE,4,12/8/2011 12:44,3.75,14138,United Kingdom
581377,21484,CHICK GREY HOT WATER BOTTLE,4,12/8/2011 12:44,4.25,14138,United Kingdom
581377,23355,HOT WATER BOTTLE KEEP CALM,4,12/8/2011 12:44,4.95,14138,United Kingdom
581377,22867,HAND WARMER BIRD DESIGN,12,12/8/2011 12:44,2.1,14138,United Kingdom
581377,22865,HAND WARMER OWL DESIGN,12,12/8/2011 12:44,2.1,14138,United Kingdom
581377,22866,HAND WARMER SCOTTY DOG DESIGN,24,12/8/2011 12:44,2.1,14138,United Kingdom
581377,23439,HAND WARMER RED LOVE HEART,12,12/8/2011 12:44,2.1,14138,United Kingdom
581377,22632,HAND WARMER RED RETROSPOT,12,12/8/2011 12:44,2.1,14138,United Kingdom
581378,85150,LADIES & GENTLEMEN METAL SIGN,2,12/8/2011 12:50,2.55,17673,United Kingdom
581378,85152,HAND OVER THE CHOCOLATE   SIGN ,2,12/8/2011 12:50,2.1,17673,United Kingdom
581378,21164,HOME SWEET HOME METAL SIGN ,2,12/8/2011 12:50,2.95,17673,United Kingdom
581378,21172,PARTY METAL SIGN ,3,12/8/2011 12:50,1.45,17673,United Kingdom
581378,21162,TOXIC AREA  DOOR HANGER ,4,12/8/2011 12:50,0.39,17673,United Kingdom
581378,72122,COFFEE SCENT PILLAR CANDLE,3,12/8/2011 12:50,0.95,17673,United Kingdom
581378,17012C,ORIGAMI LAVENDER INCENSE/CANDL SET ,4,12/8/2011 12:50,0.85,17673,United Kingdom
581378,17012F,ORIGAMI SANDLEWOOD INCENSE/CAND SET,6,12/8/2011 12:50,0.85,17673,United Kingdom
581378,17012D,ORIGAMI ROSE INCENSE/CANDLE SET ,6,12/8/2011 12:50,0.85,17673,United Kingdom
581378,21790,VINTAGE SNAP CARDS,6,12/8/2011 12:50,0.85,17673,United Kingdom
581378,21791,VINTAGE HEADS AND TAILS CARD GAME ,4,12/8/2011 12:50,1.25,17673,United Kingdom
581378,23128,FELTCRAFT BOY JEAN-PAUL KIT,2,12/8/2011 12:50,4.95,17673,United Kingdom
581378,23126,FELTCRAFT GIRL AMELIE KIT,2,12/8/2011 12:50,4.95,17673,United Kingdom
581378,23127,FELTCRAFT GIRL NICOLE KIT,2,12/8/2011 12:50,4.95,17673,United Kingdom
581378,22439,6 ROCKET BALLOONS ,10,12/8/2011 12:50,0.65,17673,United Kingdom
581378,21328,BALLOONS  WRITING SET ,4,12/8/2011 12:50,1.65,17673,United Kingdom
581378,21329,DINOSAURS  WRITING SET ,2,12/8/2011 12:50,1.65,17673,United Kingdom
581378,21327,SKULLS WRITING SET ,2,12/8/2011 12:50,1.65,17673,United Kingdom
581378,22566,FELTCRAFT HAIRBAND PINK AND PURPLE,4,12/8/2011 12:50,0.85,17673,United Kingdom
581378,20974,12 PENCILS SMALL TUBE SKULL,3,12/8/2011 12:50,0.65,17673,United Kingdom
581378,21918,SET 12 KIDS COLOUR  CHALK STICKS,6,12/8/2011 12:50,0.42,17673,United Kingdom
581378,20979,36 PENCILS TUBE RED RETROSPOT,2,12/8/2011 12:50,1.25,17673,United Kingdom
581378,84692,BOX OF 24 COCKTAIL PARASOLS,12,12/8/2011 12:50,0.42,17673,United Kingdom
581379,21109,LARGE CAKE TOWEL CHOCOLATE SPOTS,12,12/8/2011 12:50,1.95,13954,United Kingdom
581379,21417,COCKLE SHELL DISH,12,12/8/2011 12:50,0.79,13954,United Kingdom
581379,22061,LARGE CAKE STAND  HANGING STRAWBERY,8,12/8/2011 12:50,2.95,13954,United Kingdom
581379,22221,CAKE STAND LOVEBIRD 2 TIER PINK,6,12/8/2011 12:50,2.95,13954,United Kingdom
581379,22476,EMPIRE UNION JACK TV DINNER TRAY,8,12/8/2011 12:50,1.95,13954,United Kingdom
581379,22596,CHRISTMAS STAR WISH LIST CHALKBOARD,12,12/8/2011 12:50,0.39,13954,United Kingdom
581379,22723,SET OF 6 HERB TINS SKETCHBOOK,12,12/8/2011 12:50,1.25,13954,United Kingdom
581379,23143,ZINC WIRE KITCHEN ORGANISER,4,12/8/2011 12:50,3.95,13954,United Kingdom
581379,23320,GIANT 50'S CHRISTMAS CRACKER,12,12/8/2011 12:50,1.25,13954,United Kingdom
581379,84707A,SILVER JEWELLED MIRROR TRINKET TRAY,12,12/8/2011 12:50,1.95,13954,United Kingdom
581379,23253,16 PIECE CUTLERY SET PANTRY DESIGN,2,12/8/2011 12:50,15.95,13954,United Kingdom
581379,22847,BREAD BIN DINER STYLE IVORY,1,12/8/2011 12:50,16.95,13954,United Kingdom
581380,23498,CLASSIC BICYCLE CLIPS ,12,12/8/2011 12:52,1.45,13102,United Kingdom
581380,23598,PAPER BUNTING VINTAGE PARTY,6,12/8/2011 12:52,2.95,13102,United Kingdom
581380,22466,FAIRY TALE COTTAGE NIGHT LIGHT,12,12/8/2011 12:52,1.95,13102,United Kingdom
581380,23313,VINTAGE CHRISTMAS BUNTING,5,12/8/2011 12:52,4.95,13102,United Kingdom
581380,22910,PAPER CHAIN KIT VINTAGE CHRISTMAS,12,12/8/2011 12:52,2.95,13102,United Kingdom
