579408,21832,CHOCOLATE CALCULATOR,1,11/29/2011 12:34,1.65,14701,United Kingdom
579408,22585,PACK OF 6 BIRDY GIFT TAGS,1,11/29/2011 12:34,1.25,14701,United Kingdom
579408,23201,JUMBO BAG ALPHABET,1,11/29/2011 12:34,2.08,14701,United Kingdom
579408,22812,PACK 3 BOXES CHRISTMAS PANETTONE,4,11/29/2011 12:34,1.95,14701,United Kingdom
579408,22992,REVOLVER WOODEN RULER ,3,11/29/2011 12:34,1.95,14701,United Kingdom
579408,23300,GARDENERS KNEELING PAD CUP OF TEA ,2,11/29/2011 12:34,1.65,14701,United Kingdom
579408,22197,POPCORN HOLDER,5,11/29/2011 12:34,0.85,14701,United Kingdom
579409,23531,WALL ART BIG LOVE ,1,11/29/2011 12:38,6.95,14701,United Kingdom
579410,21174,POTTERING IN THE SHED METAL SIGN,12,11/29/2011 12:45,2.08,16168,United Kingdom
579410,21868,POTTING SHED TEA MUG,12,11/29/2011 12:45,1.65,16168,United Kingdom
579410,21876,POTTERING MUG,12,11/29/2011 12:45,1.65,16168,United Kingdom
579411,23200,JUMBO BAG PEARS,1,11/29/2011 12:46,2.08,16794,United Kingdom
579411,22772,PINK DRAWER KNOB ACRYLIC EDWARDIAN,1,11/29/2011 12:46,1.25,16794,United Kingdom
579411,22773,GREEN DRAWER KNOB ACRYLIC EDWARDIAN,2,11/29/2011 12:46,1.25,16794,United Kingdom
579411,22457,NATURAL SLATE HEART CHALKBOARD ,2,11/29/2011 12:46,2.95,16794,United Kingdom
579411,22227,HANGING HEART MIRROR DECORATION ,27,11/29/2011 12:46,0.65,16794,United Kingdom
579411,23226,FILIGREE HEART DAISY WHITE,2,11/29/2011 12:46,1.25,16794,United Kingdom
579411,23227,FILIGREE HEART BUTTERFLY WHITE ,2,11/29/2011 12:46,1.25,16794,United Kingdom
579411,20725,LUNCH BAG RED RETROSPOT,7,11/29/2011 12:46,1.65,16794,United Kingdom
579411,23681,LUNCH BAG RED VINTAGE DOILY,2,11/29/2011 12:46,1.65,16794,United Kingdom
579411,22383,LUNCH BAG SUKI DESIGN ,4,11/29/2011 12:46,1.65,16794,United Kingdom
579411,22384,LUNCH BAG PINK POLKADOT,8,11/29/2011 12:46,1.65,16794,United Kingdom
579411,23209,LUNCH BAG VINTAGE DOILY ,4,11/29/2011 12:46,1.65,16794,United Kingdom
579411,23206,LUNCH BAG APPLE DESIGN,2,11/29/2011 12:46,1.65,16794,United Kingdom
579411,23583,LUNCH BAG PAISLEY PARK  ,11,11/29/2011 12:46,1.65,16794,United Kingdom
579411,22666,RECIPE BOX PANTRY YELLOW DESIGN,3,11/29/2011 12:46,2.95,16794,United Kingdom
579411,23198,PANTRY MAGNETIC  SHOPPING LIST,2,11/29/2011 12:46,1.45,16794,United Kingdom
579411,21218,RED SPOTTY BISCUIT TIN,2,11/29/2011 12:46,3.75,16794,United Kingdom
579411,82552,WASHROOM METAL SIGN,3,11/29/2011 12:46,1.45,16794,United Kingdom
579411,22720,SET OF 3 CAKE TINS PANTRY DESIGN ,1,11/29/2011 12:46,4.95,16794,United Kingdom
579411,22993,SET OF 4 PANTRY JELLY MOULDS,3,11/29/2011 12:46,1.25,16794,United Kingdom
579411,23243,SET OF TEA COFFEE SUGAR TINS PANTRY,2,11/29/2011 12:46,4.95,16794,United Kingdom
579411,21216,"SET 3 RETROSPOT TEA,COFFEE,SUGAR",2,11/29/2011 12:46,4.95,16794,United Kingdom
579411,22723,SET OF 6 HERB TINS SKETCHBOOK,3,11/29/2011 12:46,3.95,16794,United Kingdom
579412,23552,BICYCLE PUNCTURE REPAIR KIT ,6,11/29/2011 12:47,2.08,14125,United Kingdom
579412,23084,RABBIT NIGHT LIGHT,6,11/29/2011 12:47,2.08,14125,United Kingdom
579412,22150,3 STRIPEY MICE FELTCRAFT,6,11/29/2011 12:47,1.95,14125,United Kingdom
579412,23126,FELTCRAFT GIRL AMELIE KIT,4,11/29/2011 12:47,4.95,14125,United Kingdom
579412,72800E,4 IVORY DINNER CANDLES SILVER FLOCK,6,11/29/2011 12:47,2.55,14125,United Kingdom
579412,22835,HOT WATER BOTTLE I AM SO POORLY,4,11/29/2011 12:47,4.95,14125,United Kingdom
579412,22725,ALARM CLOCK BAKELIKE CHOCOLATE,4,11/29/2011 12:47,3.75,14125,United Kingdom
579412,22726,ALARM CLOCK BAKELIKE GREEN,4,11/29/2011 12:47,3.75,14125,United Kingdom
579412,22727,ALARM CLOCK BAKELIKE RED ,4,11/29/2011 12:47,3.75,14125,United Kingdom
579412,22730,ALARM CLOCK BAKELIKE IVORY,4,11/29/2011 12:47,3.75,14125,United Kingdom
579412,22192,BLUE DINER WALL CLOCK,2,11/29/2011 12:47,8.5,14125,United Kingdom
579412,23429,RED RETRO KITCHEN WALL CLOCK,2,11/29/2011 12:47,8.15,14125,United Kingdom
579412,10135,COLOURING PENCILS BROWN TUBE,10,11/29/2011 12:47,1.25,14125,United Kingdom
579412,22489,PACK OF 12 TRADITIONAL CRAYONS,24,11/29/2011 12:47,0.42,14125,United Kingdom
579412,22374,AIRLINE BAG VINTAGE JET SET RED,8,11/29/2011 12:47,4.25,14125,United Kingdom
579412,22372,AIRLINE BAG VINTAGE WORLD CHAMPION ,4,11/29/2011 12:47,4.25,14125,United Kingdom
579412,22028,PENNY FARTHING BIRTHDAY CARD,12,11/29/2011 12:47,0.42,14125,United Kingdom
579412,21506,"FANCY FONT BIRTHDAY CARD, ",12,11/29/2011 12:47,0.42,14125,United Kingdom
579412,85015,SET OF 12  VINTAGE POSTCARD SET,24,11/29/2011 12:47,0.65,14125,United Kingdom
579412,22771,CLEAR DRAWER KNOB ACRYLIC EDWARDIAN,12,11/29/2011 12:47,1.25,14125,United Kingdom
579412,23029,DRAWER KNOB CRACKLE GLAZE GREEN,6,11/29/2011 12:47,1.65,14125,United Kingdom
579412,23031,DRAWER KNOB CRACKLE GLAZE PINK,6,11/29/2011 12:47,1.65,14125,United Kingdom
579412,21990,MODERN FLORAL STATIONERY SET,12,11/29/2011 12:47,1.25,14125,United Kingdom
579413,23406,HOME SWEET HOME KEY HOLDER,2,11/29/2011 12:50,6.25,13668,United Kingdom
579413,22573,STAR WOODEN CHRISTMAS DECORATION,6,11/29/2011 12:50,0.85,13668,United Kingdom
579413,22578,WOODEN STAR CHRISTMAS SCANDINAVIAN,10,11/29/2011 12:50,0.29,13668,United Kingdom
579413,22577,WOODEN HEART CHRISTMAS SCANDINAVIAN,10,11/29/2011 12:50,0.29,13668,United Kingdom
579413,22574,HEART WOODEN CHRISTMAS DECORATION,6,11/29/2011 12:50,0.85,13668,United Kingdom
579413,23490,T-LIGHT HOLDER HANGING LOVE BIRD,1,11/29/2011 12:50,3.75,13668,United Kingdom
579413,23213,STAR WREATH DECORATION WITH BELL,6,11/29/2011 12:50,1.25,13668,United Kingdom
579413,23212,HEART WREATH DECORATION WITH BELL,6,11/29/2011 12:50,1.25,13668,United Kingdom
579413,23210,WHITE ROCKING HORSE HAND PAINTED,10,11/29/2011 12:50,1.25,13668,United Kingdom
579413,21181,PLEASE ONE PERSON METAL SIGN,8,11/29/2011 12:50,2.1,13668,United Kingdom
579413,23404,HOME SWEET HOME BLACKBOARD,2,11/29/2011 12:50,4.95,13668,United Kingdom
579413,23403,LETTER HOLDER HOME SWEET HOME,2,11/29/2011 12:50,3.75,13668,United Kingdom
579413,22178,VICTORIAN GLASS HANGING T-LIGHT,12,11/29/2011 12:50,1.95,13668,United Kingdom
579413,23132,SMALL IVORY HEART WALL ORGANISER,2,11/29/2011 12:50,5.75,13668,United Kingdom
579413,23486,ANTIQUE HEART SHELF UNIT,1,11/29/2011 12:50,16.65,13668,United Kingdom
579413,82483,WOOD 2 DRAWER CABINET WHITE FINISH,2,11/29/2011 12:50,6.95,13668,United Kingdom
579413,23400,SHELF WITH 4 HOOKS HOME SWEET HOME,4,11/29/2011 12:50,6.25,13668,United Kingdom
579413,22297,HEART IVORY TRELLIS SMALL,10,11/29/2011 12:50,1.25,13668,United Kingdom
579413,23152,IVORY SWEETHEART WIRE LETTER RACK ,2,11/29/2011 12:50,3.75,13668,United Kingdom
