537224,22866,HAND WARMER SCOTTY DOG DESIGN,4,12/5/2010 16:24,2.1,13174,United Kingdom
537224,70006,LOVE HEART POCKET WARMER,1,12/5/2010 16:24,1.65,13174,United Kingdom
537224,20829,GLITTER HANGING BUTTERFLY STRING,3,12/5/2010 16:24,2.1,13174,United Kingdom
537224,21191,LARGE WHITE HONEYCOMB PAPER BELL  ,3,12/5/2010 16:24,2.1,13174,United Kingdom
537224,21192,WHITE BELL HONEYCOMB PAPER ,5,12/5/2010 16:24,1.65,13174,United Kingdom
537224,21187,WHITE BELL HONEYCOMB PAPER GARLAND ,11,12/5/2010 16:24,1.65,13174,United Kingdom
537224,21202,DOLLY HONEYCOMB GARLAND,1,12/5/2010 16:24,1.65,13174,United Kingdom
537224,84531A,PINK KNITTED EGG COSY,1,12/5/2010 16:24,1.95,13174,United Kingdom
537224,22087,PAPER BUNTING WHITE LACE,1,12/5/2010 16:24,2.95,13174,United Kingdom
537224,21484,CHICK GREY HOT WATER BOTTLE,2,12/5/2010 16:24,3.45,13174,United Kingdom
537224,22113,GREY HEART HOT WATER BOTTLE,1,12/5/2010 16:24,3.75,13174,United Kingdom
537224,21481,FAWN BLUE HOT WATER BOTTLE,2,12/5/2010 16:24,2.95,13174,United Kingdom
537224,70007,HI TEC ALPINE HAND WARMER,1,12/5/2010 16:24,1.65,13174,United Kingdom
537224,22086,PAPER CHAIN KIT 50'S CHRISTMAS ,1,12/5/2010 16:24,2.95,13174,United Kingdom
537224,22141,CHRISTMAS CRAFT TREE TOP ANGEL,1,12/5/2010 16:24,2.1,13174,United Kingdom
537224,84406B,CREAM CUPID HEARTS COAT HANGER,2,12/5/2010 16:24,3.25,13174,United Kingdom
537224,84792,ENCHANTED BIRD COATHANGER 5 HOOK,2,12/5/2010 16:24,4.65,13174,United Kingdom
537224,21911,GARDEN METAL SIGN ,3,12/5/2010 16:24,1.65,13174,United Kingdom
537224,82551,LAUNDRY 15C METAL SIGN,3,12/5/2010 16:24,1.45,13174,United Kingdom
537224,82552,WASHROOM METAL SIGN,1,12/5/2010 16:24,1.45,13174,United Kingdom
537224,84531B,BLUE KNITTED EGG COSY,1,12/5/2010 16:24,1.95,13174,United Kingdom
537224,84531A,PINK KNITTED EGG COSY,2,12/5/2010 16:24,1.95,13174,United Kingdom
537224,21910,WAY OUT METAL SIGN ,1,12/5/2010 16:24,1.65,13174,United Kingdom
537224,21192,WHITE BELL HONEYCOMB PAPER ,3,12/5/2010 16:24,1.65,13174,United Kingdom
537224,70007,HI TEC ALPINE HAND WARMER,1,12/5/2010 16:24,1.65,13174,United Kingdom
537224,70006,LOVE HEART POCKET WARMER,2,12/5/2010 16:24,1.65,13174,United Kingdom
537224,22632,HAND WARMER RED RETROSPOT,1,12/5/2010 16:24,2.1,13174,United Kingdom
537224,22087,PAPER BUNTING WHITE LACE,3,12/5/2010 16:24,2.95,13174,United Kingdom
537224,22111,SCOTTIE DOG HOT WATER BOTTLE,3,12/5/2010 16:24,4.95,13174,United Kingdom
537224,22110,BIRD HOUSE HOT WATER BOTTLE,3,12/5/2010 16:24,2.55,13174,United Kingdom
537224,21484,CHICK GREY HOT WATER BOTTLE,1,12/5/2010 16:24,3.45,13174,United Kingdom
537224,22113,GREY HEART HOT WATER BOTTLE,2,12/5/2010 16:24,3.75,13174,United Kingdom
537224,21485,RETROSPOT HEART HOT WATER BOTTLE,3,12/5/2010 16:24,4.95,13174,United Kingdom
537224,84029E,RED WOOLLY HOTTIE WHITE HEART.,1,12/5/2010 16:24,3.75,13174,United Kingdom
537224,22670,FRENCH WC SIGN BLUE METAL,1,12/5/2010 16:24,1.25,13174,United Kingdom
537224,21187,WHITE BELL HONEYCOMB PAPER GARLAND ,2,12/5/2010 16:24,1.65,13174,United Kingdom
537224,22087,PAPER BUNTING WHITE LACE,2,12/5/2010 16:24,2.95,13174,United Kingdom
537224,84029E,RED WOOLLY HOTTIE WHITE HEART.,3,12/5/2010 16:24,3.75,13174,United Kingdom
537224,22670,FRENCH WC SIGN BLUE METAL,2,12/5/2010 16:24,1.25,13174,United Kingdom
537224,22672,FRENCH BATHROOM SIGN BLUE METAL,2,12/5/2010 16:24,1.65,13174,United Kingdom
537224,22674,FRENCH TOILET SIGN BLUE METAL,3,12/5/2010 16:24,1.25,13174,United Kingdom
537224,22632,HAND WARMER RED RETROSPOT,6,12/5/2010 16:24,2.1,13174,United Kingdom
537224,22867,HAND WARMER BIRD DESIGN,6,12/5/2010 16:24,2.1,13174,United Kingdom
537224,70007,HI TEC ALPINE HAND WARMER,1,12/5/2010 16:24,1.65,13174,United Kingdom
537224,22461,SAVOY ART DECO CLOCK,2,12/5/2010 16:24,12.75,13174,United Kingdom
537224,22833,HALL CABINET WITH 3 DRAWERS,1,12/5/2010 16:24,49.95,13174,United Kingdom
537224,20685,DOORMAT RED RETROSPOT,1,12/5/2010 16:24,7.95,13174,United Kingdom
537224,48194,DOORMAT HEARTS,1,12/5/2010 16:24,7.95,13174,United Kingdom
537224,48187,DOORMAT NEW ENGLAND,1,12/5/2010 16:24,7.95,13174,United Kingdom
537224,22690,DOORMAT HOME SWEET HOME BLUE ,1,12/5/2010 16:24,7.95,13174,United Kingdom
537224,22768,FAMILY PHOTO FRAME CORNICE,2,12/5/2010 16:24,9.95,13174,United Kingdom
537224,22637,PIGGY BANK RETROSPOT ,4,12/5/2010 16:24,2.55,13174,United Kingdom
537224,22406,MONEY BOX KINGS CHOICE DESIGN,6,12/5/2010 16:24,1.25,13174,United Kingdom
537224,84881,BLUE WIRE SPIRAL CANDLE HOLDER,2,12/5/2010 16:24,6.35,13174,United Kingdom
537224,22830,UTILTY CABINET WITH HOOKS,1,12/5/2010 16:24,26.95,13174,United Kingdom
537224,22188,BLACK HEART CARD HOLDER,4,12/5/2010 16:24,3.95,13174,United Kingdom
537224,84846A,SCENTED CANDLE IN DIGITALIS TIN,4,12/5/2010 16:24,2.1,13174,United Kingdom
537224,84978,HANGING HEART JAR T-LIGHT HOLDER,6,12/5/2010 16:24,1.25,13174,United Kingdom
537224,21363,HOME SMALL WOOD LETTERS,1,12/5/2010 16:24,4.95,13174,United Kingdom
537224,21613,S/12 VANILLA  BOTANICAL T-LIGHTS,4,12/5/2010 16:24,2.95,13174,United Kingdom
537224,21609,SET 12 LAVENDER  BOTANICAL T-LIGHTS,4,12/5/2010 16:24,2.95,13174,United Kingdom
537224,21891,TRADITIONAL WOODEN SKIPPING ROPE,4,12/5/2010 16:24,1.25,13174,United Kingdom
537224,21688,SILVER PLATE CANDLE BOWL SMALL,6,12/5/2010 16:24,2.95,13174,United Kingdom
537224,22405,MONEY BOX POCKET MONEY DESIGN,6,12/5/2010 16:24,1.25,13174,United Kingdom
537224,22766,PHOTO FRAME CORNICE,4,12/5/2010 16:24,2.95,13174,United Kingdom
537224,21695,SMALL SILVER FLOWER CANDLE POT,6,12/5/2010 16:24,2.95,13174,United Kingdom
537224,21693,SMALL HAMMERED SILVER CANDLEPOT ,6,12/5/2010 16:24,2.95,13174,United Kingdom
537224,21889,WOODEN BOX OF DOMINOES,4,12/5/2010 16:24,1.25,13174,United Kingdom
537224,22767,TRIPLE PHOTO FRAME CORNICE ,2,12/5/2010 16:24,9.95,13174,United Kingdom
537224,21361,LOVE LARGE WOOD LETTERS ,1,12/5/2010 16:24,12.75,13174,United Kingdom
537224,22622,BOX OF VINTAGE ALPHABET BLOCKS,2,12/5/2010 16:24,9.95,13174,United Kingdom
537224,22623,BOX OF VINTAGE JIGSAW BLOCKS ,2,12/5/2010 16:24,4.95,13174,United Kingdom
537224,21363,HOME SMALL WOOD LETTERS,2,12/5/2010 16:24,4.95,13174,United Kingdom
537224,21556,CERAMIC STRAWBERRY MONEY BOX,2,12/5/2010 16:24,2.55,13174,United Kingdom
