537160,20878,SET/9 CHRISTMAS T-LIGHTS SCENTED ,4,12/5/2010 13:18,1.25,14161,United Kingdom
537160,84406B,CREAM CUPID HEARTS COAT HANGER,3,12/5/2010 13:18,3.25,14161,United Kingdom
537160,22158,3 HEARTS HANGING DECORATION RUSTIC,6,12/5/2010 13:18,2.95,14161,United Kingdom
537160,22752,SET 7 BABUSHKA NESTING BOXES,2,12/5/2010 13:18,8.5,14161,United Kingdom
537160,22694,WICKER STAR ,3,12/5/2010 13:18,2.1,14161,United Kingdom
537160,22086,PAPER CHAIN KIT 50'S CHRISTMAS ,3,12/5/2010 13:18,2.95,14161,United Kingdom
537160,22865,HAND WARMER OWL DESIGN,1,12/5/2010 13:18,2.1,14161,United Kingdom
537160,22866,HAND WARMER SCOTTY DOG DESIGN,4,12/5/2010 13:18,2.1,14161,United Kingdom
537160,22633,HAND WARMER UNION JACK,7,12/5/2010 13:18,2.1,14161,United Kingdom
537160,22470,HEART OF WICKER LARGE,10,12/5/2010 13:18,2.95,14161,United Kingdom
537160,20977,36 PENCILS TUBE WOODLAND,4,12/5/2010 13:18,1.25,14161,United Kingdom
537160,22553,PLASTERS IN TIN SKULLS,4,12/5/2010 13:18,1.65,14161,United Kingdom
537160,22557,PLASTERS IN TIN VINTAGE PAISLEY ,2,12/5/2010 13:18,1.65,14161,United Kingdom
537160,22748,POPPY'S PLAYHOUSE KITCHEN,1,12/5/2010 13:18,2.1,14161,United Kingdom
537160,22745,POPPY'S PLAYHOUSE BEDROOM ,1,12/5/2010 13:18,2.1,14161,United Kingdom
537160,21870,I CAN ONLY PLEASE ONE PERSON MUG,12,12/5/2010 13:18,1.25,14161,United Kingdom
537160,21868,POTTING SHED TEA MUG,6,12/5/2010 13:18,1.25,14161,United Kingdom
537160,22187,GREEN CHRISTMAS TREE CARD HOLDER,4,12/5/2010 13:18,4.25,14161,United Kingdom
537163,22738,RIBBON REEL SNOWY VILLAGE,10,12/5/2010 13:21,1.65,17863,United Kingdom
537163,22551,PLASTERS IN TIN SPACEBOY,12,12/5/2010 13:21,1.65,17863,United Kingdom
537163,22557,PLASTERS IN TIN VINTAGE PAISLEY ,12,12/5/2010 13:21,1.65,17863,United Kingdom
537163,22659,LUNCH BOX I LOVE LONDON,12,12/5/2010 13:21,1.95,17863,United Kingdom
537163,22435,SET OF 9 HEART SHAPED BALLOONS,24,12/5/2010 13:21,1.25,17863,United Kingdom
537163,22466,FAIRY TALE COTTAGE NIGHTLIGHT,24,12/5/2010 13:21,1.95,17863,United Kingdom
537163,21731,RED TOADSTOOL LED NIGHT LIGHT,24,12/5/2010 13:21,1.65,17863,United Kingdom
537163,21094,SET/6 RED SPOTTY PAPER PLATES,12,12/5/2010 13:21,0.85,17863,United Kingdom
537163,21086,SET/6 RED SPOTTY PAPER CUPS,12,12/5/2010 13:21,0.65,17863,United Kingdom
537163,21914,BLUE HARMONICA IN BOX ,12,12/5/2010 13:21,1.25,17863,United Kingdom
537163,22027,TEA PARTY BIRTHDAY CARD,12,12/5/2010 13:21,0.42,17863,United Kingdom
537163,22712,CARD DOLLY GIRL ,12,12/5/2010 13:21,0.42,17863,United Kingdom
537163,22714,CARD BIRTHDAY COWBOY,12,12/5/2010 13:21,0.42,17863,United Kingdom
537163,21577,SAVE THE PLANET COTTON TOTE BAG,12,12/5/2010 13:21,2.25,17863,United Kingdom
537163,21580,RABBIT  DESIGN  COTTON TOTE BAG,6,12/5/2010 13:21,2.25,17863,United Kingdom
537163,22331,WOODLAND PARTY BAG + STICKER SET,8,12/5/2010 13:21,1.65,17863,United Kingdom
537163,22334,DINOSAUR PARTY BAG + STICKER SET,8,12/5/2010 13:21,1.65,17863,United Kingdom
537163,22801,ANTIQUE GLASS PEDESTAL BOWL,8,12/5/2010 13:21,3.75,17863,United Kingdom
537163,21429,RED GINGHAM ROSE JEWELLERY BOX,8,12/5/2010 13:21,1.65,17863,United Kingdom
537163,85199L,LARGE HANGING IVORY & RED WOOD BIRD,24,12/5/2010 13:21,0.65,17863,United Kingdom
537163,22791,T-LIGHT GLASS FLUTED ANTIQUE,12,12/5/2010 13:21,1.25,17863,United Kingdom
C537164,D,Discount,-1,12/5/2010 13:21,29.29,14527,United Kingdom
537176,22556,PLASTERS IN TIN CIRCUS PARADE ,2,12/5/2010 13:26,1.65,16411,United Kingdom
537176,22553,PLASTERS IN TIN SKULLS,4,12/5/2010 13:26,1.65,16411,United Kingdom
537176,21915,RED  HARMONICA IN BOX ,1,12/5/2010 13:26,1.25,16411,United Kingdom
537176,22231,JIGSAW TREE WITH BIRDHOUSE,1,12/5/2010 13:26,1.45,16411,United Kingdom
537176,21484,CHICK GREY HOT WATER BOTTLE,1,12/5/2010 13:26,3.45,16411,United Kingdom
537176,22910,PAPER CHAIN KIT VINTAGE CHRISTMAS,1,12/5/2010 13:26,2.95,16411,United Kingdom
537176,21657,MILK BOTTLE WITH GLASS STOPPER ,3,12/5/2010 13:26,6.95,16411,United Kingdom
537176,22312,OFFICE MUG WARMER POLKADOT,1,12/5/2010 13:26,2.95,16411,United Kingdom
537176,21156,RETROSPOT CHILDRENS APRON,3,12/5/2010 13:26,1.95,16411,United Kingdom
537176,22367,CHILDRENS APRON SPACEBOY DESIGN,3,12/5/2010 13:26,1.95,16411,United Kingdom
537176,21212,PACK OF 72 RETROSPOT CAKE CASES,3,12/5/2010 13:26,0.55,16411,United Kingdom
537176,22417,PACK OF 60 SPACEBOY CAKE CASES,3,12/5/2010 13:26,0.55,16411,United Kingdom
537176,22312,OFFICE MUG WARMER POLKADOT,1,12/5/2010 13:26,2.95,16411,United Kingdom
537176,84946,ANTIQUE SILVER TEA GLASS ETCHED,12,12/5/2010 13:26,1.25,16411,United Kingdom
537176,22557,PLASTERS IN TIN VINTAGE PAISLEY ,3,12/5/2010 13:26,1.65,16411,United Kingdom
537176,22555,PLASTERS IN TIN STRONGMAN,6,12/5/2010 13:26,1.65,16411,United Kingdom
537176,22556,PLASTERS IN TIN CIRCUS PARADE ,3,12/5/2010 13:26,1.65,16411,United Kingdom
537176,22551,PLASTERS IN TIN SPACEBOY,3,12/5/2010 13:26,1.65,16411,United Kingdom
537176,22792,FLUTED ANTIQUE CANDLE HOLDER,12,12/5/2010 13:26,0.85,16411,United Kingdom
537176,22697,GREEN REGENCY TEACUP AND SAUCER,1,12/5/2010 13:26,2.95,16411,United Kingdom
537176,21754,HOME BUILDING BLOCK WORD,3,12/5/2010 13:26,5.95,16411,United Kingdom
537179,22111,SCOTTIE DOG HOT WATER BOTTLE,18,12/5/2010 13:29,4.95,13767,United Kingdom
537179,21481,FAWN BLUE HOT WATER BOTTLE,24,12/5/2010 13:29,2.95,13767,United Kingdom
537179,84879,ASSORTED COLOUR BIRD ORNAMENT,32,12/5/2010 13:29,1.69,13767,United Kingdom
537179,21314,SMALL GLASS HEART TRINKET POT,16,12/5/2010 13:29,2.1,13767,United Kingdom
537179,22730,ALARM CLOCK BAKELIKE IVORY,12,12/5/2010 13:29,3.75,13767,United Kingdom
537179,22727,ALARM CLOCK BAKELIKE RED ,12,12/5/2010 13:29,3.75,13767,United Kingdom
537179,22729,ALARM CLOCK BAKELIKE ORANGE,12,12/5/2010 13:29,3.75,13767,United Kingdom
537179,22726,ALARM CLOCK BAKELIKE GREEN,12,12/5/2010 13:29,3.75,13767,United Kingdom
537179,21523,DOORMAT FANCY FONT HOME SWEET HOME,10,12/5/2010 13:29,7.95,13767,United Kingdom
537179,22699,ROSES REGENCY TEACUP AND SAUCER ,8,12/5/2010 13:29,2.95,13767,United Kingdom
537179,22697,GREEN REGENCY TEACUP AND SAUCER,8,12/5/2010 13:29,2.95,13767,United Kingdom
537179,22867,HAND WARMER BIRD DESIGN,48,12/5/2010 13:29,2.1,13767,United Kingdom
537179,22866,HAND WARMER SCOTTY DOG DESIGN,72,12/5/2010 13:29,2.1,13767,United Kingdom
537192,22859,EASTER TIN BUNNY BOUQUET,2,12/5/2010 13:42,1.65,16402,United Kingdom
537192,22860,EASTER TIN CHICKS PINK DAISY,2,12/5/2010 13:42,1.65,16402,United Kingdom
537192,21623,VINTAGE UNION JACK MEMOBOARD,1,12/5/2010 13:42,9.95,16402,United Kingdom
537192,21380,WOODEN HAPPY BIRTHDAY GARLAND,1,12/5/2010 13:42,2.95,16402,United Kingdom
537192,21107,CREAM SLICE FLANNEL PINK SPOT ,1,12/5/2010 13:42,2.95,16402,United Kingdom
537192,21106,CREAM SLICE FLANNEL CHOCOLATE SPOT ,2,12/5/2010 13:42,2.95,16402,United Kingdom
537192,22499,WOODEN UNION JACK BUNTING,1,12/5/2010 13:42,5.95,16402,United Kingdom
537192,21147,JINGLE BELLS TREE DECORATION,1,12/5/2010 13:42,2.1,16402,United Kingdom
537192,22487,WHITE WOOD GARDEN PLANT LADDER,1,12/5/2010 13:42,9.95,16402,United Kingdom
537192,22638,SET OF 4 NAPKIN CHARMS CROWNS ,1,12/5/2010 13:42,2.55,16402,United Kingdom
537192,22093,MOTORING TISSUE BOX,1,12/5/2010 13:42,1.25,16402,United Kingdom
537192,22091,EMPIRE TISSUE BOX,1,12/5/2010 13:42,1.25,16402,United Kingdom
537192,21878,PACK OF 6 SANDCASTLE FLAGS ASSORTED,1,12/5/2010 13:42,0.85,16402,United Kingdom
537192,22639,SET OF 4 NAPKIN CHARMS HEARTS,1,12/5/2010 13:42,2.55,16402,United Kingdom
537192,22065,CHRISTMAS PUDDING TRINKET POT ,2,12/5/2010 13:42,1.45,16402,United Kingdom
537192,21580,RABBIT  DESIGN  COTTON TOTE BAG,1,12/5/2010 13:42,2.25,16402,United Kingdom
537192,22097,SWALLOW SQUARE TISSUE BOX,1,12/5/2010 13:42,1.25,16402,United Kingdom
537192,22386,JUMBO BAG PINK POLKADOT,1,12/5/2010 13:42,1.95,16402,United Kingdom
537192,22087,PAPER BUNTING WHITE LACE,1,12/5/2010 13:42,2.95,16402,United Kingdom
537192,22813,PACK 3 BOXES BIRD PANNETONE ,1,12/5/2010 13:42,1.95,16402,United Kingdom
537192,22585,PACK OF 6 BIRDY GIFT TAGS,1,12/5/2010 13:42,1.25,16402,United Kingdom
537192,22907,PACK OF 20 NAPKINS PANTRY DESIGN,1,12/5/2010 13:42,0.85,16402,United Kingdom
537192,22560,TRADITIONAL MODELLING CLAY,2,12/5/2010 13:42,1.25,16402,United Kingdom
537192,22564,ALPHABET STENCIL CRAFT,1,12/5/2010 13:42,1.25,16402,United Kingdom
537192,22563,HAPPY STENCIL CRAFT,1,12/5/2010 13:42,1.25,16402,United Kingdom
537192,85174,S/4 CACTI CANDLES,1,12/5/2010 13:42,4.95,16402,United Kingdom
537192,22098,BOUDOIR SQUARE TISSUE BOX,2,12/5/2010 13:42,1.25,16402,United Kingdom
537192,22084,PAPER CHAIN KIT EMPIRE,1,12/5/2010 13:42,2.95,16402,United Kingdom
537192,21864,UNION JACK FLAG PASSPORT COVER ,1,12/5/2010 13:42,2.1,16402,United Kingdom
537192,21865,PINK UNION JACK  PASSPORT COVER ,1,12/5/2010 13:42,2.1,16402,United Kingdom
537192,20748,KENSINGTON COFFEE SET,1,12/5/2010 13:42,12.75,16402,United Kingdom
537192,22099,CARAVAN SQUARE TISSUE BOX,1,12/5/2010 13:42,1.25,16402,United Kingdom
537192,85208,SET/12 FUNKY FELT FLOWER PEG IN BAG,1,12/5/2010 13:42,2.1,16402,United Kingdom
537192,22956,36 FOIL HEART CAKE CASES,2,12/5/2010 13:42,2.1,16402,United Kingdom
537192,21106,CREAM SLICE FLANNEL CHOCOLATE SPOT ,1,12/5/2010 13:42,2.95,16402,United Kingdom
537192,21107,CREAM SLICE FLANNEL PINK SPOT ,1,12/5/2010 13:42,2.95,16402,United Kingdom
537192,22666,RECIPE BOX PANTRY YELLOW DESIGN,1,12/5/2010 13:42,2.95,16402,United Kingdom
537192,21114,LAVENDER SCENTED FABRIC HEART,5,12/5/2010 13:42,1.25,16402,United Kingdom
537192,22129,PARTY CONES CANDY TREE DECORATION,6,12/5/2010 13:42,0.85,16402,United Kingdom
537192,22128,PARTY CONES CANDY ASSORTED,6,12/5/2010 13:42,1.25,16402,United Kingdom
537192,22585,PACK OF 6 BIRDY GIFT TAGS,1,12/5/2010 13:42,1.25,16402,United Kingdom
537192,22633,HAND WARMER UNION JACK,2,12/5/2010 13:42,2.1,16402,United Kingdom
537192,22865,HAND WARMER OWL DESIGN,1,12/5/2010 13:42,2.1,16402,United Kingdom
537192,22867,HAND WARMER BIRD DESIGN,2,12/5/2010 13:42,2.1,16402,United Kingdom
537192,22808,SET OF 6 T-LIGHTS EASTER CHICKS,1,12/5/2010 13:42,2.95,16402,United Kingdom
537192,21109,"LARGE CAKE TOWEL, CHOCOLATE SPOTS",1,12/5/2010 13:42,6.75,16402,United Kingdom
537192,20702,PINK PADDED MOBILE,1,12/5/2010 13:42,4.25,16402,United Kingdom
537192,22094,RED RETROSPOT TISSUE BOX,2,12/5/2010 13:42,1.25,16402,United Kingdom
537192,85187,S/12 MINI RABBIT EASTER,1,12/5/2010 13:42,1.65,16402,United Kingdom
537192,22667,RECIPE BOX RETROSPOT ,1,12/5/2010 13:42,2.95,16402,United Kingdom
537192,22807,SET OF 6 T-LIGHTS TOADSTOOLS,1,12/5/2010 13:42,2.95,16402,United Kingdom
537192,22358,KINGS CHOICE TEA CADDY ,1,12/5/2010 13:42,2.95,16402,United Kingdom
537192,22386,JUMBO BAG PINK POLKADOT,1,12/5/2010 13:42,1.95,16402,United Kingdom
537192,22962,JAM JAR WITH PINK LID,6,12/5/2010 13:42,0.85,16402,United Kingdom
537192,22963,JAM JAR WITH GREEN LID,6,12/5/2010 13:42,0.85,16402,United Kingdom
537192,22969,HOMEMADE JAM SCENTED CANDLES,12,12/5/2010 13:42,1.45,16402,United Kingdom
537192,22961,JAM MAKING SET PRINTED,4,12/5/2010 13:42,1.45,16402,United Kingdom
537193,22890,NOVELTY BISCUITS CAKE STAND 3 TIER,1,12/5/2010 13:49,9.95,15023,United Kingdom
537193,21900,"KEY FOB , SHED",20,12/5/2010 13:49,0.65,15023,United Kingdom
537193,22890,NOVELTY BISCUITS CAKE STAND 3 TIER,1,12/5/2010 13:49,9.95,15023,United Kingdom
537193,21899,"KEY FOB , GARAGE DESIGN",12,12/5/2010 13:49,0.65,15023,United Kingdom
537193,22470,HEART OF WICKER LARGE,12,12/5/2010 13:49,2.95,15023,United Kingdom
537193,22719,GUMBALL MONOCHROME COAT RACK,1,12/5/2010 13:49,1.25,15023,United Kingdom
537193,84406B,CREAM CUPID HEARTS COAT HANGER,2,12/5/2010 13:49,3.25,15023,United Kingdom
537193,22588,CARD HOLDER GINGHAM HEART,11,12/5/2010 13:49,2.55,15023,United Kingdom
537193,22694,WICKER STAR ,12,12/5/2010 13:49,2.1,15023,United Kingdom
537193,22914,BLUE COAT RACK PARIS FASHION,1,12/5/2010 13:49,4.95,15023,United Kingdom
537193,22913,RED COAT RACK PARIS FASHION,1,12/5/2010 13:49,4.95,15023,United Kingdom
537193,22912,YELLOW COAT RACK PARIS FASHION,1,12/5/2010 13:49,4.95,15023,United Kingdom
537193,22862,LOVE HEART NAPKIN BOX ,4,12/5/2010 13:49,4.25,15023,United Kingdom
537193,22891,TEA FOR ONE POLKADOT,1,12/5/2010 13:49,4.25,15023,United Kingdom
537193,22862,LOVE HEART NAPKIN BOX ,4,12/5/2010 13:49,4.25,15023,United Kingdom
537193,22112,CHOCOLATE HOT WATER BOTTLE,4,12/5/2010 13:49,4.95,15023,United Kingdom
537193,22579,WOODEN TREE CHRISTMAS SCANDINAVIAN,12,12/5/2010 13:49,0.85,15023,United Kingdom
537193,22581,WOOD STOCKING CHRISTMAS SCANDISPOT,12,12/5/2010 13:49,0.85,15023,United Kingdom
537193,22659,LUNCH BOX I LOVE LONDON,2,12/5/2010 13:49,1.95,15023,United Kingdom
537193,22578,WOODEN STAR CHRISTMAS SCANDINAVIAN,11,12/5/2010 13:49,0.85,15023,United Kingdom
537193,21824,PAINTED METAL STAR WITH HOLLY BELLS,3,12/5/2010 13:49,1.45,15023,United Kingdom
537193,22576,SWALLOW WOODEN CHRISTMAS DECORATION,11,12/5/2010 13:49,0.85,15023,United Kingdom
537193,22571,ROCKING HORSE RED CHRISTMAS ,3,12/5/2010 13:49,0.85,15023,United Kingdom
537193,22574,HEART WOODEN CHRISTMAS DECORATION,24,12/5/2010 13:49,0.85,15023,United Kingdom
537193,22577,WOODEN HEART CHRISTMAS SCANDINAVIAN,24,12/5/2010 13:49,0.85,15023,United Kingdom
537193,22909,SET OF 20 VINTAGE CHRISTMAS NAPKINS,2,12/5/2010 13:49,0.85,15023,United Kingdom
537193,22866,HAND WARMER SCOTTY DOG DESIGN,4,12/5/2010 13:49,2.1,15023,United Kingdom
537193,22111,SCOTTIE DOG HOT WATER BOTTLE,4,12/5/2010 13:49,4.95,15023,United Kingdom
537193,22112,CHOCOLATE HOT WATER BOTTLE,2,12/5/2010 13:49,4.95,15023,United Kingdom
537193,21683,MEDIUM MEDINA STAMPED METAL BOWL ,1,12/5/2010 13:49,2.95,15023,United Kingdom
537193,22457,NATURAL SLATE HEART CHALKBOARD ,12,12/5/2010 13:49,2.95,15023,United Kingdom
537193,22891,TEA FOR ONE POLKADOT,1,12/5/2010 13:49,4.25,15023,United Kingdom
537193,84406B,CREAM CUPID HEARTS COAT HANGER,1,12/5/2010 13:49,3.25,15023,United Kingdom
537193,22822,CREAM WALL PLANTER HEART SHAPED,2,12/5/2010 13:49,5.95,15023,United Kingdom
537193,22188,BLACK HEART CARD HOLDER,6,12/5/2010 13:49,3.95,15023,United Kingdom
537193,22189,CREAM HEART CARD HOLDER,6,12/5/2010 13:49,3.95,15023,United Kingdom
537193,22770,MIRROR CORNICE,1,12/5/2010 13:49,14.95,15023,United Kingdom
537194,22619,SET OF 6 SOLDIER SKITTLES,80,12/5/2010 13:53,3.39,17402,United Kingdom
537195,22620,4 TRADITIONAL SPINNING TOPS,1,12/5/2010 13:55,1.25,15311,United Kingdom
537195,22778,GLASS CLOCHE SMALL,2,12/5/2010 13:55,3.95,15311,United Kingdom
537195,84946,ANTIQUE SILVER TEA GLASS ETCHED,12,12/5/2010 13:55,1.25,15311,United Kingdom
537195,21033,JUMBO BAG CHARLIE AND LOLA TOYS,2,12/5/2010 13:55,2.95,15311,United Kingdom
537195,84865,NEW BAROQUE BLACK PHOTO ALBUM,1,12/5/2010 13:55,8.5,15311,United Kingdom
537195,21172,PARTY METAL SIGN ,24,12/5/2010 13:55,1.45,15311,United Kingdom
537195,21504,SKULLS GREETING CARD,12,12/5/2010 13:55,0.42,15311,United Kingdom
537195,84563A,PINK & WHITE BREAKFAST TRAY,2,12/5/2010 13:55,5.95,15311,United Kingdom
537195,84563B,BLUE & WHITE BREAKFAST TRAY,1,12/5/2010 13:55,5.95,15311,United Kingdom
537195,22502,PICNIC BASKET WICKER SMALL,2,12/5/2010 13:55,5.95,15311,United Kingdom
537195,21867,PINK UNION JACK  LUGGAGE TAG,1,12/5/2010 13:55,1.25,15311,United Kingdom
537195,21672,WHITE SPOT RED CERAMIC DRAWER KNOB,6,12/5/2010 13:55,1.25,15311,United Kingdom
537195,21673,WHITE SPOT BLUE CERAMIC DRAWER KNOB,12,12/5/2010 13:55,1.25,15311,United Kingdom
537195,37444A,YELLOW BREAKFAST CUP AND SAUCER,1,12/5/2010 13:55,2.95,15311,United Kingdom
537195,22775,PURPLE DRAWERKNOB ACRYLIC EDWARDIAN,12,12/5/2010 13:55,1.25,15311,United Kingdom
537195,85035B,CHOCOLATE 3 WICK MORRIS BOX CANDLE,1,12/5/2010 13:55,4.25,15311,United Kingdom
537195,22775,PURPLE DRAWERKNOB ACRYLIC EDWARDIAN,12,12/5/2010 13:55,1.25,15311,United Kingdom
537195,84378,SET OF 3 HEART COOKIE CUTTERS,1,12/5/2010 13:55,1.25,15311,United Kingdom
537195,22637,PIGGY BANK RETROSPOT ,4,12/5/2010 13:55,2.55,15311,United Kingdom
537195,22891,TEA FOR ONE POLKADOT,1,12/5/2010 13:55,4.25,15311,United Kingdom
537195,21899,"KEY FOB , GARAGE DESIGN",1,12/5/2010 13:55,0.65,15311,United Kingdom
537195,22083,PAPER CHAIN KIT RETROSPOT,5,12/5/2010 13:55,2.95,15311,United Kingdom
537195,82613B,"METAL SIGN,CUPCAKE SINGLE HOOK",1,12/5/2010 13:55,1.25,15311,United Kingdom
537195,82599,FANNY'S REST STOPMETAL SIGN,5,12/5/2010 13:55,2.1,15311,United Kingdom
537195,21158,MOODY GIRL DOOR HANGER ,1,12/5/2010 13:55,1.45,15311,United Kingdom
537195,22086,PAPER CHAIN KIT 50'S CHRISTMAS ,2,12/5/2010 13:55,2.95,15311,United Kingdom
537195,85014A,BLACK/BLUE POLKADOT UMBRELLA,1,12/5/2010 13:55,5.95,15311,United Kingdom
537195,37446,MINI CAKE STAND WITH HANGING CAKES,32,12/5/2010 13:55,1.25,15311,United Kingdom
537195,22355,CHARLOTTE BAG SUKI DESIGN,100,12/5/2010 13:55,0.72,15311,United Kingdom
537195,21258,VICTORIAN SEWING BOX LARGE,8,12/5/2010 13:55,10.95,15311,United Kingdom
537195,79321,CHILLI LIGHTS,24,12/5/2010 13:55,4.25,15311,United Kingdom
537195,37449,CERAMIC CAKE STAND + HANGING CAKES,8,12/5/2010 13:55,8.5,15311,United Kingdom
537195,35004C,SET OF 3 COLOURED  FLYING DUCKS,12,12/5/2010 13:55,4.65,15311,United Kingdom
537196,22112,CHOCOLATE HOT WATER BOTTLE,1,12/5/2010 13:55,4.95,15426,United Kingdom
537196,22910,PAPER CHAIN KIT VINTAGE CHRISTMAS,1,12/5/2010 13:55,2.95,15426,United Kingdom
537196,79190A,RETRO PLASTIC 70'S TRAY,1,12/5/2010 13:55,0.42,15426,United Kingdom
537196,22834,HAND WARMER BABUSHKA DESIGN,1,12/5/2010 13:55,2.1,15426,United Kingdom
537196,21356,TOAST ITS - FAIRY FLOWER,1,12/5/2010 13:55,1.25,15426,United Kingdom
537196,22607,WOODEN ROUNDERS GARDEN SET ,1,12/5/2010 13:55,9.95,15426,United Kingdom
537196,84987,SET OF 36 TEATIME PAPER DOILIES,1,12/5/2010 13:55,1.45,15426,United Kingdom
537196,22800,ANTIQUE TALL SWIRLGLASS TRINKET POT,1,12/5/2010 13:55,3.75,15426,United Kingdom
537196,22798,ANTIQUE GLASS DRESSING TABLE POT,1,12/5/2010 13:55,2.95,15426,United Kingdom
537196,21313,GLASS HEART T-LIGHT HOLDER ,1,12/5/2010 13:55,0.85,15426,United Kingdom
537196,15034,PAPER POCKET TRAVELING FAN ,1,12/5/2010 13:55,0.14,15426,United Kingdom
537196,22151,PLACE SETTING WHITE HEART,1,12/5/2010 13:55,0.42,15426,United Kingdom
537196,22640,SET OF 4 NAPKIN CHARMS 3 KEYS ,1,12/5/2010 13:55,2.55,15426,United Kingdom
537196,22296,HEART IVORY TRELLIS LARGE,1,12/5/2010 13:55,1.65,15426,United Kingdom
537196,47593B,SCOTTIE DOGS BABY BIB,1,12/5/2010 13:55,1.25,15426,United Kingdom
537196,84946,ANTIQUE SILVER TEA GLASS ETCHED,1,12/5/2010 13:55,1.25,15426,United Kingdom
537196,21143,ANTIQUE GLASS HEART DECORATION ,1,12/5/2010 13:55,1.95,15426,United Kingdom
537196,21754,HOME BUILDING BLOCK WORD,1,12/5/2010 13:55,5.95,15426,United Kingdom
537196,85129D,BEADED CRYSTAL HEART PINK SMALL,1,12/5/2010 13:55,1.25,15426,United Kingdom
537196,21213,PACK OF 72 SKULL CAKE CASES,1,12/5/2010 13:55,0.55,15426,United Kingdom
537196,85129C,BEADED CRYSTAL HEART BLUE SMALL,2,12/5/2010 13:55,1.25,15426,United Kingdom
537196,22574,HEART WOODEN CHRISTMAS DECORATION,2,12/5/2010 13:55,0.85,15426,United Kingdom
537196,22421,LIPSTICK PEN FUSCHIA,1,12/5/2010 13:55,0.42,15426,United Kingdom
537196,21811,CHRISTMAS HANGING HEART WITH BELL,1,12/5/2010 13:55,1.25,15426,United Kingdom
537196,22639,SET OF 4 NAPKIN CHARMS HEARTS,1,12/5/2010 13:55,2.55,15426,United Kingdom
537196,21811,CHRISTMAS HANGING HEART WITH BELL,1,12/5/2010 13:55,1.25,15426,United Kingdom
537196,22640,SET OF 4 NAPKIN CHARMS 3 KEYS ,1,12/5/2010 13:55,2.55,15426,United Kingdom
537196,84879,ASSORTED COLOUR BIRD ORNAMENT,4,12/5/2010 13:55,1.69,15426,United Kingdom
537196,22156,HEART DECORATION WITH PEARLS ,1,12/5/2010 13:55,0.85,15426,United Kingdom
537196,21811,CHRISTMAS HANGING HEART WITH BELL,1,12/5/2010 13:55,1.25,15426,United Kingdom
537196,85129B,BEADED CRYSTAL HEART GREEN SMALL,2,12/5/2010 13:55,1.25,15426,United Kingdom
537196,35924,HANGING FAIRY CAKE DECORATION,2,12/5/2010 13:55,2.1,15426,United Kingdom
537196,22595,CHRISTMAS GINGHAM HEART,2,12/5/2010 13:55,0.85,15426,United Kingdom
537196,85129D,BEADED CRYSTAL HEART PINK SMALL,1,12/5/2010 13:55,1.25,15426,United Kingdom
537196,21892,TRADITIONAL WOODEN CATCH CUP GAME ,1,12/5/2010 13:55,1.25,15426,United Kingdom
537196,22851,SET 20 NAPKINS FAIRY CAKES DESIGN ,1,12/5/2010 13:55,0.85,15426,United Kingdom
537196,21116,OWL DOORSTOP,1,12/5/2010 13:55,4.95,15426,United Kingdom
537196,21624,VINTAGE UNION JACK DOORSTOP,1,12/5/2010 13:55,5.95,15426,United Kingdom
537196,47567B,TEA TIME KITCHEN APRON,1,12/5/2010 13:55,5.95,15426,United Kingdom
537196,47559B,TEA TIME OVEN GLOVE,2,12/5/2010 13:55,1.25,15426,United Kingdom
537196,47567B,TEA TIME KITCHEN APRON,1,12/5/2010 13:55,5.95,15426,United Kingdom
537196,20671,BLUE TEATIME PRINT BOWL ,2,12/5/2010 13:55,1.25,15426,United Kingdom
537196,85130A,BEADED PEARL HEART WHITE LARGE,2,12/5/2010 13:55,1.65,15426,United Kingdom
537196,84792,ENCHANTED BIRD COATHANGER 5 HOOK,1,12/5/2010 13:55,4.65,15426,United Kingdom
537196,84508B,STRIPES DESIGN TEDDY,1,12/5/2010 13:55,2.55,15426,United Kingdom
537196,84988,SET OF 72 PINK HEART PAPER DOILIES,1,12/5/2010 13:55,1.45,15426,United Kingdom
537196,22851,SET 20 NAPKINS FAIRY CAKES DESIGN ,1,12/5/2010 13:55,0.85,15426,United Kingdom
537196,20829,GLITTER HANGING BUTTERFLY STRING,1,12/5/2010 13:55,2.1,15426,United Kingdom
537196,15060B,FAIRY CAKE DESIGN UMBRELLA,3,12/5/2010 13:55,3.75,15426,United Kingdom
537196,47566B,TEA TIME PARTY BUNTING,3,12/5/2010 13:55,4.65,15426,United Kingdom
537196,22318,FIVE HEART HANGING DECORATION,1,12/5/2010 13:55,2.95,15426,United Kingdom
537196,84406B,CREAM CUPID HEARTS COAT HANGER,1,12/5/2010 13:55,3.25,15426,United Kingdom
537196,22278,OVERNIGHT BAG VINTAGE ROSE PAISLEY,1,12/5/2010 13:55,4.95,15426,United Kingdom
537196,22570,FELTCRAFT CUSHION RABBIT,1,12/5/2010 13:55,3.75,15426,United Kingdom
537196,22278,OVERNIGHT BAG VINTAGE ROSE PAISLEY,1,12/5/2010 13:55,4.95,15426,United Kingdom
537196,22568,FELTCRAFT CUSHION OWL,2,12/5/2010 13:55,3.75,15426,United Kingdom
537196,20967,GREY FLORAL FELTCRAFT SHOULDER BAG,1,12/5/2010 13:55,3.75,15426,United Kingdom
537196,22570,FELTCRAFT CUSHION RABBIT,1,12/5/2010 13:55,3.75,15426,United Kingdom
537196,22147,FELTCRAFT BUTTERFLY HEARTS,2,12/5/2010 13:55,1.45,15426,United Kingdom
537196,21231,SWEETHEART CERAMIC TRINKET BOX,4,12/5/2010 13:55,1.25,15426,United Kingdom
537196,21232,STRAWBERRY CERAMIC TRINKET BOX,2,12/5/2010 13:55,1.25,15426,United Kingdom
537196,35004B,SET OF 3 BLACK FLYING DUCKS,1,12/5/2010 13:55,5.45,15426,United Kingdom
537196,22430,ENAMEL WATERING CAN CREAM,1,12/5/2010 13:55,4.95,15426,United Kingdom
537196,84509G,SET OF 4 FAIRY CAKE PLACEMATS ,2,12/5/2010 13:55,3.75,15426,United Kingdom
537196,21908,CHOCOLATE THIS WAY METAL SIGN,2,12/5/2010 13:55,2.1,15426,United Kingdom
537196,21903,MAN FLU METAL SIGN,1,12/5/2010 13:55,2.1,15426,United Kingdom
537196,82599,FANNY'S REST STOPMETAL SIGN,1,12/5/2010 13:55,2.1,15426,United Kingdom
537196,21903,MAN FLU METAL SIGN,1,12/5/2010 13:55,2.1,15426,United Kingdom
537196,85152,HAND OVER THE CHOCOLATE   SIGN ,1,12/5/2010 13:55,2.1,15426,United Kingdom
537196,21166,COOK WITH WINE METAL SIGN ,1,12/5/2010 13:55,1.95,15426,United Kingdom
537196,21181,PLEASE ONE PERSON METAL SIGN,2,12/5/2010 13:55,2.1,15426,United Kingdom
537196,21904,HOUSE WRECKING METAL SIGN ,1,12/5/2010 13:55,2.1,15426,United Kingdom
537196,21422,PORCELAIN ROSE SMALL,8,12/5/2010 13:55,0.85,15426,United Kingdom
537196,22121,NOEL WOODEN BLOCK LETTERS ,1,12/5/2010 13:55,5.95,15426,United Kingdom
537196,21745,GAOLERS KEYS DECORATIVE GARDEN ,1,12/5/2010 13:55,3.75,15426,United Kingdom
537196,82486,WOOD S/3 CABINET ANT WHITE FINISH,1,12/5/2010 13:55,7.95,15426,United Kingdom
537196,82483,WOOD 2 DRAWER CABINET WHITE FINISH,1,12/5/2010 13:55,5.95,15426,United Kingdom
537196,21326,AGED GLASS SILVER T-LIGHT HOLDER,12,12/5/2010 13:55,0.65,15426,United Kingdom
537196,84946,ANTIQUE SILVER TEA GLASS ETCHED,6,12/5/2010 13:55,1.25,15426,United Kingdom
537196,84947,ANTIQUE SILVER TEA GLASS ENGRAVED,3,12/5/2010 13:55,1.25,15426,United Kingdom
537196,21754,HOME BUILDING BLOCK WORD,2,12/5/2010 13:55,5.95,15426,United Kingdom
537196,21137,BLACK RECORD COVER FRAME,24,12/5/2010 13:55,3.39,15426,United Kingdom
537196,21340,CLASSIC METAL BIRDCAGE PLANT HOLDER,1,12/5/2010 13:55,12.75,15426,United Kingdom
537196,21361,LOVE LARGE WOOD LETTERS ,1,12/5/2010 13:55,12.75,15426,United Kingdom
537196,22427,ENAMEL FLOWER JUG CREAM,1,12/5/2010 13:55,5.95,15426,United Kingdom
537196,22430,ENAMEL WATERING CAN CREAM,1,12/5/2010 13:55,4.95,15426,United Kingdom
537197,22843,BISCUIT TIN VINTAGE GREEN,2,12/5/2010 14:02,6.75,12647,Germany
537197,22842,BISCUIT TIN VINTAGE RED,2,12/5/2010 14:02,6.75,12647,Germany
537197,22961,JAM MAKING SET PRINTED,12,12/5/2010 14:02,1.45,12647,Germany
537197,22962,JAM JAR WITH PINK LID,12,12/5/2010 14:02,0.85,12647,Germany
537197,22963,JAM JAR WITH GREEN LID,12,12/5/2010 14:02,0.85,12647,Germany
537197,84997D,PINK 3 PIECE POLKADOT CUTLERY SET,6,12/5/2010 14:02,3.75,12647,Germany
537197,22199,FRYING PAN RED RETROSPOT,4,12/5/2010 14:02,4.25,12647,Germany
537197,22200,FRYING PAN PINK POLKADOT,4,12/5/2010 14:02,4.25,12647,Germany
537197,22505,MEMO BOARD COTTAGE DESIGN,4,12/5/2010 14:02,4.95,12647,Germany
537197,22507,MEMO BOARD RETROSPOT  DESIGN,4,12/5/2010 14:02,4.95,12647,Germany
537197,84050,PINK HEART SHAPE EGG FRYING PAN,6,12/5/2010 14:02,1.65,12647,Germany
537197,85055,FRENCH ENAMEL UTENSIL HOLDER,4,12/5/2010 14:02,3.75,12647,Germany
537197,84968A,SET OF 16 VINTAGE ROSE CUTLERY,1,12/5/2010 14:02,12.75,12647,Germany
537197,POST,POSTAGE,3,12/5/2010 14:02,18,12647,Germany
537197,22624,IVORY KITCHEN SCALES,2,12/5/2010 14:02,8.5,12647,Germany
537197,22841,ROUND CAKE TIN VINTAGE GREEN,1,12/5/2010 14:02,0,12647,Germany
537197,22847,BREAD BIN DINER STYLE IVORY,1,12/5/2010 14:02,16.95,12647,Germany
537198,20685,DOORMAT RED RETROSPOT,10,12/5/2010 14:03,6.75,12647,Germany
