537208,22041,"RECORD FRAME 7"" SINGLE SIZE ",2,12/5/2010 15:12,2.55,15889,United Kingdom
537208,22532,MAGIC DRAWING SLATE LEAP FROG ,4,12/5/2010 15:12,0.42,15889,United Kingdom
537208,22531,MAGIC DRAWING SLATE CIRCUS PARADE  ,3,12/5/2010 15:12,0.42,15889,United Kingdom
537208,22441,GROW YOUR OWN BASIL IN ENAMEL MUG,1,12/5/2010 15:12,2.1,15889,United Kingdom
537208,22744,MAKE YOUR OWN MONSOON CARD KIT,1,12/5/2010 15:12,2.95,15889,United Kingdom
537208,22726,ALARM CLOCK BAKELIKE GREEN,1,12/5/2010 15:12,3.75,15889,United Kingdom
537208,22725,ALARM CLOCK BAKELIKE CHOCOLATE,1,12/5/2010 15:12,3.75,15889,United Kingdom
537208,22441,GROW YOUR OWN BASIL IN ENAMEL MUG,1,12/5/2010 15:12,2.1,15889,United Kingdom
537208,21034,REX CASH+CARRY JUMBO SHOPPER,1,12/5/2010 15:12,0.95,15889,United Kingdom
537208,90185D,CRYSTAL DIAMANTE EXPANDABLE RING,2,12/5/2010 15:12,4.25,15889,United Kingdom
537208,90082D,DIAMANTE BOW BROOCH BLACK COLOUR,1,12/5/2010 15:12,6.35,15889,United Kingdom
537208,90082B,DIAMANTE BOW BROOCH RED COLOUR,1,12/5/2010 15:12,6.35,15889,United Kingdom
537208,90200E,GREEN SWEETHEART BRACELET,2,12/5/2010 15:12,4.25,15889,United Kingdom
537208,90062,CARNIVAL BRACELET,1,12/5/2010 15:12,12.75,15889,United Kingdom
537209,21115,ROSE CARAVAN DOORSTOP,1,12/5/2010 15:12,6.75,14606,United Kingdom
537209,22107,PIZZA PLATE IN BOX,3,12/5/2010 15:12,3.75,14606,United Kingdom
537209,21616,4 PEAR BOTANICAL DINNER CANDLES,4,12/5/2010 15:12,3.75,14606,United Kingdom
537209,21467,CHERRY CROCHET FOOD COVER,1,12/5/2010 15:12,3.75,14606,United Kingdom
537209,20750,RED RETROSPOT MINI CASES,2,12/5/2010 15:12,7.95,14606,United Kingdom
537209,22096,PINK PAISLEY SQUARE TISSUE BOX ,1,12/5/2010 15:12,1.25,14606,United Kingdom
537209,22150,3 STRIPEY MICE FELTCRAFT,1,12/5/2010 15:12,1.95,14606,United Kingdom
537209,22147,FELTCRAFT BUTTERFLY HEARTS,1,12/5/2010 15:12,1.45,14606,United Kingdom
537209,17090D,VANILLA INCENSE 40 CONES IN TIN,1,12/5/2010 15:12,1.25,14606,United Kingdom
537209,22482,BLUE TEA TOWEL CLASSIC DESIGN,1,12/5/2010 15:12,1.25,14606,United Kingdom
537209,21056,DOCTOR'S BAG SOFT TOY,1,12/5/2010 15:12,8.95,14606,United Kingdom
537209,20972,PINK CREAM FELT CRAFT TRINKET BOX ,1,12/5/2010 15:12,1.25,14606,United Kingdom
537209,22568,FELTCRAFT CUSHION OWL,2,12/5/2010 15:12,3.75,14606,United Kingdom
537209,22570,FELTCRAFT CUSHION RABBIT,1,12/5/2010 15:12,3.75,14606,United Kingdom
537209,21894,POTTING SHED SEED ENVELOPES,1,12/5/2010 15:12,1.25,14606,United Kingdom
537209,22577,WOODEN HEART CHRISTMAS SCANDINAVIAN,3,12/5/2010 15:12,0.85,14606,United Kingdom
537209,20972,PINK CREAM FELT CRAFT TRINKET BOX ,2,12/5/2010 15:12,1.25,14606,United Kingdom
537209,85231G,ORANGE SCENTED SET/9 T-LIGHTS,1,12/5/2010 15:12,0.85,14606,United Kingdom
537209,17003,BROCADE RING PURSE ,3,12/5/2010 15:12,0.21,14606,United Kingdom
537209,37461,FUNKY MONKEY MUG,1,12/5/2010 15:12,1.25,14606,United Kingdom
537209,82580,BATHROOM METAL SIGN,1,12/5/2010 15:12,0.55,14606,United Kingdom
537209,82616C,MIDNIGHT GLAMOUR SCARF KNITTING KIT,1,12/5/2010 15:12,2.95,14606,United Kingdom
537209,21564,PINK  HEART SHAPE LOVE BUCKET ,1,12/5/2010 15:12,2.95,14606,United Kingdom
537209,21874,GIN AND TONIC MUG,1,12/5/2010 15:12,1.25,14606,United Kingdom
537209,21484,CHICK GREY HOT WATER BOTTLE,1,12/5/2010 15:12,3.45,14606,United Kingdom
537209,20768,GREEN FERN JOURNAL ,2,12/5/2010 15:12,2.55,14606,United Kingdom
537209,20914,SET/5 RED RETROSPOT LID GLASS BOWLS,1,12/5/2010 15:12,2.95,14606,United Kingdom
537209,82486,WOOD S/3 CABINET ANT WHITE FINISH,1,12/5/2010 15:12,7.95,14606,United Kingdom
537209,20749,ASSORTED COLOUR MINI CASES,2,12/5/2010 15:12,7.95,14606,United Kingdom
537209,22474,SPACEBOY TV DINNER TRAY,1,12/5/2010 15:12,4.95,14606,United Kingdom
537209,21112,"SWISS ROLL TOWEL, PINK  SPOTS",1,12/5/2010 15:12,2.95,14606,United Kingdom
537209,21850,BLUE  DIAMANTE PEN IN GIFT BOX,1,12/5/2010 15:12,4.95,14606,United Kingdom
537209,21719,LOVELY BONBON STICKER SHEET,3,12/5/2010 15:12,0.85,14606,United Kingdom
537209,20655,QUEEN OF SKIES LUGGAGE TAG,1,12/5/2010 15:12,1.25,14606,United Kingdom
537209,20615,BLUE POLKADOT PASSPORT COVER,1,12/5/2010 15:12,2.1,14606,United Kingdom
537209,21122,SET/10 PINK POLKADOT PARTY CANDLES,1,12/5/2010 15:12,1.25,14606,United Kingdom
537209,20659,ECONOMY LUGGAGE TAG,1,12/5/2010 15:12,1.25,14606,United Kingdom
537209,71459,HANGING JAM JAR T-LIGHT HOLDER,24,12/5/2010 15:12,0.85,14606,United Kingdom
537209,85114C,RED ENCHANTED FOREST PLACEMAT,2,12/5/2010 15:12,1.65,14606,United Kingdom
537209,20985,HEART CALCULATOR,1,12/5/2010 15:12,1.25,14606,United Kingdom
537209,21042,RED RETROSPOT APRON ,2,12/5/2010 15:12,5.95,14606,United Kingdom
537209,20971,PINK BLUE FELT CRAFT TRINKET BOX,1,12/5/2010 15:12,1.25,14606,United Kingdom
537210,85123A,WHITE HANGING HEART T-LIGHT HOLDER,32,12/5/2010 15:15,2.55,15953,United Kingdom
537210,82494L,WOODEN FRAME ANTIQUE WHITE ,6,12/5/2010 15:15,2.95,15953,United Kingdom
537210,82482,WOODEN PICTURE FRAME WHITE FINISH,6,12/5/2010 15:15,2.55,15953,United Kingdom
537210,21136,PAINTED METAL PEARS ASSORTED,8,12/5/2010 15:15,1.69,15953,United Kingdom
537210,84879,ASSORTED COLOUR BIRD ORNAMENT,8,12/5/2010 15:15,1.69,15953,United Kingdom
537210,22633,HAND WARMER UNION JACK,1,12/5/2010 15:15,2.1,15953,United Kingdom
537210,72802C,VANILLA SCENT CANDLE JEWELLED BOX,3,12/5/2010 15:15,4.25,15953,United Kingdom
537210,72802B,OCEAN SCENT CANDLE IN JEWELLED BOX,3,12/5/2010 15:15,4.25,15953,United Kingdom
537210,22942,CHRISTMAS LIGHTS 10 SANTAS ,1,12/5/2010 15:15,8.5,15953,United Kingdom
537210,20728,LUNCH BAG CARS BLUE,1,12/5/2010 15:15,1.65,15953,United Kingdom
537210,20726,LUNCH BAG WOODLAND,1,12/5/2010 15:15,1.65,15953,United Kingdom
537210,84596L,BISCUITS SMALL BOWL LIGHT BLUE,1,12/5/2010 15:15,1.25,15953,United Kingdom
537210,84596F,SMALL MARSHMALLOWS PINK BOWL,1,12/5/2010 15:15,1.25,15953,United Kingdom
537210,85231B,CINAMMON SET OF 9 T-LIGHTS,27,12/5/2010 15:15,0.85,15953,United Kingdom
537210,22633,HAND WARMER UNION JACK,1,12/5/2010 15:15,2.1,15953,United Kingdom
537210,47559B,TEA TIME OVEN GLOVE,1,12/5/2010 15:15,1.25,15953,United Kingdom
537211,22666,RECIPE BOX PANTRY YELLOW DESIGN,6,12/5/2010 15:18,2.95,16143,United Kingdom
537211,22470,HEART OF WICKER LARGE,40,12/5/2010 15:18,2.55,16143,United Kingdom
537211,22694,WICKER STAR ,6,12/5/2010 15:18,2.1,16143,United Kingdom
537211,22469,HEART OF WICKER SMALL,12,12/5/2010 15:18,1.65,16143,United Kingdom
537211,22667,RECIPE BOX RETROSPOT ,6,12/5/2010 15:18,2.95,16143,United Kingdom
537211,22665,RECIPE BOX BLUE SKETCHBOOK DESIGN,6,12/5/2010 15:18,2.95,16143,United Kingdom
537211,21430,SET/3 RED GINGHAM ROSE STORAGE BOX,4,12/5/2010 15:18,3.75,16143,United Kingdom
537211,22215,CAKE STAND WHITE TWO TIER LACE,2,12/5/2010 15:18,8.5,16143,United Kingdom
537211,21531,RED RETROSPOT SUGAR JAM BOWL,6,12/5/2010 15:18,2.55,16143,United Kingdom
537211,21539,RED RETROSPOT BUTTER DISH,3,12/5/2010 15:18,4.95,16143,United Kingdom
537211,20725,LUNCH BAG RED RETROSPOT,10,12/5/2010 15:18,1.65,16143,United Kingdom
537211,22383,LUNCH BAG SUKI  DESIGN ,10,12/5/2010 15:18,1.65,16143,United Kingdom
537211,21175,GIN + TONIC DIET METAL SIGN,12,12/5/2010 15:18,2.1,16143,United Kingdom
537211,22116,METAL SIGN HIS DINNER IS SERVED,6,12/5/2010 15:18,2.95,16143,United Kingdom
537211,22457,NATURAL SLATE HEART CHALKBOARD ,6,12/5/2010 15:18,2.95,16143,United Kingdom
537211,47559B,TEA TIME OVEN GLOVE,10,12/5/2010 15:18,1.25,16143,United Kingdom
537212,20712,JUMBO BAG WOODLAND ANIMALS,10,12/5/2010 15:21,1.95,12720,Germany
537212,20719,WOODLAND CHARLOTTE BAG,10,12/5/2010 15:21,0.85,12720,Germany
537212,22554,PLASTERS IN TIN WOODLAND ANIMALS,12,12/5/2010 15:21,1.65,12720,Germany
537212,21981,PACK OF 12 WOODLAND TISSUES ,24,12/5/2010 15:21,0.29,12720,Germany
537212,22960,JAM MAKING SET WITH JARS,6,12/5/2010 15:21,4.25,12720,Germany
537212,22961,JAM MAKING SET PRINTED,12,12/5/2010 15:21,1.45,12720,Germany
537212,22962,JAM JAR WITH PINK LID,12,12/5/2010 15:21,0.85,12720,Germany
537212,22963,JAM JAR WITH GREEN LID,12,12/5/2010 15:21,0.85,12720,Germany
537212,21984,PACK OF 12 PINK PAISLEY TISSUES ,24,12/5/2010 15:21,0.29,12720,Germany
537212,21883,STARS GIFT TAPE ,12,12/5/2010 15:21,0.65,12720,Germany
537212,22557,PLASTERS IN TIN VINTAGE PAISLEY ,12,12/5/2010 15:21,1.65,12720,Germany
537212,22197,SMALL POPCORN HOLDER,24,12/5/2010 15:21,0.85,12720,Germany
537212,22346,PARTY PIZZA DISH GREEN POLKADOT,12,12/5/2010 15:21,0.85,12720,Germany
537212,22344,PARTY PIZZA DISH PINK POLKADOT,12,12/5/2010 15:21,0.85,12720,Germany
537212,22345,PARTY PIZZA DISH BLUE POLKADOT,12,12/5/2010 15:21,0.85,12720,Germany
537212,22149,FELTCRAFT 6 FLOWER FRIENDS,6,12/5/2010 15:21,2.1,12720,Germany
537212,22625,RED KITCHEN SCALES,2,12/5/2010 15:21,8.5,12720,Germany
537212,22624,IVORY KITCHEN SCALES,2,12/5/2010 15:21,8.5,12720,Germany
537212,22111,SCOTTIE DOG HOT WATER BOTTLE,3,12/5/2010 15:21,4.95,12720,Germany
537212,21481,FAWN BLUE HOT WATER BOTTLE,6,12/5/2010 15:21,2.95,12720,Germany
537212,84920,PINK FLOWER FABRIC PONY,4,12/5/2010 15:21,3.75,12720,Germany
537212,21430,SET/3 RED GINGHAM ROSE STORAGE BOX,4,12/5/2010 15:21,3.75,12720,Germany
537212,20677,PINK POLKADOT BOWL,8,12/5/2010 15:21,1.25,12720,Germany
537212,21243,PINK  POLKADOT PLATE ,8,12/5/2010 15:21,1.69,12720,Germany
537212,20718,RED RETROSPOT SHOPPER BAG,10,12/5/2010 15:21,1.25,12720,Germany
537212,22386,JUMBO BAG PINK POLKADOT,10,12/5/2010 15:21,1.95,12720,Germany
537212,85099B,JUMBO BAG RED RETROSPOT,10,12/5/2010 15:21,1.95,12720,Germany
537212,21238,RED RETROSPOT CUP,8,12/5/2010 15:21,0.85,12720,Germany
537212,21239,PINK  POLKADOT CUP,8,12/5/2010 15:21,0.85,12720,Germany
537212,POST,POSTAGE,4,12/5/2010 15:21,18,12720,Germany
537213,20966,SANDWICH BATH SPONGE,1,12/5/2010 15:26,1.25,12748,United Kingdom
537213,20963,APPLE BATH SPONGE,1,12/5/2010 15:26,1.25,12748,United Kingdom
537213,85215,ASSORTED CHEESE FRIDGE MAGNETS,1,12/5/2010 15:26,0.65,12748,United Kingdom
537213,21700,BIG DOUGHNUT FRIDGE MAGNETS,2,12/5/2010 15:26,0.85,12748,United Kingdom
537213,20961,STRAWBERRY BATH SPONGE ,1,12/5/2010 15:26,1.25,12748,United Kingdom
537213,21556,CERAMIC STRAWBERRY MONEY BOX,1,12/5/2010 15:26,2.55,12748,United Kingdom
537214,20963,APPLE BATH SPONGE,10,12/5/2010 15:35,1.25,16422,United Kingdom
537214,20676,RED RETROSPOT BOWL,72,12/5/2010 15:35,1.06,16422,United Kingdom
537214,21094,SET/6 RED SPOTTY PAPER PLATES,192,12/5/2010 15:35,0.64,16422,United Kingdom
537214,21080,SET/20 RED RETROSPOT PAPER NAPKINS ,96,12/5/2010 15:35,0.64,16422,United Kingdom
537214,17003,BROCADE RING PURSE ,720,12/5/2010 15:35,0.16,16422,United Kingdom
537214,20974,12 PENCILS SMALL TUBE SKULL,48,12/5/2010 15:35,0.65,16422,United Kingdom
537214,47599A,PINK PARTY BAGS,50,12/5/2010 15:35,2.1,16422,United Kingdom
537214,47599B,BLUE PARTY BAGS ,50,12/5/2010 15:35,2.1,16422,United Kingdom
537214,20975,12 PENCILS SMALL TUBE RED RETROSPOT,144,12/5/2010 15:35,0.65,16422,United Kingdom
537214,22090,PAPER BUNTING RETROSPOT,40,12/5/2010 15:35,2.55,16422,United Kingdom
537214,47590A,BLUE HAPPY BIRTHDAY BUNTING,50,12/5/2010 15:35,4.65,16422,United Kingdom
537214,21121,SET/10 RED POLKADOT PARTY CANDLES,288,12/5/2010 15:35,1.06,16422,United Kingdom
537214,21122,SET/10 PINK POLKADOT PARTY CANDLES,288,12/5/2010 15:35,1.06,16422,United Kingdom
537215,85124C,GREEN JUICY FRUIT PHOTO FRAME,12,12/5/2010 15:38,2.55,12747,United Kingdom
537215,85124B,BLUE JUICY FRUIT PHOTO FRAME,6,12/5/2010 15:38,2.55,12747,United Kingdom
537215,84879,ASSORTED COLOUR BIRD ORNAMENT,16,12/5/2010 15:38,1.69,12747,United Kingdom
537215,85062,PEARL CRYSTAL PUMPKIN T-LIGHT HLDR,24,12/5/2010 15:38,1.65,12747,United Kingdom
537215,85064,CREAM SWEETHEART LETTER RACK,6,12/5/2010 15:38,5.45,12747,United Kingdom
537215,82484,WOOD BLACK BOARD ANT WHITE FINISH,36,12/5/2010 15:38,5.55,12747,United Kingdom
537215,21136,PAINTED METAL PEARS ASSORTED,8,12/5/2010 15:38,1.69,12747,United Kingdom
537216,22195,LARGE HEART MEASURING SPOONS,12,12/5/2010 15:40,1.65,15502,United Kingdom
537216,22357,KINGS CHOICE BISCUIT TIN,4,12/5/2010 15:40,4.25,15502,United Kingdom
537216,22476,EMPIRE UNION JACK TV DINNER TRAY,4,12/5/2010 15:40,4.95,15502,United Kingdom
537216,71477,COLOUR GLASS. STAR T-LIGHT HOLDER,24,12/5/2010 15:40,2.75,15502,United Kingdom
537216,84658,WHITE STITCHED CUSHION COVER,6,12/5/2010 15:40,6.95,15502,United Kingdom
537216,82484,WOOD BLACK BOARD ANT WHITE FINISH,10,12/5/2010 15:40,6.45,15502,United Kingdom
537216,22473,TV DINNER TRAY VINTAGE PAISLEY,4,12/5/2010 15:40,4.95,15502,United Kingdom
537216,47566B,TEA TIME PARTY BUNTING,8,12/5/2010 15:40,4.65,15502,United Kingdom
537216,47580,TEA TIME DES TEA COSY,6,12/5/2010 15:40,2.55,15502,United Kingdom
537216,22197,SMALL POPCORN HOLDER,48,12/5/2010 15:40,0.85,15502,United Kingdom
537216,22196,SMALL HEART MEASURING SPOONS,12,12/5/2010 15:40,0.85,15502,United Kingdom
537216,21949,SET OF 6 STRAWBERRY CHOPSTICKS,12,12/5/2010 15:40,1.25,15502,United Kingdom
537216,21080,SET/20 RED RETROSPOT PAPER NAPKINS ,24,12/5/2010 15:40,0.85,15502,United Kingdom
537216,22625,RED KITCHEN SCALES,2,12/5/2010 15:40,8.5,15502,United Kingdom
537216,21733,RED HANGING HEART T-LIGHT HOLDER,24,12/5/2010 15:40,2.95,15502,United Kingdom
537216,18098C,PORCELAIN BUTTERFLY OIL BURNER,6,12/5/2010 15:40,2.95,15502,United Kingdom
537216,21906,PHARMACIE FIRST AID TIN,4,12/5/2010 15:40,6.75,15502,United Kingdom
537216,22198,LARGE POPCORN HOLDER ,30,12/5/2010 15:40,1.65,15502,United Kingdom
537217,22849,"BREAD BIN, DINER STYLE, MINT",4,12/5/2010 15:40,14.95,15502,United Kingdom
537217,22847,"BREAD BIN, DINER STYLE, IVORY",4,12/5/2010 15:40,14.95,15502,United Kingdom
537217,22927,GREEN GIANT GARDEN THERMOMETER,4,12/5/2010 15:40,5.95,15502,United Kingdom
537217,22926,IVORY GIANT GARDEN THERMOMETER,4,12/5/2010 15:40,5.95,15502,United Kingdom
537218,85016,SET OF 6 VINTAGE NOTELETS KIT,6,12/5/2010 15:46,2.55,12763,Japan
537218,21506,"FANCY FONT BIRTHDAY CARD, ",12,12/5/2010 15:46,0.42,12763,Japan
537218,22716,CARD CIRCUS PARADE,12,12/5/2010 15:46,0.42,12763,Japan
537218,22983,CARD BILLBOARD FONT,12,12/5/2010 15:46,0.42,12763,Japan
537218,22030,SWALLOWS GREETING CARD,12,12/5/2010 15:46,0.42,12763,Japan
537218,22984,CARD GINGHAM ROSE ,12,12/5/2010 15:46,0.42,12763,Japan
537218,85015,SET OF 12  VINTAGE POSTCARD SET,6,12/5/2010 15:46,2.55,12763,Japan
537218,21381,MINI WOODEN HAPPY BIRTHDAY GARLAND,12,12/5/2010 15:46,1.69,12763,Japan
537218,21080,SET/20 RED RETROSPOT PAPER NAPKINS ,12,12/5/2010 15:46,0.85,12763,Japan
537218,84520B,PACK 20 ENGLISH ROSE PAPER NAPKINS,12,12/5/2010 15:46,0.85,12763,Japan
537218,21210,SET OF 72 RETROSPOT PAPER  DOILIES,24,12/5/2010 15:46,1.45,12763,Japan
537218,84988,SET OF 72 PINK HEART PAPER DOILIES,24,12/5/2010 15:46,1.45,12763,Japan
537218,22749,FELTCRAFT PRINCESS CHARLOTTE DOLL,16,12/5/2010 15:46,3.75,12763,Japan
537218,22750,FELTCRAFT PRINCESS LOLA DOLL,8,12/5/2010 15:46,3.75,12763,Japan
537218,22751,FELTCRAFT PRINCESS OLIVIA DOLL,8,12/5/2010 15:46,3.75,12763,Japan
537218,22940,FELTCRAFT CHRISTMAS FAIRY,8,12/5/2010 15:46,4.25,12763,Japan
537219,21217,RED RETROSPOT ROUND CAKE TINS,2,12/5/2010 15:47,9.95,14081,United Kingdom
537219,72818,CHRISTMAS DECOUPAGE CANDLE,5,12/5/2010 15:47,0.85,14081,United Kingdom
537219,22969,HOMEMADE JAM SCENTED CANDLES,12,12/5/2010 15:47,1.45,14081,United Kingdom
537219,22816,CARD MOTORBIKE SANTA,24,12/5/2010 15:47,0.42,14081,United Kingdom
537219,22818,CARD CHRISTMAS VILLAGE,36,12/5/2010 15:47,0.42,14081,United Kingdom
537219,21899,"KEY FOB , GARAGE DESIGN",1,12/5/2010 15:47,0.65,14081,United Kingdom
537219,21901,"KEY FOB , BACK DOOR ",1,12/5/2010 15:47,0.65,14081,United Kingdom
537219,21902,"KEY FOB , FRONT  DOOR ",3,12/5/2010 15:47,0.65,14081,United Kingdom
537219,21900,"KEY FOB , SHED",2,12/5/2010 15:47,0.65,14081,United Kingdom
537219,21527,RED RETROSPOT TRADITIONAL TEAPOT ,2,12/5/2010 15:47,7.95,14081,United Kingdom
537219,84029E,RED WOOLLY HOTTIE WHITE HEART.,1,12/5/2010 15:47,3.75,14081,United Kingdom
537219,21479,WHITE SKULL HOT WATER BOTTLE ,2,12/5/2010 15:47,3.75,14081,United Kingdom
537219,21485,RETROSPOT HEART HOT WATER BOTTLE,1,12/5/2010 15:47,4.95,14081,United Kingdom
537219,22114,HOT WATER BOTTLE TEA AND SYMPATHY,1,12/5/2010 15:47,3.95,14081,United Kingdom
537219,22111,SCOTTIE DOG HOT WATER BOTTLE,1,12/5/2010 15:47,4.95,14081,United Kingdom
537219,22835,HOT WATER BOTTLE I AM SO POORLY,1,12/5/2010 15:47,4.65,14081,United Kingdom
537219,84029G,KNITTED UNION FLAG HOT WATER BOTTLE,2,12/5/2010 15:47,3.75,14081,United Kingdom
537219,22834,HAND WARMER BABUSHKA DESIGN,2,12/5/2010 15:47,2.1,14081,United Kingdom
537219,22866,HAND WARMER SCOTTY DOG DESIGN,2,12/5/2010 15:47,2.1,14081,United Kingdom
537219,22910,PAPER CHAIN KIT VINTAGE CHRISTMAS,1,12/5/2010 15:47,2.95,14081,United Kingdom
537219,22086,PAPER CHAIN KIT 50'S CHRISTMAS ,1,12/5/2010 15:47,2.95,14081,United Kingdom
537219,22964,3 PIECE SPACEBOY COOKIE CUTTER SET,3,12/5/2010 15:47,2.1,14081,United Kingdom
537219,22632,HAND WARMER RED RETROSPOT,2,12/5/2010 15:47,2.1,14081,United Kingdom
537219,22633,HAND WARMER UNION JACK,4,12/5/2010 15:47,2.1,14081,United Kingdom
537219,22923,FRIDGE MAGNETS LES ENFANTS ASSORTED,6,12/5/2010 15:47,0.85,14081,United Kingdom
537219,22134,LADLE LOVE HEART RED ,6,12/5/2010 15:47,0.42,14081,United Kingdom
537219,22135,LADLE LOVE HEART PINK,6,12/5/2010 15:47,0.42,14081,United Kingdom
537219,22739,RIBBON REEL CHRISTMAS SOCK BAUBLE,1,12/5/2010 15:47,1.65,14081,United Kingdom
537219,22737,RIBBON REEL CHRISTMAS PRESENT ,2,12/5/2010 15:47,1.65,14081,United Kingdom
537219,84375,SET OF 20 KIDS COOKIE CUTTERS,3,12/5/2010 15:47,2.1,14081,United Kingdom
537219,22196,SMALL HEART MEASURING SPOONS,8,12/5/2010 15:47,0.85,14081,United Kingdom
537219,22195,LARGE HEART MEASURING SPOONS,4,12/5/2010 15:47,1.65,14081,United Kingdom
537219,22142,CHRISTMAS CRAFT WHITE FAIRY ,2,12/5/2010 15:47,1.45,14081,United Kingdom
537219,22144,CHRISTMAS CRAFT LITTLE FRIENDS,2,12/5/2010 15:47,2.1,14081,United Kingdom
537219,22966,GINGERBREAD MAN COOKIE CUTTER,8,12/5/2010 15:47,1.25,14081,United Kingdom
537219,22949,36 DOILIES DOLLY GIRL,1,12/5/2010 15:47,1.45,14081,United Kingdom
537219,21210,SET OF 72 RETROSPOT PAPER  DOILIES,2,12/5/2010 15:47,1.45,14081,United Kingdom
537219,22940,FELTCRAFT CHRISTMAS FAIRY,2,12/5/2010 15:47,4.25,14081,United Kingdom
537219,22841,ROUND CAKE TIN VINTAGE GREEN,1,12/5/2010 15:47,7.95,14081,United Kingdom
537219,21843,RED RETROSPOT CAKE STAND,2,12/5/2010 15:47,10.95,14081,United Kingdom
537219,22423,REGENCY CAKESTAND 3 TIER,2,12/5/2010 15:47,12.75,14081,United Kingdom
537219,21980,PACK OF 12 RED RETROSPOT TISSUES ,12,12/5/2010 15:47,0.29,14081,United Kingdom
537219,21531,RED RETROSPOT SUGAR JAM BOWL,1,12/5/2010 15:47,2.55,14081,United Kingdom
537219,21539,RED RETROSPOT BUTTER DISH,2,12/5/2010 15:47,4.95,14081,United Kingdom
537219,21531,RED RETROSPOT SUGAR JAM BOWL,2,12/5/2010 15:47,2.55,14081,United Kingdom
537219,21539,RED RETROSPOT BUTTER DISH,1,12/5/2010 15:47,4.95,14081,United Kingdom
537219,85036C,ROSE 1 WICK MORRIS BOXED CANDLE,1,12/5/2010 15:47,4.25,14081,United Kingdom
537219,85035A,GARDENIA 3 WICK MORRIS BOXED CANDLE,1,12/5/2010 15:47,4.25,14081,United Kingdom
537219,85035B,CHOCOLATE 3 WICK MORRIS BOX CANDLE,2,12/5/2010 15:47,4.25,14081,United Kingdom
537219,85035C,ROSE 3 WICK MORRIS BOX CANDLE,1,12/5/2010 15:47,4.25,14081,United Kingdom
537219,22666,RECIPE BOX PANTRY YELLOW DESIGN,1,12/5/2010 15:47,2.95,14081,United Kingdom
537219,22667,RECIPE BOX RETROSPOT ,2,12/5/2010 15:47,2.95,14081,United Kingdom
537219,22618,COOKING SET RETROSPOT,1,12/5/2010 15:47,9.95,14081,United Kingdom
537219,20750,RED RETROSPOT MINI CASES,1,12/5/2010 15:47,7.95,14081,United Kingdom
537219,20749,ASSORTED COLOUR MINI CASES,1,12/5/2010 15:47,7.95,14081,United Kingdom
537219,22617,BAKING SET SPACEBOY DESIGN,2,12/5/2010 15:47,4.95,14081,United Kingdom
537219,85170D,SET/6 PINK BIRD T-LIGHT CANDLES,1,12/5/2010 15:47,2.1,14081,United Kingdom
537219,21890,S/6 WOODEN SKITTLES IN COTTON BAG,1,12/5/2010 15:47,2.95,14081,United Kingdom
537219,22619,SET OF 6 SOLDIER SKITTLES,3,12/5/2010 15:47,3.75,14081,United Kingdom
537219,22865,HAND WARMER OWL DESIGN,3,12/5/2010 15:47,2.1,14081,United Kingdom
537219,22951,60 CAKE CASES DOLLY GIRL DESIGN,4,12/5/2010 15:47,0.55,14081,United Kingdom
537219,84991,60 TEATIME FAIRY CAKE CASES,3,12/5/2010 15:47,0.55,14081,United Kingdom
537219,22417,PACK OF 60 SPACEBOY CAKE CASES,3,12/5/2010 15:47,0.55,14081,United Kingdom
537219,84992,72 SWEETHEART FAIRY CAKE CASES,3,12/5/2010 15:47,0.55,14081,United Kingdom
537219,21977,PACK OF 60 PINK PAISLEY CAKE CASES,3,12/5/2010 15:47,0.55,14081,United Kingdom
537219,21212,PACK OF 72 RETROSPOT CAKE CASES,12,12/5/2010 15:47,0.55,14081,United Kingdom
537219,21791,VINTAGE HEADS AND TAILS CARD GAME ,4,12/5/2010 15:47,1.25,14081,United Kingdom
537219,21790,VINTAGE SNAP CARDS,7,12/5/2010 15:47,0.85,14081,United Kingdom
537219,22548,HEADS AND TAILS SPORTING FUN,4,12/5/2010 15:47,1.25,14081,United Kingdom
537220,22450,SILK PURSE BABUSHKA BLUE,1,12/5/2010 15:49,3.35,,United Kingdom
537221,22942,CHRISTMAS LIGHTS 10 SANTAS ,1,12/5/2010 15:54,8.5,17965,United Kingdom
537221,22810,SET OF 6 T-LIGHTS SNOWMEN,1,12/5/2010 15:54,2.95,17965,United Kingdom
537221,22633,HAND WARMER UNION JACK,4,12/5/2010 15:54,2.1,17965,United Kingdom
537221,22751,FELTCRAFT PRINCESS OLIVIA DOLL,1,12/5/2010 15:54,3.75,17965,United Kingdom
537221,22750,FELTCRAFT PRINCESS LOLA DOLL,1,12/5/2010 15:54,3.75,17965,United Kingdom
537221,22749,FELTCRAFT PRINCESS CHARLOTTE DOLL,1,12/5/2010 15:54,3.75,17965,United Kingdom
537221,20972,PINK CREAM FELT CRAFT TRINKET BOX ,5,12/5/2010 15:54,1.25,17965,United Kingdom
537222,21385,IVORY HANGING DECORATION  HEART,1,12/5/2010 16:00,0.85,14404,United Kingdom
537222,21967,PACK OF 12 SKULL TISSUES,1,12/5/2010 16:00,0.29,14404,United Kingdom
537222,20728,LUNCH BAG CARS BLUE,10,12/5/2010 16:00,1.65,14404,United Kingdom
537222,21640,ASSORTED TUTTI FRUTTI  FOB NOTEBOOK,1,12/5/2010 16:00,0.85,14404,United Kingdom
537222,20966,SANDWICH BATH SPONGE,1,12/5/2010 16:00,1.25,14404,United Kingdom
537222,22086,PAPER CHAIN KIT 50'S CHRISTMAS ,1,12/5/2010 16:00,2.95,14404,United Kingdom
537222,22910,PAPER CHAIN KIT VINTAGE CHRISTMAS,1,12/5/2010 16:00,2.95,14404,United Kingdom
537222,21900,"KEY FOB , SHED",1,12/5/2010 16:00,0.65,14404,United Kingdom
537222,15034,PAPER POCKET TRAVELING FAN ,1,12/5/2010 16:00,0.14,14404,United Kingdom
537222,85150,LADIES & GENTLEMEN METAL SIGN,1,12/5/2010 16:00,2.55,14404,United Kingdom
537222,21098,CHRISTMAS TOILET ROLL,1,12/5/2010 16:00,1.25,14404,United Kingdom
537222,84050,PINK HEART SHAPE EGG FRYING PAN,3,12/5/2010 16:00,1.65,14404,United Kingdom
537222,20727,LUNCH BAG  BLACK SKULL.,10,12/5/2010 16:00,1.65,14404,United Kingdom
537222,22278,OVERNIGHT BAG VINTAGE ROSE PAISLEY,1,12/5/2010 16:00,4.95,14404,United Kingdom
537222,21894,POTTING SHED SEED ENVELOPES,1,12/5/2010 16:00,1.25,14404,United Kingdom
537222,85135C,RED DRAGONFLY HELICOPTER,1,12/5/2010 16:00,7.95,14404,United Kingdom
537222,22375,AIRLINE BAG VINTAGE JET SET BROWN,1,12/5/2010 16:00,4.25,14404,United Kingdom
537222,21955,DOORMAT UNION JACK GUNS AND ROSES,1,12/5/2010 16:00,7.95,14404,United Kingdom
537222,22423,REGENCY CAKESTAND 3 TIER,1,12/5/2010 16:00,12.75,14404,United Kingdom
537222,22195,LARGE HEART MEASURING SPOONS,3,12/5/2010 16:00,1.65,14404,United Kingdom
537222,20726,LUNCH BAG WOODLAND,10,12/5/2010 16:00,1.65,14404,United Kingdom
537222,22375,AIRLINE BAG VINTAGE JET SET BROWN,1,12/5/2010 16:00,4.25,14404,United Kingdom
537222,22376,AIRLINE BAG VINTAGE JET SET WHITE,1,12/5/2010 16:00,4.25,14404,United Kingdom
537222,22371,AIRLINE BAG VINTAGE TOKYO 78,1,12/5/2010 16:00,4.25,14404,United Kingdom
537222,22372,AIRLINE BAG VINTAGE WORLD CHAMPION ,1,12/5/2010 16:00,4.25,14404,United Kingdom
537222,22374,AIRLINE BAG VINTAGE JET SET RED,1,12/5/2010 16:00,4.25,14404,United Kingdom
537223,22835,HOT WATER BOTTLE I AM SO POORLY,4,12/5/2010 16:10,4.65,13579,United Kingdom
537223,21485,RETROSPOT HEART HOT WATER BOTTLE,3,12/5/2010 16:10,4.95,13579,United Kingdom
537223,85048,15CM CHRISTMAS GLASS BALL 20 LIGHTS,4,12/5/2010 16:10,7.95,13579,United Kingdom
537223,21055,TOOL BOX SOFT TOY ,1,12/5/2010 16:10,8.95,13579,United Kingdom
537223,22112,CHOCOLATE HOT WATER BOTTLE,6,12/5/2010 16:10,4.95,13579,United Kingdom
537223,22114,HOT WATER BOTTLE TEA AND SYMPATHY,4,12/5/2010 16:10,3.95,13579,United Kingdom
537223,22469,HEART OF WICKER SMALL,12,12/5/2010 16:10,1.65,13579,United Kingdom
537223,22141,CHRISTMAS CRAFT TREE TOP ANGEL,6,12/5/2010 16:10,2.1,13579,United Kingdom
537223,22144,CHRISTMAS CRAFT LITTLE FRIENDS,6,12/5/2010 16:10,2.1,13579,United Kingdom
537224,22829,SWEETHEART WIRE WALL TIDY,2,12/5/2010 16:24,9.95,13174,United Kingdom
537224,70007,HI TEC ALPINE HAND WARMER,1,12/5/2010 16:24,1.65,13174,United Kingdom
537224,84375,SET OF 20 KIDS COOKIE CUTTERS,2,12/5/2010 16:24,2.1,13174,United Kingdom
537224,70007,HI TEC ALPINE HAND WARMER,1,12/5/2010 16:24,1.65,13174,United Kingdom
537224,70006,LOVE HEART POCKET WARMER,1,12/5/2010 16:24,1.65,13174,United Kingdom
537224,85025C,PINK HEART SHAPE PHOTO FRAME,1,12/5/2010 16:24,1.65,13174,United Kingdom
537224,22866,HAND WARMER SCOTTY DOG DESIGN,1,12/5/2010 16:24,2.1,13174,United Kingdom
537224,22086,PAPER CHAIN KIT 50'S CHRISTMAS ,1,12/5/2010 16:24,2.95,13174,United Kingdom
537224,21202,DOLLY HONEYCOMB GARLAND,1,12/5/2010 16:24,1.65,13174,United Kingdom
537224,22294,HEART FILIGREE DOVE  SMALL,7,12/5/2010 16:24,1.25,13174,United Kingdom
537224,35971,ROSE FOLKART HEART DECORATIONS,4,12/5/2010 16:24,1.25,13174,United Kingdom
537224,35971,ROSE FOLKART HEART DECORATIONS,3,12/5/2010 16:24,1.25,13174,United Kingdom
537224,21822,GLITTER CHRISTMAS TREE WITH BELLS,6,12/5/2010 16:24,1.95,13174,United Kingdom
537224,22602,CHRISTMAS RETROSPOT HEART WOOD,11,12/5/2010 16:24,0.85,13174,United Kingdom
